बै का .	బె కా .
उनहोंने वि क लो में उसका ख ून किया . मैं सा बि त नहीं कर सकता , पर मुझे पकका यकीन है .	అత డిని వాళలు వి క లో లో చం పే శా రు . అది రు జు వు చేయ లేను , కానీ వాళలు చేశా రని నాకు తెలుసు .
तुमहें यह सब चीजें समझ नहीं आ एँ गी	దాని గురించి నీకు ఏమీ అరథం కాదు
वैसे भी मेरे हाथ ख ून से र ं गे हैं .	నా చే తి కి ఎ ట ూ రక తం అ ంటి ంది కదా .
नहीं . मुझे नहीं पी नी . मैं बस . . .	వదదు . ఫర వాలేదు . నేను కేవలం . . .
कया तुमहें कल सच में अपनी बह नों से मिलने जाना है ?	రే పు నువవు నిజంగా మీ అ కక చె ల లె ళ లని కలు సుకో వ ాలా ?
- और फिर तुमने उसे मा रा ? - हाँ , मैंने उसे मा रा .	- ఆ తరువాత అత డని కొ టట ా వా ? - అవును , వాడిని కొ టట ా ను .
यह मेरी गलती है .	ఇది నా పొ ర పాటు .
दोबारा जी व ंत महसूस कर रहा हूँ !	నేను జీవి సతునన టలు గా అనిపి సతోంది !
" बस हमारे " नाम .	" మన ఇదద రి " కోసం .
- आ पा त का ली न से वा . कया से वा चाहिए ? - हे भगवान , काफी जलदी आ गए .	- అత య వ సర సే వ లు . మీకు ఏ సే వ కావాలి ? - దేవుడా , చాలా తవర గా వచ చేశారు .
यह 2 9 साल की है . हतया करने के लिए न यू न त म उ मर कितनी हो नी चाहिए ?	తన వయ స సు 2 9 . ఒక మనిషి ని చం ప డానికి పరి మి త వయ స సు ఎంత ఉండాలి ?
- जानती हूँ . हाँ . - या शायद वह सच में बि स तर में ही मरी होगी .	- నాకు తెలుసు . అవును . - లేదా బహుశా ఆమె మ ంచ ం మీద మ రణ ి ంచి ఉంటుంది .
देखो , मुझे पता है यह क ठ ि न है ,	చూడు , ఇది కష టం అని నాకు తెలుసు ,
- उसे यही सं दे ह है . - कैसा सं दे ह ?	- అతని అను మా నం అదే . - ఏంటి అది ?
- कि मैंने उसकी जान ली . - हाँ , हमने उसकी जान ली .	- నేను చం పి న ందు కే నా బాధ . - అవును , మనం చేశా ం .
बस उसे एक म हिला दवा रा स ँ वा रे जाने की जरूरत है .	ఒక గ ృ హి ణి వ సతే అదే ఇ లలు అయి పో తుంది , నిజంగా .
तुमहें मेरी इतनी चिंता नहीं थी जब मैं उसे गोली मार ने वाली थी .	నేను అత డిని ష ూ ట చేయ బో యి నపపుడు నా మీద ఇంత పరే మ చూపి ంచ లేదు .
ठीक है , देखो , पै दल जाना ! भाग ना मत . हम क हें गे कि तुम बी मार हो .	సరే , చూడు , న డు ! పరి గె తత కు . నీకు ఆ రో గ యం బా గ ాల ే దని చెబు తా ం .
तुमने मि ना को देखा और मौ के का फा य दा उठा या . और मेरा भी फा य दा उठा रही हो .	మి నా ని చూశా వు ఇంకా ఆ అవకా శా నని వాడు కుననా వు . ఇపపుడు నాతో కూడా అదే చేసతుననా వు .
- माँ ! आप कहाँ हैं ? - अरे , धत .	- అమమా ! ఎకకడ ఉననావు ? - ఓహ , చెతత .
अ रस नहीं आए गी .	ఉ రస రా వడం లేదు .
हाँ , मैं पा इं ट ल ूँगा . . . वह कया है , ले गर ?	సరే , నాకు ఒక పి ంట . . . అదే ంటి , ఆ బీ రు ఇ సతా రా ?
उस रात वे सब एक साथ नहीं थीं .	ఆ రాతరి వాళల ంతా కలిసి లే రు .
ए , मुझे तुमहारी याद आई . तुम कहाँ चले गए ?	హేయ , నినను మి స అవు తుననాను . ఎ కకడికి వెళ లా వు ?
देखो , यहाँ आओ .	చూడు , ఇలా రా .
वह उ चि त अं ते ष टि की ह क दार थी .	ఆమె కు స రెన వీ డ కో లు ఇవ వాలి .
मैं देख ता हूँ .	నేను తీ సతాను .
ज ॉन प ॉल मर गया . वह मर गया , इ वा . वह मर गया .	జా న పాల చని పోయా డు . అతను చని పోయా డు , ఈ వా .
अगर वह मि ना के बारे में झूठ बो ले गा , तो फिर मैं ज ॉर ज की सच चा ई उ जा गर कर द ूँगी .	నా ఉదదేశం , అతను గ నుక మి నా గురించి అబ దధ ం చె బి తే , నేను జా ర జ గురించి నిజం చెపపే సతాను .
अरे , नहीं ! यह कया हो गया ?	ఓహ , లేదు ! అకకడ ఏం జరిగింది ?
आज कल तुमहारा धयान भ ट का हुआ है . सच कहूँ तो , तुम सा मान य बर ता व नहीं कर रही हो .	ఈ మధయ నీకు వే రే ఆలోచ నలు ఎ కకు వయ యా యి . నిజ ా యి తీ గా చెపప ాల ంటే , నువవు గ తం లో ఈ వా గా లేవు .
और मैंने सोचा , " वह मि ना को चो ट पहुँ चा ना कयों चाह े गी ? "	కానీ " మి నా ని తన ె ందుకు చం పు తుంది ? " అని ఆలోచి ంచా ను .
और मुझे पता है कि तुमने ही पुलिस से झूठ ी शि का य त की थी .	పోలీసు లకు చెపపి ననను ఇ రికి ంచా వని కూడా నాకు తెలుసు .
2 4 कॉ ग हि ल सट री ट मै ला हा इ ड को रट ड ब लू ड ब लि न	2 4 కా గ హి ల వీ ధి మ ల హె డ కోర ట వె సట డబ లి న
मुझे पता है कि जिस रात मि ना मरी थी , बै का व हीं थी ,	మి నా చని పోయి న రోజు బె కా అ కకడికి వచచి ందని నాకు తెలుసు ,
- मैं सा ँ स नहीं ले पा रही . - पकका अंदर औ जार होंगे !	- నాకు ఊ పి రి ఆడ టం లేదు . - అకకడ ఏమెనా పరి కర ాలు ఉననా యే మో !
नहीं , मैं नहीं रु क ूँगा . मेरी माँ के यहाँ जा रहा हूँ .	లేదు , నేను ఉండ టం లేదు . మా అమమ ఇంటికి వెళ తుననాను .
नहीं , इसमें काफी जो खि म है .	లేదు , అది బాగా పరమా ద క రం .
- आपको कया से वा चाहिए ? - हैलो ? मुझे एक ए म बु लें स चाहिए !	- మీకు ఏం సే వ కావాలి ? - హలో ? నాకు అ ం బు లె నస పం ప ండి !
अरे , चलो भी .	ఓహ , ఫోన తీ యి .
पता है मैंने तुमहारे लिए परा र थ ना की थी ?	నీ కోసం నేను పరా రథ నలు చేశా ను తెలుసా ?
उस " आ खि री रात " वाली बकवास पर कोई विश वास नहीं है .	" ఇదే చి వరి రాతరి " లాంటి చెతత మాట లని నేను అసలు నమమ ను .
तो , मैंने पूछ ा था कि कया यह आदमी शुकर वार को मै च देख रहा था .	సరే , ఆ శు కర వా రం నా డు ఈ వయకతి ఇకకడ మయా చ చూ సతూ గ డి పా డా అని అడి గా ను .
हैलो ? माफ करना , सर , आप सुन रहे हैं ?	హలో ? మన ని ంచండి , సర , మీరు అకకడ ే ఉననా రా ?
हाँ , हम ठीक हैं . मैं बस ज ॉन प ॉल को लेकर चिं ति त हूँ और . . .	అవును , మేము బాగానే ఉననా ం . నాకు జా న పాల గురి ంచే ఆ ందో ళ న ఇంకా . . .
- तुमने कया कहा ? - मैंने उससे तुमसे दूर रह ने को कहा .	- నువవు ఏం చెపపా వు ? - నా జో లి కి రా వ దద ని చెపపా ను .
कि वह बस बैठ कर हम दोनों को पागल ों की तरह यहाँ - वहाँ भाग ते देख ती रहे गी ?	మన ఇదద రం కేవలం తల లేని కో ళల మా ది రి గా ఇ ట ూ అ ట ూ తి రుగు తు ంటే తను చూ సతూ ఉ ంటు ంద నా ?
ग ै ब रि एल ने तुमहें इ वा के साथ देखा था .	నువవు ఈ వా తో ఉండ టం గా బ రి యే ల చూశా డు .
ढ ों गी तुम हो ! तुमने मुझसे पयार करने का ढ ों ग किया .	నువవు అబ దధ ాల కో రు వి . ననను ఇష ట పడి న టలు న టి ంచా వు .
घर सु ंदर है !	చ కక ని ఇ లలు !
मुझे थे रे सा के लिए नि कर ख री द ते हुए थोडा अजीब महसूस हुआ ,	థ ె రె సా కోసం ని కక రలు ఎ ంచడం నాకు కొ ద ది గా ఇ బబంది గా అనిపి ంచింది ,
- मै ट ? - टॉ म ?	- మయా ట ? - టా మ ?
- अरे , धत . - यह कया हुआ ?	- ఓహ , చెతత . - ఏంటి ఈ చెతత ?
तो , ब ला न ड , कया तुमहारे डै ड ने तुमहारी प ॉ के ट म नी बंद करने की ध म की दी थी ?	మరి , బ లా న డ , నీ పా కె ట మ నీ ర దదు చేసతా నని మీ నానన నినను బె ది రి ంచా డా ?
- पर मैंने बस आँख ें म ू ंद कर ख री दा . - मेरे पास इस बकवास के लिए समय नहीं है .	- కానీ నేను క ళలు మూ సే సు కుననాను . - ఇలా ంటి చెతత మాట లు వి నే సమయం లేదు .
यह उसका पसंद ी दा था . अगर और कोई उसके नाम पर नहीं पी ए गा , तो मैं पी य ूँगी .	ఇది ఆమె కు ఇష ట మెన డ రి ంక . ఎవ వర ూ తా గ క పోయి నా ఆమె కోసం నేను తా గు తాను .
मैं एक से क ंड में तुमहारी जान ल ूँगी .	నినను ఒక సె కను లో నేనే చం పే సతాను .
कोई कुछ नहीं करे गा , कोई अके ले कुछ नहीं करे गा . ठीक है ?	ఎవ వర ూ ఏ పర య తన మూ చేయ దదు , ఎవ వర ూ ఒ ంట రి గా ఏ ప నీ చేయ దదు . సరేనా ?
इसलिए तुमहें सु बह फा दर डॉ य ल को फोन करना चाहिए .	కాబటటి రే పు ఉద యం ఫా దర డో య ల ని పి లి పి ంచండి .
और हम हो ट ल स पा में आ धा दिन बि ता एँ ?	స గం రోజు హో టల సప ాలో మనం గ డ ప చచు .
और फिर कया ? हम पुलिस के पास नहीं जा सकते .	ఇంకా ఆ తరువాత ఏంటి ? మనం పోలీసు లని ఆ శ ర యి ంచ లే ం .
मुझे अभी - अभी मेरी माँ बि स तर में अ चल अ व स था में मिली .	మా అమమ క దల లేని సథి తి లో మ ంచ ం మీద పడి ఉ ందని ఇ పపుడే చూశా ను .
तुम बै का की कु र सी पर बैठ सकते हो .	నువవు , బె కా కు రచ ీ లో కూ రచ ో వచచు .
इतनी चिंता मत करो . मैं उससे कुछ नहीं कहूँ गा .	అలా ఆ ందో ళ న పడ కు . నేను వాడి కి ఏమీ చెపప ను .
दोसत के व की ल होने का कया फा य दा अगर उसका इस ते माल ही न कर स को , है न ?	మనం వాడు కో కపోతే , ఒక నయాయ వా ది మన కి సనే హి తు డె తే మా తరం ఏం లా భ ం ?
मुझे बस तुमहारी और इस बचचे की पर वाह है .	నాకు నువవు ముఖ యం ఇంకా మన బి డ డ పు టట డం ముఖ యం .
- अंदर जाओ ! - माफ करना !	- వెళ లు ! - మన ని ంచాలి !
मेरा दिल ट ू ट ने वाला है , इ वा .	నా గు ండ ె ప గి లి పో యే లా ఉంది , ఈ వా .
- तुम वह अस पता ल से निकाल सकती हो ? - सच में , इ वा ?	- దానిని హా స పి టల నుండి తీసుకు రా గల వా ? - ఏంటి ఇది , ఈ వా ?
उसने जो तुमहारे साथ किया , उसके बाद उसे जेल में होना चाहिए था .	నీకు చేసిన ద రో హా నికి , ఆ చెతత వెధవ ఈ పా టి కి జె లు లో ఉండాలి .
पता नहीं वह कहाँ है , पर उसके पास हमारे कम रे की चा बी है .	తను ఎ కకడికి వెళలి ందో తెలియదు , కానీ మన గ ది తా ళ ం తన దగ గరే ఉంది .
अरे , हाँ .	ఓహ , అవును .
अरे , बै का .	ఓహ , బె కా .
मैं उसकी बात नहीं सुन ना चाहती .	నాకు తన మాట లు వి నా లని లేదు .
तुम पूरी तरह गा य ब हो गई थी .	నువవు పూరతి గా కను మ రు గ యి పోయా వు .
माफ करना !	కషమి ంచండి !
इस वाली को , बेशक यह शुकर वार को यहाँ मौ जू द थी .	ఇది గో , ఈ మె , ఆ శు కర వా రం నా డు ఈ మె ఖచచితంగా ఇకకడ ఉంది .
इसलिए उममीद है हम उसके लिए स भ य बर ता व करेंगे .	కాబటటి ఆమె కోసం దీని ని హు ందా గా మన లోనే ఉ ంచు కు ందా ం .
जहाँ एक होगा , वहाँ और होंगे , इसलिए उन सब को खतम करना जरू री है .	ఒకక టి ఉనన చో ట , అందరూ ఉంటా రు , అందుకే మొతత ం వాటి గ ూ టి నే విష మ యం చేయాలి .
जे पी , तुम बैठ कयों नहीं जाते ?	జె పి , నువవు కూ రచ ో వచచు కదా ?
ज ॉन प ॉल को अभी मेरी जरूरत है . बाद में बात करेंगे , ठीक है ?	జా న పాల ననను పి లు సతుననా డు . తరవాత మాటలాడ తాను , సరేనా ?
ठीक है , जरूर . कोई बात नहीं . कृपया .	సరే , అలాగే . ఏం ఫర వాలేదు . దయచేసి వెళ లు .
कृपया चु प हो जाओ .	దయచేసి నో రు మూ సుకో .
पर यह सच नहीं है .	కానీ అది నిజం కాదు .
वि लि य मस के स कभी प ं ज ीक ृ त नहीं किया गया था . कोई बी मा हुआ ही नहीं था .	ఆ వి లి య మస కేసు ని ఇంత వర కూ దా ఖ లు చేయ లేదు . బీ మా అనే దే చేయ లేదు .
मैंने ही तुमहें बताया था .	అవును , నీకు ఆ విషయం చెపపా ను .
- ठीक है , बच चों , डि नर ! - आ रहे हैं !	- సరే , పిలల లూ , వి ందు సిదధ ం ! - వ సతుననా ం !
ठीक है , जान . हमें तुमसे पयार है .	సరే , బంగా రం . నినను మే ం పరే మి సతుననా ం .
अरे , धत .	ఓహ , చెతత .
मै ट को उस गा र वी लडकी से पयार है .	ఆ గా ర వీ అమమాయి తో మయా ట పరే మ లో ఉననాడు .
और मैं तुमहें माफ करता हूँ .	ఇంకా నినను కషమి సతుననాను .
रॉ जर , तुमहारे जैसे लोगों को मुझ जैसे को माफ करने का ह क नहीं है .	నీ లాంటి వాళల కి , రో జర , నా లాంటి వాళ లని కషమి ంచే అర హ త ఉండ దు .
तुम यह कयों पूछ रहे हो ?	నువవు ఎందుకు అడుగు తుననావు ?
मि ना को इससे न फ रत होती .	మి నా ఇ దంతా అస హ యి ంచు కునే ది .
बढिया वि चार है . धनयवाद .	అదభు త మెన ఆలోచ న . ధనయవాదాలు .
और जो भी तुम पी रही हो .	లేదా మీ దగగర ఏ ది ఉంటే అది .
कि मि ना की मौ त से बै का का कोई लेना - देना है ,	మి నా చని పో వడం వె నుక బె కా పర మే యం ఉ ందని ,
रुको . बै का , रुको !	ఆగు . బె కా , ఆగు !
मैं सच में बी मार महसूस कर रही हूँ .	నాకు నిజంగా నే అ నా రో గ య ంగా ఉంది .
इसलिए उनहें मा रा ?	అదే నా జరిగింది ?
मैं यहाँ सा री लड कि यों के साथ हूँ . तुम ठीक हो ?	మన ఆడ పిలల ల ంద రి తో ఇకకడ ే ఉననాను . నువవు బాగానే ఉననా వా ?
तुम लोग चलो या न चलो , पर मैं वहाँ जा रही हूँ .	ఏ మో , మీరు వచచి నా రా క పోయి నా నేను అ కకడికి వెళ తుననాను .
- हाँ . - तुम बेवकूफ हो . वह तुमसे झूठ कह रही है .	- అవును . - నువవు ఒక వెధవ వి . ఆమె నీకు అబ దధ ం చెబు తోంది .
आज उसके साथ मेरी आ खि री रात है .	ఇదే అతని తో నేను గ డి పే చి వరి రాతరి .
इसका कया मतलब है ?	దాని అరథం ఏంటి ?
मैंने वह निकाल दिया कयोंकि उससे वह घट िया दिख रही थी .	దాని వలల ఆమె చ ౌ క బా రు గా కనిపి స తో ందని నేను దానిని తీ సి వే శా ను .
सु नि श चि त करना कि वह कोई बच का नी हर कत न करे .	తను ఏ పిచచి పని చేయ కుండా ఉండే లా చూడు .
पकका उसे पता था कि ज ॉर ज की ला श वहाँ है . पकका वह उसे देख ने गई होगी .	జా ర జ అకకడ ఉననా డని ఆమె కు తెలి సే ఉంటుంది . అత డిని చూడ టానికి ఆమె వెళలి ఉంటుంది .
सच कहूँ तो , मै ट , मुझे तुमहारे भाई की पर वाह नहीं है .	ఈ పరా చి క ాలు చ ాలు , మయా ట . మీ అనన యయ గురించి నేను ప టటి ంచుకో ను .
नहीं . मैं बस सो ने जा रही हूँ .	లేదు . నాకు తవర గా పడు కో వాలని ఉంది .
ए , अगर तुमहारे पास घर में डियो र ला इट है , तो उससे मदद होगी .	హేయ , మీకు తెలుసా , డ యో ర లెట గ నుక ఇంట లో ఉంటే , అది కొ ంత న యం చే సతుంది .
वह सो रही हैं .	ఆమె ని దర పో తోంది .
माफ कर दो , बै का .	కషమించు , బె కా .
यहाँ आओ .	ఇలా రా .
मैं ठीक हूँ . तुमसे बाद में मिल ूँगी .	నేను బాగానే ఉననాను . నినను మళలీ కలు సతాను .
वह बस उ दा स है .	తను బాధ పడు తోంది .
मैं एक घं टे में लौट ूँगा .	నేను ఒక గంట లో వ సతాను .
कया हुआ ?	ఏ మెంది ?
मुझे पसंद नहीं कि तुम यहाँ समय बि ता ओ , और उनके दिमाग में अजीब चीजें भरो .	నువవు ఇకకడికి రా వడం , నీ ఆలోచ నలు ఆమె మీద రు దద డం నాకు ఇషటం లేదు .
जे पी का कहना है कि तुमने हा ल ही में कुछ गलत ियाँ की हैं , अ म . . .	ఈ మధయ కాల ంలో కొనని తపపు లు దొ ర లా య ని జె పి చెబు తుననా డు . . .
