प ॉल सो लो टर ॉ फ खो जी प तर कार - रो लि ंग सट ो न	పాల సో లో ట రా ఫ పరి శ ో ధ నా వి లే కరి - రో లి ంగ సట ో న
वह हमेशा मुझे चर च के लिए पै सा दे ता है .	అతను ఎపపుడూ నాకు చ రచ కోసం డబబు లు ఇ సతుననా డు .
प ॉल सो लो टर ॉ फ खो जी प तर कार - रो लि ंग सट ो न	పాల సో లో ట రా ఫ పరి శ ో ధ నా వి లే కరి - రో లి ంగ సట ో న
प ॉल सो लो टर ॉ फ खो जी प तर कार - रो लि ंग सट ो न	పాల సో లో ట రా ఫ పరి శ ో ధ నా వి లే కరి - రో లి ంగ సట ో న
पर अस ली पि टा ई उनके घर के अंदर आने के बाद ही शुरू हुई .	కానీ గ టటి గా కొ టట డం అత నని ఇంట లోకి తీసుకు వెళళ ే వర కు మొద లవ లేదు .
और फिर मैंने सोचा , " अचछा . ठीक है . " फिर अग ले दिन लगा ,	ఆ తరువాత అను కుననాను , " సరే , పర వాలేదు " అని . తరువాత రోజు , చూ సతే
- हाँ . खुद को स जा दे नी चाहिए . - अब उन का ग जा त ों पर द सत खत कर दो .	- అవును . ఆమె ను లోప ల వే య ాలి . - ఆ కా గి త ాల పె స ంత కం చేయ ండి .
किसी को पर वाह नहीं थी अगर किसी ऐसे बं दे को लू ट ते हो	సమా జా నని నా శ నం చేసతుననా డు అని అను కునే వయకతి ని
मैं वहाँ हो कर भी वहाँ नहीं था .	అకకడ ఉననాను , కానీ ఏం తెలియ టం లేదు .
और सी धे अफ सर ों पर	ఇంకా గురి పెటట టం
और उन के स ों को दोबारा खो ल ने की अप ी ल दा यर करनी होगी .	కేసు తిరిగి తె రి చే ందుకు పి టి షన దా ఖ లు చేసతా ము .
इसके साथ भी स मान बर ता व होना चाहिए .	దానిని అదే వి ధ ంగా పరి గ ణి ంచాలి .
कयोंकि रे जी ग रा हम ने उसकी गिर फ ता री की शे ख ी ब घ ा री थी .	ఎందుకంటే రె జీ గరా హం అతని అ రె సట గురించి గొపప గా చెపపు కుననా డు .
मीक मिल के के स में यह सबसे अ हम द सता वे ज है ,	ఇది మీక మి ల కేసు లో చాలా కీ ల క మెన ప తరం ,
पर रि पो रट के बारे में सबसे अ हम बात थी	ఏ ది ఏమెనా , ని వే ది క లో చాలా ముఖ య మెన ది ఏంట ంటే
अ भ ि यु कत का वि वर ण क द 6 फु ट	వయకతి సమా చా రం ఎ తతు 6 ' 0
कयोंकि यह ठीक नहीं है .	ఎందుకంటే అది స రెన ది కాదు .
जब तक उसने उसे नीचे नहीं र खा .	ఆ తను ఆ యు ధం కలి గి ఉననా డని తెలియదు .
- पर मीक तो सा इ किल चला रहा था . - सा इ किल पर .	- కానీ మీక బె క న డు పు తుననా డు . - బె క పె న .
सब कुछ न क ली का ग जा त बना ने से शुरू होता था .	అంతా ప తర ాలు రా య టం నుంచి మొద ల వు తుంది .
मैंने फि ला डे ल फ िया में बहुत समय बि ता या है .	నేను ఫి ల డె ల ఫి య ాలో చాలా కాల ం గ డి పా ను .
जिस ने अ भ ि यु कत ों में से एक को ह थ क डी लगा ई थी ,	నిజ ానికి ము ద దా యి లలో ఒక రి చే తి కి సం కె ళళు వే సిన తను ,
मीक के क जिन का घर न शे के सौ दे वाला न ु क क ड	మీక క జి న ఇ లలు మా ద క దర వయ అమమ కాల మ లు పు
कयोंकि मैंने रे जी ग रा हम के साथ मिल कर चो री की है ,	ఎందుకంటే నేను రె జీ గరా హ ంతో దొ ంగ త నం చేశా ను ,
- हमारे पास कोई बि ंग ो बो र ड नहीं है . - हाँ .	- మా వ దద బి ంగ ో బు లె టలు లేవు . - అవును .
ना र को टि कस वा लों ने उसे ( रॉ बर ट वि लि य मस ) बु री तरह पी टा , उसका हु लिया ही बदल गया है .	పోలీసు లు అత నని ( రా బర ట వి లి య మస ) దారు ణ ంగా కొ టట ా రు , తను తన లా గే లే డు అసలు .
कि ग रा हम ई मान दार पुलिस वाला नहीं है .	గరా హం నమమ ద గి న పోలీసు కా దని మాకు చెపపా డు .
1 3 फर व री , 2 0 1 8	ఫి బర వరి 1 3 , 2 0 1 8
प ॉल सो लो टर ॉ फ दवा रा श ॉन म के बे दवा रा चि तर ण	పాల సో లో ట రా ఫ రచ న సీ న మె కక యా బ బ ొ మమ లు
बद मा श पु लि सवा लों की उस सू ची के बारे में	ఆ దు ర మా రగ పు పోలీసు ల జా బి తా గురించి
और मेरी जे ब में थोडा बचा भी है .	ఇంకా నా జే బు లో మి గి లు ననా యి .
और उसने मुझे देखा . वह बो ली ,	తను నా వెపు చూ సింది . తను అనన ది ,
- मैं वह देख ने को बे ता ब हूँ . - सुना , फि ली ?	- అది చూడ ాలను ంది . - అది వి ననా వా , ఫి ల లీ ? వి ననా వా ?
लं बी अ व धि वाली व या पक छा न बी न के लिए बना ई गई थी .	వి సత ృ త పరి ధి పరి శ ో ధన ల కె రూ పొ ంది ంచ బడి ంది .
ब यु ला पार कर मीक की दा दी	బ యూ లా పార కర మీక బా మమ
2 2 00 सा उ थ हे म बर गर सट री ट	2 2 00 ఎ స హె ం బర గర వీ ధి
" मीक मिल को रि हा करो . "	చెపపా మని అను కుననా రు .
जल द घर आ जाओ गे , भाई .	తవర గా ఇంటికి రా , సోద రా .
तो हम बस सा उ थ हे म बर गर सट री ट के 2 2 00 बल ॉ क में पहुँच ने वाले थे .	అందుకే మేము 2 2 00 ద కషి ణ హె ం బర గర వీ ధి లోకి వెళళ బో తుననాం .
- हाँ , " बि ंग ो " कहा था . - " बि ंग ो " कयों कह रहे हो ?	- అవును , " బి ంగ ో . " - మీరు " బి ంగ ో " అని దే నికి అ ంటుననా రు ?
" कुछ तो करना होगा " यह मेरी शि का य त के अ ंत में लि खा था .	" ఏదో ఒకటి చేయాలి " అని నా ఫి ర యా దు చి వర న రా శా ను .
और हम इसे सं जी द गी से ले ते हैं .	మే మ ది తీ వర ంగా పరి గ ణి సతా ము .
जो एक तरह से फि ला डे ल फ िया पुलिस वि भाग के ने वी सी ल के जैसा है .	అది ఫి ల డె ల ఫి యా పోలీసు వి భా గం వారి నే వీ సీ లస లాంటి ది .
घ ू म जा , सा ले .	వె ను కకు తి రుగు .
मीक को बाहर निका लो और इस को अंदर डा लो .	అతని ని వది లి , ఆమె ను లోప ల వే య ాలి .
लगता है 2 0 1 8 के सु पर बोल में अपने परि च य के लिए ई गल स	ఈ గి ల జ టటు డ రీ మస అ ండ నె ట మే రస ను వారి 2 0 1 8 సూ పర బ ౌ ల పరి చ యా నికి
रे जी ग रा हम ना र को टि कस फी लड यू नि ट का हि ससा था ,	రె జీ గరా హం నా ర కా టి క ఫీ ల డ యూ ని ట లో భా గం ,
न शा बे च ने वा लों और उन लोगों के घर ों से	కొనని వే ల డ ాల ర ల డబబు ను మా ద క దర వయ డీ ల ర ల నుంచి ,
रे सन पार कर मीक का क जिन	రా స న పార కర మీక క జి న
इ की म पार कर मीक का क जिन	ఇ కీ మ పార కర మీక క జి న
तब एक रे फ री / म ध य स थ नि यु कत किया जाता है ,	వాళళు పరా థ మి కంగా వీ ళళు నమమ ద గి న వా రా కా దా అని
हम ट व ं टी से क ंड ए ंड जै कस न के न ु क क ड पर पहुँच रहे हैं .	మేము జా నస న , 2 2 వ మ లు పు దగగర కు చే రు కుంటుననా ము .
त थ यों की सम ीक ष ा : ग रा हम " सं घ ी य अधि का रि यों दवा रा भर ष टा चार के	వా సత వాల వ ృ త తా ంత ం : గరా హం " వి వి ధ ఆ రో పి త అవి నీ తి చ రయ ల
हमारे पास दो ह ल फ ना मे हैं ,	మాకు రెండు వా ంగ మూ ల ాలు అ ందా యి ,
ड री मस ए ंड ना इट मे अ रस चु न ेंगे , तो . . .	ఎ నను కునన టటు ఉననారు , అందుకే . . .
रे जी ग रा हम मीक का गिर फ ता री अफ सर	రె జీ గరా హం మీ కను అ రె సట చేసిన అ ధి కా రి
बहुत सी बातें चल रही थीं , अचछी बातें .	చాలా స ంద డి చో టు చేసు కు ంది , చాలా మంచి స ంద డి .
वह लै म बो र गि नी , मेरी न ई गाडी वह मेरा सा या है	నా లా ం బర గి నీ ని , నా కొతత పరే య సి నా బ దు లు న డు పు తుంది
ऐसा नहीं होता . खा सत ौर पर , द कष ि ण ी फि ली में तो नहीं .	అది జరగ దు . ముఖ య ంగా , వా సత వ ంగా , ద కషి ణ ఫి ల లీ లో
कि ग रा हम का नाम उस क थि त " नहीं बुला एँ " सू ची में है ,	అతని పేరు డు నా ట కాల జా బి త ాలో కనిపి సతునన టలు
घर की त ला शी ले ने और उसे गिर फ तार करने के लिए इस ते माल किया .	మీ కను అతని ఇంటి దగగర అ రె సట చేయ టానికి ఉ ప యో గి ంచారు .
और यह वि वर ण कि " म ध य म वर ण " का है , वह मीक से मे ल नहीं खा ता .	వర ణ న లో ఉనన . . . " మధయ సత రం గు " మీ కకు సరి పో ల టం లేదు .
मैंने उसे अपना नाम बताया . कहा , " मैं यहाँ मीक मिल के के स पर बात करने आया हूँ . "	అతనికి నా పేరు చెపపా . " ఇకకడికి మీక మి ల కేసు విషయ ంగా వచచా ను " అననా ను .
मुझे खा ने के लिए सन ै कस मिले .	నాకు చి రు తి ండ లు తె చచా రు .
ठीक है .	అవును .
वहाँ पर मीक ने क थि त रूप से न शी ली दवा बे ची ,	మీక మా ద క దర వయ ాలు అమ మి న టటు ఆ రో ప ణ ఉంది ,
जैसा कि उसने अपने ब यान में लि खा है .	వి ధా నా నని బటటి వి భ ే ది సతుననా ము .
बस वह यही कह रहा था , " मैंने कुछ गलत नहीं किया है .	అది అతను పరా థ మి కంగా , " నేనే మీ తపపు చేయ లేదు .
पु लि सवा लों से एक - दूसरे के बारे में बात निकल वा ना बहुत मुशकिल है .	పోలీసు లను ఒక రి గురించి ఒక రు మాటలా డే లా చేయ టం చాలా కష టం .
उसने आज त करी बन आ धा दर जन खु ला स ों की जानकारी दी है .	ఆ రు సోద ాల కు వెంట నే తన స హ కా రా నని అ ంది ంచా డు .
और ना र को टि कस फी लड यू नि ट में भर ष टा चार जो र ों पर था .	నా ర కో టి కస యూ ని ట లో అవి నీ తి తా ర సథా యి లో ఉంది .
दी वार से लग कर ख डा हो !	నువవు గో డ కు అనుకో .
और इसी लिए , हमें हर के स , हर उस स जा का	ఫ లి తంగా , మేము జా బి త ాలో ఉనన పరతి ఒకక కేసు ను ,
ज ॉर ड न सी व मीक का व की ल	జో ర డ న సీ వ మీక లా య ర
स मु दा य में उनहें पुलिस अफ सर के रूप में सभी जानते हैं , है न ?	వాళళు ఈ పరా ంత ంలో పోలీసు అ ధి కారు లు గా జ నం అంద రికీ తెలి సి ఉంటా రు , అవునా ?
" 2 2 0 4 सा उ थ हे म बर गर सट री ट के पास उसके सिर पर वार किया .	" 2 2 0 4 ద కషి ణ హె ం బర గర వీ ధి లో అతని త లను త ననా రు అని జి రీ క చెపపా డు .
" जिस पुलिस वाले ने मीक के खिला फ ब यान दिया था वह इस सू ची में है .	" మీ కకు వయ తి రే కంగా సా కష య మి చచి న పోలీసు ఆ జా బి త ాలో ఒక డు .
ग रा हम नंबर 6 2 1 4 को ना र को टि कस फी लड यू नि ट में डा ला गया है	గరా హం ను # 6 2 1 4 నా ర కో టి క ఫీ ల డ యూ ని ట కు నియ మి ంచారు .
तो आपको उसके साथ ऐसे पे श आने का उ चि त कारण देना पडता है ,	మీరు అతనికి చేసిన ది నయాయ మెన దని ని రూ పి ంచుకో వాలి ,
" धत . मुझे नहीं पता था यह इतना ग ं भी र है . "	" దారు ణం . దీని వెన క ఇంత క థ ఉనన టలు నాకు తెలియదు . "
एक से वा नि व ृ त त ना र को टि कस अफ सर , जे फ री व ॉ कर ,	పర ముఖ నా ర కో టి కస పోలీసు , జె ఫ రీ వా కర ,
उन घट ना ओं के वि वर ण में दि क कत यह थी	ఆ వ రు స సం ఘ టన ల వలల సమసయ ఏంట ంటే
और जब कोई बडा छा पा मार ते हैं तो उनका बडा नाम होता है	వాళళు ఏదెనా పెదద సో దా కు వెళళి నపపుడు , ఇంకా వాళళు మా ద క దర వయ ాల ననీ
वह भी एक पुलिस अफ सर थी .	ఆమె కూడా ఒక పోలీసు అ ధి కా రి .
मुझे इसका पूरा यकीन है ,	నేను చాలా గ టటి గా నమ ము తుననా ,
जब इस तरह के आकर ा म क बल के इस ते माल पर सवाल पू छे जाते हैं . . .	అవి ఊ డి పోయి నపపుడు ఎకకువ బ ల ం ఉ ప యో గి ంచ టం వలల నే మో . . .
* यू ए स कान ून वि भाग	* యూ . ఎ స . నయాయ వి భా గం
लू क ब रि ंड ल - खि म परा इ वे ट जा सूस	లూ క బ రి ండి ల - కి మ పర ె వే ట పరి శ ో ధ కు డు
उनहोंने पूछ ा , " इसके चे ह रे को कया हुआ ? "	ఆమె , " అతని మొ హా నికి ఏమ యి ంది ? " అని అడుగు తుంది .
यह शि का य त मैंने 2 4 जन व री , 2 00 7 को दर ज करा ई थी .	నేను జ న వరి 2 4 , 2 00 7 న చేసిన ఫి ర యా దు ఇది .
जब किसी भी टी म का वार ंट म ं जू र होता है , तो सा री टी में एक साथ हो जाती हैं ,	ఏదెనా బ ృ ందా నికి వా రె ంట అ మో ది ంచిన పపుడు , అనని బ ృ ంద ాలు కలు సతా యి ,
ग ली का दूस रा छो र लोगों से भ रा था .	వీ ధి కి అ టు వెపు అంతా జ న ంతో ని ండి పోయింది .
1 1 और माम लों पर पुलिस भर ष टा चार का ध ब बा	ఇంకా 1 1 కేసు లు పోలీసు ల అవి నీ తి తో క ళ ం కి తమ య యా యి
जब यह कार य वा ही शुरू हुई थी .	అసలు అ రె సట యి న దగగర నుంచి చూడ ాలి .
कि सं भ व है कि मीक को स जा एक झूठ ी गवा ही के कारण हुई है ,	నిర ధా రి ంచిన టలు తెలు సతోంది కాబటటి , దాని ఆ ధా ర ంగా అతని పె ని రూ పి ంచిన
उनहोंने ख ब री को ख री द ने के लिए भे जा , ठीक है ?	వాళళు ర హ సయ ఇ న ఫా ర మె ంట ను కొ ను గో లు కు పం పి ంచారు , అవునా ?
सबसे नि ंद नी य है , ए फ बी आई दवा रा रख ी गई प ॉ ली ग रा फ पर ीक ष ा में अस फ ल होने का .	ఎ ఫ బి ఐ నిర వ హి ంచిన ప ాలి గరా ఫ పర ీ కష లో వి ఫ ల మ యి న టలు నిర ధా రి ంచారు .
जहाँ मेरे पिता हैं .	మా నానన ఉనన చో ట .
गि नो ला ख ों में पै सा फिर दिखा ओ जैसे मैं कं गा ल हूँ	కో టల కొ ల ది డబబు ను లె కకి ంచి అపపుడు ది వ ాలా తీ సిన టటు పని చేశా
जिस में ग रा हम का दा वा था कि उसने मीक को	గరా హం అందు లో మీ కను , ద కషి ణ ఫి ల లీ ,
मीक मिल को रि हा करो	మీక మి లను వ దల ండి
जब मीक मिल गिर फ तार हुआ , तब मैं वहाँ नहीं था .	మీక మి ల అ రె సట యి నపపుడు నేను అకకడ లేను .
इन में से कई अफ सर ों का बहुत कम हाथ था ,	ఈ అ ధి కారు లలో చాలా మంది కి అ తి త కకువ పా తర ఉంది ,
अब श हर में एक नया जि ला अ ट ॉर नी आया है .	ఇపపుడు , న గరా నికి కొతత డి సట రిక అ టా ర నీ వచచా రు .
मेरी माँ तु र ंत अस पता ल आ गई . वे पु लि सवा लों पर चि ल ला रहे थे .	మా అమమ , ప రు గె తతు కు ంట ూ ఆ సు ప త రి కొ చచి ంది . వాళళు పోలీసు ల మీద అ రు సతుననారు .
हाथ ऊपर ! अपने हाथ ऊपर करो !	హ యా ండ స అ ప ! చే తులు పె కి పెటట ండి !
मैंने बंद ूक ज मी न पर रख दी .	నేను నే ల మీద నా తు పా కీ పెటటా ను .
और उनहोंने ये वा क ए त ला शी वार ंट में ब या ँ किए	వాళళు ఆ సం ఘ టన లను సర చ వా రె ంట లో రా సా రు
हा था पा ई , न शे का सौ दा , सब ूत ों के साथ छे ड छा ड ,	ద ౌ ర జ న యం , సా కష య ాలను తపపు దో వ ప టటి ంచ టం ,
कि उनहें घट ना स थ ल से न शी ली दवा एँ मिली थीं .	కను గొ నన మా ద క దర వయ ాల కు వి చా రణ లో ఎలా ంటి ఆ ధా ర ము లేదు .
फर व री 2 0 1 8	ఫి బర వరి 2 0 1 8
मीक मिल का ड री मस ए ंड ना इट मे अ रस	మీక వి ల డ రీ మస అ ండ నె ట మే రస
कयोंकि जि तने दिन हमें सब ूत नहीं मिल ेंगे ,	ఎందుకంటే మాకు కా వల సిన ఆ ధా రం దొ ర కని పరతి ఒకక రోజు ,
" मीक रि हा नहीं हुआ है , तो मतलब तुम पूरी मे ह न त नहीं कर रहे . "	" ఒక వే ళ మీక వి డు దల అవ టం లేదు అంటే , మీరు సరి పడ కష ట పడ టం లేదు " అని అ ంటుననా రు .
और यह है जै कस न .	జా కస న ఇకకడ ఉననాడు .
पर वह बस एक दस मिनट की बात ची त ही थी ,	కానీ అది ఒక 1 0 నిమిష ాల సం భా ష ణ ,
