वह पहली बार था कि मैं बिलकुल नहीं ड रा .	మొదటి సారి నేను భయ పడ కుండా ఉండ గ లి గా ను .
अब मैं सभी लड कों को बि स तर पर ना श ता ला कर नहीं दे सकती .	మీ కు ర రా ళల ంద రికీ మ ంచ ాల దగగర కి నేను బ రే క ఫా సట అ ంది ంచ లేను .
इस पागल कमी ने ने आर टी श ॉ का गा ना गु न गु ना ना शुरू किया .	ఈ క రే జీ వెధవ , ఆర టీ షా పా ట ని కూ ని రా గం తీ య డం మొద లు పె డ తా డు .
भाग ने दो ! वह जयादा दूर नहीं जा पा ए गा !	అత డిని వదిలే య ! ఎకకువ దూ రం వెళల లే డు !
मैं , मैं तुमहारे जैसा हूँ : एक पायलट , एक सम मान नी य वय क ति .	నేను , మీ లాంటి వాడి నే . పె లెట ని , గ ౌ ర వం పొ ంది న వాడిని .
- मैंने पूछ ा कया बक . . . - ज ॉन इ ग न ! ह ल का दा ई ं तरफ देखो .	- బ క గురించి అడి గా ను . . . - జా న ఈ గ న ! నీకు కు డి వెపు .
वे सट फा लिया , जर म नी	వె సట ఫ ే లి యా , జర మ నీ
- हैलो . - सं भ ल कर . घु ड स वार से ना आ गई .	- హలో . - చూడ ండి . వీ రు లు వ సతుననారు .
हाँ . की थी . माफ करना . मैंने सोचा था कि कोई पु रु ष होगा .	అవును . అను కుననాను . సా రీ . నేను ఎవరో మ గ వాడు అను కుననా .
कैसे पता चला कि मैं झूठ बोल रही हूँ ?	నేను అబ దధ ం చెపపా నని ఎలా గర హి ంచారు ?
पिछ ली बार , मैं अ ंत में हो ट ल के कम रे की ज मी न पर बिना बू ट ों के प डा था .	కింద టి సారి తా గి నపపుడు , నేను హో టల గ ది లో నే ల మీద బ ూ టలు లే కుండా పడి ఉననాను .
माफ करना वे तुमहारे अ मरी की बर ै ंड जि तने अचछे नहीं हैं .	సా రీ కానీ అవి మీ అ మె రిక న బ రా ండ లు అంత మంచి గా ఉండ వు .
तो वे हमेशा ऐसा बर ता व न करते कि मान ो वे पहली बार घर से बाहर निक ले हों ,	వాళలు ఎ పపుడు బయట కొ చచి నా ఇంటి నుండి మొదటి సారి బయట కి అడుగు పె టటి న టలు ,
आपके पास यहाँ कुछ अचछा सं गी त है .	మన కి ఇకకడ మంచి సంగ ీ తం దొ రు కు తుంది .
सं गी त की सा री परति भा एँ मेरी माँ और बहन को मिली हैं ,	మా అమమ గా రికీ , సోద రికీ మ యూ జి క లో మంచి పరతి భ ఉంది ,
कया तुम भूल गए कि हम रू म मे ट हैं ?	మనం రూ మ మే ట స అనన సంగ తి మర చి పోయా రా ?
म ं सटर के ऊपर हमारे आ खि री मि शन में .	మా ం సటర లో మన చి వరి మి షన గురించి .
दरअसल , मैं आप से इसी बारे में बात करना चाहता था .	అంటే , నేను దాని గురి ంచే మీ తో మాటలాడ ాలి అను కుననాను .
हम तुमहें मार ना नहीं चाहते हैं .	నినను చం ప ాలని మేము అనుకో వడం లేదు .
तुम कया करती हो , सब ल टर न वे स गे ट ?	మీరు ఏం చే సతు ంటా రు , ఆ ఫీ సర వె స గే ట ?
मैं इन कु त त ों को द फ ना ने के लिए जगह ढूँढ रहा हूँ .	ఈ కు కక లని సమా ధి చేసే చో టు కోసం వె తు కు తుననాను .
मैं इस पर सम मान पू र व क आपका वि रो ध करना चा हूँ गी .	నేను మర యా ద పూర వ కంగా నే ఆ విషయం లో మీ తో వి భ ే ది సతాను .
अरे , चलो भी . कौन पत ते बा ं टे गा ?	ఓహ , ఇలా చూడ ండి . ఎవరు ఆ డు తుననారు ?
और फिर आ ख िर कार उसे उ पाय सू झा .	చి వ రికి ఒక పరి ష కా రం కని పెటటా డు .
सब ल टर न वे स गे ट , तुमहारी रू म मे ट .	ఆ ఫీ సర వె స గే ట , మీ రూ మ మే ట ని .
वह कया होता है ?	అంటే అది ఏంటి ?
जब मेरा विमान मार गि रा या गया था , तब हम दो - एक से आगे थे .	నా విమానం నే ల కూ లే సమ యా నికి మేము రెండు , ఒకటి ఆ ధి క యం లో ఉననా ం .
कै प टन कर ॉ सब ी .	కె ప టె న క రో స బీ .
आज रात को इस पूरी दुनिया में	ఈ రాతరి మొతత ం పరపంచ ం అంత టా
हम में से कोई अके ला नहीं था .	మన లో ఎవ రం ఒ ంట రి వాళల ం కా ము .
और म ूल रूप से , अ ंत में मेरे पास न सि क के थे और न ही बू ट .	దాని తో , నేను క వార టర లు , బ ూ ట లూ కూడా లే కుండా మి గి లా ను .
- मुझे बेहद खे द है . - इसलिए उनहोंने मुझे यहाँ भेज दिया .	- చాలా సా రీ . - అందుకే వాళలు ననను ఇకకడికి పం పి ంచారు .
अब यह रहे तुमहारे नि र देश .	ఇపపుడు మీకు ఇ వే మా ఆ దే శ ాలు .
और मैं उन में से एक नहीं था . मैं ठीक हूँ .	వాళ లలో నేను లేను . నేను బాగానే ఉననాను .
मैं चि ट ठ ियाँ लि ख ने में काफी बु री हूँ .	నేను ఉ తత ర ాలు రా య డం లో చాలా ఘ ో ర ంగా ఉంటా ను .
इसलिए , मुझे तुमहारे गर ु प , तुमहारे सक वा डर न और तुमहारे विमान का सत या प न चाहिए	కాబటటి , నాకు మీ గర ూ ప వె రి ఫి కే షన కావాలి , మీ స క వా డ ర న ఇంకా మీ విమానం వి వర ాలు ఇవవ ండి
डॉ क टर ह यू सट न ?	డా క టర హ ూ సట న ?
ए टी ए स हमें अपने जना ना नाम ों को छु पा ने के लिए पर ो त सा हि त करती है , इसलिए ए . ए म . वे स गे ट .	బ రి టీ ష ఆర మీ మ హి ళ ా వి భా గ ంలో మా ఆడ వారి పే ర లను గో ప య ంగా ఉ ంచు తారు , అందుకే నా పేరు ఎ . ఎ ం . వె స గే ట .
मुझे यह भी पता है कि तुमहारा जन म मै नि टो व ॉ क , वि सक ॉन सि न में हुआ था .	మీరు వి స కా న సిన పరా ంత ంలో ని మా ని టో వో క లో పు టట ా రని కూడా తెలుసు .
जहाँ तक मैंने सुना है , बेशक नहीं हो .	నేను వి నన ంత వర కూ , ఖచచితంగా పె ళ లి కాల ేదు .
द न यू य ॉर क टा इ मस ए ट थ ए यर फो रस ने ब रे मे न को त बा ह किया	న యూ యా రక టె మస ఎ యి త ఎ యి ర ఫో రస దా డి లో బ రె మన ధ వం సం
दरअसल , यह तुमहारे सी ओ के हाथ ों में था जब उनहोंने तुमहें यहाँ भे जा था .	నిజంగా , ఆ విష యానని నిర ధా రి ంచ వల సింది నినను ఇకకడికి పం పి న మీ క మా ండి ంగ ఆ ఫీ సరే .
या गरे ट चार टर ऑ फ फ री ड मस ने इसी की नी ं व रख ी थी .	లేదా గరే ట చా ర టర ఆ ఫ ఫ రీ డ మస అ ం దు కు పు నా దు లు వే శా యి .
आपने कहा था कि स मा यो जन करने में ए का ध दिन लग ते हैं .	అ ల వా టు పడ టానికి ఒకటి రెండు పడు తుంది అననా రు కదా .
आँख पर लगे की च ड के नाम .	ఇది గో మీ క ళ లలో మ టటి ఉంది .
हम बस सं यो ग से मिले थे .	మేము ఒక చో ట కలి శా ము అంతే .
वह तुमहारा दोसत था , है न ?	అతను మీ సనే హి తు డు , కదా ?
मुझे तुमहें बता ते हुए खे द हो रहा है कि तुम काफी मु सी ब त में हो .	మీరు ఒక రక మెన ఇ ర కా టం లో ఉననా రని చెపప డానికి వి చా రి సతుననాను .
हम यह फिर से नहीं सुन ना चाहते , इसलिए बोल ना बंद कयों नहीं करते ?	మాకు మళలీ వి నా లని లేదు , కాబటటి ఇం క ఆ విషయం వదిలే య చచు కదా ?
पी . ए स . ब बल स को मेरा ' न मस ते ' कहना !	గ మని క : బ బు లస కి నా తర పు న ' హాయ ' చెపపు !
इसलिए , स पता हा ंत की छु ट टी पर जाने से पहले , मैं उनहें भा ष ण नहीं द ूँगा .	కాబటటి , మా పిలల లని వీ కె ండ వి హా రాల కి అను మ తి ంచిన పపుడు , వాళల కి లె క చ రలు ఇవవ ను .
सब कला इ यों का क माल होता है , लड के .	అద ంతా మ ణి క టటు లోనే ఉంటుంది , పిలల వా డా .
इस यु द ध में किसी के भी मर ने का केवल यही कारण है .	ఈ యు దధ ంలో ఎవరెనా చని పో వడానికి అద ొ కక టే కారణ ం .
ज ंग का . . .	ఆ యు దధ ం . . .
ब बल स के नाम .	బ బు లస కోసం .
कया वह फिर से कहा निया ँ सुना रहा है ?	ఇ తను మీకు మళలీ క థ లు చెబు తుననా డా ?
- " सब ल टर न . " - सब ल टर न स .	- " ఆ ఫీ సర . " - ఆ ఫీ సర లు .
- हमें को ष ा ध य कष को इसकी शि का य त करनी चाहिए . - अगर तुमहें परे शा नी नहीं है , तो मुझे भी नहीं है .	- మనం ఈ విష యానని మే నే జ రు కి రి పో ర ట చేయాలి . - కానీ , మీకు ఇ బబంది లే కపోతే నాకు ఫర వాలేదు .
कया तुम वर लड सी री ज का न ती जा जान ना चा हो गे ?	పరపంచ సి రీ స ఫ లి తం తెలుసు కో వాలి అనుకుంటుననా రా ?
पर मैं चा हूँ गा कि तुम भी मुझे कुछ चीजें बताओ .	కానీ మీరు కూడా నాకు అనని వి వర ాల ూ చెపప ాలి .
पर अ मरी की पु रु ष वर ग की पर वाह किए बिना द ृ ढ रह ते हैं .	కానీ అ మె రిక న మ గ వారు ఆ విషయం లో వర గ వె రు ధయ ాలని ప టటి ంచుకో రు .
- सु पर भा त . हैलो . - दे वि यों . मैडम .	- మార ని ంగ . హలో . - లే డీ స . మే డ మ .
हम कम काम ो त ते जि त होते हैं , हमें कम वे त न मिल ता है और हम आ इ जे न हा वर के नीचे काम कर रहे हैं .	మేము త కకువ శ ృ ంగా రం చేసతా ం , త కకువ జీ తం తీసు కొ ంటా ం , ఇంకా ఐ సె న హో వర సా రథ యం లో ఉననా ం .
मौ ज - मस ती कर रहे हों .	వి శ ృ ం ఖ ల ంగా పర వర తి ంచ రు .
तो , कया ? नै वि गे टर ? बॉ म बार डि यर ?	అయితే , ఏంటి ? నే వి గే టర ? బం బా ర డి య ర ?
मुझे सं गी त का जयादा ज ञ ा न नहीं है .	మ యూ జి క గురించి నా క ంత గా తెలీదు .
इससे फर क नहीं पडता था .	కానీ అది విషయం కాదు .
- अ मरी की ! - अ मरी की !	- అ మె రిక న ! - అ మె రిక న !
वहाँ से , कहानी थोडी ध ु ं ध ली हो जाती है .	ఇక అ కకడి నుండి , క థ అంతా అస ప షట ంగా గుర తుంది .
यू रो प में दूस रा मो र चा	యూ ర ప లో రెండ ో కూ ట మి
पर मुझे मान ना पडे गा , रे डियो पर उसकी आवा ज सुन कर ,	కానీ నిజం చెపప ాల ంటే , రే డి యో లో తన వా యి స ని వి నన పపుడు ,
हम तुमहें मार ना नहीं चाहते हैं .	నినను చం పే ఉదదేశం మాకు లేదు .
हाँ , मुझे यह पहले से पता है .	అవును , అది నాకు ఇ పపటి కే తెలుసు .
पर अगर तुमहें विश वास होता है , तो वे म हिला ओं को अस ली डि ग री नहीं दे ते हैं .	మీరు నమ ము తా రో లే దో కానీ , అకకడ వాళలు ఆడ వా రికి అస లెన డి గర ీ లు ఇవవ రు .
और मेरी भा ष ा के लिए माफ ी चा हूँ गी , पर वे किसी ने साथ भी " से कस " कर सकते हैं .	ఇంకా నా భా ష ని మన ని ంచండి , కానీ వాళలు క ది లే ది ఏదెనా సరే , దాని తో " శ ృ ంగా రం " చేసే సతారు .
" सब ल टर न . "	" ఆ ఫీ సర . "
सौ व ें से .	1 00 వ గర ూ ప .
उन में से एक अब भी जि ंदा है .	వీ ళ లలో ఒక డు ఇంకా బ తి కే ఉననాడు .
अरे , नहीं .	ఓహ , బా బ ూ .
अरे , नहीं .	ఓహ , పా పం .
यह अचछी बात नहीं है .	అది మంచి పని కాదు .
वहाँ से हर फा र म और हर श हर दिख रहा था	పరతి వయ వ సా య కష ే తరం ఇంకా పరతి ఊ రు నీ చూశా ను
यु वा व स था में , हम कभी किसी कु ं वा री के साथ से कस करने की कल प ना भी नहीं कर सकते थे .	యు వ కులు గా ఉండ గా , మేము ఎపపుడూ ఒక క న య తో శ ృ ంగా రం చేయ డా నని క నీ సం ఊ హి ంచ లే ము .
अचछा होगा अगर तुम नए सै नि कों को दिखा दो कि 2 5 मि शन सच में पू रे किए जा सकते हैं .	ఇ ర వె ఐ దు మి షన లు సా ధి ంచడం సా ధయ మే అని నువవు కొతత కు ర రా ళల కి చె బి తే మంచిది .
घर के अंदर जाओ और पुलिस को फोन करो .	మీరు ఇంట లోకి వెళలి పోలీసు కి ఫోన చేయ ండి .
और अगर बा रिश हुई , कयोंकि यह इ ंग लै ंड है ,	ఇది ఇం గల ండ కాబటటి , వర ష ం పడి తే గ నుక ,
बडा परिवार , छो टा घर , कुछ ही दरवा जे .	పెదద కుటుం బం , చినన ఇ లలు , త కకువ తలు పు లు .
हम इस ध व सत फो रट में थे और खा डी के ऊपर से दो इं ज नों के बल पर जा रहे थे .	మేము దా డి కి గు రెన విమానం లో ఉననా ము , కేవలం రెండు ఇం జ న ల బ ల ంతో గ ాలి లో ఎ గు రు తుననాం .
खो द ना शुरू करो . मेरी मदद करो .	ఇంకా త వ వు . నాకు సాయం చేయి .
अ मरी की कया कहते हैं कि हम अ ंग रे ज ों में कया समस या है ?	మా బ రి టీ ష వాళల తో ఏ సమసయ లు ఉంటా య ని మీ అ మె రిక నలు అనుకుంటా రు ?
और ब बल स ने सि क कों और बू ट ों वाले एक खेल का आ वि ष कार किया था .	ఇంకా బ బు లస క వార టర లు ఇంకా బ ూ ట లతో ఏదో ఆట మొద లు పెటటా డు .
- तुम कै प टन कर ॉ सब ी हो ? - हे भगवान .	- కె ప టె న క రో స బీ , మీ రే నా ? - ఓహ , దేవుడా .
यह आदमी मेरी तरफ मु डा और उसने कहा ,	ఈ కు ర ర వాడు నా వెపు తిరిగి ఏం అననా డ ంటే ,
जयादा तर झूठ ी थीं .	చాలా వర కూ నిజం కా వు .
वहाँ ऊपर काफी ठ ंड लग ती है . "	పె న బాగా చ లి గా ఉంటుంది . "
मुझे यह वाला पता नहीं था .	అది అంటే ఏమి టో నాకు తెలియదు .
तो मैं पर ो फ े सर गु ड हार ट के सम ू ह साथ श ै री पी ने जाती .	నేను పర ొ ఫె సర గు డ హా ర ట తో కలిసి వెన తా గ డానికి వెళ లేదా నని .
चलो भी , चार ली . हमारे साथ आओ .	ఇలా రా , చా ర లీ . మా తో చే రు .
- वह है मेरा नाम , र ै ंक , और कर मा ंक . . . - और कर मा ंक सं खया .	- నా పేరు , నా ర యా ంక , నా సీ రి య ల నె ం బ రు . . . - ఇంకా సీ రి య ల నె ం బ రు .
बेशक . शु भ रात रि , सर . सम मे ल न का मजा ली जिए .	ఫర వాలేదు . గు డ నె ట , సర . ఈ స ద స సు ని ఆ సవా ది ంచండి .
तो तुम य ै ं की ज के फै न हो ?	అయితే మీరు యా ం కీ స ఫ యా న కదా ?
दे वि यों और स जज नों , मि स ए ला वॉल श .	లే డీ స ఇంకా జె ంటి ల మెన , మి స ఎ లలా వాల ష .
ताकि मैं उनके सामने पु ष टि कर सक ूँ कि तुम बेशक वही हो जो तुम बता रहे हो .	అపపుడు మీరు చెపపి నవ ననీ స రెన వి వర ాల ే అని నేను మా అ ధి కారు లకు నిర ధా రణ చేయ గ లు గు తాను .
- " हमारे पिता . . . - उसे खतम कर दो .	- " మా త ండ రి . . . - వాడిని చం పే య .
हमें पता है कि तुमहें पहली बार ऑ सट बी वन के पास गिर फ तार किया गया था . . .	మిమమలని నిజ ానికి ఓ సట బీ వె ర న దగగర పటటు కుననా మని మాకు తెలుసు . . .
ल ु फ ट व ॉ फ - निय ंत रि त स टा लग ल ु फ ट I I I	లు ఫ త వా ఫ ే - నియ ంత రణ మూ డో సట ాల గ లు ఫ త
भ ौ गो लि क द ृ ष टि से , वे तुमहारे परिवार के मु का ब ले काफी करी ब हैं .	భ ౌ గో ళ ి కంగా చూ సతే , మీ పరా ంత ంతో పో లి సతే మా పరా ంత మే దగగర .
श रा ब के न शे में ध ु त होते हो , हमारे प ब ों में लड ते हो .	మీ తా గు డు అ ల వా టలు , మా ప బ లలో మీరు చేసే గొ డ వ లు .
दुनिया भर के मि तर देश ों का	పరపంచ ం అంత టా మి తర దే శ ాలు
जयादा तर लोगों को ए का ध दिन की जरूरत होती है .	చాలా మంది కి ఒకటి రెండు రోజు లు పడు తుంది .
गा र ड ! पीछे ह टो !	గా ర డ స ! సిదధ ంక ండి !
' ए ' से ए ले सा ंड रा . . . सं कष ि पत में सा ंड रा . . .	ఎ అంటే ఆ లె శా ండ రా . . . పొ టటి గా పి ల వాల ంటే శా ండ రా . . .
तुम कुछ ब जाते हो ?	మీరు వా యి సతా రా ?
कया बक क ले वे न भी य ै ं की ज का फै न था ?	బ క క లె వెన కూడా యా ం కీ స అభి మా నా ?
