जे र ला म रे ल केवल जी वि त ही नहीं है . उसने बच चों को भी जन म दिया है .	జె ర లా మ రె ల , బర తి కి ఉండ ట మే కాదు . సం తా నా నని కూడా పొ ందా డు .
जैसा कि ई श वर मुझे नि र देश दे ते हैं , मैं एक भगवान हूँ जि तना वे अन ुम ति दे ते हैं .	ద ె వం నాకు సూ చి ంచిన టలు గానే , అతను అను మ తి ంచిన ంత వర కూ నేను కూడా దే వ త నే .
जल द ही मुझे पता चल जाएगा और तुमहें नहीं .	తవర లోనే అది నాకు తెలు సతుంది , కానీ నీకు తెలీదు .
मैं देख भा ल के लिए अचछा ह ूं , समझ ने के लिए नहीं .	నేను బాగా చూ సు కుంటా ను కానీ , అంత బాగా అరథం చేసుకో లేను .
ये कि ता ब ें हैं .	ఇ వి పు సత క ాలు .
यह सं देश कह ता है जो ऊपर है उसे हमें ऊपर रख ना चाहिए ,	పె న ఉనన వాటి ని పె నే ఉ ంచ ాలని , కరి ంద ఉనన వాటి ని కరి ందే ఉ ంచ ాలని
लोग भा लू और शे र से डर ते हैं और बचा व के लिए अंदर रह ते हैं .	ఎ లు గు బ ంట లు మరియు సి ం హ ాల భయ ంతో పర జ లు తమ ఇ ళళ లలో నే ర కష ణ పో ందు తుననారు .
मुझे तुमहें कोई ब हा ना देने की जरूरत नहीं है .	నీకు సా కులు చెపప వల సిన అవసరం నాకు లేదు .
तुमहारे दवा रा किए गए कर म ों के बारे में सोच ो .	నువవు చేసిన ప ను ల నని ంటి నీ గురతు తె చచు కో .
और ट ै मै क टी और मेरे बीच एक गु पत समझ ौ ते दवा रा ,	అంతే గా క ట మా క టీ కీ నా కూ మధయ ను నన ఓ ర హ సయ ఒ పప ంద ం పర కా రం ,
कया तुमहारे साथ भी सब ठीक है ?	నీ క ంతా బాగానే జరుగు తో ందా ?
हम तब तक कुछ नहीं क हें गे .	అ పపటి దా కా మనం నో రు మె ద ప కూడదు .
के क ने अपना स वाद खो दिया ,	కే కులు వాటి రు చి ని కో ల పోయా యి ,
कयोंकि , अगर तुमने अभी तक अन ुम ा न नहीं लगा या , इन भा इ यों और बह नों के नाम थे	ఎందుకంటే , మీరు ఈ పా టి కే ఊ హి ంచ లేక పోయి న టటే , ఆ అననా చె ల లె ళళ పే రలు ,
कृपया , मैं वि न ती करता ह ूं , हमें जाने दी जिए .	దయచేసి , మమ మ లని వదిలే య మని మిమమలని పరా ధ ే య పడు తుననాను .
लट ठा बर बाद मत करो . मैं तुमहें गर म रख ती हूँ .	మొ దదు ను వ ృ ధా చేయ వదదు . నీకు వె చచ ద నా నని నేను ఇ సతాను .
उसके बच चों को खो जो , और उनहें मेरे पास ला ओ .	అతని సం తా నా నని పటటు కొ ని , నా ము ందుకు తీసుకు రా వాలి .
कया वह तुम हो ?	అది నువవే నా ?
पै रिस ?	ప యా రి స ?
पै रिस .	ప యా రి స .
बढिया .	మంచిది .
हमने केवल सच बो ला .	మేము నిజ మే మాటలా డా ము .
उनके सम र थ क हैं , जो बढ ते जा रहे हैं .	వాళళ కి చాలా మంది మి తరు లు ననా రు .
पै रिस .	ప యా రి స .
ह नि वा . उसे किसी को नहीं बता ना चाहिए .	హ నీ వా . వాడు ఈ విషయం మూ డో క ంటి కి చెపప కూడదు .
तुमहें पास कया है ?	నీ దగగర ఏ పు సత క ము ంది ?
लेकिन हमें कोई जवाब नहीं मिला , कोई ग ं ध नहीं , कोई नि शान नहीं , कोई उममीद नहीं .	కానీ మాకు సమా చా రం కానీ , వా స న కానీ , గురతు లు కానీ , ఆ శ కానీ ద కక లేదు .
- मैंने सं पू रण सं देश पढ ा है . - इसे मुझे दो .	- నేను మీకు మొతత ం చ ది వి పెటటా ను . - అది నాకు ఇవవ ండి .
मुझे लगा कि सा री कि ता ब ें जल गई हैं .	పు సత కాల నని ంటి నీ దగ ధం చేసే శా రని భా వి ంచా ను .
तुमहारी द या ल ु ता के कारण तुमने वर ष ों तक उनहें यही बताया कि तुम उनके पिता हो .	ఎ నన ో ఏ ళళు గా , నీ మంచి తన ంతో , నువవే వారి త ండ రి వని ఆ క వలల కి చెపపా వు .
यह सिरफ एक बॉ कस है , मेरी जान .	ఇది కేవలం ఒక పెటట ె మాతరమే , బంగా రం .
मुझे यह भी नहीं पता था कि गा ँ व में हमारे बीच एक छा या रह ती थी .	ఈ గరా మ ంలో మన మధయ ఓ ఛ ా య ఉ ంద నే విషయం కూడా నాకు తెలీదు .
और , इसलिए , इस भा री मन से मैं अब आपका नि र देश चाहता ह ूं .	అ ంచే త , విష ా ద హ ృ దయ ంతో మీ ఉ ప దే శా నని కో రు తుననాను .
एक बार , हमने एक - दूसरे से बिना बो ले बात की . . .	ఒక పపుడు , మన మధయ మాట లు లే కుండా నే మనం మాటలాడు కుననా ం . . .
और जब वह हमारे गा ं व आई ,	తను మా గరా మా నికి వచచే స రికి ,
जल द ही , परिवार ने झ ग डा करना शुरू कर दिया , कि कौन सु ंदर था	కొ ననా ళళ కే , ఎవరు అంద ంగా ఉననా రో , ఎవరు అంద వి హ ీ న ంగా ఉననా రో అనే దాని మీద
मेरे घर के अंदर भी आया हो सकता है .	సా హ సం ఎవరో చేసతుననా రని నాకు అనిపి సతోంది .
वे मेरे बचचे हैं .	వాళళు నా క నన పిలల లు .
मैं द ृ ष टि वि ध र म की पर श ं सा कर ूं गी .	చూ పు అ ప ధ ర మా నని చా టి చెప తాను .
वह खुद को शु द ध रख ती है . भ वि ष य बता ने वाले भी उसे महसूस नहीं कर सकते .	తన లో అ లో చ ల నని ంటి నీ న శి ం ప జే సు కు ంటుంది . తను ది వయ ద ృష టి సారి ంచు వా రికి కూడా దొ రక దు .
वह त भी चल ती है जब दूसरे चल ते हैं .	ఇ తరు లు క ది లి న పపుడే ఆమె కూడా క దు లు తుంది .
मुझे लगता है , कया तुम एक और रख सकते हो ?	మ రో ర హ స యానని కూడా మీరు కా పా డ గల రా ?
मुझे लगा कि वह तुमहें खुद बता ए गी .	మీకు కూడా త నే స వయ ంగా చెపప ాలని ఆ శి ంచా ను .
मान व ने इस शक ति , और उनके मन की शक ति का उप यो ग ,	ఈ శ కతి ని , ఇంకా తమ మే ధ ో శ కతి ని ఉ ప యో గి ంచి
अब इसे आ ं टी पै रिस को दे दो .	ఇపపుడు దానని ప యా రి స ఆ ంట ీ కి ఇవ వు .
तो वे मर जाए ं गे .	ఆ తరవాత చచ చి పో తారు .
शायद हम य हां ई श वर से भी बहुत दूर हैं .	బహుశా మన మి కకడ దేవు నికి కూడా ద ూర ంగా ఉననా మే మో .
दू सर ों ने इसे लि खा . तुमहें भे जा गया . झ ु को .	ఇది ఇ తరు లు ర చి ంచి , నినను పం పా రు . మో కా ళళ మీద కూ రచ ో .
इस प हा ड से एक और रा सता है .	ఈ కొ ండ ది గ డానికి మ రో మా రగ ము ంది .
कयोंकि छा या हमेशा म हिला ए ं होती हैं . पु रु ष अ ना डी होते हैं .	ఎందుకంటే ఛ ా య లు ఆడ వాళళ ే అయ యు ంటా రు కను క . మ గ వాళళు దానికి మో టు గా ఉంటా రు .
हमारी से ना एँ पर का श की इन श ै ता नों से लड ते के लिए मै दा न में निक ली हैं .	ఈ కా ంతి త ాల ూ కు దు ష టు లతో మన సే నలు క ద న రం గ ంలో పో రా డు తుననా యి .
ह नि वा , को फु न , तुमहारा खि लौ ना कहा ं है ?	హ నీ వా , కొ ఫ ూ న , మీ బ ొ మమ ఎ కక డు ంది ?
सर दि यों को गर म और गर मि यों को ठ ं डा करती ह ूं , हमारे बा डे पर जा दू डा ला	శ ీ తా క ాలా నని వె చచ గా ఉ ంచు తూ , వే స వి క ాలా నని చ లల గా ఉ ంచు తూ , సి ం హ ాలు మరి యి ఎ లు గు ల బా రి న
मुझे अपने चार ों ओर अ विश वास महसूस होता है .	నా చు టట ూ భా రీ నమమ క ద రో హం జరుగు తునన టటు అనిపి సతోంది .
मुझे डर है कि कोई मेरे लिए और मेरे सबसे करी बी लोगों की जा सू सी करने के लिए	నా మీ దా , నాకు దగ గ రెన వారి మీ దా స వయ ంగా నా ఇంట లోనే ని ఘ ా పెటట ే ంత
चे ट - चे ट - चे ट !	పా రా హు షా ర !
बेशक .	అవును .
देखो , मैं दिन में ऐसी बातें सुन ता ह ूं जो मुझे ज गा ए रख ती हैं .	ప గ టి ప ూ ట నేను వి ంటు నన కొనని విషయ ాలు రాతరి నాకు ని దర ప టట కుండా చేసతుననా యి .
मुझे लगता है यह अब ना उममीद है .	ఇపపుడు దీని వలల లా భ ం లే దని నా నమమ కం .
ल ॉर ड कार न .	కార న పర భు వు .
और उसके बाद वे सभी हमेशा खुशी से रह ने लगे .	ఆ తరవాత వాళళు ఆన ంద ంగా జీవి ంచ సా గా రు .
मेरे दवा रा छो डी गई कि ता ब ों से सी खो .	నేను వది లి వెళలి న పు సత కాల నుండి నే రచు కో ండి .
वे स थ िर होती हैं , और फिर भी वे कल प ना में ले जाती हैं .	అవి శ బ ద ం చేయ వు కానీ అనే క ఊ హ లని రే కె తతి సతా యి .
उस में जाना . व हां तुमहें एक बॉ कस मिले गा .	అందు లోకి ఎ కకి చూడు . అకకడ నీ కో పెటట ె క న బ డు తుంది .
मैं आपका सम र पि त से व क बना र हूँ गा , ट ै मै क टी जू न . "	ఎ లల పు డ ూ మీ వి ధ ే య ధా సు డ నే , ట మా క టీ జ ూ న . "
एक ने सबसे अधि क सु ग ं धि त इ तर बना या .	ఒక రు అత య ంత సు గం ధ భ రి త మెన అత తరు ను చేసే వారు .
मैंने उसके लिए वे दी पर एक नो ट छो डा था और जब मैं वापस आई , तो वह व हां नहीं था .	ఆమె కోసం బ లల మీద ఓ చ ీ టీ ని ఉ ంచా ను , తి రి గొ చచి చూ సే స రికి అది లేదు .
मैं तुमहारे पा प ों को कष मा कर दू ं गी .	నీ పా ప ాలని నేను కషమి ంచే సతాను .
जे र ला म रे ल ने एक भा लू से उनकी जान बचा ई , और तुमहारी भी .	నీ పరా ణ ా నని , పిలల ల పరా ణ ా నని ఎ లు గు బా రి నుండి జె ర లా మ రె ల కా పా డా డు .
मुझे लगता है कि वह खुद को हम से अ व गत करा ए गी .	తన కి తా నే మన కి సా కష ా త కార మ వు తు ందని నేను భా వి సతుననాను .
वह बी स साल की से वा के लिए अधि कृ त है , और वह बी स साल से वा करे गा .	ఇ ర వె ఏ ళళ సే వ కని అత డిని నియ మి ంచుకో వడం జరిగింది , ఆ 2 0 ఏ ళళు సే వ చేసే తీ రు తా డు .
वह केवल जे र ला म रे ल के बारे में सोच ती है जब यहाँ हो , घर पर ,	తను ఎపపుడూ జె ర లా మ రె ల గురించి మాతరమే ఆలోచి సతుంది , కానీ ఇకకడ , మన ఊ రి లో ,
अ ंत में , एक दिन वे फिर से एक साथ आए . . .	చి వ రికి , ఒక రోజు , అందరూ కలిసి . . .
अगर तुमने कुछ नहीं सुना , तो तुमहारे कान मेरे किसी काम के नहीं .	నీ కే మీ విన బడ కు ంటే , నీ చె వు ల వలల నా కే ం పర యో జ నం లేదు .
और हमारे क बी ले को सुरकष ा की और नि र दे शि त किया .	మన జా తి ని సు ర కషి త పరా ంతా నికి చే ర చా డు .
पयार के साथ , तुमहें पयार करने वाला पिता . . .	ఎ న లేని పరే మ తో , మీ పరి య మెన త ండ రి . . .
उसने एक पु ल बना या .	అత నో వ ంత ె న నిర మి ంచా డు .
ट ै मै क टी जू न कभी वि न मर नहीं होता , वह से व क नहीं है ,	ట మా క టీ జ ూ న కి విన యం అంటే ఏంట ో తెలీదు , అతను దా సు డు కూడా కాదు ,
उसकी हर बात का एक मतलब होता है .	అతను చేసే పర తీ పని లో ఏదో అరథం ఉంటుంది .
हमें उनका सम मान करना चाहिए .	మనం వారి ని గ ౌ ర వి ంచాలి .
उनहें मुझे ढ ूं ढ ने के लिए क हो और बोल दो . . .	నా వ దద కి వచచి వాళళ ని చెపపే య మను . . .
जो गर म बर फ की तरह महसूस होती थी .	వ స తర ాలను పటటు తో కు టటే వారు .
उसके श बद ों से परिवार बहुत है रा न था . . .	అతని మాట లు వి ని ఆ కుటుం బా నికి నో ట మాట రాల ేదు . . .
उनहें सच चा ई का पता लगा ने दो . . .	నిజ ా నని తెలుసు కో నివ వు . . .
काफी ब डे होंगे समझ ने के लिए कि अंदर कया है .	అందు లో ఉనన ది అరథ ంచే సుకో వడానికి క నీ సం అంత వయ సు ఉండాలి .
यह जी वन काफी नहीं है .	ఈ జీవితం సరి పో దు .
बस इसलिए कि हम य हां छ ि प रहे हैं इसका मतलब यह नहीं है कि दुनिया बदल गई है .	మన మి కకడ దా కక ొ ని ఉనన ంత మా త రా న పరపంచ ం మా రి పోయి ందని అరథం కాదు .
मैंने नि र देश भी दि ए हैं ज हां तुमहें जाना चाहिए	మీ గరా మా నని వి డి చి పె టటి వెళళ గ లి గే ంత ధ ె ర యం మీకు వచచి నపపుడు
मैंने उनके साथ सप ने देख े .	తన తో నేను వాటి ని ఊ హి ంచు కుననాను .
ल ॉर ड कार न और ले डी जी . . .	కార న పర భు వు మరియు జీ నా య కీ . . .
उसने जवाब दिया " खैर " . . .	" అ దీ , " అతను బ దు లి వ వ సా గా డు . . .
इन का नाम ह नि वा और को फु न रख ना .	వీ ళళ కి హ నీ వా , కొ ఫ ూ న అని పే రలు పెటటు .
दूसरे ने सबसे मी ठा के क बना या .	ఒక రు అత య ంత మ ధ ు ర మెన కే కు లను చేసే వారు .
मैं कह ता ह ूं कि हम सत य की घ ो ष ण ा करते हैं .	మనం నిజ ా నని పర క టి ంచ ాలని నే న ంటా ను .
इसका उप यो ग करना तुमहारा कर त वय है .	దీ నని వి ని యో గి ంచుకో వల సిన బాధ యత మీ పె ఉంది .
तो वे बस अपनी आँख ें बंद करके चल ेंगे और बढ े होंगे ,	అయితే వాళళు జీవి తా ంత ం క ళళు మూ సు కు ని ఇకకడ ే తి రుగు తూ , పె రుగు తూ ,
मेरी दा दी ने मुझे कहा निया ं सुना ई ं जो उनकी दा दी की दा दी ने उनहें सुना ई ं .	మా బా మమ కి తన బా మమ కి బా మమ చెపపి న క థ లని నాకు కూడా చెపపి ంది .
चु डै ल खो ज क आ रहे हैं .	మా ంత రి కా ంత కులు వ సతుననారు .
चे ट - चे ट !	పా రా హు షా ర !
मेरे बचचे शा पि त नहीं है . . .	నా పిలల లు శా ప గర సతు లు కా కపో వచచు . . .
छा या .	ఛ ా య .
तो किसी और की ब जाए , तुमहें , शायद पता हो .	అది నీ కే తెలు సతు ందని అను కుననాను .
म हा रा नी , वि ध र मी जे र ला म रे ल खो गया है .	మ హా రా ణి , మ త వి రో ధి జె ర లా మ రె ల ఎ టో వెళలి పోయా డు .
हम पा यान हैं	మనం ప యా న ప ౌ రు ల ం
हम पा यान हैं	మనం ప యా న ప ౌ రు ల ం
माँ !	అమమా !
कया ?	ఏంటి ?
और मुझे बताया कि सू र ज की एक बहन थी जो रात को खेल ने के लिए बाहर आई थी .	ఆ డు కు ంటు ందని నాకు చెపపి న పపుడే నాకు విషయం తెలి సి పోయింది .
तब वह उस आदमी का साम ना करे गा जो मैं कभी था ,	అది ఆడ యి నా మ గ యి నా , నా ము ను ప టి మనిషి ని చూడ వల సి వ సతుంది ,
यही मैं उनके लिए चाहती ह ूं , कि वे जी ए ं .	వాళళ విషయం లో నేను కో రు కునే ది అదే , వాళళు బర త కాల ని .
और अगर बोल ते हुए वे मेरी तरफ देख ते हैं ,	అలా వచచి నాతో మాటలాడు తునన పపుడు ,
मैंने धयान से कि ता ब ें चु नी हैं .	నేను అ తి జా గర తత గా పు సత కాల ను ఎ నను కొ ననాను .
कि ता ब ें प वि तर होती हैं .	పు సత క ాలు ప వి త రా కా రం లో ఉంటా యి .
खैर , तुम बहुत अचछी हो , पै रिस .	అది నీ మంచి త నం , ప యా రి స .
और उनहोंने यह फै सला किया कि जो भी द ृ ष टि ने उनहें बताया वह सब भूल जाए ं गे .	చూ పు వాళళ కి చెపపి న విష యానని మర చి పో వాలని ని శ చ యి ంచు కుననా రు ,
और जल द ही , वे फिर से सं तु ष ट हो गए .	అ తి కొ ద ది క ాలా ని కే మళలీ ఆ స ంత ృ ప తి ని పొ ందా రు .
यह तुमहारी पसंद है ?	అదే నా నీ ఎ ం పి క ?
मुझे लगता है कि यह आ खि री भा लू है .	ఇదే ఆ ఖ రి ఎ లు గు అనుకుంటా ను .
एक थोडा सु ंदर है , एक सा दा है . . .	ఒక రు మా మూ లు గా ఉననా రని . . .
मुझे नहीं पता . मैंने ऐसा पहले कभी नहीं किया है .	నాకు తెలీదు . ఇలా నేను ఎపపుడూ చేయ లేదు .
