हेदर ?	హే థర !
र च ना त म क पर य वे कष क र वी न दर श ं कर शु कल	కరి యే టి వ సూ పర వె జర : రా జే శ వర రా వు వల వల
तुमहें ठीक देख कर अचछा लग रहा है .	నువవు నీ కా ళళ పె ని ల బడ గల గ డం సంతోష ం .
तुम जानते हो और भी र ंग होते हैं .	నీకు వే రే రం గు లు ఉంటా య ని తెలుసు గా .
जब उसके ठीक ब गल में हो , तब नहीं .	బహుశా నువవు అతని ప కక న ఉంటే కా దే మో .
ह ंट के नी खेल रहा था ? वह वहाँ था ?	హ ంట కె ననీ ఆ డా డా ? అతను అకకడ ఉననా డా ?
- बच चों ने क सम खा ई कि खेल नहीं खेल रहे थे . - पता है .	- ఆ పిలల లు ఆడ ట లే దని పరమా ణం చేశారు . - నాకు తెలుసు .
तुम वा कई यह पह न कर डर बी पर जाओ गी ?	రే సు కు నిజంగా అది వే సు కుంటా వా ?
ए , बि श प आया है .	హే , బి ష ప వచచా డు .
शायद , पर आ ग लगी , खेल चा लू है , बचचे हैं , और ह ड डि यों से भ री थ ै ली , इसलिए . . .	అయి ండ వచచు , కానీ మ ంట లు , ఒక ఆట , కొ ంద రు పిలల లు , ఒక ఎ ము కల స ంచి ఉననాయి , అందు కని . . .
गु ससा हुई थी , जब मैंने एड म की स वे ट श रट पह नी थी ?	నేను ఆ డం చ ొక కా వే సు కుననా నని ఏ పరి ల అ రి చి ంది ?
उन लोगों को देखना चाहती हूँ जिन हें पूरी जिंदगी नहीं देखा .	నా చెతత జీవి తా నని ని త యం చూ సిన వారు కా ని వారి ని కలు సుకో వాల ను ంది .
कया ? मुझे . . .	ఏంటి ? నాకు . . .
- उसे लगा कि मेरा उससे कुछ सं बं ध था ? - हाँ .	- ఆమె నేను అతని తో జ త క టట ా నని అను కు ందా ? - అవును .
सा त सं खया वाले नंबर को धयान से देखो , ठीक है ?	ఏ డు అ ం కె ల సం ఖ య ను దయచేసి గ మని ంచండి , సరేనా ?
यह माम ला काफी ग ं भी र है , हेदर .	ఇది గం భ ీ ర మెన వయ వ హా రం , హే థర .
- हैलो , बो , कया हा ल है ? - हैलो .	- హే , బో , ఏంటి సంగ తులు ? - హే .
और तुमहारे लिए कुछ ला ई हूँ .	ఇంకా నీ కోసం ఒకటి తీసు కొ చచా ను .
वही आ खि री दिन था जब मैंने उनहें जि ंदा देखा .	అదే నేను ఆ య నను స జీ వ ంగా చూ సిన చి వరి రోజు .
मैं तुमसे उस बारे में बात करना चाहता था .	నేను దాని గురించి మాటలాడ ాలని అనుకుంటుననా ను .
लोगों को यह तो नहीं पता चला कि मुझे पह ला मौ का नहीं मिल ता .	నేను కొతత వి కొ నుక కో లే నని అంద రికీ తెలి సే క ననా అది న యం .
उसका पता लगा या . ट रि नि टी फ ॉल स में ना च ती है .	ఆమె ట రి ని టీ ఫ ాల స లో సట రి పప రని తెలి సింది .
कैसे वह म श ह ूर हो सकती थीं .	ఆమె ఎంత పర ఖ యా తి చె ందే ది అని .
सोच ना कि वह एक अचछी माँ थीं .	ఆమె మంచి అమమ అని అనుకో వడం .
अचछा , तो . . .	సరే , అంటే . . .
पता न था कि तुम डर बी में काम कर रही हो .	నువవు రే సు లో పని చేసతుననా వని నాకు తెలియదు .
मैं हेदर को टि कट दे द ूँगी .	నేను హే థర కు తన టి కె ట ఇ సతాను .
निका स 1 2 - आई - 4 5 - रात 1 ब जे	ని ష కర మ ణ 1 2 - ఐ - 4 5 - ఉద యం 1
- तुम आ गई . - हैलो . यहाँ आओ .	- నువవు వచచా వు . - హాయ . ఇలా రా .
उसका और इंतजार नहीं कर सकते .	ఇక తన గురించి వే చి చూడ లే ం .
लगता है वि लि य मस के साथ बात खतम हो रही है .	అతను వి లి య మస తో నిర ధా రణ కు వ సతునన టటు ంది .
लि ट ल बिल ने ऐ बी कला र क का जि कर किया था .	లి టి ల బి ల , అతను ఆ బీ గురించి పర సతా వి ంచా డు .
मुझे लगता है कोई पै निक पर श रत लगा रहा है .	పా నిక మీద ఎవరో ప ంద ెం కా సతుననా ర ను కుంటా ?
इस बारे में माँ तुमसे सु बह बात करे गी .	అమమ నీ తో దీని గురించి ఉద యం మాటలాడు తుంది .
हाँ . तो , ए का उ ं टि ंग कयों ?	సరే . మరి , అ క ౌ ంటి ంగ ఎందుకు ?
- पया रे बन रहे हो ? - बस सच कह रहा हूँ .	- తెలి వి గా మాటలాడు తుననా వా ? - లేదు వా సత వం .
वि जे ता , च ौ द ह नंबर , रे ह ॉल !	వి జే త , నం బ రు 1 4 , రే హ ాల !
जज ों को खेल ने की इ जा ज त है ?	నయాయ నిరణ ే త లను ఆ డని సతా రా ?
यह क ॉर न हो ल में मा ह िर है .	తను కార న హో ల బాగా ఆ డు తుంది .
- बंद कर दो . . . - इसे छोड ो . वापस रख ो .	- అది మూ సే య . . . - వదిలే య . తిరిగి పెటట ే య .
एक दिन मैं डी ए से मिला .	ఆ రోజు నేను డీ ఏ ను కలి సా ను .
म ं च पर सवागत है , रा कै ल !	వే ది క మీద కు సవా గ తం , ర ఖ ే ల !
आपको पता है लि ली कहाँ है ?	లి ల లీ ఎకకడ ఉ ందో తెలుసా ?
पर खेल अलग सा लग रहा है , नहीं कया ?	ఆట భి నన ంగా అనిపి ంచి నా , అది అలా ఉండ దు ?
डर ने की कोई वजह नहीं . मैं जी त ूँगा .	భయ పడ ాల సిన అవసరం లేదు . నేను గె లు సతాను .
हाँ , वह पर ं परा है . हर साल बचचे व हीं करते हैं .	అది సం పర దా యం . పిలల లు అకకడ పరతి ఏ డా ది చేసు కుంటా రు .
तो , यह कहना कि हम पार टी में थे , ठीक ?	మనం పార టీ లో ఉననా మని చెపపు , సరేనా ?
हर कोई नहीं .	అందరూ కాదు .
देखो , आपकी पह चा न पै स ों से नहीं होती .	చూడు , నువవు ఏంట ో డబబు తెలియ చేయ దు .
- शुकरिया . - कोई बात नहीं .	- ధనయవాదాలు . - పర వాలేదు .
मुझे स पर लॉ क के यहाँ जो सू ची मिली थी , याद है ?	నాకు స పర లా క వాళళ ఇంటి లో దొ రికి న జా బి తా గురతు ందా ?
ताकि त ला शी का वार ंट मिले और वे ठीक से ढूँढ पा एँ .	చూ ప ను ననా రు , సర చ వా రె ంట తె చచి , మొతత ం చూ సతారు .
कया बात करना चाहती हो ?	నువవు నాతో ఏం మాటలాడ ాలి ?
मेरी बहन है . लि ली के बारे में है .	మా చె లలి ఫోన చేసి ంది . లి ల లీ గురించి .
किसी को जानता हूँ जो ठीक कर सकता है .	చ వ క గా , అది బాగు చేయ గల వాడు తెలుసు .
कोई फिर से खाना बना ने के वी डियो देख रहा था .	ఎవరో మళళీ ఎలా చేయ ాల నే వీ డి యో లు చూ సిన టటు ఉననారు .
माफ करना . तुमहें अपना माल चाहिए ?	కషమించు . నీకు నీ చెతత స రు కు కా వ ాలా ?
बहुत चिंता हो रही थी .	నేను చాలా కంగా రు పడ డా ను .
तुमहें लगता है घर से आ ख िर में निकल ने के लिए जज फा लत ू अं क देंगे ?	ఇంటి ని చి వర గా వది లి వచచి న ందుకు నాకు నయాయ నిరణ ే తలు అద న పు పా యి ంట లి సతా రా ?
वह बहुत अचछा बच चा था .	అతను చాలా మంచి పి లలా డు .
उसकी जगह किस ने ली थी ?	అత నని ఎవరు భ ర తీ చేశారు ?
इसलिए वह मेरे पास थी .	అది అలా నాకు దొ రికి ంది .
वा सत वि क ता को लेकर सभी की अपनी अलग सोच है ,	వా సత వా నని నిర వ చి ంచే ందుకు ఎవరి ఆలోచ నలు వారి వి ,
मै दा न से निकल ने पर उनका चे हरा देखा , कभी नहीं भूल पा ऊँगा .	నేను అది గె లి చా క , ఆయన ముఖ ం నేను ఎ పపటి కీ మర చి పో లేను .
हेदर , उ ठ ो !	హే థర , లె గు !
याद है आ ठ वी ं कला स में , ए परि ल कैसे	నీకు గురతు ందా ఎ నిమి దో తర గ తి లో ,
- जयादा मो टी हो गई ? - माँ , मैं मजाक कर रही थी .	- లా వు గా అయి పోయా నా ? - అమమా , సర దా కి అననా ను .
भाई के लिए माफ करना .	తమ ము డి తర ఫ ు న కష మా ప ణ లు .
वे खेल को पास से देख पा ते हैं ,	అది వాళళ ను ఆట కు దగగర గా ఉ ంచు తుంది ,
- छोड कर जा रही हो ? - शु भ काम ना एँ .	- వది లి వెళ ు తుననా వా ? - శు భా శ ీ స సు లు .
को र टे ज बो ला जिस रात आ ग लगी , वह तुमहारे कम रे में गया था .	మ ంట లు రే గి న రోజు , కోర టె జ నీ గ ది అంతా వె తి కా న ననా డు .
- ए . - हेदर !	- హే . - హే థర !
हैलो , जान ,	హే , బంగా రం ,
बद न की आ ग बु झा ने के लिए तुमने सबसे घट िया आदमी को चु ना .	సె కస వా ం ఛ కోసం నీ ది పరపంచ ంలో కె లలా దారు ణ మెన ఎ ం పి క .
मुझे देर हो जाए गी . बाद में मिल ूँगा , ठीक है ?	ఆ లస యం అవు తుంది . తరువాత కలు సతాను , సరేనా ?
मतलब , ल ॉन ग ह ॉर न सट े ट की एक है ,	అంటే , లా ంగ హా ర న సట ే ట లో ఒకటి ఉంది ,
स ड कों पर कई तरह के लोग होंगे .	రో డ ల పె న ఉండ కూడ ని మను ష ు లు ఉంటా రు .
असल में वै सा नहीं होना था , है न ?	అది నిజ మెన ది కా కూడదు , తెలుసా ?
सच में , शे री , तुमहें हुआ कया है ?	నిజంగా నా , ష ె రీ , నీకు ఏమ యి ంది ?
उस में मुशकिल यह है कि	అందు లో సమసయ ఏంట ంటే ,
- शुकरिया . - शुकरिया .	- క ృ త జ ఞ తలు . - క ృ త జ ఞ తలు .
- मैं वह नहीं चाहती थी . - कया नहीं चाहती थी ?	- అలా చేయ ాలను కో లేదు . - ఏం చేయ ాలను కో లేదు .
- उन में से गोली नहीं चल ती . - तुमसे यह किस ने कहा ?	- అందు లో గ ాలి తపప ఏమీ పే ల దు . - అది నీకు ఎవరు చెపపా రు ?
उनके माँ - बा प स खत हैं , इसलिए बात को छु पा कर रख ते हैं .	అది ర హ సయ ంగా ఉ ంచారు , ఆమె తల లి ద ండ రు లు క ఠ ి నం అని .
उसने वह गु ड वि ल को दे दी थी .	అతను అది గు డ వి లకు దా నం చేశా డు .
परति यो गि ता के लिए उसने भ वि ष य वा ण ी की है .	అది ఛ ా ం పి యన షి ప సి రీ స పె అతని అ ంచ నాలు .
कया मतलब ?	అంటే ఏంటి ?
कया मतलब ?	అంటే ఏంటి ?
या नि उसे डर होगा कि शायद तुम जी तो गे .	దా న రథ ం అతనికి నువవు గె లు సతా వే మో అని భ యం .
मैं ड रि ंक पर सभी से मिलने कै रि ग न जा रही हूँ .	నేను కా రి గ న లో డ రి ంక కి వెళళి అంద రి నీ కల వ బో తుననాను .
डॉ ट से पता चला कि तुम कुछ दि नों से नहीं गए ,	డా ట నువవు గ త కొనని రోజు లు గా రా వడం లే దని చెపపా డు ,
यह सा बि त करने के लिए कि तुम गरे बिल नि वास में थे ,	నినను ధా నయా గా రం ఇంకా గరే బి ల ఇంటి దగ గ రు నన టటు
मैं बा कि यों के कुछ देर बाद बाहर निक ली .	నేను అంద రి కంటే కా సత తరువాత వచచా ను .
तुम कया सोच रहे हो ?	ఏం ఆలోచి సతుననా వు ?
- यह ठीक नहीं हुआ . - बैठ जाएँ गी ? मुझे च क कर आ रहा है .	- ఇది పిచచి ఆలోచ న . - కొంచెం కూ రచు ంటా వా ? క ళళు తి రుగు తుననా య .
आज रात के लिए आ खि री चार मा य ने रख ते हैं , पर वे अं कों के अ ला वा हैं ?	ఈ రాతరి వాళళ కు పా యి ంట లే కా కుండా ' ' చి వరి నలు గు రు ముఖ య మా ? ' '
चलो . पलीज बताओ न . ना राज नहीं हूँ .	చెపపు . దయచేసి , చెపపు . నాకు కో పం లేదు .
- उसे श रत लगा ने में मजा आता है . - कया मतलब ?	- అతని అ ంచ నాలు వి సత రి ం ప చేసతుననా డు . - అంటే ఏంటి ?
कया मतलब , हम जी ते तो ? पता नहीं . कुछ सोचा नहीं है .	మనం గె లి సతే అ నా ? ఏ మో తెలియదు . నిజ ానికి అది ఆలోచి ంచ లేదు .
का श . . .	నేను . . .
उनहोंने पी रख ी थी .	ఆయన తా గి ఉననారు .
- मैं लू क हूँ . - मैं तुमहें जानता हूँ .	- నేను లూ కను . - నువవు ఎవరో తెలుసు .
जरूरत प डी तो दी वार ें भी तो ड डाल ेंगे .	వాళళు గో డ లు తె రు సతారు , అవ సర మె తే .
मतलब , उनहें सवी कार ने से ?	ఎలా అంటే , అది ఒ పపు కో డానికి ?
निकल जाओ !	వెళళి పో !
- लि ली , पलीज यहाँ आओ गी ? - अचछा , आ रही हूँ .	- లి ల లీ , దయచేసి . ఇకకడ కు వ సతా వా ? - సరే , వ సతుననా .
मुझे डर लग रहा है .	నాకు భయ ంగా ఉంది .
हमें पता है इस साल एक और खेल खे ला जा रहा है .	ఈ ఏ డా ది మ రో ఆట ఆ డు తుననా రని మాకు తెలుసు .
मैं चाहती थी कि वह मुझ पर भरो सा करे , पर . . .	అతను ననను నమమ ాలని అను కుననాను , కానీ . . .
तुम लोग वहाँ पै निक खेल ने गए थे ?	మీ రం తా అకకడ పా నిక ఆడ డానికి వెళళ ా రా ?
तो अधि क न शा को लेकर झूठ कह रहे हैं ?	అ తి మో తా దు పె అబ దధ ం చెపపా ర ంటా రా ?
कयों ? वह हफ त ों तुमसे ना राज रही .	ఎందుకు ? ఆమె వార ాలు ఇ బబంది పె టటి ంది .
अं ति म कर िया के बाद उनके साथ शे रि फ के द फ तर गया .	అంత య కరి య ల తరువాత అతని తో కలిసి ష ె రీ ఫ ఆ ఫీ సు కు వెళళ ా ను .
तब यह कहानी नहीं रह जाए गी .	అది ఇక క థ గా మి గి లి పో దు .
जब भी तुमहें मौ का मिल ता है , अपनी नो ट बु क में	నీకు వి రా మ ం దొ రిక న పపుడ లలా నువవు ఎపపుడూ
- न सी ब वाला हरा र ंग . - बन डा ना नहीं हैं , नहीं .	- అద ృష టా నని తె చ చే ఆ కు ప చచ . - రు మ ాలు వదదు .
यह लो . शुकरिया .	ఇది గో . ధనయవాదాలు .
माँ , यह कया है ?	హే , అమమా , ఇదే ంటి ?
मेरा जो श आ स मान छ ू रहा है ! धत तेरी !	నాకు చాలా ఉ త సా హ ంగా ఉంది ! అబబా !
- शुकरिया . - हाँ .	- ధనయవాదాలు . - సరే .
दो सौ प च ह त तर ? तुमहें 1 00 अं क मिले ?	2 7 5 ? నీకు 1 00 పా యి ంట లు వచచా యా ?
सब ूत जल कर रा ख हो चुका है .	సా కష యం బ ూ డి ద యి పోయింది .
पिछ ले साल वह एक जज था .	గ త ఏ డా ది అతను నయాయ నిరణ ే త .
मेरे पिता उनकी इ मा रत के मा लि क हैं . मुझे कि रा या ले ने भेज ते .	వాళళ అ పార ట మె ంట మా నానన ది . ఆయన ననను అ దద ె కు పం పే వారు .
आप या तो छो टे इंसान हैं , या नहीं .	నువవు చెతత దాని వా కా దా అనన ది .
सभी रे सर अपने इं जन चा लू करें .	రే సర లు , మీ ఇం జి నలు సటా ర ట చెయయ ండి .
मैंने पह े ली ह ल की थी , याद है ?	పొ డు పు క థ పరి ష కరి ంచా ను , గురతు ందా ?
बा रह नंबर वाली पी ली गाडी में डॉज मे सन है .	ప సు పు ప చచ కారు నం బ రు 1 2 లో , డా డజ మే స న .
गरे बिल चु नौ ती के बाद जो अं क थे , पहली तीन सं खया एँ वही हैं .	మొదటి మూ డు నం బర లు గరే బి ల దగగర మనకు వచచి న పా యి ంట లు .
तुमहारी कि सम त जो र दार थी .	చాలా అద ృష ట వం తు ర ాలి వి .
कया हम ग री ब हैं ?	మనం పే ద వాళళ మా ?
मैं ग री ब हूँ , पता है ?	నేను పే ద దానని , గురతు ందా ?
कितना ड रा वना है .	చాలా పిచచి త నం .
खेल को व हीं खतम होना था .	నిజ ానికి అది ఆ పే య ాలి .
वहाँ मुझे होना चाहिए था .	అకకడ నేను ఉండ ాల సింది .
भ ले ही वह सा मान उठा कर आपके सिर पर मा रे .	ఆమె మీ తల పె కి ప లే టలు వి సి రి నా సరే .
चलो , लि ली ब ग . मुझसे बात करो .	మాటలాడు , లి ల లీ బ గ . నాతో మాటలాడు .
सं वाद अनु वाद क पर वी न कौ र शो म	ఉ ప శ ీ ర షి కలు అ నువ ది ంచిన ది కర త సమ త
और तुमने मेरी जान बचा ई .	నువవు ననను కా పా డా వు .
वो खि ड किया ँ देख रहे हो ?	ఆ కి టి కీ ల ననీ చూశా వా ?
पर तुमहें कहा निया ँ सुना ने की जरूरत नहीं , है न ?	కానీ నేను నీకు క థ లు చెపప నవ సరం లేదు , కదా ?
मुझे बि श प को ढूँढ ना है .	నేను బి ష ప ను వె త క ాలి .
बस सर टि फि के ट वाली पढ ा ई है .	ఇది సర టి ఫి కే షన పర ో గరా ం మాతరమే .
डॉज से कहा कि जी ता तो उसे स ॉ निक ख री द कर द ूँगी .	డా డజ కి తను గె లి సతే సో నిక కొ ని సతా న ననాను .
