तुम कौन हो ?	ఎవరు నువవు ?
मैं बस यह जान ना चाहता था कि तुम इस बारे में कया सोच ती हो .	సరే , నువవు ఏం అనుకుంటుననా వో తెలుసు కో వాలి అనిపి ంచింది .
लेकिन जिस या तरी ने ऐसा किया , जिस ने इतनी परे शा नी उठा ई ,	కానీ ఆ మె సే జ పం పి న పర యా ణి కు డు , ఆ పరమా దానని ఎదు ర కొ నన వాడు ,
अचछा आ इ ड िया नहीं था , दोसत .	అది మంచి ఆలోచ న కాదు , మి తర మా .
{ \ an8 } या तरी 1 के को अनु रो ध भे जा गया . . .	{ \ an8 } ప యా సి ం జర 1 కె కి అ భయ రథ న పం ప బడి ంది . . .
कोई बात नहीं .	మ రే ం ఫర వాలేదు .
यह एक मै से ज है . विमान कुछ बता ने की कोशिश कर रहा है .	అది ఒక మె సే జ . ఈ విమానం ఏదో చెపప ాలని పరయతని స తో ందని అరథం .
यहाँ दिख जाता है . ई जी एल एल , यही को ड है .	అంటే , అది ఇకకడ ఉంటుంది . ఇ జి ఎ ల ఎ ల , అది కో డ .
उसने विमान के उडा न भर ने के ठीक बाद मेरी गर ल फर ें ड को मै से ज भे जा कि विमान पर कुछ मु सी ब त हो गई है .	ఆ విమానం టే కా ఫ అయి న వెంట నే అతను ఒక మె సే జ చే సతూ విమానం లో ఏదో పరిసథి తి త లె తతి ందని చెపపా డు .
मैं ए टी सी में काम करता हूँ .	నేను ఎ టి సి లో పని చేసతాను .
देखो . इसे देखो , ठीक है ? इन हें यह करने पर म जब ूर मत करो .	చూడు , ఇది గో , ఇపపుడు చేసతా వా ? వాళ లని ఇలా చేయ నివ వ కు .
उनका डर नि रा धा र था . - देखा ?	- త పపుడు హె చచ రిక . - చూడు ?
सुरकष ा ला इस ें स नी ला क ुम ा र	సె క యూ రి టీ లె సె నస నీ లా కు మార
बंद ूक ! बंद ूक को परे कर दो !	ఆ తు పా కి ! తు పా కి ని తన ను !
मैं कह ही दे ती हूँ , हाँ ?	నేను చెపప బో తుననాను , సరేనా ?
हाँ . वह देखो .	అది గో . అకకడ .
यही समय है . पहले मैं जाता हूँ , फिर तुम आ जाना . हाँ ?	ఇదే సమయం . నేను వెళ తాను , నువవు అను సరి ంచు . సరేనా ?
अब बस हम आप से दोबारा पता कर रहे हैं . - पू छो कि कया वे अपनी स करी न शे यर कर सकते हैं .	- ఇపపుడు మేము మీ తో రెండ ో సారి చె క చేసు కుంటుననా ం . - వాళల స క రీ న ని మన కి ష ే ర చేయ గల రే మో అడుగు .
पू रे दिल से पयार करो , डै न , नहीं तो जिंदगी आगे बढ जाती है .	ఆమె విషయం లో సప షట ంగా ఉ ండు , డా న , లేదా పరిసథి తులు మా రి పో వచచు .
आज का दिन मेरे लिए बहुत जरू री है , का ई .	ఈ రోజు నాకు చాలా ముఖ య మెన రోజు , ఖ ా య .
- मार शा . . . - नहीं , सै म ऐसा ही है .	- మార షా . . . - లేదు , సా మ ఇలా గే ఉంటా డు .
के ए 2 9 . कि लो एल फा दो नौ . विमान ने लग भ ग एक घं टा पहले उडा न भ री थी .	కె ఎ 2 9 . కి లో ఆ ల ఫా రెండు తొ మ మి ది . ఒక గంట కింద ట టే కా ఫ అయి ంది .
उनकी आवा ज ऐसी ही होती है .	వాళలు అలాగే మాటలాడ తారు .
वह , मतलब , द ौ ड शुरू करने वाली बंद ूक होती है ना .	అంటే అది , నీకు తెలుసా , ఏదెనా పో టీ ని పరా రం భి ంచే గ న .
हमें इसका जवाब देना होगा .	మీరు దానికి సప ంది ంచాలి .
जिस का मतलब है वह आज सक ूल नहीं गया है ,	అందు వలల ఈ రోజు స కూ లు కు వెళల డం లేదు ,
- सा इ मन ? - तुम पहले ही काफी मु सी ब त में हो .	- సె మన ? - నీకు ఇ పపటి కే సరి ప డా సమసయ లు ఉననాయి .
- कै प टन कॉ क पि ट में नहीं हैं ? - आपने सही सुना .	- కా క పి ట నుండి కె ప టె న బయట కి వెళ లా రా ? - అది నిజం .
मुझे अफ सो स है वह अभी बहुत दूर है .	అ ందుకు ఇంకా చాలా సమయం ఉంది అనుకుంటా .
अगर कुछ भी होता है , तो हम फोन पर बात करेंगे .	పరిసథి తి ఏమెనా మా రి తే , మనం ఫో ను లో మాటలాడు కు ందా ం .
ठीक है . हाँ .	సరే . అలాగే .
इसे पक डो , ए डी ! इसका ग ला घ ों ट दो !	అత డిని పటటు కో , ఎ డీ ! ఊ పి రి ఆడ నివ వ కు !
आप सी धा विमान से सं पर क कर सकते हैं ?	నే రు గా ఆ విమా నా నని సం పర ది ంచ గల వా ?
आगे किसी भी तरह के वि रो ध का परि ण ा म किसी की मौ त हो सकता है .	ఇక ముందు ఎవరెనా పరతి ఘ టి సతే ఫ లి తం పరా ణ ా ంత కంగా ఉంటుంది .
तुम लोगों को यकीन है कि ऐसा मौ सम की वजह से नहीं हो रहा है ?	వా తా వర ణం కారణ ంగా అది దా రి తపప లే దని ఖచచితంగా చెపప గల మా ?
ठीक है , और आज कल पाँच मिनट कि तने ल म बे होते हैं ?	సరే , ఈ రోజు లలో ఐ దు నిమిష ాలు అంటే ఎంత సమయం ?
यह ही थ रो , ई जी एल एल है , 3 2 0 डि ग री के को ण पर .	అది హ ీ త రో , ఇ జి ఎ ల ఎ ల , 3 2 0 డి గర ీ ల బ ే రి ంగ లో ఉంది .
हे . तुमने पायलट से बात की थी . उसने कहा था सब ठीक है .	హేయ , నువవు పె లెట తో మాటలా డా వు . ఏమీ జరగ లే దని అతను చెపపా డు .
तुमहें लगता है हम बेवकूफ हैं . . .	మేము మూ ర ఖ ు ల ం అనుకుంటుననా వా . . .
मेरी गर ल फर ें ड का पू र व - पति दु ब ई से ल ंद न आने वाली एक फ ला इट पर स वार है .	నా గర ల ఫ రెండ మా జీ భ ర త దు బా య నుండి ల ండ న కి విమానం లో బయ లు దే రా డు .
ठीक है . विमान पर कुछ दि क कत हुई थी ?	సరే . విమానం లో ఒక సమసయ ఏ ర పడి ందా ?
हाँ , अब बात करते हुए थोडा अजीब लग रहा है .	అవును , ఇది ఇపపుడు కా సత వి చి తర ంగా అనిపి సతోంది .
वे उससे बात नहीं करेंगे . वे कै प टन से ही बात करेंगे .	వాళలు ఆమె తో మాటలాడ రు . వాళలు కె ప టె న తో మాతరమే మాటలాడ తారు .
- . . . मैं इस सी ट से नहीं उ ठ ने वाला . - जो यह कह ता है , वह करो .	- . . . నేను ఈ సీ టు నుండి లే వ ను . - అతను చెపపి ంది నో రు మూ సు కు ని చేయి .
बस यही है ?	ఇది అంతే నా ?
पायलट से उनकी पहले ही बात हो चु की थी . उनहोंने पु ष टि की कि उनका डर नि रा धा र था .	వాళలు ఇ పపటి కే పె లెట తో మాటలా డా ర ట . అది త పపుడు హె చచ రిక అని ఖ రా రు చేశారు .
वहाँ बैठ ो .	అకకడ కూ రచ ో .
नहीं , यह नहीं हो सकता .	లేదు , అది జరగ ని పని .
- वह कहते कि हम परे शान ना हों . - ऐसा नहीं कह सकते .	- మన లని ఆ ందో ళ న పడ వ దద ని చెపపా డు . - ఆ విషయం నీకు తెలియదు .
मैं इसे पह चा न ता हूँ .	ఆమె ని నేను గుర తి ంచా ను .
तु र किए - सी रि या - इ रा क	టర కీ - సి రి యా - ఇ రా క
आप कौन हैं ?	మీరు ఎవరు ?
गए काम से . - तुमहें एक फोन आता है , तुम दु ब ई को फोन करते हो ,	- ఇది గో వి ను . - సరే , నీకు ఫోన వచచింది , నువవు దు బా య కి ఫోన చేశా వు .
अगर तुमने मुझे कॉ क पि ट में भे जा , तो हा ला त और जयादा	ననను గ నుక కా క పి ట లోప లి కి పం పి తే , పరిసథి తులు ఇ పపటి కంటే
इसे आ खि री चे ता व नी समझ ा जाए . "	ఇది తు ది హె చచ రిక గా భా వి ంచ గల రు . "
पहली सी ट , वहाँ बैठ ो . बस यहाँ .	మొద ట గా , అకకడ కూ రచ ో . సరి గగా అకకడ .
तुमहारा फोन आज तक बंद कब हुआ है ?	నీ ఫోన ఎ పపుడు ఆ ఫ అయి ంది గ నుక ?
पिछ ली टर म में आपने यह कहा था .	కింద టి టె ర మ లో కూడా అదే చెపపా వు .
मैं यहीं हूँ . ठीक है ?	నేను ఉననాను . సరేనా ?
अब सब कुछ ठीक है . उनका डर नि रा धा र था .	ఇపపుడు అంతా స దదు మ ణి గి ంది . త పపుడు హె చచ రిక .
ठीक है . तो , ब ग दा द वा लों को यह दिख रहा है .	సరే . అయితే , బా గ దా ద చూ సతునన ది ఇదే కదా .
मैंने कहा सब कुछ ठीक है . वे बिना वजह डर गए थे .	అంతా బాగానే ఉంది అని చెపపా ను . కేవలం త పపుడు హె చచ రిక .
पलीज ब ग दा द क ंट रो ल को 1 2 3 द श म ल व 5 2 पर क ॉल करें .	దయచేసి బా గ దా ద క ంట రో ల కి 1 2 3 ద శా ం శం 5 2 కి కాల చేయ ండి .
लेकिन . . .	కానీ . . .
और सुनो , हो सकता है इसमें कुछ ना निक ले , लेकिन . . .	ఇంకా వి ను , ఇ ందు లో విషయం ఉండ కపో వచచు , కానీ . . .
मैं समझ ता हूँ . मुझे पता है .	నాకు అది తెలుసు . అది అరథ మెంది .
उसने बस खुद को बचा ने के लिए हम सब को ध ो खा दिया है . यह हो रहा है .	త నని తాను కా పా డు కో వడం కోసం మన ంద రికీ ద రో హం చేశా డు . అదే జరుగు తోంది అకకడ .
इसके रह ते हुए कोई ग ड ब ड नहीं हो सकती .	ఏదెనా సమసయ ఉంటే , ఆమె వెంట నే గుర తి సతుంది .
यहाँ रे डियो में काफी समस या एँ आ रही हैं ,	మాకు రే డి యో తో చాలా సమసయ లు వ సతుననా యి
सब कुछ काफी सा मान य लग रहा है .	ఇ దంతా చాలా మా మూ లు వయ వ హా రం .
यह मेरी बेटी को अपने बचचे की पार टी में ले गई थी .	మా అమమాయి ని తన బి డ డ పార టీ కి తీసుకు వెళలి ంది .
पिछ ले हफ ते , इस ने एक आदमी को खि लौ ने की बंद ूक ला ने से मना कर दिया था .	కింద టి వా రం , ఒక వయకతి సటా ర టర పి సట ల తీసుకు వ సతు ంటే ఆమె ఆ పి ంది .
इसका नाम नी ला है .	నీ లా . అది ఆమె పేరు .
1 के : वे इ रा की फ ौ ज से सं पर क करेंगे .	1 కె : వాళలు ఇ రా కీ సె నయా నని సం పర ది సతారు .
इसका कया मतलब है ?	అది ఎలా జరుగు తుంది ?
दा ल में कुछ का ला है . हाँ .	ఏదో తే డా గా ఉ ందని అరథం . నిజం .
और वह सक ूल से भी आगे काफी दूर है .	అది వాడి స కూ లు క ననా చాలా ద ూర ంగా ఉంది .
तो , कि ंग डम 2 - 9 पर कुछ हुआ है . . .	అయితే , కి ంగ డ మ 2 - 9 కి ఏదో జరిగింది . . .
आने के लिए तैयार होती हो , वह च क कर लगा ता रहे , ठीक है ?	విమా నా నని గ ాలి లో చ కక రలు కొ టట మని చెబు తాను , చెపప నా ?
तुम ऐसा कयों कर रहे हो ? तुम लोग कया चाहते हो ?	ఎందుకు ఇ దంతా చేసతుననా వు ? మీకు ఏం కావాలి ?
मेरा हाथ !	నా చేయి !
वा य ुम ा र ग ली मा 6 0 2 पर कि ंग डम 2 - 9 ,	కి ంగ డ మ 2 - 9 లీ మా 6 0 2 ఎ యి ర వే మీద ఉంది ,
सब कुछ पूरी तरह से सुरकष ित है , शुकरिया ब ग दा द .	అంతా కష ే మ ం ఇంకా బాగు ననా ం , థాంక యూ బా గ దా ద .
त भी देखा जब वे मुझे यहाँ लेकर आ रहे थे . वे बं धे हुए थे .	వాళలు ననను ఇకకడికి పం పి ంచిన పపుడు చూశా ను . వాళ లని క టటే సి ఉ ంచారు .
वह ऐसा कभी नहीं कह ता अगर हा ला त ग ं भी र नहीं होते .	పరిసథి తి చాలా తీ వర మెన ది కా బ టటే అతను అలా చెపపి ఉంటా డు .
तुमने दु ब ई फोन किया तो उनहोंने ठीक - ठीक कया कहा ?	నువవు దు బా య కి ఫోన చేశా వు మరి దు బా య వాళలు ఏం చెపపా రు ?
जानता हूँ . मुझे माफ करना . मुझे एक मदद चाहिए .	నాకు తెలుసు . సా రీ . నాకు ఒక సాయం చేయాలి .
या जब हमने यह फै सला किया था कि हमारे बीच सब खतम हो गया है , तो वह खतम हो गया था .	లేదా మన మధయ బం ధం ము గి సింది అని నువవు ఒ పపు కునన పపుడు , అది ము గి సి పోయింది .
अपनी कु र सी की पे टी खो लो . पे टी खो लो .	నీ సీ ట బె ల ట తీ సే య . బె ల టు తీ సే య .
वह खास बी मार तो नहीं लग रही थी .	ఆమె అంత అ నా రో గ య ంగా ఏమీ కనిపి ంచ లేదు .
{ \ an8 } 1 के : तुमहारी यो जना काम कर गई .	{ \ an8 } 1 కె : నీ ప లా న పని చేసి ంది .
. . . तो मैं उसे उस बं दे की फि कर करने से नहीं रो क ूँगी ,	. . . అపపుడు ఆమె ఆ వయకతి కోసం తన కి కా వల సిన ంత గా ప టటి ంచుకో వచచు ,
यह बहुत जयादा जरू री है .	ఇది ఖచచితంగా జరిగి తీ ర ాలి .
उप - शी र ष क अनु वाद क : पु नी त	తెలు గు అను వాద ం : స తీ శ కు మార
मैं दुनिया की सबसे बु री या त रा पर हूँ , बस और कुछ नहीं .	ఈ పరపంచ ంలో నే అ తి చెతత పర యా ణం చేసతుననా ను , అదే నేను చే సతునన ది .
हाँ , और हो स के तो इस तरह की बात के लिए मुझे दोबारा फोन मत करना , हाँ ?	అవును , ఇంకా బహుశా మళలీ ఇలా ంటి విషయ ాల గురించి నాకు ఇం కె పపుడ ూ ఫోన చేయ కు , సరేనా ?
यह यो जना का हि ससा हो ही नहीं सकता .	అది మీ ప లా న లో భా గం కా కపో వచచు .
सही . विमान के पायलट से बात हुई थी .	నిజం . విమానం వారి తో మాటలా డా ను .
इस ने कया किया है ?	ఆమె ఏం చేసి ంది ?
सब कुछ ले लिया ?	అన నీ తీసు కుననా వా ?
शुरू में सन ै कस . . . सी फ ू ड . . .	సటా ర టర లు . . . అనని ర కాల సీ ఫ ు డ . . .
हो सकता है कोई उससे झूठ बु ल वा रहा हो .	బహుశా ఎవరెనా అతని తో అబ దధ ం చెపపి ంచి ఉండ చచు .
- और उसके लिए लड ना वा जि ब है . . . - वा जि ब है .	- ఆమె కోసం పో రా డ వచచ ంటే . . . - అ ందుకు ఆమె అర హు ర ాలు .
देखो , तुमने हर किसी को अपनी मर जी से बि ठा या है , सि वा य उसके .	చూడు , అందరూ ఎవరు ఎకకడ ఉండ ాలో అకకడ ఉననారు , అతను తపప .
हाँ ? अचछा , अंदर जाओ . जाओ अंदर . अंदर .	సరేనా ? సరే , లోప లి కి వెళ లు . లోప లి కి వెళ లు .
- तुम मेरी बात सुन रही हो ? - हाँ . देखो . . .	- నువవు ఇంకా లెన లోనే ఉననా వా ? - ఉననాను . చూడు . . .
मैं कहीं नहीं जा ऊँगा ! मुझे छोड ो , छोड ो मुझे !	నేను క ద లను ! నా మీద చే తులు తీ య ండి , ద ూర ంగా వెళల ండి !
तो आज सु बह सब कुछ बहुत अचछा नहीं चल रहा है .	కాబటటి ఈ ఉద యం నుంచి మేము చాలా గ ంద రగ ో ళ ంగా నే ఉననా ం .
और ग ंत व यों की सू च ना यहाँ है .	ఇంకా పర ో గరా మ గ మ య ాలు ఇకకడ ఉననాయి .
शुकरिया .	థాంక యూ .
शुकरिया .	థాంక యూ .
हे , सब ठीक हो जाएगा , ठीक है ?	హేయ , అంతా బాగానే ఉంటుంది , సరేనా ?
मेरी बात कै प टन से हो रही है ?	నేను కె ప టె న తో నే మాటలాడు తుననా నా ?
- आप कै प टन हैं ? - जी .	- మీరు కె ప టె నా ? - అవును .
तुमहारे लिए एक लग भ ग आ पा त का ली न फ ला इट आई थी .	నీకు ఒకటి మా తరం దా దా పు గా ఎ మర జె నస ీ పరిసథి తి ఉంది .
उसे यह सोच ने पर म जब ूर किया कि वह खत रे में था जब कि जा ह िर है वह खत रे में नहीं था .	పరమా ద ంలో లేక పోయి నా అన వ సర ంగా త నని ఆ ందో ళ న పడ ే లా చేసిన ందుకు కో ప ంగా ఉంది .
वह तुम लोगों का सर दार , कया नाम है उसका ?	ఆ మనిషి , ఆ ఇ న ఛ ా ర జ , అతని పేరు ఏంటి ?
अगर सब कुछ ठीक हो चुका था , तो दूसरे क ॉलर ने और मै से ज कयों नहीं भे जे ?	ఆ సమసయ పరి ష కా రం అయి పోయి నపపుడు , రెండ ో కాల ర మరి నని మె సే జ లు ఎందుకు పం ప లేక పోయా డు ?
{ \ an8 } पायलट ए ले न , पलीज अपनी जन मत ि थि बता एँ , यह सुरकष ा सवाल है .	{ \ an8 } పె లెట అ లెన , దయచేసి మీ పు టటి న రోజు , సె క యూ రి టీ పర శ నని ఖ రా రు చేయ ండి .
बॉ बस . - ए लिस ?	- బా బ స . - ఆ లి స ?
मैं तुमहें झ ी ं गा म छ ली खिला ऊँगा . ठीक है ?	నీకు ఎ ండ ర కా య ల వ ంట కా నని వి ందు గా ఇ సతాను . సరేనా ?
