उनहोंने मुझे फा इ ल अप डे ट करने को कहा है . यह हमारी सर वो त त म पर ण ा ली सम ीक ष ा का हि ससा है .	బె సట పరా క టీ స రి వయ ూ లో భా గ ంగా ఫె లు ను అ ప డే ట చేయ మని ననను అడి గా రు .
जो हम चा हें गे कि तुम हमें आ म ने - सामने समझ ा ओ .	మీ తో నే రు గా చ ర చి ంచ ాలను కుంటుననా ం .
तुम सोच रही हो कि , भगवान न करें ऐसा हो ,	నువవే ం అనుకుంటుననా వ ంటే , ఒక వే ళ
ए र ॉल मै थि स पर हो रही यह जा ँच ,	ఎ ర ర ొ ల మయా థ ి స పె జరిగి న దర యా ప తు విషయం లో ,
उसने कहा कि वह मुझे मार डा ले गा .	ననను చం పే సతా అ ంటుననా డు .
यह स था नी य इ ति हा स है . वह आदमी स था नी य फै न है .	అది సథా ని కంగా పెదద స ంచ ల న మెన కేసు కదా . అతను దానికి అభి మా ని .
तुमने फोन करने को कहा था . शायद मैं उस ी के साथ ला इन पर हूँ .	మీరు కాల చేయ మ ననా రు కదా . ఆమె ఎవరో తెలి సింది .
- हाँ . सब कैसे हैं ? - ए , ए . वह रहा वे टर .	- హా , హా . అందరూ ఏమ ంటుననా రు బా బు లూ ? - ఓ య . అ దు గో వె యి టర .
मेरे पास ला ख ों हैं .	లకష లలో చూశా ను .
पार कह ि ल ए सट े ट में वह मु सी ब त ?	పార క హి ల ఎ సట ే ట కి సంబం ధి ంచిన కేసు కదా ?
नहीं , जैसा कि मैंने कहा , वह ग ुम नाम क ॉल था .	లేదు , చెపపా కదా , ఆ కాల చేసిన వయకతి తన వి వర ాల ే మీ చెపప లేదు .
मेरे स ह कर मी , डी ए स फ लै हर टी के साथ काम कर रही हो ?	నా స హో ద యో గి డి టె క టి వ సా ర జె ంట ఫ లా హ ర టీ తో కలిసి పని చేసతుననా రు కదా ?
ए ए न पी आर खो ज	నం బర ప లే టల సె రచ
ठीक है . समझ गई .	సరే . అలాగే .
हैलो . क ॉलर ?	హలో . హలో . మే డ మ ?
हमेशा नहीं .	ఎపపుడూ కా ద ను కో .
हाँ , जानता हूँ .	హా , తెలుసు .
तो , चलो भी . तुम यहाँ दरअसल कयों आई हो ?	అసలు విషయం చెపప ండి . మీరు ఇకకడికి అసలు ఎందుకు వచచా రు ?
- ऐसा होता है , है न ? - हाँ ,	- స గం మంది చేసే పని అదే కదా ? - అవును ,
शा बा श . अब सुनो कया करना है .	మంచిది . ఇపపుడు నేను చెపపి న టటు చేయ ండి .
कभी - कभी ?	అ పపుడ పపు డా ?
मैंने र सो ई के द राज से चा कू लिया .	వ ంట గ ది లో ఉండే స ొ రుగు నుండి క తతి తీసు కుననాను .
ती स बार .	ము పప ె సా రలు .
जो बे थ के साथ हुआ , वह आज	బె త కి ఎదు రెన దే , చాలా మంది కి కూడా
उसने कहा , " अगर तुमने मेरे साथ अचछा बर ता व नहीं किया ,	అంటే , " నువవు ననను సరి గగా చూ సుకో కపోతే ,
हम आ रहे हैं .	మా వాళలు వ సతుననారు .
र सो ई में इस ते माल होने वाले सा त - इं च के चा कू को छु पा ना आ सान है .	ఏ డు అ ం గు ళ ాల క తతి ని చాలా సు ల భ ంగా దా చ వచచు కదా .
यहाँ आकर मुझे यह जानकारी देने के लिए धनयवाद .	ఇ కకడి దా కా వచచి ఈ సమా చా రం నాకు తెలి పి న ందుకు చాలా చాలా థ యా ంక స .
अग ली बार , वही करो जो कहा जाए . ई - मे ल भे जो . ठीक है ?	ఈ సారి మీకు చెపపి న పని చెపపి న టటు గా చేయ ండి . ఈ మె యి ల పం ప ండి ముందు . సరేనా ?
- वि भाग ? - सी आई डी .	- ఏ డి పార టు మె ంట ? - సి ఐ డి .
- मैं डी ए स लें कर हूँ . - हाँ , ऊपर आओ .	- నేను డి టె క టి వ సా ర జె ంట లె ం కర ని . - హా , పె కి రండి .
दू सर ों पर हुई हि ं सा के बारे में बता ना जयादा आ सान होता है .	ఇ తరు లు త మని హి ం సి సతుననా రని చెపపే సతు ంటా రు .
तो पकका उसकी जान को खत रा था ?	అయితే ఆమె కి ఖచచితంగా పరా ణ హా ని ఉ ంద ంటా రా ?
मुझे समय देने के लिए धनयवाद .	మా కోసం సమ యానని వె చచి ంచిన ందుకు థ యా ంక యూ .
फिर भी , पकका तुमने कुछ ला श ें तो देख ी हों गी .	అయి నా కానీ , మీ పని లో భా గ ంగా మీరు మ ృ త దే హ ాలను చూ సి ఉంటా రు కదా .
बे चा रा .	పా పం .
मेरे साथ कोई नहीं है .	తో డు ఎవరూ లే రు .
सुनो .	చూడ ండి .
जे ए च जन र ल सट ो रस	జే . హె చ కి రా ణ ా దు కా ణం
और इस क ॉलर ने खास इसी जु र म का जि कर किया ?	ఈ కాల చేసిన వయకతి , నే రం గురించి పూరతి వి వర ాలు అ ంది ంచా రా ?
बेशक .	అంతే గా .
सभी यू नि ट धयान द ें . एक घ रे लू हि ं सा जा री है	అనని పోలీసు బ ృ ంద ాల కూ స ందే శం . ఇపపుడు ఒక గ ృ హ హి ం స జరుగు తోంది ,
तो कुछ मान सि क रूप से बी मार लोग ,	అతనికి కొ ంద రు పి చచ ో ళలు
और दरअसल मैं . . .	నే నె తే ఏం చెప తా న ంటే . . .
पर उसने यह अलग ढ ंग से कहा था .	అతను ఆ మాట లను అనన వి ధా నం నువవు చూ సు ండ ాలి .
तुमहें गाडी का नंबर चाहिए या नहीं ?	బ ండి నం బ రు చెపప నా , వ ద దా ?
म रि या , सुनो कया करना है .	మరి యా , మీరు నేను చెపపి న టటు చేయ ండి .
ठीक है , बढिया है .	సరే , మంచిది .
- तुमहारे पास कल म है ? - नहीं , कोई बात नहीं . मैं याद रख ल ूँगी .	- పె న ఉందా ? - పర వాలేదు లే . నాకు గురతు ంటుంది .
तुमहें यह नहीं पता .	ఊ రి కే అని నువ వె లా చెపప గల వు !
- सा र ज ें ट . डै नि एल है गर टी . - जू न लें कर .	- సా ర జె ంట . నేను డ యా నియ ల హె గర టీ ని . - నేను జ ూ న లె ం కర ని .
और हर सवा भ ि मा नी दल की तरह , उनका भी एक नाम था .	ఏ సవా భి మా న బ ృ ందా ని కె నా పేరు నన టటే , వాళల బ ృ ందా నికి కూడా ఓ పేరు ంది .
मुझसे मिलने के लिए धनयवाद .	నాకు సమయం కే టా యి ంచ గ లి గి న ందుకు థ యా ంక స .
अ सि सट ें ट ची फ क मि शन र कल ॉ डि आ मे ह यू .	అ సి సట ె ంట చ ీ ఫ క మి షన ర , క లా డి యా మే హ యూ మన తో ఉననారు .
- माँ . - या उनहें कया चाहिए .	- అమమా . - వాళల కే ం కావాల ో కూడా తెలీ ట లేదు .
उस लडकी का न न हा बेटा पै ट रिक , ए र ॉल का नहीं .	ఆమె కి పా ట రిక అనే అబబా యి ఉననాడు . ఆ అబబా యి మయా థ ి స కొ డు కు కాదు .
जरूर . रुको . मैं क ॉल जो ड ती हूँ .	తపప కుండా . లెన లో ఉండ ండి . నేను క నె క ట చేసతాను .
अरे , डी ए स लें कर .	డి టె క టి వ సా ర జె ంట లె ం కర .
ग ले और सी ने में ?	గొ ం తు లో , ఇంకా ఛ ా తి లో నా ?
दरअसल , कै ली , यह उस कहा व त जैसा ही है .	కె ల లీ , ఇకకడ విషయం ఏంట ంటే ,
छ ब बी स साल	శి కష , 2 6 ఏ ళలు
सच कहूँ तो , फि ल हा ल , मुझे तो यह श रा रत लग ती है .	నిజం చెపప ాల ంటే , పర సతు తా నికి ఆమె పరా ంక కాల చేసిన టటు గా అనిపి సతోంది .
" ओ . जे की तरह . " मेरा मतलब , इससे कुछ सप ष ट नहीं होता है .	చినన సె జు పి సతా అన డం మ రీ అ తి గానే ఉంది .
पहले , चलो उसे ढूँढ ें , उसे खत रे से बचा एँ .	ముందు ఆమె ఆ చూ కి ని కని పె టటి , ఆమె ని పరమా ద ం నుండి బయట పడ ే దదాం .
है क नी डा उन स का एक ऑ फि सर .	హ యా క నీ డ ౌ నస సట ే ష ను లో ఉండే ఒక ఆ ఫీ సర .
मैंने बस कल रात हे ज ले न के ग ुम नाम क ॉलर के बारे में	ని నన రాతరి హ య ీ స లే న నుండి మీకు ఎవరో ఒక గురతు తెలీ ని వయకతి కాల చేశారు కదా ,
सर , सी ए ंड सी लॉ ग में जो वह क ॉल था . . .	సర , క మా ండ అ ండ క ంట రో ల లా గ కి సంబం ధి ంచిన ఆ కాల విషయం లో . . .
काम कैसा चल रहा है ?	పని ఎలా ఉంది ?
इस सवाल का जवाब देने के लिए मौ जू द हैं ,	ఆ పర శ న కు సమా ధా నం ఇవ వడానికి
तुम सुरकष ित हो ?	మీరు కష ే మ ంగా నే ఉననా రా ?
तो , तुम हमारी मदद करो गी या हमारे काम में बा धा डा लो गी ?	మరి మీరు సా య పడ తా రా , న టటే ట ము ంచు తా రా ?
सुनो , मैं नहीं पूछ ती .	చూడు నేను కూడా అడి గే దానని కాదు .
जो अपना नाम बता ने से इं कार कर रही है .	ఆమె పేరు వె లల డి ంచడం లేదు .
उसने कहा कि वह इतना बेवकूफ है और . . .	ప నికి మ ాలి న వా డ ట , ఇంకా . . .
यह पर ो फ े शन ल सट ै ंड र ड स डि पार ट में ट से डी आई मा रख म हैं .	ఈ మె డి టె క టి వ ఇ నస పె క టర మార క మ , ఈ మె పర ొ ఫె షన లస సటా ండ ర డ స వి భా గ ంలో పని చేసతా రు .
शायद आपको कुछ समय के लिए खि ड की से बाहर झा ँ क ना छोड देना चाहिए .	కొ ంత కాల ం కి టి కీ నుండి బయటకు చూడ టం మా నే య .
बस भी करो , कै ल .	అబబా , కె ల .
- अग ला मो ड . मार स िया वि ल स . - अ ह - ह ँ .	- తర వా తి మ లు పు దగగర మార సి యా వి లలా స ఉండే వాడు . - సరే .
रे जि सट रे शन नंबर ए इ 6 4 ए न जे ड यू	బ ండి నం బ రు A E 6 4 N Z U
चा य के लिए धनयवाद .	టీ తె చచి ఇ చచి న ందుకు థ యా ంక స .
हाँ .	అవును .
कम से कम 2 4 साल की सला ह दी जाती है	క నీ సం 2 4 ఏ ళల శి కష వి ధి ంచ వల సింది గా సి ఫా ర సు చేయ డ మెంది
इस क ॉलर के बॉ य फर ें ड का कहना है कि वह अब भी उसके पास है . वह ह थ िया र .	ఈ కాల చేసిన వయకతి ల వర దగగర అది ఉ ంద ట . ఆ క తతి .
ठीक है . हाँ .	సరే మరి .
धत .	ఛ .
हाँ .	అవును .
हाँ .	అవును .
हाँ .	అవును .
हाँ .	అవును .
हाँ .	అవును .
हाँ .	అవును .
कई लोगों के साथ हो सकता है , है न ?	ఎదు రు అయ యు ండ వచచు , కదా ?
हैलो , पर ो फ े शन ल सट ै ंड र ड स से डी आई मा रख म बोल रही हूँ .	హలో , నేను ఫర ొ ఫె షన ల సటా ండ ర డ స నుండి డి టె క టి వ ఇ నస పె క టర మార క మ ని మాటలాడు తుననా .
मैं आ रही हूँ . समझ गई ?	నేను అ కకడి కే వ సతుననాను . అరథ మె ందా ?
और , वह जवा न है . मह त वा का ं कष ी है .	చినన వయ స సు కదా . ఏదో సా ధి ంచ ాలని క సి గా ఉనన టటు ంది .
ई - मे ल . दो सता ना , आ धि का रिक .	సనే హ పూర వ కంగా , అ ధి కా రిక ంగా ఈ మె యి ల పం పు .
- धनयवाद . - जरूर .	- థ యా ంక స . - మ రే ం పర వాలేదు .
जैसे ही वह अंदर आए , वह चा बि या ँ लो ,	అతను అలా వచచి న మ రు కష ణం , మీరు ఆ తా ళ ంచ ె వు లను పటటు కొ ని ,
- बेशक लगा लिया . - पह ला ऑ फि सर डी सी आई है गर टी था .	- నువవు చూ సే ఉంటా వు లే . - వి చా రణ చేసి ంది , డి టె క టి వ చ ీ ఫ ఇ నస పె క టర , హె గర టీ .
तो बस . . . तुमने एक टो करी में पर चे डा ले और मेरे नाम का पर चा निकल आया ?	అంటే . . . మీరు ర యా ండ మ గా నా పేరు ఎ ంచు కుననా రా ?
कब ूल कयों किया ?	ఎందుకు ఒ పపు కుననా డ ంటా రా ?
कया तुमहें लॉ ग - इन करने में समस या हो रही है ?	నువవు లా గి న అవ వ గ లు గు తుననా వా ?
खुद को सुरकष ित रख ना .	నువవు జా గర తత .
हाँ , और बात ची त नहीं .	అవును , నిజ మే .
पता नहीं तुम इससे अ व गत हो या नहीं ,	మీకు తెలు సో లే దో కానీ ,
यह मत लि खो .	పే రలు రా సుకో వదదు .
- हाँ . - एक से पाँच के स के ल पर ?	- హా . - ఒకటి నుండి అయి దు దా కా ఎంత రే టి ంగ ఇ సతారు ?
कोई आ रो प नहीं लगा . उनहोंने उसे छोड दिया होगा .	కేసు వే య లేదు . వదిలే సి ఉంటా రు .
- मेरा स ह कर मी , डी सी जै कस न . - हैलो .	- ఇ తను నా స హో ద యో గి , డి టె క టి వ కా ని సట ే బు ల జా కస న . - హాయ .
हाँ , हमने उनहें पक ड लिया .	మేము పటటు కుననా ం .
ती स बार , यह . . .	ము పప ె సా రలు అంటే , అది . . .
अ ंत में , पड ो सी , समझ े .	చి వ రికి ప కకి ంటి వాళ లే కను గొ ననా రు .
धत तेरी की .	దేవుడా .
बद मा श . पै ट रिक !	ఓ రి నీ వే ష ాలో . పా ట రిక !
सं दि ग ध हम ला वर नौ व ें मा ले में फ लै ट 9 4 2 में है .	దా డి చేసిన వయకతి , తొ మ మి ద వ అంత సథ ు లో 9 4 2 నం బర ఫ లా టు లో ఉననా డని భా వి సతుననా .
कया टी ए ंड सी मी ट में उसका जि कर हुआ ?	వి వి ధ వి భా గ ాల మధయ జ రి గే స మన వయ సమా వే శం లో అది చ రచ కు రాల ే దా ?
तो , यह क ॉलर ,	ఈ కాల చేసిన వయకతి కి
समझ ी ? भा गो और ची खो . मदद के लिए ची खो .	సరేనా ? ప రుగు తతు తూ అర వ ండి . కా పా డ ండి , కా పా డ ండి అ ంట ూ అర వ ండి .
ए ं डी , यू नि ट कहाँ है ?	ఆ ండ ీ , మన వాళలు ఎ కకడి దా కా వెళ లా రు ?
उसने दा वा किया .	తను ప క కా గా చెప తో ంద నన మాట .
कया हुआ ?	ఏంటి ?
सो नया सि ं ह . मेरे ऑ फि स में सवागत है .	నా పేరు సో ని యా సి ంగ . చి ంద ర వ ంద ర గా ఉండే నా ఆ ఫీ సు కు సవా గ తం .
- मु द रा , हाँ . - हाँ ?	- సరి గగా ని ల బడ ాలి , సరేనా ? - సరే .
उससे खत ों के मा ध य म से दो स ती करने चाहते हैं , उससे शादी करने की या पैसे देने की पे शक श करते हैं .	పె న ఫ రెండ స అయ యా రు , పె ళ లి చేసు కుంటా మ ననా రు , డబబు ఇ సతా మ ననా రు .
- ठीक है . - हतया का माम ला था .	- సరే . - హ తయ కేసు .
मैं नाम नहीं बता ऊँ गी .	పేరు అడ గ క ండి .
नहीं . यहाँ कुछ नहीं है . माफ कर दो .	అదే ం లేదు ఇకకడ . సా రీ .
मैं यहाँ पूरी तरह से अके ली हूँ .	ఒకక దా న నే ఉననా ఇకకడ .
यह काम का हि ससा ही है .	నేను చేసే ఉద యో గ ంలో అవ ననీ మా మూ లే మరి .
हम अब भी ढूँढ रहे हैं .	లేదు , ఇంకా తెలుసు కొ నే పని లోనే ఉననా ం .
नाम . कृपया .	పేరు కూడా చెపప ాలి .
तुमने उनहें पक डा ?	క నీ సం ఆ దొ ంగ లని పటటు కుననా రా ?
हैलो . डी ए स लें कर .	హలో . డి టె క టి వ సా ర జె ంట లె ం కర .
- नहीं . - पर क ॉलर ने	- లేదు . - కానీ ఆ కాల చేసిన వయకతి ,
अ श वे त आदमी , श वे त गर ल फर ें ड .	అంటే , అతను న లల వాడు , అతని ల వర తె లల మ మా యి కదా .
कृपया , मुझे अपने बॉ य फर ें ड का नाम बताओ .	దయచేసి మీ ల వర పే రే ంట ో చెపప గ లి గి తే , అది మాకు చాలా ఉ ప యో గ పడు తుంది .
वे लग भ ग उसकी खो प डी का आ कार मा प रहे थे .	వాళలు కూడా అతని మా న సి క సథి తి ని అ ంచ నా వే సే పని లోనే ము ని గి పోయా రు .
यह जवा न लोगों का खेल है .	డి టె క టి వ పద వి యు వ కు ల కే సూ ట అవు తు ంద ంటా రు .
अरे , क लो ई .	క లో యి .
आओ .	రండి .
कमी ना .	చెతత వెధవ .
तुम सी आई डी में कब से हो ?	సి ఐ డి లో మీరు ఎ పపటి నుంచి పని చేసతుననా రు ?
तुमहारा कया है ?	మరి మీ ది ?
वह छ ह साल का बच चा था .	అతనికి అపపుడు ఆ రే ళలు , చినన పి లలో డు .
पर , कभी - कभी ड रे हुए या अस हा य होने पर ,	కానీ మన కి ఎపపుడ ెనా భ యం అనిపి ంచి నా , లేదా ని స స హాయ ంగా అనిపి ంచి నా ,
तो अ चा न क ए र ॉल बन गया , " अ श वे त आदमी , गु स सै ल , मदद करो . "	ఇక హ ఠ ా తతు గా ఎ ర ర ొ ల " న లల వాడిని కను క ఆ వే శం లో చేశా నని అ ంటుననా రు , సా య పడ ండి , " అన డం మొద లె టట ా డు .
उसने कहा . . .	అతను ఏమ ంటుననా డ ంటే . . .
जिस से वह बाद में मु कर गया .	కానీ ఒ పపు కునన దానని మళలీ ఉ ప సం హ రి ంచు కుననా డు గా .
पहुँच अस व ीक ृ त	యా క సె స తి రస కరి ంచ బడి ంది
पहुँच अस व ीक ृ त	యా క సె స తి రస కరి ంచ బడి ంది
