बरा ंड नहीं किया तो मैं आपका आ धि का रिक सा थी नहीं हूँ .	కానీ నాకు ము దర వే సే వర కూ నేను అ ధి కా రిక ంగా మీ సి పా యి అవ వ ను .
लोग यही कहते हैं .	పర జ లు అదే చెబు తారు .
हमारे बिना हो भी चुका है .	మేము లే కుండా నే అది జరిగింది .
मुझे यहाँ मत छोड ो .	నన ని లా వదిలే య కు .
कोई मेरी फ यू जन को र ले गया . पलीज .	ఎవరో నా ఫ యూ జ న కోర కొ టటే శా రు . దయచేసి .
कहना कया चाहती हो ?	ఏం సూ చి సతుననా వు ?
सही कहा .	అది నిజం .
यह इं टर वॉल ट ले न - दे न का रिक ॉर ड है	ఈ కి ంది ది వాల టల మధయ మార పి డి ల రి కార డు
यह दुनिया बु री है .	నా కి కకడ న చచ లేదు .
जयादा सं सा धन हैं , बेहतर शि कष ा है और वह कहा व त भी तो है .	మె రు గె న వి ద యా వయ వ సథ , ఇంకా , ఓ పర ముఖ మాట తెలుసు గా .
हम कि सम त वाले हैं .	మనం అద ృష ట వం తు ల ం .
ए च - अनु सं धा न ए व ं वि का स ह ॉ थ ॉर न मे डि कल पर यो ग शा ला	హె చ - పరి శ ో ధన మరియు అభి వ ృ దధ ి హా థ ో ర న మె డి కల ల యా బ రే ట రీ స
पता है , मैं भी चु ना व ल डा था एक बार .	నాకు తెలుసు , ఓ సారి పో టీ చేశా ను .
मेरे जैसे आ म लोग रह ते हैं .	నా లాంటి సా ధా రణ మను ష ు లే .
और साथ में काम कर सक ें .	ఇంకా కలిసి పు న ర నిర మి దదాం .
वह वा कई खास था .	అది చాలా పర త యే కం .
मुझ पर कर सकते हो .	కానీ ననను నమ ము .
यु द ध के बाद यहाँ 3 4 , 00 0 लोग रह ते थे ?	యు దధ ం తరువాత ఇకకడ 3 4 , 00 0 మంది నివ సి ంచా రా ?
सच में ? बहुत दर द होगा .	క చచి త మా ? న ొ పప ి గా ఉంటుంది .
मुझे निका लो , फिर ले लेना .	ననను తీ సతే తీసుకో వచచు .
पू रे दस पो सटर लगा ए थे .	ప ది పో సట రలు పె టటి ఉంటా ను .
वॉल ट 3 1 , 3 2 और 3 3 में .	ఈ వాల ట 3 1 , 3 2 ఇంకా 3 3 లలో .
तो , मतलब , प ृ थ वी गो ल है , च प टी है . . .	ఇక , అంటే , భ ూ మి గు ండ రం , భ ూ మి బ లల ప రు పు . . .
यह टी - 6 0 है न ?	టీ - 6 0 , అంతే కదా ?
यहाँ वो ट करें !	ఇకకడ ఓ టు వే య ండి !
उससे भी बडी बात , स भ य ता का भ वि ष य भी .	ఇక , మ రీ ముఖ య ంగా , మా న వాళ ి కి భ విష యత తు అని .
पर मैं ऐसी जगह से आई हूँ जहाँ अपनी दुनिया खुद बना ते हैं .	కానీ ఎవరి నె నా ఒ పప ి ంచ గ లి గే చో టు నుండి నేను వచచా ను .
तब तो सच होगा .	అయితే నిజ మే నే మో .
फिर ह क के दिन का कया ?	పు న రు దధ రణ ది నం సంగ తే ంటి ?
यह . . .	అది . . .
वही जो हमेशा होता है .	ఎపపుడూ జ రి గే దే జరిగింది .
मैंने वॉल ट 3 1 की ओ वर सि यर से बात की और हमारी एक रा य ब नी .	ఇపపుడు , వాల ట 3 1 పర య వే కష కు ని తో నేను మాటలా డా క , మేము అ ంగ ీ కరి ంచా ము .
जो लोगों की अ द ला - बद ली का है	వయ క తు ల పం పి ణ ీ కోసం అమ లు చేసిన ది
अब मैं आपका सा थी हूँ . आप जो चा हें बता एँ .	ఇపపుడు అ ధి కా రిక ంగా మీ సి పా యి ని . ఏదెనా చెపప ండి .
शे डी सै ंड स में सवागत है	ష ే డీ శా ండ స కు సవా గ తం
और न ई शु रु आत करेंगे .	కొతత జీవితం ఆ రం భి సతారు .
पर नहीं मा रा .	నువ వ లా చేయ లేదు .
- और अ नि श चि त ता . . . - सच , कोई बात नहीं .	- ఇంకా అని శ చి తి అంత టి తో . . . - నిజంగా పర లేదు .
यह कै सी जगह है ?	ఈ చో టు ఏమి టి ?
तुम पाँच - छ ह यो द धा ओं को मेरे पिता को बचा ने मेरे साथ भे जो गे .	మా నా ననను కా పా డే ందుకు మీ సె ని కు లలో ఐ దారు గురి సే వ లను నాకు అ ంది సతా వు .
- उनहें पि प - बॉ य चाहिए . - उनके पास था .	- పి ప బా య కావాలి . - వాళ లకు ఉంది .
मुझे भरो सा करना तो है ,	నినను నమమ ాల నే ఉంది ,
पर हमारा जज बा नहीं .	కానీ మన స ఫ ూర తి ని కాదు .
तुम यह इसी लिए पूछ रहे हो .	ఎందుకు అని నువవు అడి గే ది ఇదే .
ओ वर सि यर के रूप में मेरा पह ला आ देश है कि सारे वॉल ट की मी टि ंग होगी	పర య వే కష కు ని గా నా మొదటి శా స నం లో , రే పు ఉద యం 1 0 : 00 గంట లకు
शायद मुझे तुमहें कुछ बता देना चाहिए .	బహుశా నీకు చెపపి తీ రాల సిన విషయం ఒకటి ఉంది .
दरअसल , बात यह है . . .	నిజ ానికి , అది . . .
कया कर दिया ?	నువవే ం చేశా వు ?
तो उन में कया होगा ?	మరి వాటి లో ఏ ము ననా య ని ?
ठीक है .	అడుగు .
मुझे समझ आया कि उनकी वजह से सब सच लगता था .	అద ంతా నిజంగా అనిపి ంచే లా చేసిన ది ఆ మే నని గర హి ంచా ను .
हम आगे जा रहे हैं .	మేము అ టు దా ట ాలి అంతే .
तैयार ?	సిదధ మా ?
हमारे वॉल ट इतने प वि तर हैं कि इन हें खा ली नहीं रख ना चाहिए .	మన వాల ట లను ఖ ా ళ ీ గా ఉ ంచ కూడదు , అవి చాలా ప వి తర మెన వి .
अन य लोग अग ले कुछ हफ त ों में वॉल ट 3 2 में रह ने आ एँगे	ఇ తరు లు రా బో యే కొనని వా రాల లో వాల ట 3 2 కు మా రి
हम कहाँ हैं ?	మనం ఎ కక డు ననా ం ?
सा व धा नी बर त रहे हैं . तुम आ सकते हो .	సరే , మేము జా గర తత గా ఉననా మ ంత ే . మీరు రా వచచు .
मैंने कहा था . दर द होगा .	చెపపా ను గా . న ొ పప ి గా ఉంటుంది .
थे डि य स , तुमहें मार डाल ूँगा .	నినను చం పు తాను , థా డి య స .
तरी का सब का अलग होता है .	ఎలా అనే విషయం లో ఏ కీ భ వి ంచ రు .
हम लौट नहीं सकते ?	మనం ఇంటికి పో వచచు గా ?
मुझे बस इतना पता है कि हम बस जा रहे हैं .	నాకు తెలి సి ంద లలా మనం వెళలి పో వాల నే .
सुनो , मेरे पास टर ै कर है जो उस सिर तक ले जाएगा .	వి ను , ఆ తల దగగర కు తీసు కె ళ లే ట రా కర ఉంది .
मैं बचा था .	నేను బ తి కా ను .
मैं बे ट टी हूँ , ओ वर सि यर के लिए आपका वो ट चाहती हूँ .	నేను బె టీ ని , పర య వే కష కు ర ాలి గా ఇ వాళ మీ ఓ టు కోసం కో రు తుననాను .
घ ो ष ित करते हुए खुशी होती है कि 9 8 परति श त बह ुम त के साथ . . .	ఇది పర క టి ంచడం నాకు గ ౌ ర వం , 9 8 శా తం మె జా రి టీ తో . . .
हम में से कुछ लोग 3 3 को फिर से बना एँगे ,	మన లో కొ ంద రు 3 3 పు న రని ర మా ణం కోసం ఇకకడ ే ఉంటా రు ,
अरे , तुमहें वि कि रण की बी मा री है .	హే , నీ ది రే డి యే షన అ నా రో గ యం .
ए वा वे सट ओ वर सि यर - 3 1 से 3 3	ఏ వా 3 1 నుండి 3 3 - గె లి చి న ఓ వర సీ ర
" जब हा ला त ख रा ब हों , तब वॉल ट 3 1 के उममीद वार को जि ता ओ . "	" పరిసథి తులు మ ంద కొ డి గా ఉంటే , వాల ట 3 1 నుంచి ఎవరి కె నా ఓ టు వే య ండి . "
मतलब , अस ली , " प ं गा मत लेना " टा इ प की बंद ूक ें .	అంటే , నిజంగా , " భ ీ కర ంగా న ష టం కలి గి ంచే " ర కం తు పా కులు .
ब म गिर ने के बाद .	బా ం బు లు పడి న తరవాత .
अ भ िया न बढिया था .	మంచి పర చా రం చేశా వు .
चल ते रहना चाहिए .	మనం ము ందుకు సా గ ాలి .
हमें याद रख ना होगा कि यहाँ बहुत सु वि धा एँ हैं	మనం ఇకకడ ఎంత బాగు ననా మో గురతు ంచుకో వాలి
समझ े ? यहाँ जैसे नहीं .	సరేనా ? ఇ కకడి మా ది రి కాదు .
टा इट स यह बस ख र ों च नहीं है .	టె ట స , ఇది గ ీ రు కో వడం కంటే ఎకకువ .
मैं तुमहें मार डाल ूँगा ! क सम से मार डाल ूँगा !	నినను చం పే సతా ! ఒ టటు , నినను చం పు తాను !
हैं क म ॅ क ली न की कु र सी पर बैठ ना सम मान की बात है .	హా ంక మె క లీ న అడుగు జా డ లలో కి అడుగు పెటట డం నాకు ఎ ంతో గ ౌ ర వం .
तुम भ वि ष य बदल सकती हो अगर तुम मुझे मो ल डे वर तक पहुँ चा दो .	నువవు ననను మో ల డే వర దగగర కు తీసుకు ని వెళల గ లి గి తే భ విష యత తు ను మా రచ గల వు .
आज आप जि से चु न ेंगे , उससे इस मि शन की ओर एक क दम और बढ ा या जाएगा .	ఈ రోజు మీరు ఎవరి ని ఎ ంచు కుంటా రు అనే ది ఆ మి ష నను సా ధి ంచ డానికి ఒక ముఖ య మెన ద శ .
न ॉर म , तुमहें कुछ कहना है ?	నువవు ఇం కే మెనా చెబు తా వా , నో ర మ ?
नहीं , यहाँ आओ . पलीज !	లేదు , వెన కకు రా ! దయచేసి !
फ ॉल आ उ ट	ఫ ాల ౌ ట
काम या ब होना .	నీ అద ృష టం .
मजाक चल रहा है ?	ఎవరి తో నా పరా చి కం ?
गरे ग री या फ े 3 1 से 3 3 - च य नि त ओ वर सि यर	జా ర జ యా ఫ ే 3 1 నుండి 3 3 - ఓ వర సీ ర
यहाँ हमारे और उनके सि वा कोई नहीं है .	మనం , వాళలు తపప ఇకకడ ఎవరూ లే రు .
है न ?	అవునా ?
बे ट टी ?	బె టీ ?
मेरी मदद के बद ले में फिर	నా సహా యా నికి బ దు లు గా , అపపుడు ,
{ \ an8 } जी ता - जा ग ता लो कत ं तर	{ \ an8 } పర జా సవా మ యం పని చే సతోంది
एक चीज और देख नी है .	నేను మర ొక విషయం చూడ ాలి .
अपने ह क ले ने का दिन है .	పు న రు దధ రణ ది నో త స వం .
बेवकूफ कमी ने , सब तुमहारी गलती है .	చెతత వెధవ , ఇ దంతా నీ తపప ే నని నీకు తెలుసు .
सिरफ मेरा सिर .	కేవలం నా తల వర కే .
हम साथ चल ेंगे .	కలిసి పర యా ణి దదాం .
यह एक वॉल ट है .	మనం వాల ట లో ఉననా ం .
हाँ . मतलब , आप जो चा हें .	అవును . అంటే , మీరు ఏద ంటే అది .
तो तुम बे हो श हो जाओ गी , समझ ी ?	నువవు పడి పో తా వు , సరేనా ?
अरे , यार !	అయ యో , బా బ ూ !
कि हमारे खे त में जो बडी रो श नी है वही सू र ज है .	నా పొ ల ంలో ఉండే పెదద లెట నే స ూర యు డని నిజంగా అను కునే దానని .
रे ज , अग ली बार सही .	తరువాత నీ అద ృష టం , రె జ .
मेरे वॉल ट का उ द देश य ही था कि किसी दिन सत ह पर आ एँगे और . . .	మా వాల ట మొతత ం ఉదదేశం ఏదో ఒక రోజు న ఇకకడ ఉ పరి త లా నికి వచచి , నా గ రిక తను . . .
पता नहीं वॉल ट 3 2 के लोग कया कर रहे थे .	వాల ట 3 2 పర జ లు ఏం చేసే వాళ లో మరి .
शायद तुमहें भी वही चाहिए , है न ?	నువవు వె తు కు తునన ది కూడా అదే అనుకో వచచా ?
ब धा ई हो , ओ वर सि यर .	అభి న ంద నలు , పర య వే కష కా .
वैसे , बुरा मत मान ना , बात कुछ ब नी नहीं .	సరే , నీ కి ది మె రు గగా ఉ ంటు ంద ంటే , అది పని చేయ లేదు .
मेरे बा ँ ह की जे ब में र ै ड अ वे है .	నా చే తి అర లో రా డ ఎ వే ఉంది .
हमने कहा ह थ िया र नहीं हैं .	మా దగగర ఆ యు ధ ాలు లే వని చెపపే శా ం .
तुमहारे पिता को पा ने का यही तरी का है .	మీ నా ననను తిరిగి తె చచు కునే ందుకు ఇ దొ కక టే మా రగ ం .
ओह , यार !	అ రె , బా బ ూ !
हि लो मत .	క దల డం ఆ పు .
मेरे भी .	నాకు కూడా .
तुम . . .	నువవు . . .
अगर तुमहें यह दवा नहीं मिली ,	వి ను , ఈ మ ందు వే సుకో కపోతే పడి పో తా వు ,
खैर , अब यहाँ से जाओ .	సరే , మీ పని కొ న సా గి ంచండి .
रुको .	ఆగు .
- हाँ . - बंद ूक ें भी ?	- ఉననాయి . - మరి తు పా కులు ?
सही .	నిజం .
सुनो .	సరే .
तीन .	మూ డు .
कया ?	ఏంటి ?
सुनो .	హేయ .
पता नहीं कोई बचा या नहीं .	ఎవరెనా బ తి కా రో లే దో .
सुनो .	హేయ .
रुको .	ఆగు .
लूसी !	లూ సీ
उसके साथ द फ ना या .	ఆమె తో కలి పి పా తే శా ం .
उ द देश य , डर , वि चार , प छ ता वा , पयार व ग ै रह की बातें .	లకష య ాలు , అ భ దర తలు , ఆలోచ నలు , ప శ చా త తా ప ాలు , పరే మ లాంటి విషయ ాలు .
शायद आ लू का चो खा जयादा अचछा है .	బంగా ళ దు ం ప ల గు జ జు ఇం కొంచెం బాగు ంటే ందే మో .
तो कयों न हम ग ह री सा ँ स लें ?	అయితే , మనం దీ ర ఘ శ వా స తీసుకో వచచు గా ?
और फिर की ड ों वाला अ का ल प डा .	అ పపుడే ఆ ను లి పు రుగు క రు వు వచచింది .
पलीज , नहीं ! मुझे यहाँ मत छोड ो .	దయచేసి , దయచేసి వదదు ! నన ని కకడ వదిలే య కు .
तुम चल नहीं पा रहे ?	ఎందుకు క దల లేవు ?
हाँ , है तो सही .	అవును , మనకు ఉననాయి .
वॉल ट 3 2 के भ वि ष य को लेकर , कल सु बह 1 0 : 00 ब जे .	వాల ట 3 2 భ విష యత తు గురించి వాల ట వి సత ృ త సమా వే శం నిర వ హి సతాను .
और तुमने सोचा कि बस किसी क बी ले के सर दार से मि लो	అలాగే , ఎలా ంటి క వ చం ఇంకా సహా యం లే కుండా
मुझसे दूर रहो !	ననను వ దు లు !
हमें लौट ने से पहले कहानी पक की करनी होगी .	మనం వె ను కకు వెళ లే ము ందే మన క థ లను సరి గగా వి వరి ంచ గల ం .
- धनयवाद , यो द धा टा इट स . - हाँ .	- ధనయవాదాలు , టె ట స సె ని కా . - సరే , సరే .
वह . . .	అతను . . .
द रि ं दे .	రా కష సు లు .
माफ करना , रे ज .	ననను కషమించు , రె జ .
पता है ,	తెలుసు గా ,
और मुझे लगता था ध ू प ऐसी ही होती है .	ఎ ండ తో నా చ ర మ ం మా డి పో వడం నాకు నిజంగా తెలి సే ది .
ठीक है .	పర వాలేదు .
बंद ूक दो .	తు పా కీ .
यार , पता नहीं .	అ దీ , నాకు తెలియదు .
ऐसे तो हम शा म तक उसे पक ड ल ेंगे .	ఈ రే టు పర కా రం , సా య ంత రా నికి పటటు బడి పో తా ం .
तीन लो कत ं तर और तीन वॉल ट .	మూ డు పర జా సవా మ య ాలు , మూ డు వాల టలు .
दुनिया की सबसे अचछी जगह .	పరపంచ ంలో ఉ తత మ చో టు లో మనం ఉననా ం .
त ू तो गया काम से .	దీ నికి నినను చం పు తారు .
डै ड ने कया बताया ?	మీ నానన నీ కే ం చెపపా రు ?
मुझे लगता है सभी तना व में हैं .	మనం అంద రం కొంచెం కంగా రు పడు తుననా మ ంటా ను .
कुछ दिल च सप बात दिख ी ?	ఏదెనా ఆ స కతి గా అనిపి ంచి ందా ?
तुमहारा बच प न ज मी न के नीचे बक से में बी ता है .	భ ూ గర భ ంలో పెటట ె లో పె రిగి న ది నువవు .
खत रा है . मुझे बंद ूक दो .	సు ర కషి తం కాదు . నీ తు పా కీ ఇవ వు .
सभी को दुनिया बचा नी होती है . बस . . .	అందరూ పరపంచ ం కా పా డ ాలను కుంటా రు . వాళలు కేవలం . . .
वह तो बस . . .	విషయం ఏంట ంటే . . .
आज कल तुम लोग कया सोच ते हो ?	మీరు ఈ రోజు లలో దాని పె ఏ మను కుంటా రు ?
- हाँ . - हाँ .	- అవును . - అవును .
जैसे फर सट एड .	పర థ మ చి కి త స లా గా .
सब तरह से देखो तो वॉल ट 3 1 में	అనని వి ధ ాలు గా , వాల ట 3 1 కి వ న రు లు ఎకకువ ,
- धनयवाद . - धनयवाद .	- ధనయవాదాలు . - ధనయవాదాలు .
- रात हो चु की है . - अरे , यार !	- ఆ ల సయ మెంది . - చేయ ండి !
और सट े फ भी वॉल ट 3 1 की है .	చెపప ాలని కాదు , సట ె ఫ కూడా వాల ట 3 1 .
ताकि वह तक नी क किसी और के पास न हो ?	సా ం కే తి క తను వె తి కి , సే కరి ంచి , దానిని వా డ తా రా ?
भरो सा करो , मैं ऐसा करना चाहती हूँ , पर	నా మాట నమ ము , నిజంగా నినను నమమ ాలని ఉంది , కానీ . . .
मेरी माँ का .	మా అమమ ది .
म ं जू र है ?	నీకు ఆ మో ద మా ?
यो द धा टा इट स .	నేను సె నిక టె ట స .
चलो .	రా .
धत त .	ఛ త .
पता नहीं . पर बात तो सच है .	ఎందు కో నాకు తెలియదు . అలా చేసతా ర ంత ే .
" बु रे हा ला त में 3 1 को वो ट दो . "	" పరిసథి తులు బా గో నపపుడు , 3 1 కి ఓ టు వే య ండి . "
कया कर रहे हो ?	అకకడ ఏం జరుగు తోంది ?
कया हो रहा है ?	ఇకకడ ఏం జరుగు తోంది ?
ऐसा मत . . .	లేదు , వదదు . . .
मार ही देना था .	చం పాల సింది .
