- चीज ों को वय क ति गत रूप से ले ती है . - विश वास नहीं होता .	- ఏదో లకష యం కోసం పని చేయడం లాంటి సో ది అనన మాట . - అ యయ బా బో య .
है थ र वे , ट वि न टा वर स .	హా తర వే , ట విన ట వర స .
फिर भी . पकका इसके पास कुछ दिल च सप कहा निया ँ हों गी , है न ?	అయి నా కానీ , మీరు మంచి మంచి కేసు లలో నే పని చేసు ంటా రు .
एक म हिला को ही माम ला संभाल ना होगा .	ఆడ వాళ లె తే బాగు ంటు ందని నీకు చెప తుననా .
कै दि यों की सू ची : ए च ए म पी वा इट कर ॉ स जेल	ఖ ె దీ ల జా బి తా : పర భు త వ వె ట క రా స జె లు
- कया वह पक डा गया ? - नहीं , अभी नहीं .	- వాడిని పటటు కుననా మా ? - ఇంకా లేదు .
क ॉलर ने दा वा किया कि किसी गलत इंसान को स जा मिली थी .	ఆ కాల చేసిన వయకతి , నిర దో షి కి శి కష పడి ందని ఆ రో పి ంచింది .
- मैं कया मदद कर सकती हूँ ? - पुलिस ?	- చెపప ండి , ఏం కావాలి ? - పోలీ సే నా ?
ए र ॉल मै थि स मेरा आ शा ही न उ द देश य है .	అలాగే నా లకష యం ఎ ర ర ొ ల మయా థ ి స అనన మాట .
टा ई और जै के ट . ये कया पह न कर आए हो ?	టె , జా కె ట వే సు కొ ని వచచా వే ంటి నా య నా ?
- तु र ंत मदद का अनु रो ध कर रही हूँ . ओ वर . - ठीक है , जी रो य ै ं की डे ल टा .	- అత య వ సర సాయం కావాలి . అంతే . - జీ రో యా ం కీ డె ల టా మీ స ందే శా నని అ ందుకు ంది .
मेरे स ह यो गी बरा यन फ लै हर टी के द सता वे ज पहुँ चा ने आई थी .	నా స హో ద యో గి బర యన ఫ లా హ ర టీ కి కొనని ప తర ాలు తె చచి ంది .
और उस गलत इंसान को स जा होने का कया , जिस म हिला की उसने हतया की थी ?	మరి , ఆమె ల వర చం పి న నే రా నికి శి కష పడు తునన నిర దో షి సంగ తే మెనా తెలి సి ందా ?
ए र ॉल मै थि स हतया रा	ఎ ర ర ొ ల మయా థ ి స హ తయ
वह बस तुमहें जन म दिन की शु भ काम ना एँ देना चाहता है .	నీకు పు టటి న జు శు భా కా ం కష లు చెపప ాలను కుంటుననా డు , అంతే ,
रुको , ए र ॉल , बे टे .	కా సత ఆగు , ఎ ర ర ొ ల .
कोई खबर नहीं है .	పెదద గా ఏం లేదు లే .
- समय बर बाद करने वाली है ? - शायद .	- ఊ రి కే చేసి ఉ ంటు ందా ? - కా వచచు .
- डा ये न , कया तुम . . . - ठीक है .	- డ యే న , నువవు చెప తా వా . . . - సరే .
हाँ , एक भ ग ौ डा मिला है . मतलब , भ ग ौ डे जैसा ही है .	హా , భలే ప రు గె తతు తుననా డు . సూ పర గా ప రు గె తతు తుననా డు .
म रि या , तुम समझ रही हो ? क हो . क हो कि तुम समझ गई !	మరి యా , మీకు అరథ మె ందా ? చెపప ండి . అరథ మె ందని చెపప ండి .
मैं बस . . . मैं बह स नहीं कर ूँगा .	అయితే . . . నువవు ఏద ంటే అదే ఇక .
तो , मे सट रो . . .	మరి మా సటా రూ . . .
हमारे पास अभी कोई नाम नहीं है , पर मैं यहाँ इसलिए आई हूँ . . .	ఇంకా అతని పే రే ంట ో తెలీదు , కానీ నేను ఇకకడికి ఎందుకు వచచా న ంటే . . .
उसके ती खे हि स से को सी धे उसके चे ह रे में घ ों पो .	వాటి కి ఉండే ప దు నె న అ ంచు ను అతని ముఖ ంలో కి గు చచ ాలి .
सच में ? पता नहीं . मुझे लगा कि शायद मैंने उस पर जयादा जो र डा ला .	నిజంగా నా ? ఏ మో మరి . మ రీ ఎకకువ బ లవ ంత పెటట ే శా నే మో అనిపి ంచింది .
तुमहें उस पर विश वास नहीं हुआ ?	మీరు ఆమె చెపపి న దానని నమమ ట లేదా ?
- ठीक है . - उसने मुझे इसे चिंता का वि ष य बताया .	- సరే . - ఆమె ఆ విషయం లో ఆ ందో ళ న వె లి బు చచి ంది .
बात यह है कि मैंने क ॉल हैं ड ल र से खुद चर चा की .	అంటే , ఆ కాల మాటలా డి న వయకతి తో నేను మాటలా డా .
यह समझ दा री है .	తెలి వెన ఆలోచ నే .
- कया हुआ ? - यह . . . पता नहीं .	- ఏంటి ? - అంటే . . . ఏ మో మరి .
- ए . - अरे , धत .	- హేయ . - అబబా .
कि उनका कोई उ द देश य है या नहीं .	దాని గురించి నేనే ం చెపప లేను .
मेरी टी म कर रही है , हाँ . हाँ .	నా టీ మ పని చే సతోంది . అవును .
वह ना बा लि ग था . बा रह साल का .	అపపుడు అతను మెన ర . ప నన ె ండ ే ళలు .
कुछ साल ों से .	రెండ ే ళల నుండి .
आप बिना किसी कारण के परे शान हो रही हैं .	ఏ వే వో ఊ హి ంచు కొ ని ఊ రి కే కంగా రు పడి పో తుననావు .
मैं एक म हिला को ढूँढ ने की कोशिश कर रही हूँ , सं भ व त ः ला ति नी अ मरी की ,	నేను ఒక మ హి ళ ఆ చూ కీ ని కను గొ నే పరయత నం లో ఉననాను , ఆమె హి స పా నిక అయ యు ండ వచచు ,
मुझे लगा उसे आ जी वन का रा वास की स जा मिली थी .	అతనికి యా వ జ జీ వ శి కష పడు ంటుంది అను కుననా .
- धनयवाद . अ ल वि दा . - तुमहारा दिन अचछा बी ते .	- థ యా ంక యూ . బె . - రో జ ంతా కు లా సా గా గ డు పు .
शु भ रात रि , टो न .	గు డ నె ట , టో న .
मैं चाहती हूँ कि तुम एक ट ू थ बर श लो , समझ ी ? या चा बि या ँ .	మీరు ఒక బర ష తీసుకో ండి , సరేనా ? తా ళ ంచ ె వు లు అయి నా పర వాలేదు .
नहीं , माँ . मैं यह बार - बार नहीं कर सकती . आप मुझे मु सी ब त में डाल द ें गी .	అమమా , నేను పరతి సారి ఇలా చేయ లేను . నీ వలల నేను సమసయ లలో చి కకు కుంటా .
उसे बे च ने के इ रा दे से डर ग स रख ने के जु र म में गिर फ तार किया गया था .	అతని దగగర డ రగ స ఉననా య ని , వాటి ని సర ఫ రా చేసతుననా డని అత డిని అ రె సట చేశారు .
हैलो . हे ज ले न के एक फोन बॉ कस से किसी ने फोन किया है	హాయ . హ య ీ స లే న లో ని కా యి న బా కస నుండి ఒక కాల ర ఫోన చేశారు ,
पर तुमने उससे खुद बात की थी . तुम फोन पर मौ जू द थी . इसलिए मुझे पूछ ना होगा . . .	కానీ మీరు ఆమె తో మాటలా డా రు . పర తయ కష ంగా వి ననా రు . కాబటటి ఒక విషయం అడ గ ాలను కుంటుననా . . .
- उसने कैसे . . . - चा कू से .	- అతను ఎలా . . . - క తతి తో .
जानती हो ना श री मै थि स को 2 4 साल ों की स जा कयों हुई .	మిసటర మయా థ ి స కి 2 4 ఏ ళల శి కష ఎందుకు పడి ందో మీకు తెలుసా ?
मेरा एक 1 2 - वर ष ी य बेटा है .	నాకు 1 2 ఏ ళల పి లలా డు ఉననాడు .
हैलो , मैं डी ए स जू न लें कर बोल रही हूँ .	హాయ , నేను డి టె క టి వ సా ర జె ంట జ ూ న లె ం కర ని .
कया आपको वै न पर कुछ लि खा दिख रहा है ?	ఆ వయా న మీద గురతు లు ఏమెనా కనిపి సతుననా యా ?
हैलो ? क ॉलर , ला इन पर रहो .	హలో ? మే డ మ , లెన లోనే ఉండ ండి .
हैलो . ला इन पर रहो . क ॉलर .	హలో . మే డ మ , లెన లోనే ఉండ ండి .
सन 2 0 1 2 , हाँ .	అవును , 2 0 1 2 .
खैर , मैं यह कह रहा हूँ कि ,	ఇంత కీ నేనే ం అ ంటుననా న ంటే ,
उसे शे ख ी ब खा र ना पसंद है .	ఏదో బి ల డ ప ఇ చచు కొ ని ఉంటా డు .
मैंने नो ट कर लिया , डि टे क टि व सा र ज ें ट .	అంతా నో ట చేసు కుననాను , డి టె క టి వ సా ర జె ంట .
कोई बात नहीं . कोशिश करने के लिए धनयवाद .	పర వాలేదు . ఈ ప నం తా చేసిన ందుకు థ యా ంక స .
नहीं . वे बस मुझे आप जैसे खास कला इं ट ों के लिए ही बुला ते हैं .	కాదు , కాదు . మీ లాంటి గొపప కల యి ంట స వచచి న పపుడే నాకు పని అ పప గి సతారు .
हाँ , पर , ए र ॉल की टी म को लगा था कि उनके पास अप ी ल के लिए आ धा र हैं .	హా , కానీ అ పప ీ ల చేసే అవకా శం దొ రికి ందని ఎ ర ర ొ ల టీ మ భా వి సతోంది .
यह पु रत गा ली श बद है . या नी , " ठीक है " .	అది పో రచు గ ీ స భా ష . అంటే " సరే " అని అరథం .
मैं बस हर वि वर ण की जा ँच कर रही हूँ .	నేను వి వర ాల నని ంటి నీ పరి శ ీ లి సతుననా న ంత ే .
अफ सो स , करि समस पर ऐसा हुआ .	కరి సమ స సమయం లోనే అనన మాట .
आप जानते हैं कि वे अपने क ॉल रिक ॉर ड करते हैं , है न ?	వాళలు తమ కాల స రి కార డ చేసతా రని మీకు తెలుసు కదా ?
चिंता की कोई बात नहीं है .	కంగా రు పడ ాల సిన పని లేదు .
तो तुमहें लगता है वह आदमी न स ल वा दी है ?	అయితే అతనికి జా త యా హం కా రం ఉ ంద ంటా వా ?
ना के लिए एक बार ट ै प करो , हाँ के लिए दो बार . समझ रही हो ?	లేదు అయితే ఒక సారి , అవును అయితే రెండు సా రలు ట యా ప చేయ ండి . సరేనా ?
- पुलिस डि टे क टि व . - हे भगवान . कया हम गिर फ तार हो गए हैं ?	- నేను పోలీ స డి టె క టి వ ని . - దేవుడా . మమ మ లని అ రె సట చేసతుననా రా ?
मुझे उसका नाम बता ना होगा अगर . . .	మీరు అతని పేరు చెపప ాల సి ఉంటుంది . . .
हाँ . ठीक है .	సరే . అలాగే .
या यह आदमी जो उसे चो ट पहुँ चा रहा है ,	లేదా , ఆమె ని హి ం సి ంచే ఈ పెదద మనిషి ,
कया तुम बा थ रू म में घु सी ?	మీరు బా తర ూ ము లో ఉననా రా ?
जो आदमी दो ष ी पा या गया , वह उसकी मौ त के समय उसका बॉ य फर ें ड था , ए र ॉल मै थि स .	ఆమె చని పోయి నపపుడు , ల వర అయి న ఎ ర ర ొ ల మయా థ ి స కి ఆ కేసు లో శి కష పడి ంది .
तुम लोग " नाम बताओ , नाम बताओ " कयों कहते रह ते हो ?	ఎందుకు ఊ రి కే పేరు , పేరు అని చా వ గొ డు తుననారు ?
मुझे अं दा जा लगा ने दो . इं टर - बरा ं च टा सक फो रस .	నేను ఊ హి ంచి చెప తాను . ఇంట ర - బ రా ంచ టా స క ఫో ర సే కదా .
मु कर गया . हाँ , बचा व प कष के व की ल के साथ कम रे में बैठ ने के बाद वे सभी मु कर जाते हैं .	ఉ ప సం హ రి ంచు కుననా డు . కానీ డి ఫె నస లా య రు తో మాటలాడు కుననా క , అందరూ చేసే ది అదే కదా .
- मेरी ही तरह . - ठीक है , और . . .	- నా లాంటి అమమా యే . - సరే , ఇంత కీ . . .
ठीक है , म रि या . कया तुमहें वहाँ से बाहर निकल ने का कोई रा सता दिख रहा है ?	సరే , మరి యా . మీకు గ ది నుండి బయటకు వెళల గల మా రగ ం ఏమెనా కనిపి స తో ందా ?
साथ ही मौ जू द हैं , ए र ॉल मै थि स और उनकी स ॉ लि सि टर रॉ स कार डो ना .	ఇంకా ఎ ర ర ొ ల మయా థ ి స , అతని లా య ర రా స కార డో నా కూడా ఉననారు .
मुझे पुलिस की जरूरत है .	నాకు పోలీసు లు కావాలి .
बॉ य फर ें ड ने आज रात हि ं सा की है . जान से मार ने की ध म की दे रहा है .	ఈ రోజు రాతరి ఆమె ల వర హి ం సా తమ కంగా పర వర తి సతూ , చం పే సతా నని బె ది రి సతుననా డ ట .
- इससे फर क नहीं पडता कि उसका वि चार गलत . . . - वि चार ?	- మనం అత డిని ఎంత తపపు గా అను కుననా . . . - తపపు గా అనుకో వ డ మా ?
मैं बस कह रही हूँ कि यह दिल च सप है .	మంచి మంచి కేసు ల నే అననా ను , అంతే .
बस . . . मुझे तुमहें बता ना होगा .	నేను . . . ఇం కో విషయం మీకు చెపప ాలి .
बस . . . मुझे तुमहें बता ना होगा .	నేను . . . ఇం కో విషయం మీకు చెపప ాలి .
- मैं बता चु की हूँ , हम . . . - झूठ .	- చెపపా కదా , మేము . . . - అబ దధ ం .
ठीक है , पहले मुझे नाम बता ना होगा .	సరే , ముందు మీ పే రే ంట ో చెపప ండి .
क ॉलर , हैलो ?	మే డ మ , హలో ?
हैलो . क ॉलर ?	హలో . మే డ మ ?
मुझे आपके एक स ह कर मी को कुछ द सता वे ज भी पहुँ चा ने थे .	అంతే గా క , మీ స హో ద యో గి కి కొనని ప తర ాలు కూడా ఇవ వాల సి ఉంది .
- वह मजाक था . ओ . जे . मजाक था . - हाँ , जानता हूँ . मैं समझ गया .	- అది జో క . చినన సె జ పి సతా అననా డని జో క గా అలా అననా . - హా , అరథ మెంది .
और कहीं घ ों प ना याद है ?	ఇం కె కకడ ెనా పొ డి చా రా ?
- पकका ? - सौ परति श त .	- అంతే అంటా వా ? - అంతే .
वह जानकारी सा झा करने का यह सही समय होगा .	ఏదెనా ఉంటే , దానని ఇ పపుడే వది లి ంచుకో వడం మే లు .
वे दोबारा आ गए हैं . जब से ज गी हूँ , त भी से उनकी गाडी वहाँ ख डी है .	వాళలు మళలీ వచచా రు . నేను లే చి న పపటి నుండి ఆ వయా న అకకడ ే ఉంది .
मै थि स ने जो भी किया , पै ट रिक ने दी वार के दूस री ओर से सब कुछ सुना .	మయా థ ి స చేసిన ప ను ల నని ంటి నీ ఆ అబబా యి గో డ అవ తల నుండి వి ననా డు .
म रि या , ख डी हो जाओ . ख डी हो गई ?	మరి యా , లే చి ని ల బడ ండి . ని ల బడ డా రా ?
- हैलो , क ॉलर . - हैलो .	- హలో , మే డ మ . - హలో .
डै नि एल . है गर टी @ पू र वी ल ंद न पुलिस . कॉ म वि ष य : उ त तर : ए र ॉल मै थि स	D A N I E L . H E G A R T Y @ E A S T L D N P O L I C E . C O M స బ జె క ట : ఎ ర ర ొ ల మయా థ ి స గురించి
हाँ , जानती हूँ . . .	హా , హా , అరథ మెంది . . .
हम काम जा री रख ते हैं .	ము ందుకు సా గి పో వాలి .
नहीं , वह आदमी उसके साथ फ लै ट में है . यू नि ट वहाँ जा रही है .	లేదు , ఆమె తో పాటు అతను కూడా ఉననాడు . పోలీసు లు అ కకడి కే వెళ తుననారు .
- उससे दोबारा सं पर क करो , जै स मिन . - कोशिश कर रही हूँ .	- తన కి మళలీ కాల చేయ ండి , జా స మి న . - కాల చేసతుననా .
पहली बात , यह काफी समय पहले की बात है .	ఒక విషయం ఏంట ంటే , ఇది జరిగి చాలా కాల మెంది .
ठीक है . यू नि ट भेज रहा हूँ . बस उसे ला इन पर रख ो .	సరే , పోలీసు లని పం పి సతుననా . ఆమె లెన లోనే ఉండే లా చూడు .
चलो भी . पकका तुमहारे पास इससे भी घ ि नौ नी कहा निया ँ हों गी .	ఇంకా చెపప ండి . ఇలా భ యం కర మెన క థ లను చాలా నే చూ సి ఉంటా రు కదా మీరు .
तुम मुझे जानते हो . मैं अ ती त के बारे में कभी नहीं सोच ता .	నా గురించి నీకు తెలుసు కదా . గ తా నని ప టటి ంచు కొ నే ర కం కాదు నేను .
तुमहारी बात मान ले ता हूँ . हाँ . समझ ी ?	వి భ ే ది ంచ కుండా ఉంటే సరి పో తుంది . అంతే కదా ?
मेरा मतलब , आ ख िर कार , करि समस थी .	ఎంత ెనా అది కరి సమ స సమయం కదా .
" एक के स से जु डी जरू री जानकारी . " यह खुद लेकर आने के लिए धनयवाद .	" ఒక కేసు కు సంబం ధి ంచిన సమా చా రం . " మీరు వయకతి గ తంగా వచచి మంచి పని చేశారు .
बर ौ ज ? दो ह जार . . .	బ రో స ? రెండు వే ల . . .
हैलो . जू न .	హాయ , జ ూ న .
देखो , मेरा मतलब , मैं यह नहीं कह सकती	చూడ ండి , వాళల కే మెనా ఎ జె ండా ఉ ందో ఏ మో కానీ ,
मैंने ए डा ले इ ड बर ौ ज की हतया की .	అడి లె డ బ రో స ని నేనే చం పా ను .
कया दरवा जा बंद है ?	తలు పు లా క వే సి ఉందా ?
तुम श नि वार को जि तनी चा हो , छु ट टी ले सकती हो .	శ ని వా రం పని ఉంది , అ ందా కా నువవు రా క పోయి నా పర లే ద ట .
सच कहूँ तो , मैं डा , मैं तुमहारी क ॉलर से पूरी तरह से स हम त हूँ .	నిజం చెపప ాల ంటే , మా ండా , కాల చేసిన వయకతి తో నేను పూరతి గా ఏ కీ భ వి సతుననా .
ठीक है . शु भ रात रि .	సరే . గు డ నె ట , గు రూ .
तो मैं तैयार हूँ .	దానికి నేను సిదధ మే .
उसे यह भी पता था कि उसे 2 4 साल ों की स जा हुई है .	శి కష పడి ంది 2 4 ఏ ళ లకు అని కూడా తన కి తెలుసు .
उसने यह कहा , उसने वह कहा , यह . . .	అతను ఒక ట ననా డు , ఆమె ఒక ట ంది , ఇ దంతా . . .
