तुम कौन हो ?	ఎవరు నువవు ?
मेरे लिए ये लोग कोई मा य ने नहीं रख ते .	ఈ జ నం ఎవ వర ూ నాకు ఏ మా తరం ముఖ యం కాదు .
- तुम आ ख िर हो कौन ? - तुम लोगों ने जलदी शुरू कर दिया , है ना ?	- నువవు అసలు ఎవరు ? - మీరు చాలా తవర గా పని మొద లు పెటటా రు , కదా ?
ने ल सन - सै म ब रि टि श ना गर ि क	నె లస న - సా మ బ రి టీ ష ప ౌ రు డు
सै म ने ल सन ?	సా మ నె లస న ?
नहीं !	వదదు !
हम चाहते हैं कि आप अपनी - अपनी सी ट ों पर बैठ े र हें और अपनी कु र सी की पे टी बा ं ध लें .	మీ సీ ట లలో మీరు కూ రచు ని సీ టు బె ల టు లు పెటటు కు ని ఉండ ాల సింది గా మిమమలని కో రు తుననాను .
बढिया , इसे मुझे दो .	సరే , అది నాకు ఇవ వు .
एक बार और देखो .	ఇం కొ క సారి చూడు .
नहीं . यहाँ नहीं , मेरे दोसत .	లేదు . ఇకకడ ఆడ కూడదు , మి తర మా .
लेकिन उसकी आवा ज .	కానీ అతని గొ ం తు .
तो तुमहें अब कुछ करने की जरूरत नहीं है ?	అయితే నువవు ఇపపుడు ఏమీ ము టటు కో న కక ర లేదా ?
नहीं . ही थ रो पहुँच ने के एक घं टे पहले तक नहीं .	లేదు . హ ీ త రో చే రు కో వడానికి ఒక గంట ముందు వర కూ .
कया हो रहा है ?	ఏం జరుగు తో ందా ?
हैलो ? नीचे बैठ ो .	హలో ? కింద కూ రచ ో .
मैं अपना फोन चा लू रख ूँगा .	నా ఫో ను ఆన లోనే ఉ ంచు తాను .
मार शा .	మార షా .
2 डी	2 డి
2 डी : यहाँ बातें करें .	2 డి : ఇకకడ చా ట చేయ ండి .
अपना सं देश टा इ प करें	మీ స ందే శం టె ప చేయ ండి
1 के : अभी तक कुछ नहीं .	1 కె : ఇంకా ఏం తెలియదు .
मैंने कहा था ?	నేను చెపపా నా ?
अब दु ल ला .	అబ దు లలా .
1 के : इ रा की ए टी सी विमान से सं पर क करेंगे . लेकिन उनहें कोई जवाब नहीं मिले गा .	1 కె : ఇ రా కీ ఎ టి సి మన విమా నా నని కా ంటా క ట చేసతా రు . కానీ ఎలా ంటి సమా ధా నం ఉండ దు .
इ रा क	ఇ రా క
{ \ an8 } कि ंग डम 2 - 9 .	{ \ an8 } కి ంగ డ మ 2 - 9 .
कया आप कै प टन बोल रही हैं ?	మాటలాడు తునన ది కె ప టె న కదా ?
ठीक है . मैं जाता हूँ .	సరే . నేను వెళ తుననాను .
कि ंग डम 2 - 9 .	కి ంగ డ మ 2 - 9 .
जा बे ल अ ली अब ू धा बी	జె బె ల ఆ లి అ బు దా బి
मा इ कल ?	మె ఖ ే ల ?
अपना मै से ज टा इ प करें	మీ స ందే శం టె ప చేయ ండి
यह सिरफ एक तरह का सं के त हो सकता है कि कुछ ग ड ब ड है .	ఏదెనా దా రి తపప ి తే , విమానం లో ఏదో సమసయ ఉ ందని సం కే తం .
नी ला !	నీ లా !
नी ला ?	నీ లా ?
नी ला ?	నీ లా ?
बा थ रू म साफ करना आ सान होता है .	బా త రూ ము లు శు భ రం చేయడం తే లి క .
दे री से उ डे गी . मैंने तुमहारी के एल ए म देख ली थी . मा इ कल ने तुमहारी स वि स ए यर संभाल ली .	ఆ లస యం అయి ంది . నీ కె ఎ ల ఎ మ కూడా నేను చూ సు కుననాను . నీ స వి స ఎ యి ర ని మె ఖ ే ల చూ సు కుననా డు .
सब जानते हैं कि पायलट सिरफ उडा न भर ते हैं और विमान को नीचे उ तार ते हैं .	పె లె టలు కేవలం టే కా ఫ ఇంకా ల యా ండి ంగ మాతరమే చేసతా రని అంద రికీ తెలి సి ందే .
सिरफ वही करें जो वे लोग कहते हैं जिन का इस समय इस विमान पर कब जा है .	ఈ విమానం పర సతు తం సవా ధ ీ నం చేసు కునన వారి ఆ దే శ ాలను మాతరమే అను సరి ంచండి .
उनहोंने दु ब ई के ह वाई अ ड डे के लोगों से बात की . वे बिना वजह डर गए थे .	వాళలు దు బా య లో , ఎ యి ర పో ర ట సి బబంది తో మాటలా డా రు . అది త పపుడు హె చచ రిక .
दु ब ई के पास पहले ही एक फोन आ चुका था . समस या पहले ही ह ल हो चु की थी .	అంత కు ము ందే దు బా య కి ఒక కాల వెళలి ంది . అది అ పపటి కే పరి ష కా రం అయి ంది .
- ख रा ब हो जाएँगे . मेरी बात सुनो . . . - पे टी से अपना हाथ ह टा ओ .	- ఘ ో ర ంగా మార తా యి . నా మాట వి ను . . . - ఆ బె ల టు మీద నీ చేయి తీ యి .
इस सब का मतलब यह है , सा इ मन , कि मुझे दस मिनट की देर हो जाए गी .	ఈ అనని కారణ ాల వలల , సె మన , నేను ప ది నిమిష ాలు ఆ ల సయ ంగా వ సతాను .
मैं कर सकता हूँ , पर वाई फा ई चल रहा हो तो कोई भी कर सकता है .	అంటే , మాటలాడ గలను , కానీ వె - ఫె ఆన లో ఉంటే ఎవరెనా సం పర ది ంచ చచు .
जैसा कि मैंने कहा था , मैं बस घर जाना चाहता हूँ .	నేను ము ందే చెపపి న టలు , నాకు ఇంటికి వెళల ాలని ఉంది .
पलीज , जा रा . मैंने उससे कहा है मैं कोशिश कर ूँगा .	పలీజ , జా హ రా . నేను చూ సు కుంటా నని తన కి హా మీ ఇ చచా ను .
वह पाँच घं टे बाद हमारी ह वाई सी मा में आए गा .	మన గ గ న తల ంలో కి రా వడానికి ఐ దు గంట లు పడు తుంది .
देखो , कल ही बॉ बी का अप ें डि कस निकल वा या है ,	చూడు , బా బీ కి ని నన అ పె ండి కస సమసయ వచచింది ,
या हम वहाँ के ए टी सी से सं पर क करने . . .	లే ద ంటే మనం ఎ టి సి ద వా రా పరయతని ంచ చచు . . .
किसी ने गोली चला दी , मैंने बस यही सुना .	తు పా కి పే లి ంది , నాకు అదే వి ని పి ంచింది .
तो , आपने ऐसा कयों कहा कि कै प टन आप हैं ?	అపపుడు , నేనే కె ప టె న అని ఎందుకు చెపపా వు ?
- वे पी . ई . के लिए हैं . - वे ल करो पह नो .	- ఇ వి ఫి జి కల ఎడ యు కే షన కోసం . - వె ల క రో .
हे ! जो तुम चाहते हो , वह कर तो रही हैं .	హేయ ! ఆమె నువవు అడి గి ంది చే సతోంది కదా .
के ए 2 9 के या तरी इस कष े तर में होंगे . दूस री फ ला इट के या त रि यों के साथ .	కె ఎ 2 9 పర యా ణి కులు ఈ పరా ంత ంలో ఉననారు . మి గ తా విమా నా ల పర యా ణి కు లతో కలిసి .
बी ए 9 8 5 0 , अब आप उडा न भर सकते हैं .	బి ఎ 9 8 5 0 , మీ టే కా ఫ కి అను మ తి ఉంది .
प ला जा में हम दोनों साथ खाना खा एँ .	ప లా జ ాలో ఇదద రి కోసం టే బు ల కావాలి .
कयोंकि कॉ क पि ट में कोई नहीं है .	ఎందుకంటే కా క పి ట లో ఎవ వర ూ లే రు .
कुछ नहीं , बिलकुल भी कुछ न . . .	ఏమీ లేదు , ఖచచితంగా ఏమీ లేదు . . .
पलीज अं ति म ग ंत वय और दि शा की पु ष टि करें . सुरकष ा सत या प न के लिए .	మీ గ మ యం ఇంకా మా రగ ం ఖ రా రు చేయ ండి . సె క యూ రి టీ త ని ఖ ీ పూర త యి ంది .
यही मतलब होगा जब उनहोंने कहा था " बर दा श त नहीं किया जाएगा . "	" ఇక పె స హి ంచ ము " అని వాళలు ఎందుకు అననా రో ఇపపుడు అరథం అవు తోంది .
तो , फिर तुमने कया किया ? मान भी लो , तुमने कुछ तो किया होगा .	అయితే , మరి నువవు ఏం చేశా వు ? ఇలా చూడు , నువవు ఏదో చేసి ఉంటా వు .
हो सकता है . किसी ने पता किया ?	అయి ఉండ చచు . ఎవరెనా చె క చేశా రా ?
वह तुमहारी तरफ आ रहा है , ए डी .	అతను నీ వె పే వ సతుననా డు , ఎ డీ .
तो , फिर अचछे से खाना खा एँगे .	అయితే , ఆ వి ందు స వయ ంగా చే దదాం .
जाओ और इसका पास पो रट लेकर आओ .	వెళలి అతని పా స పో ర ట తీసుకో .
हे , तुम . तुम कया कर रहे हो ?	హేయ , ఓ య . మీరు ఏం చేసతుననా రు ?
जिस का मतलब है आज मुझे उसे चा इ लड के यर में छोड ना पडे गा .	ఆ కారణ ంగా నేను వే రే చె ల డ కే ర సె ంట ర చూ సుకో వల సి వచచింది .
ठीक है , फ ला इट नंबर कया है ?	సరే , ఆ విమానం నె ం బ రు ఎంత ?
अगर वह झूठ बोल रहा हो तो ?	అతను అబ దధ ం ఆ డి ఉండ చచు కదా ?
अगर तुम इन हें दोबारा देखना चाहते हो , तो इसे खो लो .	వీ ళ లని నువవు మళలీ చూడ ాలి అను కు ంటే , దీ నని ఓ పె న చేయి .
यू रो प , गरे ट ब रि टे न , ल ंद न .	యూ రో ప , గరే ట బ రి టన , ల ండ న .
कि सब कुछ ठीक है , तुमने सुना मैं कया कह रहा हूँ ?	ఇకకడ అంతా బాగానే ఉ ందని వాళల కి చెపప ాలి , వి ంటుననా వా ?
- माफ करना ? - बिना वजह डर गए थे , इसका कया मतलब है ?	- సా రీ ? - ఒక త పపుడు హె చచ రిక , అది ఎలా జరుగు తుంది ?
तो , ऐसे में वह कया चाहते हम कया करें ?	అయితే , తను మనం ఏం చేయ ాలని ఆ శి సతుననా డు ?
" मैं आपके के बि न कर ू से बोल रही हूँ .	" మీ క యా బి న సి బబంది ని మాటలాడు తుననాను .
पलीज अपना नंबर छोड द ें और मैं आपको वापस फोन कर ूँगा .	మీ నె ం బ రు చెపప ండి , తరువాత నేనే తిరిగి కాల చేసతాను .
हमें कोई मदद नहीं चाहिए .	మాకు ఏ సాయం అవసరం లేదు .
{ \ an8 } ए ले न , रॉ बि न कै प टन	{ \ an8 } అ లెన , రా బి న కె ప టె న
मुझे बस एक बार विमान में पीछे की तरफ जाने दो .	నేను విమానం వె నుక భా గా నికి ఒక సారి వెళలి వ సతాను .
यही दि क कत है . मैं एक ऐसे आदमी को झ े ल रही हूँ .	ఇదే అసలు సమసయ . అలా ంటి మనిషి ని నేను భ రి సతుననాను .
हमें कल से भी जयादा देर हो गई है . और कल वाला अपने आप में एक रिक ॉर ड था .	మనం ని నన టి క ననా ఈ రోజు ఇంకా ఆ లస యం అయ యా ం . ఇదే ఒక రి కార డు అయి పోయింది .
अगर ये ह वाई या ता या त निय ं तर ण वाले हैं , तो हमें इसका अभी जवाब देना होगा .	అది గ నుక ఎ యి ర ట రా ఫి క క ంట రో ల అయితే , మనం వెంట నే దానికి జ వా బు చెపప ాలి .
मैं 3 0 से क ंड में अपनी कार तक पहुँच जा ऊँ गी . . .	మ రో ము పప ె సె క న లలో నేను నా కారు లో ఉంటా ను . . .
हाँ , हा य . हाँ , मुझे पाँच मिनट की देर हो जाए गी .	హాయ . అంటే , నేను ఐ దు నిమిష ాలు ఆ ల సయ ంగా వ సతాను .
ठीक है , उनहें जाने दो .	సరే , ఆమె ని వెళ లని వ వ ండి .
अपनी सी ट पर वापस जाओ . इससे कुछ नहीं होने वाला .	వెళలి నీ సీ ట లో కూ రచ ో . ఇలా చేయడం లో అరథం లేదు .
- उनसे क हो अपनी स करी न शे यर करें . - ठीक है , हम से अपनी स करी न शे यर कर दी जिए .	- వాళల స క రీ నస ష ే ర చేయ మని అడుగు . - సరే , మీరు మీ స క రీ న ని వెంట నే ష ే ర చేయ ండి .
रॉ बि न ए ले न से मेरी इसी समय बात करवा इए . सुरकष ा उ द देश यों के लिए , अभी .	నేను రా బి న అ లెన తో వెంట నే మాటలాడ ాలి . ఇది విమానం భ దర త కోసం తపప దు .
उडा न भर ने से पहले अप लो ड कर दिया गया होगा .	ఇంకా ఆ రూ ట ని టే కా ఫ కి ము ందే అ ప లో డ చేశారు .
यह तो अचछी खबर है ना ?	అది మంచి విషయం కా దా ?
उनसे ऐसे बात मत करो .	ఆమె తో అలా మాటలాడ క ండి .
सोच ो , अग ले छ ह घ ंट ों में कया हो सकता है .	తరువాత ఆ రు గంట లలో ఇం కె ంత జరగ చచ ో ఊ హి ంచండి .
हमने पाँच बार पह चा न जान ने की कोशिश की .	మేము గుర తి ంచ డానికి ఐ దు సా రలు పరయతని ంచా ము .
अचछा . और यहाँ नि श चि त त ौर पर उसके पू र व - पति की बात हो रही है ?	సరే . అయితే మనం ఖచచితంగా ఆమె మా జీ భ ర త గురి ంచే మాటలాడు తుననా మా ?
हाँ , कोई बात नहीं .	సరే , మ రే ం ఫర వాలేదు .
डि ग री के बारे में ?	ఆ డి గర ీ ల గురి ంచా ?
तुम . मु ँ ह बंद रख ो .	నువవు . నో రు మూ యి .
हाँ , मैं स हम त हूँ .	అవును , ఒ పపు కుంటా .
मैं बस उममीद कर ूँगी कि मेरा बॉ स तुमहारे जि तना हो श िया र ना हो . अब अंदर जाओ , पलीज .	మా బా స నీ అంత తెలి వెన వాడు కా కూడ దని ఆ శి సతాను . ఇం క నువవు లోప లి కి వెళ లు , పలీజ .
मैं अपने जन म दिन पर यही चाहता हूँ .	నా పు టటి న రోజు న నేను కో రు కునే ది అదే .
विमान पर बर फ है ?	విమానం లో ఐ స ఉందా ?
मैं जानता हूँ कि यह बात करना अजीब है , जानता हूँ .	నాకు తెలుసు , ఇది ఒక వి చి తర మెన ఫోన కాల , నాకు తెలుసు .
पे शे वर स फा ई कर मी .	పర ొ ఫె షన ల క లీ న ర ల ం .
हाँ , व हीं , दोसत .	ఇం క చ ాలు , మి తర మా .
लेकिन असल में , इससे हा ला त और जयादा बि ग ड जाएँगे .	కానీ నిజ ానికి పరిసథి తి అంత క ననా ఘ ో ర ంగా త యా ర వు తుంది .
सा इ मन के पास फोन आया था , उसने दु ब ई फोन किया , दु ब ई ने बताया कि वह पु रा नी खबर थी . उनका डर नि रा धा र था .	సె మన కి ఫోన వచచింది , దు బా య కి ఫోన చేశా డు , అది పా త వార త ని దు బా య వాళలు చెపపా రు . త పపుడు హె చచ రిక .
अचछा . यह आत ंक वाद - वि रो धी समस या नहीं है , डै निय ल .	అవును . కానీ ఇది క ౌ ంట ర టె ర ర రి జ మ ఘ టన కాదు , డా నియ ె ల .
यहाँ मेरी फ ला इट स करी न पर एक मै से ज आता है , जो आपको वहाँ दिखा ता है ,	నా ఫ ల యి ట స క రీ న మీద మనం ఇకకడ ఉననా మని చూపి సతూ ఒక మె సే జ వ సతుంది .
ठीक है , समझ गई .	అలాగే , అరథ మెంది .
वे लोग अग ले हफ ते यह घर छोड कर जा रहे हैं . कया मैं ऊपर जाकर उनहें बता ऊँ आप आए हैं ?	వాళలు వచచే వా రం ఇ లలు మా రి పో తుననారు . నువవు వచచా వని పె కి వెళలి చెపపి ర మమ ంటా వా ?
तुम मुझे आत ंक वाद - वि रो धी चीज ों के सि ल सि ले में फोन करते हो तो ठीक है , लेकिन . . .	క ౌ ంట ర టె ర ర రి జ మ కేసు లు వచచి నపపుడు నాకు ఎందుకు ఫోన చేసతా వో తెలుసు కానీ . . .
{ \ an8 } सू ची - दोबारा शुरू करें	{ \ an8 } మెన యూ - మళలీ పరా రం భి ంచండి
{ \ an8 } 2 डी : तुमने दि शा बदल दी ?	{ \ an8 } 2 డి : నువవు ది శ ను మార చా వా ?
यह हमारे पर भा व कष े तर में नहीं आता है , लेकिन कोई बात नहीं .	వా సత వ ంగా అది మన పరి ధి లోకి రా దు , కానీ మనం పరయతని ంచి చూ దదాం .
मैं आ रहा हूँ .	నేను వ సతుననాను .
हाँ . एक से क ंड .	సరే . ఒకక సె కను .
{ \ an8 } सही में ?	{ \ an8 } నిజంగా నా ?
शुकरिया , मा इ कल .	థాంక యూ , మె ఖ ే ల .
विमान के पीछे .	ఆ విమానం వె నుక .
मैं तुमसे दोबारा नहीं कहूँ गा , दोसत . बैठ जाओ .	నీకు మళలీ ఇం కో సారి చెపప ను , మి తర మా . కూ రచ ో .
इसे थोडा बडा करके दिखा सकते हैं , पलीज , ज ला ल ?	దయచేసి మా కోసం కొ ద ది గా జ ూ మ చేయ గల వా , జ ల ాల ?
यह ल ु फ थ ै न जा का कया चल रहा है ?	ఈ లు ఫ తా ం స ాలో ఏం జరుగు తోంది ?
वहाँ बिलकुल पीछे की तरफ जाकर .	అందరూ వె నుక వెపు కి వెళల ండి .
- कहाँ कहा आपने ? दु ब ई ? - हाँ .	- ఎకకడ అంటా వు ? దు బా య ? - అవును .
बस , अब मुझे गु ससा आने वाला है . जलदी करो .	చూడు , నాకు ఇం క ఇపపుడు కో పం వ సతోంది . ఇం క రా .
ठीक है . अगर मैं वहाँ ऑ टो पायलट द बा ता हूँ ,	సరే . అంటే , నేను అకకడ ఆ టో పె లెట బ టన ఆన చే సతే ,
तो अगर कोई यह बात दूस री बार कह ता है . . .	మరి ఇదే మాట ని ఎవరెనా రెండు సా రలు చె బి తే . . .
बि ज ने स कला स में एक बं दे ने गोली चला दी , वहाँ ल डा ई हो रही थी , दो बंद ों ने उनहें रो क ने की कोशिश की थी .	బి జి నె స క లా సు లో ఒక గ న పే లి ంది , అకకడ గొ డ వ జరిగింది , ఇదద రు వయ క తులు వాళల మీద దా డి కి పరయతని ంచారు .
