हेदर ?	హే థర !
एक हफ ते से जज ों की कोई खबर नहीं .	మనం నయాయ నిరణ ే తల నుండి విన క వార మ యి ంది .
किसी को बुला ती हूँ !	ఎవరి నె నా తీసుకు వ సతాను !
मैंने खुद बा ँ धा है .	నేను ఇది త యా రు చేశా ను .
जैसा कि तुमने कहा , खेल कभी नहीं रु क ता .	నువవు చెపపి న టటు గానే , ఆట ఎపపుడూ కొ న సా గు తుంది .
तुमहें ढूँढ ता हुआ आया ,	నేను నీ కోసం వచచా ను ,
मुझे को ल व ॉ रे न का पता चल गया .	కో ల వా రెన జా డ కను గొ ననాను .
शायद डॉज मे सन फ ँ स गया है !	డా డజ మే స న ఇ రు కకు పోయా డ ను కుంటా !
पता नहीं , भ ट के हुए से लग ते हैं .	ఎందు కో తెలీదు , దా రి తపప ి న టటు ఉంటా రు .
छोड ो भी , हेदर .	ఊ రు కో , హే థర .
कुछ न कुछ लि ख ती रह ती हो .	నీ చినన పు సత క ంలో రా సతు ంటా వు .
निक डे रिक ने कहा कि हमारी है सि य त नहीं , इसलिए मेरे पास फोन नहीं .	మనకు తా హ తు లేక నేను ఫోన కొ నుక కో లే దని నిక డె రిక అననా డు .
ठीक है ?	సరేనా ?
फिर मिल ेंगे , दोसत .	మళళీ కలు సతాను , క ౌ బా య .
बंद ूक .	తు పా కీ .
कोशिश अचछी थी .	మంచి పరయత నం .
- हैलो , अफ सर वि लि य मस . - मुझे हेदर नि ल कहाँ मिले गी ?	- హాయ , ఆ ఫీ సర వి లి య మస . - హే థర ని ల ఎకకడ ఉంది ?
हा ई सक ूल से वहाँ पार टी करते आए हैं .	మన హె స కూ ల నుండి అకకడ పార టీ చేసు కునే వారు .
तुमहारी माँ लि ली को अपने साथ काम पर ले गई हैं .	మీ అమమ లి ల లీ ని తన తో కొంచెం సే పు ప నికి తీసుకు వెళళి ంది .
लि ट ल बिल की अं ति म कर िया के बाद आज सु बह डी ए से बात हुई .	ఈ ఉద యం లి టి ల బి ల కార యం తరువాత డీ ఏ తో మాటలా డా ను .
- आगे खेल ना चाहती हो ? - मुझे कार प में नहीं रहना .	- నువవు ఆట కొ న సా గి ంచ ాల ంటా వా ? - నాకు కార ప లో ఉండ ాలని లేదు .
कयों ? अचछी नहीं लग रही ?	ఎందుకు ? బాగా కనిపి ంచడం లేదా ?
- मजाक कर रही हो कया ? - नहीं .	- నాతో పరా చి క ాలా ? - లేదు .
मैं तुमहारे बारे में हमेशा उस तरह से सोच ता हूँ .	నేను నీ గురించి ఎపపుడూ అలా నే అనుకుంటా ను .
इसे रख दो . बेटा , इसे वापस रख दो , ठीक है ?	అది తిరిగి పెటటు . బంగా రం , తిరిగి పెటట ే య , సరేనా ?
तुमने मुझे ड रा दिया .	ననను భయ పెటట ే శా వు .
इसलिए सोचा तुमहारा हा ल चा ल जान ल ूँ .	అందు కని నీ కె లా ఉ ందో నని చూడ డానికి వచచా ను .
डे मो डर बी के लिए नाम लि खा ने .	డె మో డ ర బీ కి న మో దు చేసు కుంటుననా ను .
- हैलो . - हैलो . यहाँ कया कर रही हो ?	- హే . - హే . ఇకకడ ే ం చేసతుననా వు ?
- ए ! भा ड में जाओ ! - घ े र लिया , सा ले .	- హే ! పో రా ! - నినను గు ద దే శా ను .
का श वह सी धे दी वार में जाकर ट करा ए .	అతను నే రు గా గో డ లోకి వెళళ ాలి .
यकीन मान ो , का श मैं भूल पा ती .	ననను నమ ము , నాకు మర చి పో వాల నే ఉంది .
- कया ? - सुनो , हमें जाना होगा , चलो .	- ఏంటి ? - హే , మనం వెళళ ాలి . రా .
मुझे लगा कि माँ की हैं , इसलिए मैंने फ ें क दी ं ,	అవి అమమ వి అను కుననాను , అందు కని పడ ే శా ను ,
मुझे तुम ए का उ ंट ें ट तो नहीं लग ती .	నువవు అ క ౌ ంట ె ంట లా కనిపి ంచ వు .
उसने कहा कि इसी वजह से मेरे पास एक ही जो डी जू ते हैं	అందుకే నాకు స నీ కర స ఒక జ త మాతరమే ఉననా య ననా డు ,
उसके बा जू में एक सु ई थी , पर . . .	అతని చే తి లో సూ ది గు చచి ఉంది , కానీ . . .
नै ट ली मेरी बेटी है ,	నా ట లీ నా కూ తు రు ,
- मिल गया . - अग ला .	- శు భ రాతరి . - తరువాత .
बो की सि गरे ट . मुझे नहीं पता था .	బో సి గ రె టలు . నాకు తెలియదు .
जाकर उसे अपने दिल का हा ल बता सकती हो , पलीज ?	దయచేసి , అతనికి నీ భా వ న తెలియ చేసతా వా ?
दो ही साल ों की बात है और काफी स स ती है , इसलिए . . .	అ ంది రెండ ే ళళ ే , అది చాలా చ వ క , అందు కని . . .
लि ट ल बिल की मौ त के लिए उनहें किसी को गिर फ तार करना होगा .	అతను లి టి ల బి ల మ రణ ానికి ఎవరి నె నా అ రె సట చేయాలి .
और कई लोग उसके पिता की काफी इ जज त करते हैं .	వాళళ నానన ంటే చాలా మంది కి చాలా గ ౌ ర వం .
हर कोई उसे चाहता था .	అందరూ అతని ని ఇష ట పడ ే వారు .
सा . करि स टी न लै ंग ली	సా ర జె ంట కరి సట ీ న
- कया ? - वह तुमहें अचछा लगता है .	- ఏంటి ? - నీకు అత న ంటే ఇషటం .
पर तुम बता सकती हो कि रू सी रू ले ट में जि मी के साथ कया हुआ था ?	కానీ ర ష యన రో లెట ఆట లో జి మ మీ కి ఏం జరిగి ందో చెబు తా వా ?
लि ली ?	లి ల లీ ?
इसे वापस रख दो .	అది తిరిగి పెటట ే య .
- तुमहें अपना माल चाहिए ? - इसे रख दो .	- నీకు నీ స రు కు కా వ ాలా ? - అది తిరిగి పెటట ే య .
अचछा ?	అవునా ?
बी वी के साथ ल डा ई हो जाए तो घ रे लू अ तया चार का आ रो प लगा ते हैं ,	మీ ఆ వి డ తో గొ డ వ పడి తే , గ ృ హ హి ం స కింద అ రె సట చేసతా రు ,
ए , किसी ने मेरी बी यर देख ी है ?	హే , నా బీ ర ఎకకడ ఉ ందో ఎవరెనా చూశా రా ?
तुमहें वहाँ नहीं होना था . . .	నువవు అకకడ ఉండ కూడదు . . .
रि चर ड स परा ंत शे रि फ वि भाग	రి చ ర డ స క ౌ ంట ీ ష ె రీ ఫ డి పార ట మె ంట
मुझे . . . मुझे तुमहारी थोडी फि कर हो रही थी .	నాకు . . . నాకు నీ గురించి కొంచెం కంగా రు అనిపి ంచింది .
हाँ , मैं शायद 1 6 साल का था जब मुझे यह मिला ,	అవును , నాకు , బహుశా , అది గె లి చి నపపుడు 1 6 ఏ ళళు ఉంటా యి ,
तुम तो र च ना त म क लग ती हो .	నీ ది స ృ జ నా తమ క తర హా .
इ क ती स नंबर निकल प डी है .	నం బ రు 3 1 వెళ ు తుంది .
थोडी - बहुत बी यर पी ने से , न शे में गाडी चला ने का आ रो प लगा या .	కొనని బీ రలు తా గి తే , తా గి న డి పా నని అ రె సట చేశారు .
लि ट ल बिल के ली त ह खा ने में था .	లి టి ల బి ల కె ల లీ నే ల మా ళ ి గ లో ఉననాడు .
भ ु ग ता न ? किस से ?	చె లలి ంచా రా ? ఎవరు ?
खुद को संभा लो .	బాగా అరథం చేసుకో .
लि ली . ए , लि ली .	లి ల లీ . హే . లి ల లీ .
दिखा ई दे रही हूँ ?	కనిపి సతుననా నా ?
का श मैं वहाँ होता .	నే న కకడ ఉంటే బాగు ండ ే ది .
ऐसा है . . .	అంటే . . .
ठीक है , मुझे कहा निया ँ लि ख ना पसंद है , पर . . .	సరే , నాకు క థ లు రా య టం ఇషటం , కానీ . . .
समझ रहे हो ?	అరథ మె ందా ?
कया कया है ?	ఏ ది ఏంటి ?
जि मी और मैं वहाँ सिरफ हार ने के लिए मौ जू द थे .	జి మ మీ నేను మాతరమే అకకడ ఓ డి పో యే వాళళ ం .
और फिर , पल भर में ,	అపపుడు , కను రె పప పాటు లో ,
कार प की सा ला ना मे ट ल सट ै ं पी ड डे मो लि शन डर बी में आपका सवागत है .	కార ప వార షి క మె టల సటా ం పీ డ డె మ ాలి షన డె ర బీ కి సవా గ తం .
लगे गा कि जो आदमी चार घं टे संभा वना ओं में ड ू बा रहे ,	రోజు లో నాలు గు గంట లు అ ంచ నా ల పె గ డి పే వాడి కి
- पर कया ? - सारे सब ूत जल चु के थे ,	- కానీ ఏంటి ? - అనని సా కష య ాలు క ాలి పోయా యి ,
कुछ ही परति यो गी ब चे हैं , दो स तो .	కొ ంద రే పో టీ దారు లు మి గి లా రు , మి తరు లా రా .
त य हुआ था कि रे कभी था ही नहीं .	మనం రే గురించి మాటలాడు కో మని అను కుననా ం .
त किया ठीक कर दे ता हूँ .	నీ కోసం ది ండ లు పె డ తాను ఉ ండు .
ह ंट की जानकारी गलत थी .	హ ంట కూడా తపపు గా అను కుననా డు .
उनसे कहा कि कभी मुझे ऐसे शर मि ंदा नहीं करो गे ,	నేను నీ కోసం అంత కష ట పడి న తరువాత , ఇంకా నీ కోసం అంత చేశా క ,
इसकी शु रु आत खेल की तरह हुई .	అది ఒక ఆట లా మొద ల యి ంది .
च ौ द ह नंबर बा ल - बा ल ब ची .	నం బ రు 1 4 దా దా పు గా దా టే శా డు .
भगवान भ ला करे , लडकी दर - दर भ ट क ती है .	ఆమె మన సు ను ఆ శ ీ ర వది ంచండి , ఈ మె ఒక తి రుగు బో తు .
कुछ इस तरह मान ो वह ऐसी बात जानता था , जो हमें नहीं मा लू म थी .	మనకు తెలియ న ది ఏదో అతనికి తెలి సిన టటు అనిపి ంచింది .
सुनो , सब ठीक है .	హే , పర వాలేదు .
जलदी ठीक हो जाओ !	తవర గా కో లు కో !
अचछा . खया ल रख ना .	సరే . బాగు ండు .
ए , कोई बात नहीं .	హే , పర వాలేదు .
कभी अपनी चाह त ों से डर लगता है ?	ఏ నా డ ెనా నీకు కావాల సిన దానికి భయ పడ డా వా ?
को ल ने मा ना कि उसे भ ु ग ता न मिला था , इसलिए उसने खेल छो डा था .	తన కు చె లలి ంచడం వలల వె దొ లి గా డని కో ల ఒ పపు కుననా డు .
हाँ , वह सो रही है , जान , सब ठीक है .	తెలుసు , తను ని దర పో తుంది , బంగా రం . పర వాలేదు .
- मान ो अब यह खेल नहीं रहा . - हाँ .	- అది ఆట కా న టలు గా . - అవును .
हैलो . तुम कहाँ से च ली आई ?	హే . నువవు ఎ కకడి నుండి ఊ డి పడ డా వు ?
वह ह ंट से पहले जाना चाहता था .	అతను హ ంట కంటే ముందు వెళళ ాలను కుననా డు .
रख दो , हम बाद में बात करेंगे .	తిరిగి పెటట ే య , తరువాత మాటలాడు కు ందా ం .
इस रा उ ंड में कुछ नए परति यो गी हैं .	ఈ ర ౌ ండ లో కొ ంత మంది కొతత పో టీ దారు లు ఉననారు .
जाते समय कुछ चा य - कॉ फी लेना चा हें गी ?	కా ఫీ గా నీ టీ గా నీ తీసు కుంటా రా ?
मुझे भी .	నాకు కూడా .
अचछा .	సరే .
और निक डे रिक बहुत नी च इंसान लगता है .	కానీ ఈ నిక డె రిక , అతను ఒక చెతత కు పప లా ఉననాడు .
नहीं , इस बार मैं य ूँ ही आया हूँ .	లేదు , ఈ సారి , నేను ఇకకడికి సర దా గా వచచా ను .
- उनहें बहुत ना ज हुआ होगा . - नहीं .	- ఆయన కు గర వ ంగా ఉ ండి ఉంటుంది . - అంత గా కాదు .
डॉज ?	డా డజ ?
अचछा .	సరే .
कया ?	ఏంట ీ ?
अचछा .	సరే .
यह मेरी . . . इसे अके ली छोड दो .	అది నా . . . తన ను వదిలే య .
तुम इसे छोड दो .	తన ను వదిలే య .
माँ .	అమమా .
यहाँ आओ !	వెన కకు రా !
तुमने मुझे बाहर निका ला . मैं तो . . .	నేను బయట పడ డం లో సాయం చేశా వు . నేను చేయ లేక . . .
ली ला और ह ंट के नी एक साल से साथ हैं .	లీ లా ఇంకా హ ంట కె ననీ ఏ డా ది గా కలిసి ఉ ంటుననా రు .
कहा कि तुमहें हो श आए तो उनहें फोन कर ूँ .	నువవు లే చా క తన కు ఫోన చేయ మని ంది .
अचछा , मुझे तुम को इतने देने हैं .	సరే , అయితే , ఇది గో నేను నీకు ఇవ వాల సింది .
और तुम ? तुम पै स ों का कया करो गी ?	నీ సంగ తి ఏంటి ? నువవు డబబు తో ఏం చేసతా వు ?
पे ड ों के बीच में वो घर देख रहे हो ?	చె ట లల లో ఆ ఇ ళళు అన నీ చూశా వా ?
सिरफ पुलिस नहीं है . यह . . .	అది పోలీసు లు మాతరమే కాదు . అది . . .
अग ला रा उ ंड शुरू होने वाला है .	తరు వా తి ర ౌ ండ రా బో తుంది .
एक दम पास आ जाता है .	అతను చాలా దగగర గా వచచా డు .
उनसे कम समय में करने पर .	ఆ య నను ఓ డి ంచిన పపుడు .
- मैंने . . . - ए .	- నేను . . . - హే , హే .
हे भगवान , हेदर .	అయ యో , దేవుడా , హే థర .
वो आँख ें हैं , बेटा .	అవి క ళళు , బా బు .
लड को और लड कि यो ,	అమమాయి లు , అబబా యి లు ,
ए , कया बात है ? तुम ठीक हो ?	హే , ఏమ యి ంది ? నువవు బాగానే ఉననా వా ?
माफ करना , मैं ठीक हूँ .	కషమించు , నేను బాగానే ఉననాను .
दिमाग में जो कहा निया ँ हैं , बस उनहें बाहर निकाल दे ती हूँ .	అది నా బు ర ర లోకి క థ లు వ సతు ంటా యి , మీకు తెలుసా ?
लोगों का कहना है कि आज रात एक चु नौ ती होगी .	ఈ రాతరి స వ ాలు ఉ ంటు ందని అ ంటుననా రు .
जी ते या हा रे , साथ - साथ होंगे .	ఓ డి నా గె లి చి నా , కలి సే .
स कार ले ट स स ज जन पु रु ष ों का क लब	స కార లెట స జె ంటి ల మెన కల బ
एक बार के लिए .	ఒక చినన ఆట .
आपको याद है जि मी की अं ति म कर िया पर कि तने लोग आए थे ?	జి మ మీ కార యా నికి ఎంత మంది వచచా రో గురతు ందా ?
तो मेरे पापा बि स तर पर मेरे पास बैठ ते ,	మా నానన నా మ ంచ ం ప కక న కూ రచు ని ,
बू म , रे ह ॉल ने उसे मा त दे दी !	గు ద దే శా డు , రే హ ాల అతని పని ము గి ంచా డు !
सभी चा ल क अपनी गा डि यों के पास पहुँच ें .	డ రె వర లు , మీ కార ల దగగర కు రండి .
खुश हूँ कि तुम नहीं थे .	నువవు లేవు సంతోష ం .
आपको है रा नी होगी , पर हर बात आपकी नहीं होती .	ఇది మీకు ఆ శ చ ర యం కలి గి ంచ వచచు , కానీ అన నీ మీ గురి ంచే కాదు .
और फिर , ये तुमहारे दो हफ ते के पे श गी पैसे .	ఇంకా , ఇది నీ రెండు వా రాల అడ వా నస .
जब वे कि रा या नहीं भर पा ए , तो मैंने उनकी मदद करना शुरू किया .	వాళళు ఇవవ లే నపపుడు , నేను ఆమె కు సాయం చేసే వాడిని .
बहुत बुरा हुआ .	అది దారు ణ ంగా ఉంది .
वह सोच - समझ कर पै सा ख र च करे गा .	ఎకకడ డబబు పెటట ాలో తెలుసు అనుకుంటా ను .
और . . .	ఇంకా . . .
हैलो , रे .	హే , రే .
- चलो . - शुरू में यह एक चा ल थी , फिर . . .	- చెపపు . - పరమా ణ పూరతి గా మొద ట అది వయ ూ హం , తరువాత . . .
बे ड जे ड - 5 नाम चु नि ए नाम - संभा वना - बा जी	బె ట జ డ - 5 ఎ ం పి కలు చేసుకో ండి ఎ ం పి కలు - అ ంచ నాలు - ప ంద ెం
शुकर है कि तुम बचचे ठीक हो .	సరే , మీరు పిలల లు బాగు ననా రు , సంతోష ం .
आ ग का खेल से कोई लेना - देना नहीं था .	మ ంట లకు ఆట కు ఏం సంబం ధం లేదు .
पार टी के लिए ऐसी बे कार जगह .	పార టీ కి అంత కంటే మంచి చో టు దొ రక లేదు .
कुछ नहीं सू झ रहा था .	నేను ఏమీ ఆలోచి ంచ లేక పోయా ను .
- और ? - और . . .	- ఇంకా ? - ఇంకా . . .
कार प में सवागत है	కార ప కు సవా గ తం
तुम कहीं . . .	బహుశా , నువవు . . .
जु आ खेल ते हो कया ?	జ ూ ద ం మనిషి వా ?
- पागल प न है . - बहुत अचछा है .	- అది పిచచి . - చాలా బాగా చేసతుననా డు .
खतम करो . चलो भी !	మనం ఇది చే దదాం . రండి !
तुम लोग साथ में .	మీ ఇదద రు కలిసి ఉండ డం .
और बो मुझ पर चि ल ला या .	బో నా పె అ రి చా డు .
उस रात तुमहें ली ला के बारे में बता ना चाहता था ,	ఆ రాతరి లీ లా విషయం చెపప ాలని వచచా ను ,
डॉज मे सन और रे ह ॉल .	డా డజ మే స న మరియు రే హ ాల వి .
मुझे भी जल न हुई थी .	అంటే , నా కూ ఈ ర ష య కలి గి ంది .
- ए . - मैं तुम तक पहुँच नहीं पा ई .	- హే , హే , హే . - నేను నినను చే రు కో లేక పోయా ను .
आज रात के लिए आ खि री चार ही मा य ने रख ते हैं , पर	ఈ రాతరి చి వరి నలు గు రు ముఖ యం , కానీ ,
- पर हम अभी भी साथ मिल कर खेल सकते हैं न ? - सा झ े दार .	- మనం అయి నా స హ చ రు ల మే కదా ? - భా గ సవా ము ల ం .
उसकी ला श ?	అతని శ వా ననా ?
ठीक कहा .	అవును .
यह बो का है .	అది బో ది .
बा य .	బె .
जि मी ने .	జి మ మీ .
