वह बस वहाँ बैठ कर मु स कु रा ता है . . .	అకకడ కూ రచ ొ ని నవ వు తుననా డు అంతే . . .
दोनों बैठ कर एक - दूसरे को देख मु स कु रा ते रह ते हैं .	ఇదద ర కకడ కూ రచ ొ ని ఒక రి న ొక రు చూ సు కొ ని నవ వు కుననా రు .
मीक मिल को रि हा करो	మీక మి లను వదిలే య ండి
लोगों को कहते सुन ता हूँ , " मीक मिल को रि हा करो . "	నేను జ నం " మీక మి లను వదిలే య ండి " అని అన టం వి ననాను .
मीक मिल को रि हा करो .	మీక మి లను వదిలే య ండి .
मीक मिल को रि हा करो .	మీక మి లను వదిలే య ండి .
मीक मिल को रि हा करो .	మీక మి లను వదిలే య ండి .
फ री मीक	ఫ రీ మీక
मीक मिल को रि हा करो .	మీ కను వి డు దల చేయ ండి .
2 4 जन व री , 2 00 7	జ న వరి 2 4 , 2 00 7
पी / ओ रे जि ना लड ग रा हम	పి / ఓ రె జి నా ల డ గరా హం
उसकी अग ली रात के उस छा पे तक	ఇంకా ఆ సోద ాలో చేయ బడ డ ఆ రో ప ణ ల
उस ी जगह पर वापस भे जा ,	అదే చో టు కు పం పి ంచారు ,
ये लोग ना र को टि कस अफ सर हैं .	వీ ళళు నా ర కో టి కస అ ధి కారు లు .
गिर फ ता री जा य ज थी .	అనన ది కను గొ న వచచు .
ओर लै ंड ो	ఓ ర లా ండ ో
मैं ह वाई ज हा ज से फ लो रि डा गया और रे जी ग रा हम के घर पहुँ चा .	నేను ఫ లో రి డా కి విమానం లో వెళళి రె జీ గరా హం ఇంటికి వెళళ ా ను .
और उसने कहा , " मुझे मीक मिल के के स के बारे में कुछ नहीं कहना . "	అతను , " నేను మీక మి ల కేసు గురించి చెపప ాల సింది ఏమీ లేదు " అననా డు .
से क ंड ना ज रे थ मि शन री बै प टि सट चर च	సె క ండ న జా రె త మి షన రీ బా ప టి సట చ రచ
रे व . डॉ . जो . एल . ह ॉ ली सी नि यर , पा द री	రె వ . డా . జో . ఎ ల . హో లీ సీ నియ ర , పా సటర
आ मी न .	ఆమె న .
हाँ , मुझे . . .	సరే , ననను . . .
मैं मीक के लिए परा र थ ना करती हूँ कयोंकि वह एक पिता है ,	నేను మీక కోసం పరా రథ ి సతుననాను , ఎందుకంటే అతను ఒక త ండ రి ,
ऑ फि सर जो न स , ऑ फि सर ग रा हम . . .	ఆ ఫీ సర జో నస , ఆ ఫీ సర గరా హం . . .
अब , इस यू नि ट का उ द देश य बडा होता है .	ఇపపుడు , యూ ని ట కు గం భ ీ ర మెన మి షన ఉంది .
उसने " गलती " नहीं कहा था . " ग ंद " कहा था .	ఆమె " తపపు " అని అన లేదు . " చెతత పని " అ ంది .
उस समय , मैं और रे जी ग रा हम	ఆ సమయం లో , నే న ూ రె జీ గరా హం
कयोंकि ऐसी ही कहा निया ँ मैंने भी बहुत बार बना ई थीं .	ఎందుకంటే ఇ వే క థా ం శ ాలను నేను చాలా సా రలు ఉ ప యో గి ంచా ను .
और यह पूरी तरह स ंग ठ ित है .	అది చాలా దగగర సంబం ధ ము ంది .
पुलिस !	పోలీ స !
वे बस आए और उसे बु री तरह मार ना शुरू कर दिया .	వాళళు వచచి అత నని త నన టం , కొ టట టం పరా రం భి ంచారు .
- वह जिस के लिए आया था उसे मिल गया . - हाँ .	- దే ని కోసం వచచా డో అది దొ రికి ంది . - అవును .
घर एक दम त ह स - न ह स प डा था .	ఇ లలు చి ననా భి నన ంగా ఉంది .
न शी मा वि लि य मस	న ష ీ మా వి లి య మస
और इसके कारण , पुलिस वाले और भी शे र हो जाते हैं ,	అందుకే , అతను సూ పర పర ె డే టర పోలీసు లను స ృష టి ంచా డు
" मैं तुम पर मु क द मा कर ूँगा . मैं देख ल ूँगा . "	" నేను మీ పె కేసు పె డ తాను . ఇది చేసతాను " అంటే ,
मीक की पि टा ई और गिर फ ता री के छ ह म ही ने बाद ,	మీ కను కొ టటి , అ రె సట చేసిన ఆ రు నె లల తరువాత ,
तो यह सू ची फि ला डे ल फ िया पुलिस वि भाग के उन सभी अफ सर ों की है	అయితే ఫి ల డె ల ఫి యా పోలీసు వి భా గం మీక పోలీసు ల క రూ ర త వ ఆ రో ప ణ పె
और वह है पुलिस ऑ फि सर जे र लड गि बस न .	అత నే పోలీసు అ ధి కా రి జె రాల డ గి బ స న .
जो घट ना कर म जे र लड गि बस न ने हमें बताया ,	జర ాల డ గి బ స న మాకు చెపపి న సం ఘ టన ల క థ నాలు
अधि का रि यों से झूठ बोल ना , ये उन कुछ आ रो प ों में से हैं , जो उस में बता ए गए हैं .	మా ద క దర వయ వయా పా రం , అ ధి కారు లకు అబ దధ ం చెపప టం , అది కేవలం జా బి త ాలో ని కొ ంత భా గ మే .
डी ए के द फ तर ने एक वि शे ष सू ची तैयार की ,	డి ఎ కార య ాల యం 6 6 పోలీ స అ ధి కారు ల పే రలు నన
शायद मैंने खबर ों में देखा था कि एक गु पत सू ची है .	నేను దానిని వార త లలో , ర హ సయ జా బి తా గా చూశా నను కుంటా .
रे जी ग रा हम को अनु शा सन सं बं धी आ रो प ों की जा ँच के लिए	రె జీ గరా హం ను పోలీసు బో ర డ ఆ ఫ ఇం క వె రీ , పి బి ఐ ము ందుకు
मुझे समझ नहीं आया कि उस पर मु क द मा कयों नहीं चला .	అతని ని ఎందుకు వి చా రి ంచ లే దో నాకు సప షట ంగా తెలియదు .
तो उसे इस स जा से मु कत होने का अधि कार है .	నే రా నని ర దదు చేయ ొ చచ ని దా వాల ో పే ర కొ ననా ము .
1 1 साल की यह क ठ ि न पर ीक ष ा अब खतम कर दी जाए गी ,	ఈ 1 1 ఏ ళళ క ఠ ి న పరిసథి తులు , అసలు ఏమీ జరగ న టలు గా
और फिर , ऊपर से वह ले ख जो रो लि ंग सट ो न में छ पा था .	వీ ట నని ంటి నీ మి ంచి , రో లి ంగ సట ో న లో వయా సం వచచింది .
उसने कहा , " नहीं . " ऐसी कोई गिर फ ता री नहीं थी जिस में उसे जरा सा भी शक हो , ठीक ?	అతను అననా డు , " లేదు . " అతని ఏ ఒకక అ రె సట ు విషయం లో ఎలా ంటి అను మా నం లేదు , సరేనా ?
जे नी स ब रि ंक ली को ये खेल खेल ना बंद करके यह बकवास बंद करनी चाहिए .	జి నీ స బ రి ంక లీ , ఆమె ఇక ఆట లా డ టం ఆ పే య ాలి , దానిని ద ూర ంగా పా రే య ాలి .
" फिर उसे घर के अंदर घ सी ट कर ले गए और उसके सिर पर वार करते रहे .	" వాళళు అపపుడు అత నని ఇంట లోకి లా కె ళళ ి అతని తల పె కొ డు తూ నే ఉననారు .
फि ली के पू र व ना र को टि कस अफ सर जे फ री व ॉ कर को सा ढ े तीन साल की स जा	మా జీ ఫి ల లీ నా ర కో టి కస పోలీసు జె ఫ రీ వా కర కు 3 1 / 2 ఏ ళళ జె లు శి కష
वह एक धा र मि क सं स था का हि ससा है जिस में वह भगवान के उप देश ों को	అతను ఒక మి ని సట రీ లో ఉననాడు , అతను దేవు ని మాట ఫ లో రి డ ాలో పర జ లకు
फि ला डे ल फ िया के पू र व डी ए से थ वि लि य मस को अधि कत म स जा मिली है .	మా జీ ఫి ల డె ల ఫి యా డి ఎ సే థ వి లి య మస కు శి కష అత య ధి కంగా ఉంటుంది .
साथ ही , जब हम पू र व अफ सर ों तक पहुँच ने की कोशिश कर रहे थे ,	అదే సమయం లో , మేము మా జీ అ ధి కారు లను కల వాలని పరయతని ంచిన పపుడు ,
" वह सा इ किल पर ट व ं टी से क ंड ए ंड जै कस न के न ु क क ड तक गया . "	" అతను బె క మీద వచచి 2 2 వ మరియు జా కస న మ లు పు వెపు వెళళ ా డు . "
आज का खु ला सा पिछ ले साल की गिर फ ता री के कारण सामने आया .	ఆ రోజు చేసిన సో దా గ త సం వ త సరం అ రె సట ు కారణ ంగా చేసి ంది .
हम सोच रहे थे , " रे जी ग रा हम की कहानी कया हो सकती है ?	మేము , " రె జీ గరా హం నే ప థ యం ఎలా ంటి ది ? " అని అను కుననా ము .
जैसे ही मैंने फोन र खा , मैंने मु ड कर अपनी बी वी से कहा ,	ఫోన పెటట ే సిన వెంట నే నేను నా భా రయ వెపు తిరిగి అననా ను ,
मीक मिल - ई गल स ने सु पर बोल में मेरा साथ दिया . . .	మీక మి ల - ఈ గి లస ' డ రీ మస అ ండ నె ట మే రస ' వి ని పి ంచి . . .
ऊपर वाले कम रे से पुलिस वाले को कहते सुना , " बि ंग ो . "	కింద నుంచి , పోలీసు పె కి " బి ంగ ో " అని అన టం వి ననాను .
वि लि य मस ने अपनी सामने वाली जे ब से बंद ूक निका ली	వి లి య మస తన ప యా ంటు ముందు నుంచి న లల తు పా కీ తీ శా డు
यह मेरे लिए परे रण ा दा य क था कि उन खिला डि यों ने	ఆ క రీ డా కారు లు అతనికి స ందే శా నని అ ంది ంచ టానికి
पुलिस अफ सर ग रा हम ने अपने झूठ को सवी कार किया .	పి / ఓ గరా హం తను అబ దద ం చెపపి న టటు ఒ పపు కుననా డు .
हम जानते थे , गि बस न की अपनी परे शा निया ँ थीं .	గి బ స న కు తన సమసయ లు తన కు ఉననా య ని మాకు తెలుసు .
भर ष टा चार त ह की का त ने किया पुलिस की ओर इ शा रा	అవి నీ తి దర యా ప తు పోలీసు లను చి కకు లలో పడ ే సింది
इस तरह मि टा दी जाए गी मान ो कुछ हुआ ही न था .	తు డి చి పెటటు కు పో తా య ని కొతత ఆ శ లు కలి గి ంచా యి .
दूसरे लोगों के मु क द मे फिर शुरू हो रहे हैं .	ఇ తర వయ క తులు కొతత వి చా రణ లు ఎదు ర కొ ంటుననా రు .
खुद को बचा ने का सबसे अचछा तरी का होता था	మీ ట రా కస తెలియ కుండా చేయ టానికి ఉ తత మ మా రగ ం
" मैं मीक मिल की गिर फ ता री में शा मिल था . "	" నేను మీక మి ల అ రె సట ు లో భా గ సతు డి నే " అని .
मे न सा डी न प तर कार - फि ला डे ल फ िया इन क वा यर र	మెన షా డీ న వి లే కరి - ఫి ల డె ల ఫి యా ఎ ంక వె ర ర
मैंने पुलिस वाले से पूछ ा , " अपने बे टे से बात कर सकती हूँ ? " उसने कहा , " नहीं . "	నేను పోలీసు ను అడి గా ను , " మా అబబా యి తో మాటలాడ వచచా ? " అని , అతను " లేదు " అననా డు .
और वह थी . . . हम सब उस इ ला के में गए .	అది . . . మే మ ంద రం ఆ పరా ంతా నికి వెళళ ా ం .
कुल जा ँच परि ण ा म / अनु श ं सा दो ष ी / बर खा सत गी	సమ గర కను గొ నన వి / సి ఫా ర సు నే రం / కొ టటి వే త
और जि ला अ ट ॉर नी के द फ तर से पता चला है	గరా హం వి శ వ స నీ యత అను మా నా స పద ంగా ఉనన ందు న
तो , हम उस ी के लिए परा र थ ना कर रहे हैं .	కాబటటి మే ం దాని కోసం పరా రథ ి సతుననా ము .
शु रु आत 1 1 से 2 3 म ही ने की स जा से हुई थी , जो बढ कर करी ब 1 0 से 1 2 साल हो गई .	అది 1 1 నుంచి 2 3 నె లల తో మొద ల యి , తరువాత దా దా పు 1 0 నుంచి 1 2 ఏ ళళు అయ యి ంది .
सारे अफ सर ों को दो ष मु कत कर दिया गया .	అ ధి కారు లు అందరూ నివ ృ తతి చేయ బడ డా రు .
तो अब हम सा उ थ ट व ं टी से क ंड पर हैं .	ఇపపుడు మనం ద కషి ణ 2 2 వ వీ ధి లో ఉననా ం .
यहाँ तक कि जब उस पर आ रो प लगा ए गए ,	అ రె సట ు రి కార డు లు కూడా చూపి సతునన ది ,
जिस में 6 6 पुलिस अफ सर ों के नाम हैं .	ఒక పర త యే క జా బి తాను త యా రు చేసి ంది .
और हमारे साथ बहुत से अ हम लोग थे	మాకు మా చు టట ూ చాలా ముఖ య మెన వాళళు
अब चीजें कुछ बेहतर होने लगी हैं .	ఇక అతనికి అన నీ అను కూ లి సతుననా యి .
और पुलिस वाले , हमें रो क रहे थे .	పోలీసు లు మమ మ లని అడ డు కుంటుననా రు .
हम देखना चाहते थे कि अफ सर ों ने अ दा ल ती का ग जा त ों और कट घ रे में	మేము అ ధి కారు లు కోర టు పే పర లలో మరియు బో ను లో వారు వి వరి ంచిన టటు గా
जब उसकी मौ त हुई , तो लगा , मान ो मेरा एक हि ससा मुझसे दूर हो गया .	ఆమె చని పోయి నపపుడు , నా లో ఒక భా గా నని కో ల పోయి న టటు అనిపి ంచింది .
यह जान ने के लिए कि पुलिस वाले मेरे भाई को कयों मार रहे हैं ?	ఎందుకంటే ఈ పోలీసు లు ఎందుకు మా సోద రు డిని అలా కొ డు తుననారు ?
पर वह कहानी मैंने नहीं लि ख ी .	అది నేను ఇపపుడు రా సిన ది కాదు .
उनके पास मेरा पै सा है , भाई !	వాళళు నా డబబు లు తీసు కుననా రు !
और , जैसे , कुछ लोग उस समय बस पुलिस की गाडी चला रहे थे .	ఉ దా హ రణ కు , అందు లో కొ ంద రు కేవలం పోలీ స వా హ నం న డు పు తుననారు .
और जब पीछे से अंदर गए , मीक हमें एक कम रे में मिला .	మేము వె నుక నుంచి వెళళి నపపుడు , మీక గ ది కను గొ న గ లి గా ం .
मैंने कहा , " मुझे नहीं पता था कि वह मीक मिल है . "	నేను చెపపా ను , " నాకు అతను మీక మి ల అని తెలియదు " అని .
मैं बहुत खुश हूँ और बस अब यह देखना है कि कया होने वाला है , समझ रहे हो न ?	నేను సంతోష ంగా ఉననాను , ఏమి జరుగు తు ందో నని వే చి చూ సతుననాను , నా భా వం అరథ మ యి ందా ?
बहुत सी कोशिश ों के बाद हमें एक पुलिस अफ सर मिला ,	చాలా , చాలా పరయత నా ల తరువాత , మాకు ఒక పోలీసు అ ధి కా రి
कि य दि उस घर में पै सा है , वह भी बहुत सा रा पै सा ,	ఒక వే ళ ఆ ఇంట లో చాలా డబబు ఉ ండు ంటే , చాలా ఎకకువ డబబు ,
जो यह है कि कया मीक ने अफ सर ों पर बंद ूक ता नी थी ?	అంటే , అసలు మీక ఈ అ ధి కా ా రు లకు తు పా కి గురి పెటటా డా ?
पा पी वि लि य मस मीक का बेटा	పా పీ వి లి య మస మీక కొ డు కు
न शी मा वि लि य मस मीक की बहन	న ష ీ మా వి లి య మస మీక సోద రి
फि ला डे ल फ िया पुलिस वि भाग	ఫి ల డె ల ఫి యా పోలీసు వి భా గం
अभी भी हमारी जज वही है .	ఆ నయాయ మూ ర తి ఇంకా ఉననాడు .
जब तक मैं सामने के दरवा जे से निक ला , वे लोग र मीक को अस पता ल ले जा रहे थे .	నేను ముందు తలు పు దగగర కు వెళళ ే స రికి ర మీ కను ఆ సు ప త రికి తీసు కె ళ ు తుననారు .
ऑ फि सर ग रा हम और ज ॉन सन ने दा वा किया कि वि लि य मस ने उन पर बंद ूक ता नी थी .	అ ధి కారు లు గరా హం , జా నస నలు వి లి య మస తమ పె కి తు పా కి గురి పెటటా డని ఆ రో పి ంచారు .
कई पुलिस वाले हम से बात करने से इं कार कर दे ते थे .	చాలా మంది పోలీసు లు మాటలాడ టానికి ని రా కరి ంచారు .
और उसे ऑ फि सर ग रा हम और ज ॉन सन पर ता न ते नहीं देखा .	అ ధి కారు లు గరా హం , జా నస న లకు గురి పెటట గా చూడ లేదు .
मेरा नाम जे र लड गि बस न है . यहाँ दि ए त थ यों की मुझे वय क ति गत जानकारी है ,	నేను జర ాల డ గి బ స న . ఇ ందు మీద ట వా ంగ మూ ల ం ఇ చచి న వా సత వాల పె నాకు అవ గా హ న ఉంది ,
फि ला डे ल फ िया के छ ह ना र को टि कस पु लि सवा लों के क थि त भर ष टा चार का खु ला सा .	ఆ రుగు రు ఫి ల డె ల ఫి యా నా ర కో టి కస పోలీసు లు అవి నీ తి ఆ రో ప ణ ను బ టట బయ లు చేశారు .
वि लि य म बे ली मीक का क जिन	వి లి య మ బె యి లీ మీక క జి న
आ ंत रिक माम लों के वि भाग दवा रा एक और छा न बी न से	అంత రగ త వయ వ హా రాల వి భా గం జ రి పి న త దు పరి పరి శ ో ధన లో
" उसने यह कयों किया था ? उसने वह कयों किया था ? "	" అతను ఇలా చేశా డు కదా ? అతను అలా చేశా డు కదా ? "
मीक के बहुत से दोसत हैं , और हर कोई कह रहा है ,	మీ కకు చాలా మంది సనే హి తులు ఉననారు , వాళళ ంద రూ ,
हम छा पा मार ने वाली जगह से दो बल ॉ क दूर रु के .	మేము లకష య పరా ంతా నికి రెండు వీ ధ ు ల అవ తల ఉననా ము .
य दि वि लि य मस ने ऐसा किया होता , तो अफ सर ों ने उसे गोली मार दी होती .	ఒక వే ళ వి లి య మస అలా చేసు ంటే , అ ధి కారు లు అత నని కాల చి చం పే సి ఉండే వాళళు .
ई गल स की जी त हुई , 4 1 - 3 3	ఈ గి లస గె లి చా రు , 4 1 - 3 3
