ल कष य के साथ लौट ूं तो नहीं .	లకష యానని తీసు కె ళ ి తే చం ప రు .
तुमहारा सबसे प वि तर कर त वय है सं घ की रकष ा करो ,	సో దర జా తి ని సం ర కషి ంచడం నీ అ తి ప వి తర మెన బాధ యత ,
उसके बाद सबसे प वि तर कर त वय है मेरी , या नी यो द धा टा इट स की रकष ा करो .	ఆ తరువాత ననను , అంటే సె ని కు డు టె ట స ను ర కషి ంచడం నీ అ తి ప వి తర బాధ యత .
टी	టీ
बात सुनो .	హే , చూడు .
जो भी चा हें .	ప టటి ంచుకో ను .
मै क सि मस .	మా క సి మస .
यह . . .	థా . . .
थे डि य स !	థా డి య స !
यकीन नहीं होता तुमसे बरा ंड लिया .	నీ తో ము దర వే యి ంచడం నేను నమమ లేను .
थे डि य स .	థా డి య స !
थे डि य स !	థా డి య స !
थे डि य स !	థా డి య స !
नहीं !	వదదు !
सुनो , मुझे यहाँ से निका लो गी पलीज ?	హే , ననను ఇ కకడి నుంచి బయట పడ ే సతా వా ?
वह तुम ही थे न ?	అది నువవే , కదా ?
वहाँ , फि ली में ?	అపపుడు ఫి ల లీ లో ?
हाँ , वहाँ . . . मैं ही था .	అవును , అది . . . అది నేనే .
याद है वह बं दा जो मेरे साथ था ?	నాతో వదిలే సిన అతను గుర తుననా డా ?
सच कह ता हूँ . पलीज .	ననను నమ ము . దయచేసి .
मैं लूसी हूँ .	నా పేరు లూ సీ .
एक मै न यु अ ल ऑ प शन है .	ఓ మా న వీ య ఆ ప షన ఉంది .
- तुमहें बस . . . - मिल गया .	- నువవు . . . - చూ సు కు ంట ాల ే .
अरे .	హేయ .
शायद लॉ ग बदल दि ए हों .	బహుశా ఆ లా గ లు తపప ే మో .
हमें पता है अंदर कया है	అకకడ ఏ ము ందో మాకు తెలుసు
न ॉर मन .	నో ర మన .
चे सटर .	చె సటర .
तुम दोनों कहाँ थे ?	ఇదద రూ ఎ టు వెళ లా రు ?
र ै ड अ वे	రా డ ఎ వే
नहीं .	లేదు .
देखो .	చూడు .
एक दिन ऐसा आए गा जब हमें मौ का मिले गा कि हम ध र ती पर फिर आ बाद होंगे	ఏదో రోజు న భ ూ మి ని మను ష ు లతో తిరిగి ని ం పి , నయా యానని మరియు నా గ రిక తను
टर ै कर	ట రా కర
सुनो , एक मदद करो गे ?	హే , ఓ సాయం అడ గ వచచా ?
बताओ गे पिछ ले 2 00 साल ों में कया - कया हुआ ?	గ త 2 00 ఏ ళ లలో ఏం జరిగి ందో నాకు చెపప గల వా ?
लूसी .	లూ సీ .
{ \ an8 } . . . बे ट टी पी यर सन को वॉल ट का ओ वर सि यर चु ना गया है .	{ \ an8 } . . . వాల ట పర య వే కష కు ర ాలి గా బె టీ పి య రస న ఎ ం పి క య యా రు .
नहीं .	లేవు .
नहीं .	లేవు .
अपनी बंद ूक मुझे दो .	నీ తు పా కీ ఇ టు ఇవ వు .
हम उस ओर आ रहे हैं .	మీ వెపు న డు సతుననా ం .
कया बकवास कर रही हो ?	అసలు ఏం వా గు తుననావు ?
नर भ कष ी .	ఫీ ండ లు .
तुमहें गोली लगी है .	నీకు తూ టా త గి లి ంది .
बस एक ख र ों च है .	ఓ గ ీ త పడి ంద ంత ే .
बे ट टी को वो ट दिया .	బె టీ కి ఓ టు వే శా ను .
सट े फ ?	సట ె ఫ ?
यह तो . . . सच नहीं है न ?	ఇది . . . నిజం కాదు , కదా ?
उसे ह क का दिन कहते हैं , यही हमारी परे रण ा है और . . .	అది పు న రు దధ రణ ది నం , అదే మా అంద రికీ పరే రణ , ఇంకా . . .
आओ .	పద .
देखो .	చూడు .
अरे .	హేయ .
लूसी !	లూ సీ !
लूसी .	లూ సీ .
लूसी .	లూ సీ .
मे डि कल सा मान	వె దయ సర ఫర ాలు
इसलिए मैं पु नर वास अ भ िया न की घ ो ष ण ा कर रही हूँ .	అందుకే పు న రా వా స పర చా రా నని నేను పర క టి సతుననాను .
बे स पर लौट कर सब को दिखा ऊँगा , उनके चे ह रे देख ने ला य क होंगे	నేను తవర గా బ ే స కు వెళలి , లకష య ంతో పాటు మనం తిరిగి వెళ లా క
मतलब , मैं ऐसी दुनिया से हूँ जहाँ कोई सबसे बु री चीज	అంటే , నీకు ధనయవాదాలు చెపప డం మరి చి పో వ డ మే , నీకు చేయ గల
मेरे सा थी ने ऐसी चीज चु रा ई जो सं घ के लिए अ हम है .	సరే , సో దర జా తి కి కీ ల క మెన ది నా సి పా యి దొ ం గి లి ంచా డు .
तो 2 00 साल चल ने वाला सं यो ग एक ना रे के कारण है ?	2 00 సం వ త సర ాల కా క తా ళ ీ యం ఓ ని నా ద ంతో అనుకుంటా వా ?
कयोंकि हम एक वॉल ट में घु से थे जहाँ ला श ें थीं .	ఎందుకంటే శ వాల తో ని ండి న వాల ట లోకి వెళలి వచచా ం .
ए ं करे ज की ल डा ई के बाद से ना ने इसे बना या .	యా ంక రే జ యు దధ ం తరువాత సె న యం ఇ వి వాడు తోంది .
इन हें ख तर ों को रो क ने के लिए अलग किया था .	పరమా ద ాలను ని వారి ంచ డానికి వి డి గా ఉ ంటుననా ం .
मुझे लगा जैसे कोई ना व हमारी ओर आ रही हो .	ఇది ఓ ర కంగా పడ వ మన వెపు రా వడం లాంటి దే మో .
हैं क म ॅ क ली न नि र वा चि त ओ वर सि यर - 3 1 से 3 3	హా ంక మె క లీ న 3 1 నుండి 3 3 - గె లి చి న ఓ వర సీ ర
मुझे बस पिछ ले 2 00 साल ों का पता करना है .	నాకు గ త 2 00 ఏ ళల విషయం లో సాయం కావాల ంత ే .
नए कै ली फो र निया ग ण राज य की पहली राज धा नी	న యూ క ాలి ఫో రని యా రి ప బ లి కకు తొ లి రా జ ధా ని
मेरी माँ के बाद उनका पि प - बॉ य कहाँ गया ?	మా అమమ చని పోయా క , తన పి ప బా య కు ఏ మెంది ?
रे ज मै क फी - बे ट टी पी यर सन - व ु डी थ ॉ मस	ఒకటి ఎ ంచుకో ండి రె జ - బె టీ - వు డీ థా మస
कया कर सकते हैं ? कुछ पो सटर लगा ते हैं	నువవు ఏం చేసతా వు ? కొనని పో సట రలు పె టటి
मुझे ली डर शि प पर सवाल नहीं उठा ना था .	మీ నా య క త వం పె పర శ న కాదు , పర య వే కష కా .
इं जी निय रि ंग की कि ता ब ों में देखा है ,	ఇ వి పా త ఇం జి నీ రి ంగ ప తర ాల లో చూశా ను ,
- आ लू बो रहे थे . - आ लू बो रहे थे .	- టా టో స నా టు తుననాం . - టా టో స నా ట డం .
हाँ , पर पता नहीं उस में है कया .	హా , కానీ అందు లో ఏ ము ందో తెలియదు .
फिर लो कत ं तर अपना काम करता है .	పర జా సవా మ యం త ని పని చేయ ాల ంటా వు .
इसी लिए यहाँ आई हूँ . मतलब , इसी लिए यहाँ से गु जर रही हूँ .	అందుకే ఇకకడ కు వచచా ను . అంటే , అందుకే ఈ దా రి లో వెళ ు తుననాను .
- डे वी , कोई बात नहीं . - हाँ .	- కష ట పెటటు కో కు , డే వీ . - హా .
टा इट स और थे डि य स ! द टी बॉ य ज !	టె ట స ఇంకా థా డి య స ! టీ బా య స !
तुमने उसे अंदर तक ची र दिया . सा री आ ंत ें बाहर आ गई थीं .	దానిని చ ీ ల చి పడ ే శా వు . చె లలా చె దు రు గా దాని పొ టట భా గ ాలు .
हम ला वर ों ने बहुत कुछ तो डा .	రె డ రలు చాలా నా శ నం చేశారు .
मेरे दिन ख रा ब चल रहे हैं .	ఈ వా రం నాకు కష ట ంగా ఉంది .
और सं घ के पास ले जाएँगे .	నీ సో దర జా తి దగగర కు పో దాం .
शे डी सै ंड स प ब लि क ला इ ब रे री	ష ే డీ శా ండ స పర జా గ రం థ ాల యం
चे ता व नी : कुछ गिर सकता है	హె చచ రిక : పడి పో యే వ సతు వు లు
और यह देख ते हुए कि सा री दुनिया को वह सिर चाहिए ,	ఇపపుడు , ఈ భ ూ మి మీద పరతి ఒకక రూ దాని వెంట బడ డం చూశా క ,
तुम लोग यु द ध के पहले की तक नी कों का इस ते माल करके वै सी चीजें इ कट ठा करते हो	అయితే , యు దధ ానికి పూర వ సా ం కే తి క తను ఎవరూ ఉ ప యో గి ంచ కుండా , యు దధ ానికి ముందు
अंदर कुछ भी हो सकता है .	అకకడ లోప ల ఏదెనా ఉండ వచచు .
मुझे उसके पीछे जाना है .	నేను తన ను వె ం బడి ంచాలి .
चिंता की बात नहीं है , तो फु स फु सा कयों रहे हैं ?	ఇ ద స లు ఆ ందో ళ న క రం కా కపోతే , ఎందుకు మన గు స గు స లు ?
इसे दवा ओं की जरूरत है .	నీకు ఏదెనా మ ందు వే య ాలి .
यह एक बहुत ब डे मो जे जैसा है . मतलब , वह है कया ?	ఇదే దో పెదద సా కస లేదా అలా ఉంది . అంటే , ఏంట ది ?
बे स पर लौट ने से पहले ,	మనం బ ే స కు వెళ లే ముందు ,
ये लोगों को खा ते हैं .	మను ష ు లను తి నే మను ష ు లు .
बाद में बात करते हैं .	మనం తరవాత కొ న సా గి దదాం .
तुम बे हो श हो गई , तो हम दोनों मा रे जाएँगे .	నువవు సప ృ హ కో ల పోయా వ ంటే , మనం ఇదద రం చని పో తా ం .
मुझे लगा मैं तो गया .	చచ చి పోయా నని అను కుననా .
हमें ध ो खा दे रहे हो ?	మమ మ లని మో సం చే ద దా మ నా ?
मुझे पता नहीं था वॉल ट में लोग रह ते हैं .	ఆ వాల ట లలో పర జ లు నివ సి ంచడం నా కస లు తెలియదు .
रॉ बर ट ओ ल सन नि र वा चि त ओ वर सि यर - 3 1 से 3 3	రా బర ట ఓ ల సె న 3 1 నుండి 3 3 - గె లి చి న ఓ వర సీ ర
त भी तो पूछ रहा हूँ .	అందుకే అడుగు తుననాను .
हमें वह सिर लेना है .	మనం ఆ త లను పొ ంద ాలి .
अब भी बहुत गर म है .	అది ం కా వే డి గా ఉంది .
{ \ an8 } ह ॉ थ ॉर न मे डि कल पर यो ग शा ला वॉल ट - टे क कं प नी का वि भाग	{ \ an8 } హా థ ో ర న మె డి కల ల యా బ రే ట రీ స వాల ట టె క కార పొ రే షన వి భా గం
और बे ट टी एक बार ओ वर सि यर रह चु की है .	బె టీ గ తం లోనే పర య వే కష కు ర ాలి గా చేసి ంది .
जैसे सभी को ऐ प पल पा ई से जे लो के क जयादा पसंद कयों है .	అంద రికీ ఆ పి ల పె కంటే జె లలో కే క ఎందు కి షట మో కూడా అడ గ వచచు .
मुझे यहाँ मत छोड ो !	నన ని కకడ వదిలే య కు !
यही कर सकता है कि धनयवाद नहीं क हे .	అ తి పెదద చె డు అనే చో టు నుంచి వచచా ను .
कहा व त तो पता होगी .	ఓ సా మె త తెలుసు గా .
स भ य ता शुरू करेंगे .	తిరిగి ఆ రం భ ంచ డ మే .
लगा मैंने कर दिया . मुझे सच में लगा .	నా దగగర అది ఉ ంద ను కుననా . నిజంగా నే .
- अगर कोई पू छे कहाँ थे . . . - तो मेरा दिल ट ू ट जाएगा .	- మన ఆ చూ కీ ఎవరెనా అడి గి తే . . . - నాకు గు ండ ె పో టు .
मुझे बरा ंड करें .	నాకు ము దర వే య ాలి .
ठीक है , हि ल ना मत .	సరే , అలాగే ఉ ండు .
पता तो चल जाएगा .	వాళలు కని పె డ తారు .
यार , आपका वो ट है .	హేయ , అది నీ ఓ టు .
बाद में ले ल ेंगे .	ఆ తల ఆగు తుంది లే .
और उससे पहले के 3 2 0 साल ों का अ मे रि की इ ति हा स भी .	ఇంకా దానికి ముందు 3 2 0 ఏ ళల పాటు అ మె రి కా చ రి తర కూడా .
और हम तब तक चल ते र हें गे जब तक वह रो श नी सत ह तक नहीं पहुँच जाती .	ఆ కా ంతి ని ఏదో ఓ రోజు న ఉ పరి తల ం మీద కు తె చ చే వర కూ మనం దానిని మో సతా ము .
और यो द धा टा इट स ?	సె నిక టె ట స ఎకకడ ?
एक स बे ट टी पी यर सन	ఎ కస బె టీ పి య రస న
इं टर - वॉल ट आर का इ व	ఇంట ర - వాల ట ఆర కె వ
तुमहारे पास है ?	మీ దగగర ఆ యు ధ ాలా ?
तो ऐसा करते हैं .	మనం ఇలా చే దదాం .
तुमहें सं घ में यही बता ते हैं ?	నీ సో దర జా తి లో నీకు అదే చెపపా రా ?
लि खा है इसे बाहर से खो ला था .	బయ టి నుంచి తె రి చా రని చూ పు తోంది .
वह मर चुका है .	అతను చని పోయా డు .
पा नी का सं कट और वो कै दी . . .	నీ టి సం కష ో భ ం , ఇంకా ఖ ె దీ లు . . .
इ क ती स से तै ं ती स	3 1 నుండి 3 3 కి
इसमें तो टे म पर ड ला इ नि ंग भी है , मतलब . . .	వీ టి లో టె ం పర డ లె ని ంగ ఒకటి ఉంటుంది , అది . . .
बात सं घ की है .	అది సో దర జా తి .
{ \ an8 } . . . याद रख ें आज हमारे वॉल ट का भ वि ष य त य होगा .	{ \ an8 } . . . ఇ వాళ అనే ది మన వాల ట కు భ వి త అని గురతు ంచుకో ండి .
मैं बच चा था तब ब म गि रे थे .	బా ం బు లు పడి నపపుడు చినన ో డిని .
हैलो , वॉल ट 3 3 .	హలో , వాల ట 3 3 .
ताकि हम साथ में ठीक हो सक ें .	అలా మనం ఉ మమ డి గా కో లు కో గల ం .
र च ना त म क पर य वे कष क अ शो क ब कष ी	కరి యే టి వ సూ పర వె జర శి రీ ష దర భా
मेरे पिता भी यही कहते थे .	నా నానన కూడా అదే చెపపే వారు .
आने के लिए सभी को धनयवाद .	మీ రా కకు అంద రికీ ధనయవాదాలు .
- उनहोंने कहा ह थ िया र नहीं हैं . - झूठ .	- తమ దగగర ఆ యు ధ ాలు లే వ ననా రు . - అది అబ దధ ం .
तुमहारा नाम ?	నీ పేరు ఏంటి ?
मुझे विश वय ु द ध का पता है , ब म गिर रहे थे ,	నాకు మ హా యు దధ ం , బా ం బు లు పడ డం తెలుసు ,
तुम दवा के बारे में झूठ बोल सकते थे , पर नहीं बो ला .	మ ందు విషయం లో అబ దధ ం చెపపి ఉండ వచచు , అలా చేయ లేదు .
हम इस जगह को साथ देख ें .	మనం ఈ చో టు ను కలిసి చూడ డం .
सट ै ंड बा य मो ड	సటా ండ బె మో డ
मैं बे हो श थी तब मुझे मार सकते थे ,	నే న కకడ పడి పోయి ఉండ గా ననను చం పే య వచచు ,
नर भ कष ी मतलब ?	ఫీ ండ ఏమి టి ?
हैलो , न ॉर मन .	హలో , నో ర మన .
हुआ कया था ?	ఏం జరిగింది ?
इस दुनिया में भरो सा करना मुशकिल है .	ఇకకడ నమమ కం తవర గా రా దని అరథ మెంది .
च श मा और पू रे श री र वाला ?	అ దద ాలు , ఆ శ రీ రం అంతా ?
टर ै कर से तुमहारे सा थी को ढूँढ ल ेंगे , उससे सिर ल ेंगे	నా ట రా కర ఉ ప యో గి ంచి , నీ సి పా యి ని పటటు కు ని , త లను తీసుకు ని ,
मुझे लगता है सं कट के इस समय में हमें किसी अनु भ वी वय क ति की जरूरत है .	సం కష ో భ ం సమయం లో , అను భ వం గల వారి ని ఎ ంచుకో వాలని నాకు అనిపి సతోంది .
जी ने का अचछा तरी का है .	మంచి గా బ త క డం లా ఉంది .
{ \ an8 } बे ट टी 3 1 से 3 3	{ \ an8 } బె టీ 3 1 నుండి 3 3
- कया ? नहीं . - ठीक है !	- ఏంటి ? లేదు . - సరే !
तीन की गि न ती पर हाथ ऊपर करना .	మూ డు లె కకి ంచ గానే చే తులు ఎ తతు దాం .
व ु डी का साथ द ें भ वि ष य का ओ वर सि यर	భా వి ఓ వర సీ ర వ ూ డీ తో పని చేయ ండి
उनहोंने वॉल ट 3 2 में वही तो किया .	వాల ట 3 2 లో కూడా వాళల దే చేశారు .
मेरी माँ का पि प - बॉ य हम ला वर ों को कैसे मिला ?	మా అమమ పి ప బా య రె డ ర ల దగగర కె లా చే రి ంది ?
बे ट टी को वो ट द ूँगा .	నేను బె టీ కి ఓ టే సతాను .
माँ मुझे उस रो श नी में खेल ने ले जाती थी	ఆ లె టు కింద ఆ డి ంచే ందుకు మా అమమ తీసు కె ళ ి తే ,
बस पिछ ले 2 00 साल , बडी खबर ें .	గ త 2 00 ఏ ళల వర కే , చ క చ కా చెపప మని .
वॉल ट 3 1 यहाँ से कैसे अलग है ?	ఇ కకడి కంటే వాల ట 3 1 లో తే డా ఏంటి ?
हो सकता है अगर . . . मतलब , बता द ें तो .	కా వచచు , ఒక వే ళ . . . అంటే , తెలి సే పని లేదు .
- लगता था काम ब ने गा ? - सिर तो मिल गया था .	- అలా జరుగు తు ంద నా ? - నా దగగర తల ఉంది .
किसी कारण से गु पत मत दा न है .	అందుకే పర ె వే టు బ ూ త లలో ఓ టే సతా ం .
कै ली फो र निया ग ण राज य का नाम नहीं सुना ?	న యూ క ాలి ఫో రని యా రి ప బ లి క గురించి విన లేదా ?
न ु का को ला	న యూ కా లూ కా
तुमहारे पिता के साथ .	నేను ఇంకా మీ నానన .
सब ठीक है .	పర వాలేదు .
अजीब नहीं लगता कि हम वॉल ट 3 1 से ही ओ वर सि यर चु न ते हैं ?	మనం ఎపపుడూ వాల ట 3 1 ను ంచే పర య వే కష కు ని ఎ ంచుకో వడం వి ంత గా లేదా ?
जब वे हमें टा र गे ट के साथ लौट ता देख ेंगे .	అంద రి మొ హ ాలు చూడ ాలని ఉ త సా హ ంగా ఉంది .
सट े फ , मैं तो जा ही रहा था .	సట ె ఫ , ఇ పపుడే బయ లు దే రు తుననాను .
फ ॉल आ उ ट पर पिछ ली बार	ఫ ాల ౌ ట ఇంత కు ముందు
जब मैंने गोली मा री , लगा मैंने कर दिया .	నేను కాల చా క , సా ధి ంచా నని భా వి ంచా ను .
