तो मैं नीचे गई , वहाँ किसी के साथ उसका मु का ब ला हो रहा था .	అందుకే అ కకడికి వెళళ ా ను , అతను ఎవరి తో నో గొ డ వ పడు తుననా డు .
और अगर जज ब रि ंक ली जै सी जज मिल जाए ,	నీకు జ డజ బ రి ంక లీ లాంటి జ డ జి దొ రికి తే ,
तो हम मस ती कर सकते हैं और म जे दार चीजें कर सकते हैं ?	అయితే చాలా సర దా గా గ డు పు తా ము , చాలా సర దా ప ను లు చేసతా మ నా ?
मैंने अपने भ ती जे से झूठ बो ला और उससे कहा कि उसके पिता कॉ ले ज में हैं ,	నేను నా మే న లలు డి కి అబ దధ ం చెపపా ను , తన కి వాళళ నానన కాల ే జీ లో ఉననా డని చెపపా ,
और मीक और मैंने काफी लं बी बात ची त की .	నే న ూ మీక చాలా సే పు మాటలాడు కుననా ము .
या उ त तरी फि ला डे ल फ िया में ब डे हुए हों , तो वहाँ मर द ों की ता दा द बहुत कम थी .	లేదా ఉ తత ర ఫి ల డె ల ఫి యా ాలో 8 0 లలో పె రిగి తే , అకకడ అసలు మ గ వాళళు ఎవరూ లే రు .
या शायद बाहर जाकर छो टी बह नों के लिए खाना जु टा ने के रा स ते खो ज ने पडे हों ,	లేదా వాళళు బయటకు వెళళి వాళళ తమ చె ల లె ళళ ను పో షి ంచే మా రగ ం కను గొ నా లే మో ,
कई लोग हैं जिन के परिवार ों में मीक मिल जैसे लोग थे .	మీక మి లలా ంటి వారు చాలా మంది వాళళ కుటుం బ ాల లో న ూ ఉననారు .
शायद उनहोंने साल की सौ रात ें भ ू खे रह कर का टी हों गी ,	వాళళు బహుశా సం వ త సరం లో 1 00 రా తరు లు ప సతు లు ఉ ండి ఉంటా రు ,
कयोंकि उनहें अपने बच चों को खिला ना होता है , पर वह मेरे पिता की सोच थी ,	ఎందుకంటే వాళళు వాళళ పిలల లను పో షి ంచుకో వాలి కానీ అది మా నానన ఆలోచ న ,
जब पुलिस वाले लोगों को बंद ूक से मार ते हैं , यह बहुत बुरा होता है .	పోలీసు లు జ నా లను తు పా కు లతో చం పి తే , మీకు తెలుసు , అది దారు ణ మెన విషయ మని .
वह हमेशा कह ता था , " मैं बहुत बडा आदमी बन ूँगा . "	తను ఎపపుడూ " నేను గొపప వాడిని అవు తాను " అని అనే వాడు .
गया रह - न शे का सा मान रख ना बा रह - आकर ा म क मार पी ट	1 1 . మా ద క దర వయ సా మా గ రి కలి గి ఉ ండు ట 1 2 . తీ వర మెన దా డి
को कीन बे च ना . . . सब को पता था मैं को कीन नहीं बे च ता	కొ కె యి న అమమ టం . . . నేను ఎ పపుడు కొ కె యి న అమమ లేదు
अब मैं द कष ि ण ी फि ली में घ ू म ता था , और रात ों को भी बाहर रह ता था .	నేను ఇపపుడు ఫి ల లీ బె ట ఉ ంటుననా ను రాతరి ళళు అంద రి తో కలిసి ఉ ంటుననా ను .
मुझे कभी नहीं लगा कि ग री ब हूँ .	నా కే నా డ ూ పే ద వాడి నని అనిపి ంచ లేదు .
और जब कोई करे बद त मी जी तो सबसे पहले बाहर आए बंद ूक	ని గగా నినను అ గ ౌ ర వ పరి సతే గ న నీ మొదటి పరతి సప ంద న
पर हम मना नहीं करते थे कयोंकि उसके पास रह ने की जगह नहीं थी .	కానీ అత నని ఉండ ని చచా ము ఎందుకంటే అతనికి ఉండ టానికి ఇం కే చో టు లేదు .
मुझे भाग ने तक का मौ का नहीं मिला . उनहोंने मुझे ज मी न पर प ट क दिया .	నాకు పా రి పో వ టానికి అవకా శం దొ రక లేదు . వాళళు ననను పటటు కుననా రు .
" हमें लू टा जा रहा है . अब हमें अ गवा करेंगे . "	" మమ మ లని దో చు కుంటుననా రు . ఇపపుడు అ ప హ రి సతుననారు . "
मैं बो ला उन बै ंड ों के लिए कर दो	నే న ది బ యా ండ కొ ర కు చె ద దా మ ంటా ను
तुम हम सब के साथ गलत करते आए हो ,	మీ రం తా మా తో త గా దా పడు తు ంటా రు ,
पता है न कि मैं मर चुका होता या कम से कम वे मुझे गोली मार दे ते या गोली चला ते .	నేను చని పో యే వాడిని లేదా , ననను కాల చే వారు , లేదా నా వెపు కాల పు లు జ రి పే వారు .
नया य पर ण ा ली बहुत से अफ री की - अ मरी की लोगों के लिए	చాలా మంది ఆ ఫ రిక న అ మె రిక న లకు నే ర నయాయ వయ వ సథ ,
बस मुझे खुद पर बर स ते हाथ - पै र ही दिख रहे थे .	నాకు కనిపి ంచి ంద లలా కా ళళు , చే తు లతో ననను కొ టట డం .
हम मीक को सट ू डियो में ही रख ते .	మేము మీ కను సట ూ డి యో లో ఉ ంచా ము .
य दि तुम वह रा सता नहीं खो ज ते ,	ఒక వే ళ అలా బర త కాల ని అనుకో కపోతే ,
हमारे घर के पास ही र मीक नाम का एक और लड का था .	వీ ధి చి వర లో ర మీక అనే ఇం కో అబబా యి ఉండే వాడు .
मेरे देख ते ही देख ते मान ो मेरा पूरा पड ो स एक ही पल में मुझ पर ट ू ट प डा .	నేను చూ సతూ ఉండే వాడిని , ఎలా అంటే , చూ టట ూ ఉనన వారు కష ణ ంలో నా పె దా డి చేసే వారు .
वह तीन म ही ने से जेल में है .	అతను 3 నె లలు గా జె లు లో ఉననాడు .
मैं चाहता हूँ मुझे पहले एक अचछे इंसान , एक भ ले इंसान के रूप में देखा जाए .	ముందు ననను ఒక మంచి వయకతి గా , మంచి మన సు నన వాడి గా చూడ ాలని కో రు కుంటుననా .
यह जान कर कि वह एक र ै पर है .	తను ఒక ర యా పర అని తెలుసు కొ ని .
मतलब , मैं हर रो ज ह जार ों बच चों को बस में ले जाता हूँ ,	తెలుసా , నేను వ ంద ల మంది పిలల లను పరతి రోజు తీసు కె ళ ు తు ంటా ను ,
या लगता है उस दिन बाहर नहीं निकल ना चाहिए . हो सकता है मैं मर जा ऊँ .	లేదా నేను ఈ రోజు బయటకు వెళళ కూడదు . బహుశా నేను చచ చి పో తా నే మో అనిపి సతుంది .
उसकी माँ न शा करती थी जब वह उससे गर भ व ती थी	అతని తల లి క డు పు తో ఉండ గా గం జా యి తా గి ంది
मुझे याद है वह मुझे बा इ क चला ना सि खा ते थे ,	నాకు ఆయన బె క న డ ప టం నే ర పి ంచ టం గుర తుంది ,
2 2 0 4 सा उ थ हे म बर गर सट री ट च ौ बी स जन व री , 2 00 7	2 2 0 4 ద కషి ణ హె మ బర గర వీ ధి జ న వరి 2 4 , 2 00 7
ऐसा तो किसी आत ंक वा दी के साथ होता होगा .	అది ఒక ఉ గర వా ది కి ఉండ ాల సిన వి లా అనిపి ంచా యి .
हर कोई मुझे चि ढ ा रहा था कि वह लड का मुझे मा त दे रहा है .	అతను ననను కొ డు తుననా డని అందరూ ననను వె కకి రి సతుననారు .
यह पूरा सि सट म ही ख रा ब है .	ఈ వయ వ సథ అంతా నా శ నం అయ యి ంది .
पर कोई और रा ह है ही नहीं .	కానీ నిజ ానికి ఎ ం పి కలు లేవు .
मैंने अपनी आ ंट को उनके ता ब ूत में किस किया और उनका मा था ठ ं डा था	శ వ పే టి క లో మా మే న తత ను ము దదు పెటటు కో వడం గుర తుంది తన ను దు రు చ లల గా ఉంది
बै ट ल र ै प , मुझ में यह साह स व हीं से आया है .	బ యా టి ల ర యా ప , అదే నా లో ధ ె ర యం ని ం పి ంది .
घट ना ओं का ना ट की य रू पा ं तर दिखा या गया है .	పు న రని ర మి ంచ బడి న నా ట కీ య ద ృ శ య ాలు ంటా యి .
कुछ करने की बे ता बी होती है	చెతత లోప లి కి పర వ హి సతుంది
1 9 7 0 से 1 9 7 9 तक , श हर ने उ त पा द न कष े तर की लग भ ग 1 4 0 , 00 0 नौ कर ियाँ ग ँ वा दी ं .	1 9 7 0 నుంచి 1 9 7 9 వర కు , న గ రం లో ఉ త ప తతి రం గ ంలో దా దా పు గా 1 4 0 , 00 0 ల ఉద యో గ ాలు పోయా యి .
मैं फि ला डे ल फ िया श हर में एक बस चला ता था .	నేను ఫి ల డె ల ఫి యా న గ రం లో బ స సు న డి పా ను .
मु ँ ह बंद रख ो !	నో రు మూ సుకో !
कया ? हि लो मत !	ఏంటి ? క ద లకు !
यहाँ तक कि कभी - कभी मेरी माँ का काम छ ू ट जाता था .	కొనని సా రలు , మా అమమ ను పని నుండి తొ ల గి ంచిన పపుడు కూడా .
पाँच - सा मान य हम ला छ ह - लोगों को खत रे में डाल ना	5 . సా ధా రణ దా డి 6 . నిర లకష ప ూ రి త అ పా య కర సథి తి కలి గి ంచ టం
हि ं सा बहुत बढ गई , अ परा ध बहुत बढ गए .	అది హి ం సా తమ కం , అది నే రాల తో ని ండి ఉంది .
पूरा पड ो स ध क का - मु क की करते , लड ते हुए	మొతత ం వీ ధి లో వా రం తా బ ొ ద ది ంక లలా వచచా రు ,
सब कहते हैं कि मेरे पिता चो री करते थे .	మా నానన దొ ంగ త నాలు చేసే వా డని అంటా రు .
बस वही मेरे जी वन के पु रु ष रो ल म ॉ ड ल थे , और वे न शा बे च ने का काम करते थे .	వాళళు నా జీవి తా నికి పు రు ష ఆ దర శ వం తులు , వాళళు డ రగ డీ ల రలు గా , అలా ంటి వి చేసే వారు .
बे च ने के उ द देश य से कर ै क को के न रख ना .	కొ కె యి న కలి గి ఉ ండి అమ మే ఉద దే శ యం ఉండ డం .
जो लोग मेरे सामने आ ते हैं , उनसे एक तरह के बर ता व की आ शा होती है .	నా ము ందుకు వచచే వాళళు , ప దధ తి గా పర వర తి ంచ ాలని ఆ శి ంచ బ డు తుంది .
वह हमेशा कह ता था , " मैं बहुत बडा आदमी बन ूँगा . "	" నేను పెదద వాడిని అవు తాను " అని అతను ఎపపుడూ అనే వాడు .
वह कई नौ कर ियाँ करता था .	అతను చాలా ప ను లు చేసే వాడు .
और फिर तुमहारी कहानी खतम .	అదే క థ కు అంత ం అవు తుంది .
गा डि यों में ब ज ते गा ने सुनो , तो बस मीक मिली के गा ने ब ज रहे हैं .	ఆ కార లలో సంగ ీ తం వి ంటే , వాళళు మీక మి ల లీ సంగ ీ తం వి ంటు ంటా రు .
मैं उस परिवार के बहुत करी ब हो गया .	నేను ఆ కుటుం బ ంతో స నని హి తు డిని అయ యా ను .
जहाँ हर पाँच मिनट में हतया रा जे सन नजर आता है .	పరతి ఐ దు నిమిష ాల కు జే స న రా వ టం చూ సతునన టటు ఉంటుంది .
बहुत से लोग कहते हैं कि हमें अपनी रा ह खुद चु न नी होती है .	చాలా మంది అంటా రు నువవు ఎ ంచుకో వాల సిన వి , చేయ ాల సిన వి ఉననాయి అని .
से क यू रस . सब को , अ ल वि दा .	సె క యూ రస . గు డ బె , అంద రికీ .
मैं अस ली न शा कर ूँगा , यार तुम सब बेवकूफ लग ो गे	నేనే దో పని లో ఉంటా ను , మీ రం తా వెధ వల లా కనిపి సతు నా రు
बाद में बि करी और बढ ी , और तब मैंने पै सा क मा ना शुरू किया .	తరువాత పు ం జు కు ంది , అపపుడు నేను డబబు సం పా ది ంచ టం మొద లు పెటటా ను .
और हर कोई वही सं गी त सुन रहा होता .	పరతి ఒకక రు అదే సంగ ీ తా నని వి ంటుననా రు .
वे गर मी की रात ें ठ ं डी भी हो सकती हैं	వాళళ వే స వి రా తరు లు ఇంకా భయ పె డ తా యి
वहाँ 1 6 साल का एक लड का था . उसके बोल जब र द सत थे , जैसे वह . . .	1 6 ఏ ళళ ఒక అబబా యి ఉండే వాడు . అతని భా ష , చెపపే వి ధా నం . . .
गया रह साल पहले की एक रात ने मीक का पूरा जी वन बदल दिया .	మీకు జీవితం మొతత ం ఒకక రాతరి తో నిర వ చి ంచ బడి ంది , 1 1 ఏ ళళ కరి తం .
उसके पास एक बै ग भर कर को कीन की छो टी शी श ियाँ थीं .	అతని దగగర ఒక బ యా గు లో కొ కె యి న సీ స ాలు ఉననాయి .
फिर दरवा जा खो ल ते हो . जब रात का समय होता है .	బయటకు వెళళ ే ముందు చు టట ూ చూడ ాలి . అది రాతరి సమయం .
जिस का मतलब जे सन हर पल सामने आता था .	అంటే జే స న పరతి సీ న లో ఉంటా డ నన మాట .
यह स पता ह के सा त ों दिन चल ता रह ता .	ఇది వా రా నికి ఏ డు రోజు లు జరుగు తుంది .
और याद है कि कई बार एक बं दे ने कहा ,	నాకు గుర తుంది కొనని సా రలు , ఇ తను ,
पर बस मीक की आवा ज सु नी जा रही है कयोंकि वह सं गी त बना ता है .	మీక సంగ ీ త కారు డు కాబటటి , అతని కోసం మాటలా డే జ నం ఉననారు .
पर उसे खबर ों और साथ पढ ने वाले कुछ बच चों से पता चल गया	కానీ తన కి వార తల ద వా రా , కొ ంత మంది తో టి వి ద యా రథ ు లు వాళళ నానన
तो सोचा अचछा होगा कि कहूँ वह कॉ ले ज गया है ,	అందుకే తను తిరిగి జె లు కు వెళళ ా డని తెలియ టం కంటే
मेरा ह ौ सला तो ड ने के लिए	నాకు అ లు పు తె పప ి ంచండి
हमें न शी ली दवा मिली है .	మా ద క దర వయ ాలు దొ రి కా యి .
ब यु ला पार कर मीक की दा दी	బ యూ లా పార కర మీక నా నమమ
रॉ बर ट पार कर मीक के पिता	రా బర ట పార కర మీక త ండ రి
बे वर ली पार कर मीक की बु आ	బ ే వర లీ పార కర మీక ఆ ంట ీ
और तब भी उसने वही करने का सोच र खा था , जो वह अब कर रहा है .	తను ఇపపుడు చే సతునన దానికి తన కో పర ణ ా ళ ి క ఉంది , అ పప ట లో .
वह मेरे लिए दु ख भ रा दिन था , पर मेरे जी वन के अचछे दि नों में से एक था ,	అది నాకు వి చా ర కర మెన రోజు , కానీ అది నా జీవితం లో ఒక ఉ తత మ మెన రోజు
प च ची स जन व री , 2 00 7 को मीक पर आ रो प लगे . . .	జ న వరి 2 5 , 2 00 7 లో , మీక పె చేసిన నే రా రో ప ణ లు . . .
ज मान त पर रि हा होने पर उसने कुछ इं टर व यू देने के लिए हाँ कर दी .	బె యి ల మీద వి డు ద లె నపపుడు , అతను వ రు స ఇంట ర వయ ూ లు ఇవవ టానికి ఒ పపు కుననా డు .
मैं @ m e e k m i l l के साथ हूँ . आ शा है मेरा श हर भी यही करे गा .	@ మీక మి లకు మ దద తి సతాను . నా న గర మూ ఇ సతు ంద ను కుంటుననా ను .
अब आप बात ची त शुरू कर सकते हैं .	మీరు ఇపపుడు సం భా ష ణ మొద లు పెటట వచచు .
- हैलो . - ए .	- హలో . - హలో .
वह फ े अ र म ॉन ट पार क के पास एक छो टा सा इ ला का था .	అది ఫె యి ర మ ౌ ంట పార క వ దద ఒక ఇ రు కె న పరా ంత ం .
करि स पार कर मीक के अं कल	కరి స పార కర మీక అ ం కు ల
जो पू रे हो श उडा दे ख ून , ख ून बंद ूक का खेल	అది మీ ని గగా ను చం పే సింది హ తయ , హ తయ తు పా కు ల ఆట
रे सन पार कर मीक का क जिन	రా స స న పార కర మీక క జి న
दरवा जा खो ल ने के लिए उसका सिर पक ड कर दरवा जे पर मा रा .	వాళళు మ ౌ లి కంగా , అతని త లను తలు పు వి రగ గొ టటే రా డ లా వా డా రు .
और फिर एक पुलिस वाले ने आकर अपने व ॉ की - टॉ की से फोन किया ,	తరువాత పోలీసు వచచా క , అతని వా కీ టా కీ తో కాల చేశా డు ,
मुझे वह लड का याद आ गया जि से न ु क क ड पर मा रा गया था .	నేను ఈ మ లు పు లోనే చం పే య బడ డ ఆ అబబా యి గురించి ఆలోచి ంచా ను .
एक अजीब घट ना में , कल रात र ै पर मीक मिल को न यू य ॉर क सि टी में गिर फ तार कर लिया .	వి చి తర మెన క థ లో , ర యా పర మీక మి లను గ త రాతరి న యూ యా రక న గ రం లో అ రె సట చేశారు .
" दस 1 00 में बदल सकते हैं , और 1 00 फिर 1 , 00 0 में ,	" ప ది మంది , వ ంద మంది అవు తారు , 1 00 మంది , 1 00 0 మంది అవు తారు ,
रॉ न पार कर मीक के अं कल	రా న పార కర మీక అ ం కు ల
जज ों को के स के अनु सा र फै सला सुना ने की आ जा दी नहीं थी ,	నయాయ మూ ర తి కి కేసు ను బటటి తీ ర పు ఇ చ చే వీ లు లే కుండా ,
और बस में हर बच चा उसके ही गा ने सुन रहा होता था .	అకకడ బ స సు లో పరతి పిలల వాడు అతని సంగ ీ తా న నే వి ంటుననా డు .
हम क पडे तक नहीं जु टा पा ते थे	మాకు బ టట లు కొ ను కకు నే సథ ో మ త లేదు
और फिर उसने सब कुछ उ गल दिया .	బయటకు కక కాల ని అను కుననా డ ను కుంటా .
पुलिस ! हाथ ऊपर करो ! अपने हाथ ऊपर करो !	పోలీ స ! చే తులు పె కె తతు ! మీ చే తులు పె కె తతు !
