और पै ट रिक की मदद से मुझे यकीन है तुम जान कार भी बन जाओ गी .	ప యా ట రిక స హాయ ంతో ఇంకా బాగా వ ండ గ లు గు తా వని చెపప గలను .
पै ट रिक तो गया .	ప యా ట రిక వెళ లా డు .
पै ट रिक .	ప యా ట రిక .
और टॉ म ?	మరి టా మ ?
मेरे जी वन में कोई है .	నా జీవితం లో ఒక రు ఉననారు .
इस तरफ .	ఇ టు వెపు .
हाँ , यह सच है !	అవును , ఇది నిజం !
पै ट रिक काम से गया था .	ప యా ట రిక పని మీద వెళ లా డు .
पै ट रिक .	ప యా ట రిక .
सि गरे ट मत दी जिए गा . यह आप से ले ने की कोशिश करेंगे .	అతను సి గ రె టలు తా గ కూడదు . ఏదో వి ధ ంగా మీ దగగర తీసు కుంటా డు .
कुछ ग ड ब ड है . तुमहें उस बारे में बात करनी चाहिए .	ఏదో జరిగింది . నువవు దాని గురించి చెపప ాలి .
किसी खास कला कार के बारे में सोच र खा है ?	నీ మన సు లో ఎవరెనా క ళ ా కారు లు ఉననా రా ?
हम पै ट रिक के लिए एक व की ल ढ ूं ढ ेंगे .	మనం ప యా ట రిక కోసం ఒక లా య ర ను పెటటు కు ందా ం .
टर नर नाम का कोई चि तर कार है कया ?	టర న ర అనే చి తర కారు డు ఉననా రా ?
दरअसल तुमसे पूछ ना चाहता था .	నిజ ానికి ని నన ొక పర శ న అడుగు తాను .
मैं तो भूल ही गया था कि कुछ लोग अभी भी मा सू म होते हैं .	ఇంకా కొ ంద రు అ మా య కంగా ఉంటా ర నే ది నేను మర చి పోయా ను .
हाँ . यह तो बढिया रहे गा .	అవును . అది మంచి పని .
हमें धयान से रहना होगा .	మనం జా గర తత గా ఉండాలి .
- जी ! - जी ? बहुत अचछे .	- అవును ! - అవునా ? మంచిది .
मुझे तुमसे बात करनी है .	నేను నీ తో మాటలాడ ాలి .
चा हो तो पू ल से शु रु आत कर सकती हो .	నువవు కావాల ను కు ంటే కొ లను లో మొద లు పెటటు .
तुम ती नों इतना समय साथ बि ता ते हो .	మీరు ము గ గు రు చాలా కలిసి తి రుగు తుననారు .
पै ट रिक . बस करो .	ప యా ట రిక ! ఆగు .
- चि यर स . - चि यर स .	- చ ీ రస . - చ ీ రస .
और ड रा वना भी .	భయ పెటట ే లా కూడా .
व हीं रु क जाओ !	అకకడ ే ఆ గి పో ండి !
कम ब खत सम लै ंग ि क .	వెధవ కొ జ జ ాలు .
मुझे माफ कर दो .	ననను మన ని ంచు .
मैंने बात कर ली है कि उसे अचछा मु आ व जा मिले गा .	అతనికి దానికి త గి న పరతి ఫ ల ం దొ రు కు తుంది .
मैं कया कर ूँ ?	నేను ఏం చేయాలి ?
मुझे माफ कर दो .	ననను మన ని ంచు .
माफ कर दो मुझे .	ననను మన ని ంచు .
जो र से बो लिए .	గ టటి గా చెపప ండి .
खाना कैसा है ?	భ ో జ నం ఎలా ఉంది ?
जब तक तुम उसे यहाँ नहीं ला ई थी , सब ठीक ही चल रहा था .	నువవు అత నని తీసు కొ చ చే వర కు ఇకకడ అంతా బాగుంది .
- हे भगवान . - उनहोंने किसी कमी ने को खो ज निका ला	- ఓ రి దేవుడా . - వాళలు ఒక డిని పటటు కొ చచా రు
यह बाद की ता री ख से है .	ఇది ఆ తరు వా తి తే దీ .
उसने तुमहारे लिए पूछ ा .	అతను నినను అడి గా డు .
इतने साल ों से तुम दोनों को अलग रख ने की दो ष ी मैं खुद को ठ हरा ती रही .	మిమమలని వి డ గొ టటి న ందుకు ఇ న నే ళలు ననను నేను ని ంది ంచు కుననాను .
तुम उसकी नौ करा नी बन कर र होगी . बकवास तो यह है .	అతనికి చాలా సే వ లు చేసతుననా వు . అది హా స యా స పద ంగా ఉంది .
तुमहें यहाँ ला ने के लिए वह मुझे कभी माफ नहीं करे गा .	నినను ఇకకడ కు తె చచి న ందుకు అతను ననను కషమి ంచ డు .
और मैंने तुम दोनों जै सी सु ंदर जो डी आज तक नहीं देख ी .	మీ అంత అంద మెన జ ంట ను నేను ఇ పపటి వర కు చూడ లేదు .
नहीं होते . तुम मेरे साथ कभी नहीं थे . मेरे लिए नहीं .	నువవు ఎపపుడూ ఇకకడ లేవు . పూరతి గా నా కోసం లేవు .
टॉ म मुझे नहीं बचा ता तो मुझे ट रि प र दद ही करनी पड ती .	టా మ వచచి నాకు సాయం చేయ కపోతే నేను దీ నని ర దదు చేసు ండ ే వాడిని .
हैं पुलिस वाले , पर देख ने में ग जब हैं .	అతను పోలీసు ల కంటే అంద ంగా ఉననాడు .
स ंग रहा ल य स हा य क के लिए पैसे दे रहा है	మ యూ జి యం అ సి సట ె ంట కు చె లలి సతోంది .
- बहुत पया री शादी थी . एक दम सही . - अचछा ?	- అద ొక మ ధ ు ర మెన వే డు క . చ కక గా ఉంది . - నిజంగా నా ?
मेरा पुलिस वाला	మె పోలీ సమ యా న
ठीक है .	నిజ మే .
मुझे तै र ना आता है . बस अचछे से नहीं .	నాకు వచచు . కానీ అంత బాగా రా దు .
ठीक है ?	సరేనా ?
तुमने कहा कि तुम . . .	ఏం కావాల ననా వు . . .
- तुम उसके म ॉ ड ल ब ने थे ? - मैं और पै ट रिक ऐसे ही तो मिले थे .	- దీ నికి ఫో జు ఇ చచా వా ? - నేను , ప యా ట రిక అలా కలి శా ము .
ब डे होने से .	ఎ దగ డం గురించి .
कि बस अचछे दिन ही होंगे . अब देखो जरा मुझे .	దాని తో పాటు ఎ నన ో మంచి వి వ సతా యి . ఇపపుడు ననను చూడు .
- आप एक अचछे म ॉ ड ल बन ेंगे . - मैं ?	- మీరు మంచి క థా విషయం అవు తారు . - నే నా ?
हमें नहीं करना चाहिए .	మనం అలా చేయ వ ద దే మో .
ठीक है ?	సరేనా ?
खो गया है दिल मेरा	నా మన సు పా రే సు కుననాను
ह ँ स सकता है वह	అతను నవ వ గల డు
मैं इससे स हम त हूँ .	నేను దానికి తా గు తాను .
स हा य क ?	స హాయ మా ?
मि से ज बर जे स , आप सक ूल में पढ ा ती हैं , है ना ?	మి సె స బర జె స , మీరు ఉ పా ధ యా యు ర ాలు , కదా ?
मैं अभी भी सक ूल में पढ ा ती हूँ .	నేను ఉ పా ధ యా య వ ృ తతి కొ న సా గి సతుననాను .
मुझे बोल ने दो .	ననను చెపప నీ .
के नि दे शक के साथ पर सन ल ट ूर किया है ?	నీకు ఎపపుడ ెనా వయకతి గ తంగా తి పప ి చూపి ంచా రా ?
एक आ श िया ना जहाँ रह ते हैं दी वा ने दो	నివ సి సతారు పరే మి కులు ఒక ఇంట లో
- समझ ी नहीं . . . - हमारा वे नि स ट रि प .	- మన ని ంచాలి - - - మా వె ని స పర య టన .
धयान से बि ता ना ये दिन देखना यह खुश बू रहे गी स दा	జా గర తత గా కలు పు తూ ఉ ండు రోజు ల తర బడి చూడు అది ఎలా ఉ ంటు ందో
जैसे अ शा ंत स मु दर में तै र ना .	పర చ ండ మెన అ లల లో ఈ ది న టలు .
पता नहीं कया हो रहा है .	ఏం జరుగు తో ందో నాకు తెలియదు .
मैं शादी करने वाला हूँ .	నేను పె ళ లి చేసుకో బో తుననాను .
क थि त त ौर पर , सा र वज निक जगह में घ ो र अ भ दर ता	అవి ఏ మన గా , పర జా మ రుగు దొ డ లలో అస భయ ంగా పర వర తి ంచడం ,
- पर हमें तो ला इ ब रे री जाना था . - तुम नहीं जाना चाहती ?	- లె బర రీ కి రాల ే కపో తునన అ ందుకు బాధ గా ఉంది . - నీకు రా వాలని లేదా ?
न , तुमने हा द से के बारे में कहा था .	లేదు , పరమా ద ం గురించి ఫి ర యా దు చేశా డ ననా వు .
मुझे ख स रा हो गया था .	నాకు త టటు పో సింది .
मैंने तुमहारे लिए शादी की शान दार दा व त प का ने का वा दा किया था .	నేను మీకు మంచి పె ళ లి వి ందు చేసి పె డ తా నని మా టి చచా ను .
जब तुम दोनों वे नि स में थे , तो मुझे लगा मेरे साथ ध ो खा हुआ है .	మీరు వె ని స లో ఉనన పపుడు , నేను మో స పోయా నని అనిపి ంచింది .
एक हा द सा हो गया है . बू ढ ी और त है . आप जलदी चल सकते हैं ?	ఒక పరమా ద ం జరిగింది . ము స లా వి డ . తొ ంద ర గా వ సతా రా ?
आप से मिलने कोई ऑ फि सर आए हैं .	ఒక పోలీ స అ ధి కా రి మీ కొ ర కు వచచా రు .
पागल मत बन ो . तुम जानती हो कि उसे यहाँ कयों ला ई हो .	పిచచి గా మాటలాడ కు . అత నని ఇకకడికి ఎందుకు తె చచా వో నీకు తెలుసు .
धयान रख ना है कि यह अचछा - खा सा पा नी प िए ं .	అతను త గి నన ని నీ ళలు తా గే లా చూడ ాలి .
बता ना मुझे , दी वार पर लट के	చెపపు నాకు , మా యా దర ప ణం
वह ि स की लू ं गी .	వి స కీ ఇవ వు .
मैंने पहले कभी कहा नहीं कयोंकि शायद मुझे डर लगता था .	భ యం వలల నే మో , ఇంత కు ముందు ఎపపుడూ పరయతని ంచ లేదు .
घर अचछा है .	ఇ లలు బాగుంది .
सब ने उसका साथ छोड दिया है .	అత నని అందరూ వదిలే శా రు .
अब से उसका नाम नहीं ल ेंगे .	మ రో సారి అతని పే రె తత కు .
- और मुझे जाना है . - पर . . .	- నేను వెళల ాలి . - కానీ - -
जयादा चो ट - वो ट तो नहीं लगी थी ना ?	ఇది అంత గా పరమా ద ం కాదు , కదా ?
मा सू मि य त के साथ एक जि ज ञ ा सा .	అ మా య క త వం , కు తూ హ ల ం కల బో సి ఉననాయి .
रि टा यर हो चु की हूँ .	పద వి వి ర మి ంచా ను .
स जा देने के लिए .	తన ను శి కషి ంచ డానికి .
यह कैसे कर ले ते हो ?	అది ఎలా చేయ గల వు ?
त ू अब जेल जाएगा .	ని నన రె సట చేసతుననా ం .
दिल है उसका पत थ र का	అతని లో చ ల నం లేదు
और उस ट ूर के द ौ रा न कया आपको ऐसी कोई वजह दिखा ई दी	ఆ స ంద ర శ న సమయం లో , మిసటర హే జె ల వు డ మీ వి ద యా రథ ు లకు పరమా ద కర మని
तुम ना इ जेल और उसके दोसत से मिले ?	నీకు నె జె ల , అతని సనే హి తు డు కనిపి ంచా రా ?
पर सप ने तो देख सकती हो . सप ने देखो गी नहीं तो कुछ नहीं होने वाला .	కానీ నువవు తపప కుండా కల గ నా లి . అది లేని దే ఏ దీ సా ధయ పడ దు .
मुझे शि कष ा , व या कर ण या शि ष टा चार की पर वाह नहीं होती .	వి దయ , వయా క రణ ం , మర యా దల గురించి ప టటి ంచుకో ను .
तो समझ ा ना बंद करो कि मुझे उसके बारे में कया सोच ना चाहिए !	అందుకే దాని గురించి నేను ఏ మను కో వాల ో చెపప డం ఆ పు !
पर तुमने वे सटर न आर ट ग ै ल रि ज	కానీ వె సటర న ఆర ట గ య ాల రీ స డె రె క టర
मुझे लगा तुम यही चाहते थे .	నీకు కావాల సింది అదే అను కుననాను .
और एक दिन , हमारे बचचे भी होंगे .	ఏదో ఒక రోజు పిలల లని క ంటా ం .
हम दोनों भी अजीब उल झ न में हैं , है ना ?	మన మి దద రం గ ంద రగ ో ళ ంలో ఉననా ం , కదా ?
छ ू लो मेरे ना जु क हो ठ ों को	ఒక తా జా , సు నని త మెన ము దదు పెటటు
बहुत - बहुत शुकरिया .	చాలా ధనయవాదాలు .
चाह े वह बी यर पी ते हुए ड कार मा रे या ओ पे रा देख ते सो जाए ,	అతను బీ రు తా గు తూ తే న చి నా , క చే రీ లో ని దర పోయి నా ,
वह एक दम सही है .	అతను చ కక గా ఉంటా డు .
मैं तुमहें बता ना चाहता था . . .	నీకు చెపప ాలను కుననాను . . .
लगता तो यही है .	అలాగే అనిపి సతోంది .
" टॉ म कहाँ है ? "	" టా మ ఎ కక డు ననా డు ? "
मैं आ गया .	నేను వచచా ను .
क जिन ?	క జి నా ?
हाँ , अगर बी यर है तो .	దయచేసి బీ రు ఉంటే ఇవవ ండి .
हम पाँच साल साथ रहे .	ఐ దే ళల పాటు కలిసి ఉననా ము .
अचछा .	అలా గా .
ठीक था ना ?	ఇది బాగు ందా ?
न झूठ बोल ने की .	అబ దధ ాలు చెపప కుండా .
और अब मैं बिलकुल अलग हूँ .	ఇపపుడు పూరతి గా భి నన ంగా ఉననాను .
मेरे लिए एक और सा ंस लें .	మ రో సారి శ వా స తీసుకో .
अब मैं कया कर ूं गा ?	నేను ఏం చేయాలి ?
" मेरे सामने मेरा पुलिस वाला एक दम सा कष ा त ख डा था . "	నా పోలీసు చాలా హు షా రు గా నా ముందు ననా డు . "
उसे नौ करी मिल गई है .	అతనికి ఉద యో గం దొ రికి ంది .
तुम उसे आने के लिए बोल दो गी ? मुझे उससे मिल ना है .	అత నని ర మమ ని చెబు తా వా ? నేను అత నని కల వాలి .
तुमने उसे बर बाद कर दिया .	అతని ని నా శ నం చేసా వు .
वह सही नहीं था .	అది స రెన పని కాదు .
- मैं मदद कर ूँ ? - बेहतर होगा हमें करने द ें .	- నేను పటటు కో నా ? - మేము చేయ డ మే మే లు .
- जान ना चा हो गे उसने कया कहा ? - नहीं .	- ఏమ ననా డో తెలుసు కో వాలని ఉందా ? - అంత గా కాదు .
हो न हो मेरी भी कला में रू चि होगी .	అయి నా నాకు తపప కుండా క ళల ప టల అభి రు చి ఉంది .
- और तुम . . . - उ त तर की तरफ था .	- నువవు ఎకకడ ఉ ంటుననా వు . . . - ఉ తత రా న .
- मै रि यन के नाम . - नहीं . हम सब के नाम .	- మే రి యన కు . - కాదు . మన అంద రికీ .
यह मैं पहले भी कई बार सुन चुका हूँ .	ఇది విన డం నాకు ఇదే మొదటి సారి .
और नै ति क ता को खत रे में डाल ना ?	సమా జ నె తి క వి లు వ లకు భ ంగ ం కలి గి ంచడం ?
जिस दिन से हम मिले थे . और झूठ बोल ते रहे . तुम पै ट रिक को चाहते थे .	మనం కలి సిన పపటి నుండి అబ దధ ాల ే . ప యా ట రిక ను పరే మి సతుననా వు .
वह ठीक मेरे सामने से निक ला , जैसे मुझे जानता भी न हो .	అతను నేను ఎవరో తెలియ న టలు చూ సతూ వెళలి పోయా డు .
- एक बार और ? - एक बार और .	- ఇం కొ క టా ? - ఇం కొ క టి .
- कया ? - टॉ म कहाँ है ?	- ఏంటి ? - టా మ ఎ కక డు ననా డు ?
मि . और मि से ज बर जे स .	శ రీ మ తి మరియు శ రీ బర జె స .
मि . और मि से ज बर जे स .	శ రీ మ తి మరియు శ రీ బర జె స !
मुझे उन पर तर स आता है जो नहीं जानते कि इस पयार में जी ना कैसा होता है .	పరే మ లో ఇలా ఉ ంటు ందని తెలియ ని వారి ని చూ సతే నాకు జ ాల ే సతుంది .
हफ ते में दो बार , मैं इन का चे क अप करके दवा ए ं बद लू ं गा .	వా రా నికి రెండు సా రలు అత నని పరి శ ీ లి ంచి త గి న మో తా దు లో మ ందు లి సతాను .
तुम पा नी से डर कर तो जी नहीं सकती .	అంటే , జీవి తా ంత ం నీ ళ లకు భయ పడు తూ బర త క లే ము .
- नी च कहीं का , छ ी . . . इ ध र आ . - उ ठ .	- నీ చ ంగా , అస హ య ంగా ఉంది . . . రా . - పె కి లే .
इसे मत बि गा डो .	దీ నని పా డు చేయ కు .
मैं समझ सकती हूँ .	నాకు అరథ మెంది .
यह सच है ही नहीं .	అది నిజం కాదు .
- एक मी ल दूर से देख कर पह चा न लो . - अचछा .	- వాళ లను దూ రం ను ండ ే గురతు ప టట వచచు . - సరే మంచిది .
और अब तुम जा रही हो ? और मैं कया कर ूँ ?	ఇపపుడు నువవు వెళలి పో తుననా వా ? నేను ఏం చేయాలి ?
तुम अके ले कैसे रह ते हो ?	ఒ ంట రి గా ఎలా ఉండ గ లు గు తుననావు ?
जिन की जो डी आ दर श और सु स भ य है .	చ కక ని సం స కార వ ంత మెన జ ంట .
का श तुम अपना चे हरा देख पा ती .	నీ మొ హం చూ సతే అలా ఉంది .
टॉ म , मुझे कुछ जान ना है .	టా మ , నాకు ఒక విషయం తెలియ ాలి .
कितनी देर से कुछ भी ठीक नहीं है .	నాకు ఎ ననా ళలు గా నో కాల ం కలిసి రా వడం లేదు .
मुझे उस दिन ह वल दार ने बुला या था .	ననను ఒక రోజు సా ర జె ంట కల వడానికి పి లి చా రు .
मुझे कुछ और पता होना चाहिए ?	నాకు చెపప ాల సింది ఇంకా ఏమెనా ఉందా ?
श ह द की ब ूँ द	తే నె చు కక
हाँ , जान म	అవును , పా పా
- इतनी परे शा नी है , तो उसे भेज दो . - तुमहारा कह ने का मतलब यह नहीं है .	- అతను నీకు బాధ కలి గి సతే పం పి ంచే య . - నీ ఉదదేశం అది కాదు .
कैसे ? यह कैसे हुआ ?	ఎలా ? ఇది ఎలా జరిగింది ?
मेरे पास बी यर नहीं है .	నా దగగర బీ రు లేదు .
सोच कर देखो .	ఊ హి ంచుకో .
