जि मी ! जि मी , कया फर ै ं की बच निक ला ?	జి మ మీ ! జి మ మీ , ఫ రా ం కీ పరా ణ ాల తో బయట పడ డా డా ?
कया ?	ఏంటి ?
मैंने जि तने भी पायलट ों को बी - 1 7 उडा ते देखा है , रो जी उन में बेह तरी न पायलट है .	బి - 1 7 విమా నా నని న డి పి న వారి లో నేను చూ సిన అత యు తత మ పె లెట రో సీ .
यही वह सं घ है जो फा सी वा दि यों को त बा ह कर दे गा	మి తర దే శ ాల ే ఆ నియ ంత లని అంత ం చేసతా యి
अगर तुमहारी कि सम त अचछी रही , तो मैं तुमहें प ंट करना भी सि खा सकती हूँ .	మీకు అద ృష టం ఉంటే , మీకు పడ వ న డ ప డం కూడా నేను నే ర పి ంచ చచు .
तो ब ॉल रू म में बि लि यर ड , ता श , श तर ं ज और बै ड मि ंट न हैं .	బి లి య ర డ స , పే కలు , చ ద రం గం , ఇంకా బ ాల రూ మ లో బ యా డ మి ంట న ఆ టలు ఉననాయి .
मुझे लगा था कि गे बल है .	నేను అయితే గే బ ల అను కునే దానని .
मैं ? मैं ऑ कस फो र ड यू नि वर सि टी जा रहा था .	మరి నేను ? నేను ఆ కస ఫర డ యూ ని వర సి టీ కి పర యా ణ మ య యా ను .
यहाँ कया हो रहा है ?	ఇకకడ అసలు ఏం జరుగు తోంది ?
वह तुमहारा पह ला मि शन था ?	అదే మీ మొదటి మి ష నా ?
- कया , अभी ? - बेशक .	- ఏంటి , ఇ పపు డా ? - అవును .
मैंने सुना है कि सब कला इ यों का खेल है .	మీకు తెలుసా , అద ంతా మ ణి క టటు లోనే ఉ ంటు ందని వి ననాను .
तुम कहाँ से हो ?	ఎ కకడి నుండి వచచా వు ?
वह मेरी ही गलती थी .	అది నా పొ ర పా టే .
पर जो आ खि री चीज मुझे याद है , वह है ब बल स के साथ बा थ रू म में उल टी करना	కానీ నాకు చి వరి గా గురతు నన ది ఏమి ట ంటే నేను బ బు లస తో కలిసి బా త రూ మ లో వా ంతి చేసు కుననాను ,
डॉ क टर ों को बु रे सप ने नहीं आ सकते ?	డా క టర ల కి పీ డ కల లు రా వ ంటా రా ?
दु श मन के लिए आ सान ल कष य थे .	శ తరు విమా నాలు తే లి క గా గురి చూశా యి .
मैं तुमहें एक बात बता सकता हूँ , मे जर , गे स टा पो को कभी गलत फ हम ी नहीं होती है .	నేను మీకు ఒక విషయం చెపప గలను , మే జర , గె సటా పో ఎపపుడూ పొ ర బడ దు .
. . . ब म ों और छ र र ों का राज है	. . . బా ం బు లు ఇంకా ఆ యు ధ ాలు ఏ లు తుననా యి
हम में से वे जिन होंने एक के बाद एक मि श नों में जाना जा री र खा ,	మి షన తరువాత మి షన నిర వ హి ంచే మి గి లి న మ ాలా ంటి వాళల ం
मे जर इ ग न , अंदर आओ .	మే జర ఈ గ న , లోప లి కి రండి .
हम सभी को जिंदगी में कोई ऐसा चाहिए जिस के साथ कं धे से कं धा मिला कर उल टी कर सक ें .	కానీ , మన కి జీవితం లో కావాల సింది ఏమి ట ంటే మనం వాల డానికి ఒక భు జ ం .
नहीं , नहीं . यह ? यहाँ , यह ?	లేదు , లేదు . ఇ దా ? ఇది , మనం ఉనన దా ?
वे सा व धा नी से म ृ त पायलट ों का जि कर करते थे .	చని పోయి న పె లెట ల గురించి మ ాలో మేము గు స గు స లా డు కో వల సి ందే .
सच में ?	నిజంగా నా ?
आप उसे बिना कोई सु र च ू के वापस ब जाना जा री रख ने को क हें गे ?	మనం ఎకకడ యి తే విన డం ఆ పా మో , అ కకడి నుండి మళలీ వా యి ంచ ాలని ఆ య నని అడ గ లే ం , కదా ?
बे सब ॉल अब भी मेरे लिए थोडा रह स य है ,	బ ే స బ ాల ఇ పపటి కీ నాకు ఒక మి సట రీ గా అనిపి సతుంది ,
मैंने रे गे न सब र ग हम ले में उसके कार नाम ों के बारे में पढ ा था .	రీ గ నస బ రగ దా డి లో అతని దూ కు డు గురించి చ ది వా ను .
हाँ . खैर , जे मस , इस द ौ रे के लिए धनयवाद .	సరే . మంచిది , జే మస , నాకు అన నీ చూపి ంచిన ందుకు థాంక స .
और मैं चीज ों को ऐसे समझ सकता हूँ जो शायद	నేను మిమమలని అరథం చేసు కునన టలు గా
अगर वे हम सब को मार भी द ें , तो भी उनहें फर क नहीं पडता है , है न ?	మన ంద రి నీ చం పే సి నా కూడా వాళలు ప టటి ంచుకో రు , అవునా ?
द ह श त फै ला ने वाले !	భ యం కర మెన వా యు సె ని కులు !
मुझे खे द है कि यह मेरे हाथ ों में नहीं है , रॉ बर ट .	అది నా డి పార టు మె ంట కా ద ను కుంటా , రా బర ట .
मैं ब बल स की जगह गर ु प नै वि गे टर बन गया .	గర ూ ప నే వి గే టర గా ననను బ బు లస సథా నం లో తీసు కుననా రు .
तुम दोसत उस विमान में बस एक कारण से था , बस एक ही कारण से :	మీ సనే హి తు డు ఆ విమానం లో ఉనన ది కేవలం ఒకక కారణ ం కోసం , ఒకక కారణ ం కోసం మాతరమే :
हम डा ंस करने चल ेंगे .	మనం డా నస చేయ డానికి వెళ దాం .
मैं इस पूरी वि शा ल दुनिया में सारे लोगों को देख पा रही थी	ఈ మొతత ం పరపంచ ంలో ఉనన పర జ ల ంద రి నీ నేను చూశా ను
ए , यह वही है जिस के बारे में मैं बता रहा था .	హేయ , నేను మీకు చెపపి న వయకతి ఇ త నే .
वैसे ही प ृ थ वी पर भी हो ,	స వర గ లో క ము మా ది రి గా ఈ భ ూ మి మీద ,
धी रे - धी रे मेरे साथ दो हरा ओ :	నేను చెపపా క ని దా న ంగా రి పీ ట చేయ ండి :
मेरी सला ह है कि जब तक सं भ व हो , फा य दा उठा ओ .	మీకు అవకా శం వచచి న పపుడే ఈ స దు పా య ాలు వాడు కో వాలని నా స ల హా .
तुमहें लगता है यह हमारे लड कों ने किया ?	ఈ దా డి మన సె ని కు ల ప నే అంటా వా ?
पर हमारा सं घ गु ला मी की उन ज ं जी र ों को तो ड दे गा	కానీ మన మి తర దే శ ాలు దా సయ శ ృ ం ఖ ల ాల నుంచి వి ము కతి పొ ంద బో తుననా యి
मैं एक प ं टर हूँ .	నేను పడ వ లు న డు పు తాను .
- कल रात को नी ंद कै सी हुई ? - बढिया .	- ని నన రాతరి ని దర ఎలా ప టటి ంది ? - బాగా ప టటి ంది .
मैं एक प हा ड पर च ढ ी आ स मान के बीच में	ఆ కా శం మధయ లో ఉనన పర వ తం మీద కి నేను న డి చి వెళ లా ను
मैं एक प हा ड पर च ढ ी आ स मान के बीच में	ఆ కా శం మధయ లో ఉనన పర వ తం మీద కి నేను న డి చి వెళ లా ను
शा ंत हो जाओ , शा ंत हो जाओ .	ఫర వాలేదు . ఫర వాలేదు .
और वह बेहद अजीब था .	అది చాలా వి చి తర మెన విషయం .
ह वा में जयादा देर उ ड ते रह ने वाला नहीं था .	ఎందుకంటే మా విమానం ఎకకువ సే పు గ ాలి లో ఎ గి రే అవకా శం లేదు .
आप कहाँ तै ना त थे , डॉ क ?	మీరు ఎకకడ పని చేసతా రు , డా క టర ?
- तो मैं यह जानकारी . . . - मुझे उनके नाम नहीं पता .	- నేను దానని వే రే వాళల కి అంద చేసతాను . . . - నాకు వాళల పే రలు తెలియదు .
म ं सटर रो जी का बस ती स रा मि शन ही था ,	మా ం సటర న గ రం మీద దా డి , రో సీ కి కేవలం మూ డో మి షన ,
बेशक , तुम अ मरी कि यों के सं स था पक पिता ओं को	అయితే , అ టు వ ంటి సూ తర ాలను మీ పెదద లు రూ పొ ంది ంచుకో వడానికి
अ ह - अ ह , बस इतनी जलदी नहीं . मैं जयादा नहीं पी पा ता हूँ .	ఆ హ . . . ఆ హ , ఇం క చ ాలు . నేను పెదద గా తా గ ను .
पर फिर भी कभी - कभी ऐसा लगता है कि वे बहुत दूर हैं .	అయి నా కూడా కొనని సా రలు వాళలు చాలా , చాలా ద ూర ంగా ఉనన టలు అనిపి సతుంది .
आ राम करने के लिए उस जगह जाने का आ देश दिया जि से हम फ लै क हा उस बुला ते थे .	శ తరు వు ల మీద దా డు లు చేసిన సె ని కు లకు కే టా యి ంచే వి శ రా ంతి గ ృ హ ాల లో వా రం రోజు లు గ డ ప ాలని ఆ దే శి ంచా డు .
" हे हमारे पिता , आप जो स वर ग में हैं , आपका नाम प वि तर मा ना जाए . . .	" స వర గ లో క ము లో నివ సి సతా వు , నీ పేరు ప వి తర మెన ది . . .
मैं देख सकती हूँ कि तुम शादी शु दा हो .	మీకు పె ళల యి ందని తెలు సతోంది .
आपको वापस विमान में च ढ कर कम ब खत काम पूरा करना चाहिए .	మనం మళలీ విమానం లో కూ రచు ంటా ం , ఇంకా మన కి అ పప గి ంచిన పని ని పూరతి చేసతా ం .
लगता है पार टी चल रही है .	చూడ బో తే ఇది పార టీ లా కనిపి సతోంది .
दो इं जन बंद करने पडे .	రెండు ఇం జ నలు పని చేయడం లేదు .
ह जार ों बार सुन चुका हूँ .	లకష ల సా రలు వి ననాను .
इस कारण गे स टा पो तुमहें जा सूस बुला एँगे .	జర మన పోలీసు గె సటా పో మిమమలని గ ూ ఢ చా రి గా పరి గ ణి సతుంది .
कोई बात नहीं . मुझे याद आ गया .	మ రే ం ఫర వాలేదు . నాకు ఇపపుడు గుర తొ చచి ంది .
पता नहीं इसका कया मतलब है , पर लगता है तुमने क सम खा ई .	దాని అరథం ఏమి టో నాకు పూరతి గా తెలియదు కానీ అది అ ధి కా రిక ంగా అనిపి సతోంది .
वैसे , शायद इस स फर में आपको जयादा कुछ देख ने का समय नहीं मिले गा .	కానీ , ఈ పర య టన లో మీరు ఎకకువ గా ఏమీ చూడ లే కపో వచచు .
खैर , मुझे समय दो . मैं बेहतर बन जा ऊँ गी . वा दा करती हूँ .	అయితే , కా సత సమయం ఇవవ ండి . నేను అబ దధ ాలు ఆడ టం ఇంకా మె రుగు పర చు కుంటా . పరా మి స .
- चलो भी . - तुम यह फिर से सुन ना चाहते हो . चलो भी .	- పలీజ . - నీకు మళలీ వి నా లి ఉంది కదా .
बेशक , मैडम .	తపప కుండా , మే డ మ .
ए , देखो एक भाग रहा है .	హేయ , చూడు , ఒక డు పా రి పో తుననా డు .
अ तया चा री की मन मा नी सत ता के वि रु द ध एक इंसान की स व त ं तर ता .	ఏ క ప కష ంగా ఆ ధి ప త యం చె లా యి ంచే ని రం కు శ పాల న నుండి పరతి ఒకక రికీ స వే చ ఛ కల పి ంచాలి .
मैंने सुना है कि वह काफी परति भा शा ली पायलट था .	అతను చాలా మంచి పె లెట అని వి ననాను .
उममीद है कि तुमहारी प तनी ने तुमहें टॉ य ले ट की सी ट नीचे छोड ने के लिए पर शि कष ित किया होगा .	టా యి లెట సీ ట కి ంది కి పెటట మని మీ ఆ వి డ మీకు టర యి ని ంగ ఇ చచి ఉంటుంది .
कुछ ऐसा द सता वे ज बना ने में 5 00 साल ों से जयादा समय लग गया .	మీ అ మె రిక న లకు ఐ దు వ ంద ల సం వ త సర ాలు ప టటి ంది .
मैं बस पूरा स ंग रह सुन रहा हूँ .	అకకడ ఉనన వాటి లలో ఏదో పెటటు కు ని వి ంటుననా ను .
और 3 5 परा र ं भ ि क द लों में से 3 2 गा य ब हो चु के थे .	3 5 మంది వె మా నిక ద ళ ాలు ఉండ గా , వారి లో 3 2 ద ళ ాల సి బబంది గ లల ంత య యా రు .
उ दा हर ण के लिए , अग ले हफ ते थ ॉर प ऐ ब ट स में कि तने बी - 1 7 आने की उममीद है .	ఉ దా హ రణ కి , వచచే వా రం థ ో ర ప ఆ బో ట స లో మళలీ భ ర తీ కా బో యే బి - 1 7 బా ం బర విమా నా ల సం ఖ య గురించి చెపప చచు .
हमने तीन फो रट खो दि ए थे .	మేము మూ డు యు దధ విమా నా లని కో ల పోయా ం .
मुझे ल की सट रा इ क पसंद है .	ల కక ీ సటర యి క నాకు వయకతి గ తంగా ఇషటం .
तुम पायलट ों जैसे अ क ड ू नहीं हो , पर तुम एक कै प टन हो .	పె లెట కి ఉండ ాల సిన పొ గ రు మీ లో కనిపి ంచడం లేదు , కానీ మీరు కె ప టె న అయ యా రు .
वह कल पहुँच ेंगे . और हम उनहें " सब ल टर न स " बुला ते हैं . "	రే ప టి వర కూ రా కపో వచచు , అనుకుంటా . ఇంకా మేము వాళ లని " ఆ ఫీ సర లు " అని పి లు సతా ం .
पर वह इतना दर द ना क था कि कर न ल हार डि ंग ने	కానీ అది ఎంత భ యం కర ంగా సా గి ంద ంటే కల న ల హా ర డి ంగ పర త యే కంగా
आप . . . आप यह च ूक रहे हैं .	ఇ దీ . . . దీని ని మీరు మి స అవు తుననారు .
न यू य ॉर क य ै ं की ज ब नाम स ें ट ल ु इस कार डि न ल स .	న యూ యా రక యా ం కీ స వె ర సె స సె యి ంట లూ యి స కార డి న లస మధయ పో టీ .
ओ ' नी ल का कया ?	ఓ ' నీ ల సంగ తి ఏంటి ?
कया तुम मुझे विमान उ तार ने के नि र देश दो गे ? "	మాకు ల యా ండి ంగ ఆ దే శ ాలు ఇ సతా రా ? "
जब हमें मौ का मिले गा , तुमहें लगता है कि तुम उस ट ख ने के साथ भाग स को गे ?	మన కి ఒక వే ళ అవకా శం వ సతే , ఆ క ాలి మ డ మ తో పరి గె తత గల వా ?
उनके पास घ ो डे हैं .	వీ ళల దగగర గుర ర ాలు ఉననాయి .
और अब यु द ध के द ौ रा न हमें पता चला है कि हमारा साम ू हि क . . .	ఇంకా ఇపపుడు ఈ యు దధ సమయం లో మనం సమ ష టి గా . . .
तुमहें थोडी वह ि स की द ूँ ?	మీకు ఒక గ లా సు లో వి స కీ పో య మ ంటా రా ?
व या खया नों और सा मा जि क कार य कर म ों के बाद ,	ఒక ప కక పర సంగ ాలు , మర ొక ప కక సమా వే శ ాలు నిర వ హి సతు ండ టం వలల ,
पिछ ले हफ ते एक बडी च ै म पि यन शि प थी , है न ?	కింద టి వా రం అకకడ పెదద చా ం పి యన షి ప పో టీ లు జ రి గా యి , కదా ?
और आपको इस बारे में बात नहीं करनी चाहिए . आपको इस बारे में शि का य त नहीं करनी चाहिए .	మనం దాని గురించి మాటలాడు కో ము . దాని గురించి ఏ డు సతూ కూ రచ ో ము .
इस तरफ से च लिए .	మనం దా దా పు గా వచ చేశా ం .
अब हम यहाँ हैं .	ఇది గో మనం ఇకకడ ఉననా ం .
मेरा मतलब . . . देखो .	నా ఉదదేశం . . . అంటే , చూడ ండి .
ऊपर आओ .	పె కి .
उससे बद ला लो , लड कों !	వాడి సంగ తి చూడ ండి , కు ర రా ళ లూ !
वह क ठ ि न मि शन था , पर मैं ठीक हूँ .	అది కష ట ంగా జరిగింది , కానీ నేను బాగానే ఉననాను .
वै सा कुछ भी नहीं है जो अब भी मौ जू द हो .	పా త ది ఒకక టి కూడా కనిపి ంచ దు .
कया कहते हो , तुम और मैं भाग ने की कोशिश करें ?	నువవు , నేను , తపప ి ంచుకో వడానికి పరయతని దదాం అంటే నువవు ఏం అంటా వు ?
जानते हो तुम खुद की मदद नहीं कर रहे हो ?	మీకు మీరు మే లు చేసు కునే లా వయ వ హ రి ంచడం లే దని నేను నమమ చచా ?
एक ही दो पह र में 1 2 0 सै निक मा रे गए .	ఒక మ ధ యా హ నం వే ళ న ూ ట ఇ ర వె మంది సె ని కులు చని పోయా రు .
कयों नहीं आ सकते ?	ఎందుకు రా వు ?
बेशक यह कोई राज नहीं है .	ఖచచితంగా అది జా తీ య ర హ స యం ఏమీ కాదు .
आ यो वा . वैसे , पकका 1 8 4 6 से पहले वहाँ कुछ तो होगा .	ఐ యో వా . కానీ , 1 8 4 6 కి ముందు అకకడ క టటి న వి ఏ వో ఖచచితంగా ఉండే ఉంటా యి కదా .
तुम यह पहले भी सुन चु के हो ?	ఇంత కు ముందు వి ననా వా ?
अ त य धि क पर शि कष ित सुरकष ा ब लों के मेरे स ह कर मी नहीं समझ पा एँगे .	తీ వర మెన భా వ జ ాల ంతో ఉండే ర కష ణ ద ళ ాల లో ఉండే నా స హ ఉద యో గు లు మిమమలని అరథం చేసుకో లే కపో వచచు .
इसकी काफी कम संभा वना है कि आपको परि सर से बाहर निकल ने का समय मिले गा .	మీరు క యా ం ప స దా టి బయటకు వెళ లే అవకా శం ఉండ కపో వచచు .
अ मरी की .	అ మె రిక నలు .
यह रहा आँख पर लगे की च ड के नाम .	ఇది గో , మీ క ళ లలో మ టటి .
ब डे दा ं व खेल ने वाला .	పెదద ఖ రచు గా డు .
और वे जि तनी ते जी से हो स के , सोच ने लगे कयोंकि यह विमान	వాళలు సా ధయ మెన ంత వే గ ంగా ఆలోచ నలు చేశారు
कया सं देश है ?	అది ఏంటి ?
वाह . अ ंग रे ज ों ने सच में पहली बार सट ीक नि शा ना लगा या .	ఛ . బ రి టన సె ని కులు ఈ సా రికి మొ త తా నికి ఒక లకష యానని ధ వం సం చేయ గ లి గా రు అనుకుంటా .
