गो ल डी , मेरे डै डी को तीन म ही ने पहले गिर फ तार किया गया था .	గో ల డీ , నా నానన ని మూ డు నె లల కరి తం అ రె సట ు చేశారు .
एक हि ल ती हुई प ट टी लट का दो जिस पर ढ ि ल लों लि खा हो .	వె లు ప ల బో ర డు ని వే లా డ దీ య ండి దాని పె న ధి లలో న అని వ రా య ండి .
तुम अपने परिवार के अन य स दस यों को साथ ला सकते थे .	మీరు ఇ తర కుటుం బ స భ యు లను తీసుకు రా వాల సింది .
कया मजाक कर रहे हो ? मैं तुमहारा मा मा हूँ !	నీ వు నాతో సర దా చేసతుననా వా ? నేను నీ తల లి సోద రు డు !
सिरफ गो ल डी को ब धा ई कयों ? आपको सभी को ब धा ई दे नी चाहिए .	ఎందుకు గో ల డీ ని మాతరమే అభి న ంది ంచారు ? మీరు అంద రి ని అభి న ంది ంచాలి .
- हाँ . यह कुछ और है . - हाँ , कुछ इसी तरह की .	- అవును . అది ఏదో . - అవును , అలా నే ఎ దో .
शायद उन में से दस जो डे मुझे को स रहे होंगे .	బహుశా ఒక 1 0 జ ంట లు ననను శ పి సతు ంటా రు .
- न मस ते . - आओ , बाकी बात अंदर जाकर करते हैं .	- హలో . - లోప లి కి వెళళి మాటలా దు కు ందా ం .
वैसे , बाहर ग न ना बे च ने वाला स टा ल है .	ఒక దు కా ణ ము ఉంది వె లు ప ల చె ర కు అమ ము తుననారు .
यह सब देख ने से पहले मैं मर कयों नहीं गया ?	నేను ఇ వి చు సే బ దు లు చని పోయి ఉండాలి ?
गो ल डी कि रा ए दार की प तनी को ग ले लगा रहा था .	అ దద ె దారు ని భా రయ ను క ౌ గి లి ంచు కుననా డు .
ज स , पूरा जि ंग बा ंग तुमहारा पी छा कर रहा है .	జా స , వాళళ ంద రూ నినను వె ం బడి సతుననారు .
हम जो डी बन वा ने वाले को भी अचछी र कम देंगे .	సంబం ధం కు ది ర చే వాళళ కి కూడా బాగానే డబబు లు ఇ సతా ము .
ढ ि ल लों साह ब , गो ल डी को इन दे हा ती तरी कों का उप यो ग करके ठीक नहीं किया जा सकता .	మిసటర ధి లలా న , ఈ ఈ మో టె న వి ధా నా లను ఉ ప యో గి ంచి , గో ల డీ ని న యం చేయ లే ము
आँख ें बंद करके कुछ नहीं होगा ,	క ళళు మూ సు కు ంటే నేను లే నన న టటు కా ను .
मैं अपनी बेटी को बा दा म खिला कर	నా కూ తు రు కు బా దాం పప పు లు తి ని పి ంచి
भ ु ल ल र साह ब , मेरे पास कई रिश ते हैं .	భు లలా ర , నా దగగర అనే కం ఉననాయి .
मैं तुमहें सो ने की ई ंट दू ं गा .	నేను మీకు ఒక బంగా రు ఇ టు కను ఇ సతాను .
मैं आपका बेटा नहीं हूँ जो मैंने ऐसा होने दिया . मुझे हाथ लगा कर दिखा ओ .	మి మ లని అలా చేయ ని సతే నేను ని కొ డు కే కాదు . ననను తా కి చు డ ండి .
भा भी , इन फ ूल ों में कुछ खास बात है .	మర ద లా , ఈ పు వ వు లు పర త యే క మెన వి .
परि य , तुमहारी नजर त ल वार बन गई	పరి యా , మీ కో ల ఒక పరా ణ ా ంత క మెన ఆ యు ధం
परि य , तुमहारी नजर त ल वार बन गई	పరి యా , మీ కో ల ఒక పరా ణ ా ంత క మెన ఆ యు ధం
तुमने इसमें कि तने र ंग करे हैं	నువవు వాటి కీ భి నన మెన రం గు లు వే శా వు
उन दो ना च ने वाले भ ूत ों की स थि ति कया है जो अब भी इस घर में घ ू म ते हैं ?	ఆ రెండు న యం చేసే ద ె యయ ాల క థ ే ంటి ఇంకా అవి మీ ఇంటి ని వ దల లేదా ?
उनहोंने उसे दे कर कहा , " जब वो तुमहें मिले , तो उसे पी ला देना . "	వారు అతని ని చు కక లు ఇ చచి , వాళళు కనిపి ంచా క నువవే ఇవ వు .
वह सु बह सबसे पहले उसके पै र छ ू ता है .	ఉద యం మొద ట చేసే పని అతని క ళళ కు నమ స కరి ంచడం .
तो मैं उसके कान में कहूँ गा .	అయితే గు స గు స గా తి డ తాను .
लेकिन तुमने उस दिन हमें उसके बारे में कयों नहीं बताया ?	కానీ ఆ రోజు అతని గురించి మాకు ఎందుకు చెపప లేదు ?
पिता जी ने मुझे सुन वाई के लिए अ दा लत में आने को कहा था .	నానన ననను వి చా రణ కోసం కోర టు కు వెళళ మని అడి గా రు .
तुम नर क में जाओ , बद मा श .	నువవు న రక ంలో చా వు , దు ష టు డా .
इसे महसूस नहीं कर सकता , लेकिन मैं उसके काम पर चि ल ला या .	అను భ ూ తి లేదు , కానీ నేను అతని చ రయ ల వల న అ రి చా ను .
मेरी मदद करो ! उसे रो को !	నాకు సాయం చె య యి ! అత నని ఆ పు !
भ ूत जै सी कोई चीज नहीं होती .	ద యయ ాలు వ ంటి వి ఏ వీ లేవు .
अं कल , मान ो या ना मान ो , मुझे लगता है वो सच बोल रहे हैं .	అ ం కు ల , నమమ ండి నమమ కపో ండి . అతను నిజం చెప తుననా డు .
हम एक घं टे बाद मिल ेंगे .	ఒక గంట తరువాత మనం కలు ద దా ము .
जी जा जी , बाकी ना ट क हमारे घर पर करते हैं .	బా వ , మి గి లి న డ రా మా మనం ఇంటికి వెళలి చేసు కు ందా ం .
वो मरी , कयोंकि वो अपने बा ल खु ले रख ती थी .	వారు జు టటు వి ర బో సు కొ ని ఉండే వాళళు కాబటటి చచ చా రు .
देख , उसने अपना अस ली र ंग दिखा ना शुरू कर दिया है .	ఆమె నిజ మెన రం గు లను చూ ప డం మొద లు పె టటి ంది .
मैं तुमसे जयादा पार व ती कौ र से गु ससा हूँ .	నేను నీ పె న క ననా పార వ తి పె న ఎకకువ కో ప ంగా ఉననాను .
उसने अपने परिवार के सामने मेरी बे इ जज ती करवा दी .	అతను ఆమె కుటుం బం ముందు ననను అవ మా ని ంచా డు .
- उसका स सु र कौन है ? - तुम हो .	- ఆమె మా మ యయ ఎవరు ? - మీరు .
कयोंकि तुमने हा ई सक ूल भी पूरा नहीं किया ,	నువవు హె స కూ ల కూడా పూరతి చెయయ లేదు .
हमें इसे मो ड ना होगा ?	మనం దాని తి పప ాలా ?
अब वह वही श बद को दो हरा रहा है . . .	అతను అదే ప దానని మళళీ మళళీ అ ంటుననా డు . . .
- न मस ते . - ये लडकी है .	- హలో . - ఇది వ ధ ు వు .
लेकिन जब मैं उससे मी त की शादी करने को तैयार था . . .	కానీ అతనికి మీ తను ఇ చచి పెళళి చేయ డానికి సిదధ ంగా ఉనన పపుడు . . .
तो हम भगवान पर भरो सा नहीं कर सकते ?	కాబటటి మన ము దేవు ని పె న నమమ కం పెటటు కో లే మ ?
मुझसे गलती हो गई .	నేను ఒక తపపు చేశా ను .
चलो खुशी के गी त गा ए ं	ఒక సంతోష ంగా పా ట కు
चलो खुशी के गी त गा ए ं	ఒక సంతోష ంగా పా ట కు
आप कया कह रहे हो ?	నీ వు ఏమి చెప తుననావు ?
आप कया कह रहे हो ?	నీ వు ఏమి చెప తుననావు ?
मैंने पहले ही उनहें तुम दोनों के कारण काफी उ क सा या है .	నేను ఇ పపటి కే త నని పరే రే పి ంచా ను మీరు ఇదద రి వలల .
उसने मेरे कि रा ये दार से शादी की है .	ఆమె నా ఇంటి అ దద ె దారు ని వి వా హం చేసు కు ంది .
हम आज ही सब कुछ प का कर ले ते .	ఈ రోజు అంతా మాటలా డే సు కు ందా ం .
जो हर दिन लोगों को के स जि ता ता है .	నా ననను నువవు ఎ నన డ ూ పొ గ డ లేదు .
और मैं खुद में में खो या रह ता हूँ .	అని ప నికి మ ాలి న మాట లు చెపప ను .
लेकिन आज , मैंने सी खा कि . . .	కానీ నే డు , నేను నే రచు కుననాను . . .
अब उसे मार ने में मजा मत करो .	కొ టటే సమయం లో ఇపపుడు ఆన ంద ంగా లేదు .
ज स , वे हमें यहाँ ढूँढ ल ेंगे .	జా స , వాళళు మన లని ఇకకడ కను కుంటా రు .
कया तुमहारा मतलब है , तुम कभी पै सा नहीं क मा ओ गे ?	నీ ఉ దద ె ె ె ే శం , మీరు ఏ డబబు ను సం పా ది ంచ వా ?
वे इस तरह एक - दूसरे का हाथ कयों पक ड ेंगे ?	ఎందుకు వారు ఒక రి చే తులు ఒక రు ఇలా పెటటు కుంటా రా ?
और भगवान हमेशा सु ंदर म हिला की सुन ता है .	దేవు డు ఎ లల పపుడ ూ ఒక అంద మెన సత రీ కి మాట ే వి ంటా డు .
उनहोंने पू रे घर की त ला शी ली , लेकिन बच चा नहीं मिला .	వారు మొతత ం ఇంటి ని శ ో ధి ంచారు కానీ తన బి డ డ ను కను గొ న లేక పోయా డు .
- साह ब जी , मुझे मत रो को . मुझे कू द ना है . - नहीं ! मत करो , च न नो !	- ననను ఆ ప క ండి . నేను జ ం ప చేసతాను . - వదదు ! వదదు , ఛ నన ో !
कयों ? कया मेरा सी - से क शन हुआ है ? आप मेरी से ह त पूछ ने कयों आओ गे ?	ఎందుకు ? నాకు సి - సె కష న అయి ందా ? ఎందుకు నా ఆ రో గ యం గురించి అడ గ టానికి వచచా రు ?
अगर मैं बिल लू बं स ल की बेटी से शादी कर ल ूँ , तो हम इस झ ं झ ट से बच सकते हैं .	బి లలు బ నస ల కూ తు రి ని పె ళ లి చేసు కు ంటే దీని నుంచి తపప ి ంచుకో వచచు .
तुम और तुमहारे पिता की सोच च प पल तक ही है .	నువవు , నీ త ండ రి చెపపు ల క ననా ము ందుకు ఆలోచి ంచ లే రు .
दुनिया मुझे दे सी रॉ कस टा र कह ती है !	పరప ంచా నికి నేను దే శ ీ రా క సటా ర లా తెలుసు !
वह मेरे साथ अचछी है , मुझे लगता है	ఆమె నాతో మంచి గా ఉంది , నేను భా వి సతుననాను
मुझे सच बताओ .	నిజం చెపపు .
हे भगवान , मैंने अपनी दवा कयों नहीं खा ई ?	ఓహ గా డ , నా మాతర ఎందుకు తీసుకో లేదు ?
चलो चल ते हैं .	వెళ దాం ప దా .
चलो चल ते हैं .	వెళ దాం ప దా .
हाँ , पिता जी ?	చెపపు నానన ?
चलो . उसे बाहर से पक डो .	బయట నుండి అత నని పటటు కో ండి .
तुम जाओ . जाओ .	నీ వు వే ళళు .
हम शादी करने के बाद तो लड ते ही र हें गे . तो कया फा य दा ?	మనం పె ళ లి తరవాత కొ ట లా డు తు ంటా ము . ఉ ప యో గం ఏంటి ?
पागल हो गए हो ? अं कल , हमने पत थ र मार ने से मना किया था .	మనం చని పోయా మా ? అ ం కు ల , ఆ రా యి ని వా డ దదు అనన మా .
- हाँ , अं कल . फ ूल के ग म ले से मत मार ना . - पिता जी , भा गो !	- అవును , మా మ యయ . ప ూ లకు ండ ీ తో కొ టట దు . - డా డీ , ర న !
बात सुनो . . .	విన ండి . . .
इसे जलदी से खतम करो और गा ना शुरू कर दो .	తవర గా ము గి ంచి పా ట ను పరా రం భి ంచండి .
आपको पता नहीं कया हुआ ?	మీకు ఏమి జరిగి ందో తెలియదు ?
मैं उन दोनों को मार दू ं गा !	నేను ఇదద రి నీ చం పు తాను !
- कया ! - कया !	- ఏంటి ! - ఏంటి !
मैं कुछ करता हूँ .	ఏదో ఒకటి ఆలోచి సతాను .
उसकी शादी मेरे कि रा ये दार से हुई , और तुम कह रही है इससे शादी की है .	ఆమె నా అ దద ె దారు ని పెళళి చేసు కు ంది కానీ అతని ని పెళళి చేసు కు ందని మీరు అ ంటుననా రు .
सवागत है . . .	సవా గ తం . . .
मैं खुशी राम नहीं जा सकता , इसलिए मैंने इसे एक स था नी य ह ल वाई से ख री द लिया .	ఖ ు సీ రా ం దగ గ రికి పో లేక పోయా ను అందు క నే దగ గ రి లో నుండి తె చచి నా ను .
ह नी . . .	హ నీ . . .
एक चु डै ल और एक भ ूत ने मिल कर इस रा कष स को जन म दिया .	ఒక మ ంత రగ త తె మరియు ఒక ద ె య యం కలిసి ఈ రా కష సు డి కి జ న మని చచి ంది .
- सच में ? मैं जाकर देख ता हूँ . - नहीं . अंदर मत जा इए .	- నిజంగా ? ననను వెళలి చూ సతాను . - కాదు , లేదు . లోప లకు వెళల వదదు .
दु ल ह न का भाई . बडा भाई .	వ ధ ు వు సోద రు డు . పెదద అనన యయ .
- तुमहें और ह नी को शादी करनी है . - शादी तो . . .	నువవు హ నీ పె ళ లి చేసుకో వాల ను కుంటుననా రు .
मेरी बेटी से तो तुमहें शादी करनी होगी .	నా కు మార తె ని మీరు వి వా హం చేసుకో వాల సి ఉంటుంది .
दो पै रो वाली कोई भ ै ंस नहीं होती .	రెండు కా ళళ గే ద ె అనే ది లేదు .
वो गया था , मैं नहीं गया था .	అతను అది హా జర య యా రు , నేను కాల ేదు .
हम शर न की शादी में मिले थे .	మేము శ రణ వి వా హం లో కలు సు కుననా ము .
तुमने कया किया है , तुम बेवकूफ ों !	మీరు ఏమి చేసా రు , వెధ వల లా రా !
कभी - कभी पै र सो जाता है , ज स .	కొనని సా రలు క ళళు ప టటే సతా యి , జా స .
म जब ूत बन ो , सब ठीक हो जाएगा .	ద ె రయ ంగా ఉ ండు , అంతా బా నే ఉంటుంది .
मैंने पयार से स गा ई कर ली थी	మేము రి ం గు లు పరే మ గా మా రచు కుననా ము
किसी ने अस पता ल में हमारे साथ अपने बचचे को बदल दिया .	ఆ సు ప త రి లో ఎవరో తమ బి డ డ ను మా తో మా రచు కుననా రు .
लेकिन आज , मैंने एक बात सी ख ी . आप हो श िया र हो .	కానీ నే డు , ఒక విషయం నే రచు కుననాను . మీరు తెలి వెన వారు .
हे भगवान , वह आपकी बह ू को इन ती अके ली जगह पर ला या है .	అతను నా కో డ లి ని ఇ టు వ ంటి చో టు కు తీసు కొ చచా డు .
मुझे बहुत नी ंद आ रही है . मैं सो ने जा रहा हूँ .	నాకు ని దర వ సతోంది . నేను ని దర పో తుననాను .
- मुझे यकीन है वे सिरफ चो र हैं . - साह ब जी , मैं थ क गई . मैं तुमहें छ ू ल ूँ ?	- వాళళు దొ ంగ లే అయ యు ంటా రు . - సర , నేను అ ల సి పోయా . మిమమలని తా క నా ?
मैं इतना अचछा वय व हार कर ूं गा . . .	నేను చ కక గా పర వర తి సతాను . . .
- तुम हमें ग री ब कह रहे हाँ ? - हाँ .	- నువవు మమ మ లని పే ద లు అ ంటుననా వా ? - అవును .
हम तु र ंत चल ेंगे .	మనం వెంట నే వెళ తా ము .
तुम भी मिल लेना .	మీరు అత నని కల వ వచచు .
और जहाँ तक तुमहारे पिता की बात है . . .	మీ త ండ రికి సంబం ధి ంచిన ంత వర కు . . .
आपको शर म आ नी चाहिए .	మీరు సి గ గు పడ ాలి .
कुछ भी ठीक नहीं है .	ఏ దీ సరి గగా లేదు .
- कया अब तुमहें महसूस हो रहा है ? - नहीं .	- ఇపపుడు ఏమెనా తెలు సతు ందా ? - లేదు .
- साह ब जी ! - चु प रहो !	- సర ! - నో రు ము య యి !
इतने ब डे ब ंग ले का वह कया करेंगे ?	అ టు వ ంటి పెదద బ ంగ ళ ాలో అతను ఏమి చేసతా డు ?
- मैं बा इ क पर हूँ . - मैं तुमहें बा इ क पर भी नहीं जाने दू ं गा .	- నేను బె క లో ఉననాను . - నేను నినను బె క వెళళ నివ వ ను .
हम उसका कया करेंगे ?	ఆమె ఏమి చేయ వచచు ?
मी त , हमें छ ि प ना पडे गा .	మేము దా చ వల సి ఉంటుంది .
जो तुम उसके गु जर ने के दिन छु ट टी मा ंग रहे हो ?	ఆమె చని పోయి న రోజు సె ల వు అడుగు తుననావు ?
बेशक , यह तुमहारे लिए कोई मुशकिल काम नहीं है .	వా సత వా నికి , ఇది మీకు కష ట మెన పని కాదు .
- हाँ , मेरे पिता श हर से बाहर हैं . - ओह .	- అవును , మా నానన ఊ రికి వెళ లా రు . - అవునా అలా గా .
तुमने मुझे किसी लड के के बारे में नहीं बताया .	నువవు ఏ అబబా యి గురించి నాకు చెపప లేదు .
कि समय पर आओ कयोंकि उनहें अ दा लत बंद करनी है .	టె ం కి ర మమ ని లే కపో తె కోర టు మూ సే సతా రని .
मैं भी ! उसने मुझे सबसे जयादा चो ट पहुँ चा ई है .	నేను కూడా ! అతను ననను చాలా బాధ పెటటా డు .
साह ब , जैसे गा य क गा यन के द ौ रा न लोगों के साथ बात ची त करते हैं . . .	సర , పా టలు పా డే ట పపుడు పా డే వారు జ నా లతో మాటలా డి న టటు . . .
तुम म ू ड में कयों नहीं हो !	ఎందుకు నీకు మూ డ లేదు !
तुमहारा पयार परे शान करता है मुझे सो ने नहीं दे ता है	మీ పరే మ సమ స యా తమ క మెన ది , ఇది ననను ని దర పో నీ దు
