जे र ला म रे ल .	జె ర లా మ రె ల .
कृपया रो दो . कृपया जी वि त रहो .	దయచేసి ఏ డ వ ండి . బర తి కే ఉండ ండి .
अरे ! नहीं !	హేయ ! వదదు !
अरे ! अरे , मेरी ओर मु डो !	హేయ ! హేయ , నా వెపు చూడు !
अरे , मेरी ओर मु डो !	హేయ , నా వెపు చూడు !
जे र ला म रे ल . . .	జె ర లా మ రె ల . . .
उसे बता ना कि बॉ कस की चीजें मेरे बच चों के लिए है .	ఆ పెటట ె లో ని వ సతు వు లు నా పిలల ల కో సమ ని తన కి చెపపు .
जे र ला म रे ल !	జె ర లా మ రె ల !
जे र ला म रे ल .	జె ర లా మ రె ల .
जे र ला म रे ल !	జె ర లా మ రె ల !
- कया य हां कोई कान ून नहीं है ? - हम य हां के कान ून से बहुत दूर हैं .	- ఈ పర దేశం లో చ టట మ నే ది లేదా ? - మనం ఇకకడ చ టట ానికి చాలా దూ రా న ఉననా ం .
बा बा व ॉ स ?	బా బా వా స ?
छा या . . .	ఛ ా యా . . .
कया यह हां है ?	అది స మమ త మే ననా ?
छा या ?	ఛ ా యా ?
ए बी सी	ఏ బీ సీ
तुमहें कुछ अलग पता है , मा घ रा ?	కా దని నీ కే మెనా తెలుసా , మా గరా ?
बा बा व ॉ स . . .	బా బా వా స . . .
हम अके ले नहीं है .	మనం ఓ ంట రి గా లే ము .
छा या ?	ఛ ా యా ?
छा या ?	ఛ ా యా ?
वह नहीं बो ले गी .	తను మాటలాడ లేదు .
बहुत सा री घ ा ट ियाँ और न दिया ँ हैं . इसमें साल ों लग ेंगे .	లో య లూ , న దు లు చాలా ఉననాయి . దానికి ఏ నన ో ఏ ళళు పడు తుంది .
मुझे सो ने में दि क कत होती है .	నాకు ని దర సరి గగా ప టట డం లేదు .
और मैं स वय ं बोल ने वाले को ढूँढ ता हूँ ,	నాకు నేను గా ఆ మనిషి ని కను క కను కక ొ ంటే ,
दू त !	ధ ూ త !
रा नी के लिए एक सं देश है .	మ హా రా ణి గా రికి ఓ ని వే ది క .
घ ृ ण ा और परति शो ध यह वह दो चीजें हैं जो उसे परे रि त करती हैं .	ఎందుకంటే అత డిని న డి పి ంచే వి రెండ ే రెండు , వి ద వే ష ం , పర తీ కా రం .
कौन अन य लोग ?	ఎవ రా ఇ తరు లు ?
लोग आपकी शक ति पर सवाल उठा रहे हैं .	జ నాలు మీ అ ధి కా రా నని పర శ ని సతుననారు .
और मैं तुमहारे दवा रा एक बार इन कार की गई भगवान बन ूं गी .	అంతే గా క ఒక పపుడు నువవు వ దద ను కునన నేను , దే వ త ని అవు తాను .
जिन हें मैंने अपना लिए व फा दार मा ना .	ఎవరి నె తే నేను వి ధ ే యు లని భా వి ంచా నో .
सच जो आप सभी जानते हैं .	మీక ంద రికీ తెలి సిన నిజం .
यह सच है .	ఇది నిజం .
लेकिन सबसे बडी ल डा ई जो मैं लड रही ह ूं , वह है पर का श के खिला फ . . .	కానీ నేను నా అ తి పెదద యు దధ ా నని కా ంతి కి వయ తి రే కంగా చేసతుననా ను . . .
एक शक ति जो , एक बार फिर ,	బాగు పడి న పరప ంచా నని మళలీ
उनकी पी ठ पीछे का ना फ ू सी नहीं करनी चाहिए .	వారి వె నుక దే శ ద రో హ పు ప లు కులు ప లు కక ూ డ దు .
हम प वि तर हैं	మనం పు నీ తు ల ం
हम प वि तर हैं	మనం పు నీ తు ల ం
मैं बच चों के लिए गु ला ब का फ ल ला ई हूँ .	నేను పిలల ల కి కొనని రో జ ప ళళ ను తె చచా ను .
मा घ रा . . .	మా గరా . . .
इसे कहीं भी रख दो , कहीं भी ज हां तुमहें अचछा लगे , बस चु प चा प .	దానని ఎకకడ ెనా , నీకు ఎకకడ కావాల ంటే అకకడ , శ బ ద ం రా కుండా పెటటు .
बा बा !	బా బా !
मुझे पता है .	నాకు తెలుసు .
और , ऐसा कह कर , वह जाने लगा .	అలా అని , అతను వెళలి పోయా డు .
कयोंकि , उसके आने से पहले , वे सभी पूरी तरह से सं तु ष ट थे .	ఎందుకంటే , అతను రా క ముందు , వాళళ ంద రూ స ంత ృ ప తి గా ఉండే వాళళు .
किस बारे में ?	దే ని గురించి ?
जे र ला म रे ल का कया ?	మరి జె ర లా మ రె ల కి ?
मा घ रा ?	మా గరా ?
नहीं .	కాదు .
ह नि वा . . .	హ నీ వా . . .
नहीं .	కాదు .
आगे बढ ो .	కా నివ వు .
वे वि शा ल का य ज हा ज ों से प ृ थ वी के बाहर भी गए .	భా రీ న ౌ క లలో భ ూ మి ని వది లి వెళలి పోయా రు కూడా .
जे र ला म रे ल . "	జె ర లా మ రె ల . "
बा बा ?	బా బా ?
तुमहारे पास ?	మరి నీ దగగర ?
कुछ लोगों ने कहा ग रह को वि ना श से बचा ने के लिए भगवान ने उनसे द ृ ष टि वापस ले ली थी .	ఈ గర హం నా శ నం కా కుండా కా పా డ టానికి దేవు డే వారి చూ పు ను లా గే సు కుననా డని కొ ంద రు అంటా రు .
जा ल सा जी से बच ने के लिए वह हमेशा हर दस व ें श बद पर दिल बा ं ध ता है ,	న కీ లీ చేయ కూడ దని పర తీ పద వ ప ూ స తరవాత ఎపపుడూ అత నో హ ృ ద యానని క డ తా డు ,
और बा रह साल ों के लिए हम इस पर कोई बात नहीं करेंगे .	ప నన ె ండ ే ళళ వర కు , మనం దీని గురించి అస స లు మాటలాడ కూడదు .
हम पे ड की छा ल से एक न ई दुनिया कैसे बना सकते हैं ?	ఓ చె టటు బె ర డు తో కొతత పరప ంచా నని మన మె లా స ృష టి ంచ గల ం ?
लेकिन चु डै ल ढूँढ ने वा लों ने उन सभी को ज ला दिया .	కానీ మా ంత రి కా ంత కు డు వాటి నన ని ంటి నీ దగ ధం చేసే శా డు .
अ भ यार ण य में , झ र ने के पास , एक छो टी सी गु फा है .	ఆ శ ర మ ం వ దద , జ ల పా తా నికి ప కక గా , ఓ చి నని గు హ ఉంది .
हमें उनहें बह ुम ूल य बी ज ों की तरह द फ ना ना चाहिए .	మనం వీ టి ని అ మూ ల య మెన వి తత నా లలా గా ప ూ డ చి పెటట ాలి .
अगर किसी को कुछ कहना है , तो कृपया , गे दर बै कस ,	గె థర బా కస , ఎవరెనా ఏదెనా చెపప ాలను కు ంటే , దయచేసి ,
तो जे र ला म रे ल ने जो बताया , वह सच था , बा बा व ॉ स .	అయితే జె ర లా మ రె ల నీకు చెపపి ంది నిజ మే , బా బా వా స .
" रुको ! तुमहारा नाम कया है ? " उनहोंने उसे पूछ ा .	" ఆగు ! నీ పే రే ంటి ? " అని వాళళు అత డిని అడి గా రు .
तुमहारे दवा रा देख ी गई चीज ों के बारे में सोच ो .	నువవు వీ కషి ంచిన ద ృ శ య ాల నని ంటి నీ గురతు తె చచు కో .
छा या , कया तुम एक चु डै ल पर नजर रख सकती हो ?	ఛ ా యా , నువవు మ ంత రగ త తె ని ఛ ా య లా వె ం బడి ంచ గల వా ?
- तो उसे मत बता ना . - तुम मुझसे झूठ बु ल वा ओ गी ?	- తన కి చెపప వదదు . - ననను తన తో అబ దధ మా డ మ ంటా వా ?
शायद द ृ ष टि के बारे में कहा निया ँ सच हैं .	చూ పు గురించి చెపపు కో నే క థ ల ననీ నిజ మే ఏ మో .
ह य ची न थ के पे ड के नीचे कि ता ब ें द फ ना दो .	పు సత కాల ను గో మే ధ వ ృ కష ం ప కక న ప ూ డ చి పెటటు .
ज ञ ा न जो एक न ई दुनिया की शुरू आत करे गा .	ఓ కొతత పరప ంచా నని ఆ రం భి ంచ గల జ ఞ ా న సం పద .
कया तुम एक चु डै ल पर नजर रख सकती हो ?	నువవు మ ంత రగ త తె ని ఛ ా య లా వె ం బడి ంచ గల వా ?
और एक दिन , हमारी परा र थ ना सु नी जाए गी .	ఏదో క రోజు , మన పరా రథ నలు ఆ ల కి ంచ బడ తా యి .
मैं वि न मर ता पू र व क नि वे द न करता ह ूं हमें पा यान वापस लौट ने की अन ुम ति द ें .	తిరిగి ప యా న కి వచచే ందుకు మాకు అను మ తి ఇవవ వల సింది గా స విన య ంగా కో రు తుననాను .
और तुम में से एक बहुत बद सू रत है . "	ఇం కొ క రు కు రూ పి అని నేను చెపప గలను . "
बा बा व ॉ स और मैंने एक नि रण य लिया है .	బా బా వా స , నే న ూ ఓ నిరణ యా నికి వచచా ం .
फिर से दुनिया बना ने की हि दा य त के साथ केवल चु ने हुए लोगों को दिया गया .	మర లా పరపంచ నిర మా ణం చే ప టట ాల నే ఉ ప దే శ ంతో ఎ నను కొ నన వారి కే అది వ వ బ డు తోంది .
और मैंने यह उप हार तुमहें दिया है .	ఈ కా ను కను మీకు నేను అంద జే సతుననాను .
अगर तुमहें लगता है वे अभी भी बहुत छो टे हैं , तुम कब तक इंतजार करो गी ?	వాళ లి ం కా ప సి పిలల లే అని నువ వ ను కు ంటు నన ప కష ంలో , ఇం కె ంత కాల ం ఆగు తా వు ?
और घ ा टी में भा लू को मार ने के लिए .	ఇంకా ఈ లో య లో ఎ లు గు లను చం ప డానికి .
इससे पहले कि मैं उनहें ढ ूं ढ लू ं .	నేను వాళళ ని ముందు గా కను క కో క ము ందే .
और तुमने अपने घर ों को खो दिया .	మీరు మీ ఇ ళళ ను కూడా కో ల పోయా రు .
मैं कह ता ह ूं हम सच छ ि पा ते हैं .	మనం నిజ ా నని దా చ ాలని నే న ంటా ను .
दुनिया को जी तने के लिए किया .	మను ష ు లు పరప ంచా నని ఆ కర మి ంచారు .
और उसकी से वा का हर एक दिन , वह जे र ला म रे ल का शि कार करे गा .	ఆ సే వ లో భా గ ంగా పర తీ రోజు అతను జె ర లా మ రె ల వే ట లోనే గ డు పు తా డు .
" लेकिन हम में से कौन सा कौन है ? " उनहोंने उससे पूछ ा .	" కానీ మ ాలో ఎవరు , ఎవరు ? " అని వాళళు తమ అనన యయ ని అడి గా రు .
य दि उनका रह स य बाहर आ गया ,	ఒక వే ళ వారి ర హ స యం బయట పడి నా ,
कोई ऐसी जिस के पास अपने श री र को छ ि पा ने की शक ति हो .	తన దే హా నని తాను దా చు కో గల నే ర పు గల యు వ తి అయ యు ంటుంది .
बा बा व ॉ स कान ून नहीं है .	కానీ బా బా వా స చ టట ం కాదు .
मुझे तुमहारा सं देश मिला .	నాకు నీ స ందే శం అ ంది ంది .
जब तक हम यह नहीं जान जाते कि उनके पास कष म ता है ,	వాళళ కి ఆ శ కతి ఉ ందని మన కి ఖచచితంగా తెలి సే వర కూ ,
वे . . . वे कि ता ब ें हैं .	ఇ వి . . . ఇ వి పు సత క ాలు .
एक साथ , हम दुनिया को नए सि रे से शुरू करेंगे .	మనం కలిసి క టటు గా ఈ పరప ంచా నని న ూ తన ంగా నిర మి దదాం .
और वे सभी रो ज खुशी - खुशी एक साथ काम करते थे ,	వాళళ ంద రూ పర తీ రోజు ఆన ంద ంగా కలిసి పని చేసే వాళళు ,
वह तीन म ही ने की गर भ व ती थी . उसने कभी नहीं बताया कि उनका पिता कौन था .	తను అపపుడు మూ డు నె లల గర భి ణి , ఆ బి డ డ కి త ండ రె వర ో తన ె నన డ ూ చెపప లేదు .
जो भी द ृ ष टि ने कहा यह सोच ने में हर एक ने इतना समय बि ता या कि . . .	చూ పు చెపపి న దాని గురించి వాళళు చాలా సమయం ఆలోచి ంచడం మొద లు పెటటా రు . . .
मैं कभी नहीं भूल ूँगा .	నేను ఎ పపటి కీ మర చి పో ను .
लेकिन हमें उममीद होगी .	కానీ మన కి ఆ శ ఉంటుంది .
हम य हां हमेशा से अके ले रह रहे हैं , अं ध विश वास से भ रे गा ं व में .	మన మి కకడ , మూ ఢ నమమ కాల తో ని ండి ఉనన ఈ గరా మ ంలో ఒ ంట రి గా చి ర కాల ం ఉండాలి .
" हम म ही नों से सू र या सत होने की जगह के प हा ड ों में ढ ूं ढ रहे हैं .	" మేము ఎ నన ో నె లల నుండి స ూర యా సత మ య పరా ంత ంలో ని కొ ండ లలో గ ాలి సతుననా ము .
- रुको , ह नि वा . - को फु न .	- ఆగు , హ నీ వా . - కొ ఫ ూ న .
ट ै मै क टी जू न शा ही कर स ंग रह करता है और शा ही चु डै ल ढूँढ ने वाला .	ట మా క టీ జ ూ న , రా జ సంబం ధ ప నను సే కర త మరియు రా జ సంబం ధ మా ంత రి కా ంత కు డు .
लेकिन जब बह नों और भा इ यों ने उससे पूछ ा कि उसने कया किया . . .	కానీ తన అననా చె ల లె ళళు నువవే ం చేశా వు అని అత డిని అడి గి నపపుడు . . .
- ह वा जो मैं महसूस कर रही हूँ . . . - हां .	- నాకు గ ాలి లో ఏం తెలు స తో ంద ంటే . . . - అవును .
बॉ कस में और कया है ?	పెటట ె లో ఇం కే ము ననా యి ?
छा या झूठ बोल रही है !	ఛ ా య అబ దధ ం చెప తోంది !
ठीक है . अचछी बात है .	మంచిది . అది మంచి దే .
उनका पसंद ी दा खि लौ ना .	వాళళ కి ఇష ట మెన బ ొ మమ .
कया तुमहारे पास है ?	బ ొ మమ ని కని పెటట ే శా వా ?
तुम दो , जु ड वा ं , पहले से ही उसके अंदर थे .	మీ క వల లి దద రూ అ పపటి కే తన గర భ ంలో ఉననారు .
" ट ू किल ए मो कि ंग बर ड "	టు కి ల ఏ మా కి ంగ బర డ
ये जु ड वा ँ एक न ई दुनिया की शु रु आत हैं .	కొతత పరపంచ ం ఆ రం భా నికి ఈ క వల లు పు నా దు లు .
सर दि यों के अ ंत में , एक म हिला हमारे गा ँ व में भ ट क गई थी .	శ ీ తా కాల ం ము గి సే సమయం లో , ఓ మ హి ళ మా గరా మ ంలో కి పర వే శి ంచింది .
अरे ! मेरी तरफ देखो !	హేయ ! నా వెపు చూడు !
और तुमहें कैसे पता चले गा जब वह आए गी ?	మరి అది వచచి న సంగ తి నీ కె లా తెలు సతుంది ?
कया मतलब है , पै रिस ?	అంటే ఏంటి , ప యా రి స ?
कयोंकि वे जे र ला म रे ल से एक उप हार हैं .	ఎందుకంటే అవి జె ర లా మ రె ల కా ను కలు కాబటటి .
इसकी संभा वना कम है .	అది దా దా పు అ సా ధ యం .
- म हा रा नी . . . - मैंने कहा घु ट ने टे को !	- మ హా రా ణ ీ . . . - మో కా ళళ మీద కూ రచ ో మ ననాను !
तो तुमहें कया लगता है कि यह कौन है ?	మరి అది ఎవర యి ఉండ వచచ ని అనుకుంటుననా వు ?
उसे विश वास होना चाहिए कि मौ न सुन ने की उसकी कष म ता उनहें वि रा सत में मिली है .	వాళళ కి కూడా తన లా గానే ని శ బ ధా నని వి నే శ కతి వచచు ండ వచచ ని తన నమమ కం కా వచచు .
उसने कहा कि उसने लोगों को सच बताया .	పర జ ల కి నిజం చెపపా నని అతను బ దు లి చచా డు .
अगर उनहें कुछ , कुछ भी हो जाए , और एक ह जार अन य " अगर , "	ఒక వే ళ ఇం కే ద ెనా జరిగి నా , ఇలా ంటి " ఒక వే ళ " లు వే లల లో ఉననాయి ,
इस तरह मैं उनहें पह चा न पा ऊ ं गा जब वे मेरे पास आए ं गे .	వాళళు నా చె ంత కు వచచి నపపుడు నేను గురతు ప టట డానికి వీ లు గా .
वह खो गई थी , और उसने उसे बचा लिया .	తను తపప ి పోయింది , అతను తన ను కా పా డా డు .
तुमहें कयों लगता है वह ' सत री ' है ?	ఎందుకు ప దే ప దే " ఆమె " అని అ ంటుననా వు ?
जो सुना वह मन के सं देश में डाल दिया .	తను వి నన ది , నా మె డ కి త గి లి ంచింది .
उनहोंने बच चों के बारे में बात की .	వాళళు పిలల ల గురించి మాటలాడు కుననా రు .
वह शायद मेरे सवा लों का जवाब न दे .	తను నా పర శ న ల కి సమా ధా నం చెపప కపో వచచు .
उसने इन के बु खा र को नहीं ठीक किया .	వారి జ వర ాలను జె ర లా మ రె ల న యం చేయ లేదు .
व हां कौन है ? मुझे जवाब दो , कौन है ?	ఎవర కకడ ? సమా ధా నం చెపప ండి , ఎవర కకడ ?
पै रिस से बात करो .	ప యా రి స కి చెపపు .
छा या , जैसा मैंने कहा वै सा करो गी ?	ఛ ా యా , నేను అడి గి న పని చేసి పె డ తా వా ?
कया तुम व हां हो ?	నువ వి కకడ ే ఉననా వా ?
उसने यही कहा है .	తను చెపపి ంది అదే .
- और जब वे चले जाए ं गे . . . - नहीं .	- వాళళు వెళలి పోయి నపపుడు . . . - లేదు .
लेकिन जु ड वा ँ , बा बा , जु ड वा ँ परि व रत न हो सकते हैं .	కానీ ఆ క వల లు , బా బా , ఆ క వల లు మార పు కు పు నా ది కా గల రు .
जिस का मतलब मैं कभी नहीं समझ पा ता .	అదే ంట నే ది నా కె పపటి కీ అరథం కాదు .
बा बा व ॉ स , मैं हमेशा एक ऐसे वय क ति को चु न ूं गी जो मेरी देख भा ल कर स के	బా బా వా స , ననను అరథం చేసు కొ నే వాడి క ననా ననను బాగా చూ సు కొ నే వాడి నే
