कई बार मुझे शक होता है कि तुम मेरे बचचे नहीं हो .	చాలా సా రలు నువవు మా బి డ డ కా దే మో అని అను మా నం వచచింది .
दू ल हे के पिता एक व की ल हैं .	వ రు డి త ండ రి ఒక నయాయ వా ది .
- आप यहाँ कया कर रहे हो , गु ला बी ? - गो ल डी .	- ఇకకడ ఏం చేసతుననా వు , గు లా బీ ? - గో ల డి .
मैं . . . मैं यहाँ आया था	నేను . . . నేను ఇకకడ కు . . .
हाँ , पिता जी ?	చెపపు , నానన ?
यहाँ , कया महसूस हो रहा है ?	ఇకకడ , ఎ మ ననా అనిపి స తో ందా ?
- ज स ! - गो ल डी !	- జా స ! - గో ల డి !
- ज स ! - गो ल डी !	- జా స ! - గో ల డి !
लेकिन वो हमेशा का न ु क सान कर सकता है .	కానీ పూరతి గా పని చేయ కుండా పో తా యే మో అని .
ढ ि ल लों साह ब !	మిసటర ధి లలా న !
ढ ि ल लों साह ब !	మిసటర ధి లలా న !
सच कहूँ तो , उनहें देख कर मुझे भी ऐसा लगा	నిజంగా చెపప ాల ంటే , అత నని కలి సిన తరవాత
हाँ , पिता जी . मे रह ल ूँगी .	అవును , నానన . నేను చేసతా .
मैं आप से वि न ती करता हूँ .	నేను నినను వే డు కుంటుననా ను .
कौन कह ता है कि मेरा बेटा कु ँ वा रा है ?	నా కొ డు కు ఒ ంట రి గా ఉననా డని ఎవరు చెపపా రు ?
आपको अ दा लत में सो ना चाहिए .	మీరు కోర టు లో ని ద రి ంచాలి .
- हाँ . - बद मा श .	- సరే . - వెధవ .
अगर हमें कुछ बन ना ही था , तो हमें गा य बन ना चाहिए था .	మనం దే ని లా గ ెనా న టి ంచాలి అంటే అది ఆ వు అయి ఉండాలి .
दरअसल , मुझे आपके के स को समझ ने में थोडा समय लगा .	నిజ ానికి , మి కేసు చ ది వే కి కొ ంత సమయం ప టటి ంది , అ ం కు ల .
कह ती है , " इस उ मर में पिता जी को अके ला कैसे छोड ें ? "	ఆమె చెపపి ంది , ఈ వయ సు లో నా ననను ఒ ంట రి గా ఎలా వ దల ం ?
सु ंदर ता ली ब जाए और वह उसका साथ दे ती है	అంద గా ళళు చ పప టలు కొ డి తే ఆమె ఆ డు తుంది
सु ंदर ता ली ब जाए और वह उसका साथ दे ती है	అంద గా ళళు చ పప టలు కొ డి తే ఆమె ఆ డు తుంది
- मैं शादी नहीं करना चाहती . - सच में ?	- నాకు పెళళి చేసుకో వాలని లేదు . - నిజంగా ?
कल रात से दू ध देने का मन कर रहा है .	ని నన రాతరి నుండి ప ాలు ఇవ వాలని పి సతోంది .
मैंने अपना जी वन परे म के नाम कर दिया था	నేను పరే మ కు జీవి తా నని అ ం కి తం చేశా ను
मी त . पहले , मु गल , और फिर अ ंग रे ज . . .	మీ త . మొద ట ము ఘ లస , తరువాత ఆ ంగ లే యు లు . . .
कह ता है किसी दिन मेरे जी जा जी तुमहें सच में हाथ लगा देंगे .	తను అ ంటుననా డు , ఏదో ఒక రోజు మా బా వ నీకు నిజంగా నే చె య యి సతా డు అని .
हे भगवान . मेरे सो ते हुए ये बद मा श मेरी परति ष ठा को बर बाद कर दे गा .	దేవుడా , వీ డు నా పేరు మొతత ం పా డు చేసతా డు నేను ని దర వు నన పు డు .
मु द दे पर आओ .	విష యా నికి రా .
मेरे मु व क किल बिल लू बं स ल ने कुछ ग ं भी र नहीं किया है ,	నా కల యి ంట బి లలు బ నస ల బె యి ల కూడా మ ం జ ూ రు కా కుండా
तुम यहाँ कया कर रहे हो ?	మీరు ఇకకడ ఏమి చేసతుననా రు ?
ठीक है , बेटी . तुम स सु र कह दिया करो .	ఇది సరే , పరి య . ఆ య నను మా వయ య అని పి లు వు .
चा चा तुमहें गु रु दवा रे ले जाकर तुम दोनों की शादी करवा सकते हैं .	అ ం కు ల మిమమలని గు రు ద వా రా కు తీసుకు వెళళి మీకు పె ళ లి చేసతా డు .
हमें राम ली ला नहीं करवा नी .	అతని ని న టి ంచ మని చెపప ము .
ह नी , तुमहें भ ै ंस की म ूर ति कयों चाहिए ?	హ నీ , ఎందుకు నీ కె ందుకు బర రె వి గర హం ?
मैंने अपना सा रा जी वन अके ले बि ता या है .	నేను ఒ ంట రి గా నా జీవి తా నని గ డి పా ను .
बेवकूफ , हम चा चा को ये तो नहीं कह सकते	వెధవ , మనం పెళళి కా ని అమమాయి ని ఇంట లో
आपको इन फ ूल ों को ह टा कर सो जाना चाहिए .	మీరు వీ టి ని ప కక కు తో సి ని దర పో వాలి .
- कया आप उनहें घर तक छोड ो गे ? - रुको !	- వాళళ ని ఇంట లో వ దు లు తా రా ? - ఉ ండు ! ఉ ండు !
और वहाँ , तुम म हिला की तरह ना च रहे हो ?	నువవే మో ఆడ దాని లా డ యా నస చేసతుననా వా ?
मुझे तुमहारे घर जाने का प छ ता वा हो रहा है , पिता जी .	నేను మీ ఇంటికి వచచి న ందుకు చి ంతి సతుననాను , నానన .
जि तनी गा लिया ं मुझे उसे दे नी हैं वो तुम भी सुन लो .	నువవు కూడా అతని కోసం రా బో తునన శా ప ాలను విన చచు .
कि तुम मेरे के स के साथ मेरी बेटी को संभाल रहे थे ?	నా కేసు తో పాటు నా కూ తు రని కూడా చూ సు కుననా వని ?
2 9 साल का हो गया और इतनी समझ नहीं है .	2 9 ఎ లలా వయ సు లో కూడా నీకు తెలియ లేదు
कुछ नहीं , मुझे बस थोडा च क कर आ रहा है .	ఏమి లేదు , నాకు క ళళు తి రుగు తుననా యి .
- मैं तुमहें सब क सि खा ऊँगा . - पिता जी , रुको . उनहें जाने दो .	- నేను మీకు ఒక పా ఠ ం బో ధి సతాను . - నానన , ఆ ప ండి . వాళళ ని వెళ లని వ వు .
- वह हमारे कि रा ए दार को ग ले लगा रही है . - तुम कभी कोई अचछी खबर नहीं ला सकते .	- మా అ దద ె దారు ని క ౌ గి లి ంచు కు ంది . - మీరు ఎపపుడూ మంచి వార తను తీసుకు రా దు .
और वह उसका साथ दे ती है	ఆమె దాని బీ ట కు ఆ డు తుంది
और मेरी ता ई का सा ला . . .	మరియు నా అత త భా రయ . . .
सं भ व है कि बिल लू बं स ल को	బహుశా బి లలు బ నస ల జె లలో
और फा इ ल आपके सामने है .	మరియు ఫె ల మీ ముందు ఉంది .
और मेरे पिता अब वापस नहीं आए हैं .	మరియు మా నానన ఇ పపటి కీ తిరిగి రాల ేదు .
कु ं डी इतना शो र नहीं करती	గొ ళళ ెం ఒక రి ని లే పే అంత
- इ ला ज क ना डा में हो सकता है ? - हाँ .	- ఇది కె న డ ాలో చి కి త స చేయ వచచా ? - అవును .
अगर वो भ ूत दु बारा मर गए ,	ఆ ద యయ ాలు మళలీ చని పో తే ,
कया झूठ है ?	అబ దధ ం ఏమి టి ?
लेकिन उनके स सु र का भी दिमाग ख रा ब है .	కానీ అతని మా మ యయ తన మ తి కో ల పోయా డు .
पिता जी , कया मा मा ही आपको बद नाम करने के लिए कु ं डी खो ल ते हैं ?	నానన , మా మ గొ ళళ ెం తె ర చి పా రి పో తా డా నినను అవ మా ని ంచే ందుకు ?
तुम पागल हो ग ये हो . तुम बर बाद हो गए .	మీరు వె ర రి . మీరు నా శ నం అయి పోయా రు .
- गो ल डी ! - मैं तुमहें जाने नहीं द ूँगा !	- గో ల డి ! - నేను మిమమలని వెళ లని వ వ ను !
मा मा , पिता जी और च न नो अब इस घर में नहीं रह सकते .	అ ం కు ల , త ండ రి మరియు ఛ నన ో ఈ ఇంట లో నివ సి ంచ లే రు .
जरा मुझे छ ू ओ	ననను తా క ండి
जरा मुझे छ ू ओ	ననను తా క ండి
जरा मुझे छ ू ओ	ననను తా క ండి
जरा मुझे छ ू ओ	ననను తా క ండి
अब तुमहारी सर ज री मेरे हाथ ों होगी .	ఇపపుడు మీకు నేను శ స తర చి కి త స చేసతాను .
करे न स टा रट करो . चलो , घर चल ते हैं .	క రే న పరా రం భి ంచు . ప దా ఇంటికి వెళ దా ము .
वो देश द रो ही हैं और हम देश भ कत हैं .	వారు దే శ ద రో హు లు మరియు మనం దే శ భ క తు ల ం .
ला न त है तुम पर ! तुम . . .	మీరు నా శ నం చేశారు . . .
कया मैं आपके लिए ग न ने का रस ला ऊँ ? या आप ग न ना भी खा सकते हो .	మీ కోసం చె రు కు ర సం తె మమ ంటా రా ? కా సత చె రు కు కూడా తి న వచచు .
यह सही नहीं है . हमेशा से ये ऐसे ही होता है .	ఇది సరి కాదు , ఇది ఎ పపుడు ఇలా నే జరుగు తూ వచచింది .
और वे कभी - कभी बाहर सक ू टर और बा इ क चो री करते हैं .	మరియు బయట ఉనన స కూ టర లు , బె కులు దొ ం గి లి సతారు .
और छो टी बेटी की शादी एक पागल परिवार में हुई है .	మా చినన కూ తు రు ఒక పిచచి కుటుం బ ంలో పెళళ ె ంది .
वो प ं जा बि यों के पै रो में ल हरा ता है .	పం జా బీ ల కా ళళ పె న ఉండ డం సరి కాదు .
हैलो , ज स . कया तुमहारे पिता वापस आए ?	హాయ , జా స . మీ నానన తిరిగి వచచా డా ?
मैं केवल पै र ों का इ ला ज करता हूँ .	నేను కా ళళు కు మాతరమే చి కి త స చేసతాను .
हाँ , पिता जी . मैंने उनहें खुद देखा .	అవును , నానన . నేను వాటి ని చూ సా ను .
तुमहें उससे पयार से बात करनी चाहिए .	మీరు పరే మ తో దీని ని పరి ష కరి ంచాలి .
या उस पर फ ूल फ ें के . ग म ले के साथ .	లే ద ంటే ప ూ లు చ ళళు ప ూ ల కు ండి తో పాటు .
उसकी अभी - अभी शादी हुई है .	అతనికి ఇ పపుడే పె ళ లె ంది .
वह वि न ती करे गी , " बस आ जाओ , मुझे फर क नहीं पडता , अके ले आओ . "	నువవు రా , నువవు ఒ ంట రి వా డ ెనా పర లేదు " అని వే డు కు ంటుంది .
वह वि न ती करे गी , " बस आ जाओ , मुझे फर क नहीं पडता , अके ले आओ . "	నువవు రా , నువవు ఒ ంట రి వా డ ెనా పర లేదు " అని వే డు కు ంటుంది .
ढ ि ल लों साह ब , कया फर क पडता है कि वह शादी शु दा है या कु ँ वा रा ?	మిసటర ధి లలా న , తన కు పెళళి అవ విన అవ వ క పోయి న ప టటి ంపు లేదు ?
अगर किसी ने देख लिया , हम मुशकिल में पड जाए ं गे .	ఎవరెనా కని పెటటా ర ంటే , మనం ఇ బబ ందు లలో పడ తా ము .
रुको , यह दू ध का समय है .	ఆగు , ప ాలు పి ండ ే సమయం .
रा ँ झा ने ही र के लिए एक ब करी को पा लत ू बना या था .	బా బు , రా ం జా హ ీ ర కోసం ప శు వు లను చూ సు కుననా డు .
पिता जी , उनहें जाने दो .	నానన వదదు , వదిలే సే యి .
पिता जी , उसे जाने दो .	నానన , అతని ని వదిలే య ండి .
कि वह तुमहारे साथ था .	నాకు ఇపపుడు హా యి గ ఉంది .
- बेटी . - हाँ , पिता जी .	- చి ననా రి . - అవును , నానన .
जिस के कोई रिश ते नहीं वो रिश त ों के बारे में कया जाने ?	ఎవరు లేని వాడు ఏ బం ధ ు వు లు సంబం ధ ాల గురించి మాటలాడ తారు ? కదా ?
हमें पहले अपने देश को स व त ं तर ता दि ला ने पर धयान देना चाहिए .	మన దేశం లో స వే చ ఛ ను పొ ంద ాల ంటే మన ము మొద ట ద ృష టి పెటట ాలి .
मैंने किसी बे कार से बात नहीं की	ప నికి రా ని వాళళ కి వి నో దానని ఇవవ లేదు
मैं तुमहारे चा चा से अके ले मिल ूं गा .	నేను ఒ ంట రి గా మీ మా మను కలు సతాను .
ये बात लड कि यों से पूछ ी जाती है .	వ ధ ు వు కుటుం బం ఆ పర శ న అడి గి ఉండాలి .
मैं वी जा आ वे द न करने जा रही हूँ .	నేను తన వీ సా కోసం దర ఖ ా సతు చేసతాను .
वैसे भी , ये भ ूत जो तुमने देख े . . .	ఏమెనా , మీరు చూ సిన ఈ ద యయ ాలు . . .
अगर मुझे त ला क का माम ला मिल जाए .	నాకు ఒక వే ళ వి డా కు ల కేసు తీసుకు ంటే .
देखो . तुम मुझे कयों देख रहे हो ?	చూడు . మీరు ఎందుకు ననను చూ సతుననారు ?
बैठ जाओ , बेटी . हम उनहें पक ड ल ेंगे .	అవును . మేము వారి ని పటటు కుంటా ము .
- सच में . - चलो चल ते हैं .	- నిజంగా ? - వెళ దాం ప దా .
तो कया ? मो टर सा इ किल पर ला ल ब त ती नहीं होती	ఐ తే ఏంటి ? మో టా ర సె కి ళళు మీద ఎ రు పు బీ కా న లేదు గా
- तुम कया कह रहे हो ? - बस पिता जी की नजर ों में .	- మీ రే ం చె పు తుననారు ? - కేవలం మీ డా డీ క ళళ లో .
अगर बहन आज जि ंदा होती , तो एक बार फिर मर जाती .	సోద రి బర తి కి ఉంటే ఆమె మర ల చని పోయి ఉండే ది .
मुझे समझ नहीं आता कि आपने उनकी बहन से शादी कयों की !	నువవు అతని సోద రి ని ఎందుకు పె ళ లి చేసు కుననా వో అరథం కాల ేదు !
तुमहारा और तुमहारे पिता के बचचे एक साथ सक ूल जाए ं गे .	మీ కొ డు కు మరియు మీ నానన కు మా రు డు కలిసి పా ఠ శ ాల కు వెళ తారు .
जब मेरा क ना डा का वी जा बन ता है , तुम आकर मेरा सप ना तो ड दे ते हो .	నేను కె న డి యన వీ సా ను పొ ంద బో తుననాను , నువవు నా క లల ను వి చ ఛ ి నన ం చేసతా వు .
कुछ पा उ ंड के लिए आप अ ंग रे जो से मिल गए ? घ ृ ण ित .	మీరు డబబు కోసం బ రి టీ ష వెపు న ఉననా రా ? అయ యో .
आप सा र वज निक रूप से किसी की बेटी को कयों बद नाम कर रहे हो ?	ఎందుకు మీరు మర ొ కరి కూ తు రని బ హి రం గ ంగా ని ంది సతుననారు ?
रुको , मैं तुमहें सब क सि खा ऊँ गी .	ఉ ండు , నేను నీకు గు ణ పా ఠ ం నే ర పి సతా .
ह ं गा मा कयों हो रहा है ?	అసలు ఈ గొ డ వ ంతా ఏంటి ?
रुको , तुम !	నువవు ఉ ండు !
जब मैं तुमहारे बारे में सोच ती हूँ	నేను మీ గురించి ఆలోచి ంచిన పపుడు
फिर चु प चा प अपने परिवार के साथ मेरे घर आ जाओ .	మరి ని శ శ బ ద ంగా నా ఇంటికి మీ కుటుం బ ంతో రా .
बहुत अचछा परिवार है .	ఇది చాలా మంచి కుటుం బం .
ये लडकी के चा चा हैं .	అతను వ ధ ు వు య ొ కక మా మ యయ .
मैं कुछ दि नों में क ना डा जाने की तै या री कर रहा हूँ .	నేను కొనని రోజు లలో కె న డా కు వెళళ డానికి సిదధ ం అవు తుననాను .
- उसने आपको सब कुछ बता दिया ? - आपको भी पता है ?	- అతను పరతి దీ మీకు చెపపా డా ? - నీకు తెలుసా ?
ये कुछ जयादा हो गया .	అనని టి కీ హ దదు ఉంటుంది .
तुम यहाँ कया कर रहे हो , गो ल डी ?	నువవు ఇకకడ ఏమి చేసతుననా వు , గో ల డీ ?
मैं भ ले ही व की ल नहीं हूँ , लेकिन मैं हमेशा व की लों से घ ि रा रह ता हूँ .	నేను ఒక నయాయ వా ది కా కపో వచచు కానీ ఎ పపుడు వారు నా చు టట ూ ఉంటా రు .
जो भी करना , उसे चु प के से करना .	నువవు ఏ ది చేసిన ని శ శ బ ద ంగా ఉ ంచండి .
ये मुझे ही करना प डा .	నేనే చెయయ ాల సి వచచింది .
- यह सच है ? - तुम कया कह रहे हो ?	- ఇది నిజ మే నా ? - మీ రే ం చె పు తుననారు ?
मैं मान ता ह ून कि इस घर में भ ूत रह ते हैं .	ఈ ఇంట లో ద యయ ాలు ఉననా య ని నేను అ ంగ ీ కరి సతుననాను .
पिता जी ! !	నానన ! నానన !
हाँ , साह ब ?	అవును అ ండి ?
तुमहें भी कुछ कहना चाहिए . मुझसे हमेशा सब कुछ मत कह ल वा ओ .	మీరు కూడా చెపప ాలి . అంత నేనే చెపప ాలి అని ఆ శి ంచ వదదు .
हैलो , पुलिस ? कोई मेरे जी जा जी को पी ट रहा है .	హలో , పోలీసు ? ఎవరో నా బా వ ని కొ డు తుననారు .
- पिता जी , ग ले लगा ओ , माम ला खतम करो . - हाँ .	- డా డీ , త నని క ౌ గి ల ంచు కొ ని , ము గి ంచే యి . - అవును .
मुझे कोई सला ह मत देना .	నాకు ఏ స ల హా ఇవవ వదదు .
आपको पता है , बिल लू बं स ल . . . ज स उनकी बेटी से शादी कर रहा है .	నీకు తెలుసు , బి లలు బ నస ాల . . . జా స తన కు మార తె ను వి వా హం చేసు కుంటా డు .
यह कौन है ?	ఎవరు ? ఎవరు ?
च न नो , सो जाओ . ले ट जाओ .	ఛ నన ో , ని దర పో . పడు కో .
अगर उसे गु ससा आया , आपको स ड कों पर भी ख मा ंग नी पडे गी .	ఆమె ని గర హా నని కో ల పో తే , మీరు వీ ధ ు లలో యా చి ంచ వల సి ఉంటుంది .
