अब मैंने आपको कैसे दि क कत में डाल दिया ?	ఇపపుడు నేను నినను బాధ పెటట నా ?
आप घर पर मेरे पिता हो . यहाँ , आप मेरे लिए सिरफ एक सी नि यर हो .	ఇంట లో మీరు నా త ండ రి . ఇకకడ , నువవు నాకు సీ నియ ర .
ह नी के साथ मी त के घर नहीं गए थे ?	సంబం ధం మాటలాడ టానికి వచచా రు కదా ?
- मेरी बच ची ! - चा चा जी !	- నా బి డ డ ! - మా మా !
तुमहें अपना मै रि ज ब यू रो बंद कर देना चाहिए .	మీ వి వా హ బ యూ రో వయా పా రం మూ సే య ాలి .
वो आपके न मस कार के लिए थे . यह आपके जाने पर .	అది ప ల కరి ంచ డానికి . ఇది వీ డు కో లు .
आप कब ब डे होंगे ?	నువ వె పపుడు ఎదు గు తా వు ?
- कया हुआ ? - गो ल डी की प तनी भाग गई .	- ఏం జరిగింది ? - గో ల డీ య ొ కక భా రయ పా రి పోయా రు .
बात सुनो ! गो ल डी !	విన ండి ! గో ల డీ ! గో ల డీ !
चा हें कोई कैसा ही लगे , पर भा व हमेशा अचछा पड ना चाहिए .	ఒక వయకతి ఎలా ఉననా , అభి పరా యం మంచిది ఉండాలి .
तुमहें ब हा ने बना ते रहना चाहिए और लड कों को खा रि ज करते रहना चाहिए .	ఎ దో ఒకటి చె పు తూ అబబా యి లని ఇషటం లేదు అని చె పు తూ ఉ ండు .
कया तुमहें लगता है भ ै ंस पीछे की ओर चल सकती है ?	గే ద ె లు వె ను కకు న డు సతా య ను కుంటుననా వా ?
इसलिए शि ष टा चार कह ता है कि हम उनसे माफ ी मा ंग ें .	మర యా ద కు నేను వా రికీ కష మా ప ణ చెపప ాలి .
इसलिए मैं उनके हा ल - चा ल पूछ ने आ गया .	అందుకే నేను తన ఆ రో గ యం గురించి అడ గ టానికి వచచా ను .
जैसे वहाँ पर मेरे सो ने के लिए बि स तर बि छा होगा .	నేను ని దర పో టానికి అకకడ మ ంచ ం ఉనన టలు .
- है प पी , वि देश ी की तरह बो लो ! - मैं नहीं छोड ूं गा !	- వి దే శ ీ యు డి గా న టి ంచు . ! - నేను కాదు .
हम शादी नहीं कर सकते .	ఈ సంబం ధం కు దర దు .
तो कया मैं त ला श शुरू कर द ूँ ?	నేను చూడ టం మొద లు పెటట ాలా ?
च रि त रही न ढ ि ल लों !	క యా రె క టర లేని ధి లలా న !
जाने मा ने , अचछे लोग	బాగా తెలి సిన , మంచి స వ భా వం
मैंने अभी तक यह नहीं कहा !	నేను ఇంకా చెపప లేదు !
- शायद भेज दे . - वाह .	- తను పం ప వచచే మో . - బాగుంది .
मुझे कुछ दिन दी जिए .	నాకు కొ ద ది రోజు లు ఇవవ ండి .
मैं उनकी शादी से पहले अके ले बात नहीं करवा ना चाहता .	వారు వి వా హ నికి ముందు మాటలాడు కో డం వదదు .
ढ ि ल लों साह ब आए हैं .	మిసటర ధి లలా న ఇకకడ ఉననాడు .
- एक थ प पड दू ं गा ! - साह ब जी !	- నేను కొ డ తాను ! - సర !
अब , तुमहें इस शादी में अचछा लड का बन कर जाना है .	ఇపపుడు , ఈ పెళళి లో మంచి గా పర వర తి ంచు .
- लेकिन वह अके ला नहीं होना चाहिए . - तुमहारा मतलब कया है ?	- కానీ అతను ఒ ంట రి గా ఉండ కూడదు . - ఏమ ంటుననా రు ?
यही एक मा तर ऐसी जगह थी जहाँ मेरा कभी अप मान नहीं हुआ था .	ఇది ఏ కె క పర దేశం ననను ఎపపుడూ అవ మా ని ంచ లేదు .
साह ब जी , अगर आपको गिर ना था , तो आप इ ध र - उ ध र गिर सकते थे .	సర , మీరు పడ ాలి అంటే ఇకకడ ో ఎకకడ ో పడి ండ చచు .
और वो मेरा बेटा नहीं है .	అతను నా కు మా రు డు కాదు .
ऊपर तुमहारे कम रे में .	మే డ మీద నీ గ ది కి .
ऐसा इसलिए कयोंकि उसने कहा कि उसके पिता को द हे ज का ला ल च था .	అతని త ండ రి క ట నం కోసం ఆ శ పడు తుననా డని , చెపపా డు .
अगर महसूस नहीं हो रहा , तो चि ल ला कयों रहे हो ?	మీరు దానిని అను భ ూ తి చేయ లే కపోతే , అపపుడు ఎందుకు అ రు సతుననా వు ?
- भ ूत बाहर द ौ डा . - रुको .	- ద ె య యం వె లు ప ల న డి చి ంది . - ఆగు .
तुमहारे वय व हार को धयान में रख ते हुए , मुझे नहीं लगता कुछ ब चे गा .	నీ పర వర తన ను పరి శ ీ లి సతే , ఏ ది మి గల దు అని అను కు ంట .
तो तुम उससे शादी नहीं करना चाहते ?	ఐ తే ఆమె ను పె ళ లి చేసుకో వా ?
हम जाकर अभी उससे पूछ ेंगे .	మనం వెంట నే వెళళి ఆమె ను అడుగు తా ము .
वैसे भी उसके कर म ों को कौन देख े गा ?	తన కార య ాలను ఎవరు చూ సతారు ?
हाँ , आप यहाँ कयों ख डे हो ?	అవును , నువవు ఇకకడ ఏమి చేసతుననా రు ?
- नहीं . - कया कह रहे हो , ह की म साह ब ?	- లేదు . - హ కీ మ , ఏమ ంటుననా రు ?
तुम चिंता मत करो . ड रो मत .	మీకు ఆ ందో ళ న అవసరం లేదు . భయ పడ వదదు .
मैं ही उस बेटी का पिता हूँ , साह ब .	నేను ఆ కు మార తె త ండ రి , సర .
मुझे अब तक ठीक लग रहा था .	నేను ఇపపుడు వర కు సరి గ గానే ఉననాను .
आपको अं तर महसूस हो रहा है , है ना ?	నీకు తే డా తెలు సతోంది కదా ?
- जाना है . - ठीक है , कार चला ओ .	- వెళల ాల నే ఉంది . - సరే మరి , కారు న డు పు .
कया हुआ , ज स ? कया तुम ठीक हो ?	ఏమి జరిగింది , జా స ? నువవు బా నే ఉననా వా ?
मैं कुछ भी समझ ना नहीं चाहती .	నేను దే ని నీ అరథం చేసుకో వాల ను కొ డం లేదు .
कया वह आपको कि रा या नहीं दे ता ?	అతను మీకు అ దద ె కి చచా డా ?
कया आप बता सकते हैं कि मेरा बेटा कहाँ है ?	నా కొ డు కు ఎకకడ ఉననా డో చెపప గల రా ?
मैं हमेशा तुमहारे बारे में सोच ती रह ती हूँ	నేను మీ గురించి ఆలోచి సతూ ఉంటా ను
बेटी , कया तुम ऐसे परिवार के साथ रह पा ओ गी ?	అ టు వ ంటి కుటుం బ ంతో సర దు కు పో గల వా ?
इसे भूल जाओ , हम कया बात कर रहे थे ?	దీ నని మర చి పో , మనం దే ని గురించి మాటలాడు తుననాం ?
ग ठ िया नहीं . उसने कुछ बुरा सोचा है .	ఆ రథ రె టి స కాదు . ఆమె ఏదో అ ధ వా నన ంగా ఆలోచి ంచింది .
कया कर रहे हो , पिता जी ?	ఏమి చేసతుననా వు , డా డీ ?
मुझे यह भी नहीं पता तुम लोग पयार को कया समझ ते हो .	మీకు పరే మ ంటే ఏమి టో కూడా నాకు తెలియదు .
मी त इतनी बुरा नहीं जो कोई काम करने से मा ना कर दे .	మీ త ఏ పని ని ని రా కరి ంచే ంత చె డ డ ది కాదు .
कोई लड का अगर तुमहारे पास आए उसके लिए गु ससा पक ड ता रख ता हूँ	నీకు దగగర వ వాల ను కొ నే ఎవ డి పె న అయి నా నాకు కో పం
आपको पहले उनसे मिल ना चाहिए . हम बाद में उसका परि च य करवा देंगे .	మనం మొద ట కలు దదాం . తరువాత అత నని పరి చ యం చేసతా ము .
तुम कहाँ जा रहे हो ?	మీరు ఎ కకడికి వెళ ు తుననారు ?
- कि से पागल कह रहे हो ? - तुमहें . और कौन हो सकता है ?	- ఎవ రికీ పిచచి ? - నీ కే . ఇం కె వర ె ఉంటా రు ?
यह हमारा ध ं धा भी नहीं है . तुमने हमें इसमें फ ं सा या है .	మే మూ చెయయ లేదు . అన వ సర ంగా ఇ ందు లోకి లా గా వు .
कयों झूठ बोल रहे हो , जी जा जी .	ఎందుకు మీరు అబ దధ ంచ ె ప తుననారు , బా వ ?
अब कहीं ग रा ह क भी न चले जाएँ .	కల యి ంట ని వెళ లని వ వ కు .
ज स !	జా స !
ज स !	జా స !
मुझे पता था .	నాకు అది తెలుసు .
ज स !	జా స !
रो ना मत .	ఏ డ వ కు .
रो ना मत .	ఏ డ వ కు .
वाह !	ఓహ !
उसकी आँख ें च म क ती हैं	ఆమె క ళళు మె రి సే
कयोंकि मैंने विश व स नी य स रो त ों से पता लगा या है	ఎందుకంటే నేను నమమ ద గి న వ న రు ల నుండి
ज स !	జా స !
ज स ?	జా స ?
हमें लट का ए मत रख ो .	మమలని వే చి ఉండే లా చేయ కు .
न मस ते , अं कल .	హలో , మా మ .
अपना के स ल डा सकता था .	కేసు ను పో రా డే లా చేసి ఉంటా ను .
नाम मे , इन फ ूल ों को पा नी दे देना .	నా మా చె ట లకు నీ ళళు పొ య యి .
- बेटा ! - हाँ .	- డి య ర ! - చెపప ండి .
तुमहें इसे अपने परिवार के डॉ क टर को दिखा ना चाहिए .	నువవు మీ కుటుం బ వె ద యు నికి చూపి ంచాలి .
तुमहारे पिता श हर से बाहर हैं , है ना ?	మీ నానన ఊ రికి వెళ లా రు , కదా ?
ब रे ली !	బా రె ల లీ !
मैं कह सकता हूँ वो सभी 1 00 जो ड ियाँ तुमहें को स रही हों गी .	1 00 జ ంట లు నినను ని ంది సతూ ఉంటా రని చెపప గలను .
इन हें छा ँ ट कर बताओ कि मी त के लिए कौन सा लड का अचछा रहे गा .	దీ నని చూ సి మీ త కు సరి పడ వ రు డిని ఎ ం పి క చేయి .
उनहें भी लड के का परिवार चाहिए .	తను కూడా అబబా యి కి కుటుం బం ఉండాలి అననా డు .
अगर वे एक साथ मिल जाते हैं , तो लोग ये समझ के आ ते हैं	వా రం తా కలిసి వెళ తే , చూడ టానికి ఎ గ బడ తారు .
इसे देखो .	దీని ని చూడు .
ज स ?	జా స ?
- ना गो रा ना का ला . - जी जा जी !	- అతను మంచి కాదు చె డు కాదు ! - బా వ గా రు !
जब तक हम कर सकते हैं हमें करना होगा .	మనకు సా ధయ మెన ంత కాల ం చేయాలి .
मेरी मी त ! ! मी त !	నా మీ త ! మీ త !
- नहीं ! - चलो चल ते हैं .	- కాదు కాదు ! - రా ప దా , వెళ దాం .
बस इतना बताओ कि पै र कहाँ पर हैं .	కా ళళు ఎకకడ ఉననా యో చెపపు .
ज स !	జా స !
अन दर आ इए .	పర వే శి ంచండి .
बेटी , चो र अ क सर लोगों को भ ूत से ड रा ते हैं , ताकि वे बाहर न निकल ें . . .	అమమా , ఇ వి మను ష ు లను భయ పె డ తా యి కాబటటి బయటకు రా వు . . .
ज स !	జా స !
पिता जी !	నా ననా !
बस बहुत हुआ .	అది చ ాలు .
मैं तुमसे बि न ती कर रही हूँ .	నేను విన య పూర వ క మెన అ భయ రథ న చేసతుననా ను .
और मुझे कहीं और काम नहीं मिले गा .	ఇ కక ే క డా నాకు పని దొ రక దు .
कभी - कभी वह लोगों को भी का ट ले ते हैं .	కొనని సా రలు అతను కో రు కు తా డు .
कया मैं अके ले में बता ऊँ ?	నేను నీకు పర ె వే టు లో తెలియ జే య ాలా ?
पिता जी !	త ండ రి !
- मैंने तुम दोनों की शादी नहीं की ! - आप कया कह रहे हो ?	- మీ ఇదద రికీ నేను పెళళి చేయ లేదు ! - ఏమి టీ ?
और हम बद नाम हो गए .	మరియు ని ంద మాకు వచచింది .
मैं कयों नहीं ले जा ऊँ गी ?	ఎందుకు తీసు కె ళ లను ?
तुम ऐसे परिवार के बिना ही बेहतर थीं .	అలా ంటి కుటుం బం ఉండ టం కంటే ఒ ంట రి గా ఉండ డ మే మంచిది .
मुझे वह पसंद है .	నాకు న చ ఛ ా డు .
बात सुनो .	అరథం చేసుకో .
ये देखो .	ఇది గో .
रुको , मी त तुमहारी प तनी है , ढ ि ल लों साह ब तुमहारे पिता हैं .	ఆగు , మీ త మీ భా రయ , మిసటర ధి లలా న మీ త ండ రి ఆ .
- मेरे साथ आओ . - सवागत है .	- నాతో రా . - సవా గ తం .
उसने उससे शादी की है .	ఆమె అతని ని వి వా హం చేసు కు ంది .
जब तुमहारी प तनी नीचे सो रही है ?	ఉనన పు డు నువవు కింద ఏమి చేసతుననా వని ?
- हाँ . - आ सान .	- అవును . - సి ంపు ల .
मैं घट िया आ शि कों वाली बात नहीं कहूँ गा , मैं सो नहीं सकता , मुझे भ ू ख नहीं लग ती	నేను ని దర పో లేను , నాకు ఆ కలి లేదు , మరియు ఏదో లో క ంలో ఉంటా ను
जिस तरह से वह चि ल ला ता है . . . आपको के स मिल ना बंद हो जाए ं गे ,	అ యన అ రి చే . . . నీకు కేసు లు రా వడం ఆ గి పో తుంది ,
खा ने - पी ने की चीजें बेह तरी न गु ण व त ता वाली हो नी चाहिए .	ఆ హా రం మరియు పా నీ య ాలు టా ప నా ణ యత ఉండాలి .
- बहुत ों को बर बा दी की कोशिश करते देखा . . . - तुम . . .	- నేను చాలా మంది ని చూ సా . . . - నువవు . . .
जी जा जी ! स ड क पर ! वह उनहें अब स ड क पर ग ले लगा रही है !	బా వ ! ఆమె రో డ మీద అత నని క ౌ గి లి ంచు కు ంది !
मैं भी तुमसे पयार करता हूँ .	నేను కూడా నినను పరే మి సతుననాను .
अपनी माँ से पू छो जिस ने इस भा लू को पसंद किया था .	ఈ ఎ లు గు బ ంటి ఇష ట పడి న మీ అమమ కు చెపపు .
मैं मान ता हूँ कि इ ला ज थोडा टे ढ ा है .	చి కి త స కొంచ ం వి ంత గానే ఉంటుంది నేను ఒ పపు కుంటా ను .
वे मेरी ता री फ करते हैं कोई नहीं मेरे जो ड का	నా పర శం స లను పా డ తారు , స రెన రా గ ంలో
मैं बहुत छो टी थी जब मेरे मा ता - पिता गु जर गए .	నా చినన త నం లో తల లి ద ండ రు లు పోయా రు .
लेकिन उसने गा र ं टी दी कि उसके पै र ठीक होंगे .	కానీ ఆమె తన కా ళళ కు హా మీ ఇ చచి ంది .
तुमहारे पति के पास पिता की गल ति यों के अ ला वा	మీ భ ర త కు తన త ండ రి తపపు లు కా కుండా
मेरा मतलब है , आपकी लडकी को कैसा लड का चाहिए ?	మీ అమమాయి కి ఎలా ంటి వ రు డు కావాలి ?
वह कह रहा है कि मेरा बेटा पहले से शादी शु दा है .	నా కు మా రు డు ఇ పపటి కే వి వా హం చేసు కుననా డు అని అతను చెప తుననా డు .
मैंने बस कहा कि " साह ब , जरा हाथ लगा ना . "	నేను , సర , ము టటు కో అని అననా ను .
आपको पता है कि यह कया बात है .	ఇది ఎకకడ నుండి వ సతుంది అని నీకు తెలుసు .
अब , अपने दिमाग में बस ये रख ो .	ఇపపుడు , ఈ విషయం మాతరమే ఉ ంచు మీ మన స సు లో .
मैं यहाँ कं गा ल बन ने नहीं आया .	నేను న షట పో వ టానికి నేను ఇకకడికి రాల ేదు .
मेरी बेटी भाग य शा ली गु ड िया है .	నా కు మార తె ది లకష మీ క ళ ఉనన కు ంద న పు బ ొ మమ .
तो मेरे सामने बार बार कयों करता है ?	మళళీ మళళీ ఎ ను కి లా చేసతా వు ?
उनहोंने अभी मेरे पैसे नहीं दि ए हैं .	వారు ఇంకా నా క మి షన ఇవ వాలి .
तुम अभी भी बि स तर में कया कर रहे हो ?	మ ంచ ం పె ఇంకా ఏం చేసతుననా వు ?
मैं उसकी जा ँच करने आया था .	నేను దానిని త ని ఖ ీ చేయ డానికి వచచా ను .
च न नो , सक ू टर चा लू रख ो . इसे चा लू रख ो .	ఛ నన ో స కూ టర ను ఆన లోనే పెటటు .
सबसे पहले , हमारे मु दद ों से नि प टो .	మొద ట , మా సమసయ లను పూరతి చే ద దా ము .
सब के सो ने के बाद चले जाना .	అంద రు ని దర పోయా క వెళళ ు .
- ठीक है . - हम जलदी में नहीं हैं .	- సరే . - మన కే ం తొ దర లేదు .
लेकिन मुझे बताओ , कया उनहोंने इस घर में किसी को चो ट पहुँ चा ई है ?	కానీ నాకు చెపప ండి , ఈ ఇంట లో ఎవరి నె నా గా య పర చా రా ?
पिता जी . उनहें जाने दो .	డా డీ . వాటి ని ఒ ంట రి గా వదిలే య ండి .
लेकिन हमारी इ जज त च ली जाए गी अगर पिता जी को सबसे सामने पी टा गया .	నానన అంద రి ముందు ద ె బబ లు తి ంటే మన ప రు వు పో తుంది .
जी जा जी , कया आप साफ कह सकते हो ?	బా వ , దీ నని వి వరి ంచ గల వా ?
देखो , मुझे बुरा लग रहा है .	చూడు , నేను కూడా బాధ పడు తుననా .
कया कोई बात करने आगे आए गा ?	ఎవర ననా మాటలాడ టానికి ము ందుకు వ సతా రా ?
- खो लो . - हाँ , खो ल ता हूँ .	- దానని తె ర వు . - అవును , తె ర వ ండి .
- अब ? - बिलकुल भी नहीं . नहीं !	- ఇపపుడు ? - అసలు లేదు !
ठीक है , लेकिन अगर हम और परे शा नी में पड गए तो कया होगा ?	మంచిది , కానీ మరి ంత ఇ బబ ందు లను చి కకు కు ంటే ?
