- मैडम ? - अपनी प तनी और बेटी के पास लौट जाओ .	- మే డం ? - నువవు నీ భా రయ పిలల ల దగ గ రి కె ళళు .
यह बात सच है .	అది చాలా నిజం .
तुम कैसे . . .	ఎలా నువవు . . .
मुझे माफ करना .	ననను కషమించు .
मैंने यह उनके लिए नहीं किया .	అది నేను ఆయన కోసం చేయ లేదు .
शायद मैंने तुमहारे साथ स ख ती की , पर जरा खुद को देखो .	బహుశా కొంచెం క ఠ ి న ంగా వయ వ హ రి ంచి ఉంటా ను , కానీ నినను చూడు .
यह सट ॉर म फर ंट है . सट ॉर म फर ंट , यह रे बे का है .	ఈ మె సటా ర మ ఫర ంట . సటా ర మ ఫర ంట , ఈ మె రె బె క కా .
च ै ने ल बदल सकते हैं ? सुन वाई शुरू हो गई है .	మనం ఛ ా నె ల మా రచు దా మా ? వి చా రణ రా బో తుంది .
मुझे इसी पल तुमसे मिल ना है .	నేను వెంట నే నినను చూడ ాలి .
वि क टो रि या न यू मन जैसे ए स जे ड बल यू हम से कया चाहते हैं ?	వి క టో రి యా న యూ మా న లాంటి ఎ స జే డబ ల యూ లు మన లని ఏం చేయ మ ంటా రు ?
ती स परति श त जन ता को अब अचछी तरह पता है	ము ప ఫె శా తం పర జ ల ని బ దధ త ఇపపుడు తెలి సింది ,
कि उसने अपने लोगों को बचा ने की कोशिश की ?	ర కషి ంచే పరయత నం చేసే వారి ని పీ డి ంచా రా ?
नै ति क समझ ौ त ों के अपने फा य दे होते हैं .	నె తి క రా జీ కి దాని పర యో జ నాలు దాని కుంటా యి .
- ए . - नहीं .	- హే . - వదదు .
जाकर प तनी के साथ सो ते हैं .	మన మె ళళ ి భా రయ తో గ డు పు దాం .
तुमहें अपनी गर ल फर ें ड , सट ॉर म फर ंट से मिला ना चाहता हूँ .	నా గర ల ఫ రెండ , సటా ర మ ఫర ంట ను పరి చ యం చేయ ాలను కుంటుననా .
आप जब से सी ए स ओ थे , तब से व ॉ ट वहाँ कुछ ग ैर कान ू नी पर ीक ष ण करता आया है	మీ ర కకడ సీ ఎ స ఓ గా ఉనన పపటి నుండి వా ట చ టట వి రు దధ పర ీ కష లు చే సతుంది ,
एक अलग ही रा ह त मिल ती है .	ఈ వి ధ ంగా ఆ శ ర యం కల పి ంచింది .
टो नी तुमहारा क वार टर बै क है .	టో నీ ఇది గో నీ క వా టర బ యా క .
मुझे बस इसी के बारे में बात करनी है .	నేను ఎకకువ గా ఇం కే మీ మాటలాడ ాలని అనుకో ను .
हाँ . च लिए , हमें जाना होगा .	అవును . రండి మనం వెళళ ాలి .
डॉ . वो गल बा म .	డా . వో గె ల బా మ .
आ खि री वकत में , उस पर कया बी ती होगी .	ఆ చి వరి కొనని కష ణ ాల లో ఏం అను భ వి ంచి ందో .
शायद हम सब यह मान सकते हैं कि तुम ही शि कार ब ने हो .	మే మ ంద రం నువవు అస లెన బా ధి తు డి వి అని ఒ పపు కో వచచు .
पर मुझे भी एक मौ का चाहिए .	కానీ నాకు మ లు పు కావాలి .
मैं यह सब छोड चुका हूँ .	ఈ చెతత ంతా నాకు ము గి సింది .
- अगर वह अभी तक जि ंदा है . . . - रुको .	- ఆమె ఇంకా బర తి కే ఉంటే . . . - ఆగు .
. . . तु र न त वि रो ध कीजिए .	. . . వెంట నే ని ల బడ ండి .
मैं किसी अधि कारी के आने का इंतजार करते - करते थ क चु की हूँ . . .	నాకు ఎవరో నిర వ హ కు ల కోసం వే చి చూడ టానికి వి సు గగా ఉంది . . .
तुम और मैं .	నువవు , నే న ూ .
वह मेरा काम नहीं था , पर साथ देने के लिए शुकरिया .	అది నేను కాదు , కానీ మీ స హ కా రా నికి ధనయవాదాలు .
जहाँ व ॉ ट के सम र थ कों और वि रो ध करता ओं में ट क कर हुई ,	వా ట అను కూ ల మరియు వయ తి రే క నిర స న కారు ల మధయ ఘ ర ష ణ
कया बात है ?	ఏం జరిగింది ?
- आपने मुझसे झूठ कहा . - कया मतलब ?	- నాకు అబ దధ ాలు చెపపా వు . - అంటే ఏంటి ?
- कया ? - त ू बु ले ट पर ू फ है कया , सा ले ?	- ఏంటి ? - బు లెట ఫ రూ ఫ వే సు కుననా వా ?
- यह ठीक नहीं है . - तुम आकर बैठ ो गी ?	- అది స రెన ది కాదు . - కూ రచు ంటా వా ?
व ॉ ट भ ला ऐसा कयों करे गा ?	వా ట ఎందు క లా చే సతుంది ?
तुम पहले इंसान नहीं हो जिस ने मुझे कमी ना बताया .	ననను చెతత ముఖ మని పి లి చి న మొదటి వాడి వి కాదు .
इ ति हा स में ऐसा कोई भी है जिस पर इतना जु ल म हुआ ,	ఇది వర కు చ రి తర లో ఎ నన డ ెనా ఎవరి నె నా తమ వారి ని
हाँ . हमारी ही कोई अपनी .	అవును . మా స వ ంత మనిషి .
या पह रे दार ए के बंद ूक ें लेकर , हम पर ट ू ट पड ेंगे .	లేదా మన లని గా ర డు లు ఏ కే లతో తూ టలు పొ డు సతారు .
तुम समझ ही नहीं सकती .	నీకు బహుశా అరథం కా దే మో .
मुझे आप पर यकीन है कि आप हमें रा सता दिखा एँगे .	మీరు మాకు మా రగ దర శ కం చేసతా రని నమ ము తుననాను .
उसका दा वा है कि कार य कर म ने उसे ध ो खा दिया ,	అంటే , అతను కర మ ణి క తన ను వి ఫ ల ం చేసి ందని అంటా డు ,
कयोंकि मैं ब गल के कम रे में , आपकी बेटी के पास जा ऊँगा	ఎందుకంటే నేను ప కక గ ది లోకి వెళ ు తుననాను , మీ కూ తు రి దగగర కు ,
उसकी सा थी ने ह िर ण के क पडे पह ने थे जिस का ई गल ने " शि कार किया " और " घु ड सवा री की . "	అందు లో తన భా గ సవా మి జి ంక లా వే ష ం వే సు కు ంటే , ఈ గి ల " వే టా డి " " పె కి ఎ క కా డు . "
शायद तुमहें अपनी प तनी को खुश करना चाहिए था , बे कार आदमी .	నువవు నీ భా రయ ను స ంత ృ ప తి పర చ ాలి , భా రయ ను తా ర చే వెధవ .
ए म पा यर व ॉ क .	ఎ ం పె ర వా క .
पर नहीं है .	కానీ లేను .
अरे , बेटा .	హే , మి తర మా .
सुन वाई पर , वह व ॉ ट के खिला फ मु ँ ह खो ल ने के लिए तैयार है .	అతను వి చా రణ లో వా ట కు వయ తి రే కంగా చెపప డానికి సిదధ మే .
माफ कीजिए , वह बहुत थ क गए हैं .	కషమి ంచండి , ఆయన చాలా అ లి సి పోయా రు .
चिंता मत करो . इसके पास माँ होगी .	కంగా రు పడ కు . తన కు అమమ ఉంటుంది .
उनहें और सु पर आत ंक वा दी चाहिए . यही . . .	వాళళ కు ఇంకా మ హా ఉ గర వా దు లు కావాలి . అవి . . .
का ंग रे स ? बस भी कीजिए .	కా ంగ రె స ? ఇక చెపప కు .
एक नंबर के भर ष ट , कमी ने लोग हैं .	పూరతి గా అవి నీ తి చెతత మొ హ ాలు .
ई श वर के अ धी न एक देश , याद है ?	దేవు ని కరి ంద ఒక దేశం , గురతు ందా ?
मैंने हमेशा आप से ई मान दा री बर ती है . इस बार भी ई मान दा री बर त ूँगा .	మీ తో ఎపపుడూ నిజ ా యి తీ గా ఉననాను . ఇ పపుడ ూ నిజ ా యి తీ గా ఉండాలి .
सुनो , व ॉ ट ने तुमहारे साथ गलत किया , है ना ?	వి ను , వా ట నినను నా శ నం చేసి ంది , అవునా ?
तुमहारा दिन अचछा हो .	నీ రోజు బాగు ండ ాలి .
आपने उनहें फोन किया ?	వాళళ కి ఫోన చేశా వా ?
जिंदगी हमेशा मुशकिल रही है ,	జీవితం ఎపపుడూ కష ట ంగా నే ఉండే ది ,
मुझे माफ कर दो , मे व .	ననను కషమించు , మే వ .
कैसे उसे संभाल ना है .	నీ క త ని ది ఉనన టటు గా .
वह कया है ?	అది ఏంటి ?
इससे पहले कि इस ढ ी ठ चे ह रे से किसी को चो ट पहुँ चे , इसे बद लो .	ఎవరి నీ దాని తో గా య పర చ క ము ందే ఆ దు డు కె న చూ పు ప కక న పెటటు .
ती खे श बद ों में ट वी ट देने में ?	శ కతి వ ంత మెన పద ాల తో ట వీ టల కా ?
जैसे कि , ए न बी ए 2 के ? प यू ड ू पा ई ?	ఎ న బీ ఏ 2 కే లాంటి వి ? ప యూ డీ పె ?
- शुकरिया . - हाँ .	- ధనయవాదాలు . - సరే .
कं पा उ ंड वी के सम र थ न में हमें ला ख ों ट वी ट आए हैं .	కా ం ప ౌ ండ వీ కు మ దధ తు గా మి లి యన ట వీ టలు వచచా యి .
तुम मेरी सबसे बडी ना का मी हो .	నువవు నా గొపప వె ఫ ల యా ని వి .
सु पर ही रो अ मरी का को बचा ते हैं	సూ ప లు అ మె రి కా ను ర కషి సతారు
या तो मैं पर ण ा ली में हूँ ,	నే ని ం కా వయ వ సథ లో అననా ఉండాలి ,
डि सक की जरूरत नहीं है , बस डा उन लो ड कर सकते . . .	డి స కలు అవసరం లేదు , డ ౌ న లో డ చేసుకో వచచు . . .
ए , मेरी बात सुनो . हम बैठ कर बात करेंगे , ठीक है ?	నా మాట వి ను . మన మి ది మాటలాడు కు ందా ం , సరేనా ?
जैसा कि तुमने कहा .	నువవు చెపపా వు గా .
मुझे वह फि ल म नहीं देख नी .	నాకు ఆ సి ని మా చూడ ాలని లేదు .
आप लोग कैसे हैं ?	మీ రం తా ఎలా ఉననారు ?
मैं बस साफ बता ना चाहती हूँ .	సప షట ంగా ఉండ ాలను కుంటుననా .
और सु पर ही रो चाहिए !	మరి ంత మంది సూ ప లు !
स टा र ला इट .	సటా ర లెట .
तुमने कया कर दिया ?	నువవు ఏం చేశా వు ?
अरे , जि म .	హే , జి మ .
एक और . श रा ब का एक और पया ला .	ఇం కొ క టి . ఒక పె ంట పే ల ఏ ల .
बहुत बडी बात है .	చాలా సంతోష కర మెన ది .
तो , तुम ऐसा कुछ देख ते हो जो बच चों को पसंद हो ?	అయితే , పిలల లు చేసే వి ఏ వె నా నువవు చేశా వా ?
वह तो ऐसा चाहता भी नहीं था .	తను అస ల ది కావాల ను కో లేదు .
कैसे . . .	ఎలా . . .
स टा र ला इट ?	సటా ర లెట ?
अचछा . सभी लोग शा ंत हो जाएँ .	సరే , సరే , అందరూ ని శ శ బ ద ం .
न यू मन की कं पा उ ंड वी सुन वाई " अफ वाह , प कष पा त और गलत सू च ना "	న యూ మా న కా ం ప ౌ ండ వీ వి చా రణ " వ ద ంతి , ప కష పా తం మరియు త పపుడు సమా చా రం "
तो आपके इस कै ं सर से जलदी , आपको खतम कर द ूँगा .	ఆ కా న సర కంటే వే గ ంగా నినను నేను చం పే సతా .
जब वह बा ह री दुनिया देख े गा , तो वह घ बरा जाएगा .	వాడు బయట పరపంచ ం చూ సిన పపుడు భయ పడి పో తా డు .
ले नी ऐसा कभी नहीं कर पा ता .	లె ననీ అలా ఎపపుడూ చేయ డు .
यह सम लै ंग ि क र वै या नहीं है .	ఇది స వ లి ంగ సం పర కం కాదు .
सब कुछ मेरी माँ का मन पसंद .	అన నీ మా అమమ కు ఇష ట మెన వి .
हर एक पल जो हम बर बाद करते हैं . . .	మనం వ ృ థా చేసే పరతి నిమిష ం . . .
तुमहें कया चाहिए ?	నీకు ఏం కావాలి ?
बहुत अचछी बात है .	అది మంచి ఆలోచ న .
उसकी एक माँ है .	అతనికి తల లి ఉంది .
उसके बाद , आपके दोनों बे ट ों को ढूँढ ूँगा , और उनकी पत नि यों को और उनके बच चों को .	ఆ తరువాత మీ ఇదద రు కొ డు కు లను , వారి భా రయ లను , చినన పిలల లను కను గొ ంటా ను .
बच चों के लिए ठीक हैं . यह उनहें अभी देख सकता है . तुमहारी उ तनी उ मर है .	అవి తల లి ద ండ రు ల పర య వే కష ణ లో చూడ వచచు . నువవు పెదద వాడి వే చూడ వచచు .
मैं समझ ता हूँ . घ बरा इए मत .	నాకు తెలుసు . ఫర వాలేదు .
मुझे बेहद खुशी है कि इस बार , मैं वहाँ थी , पर . . .	ఈ సారి నే న కకడ ఉండ డం సంతోష ంగా ఉంది , కానీ . . .
तुम मुझे बडी अचछी लग ती हो . तुम में दम है .	నాకు నువ వ ంటే ఇషటం . నీ లో ధ ె ర యం ఉంది .
वह . . .	అది . . .
मुझे म ं जू री मिल चु की है .	దానికి ఆ మో ద ం పొ ందా ను .
अलग - अलग पसंद है .	వి భి నన పటటు లు .
वह मेरी बेटी है .	ఆమె నా కూ తు రు .
- चलो . - अचछा ?	- రండి . - అవునా ?
और आप से बेहतर कि से पता होगा ?	మీ కంటే ఎకకువ ఎవ రికి తెలు సతుంది ?
आज के दिन आपका पूरा परिवार जान से जाएगा .	మీ మొతత ం కుటుం బం ఈ రోజు చని పో తుంది .
तो . . .	సరే . . .
बैठ गए .	ఇదే అది .
मैं तुम सभी को निका रा गु आ के विमान पर च ढ ा द ूँगी .	మీ అంద రి నీ నిక రా గ వా కు విమానం లో పం పి సతాను .
जो एक तरफ बैठ ा है , जब कि अस ली ही रो क माल करते फिर ते हैं .	ప కక కు కూ రచు ంటే , నిజ మెన హ ీ రో లు ప ను లు చేసతుననా రు .
मुझे इससे बहुत लगा व है , और शायद तुमहें भी होगा .	ఆమె నేను చాలా ఎకకువ శ ర దధ చూ పే ది , నువ వ ూ చూ పు తా వ ను కుంటా .
इस माम ले में तो मत क हो .	అది ఈ స ంద ర భ ంలో అన కు .
स टा र ला इट उन लोगों के साथ मिल कर सा जि श कर रही है	సటా ర లెట కు టర ప నని ంది , అ మా ను ష ంగా హ తయ చేసిన
दुनिया बडी कमी नी है .	బయట పరపంచ ం చాలా దారు ణం .
हैलो , बेटा . कैसे हो ?	హే , మి తర మా . ఎలా ఉననావు ?
वह बहुत पहले की बात है .	అది చాలా కాల ం కరి తం .
वे भर ती होना चाहती थीं .	వాళళు అ ప లె చేసే వారు .
मा इ कल , तुमने फा उल किया .	మె ఖ ే ల , అది ఆ పు తుంది .
मुझे तुमसे बात करनी है .	నేను నీ తో మాటలాడ ాలి .
मुझे माफ कर दो .	ననను కషమించు .
कयोंकि मैं उससे पयार करती हूँ .	ఎందుకంటే నాకు వా డ ంటే పరే మ .
आपका जवाब नहीं .	నువవు అదభు తం .
इन होंने मुझे उडा कर दिखा या .	వాళళు ననను ఎ గి రి ంచి చూపి ంచారు .
- उनहें तुम दोनों की जरूरत है . - हाँ .	- వాళళ కు మీ రి దద రు కావాలి . - సరే .
हम गलत टी म में हैं .	మనం తపపు జ టటు లో ఉననా ం .
ए ली ना छोड कर च ली गई है .	ఎ లీ నా వెళళి పోయింది .
उसकी जिंदगी अलग है .	అతని జీవితం భి నన మెన ది .
इसे अ ख रो ट से एल र जी है .	అతనికి గి ం జ లు పడ వు .
हो सकता है कि ये सिर फि रे हमारी सी मा पार कर चु के हों	ఈ ఉ న మా దు లు మన సరి హ దదు లు దా టి ఇ పపటి కే వచ చేసి ,
पर वह तब , अगर सुन वाई तक तुम उसे मर ने से बचा स को तो .	కానీ వి చా రణ వర కు ఆమె ను స జీ వ ంగా ఉ ంచ గ లి గి తే నే .
- तो उसका पता लगा ओ . - ठीक है .	- ఆమె ను కను గొ న ండి . - సరే .
का श मुझ में तुमहारे जि तनी हि म मत होती ,	నాకు నీ అంత బ ల ంగా ఉండ ాలని ఉంది ,
तुम पहले , सवा भा वि क त ौर पर जन मे सु पर ही रो हो .	నువవు స హ జ ంగా పు టటి న మొదటి సూ పర హ ీ రో వి .
मैंने उसे पहले भी कम समझ ा था . दोबारा यह गलती नहीं कर ूँगा .	ఆమె ను ఇది వర కు త కకువ అ ంచ నా వే శా ను . అది మళళీ చేయ ను .
सट ॉर म फर ंट उन पर श ंस कों का प कष ले ती है जिन होंने बे घर अ पर वा सी पर हम ला किया	నిర వా సి త వల స దారు ని పె దా డి చేసిన అభి మా ను లను సమ రథ ి ంచిన సటా ర మ ఫర ంట
द बॉ य ज	ది బా య స
मुझे लगता कि ई श वर मुझे किसी मु हि म पर भेज रहे हैं .	ననను దేవు డ ొ లకష యం కోసం పం పి సతుననా డ ను కుననా .
चलो भी .	సరే లే .
बार - बार . . .	మళళీ మళళీ . . .
चले जाओ और कभी लौट कर मत आ ना .	వెళళ ు , మళళీ తిరిగి రా కు .
मुझे पता है ,	నాకు అరథ మెంది ,
कैसे मुझे संभाल ते हो ,	నాకు మ దధ తు గా ఉ ండు ,
ठीक है ?	సరేనా ?
उस बचचे को किसी भी चीज की कोई समझ नहीं है .	ఆ పి లలా డి కి దే ని గురించి ఏమీ తెలియదు .
कभी आपको उस दर द का अ ह सा स हुआ	అది మీ సప ృ హ లోకి వచచి ందా ,
कमी ने .	వెధవ లు .
नहीं . अफ सो स , ह यू ने हमारे अ हम गवा ह को जल ने दिया .	హ యూ మన ముఖ య సా కష యి త నని తాను కాల చు కు ని చని పో యే లా చేశా డు .
वह सब सच होगा और सच के सि वा कुछ नहीं होगा ?	నిజం తపప ఇం కే ం కా దని పరమా ణం చేసతా రా ?
सी - स पै न - सर कार को लेकर आपकी अ शो धि त रा य तक नी की मुशकिल ें कृपया धी र ज रख ें	సీ - స పా న స వరి ంచ ని పర భు త వ కో ణం సా ం కే తి క ఇ బబ ందు లు దయచేసి వే చి ఉండ ండి
