तो अगर मैं इसे ठीक से समझ रहा हूँ , तो शायद घर यहाँ पर था ?	అందుకే ఒక వే ళ నేను ఇది సరి గగా చూ సతునన టల యి తే ఇ లలు ఉనన ది ఇకకడ ే నా ?
हमारे अस पता ल से निकल ने के बाद , हम पु लि सवा लों से त ंग आ चु के थे .	మేము ఆ సు ప త రి వది లి వచచా క , మాకు పోలీసు ల ంటే వి సు గు వచచింది .
और आ ख िर कार , हमें जे र लड गि बस न मिल गया .	చి వర కు జర ాల డ గి బ స నను కను గొ న గ లి గా ం .
जे फ री व ॉ कर ने सा ढ े तीन साल सर कारी जेल में गु जा रे .	జె ఫ రీ వా కర మూ డు నన ర ఏ ళళు ఫె డ ర ల జె లు లో గ డి పా డు .
पर इस पू रे माम ले में एक और बात यह है	ఈ మొతత ం స ంద ర భ ంలో మ రో మ లు పు ఏంట ంటే
जो उनहें पता हो नी चाहिए .	నా దగగర ఉ ందని చెపపా ను .
छोड ो मुझे , यार . ठ ंड रख ो .	నా మీద లె గు . పర వాలేదు .
जब हम वहाँ पहुँ चे , हर तरफ ख ून था .	అ కకడికి వెళళ ే స రికి , అంతా రక తం ఉంది .
किसी ने भाग कर आकर कहा ,	ఎవరో పె కి ప రు గె తతు కొ చచి ,
प ॉ ली ग रा फ पर ीक ष ण , जिस में वह अस फ ल रहा .	పాల ీ గరా ఫ పర ీ కష లో అతను వి ఫ ల మ య యా డు .
इस जज का कुछ कह नहीं सकते . मुझे नहीं पता था यह इतना लं बा खि ं चे गा .	ఈ నయా యా మూ ర తి తో ఏం జరుగు తు ందో తెలియదు . నేను ఇంత దూ రం వ సతు ందని అనుకో లేదు .
मैंने कम से कम 1 , 4 00 के स प लट ने में मदद की है , जो अभी भी जा री है .	నేను క నీ సం 1 , 4 00 కేసు లు ఇంకా ఫి ర యా దు లను తారు మా రు చేయ టానికి స హాయ పడ డా ను .
" ए , हमने सुना कि वे मीक को गर ै जु ए ट अस पता ल ले गए हैं . "	" హే , వాళళు మీ కను గరా డ యు వే ట ఆ సు ప త రికి తీసు కె ళళ ా రని వి ననా ం . "
पर हमने उस समय की लि ख ी गई पुलिस रि पो रट पढ ी . . .	కానీ ఆ సమయం లో పోలీసు ల ని వే ది కను చూశా ము . . .
फि ला डे ल फ िया त ह की का त के नि शा ने पर भर ष ट पुलिस वाले	ఫి ల డె ల ఫి యా దర యా ప తు లో అవి నీ తి పోలీసు లే లకష యం
और उसे अपने पिता को देख कर खुशी हुई .	తను వాళళ నా ననను చూ సి ఆన ంది ంచా డు .
और यह देखना शुरू किया कि कया मीक की	మీ కను ముందు గా అ రె సట చేయ వచచా లేదా
मुझे लगता है रे जी को पता था कि घर में न शी ली दवा का ध ं धा चल ता है .	రె జీ కి ఆ ఇంట లో మా ద క దర వయ కార య క లా ప ాలు జరుగు తుననా య ని తెలు స ని నమ ము తుననాను .
मीक के जा सूस ों ने मुझसे सं पर क किया .	మీక పరి శ ో ధ కులు నా దగగర కు వచచా రు .
जि से पता हो कि ना र को टि कस फी लड यू नि ट कैसे काम करती है .	ఎవరెనా నా ర కో టి కస ఫీ ల డ యూ ని ట ఎలా పని చే సతు ందో తెలి సిన వాళళు .
तब सु पर वा इ जर अंदर आकर ह ँ स कर कह ता , " तुम लोग पागल हो . "	అపపుడు సూ పర వె జర వచచి నవ వు తూ " మీరు పిచచి వాళళు " అని అనే వాడు .
कै थी वि लि य मस मीक की माँ	కా థ ీ వి లి య మస మీక తల లి
2 2 0 4 सा उ थ हे म बर गर सट री ट	2 2 0 4 ఎ స . హె ం బర గర వీ ధి
उसका नाम जे फ री व ॉ कर है .	అతని పేరు జె ఫ రీ వా కర .
कै थी वि लि य मस मीक की माँ	కా థ ీ వి లి య మస మీక తల లి
य दि इस सू ची को देख ें ,	మీరు ఈ జా బి తాను చూడ ండి ,
तो पहली घट ना थी न ु क क ड पर हुए न शे के सौ दे की नि ग रा नी .	అయితే మొద ట జరిగి న సం ఘ టన మ లు పు లో మా ద క దర వయ కొ ను గో లు పె ని ఘ ా .
आपकी जिंदगी आपके साथ काम करने वाले पर नि र भर होती है .	మీ జీవితం ఇ తను వాళళ పని చే సతునన దాని మీద ఆ ధా ర పడి ఉంటుంది .
हम आज सु बह भगवान के म हि मा गा न के लिए इ कट ठ े हुए हैं .	మేము ఈ ఉద యం దేవు ని మ హి మను , కీ ర తి ని సతు తి ంచు దా మని వచచా ము .
उसे अ परा ध करने के आ रो प में गिर फ तार कर स जा दी गई है ,	అతను మా ద క దర వయ డీ ల ర ల నుంచి దొ ంగ త నం లాంటి నే రా రో ప ణ ల కారణ ంగా
जो एक सप ष ट जानकारी है .	అది వి లకష ణ మెన వి వ రం .
फि ला डे ल फ िया	ఫి ల డె ల ఫి యా
ना र को टि कस फी लड यू नि ट का हि ससा थे .	నా ర కో టి కస ఫీ ల డ యూ ని ట లో ఉననా ము .
और मीक मिल के के स में ,	ఇంకా మీక మి ల కేసు లో ,
दूस री बात जो का ग जा त ों में है . . .	ప తర ాల గురించి ఇం కొ క విషయం . . .
वे थोडी सी न शी ली दवा बे च ने के लिए	వాళళు దా కకు నన ఇంట లో నుంచి వచచి
और तब मैं उसके न ज द ीक जाकर उसकी त सवी र ें ख ी ं च ने लगी .	నేను అపపుడు తన దగగర కు వెళళి , ఫో టో లు తీ య డం పరా రం భి ంచా ను .
उसका नाम अधि कृ त सू ची से ला पता है .	అ ధి కా రిక జా బి త ాలో కనిపి ంచ లేదు .
" लिया , इन लोगों ने मुझे फोन किया है , और , पता चला है कि ,	" లి యా , వీ ళళు ఇ పపుడే నాకు ఫోన చేశారు , ఇంకా సప షట ంగా ,
करि स पार कर मीक के अं कल	కరి స పార కర మీక అ ం కు ల
मु ज रि म का नाम पुलिस ऑ फि सर रे जी ना लड ग रा हम	ని ంది తు డి పె రు పోలీసు అ ధి కా రి రె జీ నా ల ట గరా హం
पो सट - क न वि क शन रि ली फ एक ट	శి కష ా న ంత ర ఉ ప శ మన చ టట ం
करि स पार कर मीक के अं कल	కరి స పార కర మీక అ ం కు ల
माफ करना , जान . तुम मुझे जानती हो , मैं ठीक हूँ . तुम कै सी हो ?	కషమించు , బంగా రం . నీకు తెలుసు , నేను బాగానే ఉననాను . నువ వె లా ఉననావు ?
मतलब , परिवार के रूप में हम इस अन या य से दस साल से लड रहे हैं , यार .	ఒక కుటుం బంగా , ఈ అన యా యం పె మేము 1 0 సం వ త సర ాలు గా పో రా డు తుననా ము .
तो इस समय हम संभा वि त कारण ह ल फ ना मे को देख रहे हैं ,	అయితే మేము ఇపపుడు ఇకకడ చూ సతునన ది సం భా వయ కారణ ం అ ఫి డ వి ట ,
और जब मैं जेल में था तब मेरी बहन ने इसका ए ह सा स करवा या .	నేను జె లు లో ఉండ గా మా సోద రి గురతు చేయ ాల సి వచచింది .
उसे वह सं देश भेज ने के लिए वह अ व सर चु ना .	అది అవకా శ ంగా తీసుకో వ టం నాకు స ఫ ూర తి ని చచి ంది .
पुलिस भर ष टा चार त ह की का त में पाँच पर आ रो प	అవి నీ తి పోలీసు ల దర యా ప తు లో ఐ దు గురి పె ఆ రో ప ణ లు
और अगर ऐसा हुआ होता , तो वह अब तक मर चुका होता , या उसे गोली लगी होती .	ఒక వే ళ అది జరిగి ఉంటే , ఇ పపటి కీ అతను చని పోయి ఉండే వాడు , లేదా క నీ సం కాల చ బ డే వాడు .
हम सब के लिए वह शान दार दिन था .	అది మా అంద రికీ ఒక అదభు త మెన రోజు .
सबसे पहले , मैंने खबर ों में देखा .	ముందు గా , నేను వార త లలో చూశా ను .
मैं चार या पाँच साल की उ मर से ई गल स का पर श ं सक रहा हूँ .	నాకు నాలు గె దు ఏ ళళ పపటి నుంచి నేను ఈ గి ల అభి మా ని ని .
जिस में आ धि का रिक मदद के लिए घ ू स लेना भी शा मिल है .	అ ధి కా రిక ప ను ల కోసం ల ంచ ం తీసుకు నన టలు నే రం అ ంగ ీ కరి ంచారు .
तो ये सारे नए सब ूत , जन ता के सामने हुए ये खु ला से ,	కాబటటి ఈ కొతత సా కష యం , కొతత గా వె లు గు లో కొ చచి న వా సత వ ాలు ,
त करी बन एक घं टे बाद ,	దా దా పు ఒక గంట తరువాత ,
" ख डी की है , उसे मैं भे द नहीं पा ऊँगा . "	" తన చు టట ూ నిర మి ంచు కునన " ర కష ణ ను ప గల గొ టట లేను .
आँख ें ख ून से ला ल थीं . श री र दु ख रहा था .	నా క ళళ లలో రక తం ఉంది . నా ఒ ళళు న ొ పప ి గా ఉంది .
रॉ न पार कर मीक के अं कल	రా న పార కర మీక అ ం కు ల
गि बस न का भी आ परा धि क इ ति हा स रह चुका है .	గి బ స న కి కూడా నే ర పర వర తన కలి గి న చ రి తర ఉంది .
कि रे जी ग रा हम ना र को टि कस फी लड यू नि ट का हि ससा है ,	రె జీ గరా హం నా ర కో టి కస ఫీ ల డ యూ ని ట అనే దా ంట లో భా గం అని ,
अ दा लत की परति लि पि 1 9 अग सत , 2 00 8	కోర టు రాత పరతి ఆ గ సట ు 1 9 , 2 00 8
रे जी ग रा हम गिर फ ता री अफ सर है .	రె జీ గరా హం అ రె సట చేసిన అ ధి కా రి .
यकीन न , तुम तो यही क हो गे . तुम उसके अं कल हो , समझ े न कया कह रहा हूँ ?	అవును లే , మీరు అతనికి అ ం కు ల కాబటటి అలాగే చెబు తారు అని అనే వారు , అరథ మ యి ందా ?
" और फिर बाद में वह लेना प डा हो . . . "	" ఆ తరువాత మీరు దానని తీసు కుననా రే మో . . . "
और तब भी , वह कुछ बा लों से लट क रही थी ,	అది ఇంకా వే లా డు తూ ఉంది , కొనని వెంట రు కల తో ,
जब र मीक अपने बे टे को देख ता है और पा पी अपने पिता को ,	ర మీక తన కొ డు కు ను , పా పీ వాళళ నా ననను చూ సిన పపుడు ,
तो हमने एक पी सी आर ए अप ी ल दा यर की , पो सट - क न वि क शन रि ली फ एक ट अप ी ल ,	అందు కని మేము ఒక పి సి ఆర ఎ దా వా , శి కష ా న ంత ర ఉ ప శ మన చ టట దా వా ,
जिन के साथ काम करता हूँ उनहें जानता हूँ , और यह भी पता है मैं किस हा ल से गु जरा हूँ ,	నాతో పని చే సతునన వారి సంగ తి తెలుసు , ఎలా ంటి పరిసథి తులు ఎదు ర కొ ననా నో తెలుసు ,
बस यह कह रही हूँ कि आज वे उसे जेल लेकर गए थे .	అత నని ఈ రోజు జె లు కు తీసు కె ళళ ా రు అని చెబు తుననా న ంత ే .
और व हीं से ही घर के सामने वाले	ఇంకా ఎలా గో అలా ఆ ఇంటి ద వా రం
एक और बात है जो ठीक नहीं लग ती .	మ రో వి వర ణ కూడా సరి గగా లేదు .
और केवल लोगों का पै सा ही नहीं .	కేవలం జ నం డబబు మాతరమే కాదు .
पुलिस वाले ऊपर वाले कम रे में गए . एक पुलिस वाला त ह खा ने में गया .	పె కి వెళ ు తునన పోలీసు లు , బ ే స మె ంట లోకి వెళ ు తునన పోలీసు లు .
उस दिन रे जी ग रा हम ने मुझे बताया था कि उसे एक जगह पर जाना है ,	రె జీ గరా హం ఆ రోజు నాతో అననా డు తన కు లకష య సథా నం తెలు స ని ,
वह पुलिस रि पो रट से मे ल नहीं खा ता था ,	పోలీసు లు ని వే ది క లో ఉనన దానికి సరి పో ల లేదు ,
अब जब यह सब बकवास पता चल रही है , 1 0 - 1 1 साल के बाद ,	ఇపపుడు ఈ సమసయ అంతా పో తోంది , 1 0 , 1 1 ఏ ళళ తరవాత ,
ताकि हे म बर गर सट री ट की त ला शी के लिए उसे वार ंट मिल स के .	హె ం బర గర వీ ధి లో సో దా నిర వ హి ంచ టానికి వా రె ంట కోసం పూరతి చేయాలి .
जब मीक छो टा था , तब मेरे साथ कभी - क भा र चर च आया करता था .	మీక చినన పపుడు , అతను కొంచెం సే పు చ రచ కి నాతో ఇకకడికి వచచే వాడు .
न शी मा के आ ंत रिक माम लों के वि भाग में शि का य त दर ज करने के बाद ,	న ష ీ మా వి లి య మస అంత రగ త వయ వ హా రాల వా రికి ఫి ర యా దు చేసి ంది ,
जिन हें व की ल अपने के स में गवा ही देने के लिए नहीं बुला ते हैं .	పరా సి క యూ టర లు వారి ని కేసు లను ని రూ పి ంచుకో టానికి పి లవ రు .
पर उसके ला ग ू होने से पहले ही उसने इस ती फा दे दिया .	కానీ అది అమ లు చేసే లో పే అతను రా జీ నా మా చేశా డు .
टा य ल र मे रो नी परा इ वे ट जा सूस	టె ల ర మా రో నీ పర ె వే ట పరి శ ో ధ కు డు
गिर फ ता री अफ सर ों में से एक ,	అ రె సట ు చేసిన అ ధి కారు లలో ఒక రు ,
यह हमारा प कष पा ती होना हुआ जब कहा , " वह मेरा भ ती जा है .	" మీక మి లను వ దల ండి " అని మేము చె బి తే అతను మా బం ధ ు వు కా వ టం వలల
मैंने दरवा जा ख ट ख टा या , रे जी ग रा हम ने दरवा जा खो ला .	నేను తలు పు త టట ా ను , రె జీ గరా హం తలు పు తీ శా డు .
तो हमें हर चीज को ग हरा ई से देखना होगा .	మనం ఇంకా వి సత ృ తంగా , లో తు గా చూడ ాలి .
संभा वि त कारण ह ल फ ना मे पर आ धा रि त था ,	సం భా వయ కారణ అ ఫి డ వి ట కోసం చేసిన అ భయ రథ న ,
जो हमें सी धा मीक की रि हा ई तक ले जाएगा .	వీ లు కలు గు తు ందని మే ం అనుకుంటుననా ం .
- उस पर द सत खत कर दो . - यह बकवास बंद करो .	- స ంత కం చేయ ండి . - ఆ చెతత ను పా రే య ండి .
कयोंकि उनहोंने देखा कि मीक क थि त रूप से वहाँ था .	ఎందుకంటే వాళళు మీక అకకడ ఉనన టలు గుర తి ంచారు .
यह त य करने के लिए कि वे दो ष ी हैं या नहीं .	నిరణ యి ంచ టానికి రి ఫ రీ / నయాయ తీ ర పరి ని నియ మి సతారు .
और वह न ु क क ड से 2 0 से 3 0 फु ट की दू री पर था जब उसने सौ दा होते देखा .	ఇంకా అతను ఆ కొ ను గో లు ను చూ సిన పపుడు మ లు పు కు 2 0 నుంచి 3 0 అడుగు ల లో పు ఉననాడు .
बरा यन मै कम ॉ ने गल मीक का व की ल	బ రా యన మె క మా న గల మీక లా య రు
पुलिस च ौ क सी गाडी	పోలీసు ల ని ఘ ా వా హ నం
ख डे हो कर जो भी दा वा किया है कया सच में वै सा ही हुआ था .	అకకడ నిజంగా జరిగి ందా లేదా అని చూడ టానికి వెళళ ా ము .
सही कहा .	అవు న వు ను .
" मुझे कुछ नहीं कहना . मैं एक अचछा पुलिस वाला था . "	" చెపప టా ని కే ం లేదు . నేను మంచి పోలీసు ను " అని చెబు తుననా డు
" उसका हु लिया ही बदल गया है .	" తను తన లా గే కనిపి ంచ లేదు .
आ ंत रिक माम लों के वि भाग की रि पो रट आई .	అంత రగ త వయ వ హా రాల ని వే ది క వచచింది .
जे फ री व ॉ कर की तरह ,	జె ఫ రీ వా కర లా గా ,
बरा यन मै कम ॉ ने गल मीक का व की ल	బ రా యన మె క మొ నా గల మీక లా య ర
कि वह जलदी बाहर आए और अपने बे टे से मिले .	అతను బయటకు వచచి తన కొ డు కు ను మళళీ చూ సుకో వాలని .
कि जहाँ पुलिस की कार य वा ही हुई थी वह स था न जाकर देखा जाए .	పోలీసు ల కార య క లా ప ాలు జ రి గా యో అకకడ కు వెళళ టం చాలా కష ట ంగా ఉంటుంది .
मीक मिल की आवा ज - सु पर स टा र र ै पर अभी तक जेल में कयों है ?	మీక మి ల మాటలా డా డు - సూ పర సటా ర ర యా పర ఇంకా జె లు లోనే ఎందుకు ననా డు ?
तो वह ले ख छ पा , और फिर मैंने उसकी माँ , कै थी से बात की .	ఆ క థ నం రా గానే , నేను అతని తల లి కా థ ీ తో మాటలా డా ను .
इन छा न बी नों के कारण 1 00 0 गिर फ ता रि या ँ हुई थीं	ఈ పరి శ ో ధన లు 1 00 0 అ రె సట ు లకు దా రి తీ సా యి .
और म ध य स थ , अधि क तर व की ल होते हैं .	నయాయ తీ ర ప రు లు ఎకకువ గా లా య ర లే ఉంటా రు .
यह तो बस अफ सर ों का काम है .	అది కేవలం అ ధి కారు ల పని .
उनकी श रा ब पी ते देखा है .	వారి మ ద యం తా గ టా నని చూశా ను .
उसे कि तने पैसे मिले थे ?	అతనికి ఎంత డబబు దొ రికి ంది ?
वहाँ इतने सारे लोग थे . यकीन ही नहीं हो रहा था .	అకకడ బయట చాలా మంది జ నాలు ఉననారు . అది నమమ శ క య ంగా లేదు .
वै न जो न स राज नी ति क व या खया ता	వా న జో నస రా జ కీ య వయా ఖ యా త
