मुझे पता था कि मैं तुमहें यहाँ अके ला ही पा ऊ ं गा .	నువ వి కకడ ఒ ంట రి గా ఉంటా వని నాకు తెలుసు .
जाओ अपना खि लौ ना ढ ूं ढ ो .	మీ బ ొ మమ ఎ కక డు ందో కని పెటట ండి .
अरे , अंदर आओ . आओ बैठ ो .	హేయ , లోప లి కి రండి . కూ రచ ో ండి .
और जो नीचे है उसे नीचे .	ఈ స ందే శం చెప తోంది .
उसने वही कहानी बता ई है .	తను చెపపి న క థ అదే .
" उनहें सी ख ने दो . "	" వాళళ ని నే రచు కో నివ వు . "
भगवान इन चीज ों को भूल ता नहीं है .	దేవు డు అలా ంటి వి మర చి పో డు .
हमारे पास पहले से ही एक पिता है .	కానీ మాకు ఓ త ండ రి ఉననాడు .
ई श वर कान ून है .	దేవు డే అ ంతి మ చ టట ం .
शायद एक न ई दुनिया बना ने में , पु रा नी न ष ट हो जाए गी .	కొతత పరపంచ ం త యా రీ లో భా గ ంగా పా త పరపంచ ం వి ధ వం సా నికి గుర వు తు ందే మో .
और उस ी की तरह कई और भी हैं .	ఇలా ంటి వే చాలా ఉననాయి .
और तुम ?	మరి నీకు ?
तुमहारा ब हा ना काफी नहीं है .	నీ సా కు కూడా సరి పో దు .
एक आदमी और भी है . . .	ఇం కో వయకతి కూడా ఉననాడు . . .
ती स रे ने सबसे उ त त म सं गी त ब जा या .	మర ొక రే మో అదభు త మెన సంగ ీ తా నని వా యి ంచే వారు .
जब तुम आओ गे , मैं इंतजार कर ूं गा .	మీరు వచచి నపపుడు , నేను వే చి చూ సతూ ఉంటా ను .
मुझे बताओ कि तुम उसके बच चों के बारे में कया जानते हो .	అతని సం తా నం గురించి మీ కే ం తెలు సో చెపప ండి .
कोई ऐसी जिस से हम शायद हर दिन बातें करते हैं .	మనం రో జ ూ మాటలా డే వయకతి అయ యు ండ వచచు .
बा बा व ॉ स , तुम एक अचछे इंसान हो . . .	బా బా వా స , నువవు మంచి వాడి వి .
मेरी ओर मु डो !	ననను చూడు !
अ ल के नी . यह हमारा घर है . हम एक हैं और हम एक साथ लड ते हैं .	ఆ ల కె ననీ . ఇది మన ని వా సం . మన మ ంద ర మూ ఒకటి గానే ఉంటా ం , ఒకటి గానే కలిసి పో రా డ తా ం .
कोई भी दोनों नहीं हो सकता और फिर एक बार में सब नहीं .	ఒక ే సారి ఎవ వర ూ కూడా ఇ రు వి ధ ాలా ఉండ లే రు , అలా అని ఉండ కుండా కూడా ఉండ లే రు .
और रे श म घ ि स गया और फ ट गया .	పటటు కా సత పటటు తపప ి క ళ ా వి హ ీ న మెంది .
यह हमारी पसंद है .	అది మా ఎ ం పి క .
मा घ रा , उनहें तैयार करने की आ व श य क ता है .	మా గరా , వారి ని సం సిదధ ం చేయాలి .
उनहोंने उसे ज ला दिया कयोंकि उनहें डर था कि उसने सच बो ला था .	తను నిజం చెపపి ందని భయ పడి వారు త నని కాల చేశారు .
वे लड रहे हैं , वे खिला रहे हैं , वे स ह रहे हैं , और कुछ नहीं .	వాళళ ఏ డు పు లు , ప ాలు ప టట డ ాలు , వాళళ కూ తలు , అంతే .
एक दिन , कोई हमें ढ ूं ढ ले गा , उनहें ढ ूं ढ ल ेंगे .	ఏదో క రోజు , ఎవరో క రు మన ఆ చూ కీ ని కని పె డ తారు , వాళళ ని కని పె డ తారు .
तुम शायद सही हो .	నువ వ నన ది నిజం కా వచచు .
मैं तुमहारा पिता ह ूं .	నేను మీ త ండ రి ని .
मैंने खो ला , बा बा व ॉ स .	అవును , బా బా వా స .
कयोंकि उसने उस बु द धि मत ता पर सवाल उठा या जिस की वजह से	ఒక అ పరి చి తు డు , తన గ తం గురించి ఏ మా తరం నో రు వి పప ని అలా ంటి ఒక వయకతి కి
पहले से ही स ॉ टर बै कस और गे दर बै कस हमें चु डै ल कहते हैं .	ఇ పపటి కే సూ టర బా కస మరి యి గె థర బా కస మనం మా ంత రి కు ల ం అనన టటు మాటలాడు తు ంటా రు .
लग भ ग सभी मन ु ष यों में वह शक ति थी जो तुमहारे पास है .	మీకు నన శ కతి చాలా మంది మను ష ు ల కి ఉండే ది .
कया तुम उनहें ले ने आए हो ?	వీ ళళ ని తీసుకు వెళలి పో దా మని వచచా వా ?
नहीं . इसका कोई मतलब होगा .	లేదు . ఇ ందు లో ఏదో అరథం ఉ ండు ంటుంది .
ब जा य उस आदमी के जो मुझे समझ ता है .	నేను ఎ పపటి కీ కో రు కుంటా ను .
ह वा भी कुछ नहीं बता ती है .	గ ాలి ద వా రా కూడా ఏమీ తెలియ డం లేదు .
और जो कुछ तुम सुन ती हो , वह मुझे बताओ .	నువవు వి నన దంతా నాకు చెపప ాలి .
यह बच चों के लिए है . शायद यह एक खि लौ ना है .	ఇది పిలల ల కి . ఓ బ ొ మమ అయ యు ంటుంది .
तुम कहा ं थे ?	ఎ కకడికి వెళళ ా వు ?
लेकिन तुमहें नहीं पता , है न ?	కానీ నీకు తెలీదు కదా ?
एक पु न : स था पि त दुनिया पर च म डे की लगा म और ज ं जी र ें लगा ए गी .	తో లు తా ళళ తో , గొ లు సు లతో క టటి పడ ే సే శ కతి అది .
पर का श की वा प सी और वि ना श को ग ति देना है .	కా ంతి ని మరియు వి నా శ నా నని తవర గా సవా గ తి ంచ డ మే అవు తుంది .
कया करना चाहिए ?	మన మి పపుడు ఏం చేయాలి ?
कया तुम ठीक हो ?	నువవు బాగానే ఉననా వా ?
जे र ला म रे ल ? जे र ला म रे ल ने इन बच चों की पर व रिश नहीं की .	జె ర లా మ రె ల ? పిలల లని జె ర లా మ రె ల పె ంచ లేదు .
पर शायद बचचे हमेशा के लिए य हां नहीं र हें गे .	బహుశా నీ పిలల లు చి ర కాల ం ఉండ రే మో .
किसी दिन , हम एक साथ होंगे .	ఏదో క రోజు , మనం తపప క కలిసి జీవి సతా ము .
कयोंकि जे र ला म रे ल . . . हुआ .	ఎందుకంటే జె ర లా మ రె ల ని . . . కలి శా ను .
तुमहें बाहर जाकर खेल ने की जरूरत है .	మీరు బయటకు వెళలి ఆ డు కో ండి .
इ ध र आओ , मेरे पया रो . आओ .	దగగర కు రండి , బు జ జి పా ప లు . రండి .
यह अब तक का सबसे बडा जन म दिन का उप हार है .	దీ నికి మి ంచిన పు టటి న రోజు కా నుక మీ కి ంక ఎ పపటి కీ ల భి ంచ దు .
हां , तुम करती हो .	అవును , నీకు తెలు సతోంది .
मैंने उनहें जाने की बात करते सुना .	వాళళు వెళలి పో వడం గురించి మాటలాడు తు ంటే వి ననాను .
और जे र ला म रे ल के उप हार हमेशा अचछे होते हैं .	జె ర లా మ రె ల కా ను కల ననీ మంచి వి మరి .
जब तुमहें लगे कि तुम अपने गा ं व को छोड ने के लिए काफी म जब ूत हो .	ఎ కకడి కె ళళ ాల నే సూ చ న లని కూడా నేను పొ ందు పరి చా ను .
अ यू रा स भी उसे नहीं सुन सकते .	క నీ సం అ యూ రాల కి కూడా తన చ పపుడు విన బడ దు .
हम चु ने गए हैं	మనం ఎ నను కో బడి న వార ము
हम चु ने गए हैं	మనం ఎ నను కో బడి న వార ము
वह यहाँ है .	తను ఇకకడ ే ఉంది .
मैं अपने बच चों के साथ रहना चाहती ह ूं .	నాకు నా పిలల లతో ఉండ ాలను ంది .
मुझे पता है , जो तुमहें बहुत पयार करता है , को फु न .	తెలుసు , అతనికి మీ ర ంటే పరా ణం , కొ ఫ ూ న .
छा या , मुझे तुमहारी जरूरत है , गा ं व में किसी पर नजर रख ने में ,	ఛ ా యా , నువవు గరా మ ంలో ఒక రి ని ఛ ా య లా వె ం బడి ంచి ,
कया है . . . यह कया है ?	ఇది . . . ఏంటి ది ?
और फिर चु डै ल ढूँढ ने वाले लोग उनसे पूछ सकते हैं . . .	ఆ తరవాత మా ంత రి కా ంత కు లే అడుగు తారు . . .
किस ने गलत गा ँ ठ बा ँ धी ?	ఈ త పపుడు ము డు లు వే సింది ఎవరు ?
मैं अभी बाहर आता हूँ .	నేను తవర గానే బయటకు వచ చేసతాను .
मौ न होना झूठ नहीं है .	నో రు వి పప కపో వడం అబ దధ ం కా బో దు .
मौ न होना झूठ नहीं है .	నో రు వి పప కపో వడం అబ దధ ం కా బో దు .
तो उनहें एक नया य परि य वय क ति मिले गा .	వాళళ ముందు ఓ చ కక టి మనిషి , కేవలం ఓ మని ష ే ఉంటా డు .
जे र ला म रे ल , मेरा सच चा पयार .	జె ర లా మ రె ల , నా ఏ కె క నిజ మెన పరే మి కు డా .
" एक बार की बात है ,	" ఒ కా న ొక పపుడు ,
और च ौ थे ने रे श म की डो र से चा दर और पो शा क बना ई	ఇక నాలు గ వ వా రే మో , వె చచ టి మ ంచు లా అనిపి ంచే ను నన టి దు పప ట లను మరియు
उस इ तर ने अपनी खुश बू खो दी . . .	దాని తో అత తరు దాని సు గం ధా నని కో ల పోయింది . . .
सब कैसा चल रहा है ?	నీ క ంతా బాగానే జరుగు తో ందా ?
उनके कल के जन म दिन के लिए .	ఓ కా ను కని తె చచా ను .
और मुझे कहीं और काम करना है .	అంతే కా క నాకు వే రే చో ట ప ను లు కూడా ఉననాయి .
लेकिन मैं चु डै ल की खबर भेज ने वाला ह ूं .	కానీ మ ంత రగ త తె కి సంబం ధి ంచిన సమా చా రా నని నేను పం పి సతాను .
ये बचचे एक उप हार हैं .	ఈ పిలల లు ఓ వ రం .
कयों ?	ఎందుకు ?
कि से ?	ఎవ రికి ?
और उनकी दुनिया में कोई " बद सू रत " नहीं था और कोई " सु ंदर " नहीं था .	వారి పరపంచ ంలో " కు రూ పి " కానీ " అంద ం " కానీ లేదు .
सं गी त ने स वर का मे ल खो दिया ,	సంగ ీ తం శ ృ తి తపప ి ంది ,
कयों ?	ఎందుకు ?
तुमहारे अस ली पिता से .	మీ అస లెన త ండ రి .
हाँ . सब ठीक है .	అవును . బాగానే ఉననాను .
जे र ला म रे ल ने कहा कि हमें 1 2 साल का इंतजार करना चाहिए	వీ టి ని ప నన ె ండ ే ళళు ఆ గి పిలల ల కి ఇవ వాలని
कयोंकि उनहोंने त य किया कि वे चार ही काफी थे .	ఎందుకంటే కేవలం నలు గు రు ఉంటే చ ాలని వాళళు నిరణ యి ంచు కుననా రు కను క .
ऐसी म शी न ें जो ह जार ों मी ल तक बात कर सकती थीं .	వే ల మె ళళ దూ రా న ఉ ండి కూడా మాటలాడ గ లి గే య ంత ర ాలని కూడా నిర మి ంచారు .
जब वे जाए ं गे , कि ता ब ें उनहें ज ञ ा न द ें गी .	వాళళు వెళలి పోయి నపపుడు , ఆ పు సత కాల ే వాళళ కి జ ఞ ా నా నని సతా యి .
वे आ शा हैं , बा बा .	వాళళు మన ఆ శా కి రణ ం , బా బా .
अंदर कया है ?	ఆ పెటట ె లో ఏ ము ంది ?
लेकिन फिर एक दिन ,	కానీ ఒక రోజు ,
और वह उसके साथ रहा .	ఆ తరవాత తన తో నే అతను ఉననాడు .
कोई भी और सभी मेरे पास आ सकते हैं और उनके मन की बात कह सकते हैं ,	ఎవ వర ెనా నా వ దద కి వచచి ఉనన నిజ ా నని ప ంచుకో వచచు ,
और तुमने इसे बहुत अचछी तरह से र खा है .	చాలా బాగా కా పా డు తూ వచచా రు .
अपना हाथ देना ?	నాకు నీ చేయి ఇ సతా వా ?
यह कया है ?	ఏంటి ది ?
वह विश वास कर सकता है , लेकिन यह सच नहीं हो जाता है .	అతను నమ మి న ంత మా త రా న అది నిజ మె పో దు .
मेरे दोसत .	నే సత మా .
मेरी बात सुनो !	నేను చెపపే ది విన ండి !
और कोई ?	ఇంకా ఎవరు ?
तुम आज बा रह साल के हो गए हो .	నే టి తో మీకు ప నన ె ండు సం వ త సర ాలు పూర తయ యా యి .
यह कया है ?	ఏంటి వి ?
मैंने उनहें देश द रो ह और जा ल सा जी का दो ष ी पा या .	దే శ ద రో హం మరియు మో సం చేసిన విషయం లో వీ రి ని దో ష ు లు గా తే లు సతుననాను .
बा रह साल तक तुमने एक रह स य र खा .	ప న నే ండ ే ళళు గా మీ రో ర హ స యానని కా పా డు తూ వచచా రు .
सुन कर बुरा लगा .	అది వి ని చి ంతి సతుననాను .
तुमने बॉ कस खो ला .	నువవు పెటట ె ని తె రి చా వు .
हमारे बीच कोई वि वाद नहीं होना चाहिए .	మన మధయ ఏ గొ డ వల ూ ఉండ కూడదు .
शायद हम चु डै ल हैं .	బహుశా మనం మా ంత రి కు ల మే ఏ మో .
हमारे य हां मु सी ब त ें आ गई हैं .	మన కి కకడ సమసయ లు ననా యి .
मैं दे व ता ओं का तया ग कर दू ं गी .	దేవు ళళ ని వదిలే సతాను .
- बस ! - नहीं , बस नहीं !	- ఇక చ ాలు ! - లేదు , ఇది సరి పో దు !
जब तक आप सम र प ण नहीं करेंगे वह जवाब नहीं दे गी .	మనం ల ొ ం గి తే కానీ తను సప ంది ంచ దు .
लेकिन , अगर मुझे ह वा में फु स फु साह ट सुना ई दे ती है ,	కానీ , నాకు గ ాల లో గు స గు స లు విన బడి ,
बेशक , जैसा तुम चा हो वै सा करने के लिए तुम स व त ं तर हो .	నీకు ఏం కావాల ంటే అది చేయ వచచు అనుకో .
लो , सं देश लो और इसे पढ ो .	ఇది గో , ఈ స ందే శా నని తీసు కొ ని , చ దు వు .
मैंने सिरफ ना ट क किया कि मुझे पता नहीं था .	నేను నాకు తెలీ న టటు న టి ంచా ను .
और य दि आप मर चु के हैं , आपकी आ ं ख ें हमेशा के लिए बंद हो जाती हैं .	చచ చా క , క ళళ నే వి ఎలా గ ూ ఎ పపటి కీ మూ త బ డే ఉంటా యి .
तुम उससे न फ रत करती हो .	నీ క తన ంటే అస హ యం .
अन य जो चाहते हैं कि आप समझ ें , म हा रा नी .	జరుగు తునన వా సత వా నని మీకు వయ క త పర చ ాలను కొ నే వాళళు , మ హా రా ణి .
तुम ब हा दु र हो . जाओ .	నువవు ధ ె రయ వం తు ర ాలి వి . వెళళ ు .
और तब तक , वे अपनी आ ं ख ें बंद करके जी ए ं गे .	అ పపటి దా కా , వాళళు క ళళు మూ సు కొ ని వాళళ జీవి తా నని కొ న సా గి సతారు .
उप - शी र ष क अनु वाद क : ज शन	ఉ ప శ ీ ర షి క లను అ నువ ది ంచిన ది : అ లే ఖ య
इं जन ट ू ट रहे हैं , पा नी बढ रहा है .	ఇం జ నలు వి రిగి పో తుననా యి , నీ టి సథా యి పె రిగి పో తోంది .
उनकी शक ति ऐसी थी , वे प ृ थ वी से अधि क बढ गए और उसे न ष ट करना शुरू कर दिया .	వాళళ శ కతి సథా యి కి భ ూ మి త టటు కో లేక నా శ న మె పోయింది .
हां .	అవును .
कया हुआ ?	ఏం జరిగింది ?
सिरफ सच क हो .	కేవలం నిజ మే చెపపు .
हां .	అవును .
वह नहीं . . .	తను దే వ త కాదు . . .
एक लड का आया जिस ने कहा वह उनका खो या हुआ भाई था .	ఒక పి లలా డు వచచి ఎపపుడ ో తపప ి పోయి న వాళళ పెదద అనన యయ ని అని వాళళ తో అననా డు .
अगर उस बॉ कस की वजह से वे दूर चले गए ,	ఒక వే ళ ఆ పెటట ె లో ని ఏ వ సతు వె నా వారి ర హ స యానని బయట పె టటి నా ,
अरे .	బా బో య .
एक अ जन बी , जो अपने अ ती त की बात नहीं करता , उसे गा ं व का पर भा री बना दिया गया था ?	గరా మ పెదద బాధ యత లు ఎలా అ పప గి సతా ర ంట ూ పర శ ని ంచిన ందు కా ?
जब से वह बात हुई , तुमने इसके बारे में बात नहीं की .	న ది మ ంచు గ డ డ నుండి నీ టి గా క రిగి న పపటి నుండి నువవు దాని గురించి మాటలాడ నే లేదు .
सारे जवाब बॉ कस में हैं .	దానికి సమా ధా న ల ననీ ఆ పెటట ె లో ఉననాయి .
मेरे खिला फ बोल ना . . .	నాకు వయ తి రే కంగా మాటలాడ ట మ ంటే . . .
मैंने केवल कहा निया ँ सु नी हैं .	నేను వి నన వ ననీ క థ లే .
और अब यह नि श चि त है .	కానీ ఇపపుడు అది ఖ రా రె పోయింది .
दी वार से दूर रहो !	గో డ మీద ను నన రా ళళ ను వ దల ండి !
वह य हां आए गी .	ఆమె ఇకకడికి వ సతుంది .
वे तुमहारे साथ सुरकष ित हैं .	వారు పె రి గే కొ దద ీ నీ తో ఉండ ట మే వా రికి కష ే మ ం .
बा रह साल , मा घ रा .	ప నన ె ండు సం వ త సర ాలు , మా గరా .
' हां " के लिए दो , " नहीं " के लिए एक ? है ना ?	" స మమ తం " అయితే రెండు సా రలు . " స మమ తం " కా కు ంటే ఒక సారి అను . స మమ త మే నా ?
कया मेरा ध ये य स मा पत हो गया है ?	నా కార యం ము గి సిన దా ?
छा या , वह वय क ति पै रिस है .	ఛ ా యా , నువవు వె ం బడి ంచ వల సింది ప యా రి స ని .
शायद .	ప టట వచచు .
बिना अन ुम ति के .	అను మ తి లే కుండా తె రి చా వు .
हमारे बचचे दे व ता होंगे .	ఎందుకంటే మన పిలల లే దేవు ళళ వు తారు కను క .
