मैं एक दम बेवकूफ हूँ . उस बद बू दार डॉ क टर पर भरो सा नहीं करना चाहिए था .	నేను బాగా వె ర రి వాడిని . అలా ంటి వా స న గల డా క టర ను అసలు నమమ కుండా ఉండ ాల సింది .
हमने तुमहें घर में आने दिया ,	నినను మా ఇంటికి రా ని చచా ము ,
हैलो , वॉल ट 3 3 .	హలో , వాల ట 3 3 .
डै ड को ढूँढ ो .	నా ననను వె తు కు .
र च ना त म क पर य वे कष क अ शो क ब कष ी	కరి యే టి వ సూ పర వె జర శి రీ ష దర భా
आप मुझे य ूँ ही छोड रहे हैं ?	మీరు ననను వెళళ ని సతుననా రా ?
मुझे तुमहें कुछ बता ना है .	నీకు ఓ విషయం చెపప ాల సి ఉంది .
शायद तुम भी भ ूत बन गए हो .	నువవు జీ వ పి శా చి వి అనుకుంటా .
उनकी ऐसी खू बी को भी जि से आप नहीं जानते .	ఆమె లో ఒక వెపు గురించి మీకు తెలియ దే మో .
बहुत जगह है .	బో లె డ ంత చో టు .
एक रे डियो टा वर खो जना है .	నేను ఓ రే డి యో ట వర వె త క ాలి .
इं सा नी सिर लिए घ ू म ते लोगों से मु ला का त कम ही होती है .	మనిషి తల తో పాటు పర యా ణి ంచే వారి ని ఎకకువ గా కల వ లేదు .
हम से कहा गया था कि पर मा ण ु ब म से यु द ध खतम हो जाएँगे .	ఆ టం బా ం బు అంటే యు దధ ానికి అంత ం అని మనకు చెపపా రు .
तुमहें उसकी फि कर करने की जरूरत नहीं , समझ े दोसत ?	దాని పె ఇక నీకు చి ంతి ంచే అవసరం లేదు , బా బ ూ , ఉ ంద ంటా వా ?
एक दम नए भ कत और उनके बेवकू फा ना वि चार	వె ర రి ఉ పా య ాల తో సరి కొతత వి శ వా స కు ల జ టటు ,
अचछा ? तो शो बि ज का एक राज बता ता हूँ .	అవునా ? మీకు ఓ చినన ష ో బి జ ర హ స యం చెబు తా .
कुछ लोग सं गी त को समझ ते ही नहीं हैं .	కొ ంద రు జ నాలు , సంగ ీ తం ప టల అవ గా హ న ఉండ దు .
- मैं नहीं जा रही . - मुझ पर भरो सा करो .	- నేను వెళ లను . వెళ లను . - ననను నమ ము .
वहाँ कोई पर यो ग नहीं है .	అంటే , అకకడ ఏ పర యో గం లేదు .
उस शा ं ति के लिए आप खत रा नहीं बन ें .	ఆ శా ంతి కి మీరు వి ఘ ా తం కలి గి సతే మి న హా .
बस हमें परे शान मत करो , मैं जो चा हो बता द ूँगा .	నువవు మమ మ లని శా ంతి తో వదిలే సతే ఏదెనా సరే చెబు తాను .
पर ऐसा नहीं हुआ , है न ?	అది పని చేయ లేదు , అయి ందా ?
समझ रहे हो ?	ఒకటి తెలుసా ?
सुरकष ा सभी का अधि कार है .	మీకు భ దర త కు అర హ త ఉంది .
लॉ य ड और कैसा ंड रा दोनों वै ज ञ ा निक हैं ,	లా యి డ , క సా ండ రా ఇదద రూ శా స తర వే తత లు ,
ओ वर सि यर 3 3 :	పర య వే కష క 3 3 :
सभी का कोई परा यो ज क है पैसे क मा ने में मुझे शर म नहीं है .	అంద రికీ స పా న సర ఉంటా రు , నా జీ వ నో పా ధి విషయం లో నేను సి గ గు పడ ను .
मेरी रि सर च कं प नी को उनकी कं प नी ने ख री दा था .	నా పరి శ ో ధ నా సం సథ ను ఆమె వి భా గం కొ ను గో లు చేసి ంది .
वॉल ट 3 2 की काम चला ऊ ओ वर सि यर हों गी	వాల ట 3 2 కు తా త క ాలి క పర య వే కష కు ర ాలి గా ,
मेरे पति की हतया हुई .	కొతత జీవితం ఆ రం భి సతారు .
यह खा ने की चीज नहीं है .	నువవు దీని ని తి న లేవు .
और वाह वा ही ब टो र नी है .	నాకు కీ ర తి సం పా ది ంచాలి .
थे डि य स , वह सिर मुझे दो .	థా డి య స , తల నాకు ఇవ వు .
अब हम उन सब को अ ल वि दा कहते हैं जो हमें छोड कर वॉल ट 3 2 जा रहे हैं .	ఇక ఇపపుడు , వాల ట 3 2 కోసం మన లని వది లి వెళ లే అంద రికీ వీ డ కో లు చెబు తుననాం .
या तुमहारे सच में तीन बे टे हैं ?	లేదా నీకు ము గ గు రు పిలల లని వి ననా నా ?
मुझे कुछ बडा करना है , मौ का है . . .	భా రీ గా ఎ దగ ాలి , మనకు అవకా శం . . .
और वह ते जी से करी ब आ रही है , है न ?	అది తవర గా వచచే సతోంది , కా ద ంటా రా ?
यह एक ऐसी गा ली है जो ऐसे लोगों को दी जाती है जो पागल नहीं हैं .	పిచచి వాళ లను కా ని మను ష ు లను వి వరి ంచే ందుకు అది వాళలు వా డే ఓ ము రికి పద ం .
घर जाओ . तुमहारे लिए वही चाहता हूँ .	ఇంటికి వెళ లు . నీ కో సమ దే కావాలి .
पर मेरी समस या यह है कि	కానీ నా సమసయ ఏంట ంటే ,
ह ॉ ली व ु ड फ ॉर ए वर चर च स भा जा री है	హ ాల ీ వు డ శా శ వ తం - ఛ ా పె ల సె షన లో సే వ
वा य लि न सं गी त के मेरे छो टे , पर ता कत वर स ंग रह के साथ .	శ కతి వ ంత మెన ఫి డి ల ట యూ న ల సే క రణ లో వి లా స వ ంత ంగా గ డి పి నపపుడు .
हैलो , न ॉर म .	హాయ , నా ర మ .
जरा पे ची दा माम ला है .	అది ఓ సం కలి షట మెన సం సథ .
मैं आ ऊ ं गा .	కని పె డ తాను .
मुझे नहीं पता था कि अ मे रि का का च हे ता बंद ूक धा री इतना सं वे द न शी ल है .	అ మె రి కా మె చచి న తు పా కీ వీ రు డు అంత సు నని త మని నేను గర హి ంచ లేదు .
बि ज ली कहाँ से आती है ?	మీకు క రె ంట ఎ కకడి ది ?
सा ँ स तो आ रही है न ?	ఇకకడ గ ాలి ఆ డు తోంది గా ?
यह . . . ऐसा नहीं . . . ऐसी बात नहीं है .	ఇది . . . అలా కాదు . . . ఇదే మీ లేదు లే , నిజం .
जिन पर पर ीक ष ण किया वे उममीद के मु ता बि क नहीं थे .	మా పర ీ కష ా అ ం శ ాలు మా అ ంచ నా కంటే త కకువ సథా యి లో ఉననాయి .
सट े फ और मुझे नया घर मिला है .	సట ె ఫ , నేను కొతత ఇ లలు ఆ రం భి సతా ం .
माफ करना .	మన ని ంచాలి .
हे भगवान .	అబబా ఛ . ఛ .
वि दा करते हैं ! वॉल ट 3 2 जा इए	మీకు వీ డ కో లు ! 3 2 కి మా రు తుననారు
शायद नहीं . ठीक है .	అలా కా ద ను కుంటా . సరే .
मैं म रा कयों नहीं ?	నే నె ందుకు చని పో లేదు ?
तुमहारा इंतजार कर ूँगी . ठीक है ?	నీ కోసం వే చి ఉంటా ను . సరేనా ?
शुरू करो .	అది న ొ కకు .
तु र ंत 3 1 में लौ टो .	వెంట నే 3 1 కి వచచే సె య .
ठीक है . माफ करें . यह गलती थी . हम जा रहे हैं .	సరే . మన ని ంచండి . ఇది పొ ర పాటు . మేము ఇక బయ లు దే రు తా ం .
उन पर पर यो ग कर रहे हो . बु री बात है !	వాళల పె పర యో గ ాలు చేసతుననా రు . మీకు పిచచి !
और बकवास मुझसे स ह न नहीं होगी .	ఇంత కంటే సో ది ని భ రి ంచ లే నని .
चाह े तुमहारे पिता नहीं मिल ें ?	తిరిగి ఇవ వాలని అనుకుంటా వా ?
मैं अचछा इंसान हूँ व ग ै रह . . .	నేను మంచి వాడి నని అన డం . . .
यह तो . . . मुझे इसे . . . यह एक नि शा नी भर है . कुछ नहीं . . .	ఇది ఎకకువ . . . నేను . . . ఇది ఓ జ ఞ ా పి క . అలా కాదు . . .
फ ॉल आ उ ट पर पिछ ली बार	ఫ ాల ౌ ట ఇంత కు ముందు
और ऐसी रा जन ै ति क वि चार धा रा बे च कर भी	సరే , సర ఫ రాల తో ము గి సే రా జ కీ య భా వ జ ాలా నని
तुमहारे पिछ वा डे से छो टी आँ त बाहर निकाल सकती है .	అది సరి గగా మీ ది గు వ పరే గు జా రి పో తునన శ బ ద ం .
ठीक है , फिर से सोच ते हैं .	అది తిరిగి మూ ల యా ంక నం చేయాలి .
इसकी धा र ते ज कर दो , पलीज .	దయచేసి దానిని ప దు ను పెటట ాలి .
ओ य , पै र है मेरा . खाना नहीं , समझ े ?	ఏ య , అది నాకు . అది ఆ హా రం . కాదు , సరేనా ?
यह बडी कमी नी चीज है . यह भी चाहिए ?	ఈ ది కకు మ ాలి న చెతత ది . నీ కూ ఇది కా వ ాలా ?
वे इसे खो जना कभी बंद नहीं करेंगे .	వాళలు ఆర టి ఫా క ట ను వె త క డం ఏ నా టి కీ ఆ ప రు .
मुझे मार ना मत . मैं डॉ क टर हूँ . मदद कर सकता हूँ .	ననను చం ప క ండి . నే నా డా క టర ని . సాయం చేయ గలను .
धनयवाद , डा र लि ंग .	ధనయవాదాలు , బంగా రం .
मैं . . .	నేను . . .
ठीक है , देख ते हैं .	సరే , సరే , ఇది గో .
माफ करना .	మన ని ంచు .
आप से एक बात पूछ ूँ ?	ఓ విషయం అడ గ వచచా ?
शुरू करने से पहले , मेरी फी स की बात करें .	మనం ఆ రం భి ంచే ముందు , నా ఫీ జు విషయం లో చినన మాట .
तुमहें पता है रे डियो टा वर कहाँ होगा ?	రే డి యో ట వర ఎ కక డు ందో నీకు తెలుసా ?
बेटी , गर म को को बना या है .	నీ వే డి కో కో తీసుకో , బు జ జీ .
- यह . - वह . हाँ . ठीक है .	- ఇది గో . - అది . సరే . అవును .
बर दर हु ड .	సో దర జా తి .
- करा ं ति के लिए शु भ काम ना एँ . - रख ली जिए .	- వి ప లవ ంలో మీకు మంచి జరగ ాలి . - లేదు , ఉ ంచండి .
इसी लिए मैंने सर वो च च परि ष द से बात की है .	అందుకే నేను హె క ౌ న సి లతో సం పర ది ంపు లను చేశా ను .
मुझे पता है कि मुझे इस हा लत में	నేను స హాయ ాలు అడి గే పరిసథి తి లో లే నని
मुझे यही कहना है कि वै ज ञ ा निक जिस स मा ज को चला एँ	ప ాలి ంచ బ డే సమా జ ం , నిజంగా ఆ దర శ వ ంత మెన సా మా జి క నిర మా ణ మని
मैंने ऐसा पहले देखा है .	ఇలా ంటి సథి తి గ తం లో చూశా ను .
और , जा ह िर है कि हर वॉल ट को ओ वर सि यर की जरूरत होती है ,	ఇంకా , క చచితంగా , పరతి వాల ట కు పర య వే కష కులు అవసరం ,
और इस तरह अब हमारे दोसत हमारे पड ो सी बन गए हैं .	ఇక దాని తో , ఇపపుడు మన సనే హి తులు పొ రుగు వారి గా అవు తారు .
मुझे उसे वापस पा ने में आपकी मदद चाहिए .	దానని తిరిగి పొ ంద డం లో నాకు మీ సహా యం కావాలి .
मैं किसी ज मा ने की खू बस ू रत ह ॉ ली व ु ड हि ल स के नीचे हूँ .	ఒక పపటి అంద మెన చో టు హ ాల ీ వు డ హి లస కే ంద రం నుండి .
आज कल यह जयादा दिख ती नहीं है , है न ?	అవి అంత ఎకకువ గా క న బడ వు , అవునా ?
कया सोच रहे हो ?	ఏం ఆలోచి సతుననా వు ?
सब को यह सं गी त सच में पसंद नहीं है ?	ఈ సంగ ీ త పు శ బ ద ం న చచ ద నా , నిజంగా ?
मुझे बस जानकारी चाहिए .	సమా చా రం వె తు కు తుననా అంతే .
ठ ं डा फ यू जन , अन ंत ऊ र जा .	కో ల డ ఫ యూ జ న , అన ంత మెన శ కతి .
बै क अप पा वर शुरू किया गया .	బ యా క ప ప వర పరా రం భ మెంది .
तुमसे और हम सबसे बहुत बडा है .	అది నీ కంటే పెదద ది , మన అంద రి కంటే .
वैसे , मैं तो फि ल मी ही रो हूँ , पर आप असल जिंदगी के ही रो हैं .	సరే , నేను సి ని మ ాల లో హ ీ రో గా చేయ వచచు , కానీ నిజ జీవితం లో మీ రే హ ీ రో లు .
वही ल डा ई जो आपने भी ल डी .	మీరు చేసిన అదే యు దధ ం .
कया है ?	ఏమి టి ది ?
कुछ नहीं होगा .	నువవు బాగు ంటా వు .
- हाँ . - नहीं .	- అవును . - లేదు .
पर अगर सी प ियाँ पसंद आई हों , तो ट ू ना भी पसंद आए गी .	కానీ నీకు ఆ య సట రలు న చచి తే , డబ బా ట యూ నా కూడా తపప క న చచు తు ది .
पर तुमहारी जान बचा ने के लिए . . .	కానీ నువవు బ తి కు ండ ాల ంటే . . .
अं तर - वॉल ट मै से ज 3 3 3 1	ఇంట ర వాల ట స ందే శ ాలు 3 3 3 1
दुनिया का अ ंत बे च कर बहुत पैसे क मा ए जा सकते हैं .	పరపంచ ం అంతా నని అమమ డం లో చాలా డబబు ఉంటుంది .
लोगों से चो री करके भी यो द धा नहीं बन सकते .	సరే , జ నా ల నుంచి దొ ం గి లి ంచి నా సె ని కు డి వి కాల ే వు .
आपको वि दा करते हैं ! आप वॉल ट 3 2 में र हें गे	మీకు వీ డ కో లు ప లు కు తుననాం ! మీరు 3 2 కి మా రు తుననారు
आपको वि दा करते हैं ! आप वॉल ट 3 2 में र हें गे	మీకు వీ డ కో లు ప లు కు తుననాం ! మీరు 3 2 కి మా రు తుననారు
माफ करना , मैंने आपको नहीं सुना .	మన ని ంచాలి , నా క ది విన బడ లేదు .
शा ं ति का यह म ं दि र हमें कि सम त से मिला है ,	శా ంతి , స హ నా లతో ని ండి న ఈ పు ణ య కష ే త రా నని కను గొ న డం
मैंने उसे मर ते देखा .	తను చని పో వ డా నని చూశా ను .
तुम मेरे लिए ऐसा करो गे ?	నా కోసం అలా చేసతా వా ?
जिन सै नि कों से हम वि देश ों में लड रहे थे , उनके परिवार ,	వి దే శ ాల లో పో రా డి న ఈ సె ని కులు , వాళల కుటుం బ ాల తో ,
अचछा वि ले न कभी खुद को वि ले न नहीं समझ ता .	ఓ మంచి దు ర మార గు డు తన ను తాను చె డ డ వాడి గా చూడ డు .
पर यह हमें याद दि ला ता है कि इस जगह के कया मा य ने हैं .	కానీ ఈ సథ ల ం దే నికి సంబం ధి ంచిన దో ఇది ఉద వే గ ంగా గురతు చే సతుంది .
तो तुम वह सब भूल जाओ गे जो हमने देखा था ?	అయితే , మనం చూ సిన అనని టి నీ నువ వ లా మరి చి పో తా వా ?
ये पि ं ज रे सही लगा ए हैं आपने . बहुत अचछे .	సరే కానీ , ఈ ఉ చచు లు బాగా చేశారు . చాలా బాగుంది .
याद रख ें , आप जहाँ भी पहुँच ें , वही आपका घर है .	గురతు ంచుకో ండి , మీరు ఎ కకడికి చే రి తే , అదే మీ చో టు అని .
जब तक मैंने तुमहारे भाई से यह खत लिया	నీ సోద రు డి ఈ లే ఖ నాకు అంద ే స రికి ,
{ \ an8 } धनयवाद , कै थी .	{ \ an8 } ధనయవాదాలు , కే థ ీ .
- मुझे दो . - यह लो .	- ఇవవ మ ంటుననా ను . - సరే .
मैं वहाँ रह ता हूँ . . .	నే న కకడ బ త క గలను . . .
अजीब है न कि हमेशा वॉल ट 3 1 से ही ओ वर सि यर चु न ते हैं ?	వాల ట 3 1 ను ంచే పర య వే కష కు ని ఎ ం పి క వి ంత గా లేదా ?
अपनी बी वी की जा सू सी कर ूँ ?	నా భా రయ మీద ననను ని ఘ ా వే య మ నా ?
और अगर आपको यह पसंद न आए ,	ఇక మీరు వి నన ది మీకు న చచ కపోతే ,
जि से चा हो का ट लो , जहाँ चा हो चले जाओ .	ఏం తి ంటా వో తి ను , ఎ టు పో తా వో పో ,
सुनो , ह ॉ ली व ु ड में कट टर वाद फै ल रहा है .	చెబు తుననా , హ ాల ీ వు డ లో రా డి కలి జ ం వయా పి సతోంది .
बस इसलिए कि यह उनके बि ज ने स म ॉ ड ल में फि ट नहीं होता .	ఎందుకంటే అది వాళల వయా పార న మూ నాకు సరి పో లేదు .
रुको , तुमने सोचा . . .	ఆగు , నీ ఆలోచ న . . .
वह वे ध शा ला में है .	ఆమె అబ జర వే ట రీ లో ఉంది .
शायद आज नहीं , पर कभी तो करे गा .	బహుశా ఇ వాళ కాదు , కానీ ఏదో ఒక రోజు న .
मतलब , मेरा वॉल ट ऐसा नहीं है .	అంటే , మా వాల ట ఇలా ఉండ దు .
तो तुमहारा कोई दोसत नहीं होता , समझ े ?	నీకు మి తరు లు ఉండే వారు కాదు , అది గర హి ంచా వా ?
बढिया .	మంచిది .
हम सभी यहाँ बच कर आए हैं ,	ఇకకడ మన మ ంతా బ తి కి ఉండ గ లి గా ం ,
पर इसका न ती जा . न ती जा होगा . . .	కానీ ఫ లి త ాలు , అవును . ఆ ఫ లి త ాలు . . .
अचछा , तो हम चल ते हैं .	వెళల ొ సతాను , చ క చ కా .
उसके बाद , तुम अके ली हो , ग ू सी .	ఆ తరువాత , ఇక నీ కష ట ాలు నీ వే , గ ూ సీ .
- कया वह . . . - फ यू जन को र है .	- అది . . . అది ఓ . . . - ఫ యూ జ న కోర .
{ \ an8 } बे ट टी पि यर सन 3 1 से 3 3	{ \ an8 } బె టట ీ 3 1 నుండి 3 3
कै लि फो र निया में ऐसा कया है कि सभी यहाँ आए हैं ?	మనం అంతా వచచి న ఈ చో టు అయి న ఈ క ాలి ఫో రని యా గురించి ఏంటి ?
मेरी शादी दूसरे वॉल ट के अ जन बी से होने वाली थी .	నాకు మ రో వాల ట నుంచి ఓ అ పరి చి తు డి తో పె ళ లి జరగ ాల సి ఉంది .
हम में से कुछ वॉल ट 3 2 में जाकर न ई शु रु आत करेंगे .	మన లో కొ ంద రు వాల ట 3 2 కు మా రి ఇకకడ ే ఉంటా రు ,
मतलब तुम टॉ मी हो .	నువవు టా మీ ని అడ గ ాలి .
