तुम उसे व ृ द धा शर म भेज सकते हो , पर उममीद है नहीं भे जो गे .	నువవు అత నని ఆ శ ర మా నికి పం ప వచచు కానీ అలా చేయ వని ఆ శి సతుననాను .
- तुम दोनों को मेरे साथ चल ना चाहिए . - मैं कभी नहीं गया .	- మీ రి దద రూ నాతో పాటు రండి . - నేను ఎపపుడూ ప ఠ నా నికి వెళల లేదు .
तुमने कहा था ?	అది నీ ఆలోచ నా ?
- मैंने पहले कभी म ॉ ड लि ंग नहीं की . - बहुत आ सान होता है .	- నేను ఇంత కు ముందు మో డ ల గా చేయ లేదు . - అదే ం పెదద విషయం కాదు .
ना इ जेल का नंबर का उ ं टर पर है .	నె జె ల నం బర క ౌ ంట ర మీద ఉంది .
जयादा ग ं भी र नहीं था . पर हम बात करने लगे , और उसने नि जी ट ूर के लिए कहा .	తీ వర మెన ది కాదు . కానీ మాట లలో , త నే స వయ ంగా నాకు చూపి సతా నని చెపపా డు .
अगर यह आपकी अ भ ि ला ष ा है , तो मैं आपको आपके साथ ि यों से जयादा श रे य द ूँगा .	అదే మీ కా ం కష అయితే , మీ తో టి ఉద యో గు ల కంటే మీ రే ఎకకువ ని భా వి సతాను .
यह तुमसे तै र ना सी ख ना चाहती है , पर पूछ ने से शर मा रही है .	టా మ , ఆమె నినను నే ర పి ంచ మని అడ గ డానికి సి గ గు పడు తోంది .
- ठीक से बोल ना भी नहीं पा ता . - मुझे पकका नहीं था तुम . . .	- ఎలా అడ గ ాలో నాకు తెలియదు . - నేను అసలు అనుకో లేదు . . .
भगवान के लिए , मैं इससे अधि क नहीं स ह सकता .	దేవుడా , నేను భ రి ంచ డానికి ఒక హ దదు ఉంది .
- तुमहें मजा नहीं आए गा ? - मैं शादी शु दा हूँ .	- అది నువవు ఆన ంది ంచ వా ? - నాకు పె ళల యి ంది .
तुमहें ऐसी बातें सोच समझ कर कह नी चाहिए .	నువవు ఇలా ంటి వి అనే ట పపుడు జా గర తత గా ఉండాలి .
- हम सब के नाम . - हम सब के नाम .	- మన అంద రికీ . - మన అంద రికీ .
वह कब से यहाँ पर है , तुम एक बार भी उससे नहीं मिले .	అతను ఇకకడ ఉనన ననా ళలు , నువవు ఒకక సారి కూడా అత నని కల వ లేదు .
फिर मैं यहाँ से चला जा ऊँगा .	తరవాత మీకు ఇ బబంది పెటట ను .
इसकी कोई बात नहीं करेंगे .	దీని గురించి మళలీ చ ర చి ంచ ము .
पर मुझे लगता है आदमी को खुद को बेहतर बना ना चाहिए .	కానీ ఒక మనిషి తన ను తాను మె రుగు పర చు కో వాలని అనుకుంటా ను .
कई बार गि रा दे ते हैं . डि स फ े जि या होने पर दम न घु टे , धयान रख ें .	అతను కొనని సా రలు చ లలు కుంటా డు . అతని గొ ం తు లో అనన ం ఇ రు క కో కుండా చూడ ాలి .
कि तुमहें वापस पा ने और अपनी शादी बचा ने के लिए मैं कुछ कर सकती हूँ .	మన వి వా హా నని కా పా డు కో వడానికి నినను తిరిగి ఎలా తె చచు కో వాల నే ది .
3 1 जु ला ई 1 9 5 7	3 1 జ ూ లె 1 9 5 7
पर लगता है यह बात सच है .	కానీ అది నిజ మే అనుకుంటా ను .
मैं उसे एक हा द से का गवा ह बना ने ला या था .	నా పరి ధి లో ని ఒక పరమా ద ంలో అతను సా కషి .
मुझसे पू छो तो मैं रू स देखना चा हूँ गा .	వయకతి గ తంగా , ర ష యా చూడ ాలని అనుకుంటుననా ను .
और सबसे सच ची	అది నిజ మెంది ,
वर डी का था . बहुत सु ंदर था .	వె ర డీ . చాలా అంద ంగా ఉంది .
ड रा इ मार टी नी .	డ రె మార టి ని .
व हीं रु क जाओ !	అకకడ ే ఆ గ ండి !
उसने कहा मेरा काम अचछा है .	నా పని బాగు ందని చెపపా రు .
बहुत अचछा था .	ఇది బాగుంది .
तुमहें देख ने हैं अजीब लोग ? था ने आ जाना . मैं दिखा ऊ ं गा तुमहें .	వ కర బు దధ ి గా ళలు ఎలా ఉంటా రో చూ సతా వా ? సట ే షన కి వ సతే కొ ంద రని చూపి సతాను .
मेरा नया घर .	నా కొతత ఇ లలు .
हाथ न लगा ए ं .	ము టటు కో కూడదు .
टॉ म , एक बार तो अपना धयान खुद रख कर देखो .	టా మ , ఈ ఒకక సా రె నా నినను నువవు చూ సుకో .
स ंग रहा ल य में पै ट रिक की रि पो रट मैंने की .	ప యా ట రిక గురించి మ యూ జి యా నికి చెపపా ను .
मैंने मु क द मे में उसकी तरफ दा री करके अपनी गलती सु धा र ने की कोशिश की .	నేను చేసిన ప నికి , వి చా రణ లో అతనికి సహా యం చేయ ాలని పరయతని ంచా ను .
मैंने पै ट रिक के सु पर वा इ जर के नाम एक ग ुम नाम खत लि खा .	నేను ప యా ట రిక సూ పర వె జర కు ఆ కా శ రా మ నన ఉ తత రం రా శా ను .
तुम और टॉ म एक - दूसरे को कब से जानते हो ?	నీకు , టా మ కు ఎంత కాల ంగా పరి చ యం ఉంది ?
वे चे ह रे पर मे क अप लगा ते हैं और जे वर पह न ते हैं . घ ि न आती है .	వాళలు ముఖ ాల కు మే క ప వే సు కు ని , న గ లు పెటటు కుంటా రు . ఘ ో ర ంగా ఉంటుంది .
पयार के शर ब त में न ह ला कर	చాలా పరే మ తో వ డ డి ంచు దానని
स से कस त ट रो गी वाह न से वा	స సె కస కో సట అ ం బు లె నస సర వీ స
यही करना सही लग रहा था .	అది స రెన పని అనిపి ంచింది .
तुम बहुत अचछा तै र रही हो .	నిజంగా బాగా చేసతుననా వు .
वह बॉ बी को घ ुम ा रहा है .	అతను బా బీ ని తి పపు తుననా డు .
सप ने तो देखो मै रि यन ! हाँ .	కల గ ను , మే రి యన ! కా నివ వు .
कयोंकि आदमी को हमेशा खुद को बेहतर बना ना चाहिए .	ఎందుకంటే మనిషి తన ను తాను మె రుగు ప రు చు కు ంట ూ ఉండాలి .
बस जी रहा हूँ , मि स बरा उन .	భ రి ంచ గ లి గే లా , మి స బర ౌ న .
और बेहतर होगा कि तुम दोनों इस बात को सवी कार कर लो .	నువవు దీ నని అ ంగ ీ కరి సతే , అది మీ ఇదద రికీ మంచిది .
धी रे बो लो . मुझे बताओ . . .	నె మమ ది ంచు . నాకు చెపపు - -
पै ट रिक जेल जा रहा है और मेरी जिंदगी त बा ह हो गई है .	ప యా ట రిక జె లు కు వెళ ు తుననా డు . నేను నా శ న మె పోయా ను .
अब उनकी शादी हो गई है , मैं उसे दूर जाते हुए महसूस कर सकता हूँ .	ఇపపుడు వాళ లకు పె ళ లి అయి న ందు వలల అతను నాకు దూ రం అవు తుననా డు .
सब इसी के बारे में बात कर रहे हैं .	అందరూ దాని గురి ంచే మాటలాడు కుంటుననా రు .
- नहीं ! - वह तुमसे मिल ना नहीं चाहता !	- కాదు ! - నినను చూడ డం అతనికి ఇషటం లేదు .
गु ंड ों ने उसे इतना पी टा कि वह मर गया .	కొ ంద రు గ ూ ండ ాలు అత నని కొ టటి చం పా రు .
मैं टॉ म को काम पर लगा ना चाहता हूँ .	నేను టా మ కు పని ఇవ వాలని అనుకుంటుననా ను .
बद ले में , मैं तुमहें अचछे से तै र ना सि खा सकता हूँ .	దానికి బ దు లు గా , నేను నీకు ఇంకా ఈ త నే ర పి సతాను .
रु चि का मतलब बस जान ना है कि कोई चीज आपको कैसा महसूस करा ती है .	అభి రు చి అంటే కేవలం అది మనకు ఎలా అనిపి సతు ందో తెలుసు కో వడం .
ना इ जेल ने मना किया है .	నె జె ల నీ వు తా గ కూడ ద ననా డు .
- मैंने नहीं पढ ा . - तुमहें पढ ना चाहिए !	- నే న ది చ ద వ లేదు . - తపప కుండా చ ద వాలి !
तुम कह रही हो तुमहें पयार हो गया है .	నువవు పరే మ లో పడ డా వని చెబు తుననావు .
वे कितनी शक ति शा ली हैं .	అవి ఎంత బ ల ంగా ఉననా య నే ది .
आप कैसे हैं ?	ఎలా ఉననావు ?
कया बात है ?	నీకు ఏ మెంది ?
2 5 म ई 1 9 5 8 .	మే 2 5 , 1 9 5 8 .
मेरी मदद से .	నా స హాయ ంతో .
" मैंने उसे पीछे से भी पह चा न लिया .	" అత నని వె నుక నుండి కూడా గురతు ప టట ా ను .
" मेरा पुलिस वाला " कौन है ?	" నా పోలీసు " అంటే ఎవరు ?
