कहीं भी , कभी भी , एक दम दार सु पर ही रो पै दा होगा .	ఎకకడ ెనా , ఎపపుడ ెనా , శ కతి వ ంత మెన సూ ప కనిపి సతారు .
फिर हम उस बारे में कुछ नहीं करते .	అయి నా మనం దాని గురించి ఏమీ చేయ ము .
च लिए करते हैं	మన మి ది చే దదాం
मुझे पूरी बात जान नी है .	నాకు మొతత ం వి వర ణ కా వ లి .
तो , व हा इट च ॉ क ले ट वाली कॉ फी पि यो गी ?	వె ట చా క లెట యూ ని కార న ఫ రా ప తా గు తా వా ?
न ू वर क में डे ज इन में रु की हूँ .	నేను న ూ వా రక లో డే స ఇ న లో ఉననాను .
यकीन मान ो , मुझे पता है .	ననను నమ ము , నాకు తెలుసు .
माँ , सिरफ आपकी बात नहीं है .	అమమా , అది కేవలం నువవే కాదు .
चलो , निकल चल ें .	మనం వెళళి పో దాం .
- किस बात की म ं जू री ? - व ॉ ट में ऐ श ली से .	- దే నికి ఆ మో ద ం పొ ందా వు ? - వా ట లో ఆ ష లీ తో .
हैलो , माँ .	హలో , అమమా .
क वी न मे व , प ले जर स ले व .	క వీ న మే వ , ప లె జర స లే వ .
बि ग ब लै क नो आर	బి క బ లా క నో య ర
कया फर क पडता है ?	తే డా ఏం ఉంటుంది ?
मैं वह हा रा हुआ आदमी हूँ .	నేను భా రయ ను తా ర చే వాడి నే .
अस ली ही रो कौन हैं ?	అస లెన హ ీ రో లు ఎవరు ?
पर इससे सच चा ई नहीं बदल जाती .	కానీ అది వా సత వాల ను మా రచ లేదు .
इन दु ष ट , अ मान ु ष ि क सु पर बद मा श ों के	అది ఈ దు ష టు లు , అ మా న వీ య సూ పర వి ల నలు
उनहें अंदर आने द ें , उनहें शर ब त पि ला एँ ?	వాళళ ను లో నికి రా ని చచి ఐ స టీ ఇవవ మ ంటా రా ?
- फिर , उनहें रो क ने के लिए हमें स जा देना . - हाँ .	- వారి ని ఆ ప ాలను కునే మమ మ లని శి కషి ంచండి . - అవును .
- हमें और कं पा उ ंड वी की जरूरत है . - बिलकुल .	- మనకు మరి ంత కా ం ప ౌ ండ వీ కావాలి . - ఖచచితంగా .
हमें और सु पर ही रो चाहिए !	మరి ంత మంది సూ ప లు కావాలి !
इन हें अंदर डा लो . सभी को .	అవి లోప ల పెటట ండి . అందరూ .
बु चर , तुम कहाँ हो ?	బు చ ర , ఎకకడ ఉననావు ?
हमें जाना होगा . अभी .	మనం వెళళ ాలి . వెంట నే .
स हम ति से . चलो .	ఏ కీ భా వ ంతో . రా .
हैलो , माँ .	హలో , అమమా .
अब , मुझसे न फ रत मत करना .	ఇపపుడు , ననను ద వే షి ంచ కు .
वि लि य म .	వి లి యం .
उस में कोई शक नहीं .	ఖచచితంగా చం పు తా వు .
पर मुझे ले नी को अ ल वि दा कह ने का कभी मौ का ही नहीं मिला .	కానీ నాకు లె ననీ కి వీ డ కో లు ప లి కే అవకా శం ఎపపుడూ రాల ేదు .
मुझसे कहीं जयादा दम है .	నే నె పపుడ ూ లే న ంత ద ృ ఢ ంగా .
तुमने उसका साथ छो डा था , मैंने नहीं .	వాడిని వదిలే సింది నువవు , నేను కాదు .
- कया ? - स टा र ला इट को जि ंदा रख कर .	- ఏంటి ? - సటా ర లెట స జీ వ ంగా ఉ ంచడం .
तुमसे मिल कर बहुत अचछा लगा .	నినను కల వడం సంతోష ంగా ఉంది .
सुनो ,	వి ను ,
कि तुमने कि त नों को मा रा होगा .	నువవు ఎంత మంది ని చం పి ఉంటా వని .
मुझे पता है .	నాకు తెలుసు .
गरेस .	గరేస .
जब तक अ व धि सं वि धि है , तब तक वह समझ ौ ता भी है .	సటా ట యూ ట స ఆ ఫ లి మి టే ష నస ఉనన ంత వర కు గ డు వు తీ ర దు .
ए म ए म .	ఎ ం ఎ ం .
तुम कितनी पया री हो .	చాలా అంద ంగా ఉననావు .
ए , मेरी न ई दु ल ह न कस ै ंड रा से मि लो . ए - ट रे न .	నా కొతత వ ధ ు వు ను కలు వు , క సా ండ రా . ఏ ట రె యి న .
तुमसे मिल कर अचछा लगा .	మిమమలని కల వడం సంతోష ం .
पर , उसने कया किया था ?	అంటే , అతను ఏం చేశా డు ?
रुको , कया ?	ఆగు , ఏంటి ?
मे व ?	మే వ ?
या तुमहारे पिता की कोई फि ल म ?	లేదా మీ నానన సి ని మ ాల లో ఒకటి ?
- ना , हमें यहाँ बडा मजा आ रहा है . - बाहर आओ .	- లేదు , ఇకకడ మంచి సమయం గ డు పు తుననాం . - బయటకు .
तुम दोनों यहीं रुको , एक - दूसरे को जान ो - पह चा नो .	మీ రి దద రూ , ఇకకడ ే ఉండ ండి , పర స పర ం తెలుసు కుంటా రు .
हाँ .	సరే .
यह कया ?	ఏంటి ది ?
मुझे एक रा सता पता है .	నాకు ఒక మా రగ ం తెలుసు .
खा ने के लिए तैयार हो ?	నువవు డి నన ర కు సిదధ మా ?
रा यन ! नहीं !	రా యన ! వదదు !
मुझे नहीं पता था कि वह खुद को आ ग लगा ले गा .	అతను తన కు తాను ని పప ంటి ంచు కుంటా డని తెలియదు .
वह ह वाई अ ड डे पर हैं .	విమా నా శ ర యం లో ఉననాడు .
उनके ता ब ूत पर पे शा ब करने आ ऊँगा .	అతని శ వ పే టి క మీద మూ తరం పో సతాను .
ताकि वह लोगों की नजर ों में बना रहे .	అ ప కీ ర తి పు కార లు వి సత రి ం ప చేసతుననా డు .
धत तेरी .	అయ యో , ఛ .
वैसे , तुम लोगों का ई गल द आर चर के बारे में कया खया ल है ?	అవును గా నీ , ఈ గి ల ద ఆ రచ ర గురించి మీరు ఏం అనుకుంటుననా రు ?
वि क टो रि या न यू मन के घर के बाहर आज यह ना राज गी का मा ह ौ ल ,	వి క టో రి యా న యూ మా న ఇంటి బయట ఆ గర హ స నని వే శం కనిపి ంచింది .
तुम वही बि ली व वाले , प सी ने से ल थ प थ आदमी हो ना ?	నువవు ఆ బి లీ వ నుండి వచచి న చ కక ని యు వ కు డి వి కదా ?
म हिला पर व क ता कै रो ल मै न हा इ म का यह कहना था . . .	పరతి ని ధి కా రో ల మన హా మ విషయం తెలియ చేసి ంది . . .
रि मो ट रख दो , वर ना तुमहारा चे हरा ज ला डाल ूँगा .	రి మో ట పెటట ే య , లేదా నేను నీ ముఖ ం కాల చేసతాను .
यह घर न क ली है , पड ो सी न क ली हैं , आप न क ली हैं ?	ఈ ఇ లల ూ , పొ రుగు వారు అంతా అబ దధ ం , నువవు అబ దధ మా ?
- शुरू से . - मैंने द से वे न को छो डा ही था	- మొదటి నుండి . - అ పపుడే సె వె నను వదిలే శా ను ,
और किसी में तुमहारे जि तना दम है ? नहीं .	నువవు నీకు తెలి సిన బ ల మెన వాడి వా ? అవును .
- . . . हमें मार ने की ता क में . - हाँ .	- . . . మన లని చం ప డానికి ి . - బాగు ననాను .
अब बकवास छोड ो और फिर से शुरू करते हैं .	అరథం లేని మాట లు ఆ పి , మళళీ మొద లు పె డ దాం .
शुकरिया , पर हम जयादा देर नहीं रु क ेंगे .	ధనయవాదాలు , కానీ మేము ఎకకువ సే పు ఉండ ము .
- और बहुत अचछी रहे गी . . . - ऐ श ली . . .	- చాలా గొపప గా ఉంటుంది . . . - ఆ ష లీ . . .
मुझे पता है कि मैं अचछा पिता नहीं था .	నేను మంచి త ండ రి ని కా దని నాకు తెలుసు .
अचछा , दो स तो . माफ कीजिए , हमें जाना है .	సరే , అందరూ . కషమి ంచండి , మేము వెళళ ాలి .
नहीं . उससे उनके लिए खत रा और बढ जाएगा .	లేదు . వాళళ ను ఇంకా పరమా ద ంలో పడ ే సతాను .
मैं आपको डा ं से ज वि थ व ु ल वज दिखा ता हूँ .	నేను నీకు డా న సె స వి త ఉ లవ స చూపి సతాను .
हम सं सक ृ ति के लिए एक ज ंग लड रहे हैं .	మేము సం స క ృ తి కోసం యు దధ ం చేసతుననా ము .
मैं ठीक हूँ . मैं तुमहारे साथ चल ूँगा .	నేను బాగా ను ఉననాను . మీ తో వ సతుననాను .
अस सी साल पहले , बिलकुल वै सी दिख ती थी .	ఎ నిమి దే ళళ కరి తరం , తను అలా నే ఉండే ది .
- न तो मेरे पास समय है . . . - बि ली .	- నాకు సమయం దొ రక లేదు . . . - బి ల లీ .
कुछ तो उ पाय होगा . कोई खु फ िया रा सता ?	ఏదో ఒకటి ఉ ండి ఉండాలి . ర హ సయ పర వే శం ?
आपका परिवार मु सी ब त में आ चुका है .	మీ కుటుం బం ఇ పపటి కే ఇ బబ ందు లలో ఉంది .
अ मरी का को फिर से हि फा ज त से रख ना .	మళళీ అ మె రి కా ను సు ర కషి తంగా ఉ ంచండి .
नहीं , पलीज . मेरा परिवार है . पलीज .	లేదు , వదిలే య . నాకు కుటుం బం ఉంది .
ए , बि ली , तुम फोन ही नहीं उठा रहे .	హే , బి ల లీ , నువవు ఫోన ఎ తత డం లేదు .
एक बू ढ े , बे कार आदमी की मदद करने के लिए उसने अपने काम से छु ट टी ली .	ప నికి రా ని ము స లి వాడిని చూ సుకో వాలని తన పరా క టీ సు కు సె ల వు పె టటి ంది .
- तुमसे मिल कर अचछा लगा . - जन म दिन मु बार क हो .	- నినను కల వడం బాగుంది . - జ నమ ది న శు భా కా ం కష లు .
तो फिर , मुझे आत म सम र प ण करना होगा .	అంటే నేను ఆ నే రా నని ఒ పపు కో వాలి .
जब तुमसे और बर दा श त नहीं हो पा या	లె ననీ గ నను నో టి లో పెటటు కుననా డు
अगर ह यू कै म बे ल मेरे हाथ लग गया ,	నాకు హ యూ క యా ం ప బె ల పె పటటు వ సతే ,
वह हमारे ध र म के बारे में झूठ ी और अप मान जन क अफ वा हें फै ला रहा था	అతను తన సథా నా నని ప ది ల ప రు చు కో టానికి మన మ తం పె న అ పరతి ష ఠ ా కర మెన ,
मुझे बहुत ही अजीब सा लगता है .	నాకు చాలా మూ ర ఖ ంగా అనిపి సతుంది .
और उसे मौ त की नी ंद सु ला द ूँगा .	ఆమె త లలో మె ద డు బయటకు తీ సతాను .
ट रा ंस लू स ें ट , द इन वि जि बल कॉ क ?	ట రా నస లూ సె ంట , ద ఇ న వి జి బు ల కా క ?
उससे यह सा बि त हो जाएगा कि व ॉ ट	వా ట ను సం సథ దు ర వి ని యో గం మరియు
वह तुमहारी बा हों में लौट आए गी और तुम एक दम ठीक हो जाओ गी .	ఆమె తిరిగి నీ బా హు వు లలో ఉంటుంది , నువవు పూరతి గా బాగు ంటా వు .
वि क टो रि या न यू मन के आ रो प . . .	వి క టో రి యా న యూ మా న ఆ రో ప ణ . . .
मरी ज ों पर वी की जा ँच कयों कर रहे हैं ? उनहें कया चाहिए ?	రో గు ల పె న వీ ని ఎందుకు పర ీ కషి సతుననారు ? వాళళ కే ం కావాలి ?
मैं इस सब में फ ंस चु की हूँ .	నేను దా న ంత టి మధయ లో ఉననాను .
शुकरिया . बहुत - बहुत शुकरिया .	ధనయవాదాలు . చాలా ధనయవాదాలు .
टर मस ऑ फ ए ं डि यर में ट किया है .	టర మస ఆ ఫ ఎ న డి య ర మె ంట చేశా ను .
लड के , त ू ने तो ह द ही कर दी .	బా బు , నువవు నమమ శ క య ంగా లేవు .
आपके पास पाँच मिनट हैं . . .	మీకు ఐ దు నిమిష ాల సమయం . . .
व ॉ ट और कं पा उ ंड वी को लेकर	మనం వా ట ఇంకా కా ం ప ౌ ండ వీ పె న
निकल चल ते हैं . व ॉ ट से दूर .	వెళళి పో దాం . వా ట కు ద ూర ంగా .
कॉ ले ज की लड किया ँ ? सच में ?	కాల ే జీ అమమాయి లా ? నిజంగా నా ?
उनहोंने मेरा बु त ह टा दिया ?	వాళళు నా వి గర హం తీ సే శా రా ?
और फिर मैंने तुमहें पा या .	అపపుడు నువవు కనిపి ంచా వు .
- हम एक मु ला का त में हैं . - मैं न यू य ॉर क में हूँ .	- మేము సమా వే శం లో ఉననా ము . - నేను న యూ యా రక లో ఉననాను .
हो म लै ंड र : रा इ ज ऑ फ अ ही रो ,	హో ం లా ండ ర : రె జ ఆ ఫ ఎ హ ీ రో ,
साथ ही कं पा उ ंड वी के नि र मा ण और उसके वि तर ण को लेकर ,	కా ం ప ౌ ండ వీ ఉ త ప తతి మరియు పం పీ ణ ీ ని వి చా రి సతుననా ము ,
- यह सच नहीं है . - माँ .	- అది నిజం కాదు . - అమమా .
मुझे पता है कि तुम परे शान हो . कोई वजह थी . . .	నీకు గ ంద రగ ో ళ ంగా ఉ ందని తెలుసు . కారణ ాలు ననా యి . . .
यह सब ठीक नहीं है , यार .	ఇది ఆ రో గ య కర మెంది కాదు .
हो म लै ंड र : डा र के सट डे , हो म लै ंड र : बरा इ टे सट ना इट .	హో ం లా ండ ర : డా ర కె సట డే , హో ం లా ండ ర : బ రె టె సట నె ట .
शायद तुम सब भूल जाओ गे .	అది వదిలే సతా వ ను కుననాను .
रा यन , मैं चाहता हूँ कि तुम सट ॉर म फर ंट को जान ो .	రా యన , నువవు సటా ర మ ఫర ంట గురించి తెలుసు కో వాలి .
आप एक इं च भी करी ब आए ,	ఒకక డుగు దగగర కు వచచి నా ,
आप से मिल कर अचछा लगा .	మిమమలని కల వడం సంతోష ం .
का ंग रे स को गवा ही दो .	కా ంగ రె స కు సా కష య మి వ వు .
अचछा . खाना तैयार है .	సరే . డి నన ర సిదధ మెంది .
हाँ . भा ड में जाए वह .	అవును . అతని ని వదిలే య .
वह मेरे भाई जैसा है .	సోద రు డు లాంటి వాడు .
मैंने तुमसे कभी कुछ माँ गा है ? कभी भी ?	నినను ఎపపుడ ెనా ఏదెనా అడి గా నా ? ఎపపుడ ెనా ?
आपको उसका नाम ले ने का कोई ह क नहीं है .	నీకు వాడి పేరు ఉ చ ఛ రి ంచే అర హ త కూడా లేదు .
पर दरअसल , उसने कार य कर म को ध ो खा दिया था .	నిజ ానికి , అతను కర మ ణి కను వి ఫ ల ం చేశా డు .
मुझे आप पर यकीन है .	మిమమలని నమ ము తుననా .
- यह मेरा नाम जानता है . - हाँ , अचछा .	- దీ నికి నా పేరు తెలుసు . - అవును , సరే .
जब उसे देखो गे , तो मेरे बारे में सोच ना .	అతని ని చూ సిన పపుడు , ననను గురతు చేసుకో .
यह आ म ंड ज ॉ य था कया ?	అది ఆ ల మ ండ జా య కదా ?
मैं दुनिया का सबसे बडा सु पर ही रो हूँ .	నేను పరపంచ ంలో కె లల గొపప సూ పర హ ీ రో ను .
मुझे तो यह सम मान की बात लग ने लगी है .	అది గ ౌ ర వ ంగా భా వి ంచడం మొద లు పెటటా ను .
अब मेरी हा लत देखो .	ఇపపుడు ననను చూడు .
ली ड स , ओ लड टर ै फर ड .	లీ డ స , ఓ ల డ ట రా ఫో ర డ .
अन ै चछ ि क हतया के आ रो प नहीं लगा ऊँ गी ?	మా రణ కా ండ ఆ రో ప ణ లు గ ౌ ర వ ంగా తొ ల గి ంచ డ మా ?
पर हम सु पर मर द ों की , करो ड ों ता कत वर लोगों की फ ौ ज से प लट कर लड सकते हैं .	కానీ మేము శ కతి వ ంత మెన , మి లి యన రె టల బ ల మెన సె న య ంతో తిరిగి పో రా డ గల ము .
मुझे बाहर निका लो !	బయటకు రా నివ వ ండి !
एक च मत कार ही था .	చెతత అదభు త వయకతి .
मेरी माँ , वह . . .	మా అమమ , ఆమె . . .
स टा र ला इट एक ग द दार	సటా ర లెట దే శ ద రో హి
उसे यह पूरी दुनिया बहुत ही अजीब सी और ड रा व नी लगे गी .	ఈ పరపంచ ం మొతత ం గ ంద రగ ో ళ ంగా , భ యా న కంగా అనిపి సతుంది .
रुको ! रा यन , नहीं !	ఆగు ! రా యన ! వదదు !
और एक बार तब जब कोई आ खि री बार आपका नाम ले ता है .	మళళీ మన పేరు ఎవరెనా చి వరి సారి ప లి కి నపపుడు మ రో సారి .
- तुम सुन रहे हो ? - यह कब हुआ ?	- ఉననా వా ? - అది ఎ పపుడు జరిగింది ?
हम पर नि र भर है .	మనం నిరణ యి ంచాలి .
वह आ सान नहीं था .	అది సు ల భ ం కాదు .
काफी तो किए भी .	చాలా వర కు చేశా ను .
मेरे साथ चलो गे ?	నాతో నువ వ ొ సతా వా ?
मेरा परिवार . . .	నా కుటుం బం . . .
आप मुझे फिर से ध ो खा दे रही हैं ?	నువవు ననను మళళీ మో సం చేసతా వా ?
और फिर चर च ने , और उनके " इं टर न ल री सर च ब यू रो " ने	అపపుడు ఈ చ ర చి ఇంకా వారి ఇంట ర న ల రీ సె రచ బ యూ రో
इस बार अपनी जगह छोड कर मत जाना .	ఈ సారి నీ సథా నా నని తొ ల గి ంచ ను .
हे भगवान . बि ली .	దేవుడా . బి ల లీ .
हमारी तै या री चल रही है , ली ए न .	మనం సా ధన మధయ లో ఉననా ం , లే ఆన .
उस ी वजह से , सु पर आत ंक वा दी अ मरी का में घु स पै ठ किए जा रहे हैं .	అందుకే మ హా ఉ గర వా దు లు అ మె రి కా పె ద ండ యా తర కొ న సా గి సతుననారు .
जब भी मैं किसी को बचा ने के लिए जाती , मैं उसे जरूर छ ू ती थी .	నేను ర కషి ంచ డానికి వెళళ ే ముందు పరతి సారి దానిని తా కు తాను .
आपकी ही वजह से वह मा रा गया .	నువవే వాడు చని పో డానికి కారణ ం .
