आप उनहें ज ला सकते हैं , लेकिन वे आ ग से अधि क शक ति शा ली होती हैं .	వాటి ని మ ంట లలో వే సి బ ూ డి ద చేయ వచచు , కానీ అవి మ ంట క ననా శ కతి వ ంత మెన వి .
रुको . जे र ला म रे ल .	ఆగు . జె ర లా మ రె ల .
कया मैं खुद सं देश पढ सकती ह ूं ?	ఆ స ందే శా నని స వయ ంగా నేనే చ ద వ వచచా ?
च ली जाओ , पै रिस .	వెళలి పో , ప యా రి స .
मैं यह लं बे समय से जानती ह ूं . और मैं बस . . .	నాకు ఈ విషయం చాలా కాల ంగా తెలుసు . కానీ నేను . . .
" ठीक है , कयोंकि तुम नहीं जान सकते , तुमहें पर वाह नहीं करनी चाहिए , " उसने कहा .	" మీకు తెలీదు కాబటటి , మీరు ప టటి ంచుకో నవ సరం లేదు లే , " అని అతను బ దు లి చచా డు .
बैठ ो , मेरी जान .	కూ రచ ో , బంగా రం .
वे सभी रो ज एक साथ काम करते थे .	పర తీ రోజు కలిసి పని చేసే వాళళు .
और तुम अपनी न फ रत उन पर कयों निकाल रही हो ?	ఆ అస హ యానని నీ పిలల ల మీద ఎందుకు చూపి సతుననా వు ?
अब , तुमहें मा घ रा के लिए द या ल ु होना चाहिए .	ఇపపుడు , నువవు ఆ మంచి త నా నని మా గరా మీద చూ ప ాలి .
मुझे बताओ कि तुम जे र ला म रे ल नाम क वि ध र मी और श ै ता न के बारे में कया जानते हो .	మ త వి రో ధి మరియు దు ష టు డు అయి న జె ర లా మ రె ల గురించి మీ కే ం తెలు సో చెపప ండి .
वह किसी अन य जगह है , जिस का पता नहीं लग सकता .	తను మ రో చో ట , కని పెటట లేని వి ధ ంగా ఉంటుంది .
जो द फ न है वह ही द फ न रहे गा . हमेशा के लिए .	ప ూ డ చి పెటట బడి న ది అలాగే ఉంటుంది . . . ఎ పపటి కీ .
जब वे बा रह साल के होंगे , तब बॉ कस खो ल ना .	వాళళ కి ప నన ె ండ ే ళళు వచచా క ఆ పెటట ె ని తె ర వ ండి .
और अगर वह भूल ता भी है . . .	ఒక వే ళ దేవు డు మర చి పోయి నా . . .
पहली लि खा ई वा सत व में ट ै मै क टी जू न की है .	మొదటి మూ ర నిజంగా ట మా క టీ జ ూ న నుండి వచచి న దే .
मा घ रा कि ता ब ों को ज ला दे गी .	పు సత కాల ని మా గరా కాల చే సతుంది .
तुम कहीं न कहीं दु ः ख और आ न ंद महसूस करती हो , शायद , लेकिन जयादा तर दु ः ख .	నీకు బాధ మరియు ఎకకడ ో ఆన ంద ం కూడా తెలు సతు ందే మో , కానీ ఎకకువ గా బాధ ే .
शा श व त दी वार में द रा र से पा नी आ रहा है ,	ని తయ గో డ య ొ కక ప గు ళళ నుండి నీ రు కారు తోంది ,
इसलिए छा या छा या हैं . कोई नहीं जानता कि वे कौन हैं .	అందుకే ఛ ా య లని ఛ ా య లు అంటా రు . వాళళ ె వ వర ో ఎవ వ రికీ తెలియదు .
हम . . . हमने कुछ नहीं सुना .	మేము . . . మే మే మీ విన లేదు .
" मेरा नाम द ृ ष टि है , " उसने जवाब दिया .	" నా పేరు చూ పు , " అని అతను సమా ధా న మి చచా డు .
मेरी तरफ . . .	నా వెపు . . .
कु त त ों को भी लगता है कि वे पत थ र हैं .	కు కక లు కూడా త నని ఓ బ ండ రా య ని అనుకుంటా యి .
मैं य हां हूँ .	నేను వచచా ను .
और इसके साथ ही , वह दूर चला गया और उन सभी को है रा न अके ला छोड दिया .	అలా అనే సి , వాళ లని అ యో మ యం లో ఒ ంట రి గా వదిలే సి అతను వెళలి పోయా డు .
सच चा ई मेरे हाथ ों में है .	నిజం ఏంట ో నా చే తు లలో ఉంది .
बि स तर पर आओ .	పడ క వ దద కి పద .
हम भगवान से हमेशा मार ग दर शन के लिए परा र थ ना करते हैं ,	దేవు ని స దా మా రగ నిర దే శ నం కోసం పరా ర ధి సతూ నే ఉననా ం ,
एक गा ँ व में एक साथ चार भाई - बहन खुशी - खुशी रह रहे थे ,	ఒక ఊ రి లో నలు గు రు అననా చె ల లె ళళు ఆన ంద ంగా ఉండే వారు ,
नहीं , मैं एक भ गो डा हूँ .	లేదు . నే నో కా ంది శ ీ కు డిని .
लेकिन अ ल के नी की हमेशा एक छा या रही है .	కానీ ఆ ల కె ననీ లో ఎ పప ట ను ంచ ో ఛ ా య ఉంది .
जिस ने तुमहारी माँ को एक बर फी ले हम ले में बचा या था .	అతను మీ అమమ ను మ ంచు తు ఫా ను బా రి నుండి కా పా డా డు .
और अगर मैं उनकी आँख ों को ढ ँ क दू ं , वे अब यह नहीं कर सकते .	అదే నేను వాళళ క ళళ కు గ ంత లు క డి తే , వాళళు అద ె కక డు ందో కను క కో లే రు .
मैंने तुमहें उस बॉ कस को खो ल ने के लिए चा बी दी है .	ఆ పెటట ె ని తె ర వడానికి నీకు తా ళ ంచ ె వి ని ఇ చచా ను .
वह वय क ति जो मैं अभी ह ूं .	నే ని పపుడు నన మనిషి లా గా .
अन य लोग जिन का पर यो जन था .	ఆ ందో ళ న పడు తునన ఇ తరు లు .
खुश बू , स वाद ,	వా స న , రు చి ,
यही बात है . है न , पै रिस ?	అదే కదా ముఖ యం , ప యా రి స ?
एक बार , मैंने तुमहारे साथ इस तरह परा र थ ना की थी .	ఒక పపుడు , నేను నినను ఈ వి ధ ంగా నే పరా ర ధి ంచా ను .
सभी जानते हैं तुमहारा व तुमहारी चा ची का मेरे व मेरे परिवार के परति बुरा इ रा दा है .	నా మీ దా , నా కుటుం బం మీ దా నీ కూ , నీ పి నని కీ చె డు ఉదదేశం ఉ ంద నే ది బ హి రం గ సత యం .
द ृ ष टि की यु ग का रह स य .	చూ పు యు గం నా టి ర హ సయ ాలు .
एक बी वर इसे खो ज ले गा .	ఓ బీ వర కి దొ రు కు తు ంద ది .
यह बा बा व ॉ स था और यह पै रिस थी जिस ने मेरी माँ को . . .	మా అమమ ని , నీ స ొ ంత తో బు టటు వు ని చ లి మ ంట కి ఆ హు తి చేసి ంది . . .
यह कह ती है कि हम उसे गि रे हुए तने के अ ंत में पा ए ं गे .	ఒక నే ల ర ాలి న చె టటు దగగర ఆమె మన కి క న బ డు తు ందని ఇది చెప తోంది .
कया यह तुमहें परे शान नहीं करता है ?	అది నీకు హె రా నా కలి గి ంచడం లేదా ?
एक शक ति जो मन ु ष य को भगवान से ऊपर रख ती है . . .	దేవు డిని మనిషి అ ధి గ మి ంచే లా చేసే శ కతి . . .
" मैं आपको बता सकता है कि आप में से एक बहुत सु ंदर है . . .	" మీ లో ఒక డు మంచి అంద గా డని , ఒక రు భలే అంద గ త తె అని . . .
- हम फ ँ स गए हैं . - हम नहीं फ ँ से .	- మనం ఇ రు కకు పోయా ం . - అది నిజం కాదు .
मेरी दा दी की दा दी की खुद की कि ता ब ें थीं .	మా బా మమ కి బా మమ దగగర తన స ొ ంత పు సత క ాలు ఉండే వి .
व हां कई प हा ड हैं और खो ए हुए प ठा र .	కొ ండ లు , పీ ఠ భ ూ ము లు చాలా ఉననాయి .
आपको य हां अपनी से ना की जरूरत है , म हा रा नी	మీకు మీ సె న యం య ొ కక అవసరం ఇకకడ ఉంది , మ హా రా ణి .
अचछी बच ची .	మంచి పా ప వి .
पिता जी इस बारे में कया जानते हैं ?	నానన కి వీ టి గురించి ఏం తెలుసు ?
मैंने सोचा कि अगर कोई ऐसा वय क ति हो जो मुझे उ क सा ना चाहता हो ,	ననను రె చచ గొ టటే ంత పిచచి పని చేసే వాళళు ఎవరెనా ఉంటే , అంద రిక ననా ముందు
मैंने तुमसे जो जानकारी मा ं गी वह देने में तुम अस फ ल रहे .	నే న డి గి న సమా చా రా నని నాకు ఇవ వడం లో మీరు వి ఫ ల మ య యా రు .
इसलिए मैं तुमसे परा र थ ना में बात कर ूं गी .	అందుకే నీ తో ఈ పరా రథ న ద వా రా నేను మాటలాడ తాను .
तो , प ृ थ वी पर उनके हाथ की तरह , मैं वि ना श होने से रो क ती ह ूं ,	అందు కని , భ ూ మ మీద అతని సే వ కు ర ాలి గా , నేను వి నా శ నా నని ద ూర ంగా ఉ ంచు తూ ,
जे र ला म रे ल ने बा रह साल कहा था .	ప నన ె ండ ే ళళు అని జె ర లా మ రె ల అననా డు .
- और केवल य हां . . . - जी ने के लिए !	- ఇంకా ఇకకడ ే . . . - బర త క డా ని కే !
और उसने तुमसे एक नि वे द न किया :	అతను నినను ఒక ే ఒకటి అ భయ ర ధి ంచా డు :
उसने इन हें पयार से नहीं सु ला या कयोंकि वह चला गया था , बस भ ट क रहा था .	అత డు వాళళ కి జో కొ టటి ని దర పు చచ లేదు , అతను వెళలి పోయా డు , తి రుగు తూ ఉననాడు అంతే .
कि ता ब ें कया होती हैं ?	పు సత క ాలు అంటే ఏంటి ?
वह वि ध र मी जि से आप ढूँढ रहे हैं .	మీరు వె తు కు తునన ఆ మ త వి రో ధి .
किस ने तुमहें मुझसे झूठ बोल ने के लिए भे जा ?	నాకు అబ దధ ం చెపప మని నినను ఎవరు పం పా రు ?
हम इस दिन के आने का इंतजार कर रहे थे .	ఈ రోజు కోసం మన మె పపటి ను ండ ో వే చి చూ సతుననా ం .
हमें विश वास है कि वह एक चु डै ल है . हमें पर मा ण चाहिए .	తను మ ంత రగ త తె అని మా నమమ కం . మాకు సా కష యం కావాలి .
हमारे पू र वज ों की दुनिया से भी बेहतर .	మన పూర వీ కు ల పరపంచ ం క ననా గొపప ది అవు తుంది .
और वे तुमहारे पास कब आए ं गे ?	వీ ళళు నీ చె ంత కు ఎ పపుడు వ సతారు ?
कया मतलब ?	అంటే ఏంటి ?
एक सं देश .	ఒక స ందే శం .
नहीं . मुझे नहीं पता .	లేదు , నాకు తెలీ దే .
मैं परा र थ ना करना चाहती ह ूं .	నేను పరా రథ న చేయ ాలను కు ంట ూ ననాను .
और अपने अनु या य ि यों को हरा ओ .	నీ దే హా నని నా దే హ ంతో ఏ కం చేయి .
नि र देश किस से हैं ?	ఈ సూ చ న లని ఎవరి చచా రు ?
लेकिन बहुत साल ों के बाद , पर का श का उप हार ब हा ल किया गया ,	కానీ చాలా ఏ ళళు గ డి చా క , ఈ చూ పు శ కతి మర లా పు న రు దద రి ంచ బ డు తోంది ,
दुनिया को भ ु ग ता न करो , बा बा .	పరప ంచా నికి తిరిగి ఇ చ చేయ , బా బా .
परा ची न लोगों का सा रा ज ञ ा न उन में डाल दिया जाता है .	మన పూర వీ కు ల జ ఞ ా నమ ంతా వాటి లలో పొ ందు పర చ బడి ంది .
उनकी अचछी तरह से देख भा ल करना .	వారి ని బాగా పె ంచి పో షి ంచు .
" एक न ई दुनिया , " उसने कहा ?	" ఓ కొతత పరపంచ ం , " అని అననా డా ?
तुम सच में जान ना चाहते हो ?	నీకు నిజంగా తెలుసు కో వాల ను ందా ?
मेरी बहुत सं वे द न शी ल उ ंग लिया ं हैं . तुमने कुछ छोड दिया होगा .	నా వే ళళు చాలా సు నని త మెన వి . మీరు ఏదెనా వదిలే సు ండ వచచు .
प वि तर शक ति ल ु पत हो रही है .	ప వి తర శ కతి త గ గు ముఖ ం పడు తోంది .
जी ए ं गे , और यहीं मर जाए ं गे .	బర తి కి చి వ రికి చని పో తా ర నన మాట .
तीन लोग मौ जू द थे . बा बा व ॉ स , पै रिस और मा घ रा .	అకకడ ము గ గు రు ననా రు . బా బా వా స , ప యా రి స మరియు మా గరా .
तुमहें पता है कि उनहें किसी दिन जाना चाहिए .	వాళళు ఏదో క రోజు వెళలి పో వల సి వ సతు ందని నీకు తెలుసు .
हमेशा हमेशा के लिए .	ఎ పపటి కీ , ఎ నన టి కీ .
मैं यह सु नि श चि त करने के लिए पास रहा कि तुमहें अ भ यार ण य मिले .	మీరు ఆ శ ర మా నని కను క కో గల రని నిర ధా రి ంచు కునే ందుకు మీకు చే రు వ గా ఉననాను .
जे र ला म रे ल ने खुद कहा कि हमें उसके साथ परा मर श करना चाहिए .	మనం ఆ వి డని సం పర ది ంచ ాలని స వయ ంగా జె ర లా మ రె లే చెపపా డు .
खबर ? तुम खबर कैसे भे जो गे ?	సమా చా ర మా ? దా నన ె లా పం పి సతా వు ?
हा ला त इतने अचछे नहीं हैं .	పరిసథి తులు , అంత స వయ ంగా లేవు .
लेकिन मैं इससे लड ती ह ूं कयोंकि यह मेरी व ं शा व ली है .	కానీ అది నా వం శ బాధ యత కాబటటి ఆ యు దధ ా నని కొ న సా గి సతుననాను .
बा बा व ॉ स अभी पर भा री हैं . हमें उसे अप मा नि त नहीं करना चाहिए .	ఇపపుడు బా బా వా స మన నా య కు డు . అతనికి కో పం తె పప ి ంచ కపోతే మన కి మంచిది .
लेकिन अब तुम मुझसे बात नहीं करते .	కానీ ఇపపుడు నువవు నాతో మాటలాడ టం లేదు .
ओह , मेरे बच चों , जन म दिन मु बार क हो .	ఓహ , పెదద యి పోయా రు , జ నమ ది న శు భా కా ం కష లు .
मैंने अभी बा बा व ॉ स को चु डै ल का नाम पु कार ते सुना .	బా బా వా స , ఆ మా ంత రి కు ని పేరు ప ల క డం నేను ఇ పపుడే వి ననాను .
लेकिन सू र या सत होने की जगह के गा ँ व बि ख रे हुए हैं .	కానీ స ూర యా సత మ య పరా ంత పు గరా మ ాల ననీ చె లలా చె దు రు గా ఉననాయి .
ले डी जी .	జీ నా య కీ .
अपने झूठ पर सा ंस अ ट क गई .	నీ అబ దధ ాల తో నే ఊ పి రా డ క చా వు .
वापस आओ और मुझे शक ति , तुमहारी शक ति लिए बच चों को दे दो .	వచచి శ కతి గల , నీ శ కతి గల పిలల లని నాకు పర సా ది ంచు .
" कौन सा सच ? " उनहोंने उससे पूछ ा .	" ఏ నిజం ? " అని వాళళు అత డిని అడి గా రు .
और वे शे र और भा लू का भ ो जन बन गए ,	వారు సి ం హ ాల కి , ఎ లు గు లకు ఆ హా ర మ వు తారు ,
य हां नि र देश दि ए हैं जो तुमहें यह सुन ने में मदद करेंगे कि कि ता ब ें कया कह रही हैं .	ఇది గో ండి . ఈ పు సత కాల లో ఉనన ది అరథం చేసుకో వడానికి ఈ సూ చ నలు మీకు సా య పడ తా యి .
अब बो लो ताकि तुम अपनी जान भी न ग ं वा दो .	మీ పరా ణ ల యి నా మీకు ద కక ాల ంటే త కష ణ మే మాటలాడ ండి .
दे व ता अब केवल दो स वर ों के साथ गा ते हैं .	ఇపపుడు దే వ తలు రెండ ే స వర ాల తో గా నం చేసతుననా రు .
हमारे बीच कुछ नहीं आए गा , पै रिस , तुम भी नहीं .	మా మ ధ యన ఏ దీ రాల ేదు , ప యా రి స , నువవు కూడా .
और हम तुमहारा भ ु ग ता न कैसे करें ?	అయితే నీకు మేము ఏమి చె లలి ంచుకో వాలి ?
कौन जानता है कि यह कि से मिले गा ?	అద ె వ రికి దొ రు కు తు ందో ఎవ రికి తెలుసు ?
हमें लगता है कि वे कि ता ब ें हैं .	వాటి ని పు సత కాల ే అని మే మను కుంటుననా ం .
मैं चाहता ह ूं कि तुम याद रख ो , मैं य हां का कान ून ह ूं .	ఇకకడ చ టట ం నేనే నని నీకు గురతు చేయ ాలను కుంటుననా ను .
मुझे लगता है कि मेरे बचचे सुरकष ित हैं .	నా పిలల లని క ంటి కి రె పప లా చూ సు కు ంటు నన వ నన మాట .
य दि बॉ कस में कि ता ब ें उनहें गा ँ व छोड ने के लिए कह ती हैं	ఒక వే ళ ఆ పెటట ె లో ఉనన పు సత క ాలు వారి ని ఈ గరా మ ం వి డి చి వెళళ మ ంటే ,
किस तरह की बातें ?	ఎలా ంటి విషయ ాలు ?
धयान से देखो . . .	వీ కషి ంచండి . . .
एक बार की बात है ,	అన గ నా గా ఒక సారి ,
- उसका नाम जे र ला म रे ल है . - नहीं .	- అతని పేరు జె ర లా మ రె ల . - లేదు , లేదు .
और यह , मेरे प वि तर भगवान सक , एक जा ल सा जी है .	మరి ఇది , ప వి తర సా క పర భు వు , ఓ న కి లీ ది .
मैं जु ड वा बच चों के लिए एक उप हार ला ई ह ूं . . .	మన క వలల పు టటి న రోజు రే పు కాబటటి , వారు ప ంచుకో గల . . .
यह दर ज नों अलग - अलग घ ा टि यों से हो कर नीचे की ओर ब हे गा .	ఇది ఒక డజ ను వే ర వే రు లో య ల ద వా రా లో త టటు పరా ంతా నికి వెళళ గల దు .
लेकिन मैं ऐसा दिन में दो बार कर ूं गा .	కానీ నేను ఇలా రోజు కి రెండు సా రలు చేసతాను .
किस लिए ?	దే నికి ?
अफ सो स के साथ , पु रा ने दोसत ों . . .	వి చా ర ంతో , పా త మి తరు లా రా . . .
ध व नि , और स पर श .	శ బ ద ం మరియు స పర శ .
जे र ला म रे ल . . . शा ं ति से घर आओ . . .	జె ర లా మ రె ల . . . ఇంటికి కష ే మ ంగా వచచి . . .
