और तुम फु ल - टा इ म हो ?	ఇది మీ ఫ ు ల టె మ ప నా ?
रि टा यर हो गए ?	రి టె ర అయ యా రా ?
तो फिर , चलो . हमें इंतजार मत करवा ओ .	చెపప ండి . అలా స స పె నస లో పె డి తే ఎలా ?
उसके पास लग भ ग 8 0 पा उ ंड थे .	సు మా రు గా 8 0 ప ౌ ండ లు ఉననాయి .
जन व री .	జ న వరి .
पुलिस .	పోలీ స .
नहीं .	లేదు .
तुमहें अपनी बू ढ ी माँ पर थोडी द या दिखा नी चाहिए .	మీ ము స లి తల లి మీద కా సత జ ాలి చూపి ంచు , అది చ ాలు .
द वार फ ग री न गर ो स री ज लि मि टे ड के नाम प ं ज ीक ृ त	రి జి సటర అయి న ఓ న ర : వార ఫ గర ీ న గరా సర స లి మి టె డ
जू न . तुमहारे लिए चा य .	జ ూ న . ఇది గో ఈ టీ నీ కే .
सम ीक ष क ने उसकी जानकारी दी .	దానని రి వయ ూ వర ఫ లా గ చేశారు .
मैं कया मदद कर सकती हूँ ?	మీకు ఏ వి ధ ంగా సా య పడ గలను ?
फ लू .	సరే .
क ॉलर ?	మే డ మ ?
पूछ ने के लिए सं पर क किया है .	దాని గురి ంచే మీకు కాల చేశా .
फ लू ?	ఫ లూ ?
जै स मिन ,	జా స మి న ,
अरे .	అ దా !
नै शन ल डे टा बे स	జా తీ య డే టా బ ే స
जा ँच के लिए नाम मो हम म द खा न	వె తు కు తునన పేరు మొ హ మమ ద ఖ ా న
रे म ंड सट ु अ रट	రే మ ండ సట ు వర ట
एक आदमी को 2 0 1 2 में स जा हुई थी	ఒక వయకతి కి 2 0 1 2 లో శి కష పడి ంది .
पर इस क ॉलर ने कहा कि दरअसल वह हतया उसके बॉ य फर ें ड ने की थी .	కానీ ఈ కాల చేసిన వయకతి , ఆ హ తయ చేసి ంది తన ల వర అని చెప తోంది .
तुमहारे पास इस क ॉलर का नाम है ?	ఆ కాల చేసిన వయకతి పేరు తెలుసా ?
जानता हूँ . जरूर .	వి ననాను . తెలుసు .
तो . . . दरअसल . . .	మరి . . . అంటే . . .
- जिस आदमी पर आ रो प लगा ? - ए र ॉल मै थि स .	- ఎవ రికి శి కష పడి ంది ? - ఎ ర ర ొ ల మయా థ ి స .
और तुमहारे पास इस बारे में उसका ब यान है ?	మరి ఆమె నుండి మీరు వా ంగ మూ ల ం తీసు కుననా రా ?
वै ल री .	వాల రీ .
उसके पास पर या पत वि वर ण थे जिस से शक की कोई गु ं जा ई श नहीं ब ची .	ఆమె చెపపి న వి వర ాలను బటటి చూ సతే , మన కి ఒక అవ గా హ న వచచే సతుంది .
चा कू .	క తతి .
जो भी तुमने बताया , यह जानकारी पहले से ही उप लब ध है .	మీరు ఇపపుడు చెపపి న దంతా , అంద రికీ అందు బా టు లోనే ఉంది .
उसकी टी म ?	అతని టీ మ ?
पै ट रिक , छ ह वर ष ी य .	పా ట రిక కి ఆ రే ళలు .
" ओ . जे की तरह ? " वाह . इसका कया मतलब है ?	చినన సె జు పి సతా నా ? వా వ . అంటే ఏంటి అసలు ?
कभी - कभी , मुझे सच में ऐसा लगता है कि ,	అ పపుడ పపుడ ూ నాకు ఏ మని పి సతూ ఉ ంటు ంద ంటే ,
- क लो ई ? - हाँ ?	- క లో యి ? - హా .
हाँ .	సరే .
हम तुमहारे स ह यो ग की स रा ह ना करते हैं , डी ए स लें कर .	మీ స హ కా రా నికి ధనయవాదాలు , డి టె క టి వ సా ర జె ంట లె ం కర .
यह उनकी जिंदगी की सबसे मह त व पू रण ल डा ई है .	దీని కోసం ఇంకా ఆమె ఊ పి రి తో ఉ ందని అన వచచు .
अपने खुद के ड ें ट ल वि शे ष ज ञ दवा रा ए डा ले इ ड बर ौ ज के नि शा नों की जा ँच कर वाई और . . .	అడి లె డ బ రో స మీద ఉండే ప ంటి గా ట లని పరి శ ీ లి ంచ మని ఒక డె ంట ల ని పు ణ ు డిని కో రా ను . . .
- का सट 2 6 ए से मे ल खा ते हैं . " - का सट 2 6 ए से मे ल खा ते हैं .	- క యా సట 2 6 ఏ వే అని చెపప లే ము . " - క యా సట 2 6 ఏ వే అని చెపప లే ము .
है गर टी ?	హె గర టీ ?
है गर टी उनका मु ख िया था ?	వాళల కి హె గర టీ నా య కు డా ?
ठीक है , बो लो .	ఇపపుడు చెపపు .
पै ट रिक बर ौ ज .	పా ట రిక బ రో స .
पै ट रिक बर ौ ज .	పా ట రిక బ రో స .
शायद उसने डर ग स बे च ना छोड दिया ? बेहतर रा सता चु ना ?	బహుశా డ రగ స ద ందా వ దద ను కొ ని మంచి గా బ తు కు తుననా డే మో ?
हाँ , किसी को तो चिंता करनी होगी .	హా , ఎవరో క రు కంగా రు పడ ాలి కదా మరి .
- हाँ , तुम . जल द मिल ेंगे , ठीक है ? - मेरे लिए थो डे चि पस ले आ ना .	- నమ సతే , గు రూ . వచచే సత ాల ే , సరేనా ? - కొనని చి ప స తీసుకు రా , గు రూ .
पै ट रिक ?	పా ట రిక ?
समय है , 2 5 सि त ंबर 2 0 1 1 के 00 : 1 3 ब जे .	సమయం 00 : 1 3 , తే దీ 2 5 , సె ప టె ం బర , 2 0 1 1 .
कहाँ ?	ఎకకడ ?
ग ले में .	గొ ం తు లో .
सी ने में ?	ఛ ా తి లో నా ?
कया बात है ?	ఏంటి సంగ తి ?
देखो , टो नी . . .	చూడు , టో నీ . . .
हमें अपने इस म हा न श हर के म ूल यों के यो ग य आ ध ु निक पुलिस से वा की जरूरत है .	మన న గ రం ఎంత గొపప దో , ఆ గొపప త నా నికి త గ గ ఆ ధ ు నిక పోలీసు వయ వ సథ మన కి ఉండాలి .
कोई क ॉलर आई डी नहीं	కాల ర ఐ డీ లేని నం బర
जै स मिन .	జా స మి న .
ठीक है . जै स मिन , तुम मुझे क ॉल से जो ड सकती हो ? कर सकती हो ?	సరే . జా స మి న , కాల లో ననను కూడా చే రచ గల రా ? అలా కు దు రు తు ందా ?
वह दरवा जा तो ड कर अंदर आए गा .	అతను ఆ తలు పు గు ండా వ సతా డు .
नहीं !	అయ యో !
म रि या !	మరి యా !
म रि या .	మరి యా .
मैं अभी ऊपर जा रही हूँ .	ఇపపుడు పె కి వెళ తుననాను .
मुझे बताया गया है कि परति वा दी अपना पिछ ला ब यान बदल ना चाहता है .	పరతి వా ది , గ తం లో తాను చెపపి న వా ంగ మూ లా నని మా రచ ాలని భా వి సతుననారు .
मैं बस कह रहा हूँ . कि किसी आदमी ने कोई बे तु की टि प प ण ी की ,	మా మూ లు గా అ ంటుననా న ంత ే . అంటే , ఒక డే దో పిచచి కూ తలు కూ శా డని ,
पकका उनहें लगा होगा कि कोई उससे मिलने जरूर आए गा , है न ?	ఎవరో క రు వచచి వి డి పి సతారు లే అని అను కొ ని ఉంటా రు ఆ దొ ంగ లు .
कया वे गवा हों के ब यान हैं जो है क नी डा उन स भे जे जाने हैं ?	అవి హ యా క నీ డ ౌ నస సట ే షన లో ఇవ వాల సిన సా కష ు ల వా ంగ మూ ల ాల ే నా ?
और हाँ , अगर इसका मतलब है कि हमें सं पू रण बद ला व करना होगा	దానికి కి ంది సథా యి నుండి పూరతి గా మార పు లు చేయ వల సి వ సతే ,
- हैलो ? - क लो ई , मेरे लिए पी ए न डी में कुछ ढूँढ सकती हो ?	- హలో ? - క లో యి , పోలీ స డే టా బ ే సు లో ఒక దాని కోసం వె త క గల వా ?
अगर कोई जानकारी है जो तुमने इतने साल ों से छु पा रख ी है .	ఇ న నే ళళ ూ నువవు నాకు చెపప కుండా ఏమెనా దా చి ఉంటే , చెపపే య .
- हाँ . माफ करना , मैं . . . - मैं उस ी तरफ जा रही हूँ .	- అవును . సా రీ , నేను . . . - నేను అ టు వె పే వెళ తుననాను .
- डै न है गर टी ? - हाँ . पी डि त का नाम था , ए डा ले इ ड बर ौ ज .	- డా న హె గర టీ ? - అవును . హ తయ కు గు రె ంది , అడి లె డ బ రో స .
- अ परा धी हमेशा ही जवा न होते हैं . - बिलकुल सही कहा .	- నే ర సథ ు లలో కు ర రో ళ లే ఎకకువ గా ఉంటా రు . - అది నిజ మే .
यह बेहतर है , है न ? इस तरह तुम मु सी ब त में नहीं . . .	అది మే లు కదా , ఏమ ంటా వు ? ఆ వి ధ ంగా , నినను నువవు . . .
मैं कया मदद कर सकता हूँ ? कया मैं उससे मिला हूँ ?	నేను ఏ వి ధ ంగా సా య పడ గలను ? అతను నా కే మెనా తెలుసా ?
क ंट रो ल पु ष टि कर रहा है . सभी यू नि ट , तैयार र हें .	క ంట రో ల నిర ధా రి సతోంది . బ ృ ంద ాల ననీ సిదధ ంగా ఉండ ండి .
ए डा ले इ ड के बे टे का कया ? उसका नाम पै ट रिक है न ?	మరి అడి లె డ కొ డు కు సంగ తే ంటి ? అతని పేరు పా ట రి కా ?
याद नहीं है , समझ ा नहीं सकता . हाँ , जानती हूँ .	గురతు లేదు , చెపప లేను అని అననా డు . హా , తెలుసు లే .
तुमने उसे इतनी कर ूर ता से कयों मा रा ? कोई कारण ?	ఎందుకు ఆమె ని అంత క సి గా పొ డి చా రు ? ఎందు క ంటా రు ?
कया कोई खि ड की है जिस से तुम सुरकष ित निकल स को ?	అంటే , మీరు దూ రి వెళల గల కి టి కీ లాంటి ది అనన మాట .
मुझे लगता है कि वह बस अपना काम कर रही थी .	తన ప నే దో తను చూ సు కు ంట ూ ఉ ండి ంది అనుకుంటా .
ऑ फि स से बाहर निकल ने का मौ का मिल जाता है .	దీని వలల అయి నా ఆ ఫీ సు నుండి బయటకు రా వచచ ని .
खैर , चो र घु स आए और उनहोंने फ लै ट को लू टा .	ఇక కొ ంద రు దొ ంగ లు వచచి ఇంటి ని దో చు కుననా రు .
हाँ , मैं सारे चु ट कु ले सुन चुका हूँ , सर .	హా , ఆ జో కు వి నీ వి నీ వి సు గొ చ చేసి ంది , సర .
मैं जा ँच कर रही हूँ , जो कि शु रु आत में घ रे लू हि ं सा सं बं धी एक फोन क ॉल था ,	నేను ఒక ఫోన కాల కి సంబం ధి ంచి గ ృ హ హి ం స కేసు పె దర యా ప తు చే సతూ ఉననాను అనన మాట ,
वह अपनी कोई जानकारी नहीं दे रही है . और जो र दे रही है कि उसे पुलिस चाहिए .	తను నాకు వి వర ాల ే వీ చెపప ట లేదు . ప దే ప దే పోలీసు ల కి క నె క ట చేయ మని చెప తోంది .
ठीक है , मैं यह फा इ ल में डाल द ूँगी .	సరే . నేను ఫె ల లో దానని నో ట చేసతాను .
मैं तुमहें शर मि ंदा नहीं करना चाहता .	మిమమలని చినన బు చచ డం నా ఉదదేశం కాదు .
- तुम अपना फोन भूल गई थी . - धनयवाद .	- నువవు ఫోన మర చి పోయా వు . - థ యా ంక యూ .
- जहाँ हो व हीं रुको , समझ ी ? - हाँ .	- మీరు అకకడ ే ఉండ ండి , సరేనా ? - సరే .
कया वह मजाक था ? नहीं , बिलकुल नहीं .	అది బ ూ ట క పు కాల అంటా రా ? కా నే కాదు .
मैं समझ ता हूँ . सच में . मैं बस . . .	నిజంగా నే అరథ మెంది . నా ఉదదేశం . . .
म रि या , कया तुमहारी जान को खत रा है ?	మరి యా . ఇపపుడు మీకు పరా ణ హా ని ఉందా ?
रुको , मुझे तुमहें बता ना होगा . . .	ఒకక నిమిష ం , నే న ొక టి చెపప ాలి . . .
उसे ह थ िया र के बारे में भी पता था .	దే ని తో చం పా డో కూడా ఆమె కి తెలుసు .
खैर , अपना समय देने के लिए धनयवाद .	ఇంత సమయం వె చచి ంచిన ందుకు థ యా ంక యూ .
उसका नाम म रि या डी सू जा है . रुको .	తన పేరు మరి యా డి స ౌ జా . ఒకక నిమిష ం .
आज कल सब समझ दा री से करना पडता है .	ఈ రోజు లలో అది చాలా తెలి వెన పని .
- मैं यह कर ल ूँगा , समझ ी ? - हाँ .	- నేను వే సుకో గలను , సరేనా ? - సరే .
नहीं , बिलकुल नहीं . सच कहूँ तो , शायद वह बस बेहद ड री हुई थी .	లేదు , అస స లు లేదు . నిజ ానికి , ఆమె అ పపటి కే బాగా భయ పడి పోయి ఉంది .
- बेहतर होगा . - बढिया . कयोंकि मैंने ए स आई ओ का पता लगा लिया .	- మ రీ మంచిది . - సూ పర . నేను ఆ సీ నియ ర వి చా రణ ా ధి కా రి ఎవరో చూశా .
- सच में ? - ई - मे ल बेहतर होगा .	- నిజంగా ? - ఈ మె యి ల అయితే మే లు .
के स की सुन वाई 2 0 1 2 में हुई थी .	కేసు 2 0 1 2 లో వి చా రణ కు వచచింది .
आ पा त का ली न फोन क ॉल , जो कल रात को हे ज ले न कष े तर से आया था .	ని నన రాతరి హ య ీ స లే న నుండి వచచి న అత య వ సర ఫోన కాల అనన మాట అది .
तुमने उसे ग ले में चा कू घ ों पा ?	క తతి తో ఆమె గొ ం తు లో పొ డి చా రా ?
यह सा र वज निक त ौर पर उप लब ध है .	అంతా ప బ లి క డ ొ మెన లోనే ఉంది .
डै नि एल . उसका नाम डै नि एल है .	డ యా నియ ల . ఆయన పేరు డ యా నియ ల .
और पी डि त की जान को खत रा है .	పరా ణ ానికి ము పపు కూడా ఉంది .
मजाक . मैं मजाक कर रहा हूँ .	అది జో క . ఉ తతి నే జో క చేశా .
- वे पहुँ चे नहीं ? - नहीं .	- ఇంకా చే రు కో లేదా ? - లేదు .
- हमें पकका यकीन नहीं है , पर हमें लगता है . . . - हाँ , पै टर न वाली हु डी और जी न स .	- మాకు ఖచచితంగా తెలీదు , కానీ మా అభి పరా యం పర కా రం . . . - హా , చా ర ల హు డీ , జీ నస .
चलो , अपनी जै के ट पह नो , चलो .	ఇక జా కె ట వే సుకో , కా నివ వు .
- पकका ? मुझे कोई तक ली फ नहीं होगी . - हाँ , बिलकुल .	- అంతే అంటా రా ? మా కే ం ఇ బబంది లేదు . - హా , వదదు లె ండి .
- तुमहें बेहद मजा आ रहा है , है न ? - दरअसल , हाँ .	- నీకు బాగా ఆన ంద ంగా ఉంది కదా ? - అవును , అది నిజ మే .
हतया की जि म मे दा री ली है .	ఆ హ తయ చేసి ంది అత నే అని .
मुझे माफ कर दो . मैं . . .	మన ని ంచాలి . మిమమలని . . .
तुमने यह करना कैसे सी खा ?	టె క టట డం నీ కె లా తెలుసు ?
करि समस के पे ड पर छो टी ला इट ें व ग ै रह जल रही थीं .	కరి సమ స చె టటు మీద లెట స స నన గా వె లు గు తూ ఉననాయి .
अग सत 2 0 1 7 , जु ब ली पार क .	ఆ గ సట 2 0 1 7 , జ ూ బి లీ పార క .
- च ली जा इए . - बात बस यह है कि वह इतना उ दा स है .	- వెళలి పో . - కానీ అతను చాలా బాధ పడి పో తుననా డు .
- अचछा ? - बेवकूफ , हम सक ूल में टा ई पह न ते थे .	- అవునా ? - స కూ ల లో ఉనన పపుడు టె వే సు కొ నే వాళల ం .
मैं जानता हूँ , ठीक है ?	నాకు అరథ మెంది , సరేనా ?
कोई बात नहीं . अ ल वि दा .	మ రే ం పర వాలేదు లే . ఉంటా .
मैं बेहद गु स से में था .	హా , వి చ కష ణ కో ల పోయా ను .
हाँ , दरअसल उसने कहा , " मैं पड ो स में ही थी . "	హా , " నేను ఈ పరి సర ాల లోనే ఉననా , " అని అ ంది .
नहीं , मुझे . . . नहीं .	అంటే నాకు . . . లేదు .
तुम बहुत हो श िया र हो .	చాలా తెలి వెన దాని వ బ బా .
नहीं . उसने मुझे ध म की दी . मुझे चो ट पहुँ चा ई .	లేదు . అతను బె ది రి ంచా డు . ననను గా య పరి చా డు .
- व हीं ए डा ले इ ड की हतया हुई थी . - तो , देखो .	- అడి లె డ హ యత కు గు రె ంది అకకడ ే . - అ దీ మరి .
ठीक है , यह बढिया है .	సరే , బాగా చెప తుననారు .
बेवकूफ कमी नी कहीं की !	ఒ సే య ప నికి మ ాలి న దా నా !
आ रो प लगा ए गए हैं . यह रहा लि ंक . आगे बढ ो .	ఆ రో ప ణ వచచింది . ఇ దీ విషయం అని మొతత ం చెపపు .
हाँ . ठीक है . बो लिए .	హా . సరే , సరే . చెపపు .
कया वह तुमहें मिली ?	ఆమె ని కను గొ న గ లి గా రా ?
- कृपया एक चा य देना . धनयवाद . - बेशक , सर .	- ఒక క పపు టీ . థ యా ంక యూ . - తపప కుండా , సర .
तुमहें कया लगता है ?	మీ రే ం అనుకుంటుననా రు ?
मैंने उसे घ ों प दिया .	దాని తో త నని పొ డి చా .
कल रात के क मा ंड ए ंड क ंट रो ल लॉ ग में एक आ पा त का ली न फोन आया था ,	ని నన రాతరి క మా ండ అ ండ క ంట రో ల లా గ లో ఒక ఎ మర జె నస ీ కాల ఉంది ,
उसने बताया कि उसके बॉ य फर ें ड ने कई बार	ఒక ల వర ఉననాడు . అతను చాలా సా రలు చెపపా డ ట .
हाँ . जो शायद , कभी बरा म द नहीं हुआ . . .	అవును . అది మన కి అస స లు దొ రక లేదు కదా . . .
तुमहें सुन वाई के बारे में कितना पता है ?	వి చా రణ గురించి మీకు ఎంత మా తరం తెలుసు ?
ए ं डी , मेरे साथ है क नी के एक क ॉल बॉ कस से एक क ॉलर ला इन पर है .	ఆ ండ ీ , ఒ కా వి డ హ యా క నీ లో ఉండే కా యి న బా కస నుండి కాల చేశారు .
जिस ने गवा ही दी कि वे नि शान ए र ॉल के दा ँ त ों से मे ल खा ते हैं .	ఆ ప ంటి గా టలు ఎ ర ర ొ ల ప ళల వే అని ఆయన బ లల గు ద ది మ రీ చెపపా డు .
