Hindi	Telugu	Similarity_Score
ऐसा नहीं कहा जा सकता .	అది మనం చెపప లే ము .	0.4872
- यह कया हो रहा है . - पक डे रहना . थोडा सा और .	- కా నివ వు . - పటటు కో . ఇంకా కొ ద ది గా .	0.6243
जलदी ! जलदी ! जलदी !	క దల ండి ! పద ండి ! పద ండి !	0.3525
आगे बढ रहे हैं . कोई मेरे पीछे . . .	ము ందుకు వెళ తుననాం . ఎవరెనా ననను కా య ండి . . .	0.5824
शे यर की की मत की हर गिर ती पे नी के साथ , हम एक करो ड 8 0 ला ख क मा रहे हैं .	దాని ష ే రు ధ రలు పరతి పె ననీ త గ గు తు ంటే , మన కి మర ొక కో టి ఎ న భ ె లకష ల ప ౌ ండ లు లా భ ం వ సతుంది .	0.6654
- यह पर धा न म ंत री का फै सला है . - नहीं , वह सला ह पर काम करती हैं .	- పర ధా నమ ంత రి నిరణ యి సతారు . - లేదు , మనం ఇ చ చే స ల హా మీద ఆమె చ రయ తీసుకు ంటుంది .	0.6553
हमारे सामने एक दूस री मु सी ब त है . एक कहीं जयादा बडी मु सी ब त .	మన కి ఇం కొ క సమసయ త లె తతి ంది . అది ఇంకా పెదద సమసయ .	0.6014
मुझे म हा म हि म की सर कार दवा रा , आपके जवाब ना देने की द शा में	మీరు వెంట నే సప ంది ంచ కపోతే క ఠ ి న చ రయ లు తీసుకో మ ంట ూ	0.6108
- हाँ . ठीक हूँ शायद . - हाँ ?	- అవును . అదే అనుకుంటా . - అవునా ?	0.5027
सै म , कया तुम मुझे सुन सकते हो , पलीज ?	సా మ , నా మాట వి ంటుననా వా , పలీజ ?	0.6083
- बु झ रही है . कम बस टर में आ ग बु झ रही है . - यह . . . इसका कहना है कम बस टर में आ ग बु झ रही है .	- అయి పో వచచింది . అది అయి పో వచచింది . - అది . . . అయి పో వచచి ందని ఆమె అ ంట ో ంది .	0.5745
हम इस विमान को नीचे उ तार ना चाहते हैं .	మేము ఈ విమా నా నని ల యా ండ చేయ ాలని అనుకుంటుననా ం .	0.5156
आ जाओ , सै म . अगर मैं मर ूँगा , तो तुम भी मेरे साथ म रो गे .	ఇలా చూడు , సా మ , నేను కి ంది కి వెళ ి తే , నువవు కూడా నాతో పాటు ది గు తా వు .	0.6111
मतलब कि ंग डम 2 - 9 के चार ों तरफ 2 5 मी ल का एक वि शि ष ट घ े रा बना ना ,	కి ంగ డ మ 2 - 9 చు టట ూ దా దా పు న ల భ ె కి లో మీ టర ల పరి ధి ని పర త యే క జో న గా పరి గ ణి ంచాలి ,	0.6632
उसने कहा वह मुझे वापस फोन करे गा .	అతను నాకు మళలీ ఫోన చేసతాను అననా డు .	0.5377
कया ?	ఏంటి ?	0.3091
कया ?	ఏంటి ?	0.3091
कया ?	ఏంటి ?	0.3091
दु र घट ना ?	నే ల కూ ల డ మా ?	0.5351
कया तुम ठीक हो , का ई ?	నువవు బాగానే ఉననా వా , ఖ ా య ?	0.4731
तुम . . .	నువవు . . .	0.5798
मैं ही हूँ जिस ने यह सौ दा करवा या है .	ఆ ఒ పప ందా నని కు ది ర చి ంది నేనే .	0.5666
कया ?	ఏంటి ?	0.3091
हैलो ?	హలో ?	0.3091
जिस से वे अपने इ रा दे बदल द ें .	వాళల మన సు లు మా రచ డానికి పరయతని సతాను .	0.5297
वे एक मै से ज भेज ेंगे .	వాళలు ఒక మె సే జ పం పి సతారు .	0.5220
- ऊँ चा ई में ते ज गि रा व ट . - ठीक है , सै म . लेकिन सिरफ तुम . ठीक है ?	- వే గ ంగా ది గు తోంది . - సరే . సరే . సా మ . కానీ కేవలం నువవు మాతరమే రా వాలి . సరేనా ?	0.6488
मैंने कहा नीचे ले टो !	నే ల మీద కి ఒ రుగు !	0.5008
कया तुम मुझे सुन सकते हो ?	నా మాట వి ని పి స తో ందా ?	0.5376
नहीं . जरा सुनो . मेरी बात सुनो .	లేదు . ఎ కస క యూ జ మీ . వి ను .	0.6086
मु ड रहा है . विमान को ऊपर करें .	ఒ రుగు తోంది . పె కి ఎ గర ాలి .	0.6077
ली वर को ऊपर उठा ओ और उसे कल ॉ क वा इ ज दि शा में पूरा घ ुम ा दो .	ఆ లి వర ని పె కి లే పి , దానని స వయ ది శ లో తి పప ాలి .	0.5498
कस के पक ड कर रख ो कयोंकि मैं विमान को बा एँ मो ड ने वाली हूँ , ठीक है ?	నువవు గ టటి గా పటటు కు ని కూ రచ ో ఎందుకంటే నేను ఎడ మ వెపు ఒ రి గే లా చేసతుననా ను , సరేనా ?	0.6222
तुमहें वही करना होगा जो वे क हें गे , नहीं तो वे ऐ ल डी को मार देंगे .	వాళలు నీకు ఏం చెపపా రో , సరి గగా అదే చేయి , లే ద ంటే వాళలు ఎ లో డీ ని చం పే సతారు .	0.6171
मैं ए लिस सि ंक ले यर बोल रही हूँ . मेरी बात किस से हो रही है , पलीज ?	నా పేరు ఆ లి స సి ంక లె యి ర . నేను ఎవరి తో మాటలాడు తుననాను ?	0.6108
मुझे लू इस को अस पता ल ले जाना है , याद है ?	నేను లూ యి స ని హా స పి టల కి తీసుకు వెళల ాలి , గురతు ందా ?	0.6090
फिर इसकी खबर मी ड िया को ली क कर दे ते हैं .	ఆ విష యానని మీ డి యా కి లీ క చేశారు .	0.5131
नहीं तो तुम र न वे तक नहीं पहुँच ो गे .	లేదా ఆ ర న వే మీద ది గ డం కష టం .	0.5944
घर पर किसी ने फोन किया था ? कोई अजीब फोन या कुछ और ?	ఇంటికి ఎవరెనా కాల చేశా రా ? ఏమెనా వి చి తర మెన ఫోన లు లేదా ఏదెనా సరే ?	0.4863
यह ऐ ल डी के बारे में है .	అది ఎ లో డీ కి సంబం ధి ంచిన విషయం .	0.5501
सा र वज निक रूप से पु ष टि करने की संभा वना नहीं है ,	బ హి రం గ ంగా ఏ విష యానని ఖ రా రు చేయ కపో వచచు ,	0.6441
चु ना व बहुत सी धा है .	మన నిరణ యం ఇపపుడు సి ంపు ల .	0.5333
उनहें पता चल जाएगा कि हम नहीं जानते विमान कौन उडा रहा है .	మన విమా నా నని ఎవరు న డు పు తుననా రో మన కి తెలియ ద నన విషయం కింద తెలి సి పో తుంది .	0.5165
उसका नाम अ मैं डा है .	ఆమె పేరు అమ ండా .	0.4645
- सट ै ं सट े ड अभी से तैयार है . - और ब रि सट ल ?	- సటా న సట ె డ ఇ పపటి కే సిదధ ంగా ఉంది . - మరి బ రి సట ల ?	0.6737
कयोंकि इसका कोई आ परा धि क इ ति हा स नहीं है . अगर यह पक डा जाता , तो काम किसी और को दे दिया जाता .	ఎందుకంటే అతనికి నే రచ రి తర లేదు . ఇ తను పటటు బడి తే , మనం ఇ త డిని అను మా ని ంచ ము .	0.6193
पिछ ली बार जो लोग यहाँ रहे थे , उनहोंने एक हा उस पार टी की थी .	చి వరి గా అ దద ె కు ఉనన వాళలు ఏదో హ ౌ స పార టీ చేసు కుననా రు .	0.6385
वि त ती य रूप से ?	ఆ రథ ి కంగా నా ?	0.4772
अब हमारे समझ ौ ते से मु करो मत .	ననను తే లి క గా తీసుకో కు .	0.5378
मैं मु ख य अप हर ण करता ओं में से एक के बिलकुल सामने बैठ ा हूँ ,	నేను హె జా కర ల నా య కు డి ఎదు రు గా కూ రచు ని ఉననాను ,	0.6065
इसमें ओ सी जी का सबसे जयादा फा य दा कब होगा ?	దీని వలల వయ వ సథ ీ క ృ త నే ర గా ళల ము ఠ ా కి వచచే లా భ ం ఏంటి ?	0.5511
ऐसी कोई संभा वना नहीं कि यह जान बू झ कर ना किया गया हो .	అది పూరతి గా కా వాలని చే సతునన ది కా కపో వచచు .	0.4966
हा ला त जि तने ख रा ब होंगे , वे उ तने जयादा पैसे क मा एँगे .	ఆ విమా నా నికి ఎంత న ష టం జరిగి తే , వాళల కి అంత లా భ ం .	0.6385
जब विमान ज मी न को छु ए गा ,	మనం నే లని తా క గానే ,	0.4815
- बंद ूक नीचे . जो मैं कह ता हूँ , करो . - उसे छोड दो . पीछे ह टो !	- తు పా కీ కింద పడ ే యి . నేను చెపపి ంది చేయి . - అత డిని వదిలే య . వెన కకి వెళ లు !	0.6510
समझ गए ?	అరథ మె ందా ?	0.3659
तुम दरवा जा खो लो गी ?	తలు పు తీ సతా వా ?	0.4811
बिलकुल .	ఖచచితంగా .	0.4046
मेरे सामने वाली . 1 3 ए .	నాకు ఎదు రు గా కూ రచు ంది . 1 3 ఎ .	0.5483
दोसत ों , जरा इसे देखो .	మి తరు లా రా , మీరు ఇది చూడ ాలి .	0.5208
मेरे पास कुछ नहीं है !	నేను వాటి ని వే సుకో వడం లేదు !	0.4793
मुझे नहीं पता वह कया कह रही है .	ఆమె ఏం మాటలాడు తో ందో నాకు తెలియ డం లేదు .	0.4742
- कौन बोल रहा है ? माफ करना , यह कौन है ? - मैं नी ल वॉल श बोल रहा हूँ , ग ृ ह सच ि व .	- అది ఎవరు ? సా రీ , అది ఎవరు ? - నేను నీ ల వాల ష . హో మ సె కర ట రీ ని .	0.6546
- पीछे ह टो अभी ! पीछे ह टो ! - आ राम से , आ राम से .	- వెన కకి వెళల ండి వెంట నే ! వెన కకి వెళల ండి ! - ని దా నం , ని దా నం .	0.5588
नहीं . पलीज . मैं ठीक हूँ .	వదదు . పలీజ . నేను బాగానే ఉననాను .	0.4557
अपने हाथ मेरे सामने रख ो !	చే తులు నాకు కనిపి ంచే లా పె కె తతు !	0.4867
चलो , दरवा जा खो लो .	కా నివ వు , తలు పు తె రు వు .	0.5170
- शा बा श . - टा र गे ट सुरकष ित है .	- మంచి కు ర రా డి వి . - లకష యం సు ర కషి తం .	0.6584
कि ंग डम ए यर ला इं स के खुद के सट ॉ क , बेशक ,	కి ంగ డ మ ఎ యి ర లె నస న షట పో తు ండ గా , అను బం ధ సటా క ధ రలు	0.6644
कया आप हमें कुछ बता सकते हैं कि . . .	పరిసథి తి ఎలా ఉండ బో తు ందో మీరు మాకు చెపప గల రా . . .	0.5726
जो और त विमान उडा रही है , वह फर सट ऑ फि सर नहीं है .	ఆ విమానం న డు పు తునన ది ఫ సట ఆ ఫీ సర కా ద ట .	0.6361
हाँ . हा य , बचचे . हाँ , सब ठीक है . मैं घर आ रही हूँ .	అవును . హాయ , బంగా రం . అవును , మ రే ం ఫర వాలేదు . నేను ఇంటికి వ సతుననాను .	0.5759
तो तुमहें एक विमान को हा इ जै क करने की जरूरत नहीं है .	ఒక విమా నా నని హె జా క చేయ ాల సిన అవసరం లేదు .	0.5798
एक बहुत बडा शा रट ट रे ड किया गया था .	భా రీ గా షా ర ట ట రే డ జరిగింది .	0.5001
या तो सिरफ मैं जा सकता हूँ या कोई नहीं जा सकता . ठीक है ? वह यही चाहती है .	నేను తపప ఇం కె వ వర ూ ఇ టు రా వదదు . సరేనా ? ఆమె అదే చెబు తోంది .	0.6170
आर ए ए फ न ॉर थो लट उप लब ध है . कुल 6 . 9 स मु द री मी ल की दू री पर .	రా య ల ఎ యి ర ఫో రస నా ర త ఓ ల ట అందు బా టు లో ఉంది . దా దా పు పద మూ డు కి లో మీ టర ల దూ రం లో .	0.6883
कया तुम अंदर आ ना चा हो गे ?	మీరు లోప లి కి వచచి చూ సతా రా ?	0.5403
लेकिन यह उममीद की जा रही है कि सा मान य निय म ों का पा ल न किया जाएगा .	కానీ సా ధా రణ ంగా ఉండే పర ో టో కాల స అన నీ పా టి ంచ ాల సి ఉంటుంది .	0.5525
अगर तुमहारे पास यहाँ र ंग भर ने का कुछ सा मान है तो हाथ ऊपर करो .	మీ దగగర కల రి ంగ సా మ గ రి ఉంటే చే తులు పె కె తత ండి , ఏ హ .	0.6353
सब लोगों के यहाँ होने का कोई मतलब नहीं है .	అందరూ ఇకకడికి రా వడం లో అరథం లేదు .	0.5006
सोच ो . कया तुमहारे आ स पास कोई सं दि ग ध बात हुई है ?	ఆలోచి ంచు . ఏదెనా అను మా నా స పద ంగా ఉందా ?	0.5592
कि ंग डम 2 - 9 , एक बार फिर , कया आप . . .	కి ంగ డ మ 2 - 9 , మళలీ ఒకక సారి , మీరు వి ంటుననా రా . . .	0.6345
- . . . अपनी ठीक ऊँ चा ई . - हमारे पास ई ं धन नहीं है .	- . . . ఖచచితంగా మీ ఆ ల టి ట యూ డ కూడా . - మా విమానం లో ఇం ధ నం లేదు .	0.6936
- इन हें बस यहाँ ले आओ . - मुझे तुमहारे हाथ निकाल ने होंगे .	- ఇ వి అందు కో . - నీ చే తు లతో మాకు పని ఉంది .	0.6027
ट क कर के लिए तैयार रहो !	నే ల పె న ది గ డానికి సిదధ ం క ండి !	0.4920
के बल टा ई से इसके दोनों पै र बा ं ध ो !	అతని కా ళ లని వె ర లతో క టటే య !	0.5893
उनके लिए सबसे अचछा न ती जा ,	వాళల కి దీని వలల ఎంత లా భ ం కలి గి తే ,	0.5036
और अगर तुमहें मै से ज नहीं मिला तो ?	మరి మన కి ఆ మె సే జ రా కపోతే ?	0.5557
मैं यहाँ अके ला हूँ , दोसत .	ఇకకడ నేను ఒ కకడి నే ఉననాను , మి తర మా .	0.4900
शे यर की की मत ों में गि रा व ट के साथ .	ష ే ర ల ధ రలు ప త నం అవు తుననా యి .	0.6340
आने वाली जग हों को ब डे स तर पर	ఆ విమానం వచచే ది శ లో భా రీ గా , అత య వ సర ంగా	0.5684
तब अपने पै र ों से अपनी पूरी ता कत लगा कर	నీ పా ద ాలని ఆ పె డ లస లోకి ఉ ంచి	0.5278
- आगे बढ रहे हैं . - नीचे बैठ ो !	- ము ందుకు వెళ తుననాం . - కింద కూ రచ ో ండి !	0.5424
हमें दरवा जे से हो कर जाना पडे गा .	మనం ఆ తలు పు స ందు లో నుంచి లోప లి కి వెళల ాలి .	0.5395
मैं सिरफ तुमसे इतना चाहता हूँ कि तुम . . .	నేను నినను అడి గే ద లలా ఒకక టే . . .	0.5974
बल कि एक ग ैर - जि म मे दार कि सम के वि त ती य प तर कार को , जो सी धा यह खबर ट वि टर पर डाल दे ता है ,	ఎవరో చినన ఫ ెనా న షి య ల జర న లి సట ు తో ఈ వార త ని ట వి టట ర లో లీ క చేయి ంచారు ,	0.6487
हाँ . हमारा ई ं धन खतम हो गया है .	అవును . మొతత ం అయి పోయింది .	0.5096
उससे क हो .	ఆమె కి చెపపు .	0.4529
इसके पीछे हमेशा ,	సరే , ఎపపుడూ ,	0.4616
यहाँ सिरफ तुम लोगों की जिंद ग ियाँ खत रे में नहीं हैं , सै म .	అకకడ నీ పరా ణ ాలు మాతరమే పరమా ద ంలో లేవు , సా మ .	0.5545
अभी नहीं .	అ పపుడే కాదు .	0.3623
सिरफ वही एक वय क ति ज मी न के लोगों से सं पर क में है .	గర ౌ ండ తో అతను మాతరమే మాటలాడు తుననా డు .	0.5202
और यह ?	మరి ఇది ?	0.3240
ब रे स पो जि शन , हाथ सिर के पीछे करो .	ది గ డానికి సిదధ ం , చే తులు మీ తల వె నుక పెటట ండి .	0.5789
शुकरिया .	థాంక స .	0.3091
तुम मेरी बात सुन रहे हो ?	నా మాట వి ంటుననా వా ?	0.4813
सै म , कया तुम मुझे सुन सकते हो ? तुम सुन रहे हो ?	సా మ , నా మాట వి ంటుననా వా ? అకకడ ఉననా వా ?	0.5663
मेरा पार ट नर इस समय उनके कब जे में है .	నా జీవి త భా గ సవా మి పర సతు తం వాళల ఆ ధ ీ నం లోనే ఉంది .	0.5829
अचछा है . यह अंदर जाने में हमारे काम आए गा .	ఇది మంచి విషయం . ఇదే మన కి మా రగ ం .	0.5789
वापस यू के में आपका सवागत है ! आप अब . . .	యు నె టె డ కి ంగ డ మ కి సవా గ తం ! మేము ఇం క ఎంత మా తరం . . .	0.6028
- हमारे पास रि वर स थ र सट नहीं है . - तुमहें विमान को मो ड ना होगा . . .	- మాకు రి వర స తర సట లేదు . - మీరు ఏం చేయ ాల ంటే . . .	0.6503
किसी ब डे मी ड िया सं स था न को नहीं , जिस पर हमारा का बू हो ,	మనం నియ ంత రి ంచ గల పెదద వార తా సం సథ కాదు కానీ	0.5523
हम उनहें कुछ नहीं क हें गे .	మేము సప షట ంగా ఉననా ము .	0.4899
- नहीं . नहीं ! - इ ध र आओ .	- లేదు . లేదు ! - ఇలా లోప లి కి రా .	0.4790
पीछे . पीछे , पीछे !	వెన కకి , వెన కకి వెళల ండి !	0.3701
का ई , तुमहारी माँ चाहती है मैं अभी वहाँ आ जा ऊँ .	ఖ ా య , మీ అమమ ననను వెళలి చూడ మ ంట ో ంది .	0.5682
एक फोन आया था .	ఒక ఫోన కాల వచచింది .	0.3932
- तुमहारा नाम कया है ? - के नी .	- మీ పేరు ఏంటి ? - కె నీ .	0.5989
हम तै या री कर रहे हैं . . .	మనం ది గ డానికి సిదధ ం అవు తుననాం . . .	0.5753
कि ंग डम ए यर ला इं स पी एल सी	కి ంగ డ మ ఎ యి ర లె నస పి . ఎ ల . సి .	0.5769
हम जरू री जग हों को खा ली करवा एँगे . पर हम अपने खुद के लोगों के खिला फ कोई कार र वाई नहीं करेंगे , नहीं कर सकते .	పర ధా న పర దే శ ాలని ఖ ా ళ ీ చేయి ంచా ము . కానీ మనం , మన స ొ ంత ప ౌ రు ల మీద దా డి చేయి ంచ లే ము .	0.6420
सब वापस अपनी सी ट ों पर जाओ .	మీ సీ ట లలో కూ రచ ో ండి .	0.5014
तुम सा व धा न रहना .	నువవు జా గర తత గా ఉండాలి .	0.4668
मेरी बात सुनो . अ मैं डा .	ఇలా చూడు , అమ ండా .	0.4330
हमारे पास एक लै ंड ला इन से 9 9 9 की आ पा त से वा पर एक क ॉल आई थी , और वह इस अ पार ट में ट के प ते पर प ं ज ीक ृ त है .	ఈ అ పార ట మె ంట లో రి జి సటర డ ల యా ండ లెన నె ం బ రు నుండి 9 9 9 నె ం బ రు కి ఫోన వచచింది .	0.6949
अगर यह . . .	అది . . .	0.6034
और दूसरे सम बन धि त सट ॉ क .	ప త నం అవు తుననా యి .	0.5184
