Hindi	Telugu	Similarity_Score
वाह .	వా వ .	0.3262
नहीं .	లేదు .	0.3291
- हैलो ! - हैलो !	- హో లా ! - హో లా !	0.4555
हैलो , लड कि यों .	హలో , అమమాయి లూ .	0.4905
ड यू टी के समय कभी आ राम मत करना . "	డ యూ టీ లో ఎపపుడూ రి లా కస కా వదదు . "	0.6382
- बाद में मिल ूँगी . - धनयवाद .	- మళలీ కలు దదాం . - ధనయవాదాలు .	0.5445
कया सच में ग ड बडी है ?	అది అలా అనిపి స తో ందా ?	0.5109
लो टो - वि न 1 00 , 00 0 कला फि न ए ंड सं स	ల ొ టట ో - లకష గె లవ ండి క లా ఫి న అ ండ స నస	0.5691
- सु पर भा त , टॉ म . - हैलो . सु पर भा त , लि ज . चि प खाना चा होगी ?	- శు భ ో ద యం , టా మ . - హాయ , శు భ ో ద యం , లి జ . నీకు చి ప ఇష ట మే నా ?	0.7476
नहीं .	లేదు .	0.3291
शायद तुमने मुझे सं दि ग ध बना दिया है .	నా మీద అను మా నం వచచే లా మాటలాడ బో యా వు .	0.5914
वह भूल जाओ .	ఇం క మర చి పో .	0.4564
- गरेस . - सी धे बे बी बी को फोन किया .	- గరేస . - నే రు గా బ ే బీ బీ కి చేసి ంది .	0.6001
पसंद तो है .	నాకు ఇష ట మే .	0.5170
नहीं आ सकती .	నేను రాల ే ను .	0.3621
पता नहीं . यह हमारा प ला न बी हो सकता है . " बी " से बे बी बै का .	నాకు తెలియదు . అది మన ప లా న బి కా వచచు . " బి " అంటే బ ే బీ బె కా .	0.6572
नहीं , बि बी . नहीं .	వదదు , బీ బీ . వదదు .	0.5155
हैलो रॉ जर . मैं ऑ स कर हूँ	హాయ రో జర . నేను ఆ స కర ని .	0.6236
मुझे लगा हम मिल कर ज शन मना एँगे .	మనం ఏదెనా చే ద దా మని అను కుననాను .	0.5541
ग ना श .	గ నా ష .	0.5027
ग ना श .	గ నా ష .	0.5027
नहीं .	లేదు .	0.3291
ट रू गरेस	ట రూ గరేస	0.4581
ये य .	యా య .	0.5947
नहीं .	లేదు .	0.3291
और मेरी आँख इसकी वजह नहीं है . तुमहें नि शा ना लगा ने के लिए दो आँख ें नहीं चाहिए .	ఇది నా క నను గురించి కాదు . మనం లకష యానని గురి పెటట డానికి రెండు క ళలు అవసరం లేదు .	0.6301
बि बी .	బీ బీ .	0.3197
अगर है , तो मैं ए थ ली ट हूँ .	అదే అయితే , నేను అ థ లెట ని .	0.5885
मैं घर पर म हिला ओं से घ ि रा हूँ .	ఇంట లో నా చు టట ూ ఆడ వాళ లే ఉననారు .	0.6149
- या शायद हमें पहले कोई सा ं सक ृ ति क चीज देख नी चाहिए . - सच में ? यह जरू री है ?	- లేదా కొ ద ది సమయం సం స క ృ తి కోసం వె చచి దదాం . - నిజంగా నా ? మనం అలా చేయ ాల ంటా వా ?	0.6768
और तुमहारे न न हें श ॉर ट स भी . नहीं .	నీ పొ టటి లా గ ూ లు . అవి మా తరం వదదు .	0.5878
- और तुमहारे ट रे डि ंग कार ड भी . - नहीं , वह तुमहारे कॉ मि कस नहीं ज ला एँ गी .	- ఇంకా నీ ట రే డి ంగ కార డు లని కూడా . - లేదు , తను నీ కా మి కస ని త గు ల బె టట దు .	0.7008
स जा देने के बारे में सोच ने से पहले , तुमहें शा ंत होने का इंतजार करना चाहिए .	నీ కో పం వలల జ రి గే పరి ణ ా మ ాల గురించి నువవు ఆలోచి ంచు కునే వర కూ శా ంత ంగా ఉండాలి .	0.6215
मेरे परि ण ा म में निक ला कि . . .	నా వయకతి త వ లకష ణం ఏమి ట ంటే . . .	0.6300
कि कैसे वो यह बेहतर तरी के से कर सकता है ?	మనం ఇంకా బాగా ఎలా చేయాలి అని ఆలోచి సతా డా ?	0.5450
पर तुम सबसे अचछे अ भ ि भा व कों में से एक हो .	కానీ నాకు తెలి సిన అ తి మంచి తల లి వి నువవు .	0.5925
और ब ला न ड के लिए .	ఇంకా బ లా న డ కోసం .	0.5939
तुमहारे लिए यह कहना आ सान है . उसने तुमहारी जिंदगी बर बाद नहीं की .	నీకు అంతా మంచి గానే ఉండ చచు . వాడు నీ జీవి తా నని నా శ నం చేయ లేదు కదా .	0.5845
इ वा .	ఈ వా .	0.4399
- अ ल वि दा . - अ ल वि दा .	- ఉంటా ను . - ఉంటా ను .	0.4950
जिस से उ बर ना क ठ ि न था ?	కో లు కో వడం కష ట మ యి ందా ?	0.6202
वह बेवकूफ कयों है ?	వాడు ఎందుకు దద ద మమ ?	0.4361
नहीं ?	లేదా ?	0.3355
पर तुम कोई न रत की नहीं हो .	కానీ నువవు ష ో గర ల వి కా వు .	0.5657
- कल कोशिश करना . - ठीक है .	- రే పు పరయతని ంచు . - అలాగే .	0.5686
हाँ .	సరే .	0.3574
हमें बस गो लिया ँ बदल ने का तरी का सोच ना होगा .	వాటి ని బయటకు ఎలా తీసుకు వెళ తా మో ఆలోచి ంచాలి .	0.5341
- तुमहें बिलकुल सट ीक नि शा ना लगा ना होगा . . . - हे भगवान . मैं यह कर सकती हूँ !	- నువవు ఖచచితంగా గురి చూ సి కొ టట ాలి . . . - ఓహ , దేవుడా . నేను ఈ పని ని చేయ గలను !	0.6912
इ वा , तुम और मैं जे पी को ल कष य बना एँगे .	ఈ వా , నువవు నే న ూ జె పి మీద గురి పె డ దాం .	0.6636
- हाँ . - बढिया है .	- అవును . - మంచిది .	0.6272
वह तुम हो , मै मी .	అది నువవే , మా మీ .	0.5170
अब कया करें ?	ఇపపుడు ఏంటి ?	0.4179
चलो भी !	ఇలా రా !	0.3471
अब कया करें ? बि बी .	ఇపపుడు ఏంటి ? బీ బీ .	0.5093
- हैलो ! - ठीक है , दोसत ों .	- హాయ ! - అలాగే , కు ర రా ళ లూ .	0.6285
तुम सट ीक नि शा ना लगा सकती हो !	నీకు సప షట మెన గురి దొ రికి ంది !	0.5117
बि बी .	బీ బీ .	0.3197
कया हो रहा है ?	ఏం జరుగు తోంది ?	0.4928
नहीं , नहीं , नहीं .	లేదు , లేదు , లేదు .	0.3606
किस दु र घट ना को लेकर ? जिस में मेरे मा ता - पिता मा रे गए या जिस में मेरी आँख फ ू टी ?	ఏ పరమా ద ం ? మా తల లి ద ండ రు లు మ రణ ి ంచిన పరమా ద మా లేక నేను నా క నను కో ల పోయి న పరమా ద మా ?	0.6433
मैंने उसका फोन तो ड दिया था , अ रस . वह फो टो मि ट चु की है , तुम सुरकष ित हो .	వాడి ఫో ను ని నే ల కే సి కొ టట ా ను , ఉ రస . ఆ ఫో టో లు ఇం క పోయా యి , నీ కే ం ఫర వాలేదు .	0.6778
पता है मैंने कया सोचा ? मैंने सोचा , " वह गरेस है , और मैं वह कमी ना हूँ . "	నేను ఏం ఆలోచి ంచా నో తెలుసా ? " తను గరేస , నేను ఆ చెతత వెధ వని " అనిపి ంచింది .	0.6282
और उससे भी बु री बात है , कि उसने इसकी जि म मे दा री ले ने से इन कार कर दिया .	అంత క ననా ఘ ో ర మెన ది ఏమి ట ంటే , అ ందుకు అతను క నీ సం బాధ యత కూడా తీసుకో న ననా డు .	0.6624
डै ड आ ली शान जी वन जी ते थे , और मैं और म ॉ म उनकी गल ति यों की भर पा ई करते थे .	నానన జ ల సా గా బ తి కా డు , కానీ నేను , అమమ ఆ గ ంద రగ ో ళ ం నె తతి నె తతు కునే వాళల ం .	0.6932
नहीं , वे बस मेरी और जे पी की दु र घट ना के बारे में बात करना चाहते थे .	లేదు , వాళలు కేవలం జె పి తో జరిగి న పరమా ద ం గురించి మాటలాడ టానికి వచచా రు .	0.6144
तुमहें लगता है वह अपने पे र ें टि ंग कौ श ल के बारे में सोच भी रहा होगा ?	వాడు క నీ సం కష ణ మెనా తన పె ం ప కం తీ రు ని స మీ కషి ంచు కుంటా డు అనుకుంటుననా వా ?	0.6339
कया ? मैं बस एक बेवकूफ बच चा था जो तुमहारी परे शा निया ँ बढ ा ता था ?	ఏంటి ? నినను మరి ంత గ ంద రగ ో ళ ం పె టటి న తెలి వి త కకువ పిలల వాడి నా నేను ?	0.6050
तुम उसे प ें ट ब ॉल के द ौ रा न मार ना चाहती हो ? यह बे तु की यो जना है .	పె యి ంట బ ాల తో అత డిని చం పే య ాలి అనుకుంటుననా వా ? అది పిచచి ఆలోచ న .	0.6609
मैं डॉ न ल हूँ , मैं एक पै रा मे डि क हूँ . यह अ र सला है , यह नर स है .	నా పేరు డో న ల , నేను పా రా మె డి క ని . తన పేరు ఉ ర సు లా . తను ఒక న రస .	0.7022
यह कह ने की जरूरत नहीं है , पर तुमसे भी यही वा दा किया जाएगा .	నీకు చెపప న కక ర లేదు , నీకు కూడా అ టు వ ంటి ర హ సయ మే అ ంది ంచ బ డు తుంది .	0.6006
उसकी देख भा ल करना और शा ंत रख ना तुमहारा काम है . समझ े , डै डी ?	ఆమె ను మంచి గా , పర శా ంత ంగా ఉ ంచే బాధ యత మీ దే . సరేనా , త ండ రి గా రూ ?	0.6259
नहीं . और कृपया , कृपया उसे मत बता ना . मैं अनु रो ध करती हूँ .	లేదు . దయచేసి , దయచేసి తన కి చెపప కు . నినను వే డు కుంటుననా ను .	0.6308
मुझे खे द है कि तुमहारे परिवार ने तुमहारा साथ नहीं दिया .	నీ కుటుం బ ంతో నువవు కష ట ాలు ఎదు ర కొ నన ందుకు నాకు బాధ గా ఉంది .	0.5720
- तुम तै र ने आ ना चा होगी ? - हाँ , हम तुमहारा इंतजार करेंगे .	- నువవు కూడా ఈ త కోసం రా గల వా ? - అవును , నీ కోసం వే చి ఉంటా ం .	0.6660
बि बी को देखो . उसने पल भर में उसकी जिंदगी त बा ह कर दी .	బీ బీ ని చూడ ండి . తన జీవి తా నని అతను కష ణ ంలో నా శ నం చేశా డు .	0.5980
वैसे , उसने अपने बी मा दा वा पर प तर में तुम पर दो ष डा ला .	సరే , కానీ అతని ఇ నస ూ రె నస ఫా ర మ లో మిమమలని ని ంది ంచా డు .	0.6287
उसे महसूस करवा एँगे कि वहाँ हम उसके अस ली दु श मन हैं .	మనం అకకడ అతనికి నిజ మెన పర తయ రథ ు ల ం అనే భా వ న కల పి దదాం .	0.6350
- हाँ , मुझे पता है . उसके दिमाग में बस वही है . - हाँ .	- అవును , తెలుసు . ఈ పని లో ని మ గ నం అయి పోయా డు . - అవును .	0.6508
मैं तुमसे व हीं मिल ूँगी , पर मेरे बिना कुछ मत करना .	నినను అకకడ కలు సతాను , కానీ నేను లే కుండా ఏమీ చేయ దదు .	0.5949
मुझे माफ कर दो , बी . मैं बस बिना सो चे ब ड बडा ती गई .	కషమించు , బీ . నాకు ఒకక సారి గా ఆ వే శం వచచి తి టటే శా ను .	0.6402
- एक स ज जन कभी यह राज नहीं खो ले गा . - तुमहें हुआ है .	- చి తర కారు డు ఎపపుడూ చెపప డు . - నీ జీవితం లో జరిగింది .	0.6454
- किसी का नि शा ना काफी ते ज है . - हाँ , मेरा नि शा ना .	- సరే , ఇకకడ ఎవరో వి లు వి దయ లో ది టట . - అవును , నేనే .	0.5738
और उसकी चा बी उसके डे सक पर रख े फु ट ब ॉल म ग में है .	దాని తా ళ ం డె స కు మీద ఉనన ఫ ు ట బ ాల మ గ లో ఉంటుంది .	0.6933
तुम मेरा सा मान कयों छ ू रहे थे , मै ट ? कृपया . . .	నా వ సతు వు లతో ఏం చేసతుననా వు , మయా ట ? దయచేసి . . .	0.6852
फा इ ल उसके डे सक के सबसे नीचे वाले द राज में है .	ఆ ఫె లు అతని డె స కు కి ంది డ ర ాలో ఉంది అనుకుంటా .	0.6341
- ए , वह तुमहारे भी डै ड हैं . - नहीं , नहीं हैं .	- హేయ , ఆయన నీకు కూడా త ండ రే . - లేదు , అతను కాదు .	0.6419
तुम पी ने के बाद हो श में नहीं रह ती हो , समझ ी ? तुमहारे साथ फि ल म देख ने जाना सं भ व नहीं है ,	నువవు నీ డ రి ంక ని కూడా సరి గా చూ సుకో వు , సరేనా ? నువవు సి ని మా కి వెళ లే తీ రు ఘ ో ర ంగా ఉంటుంది ,	0.6727
- उसे में ढ कों को ड ु बो कर मार ना पसंद था . - कया ?	- క పప లని ము ంచి చం పే య డం వాడి కి ఇష ట మ ట . - ఏంటి ?	0.6825
कया मेरी बह नों के पास तुमहारी दिन चर या है ?	మా అ కక చె ల లె ళల కి మీ ష ె డ యూ ల ము ందే చెపపా రా ?	0.5789
हमारा इ रा दा उसे चो ट पहुँ चा ने का नहीं है . वह तो मैं घ ूँ सा मार कर ही कर सकती हूँ .	ఆ మనిషి ని గా య పర చ ాల నన ది మన ఉదదేశం కాదు . ఆ పని అయితే నేను నా పి డి కి లి తో నే చేయ గలను .	0.6190
वह हमेशा बि न बचचे वाली को फोन करती है .	తను ఎపపుడూ పిలల లు క నని వారి కే చే సతుంది .	0.5794
तुमहारे पास वह सब करने का समय होगा ? कयोंकि उस दिन काफी ह ं गा मा हो रहा होगा .	ఇ దంతా చేయ డానికి నీకు టె మ ఉ ంటు ందా ? ఎందుకంటే ఆ రోజు చాలా హ డా వు డి గా ఉండ బో తుంది .	0.5675
वो यह . . . वो यह सवी कार नहीं कर पा या .	నేను . . . నేను దానిని త టటు కో లేక పోయా ను .	0.5433
वा दा करो कि तुम उससे कभी नहीं मि लो गी .	అత డిని మళలీ కల వ నని నాకు పరమా ణం చేయి .	0.5664
और नीचे वाले द राज में रख े वह प ॉ लि सी ?	ఆ డ రా అడుగు న ఉనన పాల సీ ల సంగ తి ఏంటి ?	0.6501
नहीं , कोई बात नहीं . मैं ले आता हूँ .	లేదు , ఫర వాలేదు . నేను తీసుకు రా గలను .	0.5109
हमने उस में काफी अचछे समय बि ता ए हैं .	మేము గ డి పి న కొనని మ ధ ు ర కష ణ ాలు అవి .	0.5901
तो हमें काफी देर इंतजार करना होगा .	అలా అయితే మనం చాలా కాల ం వే చి ఉండాలి .	0.4878
हाँ . कया मैं स वे ट बै ंड पह न कर आ ऊँ ?	సరే . నేను స వె ట బ యా ండ పెటటు కో వ ాలా ?	0.6710
और तुमहारे डै ड ला पर वाह ड रा इ वर थे .	కానీ మీ నానన చాలా దు రు సు డ రె వ రు .	0.5884
मैं इतनी बेवकूफ महसूस कर रही हूँ .	నేను ఒక పిచచి దానిని అనిపి సతోంది .	0.4988
- कया उसके पे शा ब में पर ो टी न है ? - मैंने पे शा ब की जा ँच नहीं की है .	- తన మూ తరం లో పర ొ టీ న ఉందా ? - నేను ఇంకా తన మూ త రా నని పర ీ కషి ంచ లేదు .	0.6989
- कया ? - " कभी पयार में मत पड ना . "	- ఏంటి ? - " పరే మ లో ఎపపుడూ పడ కు . "	0.6967
मैं उन गो लि यों को फ री ज कर ूँगी .	ఈ చినన చెతత వాటి ని ఫ రీ జ చేసతాను .	0.5303
तुम और मैं जे पी के पीछे जाएँगे .	నువవు , నేను జె పి ని అను సరి దదాం .	0.5368
हाँ , मैं भूल गई थी कि तुमहें गो लिया ँ चला ना कितना पसंद है .	అవును , ఏదెనా ష ూ ట చేయడం అంటే నీకు ఎంత ఇష ట మో నేను మర చి పోయా ను .	0.6320
मैं कोशिश कर रहा हूँ , थे रे सा .	నేను పరయతని సతుననాను , థ ె రె సా .	0.5420
- हम अंदर आ सकते हैं ? - नहीं .	- మేము లోప లి కి రా వచచా ? - లేదు .	0.5793
देखो , मैंने फोन किया कयोंकि तुमने गर ु प में जे पी के जन म दिन को लेकर जवाब नहीं दिया .	చూడు . నీకు ఎందుకు ఫోన చేశా న ంటే , జె పి పు టటి న రోజు గురించి గర ూ పు లో నువవు రి ప లె ఇవవ లేదు .	0.6354
- अ ल वि दा . - कयों , बि बी ? बि बी !	- బె బె . - దే నికి , బీ బీ ? బీ బీ !	0.4844
वैसे , ऐसी वि रा सत अ म ूल य हैं .	సరే , ఇ టు వ ంటి వార సత వం అ మూ ల యం .	0.6605
हैलो . हैलो , मैं ग ै ब रि एल हूँ .	హాయ . హాయ , నా పేరు గా బ రి యే ల .	0.6122
मैंने फो टो डि ली ट कर दी थी .	ఆ ఫో టో ని నేను డి లీ ట చేశా ను .	0.5352
मैंने उनहें फोन किया . उ त सा ही खिला डी होने का ना ट क किया .	వాళల కి ఫోన చేశా ను . ఒక పిచచి ఔ త సా హి కు ర ాలి గా న టి ంచా ను .	0.5875
उप - शी र ष क अनु वाद क : म ून क लि ता	తెలు గు అను వాద ం : స తీ శ కు మార	0.5934
और मुझे सट ू डियो लौट ना है .	నేను నా సట ూ డి యో కి వెళల ాలి .	0.5706
तुमहें पता है मुझे कया पसंद है . वह गलती कर दे गा . बुरा तो नहीं मान ो गे , जान ?	నేను ఏం తి ంటా నో నీకు తెలుసు . తను సరి గగా తే లే డు . నువవు ఏమీ అనుకో వు కదా , బు జ జీ ?	0.6577
चलो डॉ न ल और जे पी को एक टी म में रख ें . जे पी को यह पसंद आए गा . लड के ब नाम लड किया ँ .	డో న ల ని జె పి జ టటు లో పె డ దాం . అబబా యి లతో అమమాయి లు ఢ ీ కొ టట డం అంటే జె పి కి ఇషటం .	0.6890
र कत चा प थोडा कम हो गया है .	రక త పో టు కొ ద ది గా త గ గి ంది .	0.5468
थोडा ? पर यह 1 2 0 से कम और 8 0 से जयादा होना चाहिए .	కొ ద ది గా నా ? కానీ అది 1 2 0 , 8 0 క ననా త కకువ ఉండాలి కదా .	0.6197
शा ंत हो जाओ , शा ंत हो जाओ . दु र घट ना एँ घट जाती हैं .	శా ంత ంగా ఉ ండు , శా ంత ంగా ఉ ండు . పరమా ద ాలు జరుగు తు ంటా యి .	0.5607
हम स पो र टी लोगों को नहीं .	మన లాంటి తా గు బో తు లకు కాదు .	0.5262
