Hindi	Telugu	Similarity_Score
हेदर ?	హే థర !	0.3262
हेदर !	హే థర !	0.3956
हेदर ?	హే థర !	0.3262
हेदर !	హే థర !	0.3956
हेदर !	హే థర !	0.3956
पै निक	పా నిక	0.4095
हेदर ?	హే థర ?	0.3956
मुझे पता है .	నాకు తెలుసు .	0.4495
नै ट ली ने जब तुमहें ढूँढ निका ला , उसके कुछ ही मिनट बाद दूस रा मा ला गिर गया .	నా ట లీ నినను కను గొ నన కొనని నిమిష ాల కే , మొతత ం రెండ ో అంత సతు కు పప కూ లి పోయింది .	0.6397
वहाँ पार टी रख ने का वि चार किस का था ?	అది అకకడ చేసుకో వాల నన ది ఎవరి ఆలోచ న ?	0.4961
नै ट ली . . .	నా ట లీ . . .	0.7295
इसलिए जेल नहीं जाना प डा .	అందుకే అతను జె లు లో లే డు .	0.5023
तो लोगों से दो स ती तो होगी .	క ౌ ంట ీ ష ె రీ ఫ గా సే వ చేయ లే డు .	0.4775
डी ए चाहते हैं किसी को बिल की मौ त का क सू र वार ठ हरा ऊँ .	లి టి ల బి ల చా వు కు , డీ ఏ ఎవరి పె నె నా నే రం మో ప మ ంటుననా రు .	0.6347
अगर वह जानता हो तो ?	అతనికి తెలి సి ఉంటే ?	0.3740
- ए का उ ं टि ंग है , और . . . - ए का उ ं टि ंग ?	- అది అ క ౌ ంటి ంగ ఇంకా . . . - అ క ౌ ంటి ంగ ?	0.6085
पता नहीं , वो झूठ - म ूठ की होती हैं , और . . .	నాకు తెలియదు , అవి స ృష టి ంచ బడ డ వి , ఇంకా . . .	0.6680
असल दुनिया में ,	వా సత వ పరపంచ ంలో ,	0.4447
अपनी खुद की वा सत वि क ता बना ओ , बेटा .	నీ వా సత వం నువవు స ృష టి ంచుకో వాల మ మా .	0.5662
तुमहें वे जू ते पसंद हैं .	నీకు ఆ స నీ కర స అంటే ఇషటం .	0.4955
वह खुद छो टा लगता है .	వాడు మాటలా డే ది చెతత .	0.4919
उसके पास जि मी का मु का ब ला करने ला य क अं क थे .	జి మ మీ తో పో టీ పడ ే ందుకు సరి పడ పా యి ంట లు ననా యి .	0.6156
पूछ ता छ करने जा रही हूँ .	నే నె ళళ ి ఆమె ను పర శ ని సతా .	0.5480
अजीब है कि संभा वना की बात कर रहे हो .	అవకా శ ాల గురించి నువవు మాటలాడ డం వి ంత .	0.5633
हेदर .	హే థర .	0.3956
वहाँ देखो .	అకకడ చూడు .	0.3909
प हा डी पर .	కొ ండ మీద .	0.3895
सोचा इसे रख ने के लिए कोई जगह ढूँढ सक ूँ .	దీ నికి లోప ల చో టు చూపి ంచ ాలని అను కుననాను .	0.5626
कया आप कहीं भी , सिरफ यह पह न ें गी ?	నువవు ఎ కకడి కె నా అదే వే సు కుంటా వా ?	0.5275
डे मि यन - . 5 0 हेदर - . 8 5	డా మి యన - . 5 0 హే థర - . 8 5	0.8141
और उनकी कहा निया ँ सुना या करते .	ఆమె గురించి క థ లు గా చెపపే వారు .	0.5251
मुझे बडा होता देख उनहें कितना गर व होता .	నేను పె రుగు తు ంటే ఎ ంతో గర వ ంగా భా వి ంచే ది .	0.5267
वह अभी भी जि ंदा हैं ?	ఆమె ఇంకా బ తి కే ఉందా ?	0.4305
डे ना .	డే నా .	0.4884
उसके पीछे कोई वजह नहीं थी .	అంటే , అ ందుకు ఏ కారణ ం లేదు .	0.4745
. . . एक दम बीच में से .	. . . సరి గగా మధయ నుండి .	0.6621
पहली दु र घट ना !	మొదటి పరమా ద ం !	0.4890
हार ने के लिए तैयार हो जाओ , डॉज .	ఓ డి పో డానికి సిదధ ంగా ఉ ండు , డా డజ .	0.5225
शो काफी अचछा था .	అది మంచి పర దర శ న .	0.3819
कया ?	ఏ ది ?	0.2973
- चु प रहो . - एक बार 1 2 यू टी बि रा द री वा लों को हरा या था .	- నో రు మూ సుకో . - ఒక ే సారి 1 2 యూ టీ స భ యు ల ంద రి నీ ఓ డి ంచింది .	0.6890
कल मैं सट े शन पर काम कर रही थी .	ని నన ష ె రీ ఫ సట ే షన లో పని చేశా ను .	0.5762
यह भी कि उनहोंने उसे तुमहारे फोन के रि कार ड दि ए .	అతనికి నీ ఫోన రి కార డు లు ఇ చచా నని చెపప డం వి ననాను .	0.5933
यह अग ली चु नौ ती है .	ఇది తరు వా తి స వ ాలు .	0.5644
कयोंकि अगर उनहें हा सि ल न कर पा ए , तो नि रा शा होगी .	ఎందుకంటే నువవు అది పొ ంద లే కపోతే ని రా శ చె ందు తా వని .	0.5506
याद है जिस दिन मैं तुमहारे घर आई थी और ली ला वहाँ थी ?	గురతు ందా , నేను మీ ఇంటికి వచచా ను ఇంకా లీ లా అకకడ ఉంది ?	0.5908
पार कि ंग में देखा था .	పార కి ంగ దగగర చూశా ను .	0.5164
पर तुमने कहा कि फर क नहीं पडता .	కానీ నువవు నీకు అన వ సరం అననా వు .	0.5609
- ए , वहाँ हाथ मत लगा ना . - इसे बंद करो .	- హే , దానికి ద ూర ంగా ఉ ండు . - అది మూ సే య .	0.6317
अचछा . सुनो .	సరే . ఇది గో .	0.4501
नहीं .	వదదు .	0.3902
नै ट ली , समय हो गया है .	నా ట లీ , సమయం అవు తుంది .	0.6232
ठीक है .	మంచిది .	0.4320
हम हमेशा मजाक किया करते कि हाथ में सा ँ ड की लगा म लेकर ही मर ेंगे .	మేము ఎపపుడూ ఆయన చే తి లో ఎ దదు తా డు తో చని పో తారు అని నవ వు కునే వాళళ ం .	0.6161
इसलिए पुलिस को पकका नहीं पता कि उसकी मौ त का कारण आ ग थी .	అందు కని మ ంట ల వల న అతను చని పోయా డని పోలీసు లు ఖచచితంగా లే రు .	0.5779
उसने कहा लि ट ल बिल के पिता ने नौ करी में उनकी काफी मदद की .	అతను ఆ ఫీ సు లో చే ర డానికి లి టి ల బి ల నానన సహా యం చేశా డ ననా డు .	0.5835
हाँ , हमें और कु र सि यों के लिए , हा ई सक ूल तक जाना प डा था .	ఆ , హె స కూ ల నుండి ఇం కొనని కు రచ ీ లు తీసుకు రా వాల సి వచచింది .	0.6654
झूठ बोल रहे हों या नहीं , सा बि त नहीं होता तो बे कार है .	రు జు వు చేయ లే కపోతే , అబ దధ మో కా దో తెలుసు కు ని ఉ ప యో గం లేదు .	0.6194
मैं पै निक में बच गया और अब यह बन डा ना मिला . यह कया है ?	పా నిక నుండి బయట పడ డా ను , నా దగగర ఉనన ద లలా రు మ ాల ే . ఇదే ంటి ?	0.6268
ऐसी माँ हो तो अचछा है , ब जा य उस माँ के जो हमें छोड गई .	మన లని వదిలే సిన అమమ కంటే అలా ంటి అమమ ఉండ డం చాలా ఉ తత మ ం .	0.6094
हेदर , मेरे पापा आए हैं और तुमसे बात करना चाहते हैं .	హే థర , మా నానన వచచా రు , నీ తో మాటలాడ ాలని అనుకుంటుననా రు .	0.5799
मैं तुमहें बता ना चाहता था कि बात असल में वह नहीं .	అది కనిపి ంచిన టటు కా దని నువవు తెలుసు కో వాల ను కుననాను .	0.5306
मेरा तो यही म ं तर है कि टी म पर पै सा लगा कर दु आ करो .	ఒక జ టటు పె డబబు పె టటి , పరా రథ ి సతాను , అంతే చేసతాను .	0.6337
कयोंकि मैंने जो हा सि ल किया , तुमहारे लिए किया .	నాకు ఎ పపటి కీ అంత అవ మా నం తీసుకు రా వని చెపపా ను .	0.5716
- यह तो बस . . . - मुझे कुछ नहीं कहना चाहिए था .	- అది కేవలం . . . - నేను ఏమీ అన కుండా ఉండ ాల సింది .	0.6915
हेदर से मि लो तो बता देना . उसे टि कट लेना होगा .	హే థర కనిపి సతే చెపప ండి . తను టి కె ట తీసుకో వాలి .	0.5727
डर बी के बाद , धयान से सा इ किल चला कर घर लौट ना .	రే సు తరువాత నీ సె కి ల మీద జా గర తత గా ఇంటికి రా .	0.6027
आ ख िर में गाडी नंबर बा रह और च ौ द ह ही ब ची हैं ,	ఇంకా న డు సతునన చి వరి రెండు కార లు 1 2 మరియు 1 4 ,	0.6064
नहीं , तुमहें कॉ ले ज लिए पै निक की जरूरत नहीं .	నీకు కాల ే జీ కి వెళళ డానికి పా నిక అవసరం లేదు .	0.5717
आज रात की चु नौ ती अं ति म चार का नि रण य करे गी .	ఆ రాతరి స వ ాలు చి వరి నలు గురి ని నిరణ యి సతుంది .	0.5829
कॉ ले ज जाने के लिए पै निक खेल ना जरू री नहीं .	నీకు కాల ే జీ కి వెళళ డానికి పా నిక అవసరం లేదు .	0.5747
नहीं . तुमने कुछ गलत नहीं किया . यह तो . . .	లేదు . నువవు తపపు గా ఏం మాటలాడ లేదు . అది . . .	0.6574
आ ग लग ने से पहले , टा य ल र को उसकी ला श मिली .	మ ంట లకు ముందు టె ల ర అతని శ వా నని కను గొ ననా డు .	0.6509
बो के साथ कुछ हुआ है , पर वह बता नहीं रही .	బో తో ఏదో జరిగింది , అది ఏంట ో చెపప డం లేదు .	0.5949
बच प न में जब मुझे अपनी माँ की याद आती थी ,	నా చినన త నం లోనే నేను మా అమమ ను కో ల పోయా ను ,	0.5904
और हम खिला डि यों को करी ब से देख पा ते हैं .	మేము ఆట గా ళళ కు దగగర వడానికి స హాయ పడు తుంది .	0.6107
उसकी दु र घट ना कोई दु र घट ना नहीं थी , है न ?	ఆమె కు జరిగి న పరమా ద ం , పరమా ద ం కాదు , కదా ?	0.6206
वह खिला डि यों की नहीं , संभा वना ओं की है .	అది ఆట గా ళళ ది కాదు , అది అ ంచ నా ల జా బి తా .	0.5498
हम एक - दूसरे के काफी करी ब आ चु के हैं .	ఎవరెనా ఎంత దగగర కా గల రో అంత దగగర య యా ము .	0.5853
हम चु नौ ती को बीच में ही छोड सकते थे .	మేము స వ ాలు ను పూరతి గా తపప ి ంచే సే వాళళ ం .	0.5865
- हाँ . - मैं सौ दे की त ला श में रह ता हूँ .	- అవును . - ఎపపుడూ డీ ల కోసం చూ సతు ంటా ను .	0.6220
मि से ज को र टे ज , आप कुछ लेना चा हें गी ?	మి సె స కోర టె జ , ఏమెనా తీసుకు ర మమ ంటా రా ?	0.6401
- इन होंने तुमहें कयों पक डा ? - इस बार ?	- నినను ఎందుకు లోప ల వే శా రు ? - ఈ సా రా ?	0.6146
उस ी से पूछ ना . मेरी समझ से बाहर है .	అతని నే అడుగు . అది నాకు అరథం కాదు .	0.5620
- भा ला मु का ब ला तो होता है न ? - कया ?	- ఎపపుడూ యో ధ ు డు ఉంటా డు , కదా ? - ఏంటి ?	0.6475
अभी के लिए , वे अं कों के अ ला वा हैं .	ఇ పపటి కి , వా రికి పా యి ంట లే కా కుండా .	0.5863
और आगे कोई दूस रा खेल नहीं होगा .	రూ పొ ంది ంచ కూడ దని నిరణ యి ంచు కుననా ం .	0.5252
कुछ , हाँ . कुछ मेरे पिता के हैं .	కొనని , అవును . కొనని మా నానన వి .	0.5536
ऐसा कोई जो उस रात हमारे साथ था .	ఆ రాతరి మన తో ఉనన వాళళ లలో ఎవరో .	0.4718
इस सब की स जा मुझे भ ु ग तनी चाहिए .	దీ న ంత టి కీ చె లలి ంచ ాల సింది నేను .	0.5606
- माफ करना . यह . . . - नहीं , मुझे कुछ कहना ही नहीं चाहिए था .	- ననను కషమించు . అది . . . - లేదు , నేను ఏమీ అన కుండా ఉండ ాల సింది .	0.6788
उसने कहा कि हम छो टे लोग हैं .	మనం ట రె ల ర లో ఉండే చెతత అననా డు .	0.5823
अगर मैं कै लि फो र निया जा पा ती ,	నేను క ాలి ఫో రని యా కు వెళళ గ లి గి ,	0.5535
मैडम , जरा मुझसे बाहर मि लिए .	మే డం , ఒకక నిమిష ం బయటకు రండి .	0.5695
याद है ह ंट ने कहा था कि को ल खेल छोड कर श हर से भाग गया था ,	కో ల ఎలా ఆట నుండి వె దొ లి గి , పా రి పోయి ఆన లెన లో ఒక అమమాయి ని	0.5876
अब हम दो नो ही ब चे हैं , दोसत .	నువ వ ూ నేనే అనుకుంటా , క ౌ బా య .	0.5634
तुमहें चो ट नहीं लग नी चाहिए थी . हमें यह छोड देना चाहिए .	నువ వ ూ గా య పడ డం మన పర ణ ా ళ ి క కాదు . మనం ఇది ఆడ డం ఆ పే య ాలి .	0.6112
मुझे तुम पर बहुत ना ज है कि तुम कॉ ले ज शुरू कर रही हो .	నువవు కాల ే జీ చ దు వు పరా రం భి ంచడం , నాకు చాలా గర వ ంగా ఉంది .	0.6143
अब बस चार गा ड ियाँ ब ची हैं .	ఇంకా నాలు గు కార లే మి గి లా యి .	0.5014
अं कों के अ ला वा . यह को ड है .	పా యి ంట లు కా కుండా . అది సూ చ న .	0.6431
मुझे छा त रा ल य में रहना है .	నాకు వ స తి గ ృ హం కావాల ను ంది .	0.6029
अगर तुम जी ते तो कया करो गे ?	నువవు గె లి సతే ఏం చేసతా వు ?	0.5677
मुझे ढ ंग के कॉ ले ज में भर ती होना है , और मुझे . . .	నాకు నిజ మెన కాల ే జీ కి దర ఖ ా సతు చేసుకో వాలని ఉంది . . .	0.6724
- हैलो , लड कि यो . - कै सी हो ?	- హలో , లే డీ స . - ఎలా ఉననారు ?	0.6172
और मैंने उससे क सम ली थी कि वह किसी से नहीं क हे गा .	అత నని ఆ విషయం ఎవ రికీ చెపప వ దద ని మాట తీసు కుననాను .	0.6081
- मैंने उससे वा दा किया और मैं . . . - अचछा . तुमहें मुझे बता ने की जरूरत नहीं .	- నేను తన కు మాట ఇ చచా ను , ఇంకా నేను . . . - సరే . నువవు నాకు చెపప నవ సరం లేదు .	0.6840
मेरी कि सम त अचछी नहीं थी .	అది నిజంగా అద ృష టం కాదు .	0.5280
- शे री ? - नहीं , सब ठीक है .	- ష ె రీ ? - లేదు , పర వాలేదు .	0.6191
सब ठीक हो जाएगा , ठीक है ?	అంతా బా గ వు తుంది , సరేనా ?	0.5232
अगर वे आ ख िर तक न जाएँ .	వాళళు మొతత ం ఆడ న ంత వర కూ .	0.5593
तुमहारे पिता की मदद से .	త నని మీ నానన రా ని చచా రు	0.4798
हेदर , डॉ क टर ों ने कहा तुमहारी जान जा सकती थी .	హే థర , చని పోయి ఉండే దాని వని డా క టర లు చెపపా రు .	0.5879
वे हमेशा यही कहते हैं .	వాళళు అలాగే చెబు తారు .	0.5114
त ू मुझे 1 00 ड ॉलर दे गी .	నాకు 1 00 డ ాల రలు ఇవ వు .	0.6016
वह कितनी खू बस ू रत थीं .	ఆమె ఎంత అంద ంగా ఉ ందో .	0.4975
याद रहे , दो स तो , जो गाडी आ ख िर तक टि की रहे गी , वही वि जे ता कह ला ए गी .	గురతు ందా , మి తరు లా రా , చి వర గా వెళ ు తూ ఉండే కారు వి జే త అవు తుంది .	0.6545
पता है यह मुशकिल है ,	ఇది కష ట మెన దని తెలుసు ,	0.5269
- मुझसे और . . . - मैंने तुमहें प ले यर स ब ॉल की	- నేను ఇంకా . . . - నేను మిమమలని ప లే య ర బ ాల ,	0.6923
हेदर ! हे भगवान , मैंने तुमहें हर जगह ढूँढ ा .	హే థర ! దేవుడా , నీ కోసం అంతా వె తు కు తుననాను .	0.5516
य दि कोई 2 6 साल तक परा ंत का शे रि फ रह ता है ,	కొ ంత మంది సనే హి తు లను చేసుకో కుండా 2 6 ఏ ళళు	0.6293
धत तेरी . मैं अ वन में पि ज जा रख कर भूल गई .	ఛ , నేను ఓ వెన లో పి జ జా పెటటా నని మర చి పోయా ను .	0.6012
श रत लगा ओ गे कि क ॉर न हो ल में हरा सकती हूँ ?	నేను నినను కార న హో ల ఆట లో ఒ డి సతా నని ప ంద ె మా ?	0.6250
कोई बात नहीं . सब ठीक है . सब ठीक है , बो .	పర వాలేదు . పర వాలేదు . అంతా బాగానే ఉంది , బో .	0.5336
और अब हमारी तुम लोगों पर क डी नजर होगी .	ఇక నుంచి మీ అంద రి నీ డే గల లా గ మని సతు ంటా ము .	0.5299
कयोंकि मुझे जल न हुई .	నాకు ఈ ర ష య కలి గి ంది .	0.5367
- ठीक है ? - शुकरिया .	- సరేనా ? - ధనయవాదాలు .	0.5324
और अधि क तर वि चार झूठ - म ूठ के होते हैं .	ఇంకా ఎకకువ గా ఆ ఆలోచ నలు , స ృష టి ంచ బడి న వే .	0.6305
उनहोंने खेल रो क दिया तो ग ड ब ड हो जाए गी .	వాళళు ఆట ఆ పే సతే , మన పని అయి పోయి న టటే .	0.5628
पर वह कोई ट रे नि ंग वाली पि सत ौ ल हो नी थी .	అది ఆ శి కష ణ తు పా కీ లలో ఒకటి అయి ండ ాలి .	0.5821
मैं यह मान ना चाहता हूँ कि वह मुझसे सच कह रही है , पर . . .	తను నాతో నిజం చెబు తు ందని నాకు నమమ ాలని ఉంది , కానీ . . .	0.6049
कहा था , देख ने ला य क खास कुछ नहीं है .	చెపపా ను గా , చూడ డానికి పెదద గా ఏం లే దని .	0.5936
च ौ द ह नंबर वाली ह री वाली में रे ह ॉल .	ఇంకా ఆ కు ప చచ కారు , నం బ రు 1 4 లో , రే హ ాల .	0.6237
और इसी वजह से हम ट रे ल र में रह ते हैं .	ఇంకా అందుకే ట రె ల ర లో ఉ ంటుననా మ ననా డు .	0.5748
यह का ग ज का ट ु क डा .	ఇకకడ ఉనన ఈ కా గి తం .	0.5282
खिला डि यों को सोच ना था कि वह अस ली है .	అది నిజ మెన దని ఆట గా ళళు అనుకో వాల ంత ే .	0.5416
चलो भी , बस एक बार .	రా , ఒకక ఆట ఆడ దాం .	0.5621
मैं सो नहीं पा या .	నాకు ని దర ప టట లేదు .	0.4582
- इसे रख दो . - खेल ने की चीज नहीं है .	- తిరిగి పెటట ే య . - అది ఆ డు కునే ది కాదు .	0.6367
कोई संभा वना है कि मुझ पर लगा इ ल जा म ह टा ने में मदद करे ?	ఎంత వర కు అతను నా పె ఆ రో ప ణ లు తపప ి ంచే అవకా శ ాలు ఉననాయి ?	0.6693
