Hindi	Telugu	Similarity_Score
जिस के बिना ये सब म ुम किन नहीं था . हाँ .	వాళళు లే కుండా ఇదే దీ సా ధయ మ యయ ే ది కాదు . అవును .	0.5876
ब डे अफ सो स के साथ आपको ये बता ना पड रहा है	మీకు తెలియ చెయయ డానికి చి ంతి సతుననా ం	0.4734
दु ल ह न के तीन करो ड के शादी के जो डे व ग ै रह को लेकर कहा निया ँ निका लो .	ఇంకా కొనని సట ో రీ స కూడ పెటట ండి పెళళి డ రె స 3 కో టల నీ అలా ంటి వి .	0.6165
देखो जी , असल बात ये है कि हर सि मर न ने ही रो को किस नहीं किया .	చూడ ండి మె యి న పా యి ంట హ ర సి మర న హ ీ రో ని కి స చెయయ లేదు .	0.6229
मैं तेरी वा ट लगा कर रख द ूँगा .	నీ సంగ తి ఇపపుడు ఇపపుడు తే లు తుంది రా .	0.4793
कु त िया !	ద ె యయ ాల ూ !	0.3912
मैंने आ दिल को कि श त भी दे दी है .	నేను ఆ ది ల కి ఇ న సట ాల మె ంట కూడా క టటే సా ను .	0.5905
हे लो ! तुमसे मिल कर अचछा लगा . आप लोग पहली बार यहाँ आ रहे हैं ?	- హాయ ! నా కూ సంతోష ంగా ఉంది . - ఇది మొదటి సారి కదా మీరు ఇకకడ కి రా వడం ?	0.6075
मा ह वा री टर ै कर अ ंड ो त सर ग च कर में 3 दिन शे ष	మెన సట రు వల ట రా కర మీ ఓ వ యు లే ష సె కి లలో 3 రోజు లే మి గి లా యి	0.6373
तुमहें कया लगा , तुम मे हमा न हो इस पार टी में ?	ఈ పార టీ కి వచచి న గె సట ను కుంటుననా వా ?	0.5743
पर मैं तुमहें इतना बता ना चाहती हूँ कि मैंने कुछ नहीं किया .	కానీ ఒకటి మా తరం చెపప ాలి నీకు నే నె లాంటి తపప ూ చెయయ లేదు .	0.5838
नहीं ! कल रात मुझे सच में उससे पयार हो गया .	నో ! ని నన రాతరి నిజంగా నే తన తో పరే మ లో పడి పోయా ను .	0.5553
अचछा , अचछा , अचछा , अचछा . बस . . . अचछा , अचछा . एक से क ंड , एक से क ंड .	ఓ కే , అలాగే , అలాగే , సరే . జ సట సరే . ఒకక ని ము ష ం . ఒకక సె క న , ఒకక సె కను .	0.6542
जो गी : बाहर निकल ! बाहर निकल ! सा ला दरवा जा खो ल .	- బయట కి రా ! బయట కి రా ! - ఈ చెతత తలు పు తి యయ రా . . .	0.5589
- दरवा जा खो ल , ही रो ! ते रा मु ँ ह तो ड ूँगा ! - कर न : जो गी . . .	మర యా ద గా తలు పు తి య యి రా ! నా కొ డ కా ప గల గొ డ తా .	0.6226
आ सा ला तेरी गो टि यों से ह ॉ की खेल ता हूँ !	ఇపపుడు నేను నీ తో హా కీ ఆడ తాను !	0.5217
जैसे तुमहें कुछ याद है .	ఎ పపటి కీ గురతు ండి పో తుంది .	0.4690
सर दार चला गया कया ?	సర దా ర వెళ ి పోయా డా ?	0.3749
बहन चो द , मुझे निकाल यहाँ से , ल ंड ! सा ला . . .	ప నికి రా ని వా డా ! నన ని కకడ నుంచి బయట కి తీసు కె ళళు .	0.5960
हाँ जी , हमें इसके लिए कुछ तो करना होगा . ट वि टर पर जो ब वा ल म चा है , उसे रो क ना होगा .	అవును , మనం దీ నని ఎలా గ ెనా ఆ పి తీ ర ాలి . ము ందా ట వి ట తర లో పు కార లు ఆ ప ాలి .	0.6745
- सक ूल जाना . - हाँ .	- స కూ లు కి వెళళ ు . - అలాగే .	0.5531
और त ू सा ला किस करने वाला !	నువ వో చెతత కి స సర వి !	0.5060
नहीं .	లేదు .	0.3291
तो अगर हर सि मर न मैडम वहाँ जा के परा र थ ना करें और माफ ी माँ ग ें तो . . .	ఒక సారి హ ర సి మర న మే మ అకకడ కి వెళళి ప ూ జ చేసి కష మా ప ణ అడి గి తే . . .	0.6737
इसे अपने अंदर रख ो . दिल की ग हरा ई में द बा कर रख ो .	జ సట నీ తో నే ఉండ నీ . ఆ సీ క రె ట ని మన సు లోనే దా చే సె య .	0.6298
सर फ राज की पी आर टी म भी यहीं है , इसलिए दोनों को एक साथ ला ओ . हाँ ?	సర ఫ రా జ పి ఆర టీ ం కూడా ఇకకడ ే ఉంది మీరు వాళళ తో కో ఆర డి నే ట చే స కో ండి , ఓ కే ?	0.6266
अरे , मुझे अन देखा कर रही हो .	హాయ , ననను అస స లు ప టటి ంచుకో వ ట లే దే .	0.5627
मैं वय सत रहा . धयान भ ट का रहा . और इस ने मेरा पूरा साथ दिया .	నేను బి జీ గా ఉననాను . గా డి తపప ా ను . తను మా తరం ననను స పో ర ట చే సతూ నే ఉంది .	0.5975
आ दिल : पापा , फै कट री का उ द घ ा टन है .	నా ననా , మనం ఒక ఫ యా క ట రీ ఓ పె న చేసతుననా ం .	0.6280
अगर जो गी और हर सि मर न एक पयार भ री फो टो इं स टा ग राम करते हैं ,	జో గ ీ , సి మర న ఒక ర ొ మా ంటి క పి క ని ఇ న సటా గరా ంలో పె డి తే . . .	0.6232
तुम चा हो तो तो ड दो ब या ह .	నువవు కావాల ంటే పెళళి ర దదు చే సె య .	0.4729
सुन रही हूँ .	నేను వి ంటుననా ను .	0.3877
पता है , दिल से अब कोई शक नहीं है .	నీకు తెలుసా , నా మన సు లో ఏ అను మా న మూ లేదు .	0.5616
और परिवार को " ए म ब रे स " करे गी .	కుటుం బా నే ఎ ం బ రే స చే సతు ందని .	0.6056
सा मान उठा ओ !	ల గే జ తీ స కో !	0.4054
कैसे ? अचछा , ठीक है .	ఎలా , ఇలా గా ? ఓ కే .	0.5766
कुछ हुआ है . तुम किसी को बता नहीं सकती .	ఏదో జరిగింది . ఎవ వ రికీ చెపప కూడదు .	0.5603
हमें दवा की नहीं , दु आ की जरूरत है .	అంటే దేవు డే మన లని కా పా డ గల డ ంటా వా ?	0.5673
ता रा , ये सब तुमहारे लिए है !	తా ర , ఇ దంతా నీ కో స మే !	0.5782
जो गी : तु झ े मु फ त में मस ती करा ऊँगा . आ जा !	అ రే పి రికి వెధ వా ! ద ె ర యం ఉంటే బయట కి రా రా	0.6493
लडकी बिलकुल ना समझ है , यार .	తను ఇంకా చినన పిలల , బా బ ూ .	0.5771
. . . डा ंस फ लो र पर आ जाएँ .	డా నస ఫ లో ర మీద కి రా వడానికి .	0.5420
मुझे माफ कर दो .	నిజంగా సా రీ	0.4007
हाँ , थोडा आ राम कर लो ना . फिर आपको पूरा ए यर पो रट कार य कर म भेज द ूँगी .	ముందు ననను రూ ంలో కి వెళ లని వ వ ండి , ఎ యి ర పో ర ట ష ె డ యూ ల పం పి సతాను .	0.6691
जिस चीज की इ चछ ा सबसे जयादा होती है , वो है सच ची खुशी को कै द करना .	అత య ంత తపప ని కో రిక ఏంట ంటే ఆ మె రు పు ని కా ప చ ర చెయయ డం .	0.6374
मैंने तुमहें शर मि ंदा किया ना ?	నినను ఎ ం బ రె స చేసా ను , కదా ?	0.5642
मी ड िया को मैं संभाल ल ूँगा . चिंता मत करो .	నేను మీ డి యా ని హా ండి ల చేసతాను . భయ పడ కు .	0.5868
मुझे लगता है तुमहें फिर से इसे खो ल ना पडे गा .	నాకు తెలి సి నువవు మళళీ ఇవ ననీ మొద లు పెటట ాలి .	0.6087
पता है , आ दिल का कुछ तो चल रहा है .	ఆ ది ల ఏదో చేసతుననా డు , తెలుసా ?	0.5497
इस पर भरो सा रख ो , आ दिल .	ఆ ది ల , త నని నమ ము .	0.5650
- अ ना उ ं सर : अचछा , लड को और लड कि यो . - शुकरिया , यार .	- సరే . బా య స ఎ ండ గర లస . - థాంక యు , బ రో .	0.6541
अगर मे ड इन हे वे न ना काम हो गया , तो ये उसकी पहली हार होगी .	మే డి న హె వెన ఫ ే యి ల యి ఉంటే అదే తన మొ డ టి ఓ ట మ యయ ే ది .	0.6233
आपका प ं जा बी खा न दा न छो ले - भ ट ू रे की उममीद रख े गा , है ना ?	మీ పం జా బీ గె సట ు ల ంద రూ మంచి మస ాలా వ ంట లు ఎ కస పె క ట చేసతా రు కదా ?	0.6953
अ बे , बाहर निकल , लो ड ू ! खो ल !	తె రు వు బయట కి రా రా నీ అబబా ! ఏ య !	0.5800
पलीज , मैं वो नहीं कह रहा .	పలీజ , అది కాదు నేను చెబు తునన ది .	0.4854
देखो , तुमहारी माँ आई हैं .	హే , మీ మ దర వచచా రు .	0.5017
और आ ख िर में , पर किसी से कम नहीं , मेरी खू बस ू रत प तनी , ता रा .	ఇంకా చి వర గా , మరి మొదటి ది నా అంద మెన భా రయ తా ర .	0.5866
दूस री बात , जहाँ से इसकी शु रु आत हुई , मेरी माँ और मेरे पिता . शुकरिया .	తరవాత , ఇ దంతా ఎకకడ మొద ల య యి ందో , మా అమమా , మా నా ననా . థాంక యు .	0.6350
अब , वह बात करे गा या नहीं हर सि मर न से , पता नहीं ना .	హ ర సి మర న తో మాటలాడ తా డో లే దో తెలీదు కదా , కదా . . .	0.6137
आ ख िर वह है कहाँ ?	ఫ క , తన ె కక డు ంది ?	0.5629
छोड मुझे ! मेरा पै र ख ी ं च ना बंद कर ! छोड दे मुझे !	- వ దల ండి ! నా కా ళళు లా కక ండి ! వ దల ండి ! - జో గి	0.6458
इन वे डि ंग प ला नर ों को बेहतर पता होना चाहिए था .	ఈ వె డ డి ంగ ప లా న రస కా సత ఆలోచి ంచ ాల సింది .	0.5733
हाँ ? और यह पूरी जगह जरूर देख िए गा .	ఏంటి ? అంతా చూ సి వెళల ండి .	0.4587
ये अभी तक इतना भ रा हुआ कयों है ?	గ లా సి ం కా ఫ ు ల గానే ఉంది ?	0.5481
तुमहें अचछी लगे गी .	నీ కక ూ డా న చచు తుంది .	0.4839
तुमहें मुझसे शादी करने की जरूरत नहीं .	నువవు ననను పెళళి చే స కో వల సిన అవసరం లేదు .	0.5419
मुझे सि ंड रे ला नहीं बन ना .	నాకు సి ండ రె లలా డ రె స ఇషటం లేదు .	0.5616
- मैं ठीक लग रही हूँ ? - जब र द सत .	- నేను బా నే ఉననా నా ? - అ మే జి ంగ .	0.5946
सुना है उसने कोशिश की थी . वह उस पर चि ल ला दिया .	ఆ ల రె డీ ట రె చేసి ంది . జో గ ీ తన పె అ రి చా డు .	0.6167
फो टो का ए ंग ल गलत है , आप देख लो .	ఫో టో ఏం గి ల క రె క టు గా లేదు . కావాల ంటే చూడ ండి .	0.5419
शुकरिया , माँ . ची यर स !	థాంక సమ మా . ఛ ీ రస !	0.5018
- बुला सा ला पुलिस को ! - ग धा है त ू !	- పోలీసు లని పి లు ! - నువ వో ప నికి రా ని వెధవ వి !	0.5750
माफ कीजिए , नि जी माम ला है , पलीज अपने कम रे में जा इए .	సా రీ , ఇది పర స న ల మాట ర , పలీజ మీ రూ ం కి వెళల ండి .	0.6379
आज तुम घर पे हो ना ?	ఇ వాళ రూ ంలో నే ఉంటా వా ?	0.5101
और कुछ वे सटर न क पड ों के आ इ ड िया हों , तो बता ना . ठीक है ?	వె సటర న అవు ట ఫి టటే మెనా తెలి సతే చెపపు . సరేనా ?	0.5930
- त ू रु क , मा दर चो द ! - कर न : जो गी ! जो गी !	- అ గు రా ఆ రే య ఎంత దూ రం పా రి పో తా వు రా ! ! - జో గ ీ ! - జో గ ీ !	0.6683
कुछ नहीं . सब ठीक है .	ఏం లేదు . అంతా బా నే ఉంది .	0.4738
क बी र : हा जी भाई , ये बिल ली आपकी है ?	అ లీ భా య , ఈ పు లి మీ దే నా ?	0.5681
ये है ते रा सर फ राज , हाँ ?	ఇదే నా మీ సర ఫ రా జ ?	0.5514
सर फी , हमें इसे संभाल ना होगा . मी ड िया को तो मौ का मिल जाएगा .	సర ఫీ , మనం దీ నని హా ండి ల చెయయ ాల సి ందే మీ డి యా వాళల ంతా ఇకకడ ే ఉననారు .	0.5601
काम हो जाने पर सब कुछ जगह पर रख दी जिए गा ?	కానీ రి పే ర వ గానే సా మా నలు ముందు లా సర ద ె యయ ండి .	0.5463
और मुझे बहुत अफ सो स है ,	ఎ ండ , అ యా ం సో సా రీ ,	0.5512
बडी पर भा वि त हुई .	నాకు న చచి ంది .	0.4587
मैं उससे नहीं मिल सकती , ता रा . वो मुझे मार डा ले गा .	నేను త నని కల వ లేను తా రా , ననను చం పే సతా డు .	0.6079
वो खतम हो चुका है . सब खतम है . ये अब तुमहारा राज है .	అది జరిగి పోయింది . అద ంతా నీ చినన సి క రె ట .	0.5537
हाँ . और मैं अब पुलिस को बुला ऊँगा .	అవును . నే ని పపుడే పోలీసు లని పి లు సతాను .	0.5207
- इस को उठा के ले के जाओ ! - खो ल !	- వీ డిని ఇకకడ నుంచి లా కక ె ళల ండి ! - తె రు !	0.5938
मैं उसके कम रे में गई थी .	నే న త ని రూ ంలో కి కూడా వెళళ ా ను .	0.5119
अब नहीं है .	ఇపపుడు ఖ ా ళ ీ .	0.4008
गु ड म ॉर नि ंग .	గు డ మార ని ంగ .	0.5559
हे लो ?	హలో ?	0.3256
वो ना ली हमारा घर है . तुमहारा भी था .	ఆ లే బర ఏ రి య ాలో నే మా ఇ లలు . ఒక పపుడు నీ ది కూడా .	0.5077
य ंग पी पल स पार टी .	యం గ పీ పు లస పార టీ .	0.5616
तो , हम कया बात कर रहे थे ?	సో , ఏం మాటలాడు తుననాం ?	0.4847
जो गी और हर सि मर न बचचे हैं .	జో గ ీ , హ ర సి మర న ఇదద రూ కూడా చినన పిలల లు .	0.5718
अचछा , मेरी नौ करी . कयोंकि अगर मैं एक दिन दे री से पहुँ चा तो ट वि टर बंद हो जाएगा .	ఓ , నా జా బా . నే న ొ కక రోజు వెళళ కపోతే ట వి టర బ ంద చేసతా రు .	0.6203
एक तरफ , एक तरफ , एक तरफ रहो !	సె డు , సె డి వ వ ండి , వెన కకి ఉండ ండి !	0.3838
पर भा त से क हो कल तक इं स टा ग राम पर जो डे का एक पयार भ रा वी डियो होगा .	పర భా త కి చెపపు ఆ జ ంట య ొ కక హ యా పీ ఇ న సటా గరా ం వీ డి యో రే ప టి కి వ సతు ందని .	0.6505
ये हम ला करना हुआ .	ననను బె ది రి ంచ కు .	0.5243
- हाँ . - माफ कीजिए .	- యా . - ఎ కస క యూ జ మి .	0.5427
है ना ? तो फिर , जान , तुमहें अपने मु ँ ह पर ता ला लगा कर रख ना होगा .	అవునా ? మరి , స వీ ట హా ర ట , నువవు ఎపపుడూ నిజం చెపప దదు .	0.6498
मेरा वो मतलब नहीं था , पर . . .	నేను ఆ ఉద దే శ ంతో ఆడ గ లేదు , కానీ . . .	0.5977
तो तुमहें पहले से पता था ?	ఈ విషయం మీకు ము ందే తెలుసా ?	0.5114
चिंता मत करो . रख द ूँगा .	- ఖ ంగా రు పడ కు . - ఓ కే .	0.5590
आ शु : हम तुमहारी जान खत रे में नहीं डाल ेंगे , सर फी !	మీ లె ఫ ు ని రి స కు లో పెటట లే ం , సర ఫీ !	0.6043
हाँ .	అవును .	0.2761
उस ी के लिए हम यहाँ आए हैं . पलीज बैठ िए .	అందుకే మనం ఇకకడ కి వచచా ం . వెళళి కూ రచ ో ండి .	0.5838
" जे " नहीं , जो गी लि ख ना , पूरा नाम .	కాదు . " జో గ ీ " అని పూరతి గా రా యి .	0.5699
लडकी : ए . कि क मार , कि क मार .	హే . కి క చె య యి , కి క చె య యి .	0.4734
सा ला , कमी ना कहीं का ! चलो !	చెతత వెధ వా . పద ండి !	0.3692
और मुझे किस करना चाहता ,	ననను ము దదు పెటటు కుంటా న ంటే ,	0.4792
मे हर बा नी करके सिरफ बर ै ंड के बारे में बात करेंगे , ठीक है ?	బ రా ండు కి సంబం ధి ంచిన పర శ నలు మాతరమే అడ గ ాలి , సరేనా ?	0.6258
छोड ो ना , जान . मैं थ का हुआ हूँ .	క మా న , బ ే బ . నేను అ ల సి సి పోయా ను . .	0.6099
शुकरिया . बहुत - बहुत शुकरिया .	థాంక యు . థాంక యు సో మ చ .	0.4165
माफ कीजिए , दे वि यो और स ज जन ो .	ఎ కస క యూ జ మీ , లే డీ స ఎ ండ జె ంటి ల మెన .	0.6174
पापा के लिए चा य च ढ ा दे .	నానన కోసం టీ పె టటి తీసుకు రా .	0.5149
नहीं . नहीं , नहीं , नहीं ! रो ना बंद करो . जरा सोच ो . तुमहें असल में कया चाहिए ?	నో నో , వదదు , ఏ డ వదదు , ఒక సారి ఆలోచి ంచు . నువవు నిజంగా ఏం కో రు కుంటుననా వు ?	0.6313
खैर . यहाँ बद ना मी मेरे बे टे की हुई है .	ఏ దే మెనా వీ ట నని టి వల లా నా కొ డు కు జీవితం పా డె పోయింది .	0.5867
हाँ . बस बे श ुम ा र पैसे वाले लोगों की शादी हो रही है .	ఆ . కేవలం క రే జీ ధన వం తులు పెళళి చేసు కుంటుననా రు .	0.6378
मे ह ंद ी वाली : हाँ , हाँ . ढूँढ ही नहीं पा एँगे . पकका .	సరే . అయి నా కూడా ఆయన కని పెటట లే రు .	0.5289
आ ख िर कार किसी के कह ने पर तो खाना प का ने लगी .	ఇ పపటి కె నా త నని వ ంట చేసే లా చేసా రు .	0.5493
उसके साथ हम बि स तर हो जा ऊँ तो कोई ए त राज ?	ఒక వే ళ నేను తన తో బె డ ష ే ర చే స కు ంటే నీకు పర లేదా ?	0.6068
और हर सि मर न मैडम अपने हाथ ों से पर शा द भी तो बना सकती हैं जो गि ंदर जी के लिए ,	హ ర సి మర న మా మ తన చే త తో పర సా ద ం చేసి తి ని పి ంచ చచు జో గ ీ ంద ర కి	0.6517
- आप से मिल कर अचछा लगा . - हे लो .	- కలి సిన ందుకు సంతోష ంగా ఉంది . - హలో .	0.5609
पर , बेटा , तुम इसे थोडा अचछे से संभाल सकते थे ना ?	కానీ , మీ రి ం కొంచెం జా గర త గా ఉండ ాల సింది .	0.5843
बाहर कहाँ ?	బయట ంటే ఎకకడ ?	0.3668
फिर ं गी और त : माफ कीजिए . मैं जा सकती हूँ ?	- ఎ కస క యూ జ మి . నేను అలా వెళళ చచా ? - తె రు , తె రు , తె రు , తె రు . . .	0.5455
