Hindi	Telugu	Similarity_Score
1 00 से जयादा सै नि कों को आपकी च ौ की पर नहीं भेज पा ए ं गे .	మీ బ లో పే తం కోసం 1 00 ద ళ ాల కంటే ఎకకువ పం ప లే ము .	0.6633
ही ना पा किस ता न में हमारी जा सूस है .	పా కి సతా న లో హ ీ నా మన గ ూ ఢ చా రి .	0.5384
ये पा ं च रा स ते और भ ु ज र न वे को तो ड दे .	ఈ ఐ దు మా రగ ాలు మరియు భు జ ర న వే .	0.6424
मैं और मेरे सा थी सु ंदर बे न के साथ ह वाई प ट टी जरूर बना ए ं गे .	నేను మరియు నా బ ృ ంద ం సు ంద ర బె న తో కలిసి ఎ యి ర సట రి ప ను పు న రని ర మా ణం చేసతా ము .	0.6533
अगर हम फा इ टर प ले न से वि घ ा को ट च ौ की पर	మన ము దా డి చేయ డానికి యు దధ విమా నా లను ఉ ప యో గి సతే	0.6025
वि कर म बल जी त से सं पर क नहीं हो पा रहा है .	వి కర మ , నేను సం పర ది ంచ లేను , బ ల జీ త .	0.6634
आप लोगों पर कोई द बा व नहीं है .	మీ పె ఎలా ంటి ఒ తతి డి లేదు .	0.5163
वि घ ा को ट पो सट की तरफ जाते हुए देखा हैं .	వి ఘ ా కో ట పో సట వెపు క వా తు చేశారు .	0.6135
बहुत श ौ क है उसे कि मैं घ ो डी च ढ ू ढ ो ल ब जे	ననను వ రు డి లా చూడ ాల నే ది ఆమె కల .	0.6069
1 5 00 हि ंद ु सता नी फ ौ जी व हां मौ जू द है .	1 5 00 మంది భా ర త సె ని కులు అకకడ నియ మి ంచ బడ డా రు .	0.6534
और प श चि मी भा रत का जि तना जयादा से जयादा इ ला का अपने कब जे में ले सकते हो ले लो .	మరియు ప శ చి మ భా ర త దేశం య ొ కక అనే క భ ూ భా గ ాలను సవా ధ ీ నం చేసుకో వచచు .	0.6626
इसलिए मैंने फै सला किया कि	కాబటటి నేను నిరణ యి ంచు కుననాను ,	0.4652
फिर हि न दु सता नी से ना चाह े सम ंदर से आ ये	ఒక వే ళ భా ర త సె న యం అయి నా స ము ద రం గు ండా నే వ సతుంది ,	0.6215
अब क चछ और भ ु ज की सुरकष ा आपके ही के हाथ ों में है .	క చ మరియు భు జ య ొ కక భ దర త మీ చే తు లలో ఉంది .	0.6731
पा किस ता न का पर च ं म !	పా కి సథా న జె ండా !	0.4269
1 9 7 0 में पू र वी पा किस ता न के बा ंग ला मु स ल मान ों और हि ंद ु ओं ने मिल कर	బ ంగ లా ము స లి ం లు మరియు త ూర పు పా కి సతా న య ొ కక హి ందు వు లు	0.6682
धी रे - धी रे रे गि सता न में आता है .	క ాలు వ ద వా రా ఎ డా రి లో నె మమ ది గా పర వ హి ంచి	0.5651
और हि ंद ु सता न कि से ना में वी र ों की कोई कमी नहीं	మరియు భా ర త సె న యం లో హ ీ రో ల కి కొ ర త లేదు .	0.6195
शा बा श .	మంచిది .	0.2963
नि शा ना !	లకష యం !	0.3664
सभी ट ै ं कों को बा ई ं ओर चला ए ं .	అనని ట యా ం కు లను ఎడ మ వెపు కు తి పప ండి .	0.5757
कि तने फ ौ जी मौ जू द है व हां ?	అకకడ ఎ నని ద ళ ాలు నియ మి ంచ బడ డా యి ?	0.5785
स रह द ों से कह कर आया था	సరి హ దదు లకు వా గ దా నం చేశా డు .	0.5225
ऑ परे शन ह ूर में इस ची ल का काम था पा किस ता नी से ना की अ ंद ु रु नी ठ ि का नों में झ क ना	అతని ఉద యో గం ఆ పరే షన హ ూర లో పా కి సతా న ర హ సయ పర దే శ ాలను గుర తి ంచడం .	0.6530
प ग गी ने जान वर तो नहीं कट ने दि ये	పా గి జ ం తు వు ల మా రణ హో మా నని అను మ తి ంచ లేదు .	0.5922
ऑ परे शन ह ूर शुरू कर दो .	హ ూర ఆ పరే షన ను పరా రం భి ంచండి .	0.5362
म गर भगवान श री कृ ष ण ने कहा है	కానీ శ రీ క ృష ణ ు డు చెపపా డు	0.5832
एक बार भ ु ज ह वाई अ ड डा कब जे में आ गया	ఒక సారి భు జ విమా నా శ ర యం మన నియ ంత రణ లో కి రా గానే	0.5983
तो ल डा ई खतम होने के बाद 1 9 6 5 की तरह	అపపుడు వారు మా తో చ రచ లు జర ప డానికి పరయతని సతారు	0.5302
व हां पर प ले न का सही सला मत लै ंड होना	ఈ విమానం ల యా ండి ంగ సు ర కషి తంగా ఉండే అవకా శ ాలు ,	0.5688
लै ंड मा इं स और गो ला बा रू द मिले ले आई ये .	ల యా ండ మెన స మరియు పే లు డు ప దా రథ ాలు మీరు పొ ంద వచచు .	0.6196
ल कष म ण . ठ े के दार को बुला के र न वे रि पे यर करवा ना शुरू करो .	లకష మ ణ . కా ంట రా క టర కు కాల చేయ ండి మరియు ర న వే మర మమ తు చేయడం పరా రం భి ంచండి .	0.6474
सर ये प ले न 5 00 सै नि कों को लेकर उ ड नहीं पा ये गा .	సర , ఈ విమానం 5 00 ద ళ ాలను తీసు కె ళల లేదు .	0.6214
- समझ ग ये ? - जी सर .	- అరథ మె ందా ? - సరే అ ండి .	0.5885
इन सै नि कों को सि वि लि यन बो ट से भे जा गया है .	ఈ ద ళ ాలను ప ౌ ర పడ వల ద వా రా పం ప బడ డా యి .	0.6210
हि ंद ु सता न से अप नों का दु ख देखा नहीं गया .	వారి స వ ంత దే శ పర జ ల దు ః ఖ ం భా ర త దేశం త టటు కో లేక పోయింది	0.5912
और उनके साथ छो टा सा व या पार करेंगे .	మరియు ఆమె తో చినన వయా పార ఒ పప ంద ం చేసు కుంటా ను .	0.5443
बेहतर .	మంచిది .	0.3228
भ ु ज ह वाई कष े तर के क मा ं डि ंग अफ सर साह ब . . .	భు జ ఎ యి ర ఫీ ల డ క మా ండి ంగ ఆ ఫీ సర . . .	0.7021
व कार आप सो मना थ के साथ जा ई ये .	వ కార , సో మ నా థ తో వెళల ండి .	0.5702
रॉ ने रण छोड भाई के हाथ में एक बहुत मह त व पू रण सं चा ल न की बा ग डो र सौ ं प दी .	రా రా న చో డ భా య ను చాలా కలి షట మెన ఆ పరే షన తో పర దా నం చేసి ంది .	0.6633
बे क सू र जान वर ों कि हतया नहीं होने देंगे .	అ మా య క జ ం తు వు య ొ కక మా రణ కా ండ ను ఎ పపటి కీ అను మ తి ంచ వదదు	0.5848
और 5 0 परति श त हि स से में रे गि सता न है .	మరియు మి గి లి న 5 0 శా తం ఎ డా రి .	0.6277
ज य भ वा नी !	హా యి ల భ వా ని	0.4355
" शा ह जहाँ पयार का बाद शा ह है . "	" షా జ హా న పరే మ చ కర వర తి . "	0.5735
पू ल के दोनों तरफ बा रू द लगा हुआ है	వ ంత ె న రెండు వెపు లా పే లు డు ప దా రథ ాలు ఉననాయి	0.5643
जी जना ब .	సరే అ ండి .	0.3560
पा किस ता न का पर च ं म !	పా కి సథా న జె ండా !	0.4269
फा यर !	కాల చు !	0.3728
ज य क न है या ला ल की . . .	శ రీ క ృష ణ ు డి కి మ హి మ	0.5862
ती स ला ख जना ब .	మూ డు లకష లు , సా ర .	0.5548
चलो ! चलो !	క ద లు ! క ద లు !	0.3632
और हि ंद ु सता न का सबसे ख ूँ खा र दु श मन .	మరియు భా ర త దే శ పర ధా న శ తరు వు .	0.6314
और 5 0 टा इ म ब म गि रा के भ ु ज ह वाई अ ड डे को त बा ह और बर बाद कर दिया .	మరియు భు జ ఎ యి ర బ ే స లో 5 0 టె ం బా ం బు లను వే సి భు జ వె మా నిక సథా వ రా నని ధ వం సం చేసి ంది .	0.6583
मार दिया जा ये ! मार दिया जा ये !	అత డని చం పు ! అత డని చం పు !	0.4845
जा मन गर से या पु ना से	జా మన గర లేదా ప ూ ణ ే	0.5338
प श चि मी पा किस ता न के जु ल म से मु क ती दिल वा ए गी .	ప శ చి మ పా కి సతా న దారు ణ ాల నుండి కూడా .	0.6133
कया ये मु स ल मान ों के साथ ग द दा री नहीं थी .	ఇది ము స లి ం లకు చేసిన ద రో హం కా దా ?	0.6122
मार दिया जा ये ! मार दिया जा ये !	అత డని చం పు ! అత డని చం పు !	0.4845
बर खा की जल धा रा च रण प खा र ती	వర ష పు చు కక లు మీ పా ద ాలను క డుగు తా యి	0.5667
त ू ह ं जू मै न ू दे दे	మీ క ననీ ళలు నాకు ఇవవ ండి	0.4611
मी राम ड और अब बू	మీ రా మ ద మరియు అబ బు	0.5103
सा ंस ें व त न की है उ धा री	దే శా నికి నా ఊ పి రి	0.4569
और ठीक बा रह ब जे वापस चला जाता है .	అర ధ రాతరి నా టి కి త గ గు తుంది .	0.5755
त ू ह ं जू मै न ू दे दे	మీ క ననీ ళలు నాకు ఇవవ ండి	0.4611
सर भ ु ज और जा मन गर पर पा किस ता नी ल डा कू विमान ने अब तक का सबसे बडा हम ला किया है .	పా కి సతా న జె టలు జా మన గర సథా వ రా నికి భా రీ న ష టా నని కలి గి ంచా యి . .	0.5960
एक रात में र न वे रि पे यर किया .	ఒక ే రాతరి లో ర న వే ను మర మమ తులు చేశారు .	0.5701
अब हम अपनी से ना चाह े राज स था न से भे जे या पू ना से भे जे या जा मन गर से भे जे	మన ము మన ద ళ ాలను రా జ సథా న , ప ూ ణ ే లేదా జా మ న గర నుండి పం పి నా	0.6346
उनहोंने ज ं गे लगी ना जो रू के लिए ना जर रे के लिए और ना ज मी न के लिए .	అతను మ హి ళల ఆ స తి , లేదా సం పద కోసం ఈ యు దధ ాలు చేయ లేదు .	0.6166
इस गा ं व में अब सिरफ बचचे बु जु र ग और और त ें है .	ఈ గరా మ ంలో మ హి ళలు , పిలల లు మరియు పా త వయ క తులు మాతరమే ఉననారు .	0.5937
ये सै निक 4 से 8 घं टे में आपकी च ौ की पर पहुँच जाए ं गे .	వారు మీ పో సట కు 4 - 8 గంట ల లోప ల చే రు కుంటా రు	0.6322
वि कर म , हमारा मि शन स फ ल हो गया है .	వి కర మ , మి షన వి జ య వ ంత మెంది .	0.5703
झूठ बो ला हम से . उसने हमें झा ं सा दिया है .	అతను మాకు అబ దధ ం చెపపా డు . అతను మమ మ లని మా య చేశా డు .	0.5921
सा ंस ें व त न की है उ धा री	దే శా నికి నా ఊ పి రి	0.4569
श हि द बन कर जाए ं गे	అమ ర వీ రు లు గా బర తు కు తా ము	0.5229
सा ंस ें व त न की है उ धा री	దే శా నికి నా ఊ పి రి	0.4569
- सर . . . - जी .	- సర . . . - చెపపు .	0.7881
दुनिया का न क शा हमेशा के लिए बदल गया	పరపంచ ం య ొ కక భ ూ గో ళ శా సత రం శా శ వ తంగా మా రి పోయింది .	0.5162
हां म रा ठा बा ग .	అవును , మ రా ఠ ా బా గ .	0.4676
इसलिए पा किस ता नी विमान ों ने भ ु ज ह वाई अ ड डे की ह वाई प ट टी तो ड दी .	పా కి సతా న విమా నాలు భు జ ఎ యి ర సట రి ప ను ధ వం సం చేశా యి .	0.6355
- सिरफ 1 2 0 सर ? - जी .	- కేవలం 1 2 0 , సర ? - అవును .	0.6791
और बहुत म ुम किन है कि तब तक हि ंद ु सता नी फ ौ ज व हां तक पहु च जा ये .	మరియు భా ర త సె న యం అ పపటి వర కు ఉ ప బ ల ాలను పొ ంద వచచు .	0.6846
च ट टा नों से ख डे है रह दी ल लड ने को तैयार	బ ండ లా సథి ర ంగా , ఎ లల పపుడ ూ పో రా డ టానికి సిదధ ంగా ఉంది .	0.5836
त ू जग न ु भ ु ला के	పరప ంచా నని వది లి వే య ండి	0.4554
सब दि वय द ृ ष टी के पो ष क हो	ద ె వి క కా ంతి లో మన ము చ లల గా ఉండ చచు	0.6041
क चछ और भ ु ज को हि ंद ु सता न से का ट दिया है .	మరియు భా ర త దేశం నుండి క చ ను మరియు భు జ ను క తతి రి ంచారు .	0.6068
हमारे पास इस वकत 1 00 ट ै ंक , 1 8 00 फ ौ जी मौ जू द है	మన దగగర ఇపపుడు 1 00 ట యా ం కులు పర సతు తం 1 8 00 మంది ద ళ ాలు ఉననాయి ,	0.7000
ते रा बेटा दू ल हा बन कर आया है .	మీ కొ డు కు వ రు డి గా వచచా డు . . . అని . .	0.5758
मैं आपका साथ दू ं गा .	నేను మీకు సహా యం చేసతాను .	0.4543
या खु दा . . . तेरी अ दा लत में मेरी एक ज मान त रख ना .	దేవుడా . . . మీ కోర టు లో నా కోసం ఒక సథ లా నని సు ర కషి తంగా ఉ ంచండి . .	0.6444
जिस से मैंने जी ने मर ने का वा दा किया था .	నేను జీవి ంచడం మరియు చని పో వడం కోసం వా గ దా నం చేశా ను .	0.5498
बल ली कि त थे है ?	బ లలి ఎకకడ ఉననాడు ?	0.4532
हम सै नि कों को भेज ने की कितनी भी कोशिश कर लें .	మీ పో సట కు ద ళ ాలను పం ప డానికి మన ము ఎంత కష ట పడ డా మో అది అన వ సరం .	0.5675
उ ड ने के लिए तैयार है सर .	ఎ గర డానికి సిదధ ంగా ఉంది సా ర .	0.5606
क डी तुमने बंद की थी ना ?	మీరు తలు పు తా ళ ం వే శా రు , కా దా ?	0.5322
और दूस री तरफ रे गि सता न का ग हरा दल दल .	మరియు మర ొక వెపు ఊ బి ఉననాయి .	0.5153
वि घ ा को ट च ौ की से .	వి ఘ ా కో ట పో సట .	0.4571
यु द ध के द ौ रा न आप आ म ना गर ि कों से काम नहीं करवा सकते .	మీరు యు దధ సమయం లో ప ౌ రు లను ఉ ప యో గి ంచ కూడదు .	0.6400
इं शा अ ल ला ह अब हमारी मु ला का त पर सो होगी .	అ లలా అను కు ంటే , మన ము రెండు రోజు లలో మళలీ కలు సతా ము .	0.5770
ते रा कर म और त िर ं गे का क फ न .	మీ దయ త రి వర ణ ప తా క ంతో చు టట బడి ంది . .	0.6415
जब तक हमारे जि सम में ख ून की एक भी बू ंद बा कि है	మన శ రీ రం లో ఆ ఖ రి చు కక రక తం వచచే వర కు	0.6356
वि घ ा को ट से भ ु ज ह वाई अ ड डे का रा सता त करी बन 1 7 0 कि लो मी टर के फा स ले पर है .	వి ఘ ా కో ట నుండి భు జ ఎ యి ర బ ే స కు 1 7 0 కి లో మీ టర లు అవు తుంది .	0.7098
हम रे अ म ृ त सर , श री न गर , प ठा न को ट , अ व ं ती पु र ,	వీ టి పె దా డి చేయడం ద వా రా , శ రీ న గర , ప ఠ ా న కో ట , అవ ంతి పూర	0.7174
या त िर ं गे में लि प ट कर आ ना .	లేదా మీరు దాని లో చు టటి ఉనన పపుడు .	0.5417
और ति स रा	మరియు మూ డు	0.4129
ब धा ई हो .	అభి న ంద నలు .	0.4225
तो हि ंद ु सता न का खेल खतम .	అపపుడు భా ర త దే శ ము ఆట ము గు సతుంది .	0.5520
जा ध व जी भाई .	జా ద వ జీ సోద రు డు .	0.4982
रे श म का हो वो दो शा ला	నా ర వ సత రం లో ఉననా	0.4903
अगर हमने 2 घं टे के अंदर हरा मी ना ला पार कर ली या ,	మేము హ ర మి నా లా ను రెండు గంట లలో దా టి తే	0.5797
कि हमारे सर कट जाए ं गे	మన ము మన తల లు కో ల పోయి న పపటి కీ	0.5091
खबर देने के लि ये शुकरिया .	సమా చా రం అ ంది చి న ందుకు ధనయవాద ము లు .	0.5095
रख ता हूँ !	అయి పొ యి ంది !	0.3552
अग ला आ देश आपको जलदी मिल जाए ं गा .	మీరు తవర లో మీ త దు పరి ఆ దే శ ాలను పొ ందు తారు .	0.5509
व हीं ढ ा ई सौ जवा न इस मि शन पर मेरे साथ चले .	వారి జీవి తా నికి వి లు వ ఇవ వని వారు ఈ మి షన లో నాతో కల వచచు .	0.5658
एक माँ के बन कर आ ये थे	మా తల లి కి కొ డు కు గా జ న మి ంచారు	0.5172
एक और सा यर न ब जे गा .	మీరు మర ొక సె ర న వి ంటా రు .	0.5553
एक माँ के बन कर आ ये थे	మా తల లి కి కొ డు కు గా జ న మి ంచారు	0.5172
जना ब चा य .	సర . టీ .	0.3706
हि ंद ु सता नी ने वी ने हमारे व ॉर शि प	భా ర త నా వి కా ద ళ ం మన యు దధ న ౌ కను ము ంచి వే సింది	0.5954
लं बी नी ंद से जा ग कर हम अग ले जन म फिर आए ं गे	మేము మళలీ మా ని దర నుండి తిరిగి నినను ర కషి ంచ డానికి వ సతా ము	0.5441
हे पर मे श वर , हे भ ग वन ,	ఓ దేవు ళల దేవు డు	0.3737
लं बी नी ंद से जा ग कर हम अग ले जन म फिर आए ं गे	మేము మళలీ మా ని దర నుండి తిరిగి నినను ర కషి ంచ డానికి వ సతా ము	0.5441
तो फिर कया रा सता है ?	అపపుడు మనకు ఏ అవకా శం ఉంది ?	0.5132
ये पा ं च स ड के भ ु ज जाती है .	వీ టి లో ఐ దు మా రగ ాలు భు జ కు వెళ తా యి .	0.6260
श री ग ण े शा दे वा श री ग ण े शा	నమ స కా రం గ ణ ప తి దే వా	0.5856
ग म ना करने देश मेरे हम जब भी याद आए ं गे	మీరు మా గురించి ఆలోచి ంచిన పపుడ లలా బాధ పడ కు , ఓ మా త ృ భ ూ మి	0.5689
ग म ना करने देश मेरे हम जब भी याद आए ं गे	మీరు మా గురించి ఆలోచి ంచిన పపుడ లలా బాధ పడ కు , ఓ మా త ృ భ ూ మి	0.5689
ठीक है सर .	సరే , సరే సా ర .	0.4135
वि कर म सर टे क ऑ फ करने वाले हैं .	వి క రం సర బయ ల దే ర డానికి సి దద ం గా వు ననా రు .	0.5919
इ ति हा स ग ढ े जा ये परति पल	చ రి తర పరతి కష ణం స ృష టి ంచ బ డు తుంది	0.5683
लेकिन बॉ क सि ंग रि ंग में जी तने वाला	రి ంగ ( వల యం ) య ొ కక ఈ ఛ ా ం పి యన	0.5579
तो समझ ो क चछ गया दु श मन के हाथ में	అపపుడు మన ము క చ ను శ తరు వు ల చే తి లో కో ల పో తా ము .	0.5828
श हि द बन कर जाए ं गे	మరియు అమ ర వీ రు లు అవు తా ము	0.5019
