Hindi	Telugu	Similarity_Score
- मुझे फर क नहीं पड ना था . - मुझे लगा ही था .	- నేను ప టటి ంచుకో ను . - ప టటి ంచుకో వ ను కుననాను .	0.5786
पै निक	పా నిక	0.4095
मेरे पास कोई चा रा नहीं था .	నాకు ఇం కే దా రి లేక పోయింది .	0.5190
पर शे रि फ भी उसे खो ल सकते हैं .	కానీ ష ె రీ ఫ కూడా అది తె ర వ గల రు .	0.6146
हमें पै स ों की त ं गी होने लगी	మాకు డబబు సమసయ లు మొద ల య యా యి ,	0.5233
मे ल नी . . .	మె లని . . .	0.6565
अभी भी कै लि फो र निया जाना चाहती हो ?	నువవు నిజంగా క ాలి ఫో రని యా వెళ తా వా ?	0.4968
नै ट ली ने कहा ऑ डि शन के लिए है .	నా ట లీ అది ఆ డి షన అని చెపపి ంది .	0.5853
वह नहीं चाहती कोई जाने कि उसने पै निक के लिए कितनी पढ ा ई की .	ఆమె పా నిక కోసం ఎంత అ ధ యయ నం చేసి ందో ఎవ రికీ తెలియ కూడ ద ను కు ంది .	0.5959
हेदर नि ल	హే థర ని ల	0.3926
हाँ .	సరే .	0.3574
व ु की , ट वि सट .	వ ూ కీ , ట వి సట .	0.5955
बा य , यार . बा य .	బె . మి తరు లా రా .	0.4668
हेदर नि ल	హే థర ని ల	0.3926
बि श प .	బి ష ప .	0.5136
याद है , तीन साल पहले तुमने एक लडकी की बात की थी ?	మూ డే ళళ కరి తం ఒక అమమాయి గురించి చెపపా వు గురతు ందా ?	0.5834
डॉज मे सन की बहन ?	డా డజ మే స న చె లలా ?	0.5240
बस त भी उसे हाथ लगा या .	ఆమె ను అదే ము టటు కో వడం .	0.5592
धयान ह टा तो भा ला मु का ब ले में ध रे रह जाओ गे .	ద ృష టి పెటట కపోతే జ ౌ సట నినను నా శ నం చే సతుంది .	0.6347
हैलो वी न , तीन साल पहले , जिस रात डे ना को चो ट लगी . . .	మూ డే ళళ కరి తం , హ ాలో వీ న రోజు , డే నా గా య పడి న రాతరి . . .	0.6519
सी ढ ि यों पर सं भ ल कर .	ఆ మె టల మీద జా గర తత .	0.5810
न क शे के अनु सा र फा ट क तक पहुँच ो	ఆడ ాల ంటే ఈ గే టు మయా ప అను సరి ంచు	0.6198
सा ला .	అబబా .	0.2667
धत तेरी .	అయ యో , ఛ .	0.4018
हेदर .	హే థర .	0.3956
अचछा , लि ली .	సరే , లి ల లీ .	0.4071
हैलो , ए .	హాయ , హే .	0.4965
मैं इसे फ ें क ती हूँ , ठीक है ?	నేను ఇది వి సు రు తాను , సరేనా ?	0.5351
चलो , लि ली .	రా , లి ల లీ .	0.3914
कया कर रही हो , मे ल ?	ఏం చేసతుననా వు , మె ల ?	0.5918
डे ना के लिए आई थी . मेरे पास सब ूत है .	ఇకకడికి డే నా కోసం వచచా ను . రు జు వు ంది .	0.5935
लू क ह ॉल वहाँ नहीं हो सकता था .	లూ క హ ాల అకకడ ఉ ండి ఉండ కపో వచచు .	0.5839
वही तो कहना चाहते हैं .	సరి గగా అదే మే మూ అనే ది .	0.4918
एक पक की स हे ली ही ऐसी चि ट ठ ियाँ लि ख सकती है . मतलब ,	ఒక పరా ణ సనే హి తు రాల ే ఇలా ంటి చ ీ టీ లు రా య గ లు గు తుంది .	0.6356
हमें शि वि र के इ नाम मिल ेंगे .	మాకు క యా ం ప అ వార డు లు ఇ సతారు .	0.5697
ए , रुको .	హే , ఆగు .	0.4993
मैं खेल ना नहीं चाहती थी .	నాకు కొ న సా గి ంచ ాలని లేదు .	0.5004
हाँ .	సరే .	0.3574
नहीं .	లేదు .	0.3291
मैंने आप से कहा , आप समय जा या कर रहे हैं .	చెపపా ను గా , మీ సమయం వ ృ థా చేసు కుంటుననా రు .	0.5663
ज ॉन ?	జా న ?	0.3776
" डॉ क . "	" డా క . "	0.6124
शे रि फ .	ష ె రీ ఫ .	0.4995
वह खेल छोड रहा है .	తను వదిలే సతుననా డు .	0.4582
चाहती हो कि वह सा रा पै सा लेकर भाग जाए ?	నువవు అతని ని ఆ డబబు తో పాటు వదిలే సతా వా ?	0.5395
मैं गाडी चला ऊँगा .	నేనే నిర వ హి సతాను .	0.4530
पर मैं ह ॉल भा इ यों को जी तने नहीं द ूँगा .	కానీ నేను హ ాల కుటుం బీ కు లను గె లవ నివ వ ను .	0.6077
कयोंकि मैं ह ॉल भा इ यों को जी तने नहीं द ूँगा .	ఎందుకంటే నేను హ ాల కుటుం బీ కు లను గె లవ నివ వ ను .	0.5855
नहीं .	అయ యో .	0.3368
पै स ों की जि म मे दा री अ मी र बचचे को कभी मत दो .	ధ నిక పిలల వాడు మధయ వర తి గా ఉంటా డని అనుకో లేదు .	0.5992
डॉज को पता है ?	డా డజ కు తెలుసా ?	0.5084
पर उसकी गिर फ ता री से एक रात पहले ओ क पार क में एक लडकी की ला श मिली .	కానీ అ రె సట యి న ముందు రాతరి , ఓ క పార క లో ఒక మ మా యి చని పోయి కనిపి ంచింది .	0.5891
पर उसकी कहानी में , तीन साल पहले जो हुआ , उसके लिए तुम दो ष ी हो .	కానీ అతని పర కా రం మూ డే ళళ కరి తం జరిగి న దానికి నువవు బాధ యు డి వి .	0.6179
जब उसने एक बक सा गि रा या , तो मैंने वहाँ पै निक की ए लब म देख ी .	తను ఒక పెటట ె ను త నని నపపుడు ఒక పా నిక చి తతు పు సత కా నని చూశా ను .	0.6476
उसे यकीन था कि लू क के चल ते डे ना वही ल चे यर में है , पर नहीं .	లూ క వల న డే నా చ కర ాల కు రచ ీ లో ఉ ంద ను కుంటుననా డు , కానీ అలా కాదు .	0.6593
मैं तुमहें अभी देना चाहता था कयोंकि मैं जलदी जा रहा हूँ .	నేను అది వెంట నే ఎందుకు ఇ చచా న ంటే నేను తవర లోనే వెళళి పో తాను .	0.5266
शायद किसी श रत को लेकर था जो चुका ई नहीं गई . कोई ना राज था .	వాళళు ప ంద ెం డబబు చె లలి ంచ లే దే మో , ఎవరి కో కో పం వచచి ఉంటుంది .	0.5675
अचछा . तो , उसने तुमसे कहा लोग पै निक पर श रत ें लगा रहे हैं ?	సరే . అయితే , అతను జ నం పా నిక పె ప ంద ెం కా సతుననా రని చెపపా డా ?	0.6504
बार - बार भूल जाती हूँ , कोई तुमहारे लिए सा मान छोड गया था .	అన నీ మర చి పో తుననాను , ఎవరో నీకు ఒక ప యా కె ట వది లి వెళళ ా రు .	0.5767
देखो , मेरा हमेशा से सप ना था कि बस यहाँ से निकल ना है .	చూడు , నా జీవి తా ంత ం , నేను ద ూర ంగా వెళళ ాల నే కో రు కుననాను .	0.5883
उससे मत कहना मैंने तुमहें बताया . उसे शर मि ंद गी होगी .	నీకు చెపపా నని తన కు చెపప కు . ఆమె కు చాలా ఇ బబంది గా ఉంది .	0.6010
बस इतना देखना कि तुमहारी गाडी मेरे लिए तैयार रहे .	నువవు చేయ ాల సి ంద లలా కారు ను నా కోసం సిదధ ంగా ఉ ంచ డ మే .	0.5675
इ ल जा म जिस पर भी लगे , उसकी चिंता मत करो , ठीक है ?	ని ంద ఎవరి పె మో ప బ డు తు ందో అని కంగా రు పడ కు , సరేనా ?	0.6331
- समझ ती हूँ . तुमहें भरो सा नहीं . - एक बात पूछ ूँ ?	- అరథ మెంది . నువవు ననను నమమ డం లేదు . - ఒకటి అడ గ నా ?	0.6640
मुझे जरा भी अं दा जा नहीं कि अभी कया हो रहा है .	పర సతు తం జరుగు తునన ది నాకు నిజంగా ఏమీ తెలియదు .	0.5723
फर क नहीं पडता . अ हम बात यह है कि तुमने लि ख ी ं .	విషయం అది కాదు . వాటి ని ఎవరు వ రా శా ర నన ది విషయం .	0.6282
मुझे नहीं पता . पता नहीं किस बात को सच मान ूँ .	నాకు తెలియదు . ఏ దీ నమమ ాలో కూడా తెలియ డం లేదు .	0.5647
मि से ज व ॉ कर का फोन था . हमारी बहन ें गा य ब हैं .	వా కర ఫోన చేశారు . మన చె ల లె ళళు కనిపి ంచడం లేదు .	0.6184
अभी तक डी ए से कुछ नहीं पता चला . ठीक है , डॉ क .	ఇంకా డీ ఏ నుండి ఏ సమా చా ర ము లేదు . అలాగే , డా క .	0.6444
लि ली , जिस समय पर यह हुआ और बाकी सब को लेकर .	లి ల లీ గురించి , సమయం గురించి ఇంకా అనని టి కీ .	0.4954
मैं तुमहें बता चु की हूँ , ऐसा नहीं हो सकता .	నేను ఇది వర కే చెపపా ను గా , అది అలా వయ వ హ రి ంచ రు .	0.5668
अब भा ला मु का ब ले में तुम और मैं ही ब चे हैं .	చూ సతు ంటే జ ౌ సట కు నువవు , నేనే మి గు లు తా మే మో .	0.6205
जब वह लडकी हमें मिली , तो एक दम मर चु की थी .	ఆ అమమాయి ని మేము చూ సిన పపుడు తను చని పోయింది .	0.5505
मुझे याद है , वहाँ पै निक का काफी सा मान था .	తన పా నిక సా మా గ రి తో అకకడ అంతా ని ండి ఉంది .	0.5612
उसने पढ ा ई नहीं की , वह तै या री कर रही थी .	ఆమె అ ధ యయ నం చేయడం లేదు , పర ణ ా ళ ి క ర చి సతుంది .	0.6388
नहीं , लि ली , ऐसा मत करो . नहीं . . . लि ली !	లేదు , లి ల లీ , అలా చేయ కు . వదదు . . . లి ల లీ !	0.6145
- बस आती रहो . चलो ! - तुमहें कुछ नहीं होगा .	- వ సతూ నే ఉ ండు . రా ! - నువవు బాగానే ఉంటా వు .	0.6291
अगर उसे कुछ हो जाता , या फिर उनहें . . .	తన కు గా నీ వాళళ కు గా నీ ఏమెనా జ రి గు ంటే . . .	0.6013
नहीं चाहती कि आज मैं तुमहारे साथ र हूँ ?	నేను ఈ రోజు నీ తో ఉండ ాలని అనుకో వ టం లేదా ?	0.5733
को र टे ज को लगता है तुमने गाडी च ढ ा ई थी .	ష ె రీ ఫ కోర టె జ నువవు గు ద దా వ ను కుంటుననా డు .	0.6457
- रुको , को र टे ज ने मान लिया ? - मान लिया ?	- ఆగు , కోర టె జ ఒ పపు కుననా డా ? - ఒ పపు కో వ డ మా ?	0.6190
और वह जि ंदा है . और वह वही ल चे यर पर है !	ఆమె బర తి కే ఉంది . చ కర ాల కు రచ ీ లో ఉంది .	0.6126
नहीं . लू क मुझे आ गा ह करना चाहता था .	లేదు . లూ క ననను హె చచ రి ంచ ాలని చూశా డు .	0.6169
हेदर की वय क ति गत चु नौ ती को कोई खबर ?	హే థర వయకతి గ త స వ ాలు పె ఏమెనా సమా చా రం ?	0.5904
- आपके पास उसका नंबर तो है न ? - हाँ .	- మీ దగగర అతని నం బర ఉంది గా ? - ఉంది .	0.6477
बस खेल जी तने पर धयान लगा ओ , ठीक है ?	ఆట గె ల వడం పె నే ద ృష టి పెటటు , సరేనా ?	0.6308
अग ले आ धे घं टे में त य होगा कि पै निक में तुम जा ल में फ ँ स कर रह जाओ गी या	త దు పరి 3 0 నిమిష ాలు , జ ౌ సట లో గె ల వడానికి నీకు పా నిక ఒక ఉ చ ఛ ు అవు తు ందా ,	0.6825
मेरी चु नौ ती के लिए , चा ला की से डे ना की आवा ज रि कार ड करना ठीक नहीं था .	నా స వ ాలు కు డే నా ను మో సం చేసి గొ ం తు రి కార డు చేయడం తెలి వెన పని కాదు .	0.6518
मुझसे और मेरे परिवार से दूर रहो .	నాకు , నా కుటుం బా నికి ద ూర ంగా ఉ ండు .	0.4833
कैसे पता कि कोई आपको नहीं देख े गा ?	మిమమలని ఎవరూ చూడ రని ఎలా చెపప గల రు ?	0.5606
बस यह कि हम दो नो मु सी ब त में हैं .	ఇదద రం ఇ బబ ందు లలో ఉననా మ నే తెలుసు .	0.6087
आ ख िर में , फर क समझ में नहीं आता .	చి వర లో , దానికి తే డా చెపప డం కష టం .	0.5657
पता नहीं , लि ली , रात को साथ सो ना ?	ఏ మో , లి ల లీ , రాత రికి వాళళ ి ంటి కా ?	0.4825
खिला डी - संभा वना - बा जी डॉज मे सन	ప లే య ర - ప ంద ెం మే స న + 1 . 4 5 1 00 , 00	0.4583
- तुमहें बुरा नहीं लगता ? - बस करो .	- నీ లో ప శ చా త తా ప భా వ న లేదా ? - ఆ పు .	0.5183
नहीं , पै निक वाला पै सा नहीं . धत !	అయ యో , పా నిక డబబు ఇలా కా కూడదు . ఛ !	0.6081
जे मस से कुछ मत कहना . अभी नहीं .	జే మస కు ఏమీ చెపప కు . అ పపుడే కాదు .	0.5984
मुझे लगता है तुमने बे ई मा नी की .	స ననా హ ాలు చేసు కుననా వ ను కుననాను .	0.5479
कम से कम , सब खतम हो गया , है न ?	హే , క నీ సం అది ము గి సింది , కదా ?	0.5873
देख लो . एक दम न ई जै सी है , यार .	చూ సుకో . కొతత దాని లా త యా ర యి ంది .	0.6222
- तुम कया कह रही हो ? - लू क ह ॉल .	- నువవు ఏం అ ంటుననా వు ? - లూ క హ ాల .	0.6465
अभी तक , कोई सब ूत नहीं मिला है .	ఇ పపటి వర కూ , ఏ సా కష యం దొ రక లేదు .	0.6008
मैं तुमहारे बिना कया कर ूँगी ?	నువవు లే కుండా నేను ఏం చేయాలి ?	0.5218
अपने पिता से कह कर मेरे भाई की गिर फ ता री वाली र प ट निकल वा ओ .	నువవు మీ నా ననను మా అనన యయ మీద అ రె సట ను ని లి పి వే య మని అడ గ ాలి .	0.6209
मेरा भाई परा ंत की जेल में था .	మా అనన యయ క ౌ ంట ీ జె లలో ఉననాడు .	0.5063
हैलो . तुम यहाँ कया कर रही हो ?	హే . నువవు ఇకకడ ే ం చేసతుననా వు ?	0.5455
नहीं , वह . . . बस . . . मैंने आज सु बह शे र के बारे में सुना .	లేదు , అది . . . నేను అ దీ . . . ఈ ఉద యం పు లి విషయం వి ననాను .	0.7356
बि श प ? वह मेरा बॉ य फर ें ड नहीं .	బి ష ప ? అతను నా పరి యు డు కాదు .	0.6159
पता है कितनी मु सी ब त में हो ?	ఎంత ఇ బబ ందు లలో ఉననా వో తెలుసా ?	0.5618
ए . सब ठीक हो जाएगा , ठीक है ?	హాయ . నువవు బాగు ంటా వు , సరేనా ?	0.5317
यहाँ रु क ने की कोई वजह नहीं .	ఇకకడ ఉండ టానికి కారణ ం లేదు .	0.5003
पता नहीं ठीक होगा या नहीं .	బాగు చేయ గల నో లే ే దో తెలియదు .	0.4201
शु रु आत वाले फा ट क पर जा ऊँगा , मु का ब ला जी त कर निकल जा ऊँगा .	పరా రం భ గే ట వ దద కు వెళ తాను , జ ౌ సట గె లు సతాను , వచ చేసతాను .	0.6757
जहाँ जाना है , जलदी पहुँच ो .	వెళళ ాల సిన చో టు కు వెళళి పో .	0.5050
तुमहारे पास दो मिनट हैं .	రెండు నిమిష ాలు ఇ సతుననా .	0.5106
हाँ . यह खेल है . तो , तुम बस अपना काम कर रही थी ?	అవును . అది ఒక ఆట . అందు కని , నీ వి ధి నిర వర తి ంచా వా ?	0.6201
ऐ बी मेरी पक की स हे ली थी .	అబ ీ నా పరా ణ సనే హి తు ర ాలు .	0.5519
रा स ते बंद कर रहे हैं . बचचे बाहर नहीं होने चाहिए .	వాళళు రో డ లు మూ సే సతుననారు . పిలల లు బయట ఉండ కూడదు .	0.5939
पहले वार में वह गिर प डा .	మొదటి ద ె బబ కు పడి పోయా డు .	0.5317
कार प रो ले रा मा बिना पै स ों के भर ती - आज रात 9 ब जे	కార ప ర ొ ల లె రా మా ఉ చి త పర వే శం - ఈ రాతరి 9 గంట లకు	0.6751
ऐ बी ने अपने गर भ को छु पा कर र खा था . अपनी पक की स हे ली को तो बताया होगा .	అబ ీ తన గర భ ం విషయం ర హ సయ ంగా ఉ ంచింది . అది పరా ణ మి తరు ర ాలి కి చెపపి ఉంటుంది .	0.6250
तुमहारे पापा को पता है ?	ఆగు , మీ నానన కు తెలుసా ?	0.5363
हे भगवान . " तुमने मुझसे सब कुछ छ ी न लिया . अब हि सा ब बरा बर हो गया . "	దేవుడా . " నా నుండి అన నీ తీసు కుననా వు . ఇపపుడు సరి సమా నం అయ యా మను కుంటా . "	0.6491
वय क ति गत चु नौ ती ठ ि का ना :	వయకతి గ త స వ ాలు పర దేశం :	0.5696
मैंने र सो ई में र खा है .	అది వ ంట గ ది లో పెటటా ను .	0.5654
मैं अभी वहाँ आती हूँ .	నేను ఇ పపుడే వ సతుననాను .	0.4439
इसलिए उसे ड रा ने के लिए , कुछ गो लिया ँ चला ई ं .	నేను దానని భయ పెటట ే ందుకు రెండు సతా రలు కాల చా ను .	0.6096
मैं सब समझ ा सकती हूँ .	నేను అంతా వి వరి ంచ గలను .	0.4786
यह जिस ने भी किया . . .	ఎవర ె తే ఇది చేశా రో . . .	0.5513
अगर तुम जज थी तो मेरे साथ समझ ौ ता कयों किया ?	నువవు నయాయ నిరణ ే త వ యి తే నాతో ఒ పప ంద ం దే నికి ?	0.5878
उस ी ने बंद ूक बद ली थी .	తు పా కీ మార చి ంది త నే .	0.5554
पता करो कया ऐ न के यहाँ हैं ? डर लग रहा है .	ఆన దగగర ఉననా రే మో చూడు ? చాలా భయ ంగా ఉంది .	0.5869
पर जि मी के माँ - बा प पै निक नहीं खेल रहे थे .	కానీ జి మ మీ తల లి ద ండ రు లు పా నిక ఆడ డం లేదు .	0.6564
इतना कुछ हो रहा था . इतने सारे लोग थे . . .	చాలా జరుగు తోంది . ఈ జ నం అంతా ఉననారు . . .	0.6736
कहते हैं , एल ए में इतना पर दू ष ण हैं कि ता रे ठीक से नहीं दिख ते .	ఎ ల ఏ లో ఎంత క ాలు ష యం ఉ ంటు ంద ంటే న కష తర ాలు కనిపి ంచ వని చెబు తారు .	0.6331
तुमहें अपनी गलती सु धा र ने का मौ का मिले गा .	నువవు తన ను చే రే ందుకు దా రి దొ రు కు తుంది .	0.6022
उ छ ल ना शुरू किया जाए ?	ఎ గర డం పరా రం భి ద దా మా ?	0.5607
उ छ ल ना शुरू किया जाए .	ఎ గర డం పరా రం భి ద దా ము .	0.5734
