Hindi	Telugu	Similarity_Score
तो , तुमहें पसंद आई ?	అయితే నీ క ది న చచి ందా ?	0.4768
कयोंकि जि तने भी साल दूर रह ने का सोचा , तुमसे दूर कभी नहीं था .	అన నే ళళు గా నేను ద ూర ంగా ఉండ ాలను కునన ది , ఎపపుడూ నీ నుండి కాదు .	0.6155
मैंने उसे नहीं देखा .	నేను అత నని కల వ లేదు .	0.4766
मुझे नहीं ख डे होना .	నాకు ని ల బడ ాలని లేదు .	0.5137
लू क जो भी करता है , पै स ों के लिए करता है . तुमने उसकी मदद की ?	లూ క ఏ లా భ ం లే కుండా అద ంతా చేయ డు . నువవు అతనికి స హాయ పడ డా వా ?	0.6650
जब तुमहारे पिता ने तुमहारे लिए यह ख री दा , मुझे बहुत जल न हुई .	మీ నానన నీ కి ది తె చచి నపపుడు నాకు చాలా ఈ ర ష య గా అనిపి ంచింది .	0.6142
मेरी दु र घट ना से पहले , गाडी की चो री के लिए लू क गिर फ तार हुआ .	నా పరమా దానికి ము ందే లూ క ఒక కారు దొ ంగ త నం లో అ రె సట అయ యా డు .	0.6880
जज ों ने तुमहारी आवा ज कैसे रि कार ड की ?	నయాయ నిరణ ే తలు నీ గొ ంత ె లా రి కార డ చేశారు ?	0.5896
तुम कया कह रहे हो ?	నువవు ఏం అ ంటుననా వు ?	0.4482
जरूर . आ जाओ . जि तने जयादा , उ तनी मस ती .	తపప కుండా . రా . ఎంత మంది ఉంటే అంత ఆన ంద ం .	0.6011
- को र टे ज के साथ समझ ौ ता किया . - को र टे ज के लिए कुछ नहीं किया !	- కోర టె జ తో ఒ పప ంద ం చేసు కుననా వు . - కోర టె జ కోసం ఏం చేయ లేదు !	0.6829
- तुमने लि खा था ? - आपको यह कहाँ मिली ं ?	- అది నువవే నా ? - మీ కి వ ననీ ఎకకడ దొ రి కా యి ?	0.5795
अचछा . किस बारे में ?	సరే . దే ని గురించి ?	0.5402
तुमहारी हर कहानी के नाम पर श ं सक बि श प	నీ క థ ల నని టి కీ పరే మ తో , నీ తొ లి అభి మా ని	0.5132
और वैसे भी , हैलो वी न , तीन साल पहले ,	అయి నా , మూ డే ళళ కరి తం , హ ాల ొ వీ న అపపుడు ,	0.6361
रे ने ठीक कहा था .	రే చెపపి ంది నిజ మే .	0.4607
र च ना त म क पर य वे कष क र वी न दर श ं कर शु कल	కరి యే టి వ సూ పర వె జర : రా జే శ వర రా వు వల వల	0.6404
कया उसने वह किया ?	అది అతను చేశా డా ?	0.5004
इ ल जा म हमेशा मुझ पर ही आता है , लू क .	ని ంద ఎపపుడూ నా పె నే వే సతారు , లూ క .	0.6294
टा य ल र - 1 . 8 ड रू - 7 5	యం గ 1 . 8 డ రూ . 7 5	0.6840
" मुझे माफ करना . "	" ననను కషమించు . "	0.5214
तुमहारे लिए ते ल भी बदल दिया , दोसत .	నీ కోసం అయి ల కూడా మార చా ను , నే స తం .	0.5965
वहाँ अं धे रा होगा .	చ ీ క టి గా ఉంటుంది .	0.5323
जब पता न हो कया कह रहे हो , तो मु ँ ह बंद रख ना चाहिए !	ఏం మాటలాడు తుననా వో నీకు తెలియ కపోతే , నో రు మూ సుకో !	0.5942
- उसे फोन करने की कोशिश की ? - नहीं .	- మీరు అతనికి ఫోన చేశా రా ? - లేదు .	0.5340
उसे ये ध म की भ री चि ट ठ ियाँ मिली ं .	ఆమె ఈ బె ది రి ంపు చ ీ టీ లు అ ందుకు ంది .	0.6312
याद है , हमें लगा कि लू क ह ॉल श रत ें लग वा रहा था ?	లూ క హ ాల ప ందే లకు నా య క త వం వ హి సతుననా డని అను కుననా ంగా ?	0.6307
डॉज ! डॉज , रुको !	డా డజ ! డా డజ , ఆగు !	0.4521
कर सक ूँ कि लू क सट टे बा ज है . टे कस स राज य कान ून . . .	బు కీ అని ని రూ పి ంచ గలను . టె క సా స రా ష టర చ టట ం . . .	0.7385
हमने जो सोचा था , उससे बद तर है .	అది మనం అను కునన దాని కంటే దారు ణం .	0.5622
मुझे नहीं पता कि किस ने लू क की गर द न पक डी है , और वजह भी नहीं पता .	లూ కను ఎవరు నియ ంత రి సతుననా రో , ఎందు కో కూడా నాకు అస స లు తెలియదు .	0.6435
लू क ने कहा कि मैं नहीं छोड सकती और मुझ पर काफी पै सा लगा था .	నా పె చాలా డబబు ప ంద ెం కా శా రని , నేను వది లి వెళళ లే నని లూ క చెపపా డు .	0.6045
- तुमहें ए त राज है ? - बिलकुल नहीं .	- నీకు ఏమెనా సమ స యా ? - లేదు , సర .	0.6268
लू क ह ॉल को जी तने देना चाहती हो ?	నువవు లూ క గె ల వాల ను కుంటుననా వా ?	0.5971
तो पिछ ले तीन साल ों से कोई झूठ बोल ता आया है .	గ త మూ డే ళళు గా ఎవరో అ సత య ాలు వి సత రి ం ప చేసతుననా రు .	0.5964
मेरी वय क ति गत चु नौ ती में चा ला की करने के लिए आवा ज चाहिए थी .	నయాయ నిరణ ే త లకు నా వయకతి గ త స వ ాలు లో సాయం చేసే ందుకు మో సం చేసి ంది .	0.6209
यह ध म की है कया ?	అది బె ది రి ం పా ?	0.4666
कयोंकि उसे खो ने का डर होता है .	ఎందుకంటే అది కో ల పో తా మని భ యం .	0.5516
डर बी से एक दिन पहले कुछ प ं कत ियाँ पढ ने को कहा .	డె ర బీ కి ముందు రోజు తను ననను అది చ ద వ మని ంది .	0.6300
अब पु ल पार करो .	ఇక వ ంత ె న దా టు .	0.5650
- लै ंग ली . - हाँ ?	- లా ంగ లీ . - ఏంటి ?	0.6068
- कोई परे शा नी है , अफ सर ? - नहीं .	- ఏదెనా సమ స యా , ఆ ఫీ సర ? - లేదు .	0.6749
तुम मेरी बात सुन भी रहे हो ?	అసలు నేను చెపపే ది వి ంటుననా వా ?	0.5008
मुझे जु ए के बारे में पता है .	నాకు ప ందే ల గురించి తెలుసు .	0.5358
तीन साल पहले लू क के चल ते डॉज की बहन वही ल चे यर में पहुँ ची ?	డా డజ సోద రి ని లూ క మూ డే ళళ కరి తం చ కర ాల కు రచ ీ లో చే ర చా డా ?	0.6615
आपको कैसे यकीन है कि जि मी ने रू ले में बंद ूक बद ली थी ?	రో లెట లో తు పా కీ ని జి మ మీ మార చా డని అంత ఖచచితంగా ఎలా తెలుసు ?	0.6199
कुछ साल पहले ,	కొ న నే ళళ కరి తం ,	0.4409
जो जैसा है , तुम उस सब को व हीं रो क पा ती ?	అనని టి నీ ఎకకడ ఉనన వి అకకడ ే స తం భి ం ప చేయ ాలని ?	0.5591
मुझे नहीं पता .	నాకు తెలియదు .	0.4335
तुमहें नहीं लगता , डॉज वजह जान ना चाह े गा ?	అది ఎందు కో డా డజ తెలుసు కో వాలని అనుకో డ ంటా వా ?	0.5269
वय क ति गत चु नौ ती में सवागत है .	నీ వయకతి గ త స వ ాలు కు సవా గ తం .	0.6226
नाम डॉ क मै जि क	పేరు డా క మా జి క	0.5201
जिस दिन मिली , उससे एक दिन पहले मर चु की थी .	వాళళు కను గొ నే ఒక రోజు ము ందే చని పోయింది .	0.5597
मैं डर गई थी .	నేను భయ పడ డా ను .	0.5065
मुझे माफ करना .	ననను కషమించు .	0.4360
उसने तो मुझे बताया भी नहीं .	అతను నా క ది చెపప లేదు కూడా .	0.5547
अचछा . पीछे आ जाओ , मेरी तरफ .	సరే . వె ను కకు నా వెపు కు రా .	0.5525
इसलिए नहीं कयोंकि तुमहें बुरा लग रहा है ?	అది ఖచచితంగా నీ లో ప శ చా త తా పం వల న కా దా ?	0.5321
जिस रात जि मी की मौ त हुई , यह उसके पास थी .	జి మ మీ చని పోయి న రోజు ఇది తన దగగర ఉంది .	0.5712
जि मी के माँ - बा प को फा इन ल तक पहुँच ने की चिंता नहीं थी .	జి మ మీ తల లి ద ండ రు లలో ఫె న లస చే రు కో వాల నన ఆ ందో ళ న లేదు .	0.6380
हाँ , नहीं , तब तक पढ ा ई शुरू हो जाए गी .	అవును , కాదు , అది తర గ తులు మొద ల యయ ే ట పపుడు .	0.6326
- किसी बात की खुशी मना रहे हो ? - नहीं .	- ఏదెనా వే డు క చేసు కుంటుననా రా ? - ఏమీ లేదు .	0.5930
तीन साल पहले , एक गाडी उससे जा ट करा ई .	తన ను మూ డే ళళ కరి తం హ ాలో వీ న రోజు గు ద దారు .	0.5811
जि मी की पर ॉ म वाली त सवी र .	ఇది జి మ మీ గరా డ యు యే షన ఫో టో .	0.4926
शायद उनहें शे रि फ को र टे ज से पता चला .	ఆయన కు ష ె రీ ఫ కోర టె జ నుండి తెలుసు ంటుంది .	0.5889
पर कल रात , रि वॉल वर की जगह , मुझे एक ट रे नि ंग वाली बंद ूक मिली . . .	కానీ గ త రాతరి నేను తు పా కీ సథా నం లో శి కష ణ తు పా కీ చూశా ను . . .	0.6491
खू ब म जे करना ! कल मिल ेंगे .	శు భ ది నం ! రే పు కలు దదాం .	0.5749
हि ल ना मत . अचछा , तैयार हो ?	క ద లకు . సరేనా , సిదధ మే నా ?	0.5905
तुमहारा सभी से कहना कि तुमहारी माँ मर चु की है !	మీ చని పోయి న అమమ గురించి నువవు అంద రికీ చెపపే విషయం !	0.5429
हमें अपने दिमाग से हमेशा डर लगता रहे .	మనం దే ని కో ఒక దానికి భయ పడు తు ండ ాలి .	0.5578
चे ता व नी है .	అది హె చచ రిక .	0.4886
अगर यह चु नौ ती पूरी कर लो गी , हेदर , तो भा ला मु का ब ले में जाओ गी .	ఈ స వ ాలు ను పూరతి చేయ గ లి గి తే , హే థర , నువవు జ ౌ సట కు వెళ తా వు .	0.7115
हाँ . ठीक है .	సరే . అలాగే .	0.4607
शु भ काम ना एँ .	శు భ ం కల గ ాలి .	0.5071
नहीं . नहीं , यह गलत है .	లేదు . లేదు , అది పొ ర పాటు .	0.4551
खेल के चल ते .	ఆట కారణ ంగా .	0.4835
तुमहारी मदद कर सकती हूँ ?	నేను నీకు సహా యం చేయ నా ?	0.4883
को र टे ज पै निक को लेकर जु आ खेल रहा था ?	కోర టె జ పా నిక పె ప ందే లు కా సతుననా డా ?	0.6322
यही लगता है .	అలాగే ఉంది .	0.3981
जो पहुँच से बाहर है , उसकी चाह त से , चाह त को पा ने में जयादा डर कयों है ?	మనం పొ ంద లేని దాని కంటే కావాల ను కునన ది పొ ంద డానికి ఎందుకు భయ పడ తా ము ?	0.6221
- चलो . - बस थोडा सा और !	- రా . - దా దా పు గా వచ చేశా వ !	0.4935
मैंने जो किया , डे ना के लिए किया , तुम जानती हो !	నేను చేసిన దంతా డే నా కోసం , అది నీకు తెలుసు !	0.5793
अगर आत मह तया के खया ल आ रहे हैं या किसी से बात करना चाहते हैं तो , मा ता - पिता	మీకు ఆ తమ హ తయ ఆలోచ నలు ఉంటే లేదా ఎవరి తో నె నా మాటలాడ ాలని ఉంటే , దయచేసి మీ తల లి ద ండ రు లను	0.6071
डॉज को तैयार रहना होगा , ताकि सा बि त	డా డజ సిదధ ంగా ఉండాలి , అ పపుడే లూ క	0.5251
जि तने मिनट ग ँ वा ओ गी , उ तने अं क जाते र हें गे .	నువవు వ ృ థా చేసే పరతి నిమిష ం పా యి ంట కో ల పో తా వు .	0.6489
हाँ , मैंने सुना . मेरे पापा का फोन आया था .	అవును , నేను వి ననాను . మా నానన ఇ పపటి కే చెపపా రు .	0.5562
रे ने कहा डे ना की दु र घट ना वाली रात के बारे में पता कर ूँ .	రే ననను డే నా పరమా ద ం జరిగి న రాతరి ని పరి శ ీ లి ంచ మ ననా డు .	0.6133
पर इन गर मि यों में मैं बस यहाँ रहना चाहता था .	కానీ ఈ వే స వి లో , నేను ఉండ ాల నే అను కుననాను .	0.5508
और सब कुछ के लिए तुमहें स जा होगी .	అనని టీ కీ నువవే జె లు కు వెళ తా వు .	0.5735
शुकरिया , मि से ज व ॉ कर .	ధనయవాదాలు , మి సె స వా కర .	0.5701
आज की चु नौ ती में एक बचा व कम रा है .	ఈ రాతరి స వ ాలు , తపప ి ంచు కునే గ ది .	0.6183
यह तुमहें कहाँ मिली ?	నీ కి ది ఎకకడ దొ రికి ంది ?	0.4254
अगर उसने डॉज की जी त की श रत लगा ई है , तो इसके बाद रे के पीछे जाएगा .	అతను డా డజ గె ల వాలని ప ంద ెం క డి తే , తరువాత అతను వె ంటా డే ది రే నే .	0.6552
एक दम धी रे से पीछे च ली आओ , मेरी तरफ , ठीक है ?	చాలా నె మమ ది గా వె ను కకు నా వెపు రా , సరేనా ?	0.6141
अगर उसने मुझे कभी माफ न किया तो ?	తను ననను ఎ పపటి కీ కషమి ంచ కపోతే ?	0.5699
नहीं . उसने को र टे ज पर भरो सा किया .	లేదు . అతను కోర టె జ ను నమ ము తా డు .	0.6328
यहाँ च ू हे कयों हैं ?	ఎ లు కలు ఎందుకు ఉననాయి ?	0.4023
रा इ फ ल बाहर कयों है ?	రె ఫి ల ఎందుకు బయ టు ంది ?	0.5431
" कल सभी जान जाएँगे कि तुमने बचचे को मार डा ला ? "	" నువవు నీ పా పా యి ని చం పా వని రే పు అంద రికీ తెలు సతుంది " ?	0.5835
पर मेरी बहन और मैंने साल ों पहले इस स फर के बारे में सोच र खा था .	కానీ మా సోద రి , నేను ఈ ట రి ప ను చాలా కాల ం కరి త మే అను కుననా ం .	0.6326
जि मी के माँ - बा प को भी बताया था .	జి మ మీ తల లి ద ండ రు ల కూ చెపపి ంది .	0.5641
नहीं , मैं इसलिए जज ब नी ताकि पैसे क मा सक ूँ	లేదు , డబబు వ సతు ందని నయాయ నిరణ ే తన య యా ను ,	0.6187
अब जब तुमहारी पहली कि ता ब निकल चु की है , अग ली वाली को लेकर डर नहीं लगे गा .	నీ మొదటి పు సత కం పర చు రణ అయ యి ంది కాబటటి , తరువాత దానికి అంత భయ పడ వు .	0.6443
एक स पता हा ंत जब मैं अपनी माँ से मिलने गई ,	నేను ఒక వా రా ంత ం మా అమమ దగగర కు వెళ ు తూ	0.6149
और साथ में एक चि ट ठ ी .	ఇంకా ఒక చ ీ టీ కూడా .	0.5108
बा कि यों की तरह , को र टे ज की अपनी कहानी है .	కోర టె జ కు అంద రి లా గే తన కూ ఓ క థ నం ఉంది .	0.6305
होना पडे गा , लि ली . और भाग ना मत .	ని ల బడ ాలి , లి ల లీ . పరి గె తత కు .	0.5761
डॉ क मै जि क	డా క మయా జి క	0.4553
डॉ क मै जि क	డా క మయా జి క	0.4553
- नै ट ली पर भरो सा करें ? - पूरी बात सुन लो .	- నా ట లీ ని నమ ము తుననా మా ? - పూరతి చేయ నీ .	0.6489
वह चाह े जि तनी भी देर तक वर दी पह ने र हें ,	అతను ఆ బ యా డ జీ ఎంత కాల ంగా వే సు కుననా ,	0.6157
मुझे अपने बे टे की याद आती है .	నాకు మా అబబా యి గుర తొ చచా డు .	0.6118
मुझे टे कस स का आ स मान याद आए गा .	నేను టె క సా స ఆ కా శం చూడ లేను .	0.6134
- यहाँ ? - यहाँ इस टर ै ं पो ली न पर .	- ఇ కక డా ? - ఆ ట రా ం పొ లి న మీ దే .	0.6322
शायद यह बेहतर है .	బహుశా ఇది మంచి దే మో .	0.3924
जिस में चि ट ठ ियाँ थीं , उसकी सा री त सवी र ें , और न क शे और बाकी चीजें थीं .	చ ీ టీ లు , తన ఫో టో లు , మయా పు లు , ఇంకా వ సతు వు లు ఉనన చి తతు పు సత కం .	0.6685
यह पै निक है , डॉज . यह खेल है .	అది పా నిక , డా డజ . అద ొక ఆట .	0.6118
किसी ने इतना पी टा कि उ ँ ग लि यों के नि शान से पह चा ना .	ఎవరో త నని ఘ ో ర ంగా కొ టట ా రు , అతని వే లి ము దర లతో గుర తి ంచారు .	0.6022
मुझे तुमहारे खिला फ नहीं होना था ?	నీకు వయ తి రే కంగా నేనే ం తెలుసు కో కూడ దా ?	0.5327
टा य ल र य ंग	టె ల ర యం గ	0.5247
चु नौ ती खतम करने में समय लगा : 2 8 मिनट	స వ ాలు ను పూరతి చేసిన సమయం : 2 8 ని .	0.6269
बर फ जै सी ला श डि क की से निका ली थी .	ఆమె చ లల బడి న శ వా నని టర క నుండి తీ శా ను .	0.5581
मुझे डर लग रहा है .	నాకు భయ ంగా ఉంది .	0.4888
अचछा , ब ग .	సరే , బ గ .	0.5595
किस बात से ? लू क ?	దే నికి భ యం ? లూ క కా ?	0.5549
मुझे तो याद भी नहीं कि इसे ले आई थी .	అది నాతో తీసుకు రా వడం గురతు లేదు .	0.5725
जब से जि मी सी नि यर सक ूल में जाने लगा , मैंने ति जो री को हाथ तक नहीं लगा या .	నేను జి మ మీ సీ నియ ర సం వ త సరం లో ఉనన పపటి నుండి ఆ లా కర ను ము టటు కో లేదు .	0.6693
हेदर न फ रत करती है , डॉज सोच ता है कि झूठ ी हूँ .	హే థర ద వే షి సతే , డా డజ కు అబ దద ాల కో రు న య యా ను .	0.6650
इसलिए , हि फा ज त के त ौर पर , जब वह घर लौट ता , मैं अपनी बंद ूक के साथ	అందు కని , తను పని నుండి ఇంటికి వచచే స రికి తన తు పా కీ నాతో ఉ ంచు కునే దానని ,	0.6031
मैंने यह ठीक से नहीं किया .	నాకు అలా చేయడం చే త కాదు .	0.5114
अग ले हफ ते ओ रि ए ं टे शन है .	వచచే వా రం ఓ రి య ె ంటే షన ఉంది .	0.6397
डॉज की बहन के बारे में है .	అది డా డజ చె లలి గురించి .	0.5587
इस खेल के निय म तुम नहीं त य कर रही .	ఈ ఆట నియ మ ాలు నువవు రా య డం లేదు .	0.5983
तुमहें कया चाहिए ?	నీకు ఏం కావాలి ?	0.4104
