Hindi	Telugu	Similarity_Score
इससे फर क नहीं पडता है .	నేను ప టటి ంచుకో ను .	0.4647
आप बस एक माँ हैं .	నువవు ఒ టటి గా మా అమమ వి .	0.4725
जैसे कि , " अन ुम ति नहीं थी " या " ठीक नहीं था . "	అంటే , " అను మ తి " లేదా " సరే " లాంటి వి .	0.6180
जो भी हो , अब सब हो चुका है .	ఏ ది ఏమెనా , ఇపపుడు అద ంతా అయి పోయింది .	0.4692
और तुम . . . तुम . . .	నువవు , సరే . . . నువవు . . .	0.5985
बस समय का ट ने के लिए .	అంటే , ఏదో ఒకటి చేయడం కోసం .	0.4754
रुको . पीछे जाओ ! जाओ !	ఆగు . వెన కకి వెళ లు ! వెన కకి !	0.4419
नहीं . नहीं . पर . . . तुम खुश ियाँ बि खे र ते थे .	లేదు . లేదు . కానీ . . . నువవు మా జీవి త ాల కు వె లు గు తె చచా వు .	0.6424
- एक छे द . - . . . एक छे द के साथ .	- రం ధ ర ంతో . - . . . రం ధ రం .	0.6421
बस उसकी पी डा का आ न ंद उठा ने के लिए .	కేవలం తన వి క ృ త ఆన ంద ం కోసం .	0.5746
तुम सु ध रो गी नहीं .	నువవు చేశా వు .	0.4462
और अगर हमने कोई उ पाय नहीं ढूँढ ा , तो सब को पता चल . . .	మనం గ నుక ఏదెనా మా రగ ం కను క కో లే కపోతే , మొతత ం అంద రికీ తెలి సి పో తుంది . . .	0.6014
तुमहें यह गलत ियाँ उन पर थो प नी चाहिए थी .	చేసిన తపపు లకు ఆ య నని శి కష అను భ వి ంచే లా వదిలే య ాల సింది .	0.5422
यह पे ची दा है .	అది సం కలి షట మెన ది .	0.5108
हाँ , मुझे भी .	అవును , నేను కూడా .	0.4515
तुमहारी ना व मुझे हिला - ड ु ला रही है .	నీ పడ వ ననను ఆ క టటు కు ంట ో ంది .	0.5575
तो , मैं पु रु ष ों के साथ समय बि ता ना चा हूँ गा .	కాబటటి , నేను మ గ వారి తో కొ ద ది సమయం గ డ ప ాలని అనుకుంటుననా ను .	0.5851
बेशक गरेस की वजह से नहीं . . .	ఏ ది ఏమెనా , గరేస పరిసథి తి అలా కాదు . . .	0.5753
इसलिए हम यह कर रहे हैं , है न ?	వాళల కో స మే మనం ఈ పని చేసతుననా ం , అవునా ?	0.5388
नहीं . मैं उस ी घर में प ली - बढ ी .	లేదు . నేను అదే ఇంట లో పె రిగి పెదద య యా ను .	0.5258
मैं नहीं चाहता तुमहें देर हो .	నువవు ఇంటికి ఆ ల సయ ంగా వెళల డం ఇషటం లేదు .	0.4864
- अगर मुझे बस . . . - अरे , नहीं .	- నాకు గ నుక తెలి సి ఉంటే . . . - ఓహ , లేదు .	0.6435
- " बी " से बेवकूफ बि बी . - हे भगवान .	- " బి " అంటే పిచచి ముఖ ం బీ బీ అని . - ఓహ దేవుడా .	0.6286
मुझे लं च तैयार करना है . पर मैं जल द फोन कर ूँगी , ठीक है ?	నేను భ ో జ నం చేయ డానికి వెళల ాలి . కానీ మనం తవర లో మళలీ మాటలాడు కు ందా ం , సరేనా ?	0.5964
मुझे उस कमी ने पर धयान देने से भी न फ रत है .	ఆ చెతత వెధవ గురించి ఎకకువ సే వు మాటలాడ టం నాకు ఇషటం లేదు .	0.5588
- हाँ , बढिया हूँ . - हाँ .	- అవును , చాలా బాగు ననాను . - సరే .	0.5020
तुम ना व में कयों रह ते हो ?	నువవు పడ వ లో ఎందుకు నివ సి సతుననా వు ?	0.5078
तो कृपया , उनका सम मान करो .	అందుకే , దయచేసి చె ట లని గ ౌ ర వి ంచండి .	0.4375
ए , गरेस . तुम स पी कर फोन पर हो .	హేయ , గరేస . నువవు స పీ కర ఫోన లో ఉననావు .	0.6114
वह वि लि य म म किन न की " हो प " है .	ఇది వి లి యం మయా కి నో న గ ీ సిన చి తరం ' హో ప '	0.5260
हमें किस का इंतजार है ? चलो चल ें !	దే ని కోసం ఎదు రు చూ సతుననా ం ? ఇం క పరా రం భి దదాం !	0.5361
शायद हमें तुमहारा र कत चा प देखना चाहिए .	బహుశా నువవు కూడా నీ బ ల డ పర ె ష ర ని పర ీ కషి ంచుకో వాలి .	0.5203
मेरा मतलब , तुम यह खु ल कर सवी कार कयों नहीं करते हो ?	నా ఉదదేశం , నువవు ఎందుకు బయటకు చెపప వు ?	0.5226
तुम उसे उठा ओ जब कि मैं कार पार क करता हूँ .	నువవు దానని పా తి పెటటు , ఇలా గో , నేను కారు పార క చేసతాను .	0.5167
वे आ मत ौर पर दो टी म ों को आप स में भ ि डा ते हैं .	వాళల మా మూ లు సె షన లో రెండు జ టలు ఒక దాని తో ఒకటి పో టీ పడ తా యి .	0.6265
तो तुमहें सच चा ई ढूँढ ने में मेरी मदद करनी होगी .	కాబటటి అసలు నిజం ఏమి టో వె లి కి తీ య డం లో నువవు నాకు సాయం చేయాలి .	0.5476
तो , हमें दु र घट ना को लेकर ए का ध सवाल पूछ ने हैं .	సరే , ఆ పరమా ద ం గురించి మేము కేవలం ఒకటి రెండు పర శ నలు అడుగు తా ం .	0.6033
एक ची नी , थोडा सा दू ध .	ఒక దా ంట లో చ కక ె ర , త కకువ ప ాలు .	0.5055
बी मे की र कम कितनी है ?	మనం వా సత వ ంగా ఎంత చె లలి ంచాలి ?	0.5021
कृपया , नहीं . नहीं .	దయచేసి , అలా చేయ కు . వదదు .	0.4730
तुमसे कह ता कि तुमहारे पिता जी को तुमसे यह कह ने का कोई ह क नहीं है .	మీ నానన కి నినను పర శ ని ంచే హ కకు లే దని చెపపే వాడిని .	0.5539
शु भ काम ना एँ . ये य .	గు డ ల క . యా య .	0.5964
मैं पूरी तरह से प ॉ श हूँ .	నేను పా ష అమమాయి ని .	0.5155
उसे जन म स पता ह से व ं चि त मत करो .	ఆ పెదద బ బా యి పు టటి న వా రా నని నువవు కా ద న కు .	0.5987
तुम पर फ बता है .	ఇది నీకు సరి పోయింది .	0.4113
नो रा का कया ?	నో రా సంగ తి ఏంటి ?	0.3251
पु रा ना बॉ य फर ें ड ?	పా త మి తరు డా ?	0.5083
वह ग ं भी र रिश ता था , समझ े ?	అది అ పప ట లో గ టటి అను బం ధం , తెలుసా ?	0.5936
मुझे एक और बार दिखा ओ .	వాటి ని మ రో సారి నాకు చూపి ంచు .	0.4607
हम आज - कल थो डे पर ग ति शी ल हैं .	మనం ఈ రోజు లలో చాలా అ భ యు దయ ంగా మా రా ము .	0.5885
अरे , धत .	ఓహ , ఛ .	0.4936
आ खि री बहन . हमने तुमहारी सा री बह नों का सा कष ा त कार लिया .	చి వరి వారు కానీ చినన వారు కాదు . మీ అ కక చె ల లె ళల ంద రి నీ మేము పర శ నలు అడి గా ము .	0.5654
ठीक है . चलो , दोसत ों . चलो जैसे मर जी ना च ें .	సరే . రండి మి తరు లా రా . మన కి ఎలా అనిపి సతే అలా డా నస చే దదాం .	0.5759
नहीं . नहीं बता सकती , वह सक ॉर पि ओ है .	చచ చి నా చెపప ను . నా వలల కాదు . వాడి ది వ ృ శ చి క రా శి .	0.5264
अरे नहीं , रुको . मेरे पास तो सट ू डियो ही नहीं है .	ఓహ ! అయ యో , ఆ గ ండి . నాకు సట ూ డి యో లేదు .	0.6264
उससे न फ रत करना जा य ज है .	వాడిని ద వే షి ంచే అర హ త నీకు ఉంది .	0.5242
कयोंकि वह सब नि ष ि द ध था .	ఎందుకంటే అవి అన నీ ని ష ే ధ పరే మ లే .	0.4589
सिर में छे द होना आ सान बात नहीं है .	అతని మె ద డు అలా గా య పడ టం అంత తే లి కె న విషయం కాదు .	0.5630
कोई यो जना र दद नहीं कर रहा है . समझ ी ? बस अपना समय लो .	ఎవ వర ూ మన ప థ కా నని వి ర మి ంచుకో వడం లేదు . సరేనా ? నీకు కా వల సిన సమయం తీసుకో .	0.5893
हाँ , पर हम सब की जिंद ग ियाँ बेहतर हो जाएँ गी .	అవును , కానీ మనం ఇంకా బాగు ంటా ము .	0.4897
जू ते मत उ ता रो .	మీరు అవి ఉ ంచుకో ండి .	0.4434
कया वह बि बी है ?	తను బీ బీ నా ?	0.4623
ए , हम बस फो र टी फु ट जा रहे हैं .	హేయ , మేము ఇ పపుడే ఫా ర టీ ఫ ు ట కి వెళ తుననా ము .	0.5983
तुम मुझे यह चीजें सि खा सकते हो	నాకు కొ ద ది గా అ ంగ ం గురించి నువవు బో ధి ంచాలి	0.5033
मैं समझ ती हूँ , वह मेरी रकष ा करने की कोशिश कर रहा है .	తను ననను కా పా డ ాలని చూ సతుననా డని తెలుసు .	0.5309
तो तुम प ॉ श हो या स पो र टी हो .	అయితే నువవు పా ష లేదా స పో ర టీ అమమాయి వి .	0.4790
हाँ , हमने सु ल ह कर ली थी .	అవును , మేము దానని ప కక న పెటట ే శా ము .	0.5563
तो मेरे सम मान की रकष ा कर रहे थे ?	అయితే నా ప రు వు ని నువవు ఎందుకు కా పా డు తుననావు ?	0.4956
- नहीं थो प पा या . मैं . . . - नहीं , थो प सकते थे , टॉ म . सकते थे .	- నేను చేయ లేక పోయా ను . నేను చేయ లేక . . . - లేదు , నువవు చేయ ాల సింది , టా మ . నువవు చేయాలి .	0.5889
हम तुमहारी देख भा ल करेंगे . ठीक है ? अपनी आँख मत छ ू ना . शा बा श .	మేము నినను జా గర తత గా చూ సు కుంటా ము . సరేనా ? నీ క నను ము టటు కో వడానికి పరయతని ంచ కు . అంతే .	0.6234
हाँ . अब जब तुम मेरे सामने हो , तो मैं सी धे पूछ सकती हूँ .	సరే . ఇపపుడు మీరు నా ముందు ఉననారు కాబటటి , నేను నే రు గా మిమమలని ఒకటి అడుగు తాను .	0.5478
इ ंदर धन ु ष वाला छो टा सा चि ह न दिखा ते .	ఆ చెతత చినన రె యి న బో రి బబ న పెటటు కు ని ఉండ ాల సింది .	0.5706
- खैर , हमें चल ना चाहिए , है न ? - हाँ , मैं . . . कयोंकि हमें . . .	- సరే , మేము ఇం క వెళల ాలి , అవును కదా ? - అవును , నేను అన బో తుననాను . . . ఎందుకంటే మేము . . .	0.6594
शायद , तुम मेरे साथ चल ना चा हो गे ?	బహుశా , నువవు కూడా నాతో కలు సతా వని అనుకో వచచా ?	0.4967
मुझे लगा कि तुमहारी बह नों ने तुमहें बता दिया होगा .	మీ అ కక లు మీకు చెపపి ఉంటా రు అను కుననా .	0.5521
- ठीक है , अ ल वि दा . - अ ल वि दा .	- సరే , ఉంటా ము . - బె .	0.5554
जान , मुझे माफ . . .	బంగా రం , ననను కషమించు . . .	0.5116
तर बू ज खाना चा होगी ?	నీకు ఇం కో పు చచ కా య కా వ ాలా ?	0.5000
और एक ला ल बा लों वाली है , पर कभी - कभी .	ఇంకా ఎ ర ర పిలల ఉంది , కానీ కొనని సా ర లే ఎ ర ర గా ఉంటుంది .	0.5068
अब भी यहाँ कयों ख डे हो ?	ఇంకా ఇకకడ ే ఎందుకు ని ల బడి ఉననావు ?	0.4853
वह बंद करो . एक - दूसरे की तरफ ऐसे देखना बंद करो .	అలా చేయడం ఆ ప ండి . ఒక ళల న ొక ళలు వె ర రి మొ హ ాలు వే సు కు ని చూ సు కుంటుననా రు .	0.5553
मैंने अभी - अभी मै री ट रे सी को करि समस ड रे सि ंग गा उन में	కరి సమ స డ రె స సి ంగ గ ౌ న తొ డు కకు ని ష ె డ డు వెన కాల ని ల బడి మే రీ ట రే సీ దొ ంగ చా టు గా	0.5996
अचछा ? कुछ रो मा ं . . .	అవునా ? ఏదెనా ఆ స కతి కర ంగా . . .	0.5347
यह कॉ नर है , और यह टॉ म है .	వీ డి పేరు కొ న ర , ఇంకా వీ డి పేరు టా మ .	0.4693
कि से मा रो ?	ఏం ష ూ ట చేయాలి ?	0.4443
बि बी , चलो .	బీ బీ , కా నివ వు .	0.3984
म लि न - सै रा गो जिन दवा रा नि र मि त	మ ాలి న శా రా గో జి న రచ న	0.4384
- माफ करना . पकका यह बहुत मुशकिल . . . - इससे तुमहारी जिंदगी बर बाद हो गई .	- కషమి ంచాలి . అది మీకు క ఠ ి న మెన ది కా వచచు . . . - ఏ ది ఏమెనా , నా ఉదదేశం , అది మీ జీవి తా నని నా శ నం చేసి ంది .	0.5736
तुमने कयों . . . कया इ वा को पता है ?	నువవు అసలు ఇది ఎ పపుడు . . . ఈ వా కి ఈ విషయం తెలుసా ?	0.6046
मुझे लगा था कि इससे मुझे . . .	అది ననను సంతోష ంగా ఉ ంచు తుంది అను కుననా . . .	0.5185
पर कोई एक आँख वाली ले सब ि यन ब ला न ड का पा ल न - पो ष ण नहीं कर रही है .	బ లా న డ ని ఒ ంటి క నను లె స బి యన పె ంచడం లేదు కదా .	0.6302
- नहीं . - नहीं ? चा य या कॉ फी लो गे ?	- లేదు . - లేదా ? మీకు టీ కానీ కా ఫీ కానీ కా వ ాలా ?	0.4815
ठीक है . तुमहें जा ँच करनी चाहिए .	సరే , నువవు తన మూ త రా నని పర ీ కషి ంచాలి అనుకుంటా .	0.5162
खास कर तब जब कार में कोई गा र वी लडकी हो .	ముఖ య ంగా గా ర వీ ఆడ పిలల కారు లో ఉ ంద ంటే ఇలా ంటి వి జరుగు తా యి .	0.5094
हमें तुमहारी यहाँ जरूरत है .	నీ అవసరం మాకు ఉంది .	0.4583
कोई ए म बु लें स बुला ओ !	ఎవరెనా అ ం బు లెన సు ని పి లవ ండి !	0.5169
वह उसे देखना भी नहीं चाहती है . और वह उसके लिए कुछ भी करे गा .	ఆమె అతని వెపు చూడ లే కపో తోంది . కానీ తరువాత అతను ఆమె లో ని ఒక భా గా నని తన తో తీసుకు వెళ తా డు .	0.5659
पर जैसे ही यह बढ ता है , अपनी दा ई को बुला ओ . समझ ी ?	కానీ అది మళలీ బాగా పె రిగి తే గ నుక , మీ మ ంత ర సా ని ని పి లి పి ంచండి , సరేనా ?	0.5252
तुमने चा य या कॉ फी पी ?	మీరు టీ కానీ కా ఫీ కానీ తా గా రా ?	0.4205
मुझे यहाँ मौ जू द होना चाहिए था .	నేను ఇకకడ ఉండ ాల సింది .	0.4634
धनयवाद .	ధనయవాదాలు .	0.3486
उसकी म ृ त बहन के क पडे .	అవి చని పోయి న వాడి అ కక దు సతు లు .	0.5360
सा ँ स ले ते रहो .	శ వా స తీసుకు ంట ూ ఉ ండు .	0.4735
तुमहें भी कभी ऐसा पयार हुआ था ?	నీ జీవితం లో ఎపపుడ యి నా పరే మ ని ష ే ధం జరిగి ందా ?	0.4753
तो , उसके सिर का छे द भे द य होगा .	కాబటటి , అతని త లలో చి లలు బా హా ట ంగా నే ఉంటుంది .	0.5470
उसे यकीन है कि कुछ ग ड ब ड है .	ఏదో గ ంద రగ ో ళ ం జరిగి ందని తను నమ ము తుననా డు .	0.5198
पता नहीं .	నాకు తెలియదు .	0.3274
पता नहीं .	నాకు తెలియదు .	0.3274
पता नहीं .	నాకు తెలియదు .	0.3274
कोई बात नहीं .	ఫర వాలేదు .	0.3357
और तुम सबसे बु री पो कर पार ट नर हो . सच में .	నాకు దొ రికి న అ తి చెతత పో కర భా గ సవా మి వి కూడా నువవే . ఎ పపటి కీ .	0.5787
शायद . . . शायद सबसे बेह तरी न हो .	బహుశా . . . నీకు తెలుసా , బహుశా అత యు తత మ తల లి వి .	0.5946
और झूठ े थे .	ఇంకా అబ దధ ాల కో రు .	0.4660
तुम सु ंदर हो . मजा किया हो . स मार ट हो .	నువవు అంద మెన దాని వి . సర దా గా ఉంటా వు . తెలి వెన దాని వి .	0.5236
शायद लि यो टा र ड भी ख री द ल ूँ .	నేను కూడా చి రు త పు లి డ రె స సు వే సుకో వచచు .	0.5417
यह तुमहारा राज य है .	ఇది నీ రా జ యం .	0.4377
वह मर ना चाहते थे .	తను చని పో వాలి అను కుననా డు .	0.4627
- हाँ , बिलकुल . वह डो ले बना ओ . - ठीक है .	- అవును , సరి గగా అదే . అంటే , ఈ క ండ లు పె ంచే వి ధ ంగా . - సరే .	0.6330
- तुम नि शा ना लगा लो गी . - हाँ .	- నీ నె పు ణ యం నీకు తిరిగి వ సతుంది . - అవును .	0.5649
का श वह कभी पै दा ही नहीं होता .	వాడు అసలు పు టట కపోతే బాగు ండ ే దని కో రు కుంటా ను .	0.5163
हो श में रहो . तुम मुझे सुन रहे हो न ?	నువవు నాతో పా టే ఉ ండు . నా మాట నీకు వి ని పి సతోంది , కదా ?	0.5440
हाँ .	అవును .	0.2761
हि सा ब बरा बर .	సట ీ వె నస కూడా అంతే .	0.3739
कैसा चर च ?	ఏ చ రచ ?	0.4227
हाँ .	అవును .	0.2761
धत .	ఛ .	0.4597
हाँ .	అవును .	0.2761
हाँ .	అవును .	0.2761
धत .	ఛ .	0.4597
भा ड में जाओ .	ఇం క ఆ పు .	0.4855
हाँ .	అవును .	0.2761
कया हुआ ?	ఏం జరిగింది ?	0.3776
उसकी आँख ों से तर ंग ें निकल ती हैं जो किसी भी चीज को ज ला सकती हैं .	అతనికి ఏదెనా కాల చేయ గల శ కతి గల క నను ఉంటుంది .	0.5141
नहीं रो क सकता .	నేను ఆ ప లేను అనుకుంటా .	0.4067
- कया हो रहा है ? - घ बरा ओ मत . हम तैयार हैं .	- ఎందుకు అందరూ ఆ ందో ళ న పడు తుననారు ? - ఆ ందో ళ న కాదు . మనం సా ధి ంచా ం .	0.5772
हाँ .	అవును .	0.2761
तो फिर मेरे पीछे आओ .	అయితే దయచేసి ననను అను సరి ంచండి .	0.4261
अभी , बि बी . हमारी ओर उसकी पी ठ है .	ఇపపుడు చూడు , బీ బీ . అతని వె నుక భా గం మన వెపు ఉంది .	0.5571
पाँच मिनट .	అయి దు నిమిష ాలు .	0.3207
अजीब बात है , पर नहीं . बस आँख ही तो फ ू टी है .	సర దా గా ఉంది , కదా . ఒక క నను కో ల పో వడం అనే ది కేవలం ఒక క నను కో ల పో వ డ మే .	0.5939
कयोंकि मुझे इन ज ंग लों का को ना - को ना पता है	ఎందుకంటే ఈ అడ వి లో పరతి అ ం గు ళ ం నాకు తెలుసు ఇంకా నాకు ఇషటం కూడా ,	0.5336
