Hindi	Telugu	Similarity_Score
- मेरी मदद करो . हमें चल ना चाहिए . - ठीक है . अब चलो .	- నాకు స హ కరి ంచు . మనం బయ లు దే ర ాలి . - అలాగే . న డు వు .	0.6957
आ जा दी , माँ .	స వే చ ఛ , అమమా .	0.4649
वे इसे कम जो र कहते हैं .	ననను బ ల హ ీ ను ర ాలని అంటా రు .	0.5265
जब तुम न व जा त शि शु थे , उसके बाद से पहली बार .	తొ లి సారి మీ గొ ం తు ను వి నే భా గ యం నాకు కలి గి ంచండి .	0.5968
अं धे रे की दुनिया में एक च म क दार च म क ती रो श नी .	అ ం ధ కార పు పరపంచ ంలో అది ధ రు వ తా ర లా గా వె దొ ల గు తుంది .	0.6534
और बो ला यन उस ना ते को सा झा करती है .	అదే అను బం ధం బో ల యన కి కూడా ఉంది .	0.6044
उन में से एक नि र मा ता था ?	ఒక డు క టటే వాడు ఉననా డా ?	0.5684
- पापा . - मुझे पता है . मैं उनहें सुन सकता हूँ .	- నా ననా . - నాకు తెలుసు . నేను వారి ని విన గలను .	0.6223
फिर हमने फै सला किया है .	అయితే ని శ చ య మె పోయింది .	0.4926
मेरे साथ बह स की , हाँ .	నాతో గొ డ వ పడి ంది , అవును .	0.5507
हम जो पहले हुआ करते थे .	మనం ఎలా ఉండే వా రం అని .	0.5530
मैं कल प ना करती हूँ . . .	నేను ఊ హి సతుననాను . . .	0.5721
कया यह तुमहारे लिए मुशकिल नहीं है ?	ఇది నీ కక ూ డా కష టం గానే ఉంది క దూ ?	0.5575
ई श वर को दो ष नहीं दिया जाता . कोई आपको दो ष नहीं दे रहा है .	ద ె వా నని ని ంది ంచ జ ాల ము . మిమమలని ఎవ వర ూ ని ంది ంచడం లేదు .	0.5849
म हा रा नी जी , कृपया . . .	మ హా రా ణ ీ , దయచేసి . . .	0.5534
हमारे पास एक वि कल प है .	మన కి ఇం కో మా రగ ము ంది .	0.5842
मैं अपने भाग य को सवी कार करती हूँ .	నా వి ధి ని నేను ఆ హ వా ని సతుననాను .	0.5377
जे र ला म रे ल , तुम मेरे लिए नहीं आए , मेरे पया रे .	జె ర లా మ రె ల , నా కోసం నువవు రాల ేదు , బంగా రం .	0.6432
हाँ ! वे कह रहे हैं " बस ! " बहुत हो चुका !	అవును ! " ఇక చ ాలు " అని వాళళ ంటుననా రు ! ఇక చ ాలు !	0.6060
और इस राज य में मैं कौन हु ँ गी ?	మరి ఆ రా జ యం లో నే నె వరి ని అవు తాను ?	0.5578
आप इसकी रा नी बन ो गी .	నువవు రా ణి వి అవు తా వు .	0.4648
मैंने त य किया है कि मैं इस श हर के लिए नहीं मर ूँगी . यह श हर मेरे लिए म रे गा .	ఈ న గ రం కోసం చా వ కూడ దని నేను నిరణ యి ంచు కుననా . ఈ న గర మే నా కోసం చా వాలి .	0.6694
और इसके अ ला वा , हम नहीं जानते वे कौन हैं . हमें यह पता लगा ने की कोशिश करनी चाहिए . . .	అ దీ గా క , వాళళ ె వర ో కూడా మన కి తెలియదు . క నీ సం తెలుసు కో వ డా ని కె నా మనం పరయత నం . . .	0.6786
वे फिर से उससे बच के भाग गए ?	అతని నుండి మళలీ తపప ి ంచు కుననా రా ?	0.5192
मुझे पता है तुम नहीं कह ने दो गी .	నువవు అనని వ వ వని నాకు తెలుసు .	0.5487
देखो , यह उसके लिए बहुत जयादा है , और वह अपनी तरफ से पूरी कोशिश कर रही है .	చూడు , జరుగు తునన వాటి నం తా ది గ మి ం గు కో వడానికి తాను చాలా పరయతని సతోంది .	0.6140
एक सं देश .	ఒక స ందే శం .	0.4515
मेरी रा नी , इन में से किसी को भी नहीं .	ఆ రె ండి ంటి లో ఎవ వరి నీ ని ంది ంచ ను , మ హా రా ణ ీ .	0.5032
मैं ल डा ई का सु झा व नहीं दे रही , पापा .	మనం యు దధ ం చేయ ాలని నేను అన డం లేదు , నా ననా .	0.5871
पिता जी , जिस की शक ति हम महसूस करते हैं लेकिन छ ू नहीं सकते . . .	త ండ రీ , నీ శ కతి మేము అను భ వి ంచ గల ము కానీ సప ృ శి ంచ లే ము . . .	0.6774
जो भी राज मैंने तुमसे रख े हैं हमारी रकष ा के लिए रख ें .	నేను నీ నుంచి ఏ ర హ సయ ాలను దా చి నా , అది మన కష ే మ ం కొ ర కే దా చా ను .	0.5991
एक ई श वर को मार ने के लिए , किसी को ई श वर बन ना पडे गा .	దే వ త ని చం పాల ంటే , ద ె వ పర మే యం య ొ కక అవసరం ఉంది .	0.6856
- कया ? - मैं जानता हूँ कि हमारी चीजें कौन ले गया .	- ఏంటి ? - మన వ సతు వు లని తీ సి ంద ె వర ో నాకు తెలుసు .	0.6269
अभी बस हम सब अ ल के नी से ब चे हुए हैं ,	ఇపపుడు ఆ ల కె ననీ లో మి గి లు నన ది మనం మాతరమే ,	0.5989
यह एक दर जन अलग - अलग घ ा टि यों से हो कर नीचे की ओर ब हे गा .	ఇది ఒక డజ ను వే ర వే రు లో య ల ద వా రా లో త టటు పరా ంతా నికి వెళళ గల దు .	0.6585
जब तक सा बि त नहीं हो जाता . . .	కా దని ని రూ పి తమ యయ ే వర కూ . . .	0.6201
जे र ला म रे ल जो भी कर सकता है , मैं भी वह कर सकता हूँ , पर बडा .	జె ర లా మ రె ల చేయ గ లి గి న దే ద ెనా , నేను ఇంకా పెదద గా చేయ గలను .	0.6431
मुझे तुमहारी आवा ज सुन ने दो	మీ పు టటి న పపటి ఏ డు పు లు కా కుండా	0.5062
हमारे पास और वि कल प ही कया है ?	మన కి ఇం కో మా రగ మే మెనా ఉందా ?	0.5695
मेरी पया री , हम नि ह त थे हैं .	బంగా రం , మన మి పపుడు ని రా యు ధ ు ల ం .	0.5949
- मुझे लगा तुम में से एक पूरी रात ज गा रहा . - आओ .	- మీ లో ఒక రు రాత రం తా మే ల కొ ను ంటా ర ను కుననా . - పద .	0.6690
- उनसे मेरा एक मा तर सं बं ध . वह . . . - ठीक है .	- మా ఇదద రి అను బం ధా నికి ఏ కె క సూ చి క . అది . . . - సరే .	0.7393
सब को पता है . . .	అంద రికీ తెలుసు . . .	0.5505
लेकिन तुमहारी बहन का गु ससा कभी किसी के लिए रह स य नहीं रहा .	కానీ నీ సోద రి కో పం గురించి తెలియ ని వార ంట ూ ఎవరూ లే రు .	0.5799
चे ट - चे ट . - मा घ रा .	- పా రా హు షా ర . - మా గరా .	0.6298
जो भी राज तुमने मुझसे रख े हैं हमेशा हमारी रकष ा के लिए रख ें .	నా నుండి నువవు ఏ ర హ సయ ాలను దా చి నా , అది మన కష ే మ ం కొ ర కే నువవు దా చా వు .	0.5992
अगर हम बहुत लं बे समय तक रहे , तो वह हमें ढूँढ ले गा .	ఎకకువ సే పు ఇకకడ ే ఉంటే , మనం అత డి కి దొ రికి పో వచచు .	0.6301
कयोंकि हम ही थे जिन की तुम जा सू सी नहीं कर सकती थी .	ఎందుకంటే నువవు ని ఘ ా పెటట లేక పోయింది కేవలం మా మీద నే కను క .	0.5571
मदद करो !	కా పా డ ండి !	0.2649
ले डी ए न ,	అన నా య కీ ,	0.5126
शायद इसे डर नहीं लग रहा है .	బహుశా దానికి భ యం లే దే మో .	0.5085
माँ . . .	అమమా . . .	0.6497
पीछे ह टो ! चु डै ल ने मेरे ग ले पर छ ू रा र खा हुआ है !	వెన కకి త గ గ ండి ! ఈ మా ంత రి కు డు నా గొ ం తు మీద క తతి ఉ ంచా డు !	0.6749
- य दि हम ह टा द ें . . . - उनके ई श वर को ह टा दिया तो वि द रो ह होंगे .	- మనం ఆమె ని గ దద ె ది ంచే సతే . . . - వారి దే వ త ని గ దద ె ది ంచి తే వారు తి రగ బడ తారు .	0.6301
मैंने इस तरह मत दा न किया कयोंकि . . .	నే నె ందుకు అలా ఓ టు వే శా న ంటే . . .	0.6008
य दि तुम हमारे खिला फ मत दा न करती तो तुमहें नहीं जाना पडता .	మాకు వయ తి రే కంగా ఓ టు వే సతే , మా తో రా కుండా నువవు ఉ ండు ండ వచచు .	0.5943
चु डै लें फ रा र हो गई हैं .	మా ంత రి కులు తపప ి ంచు కుననా రు .	0.5092
लेकिन इस तरह की या त रा के लिए , ट ै मै क टी जू न को और अधि क सै नि कों की आ व श य क ता होगी .	కానీ అ టు వ ంటి పర యా ణం తను చేయ ాల ంటే , అతనికి మరి ంత మంది సె ని కులు కావాలి .	0.6260
मुझसे और कुछ मत पू छो . बस इसे खो ज ने में मेरी मदद करो .	ననను ఇం కే మీ చెపప మని అడ గ వదదు . అది వె త క డం లో నాకు సా య పడు చ ాలు .	0.6435
वह एक छो टी थ ै ली है . वह नर म है . मु ट ठ ी के आ कार जि तनी .	ఒక చి నని స ంచి . మ ృ దు వు గా ఉంటుంది . గు పప ె డ ంత పరి మా ణం ఉంటుంది .	0.6649
वह हमारे लिए सं के त छोड देंगे .	అతను మన కి గురతు లని వి డి చి పె డ తా డు .	0.5398
उनहोंने कर दिया जो उनहें करना था .	వారు చేయ గ లి గి ంది వారు చేశారు .	0.4538
- तुमने ऐसा कयों किया ? - कया ?	- నువ వె ందుకు ఈ పని చేశా వు ? - ఏ పని ?	0.5582
नि स सं दे ह , उसने दिया , ले डी ए न .	అ ంది ంచింది , ఆన నా య కీ . అ ంది ంచింది .	0.5177
तो मैं तुमहारे पास आ रही हूँ .	అందు కని నేనే నీ చె ంత కు వ సతుననాను .	0.5284
मेरा मत दा न ह नि वा और को फु न के साथ है .	హ నీ వా మరియు కొ ఫ ూ న కి మ దద తు గా ఓ టే సతుననాను .	0.6347
नि च ली दी वार ों के बहुत से लोग अभी भी इसे मान ते हैं .	ది గు వ గో డ ల వ దద ను నన జ నాలు ఆమె నే దే వ త అని ఇంకా నమ ము తుననారు .	0.6210
आपने यह कब किया ?	ఎ పపుడు క టట ా వు ?	0.5261
जब भी मैं कर सकता था .	క టట గ లి గి నపపుడు క టటే శా ను .	0.5094
पार करो .	దా ట ండి .	0.3369
- बा बा ! - मा घ रा .	- బా బా ! - మా గరా !	0.4437
खु ला पा नी , ग हरा पा नी .	నీ ళళు తపప నే ల నే దే ఉండ దు .	0.5290
बे ट ियाँ और बे ट ें हैं .	కొ డు కూ కూ తు ళళు బం ధ ము ంది .	0.4278
हाँ , हमें हैं .	అవును , ఖచచితంగా .	0.3958
सब लोग चले गए .	అందరూ చని పోయా రు .	0.4205
ऐसा नहीं है कि मैं गा ँ व के अन य लोगों को जानती थी .	ఊ రి లో ఇ తరు ల గురించి తెలి సిన ంత గా నాకు మీ గురించి తెలియదు .	0.5551
हमे जाना होगा .	మనం వెళలి పో వాలి .	0.3925
वे आ ख िर कार चु डै लों के लिए आ ही गए !	ఎ టట కే లకు మా ంత రి కు ల కోసం వాళళు వచ చేశారు !	0.5807
हम सब वहाँ पर बेहतर होंगे . मुझे सच में लगता है .	మన మ ంద రం అకకడ మె రు గె న జీ వ నం సా గి ంచ వచచ ని నా బ ల మెన నమమ కం .	0.5717
हमारे यहाँ आने से पहले ,	మన మి కకడికి రా క ము ందే ,	0.5164
हमें अब निकल ना होगा .	మనం వెంట నే వెళలి పో వాలి .	0.4283
तो कया ? हम बस न दी के साथ चल ते र हें ? कितनी देर के लिए ?	అయితే ఏంటి ? మనం న ది వె మమ డే పర యా ణి ంచ ాలా ? ఎంత సే పు పర యా ణి ంచాలి ?	0.6291
यह ऐसा नहीं है .	అలా అని కాదు .	0.4581
हम जल द ही उनसे छु ट का रा पा ल ेंगे !	వీ ళళ ని మనం తవర లోనే వది లి ంచు కుంటా ము లే !	0.5899
मुझे नहीं पता इससे कया फर क पडता है , और आज के लिए ल डा ई बहुत हो चु की है .	దాని వల న పెదద లా భ ం ఉ ంటు ందని నే నను కో లేదు , అంతే గా క నాకు ఈ రోజు ఇక పో రా డే ఓ పి క లేదు .	0.6406
मेरे पास आपके लिए एक वि शे ष मन ो र ं जन है .	మీ కోసం ఓ పర త యే క మెన వి లా సా నని ఏ ర పాటు చేశా ను .	0.6347
- कैसे ? - यह उसने नहीं बताया .	- ఎలా ? - అది అతను చెపప లేదు .	0.6377
लेकिन शायद इस खबर का मतलब है कि ट ै मै क टी जू न को घर लौट जाना चाहिए .	కానీ ఈ వార తల పరమా రథ ం , ఇక ట మా క టీ జ ూ న ఇకకడికి వచ చేయ ాల నే మో .	0.6448
हमने उसे खो ल दिया . हमने पढ ना - लि ख ना सी खा है .	మేము దానని తె రి చా ం . మేము చ ద వడం , రా య డం నే రచు కుననా ం .	0.6160
- तो ऐसा करना होगा . - रा नी को मार ने के लिए ?	- అయితే ఈ పని చేసే తీ ర ాలి . - మ హా రా ణి ని హ త మా రచ డా ని కా ?	0.4925
उनहें रो क कर रख ो ! उनहें जाने मत दो !	వారి ని పటటు కో ండి ! వెళళ నివ వదదు !	0.5600
न दी के पार कया है ?	న ది ది గు వ ప కక ఏ ము ంది ?	0.5420
न दी शु रु आत है .	ఈ న ది ఆ రం భ ం .	0.5760
मेरी तरफ देखो .	ననను చూడ ండి .	0.4091
बो को देने के लिए . - ठीक है .	- ఇ వి బో కి ఇవ వు . - అలాగే .	0.6325
मैं द ृ ष टि के बिना हु ँ गी .	చూ పు లేని దానని నేనే అవు తాను .	0.5287
ठीक है .	అలాగే .	0.3581
- लेकिन , माँ , वह है कया ? - वह मह त व पू रण है .	- కానీ , అమమా , ఏంట ది ? - చాలా ముఖ య మెన ది .	0.6691
मैं जानती हूँ .	నాకు తెలుసు .	0.3777
बहुत भाग य शा ली .	చాలా అద ృష టం .	0.4894
और इस ज ञ ा न को प ृ थ वी के सबसे अं ध कार म य को नों तक ले जाओ गे .	ఈ జ ఞ ా న సం పద ని లో కం నలు మూ లల కు వి సత రి ం ప జే సతారు . "	0.7192
उनहें बताया कि यह जान ना किसी के लिए भी सुरकष ित नहीं था .	ఇ తరు ల కి తెలి సతే అది మంచిది కా దని వాళళ కి చెపపా ం .	0.5516
या खुद से आ वि ष कार करना चाहिए .	లేదా ఇలా జరిగి ందని మన మే అనుకో వాలి .	0.4713
तो हमें अन ुम ा न लगा ना चाहिए ,	అయితే మనం ఊ హి ంచుకో వాలి ,	0.4844
बेशक , ल ॉर ड ड ून . मुझे पता था कि आप होंगे .	తపప కుండా , డ ూ న పర భు వు . మీరు ఉంటా రని నాకు తెలుసు .	0.6216
उनहें जाने मत दो !	వారి ని వెళళ నివ వ క ండి !	0.4172
शायद तुम उनके लिए वह ख री द सकते हो .	బహుశా మీరు వాళళ కి ఆ భా గ యం కలి గి ంచ గల రే మో .	0.5822
हम एक जन जा ति हैं .	మన మ ంతా ఒక ే తె గ వార ము .	0.5032
सभी को आ म ंत रि त नहीं किया गया है , अब जाओ .	ఈ అ హ వా నం అంద రికీ కాదు , వెళలి పో ండి .	0.6026
मुझे लगता है . . .	నే నను కుంటుననా ను . . .	0.5378
द ृ ष टि वाला रा जा . . .	చూ పు గల రా జు . . .	0.6556
यह आँख ों के लिए एक सं देश है .	ఈ స ందే శా నని క ళళ తో మాతరమే చ ద వ గల రు .	0.5935
फिर भी अ नि ष ट शक ति का कोई पर मा ण नहीं है .	ఇ పపటి కీ మన కి దు షట శ కతి త ాల ూ కు ఆ ధా రం ల భి ంచ లేదు .	0.6395
पास में , एक गा ँ व है जो तुमहारे करी बी लोगों से भ रा है	దగగర లో , ని ండా మీ స నని హి తులు ఉనన ఊ రు ఒక టు ంది ,	0.6475
आगे कया है ?	ముందు ఏ ము ంది ?	0.3710
जिस ने भी इसे लिया . . .	అద ె వ రు తీసు కుననా కానీ . . .	0.5963
य दि वह ओ पा यो ल थे , तो वे सै क ड ों हो सकते हैं .	ఒ పా యో ల ప నే అయ యు ంటే , వారు వ ంద ల సం ఖ య లో ఉ ండు ండ వచచు .	0.6633
यह एक . . . जगह होगी जहाँ हम चीज ों को याद करेंगे .	ఆ చో టు . . . మన కి కొనని విషయ ాలను గురతు కు తె పప ి సతు ంద ను కుంటా .	0.6061
और बिना यह छ ि पा ए कि मैं कौन हूँ .	నిర మా ణ ంలో ప ాలు ప ంచుకో వచచ ని ఊ హి సతుననాను .	0.5347
