Hindi	Telugu	Similarity_Score
चलो हम उनसे छु ट का रा लें !	వాళళ ని వది లి ంచే సు కు ందా ం !	0.5469
बो ?	బో ?	0.3515
को फु न .	కొ ఫ ూ న .	0.5224
नहीं .	లేదు .	0.3291
नहीं .	లేదు .	0.3291
मैं गे दर बै कस हूँ !	నేను గె థర బా కస ని !	0.5807
देखो .	చూడు .	0.4116
रुको , माँ .	ఆగు , అమమా .	0.4471
नहीं !	అయ యో !	0.3368
अ र का !	ఆర కా !	0.4189
वहाँ . . .	అకకడ . . .	0.6403
जे र ला म रे ल का एक सं देश .	జె ర లా మ రె ల య ొ కక స ందే శం .	0.6429
मेरी बात सुनो .	నా మాట విన ండి .	0.4335
तो कया हम वो ट लें ?	అయితే ఓ టు వే ద దా మా ?	0.4991
वे सभी जो न दी को छोड ने और आ शर य खो ज ने के प कष में हैं .	న ది పర యా ణ ా నని ఆ పే సి ఒక ఆ శ ర యం చూ సు కు ందా మను కొ నే వా రం తా .	0.6852
- नहीं . - हम एक जन जा ति हैं , ह नि वा .	- లేదు . - మన మ ంతా ఒక ే తె గ వా రం , హ నీ వా .	0.6280
नहीं .	లేదు .	0.3291
ह नि वा .	హ నీ వా .	0.4074
जन र ल !	జ న ర ల !	0.5949
समझ आ गया . - बढिया .	- అరథ మెంది . - మంచిది .	0.4892
उनकी मौ त में सं घर ष नहीं होना चाहिए , कोई ख ून नहीं , कोई ह थ िया र नहीं .	తన చా వు లో పె ను గు లా ట ఉండ కూడదు , రక తం చి ంద కూడదు , ఆ యు ధం కూడా వా డ కూడదు .	0.6426
तुमने कया सुना ?	నువవే ం వి ననా వు ?	0.4618
हमें रात के लिए रु क ना पडे गा .	మనం ఈ రాత రికి ఏదో క చో ట ఆ గ ాలి .	0.5813
मह ल की दी वार ों के अंदर इसे सुन ने वाली पहली आप हों गी .	ఈ కో ట లో అంద రిక ననా ముందు ఆ గా నా నని మీ రే విన బో తుననారు .	0.6183
तुम पहले मर सकते हो .	ముందు నువవే చా వ వచచు .	0.4932
ठीक है .	సరే మరి .	0.3688
वैसे . . .	అంటే . . .	0.7205
थ ै ली में कया है ?	ఆ స ంచి లో ఏ ము ంది ?	0.5076
मा घ रा , सुनो . . .	మా గరా , వి ను . . .	0.6297
तो हमें जलदी करनी चाहिए .	అయితే మనం తవర గా వె త క ాలి .	0.4731
ह नि वा .	హ నీ వా .	0.4074
मैं आपको धनयवाद दे ती हूँ कि मैं इसके समय का च यन कर स की .	ఆ గ డి య ని ఎ నను కొ నే అవకా శం నాకు కల పి ంచిన ందుకు ధనయవాద ము లు .	0.6162
जब ई श वर ज यो ति हमारी त व चा ज ला ती है , तब कया आप ई श वर को दो ष ी मान ती हो या खुद को ?	ద ె వ జ వాల మీ చ ర మా నని మ ండి ంచిన పపుడు , మీరు ఎవరి ని ని ంది సతారు , దేవు డి నా , మి మమ ల నే నా ?	0.6214
मेरे आदमी ने इसे से ब के पे ड ों में गा ते हुए सुना और इसे फ ं सा ने में काम या ब रहा .	నా ప కష ు లను పటటు వాడు , ఓ ఆ పి ల చె టటు మీద ఈ ప కషి పా డు తు ండ గా వి ని , పటటు కో గ లి గా డు .	0.6623
हमारे बच चों को अभी खत रे में डाल ने का औ चि त य समझ ा ओ कयोंकि मुझे नहीं समझ रहा .	మన పిలల లని ఇపపుడు పరమా ద ంలో ఎందుకు ఉ ంచ ాలో చెపపు , ఎందుకంటే నా క రథ మ వ వడం లేదు .	0.6508
और एक दिन , तुम मेरे पास आओ गे और जो मैं जानता हूँ उसे जान ो गे .	ఏదో క రోజు , మీరు నా వ దద కు వచచి , నాకు తెలి సింది తెలుసు కుంటా రు .	0.6197
और मैं यह नहीं जान सकती जब तक मैं जे र ला म रे ल को नहीं जानती .	మరి జె ర లా మ రె ల ని కలి సతే గా నీ నా కా విషయం తెలి సే అవకా శం లేదు .	0.5894
मैं तुमहें और तुमहारी बहन को अचछी तरह से नहीं जानती .	నాకు నీ గురించి , నీ సోద రి గురించి అంత బాగా తెలియదు .	0.5139
सुन ेंगे कि उनकी रा नी द ै वी य ह स तक ष े प से मा री गई थी .	ద ె వ పర మే యం చే త నే తమ మ హా రా ణి చని పోయి ందని భా వి సతారు .	0.6480
वह पहले से ही सब कुछ जानती है जो आप पूछ रहे हो .	నువవు అడుగు తునన పర తీ పర శ న కి సమా ధా నం తన కి తెలుసు .	0.6008
देखो , मेरी म ृ त यु के लिए मेरी पूरी सं स द स हम त है ,	నా పార ల మె ంట స భ యు ల ంద రూ ననను చం ప ాలని చూ సతుననారు ,	0.6506
म हा रा नी जी , प वि तर म शी न ें भी करा ह रही हैं ,	ప వి తర య ంత ర ాలు కూడా కీ చు మ ంటుననా యి , మ హా రా ణ ీ .	0.6109
यह पूरा स डा हुआ श हर मुझे मार ना चाहता है .	ఈ కు ళ లి న న గర మ ంతా నా చా వు ను ఆ కా ం కషి సతోంది .	0.5897
जे र ला म रे ल के बच चों को मेरे ह वाले कर दो .	జె ర లా మ రె ల సం తా నా నని నాకు అ పప జె పప ే య ండి .	0.6490
हमारा वो ट जो भी त य करे गा , मैं उसका पा ल न कर ूँगी , लेकिन तुमहें यह सुन ना चाहिए .	మన ఓ టు లో ఏ ది తే లి నా దానికి నేను క టటు బ డే ఉంటా ను , కానీ మీరు నేను చెపపే ది వి నా లి .	0.6267
हमारे पास चु डै लों को देने का मौ का था ,	వారి ని అ పప జె పప ే సే అవకా శం మన కి ఉ ండి ంది ,	0.5535
शायद जि तना आगे हम इस न दी के चल ें . . .	బహుశా ఈ న ది మీద పర యా ణి సతునన కొ దద ీ . . .	0.6687
जो देख सकते हैं वे मेरा अनु सर ण करें .	కను లతో చూడ గల వారు ననను అను సరి ంచ వ లె ను	0.5623
जो देख सकते हैं वे मेरा अनु सर ण करें .	కను లతో చూడ గల వారు ననను అను సరి ంచ వ లె ను	0.5623
य दि तुमहारे पिता स वय ं का राज य नि र मा ण करते हैं , तुम उसकी राज क ुम ा री बन ो गी .	నీ త ండ రి తన కోసం ఓ సా మ రా జ యానని నిర మి ంచు కు ంటే , యు వ రా ణి వి నువవే అవు తా వు .	0.6771
हम में से एक को रात भर नजर रख ने और आ ग ज ला ए रख ने के लिए जा ग ते रहना चाहिए .	రాతరి కా ప లా గా ఉ ంట ూ , మ ంట ని కా చ డానికి రాత రం తా మన లో ఒక రు మే ల కొ ని ఉండాలి .	0.6364
और उसके लिए उनहें जवाब देना होगा !	దీ నికి సమా ధా నం వాళళు చెపపి తీ ర ాలి !	0.4878
कया उसने चु डै लों का पता लगा लिया ?	మా ంత రి కు ల ఆ చూ కీ ని తెలుసు కో గ లి గా డా ?	0.5187
ई श वर स वय ं इसे समझ नहीं पा रहे हैं .	ఇది దేవు ళళ కి సె తం అరథం కా వడం లేదు .	0.5894
आपको भी , ले डी ए न . और आपको , ल ॉर ड ड ून , मेरे बारे में सोच ने के लिए .	నా కె ఆలోచి ంచిన ందుకు మిమమలని కూడా సత కరి ంచాలి , ఆన నా య కీ , డ ూ న పర భు వు .	0.6725
मैं इसे तब तक पे श नहीं कर ूँगी जब तक वे इसके लिए तैयार ना हों .	మన లని వది లి వెళళ ే ంత సథ ె ర యం వా రికి వచచా కే నేను అది వా రికి ఇవ వాలి .	0.5983
मुझे पता है कि तुम एक छा या हो .	నువవు ఛ ా య వ నన విషయం నాకు తెలుసు .	0.5626
मैं तुमहारे किसी काम का नहीं .	ఇక నా వలల నీ కే ఉ ప యో గ మూ లేదు .	0.5023
सभी अपने घु ट नों पर टे क कर मु क ति के लिए भी ख माँ ग रहे हैं .	వాళళ ంద రూ మన ని ంచ మని మో కా ళళ మీద పడి ననను వే డు కొ ంటుననా రు .	0.6524
हमने एक अचछी दू री त य की है .	మనం చాలా దూ రం పర యా ణం చేశా ము .	0.5777
चीज ों को बेहतर बना ने के लिए उस ज ञ ा न का उप यो ग कैसे करें .	వి ని యో గి ంచి ఇపపుడు ఎలా జీవి త ాల లో వె లు గు ని ంపు కో వచచ ని .	0.6208
ट ै मै क टी जू न ने खबर भे जी है .	ట మా క టీ జ ూ న వర త మా నం పం పా డు .	0.6731
को फु न , मेरी त ल वार गा य ब है .	కొ ఫ ూ న , నా క తతి క న బడ టం లేదు .	0.6857
तुमहारी तरह , मुझे उममीद थी कि यह दिन कभी नहीं आए गा .	నీ లా గానే , నేను కూడా ఇలా ంటి రోజు రా కూడ ద నే కో రు కుననాను .	0.5409
मैं इसे आपके लिए खो ज ूँगी .	నేను వెళలి వె తి కి తె సతాను .	0.5242
अरे , कया आपको मदद चाहिए ?	హేయ , నీ కే మెనా సాయం చేయ నా ?	0.4072
समय हो गया है , मेरी रा नी .	సమయం ఆ స నన మెంది , మ హా రా ణి .	0.5440
- " जो देख सकते हैं वे मेरा अनु सर ण करें . " - " . . . मेरा अनु सर ण करें . "	- " కను లతో చూడ గల వారు ననను అను సరి ంచ వ లె ను . " - " . . . ననను అను సరి ంచ వ లె ను . "	0.6814
चु डै लें , वे भाग गई हैं !	ఆ మా ంత రి కులు పా రి పోయా రు !	0.5607
पापा ने एक ना व बना ई है .	నానన ఓ పడ వని నిర మి ంచా డు .	0.5326
अ र का , म ट ल , मेरी माँ . . .	ఆర కా , మ ట ాల , మా అమమ . . .	0.6517
मेरे लिए कुछ बहुत मह त व पू रण है . मेरे पास मेरे पिता की एक ही चीज ब ची थी .	నాకు చాలా ముఖ య మెన ది ఉంది . నా త ండ రి త ాల ూ కు నాకు మి గి లి న ఏ కె క జ ఞ ా ప కం .	0.6675
मैंने उसे व च न दिया था .	నేను అతనికి మాట ఇ చచా ను .	0.5476
जो कुछ गया वे ह थ िया र थे . कुछ भी अन मो ल नहीं है .	ఆ యు ధ ాల నే తీసుకు పోయా రు , అంత ముఖ య మెన వే మీ కా వు .	0.6552
तुम कया कल प ना करती हो कि यह राज य कैसा होगा ?	ఆ సా మ రా జ యం ఎలా ఉండ బో తు ందని నువవు ఊ హి సతుననా వు ?	0.5522
बच चों को देने के लिए एक सं देश जब वे हमें छोड ने के लिए तैयार हों .	మన లని వది లి వెళళ గల సథ ె ర యం పిలల ల కి వచచి నపపుడు వాళళ కి ఇవవ వల సిన స ందే శం .	0.5912
उनके परिवार ों ने उनकी ग ै रहा जि री को स हा है .	వారు లేని లో టు ను వారి కుటుం బ ాలు అను భ వి ంచా యి .	0.5893
वे पिता और मा ता हैं ,	ఇకకడ అమమా నానన ల బం ధం ,	0.4931
हम सं भ ो ग कर सकते हैं .	మనం పరా రథ ి ంచుకో వచచు .	0.5232
लेकिन तुम समझ ते हो ई श वर कया कह रहे हैं ?	కానీ దేవు ళళు ఏమ ంటుననా రో మీకు అరథ మ వు తో ందా ?	0.5800
मैं ट ै मै क टी जू न हूँ .	నేను ట మా క టీ జ ూ న ని .	0.6154
गा ँ व में वापस जाओ . उन सब को मार डा लो .	తిరిగి ఊ రికి వెళళ ండి . అంద రి నీ చం పే య ండి .	0.5315
कया हम जा सकते हैं ?	మేము వె ం బడి ంచ వచచా ?	0.5043
शायद मैं जानता हूँ .	నాకు తెలు స ను కుంటా .	0.4374
फिर पि ं ज रे का दरवा जा खो लें , ल ॉर ड ड ून .	పం జర పు తలు పు ను తె ర వ ండి , డ ూ న పర భు వు .	0.6813
लो . इससे तुमहें कुछ समय मिल जाएगा .	అ దీ . దీని వలల నీ కె కకువ సమయం ప టట దు లే .	0.5802
मेरे पास आने के लिए तुमहारी लं बी या त रा का पह ला च रण .	నా వ దద కు మీరు సా గి ంచ బో యే సు ది ర ఘ పు పర యా ణ ంలో తొ లి అడుగు .	0.6394
म हा रा नी जी , पा यान के लोग कहते हैं	మ హా రా ణ ీ , ప యా న ప ౌ రు లు ఇదే అ ంటుననా రు .	0.5878
और तब से , मैंने तुमहें फिर से ढूँढ ने के लिए अपना जी वन सम र पि त कर दिया .	అ పప ట ను ండ ీ , నా జీవి తా నని మిమమలని మళలీ పటటు కొ నే ందు కే అ ం కి తం చేశా ను .	0.6496
अगर मत दा न बरा ब री का होता और मैं उसके खिला फ उस बरा ब री को तो ड दे ता ,	ఒక వే ళ ఓ టు సమ ం అయ యు ండి , తన మన స సు కు వి రు దధ ంగా నేను కను క ఓ టు వే సు ండు ంటే ,	0.6507
यह खतम नहीं हुआ .	అది ం కా ము గి య లేదు .	0.4092
उसका इससे कोई लेना - देना नहीं है .	తన కీ , దీని కీ అస స లు ఏ సంబం ధ మూ లేదు .	0.5475
अगर हम भी इसे करने से डर ते हैं , तो और कौन करे गा ?	మన మే భయ పడి తే , ఆ పని చేయ డానికి ఇం కె వ రు సా హి సి ంచ గల రు ?	0.6245
वह गु ससा नहीं है .	తను కో ప ంగా లేదు .	0.5267
हम नहीं जा सकते .	మనం బయ లు దే ర కూడదు .	0.4980
मुझे चो ट लगी है .	నాకు గా య మ యి ంది .	0.5543
पति और प तनी हैं ,	భా ర యా భ ర తల బం ధం ,	0.5191
" और रा नी सं स द पर शा सन करे गी , "	" పార ల మె ంటు ను ఏ లే హ కకు చ కర వర తి దే ,	0.6579
मैं अस व स थ महसूस नहीं कर रही हूँ .	నా కి పపుడు అ నా రో గ య ంగా ఏమీ లేదు .	0.5453
जो भी कल रात आया वह लौट सकता है .	రాతరి వచచి న వాళళు మళలీ రా వచచు .	0.5116
तुमहारी जान बचा ने के लिए उनहोंने अपनी सा मान य जिंदगी बदल दी .	నీ పరా ణ ాలని కా పా డ టా ని కని వాళళ జీవి త ాల నే సమ ూ ల ంగా మార చేసు కుననా రు .	0.5417
सै न य दल को आ धे दिन से अधि क शि वि र में रख ने की जरूरत नहीं है , जब तक हम खो ज ते हैं .	మనం ఆ దా రి ని కని పెటట ే లో పు , బ ల గ ాలు శి బి రాల లో స గం రోజు క ననా ఎకకువ గ డ ప బో రు .	0.7261
- श ै ता नों को जाने दो ! - अ र का !	- ఈ దు ష టు లను వెళళ నివ వ ండి ! - ఆర కా !	0.6329
मैं वहाँ था जब तुम पै दा हुए थे .	మీరు పు టటి నపపుడు నేను ఉననాను .	0.4986
लेकिन यह मेरे बारे में नहीं है .	కానీ అది నా సవా రథ ం కోసం కాదు .	0.5460
प कष ी आ मत ौर पर लोगों के बीच का ं प ते हैं . मुझे इसकी कं प न नहीं सुना ई दे रही .	జ నా ల మ ధ యన సా ధా రణ ంగా ప కష ు లు వ ణ ు కు తా యి . కానీ ఇది వ ణ ు కు తు ండ టం నాకు విన బడ టం లే దే .	0.6907
मदद करो ! ह नि वा !	కా పా డు ! హ నీ వా !	0.4914
और वे क हें गे , " यह नया य है . "	" ఇదే నయా యం , " అని వారు అంటా రు .	0.6042
कया कैसा होगा ?	ఏ ది ఎలా ఉండే ది ?	0.3573
बाकी ल ॉर ड स आ यो जन कर रहे हैं .	ఇ తర పర భు వు లు సమా వే శ మ వు తుననారు .	0.6030
वह अन मो ल है ! हमें इसका पता लगा ना होगा वह कहाँ गई . हमें उसे वापस ला ना होगा .	అది చాలా ముఖ యం ! అదే మె పోయి ందో మనం కని పెటట ాలి . మనం దానని ద కకి ంచుకో వాలి .	0.5828
जब तक मुझे पता न चल जाए मैं कहाँ से आई हूँ .	నా గురించి నే నస స లు ఎ పపటి కీ తెలుసు కో లేను .	0.5915
मैं तुमहारे साथ आ रही हूँ .	నేను కూడా మీ తో వచ చేసతుననా ను .	0.5212
मेरी मदद करो .	ననను కా పా డ ండి .	0.3950
पर त य कष रूप से , सा द गी से , आपने एक पी ढ ी से चु डै लों का पी छा किया है .	ఒకక మాట లో చెపప ాల ంటే , ఒక జీవి త కాల ం పాటు మీరు మా ంత రి కు ల కె వే ట సా గి ంచారు .	0.6712
हम यह कर पा एँगे . - सच में ?	- మనం చే రు కో గల ం . - చే రు కో గల మా ?	0.5639
द ै वी य सं यो जन .	ది వయ మెన కల యి క .	0.5550
तो मुझे बताओ .	అందు కని చెపపు .	0.4933
लेकिन उनहोंने आप सभी को म ं तर मु ग ध कर दिया .	కానీ వాళళు మి మమ ల న ంద రి నీ మా య లో పడ ే శా రు .	0.6290
हमने बहुत तया ग किया है , अब रु क नहीं सकते .	ఇపపుడు వి ర మి ంచుకో లే న ంత త యా గం చేసే శా ము .	0.5944
इस ना व पर हम छ ह लोग हैं , और सभी की बात सु नी जाए गी .	ఈ పడ వ మీద ఆ రుగు రు ననా రు , అంద రి అభి పరా య ాలను వి ని తీ ర ాలి .	0.6278
एक नया गा ना . एक नया प कष ी .	ఒక కొతత గా నం . ఒక కొతత ప కషి .	0.5421
नि च ली दी वार के पास पर दर शन हो रहे हैं .	మీకు వయ తి రే కంగా పర దర శ నలు నిర వ హి సతుననారు .	0.6040
मुझे जाने दो .	ననను వదిలే య .	0.4298
यह कया है ? तुमने कया देखा ?	ఏంట ది ? మీ కే ం క న బ డు తుంది ?	0.5161
य दि वे भी ड का विश वास हा सि ल करते हैं , तो कोई नहीं बता सकता वे कया कर सकते हैं .	నిర స న కారు ల మ దద తు ను వారు సం పా ది ంచ గ లి గి తే , వా రే ం చేయ గల రో మాట లతో చెపప లే ము .	0.6457
हमारा मान ना है कि आगे का इ ला का जो खि म भ रा है लेकिन पार करने ला य क है .	ముందు నన దా రి పరమా ద కర మెన దే , కానీ మనం పర యా ణం సా గి ంచ వచచ ని మా నమమ కం .	0.6238
तुम उनहें पक ड नहीं पा ओ गे .	వారి ని మీరు పటటు కో లే రు .	0.5159
