Hindi	Telugu	Similarity_Score
- आ शु : उसके पापा को बुला या है . - दरवा जा खो ल !	- నేను వాళళ నానన కి ఫోన చేసా ను . - తలు పు తె రు !	0.6394
बहन चो द , दो घं टे से सर दार मेरा दरवा जा ठ ो क रहा है !	వాడు 2 గంట ల నుండి నా డో ర దగ గరే ని ల బడి చా వ గొ టట ా డు .	0.6268
भगवान को कोई ना नहीं कह सकता .	దేవు డిని ఎవరూ కా దని చెపప లే రు .	0.4751
वह तुमहारे लिए पागल है ! सभी को दिखा ई दे ता है .	అతను పూరతి గా నీ వాడు ! పర తీ ఒకక రూ అది చూడ గల రు .	0.6344
कया आप ये ए लब म ह टा देना चाहते हैं ? हाँ	నిజంగా నే ఈ ఆ ల బం డి లీ ట చే సె యయ నా ? అవును	0.6313
मैं सच में उससे पयार करती हूँ .	నే నిజంగా అత నని పరే మి సతుననాను .	0.5080
मैडम , सु बह से कुछ खा या नहीं है . बस पि ये जा रहे हैं .	మే డ మ , సా ర ఉద యం నుంచి ఏం తి న లేదు . తా గు తూ నే ఉననారు .	0.6790
मैं खुद को रो क नहीं पा ई .	అందుకే నేను తెలియ కుండా .	0.4748
और त 2 : उसे शादी नहीं करनी चाहिए . दु ल ह न के बारे में कया खया ल है ?	అతనికి పెళళి కా వడానికి వీ ల లేదు . పెళళి కూ తు రు గురించి ఏ మను కుటు ననా వు ?	0.6093
तुमने ऐसा कयों किया ?	నువవు ఎందు క లా చేసా వు ?	0.4938
शायद मैं बेवकूफ ों की तरह सोच रही हूँ .	నేను నిజంగా నే సట ు పి డ గా ఆలోచి సతునన నే మో .	0.5340
जान , वो क श ती निकल चु की है . समझ ी ?	బ ే బీ , ఆ పడ వ వెళ ి పోయింది . సరేనా ?	0.6031
मे ड इन हे वे न	మే డ ఇ న హె వెన	0.5741
त भी तो तेरी म ं गे तर ने तु झ े ध ो खा दिया !	నీ ఫి యా నస ీ అలా చేయడం లో ఆ శ చ ర యం లేదు !	0.6637
- शा बा श , बेटा . - अरे . शुकरिया , पापा .	- బా గ చేసా వు , బా బ ూ . - థాంక యు , డా డ .	0.6246
- बस करो , पलीज , पलीज , पलीज ! सर फ राज ! - कमी ने , इ ध र आ !	- సర ఫ రా జ వది లె య , పలీజ , పలీజ , పలీజ ! - ఒ రే య , ఆ గరా !	0.6860
अग ली बार ऐसा हुआ ना , तो बस पक ड के वापस च ली जाना तुम द वार का या रो हि ण ी ,	ఇం కో సారి ఇలా చేసా వ ను కో బ స సె కకి తిరిగి ఆ ద వా రక రో హి ణి , ఎకకడ నుంచి	0.6183
- ये इन का हो ट ल है . - जो गी , जो गी .	- ఇది అతని హో టల . - జో గ ీ . జో గ ీ .	0.5782
अचछा , आगे से तुम कभी उससे झूठ नहीं बो लो गी . हाँ ?	ఓ కే , ఇ పప ట ను ంచ ీ నువవు తన తో అబ దధ ం ఆడ కు . సరేనా ?	0.6423
मुझे तुमहारी नौ करी की चिंता है .	నీ జా బ గురించి ఆలోచి సతుననాను .	0.4908
मैंने सर फ राज के साथ ग ड ब ड कर दी . अगर जो गी को पता चल गया , मेरे माँ - बा प . . .	నేను సర ఫ రా జ తో పడు కుననా . ఇది జో గ ీ కి తెలి సి నా , మా పే రె ంట సు కి తెలి సి నా . . .	0.6702
- सि गरे ट पी ना बंद करो ! - अचछा !	- సి గ రె టలు మా నె య యి ! - అలాగే !	0.6461
हे लो ! आपको ये सब रो क ना होगा .	- జో గ ీ . . . - హలో ! మీ రె ఆ ప ాలి .	0.5273
और इस वकत सिरफ तुम ये कर सकती हो . ठीक है ?	మరి పర సతు తం నువవే దానని మా రచ గల వు . సరేనా ?	0.6063
मैंने ये तुमहारे लिए बना या है . पलीज ना मत कहना .	నీ కోసం నేనే స వయ ంగా చేసా ను . వ దద ని మా తరం చెపప కు .	0.6064
अचछा ? ज स पर ी त कौ र कौन है ?	నిజంగా నా ? జ స పర ీ త క ౌ ర ఎవరు ?	0.6363
पापा जी , चा य .	నానన గా రూ , టీ .	0.4628
पापा ने मुझे बताया कि त सवी र गलत ए ंग ल से ली गई थी .	నానన చెపపా రు ఆ పి క చ ర రా ంగ వెపు నుంచి తీ సా రూ అని .	0.6413
फै कट री में ?	ఫ యా క ట రీ లో నా ?	0.4973
हाँ , भाई , ये भी पा ल नी पड रही है .	అవును , దీ నని కూడా పె ంచ ాల సి వ సతుంది .	0.5748
देखो , अगर श शि क पू र मेरी शादी में आता ,	చూడ ండి శ శి క పూర ఒక వే ళ నా పెళళి కి వచచి ,	0.5769
- एक और देना . - फै जा : दरवा जा खो लो ! पुलिस है .	- నా కి ఇం కో టి క ట చె య యి - తె ర వ ండి . మే ం పోలీసు ల ం .	0.6365
सक ै ंड ल ! बॉ लि व ु ड सि ता रे को शादी की पार टी में दु ल ह न को च ू म ते देखा गया !	స కా ండ ల ! బ ాల ీ వు డ సటా ర పెళళి పార టీ లో పెళళి కూ తు రు కి ము దదు పె డు తూ దొ రికి పోయా డు !	0.7028
तुमहें अं दा जा भी है ये हमारे लिए कि तने शर म की बात है ?	నీ కే మెనా ఐ డి యా ఉందా ఇది మా కె ంత ఎ ం బా రా సి ంగా ఉ ందో ?	0.6186
ऊँ ची पार टी पे आई हो , ना ली की कु त ती की तरह बात मत करो .	క లా స పార టీ కి వచచా వు . లే బర దాని లా మాటలాడ డం ఆ పి ంక .	0.6158
मैंने बुला या तु झ े . मैंने , जो गि ंदर से ठ ी ने !	నేను పి లి సతే వచచా వు ఇకకడికి . ఈ జో గ ీ ంద ర సే థ ీ !	0.6441
- मैंने बुला या ! और सा ला पैसे भी दे रहा हूँ ! - जो गी . हाँ . हाँ .	- నేను పి లి చా ను . ఈ య ె ధ వ కి డబబు లు క టట ా ను . - జో గ ీ . అవును . అవును .	0.6581
असल में , मुझे लगता है ये क माल का खया ल है .	ఏ క చు వల లీ నే నను కో వడం ఇది గొపప అయి డి యా .	0.6451
छोड ! छोड ! मैं कह रहा हूँ . . . मैं कह रहा हूँ , छोड !	- వ దల ండి ! ఆ వెధ వని వది లె దే లేదు ! - తీసు క పొ ండి	0.5844
कोई बात नहीं ! कोई बात नहीं ! होता है . होता है , होता है !	ఏం ఫర వాలేదు ! ఇలా జరుగు తుంది . ఇలా జరుగు తుంది . ఇలా జరుగు తుంది .	0.5281
अचछा , सर फ राज , जो गी , बहुत हो गया , यार !	ఓ కే , సర ఫ రా జ , జో గ ీ , జరిగింది చ ాలు .	0.6271
कयोंकि दिल ली का राज क ुम ा र	ఎందుకంటే ఢ ి ల లీ యు వ రా జు వ దద	0.5195
शुकरिया . गु ड ना इट .	థాంక యు . గు డ నె ట .	0.5957
मतलब , जिस तरह से हमेशा फोन पर लगा रह ता है . आने - जाने का वकत भी अजीब सा है . . .	అంటే , తను ఎపపుడూ ఫోన లోనే ఉ ంటుననా డు . తన టె మి ంగ స కూడా అర ధం కా వ ట లేదు . . .	0.7093
सि गरे ट ?	సి గ రె ట ?	0.4962
तो फिर कहाँ हो ?	అయితే ఎ కక డు ననా వు ?	0.4605
मुझे उसे बता ना होगा . मुझे सच बता ना होगा . कया कर ूँ ? कया . . .	తన కి చెపప ె యయ ాలను ంది . త నని మో సం చెయయ లేను . ఇ పప ూ డు నేనే ం చెయయ ాలి ?	0.6048
अरे , मैं बता नहीं सकती मेरा दिन कैसा था .	నా ఇవ వాళ టి రోజు గురించి మాట లలో చెపప లేను .	0.5515
लड का : वह चो टी वाली लडकी . ने ह रू हा उस वाली .	ఆ పో నీ టె యి లలో ఉనన అమమాయి . నె హ రూ హ ౌ స .	0.6023
अरे , दा मा द ने बुला या . आ ते कैसे नहीं ?	అ రే అ లలు డు గా రు పి లి సతే రా కుండా ఎలా ఉంటా ం ?	0.6036
आपको बात समझ आ गई है ना ?	మీకు విషయం అర ధ మెంది కదా ?	0.5328
- ले के जा ! - जो गी : छोड ! छोड !	- తీసు కె ళల ండి ! - వ దల ండి ! వ దల ండి !	0.5419
मैं बे कार में डर रही हूँ ना ?	నేను పిచచి గా ఆలోచి సతుననాను , కదా ?	0.4635
- कर न : कया ? - नाम ुम किन . हमारे निय म हैं .	- అ సా ధ యం . మాకు రూ ల సు ననా యి . - ఏంటి ?	0.6459
और पलीज , मुझे नहीं , जो डे को श ू ट करो .	అయి నా ననను కాదు . ఆ జ ంట ని ష ూ ట చె య యి .	0.6427
एक वा य रि ंग की मर म मत करवा नी थी .	వె రి ంగ రి పే రి ంగ చేయి ంచాలి .	0.3949
आ इए सवागत करते हैं बॉ ली व ु ड के सबसे शान दार म श ह ूर अ भ ि ने ता	బ ాల ీ వు డ య ొ కక గొపప సె లె బ రి టీ ఏ క ట రు కి సవా గ తం చెబు దాం . . .	0.7168
कया आप ये शादी रो क देना चाहते हैं , बल वि ंदर ?	మీరు పెళళి ని ఆ పే ద దా మను కుంటుననా రా , బ ాల వీ ంద ర ?	0.6179
क सम से , दोबारा ऐसा नहीं कर ूँगी .	ఒ టటు గా చెబు తుననాను , మళళీ అలా చెయయ ను .	0.5477
मुझे सच में लगता है हमें ये फु टे ज ह टा दे नी चाहिए .	ఈ ఫ ు టే జి ని ఇకకడ నుంచి తీ సె యయ డం మంచి ద ను కుంటుననా ను .	0.6221
नहीं , नहीं ! जान , तुम 2 2 साल की एक लडकी हो . कोई बात नहीं .	లేదు , లేదు ! స వీ ట హా ర ట . నువ వో 2 2 ఏ ళల పిలల వి . ఇ ట స ఓ కే .	0.6319
जो गि ंदर जी और उनका परिवार बहुत ही धा र मि क हैं . हमारे गु रु दवा रे पे आ ते हैं .	జో గ ీ ంద ర వాళళ ఫా మి లీ చాలా రె లీ జి య స . వాళళు లో కల గు రు ద వా రా కి వ సతు ంటా రు .	0.6708
गु रु दवा रा में मा था टे का तो बस एक ही खया ल आया .	గు రు ద వార ాలో పరా ర ధి సతునన పపుడు నా కి దే ఆలోచ న వచచింది .	0.5856
तुमहें पता है ना ये श बद बुरा है ?	నీకు తెలుసా , అది చె డ డ మాట , కదా ?	0.5883
पता नहीं . पर कुछ तो करना होगा . ठीक है ?	నాకు తెలీదు . ఇ పపుడ ె లా కా న సి ల చెయయ మ ంటా రు ?	0.5652
हाँ , पर 4 : 00 ब जे का कार य कर म है , आ दिल .	యా . కానీ ఫ ం కష న ఈ వె ని ంగ 4 కి చేసతుననా ంగా .	0.6204
सै म : तुमहें ये सब याद नहीं आता ? मतलब , देखो तो सही .	నువవు వీ టి ని మి స అవ వ ట లేదా అంటే . ఒకక సారి చూడు వాళళ ని .	0.6110
बस कम रे में रहना . दरवा जा बंद रख ना .	జ సట రూ ంలో నే ఉ ండు . లా క చేసు కొ .	0.6043
फै जा : मुझे कहाँ ले जा रहे हो ?	ననను ఎ కకడికి తీసు కె ళ ు తుననావు ?	0.5310
ओ तेरी , स ृ ष टि तो बहुत काम कर रही है , यार .	ఓ రి నీ ! స రు ష టి ఈ రోజు చాలా పని చేసిన టలు ంది .	0.6241
तुमहें पता है न कि मैंने और जो गी ने वो कभी किया भी नहीं है ?	నీకు తెలుసా నేను జో గ ీ కలిసి ఆ పని ఎపపుడూ చెయయ లేదు ?	0.5830
बहुत अचछे , जै ज .	బాగా చేసా వు , జా జ .	0.4903
ए , पा व नी कौन है ?	హే . . . పా వని ఎవరు ?	0.4357
नहीं . घर पर रह कर वा इन ल हा उस वी डियो देख ते हैं .	నో . ఇంట లోనే ఉందా ం వి ని హ ౌ స వీ డి య ొ లు చూ దదాం .	0.6320
- अब वकत आ गया है कि सब . . . - कर न : पागल मत बन ो .	- ఇ పు డు సమయం మీ రం తా . . . - సి ల లీ గా చెయయ కు .	0.7054
कोई बात नहीं . हो गया , ठीक है ? तुमहें सब क मिल गया . ठीक है ?	పర వాలేదు . అద యి పోయింది , సరేనా ? ను వు పా ఠ ం నే రచు కుననా వు . సరేనా ?	0.6028
जो गी की माँ : मेरे बचचे को छोड दो . मि सटर से ठ ी : ले के जा !	- వాడిని తీసు కె ళళ ండి మమ మీ మీరు అననా చెపప ండి . - తీసుకు పొ ండి !	0.6041
मैं बस इतना कह रहा हूँ कि कया तुम एक बार यू ए स में कोई शादी नहीं कर सकते ?	నేను ని నన డి గే ది ఒకక టే , క నీ సం ఒకక పెళళ ెనా అ మె రి కాల ో చెయయ లే వా నా కోసం ?	0.6130
सुनो ! जो फो टो इं टर ने ट पर छा ई हुई है , उसे तुमहारी ही कं प नी ने शे यर किया है .	గె స ! ఏ ఫో టో అయితే వె ర ల అవు తో ందో అది మీ కం పె నీ ను ండ ే ష ే రయ యి ంది .	0.6837
कि द वार का की एक लडकी ने दु ब ई की एक राज क ुम ा री को सि खा या	ఒ కా ద వా రక నుంచి వచచి న అమమాయి ఒక దు బా య యు వ రా ణి కి చూపి ంచింది	0.5878
पर ई मान दा री का कया ?	మరి నిజ ా యి తీ మాట ే ంటి ?	0.3776
- दिल लगा कर पढ ना . - हाँ .	- బాగా చ దు వు ! - సరే !	0.5496
हाँ , पर जो गि ंदर को ये नहीं पता था ना	కానీ జో గ ీ ంద ర కి తెలీదు కదా . . .	0.5212
हाँ , बिलकुल पयार करती हो !	అవును , అ ఫ కో రస , పరే మి సతుననా వు !	0.5137
इसी . . . इसी के साथ , सभी अपना - अपना ड रि ंक ली जिए .	దాని మీద . . . ఆ మాట మీద అంతా , పలీజ డ రి ంక తీసుకో ండి .	0.5891
रा इ मा : दरवा जा खो लो . मैं बाहर ख डी हूँ .	తలు పు తె రు వు . నేను బయట ని ల బడ డా ను .	0.6347
दरअसल , एक घं टे में जाना है , तो . . .	అది , నేను ఇం కో గంట లో బయ లు దే ర ాలి క న క . . .	0.6543
हर बार यही कहते हो .	పర తీ సా రీ ఇదే చెబు తా వు .	0.4651
सुना है , फै कट री में है .	చెపప ల ంటే ఫ యా క ట రీ లో .	0.5758
वैसे , एक बात कहूँ , दी दी . मन के ब डे अचछे हैं , जी जा जी .	నీ కొ క మాట చెపప నా అ క కా ? బా వ గా రి మన సు చాలా మంచిది .	0.6341
फै कट री में था .	ఫ యా క ట రీ లో ఉననాను .	0.5204
जो गी के हो ट ल में . हो ट ल के कै मर ों का कया होगा ?	అది జో గ ీ హో టల . హో టల కె మే రా స గురించి ఏం చే దదాం ?	0.6294
भी ड : सर फ राज ! सर फ राज ! सर फ राज !	సర ఫ రా జ ! సర ఫ రా జ ! సర ఫ రా జ !	0.5652
माफ कीजिए ! आपको हम पर भरो सा नहीं ?	కషమి ంచండి ! మీరు మమ మ లని నమమ రా ?	0.5510
दो साल से , काम के द ौर ों के बीच मैं तुमसे मिलने आता हूँ , समझ े तुम ?	2 సం వ త సర ాల నుండి నేనే నినను కల వడానికి వ సతుననాను , అ దీ మా ఆ ఫీ స పని మీద , ఓ కే ?	0.6224
ए , एड म ने मुझे एक पर सता व दिया है .	హే , ఏ డం నాకు ఓ పర పో జ ల ఇ చచి ంది .	0.6953
उसने मुझे बंद करके र खा है . सा ले , पुलिस को बुला !	ఇకకడ స లు ఏం జరుగు తోంది . వెంట నే పోలీసు లని పి లు .	0.6325
कि हर सि मर न सब के बीच में सर फ राज खा न को हो ठ ों पर किस करे गी	హ ర సి మర న అలా అంద రి ము ంద ూ సర ఫ రా జ ఖ ా నని లి ప టు లి ప కి స చేసి మొతత ం . . .	0.6498
- जरूर . - री ना : हे लो ? हाँ .	- తపప కు ండ . - హలో ? యా .	0.6186
एक और फै कट री डाल रहा है ? तेरी तो सच ची चा ँ दी है , यार .	ఇం కో ఫ యా క ట రీ పె డు తుననా రా ? నువవు చాలా అద రు షట వం తు ర ాలి వి . . .	0.6535
- सर फ राज खा न का . - हे भगवान !	- సర ఫ రా జ ఖ ా న . - ఓ మె గా డ !	0.6620
कया कहना चाहती हो ? तुमहें लगता है उसका कोई च क कर चल रहा है ?	నువవే మ ంటుననా వు ? అతనికి ఏదెనా ఎ ఫె ర ఉ ంద ను కుంటుననా వా ?	0.5800
गु ड म ॉर नि ंग , गु पता जी .	గు డ మార ని ంగ . గు ప తా గా రూ .	0.6227
कया ?	ఏంటి ?	0.3091
मैंने उससे झूठ बो ला !	నే న బ దధ ం చెపపా ను .	0.5508
इस इंतजार में हूँ कि तुम मुझे कब रो को गे .	ననను ఉండ మని చెబు తా వే మో నని వె యి ట చేసతుననా ను .	0.5602
चु प रहो ! एक दम चु प रहो !	నో రు ము య యి ! నో రు మూ సె య యి !	0.4982
नहीं , नहीं , बस सा ँ स लो . बस सा ँ स लो . बस . . .	లేదు , లేదు , జ సట ఊ పి రి తీ స కో . జ సట ఊ పి రి తీ స కో . జ సట . . .	0.5933
और फ े सब ु क और इं स टा ग राम से ये सा री त सवी र ें ह टा ओ .	అలాగే ఫ ే స బు క ఎ ండ ఇ న సటా గరా ం నుండి ఆ పి కస డి లీ ట చె య యి .	0.7063
और ह ल वा तो खिला दो .	ఇం కొంచెం హ ల వా తి ని పి ంచు .	0.4611
मैं कुछ नहीं कर सकता , सर . आपने कॉ न टर ै कट पर द सत खत किए हैं .	నేనే ం చెయయ లేను , సర . మీరు కా ంట రా క ట సె న చేసా రు .	0.5947
उनहें पता नहीं चले गा .	వాళళు తెలుసు కో లే రు .	0.4808
तो . . . मैं अपना टि कट र दद कर द ूँ ?	అయితే . . . నా టి కె ట కా న సి ల చేసుకో నా ?	0.5699
तुमहारे कम रे के बाहर .	నీ రూ ం బయట ే ఉననాను .	0.4846
हाँ . तीन दिन में उसका उ द घ ा टन है .	అవును . అది 3 రోజు లలో తె రు చు కు ంటుంది .	0.5328
इस शादी में कितना समझ ौ ता करना पडे गा ?	ఈ పెళళి కోసం ఎంత తీ స కుననా రు .	0.5165
इस श हर में जहाँ बे श ुम ा र द ौ लत और ऊँ चे अ र मान हैं ,	ఈ ఎ ంతో ఆ స తి ఇంకా అత య ధి క ఆ శ యం ఉనన న గ రం లో ,	0.7022
वाई पी पी रात का सबसे म जे दार पल ,	వె . పి . పి నె ట లో బె సట పార ట . . .	0.5044
