Hindi	Telugu	Similarity_Score
उसे देखो . कमी ना कहीं का .	వాడిని చూడ ండి . చెతత వెధవ .	0.4730
तो , अगर बात बाहर आई , तो हम उनकी गलत ियाँ छु पा ने के जु र म में जेल जाएँगे . . .	కాబటటి , ఈ విషయం బయటకు పొ కకి తే , నానన చేసిన చెతత కి మనం జె లు కు వెళ తా ం . . .	0.6942
इसमें बस मु द रा मा य ने रख ती है . पक ड मा य ने रख ती है . सा ँ स मा य ने रख ती है .	ఇది అంతా ని ల బడ టం మీద నే ఆ ధా ర పడి ఉంటుంది . ఇంకా పటటు కో వడం . శ వా స తీసుకో వడం .	0.6826
बी मा डे टा बे स - सा इन इन	పాల సీ ల డే టా బ ే స - సె న ఇ న	0.5353
रा स ते में मत आओ , बै का .	దా రికి అడ డు రా కు , బె కా .	0.6158
- माफ करना . हम . . . - मुझे पता है तुम कौन हो .	- కషమి ంచాలి . మేము . . . - మీరు ఎవరో నాకు తెలుసు .	0.6763
जैसा कि गरेस अपने सप ं ज के क के बारे में कह ती है , " जब तक यह ढ ह नहीं जाता तब तक परि पू रण है . "	కానీ , తన స పా ం జ కే క గురించి గరేస ఏం చెబు తు ంద ంటే , " అది కూ లి పో యే వర కూ చ కక గా ఉంటుంది " అని .	0.7080
हमारे पास दो हफ ते हैं . तुम वह निकाल स को गी ?	మన కి రెండు వార ాలు ఉంది . వాటి ని సం పా ది ంచ గల వా ?	0.6059
मुझे यह वाली पसंद है .	నాకు ఇది చాలా న చచి ంది .	0.5323
कया तुमहारे पास मे ल खा ने वाले रि सट बै ंड हैं ?	మరి , నీ దగగర మయా చి ంగ రి సట బ యా ండ లు ఉననా యా ?	0.6150
जानती हूँ , जानती हूँ .	నాకు తెలుసు , తెలుసు .	0.4296
यहाँ आओ . मुझे पता है .	ఇలా రా . నాకు తెలుసు .	0.5489
हम उसे ऑ स कर के ब गल में द फ ना एँगे . ठीक है ?	మనం దీని ని ఆ స కర ప కక నే ప ూ డ చి పె డ దాం , సరేనా ?	0.6798
9 3 7 मी ल 0 3 5 . 9 2 4 . 5	9 3 7 మె లస 0 3 5 . 9 2 4 . 5	0.9236
सुनो , आज - कल कार ें काफी सुरकष ित होती हैं .	వి ను , కార లు ఈ మధయ కాల ంలో చాలా సు ర కషి త మెన వి .	0.5837
कल कोशिश करना , मै मी .	రే పు పరయతని ంచు , మా మీ .	0.5325
नहीं , मेरी आँख ों से भी तर ंग ें निकल ती हैं .	లేదు , నేను కూడా క ళల తో ని పపు లు చి మమ గలను .	0.6115
कया हो रहा है , मै ट ?	ఏం జరుగు తోంది , మయా ట ?	0.5800
तुमने ऐसा कयों किया ?	ఎందు కని ఇలా చేశా వు ?	0.5363
और मेरे परिवार के माम ले में , कुछ भी . . .	నా కుటుం బా నికి , ఏ దీ అ ంగ ీ కా రం కాదు . . .	0.6396
- शा ंत रहो . शा ंत रहो . - बस हाथ अपने ब गल में रख ने की कोशिश करो .	- శా ంత ంగా ఉ ండు , శా ంత ంగా ఉ ండు . - నీ చేయి నీ ప కక నే ఉ ంచు చ ాలు .	0.6125
मुझे बस अपनी नि जी और काम का जी जिंदगी को अलग रख ना पसंद है .	నా వయకతి గ త జీవితం , వ ృ తతి జీవితం వే రు వే రు గా ఉ ంచడం నాకు ఇషటం .	0.5998
जिस लड के को मैंने मा रा , वह बेवकूफ है .	నేను కొ టటి న ఆ అబబా యి తెలి వి త కకువ దద ద మమ .	0.5990
यह आ सान नहीं होगा .	అది అంత తే లి క కాదు .	0.4908
वै सा ही जैसा तुमने पिछ ले साल . . . र ै स बे री डाल कर बना या था ,	కింద టి ఏ డా ది నువవు రా స బె రీ స తో . . . చేసిన ది నాకు ఇషటం ,	0.6844
- कया ? - यह कै र न है .	- ఏంటి ? - అతను క లా ర న .	0.6780
वैसे , मैं अ भ या स नहीं कर पा ई हूँ , कयोंकि मैं इसे घर पर नहीं निकाल सकती .	సరే , నేను దీని ని ఇంటి బయట కి తీసుకు రాల ే ను కాబటటి ఇంత వర కూ సా ధన చేయ లేక పోయా ను .	0.6164
हाँ , नो रा बच चों की देख भा ल कर ले गी . तो अ र सला आ स के गी .	అవును , పిలల ల ంద రి నీ నో రా చూ సుకో గల దు . ఖ ా ళ ీ చేసుకో ఉ ర సు లా .	0.6696
पर तुमहें कैसे पता वे कै सी गो लिया ँ इस ते माल करते हैं ?	కానీ వాళలు ఎలా ంటి తూ ట ాలు ఉ ప యో గి సతా రో నీ కె లా తెలు సతుంది ?	0.6147
अग ली बार मिल ेंगे .	మళలీ సారి కలు సతాను .	0.4235
जै र लड को च ॉ क ले ट बेहद पसंद है , और तुम सबसे बेह तरी न च ॉ क ले ट के क बना ती हो .	జె రాల డ కి చా కొ లే ట అంటే ఇషటం , నువవు చా కొ లే ట కే కస చాలా బాగా చేసతా వు .	0.6394
- कार रो को ! कार रो को ! - नहीं . छोड ो .	- కారు ఆ పు ! కారు ఆ పు ! - లేదు . వదిలే య .	0.5840
- ए , ब ला न ड . कया कर रही हो ? - बस कुछ यो जना बना रही हूँ .	- హేయ , బ లా న డ . ఏం చేసతుననా వు ? - ఊ రి కే ఆలోచి సతుననాను .	0.6620
मेरा घर पु रा व सत ु ओं से भ रा पु रा ना पा रि वा रिक घर है .	మా చ కక ని కుటుం బం ఇంటి లో చాలా పు రా తన వ సతు వు లు ఉననాయి .	0.6509
नहीं . रुको , मै ट .	వదదు . ఉ ండు , మయా ట .	0.5764
मैं बस . . . मैं बस इतनी थ क गई हूँ .	నేను కేవలం . . . చాలా అ ల సి పోయా ను .	0.6006
वि त ती य नि दे शक अपने जन म दिन पर छु ट टी नहीं ले ता है .	ఒక ఫ ెనా న షి య ల డె రె క టర తన పు టటి న రోజు న సె ల వు తీసుకో డు .	0.6800
तुमहें अचछा लगा ?	నీకు ఇది న చచి ందా ?	0.4524
मुझे म हिला एँ पसंद नहीं हैं , इ वा .	నేను ఆడ వాళల తో సం భ ో గం చేయ లేను , ఈ వా .	0.6102
तुमहें मुझे इ शा रा करना चाहिए था .	నాకు ఏదెనా సం కే త మో ఏదో ఇవ వాల సింది .	0.5490
अ र सला कह ती है कि का श बे न ने उसे उसके बेह तरी न रूप में देखा होता .	తన స రెన య వ వ నం లో బె న గ నుక త నని కలిసి ఉంటే బాగు ండ ే దని ఉ ర సు లా అ ంట ో ంది .	0.6564
ग ना श . जै र लड को ग ना श बेहद पसंद है .	గ నా ష . జె రాల డ కి గ నా ష అంటే ఇషటం .	0.6552
तो , टी म ए में जे पी , डॉ न ल , अ र सला और गरेस होंगे .	కాబటటి , ఏ జ టటు లో జె పి , డో న ల , ఉ ర సు లా , గరేస ఉంటా రు .	0.7144
खैर , हम सब इंसान ही हैं , है न ?	ఏ ది ఏమెనా , మన మ ంతా మను ష ు ల మే , కదా ?	0.5911
मुझे यह खा ते जलदी नि प टा ने हैं .	నేను లే చి ఈ అ క ౌ ంట స సంగ తి చూడ ాలి .	0.5818
कयोंकि यह एक लि फा फ े के पीछे 2 2 बार लि खा हुआ था .	ఎందుకంటే అది ఎ న వల ప వె నుక 2 2 సా రలు రా సి ఉంది .	0.6465
री टा - सट ै न ली - ए लि जा बे थ - रॉ जर - अ नी टा - ए मिली	రీ టా - సటా న లీ - ఎ లి జ బె త రో జర - అని తా - ఎ మి లీ	0.6393
- मैं कया कह रही थी ? - ज ॉन प ॉल .	- నేను ఏం చెబు తుననాను ? - జా న పాల .	0.5698
जानते हो मुझे यह कैसे पता है ?	నాకు ఆ విషయం ఎలా తెలు సో తెలుసా ?	0.5536
मैं तुमहारा पो ल इस ते माल कर ूँगी .	నేను నీ స తం భా నని ఉ ప యో గి సతాను .	0.5852
हि लो मत . शा ंत रह ने की कोशिश करो , दोसत . शा बा श . बस ले टे रहो .	క దల దదు . అలాగే ఉ ండు , మి తర మా . అంతే . ఇలా గే వె లల కి లా పడు కు ని ఉ ండు .	0.6705
कया कला फि न भाई वापस लौट ेंगे ?	ఆ ఆ క తా యి కు ర రా ళలు మళలీ వ సతా రా ?	0.5138
माफ करना , डै ड .	మన ని ంచు , త ండ రీ .	0.5234
ना वि क का वा दा .	నా వి కు డి ర హ స యం .	0.4840
मेरा मतलब , मुझे सुरकष ा का पूरा खया ल है , समझ ी ?	నా ఉదదేశం , నేను కష ే మ ంగా న డు పు తాను , తెలుసా ?	0.6345
- नहीं , धनयवाद . - नहीं , जयादा जलदी हो गया ? अपने क दम गि नो .	- లేదు , ధనయవాదాలు . - లేదు , ఇంత పొ దదు న నే ? అడుగు లు లె కక పెటటు కో .	0.6161
- कार रो को ! - नहीं , रुको ! रुको !	- కారు ఆ పు ! - లేదు , ఆ పు ! ఆగు !	0.6537
मुझे लगा था मैं ना च सक ूँगी .	నేను డా నస చేయ గలను అను కుననాను .	0.5322
तुम हरा काम है गोली खा ए बिना बा धा को रस के	అడ డం కు ల దా రి లో ఒక వెపు నుండి మర ొక వెపు వర కూ	0.5844
और मैंने कहा , " जब वह चि ल ला कर रु क ने को कह रही थी , तो तुमहें रु क जाना चाहिए था . "	అపపుడు నేను చెపపా ను , " ఆమె నీ మీద అ రి చి ంద ీ అంటే , అది నీకు పరమా ద సం కే తంగా భా వి ంచు " అని .	0.6609
मैं मै ट हूँ और यह थ ॉ मस है .	నా పేరు మయా ట ఇంకా ఇ తను థా మస .	0.5751
- ब ला . मुझे माफ कर दो . - नहीं !	- బ లా . ననను మన ని ంచు . - లేదు !	0.6824
भगवान , रु बे न !	దేవుడా , రూ బె న !	0.5400
कोई बात नहीं .	మ రే ం ఫర వాలేదు .	0.3801
हम यह स का रात म क पे र ें टि ंग को रस कर रहे हैं .	మనం పా జి టి వ పే రె ంటి ంగ కోర సు చేసతుననా ం .	0.5831
- नो रा से पूछ लो . - तुमने नो रा को बता दिया ?	- నో రా ని అడ గ ండి . - నువవు నో రా కి చెపపా వా ?	0.5922
मैं गलती कर रही हूँ , इ वा .	నేను వె ను కం జ లో ఉననాను , ఈ వా .	0.5474
- कया हुआ ? - ची खो मत , मै मी .	- ఏం జరిగింది ? - అర వ కు , మా మీ .	0.6556
और मेरे साथ बच चों सा बर ता व करने के ब जा य , अगर तुमने मुझे बताया होता ,	ననను ఒక పిలల వాడి లా చూడ టానికి బ దు లు ఈ విషయం అ పపుడే నాతో చె బి తే ,	0.6432
" टॉ म , मुझे खे द है कि मैं ऐसे जा रहा हूँ .	" టా మ , ఇలా వది లి వెళ తునన ందుకు కషమించు .	0.6190
ठीक है . चलो इस पर बाद में बात करेंगे .	సరే . కానీ , ఇ పపటి కి మనం దీని తో వదిలే దదాం .	0.5404
मैं पयार में नहीं हूँ , समझ े ? मुझे कभी पयार नहीं होगा .	నేను పడ లేదు , సరేనా ? ఆ తలు పు ఎపపుడ ో మూ సు కు పోయింది .	0.5892
हम काफी समय ले चु के हैं .	మనం ఎకకువ సమయం తీసు కుననా ం .	0.4741
- मैं बडी हूँ . जयादा शक ति शा ली हूँ . - में ढ क को कैसे ड ु बो ते हैं ?	- నేను పెదద దానని . నీ క ననా బ ల వం తు ర ాలి ని . - క పప ని ఎవరెనా ఎలా ము ంచ గల రు ?	0.6588
कोई भी बहन स पो र टी नहीं है .	ఆట లా డే వాళలు ఎవ వర ూ లే రు .	0.5969
शायद एक आँख वाली माँ हो .	బహుశా ఒక క నను లేని తల లి వి .	0.5098
तुम रा नी हो .	నువవు రా ణి వి .	0.4249
नहीं , नहीं , नहीं , नहीं , नहीं , नहीं . भगवान . नहीं . समस या मुझ में है .	లేదు , లేదు , లేదు , లేదు , లేదు , లేదు . దేవుడా . లేదు . తపపు నా దే .	0.4793
भा गो . तुम छु प नहीं सकती .	పరి గె తతు . నువవు దా క కో లేవు .	0.5950
कयोंकि वे हमेशा किसी न किसी चीज को लेकर चि ल ला ती रह ती हैं . "	ఎందుకంటే వాళలు ఏదో విషయం గురించి ఎపపుడూ అ రు సతు నే ఉంటా రు " అననా డు .	0.5844
अरे , हाँ . हाँ . उसने कहा , " तुमहें पता है वह कै सी है .	అవును . అవును . తను అననా డు , " ఆమె ఎలా ంటి దో తెలుసా .	0.6229
क सम से , मुझे पता नहीं था वह कौन है .	అతను ఎవరో నాకు తెలియదు , పరమా ణ పూర వ కంగా .	0.5938
भगवान , तो तुमहें मेरे घर आ ना चाहिए .	దేవుడా , నువవు ఒక సారి మా ఇంటికి రా వాలి .	0.5510
वह कैसे उसके साथ एक ही टे बल पर बैठ ती थी , यह मेरी समझ से परे है .	అ టు వ ంటి వయకతి తో కలిసి భ ో జ నం చేయడం అంటే , నా వలల అయితే కాదు .	0.6614
हमें हमारी पसंद ी दा प ें टि ंग चु न कर प ें ट करनी थी .	మేము మాకు ఇష ట మెన చి తర క ళ లని ఎ ంచు కు ని వాటి ని గ ీ య ాలి .	0.6214
मैं परि ं सि पल नि ' हा रा पर इसका इस ते माल करती हूँ .	నేను వాటి ని మీ పరి న సి పాల నిమి హా రా మీద పర యో గి సతాను .	0.5431
मैं नहीं देना चाहता था .	అంటే , నా ఉదదేశం ఇది కాదు .	0.4979
इस हफ ते कुछ नए सु ंदर चे ह रे आए हैं .	ఈ వా రం అంద మెన కొతత ముఖ ాలను చూ సతుననా ం .	0.5528
बहुत बढिया . अब हम उसे प ें ट ब ॉल से नहीं मर ेंगे .	ఇది ఎంత ఆ శ చ ర యం . మనం పె యి ంట బ ాల తో అత డిని చం ప లే ము .	0.6384
पता है मैं कैसे अचछी और शा ंत र हूँ गी ? एक क बा ब और चि पस से .	ననను మంచి గా , పర శా ంత ంగా ఏం ఉ ంచు తా యో తెలుసా ? ఒక క బా బ ఇంకా చి ప స .	0.6422
हैलो . मैं नो रा हूँ , बि बी की प तनी .	హలో . నా పేరు నో రా , నేను బీ బీ భా రయ ని .	0.5690
ठीक है . हाँ .	సరే . అలాగే .	0.4579
पु रा नी पा रि वा रिक रे सि पी .	మా కుటుం బ పు పా త వ ంట కం .	0.5634
मैंने कुछ गलत नहीं किया !	నేను ఏమీ తపపు చేయ లేదు !	0.5128
तुमहें अपने जन म दिन के लिए शुकर वार को छु ट टी ले नी चाहिए .	నీ పు టటి న రోజు స ంద ర భ ంగా శు కర వా రం నా డు నువవు సె ల వు తీసుకో వాలి .	0.6228
- तो तुम ज ॉन प ॉल को दो ष नहीं दे ती हो ? - नहीं .	- అయితే మీరు అ ందుకు జా న పాల ని ని ంది ంచ రా ? - లేదు .	0.6205
और जब तुम यहाँ से जाती हो , बु री चीजें होती हैं .	నువవు లే నపపుడు ఇకకడ చె డు సం ఘ ట నలు జరుగు తా యి .	0.6040
तुम में से एक की जे ब में ख र गो श का पै र होगा .	మన లో ఒక రికి ష ర టు జే బు లో కు ందే లు పా దానని పె డ తా ం .	0.6489
तुम लोगों का क च रा चु रा ना बंद करो गे ?	నువవు జ నం చెతత ని ఏ ర డం మా నే సతా వా ?	0.6276
फ री ज की हुई गो लिया ँ बदल ूँगी . . .	గ డ డ క టటి న తూ ట ాలను మా రచు కుంటా ను . . .	0.6476
इसका मतलब है . . . भगवान . मुझे रिश ता तो ड देना चाहिए , पर नहीं तो ड सकती .	దాని అరథం . . . దేవుడా . నేను దీని ని ము గి ంచాలి , కానీ నా వలల కాదు .	0.6311
डॉ न ल काम पर होगा , तो मुझे बच चों को संभाल ना होगा . माफ करना , जान .	డో న ల కి ఉద యో గం ఉంది , కాబటటి నేను పిలల లని చూ సుకో వాలి . మన ని ంచు , బంగా రం .	0.6276
सवागत है , थ ॉ मस ! ज ॉन प ॉल वि लि य मस	మళలీ సవా గ తం , థా మస ! జా న పాల వి లి య మస	0.5898
कुछ भी आ सान नहीं होता है , बच ची .	వి లు వెన ది ఏ దీ తే లి క గా రా దు , పి లలా .	0.5466
- हैलो . तुमसे मिल कर खुशी हुई . - ए . कैसे हो ?	- హాయ , మిమమలని కల వడం సంతోష ం . - హేయ . ఎలా ఉననావు ?	0.6563
खुद तना व में उ छ ल ते रह ने से मदद नहीं होगी .	మీరు తీ వర మెన ఒ తతి డి తో బయట తి రుగు తూ ఉంటే కష టం .	0.6279
वह छे द उसके सिर के पीछे , इस हि स से में है .	అతని త లలో చి లలు తన వె నుక ఎకకడ ో ఉంది అనుకుంటా .	0.5964
- मुझे आप से न फ रत है , माँ . - जान .	- నినను ద వే షి సతాను , అమమా . - బంగా రం .	0.6496
मैं उसे मार डाल ूँगी .	నేను వాడిని చం పే సతాను .	0.4450
बद ला वि ष ा कत होता है .	పర తీ కా రం విష ం లాంటి ది .	0.5316
माफ करना . यह मेरी . . .	కషమించు . తను నా . . .	0.6598
रुको , रुको .	ఉ ండు , ఆగు .	0.4430
चलो , बि बी .	చేయి , బీ బీ .	0.3742
अगर ढ का भी , तो हम खु ज ली वाला पा उ डर इस ते माल कर ल ेंगे . तो उसे वह उ तार ना पडे गा .	ఒక వే ళ మా స క తో ఉంటే , మనం దు ర ద ప ౌ డ ర ని ఉ ప యో గి దదాం . అపపుడు మా స క తీ సతా డు .	0.7287
सु पर भा त . मेरा नाम सिर ि ल है , उ र फ , सिर ि ल द सक वी रे ल .	అంద రికీ శు భ ో ద యం . నా పేరు సి రి ల , ఇంకా , సి రి ల ద స క వి రె ల .	0.6907
काफी अ र सा हो गया है , जे पी . हमें करना चाहिए .	చాలా కాల ం అయి పోయింది , జె పి . మనం చేయాలి .	0.5345
- अब हम सच चे दोसत बन सकते हैं . - चु प रहो .	- అంటే మనం మంచి సనే హి తు ల ం కా గల ము . - నో రు మూ యి .	0.6029
र ंग गरे हो गया है . यह एक ला ल बा लों वाले आदमी के लिए ठीक नहीं है .	అతని చ ర మ ం ప ాలి పోయింది . ఎ ర రని వాళ లలో అలా జరగ డం మంచిది కాదు .	0.6521
