Hindi	Telugu	Similarity_Score
लि जी ?	లి జీ ?	0.3419
- के ट ! - . . . सा त . . .	- కే ట ! - . . . ఏ డు . . .	0.8954
- लि जी . - . . . पाँच ,	- లి జీ . - . . . ఐ దు ,	0.7645
म ॉ मी !	అమమా !	0.2501
लि जी .	లి జీ .	0.3419
की यर - ए ले ग ज ें डर ब रि टि श ना गर ि क	కీ య ర - అ లె గ జా ండ ర బ రి టీ ష ప ౌ రు డు	0.6899
सुनो . . .	వి ను . . .	0.7019
यू सु फ .	యూ సు ఫ .	0.3874
अचछा , वह बि ज ने स कला स और आ म सी ट ों के बीच वाली जगह में है .	ఆమె ను బి జి నె స క లా స ఇంకా మా మూ లు సీ టల మధయ ఉనన అర లో ఉ ంచా ను .	0.6914
मेरे पास सै म ने ल सन के लिए एक पै के ज है .	సా మ నె లస న కోసం నేను ఒక ప యా కే జ తె చచా ను .	0.6447
- कया यह सही है ? - हाँ , लेकिन . . .	- అది స రెన దే నా ? - అవును , కానీ . . .	0.6849
कोई बात नहीं . यह मेरे साथ हैं .	ఫర వాలేదు . అతను నా కోసం వచచా డు .	0.5246
वह और त .	ఆ మ హి ళ .	0.4869
उसे मत छ ू ओ . मुझे अब दोबारा से सब करना पडे गा .	అది అకకడ ము టటు కో కు . నేను ఇ దంతా మళలీ తు డ వాలి .	0.6433
- फ ला इट में , किसी ने मुझे ला त मार दी . - ला त मार दी ?	- ఇం దా క గొ డ వ లో , ఎవరో ననను త ననా రు . - నినను త ననా రా ?	0.6373
इसका कया मतलब है ?	దాని ఉదదేశం ఏంటి ?	0.4460
लेकिन अगर वह उसे पक डे गी तो चि प का नहीं पा ए गी .	కానీ ఆమె ఒక ే సమయం లో పటటు కు ని , క టట లే కపో తోంది .	0.6261
टे री ?	టె రీ ?	0.4884
ठीक है . लगा ओ .	సరే . కా నివ వు .	0.5640
नहीं .	చెతత .	0.3317
डा रि य स .	డా రి య స .	0.4553
- मैं ऐसी गलत ियाँ नहीं करता . - हाँ , बिलकुल .	- నేను ఊ రి కే నో రు జా ర ను . - లేదు , ఖచచితంగా .	0.5947
नहीं .	లేదు .	0.3291
और मैं इस विमान पर मौ जू द बाकी लोगों जैसा ही हूँ . तुमहारे जैसा ही हूँ .	ఇంకా నేను ఈ విమానం లో ఉనన ఎవ రిక ననా నేను భి నన మెన వాడిని కా ను . నీ తో సహా .	0.5929
तो , अगर वे परे शान हैं , हमें भी परे शान होना पडे गा .	అయితే , వాళలు ఆ ందో ళ న పడి తే , మనం కూడా ఆ ందో ళ న పడ ాలి .	0.6160
- बंद करो . . . - सब लोग , खि ड किया ँ अभी बंद करो !	- మూ సే య ండి . . . - అందరూ , వెంట నే తె రలు ది ంచండి !	0.6721
इसका मतलब है यह ने टो का भी हो सकता है .	అంటే అది బహుశా నా టో యు దధ విమానం కా వచచు .	0.5650
मेरा मतलब है , अगर उनकी जगह हम होते ,	నా ఉదదేశం , దీని నే ఇం కో లా చెపప ాల ంటే ,	0.5063
फा रस की खा डी दु ब ई	పె ర షి యన గల ఫ దు బా య	0.5796
ल ंद न	ల ండ న	0.4128
रो मा निया बु का रे सट	ర ొ మే ని యా బు కా రె సట	0.5319
" बं दे को " ?	" కు ర రా డా " ?	0.6237
और उनहें कया बताया गया है ?	అయితే పర ధా నికి ఏం చెపపా రు ?	0.4766
नहीं .	చెతత .	0.3317
हमें दवा इ या ँ चाहिए .	మాకు మ ందు లు కావాలి .	0.4524
जो कुछ भी हुआ है , उन में से कुछ भी , हाँ ? जैसा हम हमेशा कहते थे . . .	ఇంత వర కూ జరిగి న వి అన నీ కూడా , సరేనా ? అంటే మనం ఎపపుడూ అను కునన టలు . . .	0.6577
आपने सुना मैंने कया कहा ?	నేను ఏం చెపపా నో వి ననా వా ?	0.5178
मैं डॉ क टर हूँ .	నేను డా క టర ని .	0.5422
कोई एल . ए टर टन और ए स . ए टर टन हैं .	అది ఎ ల . అ టె ర టన ఇంకా ఎ స . అ టె ర టన .	0.6425
मार स , तुमहें आ देश का पा ल न करना है .	మార స , మీరు ఆ దే శ ాలను పా టి ంచ ాల సి ందే .	0.6173
- ओह , यह कया . - इसकी सा ँ स ें चल रही हैं ?	- ఓహ , చెతత . - ఇ తను శ వా స పీ లు సతుననా డా ?	0.6762
का ई ?	ఖ ా య ?	0.3919
का ई ?	ఖ ా య ?	0.3919
का ई ?	ఖ ా య ?	0.3919
- जरा सु नि ए . - नहीं , कोई बात नहीं .	- ఎ కస క యూ జ మీ . - లేదు , ఫర వాలేదు .	0.6292
इन होंने ऐसा दूस री बार किया है . कि तने ग ैर जि म मे दार हैं .	వాళలు ఇలా చేయడం ఇది రెండ ో సారి . వాళ లని నమమ డానికి లేదు .	0.5904
- देखा तुमने ? अपनी जान बचा ने का सा कष ा त उ दा हर ण ? - मैं ऐसा कुछ नहीं कर रहा हूँ .	- నువవు ఇది చూశా వా ? పర తయ కష ంగా తపప ి ంచు కునే పరయత నం ? - నేను చే సతునన ది అది కాదు .	0.6732
- आपकी गर द न पर ये ड रा इ ंग कयों ब नी हुई हैं ? - नहीं , यह नहीं . ऐसा नहीं कहते .	- నీ మె డ మీద ఆ బ ొ మమ లు ఎందుకు ఉననాయి ? - లేదు , అది కాదు . మనం అలా మాటలాడ కూడదు .	0.6681
जैसे ही तुम ऐसा बोल ने लग ो गे , तुमहारा श री र इस पर भरो सा करना शुरू कर दे गा .	నువవు అలా మాటలాడ టం మొద లు పె డి తే , నీ శ రీ రం కూడా అదే నమమ డం మొద లు పె డు తుంది .	0.6646
या जो भी करो , लेकिन अग ले दो मिनट के लिए तुमहारा धयान अपने फोन पर नहीं ,	లేదా ఏదెనా చేయ ండి ఎందుకంటే మనం ఇపపుడు వి దే శా ంగ మ ంత రి తో మాటలాడ బో తుననాం	0.5903
अपनी उस घट िया सु री ली आवा ज में , जो तुम सब निकाल ते हो , उन सबसे क हो	పా ట పా డి న టలు మంచి స వర ంతో మీరు చెబు తారు కదా , అలా వాళల ంద రికీ చెపపు ,	0.6539
- खि ड किया ँ खो ल दो . वे चले गए हैं ! - ऐसा मत करो . खि ड किया ँ मत खो लो .	- కి టి కీ లు తె ర వ ండి . వాళలు వెళలి పోయా రు ! - వదదు . కి టి కీ లు తె ర వదదు .	0.6561
आप सुन रहे हैं ? कि ंग डम 2 - 9 , अगर आप यह सं देश सुन रहे हैं . . .	మీరు వి ంటుననా రా ? కి ంగ డ మ 2 - 9 , మీరు ఈ పర సా రా నని వి ంటే గ నుక . . .	0.6693
कि ंग डम 2 - 9 , आप ने टो दवा रा सं रकष ित ह वाई कष े तर में उ ड रहे हैं .	కి ంగ డ మ 2 - 9 , నా టో సం ర కష ణ లో ఉనన గ గ న తల ంలో కి మీరు పర యా ణి సతుననారు .	0.7328
उनसे क हो जो कुछ हुआ , उस में हमारी कोई गलती नहीं . ठीक है ?	ఇం దా క జరిగి న దానికి మనం కారణ ం కా దని అతనికి చెపపు . సరేనా ?	0.5828
तुम बिलकुल मेरे जैसे हो . तुम भी अपने घर जाओ गे , ठीक है ?	నువవు కూడా నా లాంటి వాడి వే . నువవు ఇంటికి వెళ తా వు , కదా ?	0.6035
जे ट विमान चले गए हैं . इन हें बाहर देख ने दो . - रु क जाओ !	- యు దధ విమా నాలు వెళలి పోయా యి . వాళ లని చూడ నివ వు . - ఆ గ ండి !	0.6662
और यह सु नि श चि त करती हूँ कि विमान सही कर म में उ तर ें .	ఇంకా విమా నాలు స కర మ ంగా ది గే లా జా గర తత లు తీసు కుంటా ను .	0.6107
यह नहीं कि विमान के लोगों को कैसे बचा या जाए . . .	విమానం లో జ నా నని ఎలా ర కషి ంచాలి అనే ఆలోచ న లేదు . . .	0.5752
हमें उनहें यही बता ना है . ये अप हर ण करता ब रि टि श हैं .	వాళల కి మనం అదే చెబు తా ం . ఈ హె జా కర లు బ రి టీ ష వాళలు .	0.6565
सो रे सक ू . डा रि य स सो रे सक ू . रो मा निया के ग ृ ह म ंत री .	సో రె స క యూ . డా రి య స సో రె స క యూ . ర ొ మే ని యా హో మ మ ంత రి .	0.6650
मैं यहाँ नहीं आ ना चाहता था . मैंने उनसे कहा था .	నాకు ఈ పని చేయడం ఇషటం లేదు . వాళల కి అది చెపపా ను .	0.5798
दे वि यों और स जज नों , अगर विमान में कोई डॉ क टर है ,	లే డీ స , జె ంటి ల మెన , విమానం లో ఎవరెనా డా క టర ఉంటే ,	0.6277
ठीक है . तुम बैठ सकते हो ? तुम बैठ सकते हो , हाँ ?	సరే . నువవు కూ రచ ో గల వా ? నువవు కూ రచ ో గల వా , చెపపు ?	0.5758
तुमहें जो भी कहना है , तुम व हीं से कह सकते हो .	నీకు ఏమెనా చెపప ాలని ఉంటే , అ కకడి ను ండ ే చెపప చచు .	0.5962
बह रहा ल , लै ंग के कार या ल य ने स थ गि त कर दिया है .	అనన టలు , లా ంగ కార య ాల యం ఇ పపుడే వా యి దా పడి ంది .	0.6679
- लि जी ! लि जी ? - के ट , वापस अपनी सी ट पर जाओ .	- లి జీ ! లి జీ ? - కే ట , వెళలి నీ సీ టు లో కూ రచ ో .	0.6158
मतलब , जब तुमने मुझे टे री का नाम बताया था ?	చూడు , అంటే , నువవు టె రీ పేరు చెపపా వు కదా ?	0.6037
वे हम से पूछ ेंगे हमने इतनी देर कयों लगा ई .	మనం ఎందుకు కాల యా ప న చేశా మని ఆ రా తీ సతారు .	0.5978
हाँ , लेकिन वे यह बात नहीं जानते , है ना ?	అవును , కానీ ఆ విషయం వాళల కి తెలియదు , కదా ?	0.5795
- दस . . . - लि जी , तुम कहाँ हो ? लि जी !	- ప ది . . . - లి జీ , ఎకకడ ఉననావు ? లి జీ !	0.6672
कया इस विमान में कोई डॉ क टर है , पलीज ?	విమానం లో ఎవరెనా డా క టర ఉననా రా , పలీజ ?	0.5430
अगर तुम अपना फै सला बद लो गे ही नहीं ,	మీరు మీ నిరణ యానని మా రచు కో ని ప కష ంలో ,	0.5737
मैं आप से जलदी मिल ूँगा , माँ . ठीक है ?	నినను తవర లో కలు సతాను , అమమా . సరేనా ?	0.5733
देखो , मैं यहाँ चु प चा प बैठ कर तुमहें मर ते हुए नहीं देख सकता , ठीक है ?	చూడు , రక తం కారు తూ నువవు చని పో తు ంటే నేను ఇకకడ చూ సతూ కూ రచ ో లేను , సరేనా ?	0.6233
सं पर क करता पर हम ला किया जा रहा है .	ఆ మ హి ళ మీద ఎవరో దా డి చేసతుననా రు .	0.5497
हाँ , उसे गु ससा आ आया . और सच कहूँ तो , उसकी बात बे बु नि याद नहीं है .	అవును , ఆమె కో ప గి ంచు కు ంది . ఆమె అనన దా ంట లో కూడా అరథం ఉంది , నిజ ానికి .	0.6583
तुमहारा सा रा ख ून बह जाएगा . देखो .	నీకు రక తం బాగా కారు తోంది . చూడు .	0.5760
और अगर वह ऐसी हा लत में होता , तो मैं चाहता कि कोई उसकी मदद करे .	ఇదే వాడి కి జరిగి తే , వాడి కి కూడా ఎవరెనా సాయం చేయ ాలని కో రు కుంటా ను .	0.5169
- ए ले न ? - यह उनका नाम है . ए ले न .	- ఎ లెన ? - అది మా అమమ పేరు . ఎ లెన .	0.6687
यह सा बि त कर सकता है कि यह हमारी समस या है , रो मा निया की नहीं .	ఇది మన సమసయ అని , ర ొ మే ని యా ది కాదు అని ఈ మె సే జ రు జు వు చే సతుంది .	0.6012
- के ट , बैठ जाओ ! - . . . छ ह . . .	- కే ట , కూ రచ ో ! - . . . ఆ రు . . .	0.8352
हमारे सामने एक ग ं भी र समस या है .	మాకు ఒక తీ వర మెన సమసయ వచచింది .	0.5608
तुम मेरी मदद नहीं कर रहे हो .	నువవు నాకు సాయం చేయడం లేదు .	0.4718
आप एक क प कॉ फी ख री द रहे हैं और एक वय क ति का फोन आता है	ఒక క పపు కా ఫీ కొ న డానికి వెళ దా మ ంటే ఎవరో ఒక రు ఫోన చేసతా రు	0.6079
तुमहें यकीन है यही करना है ?	మీరు ఖచచితంగా చెబు తుననా రా ?	0.5130
ताकि तुम मेरे दिमाग से खेल स को और जानकारी निकल वा स को ?	అపపుడు ననను మాట లలో పె టటి నా నుంచి సమా చా రం లా గు తా వా ?	0.5649
मैं तुमहारी आवा ज से बता सकती हूँ . तुम जानते थे लेकिन तुमने मुझे नहीं बताया .	నీ మాట తీ రు బటటి నేను గురతు ప టట ా ను . నీకు తెలుసు కానీ నువవు నీ వర కే ఉ ంచు కుననా వు .	0.5923
तुम लोगों ने कया कर दिया ?	మీ రం తా ఇపపుడు ఏం చేశారు ?	0.5385
पता लगा ओ ये लोग कौन हैं .	వీ ళల ంతా ఎవరో తెలుసు కో ండి .	0.4955
- लेकिन क य . . . - डे वि ड .	- కానీ ఏంటి . . . - డే వి డ .	0.7291
आपको खबर मिल जाए गी . हाँ ?	నువవు అది వి ంటా వు . సరేనా ?	0.4929
मार शा , विमान से हमारा यही एक लौ ता सं पर क हो पा या है .	మార షా , ఆ విమానం నుంచి వచచి న ఒక ే ఒకక కా ంటా క ట ఇదే .	0.5899
यह विमान बु का रे सट के ऊपर से गु जर ने वाला है . हम सी धा उस ी की तरफ जा रहे हैं .	మనం బు కా రె సట మీ దు గా పర యా ణి ంచ బో తుననాం . మనం నే రు గా ఆ న గ రం వెపు వెళ తుననాం .	0.6821
सा री खि ड किया ँ बंद कर दो .	అన నీ కి టి కీ లు మూ సే య ండి .	0.5576
हाँ , ठीक है . बहुत अचछा .	సరే , అలాగే . చాలా మంచిది .	0.5442
या हो सकता है सै म हमें कुछ जानकारी , नंबर व ग ै रह बता ने की कोशिश कर रहा हो .	లేదా కొనని వి వర ాలు , నె ం బర లు మన కి తెలియ జే య డానికి సా మ పరయతని ంచి ఉండ చచు .	0.6338
यह बु शी , हार ट फर ड शे र है .	అది బు ష ీ , హె ర ట ఫో ర డ ష ె ర .	0.6538
कयोंकि साम राज य , परा कर म और म हि मा स दा ते रे हैं .	ఎందుకంటే ఈ రా జ యం నీ ది , ఈ అ ధి కా రం , ఈ కీ ర తి నీ వి .	0.6318
कया यह वि देश सच ि व हैं ?	ఆమె వి దే శా ంగ మ ంత రి కదా ?	0.4951
अगर जा दू से मुझे कुछ और मिल जाता है , तो मैं उसका इस ते माल कर ल ूँगी .	ఏదో మా య జరిగి మా చే తి కి మ రే ద యి నా అ ంది తే , అపపుడు నేను అదే ఉ ప యో గి సతాను .	0.6353
जो चीज तुमने लगा ई थी , वह काम नहीं कर रही है .	నువవు దగగర ఉ ండి క టటి ంచిన క టటు , పని చేయడం లేదు .	0.6115
- यह कया है ? - इन सु लि न . यह डा य बि टी ज के लिए है .	- ఇది ఏంటి ? - ఇ న సు లి న . ఇది చ కక ె ర వయా ధి కోసం .	0.7083
अचछा , अगर दरवा जा नहीं खु ल ता है , तो मैं पै के ज पड ो सी के पास छोड द ूँगा .	సరే , ఎవరూ ప ల కక పో తే , నేను ఆ ప యా కే జీ ని మీ ప కక ఇంట లో ఇ చ చేసి వెళ తాను .	0.7038
उसके डै ड के लिए वा प सी का कोई रा सता नहीं है .	వాళల నానన తిరిగి మా జీవి త ాల లోకి రా వడం అ సా ధ యం .	0.5638
तेरी इ चछ ा जैसे स वर ग में पूरी होती है , वैसे ही प ृ थ वी पर पूरी हो .	భ ూ మి న ందు నీ పని ము గి సిన ది ఎందుకంటే ఇక నీ వు స వర గ ము లో నివ సి ంచ వ లె ను .	0.6458
तो कोई और मा रा जाएगा .	ఎవరో ఒక రు హ తం అవు తారు .	0.5320
ये कहीं से भी हो सकते हैं . इसके बारे में अभी भी हम कुछ नहीं जानते .	వాళలు ఎ కకడి వార యి నా కా వచచు . ఇ దంతా ఏమి టో మన కి ఇంకా తెలియ డం లేదు .	0.6209
- कया कहा ? - तुम . तुम खुद को चा ला क समझ ते हो .	- అది ఏంటి ? - నువవు . నువవు తెలి వెన వాడి వి .	0.5933
- इन से क हो ये खि ड किया ँ खो ल सकते हैं . - नहीं !	- వాళలు కి టి కీ తె రలు తె ర వచచ ని చెపపు . - వదదు !	0.6727
पर धा न म ंत री के कार या ल य को सू च ना दे दी गई है .	పర ధా నమ ంత రి కార య ాల యా నికి సమా చా రం అ ంది ంచా ం .	0.6357
- मार शा . - लेकिन तुमहें यह बात पता थी , है ना ?	- మార షా . - కానీ ఆ విషయం నీకు తెలుసు , కదా ?	0.6354
कया विमान में कोई डॉ क टर है ? कोई भी ? पलीज !	విమానం లో ఎవరెనా డా క టర ఉననా రా ? ఎవరెనా ? పలీజ !	0.5153
मुझे लग रहा है आज मुझे देर होने वाली है .	ఈ రాత రికి బాగా ఆ లస యం అవు తుంది అనిపి సతోంది .	0.5744
मैं सोच रही हूँ का ई के लिए कुछ ख री द ल ूँ .	ఖ ా య కోసం నేను ఏదెనా కొ నా లని ఆలోచి సతుననాను .	0.5515
- कया ? - वैसे , नहीं .	- ఏంటి ? - అంటే , లేదు .	0.5977
हमें कुछ करना होगा !	మనం ఏదో ఒకటి చేయాలి !	0.4866
उसके लिए शु भ काम ना एँ .	అ ందుకు మీకు గు డ ల క .	0.5145
- खि ड कि यों को बंद रह ने दो . - इन हें बाहर देख ने दो .	- ఆ కి టి కీ లు మూ సి ఉ ంచండి . - వాళ లని బయట చూడ నివ వు .	0.6928
बंद हो रहा है . . .	ఆ పి వే య బ డు తోంది . . .	0.5928
तीन मिनट . हम ले के लिए तैयार हो जाओ .	మూ డు నిమిష ాలు . దా డి కి సిదధ ంగా ఉండ ండి .	0.5458
दे वि यों और स जज नों ,	లే డీ స , జె ంటి ల మెన ,	0.5246
घु ट नों के बल बैठ ो .	మో క ాలి మీద కూ రచ ో .	0.5931
घु ट नों के बल बैठ ो .	మో క ాలి మీద కూ రచ ో .	0.5931
