Hindi	Telugu	Similarity_Score
मुझे लगता है न ई शु रु आत के लिए सही समय है .	కొతత ఆ రం భా నికి ఇది స రెన సమయం అని అనుకుంటా ను .	0.6150
जलदी आ ना . मैं बचचे को संभाल रही हूँ , पै कि ंग तुम करो गे .	ఎకకువ సే పు చేయ కు . బి డ డ ను మో సతుననాను , అందుకే నువ వ ననీ సర ద ాలి .	0.6454
वहाँ मैंने तीन गर म को को रख े हैं , दो मार श मै लो , एक सा दा .	డె క మీద మూ డు వే డి కో కో లు , రెండు మార ష మ లో లు , ఒక సా దా ఉననాయి .	0.6660
मैं एक दम बेवकूफ हूँ . उस बद बू दार डॉ क टर पर भरो सा नहीं करना चाहिए था .	నేను బాగా వె ర రి వాడిని . అలా ంటి వా స న గల డా క టర ను అసలు నమమ కుండా ఉండ ాల సింది .	0.6277
हमने तुमहें घर में आने दिया ,	నినను మా ఇంటికి రా ని చచా ము ,	0.5295
हैलो , वॉल ट 3 3 .	హలో , వాల ట 3 3 .	0.6453
डै ड को ढूँढ ो .	నా ననను వె తు కు .	0.4764
र च ना त म क पर य वे कष क अ शो क ब कष ी	కరి యే టి వ సూ పర వె జర శి రీ ష దర భా	0.6052
आप मुझे य ूँ ही छोड रहे हैं ?	మీరు ననను వెళళ ని సతుననా రా ?	0.5453
मुझे तुमहें कुछ बता ना है .	నీకు ఓ విషయం చెపప ాల సి ఉంది .	0.5540
शायद तुम भी भ ूत बन गए हो .	నువవు జీ వ పి శా చి వి అనుకుంటా .	0.4418
उनकी ऐसी खू बी को भी जि से आप नहीं जानते .	ఆమె లో ఒక వెపు గురించి మీకు తెలియ దే మో .	0.5454
बहुत जगह है .	బో లె డ ంత చో టు .	0.3738
एक रे डियो टा वर खो जना है .	నేను ఓ రే డి యో ట వర వె త క ాలి .	0.5525
इं सा नी सिर लिए घ ू म ते लोगों से मु ला का त कम ही होती है .	మనిషి తల తో పాటు పర యా ణి ంచే వారి ని ఎకకువ గా కల వ లేదు .	0.6088
हम से कहा गया था कि पर मा ण ु ब म से यु द ध खतम हो जाएँगे .	ఆ టం బా ం బు అంటే యు దధ ానికి అంత ం అని మనకు చెపపా రు .	0.6390
तुमहें उसकी फि कर करने की जरूरत नहीं , समझ े दोसत ?	దాని పె ఇక నీకు చి ంతి ంచే అవసరం లేదు , బా బ ూ , ఉ ంద ంటా వా ?	0.5485
एक दम नए भ कत और उनके बेवकू फा ना वि चार	వె ర రి ఉ పా య ాల తో సరి కొతత వి శ వా స కు ల జ టటు ,	0.5812
अचछा ? तो शो बि ज का एक राज बता ता हूँ .	అవునా ? మీకు ఓ చినన ష ో బి జ ర హ స యం చెబు తా .	0.5908
कुछ लोग सं गी त को समझ ते ही नहीं हैं .	కొ ంద రు జ నాలు , సంగ ీ తం ప టల అవ గా హ న ఉండ దు .	0.6132
- मैं नहीं जा रही . - मुझ पर भरो सा करो .	- నేను వెళ లను . వెళ లను . - ననను నమ ము .	0.6322
वहाँ कोई पर यो ग नहीं है .	అంటే , అకకడ ఏ పర యో గం లేదు .	0.5579
उस शा ं ति के लिए आप खत रा नहीं बन ें .	ఆ శా ంతి కి మీరు వి ఘ ా తం కలి గి సతే మి న హా .	0.5685
बस हमें परे शान मत करो , मैं जो चा हो बता द ूँगा .	నువవు మమ మ లని శా ంతి తో వదిలే సతే ఏదెనా సరే చెబు తాను .	0.5721
पर ऐसा नहीं हुआ , है न ?	అది పని చేయ లేదు , అయి ందా ?	0.5333
समझ रहे हो ?	ఒకటి తెలుసా ?	0.4418
सुरकष ा सभी का अधि कार है .	మీకు భ దర త కు అర హ త ఉంది .	0.5451
लॉ य ड और कैसा ंड रा दोनों वै ज ञ ा निक हैं ,	లా యి డ , క సా ండ రా ఇదద రూ శా స తర వే తత లు ,	0.6573
ओ वर सि यर 3 3 :	పర య వే కష క 3 3 :	0.6640
सभी का कोई परा यो ज क है पैसे क मा ने में मुझे शर म नहीं है .	అంద రికీ స పా న సర ఉంటా రు , నా జీ వ నో పా ధి విషయం లో నేను సి గ గు పడ ను .	0.6466
मेरी रि सर च कं प नी को उनकी कं प नी ने ख री दा था .	నా పరి శ ో ధ నా సం సథ ను ఆమె వి భా గం కొ ను గో లు చేసి ంది .	0.6217
वॉल ट 3 2 की काम चला ऊ ओ वर सि यर हों गी	వాల ట 3 2 కు తా త క ాలి క పర య వే కష కు ర ాలి గా ,	0.6059
मेरे पति की हतया हुई .	కొతత జీవితం ఆ రం భి సతారు .	0.5130
यह खा ने की चीज नहीं है .	నువవు దీని ని తి న లేవు .	0.5387
और वाह वा ही ब टो र नी है .	నాకు కీ ర తి సం పా ది ంచాలి .	0.5241
थे डि य स , वह सिर मुझे दो .	థా డి య స , తల నాకు ఇవ వు .	0.6666
अब हम उन सब को अ ल वि दा कहते हैं जो हमें छोड कर वॉल ट 3 2 जा रहे हैं .	ఇక ఇపపుడు , వాల ట 3 2 కోసం మన లని వది లి వెళ లే అంద రికీ వీ డ కో లు చెబు తుననాం .	0.6519
या तुमहारे सच में तीन बे टे हैं ?	లేదా నీకు ము గ గు రు పిలల లని వి ననా నా ?	0.5390
मुझे कुछ बडा करना है , मौ का है . . .	భా రీ గా ఎ దగ ాలి , మనకు అవకా శం . . .	0.6606
और वह ते जी से करी ब आ रही है , है न ?	అది తవర గా వచచే సతోంది , కా ద ంటా రా ?	0.5948
यह एक ऐसी गा ली है जो ऐसे लोगों को दी जाती है जो पागल नहीं हैं .	పిచచి వాళ లను కా ని మను ష ు లను వి వరి ంచే ందుకు అది వాళలు వా డే ఓ ము రికి పద ం .	0.5697
घर जाओ . तुमहारे लिए वही चाहता हूँ .	ఇంటికి వెళ లు . నీ కో సమ దే కావాలి .	0.5476
पर मेरी समस या यह है कि	కానీ నా సమసయ ఏంట ంటే ,	0.5025
ह ॉ ली व ु ड फ ॉर ए वर चर च स भा जा री है	హ ాల ీ వు డ శా శ వ తం - ఛ ా పె ల సె షన లో సే వ	0.6528
वा य लि न सं गी त के मेरे छो टे , पर ता कत वर स ंग रह के साथ .	శ కతి వ ంత మెన ఫి డి ల ట యూ న ల సే క రణ లో వి లా స వ ంత ంగా గ డి పి నపపుడు .	0.6703
हैलो , न ॉर म .	హాయ , నా ర మ .	0.5404
जरा पे ची दा माम ला है .	అది ఓ సం కలి షట మెన సం సథ .	0.5252
मैं आ ऊ ं गा .	కని పె డ తాను .	0.4999
मुझे नहीं पता था कि अ मे रि का का च हे ता बंद ूक धा री इतना सं वे द न शी ल है .	అ మె రి కా మె చచి న తు పా కీ వీ రు డు అంత సు నని త మని నేను గర హి ంచ లేదు .	0.6769
बि ज ली कहाँ से आती है ?	మీకు క రె ంట ఎ కకడి ది ?	0.5680
सा ँ स तो आ रही है न ?	ఇకకడ గ ాలి ఆ డు తోంది గా ?	0.5454
यह . . . ऐसा नहीं . . . ऐसी बात नहीं है .	ఇది . . . అలా కాదు . . . ఇదే మీ లేదు లే , నిజం .	0.6790
जिन पर पर ीक ष ण किया वे उममीद के मु ता बि क नहीं थे .	మా పర ీ కష ా అ ం శ ాలు మా అ ంచ నా కంటే త కకువ సథా యి లో ఉననాయి .	0.6296
सट े फ और मुझे नया घर मिला है .	సట ె ఫ , నేను కొతత ఇ లలు ఆ రం భి సతా ం .	0.6113
माफ करना .	మన ని ంచాలి .	0.3237
हे भगवान .	అబబా ఛ . ఛ .	0.4472
वि दा करते हैं ! वॉल ट 3 2 जा इए	మీకు వీ డ కో లు ! 3 2 కి మా రు తుననారు	0.6007
शायद नहीं . ठीक है .	అలా కా ద ను కుంటా . సరే .	0.5136
मैं म रा कयों नहीं ?	నే నె ందుకు చని పో లేదు ?	0.4309
तुमहारा इंतजार कर ूँगी . ठीक है ?	నీ కోసం వే చి ఉంటా ను . సరేనా ?	0.5176
शुरू करो .	అది న ొ కకు .	0.4469
तु र ंत 3 1 में लौ टो .	వెంట నే 3 1 కి వచచే సె య .	0.5767
ठीक है . माफ करें . यह गलती थी . हम जा रहे हैं .	సరే . మన ని ంచండి . ఇది పొ ర పాటు . మేము ఇక బయ లు దే రు తా ం .	0.6445
उन पर पर यो ग कर रहे हो . बु री बात है !	వాళల పె పర యో గ ాలు చేసతుననా రు . మీకు పిచచి !	0.5680
और बकवास मुझसे स ह न नहीं होगी .	ఇంత కంటే సో ది ని భ రి ంచ లే నని .	0.5418
चाह े तुमहारे पिता नहीं मिल ें ?	తిరిగి ఇవ వాలని అనుకుంటా వా ?	0.4806
मैं अचछा इंसान हूँ व ग ै रह . . .	నేను మంచి వాడి నని అన డం . . .	0.6031
यह तो . . . मुझे इसे . . . यह एक नि शा नी भर है . कुछ नहीं . . .	ఇది ఎకకువ . . . నేను . . . ఇది ఓ జ ఞ ా పి క . అలా కాదు . . .	0.7995
फ ॉल आ उ ट पर पिछ ली बार	ఫ ాల ౌ ట ఇంత కు ముందు	0.5397
और ऐसी रा जन ै ति क वि चार धा रा बे च कर भी	సరే , సర ఫ రాల తో ము గి సే రా జ కీ య భా వ జ ాలా నని	0.5820
तुमहारे पिछ वा डे से छो टी आँ त बाहर निकाल सकती है .	అది సరి గగా మీ ది గు వ పరే గు జా రి పో తునన శ బ ద ం .	0.6300
ठीक है , फिर से सोच ते हैं .	అది తిరిగి మూ ల యా ంక నం చేయాలి .	0.5006
इसकी धा र ते ज कर दो , पलीज .	దయచేసి దానిని ప దు ను పెటట ాలి .	0.4866
ओ य , पै र है मेरा . खाना नहीं , समझ े ?	ఏ య , అది నాకు . అది ఆ హా రం . కాదు , సరేనా ?	0.6682
यह बडी कमी नी चीज है . यह भी चाहिए ?	ఈ ది కకు మ ాలి న చెతత ది . నీ కూ ఇది కా వ ాలా ?	0.5024
वे इसे खो जना कभी बंद नहीं करेंगे .	వాళలు ఆర టి ఫా క ట ను వె త క డం ఏ నా టి కీ ఆ ప రు .	0.5196
मुझे मार ना मत . मैं डॉ क टर हूँ . मदद कर सकता हूँ .	ననను చం ప క ండి . నే నా డా క టర ని . సాయం చేయ గలను .	0.6584
धनयवाद , डा र लि ंग .	ధనయవాదాలు , బంగా రం .	0.5082
मैं . . .	నేను . . .	0.6413
ठीक है , देख ते हैं .	సరే , సరే , ఇది గో .	0.5123
माफ करना .	మన ని ంచు .	0.4267
आप से एक बात पूछ ूँ ?	ఓ విషయం అడ గ వచచా ?	0.5260
शुरू करने से पहले , मेरी फी स की बात करें .	మనం ఆ రం భి ంచే ముందు , నా ఫీ జు విషయం లో చినన మాట .	0.5837
तुमहें पता है रे डियो टा वर कहाँ होगा ?	రే డి యో ట వర ఎ కక డు ందో నీకు తెలుసా ?	0.5918
बेटी , गर म को को बना या है .	నీ వే డి కో కో తీసుకో , బు జ జీ .	0.5107
- यह . - वह . हाँ . ठीक है .	- ఇది గో . - అది . సరే . అవును .	0.6430
बर दर हु ड .	సో దర జా తి .	0.5229
- करा ं ति के लिए शु भ काम ना एँ . - रख ली जिए .	- వి ప లవ ంలో మీకు మంచి జరగ ాలి . - లేదు , ఉ ంచండి .	0.6334
इसी लिए मैंने सर वो च च परि ष द से बात की है .	అందుకే నేను హె క ౌ న సి లతో సం పర ది ంపు లను చేశా ను .	0.6106
मुझे पता है कि मुझे इस हा लत में	నేను స హాయ ాలు అడి గే పరిసథి తి లో లే నని	0.5357
मुझे यही कहना है कि वै ज ञ ा निक जिस स मा ज को चला एँ	ప ాలి ంచ బ డే సమా జ ం , నిజంగా ఆ దర శ వ ంత మెన సా మా జి క నిర మా ణ మని	0.5789
मैंने ऐसा पहले देखा है .	ఇలా ంటి సథి తి గ తం లో చూశా ను .	0.4946
और , जा ह िर है कि हर वॉल ट को ओ वर सि यर की जरूरत होती है ,	ఇంకా , క చచితంగా , పరతి వాల ట కు పర య వే కష కులు అవసరం ,	0.6394
और इस तरह अब हमारे दोसत हमारे पड ो सी बन गए हैं .	ఇక దాని తో , ఇపపుడు మన సనే హి తులు పొ రుగు వారి గా అవు తారు .	0.5338
मुझे उसे वापस पा ने में आपकी मदद चाहिए .	దానని తిరిగి పొ ంద డం లో నాకు మీ సహా యం కావాలి .	0.5263
मैं किसी ज मा ने की खू बस ू रत ह ॉ ली व ु ड हि ल स के नीचे हूँ .	ఒక పపటి అంద మెన చో టు హ ాల ీ వు డ హి లస కే ంద రం నుండి .	0.6810
आज कल यह जयादा दिख ती नहीं है , है न ?	అవి అంత ఎకకువ గా క న బడ వు , అవునా ?	0.6206
कया सोच रहे हो ?	ఏం ఆలోచి సతుననా వు ?	0.5021
सब को यह सं गी त सच में पसंद नहीं है ?	ఈ సంగ ీ త పు శ బ ద ం న చచ ద నా , నిజంగా ?	0.6177
मुझे बस जानकारी चाहिए .	సమా చా రం వె తు కు తుననా అంతే .	0.4612
ठ ं डा फ यू जन , अन ंत ऊ र जा .	కో ల డ ఫ యూ జ న , అన ంత మెన శ కతి .	0.6828
बै क अप पा वर शुरू किया गया .	బ యా క ప ప వర పరా రం భ మెంది .	0.5942
तुमसे और हम सबसे बहुत बडा है .	అది నీ కంటే పెదద ది , మన అంద రి కంటే .	0.4902
वैसे , मैं तो फि ल मी ही रो हूँ , पर आप असल जिंदगी के ही रो हैं .	సరే , నేను సి ని మ ాల లో హ ీ రో గా చేయ వచచు , కానీ నిజ జీవితం లో మీ రే హ ీ రో లు .	0.5975
वही ल डा ई जो आपने भी ल डी .	మీరు చేసిన అదే యు దధ ం .	0.5098
कया है ?	ఏమి టి ది ?	0.3924
कुछ नहीं होगा .	నువవు బాగు ంటా వు .	0.4464
- हाँ . - नहीं .	- అవును . - లేదు .	0.5106
पर अगर सी प ियाँ पसंद आई हों , तो ट ू ना भी पसंद आए गी .	కానీ నీకు ఆ య సట రలు న చచి తే , డబ బా ట యూ నా కూడా తపప క న చచు తు ది .	0.6326
पर तुमहारी जान बचा ने के लिए . . .	కానీ నువవు బ తి కు ండ ాల ంటే . . .	0.6462
अं तर - वॉल ट मै से ज 3 3 3 1	ఇంట ర వాల ట స ందే శ ాలు 3 3 3 1	0.7006
दुनिया का अ ंत बे च कर बहुत पैसे क मा ए जा सकते हैं .	పరపంచ ం అంతా నని అమమ డం లో చాలా డబబు ఉంటుంది .	0.5658
लोगों से चो री करके भी यो द धा नहीं बन सकते .	సరే , జ నా ల నుంచి దొ ం గి లి ంచి నా సె ని కు డి వి కాల ే వు .	0.5402
आपको वि दा करते हैं ! आप वॉल ट 3 2 में र हें गे	మీకు వీ డ కో లు ప లు కు తుననాం ! మీరు 3 2 కి మా రు తుననారు	0.5817
आपको वि दा करते हैं ! आप वॉल ट 3 2 में र हें गे	మీకు వీ డ కో లు ప లు కు తుననాం ! మీరు 3 2 కి మా రు తుననారు	0.5817
माफ करना , मैंने आपको नहीं सुना .	మన ని ంచాలి , నా క ది విన బడ లేదు .	0.5301
शा ं ति का यह म ं दि र हमें कि सम त से मिला है ,	శా ంతి , స హ నా లతో ని ండి న ఈ పు ణ య కష ే త రా నని కను గొ న డం	0.6198
मैंने उसे मर ते देखा .	తను చని పో వ డా నని చూశా ను .	0.4987
तुम मेरे लिए ऐसा करो गे ?	నా కోసం అలా చేసతా వా ?	0.5103
जिन सै नि कों से हम वि देश ों में लड रहे थे , उनके परिवार ,	వి దే శ ాల లో పో రా డి న ఈ సె ని కులు , వాళల కుటుం బ ాల తో ,	0.6534
अचछा वि ले न कभी खुद को वि ले न नहीं समझ ता .	ఓ మంచి దు ర మార గు డు తన ను తాను చె డ డ వాడి గా చూడ డు .	0.5918
पर यह हमें याद दि ला ता है कि इस जगह के कया मा य ने हैं .	కానీ ఈ సథ ల ం దే నికి సంబం ధి ంచిన దో ఇది ఉద వే గ ంగా గురతు చే సతుంది .	0.5891
तो तुम वह सब भूल जाओ गे जो हमने देखा था ?	అయితే , మనం చూ సిన అనని టి నీ నువ వ లా మరి చి పో తా వా ?	0.5660
ये पि ं ज रे सही लगा ए हैं आपने . बहुत अचछे .	సరే కానీ , ఈ ఉ చచు లు బాగా చేశారు . చాలా బాగుంది .	0.5699
याद रख ें , आप जहाँ भी पहुँच ें , वही आपका घर है .	గురతు ంచుకో ండి , మీరు ఎ కకడికి చే రి తే , అదే మీ చో టు అని .	0.5581
जब तक मैंने तुमहारे भाई से यह खत लिया	నీ సోద రు డి ఈ లే ఖ నాకు అంద ే స రికి ,	0.5536
{ \ an8 } धनयवाद , कै थी .	{ \ an8 } ధనయవాదాలు , కే థ ీ .	0.6652
- मुझे दो . - यह लो .	- ఇవవ మ ంటుననా ను . - సరే .	0.5821
मैं वहाँ रह ता हूँ . . .	నే న కకడ బ త క గలను . . .	0.5736
अजीब है न कि हमेशा वॉल ट 3 1 से ही ओ वर सि यर चु न ते हैं ?	వాల ట 3 1 ను ంచే పర య వే కష కు ని ఎ ం పి క వి ంత గా లేదా ?	0.7162
अपनी बी वी की जा सू सी कर ूँ ?	నా భా రయ మీద ననను ని ఘ ా వే య మ నా ?	0.4872
और अगर आपको यह पसंद न आए ,	ఇక మీరు వి నన ది మీకు న చచ కపోతే ,	0.5008
जि से चा हो का ट लो , जहाँ चा हो चले जाओ .	ఏం తి ంటా వో తి ను , ఎ టు పో తా వో పో ,	0.5788
सुनो , ह ॉ ली व ु ड में कट टर वाद फै ल रहा है .	చెబు తుననా , హ ాల ీ వు డ లో రా డి కలి జ ం వయా పి సతోంది .	0.6422
बस इसलिए कि यह उनके बि ज ने स म ॉ ड ल में फि ट नहीं होता .	ఎందుకంటే అది వాళల వయా పార న మూ నాకు సరి పో లేదు .	0.5794
रुको , तुमने सोचा . . .	ఆగు , నీ ఆలోచ న . . .	0.6345
वह वे ध शा ला में है .	ఆమె అబ జర వే ట రీ లో ఉంది .	0.5602
शायद आज नहीं , पर कभी तो करे गा .	బహుశా ఇ వాళ కాదు , కానీ ఏదో ఒక రోజు న .	0.5358
मतलब , मेरा वॉल ट ऐसा नहीं है .	అంటే , మా వాల ట ఇలా ఉండ దు .	0.5676
