Hindi	Telugu	Similarity_Score
रुको , तुम कया कह रही हो ?	ఆగు , నువవు చెపపే ది ఏంటి ?	0.5202
है ना , गरेस , फै ंग ,	హ ననా , గరేస , ఫె ంగ ,	0.6545
नहीं .	లేదు .	0.3291
हैलो , डॉ गी .	హాయ , కు క కా .	0.5109
नहीं !	లేదు !	0.3291
मैं तुमहें यह सच में बता ना चाहती थी , पर तुम दोनों ने खुद पता कर लिया .	నేను మీ తో నిజంగా చెపప ాల నే అను కుననా , కానీ మీ రి దద రూ ము ందే కని పెటట ే సా రు .	0.6048
पर कया तुमहें नहीं लगता कि तुमहें जा ँच करनी चाहिए ?	కానీ మీరు దర యా ప తు చే సతే మంచిది అని అనిపి ంచడం లేదా ?	0.5391
- सही कहा ? तुमने ऐसा कयों कहा ? - अ नी क , मुझे एक मिनट दो .	- అవునా ? ఇపపుడు అలా ఎందు క ననా వు ? - య నిక , ఒక నిమిష ం ఇవ వు .	0.6804
मैंने भी एडगर की हतया की .	నేను కూడా ఎడ గర ని చం పా ను .	0.5322
नहीं .	వదదు .	0.3902
फै ंग , स सु र जिस की कं गा ली का किसी को पता नहीं है .	ఫె ంగ , ర హ సయ ంగా ఆ రథ ి క ఇ బబ ందు లు ఎదు ర కొ ంటు నన మా వయ య .	0.6215
वि वि यन , सा स जिस का अपना राज है .	వి వి యన , తన స ొ ంత ర హ స యం ఉనన అత త .	0.5772
यू लि सी स .	యూ లె సీ స .	0.5649
कोई बात नहीं . हम सभी को उस अफ े यर के बारे में पता है .	ఏం పర లేదు . మా అంద రికీ మీ అ కర మ సంబం ధం గురించి తెలుసు .	0.6263
{ \ an8 } वि वि यन	{ \ an8 } వి వి యన	0.5777
यू लि सी स !	యూ లె సీ స !	0.5649
वह द या ल ु है .	అతను మ ంచ ో డు .	0.5406
यहाँ कया हो रहा है ?	ఇకకడ ఏం జరుగు తోంది ?	0.4947
मैं वह नहीं कर रहा था .	నేను చేసి ంది అది కాదు .	0.4368
- पि त ृ त व टे सट ? - मैंने उनसे कहा था कि तुमहें न बता एँ ,	- పె టర ని టీ టె సటా ? - నేను వాళ లకు చెపప ొ దదు అని చెపపా ను ,	0.6774
बात यह है कि ,	విషయం ఏంట ంటే ,	0.4410
अरे , धत तेरी की .	భలే , చెతత వెధ వా .	0.5331
इसलिए अग ली सु बह , जब उसने एक म हिला की ची ख सु नी . . .	కాబటటి , తరవాత రోజు ఉద యం ఒక మ హి ళ అ రు పు విన గానే . . .	0.6923
अगर उस में ज हर नहीं है , तो कोई समस या नहीं होगी , है न ?	అంటే , ఇ ందు లో ఎలా ంటి విష ం లే కపోతే సమసయ ఉండ కూడదు , కదా ?	0.6284
नहीं .	లేదు .	0.3291
वाह .	వా వ .	0.3262
विश वास कीजिए , पर . . .	ఆ మాట నిజం , కానీ . . .	0.5402
- अरे , हाँ , बिलकुल . - हाँ .	- ఓహ , సరే , అలాగే . - అవును .	0.6466
पर शायद इस स पता हा ंत के कारण , मुझे सोच ने का मौ का मिला कि पयार कया है	కానీ ఈ వా రా ంత ం నాకు పరే మ మీద ఉనన భా వ న కు పర ీ కష లాంటి ది అన ొ చచు , అంటే ,	0.6298
और शायद इस बारे में बात करने के लिए यह सही समय या जगह नहीं है ,	అలాగే ఈ విషయం మాటలాడ డానికి ఇది స రెన సథ ల మో లేక సమ య మో కా కపో వచచు ,	0.5830
नहीं !	లేదు !	0.3291
जैसे तुमने बना ई , वैसे नहीं . तुमने वह कैसे बना ई ?	అంటే , అ చచ ం నువవు చేసిన టటే కాదు . అలా ఎలా చేశా వు ?	0.6046
- जो ई ! अ नी क ! - हैलो !	- జో యి ! య నిక ! - హాయ !	0.6475
- वह काफी अचछी है , है न ? - शान दार है !	- ఆమె బాగా చే సతోంది , కదా ? - అదభు తంగా !	0.6129
पयार में . जिंदगी में . किसी और चीज में .	పరే మ కోసం . జీవితం కోసం . వే ర ొ కదా ని కోసం .	0.4954
कट !	క ట !	0.3918
रुको , कया ?	ఆగు , ఏంటి ?	0.5207
- ए , मैंने कैसा किया ? - बहुत बढिया .	- హేయ , నేను ఎలా చేశా ను ? - అదభు తంగా .	0.6425
मैं बेहद अस ह ज महसूस कर रहा हूँ .	నాకు ఇపపుడు చాలా ఇ బబంది గా ఉంది .	0.4992
वि वि यन , रि हर स ल डि नर के बाद , तुम यू लि सी स से वी पि ंग वि लो के नीचे मिली थी .	వి వి యన , రి హా రస ల భ ో జ నం తరవాత మీరు వీ పి ంగ వి లలో దగగర యూ లె సీ స ని కలి శా రు .	0.6716
वि वि यन के दरवा जे तक गए , कयोंकि उनहें लगा था कि आवा ज व हीं से आई थी .	నే రు గా వి వి యన అ రి చి ంది అను కు ని వాళళ గ ది కి వెళళి నపపుడు వచచి న శ బ ద ం .	0.6223
मैं अपने ए ह सा स ों को भूल ने के लिए दुनिया भर में भाग ता रहा .	నేను నా ఫీ లి ంగ స నుండి తపప ి ంచుకో వడానికి పరపంచ మ ంతా తి రి గా ను .	0.6149
- जो ई , तुमहें मिल गए ? - हाँ . एडगर के ऑ फि स में एक टी वी है .	- జో యి , వీ డి యో దొ రికి ందా ? - అవును . ఎడ గర ఆ ఫీ సు లో టీ వీ ఉంది .	0.6848
मैं कह रही हूँ कि मुझे तुमहारे साथ रह कर बेहद खुशी मिल ती है	నీ తో ఉనన పపుడు నేను ఎలా ఉంటా నో నాకు న చచు తుంది అని అ ంటుననా ,	0.5767
मैं चु प चा प नहीं बैठ ूँगा जब कि तुम दोनों डि टे क टि व ब ने घ ू मो .	మీ ఇదద రు స ననా సు లు డి టె క టి వ ఆట ఆ డు తు ంటే నేను ఊ రి కే చూడ ను .	0.7077
कयोंकि वि वि यन ने उसकी अग ली सु बह ही उनहें वहाँ से उठा या था	ఎందుకంటే వి వి యన వాటి ని తర వా తి రోజు ఉద యం వర కు తీసుకో లేదు ,	0.5808
और फै ंग ने उस गि ला स से पी या जिस में गरेस ने ऐ डर ॉल डा ला था .	అలాగే ఫె ంగ ఏ మో గరేస ఆ డె ర రాల కలి పి న గ లా సు లో నుండి తా గా డు .	0.6593
हाँ , मैं आप से इस बारे में बात नहीं करना चाहता था . . .	అవును , నేను అలా ంటి విషయ ాలు మాటలాడ ాలని అస స లు అనుకో లేదు ,	0.5470
विश वास करो , कर न ल जि ंदा है . वह कमी ना म रे गा ही नहीं .	ఖచచితంగా చెపప గలను , కల న ల చా వ లేదు . ఆ చెతత కు కక చా వ దు .	0.6541
मेरे पास पहले से ही एक कु त ता है जो मर ता ही नहीं है .	నా దగగర ఇ పపటి కే చా వడానికి ఒ పపు కో ని కు కక ఒకటి ఉంది .	0.6145
ब यू से फै ला स की मत बढ ती जा रही है . और बढ ती जा रही है .	బు సె ఫ లస , దాని రే టు పె రుగు తోంది . బాగా పె రుగు తుంది .	0.6174
तुमहें निका ला जाता है . अपना सा मान स मे टो और निक लो .	భలే , నీ ఉద యో గం తీ సే సతుననా . నీ బ యా గు లు సర దు కొ ని పో .	0.6140
- जो - जो , इन पु ट पर द बा ओ . - डै ड , मैं द बा रही हूँ .	- జో - జో , ఇ న పు ట మీద న ొ కకు . - నా ననా , అదే చేసతుననా .	0.7193
कयोंकि यह मी ठा है , पर फ ल दार है और इसमें दू ध है .	అంటే , అది తి యయ గా , ప ళల తో కలిసి భలే మ ృ దు వు గా ఉంది .	0.6568
पर कैसे ? मैंने उसे खि ड की से नीचे फ ें क दिया था .	కానీ ఎలా ? నేను దీ నని కి టి కీ లో నుండి వి సి రే సా ను .	0.5942
इतना साह सी है कि उसने मुझे दूस रा मौ का दिया .	ఆయన నాకు రెండ వ అవకా శం ఇవవ గల ధ ె ర యం ఉనన మనిషి .	0.5735
और फै ंग ने एडगर के सामने वह गि ला स नीचे र खा .	ఆ తరవాత ఫె ంగ ఆ గ లా సు ని ఎడ గర ముందు పెటటా డు .	0.6571
मैं आ फ टर - पार टी तक घर में घु सा ही नहीं था .	నేను ఆ ఫ టర పార టీ అ యయ ే వర కు ఇంటికి వెళళ లేదు .	0.6287
पर मेरे लिए सु नि श चि त होना जरू री था , गरेस .	కానీ నేను ధ ృ వీ కరి ంచుకో వాలి అను కుననా , గరేస .	0.6052
मैं बस अपनी बहन के लिए एक नो ट छोड रही थी .	నేను నా చె లలి కి ఒక నో ట రా సి పె డు తుననాను .	0.5612
तो फिर , तुमहें हम सब को गिर फ तार करना होगा	సరే , అంటే మీరు మా అంద రి నీ అ రె సట ు చేయాలి	0.5577
तुमने इ सा बे ल पर डो रे डाल ने की कोशिश की ?	నువవు ఇ సా బె ల కలిసి వ ంట లు నే రచు కుననా వా ?	0.6273
किसी ने अभी - अभी मुझे एडगर की मौ त पर एक ले ख भे जा .	ఎవరో నాకు ఎడ గర చా వు గురించి ఒక ఆర టి కల పం పి ంచారు .	0.6441
मुझे नहीं लगता कि अ नी क ने यह किया .	హ తయ య నిక చేసి ఉంటా డని నేను అనుకో ను .	0.5805
तुमहें नौ जिंद ग ियाँ मिली हैं , है न , न न हे कु त ते ?	నీకు తొ మ మి ది జీవి త ాలు ఉననాయి , కదా , బు జ జి కొ ండా ?	0.6527
- अफ े यर ? - गरेस के साथ मेरा अफ े यर .	- ఏం సంబం ధం ? - గరేస తో నా సంబం ధం .	0.5464
- यह एक उ त त म मि श रण है . . . - अ नी क .	- అనని గు ణ ాలు కలి సిన . . . - య నిక .	0.6687
मैं उस में इ सा बे ल की जिन डाल ूँगी .	నేను ఇ ందు లోకి ఇ సా బె ల జి న పో సతాను .	0.5967
- जो , अगर तुम ए च डी ए म आई द बा ओ तो . . . - नहीं , बस A p p l e T V पर जाओ .	- జో , నువవు హె చ . డి . ఎ మ . ఐ మీద . . . - కాదు , యా పి ల టీ వీ మీద న ొ కకు .	0.7425
मैंने तुमहें भूल ने की कोशिश की ,	నినను మర చి పో వడానికి పరయతని ంచా ను ,	0.4979
का इ ल र ! ए , तुम रिक ॉर ड कर रहे हो ?	కె ల ర ! హేయ , రి కార డి ంగ చేసతుననా వా ?	0.6282
- और तुम जी त नहीं पा ओ गी . - नहीं .	- అలాగే నువవు గె లవ లేవు . - లేదు .	0.5845
- उसने कहा , " जाओ , यह ले आओ , कमी ने . " - बेशक तुमने यह कहा , है न ?	- ఆమె , " ఇది తీసుకు రా , ము ండా " అ ంది . - నువవు ఆ మాట అననా వు , కదా ?	0.7141
और तुम दोनों इ कल ौ ते नहीं हो जिन हें खुश हा ल ह ॉ ली व ु ड अ ंत मिला .	అలాగే అంద మెన హ ాల ీ వు డ ము గి ంపు దొ రికి ంది కేవలం మీ ఇదద రి కే కాదు .	0.6632
पर मैं भाग - भाग कर थ क चुका हूँ .	కానీ నేను పరి గె తతి అ ల సి పోయా ను .	0.5295
हा वी , इस लडकी को गिर फ तार करो .	హ ౌ వి , ఆ అమమాయి ని అ రె సట ు చె య .	0.5164
मुझे वह तुमहारे कम रे में मिली	నేను దానిని నీ గ ది లో చూశా ను ,	0.5227
तुमहें लगा कि मैंने हतया की ?	నువవు నేనే చం పా ను అను కుననా వా ?	0.5095
और तुम सोच ो गे , " मैंने तुमहें सब बता दिया . " नहीं बताया .	ఇపపుడు మీ రం తా , " నేను అంతా చెపపా ను " అన ొ చచు . నేను చెపప లేదు .	0.6284
मैंने बचा हुआ क ुम ि स ड च बे बी ज बना ने में इस ते माल कर दिया .	నేను మి గి లి న కొంచెం ఖ ు మి స ని డ చ బ ే బీ స చేయ డానికి వా డే శా ను .	0.6483
हाँ , माफ कर दी जिए . मैं अब भी आपके सामने घ बरा जाता हूँ .	అవును , కషమి ంచండి . మీ ముందు నాకు ఇంకా కంగా రు గానే ఉంటుంది .	0.5835
{ \ an8 } एक स मार कस द मर डर सप ॉ ट	{ \ an8 } ఎ కస మార కస ది మర డ ర స పా ట	0.6991
सच में ? कयोंकि तुमने जो भी पे श किया , वह सब ूत नहीं है .	నిజంగా ? ఎందుకంటే నువవు చెపపి ంది ఏ దీ ఆ ధా ర ంగా తీసుకో లే ము .	0.5990
{ \ an8 } ब धा ई हो एडगर और गरेस	{ \ an8 } అభి న ంద నలు ఎడ గర & గరేస	0.6738
पर मुझे नहीं लगता कि फै ंग ने असल में तुमहारे साथ पी .	కానీ ఫె ంగ నిజ ానికి నీ తో కలిసి తా గా డు అని నేను అనుకో ను .	0.5744
अब , अगर वह इंसान शा वर में फ ूल ों की चा य बना ना चाहता था ,	సరే , ఆ వయ క తే గ నుక ష వర లో పు వ వు తో టీ చేయాలి అను కు ంటే ,	0.6519
- कया ? नहीं . . . - वि वि यन .	- ఏంటి ? లేదు . . . - వి వి యన .	0.6598
ठीक है . तुमने देखा मैं कया कर रहा था ? ठीक है . खैर . . .	సరే . నేను ఏం చేసతుననా నో నువవు చూశా వా ? సరే . అంటే . . .	0.6792
- चार मिनट ब चे हैं . - हाँ .	- నాలు గు ని ము ష ాలు . - సరే .	0.5561
देखो , वह एक दु र घट ना थी , है न ? जैसा कि तुमने कहा था .	చూడు , అది అనుకో కుండా జరిగింది , కదా ? నువవు అనన టటే .	0.6014
हमें हमारी हतया रि न मिल गई है . और वह गरेस है . - हाँ .	- మాకు మా హ ంత కు ర ాలు దొ రికి ంది . అది గరేస . - అవును .	0.6364
- फिर से , मुझे बेहद खे द है . - तुमहें खे द नहीं है .	- మళళీ చెప తుననా , కషమి ంచండి . - నీకు ఏ మా తరం బాధ లేదు .	0.6415
- मुझे तुमहारे " का ंट सी " से पी ने दो . - यह खा ली है .	- నీ కా ంట సి నుండి ననను తా గ నివ వు . - అది ఖ ా ళ ీ గా ఉంది .	0.6661
दरअसल , मुझे याद नहीं है .	నిజ ానికి , నాకు గురతు లేదు .	0.4615
नहीं , मैं कभी . . . देखो .	లేదు , నేను అలా . . . చూడు .	0.6796
नहीं , पर इससे सर परा इ ज ख रा ब हो जाएगा , कयोंकि . . .	లేదు , కానీ అలా చే సతే సర పర ె జ పో తుంది , ఎందుకంటే . . .	0.6384
और गलती से ज हर वाला गि ला स एडगर के पास छोड दिया .	అనుకో కుండా విష ం కలి పి న గ లా సు ను ఎడ గర దగగర వది లా డు .	0.6040
पर इससे मुझे एक मि लि यन ड ॉलर जरूर मिल ेंगे , है न ?	దీని వలల నాకు ఎలా గు ప ది లకష ల డ ాల రలు అందు తా యి , కదా ?	0.6427
सही कहा . नहीं है . पर , पता है कया , तुमहारी तरह मैं भी अ ंग ूठ ी बना सकता हूँ .	నిజ మే . లేదు . కానీ ఒకటి చెపప నా , నేను కూడా నీ లా గే ఇలా ంటి ది ఒకటి చేయ గలను .	0.6260
कया हुआ ? कया हो रहा है ?	ఏంటి ది ? ఏం జరుగు తోంది ?	0.5153
जाओ , वह ले आओ और पू छो .	దానిని తీసు కొ చచి అడుగు .	0.4773
नहीं , पर अब तुमहें पता है कि यह होगा , इसलिए यह सर परा इ ज नहीं होगा .	లేదు , కానీ ఇపపుడు జరగ బో తోంది అని తెలుసు కాబటటి , అందు లో సర పర ె జ ఉండ దు .	0.6232
ठीक है . तो , किस ने की ?	సరే . మరి , ఎవరు చేశారు ?	0.5030
- नहीं , आप नहीं कर सकते . - गरेस को मत छु ओ .	- లేదు , మీరు చేయ లే రు . - గరేస ని ము టటు కో వదదు .	0.6049
कि कोई पि स ते के खो ल कु चल ते हुए भाग रहा था ,	కార కర లా డ డం గుర తుంది అని ట రా వి స కూడా చెపపా డు ,	0.6337
के त ली मैंने छु पा ई थी .	టీ పా య ని దా చి ంది నేనే .	0.5632
मुझे समझ नहीं आता है .	నాకు ఒకటి అరథం కాల ేదు .	0.5204
- उसे ज हर दिया गया था . - मैंने एडगर को अपने हाथ ों से ज हर दिया था .	- వాడి కి విష ం పెటటా రు . - నేనే నా చే తు లతో ఎడ గర కి విష ం పెటటా ను .	0.6305
- एक मिनट ? हमारे पास समय . . . - मुझे . . .	- ఒకక నిమిష మా ? మనకు ఇపపుడు . . . - నాకు . . .	0.7380
- कया ? - बस एक मिनट .	- ఏంటి ? - ఒకక నిమిష ం .	0.5682
- रुको . - नहीं , नहीं !	- ఆగు . - వదదు , వదదు !	0.5445
और जब उसने फै ंग को देखा , तो ऐसा लगा मान ो उसने भ ूत देख लिया हो .	అలాగే వాడు ఫె ంగ ని చూ సిన పపుడు , ఏదో భ ూ తా నని చూ సిన టటు చూశా డు .	0.6515
तुमहारी मदद के लिए धनयवाद . तुमहारा पार ट नर बन कर बेहद खुशी हुई .	నీ సహా యా నికి చాలా థాంక స . నీ తో కలిసి పని చేయడం చాలా బాగుంది .	0.5343
- हाँ . - अरे , नहीं .	- అవును . - ఓహ , అమమ ో .	0.5914
बेवकूफ . ऐसा मत क हो .	వెధ వా . అలా మాటలాడ కు .	0.5608
यहाँ भी एक टी वी है .	ఇకకడ ఒక టీ వీ ఉంది లే .	0.4832
- और गरेस का कया ? - मुझे नहीं लगता कि गरेस ने हतया की .	- మరి గరేస సంగ తి ఏంటి ? - గరేస హ తయ చేసి ందని నేను అనుకో ను .	0.6033
जो ई ने कु त ते को खि ड की से नीचे फ ें क दिया और वह इ सा बे ल के टर ै म पो लि न पर गि रा .	జో యి కు కక ని కి టి కీ లో నుండి వి సి రే సింది , అది వెళలి ఇ సా బె ల ట రా ం పో లి న మీద పడి ంది .	0.6518
- सच में ? - करी ब एक मि लि यन ड ॉलर ? आपने यही नहीं कहा . . .	- నిజంగా ? - అంటే ప ది లకష ల డ ాల రలు సరి పో తా యా ? అది నువవు . . .	0.6946
से बा सट ि यन , यू लि सी स ,	సె బా స టి న , యూ లె సీ స ,	0.6095
पर गरेस आ फ टर - पार टी में रो जे पी रही थी .	కానీ ఆ ఫ టర - పార టీ లో గరేస ర ొ సె తా గి ంది .	0.5923
