Hindi	Telugu	Similarity_Score
तुमहें ऐ पि टा इ जर चाहिए ?	నీకు సటా ర టర ఏమెనా కా వ ాలా ?	0.5106
और . . . ब ला , ब ला , ब ला .	అలాగే . . . బ లా , బ లా , బ లా .	0.5662
सच में , है न ? बहुत खू ब , गरेस .	నిజ మే , కదా ? భలే పని చేశా వు , గరేస .	0.6514
दू ल हा आ गया . शादी के लिए ये क पडे थो डे फी के नहीं हो गए , ह ँ ?	మిసటర పెళళి కొ డు కు వచచా డు . పె ళ లి రోజు న ఇలా ంటి బ టట లా వే సు కునే ది , ఆ హ ?	0.6730
और इतनी सा री सी ढ ि यों को देख कर	అలాగే నేను చూ సతునన ఈ మె ట లను బటటి ,	0.5629
इसलिए इसे च ॉ क ले ट कहना ही नहीं चाहिए .	అసలు దానిని చా క లెట అని పి లవ డ మే పెదద తపపు .	0.5517
ठीक है . दोनों परिवार ों की एक फो टो ले ल ूँ ?	సరే . రెండు కుటుం బ ాల తో ఒక ఫో టో తీ య నా ?	0.6319
नहीं , मुझे नहीं लगता कि वह दूस री बार म जे दार लगे गा ,	లేదు , ఇం కొ క సారి నేను అంత బాగా ఎ ం జా య చేసతాను అనుకో వడం లేదు ,	0.6013
ए . मुझे तुमसे पयार है और मेरे मा ता - पिता तुमहें बेहद पसंद करेंगे .	హేయ . ఐ లవ యు , అలాగే మా అమమా నానన లకు కూడా నువవు న చచు తా వు .	0.6068
- तुमने यही कहा था , अ नी क . - कया ? नहीं , मैंने ऐसा नहीं कहा .	- నువవు అనన ది కూడా అదే కదా , య నిక . - ఏంటి ? లేదు , నేను అలా అన లేదు .	0.6346
- मैंने ऐसा नहीं किया , जो जो . कृपया . - मुझे पता है .	- నేను చేయ లేదు , జో జో . పలీజ . - నాకు తెలుసు .	0.6300
- दरअसल . . . - रुको . सच में ?	- నిజ ానికి . . . - ఆగు . నిజంగా నా ?	0.6263
हाँ . मैं अभी - अभी इस स पता हा ंत को पहली बार उसके मा ता - पिता से मिला .	అవును . నేను ఈ వా రం ఆమె అమమా నానన లను మొదటి సారి గా కలి శా ను .	0.5809
- धनयवाद . वाह . - तुमहारा सवागत है .	- థాంక స . వా వ . - అదే ం పర లేదు .	0.6155
मुझे पता नहीं वह कौन था .	అది ఎవరో నాకు తెలీదు .	0.4897
हमने म ॉ डे सट ो सटर ै ंग ल र , बि सब ी बी सट वाले माम ले सु ल झा ने में मदद की ,	మేము మొ డే సట ో హ ంత కు డు , బి స బీ మ ృ గం , అలాగే సటా న లీ , ఐ డ హో లో ని	0.7096
हमें गरेस को बचा ना होगा .	మనం గరేస ని కా పా డ ాలి .	0.5033
- कौन ? - गरेस .	- ఎవర ది ? - గరేస .	0.5983
अ नी क उसे पक ड सकता है .	దానిని య నిక పటటు కుంటా డు .	0.5096
तुमहारा कया मतलब है ? कया तुम मुझसे पूछ रहे हो कि कया मैं कभी जेल गया था ?	అంటే ఏంటి నీ ఉదదేశం ? నేను జె లు కు వెళళ ా నా లేదా అని అడుగు తుననా వా ?	0.5969
रॉ कस ै ना .	రో క సా న .	0.4233
रॉ कस ै ना .	రో క సా న .	0.4233
तुमहारे लिए न गे ट स ले आई हूँ .	నీ కో స మే తి న డానికి ఇ వి తీసు కొ చచా .	0.5671
जो ई ने मुझसे कहा कि मुझे न हा लेना चाहिए .	జో యి నేను మీ బా త రూ మ లో స నా న ము చేయ ొ చచు అ ంది .	0.5971
फिर मैं आपके परिवार को ले ने जा ऊँगा और मैं आपको नि रा श नहीं कर ूँगा .	ఆ తరవాత వెళలి మీ వాళళ ను తీసు కొ సతాను , మిమమలని ఏ మా తరం ని రా శ పర చ ను .	0.6175
- किसी ने मेरा हाथ छु आ ! - मैं गरेस हूँ .	- నా చే తి కి ఏదో త గు లు తుంది ! - నేను గరేస ని .	0.6373
मेरा मतलब , दु ख द रूप से , पर साथ ही अ चा न क मर ता है	అంటే , దారు ణ ంగా నే , కానీ అనుకో కుండా చని పో తే	0.5548
मुझे बस इतना पता था कि उनका आ शी र वाद पा ने के लिए	కానీ వాళ లకు న చచ ాలి అంటే నేను ఏదో క టి చెపపి	0.5715
तो ज ॉ नी इ ंग लि श ने दोबारा तुमहें नी चा दिखा दिया ?	అంటే ఆ హ ీ రో నీకు మళళీ ద ె బబ వే శా డు అనన మాట ?	0.5831
ब डे चा व से उसे खा रही है , है न ?	దానిని భలే తి నే సతుంది , కదా ?	0.5394
मुझे एक ल लोगों की टे बल पर अजीब लोगों और पू र व - बॉ य फर ें ड ों के साथ दूर बि ठा या गया था .	ననను ద ూర ంగా వి డ డు ర మెన వాళళు , ఎ కస - బా య ఫ రెండ లు ఉండే సి ం గి లస టే బు ల దగగర కూ రచ ో బె టట ా రు .	0.7149
काफी गा ली - गल ौ ज का इस ते माल किया था . काफी अप श बद लि खे थे .	చాలా గొపప భా ష నే వా డా వు . బో లె డ నని బ ూ తులు ఉననాయి .	0.6060
जब कि हम बस चाहते थे कि वह बस जो ई की पर वाह करे .	మేము వాడి గురించి ఏ మని అనుకుంటుననా మా అనే ఆలోచి ంచే వాడు .	0.4885
शायद इतना मजाक काफी है .	ఇక ఆ పి తే బాగు ంటుంది .	0.4885
- अब मेरी बा री . - हाँ .	- ఇపపుడు మార ాలి . - సరే .	0.5848
कया तुम यहीं सो ए थे ?	నువవు ఇకకడ ే పడు కుననా వా ?	0.4869
कृपया अंदर बैठ िए . च लिए .	దయచేసి ఎ కక ండి . రండి .	0.5038
जैसा कि आप में से कई जानते हैं , एडगर भी ड के सामने स ह ज महसूस नहीं करता है .	మీ లో చాలా మంది కి తెలుసు , ఎడ గర జ నం ముందు అంత స ౌ కర య ంగా ఉండ లే డు అని .	0.6653
कृपया , मुझे कि ंग ऑ फ बि ंग बुला ओ . इससे मह त व पू रण और कुछ नहीं है !	పలీజ , ననను కి ంగ ఆ ఫ బి ంగ అని పి లు వు . ఎవరెనా నా తర వా తే !	0.6710
तुमहारी कार अब भी ल ु ढ क रही है .	నీ కారు ఇంకా వెళ తూ నే ఉంది .	0.5272
- कया ? - कया तुमने अभी - अभी कु त ते को ला त मा री ?	- ఏంటి ? - నువవు ఇపపుడు ఆ కు కక ని త ననా వా ?	0.6188
- काफी वय सत . - पा नी होता कया है ?	- నీ ళలు అంటే ఏంటి ? - చాలా .	0.5506
मुझे जाना होगा .	నేను వెళళ ాలి .	0.4236
नहीं . वे मो टे ल के बाहर ख डे थे . उनहोंने कहा कि उनहें वि न यार ड आ ना था .	కాదు . వీ ళళు మో టె ల బయట ే ఉననారు . వెన యా ర డ కి వెళళ ాలి అననా రు .	0.6501
दरअसल , शायद मैं मदद कर सकता हूँ .	సహా యం చేయ డానికి ఒక మా రగ ం ఉనన టటు ఉంది .	0.5147
कया तुम कल प ना कर सकती हो कि मैं यहाँ अपना बेह तरी न ए नी मे - परे रि त ल बा दा पह ने बैठ ा हूँ ?	నా దగగర ఉనన ఒక మంచి యా ని మే పరే రణ తో చేయ బడి న రో బ వే సు కొ ని నేను ఇలా కూ రచు ంటే ఎలా ఉ ంటు ందో ఊ హి ంచ గల వా ?	0.6571
गरेस मेरे पया रे बे टे से केवल छ ह म ही ने पहले मिली थी .	గరేస నా కొ డు కు ను కలు సు కొ ని కేవలం ఆ రు నె లలు మాతరమే అవు తుంది .	0.5835
मैं एक रे डि ट दल का हि ससा हूँ .	నేను ఒక రె డ డి ట గర ూ పు లో స భ యు డిని .	0.6037
धत , यह तो बुरा हुआ .	అమమ ో , ఇది చాలా దారు ణం .	0.5301
और एक और हतया होती है .	ఇం కొ క హ తయ జరిగింది .	0.5422
मैं इसे खा ली कर द ूँगा .	మొతత ం తా గే సతుననాను .	0.5130
कया तुमने मेरे शान दार दा मा द की छ ि पक ली खो दी ?	నువవు నా అ లలు డి బ లలి ని పో గొ టట ా వా ఏంటి ?	0.5831
सभी धयान द ें ! सभी गि ला स नीचे रख दी जिए .	అందరూ విన ండి ! మీ చే తు లలో ఉనన వి కింద పెటట ండి .	0.5705
नहीं , मुझे पता है , मुझे पता है . हम इसे सु ल झा ल ेंगे .	లేదు , నాకు తెలుసు . మనం ఏద ొక మా రగ ం ఆలోచి దదాం .	0.6091
यह कि ता ब के क वर का डि जा इन है .	పు సత కా నికి మొ క క వర ఇ దు గో .	0.6367
ऐसा नहीं है कि हमने नहीं किया , कयोंकि हम डे ट कर रहे हैं और एक साल से डे ट कर रहे हैं .	అంటే కలిసి పడు కో లే దని కాదు , ఎందుకంటే ఎంత ెనా మేము ఏ డా ది గా జ ంట గా ఉననా ము కదా .	0.6204
ए . विश वास करो , वे तुमसे न फ रत नहीं करते हैं .	హేయ . వాళ లకు నువ వ ంటే అస స లు ద వే ష ం లేదు .	0.6334
हाँ . मुझे लगा ही था कि तुम इसमें अचछे हो गे .	అవును . నీకు అది వచచే ఉంటుంది అని నాకు అనిపి ంచింది .	0.5339
तो एडगर भा ं प गया कि वह आदमी बस डी ं गे हाँ क रहा था .	ఎడ గర కి వాడు మాట లే కానీ చే షట లలో ఏమీ చేయ లే డు అని అరథ మెంది .	0.5868
एक अजीब मु स कान दे ते हो जो खु शन ुम ा नहीं बल कि ड रा व नी दिख ती है .	సంతోష ం లా కనిపి ంచ డానికి బ దు లు భ యం అని తెలి సే వి ంత ె న నవ వు నవ వు తుననావు .	0.6507
वह वै सा ही बर ता व कर रही है जैसा मैंने ब रे ट से शादी करने से पहले किया था .	నేను బ రె ట ని పె ళ లి చేసుకో వడానికి ముందు ఎలా పర వర తి ంచా నో ఆమె కూడా అలాగే పర వర తి సతోంది .	0.6134
द कि ंग ऑ फ बि ंग	కి ంగ ఆ ఫ బి ంగ	0.4382
रॉ कस ै ना	రో క సా న	0.3889
किसी ने मुझे एक ल लोगों वाले टे बल पर बि ठा दिया था .	ఎవరో ననను సి ం గి లస టే బు ల దగగర కూ రచ ో బె టట ా రు .	0.6233
इस थ के - हा रे मु सा फिर को एक जा म पे श करने दो .	ఈ అ ల సిన పర యా ణి కు డు ఒక మాట చెపప ాలని అనుకుంటుననా డు .	0.6262
वह कै सी बू है ?	ఆ వా స న ఏంటి ?	0.5393
और को रि या ई भी .	కొ రి యన కూడా .	0.4030
रॉ कस ै ना . हैलो .	రో క సా న . హలో .	0.4898
- अ नी क ? - ए .	- య నిక ? - హేయ .	0.6225
रिश ते .	బం ధ ాలు .	0.3365
कया हो रहा है ?	ఆ శ బ ద ం ఏంటి ?	0.4172
फिर , पहले डा ंस के बीच में . . .	ఆ తరవాత , వాళళ మొదటి డా నస మధయ లో . . .	0.6137
मुझे पकका पता नहीं है , पर ऐ ति हा सि क द ृ ष टि से , जब र ई स , श वे त लोग फु स फु सा ते हैं ,	నాకు తెలీదు , కానీ చ రి తర ను తి ర గే సతే , డబబు నన తె లల జా తి వారు అలా గు స గు స లా డు కుంటుననా రు అంటే ,	0.6917
पता नहीं . मुझे इतनी देर हो गई थी कि मेरे पास सोच ने का समय ही नहीं था .	ఏ మో . నేను బాగా ఆ లస యం అయ యా ను , అద ంతా ఆలోచి ంచే సమయం నాకు లేదు .	0.6482
एडगर को सब के सामने बोल ना सच में पसंद नहीं है . या पसंद नहीं था .	ఎడ గర కి అంద రి ముందు మాటలాడ డం న చచ దు , అంటే న చ చే ది కాదు .	0.6303
पर फिर भी , एक और बेहद दिल च सप माम ला ठ ं डा पड गया .	కానీ ఏ ది ఏమెనా , ఇం కొ క మంచి కేసు ఆ ధా ర ాలు లేక మూ ల న పడి ంది .	0.5951
हाँ , मुझे भी . मुझे भी चा लें चल ना पसंद है .	అవును , నాకు కూడా . నాకు కూడా అలా చేయడం చాలా ఇషటం .	0.5749
कृपया , बस करो . मैं तुमहें दिखा ऊँगा कौन मा लि क है .	దయచేసి ఆ పు . నేను నీ మీద ఆ ధి ప త యం చూ పు తాను .	0.6324
नहीं , ता ली मत ब जाओ . मुझे तुमहारी द या नहीं चाहिए .	వదదు , చ పప టలు కొ టట ొ దదు . మీ జ ాలి నాకు వదదు .	0.5882
तुम मेरी माँ का पर स भी पक ड सकते हो .	నువవు మా అమమ పర సు ను కూడా తీసుకు ని ఉ ంచుకో .	0.5457
- शा ंत हो जाओ . - नहीं . मैं नहीं . . .	- శా ంతి ంచు . - లేదు . నేను . . .	0.6118
तो , गरेस मुझसे बात नहीं कर रही है . बिलकुल नजर अं दा ज कर रही है .	చూడు , గరేస నాతో మాటలాడ డం లేదు . మొ హం తి పప ే సు కు ంటుంది .	0.6254
देखो किस ने फोन किया है .	ఇ ననా ళ లకు గుర తొ చచా ను అనన మాట .	0.4835
ठीक है . आ धि का रिक परि च य .	సరే . ఇక పరి చ య ాలు మొద లె డ దాం .	0.5937
फ ं कल , यह कू मि स होता कया है ?	ఫ న కు ల , ఖ ు మి స అంటే ఏంటి ?	0.6424
तो अब मैं कॉ टे ज में वापस जाकर आपकी बेटी के साथ सो ऊँगा .	నేను ఇక మా గ ది కి వెళలి మీ అమమాయి తో పడు కుంటా ను .	0.5921
हाँ , बस उसे ला त मार दो .	నిజ మే , దానిని క ాలి తో తన నే య .	0.4819
इससे वह शादी नहीं करने ला य क नहीं बन जाता , है न ?	వాళళు పెళళి కి ప నికి రా ని వారు కారు , సరేనా ?	0.5176
यह आज की रात का सबसे बढिया भा ष ण था .	ఇ వాళ రాతరి ఇ చచి న అదభు త మెన స పీ చ అదే .	0.5737
और मैंने दे दिया ,	ఇక పని పూరతి అయి ంది ,	0.4527
वह मुझे नहीं पता .	ఆ విషయం నాకు తెలీదు .	0.4439
मैं यह जानती हूँ .	అది నాకు తెలు సతుంది .	0.4272
मुझे तुम पसंद हो , अ नी क .	నాకు నువవు న చచా వు , య నిక .	0.6017
और मैंने काफी अचछा काम किया .	ఆ పని ని కూడా నేను చాలా బాగా చేశా .	0.4525
तुमहारी पार क की हुई कार ल ु ढ क कर ट करा गई ?	నువవు పార క చేసిన కారు తో ఇం కొ కదా ని ని గు ద దే శా వా ?	0.5331
और सबसे पहली सं दि ग ध दु ल ह न है , जो कि जो ई की बहन है .	అలాగే మొదటి అను మా ని తు ర ాలు పె ళ లి కూ తు రే , ఆమె జో యి వాళళ చె లలి .	0.6273
और उसे पता होगा कि कया किया जाना चाहिए .	ఏం చేయ ాలో అతనికి బాగా తెలు సతుంది .	0.4474
- वाह . - हाँ .	- వా వ . - భలే .	0.5756
यह हुई न बात .	అలా ఉండాలి .	0.3582
इसलिए अधि का रि यों को सू चि त करने से पहले , हमें कुछ जरू री	మేము అ ధి కారు లకు చెపప డానికి ముందు ముఖ య మెన కొనని వయా పార వయ వ హా ర ాలను	0.5759
अरे , हाँ . नहीं , मुझे पता है . मैं बस मजाक कर रहा था .	ఓహ , సరే . నాకు తెలుసు . నేను జో క చేశా ను అంతే .	0.6122
- मैं अंदर आ गई . - जब भी तुम तैयार हो , एडगर ,	- నా తల పెటట ే సా . - సిదధ ంగా ఉనన పపుడు పెటటు , ఎడ గర .	0.6529
- हाँ . तुमहें कैसे . . . - सी क वल !	- అవును . నీ కె లా . . . - రెండ వ భా గం కదా !	0.7002
मुझे लगता है तुम अपनी बहन से पयार करती हो . - हाँ .	- అంటే , నీ చె లలి అంటే నీకు ఇషటం అని నాకు తెలుసు . - అవును .	0.5877
- कया तुमने कभी ऐसा कुछ देखा है ? - कया , क फ लि ंक ?	- ఇలా ంటి ది ఇంత కు ము ంద ె పపుడ ెనా చూశా వా ? - ఏంటి , క ఫ లి ం కు లా ?	0.5908
जैसा कि आप देख सकते हैं , मेरे पति " न शे में ध ु त त " हैं ,	చూ సతుననారు కదా , అందరూ అనే టట టు , నా భ ర త కు కా సత ఎకకువ గా ఎ కక ే సింది ,	0.6229
मैं गरेस को स हा रे के रूप में इस ते माल कर ूँगा .	నేను గరేస ని బ రు వు ఆన చ డానికి వా డ తాను .	0.5940
- तुम यह कर स को गे , जान . - धनयवाद , जान .	- నువవు ఇది చేయ గల వు , బ ే బీ . - థాంక స , బ ే బీ .	0.6532
अब मैं एक ले खि का हूँ .	నేను ఇపపుడు ఒక రచ యి త రి ని .	0.5412
कयोंकि मुझे किसी ने नहीं बताया कि तुम दोनों शादी शु दा हो .	ఎందుకంటే మీకు పె ళ లి అయి ందని నాకు ఎవరూ చెపప లేదు .	0.5622
दे वि यों और स जज नों , च ौ ंक ने के लिए तैयार हो जा इए .	లే డీ స అ ండ జె ంటి ల మెన , ఆ శ చ రయ ంతో ఎ గి రి పో వడానికి సిదధ ం క ండి .	0.6283
अ नी क मेरा मतलब समझ रहा है .	నేను అనే ది య నిక కి అరథ మ వు తుంది .	0.5402
मैं बस रि झा ने की कोशिश कर रहा था . वह बस एक मजाक था .	నేను అంద రికీ న చచ ాలని అలా చేశా ను . అంటే , ఏదో ఒక చినన జో క లా గ .	0.5794
और ना श ते के लिए मु ख य घर में गए .	టి ఫి న తి న డానికి పెదద ఇంట లోకి వెళళ ా ము .	0.5672
- तुमहारी हि म मत कैसे हुई ? - मैंने नहीं . . .	- నీకు ఎంత ధ ె ర యం ? - నేను చేయ ాల ే . . .	0.6629
- हमें यह फिर कभी फिर से करना चाहिए . - हाँ .	- భలే , అయితే మళళీ ఇం కొ క సారి మనం వెళళ ాలి . - అవును .	0.5827
- हे भगवान , नहीं . - कया हुआ ? कया हो रहा है ?	- ఓ రి , దేవుడా , నేను నమమ ను . - ఏంటి ? ఏం జరుగు తోంది ?	0.6105
उसे लगता है कि अगर मैं र सम ों में भाग ल ूँ ,	నేను గ నుక పె ళ లి వే డు క లో పాల గొ ంటే , మీ అమమా నానన లకు	0.5859
