Hindi	Telugu	Similarity_Score
हाँ . उसका चे हरा बेहद अजीब है . और उसका ल ह जा .	నువవు ఎడ గర , ఇ పపటి కే చని పోయి న వయకతి , చని పోయి న టటు అంద రి నీ నమ మి సతుననా డు అంటా వా ?	0.5232
गरेस ने मुझे यह नहीं बताया .	వాడి అతని కరి ప టో కా యి న వి లు వ ను క ృ త రి మ ంగా పె ంచు కుననా డు అ ంట .	0.4549
है ना और गरेस तु र ंत दोसत बन गए .	కానీ అదే మో సం ఎడ గర చేయ కుండా ఆ ప గల అవకా శం నాకు ఉ ండి ఉండ ొ చచు .	0.5496
वैसे , तुमहें कया चाहिए ?	- అలాగే నేను . . . - సరే , వి పప డానికి నేను సహా యం చేసతా .	0.4433
जो जी भ पर रख ते ही पि घ ल जाती हैं .	నీ క జి న కి ఉనన స ననా సి తమ ము డు ప జి ల ని చే ధి ంచ లే కపోతే ఎలా మన సు ము కక ల వు తు ందో అలా .	0.5361
किसी दिन मैं वहाँ रहना चा हूँ गी .	- య నిక , ఈ బ లా క చె న అంటే ఏంట ో నీకు తెలుసా ? - అంటే , అవును .	0.4852
शायद इसलिए कयोंकि यह गलती एक ही बार हुई	అబబా , ఇలా ఊ హి ంచ ని పర దే శ ాల లో నీ జు టటు అ ంటు కునే వి ధా నం నాకు చాలా న చచి ంది .	0.4342
ते ई स द श म ल व दो परति श त .	మొదటి నుండి ఆమె అందు లో భా గం ఏ మో , లేదా ఎడ గర ఆమె నో రు మూ సే సి ఉండాలి .	0.4503
ती र ंदा जी में या पयार में ?	ఏంటి సంగ తి ?	0.3506
बस ? कया हुआ ?	కా వల సిన ంత ధ నం కూడ గ టటు కునన తరవాత కూడా ,	0.3625
अपने खुद के भाई की शादी ? तुम वह कयों रो क ना चाहती थी ?	అది స ంద ర భా ను సా రం అలా అయి ంది .	0.5259
तुम काफी वि चार शी ल हो ,	నేను పని చేయడం లేదు , బా బు . కావాల ంటే పో సుకో .	0.4339
- वह कया कह रहा है ? - वह गु स से में है .	గు డ ఈ వని ంగ , అ మి గో .	0.5438
वाह . बढिया सवाल है . मैं कई चीजें हूँ .	చెపపే ది బాగా వి ను ,	0.3803
हम यह करते नहीं रह सकते .	- నీకు ఆ జ ంట ఎలా తెలుసు ? - నేను పె ళ లి కొ డు కు చె లలి ని .	0.3748
सि वा ए इसके कि गरेस जो ई से लड रही थी .	" టె క స కా మ . "	0.4259
वह कयों ऐसे फोन व ग ै रह कर रहा है जैसे वह अब भी कं प नी के लिए काम करता हो ?	ఎడ గర నా ట కా నని నేను నమమ లేదు .	0.5135
जब है ना ने गरेस को म ंड प की ओर आ ते देखा ,	స హ చ రు లు ఏ మో .	0.5199
तुम उसके साथ भी से कस करती हो ?	సరే .	0.2221
अ नी क को पता है मैं किस बारे में बोल रही हूँ .	అంటే , ఆ సే ఫ .	0.4163
वह डर ग स ले ता है .	సప షట ంగా అది ఒక సే ఫ అనన టటు తెలు సతుంది కదా అది .	0.4766
यह गर न थी य त ू फा न है .	చూడ డానికి ఒక మంచి పర దేశం కావాలి . ఇకకడ ఒక నే రం జరగ బో తోంది .	0.4677
मैंने अप ै ची लोगों के बीच थोडा समय बि ता या है .	- దా క కో . - ఛ .	0.3876
हे भगवान !	ఎ కకడి కె ళ లి నా వె తి కి పటటు కుంటా !	0.3403
ए , मेरी फो टो ले लो .	నేను దాని గురించి చ ది వా ను అంతే , అందుకే ఎలా ప ల కాల ో తెలీ లేదు .	0.4403
मैं सभी को अपने फ ूल ों के बारे में बता ना चा हूँ गी .	ప ట గో ని యా , ఎ హ ?	0.4235
सोचा कि शायद तुमहें किसी सा थी की जरूरत है .	" మ రణ ం . "	0.2793
कोई छ ू ट नहीं ?	ఇం కొ క టే బు ల కి వెళ తా వా ? ఏమెనా కో డ చెప తుననా వా ?	0.3823
यह लडकी इस ब डे घर के बाहर एक त ं बू में रह ती है ?	ననను గె స చేయ నివ వు , గరేస అబ దధ ం చెప తుంది అంటా వు .	0.6247
प ौ धे की पह चा न हो गई डे वि ल स टर म पे ट वि ष ा कत	సర లే , ఈ ఫో ల డ ర ని మేము ఉ ంచు కుంటా ం , సరేనా ?	0.6722
देखो , हम यहाँ इसलिए हैं कयोंकि टर ै वि स ने कहा था कि तुम शादी रो क ना चाहती थी .	డి జి టల నే ర సతు లకు ఎలా ంటి నే ర ప ూ రి త కార య క లా పా నికి అయి నా వీ లు కల పి ంచే ఒక బ జా రు .	0.6143
द त तक सं ता न थी .	ట రా వి స గ లా డ రె స	0.5701
{ \ an8 } ती र ंदा जी	అదే అయ యు ండ ాలి .	0.4126
{ \ an8 } से बा सट ि यन भी अ क सर साथ दे ता था .	భా రీ మి నన ొ ఎడ గర మి నన ొ స తరు వా తి అడుగు	0.6136
{ \ an8 } वि ं टे ज टा इ परा इ टर	నాకు అ పపుడే దొ రికి ంది .	0.4704
एडगर ने मुझे बताया कि तुमहारी पार टी का थी म " फर ै को फा इ ल " है .	అంటే , కా యి నస ఇంట ె ర ర ప ట స వె నుక ఉనన వాడిని నేను ఎలా గు ఆ ప లేను ,	0.6478
ठीक है , मैं दोबारा कहना चा हूँ गी , मैं चि ल ला नहीं रही थी .	సరే , అంత బాగా జరగ లేదు . నేను జె లు కు వెళ తాను అనిపి సతోంది .	0.6014
वह आदमी तुमहारे लिए सू प भी नहीं ला सकता है .	ఇది వాడు చని పోయి నపపుడు తన జే బు లో దొ రికి ంది .	0.5745
इ बे रि यन है म ?	నా దొ క అ ంచ నా .	0.5787
फै ंग , मैं तुमसे बात कर सकता हूँ ?	నేను ప జి లస పరి ష కరి సతు ంటా . నువవు ?	0.5652
{ \ an8 } मुझे समझ नहीं आ रहा है . तुम स हम त हो या नहीं ?	ఇ కకడి నుండి వెళలి సర దా గా కొనని వి ంత ఆ కు ల పొ గ పీ ల చి ,	0.6280
अ ल वि दा .	ఎ మ . . .	0.4133
ठीक है .	ఏం సే ఫ ?	0.3827
है ना . . .	మో రస కో డ .	0.4392
उसका नाम वे रो निका है . वह एक न ॉ टि कल करे न ऑ परे टर है .	- దానిని అలా అన కు . - నా ఉదదేశం నువవు చేసా వని కాదు .	0.5738
रुको . से बा सट ि यन शुकर वार की रात को यहाँ से कस करने के इ रा दे से आया था ?	ఇ దంతా చేసి అన వ సరం . పోలీసు లు వచచి న తరవాత ముందు అ రె సట ు చేయ బో యే ది నన నే .	0.6688
बेशक , चि पे वा कहते हैं , " आँख ों से नि शा ना लगा ओ . "	- మళళీ నువ వా . - వాళళు జి టట ర బ గ డా నస వే సతుననారు .	0.6262
- तुमहारा भाई अ परा धी है . मेरे पास सब ूत है . - बढिया है .	ఓహ , లేదు . నె తతి మీద వె నుక నుండి కొ టట ా రు . సప ృ హ పోయింది .	0.6503
मुझे है ! मुझे आप त ति है !	ఎడ గర . ఎడ గర మి నన ొ స ఎకకడ ?	0.4672
मुझे तुमसे पयार है .	వాడిని అకకడ చూశా ను .	0.5131
और गरेस के नाम .	ననను కషమి ంచండి .	0.4208
मैं से बा सट ि यन से ट करा ई जो कि उ दा स और न शे में था .	నేను నా మొతత ం డబబు ను పో గొ టటు కునన చే త కా ని వెధ వని .	0.6534
धत तेरी की ! मुझे उसके पीछे जाना होगा .	వె రో ని కా తో నేను చాలా సంతోష ంగా ఉననాను .	0.5517
या नी चल ब सा है ,	- ఏంటి ? - ఎకకడ ?	0.4201
वहाँ स पा , कला और शि ल प और एक मा इ म कला कार था जो एक सट रि पर भी था .	కానీ నేను సహా యం చేయ డా ని కే పరయతని సతు ంటా ను అని నీకు తెలుసు కదా ?	0.5369
वे ल श धन ु ष .	- ఏంటి ? - అంటే , ఇంత కు ముందు నీ హ తయ కేసు లో . . .	0.4018
और इसलिए मुझे धयान लगा ने और मन को शा ंत करने की जरूरत थी .	నీ చే వ రాత చాలా ఛ ండ ాల ంగా ఉంది . ఇకకడ " బ లా క చె న " అని రా శా వా ?	0.5721
जो उस ी टा इ परा इ टर से टा इ प होगी जो उन सभी को करी ब ला या था .	మనం కూడా ఇపపుడు అదే కని పెటట బో తుననాం . హ ననా కు ఉనన ఉదదేశం .	0.5818
यह मेरी भ ती जी है , इसलिए कृपया उसके बारे में ऐसा मत क हो .	నేను స ొ ంత ంగా ఒక ఆన లెన పర ె వే ట డి టె క టి వ గా పని చేసతుననా .	0.6270
मैंने तुमसे कहा था , मैं तुमहारे भाई से शादी कर रही हूँ .	ఇకకడ చూడు , చా ర లె జ . ఈ పిచచి పె ళ లి ని జ రి పి ంచ బో యే ది నేనే .	0.5807
उसने गरेस के लिए एक चि ट ठ ी टा इ प करने का फै सला किया .	య నిక ఇంకా డా న రలు హ తయ చేసిన వారి ని ఎలా కని పెటటా రు ?	0.6278
मैं मान ती हूँ कि वह इतनी सो ची - समझ ी यो जना नहीं थी ,	నేను ఆ అవకా శా నని వ దు లు కో దల చు కో లేదు . ఇపపుడు కాదు .	0.6009
मुझे नी ंद नहीं आ रही थी . तुमहारी ला इट ज ली दिख ी .	ఏంటి ? సరే , అది హ ననా . ఆమె వ సతోంది . మనం ఏం చేయాలి ?	0.6022
जिस में वह अपनी भा वना एँ अचछी तरह से जा ह िर करे गी .	చి నని చి నని విషయ ాలు . చెపపి న క థ లో ఉనన ల ొ సు గు లు .	0.6206
रुको , तुम गरेस के साथ ए म सटर डम में थी ?	ఒక ర హ సయ కో డ ని పె టటి ంది అనుకుంటుననా వా ?	0.5885
" यू लि सी स , तुम नि शा ना च ूक ते हो कयोंकि तुम यहाँ से नि शा ना नहीं लगा ते हो . "	అది జరుగు తుంది అని ము ందే తెలి సి నా , దానిని చూడ డానికి దగగర గా వెళల ాల సిన నే రం .	0.6071
तुम इतने मजा किया हो . तुम म जे दार हो .	సరే . కనిపి ంచ ని జీ బ టన ని కని పెటట ాలి .	0.5404
मुझे लगता है कि तुमहें जरूर पता है .	వాటి లో ఏ వె నా బ రా ంతి కలి గే లా చేయ గల వా ?	0.5167
कया तुम बाहर चल कर बात करना चा होगी ?	నుండి దొ ం గి లి ంచ డానికి చూ సతుననాను .	0.4787
रुको . अब जब तुमहारा भाई नहीं रहा ,	ఇ పపటి కే నేను చాలా తపపు లు చేశా ను .	0.5252
या तुम मुझे सी धे गिर फ तार करो गी ?	నా కొ క గర ల ఫ రెండ ఉంది . పో లా ండ లో .	0.5715
और बडी बह नों का यही फर ज होता है .	నాకు ఇది ఎడ గర జే బు లో దొ రికి ంది .	0.5612
मुझे उसके साथ जाना चाहिए , है न ?	నేను వెళలి ఇం కొ కరి తో మాటలాడ తాను .	0.5084
{ \ an8 } एक लं गर दो ट ै क सी डर मी ड च ू हे	- నువవు ఒక దయ యా ని వి ! - ఒక చ ాలు .	0.6241
यह ब लि के न स डर फर सं खया सा त ही है .	- ఒక సారి తీసుకో వచచా ? - తీసుకో .	0.4900
उसका दिन काफी बुरा बी त रहा है .	ఇ పపు డి క సమయం మి ంచి పోయింది . కదా ?	0.5192
नो र ए पि ने फ री न स तर 1 2 परति श त से 2 6 परति श त पर चला जाता है .	మీ ధన వం తులు మ ాలా ంటి మా మూ లు వా రికి అన యా యం చేసి దానిని పె గా	0.5839
मैं शादी के निय म करवा ऊँ गी .	లేదా నువవు పడి పోయి ఉండ ొ చచు .	0.5649
. . . च म डे की चीजें , जैसे कि बे लट , टो बल रो न , वा य लि न .	నేను గరేస ని కా పా డ తాను , అలాగే ఈ పె ళ లి ని ఆ పు తాను కూడా .	0.6690
अनु ष ठा ता के रूप में , मेरे पास इस आप त ति का कारण सुन ने के अ ला वा कोई चा रा नहीं है .	అంతా నా శ నం అయి పోయింది . ఎడ గర పోయా డు . అలాగే ఇంకా దారు ణం , గరేస ని కా పా డ లేక పోయా .	0.6623
मुझे पता है कि मैं बदल ने में सक ष म नहीं हूँ , पर गरेस , जब मैं तुमहें देख ता हूँ ,	నీ ఆ చూ కీ మొ త తా ని కే మా యం అయి నా , లేక నువవు జ ాలి పడి తి ండి పె టటి , డ రి ం కు పో సిన	0.6505
मैं बस उनके जी वन का ल की कल प ना में खो जाती हूँ .	- అది మంచి విషయం కాదు . - ఎందుకు మంచి విషయం కాదు ?	0.5435
तुमने मेरी बहन को च ू मा ?	ఆమె క ళళ లో భ యానని చూశా ను .	0.5544
धत तेरी की .	ఛ .	0.2029
कया तुमहारे मन में है ना के लिए सच में कुछ है ?	నా కోసం బ లి కా వడానికి ఒక రు కావాలి . కి రా యి వయకతి .	0.5554
दे वि यों और स जज नों , क सम ों का बक सा . माफ ी चा हूँ गा .	అంటే , క నీ సం ఈ పరప ంచా నికి అలా చూ పెటట బో తుననావు .	0.6266
{ \ an8 } जैसे - जैसे वे ब डे हुए , एडगर अपने वय व सा य में जयादा वय सत हो गया .	తవర లో గరేస ని చేసుకో బో యే వాడు తన స ొ ంత కరి ప టో క రె నస ీ ని లా ంచ చేశా డు .	0.6861
उसे कोई तो परे शा नी है .	అవును , నాకు తెలుసు లే .	0.5094
मैं ऐसा नहीं कर सकती .	నాతో చేయి కలు పు తా వా ?	0.4452
" आँख ों से नि शा ना मत लगा ओ , दिल से लगा ओ . "	ఇదే అది . వాడు తపప ి ంచుకో వడానికి వే సిన ప లా న .	0.5977
मुझसे ह िर ण के पु त ले के नीचे मि लो - है ना	నీ న కి లీ సోద రు డు ఒక పెదద కు టర చేసతుననా డు .	0.6147
तुम विश वास नहीं करो गी कि है ना तुमहारे बारे में कया कह रही है .	నాకు రెండు చె ం ప లు . . . నేను కరి ప టో గురించి మాటలాడు తుననాను .	0.6010
मेरी कहानी अपनी उ मर से जयादा इस छो टी लडकी से शुरू होती है .	- నాకు ఇ వాళ ఉ తత ర ాలు ఏమెనా వచచా యా ? - కు రచ ీ లో చూడు , బా బు .	0.6263
हाँ . बेशक करती हूँ .	విన డానికి బాగుంది .	0.4214
- कोई यहाँ तुम पर आ रो प लगा ने नहीं आया है . - मैं आई हूँ .	చూ సతే నే నువవు చ ీ పు రు ని ము ంద ె పపుడ ూ ప టట లే దని చెపప ొ చచు .	0.6386
" . . . ला सकता ! "	య నిక ఇంకా డా న ర లతో .	0.3920
इसके साथ सौ दा करना बेहद क ठ ि न है .	అలా ంట పపుడే ఒక ఆ ధా రం ననను కను గొ ంది .	0.6042
बस तुमहें बता द ूँ	ఇ దంతా అసలు ఏంటి ?	0.4522
- अभी . - अ ल वि दा .	జో యి . శ బ ద ం చేయ కు .	0.5803
और शायद उसने उममीद की हो कि यह पल भर का आकर ष ण न हो .	ఇ కకడి నుండి జే బు లో బో లె డ ంత డబబు తో వెళల ాలని ఉందా ?	0.5682
मैं यहाँ यह शादी रो क ने आया हूँ .	అవును . హ ననా కి చాలా హా బీ లు ఉననాయి .	0.5392
अरे . सा व धा न . कोई बेहद न शे में है .	ఎడ గర , చని పోయా డు . తను చని పోయా డు .	0.6080
मैं तुमहारे साथ एक वय व सा य पर चर चा करना चा हूँ गा .	వాడు ఇ ట ాలి యన కా వడం ఈ కేసు కు ఎలా పని కొ సతుంది ?	0.6064
है ना और गरेस दोनों जानती थीं कि वे एडगर के साथ गलत कर रही थीं .	అలాగే ఒక సారి ఆ సే ఫ ని తె ర వడానికి పరయతని ంచ ాలని కూడా తెలుసు .	0.5805
और ब रे ट ने तुमहें ध ो खा दिया था और मुझे पता है कि तुमहें कितनी चो ट पहुँ ची थी .	నేను ఎలా ంటి ర కష ణ లే కుండా నే రు గా ఎడ గర కో పా నికి బ లి కా గల పరమా ద ంలో ఉంటా ను .	0.6515
च ूँ कि मैं लग भ ग अके ले ही यह के स सु ल झा रही हूँ ,	నాకు మా తరం మనం ఇం కొ క క ఫ లి ంక ని కని పె డి తే ,	0.6589
{ \ an8 } दो स वे टर	- ద యయ మా . - ఆ పు .	0.5309
अगर यह सच में हुआ था , तो गरेस ने मुझे कयों नहीं बताया ?	నువవు ఆ ఉ తత రా నని నాకు ఎందుకు పం పి ంచా వో నాకు ఒక అ ంచ నా ఉంది .	0.5808
{ \ an8 } बु सान में मौ सम कैसा है ?	సరే , అంటే , నీ ము కకు ను చూ సతే	0.5446
बेशक . मैं उसे फोन दे ता हूँ .	స బ టె టి లస అ నువ ది ంచింది : జో సె ఫ	0.5509
ठीक है . हम यह तुमहारे अनु सा र ही करेंगे .	- య నిక , వ సతుననా వా ? - సరే . ఇక నేను వెళళ ాలి .	0.6136
यह उस ी उ दार ता का तो ह फा है .	నేను మొదటి షి ఫ ట తీసు కుంటా ను .	0.5436
नहीं . मैं इस बार ग ं भी र हूँ .	ఆ ధా రం అంతా అందు లోనే ఉంది .	0.5197
रुको ! तुम कहाँ जा रहे हो ?	ఆమె ఎంత స పె ష లో నీకు తెలుసు .	0.5354
पर याद रहे , हम चाहते हैं कि है ना हम से बात करने के लिए तैयार हो जाए .	- నువవు వీ టి ని తీ సే సతే మంచిది . అవును . - అవును , వీ టి ని తీ సతా వా ?	0.6000
एडगर की म ृ त छ ि पक ली तुमहारे पास कयों है ?	పో నీ ఎ కస పర ె స ద వా రా డె లి వర చేయ బడి ంది .	0.6261
धनयवाद , फै ंग .	పె ల ట లె సె నస .	0.4252
वाह , तुम बेहद स मार ट हो .	- చని పో తారు . - చని పో తారు .	0.4363
मैं यह पी सकती हूँ ? मैं जरूर पी य ूँगी .	లేదా ఆమె కు వి వాద ం ఉనన ది ఎడ గర తో నా ?	0.5811
- तुमहें लगता है कि मैंने उसकी हतया की . - बिलकुल .	సరే , మిసటర గ లా డ రె స , నువవు ఈ వా రా ంత ం అంతా . . .	0.5961
