Hindi	Telugu	Similarity_Score
तुमहारी जगह मैं होती तो छु पा ने ला य क कुछ रख ती ही नहीं .	ఒక వే ళ నేను నువ వ యి తే , ఖచచితంగా దా చే ందుకు ఏ దీ ఉ ంచ ను .	0.6304
मैंने सुना पार टी में सब घ बरा ए थे .	పార టీ లో అందరూ భయ పడి పోయా రని వి ననాను .	0.5657
हम उ तने बेवकूफ नहीं जि तना सोच ते हो .	మేము మీ ర ను కునన ంత పిచచి వాళళ ం కాదు .	0.5894
अपने भाई से मिलने चला आया . कल र क है .	ఇకకడ కల రక , మా క జి నను ప ల కరి ంచ ాలని .	0.6152
र च ना त म क पर य वे कष क र वी न दर श ं कर शु कल	కరి యే టి వ సూ పర వె జర : రా జే శ వర రా వు వల వల	0.6404
तुमहें ठीक देख कर अचछा लग रहा है .	నువవు నీ కా ళళ పె ని ల బడ గల గ డం సంతోష ం .	0.5760
तुम जानते हो और भी र ंग होते हैं .	నీకు వే రే రం గు లు ఉంటా య ని తెలుసు గా .	0.5501
जब उसके ठीक ब गल में हो , तब नहीं .	బహుశా నువవు అతని ప కక న ఉంటే కా దే మో .	0.5795
ह ंट के नी खेल रहा था ? वह वहाँ था ?	హ ంట కె ననీ ఆ డా డా ? అతను అకకడ ఉననా డా ?	0.5508
- बच चों ने क सम खा ई कि खेल नहीं खेल रहे थे . - पता है .	- ఆ పిలల లు ఆడ ట లే దని పరమా ణం చేశారు . - నాకు తెలుసు .	0.6664
तुम वा कई यह पह न कर डर बी पर जाओ गी ?	రే సు కు నిజంగా అది వే సు కుంటా వా ?	0.4514
ए , बि श प आया है .	హే , బి ష ప వచచా డు .	0.5914
शायद , पर आ ग लगी , खेल चा लू है , बचचे हैं , और ह ड डि यों से भ री थ ै ली , इसलिए . . .	అయి ండ వచచు , కానీ మ ంట లు , ఒక ఆట , కొ ంద రు పిలల లు , ఒక ఎ ము కల స ంచి ఉననాయి , అందు కని . . .	0.7501
गु ससा हुई थी , जब मैंने एड म की स वे ट श रट पह नी थी ?	నేను ఆ డం చ ొక కా వే సు కుననా నని ఏ పరి ల అ రి చి ంది ?	0.6661
उन लोगों को देखना चाहती हूँ जिन हें पूरी जिंदगी नहीं देखा .	నా చెతత జీవి తా నని ని త యం చూ సిన వారు కా ని వారి ని కలు సుకో వాల ను ంది .	0.5219
कया ? मुझे . . .	ఏంటి ? నాకు . . .	0.6746
- उसे लगा कि मेरा उससे कुछ सं बं ध था ? - हाँ .	- ఆమె నేను అతని తో జ త క టట ా నని అను కు ందా ? - అవును .	0.6340
सा त सं खया वाले नंबर को धयान से देखो , ठीक है ?	ఏ డు అ ం కె ల సం ఖ య ను దయచేసి గ మని ంచండి , సరేనా ?	0.6493
यह माम ला काफी ग ं भी र है , हेदर .	ఇది గం భ ీ ర మెన వయ వ హా రం , హే థర .	0.6464
- हैलो , बो , कया हा ल है ? - हैलो .	- హే , బో , ఏంటి సంగ తులు ? - హే .	0.5984
और तुमहारे लिए कुछ ला ई हूँ .	ఇంకా నీ కోసం ఒకటి తీసు కొ చచా ను .	0.5001
वही आ खि री दिन था जब मैंने उनहें जि ंदा देखा .	అదే నేను ఆ య నను స జీ వ ంగా చూ సిన చి వరి రోజు .	0.6174
मैं तुमसे उस बारे में बात करना चाहता था .	నేను దాని గురించి మాటలాడ ాలని అనుకుంటుననా ను .	0.5061
लोगों को यह तो नहीं पता चला कि मुझे पह ला मौ का नहीं मिल ता .	నేను కొతత వి కొ నుక కో లే నని అంద రికీ తెలి సే క ననా అది న యం .	0.5602
उसका पता लगा या . ट रि नि टी फ ॉल स में ना च ती है .	ఆమె ట రి ని టీ ఫ ాల స లో సట రి పప రని తెలి సింది .	0.5321
कैसे वह म श ह ूर हो सकती थीं .	ఆమె ఎంత పర ఖ యా తి చె ందే ది అని .	0.5438
सोच ना कि वह एक अचछी माँ थीं .	ఆమె మంచి అమమ అని అనుకో వడం .	0.4924
अचछा , तो . . .	సరే , అంటే . . .	0.6110
पता न था कि तुम डर बी में काम कर रही हो .	నువవు రే సు లో పని చేసతుననా వని నాకు తెలియదు .	0.5100
मैं हेदर को टि कट दे द ूँगी .	నేను హే థర కు తన టి కె ట ఇ సతాను .	0.5811
निका स 1 2 - आई - 4 5 - रात 1 ब जे	ని ష కర మ ణ 1 2 - ఐ - 4 5 - ఉద యం 1	0.7963
- तुम आ गई . - हैलो . यहाँ आओ .	- నువవు వచచా వు . - హాయ . ఇలా రా .	0.6287
उसका और इंतजार नहीं कर सकते .	ఇక తన గురించి వే చి చూడ లే ం .	0.4934
लगता है वि लि य मस के साथ बात खतम हो रही है .	అతను వి లి య మస తో నిర ధా రణ కు వ సతునన టటు ంది .	0.6330
लि ट ल बिल ने ऐ बी कला र क का जि कर किया था .	లి టి ల బి ల , అతను ఆ బీ గురించి పర సతా వి ంచా డు .	0.5636
मुझे लगता है कोई पै निक पर श रत लगा रहा है .	పా నిక మీద ఎవరో ప ంద ెం కా సతుననా ర ను కుంటా ?	0.6023
इस बारे में माँ तुमसे सु बह बात करे गी .	అమమ నీ తో దీని గురించి ఉద యం మాటలాడు తుంది .	0.5652
हाँ . तो , ए का उ ं टि ंग कयों ?	సరే . మరి , అ క ౌ ంటి ంగ ఎందుకు ?	0.5703
- पया रे बन रहे हो ? - बस सच कह रहा हूँ .	- తెలి వి గా మాటలాడు తుననా వా ? - లేదు వా సత వం .	0.5542
वि जे ता , च ौ द ह नंबर , रे ह ॉल !	వి జే త , నం బ రు 1 4 , రే హ ాల !	0.6951
जज ों को खेल ने की इ जा ज त है ?	నయాయ నిరణ ే త లను ఆ డని సతా రా ?	0.5954
यह क ॉर न हो ल में मा ह िर है .	తను కార న హో ల బాగా ఆ డు తుంది .	0.5972
- बंद कर दो . . . - इसे छोड ो . वापस रख ो .	- అది మూ సే య . . . - వదిలే య . తిరిగి పెటట ే య .	0.6458
एक दिन मैं डी ए से मिला .	ఆ రోజు నేను డీ ఏ ను కలి సా ను .	0.5324
म ं च पर सवागत है , रा कै ल !	వే ది క మీద కు సవా గ తం , ర ఖ ే ల !	0.6516
आपको पता है लि ली कहाँ है ?	లి ల లీ ఎకకడ ఉ ందో తెలుసా ?	0.4875
पर खेल अलग सा लग रहा है , नहीं कया ?	ఆట భి నన ంగా అనిపి ంచి నా , అది అలా ఉండ దు ?	0.5357
डर ने की कोई वजह नहीं . मैं जी त ूँगा .	భయ పడ ాల సిన అవసరం లేదు . నేను గె లు సతాను .	0.5898
हाँ , वह पर ं परा है . हर साल बचचे व हीं करते हैं .	అది సం పర దా యం . పిలల లు అకకడ పరతి ఏ డా ది చేసు కుంటా రు .	0.6095
तो , यह कहना कि हम पार टी में थे , ठीक ?	మనం పార టీ లో ఉననా మని చెపపు , సరేనా ?	0.5613
हर कोई नहीं .	అందరూ కాదు .	0.3834
देखो , आपकी पह चा न पै स ों से नहीं होती .	చూడు , నువవు ఏంట ో డబబు తెలియ చేయ దు .	0.5813
- शुकरिया . - कोई बात नहीं .	- ధనయవాదాలు . - పర వాలేదు .	0.5283
मुझे स पर लॉ क के यहाँ जो सू ची मिली थी , याद है ?	నాకు స పర లా క వాళళ ఇంటి లో దొ రికి న జా బి తా గురతు ందా ?	0.6278
ताकि त ला शी का वार ंट मिले और वे ठीक से ढूँढ पा एँ .	చూ ప ను ననా రు , సర చ వా రె ంట తె చచి , మొతత ం చూ సతారు .	0.6332
कया बात करना चाहती हो ?	నువవు నాతో ఏం మాటలాడ ాలి ?	0.4298
मेरी बहन है . लि ली के बारे में है .	మా చె లలి ఫోన చేసి ంది . లి ల లీ గురించి .	0.5576
किसी को जानता हूँ जो ठीक कर सकता है .	చ వ క గా , అది బాగు చేయ గల వాడు తెలుసు .	0.5385
कोई फिर से खाना बना ने के वी डियो देख रहा था .	ఎవరో మళళీ ఎలా చేయ ాల నే వీ డి యో లు చూ సిన టటు ఉననారు .	0.5569
माफ करना . तुमहें अपना माल चाहिए ?	కషమించు . నీకు నీ చెతత స రు కు కా వ ాలా ?	0.5076
बहुत चिंता हो रही थी .	నేను చాలా కంగా రు పడ డా ను .	0.4723
तुमहें लगता है घर से आ ख िर में निकल ने के लिए जज फा लत ू अं क देंगे ?	ఇంటి ని చి వర గా వది లి వచచి న ందుకు నాకు నయాయ నిరణ ే తలు అద న పు పా యి ంట లి సతా రా ?	0.6275
वह बहुत अचछा बच चा था .	అతను చాలా మంచి పి లలా డు .	0.4440
उसकी जगह किस ने ली थी ?	అత నని ఎవరు భ ర తీ చేశారు ?	0.5249
इसलिए वह मेरे पास थी .	అది అలా నాకు దొ రికి ంది .	0.4459
वा सत वि क ता को लेकर सभी की अपनी अलग सोच है ,	వా సత వా నని నిర వ చి ంచే ందుకు ఎవరి ఆలోచ నలు వారి వి ,	0.5291
मै दा न से निकल ने पर उनका चे हरा देखा , कभी नहीं भूल पा ऊँगा .	నేను అది గె లి చా క , ఆయన ముఖ ం నేను ఎ పపటి కీ మర చి పో లేను .	0.6508
हेदर , उ ठ ो !	హే థర , లె గు !	0.5017
याद है आ ठ वी ं कला स में , ए परि ल कैसे	నీకు గురతు ందా ఎ నిమి దో తర గ తి లో ,	0.6155
- जयादा मो टी हो गई ? - माँ , मैं मजाक कर रही थी .	- లా వు గా అయి పోయా నా ? - అమమా , సర దా కి అననా ను .	0.5834
भाई के लिए माफ करना .	తమ ము డి తర ఫ ు న కష మా ప ణ లు .	0.4679
वे खेल को पास से देख पा ते हैं ,	అది వాళళ ను ఆట కు దగగర గా ఉ ంచు తుంది ,	0.5187
- छोड कर जा रही हो ? - शु भ काम ना एँ .	- వది లి వెళ ు తుననా వా ? - శు భా శ ీ స సు లు .	0.6425
को र टे ज बो ला जिस रात आ ग लगी , वह तुमहारे कम रे में गया था .	మ ంట లు రే గి న రోజు , కోర టె జ నీ గ ది అంతా వె తి కా న ననా డు .	0.6752
- ए . - हेदर !	- హే . - హే థర !	0.5807
हैलो , जान ,	హే , బంగా రం ,	0.5067
बद न की आ ग बु झा ने के लिए तुमने सबसे घट िया आदमी को चु ना .	సె కస వా ం ఛ కోసం నీ ది పరపంచ ంలో కె లలా దారు ణ మెన ఎ ం పి క .	0.6756
मुझे देर हो जाए गी . बाद में मिल ूँगा , ठीक है ?	ఆ లస యం అవు తుంది . తరువాత కలు సతాను , సరేనా ?	0.5667
मतलब , ल ॉन ग ह ॉर न सट े ट की एक है ,	అంటే , లా ంగ హా ర న సట ే ట లో ఒకటి ఉంది ,	0.6353
स ड कों पर कई तरह के लोग होंगे .	రో డ ల పె న ఉండ కూడ ని మను ష ు లు ఉంటా రు .	0.5416
असल में वै सा नहीं होना था , है न ?	అది నిజ మెన ది కా కూడదు , తెలుసా ?	0.5681
सच में , शे री , तुमहें हुआ कया है ?	నిజంగా నా , ష ె రీ , నీకు ఏమ యి ంది ?	0.6266
उस में मुशकिल यह है कि	అందు లో సమసయ ఏంట ంటే ,	0.5042
- शुकरिया . - शुकरिया .	- క ృ త జ ఞ తలు . - క ృ త జ ఞ తలు .	0.3666
- मैं वह नहीं चाहती थी . - कया नहीं चाहती थी ?	- అలా చేయ ాలను కో లేదు . - ఏం చేయ ాలను కో లేదు .	0.5339
- उन में से गोली नहीं चल ती . - तुमसे यह किस ने कहा ?	- అందు లో గ ాలి తపప ఏమీ పే ల దు . - అది నీకు ఎవరు చెపపా రు ?	0.6511
उनके माँ - बा प स खत हैं , इसलिए बात को छु पा कर रख ते हैं .	అది ర హ సయ ంగా ఉ ంచారు , ఆమె తల లి ద ండ రు లు క ఠ ి నం అని .	0.6860
उसने वह गु ड वि ल को दे दी थी .	అతను అది గు డ వి లకు దా నం చేశా డు .	0.6135
परति यो गि ता के लिए उसने भ वि ष य वा ण ी की है .	అది ఛ ా ం పి యన షి ప సి రీ స పె అతని అ ంచ నాలు .	0.6253
कया मतलब ?	అంటే ఏంటి ?	0.2860
कया मतलब ?	అంటే ఏంటి ?	0.2860
या नि उसे डर होगा कि शायद तुम जी तो गे .	దా న రథ ం అతనికి నువవు గె లు సతా వే మో అని భ యం .	0.5790
मैं ड रि ंक पर सभी से मिलने कै रि ग न जा रही हूँ .	నేను కా రి గ న లో డ రి ంక కి వెళళి అంద రి నీ కల వ బో తుననాను .	0.6055
डॉ ट से पता चला कि तुम कुछ दि नों से नहीं गए ,	డా ట నువవు గ త కొనని రోజు లు గా రా వడం లే దని చెపపా డు ,	0.6046
यह सा बि त करने के लिए कि तुम गरे बिल नि वास में थे ,	నినను ధా నయా గా రం ఇంకా గరే బి ల ఇంటి దగ గ రు నన టటు	0.6244
मैं बा कि यों के कुछ देर बाद बाहर निक ली .	నేను అంద రి కంటే కా సత తరువాత వచచా ను .	0.5720
तुम कया सोच रहे हो ?	ఏం ఆలోచి సతుననా వు ?	0.5406
- यह ठीक नहीं हुआ . - बैठ जाएँ गी ? मुझे च क कर आ रहा है .	- ఇది పిచచి ఆలోచ న . - కొంచెం కూ రచు ంటా వా ? క ళళు తి రుగు తుననా య .	0.6563
आज रात के लिए आ खि री चार मा य ने रख ते हैं , पर वे अं कों के अ ला वा हैं ?	ఈ రాతరి వాళళ కు పా యి ంట లే కా కుండా ' ' చి వరి నలు గు రు ముఖ య మా ? ' '	0.6750
चलो . पलीज बताओ न . ना राज नहीं हूँ .	చెపపు . దయచేసి , చెపపు . నాకు కో పం లేదు .	0.5148
- उसे श रत लगा ने में मजा आता है . - कया मतलब ?	- అతని అ ంచ నాలు వి సత రి ం ప చేసతుననా డు . - అంటే ఏంటి ?	0.6023
कया मतलब , हम जी ते तो ? पता नहीं . कुछ सोचा नहीं है .	మనం గె లి సతే అ నా ? ఏ మో తెలియదు . నిజ ానికి అది ఆలోచి ంచ లేదు .	0.5711
का श . . .	నేను . . .	0.6750
उनहोंने पी रख ी थी .	ఆయన తా గి ఉననారు .	0.4827
- मैं लू क हूँ . - मैं तुमहें जानता हूँ .	- నేను లూ కను . - నువవు ఎవరో తెలుసు .	0.4987
जरूरत प डी तो दी वार ें भी तो ड डाल ेंगे .	వాళళు గో డ లు తె రు సతారు , అవ సర మె తే .	0.5939
मतलब , उनहें सवी कार ने से ?	ఎలా అంటే , అది ఒ పపు కో డానికి ?	0.5420
निकल जाओ !	వెళళి పో !	0.3264
- लि ली , पलीज यहाँ आओ गी ? - अचछा , आ रही हूँ .	- లి ల లీ , దయచేసి . ఇకకడ కు వ సతా వా ? - సరే , వ సతుననా .	0.6320
मुझे डर लग रहा है .	నాకు భయ ంగా ఉంది .	0.4888
हमें पता है इस साल एक और खेल खे ला जा रहा है .	ఈ ఏ డా ది మ రో ఆట ఆ డు తుననా రని మాకు తెలుసు .	0.6292
मैं चाहती थी कि वह मुझ पर भरो सा करे , पर . . .	అతను ననను నమమ ాలని అను కుననాను , కానీ . . .	0.5807
तुम लोग वहाँ पै निक खेल ने गए थे ?	మీ రం తా అకకడ పా నిక ఆడ డానికి వెళళ ా రా ?	0.5591
तो अधि क न शा को लेकर झूठ कह रहे हैं ?	అ తి మో తా దు పె అబ దధ ం చెపపా ర ంటా రా ?	0.5954
कयों ? वह हफ त ों तुमसे ना राज रही .	ఎందుకు ? ఆమె వార ాలు ఇ బబంది పె టటి ంది .	0.5518
अं ति म कर िया के बाद उनके साथ शे रि फ के द फ तर गया .	అంత య కరి య ల తరువాత అతని తో కలిసి ష ె రీ ఫ ఆ ఫీ సు కు వెళళ ా ను .	0.6444
तब यह कहानी नहीं रह जाए गी .	అది ఇక క థ గా మి గి లి పో దు .	0.4834
जब भी तुमहें मौ का मिल ता है , अपनी नो ट बु क में	నీకు వి రా మ ం దొ రిక న పపుడ లలా నువవు ఎపపుడూ	0.5947
- न सी ब वाला हरा र ंग . - बन डा ना नहीं हैं , नहीं .	- అద ృష టా నని తె చ చే ఆ కు ప చచ . - రు మ ాలు వదదు .	0.6750
यह लो . शुकरिया .	ఇది గో . ధనయవాదాలు .	0.4781
माँ , यह कया है ?	హే , అమమా , ఇదే ంటి ?	0.5108
मेरा जो श आ स मान छ ू रहा है ! धत तेरी !	నాకు చాలా ఉ త సా హ ంగా ఉంది ! అబబా !	0.6005
- शुकरिया . - हाँ .	- ధనయవాదాలు . - సరే .	0.5513
दो सौ प च ह त तर ? तुमहें 1 00 अं क मिले ?	2 7 5 ? నీకు 1 00 పా యి ంట లు వచచా యా ?	0.6525
सब ूत जल कर रा ख हो चुका है .	సా కష యం బ ూ డి ద యి పోయింది .	0.5754
पिछ ले साल वह एक जज था .	గ త ఏ డా ది అతను నయాయ నిరణ ే త .	0.5268
मेरे पिता उनकी इ मा रत के मा लि क हैं . मुझे कि रा या ले ने भेज ते .	వాళళ అ పార ట మె ంట మా నానన ది . ఆయన ననను అ దద ె కు పం పే వారు .	0.6384
आप या तो छो टे इंसान हैं , या नहीं .	నువవు చెతత దాని వా కా దా అనన ది .	0.5383
सभी रे सर अपने इं जन चा लू करें .	రే సర లు , మీ ఇం జి నలు సటా ర ట చెయయ ండి .	0.5965
मैंने पह े ली ह ल की थी , याद है ?	పొ డు పు క థ పరి ష కరి ంచా ను , గురతు ందా ?	0.5953
बा रह नंबर वाली पी ली गाडी में डॉज मे सन है .	ప సు పు ప చచ కారు నం బ రు 1 2 లో , డా డజ మే స న .	0.6316
गरे बिल चु नौ ती के बाद जो अं क थे , पहली तीन सं खया एँ वही हैं .	మొదటి మూ డు నం బర లు గరే బి ల దగగర మనకు వచచి న పా యి ంట లు .	0.6578
तुमहारी कि सम त जो र दार थी .	చాలా అద ృష ట వం తు ర ాలి వి .	0.5673
कया हम ग री ब हैं ?	మనం పే ద వాళళ మా ?	0.5516
मैं ग री ब हूँ , पता है ?	నేను పే ద దానని , గురతు ందా ?	0.5312
कितना ड रा वना है .	చాలా పిచచి త నం .	0.4245
