Hindi	Telugu	Similarity_Score
म ॅ क सि मस .	మా క సి మస .	0.5095
सच जान ो कि बार ब कहाँ काम करती है .	మీ ఆ వి డ చేసే పని పె నిజం తెలుసు కో .	0.5324
मि सटर हा वर ड ?	మిసటర హా వర డ ?	0.5020
सै ंड रा ?	శా ండ రా ?	0.4551
बात यह है , डै डी जी , मुझे तो लगता है कि	సరే , చూడు , పె ద దా య నా , నేనే ం చెపప గల న ంటే ,	0.6300
तुमहारी छो टी बहन को भी .	నీ చి టటి చె ల లె లి తో సహా .	0.3768
मैं यहाँ से जाने वाला हूँ या फिर तुम मुझसे बद ला लो गे	నేను ఇ వాళ నిజంగా వెళలి పో తా నా , లేదా నేను నీ సోద రు డి కి	0.5801
टॉ मी !	టా మీ !	0.3419
इतनी ही बकवास स ह न होगी .	ఇంత కంటే సో ది భ రి ంచ లేను .	0.4710
मि . ह ॉ वर ड ?	మి . హా వర డ ?	0.5323
कुछ ख री द ने के लिए वॉल ट - टे क ने कि तने पैसे दि ए आपको ?	వాటి ని మీరు వదిలే య డానికి వాల ట టె క ఎంత చె లలి ంచింది ?	0.6187
वे सभी कं प निया ँ ख री द ली ं जहाँ मैंने कभी काम किया था .	అడుగు పె టటి , నేను పని చేసిన పరతి కం పె నీ ని కొ నే సింది .	0.5911
एक करो ड पति कम यु नि सट ?	క మ యూ ని సట కో టీ శ వ రు లా ?	0.5936
मैंने देखा तुमने उनहें पक ड र खा है .	ఆ పే ద మ హి ళ లను మీ రే ం చేశా రో చూశా ను .	0.5856
कि वै ज ञ ा नि कों को खु ली छ ू ट देने पर कया होता है .	ఏం జరుగు తు ందని మనం ఓ కే స సట డీ గా ఉ ప యో గి ంచ కూడదు .	0.6818
माफ करना , मैंने इसे बहुत समय से नहीं देखा है .	మన ని ంచు , నేను చాలా కాల ంగా ఆ ఫ ు టే జీ ని చూడ లేదు .	0.5719
पर यो ग शा ला में मैंने . . . आपके डॉ क टर ों को . . .	పర యో గ శ ాల లో , నేను . . . మీ డా క టర లను చూశా ను . . .	0.7520
नहीं .	లేదు .	0.3291
ला ल रॉ के ट	రె డ రా కె ట	0.4850
ठीक है . हाँ .	సరే . అంతే లే .	0.5315
बर दर हु ड से सं पर क करके यह सिर उनहें देना है .	సో దర జా తి ని సం పర ది ంచి , ఈ త లను తిరిగి ఇవ వాలి .	0.6181
{ \ an8 } इ जे कट	{ \ an8 } ఎ జె క ట	0.7737
हाँ , पर इससे लोगों की मदद कर सकता हूँ .	అవును , కానీ ఈ క వచ ంతో పర జ లకు సా య పడ గలను .	0.5976
सी पि यों की याद आ रही है ?	ఆ ఆ య సటర ల గురించి ఆలోచ నా ?	0.4987
टा इट स , तुम अचछे इंसान हो .	నువవు మంచి మనిషి వి , టె ట స .	0.5819
शे डी सै ंड स ? वह जगह तो ख तर ना क वि कि रण वाली है .	ష ే డీ శా ండ స ? అకకడ చాలా రే డి యో ధా ర మి క త ఉంటుంది .	0.6327
- भा ड में जा ! - निकल !	- పో రా ! - అవ త లి కి పో !	0.5782
मैं ऐसा कभी नहीं कर ूँगी . कभी नहीं .	నేను అలా ంటి పని చేయ ను . నేను చేయ ను .	0.4921
लोगों को बुरा लगे गा जब उनहें पता चले गा .	జ నా లకు ఈ విషయం తెలి సతే వాళలు బాధ పడ తారు .	0.5712
{ \ an8 } वॉल ट अ सा इन में ट शुरू करें	{ \ an8 } వాల ట అ సె న మె ంట ఆ రం భి ంచండి	0.6868
दु बारा ब साह ट के अ सा इन में ट भेज रहे हैं	జ నా భా పు న రు దధ రణ అ సె న మె ంట లను పం పు తోంది	0.6341
{ \ an8 } ब धा ई हो ! आप वॉल ट 3 3 में र हें गे	{ \ an8 } అభి న ంద నలు ! మీరు 3 3 లో ఉ ంటుననా రు	0.6998
{ \ an8 } ब धा ई हो ! आप वॉल ट 3 3 में र हें गे	{ \ an8 } అభి న ంద నలు ! మీరు 3 3 లో ఉ ంటుననా రు	0.6998
न ॉर म , तुमहारी याद आए गी .	నువవు గుర తొ సతా వు , నా ర మ .	0.5694
चे ट .	చె ట .	0.6082
सही सुना ,	అది నిజం .	0.4470
और हम यहीं वॉल ट चार में र हें गे और काम करेंगे ,	మేము ఇకకడ ే వాల ట 4 లో నివ సి సతుననా ం , పని చేసతా ం ,	0.5616
के पी ए स ए स	కే పీ ఎ స ఎ స	0.5798
अब ऐसी आवा ज मिल ना मुशकिल है .	ఇక పె ఆ గొపప ధ వని ని పొ ంద లేవు .	0.5527
तुम कौन हो ?	ఎవరు నువవు ?	0.3913
नहीं .	లేదు .	0.3291
थे डि य स . . .	థా డి య స . . .	0.7451
नहीं .	లేదు .	0.3291
यह अचछी बात है न ? बर दर हु ड के लोग अचछे होते हैं ?	ఏంటి ? ఇది మంచి దే గా , కా దా ? సో దర జా తి మంచి వాళ లే గా ?	0.6031
कया कर रहे हो ?	ఏం చేసతుననా వు ?	0.4943
- और , जा ह िर है , हर वॉल ट . . . - मुझे नहीं जाना है .	- తపప కుండా , పరతి వాల ట . . . - నేను వెళ లను . వెళ లను .	0.7076
मैं वहाँ रह ता हूँ .	నేను అకకడ బ త క గలను .	0.4395
शु भ काम ना ए ं , ब त ती स के लोगों .	అద ృష టం కల గ ాలి , 3 2 వా సు లా రా .	0.6573
पास वर ड डाल ें	పా స వర డ అవసరం	0.4715
अगर उनहें पता चला कि उनहें खो ज ने में मैंने पूरा वॉल ट त बा ह कर दिया है . . .	ఆ య నను ర కషి ంచ డానికి మొతత ం ఓ సమా జా నని నా శ నం చేశా నని మా నానన కు తెలి సతే . . .	0.6418
इन हें इन की स हम त होने की कष म ता और जि ंदा दि ली के लिए चु ना गया है .	వారి లో పరతి ఒకక రూ తమ అ ంగ ీ కా రం , పటటు దల పర కా రం ఎ ం పి క చేయ బడ డా రు .	0.6831
जब यह माम ला खतम हो जाए , तो हमारे साथ वॉल ट 3 3 में रह सकते हो .	ఇవ ననీ ము గి సి పోయా క , నువవు మా తో పాటు వాల ట 3 3 కి వచచి నివ సి ంచ వచచు .	0.6216
फ यू जन को र के बिना यह क व च बे कार है . मैं यो द धा नहीं र हूँ गा .	ఫ యూ జర కోర లే కుండా , ఈ క వ చం ని రు ప యో గం . సె ని కు డి గా ఉండ లేను .	0.7171
ताकि किसी " ला वा रिस द लब द लू को सुरकष ित ले जा या जा स के . "	కొ రి య ర కు చె లలి ంచ మని టా మీ కి బో లె డ నని కా ప స ను రూ ఫ స పం పా డు .	0.6331
ठीक है , तुमहारे लिए यह सा मान कोई सत ह तक पहुँ चा दे गा .	క చచితంగా , నీ కోసం ఎవరెనా స రు కు లను పె కి తీసు కొ సతారు .	0.6049
उस पागल और त के साथ दो साल पहले प हा ड ों में चला गया .	వాడు రెండ ే ళల కరి తం కొ ండ లలో పిచచి దానికి పడి పోయా డు .	0.5715
हम से कहा गया था कि अ मे रि का बेहतर होता जा रहा है .	అ మె రి కా ఎపపుడూ మె రు గ వు తూ నే ఉ ంటు ందని మనకు చెపపా రు .	0.6018
किसी वजह से , उसकी लो के शन पता नहीं चल रही है .	ఏదో కారణ ంగా , నేను ఆమె సథా నం గుర తి ంచ లేక పోయా ను .	0.5792
मेरे अंदर अब भी तुमहारी गोली के हि स से हैं .	బహుశా ఇ పపటి కే ఎకకడ ో నీ మీద ఆ ధి ప త యం పొ ందా ను .	0.5953
अगर तुमहारे पिता होते , तो वे सही काम करते .	మీ నానన ఇకకడ ఉంటే , ఆయన స రెన పని చేసే వారు .	0.5732
जो तुम जैसे भ ट के या तरी की हर बी मा री और	పరతి వయా ధి ఇంకా దు ర ద ృష టానికి సంబం ధి ంచిన	0.5610
पर वह तो एक सप ना है . सच चा ई नहीं है .	కానీ అది ఓ కల మాతరమే . అది నిజం కాదు .	0.5627
पता है , मैं आपकी बी वी को जानती हूँ .	చూడ ండి , మీ ఆ వి డ గురించి నాకు తెలుసు .	0.5252
वॉल ट - टे क यहाँ की सबसे बडी कं प नी है .	అ మె రి కాల ో అ తి పెదద కం పె నీ వాల ట టె క .	0.6218
उनका " बेहतर भ वि ष य " प हा डी की खा ई है	" మె రు గె న భ వి త " అ ంచు న వే లా డు తోంది ,	0.6254
एक सा थी को न ु क सान पहुँ चा ने के लिए	తో టి పరా ణ ాల కు హా ని కలి గి ంచిన ందుకు ,	0.5759
मि . ह ॉ वर ड , मैं कम यु नि सट नहीं हूँ .	నేను క మ యూ ని సట ను కా ను , మి . హా వర డ .	0.6730
पलीज . मुझे जाने दो . मुझे जाने दो !	వదదు , వదదు . ననను వ దల ండి . వ దల ండి !	0.4619
इस पर नहीं कहते . इसमें कहते हैं .	సరే , దాని పె కాదు . దాని లో ఉంటుంది .	0.4585
इस समय में यही कहना सही होगा कि	ఈ సమయం లో , ఇ వి నా చి వరి మాట లు అని	0.5088
मुझे यहाँ आए दो ही हफ ते हुए हैं .	ఇకకడ పె న రెండు వా రాల ే ఉననా న ంత ే .	0.5614
मेरी छो टी फा र मे सी में सवागत है .	నా మర యా ద పూర వ క ఫా ర మ సీ కి సు సవా గ తం .	0.5680
चलो . तुमहारे बा प को ढूँढ ते हैं .	అలాగే . వెళలి నీ అబ బ ను వె తు కు దాం .	0.6147
- मुझे अचछा लगा . - कोई बात नहीं .	- అది చాలా మంచి త నం . - పర వాలేదు .	0.6240
मेरे वॉल ट में सी प ियाँ नहीं हैं .	మా వాల ట లో ఆ య సట రలు ఉండే వి కా వు .	0.5872
मेरे पास ढ क क न नहीं हैं . पर . . .	నా దగగర క యా ప లు లేవు . కానీ . . .	0.6831
मुझे मेरे बे स से सं पर क करना है .	మా సథా వ రా నని నేను సం పర ది ంచాలి .	0.6056
तो अगर तुम मुझे लो के शन बता दो	ఇపపుడు నాకు ఆ సథా నం ఇ చ చే సతే ,	0.5893
किसी ने पै र पर पै र रख दिया .	ఎవరో నా క ాలు పె అడుగు పెటటా రు .	0.5314
इसी लिए तो वॉल ट में रह ते हैं .	అందుకే మనం వాల ట లో బ తు కు తా ం .	0.6052
मतलब , बे स , ट रे बल , मि ड - र ें ज .	తెలుసా , ఆ బ ే స , ట రె బు ల , మి డ స .	0.7207
ठीक है . मिल कर अचछा लगा . बा य .	సరే . కల వడం సంతోష ం . వెళ తాను .	0.6369
तुमने फ यू जन को र ढूँढ लिया .	నీకు మా ఫ యూ జ న కోర క న బడి ంది .	0.6076
- बस " हाँ " कह दो . - मेरा नाम टा इट स नहीं , म ॅ क सि मस है .	- " అవును " అని చెపపు చ ాలు . - నా పె రు టె ట స కాదు . మా గ జి మస .	0.7030
जब कि खा रे पा नी की दवा . . .	షా మ రా క ఉ పప గా ఉండే సూ చ న . . .	0.5992
यह बहुत अ हम मि शन है , तुमहें अ ड ं गा डाल ने नहीं द ूँगा .	ఇది చాలా ముఖ య మెన పని , నువ వది పా డు చే సతు ంటే ఊ రు కో లేను .	0.6519
हमारे पड ो सी वॉल ट 3 2 को दु बारा ब सा ने की तैयार के लिए	మన పొ రుగు న ఉనన వాల ట 3 2 ని తిరిగి ని ం ప డానికి స ననా హ కంగా ,	0.6175
उसे जो जान ना है , बता दो वर ना वह हम सब को मार दे गा .	అతని కే ం తెలియ ాలో అది చెపపు , లేదా మన ంద రి నీ చం పు తా డు !	0.5928
जब आप अ मे रिक न स व प न के वा दे के बारे में सोच ते हैं ,	కానీ అ మె రిక న కల గురించి ఆ వా గ దా నం గురించి ఆలోచి సతే ,	0.6342
मैं बस काम पूरा करने ही वाली थी कि त भी वॉल ट - टे क ने	నేను దానిని సా ధి ంచే అ ంచు న ఉండ గా , అ పపుడే వాల ట టె క	0.6283
हर चीज ते रे लिए नहीं है .	అన నీ నీ కో స మే అనుకుంటా వు .	0.5628
वॉल ट 3 3 में . मुझे खो जना .	వాల ట 3 3 లో . ననను కని పెటటు .	0.6539
न ॉर मन , मैंने कया कहा था ?	నీకు ఏం చెపపా ను , నో ర మన ?	0.5885
मैंने ही वह सिर का टा था .	అది కో సిన మనిషి ని నేనే .	0.4436
मुझे बहुत - सी बात ों के लिए खे द है . मेरा मतलब . . .	చాలా విషయ ాల లో కషమించు . నా ఉదదేశం అది కాదు . . .	0.6568
{ \ an8 } लो ड हो रहा है . . .	{ \ an8 } లో డ అవు తోంది . . .	0.7610
ब जा य सत ता में बैठ े लोगों से , जो अस ली दु श मन हैं .	ఇకకడ అ ధి కా రం లో ఉనన నిజ మెన శ తరు వు తో కంటే కూడా .	0.6699
रू फ स ने टॉ मी को भी उस पागल और त से मिला या था .	ఇ కకడి టా మీ ని ఆ పిచచి మ హి ళ తో పెదద రూ ఫ స కలి పా డు .	0.6248
चलो , वह सिर खो ज ते हैं .	వెళలి ఆ త లను వె తు కు దాం .	0.5774
तो धयान रख ें , मुझे यहाँ किसी का आ ना पसंद नहीं .	నేను ఈ సట ే షన కి స ంద ర శ కు లను తీసుకో నని రి మె ండ ర .	0.6178
इं सा नों का मे ल रे डियो एक टि वि टी पर त िर ो धी जा ति यों से करा ना अचछा है .	రే డి యో ధా ర మి క ని రో ధ క జా తు లతో మను ష ు లను హె బ రి డె జ చేయడం ఇ పపటి కీ సా ధయ మే .	0.6578
हाँ , उस तरफ एक है तो सही , ब डे ग ड ढ े के आगे ,	అవును , ఆ పెదద బి ల ం దా టి , ము రికి పరా ంత ం మధయ లో	0.6728
वॉल ट 4 के पहले नि वा सि यों दवा रा , फिर उन लोगों ने वि द रो ह कर दिया .	వాల ట 4 నిర వా సి తులు అతని పూర వీ కు లను పర యో గ శ ాల ఎ లు కలు గా వా డా రు .	0.6680
पर कौन - सी दवा ठीक है ?	కానీ వాటి లో ఏ ది ఏదో ?	0.4471
श बद ों का अ र थ होता है .	మాట లకు అరథం ఉంటుంది .	0.4823
वॉल ट - टे क पर ो टो टा इ प 2 4 . 00 8 . 2 ए स ली प मो ड	వాల ట టె క పర ో టో టె ప 2 4 . 00 8 . 2 ఏ ని ద రా ణ సథి తి	0.7287
धत त . उनहें पता चल गया तो मुझे मार डाल ेंगे .	ఛ . ఛ , వాళ లకు తెలి సి ంద ంటే ననను చం పే సతారు .	0.6249
अ जन बि यों के साथ मेरी कि सम त ठीक नहीं है .	అ పరి చి తు ల విషయం లో నా అద ృష టం అంత బా గో లేదు .	0.6359
इससे पता चल ता है कि	ఇపపుడు , దీని పర కా రం ,	0.5055
वे मुझे छोड रहे हैं .	ననను వదిలే సతుననారు .	0.4446
- कौन - सी ? - ठीक है .	- ఏ ది ఏదో ? - మంచిది .	0.6093
उस नर क के बीच ों बीच .	ఒకటి ఉ ందని నా నమమ కం .	0.5279
किसी को तो लगता है .	ఎవరో ఒక రు అనుకో వాలి .	0.4742
कि तुम मुझसे मिले सबसे अचछे अ जन बी हो .	నేను కలి సిన అత యు తత మ అ పరి చి తు డి వి నువవే .	0.5847
तो , आप कहते हैं कि कुछ लोगों को छोड कर	అయితే , నువ వ నే ది కొ ంద రు కా కుండా ఇ తరు లకు ,	0.5728
हमेशा ही कुछ नए गु ट बन जाते हैं , है न ?	ఎపపుడూ కొనని కొతత కక ష లు ఉంటా యి , కదా ?	0.6272
मुझे जिंदगी मि ट टी खो द ते नहीं बि ता नी .	మ టటి ని త వ వు కు ంట ూ నా జీవి తమ ంతా గ డ ప లేను .	0.5895
मैं मर ने वाला हूँ .	నేను చచ చే లా ఉననాను .	0.4775
कोई बात नहीं , दोसत .	ఏం పర వాలేదు , బా బ ూ .	0.4583
तुम भी जा रहे हो .	నువ వ ూ వెళ ు తుననావు .	0.4701
सिरफ वै ज ञ ा नि कों की ली डर शि प वाले स मु दा य में र हें गे .	పూరతి గా శా స తర వే తత ల చే నిర వ హి ంచ బ డే సం ఘ ం ఇది న డు పు తుంది .	0.6995
पा ख ंड आपकी फि ल म ों की हि ं सा जैसा है .	క ప ట త వం మీ సి ని మ ాల లో హి ం స లాంటి ది .	0.6095
पता है , अगर तुम कोई वय क ति होते ,	ఒకటి తెలుసా , నువవు మనిషి వి అయితే ,	0.5247
तुमहें मौ त की स जा दी जाती है . . .	నీకు మ రణ శి కష వి ధి ంచ బడి ంది . . .	0.5982
जो मान व डी ए नए पर वि कि रण के अ सर के वि शे ष ज ञ हैं .	మా నవ డీ ఎ న ఏ మీద రే డి యే షన పర భా వాల పె స పె ష లె జ చేశారు .	0.6662
कि सा नों का ने ता .	దా రి చూ పే రె తు .	0.5556
पर भ वि ष य करी ब आ चुका है , हम इसे देख सकते हैं .	కానీ భ విష యత తు దగగర పడు తు ంటే , మనకు అది క న బ డు తుంది .	0.6512
{ \ an8 } न ु का - को ला पी यो बेहद ठ ं डा	{ \ an8 } న ూ కా - కో లా తా గ ండి అ తి చ లల గా	0.6424
वैसे , यह न ज रि या आ शा वा दी तो है .	సరే , ఇది క చచితంగా ఆ శా వాద ద ృ క ప థ ం .	0.6018
यह तो ख तर ना क है .	అది భలే గా ఉంది .	0.4020
बताओ , मेरी जानकारी पु रा नी है ,	చెపపు , నాకు సమా చా రం అంద డం లేదా ,	0.5842
माफ करना . मैं वहाँ नहीं रह ता .	జరగ ండి . కు దర దు , నే న కకడ బ త క లేను .	0.5305
वॉल ट - टे क ने उस ल डा ई को रो क ने के सा धन ख री द लिए .	ఆ యు దధ ం ము గి ంచే దారు లను వాల ట టె క కొ నే సింది .	0.6603
मुझसे पहले यह क व च टा इट स नाम के एक यो द धा का था .	నా కంటే ముందు ఈ సూ ట కి స ొ ంత దారు డి పేరు టె ట స .	0.6391
मैंने नहीं . . .	నేను చెపప లేదు .	0.4046
उन बे चार ों का दर द कम करने की कोशिश करते देखा जिन हें तुम लोग यहाँ ला ए .	మీ పర జ లు ఈ పర దేశం లోకి వచచే లా చేసిన ఆ పే ద వారి బాధ ను త గ గి ంచ డానికి చూ సతుననా ం .	0.6305
सिरफ वि ले न उसका इस ते माल करें , तो जी त ेंगे .	దు ర మార గు లను ఉ ప యో గి ంచ ని సతే , వాళల దే గె లు సతారు .	0.6302
