Hindi	Telugu	Similarity_Score
. . . पर मैं उसके लिए खुश हूँ .	. . . కానీ నాకు సంతోష ంగా ఉంది .	0.6036
हाँ !	భలే !	0.3574
मुझे लगता है कि किसी ने एडगर को ज हर दिया	ఎవరో ఎడ గర కి విష ం పెటటా రు అనుకుంటుననా ను ,	0.5789
इ सा बे ल .	ఇ సా బె ల .	0.5811
कया हो रहा है ?	ఏం జరుగు తోంది ?	0.4928
वैसे , हाँ , सोचा तो यही था .	అంటే , అవును , అదే నా ఐ డి యా .	0.5599
पता है कया ? एक से क ंड रुको .	ఒకటి చెపప నా ? ఒకక కష ణం ఆగు .	0.6083
यह कोई सी क वल नहीं है .	ఇదే ం రెండ వ భా గం కాదు .	0.5439
नहीं .	లేదు .	0.3291
- हम डे ट कर रहे हैं . - हम डे ट कर रहे हैं .	- డే టి ంగ చేసతుననా ం . - డే టి ంగ చేసతుననా ం .	0.5275
कौन ड रि ंक लेना चाह े गा ?	ఎవరి కె నా డ రి ంక కా వ ాలా ?	0.4904
पि च के हुए बं पर वाली नी ली से डा न का मा लि क ,	వం గి పోయి న బం పర తో ఉనన నీ ల ం రం గు కారు ఓ న ర	0.6746
जो कि हमेशा भी ड के सामने ख डे होने को उ ता व ला रह ता है	ఎంత మంది జ నం ముందు ఉననా ఎ ం జా య చేసే అ ల వా టు ఉనన ననను ,	0.6400
अब , आ मत ौर पर जब पर कृ ति को त बा ह करने वाले इन र ई स ों में से कोई	సరే , సా ధా రణ ంగా భ ూ మి ని నా శ నం చేసే ఈ అ పర కు భ ే రు లు నా ఇంటి గు మమ ం	0.6842
ब धा ई नहीं दे ता हूँ पर मैंने सुना है कि यह मेरी गरेस को खुश रख ता है .	అంతే కా ని అభి న ంది ంచ ను కానీ నువవు గరేస ని చాలా సంతోష పె డ తా వని వి ననాను .	0.6094
तुम कौन हो ?	నువ వె వరి వి ?	0.3942
मैं अ नी क हूँ .	నేను య నిక ని .	0.4783
ठीक है . तो . . .	సరే . అలాగే . . .	0.6589
नहीं , यह भ द दा है .	కాదు , అది దారు ణం .	0.4834
और मैंने कया किया ?	కానీ నేనే ం చేశా ను ?	0.4488
वे एक - दूसरे से बिलकुल अलग हैं .	అంటే , వాళళు చాలా భి నన మెన వారు .	0.5610
गरेस रो मा ं टि क , जा दु ई पागल है जि से परा ची न चीज ों से पयार है	గరేస ఒక ర ొ మా ంటి క పిలల , పు రా తన వాటి ని ఇష ట పడ ే ఒక వి ంత మనిషి ,	0.6563
मैं जयादा परति कर िया नहीं दिखा रहा . तुम हमेशा यही कहते हो . नहीं . . .	నేను అ తి గా పరతి సప ంది ంచడం లేదు . నువవు ఎపపుడూ ఇలా గే అంటా వు . లేదు . . .	0.6530
अ नी क ?	య నిక ?	0.4344
पर हम आज रात नहीं करेंगे .	మేము ఇ వాళ రాతరి ఏం చేయ ము .	0.4664
बस . . .	ఇక . . .	0.8835
वाह . - पुलिस उस माम ले में शा मिल नहीं होना चाहती है .	- వా వ . - పోలీసు లకు ఆ కేసు మీద పని చేయడం ఇషటం లేదు .	0.5974
मुझे मजाक पसंद हैं . और रॉ कस ै ना को भी .	నాకు జో క లు అంటే ఇషటం . రో క సా న కి కూడా .	0.6333
उसे अपना पर भ ु त व दिखा ओ .	దాని మీద ఆ ధి ప త యం చూ పు .	0.5954
और अगर तुम वैसे ही कार चला ते हो जैसे पार क करते हो , तो मैं बस अपना आ पा . . .	నువవు కారు పార కి ంగ చేసిన టటే డ రె వి ంగ చే సతే , వాళళ తో వే గే ఓ పి క నాకు లేదు . . .	0.6637
यह मेरे लिए बहुत बडा सम मान होगा .	ఇది నేను గొపప గ ౌ ర వ ంగా భా వి సతాను .	0.5377
हाँ , सही कहा .	అవును , నిజ మే .	0.4586
अ नी क !	య నిక !	0.4344
अ नी क .	య నిక .	0.4344
यह एक साम राज य वा दी उप कर ण है .	సా మ రా జ య వా దు ల ఆ యు ధం లాంటి ది .	0.5883
हाँ .	సరే .	0.3574
प सी ने से भी ग जाते हो .	చె మ ట ఎకకువ గా వ సతుంది .	0.5336
और मैंने " नहीं " कह दिया .	అ ందుకు నేను వదదు అననా ను .	0.4793
ठीक है !	జా గర తత !	0.3610
अ नी क !	య నిక !	0.4344
- सब ठीक है ? - ठीक है . हाँ .	- సరి పోయి ందా ? - సరే . అలాగే .	0.5484
शा बा श . बढिया है .	బాగుంది . మంచిది .	0.4203
वह शक ति शा ली है . और उ दार है .	అతను బ ల మెన వాడు . మంచి వాడు .	0.5650
खैर , रॉ कस ै ना , कया तुमहें म छ ली पसंद है ?	పో ని లే , రో క సా న , నీకు చే ప అంటే ఇష ట మే నా ?	0.6453
जिस का नाम है ल ु का - छ ि पक ली .	దానని బ లలి పోలీసు అంటా రు .	0.4988
- ठीक है . - कया ?	- సరే . - ఏంటి ?	0.6350
ये य !	భలే !	0.3566
हाँ .	భలే .	0.3574
वह शान दार है .	ఇది భలే ఉంది .	0.4059
मैं उसे हर जगह ढूँढ चुका हूँ .	నేను దాని కోసం అంతా వె తి కా ను .	0.4787
और कृपया , च लिए खु शन ुम ा जो डी के नाम एक जा म पे श करें .	అలాగే అంద రం కలిసి ఈ న ూ తన జ ంట కు అభి న ంద నలు తెలు పు దాం .	0.6743
हाँ . मुझे समझ नहीं आया मैं कया कर ूँ .	అవును . కానీ నాకు ఏం చేయ ాలో తెలీ లేదు .	0.5298
पर इसे मेरे लिए आ सान मत बना ना .	కానీ నా కోసం దానిని ఈ జీ చేయ కు .	0.5270
तुमहें लगता है कि उसे पता था कोई उसे मार ने की कोशिश में था ?	తన ను చం ప డానికి పరయతని సతుననా రని వాడి కి తెలుసు అనుకుంటుననా వా ?	0.5599
और फिर , अग ली सु बह . . .	ఆ తరవాత రోజు ఉద యం . . .	0.6426
जिस पर हतया का आ रो प है .	హ త యా రో ప ణ చేయ బడి న వయకతి .	0.5412
तुम मुझसे कया छ ि पा रहे हो , अ नी क ?	నువవు నాకు ఏం చెపప డం లేదు , య నిక ?	0.6145
फिर , आ फ टर - पार टी में जाते समय , मैंने ला इ ब रे री के बाहर गरेस को देखा .	ఆ తరవాత ఆ ఫ టర - పార టీ కి వెళ తు ండ గా , గరేస లె బర రీ బయట ఉండ డం నేను చూశా ను .	0.7042
और वह एक ड रि ंक में कुछ डाल रही थी .	అపపుడు ఆమె డ రి ంక లో ఏదో పె డు తుంది .	0.5474
कया तुमने कहा कि गरेस ने उसे ज हर दिया ?	గరేస వాడి కి విష ం పె టటి ంది అని చెపపా వా ?	0.5394
नहीं . यह सच में रो मा ं टि क - कॉ मे डी है . जैसे , " अ ह - ओह , यह बेवकूफ मु सी ब त में फ ँ स गया . "	లేదు . ఇది ర ొ మా ంటి క కా మె డీ లా గే ఉంది . అంటే , " అయ యో , ఈ స ననా సి తి పప లలో పడ డా డు " అనన టటు .	0.7525
एक सु ंदर आदमी तुमहारी गर ल फर ें ड को रि झा रहा है जब कि तुम खुद को शर मि ंदा कर रहे हो .	అంద రి మధయ నినను నువవు ఎ గ తా ళ ి చేసు కు ంటు ంటే , ఒక అంద గా డు నీ పిలల కు లెన వే సతుననా డు .	0.6637
हैलो . तुमसे मिल कर खुशी हुई . तुमने अपना ओ बा मा का पु त ला गि रा दिया .	హాయ . మిమమలని కల వడం సంతోష ంగా ఉంది . మీరు మీ ఒ బా మా బ ొ మమ ని పడ ే శా రు .	0.6489
सुनो , ठीक है . तो , मैं एक शादी में आया हूँ और दू ल हा मर गया है .	చూడు , సరే . నేను ఒక పెళళి కి వచచా ను , ఇకకడ పెళళి కొ డు కు చని పోయా డు .	0.6401
सुनो . कया छ ि पक ली के सु ख द च बा ने की आवा ज से सु ंदर कोई आवा ज है ?	ఆ శ బ ద ం వి ను . ఒక బ లలి నమ ల డం కంటే మంచి శ బ ద ం ఇం కే మెనా ఉ ంటు ందా ?	0.7104
मुझे पता था कि अगर मुझे जो ई के मा ता - पिता का आ शी र वाद चाहिए ,	జో యి తల లి ద ండ రు లకు నేను న చచ ాలి అంటే , అదే నాకు చి వరి అవకా శం	0.6259
पु नर वि चार करने के बाद , जब कि यह एक बेहद दु ख द हा द सा है ,	ఇం కొ క సారి ఆలోచి ంచ గా , ఇది అత య ంత దారు ణ మెన విష ా ద మే అయి నా ,	0.6658
रुको , रुको . तुमहें पता है कि मेरी एक पर कर िया है .	ఆగు , ఒకక నిమిష ం . నా కొ క వి ధా నం ఉ ందని తెలుసు కదా .	0.6352
- तुम कया कर रहे हो ? - मैंने रॉ कस ै ना को खो दिया .	- నువవు ఏం చేసతుననా వు ? - రో క సా న కనిపి ంచడం లేదు .	0.6536
मैंने कहा था , " को रि या ई चा चा और ची नी चा च ियाँ . "	నేను , " కొ రి యన అ ం కు లస ఇంకా చె నీ స ఆ ంట ీ లు " అననా ను .	0.6237
- तुमने कया कहा ? - हमारे बीच बहुत बडी ल डा ई हुई	- ఏమ ననా వు ? - మేము ఇం దా కే పెదద గా గొ డ వ డు కుననా ం ,	0.6270
- हम कुछ नहीं सु ल झा सक ेंगे . . . - पता है कया ?	- నువవు ఏం పరి ష కరి ంచ లేవు . . . - ఒకటి చెపప నా ?	0.7146
नहीं . मैंने कभी करि प टो के बारे में नहीं सोचा .	లేదు . నేను నా చే తి ని కరి ప టో లో పె టటి ంది లేదు .	0.5784
- और दिखा सक ूँगा कि मैं उप यो गी हूँ ? - जरूर .	- పని కొ సతాను అని ని రూ పి ంచ గలను , సరేనా ? - సరే .	0.5992
पता नहीं , एडगर . वह जयादा भरो से म ंद नहीं है .	ఏ మో , ఎడ గర . వాడి కి ప ను లు చెపప డం మంచిది కాదు .	0.5975
मैं बस अके ला झा डि यों में छ ि पा हुआ था . . .	చూడ ండి , నేను ఆ పొ ద లలో దా కక ొ ని , వే రు గా . . .	0.6590
तुमहें लगता है मुझे उससे बात करनी चाहिए ?	నేను తన తో మాటలా డి తే మంచిది అనుకుంటుననా వా ?	0.5375
- कया ? - मैं कुछ खा ने के लिए ले रही हूँ .	- ఏంటి ? - తి న డానికి ఆ హా రం తీసు కుంటుననా ను .	0.6239
हाँ , अ ह - ह ँ . हाँ , नहीं , मुझे अब समझ आया .	సరే , ఆ హ - హా హ . సరే , లేదు , నాకు తెలు సతుంది .	0.6566
मैं बस चाहता हूँ कि आप मुझे पसंद करें .	మీకు నేను బాగా న చచ ాలి అనన దే నా కో రిక .	0.5629
कृपया हैं ड ब रे क इस ते माल करना सी खो गे ?	కొంచెం హ యా ండ బ రే క వా డ డం నే రచు కుంటా రా ?	0.6341
पर आप से यह कहना बेहद बद त मी जी है , तो मैं . . . मैं अपना कहा वापस ले ता हूँ .	కానీ మీ తో అలా అన డం స భ యత కాదు , కాబటటి . . . నేను ఆ మాట లు వెన కకి తీసు కుంటా ను .	0.6821
- या कया मैं ग ं भी र हूँ ? - पता नहीं .	- నిజంగా నే జో క అనుకుంటుననా వా ? - ఏ మో .	0.5637
एडगर को बो टा ई बा ँ ध ने में मदद चाहिए .	ఎడ గర కి బో టె క టట డం లో సహా యం కావాలి .	0.6183
मुझे पता है कि सभी इससे स हम त होंगे ,	నేను ఈ మాట లు అంద రి తర పు న చెప తుననాను ,	0.5656
नहीं . मैं यहाँ जो ई के साथ आया हूँ .	కాదు . నేను ఇకకడికి జో యి తో వచచా ను .	0.5539
ठीक है , सभी मु स कु रा ओ . यह बढिया है .	సరే , పెదద గా నవ వ ండి . ఇది భలే ఉంది .	0.6225
स फ े द च ॉ क ले ट उसकी पसंद ी दा सन ै क है . अगर वह इसमें गिर कर ड ू ब गई हो तो ?	దానికి తె లల ని చా క లెట అంటే బాగా ఇషటం . ఒక వే ళ అది ఇ ందు లో పడి చచ చి ఉంటే ?	0.6723
बस जो भी बुरा हो सकता था , हो गया .	నా శ నం కా గల పర తీ విషయం నా శ న మెంది .	0.5108
- तुमहारी कार चल रही है . - कया कहा ?	- నీ కారు క దు లు తోంది . - ఏమ ననా వు ?	0.6159
तुमने उन दूसरे लोगों का कया किया ?	మరి ఆ తెలీ ని వయ క తు లను ఏం చేశా వు ?	0.5610
जो भी यह शो र कर रहा है , कृपया बंद करो . रॉ कस ै ना को इससे न फ रत है .	ఆ శ బ దానని చేసే ది ఎవరెనా , దయచేసి ఆ ప ండి . రో క సా నా కి అది అస స లు న చచ దు .	0.6478
पर मैंने फै सला किया कि मुझे रि हर स ल डि नर में ही जो ई के मा ता - पिता को दिखा ना होगा	కానీ రి హా రస ల భ ో జ నం లో , జో యి వాళళ అమమా నానన లకు నేను వాళళ అమమాయి కి ఎంత మంచి జో డి నో	0.6164
ता इ वा नी शे व ड आ इस , है न ? जो ई ने मुझे इस बारे में सब कुछ बताया था .	తె వా నీ స ష ే వ చేసిన ఐ స , కదా ? జో యి నాకు మీ గురించి చాలా చెపపి ంది .	0.6801
कैसे ? इ सा बे ल शे रि फ की दोसत है .	ఎలా ? ఇ సా బె ల కి పోలీసు లు తెలుసు .	0.6414
कोई बात नहीं . सब ठीक हो जाएगा .	అదే ం పర లేదు . అంతా సర దు కు ంటుంది .	0.5396
उसने अपना दिमा गी सं तु ल न खो दिया है या फिर बस बद ला ले रही है ,	లేక కావాల నే ఇలా ఇ బబంది కర ంగా పర వర తి సతు ందో నాకు అరథం కా వడం లేదు ,	0.6177
- ए , तुम ठीक हो ? - कम ब खत एडगर .	- హేయ , ఎలా ఉననావు ? - చెతత ఎడ గర .	0.6811
मेरा बे चा रा बेटा . अपने पिता की तरह , यह भी नी ंद में चल ब सा .	పా పం నా కొ డు కు . ని దర లోనే క నను మూ సా డు , అ చచ ం తన త ండ రి లా గే .	0.6663
ए . ठीक है . कृपया यह बंद करो .	హేయ . సరే . పలీజ అలా చేయడం ఆ పు .	0.6511
- अरे , नहीं ! - ए , सब ठीक है .	- ఓహ , లేదు ! - హేయ , ఏం పర లేదు .	0.6286
मैंने इसी स पता हा ंत को पर ो पो ज करने की यो जना बना ई थी , पर मैं बस ग ड ब ड ें करता जा रहा हूँ .	నేను ఈ వా రా ంత ం ఆమె ను అడుగు దాం అని అను కుననాను , కానీ నేను చేసిన పర తీ పని పా డ వు తుంది .	0.6302
- अरे , नहीं . नहीं . - मेरा टर क !	- ఓహ , లేదు . అయ యో . - నా టర క !	0.6741
वे मान ते हैं कि यह न व वि वा हि त जो डे के लिए सम ृ द धि ला ता है .	ఈ పా నీ యం న ూ తన వ ధ ూ వ రు లకు శ రే య స సు ను ఇ సతు ందని వారి నమమ కం .	0.7040
यह भा ँ प ना इतना क ठ ि न नहीं है .	కని పెటట డం అంత కష టం ఏం కాదు .	0.5666
और उसने वह ड रि ंक एडगर को दी .	దానిని ఆమె ఎడ గర కి ఇ చచి ంది .	0.5420
मैं अग ली फो टो में आ जा ऊँगा .	నేను తర వా తి ఫ ొ టో లో ఉంటా ను .	0.5608
जैसा कि हो पी लोग कहते हैं , " आँ सु ओं से मत ड रो , कयोंकि वे शो क के आई ने होते हैं . "	హో పి తె గ వాళళు ఇలా అంటా రు , " క ననీ ళ లకు భయ పడ క ండి , అవి బాధ కు అ దద ాలు లాంటి వి " అని .	0.7032
खुद को से बा सट ि यन बुला ता है . शायद यह न क ली नाम होगा .	వాడి పేరు సె బా స టి న అ ంట . బహుశా న కి లీ పేరు అయ యు ండ ొ చచు .	0.6466
पता है कया ? मैं जाकर टे बल बदल ने की कोशिश करता हूँ .	ఒకటి చెపప నా ? నేను టే బు ల మా రి తే మంచిది అనుకుంటుననా ను .	0.5850
दे वि यों , स जज नों , स री स ृ प ों .	లే డీ స , జె ంటి ల మెన , బ లలు లు .	0.6156
मैं . . . मैं यहाँ आपको यह फोन का चार जर देने आया था .	నేను . . . నేను మీకు ఈ ఫోన ఛ ా ర జర ఇవ వడానికి వచచా ను .	0.6489
हाथ च ू म ने वाला आ गया है .	చే తు ల ర సి కు డు బయ లు దే రా డు .	0.5845
- हाँ . - अगर चा हो तो मैं बिना न हा ए रह सकता हूँ . . .	- అవును . - కావాల ంటే నేను తరవాత స నా నం చేసతా . . .	0.6271
मैं ह वा इ यन शे व ड आ इस टॉ य ले ट में भी नहीं फ ें क ूँगा .	నే నె తే హా వా యన ష ే వ ఐ స ని ఇంట లోకి కూడా రా నివ వ ను .	0.6645
और मैंने उसे कु चल दिया .	దానిని కారు కింద వే సా ను .	0.5118
अ नी क इस काम पर लग गया है	య నిక ఆ పని మీ దే ఉననాడు ,	0.5300
पर मुझसे अब भी कू मि स की बू आ रही थी , तो मैं न हा कर आ फ टर - पार टी में गया .	కానీ నా దగగర ఇంకా ఖ ు మి స వా స న రా వ డ ంతో స నా నం చేసి ఆ ఫ టర పార టీ కి బయ లు దే రా ను .	0.6801
तब तक के लिए कोई इस परि सर से बाहर नहीं जाएगा .	అది జ రి గే వర కు ఎవరూ ఇ కకడి నుండి వెళళ డానికి లేదు .	0.5559
और केवल ए रि जो ना राज य में प ं ज ीक ृ त वि च डॉ क टर को	అ రి జో నా రా ష టం లో రి జి సటర అయి న డా క టర ని అయి న నాకు	0.6133
वह मैं कर ूँगा . एडगर ने मुझे शादी का हि ससा बन ने को कहा .	అది నేనే . ఎడ గర ననను పె ళ లి కార య కర మ ంలో పాల గొ న మని చెపపా డు .	0.6187
तो मैं अपने ये मे नी जै म बि या के घ ुम ा व दार ब ले ड से तुमहारा ग ला का ट द ूँगा .	నేను య ె మెన నుండి తె చచి న వం పు లు నన నా జా ం బి యా క తతి తో నీ పీ క కో సతాను .	0.6873
मैं गरेस को तैयार होने में मदद करने वाली थी .	అంటే , నేను గరేస కి సహా యం చేయ డానికి వెళ తుననాను .	0.5554
