Hindi	Telugu	Similarity_Score
और जब मुझे पता चला कि चा य में ज हर था ,	అలాగే విష ా నని టీ లా గ కా చా రు అని తె ల సిన తరవాత ,	0.5420
और देखना मेरा कि र दार कौन नि भा रही है .	అలాగే నా పా తర ఎవరు పో షి సతుననా రో వే చి చూడ ండి .	0.4885
मैं पूरी रात बाहर था .	నేను రాత రం తా బయట ే ఉననాను .	0.4687
और इसलिए आगे बढ ने में मुझे तुमहारी मदद करनी थी .	అందుకే నువవు వాడిని మర చి పో వడానికి ఏమెనా చేయాలి అను కుననా .	0.5149
जब तक कि हम बे ड रू म में केवल हाथ ों से म जे के लिए स हम त हों ,	బె డ రూ మ లో చే తు ల వర కే పరి మి తం చేసు కు ందా ం అని ఒ పప ంద ం చేసు కునన ంత కాల ం ,	0.6252
गरेस ने हतया नहीं की . मैंने की .	గరేస కూడా ఆ పని చేయ లేదు . నేనే చేశా ను .	0.5437
अगर तुमहें वह सही लगता है , तो कया लगता है मैं उसकी हतया कयों करना चा हूँ गा ?	ఆయన చెపపే ది నిజం అనిపి సతే . ఎడ గర ని చం ప ాలను కుననా నని ఎలా అంటా వు ?	0.5885
तुम ठीक हो ? यह बहुत बडी बात है .	బాగానే ఉననా వా ? ఇది చాలా బ రు వెన విషయం .	0.5075
मैं इस बारे में न सोच ने की कोशिश कर रही थी .	నేను ఆ విషయం మర చి పో వడానికి చూ సతుననా .	0.5466
कयोंकि तुम में से कोई भी हतया रा हो सकता है .	ఎందుకంటే మీ లో ఎవరెనా హ ంత కు డు కా గల రు .	0.5863
बैठ ो .	కూ రచ ో .	0.3345
डॉ गी ?	కు క కా ?	0.4115
पर अब मुझे समझ आया कि मैं सही थी और गरेस ने ही हतया की .	కానీ ఇ పపుడే నేను అను కునన ది అంతా నిజం , చం పి ంది గరే సే అని తెలి సింది .	0.5360
- कर न ल ! यहाँ आओ . - नहीं !	- కల న ల ! ప దా . - వదదు !	0.6786
हाँ , पता है . बिलकुल .	అవును , తెలుసు . ఖచచితంగా .	0.5240
मेरी बन जाओ .	నాతో ఉ ండు .	0.4329
मेरी बन जाओ .	నాతో ఉ ండు .	0.4329
यहाँ , यू लि सी स ने ज हर वाला गि ला स फै ंग को दिया .	సరి గగా ఇకకడ ే , యూ లె సీ స విష ం కలి పి న గ లా సు ని ఫె ంగ ఇ చచా డు .	0.6217
ढ ों गी ?	పో జా ?	0.3432
पर , इतना कुछ होने के बाद ,	కానీ , అంటే , జరిగింది అంతా చూ సి	0.5277
और मैं उसे गिर फ तार कर रहा हूँ . और भगवान उस पर द या करे .	నేను ఆమె ను అ రె సట ు చేసతుననా ను . ఆమె భ విష యత తు మీద దేవు డే క రు ణి ంచాలి .	0.5687
पता है कया ? चु प रहो ! मैं कर ल ूँगी .	ఒకటి చెపప నా ? నో రు మూ సుకో ండి ! నాకు తెలుసు .	0.5711
मुझे पता है कि तुमने भी वह महसूस किया है .	అది నీకు కూడా తెలు స ని నాకు తెలుసు .	0.5451
और उस ी इंसान ने हतया की .	అలాగే ఆ వయ క తే ఈ పని ని చేశా డు .	0.5237
कया . . . जो ई , रुको . जो ई !	ఏం చే సతూ . . . జో యి ఆగు . జో యి !	0.6241
जैसा कि जु ल ु लोग कहते हैं , " मौ त वह चो ला है जो सभी इं सा नों को पह न ना होगा . "	జ ూ లు వారు అనే టట టు , " చా వు అనే ది పర తీ మని ష ీ ధ రి ంచ ాల సిన వ సత రం . "	0.7103
मैंने तुमसे पयार किया है .	నేను నినను పరే మి ంచా ను .	0.5344
कोई बात नहीं , जो .	ఏం పర లేదు , జో .	0.4928
जो ई , इसे प ॉ ज करो .	జో యి , పా జ చె య .	0.5155
- ह ल का सा . - बस एक से क ंड के लिए .	- చాలా చినన అను మా నం . - ఒకక కష ణం మాతరమే .	0.6178
वहाँ जहाँ हमने पहली बार च ू मा था .	మనం మొదటి సారి ము దదు పెటటు కునన పర దేశం లో .	0.5036
मैं तुमहारी सप ष ट वा दि ता की स रा ह ना करता हूँ . धनयवाद .	మొ హ మాట ం లేక ండా చెపపి న ందుకు సంతోష ం . థాంక స .	0.5575
इ सा बे ल , जिस माँ को ध ो खा दिया गया .	ఇ సా బె ల , ద రో హం చేయ బడి న తల లి .	0.6058
अरे , वाह . तुमहारी बात पूरी हो गई ?	ఓహ , అబబా . ఇక పూరతి అయ యి ందా ?	0.5384
इसलिए धनयवाद , हाँ .	కాబటటి మీ రే ఉ ంచుకో ండి .	0.3767
तुमहारे बचचे ब डे हो गए हैं .	నీ పిలల లు ఎ ది గి పోయా రు .	0.5709
मैंने अपने हाथ ों से उसका ग ला घ ों टा .	నేనే వాడిని నా చే తు లతో గొ ం తు పి సి కి చం పా ను .	0.5443
दरअसल , मुझे आपकी सं पत ति नहीं चाहिए ,	సరే , కానీ నాకు మీ అ కర మ స ొ తతు ఏం అవసరం లేదు ,	0.5829
म कस द नहीं है .	ఉదదేశం లేని వారు .	0.3773
मुझे बातें दो हरा ना पसंद नहीं है .	నేను చెపపి ందే మళళీ చెపప ను .	0.5103
ठीक है , का इ ल र , मुझे जाना होगा . का इ ल र .	సరే , కె ల ర , నేను వెళళ ాలి . కె ల ర .	0.6102
थ िए टर जाना . कभी - क भा र डि नर पर जाना .	థ ి యే టర కి వెళ దాం . అ పపుడ పపుడు కలిసి తి ందా ం .	0.5455
और यहाँ ऐसा कोई नहीं है जिस के पास म कस द नहीं है .	అలాగే ఇకకడ ఉదదేశం లేని వారు ఎవరూ లే రు .	0.4853
मैंने साल ों पहले गलती की थी , पर मैंने उसे ही चु ना .	చాలా ఏ ళల కరి తం నేను ఎ నన ో తపపు లు చేశా ను , కానీ నాకు అత నే కావాలి .	0.5742
कया तुम मुझसे रिश ता तो ड रही हो ?	నువవు నాతో వి డి పో తుననా వా ?	0.4948
हम कैसे सो सकते हैं जब मेरे पास वय व सा य को लेकर इतने सारे नए वि चार हैं ?	నా బు ర ర లో వయా పా రం గురించి అనే క కొతత ఐ డి య ాలు వ సతు ంటే ఎలా ని దర పో గలను చెపపు ?	0.6416
और टर ै वि स ने कहा था कि उसे याद है	అలాగే పి సతా పె ం కు ల మీద ఎవరో పరి గె డు తు ండ గా	0.5785
तो तुमहारे पास मुझे रो क ने का कोई कारण नहीं है .	ననను ఆ ప డానికి నీకు ఎలా ంటి కారణ ం లేదు .	0.5487
- यह काफी बच का ना म कस द नहीं है ? - सही कहा .	- చెపప ాల ంటే అది చాలా బ ల హ ీ న మెన ఉదదేశం , కదా ? - నిజ మే .	0.5649
केवल एक ही इंसान है जिस का आ फ टर पार टी के द ौ रा न	ఆ ఫ టర పార టీ లో ఎవరూ తమ క థ లో పేరు ఎ తత ని	0.6301
यह ले आओ , कमी ने !	ఇది తీసుకు రా , ము ండా !	0.4897
हमें वह फु टे ज देखना होगा .	మనం వీ డి యో ని చూడ ాలి .	0.5457
यह का इ ल र कौन है ?	ఈ కె ల ర అనే వాడు ఎవరు ?	0.5446
ठीक है , बहुत हुआ . धनयवाद .	సరే , ఇక చ ాలు . థాంక స .	0.5747
इसलिए तुमहें कोई और कहानी बना नी थी .	కాబటటి ఒక క థ ను అ లలా వు , బ ే బీ .	0.5628
कया वह मेरी बेटी है ?	ఆమె నా కూ తు రే నా ?	0.5048
अ नी क , मुझे पता है कि तुमहारे लिए	య నిక , జరిగి న విష యానని జో యి ఇంకా గరేస లకు	0.5414
{ \ an8 } एक साल बाद	{ \ an8 } ఒక ఏ డా ది తరవాత	0.5763
डे वि ल स टर म पे ट . मैंने केवल इतना सुना है कि उसका इस ते माल न शा करने के लिए किया जाता है .	డె వి లస ట రం పె ట . దానిని మ తతు ప దా రథ ంగా మాతరమే వా డ తారు అని నేను వి ననాను .	0.6397
और जो श और रो मा ंस से भ री जिंदगी .	ఉ త సా హ ంతో అలాగే ర ొ మా నస తో ని ండి న జీవితం .	0.5212
. . . त िर सक ृ त और गु स से में .	. . . తి రస కరి ంచ బడి కో ప ంతో వెళళ ా వు .	0.6670
उनहोंने गलत गि ला स उठा या	ఆయన మర ొక గ లా సు ను తీసు కుననా డు ,	0.5203
और अ ती त को भूल ने के नाम .	అలాగే గ తా నని మర చి పో వడానికి .	0.5116
कृपया एक रो जे देना और मेरे पति के लिए एक वह ि स की .	ఒక ర ొ సె ఇవ వు , అలాగే నా భ ర త కు ఒక వి స కీ .	0.6446
और कोई नहीं ब जाएगा ?	ఎవ రికీ న చచ లేదా ?	0.4529
एक हतया हुई है .	ఒక వయకతి చని పోయా డు .	0.4635
कयोंकि अगर हम सही हैं , तो जब एडगर को बि ंग पसंद नहीं आया . . .	ఎందుకంటే మా అ ంచ నా క రె క టు అయితే , ఎడ గర ఆ బి ంగ ఐ స న చచ లేదు అని చెపపి న తరవాత . . .	0.6065
" नहीं " या नी " नहीं ! मैं तुमहें पर ो पो ज करने वाला था ! "	" సమ స యే లేదు " అంటే , " సమ స యే లేదు ! నేనే నినను అడుగు దాం అనుకుంటుననా ! "	0.6141
बस . . . कुछ तो होगा जो हम च ूक गए हैं .	ఇకకడ . . . మేము మి స అయి ంది ఏదో ఒకటి ఉ ండి ఉండాలి .	0.5699
कया तुम सारे कं प यू टर कॉ इन बे च ने में काम या ब हुए ?	నువవు ఆ కం ప యూ టర కా యి నస అన నీ అమ మే శా వా ?	0.6536
वर ना मैं तुम सभी को कान ून के काम में द ख ल देने के आ रो प में गिर फ तार कर ल ूँगा .	లే ద ంటే నయాయ పర కరి య కు అడ డు పడ డా రు అని మీ అంద రి నీ అ రె సట ు చేసతా .	0.6530
बस आपको उन फ ूल ों से चा य बना नी थी .	నువవు చేయ ాల సి ంద లలా చి కక గా టీ కా య డం మాతరమే .	0.5724
शायद इसलिए कयोंकि जब कि तुम दो ढ ों गी डि टे क टि व बन ने का ढ ों ग कर रहे थे , अस ली पुलिस वाले . . .	బహుశా మీ రి దద రూ పో జు కొ డు తూ డి టె క టి వ ఆట ఆ డు తు ండ గా నిజ మెన పోలీసు లు . . .	0.6944
अ नी क ? नहीं . अ नी क मेरा सबसे अचछा दोसत है . मुझे पता है कि उसने यह नहीं किया .	య నిక ? లేదు , య నిక నా బె సట ఫ రెండ . వాడు చేయ లే దని నాకు తెలుసు .	0.6129
तो फिर वह मुझे दो .	అయితే దానిని నాకు ఇవ వు .	0.4881
मैं पूरा स पता हा ंत तुमहारे मा ता - पिता से अन ुम ति ले ने की कोशिश कर रहा था	నేను ఈ వా రా ంత ం అంతా మీ అమమా నానన లను అడుగు దాం అను కుననా ,	0.5691
नहीं , मैंने अपने हाथ ों से के त ली छु पा ई थी .	లేదు , నేనే దానిని స వయ ంగా దా చా ను .	0.5610
अ नी क , तुमहें सच में पता है कि हतया किस ने की , है न ?	య నిక , హ తయ చేసి ంది ఎవరో నీకు తెలుసు కదా ?	0.5885
सब के पास ज रि ए थे . सब के पास मौ के थे .	అంద రికీ ఆ స ౌ ల భ యం ఉంది . అంద రికీ ఆ అవకా శం ఉంది .	0.5946
हे भगवान !	దేవుడా !	0.3425
मैंने उस कु त ते को मार डा ला .	ఆ కు కక ని నేనే చం పా ను .	0.5900
तो आपने अपनी चा ल च ली .	కాబటటి నువవు పని మొద లె టట ా వు .	0.4969
इन पु ट . ए च डी ए म आई 3 . . .	ఇ న పు ట . హె చ . డి . ఎ మ . ఐ 3 . . .	0.7758
ठीक . . . यहाँ .	సరి గగా . . . ఇకకడ ే .	0.5975
बढिया है .	మంచిది .	0.3911
हम बाकी की जिंदगी साथ बि ता सकते थे .	మనం మన మి గి లి న జీవి త ాలు కలిసి గ డి పి ఉండే వా రం .	0.4912
सब के पास म कस द था .	అంద రికీ ఆ ఉదదేశం ఉంది .	0.4862
हाँ . पि त ृ त व टे सट .	అవును . పె టర ని టీ టె సట ు .	0.5669
सभी यहाँ आ जाओ . हमें कुछ चीज ों पर चर चा करनी है .	అందరూ ఇకకడికి రండి . మనం చ ర చి ంచుకో వాల సిన కొనని విషయ ాలు ఉననాయి .	0.5555
यह कोई अ गा था करि स टी वाली बकवास नहीं है .	ఇదే మి అ గా థ కరి స టి న వల క థ కాదు .	0.5533
हमें बस का इ ल र के एक वी डियो पर दोबारा नजर डाल नी होगी .	మేము కె ల ర తీ సిన ఒక వీ డి యో ని మళళీ చూడ ాలి .	0.5623
कोई बात नहीं .	ఏం పర లేదు .	0.3949
मेरा मतलब , शायद मुझे ह ल का सा शक हुआ था .	అంటే , చినన అను మా నం ఉంది అనుకో .	0.5260
कयोंकि गरेस बच गई है . तो , यह . . .	ఎందుకంటే గరేస కా పా డబ డి ంది . కాబటటి , అది . . .	0.5767
हाँ , मुझे भी .	అవును , నేను కూడా .	0.4515
मैंने इ सा बे ल ,	ఇ సా బె ల ని చూశా ను ,	0.5329
हाँ , मुझे भी .	అవును , నేను కూడా .	0.4515
इसलिए मैं अपना भा ष ण उसके सू ट के स में डाल ने के लिए उसके बे ड रू म में गई .	కాబటటి నేను నా మె యి డ - ఆ ఫ - హా న ర స పీ చ ని వాళళ సూ ట కేసు లో పెటట డానికి ఆమె బె డ రూ మ లోకి వెళళ ా ను .	0.6176
पर वि वि यन के ब यान में , पि त ृ त व टे सट का कोई जि कर नहीं है .	కానీ వి వి యన క థ లో నువవు అలా అడి గి న టటే లేదు .	0.5917
हमारे पास कोई सं दि ग ध नहीं है .	మేము అను మా ని తులు ఎవరో కని పెటట లేక పోయా ం .	0.5231
दिमाग में चल रही बातें समझ कर और हतया सु ल झा कर .	వాళళ కల ప న చి తర ాలను వి ంట ూ , హ తయ కేసు పరి ష కరి ంచడం చాలా బాగుంది .	0.5610
तुम इस बारे में काफी स ह ज ता से बोल रही हो .	నువవు ఈ విష యానని మ రీ సు లు వు గా తీసు కొ ని మాటలాడు తుననావు .	0.5459
और फै ंग के लिए भी गि ला स बना या और उस में डे वि ल स टर म पे ट डा ला .	వి స కీ పో సి , ఒక గ లా సు లో డె వి లస ట రం పె ట పో సా వు .	0.6510
और मैंने तुमसे इतने जु न ून के साथ पयार किया है	నా వె ర రి అనన ఎ పపటి కీ నీ మీద చూ ప లేని	0.5877
तुमहें ए ह सा स हो गया कि से बा सट ि यन ने तुमहें बार के पीछे ड रि ंक के साथ छे ड खा नी करते देखा था ,	ఈ హ ీ రో బా బు నువవు బా ర వె నుక గ లా సు తో ఆడ డం చూశా డు అని గ మని ంచి ఉంటా వు ,	0.6516
अब उसकी की मत मेरे बे चे दा म से तीन गु ना बढ गई है .	నేను అమ మి న పపటి కంటే ఇపపుడు దాని వి లు వ మూ డు రె టలు పె రిగి ంది .	0.6039
तुमहें पता चल गया कि हतया किस ने की ?	హ తయ ఎవరు చేశా రో కని పెటటా రా ?	0.5348
मैंने सच में सोचा था कि मैंने सारे सब ूत मि टा दि ए थे .	నా అడుగు జా డ లు క వర చేసు కుననాను అను కుననా .	0.5414
हे भगवान !	ఓ రి , దేవుడా !	0.3479
हे भगवान .	ఓ రి , దేవుడా .	0.3479
माफ करना , शे रि फ .	ఏమ ండి , ష రీ ఫ .	0.5180
सही कहा .	అవును .	0.4165
हे भगवान .	ఓ రి , దేవుడా .	0.3479
हम बरा उ नी खा कर न शे में ध ु त थे और मैं घ बरा ने लगी थी .	మేము కొనని బర ౌ నీ లు తి ని బాగా ని ష ాలో ఉనన పపుడు నేను భయ పడ డం మొద లె టట ా ను .	0.6115
नहीं , वह अफ े यर नहीं .	కాదు , అది కాదు .	0.3553
वह पया रा है .	అతను దయ గల మనిషి .	0.4806
कया लगता है मैंने के त ली और गर म पा नी की वय व स था कब की होगी ?	నేను ఈ టీ కా య డానికి గి నన ె అలాగే వే డి నీ ళలు ఎ పపుడు తీసు కుననాను అనుకుంటుననా రు ?	0.5575
तुमने उस बार में फै ंग की ड रि ंक में ज हर मिला कर उसे दिया	నువవు బా ర దగగర ఫె ంగ డ రి ంక లో విష ం కలి పా వు , ఆ తరవాత దానిని అతనికి ఇ చచా వు ,	0.5880
सही कहा .	అవును .	0.4165
कया ? कया तुम नहीं चाहते . . .	ఏంటి ? నీకు పె ళ లి . . .	0.5796
- बहुत खू ब . - यह त य रहा .	- అత య ద భు తం . - డీ ల .	0.6873
हाँ . सारे अ भ ि ने ता - अ भ ि ने तरी इतने बेह तरी न हैं .	అవును . క యా స టి ంగ చాలా బాగా చేశారు .	0.5331
यह एडगर के बारे में नहीं है .	ఇది ఎడ గర ని చం ప డానికి చేయ లేదు .	0.5136
और कया जरू री है और मैं अपनी बाकी की जिंदगी में कया चाहती हूँ .	నాకు ఏ ది ముఖ యం అలాగే నా మి గి లి న జీవితం అంతా నాకు ఏం కావాల నే ది పు న ః పరి శ ీ లి ంచు కుననా .	0.5262
डै नर ने ज ली ल वा इट से स गा ई की ?	డా న ర కి జ లీ ల వె ట తో ని శ చి తా రథ ం అయ యి ందా ?	0.6192
पर , जिंदगी छो टी है और . . .	కానీ , జీవితం చాలా చినన ది అలాగే . . .	0.5240
सब ठीक है , की मो सा बे ?	అంతా బాగానే ఉందా , కీ మో సా బ ే ?	0.4705
मुझे वे अ ंग ूठ ियाँ देख ने दो .	ఆ రి ంగ లు చూపి ంచండి .	0.4302
मुझसे शादी करो गे ?	ననను పె ళ లి చేసు కుంటా వా ?	0.4913
देख िए , आपको पकका नहीं पता कि गरेस ने ही हतया की .	చూడ ండి , ఈ పని చేసి ంది గరే సే అని ఖచచితంగా చెపప డానికి అవకా శ మే లేదు .	0.4922
तुमने हतया नहीं की .	నువవు చం ప లేదు .	0.4494
