Hindi	Telugu	Similarity_Score
हम बस यही सोच रहे थे कि वह कु त ता कहाँ गया . - हाँ , तो इसका जवाब मिल गया .	- మేము ఆ కు కక ఎ కకడికి పోయి ందా అనుకుంటుననా ం . - అవును , మాకు ఇక సమా ధా నం దొ రికి ంది .	0.6067
श नि वार रात को यू लि सी स यह सोच कर सो ने चला गया कि उसने फै ंग को ज हर दिया .	యూ లె సీ స శ ని వా రం రాతరి ఫె ంగ కి విష ం పెటటా ను అను కు ని ని దర పోయా డు .	0.6510
मुझे काफी स स ते में बे च ना प डा , पर मुझे हर ड ॉलर पर 6 2 स ें ट मिले .	చాలా హ డా వి డి లో అమమ ాల సి వచచింది , కానీ రూ పా యి కి 6 2 పె స లు వెన కకి వచచా యి .	0.6402
तुम कि ता ब कयों लि ख रही हो जब कि तुमहें दिमाग पढ ने में म हा रत हा सि ल है ?	నీకు ఈ మె ండ మూ వీ స మీద అంత ఇషటం ఉనన పపుడు , పు సత కం రా య డం ఎందుకు ?	0.6651
इसलिए तुमने न क ली पि त ृ त व टे सट का ब हा ना दिया .	కాబటటి నువవు ఈ ఉ తతు తతి పె టర ని టీ టె సట ు క థ అ లలా వు .	0.6445
तो गरेस ने अ ल मा री में के त ली को कयों छु पा या ?	అపపుడు వాళళ అ ల మార ాలో గరేస టీ పా య ఎందుకు దా సతుంది ?	0.6045
यह मजा किया नहीं है .	ఇదే ం సర దా గా లేదు .	0.5215
कयोंकि वह मेरी हतया करना चाहता था .	త నని తా నే చం పు కొ ని ఉండ ొ చచు అను కుననాను .	0.4745
उसे इससे न फ रत है .	దీ నికి ఇది న చచ లేదు .	0.5292
मैं क सी नो बन गया .	నేనే హ ౌ స ని అయ యా ను .	0.5119
मैंने तुम लोगों से कहा था कि मुझे ज ली ल वा इट बेहद पसंद है .	మీ అంద రికీ నాకు జ లీ ల వె ట అంటే ఇషటం అని చెపపా ను కదా .	0.6415
मैं बस कहना चाहती हूँ कि वह एक दु र घट ना थी .	ఇది కేవలం పరమా ద వ శా తతు జరిగింది అని చె పు తుననాను .	0.5654
- इ सा बे ल को लगा था कि हतया उस ी ने की थी . - कया ?	- ఇ సా బె ల తా నే హ తయ చేశా ను అను కు ంది . - ఏంటి ?	0.6594
और किसी ने जो ई को नहीं देखा .	కానీ ఎవరూ జో యి ని చూడ లేదు .	0.5739
यह बस बे तु का होता जा रहा है .	నేను ఇది నమమ లే కపో తుననాను .	0.5245
और मैं उसे कभी नहीं छोड ूँगी .	నేను ఆ య నని ఎ నన టి కీ వ ద లను .	0.5349
मैंने उसकी हतया नहीं की . किसी की हतया नहीं की .	నేను వాడిని చం ప లేదు . నేను ఎవరి నీ చం ప లేదు .	0.5240
{ \ an8 } और मैं नहीं चाहती थी कि वह बिना सु ल ह किए ह नी म ून पर च ली जाए .	{ \ an8 } అలాగే మేము సమా ధా న పడ కుండా వాళళు హ నీ మూ న కి వెళలి పో వడం నాకు ఇషటం లేదు .	0.6514
पता नहीं .	ఏ మో మరి .	0.3935
मैंने इतनी दूर आकर तुमहें नि रा श कर दिया .	నేను ఇ కకడి వర కు వచచి కూడా నినను ని రా శ పరి చా ను .	0.5567
आपको कैसे पता कि मैंने हतया नहीं की ?	హ తయ నేను చేయ లే దని మీ కె లా తెలుసు ?	0.5448
मैं . . .	నేను . . .	0.6413
हि म मत है तो मेरे सामने क हो .	ఆ మాట నా మొ హం మీద చెపపు .	0.5579
पर यह बच का ना है .	కానీ ఇది వె ర రి త నం .	0.4719
वह मेरी पार ट नर है .	ఆమె నా భా గ సవా మి .	0.4735
अचछा हुआ कि आपने जि कर किया ,	మీరు అడ గ డం త మా షా గా ఉంది ,	0.5586
- सच में ? - हाँ .	- నిజంగా ? - అవును .	0.5331
दरअसल , यह बेहद सर ल है . मैंने कभी नहीं सोचा था कि मैंने एडगर की हतया की .	అది నిజ ానికి చాలా సి ంపు ల విషయం . నేను ఎడ గర ని చం పా నని ఎ ను కో లేదు .	0.6173
कयोंकि तुमहें तुमहारी या त रा ओं से फ ूल ों का अचछा ज ञ ा न है .	ఎందుకంటే నీ పర యా ణ ాల కారణ ంగా నీకు ఆ పు వ వు ల గురించి అంతా తెలుసు .	0.6112
नहीं , टर ै वि स . मैंने सच में के त ली छु पा ई थी . - कया ? कयों ?	- కాదు , ట రా వి స . నేను నిజంగా నే టీ పా య ని దా చా ను . - ఏంటి ? ఎందుకు ?	0.6642
पर तुमहें यह पसंद नहीं आए गा .	కానీ అది చెప తే నీకు న చచ దు .	0.5594
देखो , फै ंग ने मुझसे कुछ कहा था .	విషయం ఏంట ంటే , ఫె ంగ ఇం దా క చెపపి న టటే ,	0.5694
मैंने अपनी रे डि ट से ना से ब यू से फै ला स में नि वे श करने को कहा था .	నేను నా రె డ డి ట సోద రు లతో బు సె ఫ లస ని కొ న మని చెపప డం వల లే .	0.6699
उसकी ड रि ंक में ज हर मिला या .	మ ద యం లో మాతర లు కలి పి ంది .	0.5829
जो ई , शक करने वाली सा ली .	జో యి , అను మా న ంతో ఉనన మర ద లు .	0.5757
तो , तुमहें लगता है कि मैंने एडगर की हतया की कयोंकि मुझे अ मी र लोगों से न फ रत है ?	అంటే నాకు ధన వం తులు ఇషటం లే న ందు వల లే నేను ఎడ గర ని చం పా ను అనుకుంటుననా రా ?	0.6316
हम और कया क हें ? हमने अभी - अभी माम ला सु ल झा लिया .	మేము ఇం కే ం చెపప గల ం ? మేము అదభు తంగా పరి ష కరి ంచా ం , బా బు .	0.6057
बस मुझे यह नहीं पता कि इसे कैसे सा बि त कर ूँ .	కానీ అది ని రూ పి ంచడం ఎలా గో తెలీ డం లేదు .	0.5968
मेरे और मेरे वय व सा य के साथ भी यही हुआ .	నాతో నా వయా పా రం గురించి కూడా అలాగే చెపపా వు .	0.5266
मैं बस यह भूल जा ऊँ गी और इंतजार कर ूँगी .	నేను అడి గి ంది వెన కకి తీసుకు ని ఎదు రు చూ సతాను .	0.5407
साल ों पहले , वि वि यन और यू लि सी स के बीच एक अफ े यर हुआ था .	వి వి యన ఇంకా యూ లె సీ స చాలా ఏ ళళ కరి తం అ కర మ సంబం ధం పెటటు కుననా రు .	0.6709
नि र ं तर तुम पर हतया का आ रो प लगा ने के लिए माफ ी चा हूँ गी .	ప దే ప దే నినను ని ంది ంచిన ందుకు కష మా ప ణ లు చెపప ాలి అనుకుంటుననా ను .	0.6006
और फिर मैं . . .	ఆ తరవాత నేను . . .	0.5812
कयोंकि मैंने उस कु त ते की मार डा ला .	ఎందుకంటే నేను ఆ కు కక ని చం పా ను .	0.5838
अब सभी के पास ज रि या था : है ना के ब गी चे के फ ूल .	ఇకకడ అంద రికీ ఆ స ౌ ల భ యం ఉంది : హ ననా తో ట లో ఉనన పు వ వు లు .	0.6754
- कया ? - कया हुआ ?	- ఏంటి ? - ఏంటి ?	0.4492
बस एक चीज है जो मुझे परे शान किए जा रही है .	నాకు ఇ బబంది కలి గి సతునన ఒక విషయం ఉంది .	0.5899
जान , अब तुमहें ढ ों ग करने की जरूरत नहीं है .	డా ర లి ంగ , నువవు ఇక న టి ంచ ాల సిన పని లేదు .	0.6240
{ \ an8 } कया कोई अंदर है ?	{ \ an8 } ఎవరెనా లోప ల ఉననా రా ?	0.6097
अरे , हाँ , मुझे याद है .	ఓహ , అవును , నాకు గుర తుంది .	0.5431
पर इस माम ले में , वह खास था और उसने दिल से किया था .	కానీ ఈ విషయం లో ఆమె స పె ష ల గా ఫీ ల అయి చేసి ంది .	0.5972
का इ ल र के शादी के फु टे ज	కె ల ర తీ సిన పె ళ లి వీ డి యో లు	0.5961
- ए ! - यह बेहद शान दार है !	- హేయ ! - ఇది భలే ఉంది !	0.5585
तुमहारा हतया रा पक डा गया , दोसत .	నీ హ ంత కు డిని పటటు కుననా ం , అనన .	0.5497
- इन पु ट पर द बा ओ , हाँ . - मैं वही कर रही हूँ .	- నువవు ఇ న పు ట లోకి వెళళ ాలి , అంతే . - అదే చేసతుననా .	0.6386
- नहीं . - हाँ .	- కాదు . - అవును .	0.5106
शायद वह इ सा बे ल के साथ मेरी गु पत कोशिश ों के बारे में बता रही है .	ఆమె నాకు , ఇ సా బె ల కు మధయ ఏ ర పడి న ర హ సయ దు ర ఘ టన గురించి మాటలాడు తుంది అను కు ంట .	0.6358
मैं यह कह रही हूँ कि ,	నేను ఏం చెప తుననాను అంటే ,	0.4185
मुझे जो ई और गरेस को सच चा ई बता ने को कहना कितना क ठ ि न था .	చెపప మని ననను అడ గ డం నీకు ఎంత ఇ బబంది గా ఉ ండి ఉ ంటు ందో నాకు తెలుసు .	0.6132
और मैं तुमहारे अ ला वा किसी के साथ भी हतया की गवा ह नहीं बन ना चा हूँ गी .	అలాగే ఒక హ తయ నే పరి ష కరి ంచ ాల సి వ సతే నీ తో తపప ఇం కె వరి తో నాకు ఆ పని చేయ ాలని లేదు .	0.5864
जब मैंने दरवा जा खो ला , तो यू लि सी स व हीं था	నేను తలు పు తె రి చి నపపుడు , యూ లె సీ స అకకడ ే ఉననాడు ,	0.6082
हम में से एक पर ो पो ज करके सर परा इ ज दे गा , ठीक है ?	మన లో ఒక రు సర పర ె జ గా పర పో జ చేయాలి , సరేనా ?	0.6454
- बढिया है . - बढिया है .	- మంచిది . - బాగుంది .	0.4992
पर मुझे लगता है कि यह सप ष ट है कि दु ल ह न ने ही हतया की .	కానీ నాకు ఈ పని చేసి ంది పె ళ లి కూ తు రే అని సప షట ంగా అనిపి సతోంది .	0.5973
जो दु ल ह न और म ृ तक के बा थ रू म की अ ल मा री में छु पा ई गई थी .	ఉనన గ ది బా త రూ మ అ ల మార ాలో దా చ బడి న ఒక టీ కా చే గి నన ె ను కను గొ ననా ం .	0.6988
वि वि यन , हमें जान ना है कया हुआ था .	వి వి యన , అకకడ ఏం జరిగి ందో మాకు చెపప ండి .	0.5616
सि वा ए जो ई के .	జో యి ఒక త తే తపప .	0.4500
मैंने नहीं . . .	అది నేను . . .	0.6035
जो मेरा बेवकूफ भाई कभी महसूस नहीं कर सकता है .	ఘ ా డ మెన ఇష ట ంతో నినను ఎంత గా నో పరే మి ంచా ను .	0.5666
{ \ an8 } इस तरफ .	{ \ an8 } ఇ టు రండి .	0.5899
और सभी के पास मौ के थे , कयोंकि सभी आ फ टर - पार टी में मौ जू द थे .	అలాగే అంద రికీ అవకా శం కూడా ఉంది , ఎందుకంటే అందరూ ఆ ఫ టర పార టీ లో ఉననారు .	0.6209
तो तुमने हमें बताया कि तुमने वि वि यन से इस बारे में पूछ ा था ,	కాబటటి నువవు మా తో వి వి యన ని ఆ విషయం అడి గా ను అననా వు ,	0.5960
आपको अपना टर क वापस ले ने के लिए कि तने पैसे चाहिए थे ?	నీ టర క ని వెన కకి తీసుకో వడానికి నీకు ఎంత డబబు కావాలి అననా వు ?	0.5661
बेहतर भ वि ष य के नाम .	మె రు గె న భ విష యత తు కోసం .	0.5843
मुझे नहीं लगता कि उसे शादी में दिल च स पी होगी .	ఇపపుడు ఆమె కు పె ళ లి అంటే న చచు తు ందో లే దో తెలీ డం లేదు .	0.5925
कया तुम मुझसे शादी करो गे ?	ననను పె ళ లి చేసు కుంటా వా ?	0.5640
कया तुम मुझसे शादी करो गी ?	ననను పె ళ లి చేసు కుంటా వా ?	0.5509
और इसलिए कयोंकि मैं गरेस से पयार करती हूँ . और मैंने तुम लोगों को सा री बातें नहीं बता ई ं .	అ ందుకు కారణ ం నేను గరేస తో పరే మ లో ఉండ డ మే . అలాగే నేను మీకు క థ మొతత ం చెపప లేదు .	0.6285
पर मैं भाग - भाग कर थ क चुका हूँ .	కానీ నేను ఇక పరి గె తత లేను .	0.5131
मैं गरेस का पिता हो सकता हूँ .	నేను గరేస త ండ రి ని కా వచచు .	0.5438
मैं तुमहारा सा थी बन सकता हूँ .	నేను నీకు తో డు గా ఉండ గలను .	0.5430
कया ? तुमहारे पास कोई सं दि ग ध नहीं है ?	ఏంటి ? అను మా ని తు లను కని పెటట లేదా ?	0.6081
तो मेरे व की ल तुम पर मु क द मा कर देंगे .	సరే , మా లా య ర లే నీ తో మాటలాడ తారు .	0.5847
पर इन सब में से एक के पास सबसे बडा म कस द था .	కానీ అంద రి కంటే బ ల మెన ఉదదేశం ఉనన వయకతి ఒక రు ఉననారు .	0.5772
मुझे लगता है कि फै ंग ने गलती से एडगर के साथ गि ला स बद ला .	ఫె ంగ అనుకో కుండా ఎడ గర గ లా సు ను తీసు కుననా డు అని నేను అనుకుంటుననా ను .	0.5659
अगर आप पि त ृ त व टे सट कर रहे थे , तो आप गलत गि ला स का इस ते माल कर रहे थे .	నువవు పె టర ని టీ టె సట ు చేయాలి అను కు ంటే అ ందుకు నువవు ఎ ంచు కునన గ లా సు త పపుడు గ లా సు .	0.6060
. . . जो कि मुझे अजीब लगा कयोंकि यह कैसे पसंद नहीं आ सकता है , समझ े ?	. . . నా కె తే అది నమమ శ క య ంగా లేదు , ఎందుకంటే అది న చచ ని వారు ఎవరు ఉంటా రు , చెపప ండి ?	0.6395
- तुमसे मिल कर खुशी हुई . - हाँ .	- మిమమలని కల వడం చాలా సంతోష ం . - సరే .	0.6100
मुझे लगा था कि उसने गलती से खुद की हतया की	వా డే ననను చం ప ాలి అనుకుంటుననా డు కాబటటి పరమా ద వ శా తతు	0.5322
ठीक है . जो ई ने हतया नहीं की .	సరే . జో యి ఆ పని చేయ లేదు .	0.5754
और तुम स फ ल नहीं हो गे .	నీ ప లా న పని చేయ దు .	0.5844
है ना , पयार में त ड प ने वाली बहन .	హ ననా , పరే మ కోసం వె ం పర లా డు తునన చె లలి .	0.6121
ए . नहीं . . .	హేయ . లేదు . . .	0.6483
धनयवाद .	థాంక స .	0.3387
हे भगवान , चलो भी . वैसे भी किसी को उसकी पर वाह नहीं थी .	ఓ రి , దేవుడా , ఊ రు కో ండి . అయి నా ఎవరూ ఆ చా వు ను ప టటి ంచుకో లేదు కూడా .	0.5929
मुझे बताओ कौन सा वी डियो देखना है . मैं फोन पर खो ल ल ूँगी .	ఏ వీ డి యో కావాల ో చెపపు . నేను ఫోన లో ప లే చేసతాను .	0.5917
कि तुम कल रात आ फ टर - पार टी के द ौ रा न कया कर रही थी .	ఏం చేశా వో తెలుసు కో వాలి అనుకుంటుననా ం అంతే .	0.4830
मैं तुमहें तुमहारा काम नहीं समझ ा ना चाहती ,	మీ పని ని ఎలా చేయ ాలో మీకు చెపప ాలని అనుకో వడం లేదు ,	0.5051
{ \ an8 } तो , आप अपने कै ं प सा इट वापस लौ टे . . .	{ \ an8 } కాబటటి , నువవు నీ క యా ం ప ఉనన పర దే శా నికి . . .	0.7369
मैं यू लि सी स से अके ले में बात करने गई थी .	నేను పర ె వే టు గా యూ లె సీ స తో మాటలాడ డానికి వెళ లా ను .	0.5851
एडगर ने वही देखा था .	ఎడ గర చూ సింది అదే .	0.5308
मैं यह नहीं कर सकता .	నేను ఇది చేయ లేను .	0.4109
तुमने आ फ टर - पार टी में अपने लिए गि ला स में वह ि स की डा ली	ఆ ఫ టర - పార టీ లో నువవు నీ కోసం ఒక గ లా సు , అలాగే ఫె ంగ కోసం ఒక గ లా సు	0.6479
और रॉ कस ै ना ने भी .	రో క సా న కూడా తా గి ంది .	0.4870
पूरी रात ज गा रहा .	రాత రం తా లే చే ఉననాను .	0.4574
गरेस को बचा ने के लिए हम तुमहारा शुकरिया अ दा करना चाहते हैं .	గరేస ని కా పా డి న ందుకు నీకు థాంక స చెపప ాలి అనుకుంటుననా ం .	0.5886
पता नहीं आप यह जानते हैं या नहीं .	మీకు తెలు సతు ందో లే దో తెలీదు .	0.4611
आपको लोगों को विश वास दि ला ने के लिए बस एक क यू - टि प और जि प लॉ क बै ग चाहिए था .	ఒక చె వు లో తి పపు కునే పు లల అలాగే ప లా స టి క క వర ఉంటే చ ాలు నీ క థ కు .	0.6681
- अब मैं ह ॉ ली व ु ड का हि ससा हूँ . - ठीक है .	- ఇపపుడు నేను హ ాల ీ వు డ పిలల ని . - సరే .	0.6624
{ \ an8 } द जो ई	{ \ an8 } ది జో యి	0.6262
धत , तुम सब के एक - दूसरे के साथ अफ े यर हैं .	అమమ బా బో య , మీ రం తా మా మూ లో ళలు కాదు .	0.6034
तो उसे हा सि ल करने का इ कल ौ ता रा सता था , फै ंग को खतम करना .	కాబటటి ఆమె తో ఉండాలి అంటే , అ ందుకు అత నని ఇకకడ లే కుండా చేయ డ మే మా రగ ం .	0.5791
तुम कभी कोई सा मान य चीज नहीं करती ?	నువవు ఎపపుడూ ఇలా వి ంత గా ఏదో క టి చేసతా వా ?	0.5129
टर ै वि स , ई र ष या ल ु पू र व - परे मी .	ట రా వి స , అస ూ య తో ఉనన మా జీ పరి యు డు .	0.7077
कया तुम अभी पर ो पो ज करने वाली हो ?	నువవు ఇపపుడు పర పో జ చేసతా వా ?	0.5516
बेहद भ द दा कु त ता है .	ప నికి మ ాలి న కు కక .	0.5734
कयोंकि उनकी अचछी दोसत , इ सा बे ल मिन ो ज ने उनहें ऐसा करने को कहा . "	చెపపి ంది అనన కారణ ంగా అవ ననీ ప టటి ంచుకో లేదు " అనే అంటా రు .	0.5742
माफ करना . मुझे ए ह सा स नहीं हुआ कि तुमने पूरी यो जना बना कर रख ी थी .	కషమించు . నీకు ఇంత పెదద ప లా న ఉ ందని నేను గర హి ంచ లేక పోయా .	0.6270
