Hindi	Telugu	Similarity_Score
एक सा मान य इंसान की तरह ट यू ब पक ड कर घर जाने के ब जा य . . .	మె ట రో రె లు లో మా మూ లు మనిషి లా ఇంటికి వెళ లే బ దు లు . . .	0.6368
समझ आ रहा है ? ओ य !	నీకు అరథ మె ందా ? ఓ య !	0.6057
और फिर वह तुमहारी आवा ज सुन सक ें गी .	ఆ తరువాత ఆమె నీ గొ ం తు విన గ లు గు తుంది .	0.5751
वह सच है , डै निय ल .	అది నిజం , డా నియ ె ల .	0.5290
आप हमारी कोई मदद नहीं कर रही हैं .	మాకు సాయం చేయ డానికి మీరు ఏమీ చేయ రు .	0.4290
पर अगर ऐसा करने से तुम मुझ पर थोडा भरो सा करते हो ,	కానీ దీని వలల నాకు కొ ద ది గా వె సు లు బా టు ఇవవ గ లి గి తే ,	0.5714
हाँ ? 0 1 6 3 2 . . .	అవునా ? 0 1 6 3 2 . . .	0.8809
ठीक है , जरा रुको .	సరే , అలాగే ఉ ండు .	0.5489
- हमारे पास समय नहीं है . - हम एक दूसरे के स ह यो गी हैं .	- మాకు సమయం మి ంచి పోయింది . - మనం మి తర దే శ ాల వాళల ం .	0.6474
ए रि का , यह डै निय ल हैं . मैं चाहती हूँ सं दि ग ध आई डी का पता लगा ने में यह हमारी मदद करें .	ఎ రి కా , ఇ త ని పేరు డా నియ ె ల . అను మా ని తు లని గుర తి ంచ డానికి త నని మన తో చే ర మని అడి గా ను .	0.6532
रो मा निया ई ए टी सी .	ర ొ మే ని యన ఎ టి సి .	0.4428
- फिर बाद में मिल ते हैं . - ठीक है .	- అయితే తరువాత కలు దదాం . - సరే .	0.5085
नहीं , सुनो , आप बस मेरी बात सुनो .	లేదు , వి ను , ముందు నా మాట వి ను .	0.5738
इसे ऑ क सी जन नहीं मिल पा रही है .	ఇ త నికి ఆ క సి జ న అంద డం కష ట ంగా ఉంది .	0.5962
हमें किसी चीज से इसकी छा ती में छे द करना होगा .	అతని గు ండ ె లోకి పం పి ంచ డానికి ఏదెనా పరి క రం కావాలి .	0.5185
ए 7 ए ए न आई बु का रे सट	ఎ 7 ఎ ఎ న ఐ బు కా రె సట	0.6761
मैं बस अपनी पहुँच से बाहर की चीजें देख रही हूँ .	నేను కొ న లేని వ సతు వు లని ఊ రి కే అలా చూ సతుననాను .	0.5668
तो , पी ए म और उनका बेटा व हा इट मा उ ं टे न स से अपने हो ट ल की तरफ वापस जा रहे हैं .	సరే , పర ధా ని ఇంకా ఆమె కు మా రు డు వె ట మ ౌ ంటే నస నుండి వాళల హో టల కి తిరిగి వ సతుననారు .	0.6771
कया मैं उस बं दे को अपनी बात समझ ा सकता हूँ जो तुमहारा सर दार है ?	ఎవరు ఇ న ఛ ా ర జ గా ఉననా రో ఆ కు ర రా డి కి నేను ఒక సారి వి వరి ంచాలి .	0.6110
तब से हमें यहाँ से निकल ने का समय नहीं मिला है .	అ పపటి నుండి మేము క దల డానికి సమయం లేక పోయింది .	0.5584
मैंने कहा था , " इस बार मैं तैयार नहीं हूँ . "	నేను చెపపా ను , " ఈ ప నికి నేను సిదధ ంగా లేను " అని .	0.5741
और बस मुझे यहाँ से आ जा द कर दो .	ననను మా తరం బయటకు వచచే లా చేయి .	0.5310
यह देखो , फ रे ड .	ఇది చూడు , ఫ రె డ .	0.6082
मुझे थोडा अचछा नहीं लग रहा है .	అంటే , నాకు ఆ రో గ యం బాగా లేదు .	0.5284
हाँ . नंबर कोई दूस रा था , लेकिन उस में सै म किसी और आदमी से बात कर रहा था .	అవును . అది వే రే నె ం బ రు నుండి వచచింది , కానీ సా మ మర ొక వయకతి తో మాటలాడు తుననా డు .	0.6234
मुझे उममीद है हम जलदी ही बात करेंगे .	నేను ఆమె తో మాటలాడ ాలి అనుకుంటుననా ను .	0.5202
- तुम डॉ क टर नहीं हो . - यहाँ कोई डॉ क टर नहीं है ,	- నువవు డా క టర వి కాదు . - ఎవరూ డా క టర కాదు ,	0.6223
तुम मेरी तर की ब ें जान ना चाहते हो ? मेरी यो जना ?	నా వయ ూ హ ాలు తెలుసు కుంటా వా ? నా ప లా న చెపప నా ?	0.6116
हम बु का रे सट नहीं जा रहे हैं . बु का रे सट की चिंता मत करो .	మనం బు కా రె సట కి వెళల డం లేదు . బు కా రె సట గురించి ఆ ందో ళ న పడ కు .	0.6439
क हो कि हम रो मा निया ई नहीं हैं .	మనం ర ొ మే ని యన ల ం కా దని చెపపు .	0.5637
इन के साथ किसी ने कुछ किया है ?	ఎవరెనా వీ టి ని ఏమెనా చేశా రా ?	0.4851
जिन लोगों के इ शा रे पर यह हो रहा है , उनहोंने हर चीज की तै या री की है .	ఇలా చేయ మని ఎవరు ఆ దే శి ంచా రో , వాళల కి ఖచచితంగా పరతి దాని కీ ఒక ప లా న ఉంటుంది .	0.6130
रो मा निया ई ग ृ ह म ंत री बार - बार फोन कर रहे हैं .	ర ొ మే ని యన హో మ మ ంత రి చాలా సా రలు ఫోన చేశారు .	0.6040
तो हम कार र वाई करने के लिए म जब ूर हो जाएँगे .	మేము తపప ని సరి గా చ రయ తీసుకో వల సి ఉంటుంది .	0.6074
हाँ ? 9 6 0 4 8 7 ?	అవునా ? 9 6 0 4 8 7 ?	0.8656
आप बस यह याद रख ना कि मैं आप से पयार करता हूँ . ठीक है ?	నేను నినను పరే మి సతుననా నని నువవు తెలుసు కు ంటే చ ాలు . సరేనా ?	0.5203
उ ध र मु ँ ह करो .	వెన కకి తి రుగు .	0.4917
- मैं तुमहें मर ने नहीं दे सकता . - तुम बातें करना बंद करो .	- నేను అలా చూ సతూ ఊ రు కో ను . - నువవు మాటలాడ టం ఆ పే య ాలి .	0.6334
- डै ड मर चु के हैं . - यह सुन कर अफ सो स हुआ .	- నానన చని పోయా డు . - అది విన డం బాధ గా ఉంది .	0.6673
उ त साह में ऐसा ही होता है .	అయితే ఏదెనా కొ నా ల నే ఉ త సా హం .	0.4971
. . . 1 6 3 2 . हाँ ? 9 6 0 4 8 7 ?	. . . 1 6 3 2 . చెపపు ? 9 6 0 4 8 7 ?	0.9375
और मैंने मै से ज आगे भेज दिया है .	నేను వాటి ని వాళల కి పం పి ంచా ను .	0.5853
अपने परिवार के पास , ठीक है ? उन लोगों के पास जिन से तुम पयार करते हो .	నీ కుటుం బం దగగర కి వెళ తా వు , అవునా ? నువవు పరే మి ంచే మను ష ు ల దగగర కి వెళ తా వు .	0.6060
इसके लिए यो जना तैयार होगी .	దీ నికి ఒక వయ ూ హం ఉంటుంది .	0.5540
- वह मेरी . . . - ठीक है .	- ఆమె నా . . . - సరే అయితే .	0.6775
मैं बचचे को सक ूल छोड ती हूँ , लं च के लिए स सता खाना ख री द ती हूँ	మా పా పని స కూ లు కి పం పి సతాను , నా మ ధ యా హ నం భ ో జ నం కోసం ఆ ఫ రలు చూ సతాను ,	0.6600
यह अपनी पूरी कोशिश करे गा . है ना , दोसत ?	వీ డు దీ నని బాగా చేసతా డు . కదా , బా బు ?	0.5927
- तुमहें यह बात कैसे पता च ली ? - मुझे विमान से एक मै से ज मिला है .	- నీకు ఎలా తెలి సింది ? - నాకు ఆ విమానం నుండి మె సే జ వచచింది .	0.6277
इसका दिमाग यहीं जाता है . सच में , इस ने सबसे पहले यही सोचा .	అతని ఆలోచ న ల ననీ అలాగే ఉంటా యి . నిజ ా యి తీ గా , ఇదే అతని మొదటి ఆలోచ న .	0.5651
एक आदमी को यहाँ थोडी मदद चाहिए , पलीज !	ఒక మనిషి కి ఇకకడ సాయం కావాలి , పలీజ !	0.4772
- इन हें देख ने दो जे ट विमान चले गए हैं . - मेरी बात सुनो . उनहें मत खो लो !	- యు దధ విమా నాలు వెళలి పోయా య ని వాళ లని చూడ నివ వు . - నా మాట విన ండి . వాటి మూ య ండి !	0.6439
- मुझे नहीं पता मै से ज कैसे भेज ते हैं . - मैं बता ता हूँ कैसे भेज ते हैं .	- నాకు అది ఎలా పం ప ాలో తెలియదు . - అది ఎలా చేయ ాలో నేను చెబు తాను .	0.5972
और तुम कह रही थीं कि वह समझ ौ ता करने में अचछा है .	అతను మాట లతో మంచి గా ఒ పప ి సతా డని నువవే చెపపా వు .	0.6098
अभी तो हैं .	పర సతు తా నికి .	0.4377
कया हुआ था ?	ఏం జరిగింది ?	0.4186
ऐसा होने पर हमें इन हें अन देखा करना है . हमने ऐसा ही कहा .	ఇది గ నుక జరిగి తే , వాళ లని మనం ప టటి ంచుకో వదదు . మేము అదే చెపపా ం .	0.5890
ठीक है . हाँ .	సరే . అలాగే .	0.4579
उन में से कुछ भी आपकी वजह से नहीं हुआ था . ठीक है ?	వాటి లలో దే ని కీ కూడా నువవు కారణ ం కాదు . సరేనా ?	0.5973
चार घं टे से भी कम समय बाकी है .	నాలు గు గంట లలో పే చే రు కు ంటుంది .	0.5713
- तुमहें एक डॉ क टर की जरूरत है . - अपनी सला ह अपने पास रख ो .	- నీకు ఒక డా క టర అవసరం ఉంది . - నినను ఎవరూ అడ గ డం లేదు .	0.6867
- तुम ऐसा करो गे , है ना ? - हाँ , बिलकुल कर ूँगा .	- నువవు ఆ పని చేసతా వు , కదా ? - అవును , అది నిజం .	0.6700
- हमने सब संभा ला हुआ था . - ठीक है .	- మనం వాళ లని అ దు పు లో పెటటా ం . - సరే .	0.6627
आप ख री द दा री करते हैं .	నువవు ఏమెనా కొ ంటుననా వా ?	0.4697
हाँ . लेकिन , जब यह सब शुरू हुआ , हम यहीं थे .	అవును . అంటే , అది మొద లె నపపుడు మేము ఇకకడ ే ఉననా ం .	0.5816
तुमहें किसी ने ला त नहीं मा री है . कुछ घ ों पा है .	నినను ఎవరూ త నన లేదు . నినను క తతి తో పొ డి చా రు .	0.6249
जरा सुनो . कया मैं तुमसे बात कर सकता हूँ , पलीज ?	ఎ కస క యూ జ మీ . నీ తో ఒక సారి మాటలాడ వచచా , పలీజ ?	0.6223
अगर मेरी जगह आप होती ं , तो आप भी यही करती ं .	నా సథా నం లో ఉంటే , మీరు కూడా ఇదే వి ధ ంగా చేసతా రు .	0.5033
डै निय ल ओ फै रे ल हो मी सा इ ड डि टे क टि व	డా నియ ె ల ఓ ఫా రె ల హ త యా నే రాల డి టె క టి వ	0.6409
और फिर वह तुमहारी आवा ज सुन सक ें गी .	ఆ తరువాత ఆమె నీ గొ ం తు వి ంటుంది .	0.5441
- तुम स सता खाना ख री द ती हो ? - हा ला त अचछे नहीं हैं . तुम जानती हो , है ना ?	- నీకు భ ో జ నం ఆ ఫ రలు ఉననా యా ? - అవి బాగు ండ వు . ఆ విషయం నీకు తెలుసు , కదా ?	0.7004
मुझसे अभी कहा गया है कि आपके पास वापस अपनी सी ट ों पर जाने के लिए दस से क ंड हैं .	మీ సీ ట లలో కూ రచ ో వడానికి మీకు ప ది సె క నలు మాతరమే సమయం ఉ ందని నాకు చెపపా రు .	0.6577
यह सब करने के लिए यह जगह सही नहीं है , है ना ?	ఈ వయ వ హా రా నికి ఇది స రెన పర దేశం కాదు , కదా ?	0.6061
तुम इन भ ले वय क ति से कया क हो गे ?	ఆ మంచి మనిషి కి నువవు ఏం చెబు తా వు ?	0.5774
यह अचछी बात है , है ना ?	అది మంచి విషయం , కదా ?	0.5270
बेटी ना , मेरी बात सुनो .	బె టీ నా , నా మాట వి ను .	0.4884
ब ग दा द इ रा क	బా గ దా ద ఇ రా క	0.4964
सुनो . तुमने अचछा किया . ठीक है ?	ఇలా చూడు . నువవు బాగు ననా వు . సరేనా ?	0.5951
काम हो गया .	ఇ దీ విషయం .	0.4556
पता नहीं . कया फर क पडता है ?	నాకు తెలియదు . ఏంటి విషయం ?	0.4639
मैं बस घर जाना चाहता हूँ और अपने परिवार से मिल ना चाहता हूँ .	నాకు కేవలం మా ఇంటికి వెళలి , నా కుటుం బా నని చూడ ాలని ఉంది .	0.5461
ठीक है ? तुमहारी कोई , मतलब , गर ल फर ें ड है ?	సరేనా ? నీకు ఎవరెనా , అంటే , గర ల ఫ రెండ ఉననా రా ?	0.6337
मि से ज ए चि सन , आपने हमें ऐसी कोई वजह नहीं दी है जिस से यह लगे	మి సె స ఐ ట చి స న , ఈ మను ష ు లు మా దే శా నికి ము పపు తీసుకు రా రని చెపప డానికి	0.6109
नहीं ? हे ! दोसत हैं ? सा थी हैं ?	లేదా ? హేయ ! పో నీ ఫ రెండ స ? మి తరు లు ?	0.6009
मतलब , मुझे चो ट लगी है और . . .	చూడు , నాకు గా యం అయి ంది ఇంకా . . .	0.6074
हमें रो मा निया या बु का रे सट या उन में से किसी से भी	మాకు ర ొ మే ని యా తో ఎలా ంటి సంబం ధం లేదా సమసయ లేదు ,	0.6068
वे गु रु वार या उसके बाद वाले सो म वार के लिए कह रहे हैं .	వాళలు గు రు వా రం లేదా తరువాత సో మ వా రం అడుగు తుననారు .	0.5702
हमें कुछ नहीं होगा .	మనం సు ర కషి తంగా ఉంటా ం .	0.4743
ब रि टे न ने टो का हि ससा है . वे हमारी तरफ हैं .	బ రి టన నా టో దేశం . వాళలు మన ప కష ం ఉననారు .	0.6233
अपनी जगह से हि ल ना मत .	కొ ద ది గా కూడా క ద లకు .	0.5298
कोई बात नहीं करे गा . हम से उल झ ने की कोशिश मत करो !	మీరు వాళ లకు ఎలా ంటి స ందే శ ాలు ఇవ వదదు . నాతో ఆ టలు ఆడ దదు !	0.5968
यही कि यह सच में हो रहा है और इसका ने त ृ त व आप कर रही हैं .	అంటే , ఇది వా సత వ సమసయ అని ఇంకా మీరు సా రథ యం వ హి సతుననా రని చెపపా ం .	0.6113
या , बहुत म ुम किन है , एक सै न य विमान है .	లేదా , పర ధా న ంగా , మి ల ట రీ విమానం అయి ఉండ చచు .	0.6399
हाँ . मैं तुमहारा फोन निकाल ता हूँ , ठीक है ?	సరే . నీ కోసం నీ ఫోన తీసు కుంటా , సరేనా ?	0.5448
कि ंग डम 2 - 9 , आप सुन रहे हैं ?	కి ంగ డ మ 2 - 9 , మీకు వి ని పి స తో ందా ?	0.6173
ये कुछ नहीं कर सकते .	వాళలు ఏమీ చేయ లే రు .	0.5300
सु नि ए . . .	వి ను . . .	0.7010
दो मिनट . ह थ िया र छोड ने की पु ष टि की गई है .	రెండు నిమిష ాలు . ఆ యు ధ ాల వి డు దల ఖ రా రు .	0.6533
शुकरिया . हाँ . सि ंक ले यर रो ड .	ధనయవాదాలు . సరే . సి ంక లె యి ర రో డ .	0.6131
और उनहोंने कुछ नाम ों का जि कर किया और एक फोन नंबर का जि कर किया .	ఇంకా వాళలు కొనని పే రలు పర సతా వి ంచారు , ఇంకా ఒక ఫోన నె ం బ రు కూడా చెపపా రు .	0.5614
हर बे टे को उसकी माँ की जरूरत होती है , है ना ?	పరతి కొ డు కు కీ తన తల లి పరే మ కావాలి , అవునా ?	0.6275
- प ते की ? - मेरे पास आपका पता , फ लै ट नंबर 3 0 , बर वि क हा उस है .	- చి రు నా మా ? - ఇకకడ ఫ లా ట 3 0 , బె ర వి క హ ౌ స అని రా సి ఉంది .	0.7431
यह ए टी सी बु का रे सट से ला इ व स करी न है .	ఏ టి సి బు కా రె సట నుండి ఇది పర తయ కష పర సా రం .	0.6441
पीछे वाली सी ट पर जाओ . पीछे वाली सी ट पर .	ఆ సీ టు వెన కకి వెళ లు . ఆ సీ టు వెన కకి .	0.5410
हमें लेकर समझ दा री से काम ले ने के लिए , शुकरिया कह ने के त ौर पर .	మన విషయం లో మంచి గా ఉ ంటు నన ందుకు క ృ త జ ఞ త గా ఒక కా నుక ఇ ద దా మని అనుకుంటుననా .	0.6148
" माँ " ? हाँ ? 0 1 6 3 2 9 6 0 4 8 7 ?	" అమమా " ? చెపపు ? 0 1 6 3 2 9 6 0 4 8 7 ?	0.8836
- और मुझे माफ कर दो . - तुमने मुझे कुछ बताया कयों नहीं ?	- కానీ నేను సా రీ చెబు తుననాను . - నువవు ఎందుకు ఏమీ చెపప లేదు ?	0.5835
वाई फा ई चा लू है , वह चाहता था मैं ए ले न को फोन करने में उसकी मदद कर ूँ .	వె ఫె ఆన అయి ంది , ఎ లెన కి ఫోన చేయడం కోసం అతను నా సాయం అడి గా డు .	0.6333
इसलिए , तुम इन हें एक कं प यू टर दे दो .	కాబటటి , ఇ త నికి ఒక కం ప యూ టర ఏ ర పాటు చేయి .	0.6231
पलीज अपने जे ट विमान वहाँ से ह टा ली जिए .	దయచేసి మీ యు దధ విమా నా లని తపప ి ంచండి .	0.5682
इस नंबर के सारे पिछ ले वि वर ण मि टा द ें ?	ఈ నె ం బ రు పె హి సట రీ అంతా డి లీ ట చేయ ాలా ?	0.6517
कया हमें पर धा न म ंत री के द फ तर को बता ना चाहिए या . . .	మనం టె న డ ౌ ని ంగ సట రీ ట లో పర ధా నమ ంత రికి చెబు దా మా , లేదా . . .	0.6431
मुझे टे री दिखा ई नहीं दे रहा .	నాకు టె రీ కనిపి ంచడం లేదు .	0.5480
कोई बात नहीं करे गा . बाहर देख ने के लिए कुछ नहीं है .	మీరు ఏమీ మాటలాడు కో క ండి . అందు లో నుంచి చూడ టానికి ఏమీ లేదు .	0.5668
हे ! वापस अपनी सी ट पर जाओ !	హేయ ! నీ సీ టు లో తిరిగి కూ రచ ో !	0.5008
एडगर और ज ॉन . तो हमें वही करना होगा जो हम से कहा जाता है , बिलकुल वही जो हम से कहा जाता है , हाँ ?	ఎడ గర ఇంకా జా న . కాబటటి మనం వాళలు చెపపి న ట లే చేసతా ం , ఖచచితంగా చెపపి ందే చేసతా ం , సరేనా ?	0.5995
- मैंने ऐसा कभी नहीं सोचा . - यह तर की ब काम नहीं करे गी , दोसत .	- నేను దాని గురించి అసలు ఆలోచి ంచ లేదు . - అదే మీ పని చేయ దు , మి తర మా .	0.6199
