Hindi	Telugu	Similarity_Score
- तुमने सुना उसने कया कहा ! जलदी ! अभी ! बंद ! - खि ड किया ँ बंद करो !	- తను చెపపి ంది మీరు వి ననా రు ! క దల ండి ! వెంట నే ! కి ంది కి ! - కి టి కీ తె రలు మూ య ండి !	0.6211
हम टे री को बुला ल ेंगे .	సరే , నేను టె రీ ని పి లు సతాను .	0.5289
अगर वह विमान ल ंद न की तरफ आ रहा होता और हमें लगा तार अन देखा कर रहा होता ,	అదే విమానం గ నుక ల ండ న వెపు వ సతూ మన ఆ దే శ ాలు ప టటి ంచుకో కపోతే ,	0.6199
वह कह रहे हैं उस में हमारी कोई गलती नहीं थी .	ఇది మన తపపు కా దని అతను చెబు తుననా డు .	0.5556
- उनहें मत खो लो ! रुको ! - वे चले गए हैं .	- వాటి ని మూ సి వే య ండి ! ఆ ప ండి ! - వాళలు వెళలి పోయా రు .	0.5856
हमें उन जे ट विमान ों से बात करनी होगी .	మనం ఆ యు దధ విమా నా లతో మాటలాడ ాలి .	0.5291
ह थ िया र स करि य . नि शा ना सा ध लिया गया है .	ఆ యు ధ ాలు సిదధ ం . అవి లా క అయ యా యి .	0.5761
पता लगा ओ ये लोग कौन हैं , ये कया कर रहे हैं और कयों ,	వాళలు ఎవరో కని పెటట ండి , వాళలు ఏం చే ే సతుననారు , ఎందుకు చేసతుననా రు ,	0.5339
- बिलकुल . - बिलकुल .	- ఖచచితంగా . - నిజంగా .	0.5027
हा ला त बि ग ड ते जा रहे थे . अब देखो .	పరిసథి తి ది గ జా రి పో తోంది . ఇపపుడు చూడు .	0.5728
हम ऐसा कुछ नहीं करने वाले .	మనం ఆ పని చేయడం లేదు .	0.5098
मार स . पलीज पु ष टि करो .	మార స . దయచేసి నిర ధా రి ంచండి .	0.5118
तुमने कहा था किसी की जान नहीं जाए गी .	ఎవర నీ చం ప బో మని నువవు చెపపా వు .	0.5554
वे हम से लोगों की रकष ा कर रहे हैं .	మన నుంచి వే రే జ నా నని వాళలు కా పా డు తుననారు .	0.5411
वह पे न ले आओ . उसकी सा ँ स ें रु क ने वाली हैं .	తీసుకు రా . ఇ త నికి శ వా స ఆ గి పో తోంది .	0.6355
मैं यह सब काम नहीं करती हूँ .	నేను ఇలా ంటి ప ను లు చేయ ను .	0.5081
वापस अपनी सी ट ों पर जाने के लिए दस से क ंड हैं .	మీ సీ ట లలో కూ రచ ో వడానికి మీకు ప ది సె క న ల సమయం మాతరమే ఉంది .	0.5987
नहीं , यह एक अचछा सवाल है .	లేదు , అది మంచి పర శ న .	0.5447
- ठीक है ? - हाँ .	- అంతే కదా ? - అవును .	0.5528
. . . और उनहें खो ल ना मत .	. . . వాటి ని అలా గ మూ సి ఉ ంచండి .	0.5819
हाँ ?	అంటే ?	0.3426
वाई फा ई से क ने कट हो गया है	వె ఫె కి క నె క ట అయి ంది	0.5277
माँ ?	అమమా ?	0.2929
बीच - बीच में विमान का सं पर क ए टी सी से होता रहा है . इस समय , विमान रो मा निया के ऊपर उ ड रहा है .	అది ఏ టి సి తో అ పపుడ పపుడు సం పర ది సతోంది . ఇపపుడు , ర ొ మే ని యా మీ దు గా వెళ ు తోంది .	0.6431
तुमहें मुझे उनका नाम बता ने की जरूरत नहीं है .	ఆమె పేరు ని నువవు నాకు చెపప న కక ర లేదు .	0.5607
- या तो यह होगा या इंतजार . . . - लॉ रे न स .	- ఇది అది కా వచచు లేదా వే చి ఉండాలి . . . - లా రె నస .	0.6110
हे , पता है , वाई फा ई चा लू है .	హేయ , నీకు తెలుసా , వె ఫె ఆన లో ఉంది .	0.6095
व ॉ इस मे ल क ने कट हो गया है डि सक ने कट हो गया है	వా యి స మె యి ల కి క నె క ట అయి ంది డి స క నె క ట అయి ంది	0.5730
इससे कया होता है ? कया यह दर द कम कर सकती है ?	ఇది ఏం చే సతుంది ? ఇది పె యి న కి లల రా ?	0.5592
कि ंग डम 2 - 9 , अगर आप जवाब नहीं दे ते हैं ,	కి ంగ డ మ 2 - 9 , మీరు సప ంది ంచ కపోతే ,	0.6409
कया हमने जे ट विमान ों से कोई बात की है ?	మనం ఆ యు దధ విమా నా లతో మాటలా డా మా ?	0.5573
हे , तुमने अचछा किया . हे ? सुनो .	హేయ . నువవు బాగా చేశా వు . హేయ ? ఇలా చూడు .	0.5828
यह स थि ति और जयादा ग ं भी र हो जाए गी .	ఈ పరిసథి తి తీ వ రం అవు తుంది .	0.5218
यह मुझे दो .	అది నాకు ఇవ వు .	0.5062
पर अगर तुमहें मुझ पर भरो सा नहीं है , तो मेरे हाथ बं धे रह ने दो	కానీ నువవు ననను నమమ కపోతే , నా చే తులు క టటే సి ఉ ంచు	0.5913
कया ? एक ब रि टि श विमान को ? ऐसे ही किसी भी देश के ऊपर उ ड ते हुए ?	ఏంటి ? బ రి టీ ష విమా న మా ? ఏదెనా ఒక దేశం గ గ న తల ంలో నా ?	0.6606
कि ंग डम 2 - 9 , अगर आप जवाब देने में अ सम र थ हैं , तो सं देश परा पति - सू च ना के लिए विमान के प ं ख थोडा हिला एँ .	కి ంగ డ మ 2 - 9 , మీరు సప ంది ంచ లేని ప కష ంలో , మీ రె కక లని కొ ద ది గా క ది లి ంచి బ దు లు ఇవవ ండి .	0.7074
हे , वे चले गए हैं .	హేయ , వాళలు వెళలి పోయా రు .	0.4541
और अगर आप धयान से देख ें , तो वहाँ सिरफ एक विमान नहीं है .	మీరు దగగర గా గ మని సతే , ఇది ఒకక టి మాతరమే కాదు .	0.5734
नहीं तो मैं बंद कर द ूँगा .	లే ద ంటే నేనే వాడి నో రు మూ యి సతాను .	0.4868
मार शा , तुमने ही बताया था ना कि सै म कया कर सकता है .	మార షా , నువవు అతని గురించి నాకు చెపపా వు .	0.5383
नहीं , हमें पी ए म से बात करनी होगी और वह भी अभी .	లేదు , మనం వెంట నే పర ధా ని తో మాటలాడ ాలి ఇంకా అది వెంట నే చేయాలి .	0.5139
उनके लिए , हम पास आती हुई एक मि सा इ ल हैं .	వాళల కి అది , ఒక కషి ప ణి దూ సు కు రా వడం లాంటి ది .	0.6065
मुझे लगता है हमें जे ट विमान ों से बात करनी चाहिए .	మనం ఆ యు దధ విమా నా లతో మాటలాడ ాలి అనుకుంటా .	0.5707
तुम कया कर रही हो ?	ఏం చేసతుననా వు ?	0.4621
पहले तुम बताओ .	ముందు నువవు వెళ లు .	0.3773
वह कया ?	ఆమె ఏంటి ?	0.3314
माँ ग ें .	డి మా ండ లు .	0.3626
तुमहारे सि सट म में पिछ ले छ ह म ही नों में यू ए ई जाने वाला	మీ సి సట మ లో ఎవరెనా కరి మి న ల రి కార డు ఉనన వారు	0.5892
और वहाँ पै के ज लेकर सा इन करने के लिए कोई होगा ?	అయితే ఆ ప యా కే జ కోసం స ంత కం చేయ డానికి ఎవరెనా ఇంట లో ఉంటా రా ?	0.5741
- तुमहें जो बात करनी है , कर लेना . - हाँ .	- నువవు ఏం చెపప ాలి అను కుననా వో అది చెపపు . - అలాగే .	0.5953
वह लि जी को ढूँढ ने गई थी .	ఆమె లి జీ ని వె త క డానికి వెళలి ంది .	0.4382
कुछ लेना - देना नहीं है , ना ही कोई समस या है . हम ब रि टि श हैं . हम ल ंद न जा रहे हैं .	లేదా బు కా రె సట , లేదా మ రె వర ెనా కానీ . మేము బ రి టీ ష . మనం ల ండ న వెళ తుననాం .	0.6758
पर भ ु , ते रा साम राज य हो .	నీ రా జ యం వచచు గా క .	0.5384
मैं शायद आप से मिल नहीं पा ऊँगा , माँ .	నేను నినను చూడ లే కపో వచచు , అమమా .	0.5532
उसके बाद , तुम उनहें उनकी द वाई दे सकते हो .	ఆ తరువాత అతనికి నువవు మ ందు లు ఇవ వచచు .	0.5596
तुमहें लगता है विमान में कोई डॉ क टर होगा ?	విమానం లో ఎవరెనా డా క టర ఉననారు అనుకుంటుననా వా ?	0.5279
ठीक है . बताओ .	సరే , చేయి .	0.3847
जो किसी ने बहुत मन ह ू स तरी के से स करी न पर लगा दिया है .	ఆ సమ యానని ఎవరో చె డు గా స క రీ న మీద పెటటా రు .	0.6187
हाँ , मेरे हाथ बं धे हुए हैं ना .	లేదు , ఎందుకంటే నా చే తులు క టటే సి ఉననాయి .	0.5294
हाँ , मेरे हाथ बं धे हुए हैं ना .	లేదు , ఎందుకంటే నా చే తులు క టటే సి ఉననాయి .	0.5294
कया विमान में कोई डॉ क टर या नर स है , पलीज ?	విమానం లో డా క టర కానీ న రస కానీ ఉననా రా , దయచేసి చెపప ండి ?	0.5191
बढिया , दोसत . ठीक है ?	శ వా స పీ ల చు , మి తర మా . సరేనా ?	0.4911
हा ला त वापस हमारे का बू में हैं .	మనం మళలీ పటటు సా ధి ంచా ం .	0.5026
तो हम भी उसे मार गि रा ते .	మనం దానిని ష ూ ట చేసి ఉండే వాళల ం .	0.5006
हाँ , मैं बोल रहा हूँ , माँ .	అవును , నేనే మాటలాడు తుననా , అమమా .	0.4793
नहीं . मत जाओ .	లేదు . అకకడ ే ఉ ండు .	0.4473
मेरी तरफ देखो . मैंने तुमहें बताया था तुमहारी उ मर का मेरा एक बेटा है .	ననను చూడు . నీకు చెపపా ను , నాకు నీ వయ సు కొ డు కు ఉననాడు .	0.5677
लेकिन इसका सं चा ल न यहीं से होता है .	కానీ ఆ నే రాల కు ఇదే కే ంద రం .	0.5616
- . . . नौ , आ ठ . . . - लि जी . लि जी !	- . . . తొ మ మి ది , ఎ నిమి ది . . . - లి జీ . లి జీ !	0.6096
- म ॉ म . - म ॉ म ? हाँ ?	- అమమ . - అమమా ? చెపపు ?	0.4763
मैं तुमहारी मदद नहीं करना चाहता .	నీకు నేను సాయం చేయ ాలని అనుకో వడం లేదు .	0.4744
पाँच मिनट . इंतजार करो .	ఐ దు నిమిష ాలు . గ మని సతూ ఉండ ండి .	0.4989
हमें अब कुछ दिखा ई नहीं दे रहा है .	మేము ఆ ద ృ శ యానని కో ల పోయా ం .	0.5790
मैं भी चाहता हूँ आप यहाँ होती ं , लेकिन यह अचछी जगह नहीं है , माँ .	నువవు కూడా ఉంటే బాగు ండ ే ది కానీ నువవు ఇకకడ ఉండ గ లి గే దాని వి కా వు , అమమా .	0.5823
ग ंत वय तक पहुँच ने का समय	గ మయా నికి చే రే సమయం	0.4752
वि देश सच ि व को फोन मिला ना , पलीज .	వి దే శా ంగ మ ంత రి ని ఫోన లోకి తీసుకు రా , పలీజ .	0.5201
नि शा ने पर हम हैं . आप नि शा ने पर नहीं हैं . यह आत ंक वाद का माम ला नहीं है .	వాళల లకష యం మే మే . మీరు లకష యం కాదు . ఇది తీ వర వాద ం కాదు .	0.5991
कि उनके पास दस से क ंड हैं .	వాళల కి ప ది సె క నలు మాతరమే గ డు వు .	0.5624
ओह , शुकर है .	ఓహ , చెతత .	0.5413
हे .	హేయ .	0.3311
के बि न कर ू के पास जाओ .	క యా బి న సి బబంది దగగర కి వెళ లు .	0.5431
हे .	హేయ .	0.3311
जानता हूँ , जान .	నాకు తెలుసు , బంగా రం .	0.4492
इसके लिए यो जना तैयार है .	అది అమ లు చేయ డానికి ఒక ప లా న ఉంది .	0.5189
बैठ जाओ .	కూ రచ ో .	0.3738
और तुमहारे माँ - बा प ? हे ? म ॉ म ? डै ड ?	నీ తల లి ద ండ రు ల సంగ తి ఏంటి ? హేయ ? మీ అమమ ? నానన ?	0.6784
मेरे फोन में मेरी त सवी र .	నా ఫో ను లో నా ఫో టో .	0.4628
ह द है !	చెపప ండి !	0.3403
- हाँ . - ए ले न ?	- అవును . - ఎ లెన ?	0.5974
मैं मिल ूँगा .	తపప కుండా వ సతాను .	0.3607
- रुको . - और हा ला त . . .	- ఆగు . - అది ఎలా ఉ ంద ంటే . . .	0.6350
नहीं . मुझे पता है तुम झा ँ से में नहीं आओ गे .	లేదు . నీ గురించి నాకు తెలు సతోంది .	0.5061
बडा हि ससा यू के ना गर ि कों का है , विमान के म ध य ल ंद न पहुँच ने के त य समय में अब लग भ ग . . .	వారి లో ఎకకువ మంది బ రి టీ ష ప ౌ రు లే , ఇంకా అది ల ండ న కి దా దా పు గా . . .	0.6802
यह काम नहीं कर रहा है . ने टो ल डा कू विमान , मैं कि ंग डम 2 - 9 से बोल रहा हूँ .	ఇది పని చేయడం లేదు . నా టో యు దధ విమానం , మేము కి ంగ డ మ 2 - 9 .	0.6544
तुम जाकर दवा व ग ै रह कुछ लेकर आओ , हाँ ? जाओ !	వెళలి ఏమెనా మ ందు లో లేదా మ రే ద ెనా తీసుకు రా , సరేనా ? వెళ లు !	0.5380
लेकिन वह सी धा आप से बात करना चाहते हैं .	కానీ అతను మీ తో నే రు గా మాటలాడ ాలి అని పటటు బ డు తుననా డు .	0.5306
तुमहारी उ मर का मेरा एक बेटा है .	నాకు నీ వయ సు కొ డు కు ఉననాడు .	0.5615
- कया ? - गि न ना शुरू करो !	- ఏంటి ? - ప ది నుండి లె కక పెటటు !	0.5799
पता है , मेरा मन इसे पूरी तरह र दद कर देने का हो रहा है .	నేను ఆ ప ను లు చేసే విషయం లో ఆలోచి సతుననాను .	0.5515
ब रि टि श विमान , ब रि टि श या तरी . नि शा ने पर हम हैं , वे नहीं .	బ రి టీ ష విమానం , బ రి టీ ష పర యా ణి కులు . మన మే వాళల లకష యం , వే రే దే శ ాల వాళలు కాదు .	0.6158
- एक एक स . - एक एक स ,	- ఇది ఒక ఎ కస . - ఒక ఎ కస ,	0.6092
जिस का मतलब है यह एक नि जी , अप ं ज ीक ृ त	దాని అరథం ఇది పర ె వే టు , రి జి సటర కా ని విమానం అని	0.5612
मुझे डी सी आई ग फ ूर से मिल ना है .	నేను డి సి ఐ గా ఫ ూర ని కల వడానికి వచచా ను .	0.5807
ठीक है . . . कया यह " माँ " के नाम से है ?	సరే . . . ఇది " అమమ " అని ఉందా ?	0.6463
- कया वह मेरी मदद कर सकता है ? - नहीं .	- నాకు సాయం చేయ గల వా ? - లేదు .	0.5660
और ये वे लोग हैं जिन का मे ल उनके पास पो रट से नहीं होता ?	అయితే వీ ళల పా స పో ర టు లు మయా చ కా వడం లేదా ?	0.6094
यकीन नहीं होता .	అ సా మా న యు డు .	0.4358
बाकी सब कुछ झूठ है .	అది తపప మి గ తా వ ననీ అబ దధ ాల ే .	0.4521
यह व हीं बैठ े गा और अपना मु ँ ह बंद रख े गा !	అతను అకకడ ే కూ రచు ంటా డు , ఇంకా తన నో రు మూ సు కు ని ఉంటా డు !	0.5711
बेटी ना , ह . . . लेकिन यह मेरे हाथ में नहीं है .	బె టీ నా , సరే . . . కానీ ఇది నా ఉద యో గ హో దా కి మి ంచిన పని , చూడు .	0.6225
वे लोग जो तुमसे पयार करते हैं ?	నినను పరే మి ంచే మను ష ు లు ?	0.5415
- यह उस ी का फै सला है . - कयों ?	- అది అతను తీసుకు నన నిరణ యం . - ఎందుకు ?	0.5714
- और तुम उनसे मिल ना चाहते हो . - ए ले न .	- ఇంకా ఆమె ని నువవు చూడ ాలి అనుకుంటుననా వు . - ఎ లెన .	0.6020
कोई फर क नहीं पडता तुम कौन हो .	నువవు ఎవరెనా సరే నేను ప టటి ంచుకో ను .	0.4999
मैं पा नी लेकर आती हूँ .	మంచి నీ ళలు తె సతా .	0.4820
आगे बढ ो .	ఇంకా చెపపు .	0.3845
हमने तुमसे कया कहा था ?	మీకు ఏం చెపపా ము ?	0.4838
ऐसा कुछ मत कहना जिस से वह परे शान हों . ठीक है ?	ఆమె కంగా రు పడ కుండా చూ దదాం . సరేనా ?	0.5618
ए लिस . वह निय ं तर क जिस ने सबसे पहले इसका सं के त दिया .	ఆ లి స . ఈ సమసయ ని మొద ట గా గుర తి ంచిన క ంట రో ల ర .	0.6550
कयोंकि इस समय यह बडी समस या है ?	అది ఇపపుడు అవసరం అంటా వా ?	0.4685
पता नहीं कया हो रहा है .	ఏం జరుగు తో ందో నాకు తెలియ డం లేదు .	0.4475
इसे उठा ओ ताकि हम देख सक ें .	దానని పె కి ఎ తతి తే మనం చూడ చచు .	0.5520
- जु ब बा वा लों के पास . - कौन से वाले ?	- ఆ అ ంగ ీ వే సు కునన వయకతి దగగర . - ఎకకడ ?	0.5619
जलदी !	జరగ ండి !	0.3312
सब ठीक है .	మ రే ం ఫర వాలేదు .	0.4101
इसकी सा ँ स रु क गई है .	అతని శ వా స తీసుకో వడం ఆ పే శా డు .	0.5654
वह चाहता था ए ले न एक बार उसकी आवा ज सुन लें .	ఆమె గొ ం తు వి నా లని కో రు కుననా డు .	0.5232
मैं बु का रे सट से बोल रही हूँ . पलीज जवाब दी जिए .	ఇది బు కా రె సట . దయచేసి సప ంది ంచండి .	0.5515
हम ला वर के पास ह थ िया र है .	దా డి చేసిన వాడి చే తి లో ఆ యు ధం ఉంది .	0.5164
अभी के लिए इससे काम चल जाना चाहिए .	అది ఇ పపటి కి పని కొ సతుంది .	0.4592
वे का बू से बाहर हो गए थे .	వాళలు అ దు పు తపప ా రు .	0.5283
बंद हैं और जो सी धा उनकी राज धा नी की तरफ जा रहा है .	వాళల రా జ ధా ని న గ రం వెపు దూ సు కు వెళ ు తోంది .	0.6207
तुम बस अपनी मदद कर रहे हो .	కేవలం నీకు నువవు సాయం చేసు కుంటుననా వు .	0.3811
- अब जब तुमने जि कर किया है . . . - नहीं . मेरे साथ नहीं .	- ఇపపుడు నువవు పర సతా వి ంచా వు కాబటటి . . . - అవును . నాతో అవి కు దర వు .	0.6542
हमें विमान के बीच के हि स से में कुछ दिखा ई दे रहा है . आगे की जानकारी दी जाए गी .	విమానం మధయ లో మాకు ఒక ద ృ శ యం కనిపి ంచింది . గ మని సతూ ఉ ండు .	0.5870
तुम ! हाँ . यहाँ आओ , अभी .	నువవు ! అవును . ఇకకడికి రా , ఇ పపుడే .	0.5110
