Hindi	Telugu	Similarity_Score
वह तुमहें पसंद करती है .	హేయ . దీ నికి నువవు న చచా వు .	0.4979
ठीक है . बहुत हुआ . हम . . .	సరే . ఇక చ ాలు . మేము . . .	0.6938
तुम य ूँ ही नहीं कह सकते कि किसी की हतया हुई है . - यह देखो .	- ఒక రి ని హ తయ చేశారు అని ఊ రి కే అలా అన కూడదు . - ఒక సారి అకకడ చూడు .	0.6234
अ नी क , मुझे पिछ ली बार तुमहारे ए स के प रू म में हमारी ड बल डे ट में बेहद मजा आया .	య నిక , నేను కరి తం సారి నీ ఎ స కె ప రూ మ లో డ బు ల డే ట ని చాలా ఎ ం జా య చేశా ను .	0.7037
मैं स वि मि ंग पू ल में तै र ने जा रहा हूँ .	నేను ఈ త కొ డు తూ వయా యా మ ం చేసతుననా ను .	0.6240
- हाँ , शायद हमें थोडा . . . - तुमसे बात नहीं करनी .	- సరే , మనం కొంచెం ఏ కా ంత ంగా . . . - నినను కాదు .	0.6634
ऐसा नहीं है कि , " मुझे डर ग स दो . "	" నాకు వెంట నే కావాలి " అనన టటు ఉండ ను .	0.6153
एक स मार कस द मर डर सप ॉ ट	ఎ కస మార కస ది మర డ ర స పా ట	0.5989
मुझे माफ करना , पर मुझे जाना होगा .	కషమించు , కానీ నేను వెళల ాల సి వ సతుంది .	0.5388
धनयवाद . तो , दु ल ह न का नाम है गरेस .	థాంక స . సరే , ఆ పె ళ లి కూ తు రు పేరు గరేస .	0.6448
तुमने दु ल ह न की माँ पर ऊ ंट नी का दू ध थ ूक दिया ?	నువవు పె ళ లి కూ తు రు తల లి మీద ఒ ంట ె ప ాలు ఉ మ మి వే సా వా ?	0.6720
कयोंकि तुम जो ई से बेहद पयार करते हो .	ఎందుకంటే నీకు జో యి అంటే అంత ఇషటం .	0.5267
दे वि यों और स जज नों , क सम ों का बक सा .	లే డీ స అ ండ జె ంటి ల మెన , వా గ దా నా ల బా క సు .	0.5902
नहीं , किस की ?	లేదు , ఎవరు ?	0.4496
पर मुझे यह जरूर पता है कि हम तुमहारी बे गु ना ही सा बि त करेंगे , समझ ी ?	కానీ నాకు తెలి సింది ఏంట ంటే మనం ఈ చి కకు నుండి క చచితంగా బయట పడ తా ము , సరేనా ?	0.6310
मेरा हाथ ड रा हुआ है . बेहद , बेहद ड रा हुआ है .	నా చే తులు భయ పడు తుననా యి . చాలా చాలా భయ పడు తుననా యి .	0.5187
मुझे नहीं लगता कि यह अचछा वि चार है .	అది మంచి ఐ డి యా అని నేను అనుకో ను .	0.5534
वैसे , मैं भरो सा दि ला ता हूँ , बेशक मैं बेवकूफ नहीं हूँ .	సరే , నేను మీకు ఒక హా మీ ఇవవ గలను . నేను క చచితంగా వెధ వని కా ను .	0.5964
कयोंकि मैंने पुलिस की नौ करी छोड दी है .	ఎందుకంటే నేను నా పోలీసు ఉద యో గం మా నే శా ను .	0.5489
- मुझे लगता है कि एडगर का ख ून हुआ है . - कया ?	- నాకు ఎడ గర ని హ తయ చేశారు అనిపి సతోంది . - ఏంటి ?	0.6383
और वह मजा किया नहीं था . वह सच में ना राज थे .	అలాగే ఇదే ం నవ వ ొ చ చే లా లేదు . ఆయన చాలా బాధ పడ డా డు .	0.5728
कया तुम अपने को रि या ई चा चा ओं और ची नी चा चि यों को	దయచేసి నీ కొ రి యన అ ం కు లస ఇంకా చె నీ స ఆ ంట ీ లను	0.5851
पर वह बेहद पे ची दा है .	కానీ బాగా తి క మ క పెటట ే ది .	0.5228
- हैलो . - तुम वहाँ कया कर रहे हो ?	- హలో . - నువవు ఇకకడ ఏం చేసతుననా వు ?	0.6114
तुमहारी आवा ज इतनी ऊँ ची कयों है ?	నీ స వ రం ఎందుకు అంత గ టటి గా వ సతుంది ?	0.5557
हाँ . कया मुझे प सी ना आ रहा है ? लगता है मुझे काफी प सी ना आ रहा है .	సరే . నాకు చ మ టలు వ సతుననా యా ? నాకు బాగా చ మ టలు వ సతునన టటు ఉంది .	0.6416
और फिर शादी की रात को ही उसे ज हर दे दिया .	వాళళ పె ళ లి రాత రే వాడి కి విష ం పె టటి చం పే సింది .	0.5127
हाँ , सच में ? शायद मुझे शा मिल नहीं होना चाहिए .	అంటే , నేను రా వో చచా ? నేను వ సతే బాగు ండ దే మో .	0.5933
अगर तुम सच की अस ली सच चा ई जान ना चाहते हो , तो मेरे साथ आओ .	నీకు నిజ మెన నిజం తెలుసు కో వాలని ఉంటే వెంట నే నాతో రా .	0.5515
ठीक है , मैं आ रही हूँ .	సరే , నేను వ సతుననాను .	0.5025
- वह बेवकूफ है . - डै ड .	- వా డ ొక వెధవ . - నా ననా .	0.6570
- नहीं . - सुन कर काफी है रा नी हुई .	- లేదు . - ఇ ందు లో ఆ శ చ ర యం ఏ ము ంది లే .	0.6208
ऊ ंट नी का कि ण वि त दू ध .	పు లి య బె టటి న ఒ ంట ె ప ాలు .	0.6043
सच में , है न ? और भी रो मा ं टि क - कॉ मे डी वाली बद मा श ियाँ , ह ँ ?	నవ వ ొ చ చే లా ఉంది కదా ? ర ొ మా ంటి క కా మె డీ లా గే ఉంది కదా ?	0.6087
कयोंकि मुझे लगता है कि वह अचछा फै सला था .	ఎందుకంటే నా కె తే అది మంచి నిరణ యం అనిపి సతోంది .	0.5043
ए . चलो भी !	హేయ . ఊ రు కో !	0.5075
नहीं . मुझे नहीं न हा ना .	పర లేదు . మీరు చేయ ండి .	0.5152
कि हमें बेहद खुशी है कि तुमहें कोई ऐसी मिली जो तुमहें सच में समझ ती है ,	నినను బాగా అరథం చేసు కొ నే అమమాయి ని నువవు కను గొ నన ందుకు మాకు చాలా సంతోష ంగా ఉంది ,	0.5592
कयोंकि मैं पहले से ही सारे जवाब जानता हूँ . वह काफी उ बा ऊ होगा .	ఎందుకంటే నాకు సమా ధా నాలు ము ందే తెలుసు కదా . సమయం వ ృ ధా అంతే .	0.6125
ए , कया मैं तुमसे अके ले में बात कर सकता हूँ ? बस एक छो टी सी बात है .	హేయ , నేను నీ తో కొంచెం అ టు ప కక మాటలాడ ొ చచా ? పెదద విషయం ఏం కాదు .	0.6628
कहानी खतम नहीं हुई है . मैं हतया का यह माम ला सु ल झा ने में और तुमहें	ఇదే ము గి ంపు కాదు . ఈ హ తయ ను పరి ష కరి ంచడం లో నీకు సహా యం చేసతాను .	0.6432
- का इ ल र , कृपया , बी मे के लिए इसे फि ल मा लो . - ठीक है .	- కె ల ర , ఇ నస ూ రె నస వాళళ కోసం దీని వీ డి యో తి య యి . - అలాగే .	0.6881
बस मुझे उनहें लेना पसंद नहीं है . मेरा मतलब समझ रहे हो ?	కానీ నేను వాటి ని వా డ ను . నేను చెపపే ది అరథ మ వు తు ందా ?	0.5880
इसे पी ने का मतलब होगा कि तुम हमारे परिवार का हि ससा हो .	దీ నని తా గి తే , నువవు మా కుటుం బ ంలో ఒక డి వి అని అరథం .	0.5913
बात बस यह है कि , मुझे नहीं लगता कि गरेस ने हतया की है .	అంటే , హ తయ గరేస చేసి ఉ ంటు ందని నాకు అనిపి ంచడం లేదు .	0.6082
तो यह कभी अचछी बात नहीं होती है .	ఏదో చె డు జరగ బో తోంది అని అరథం .	0.5412
नहीं . दरअसल नहीं . . .	వదదు . నిజంగా నే . . .	0.5851
म ध य ए श िया ई सट े पस की सी थि यन जन जा ति में ,	మధయ ఆ సి య ాలో ని దే శ ది మమ రు లెన సి ం థ ి యన తె గ లో ,	0.6394
बिना बुला ए टे बल पर बैठ ने वाले न शे डी चो र ! मुझे मेरा पर स वापस दो .	పి లవ కుండా వచచి న డ రగ స అ ల వా టు ఉనన దొ ంగా ! నా పర సు నాకు ఇవ వు .	0.6810
नहीं , कृपया . मैं जेल जा ऊँ गी .	లేదు , పలీజ . నేను జె లు కు పో తాను .	0.5944
कया तुमने कभी करि प टो करें सी वय व सा य आज मा या ?	ఎపపుడ ెనా కరి ప టో లో పెటటు బ డు లు పెటటా వా ?	0.5778
- मैं उनहें ला सकता हूँ . - पता नहीं . यह पा रि वा रिक चीज है .	- ఆ పని నేను చేయ గలను . - ఏ మో . ఇది మా కుటుం బా నికి సంబం ధి ంచింది .	0.6295
यह के त ली का क वर है . यह तुमहारा पु त ला है .	అది టీ పా య మీద పెటట ే టో పీ . అది నువవే .	0.5808
- वह कौन है ? - वह बे सट मै न है .	- అద ె వ రు ? - అతను బె సట మయా న .	0.6669
अरे , नहीं .	ఓహ , అమమ ో .	0.4703
अरे , नहीं .	ఓహ , అబబా .	0.5045
अरे , नहीं .	ఓహ , అమమ ో .	0.4703
देखो , एडगर की छ ि पक ली उसके क ँ धे पर ही है .	చూడు , ఎడ గర బ లలి వాడి భు జ ం మీ దే ఉంది .	0.6520
मैं उनका आ शी र वाद ले ने की उममीद कर रहा था , कयोंकि . . .	వాళళ ఆ శ ీ ర వాద ాలు తీసుకు ందా మని ఎదు రు చూ సతుననాను , ఎందుకంటే . . .	0.6209
यह काफी वय सत सु बह थी . मुझे एडगर की बो टा ई बा ँ ध नी प डी .	ఉద యం చాలా ప ను లు చేయ ాల సి వచచింది . ఎడ గర బో టె క టట ాల సి వచచింది .	0.6408
तुमने सही कहा . मेरे बे टे को ज हर दे कर मा रा गया है .	నువవు అనన ది నిజ మే . నా కొ డు కు కు విష ం పెటటా రు .	0.6464
मुझे यह सवाल समझ नहीं आया .	నాకు మీ పర శ న అరథం కా వడం లేదు .	0.5259
मैंने प ें शन मिलने से पहले ही पुलिस की नौ करी छोड दी ,	నా పె న షన రా వడానికి ము ందే నేను పోలీసు ఉద యో గా నని వదిలే శా ను ,	0.5707
कया ? मैं छ ि पा नहीं रहा था . मैंने बस वह पक डा हुआ था .	ఏంటి ? నేను దానని దా చ డం లేదు . దానిని పటటు కొ ని ఉననాను అంతే .	0.5736
उसे यही चिंता थी कि हम उसके बारे में कया सोच ते हैं ,	వాడు జో యి ని బాగా చూ సుకో వాలి అని మేము అను కు ంటే , వాడు మా తరం	0.5684
तुमसे दोबारा मिल कर खुशी हुई .	నినను మళళీ చూడ డం సంతోష ంగా ఉంది .	0.5438
तो , फो टो खि ं च वा ते समय , मैंने गरेस और एडगर को झ ग ड ते देखा था .	సరే , ఫో టో లు ది గు తునన పప డు , నేను గరేస ఇంకా ఎడ గర కొ ట లా డు కో వడం చూశా ను .	0.6767
बस तुमहें बता द ूँ , हम हमेशा ब रे ट से न फ रत करते थे . - म ॉ म .	- ఒకటి చెపప ాలి , మాకు బ రె ట అంటే మొదటి నుండి ఇషటం లేదు . - అమమా .	0.6676
हम बस कहना चाहते हैं , हम दोनों की ओर से , यहाँ आने के लिए धनयवाद !	మా ఇదద రి తర పు న , మేము మీ రం తా వచచి న ందుకు చాలా సంతోష ంగా ఉ ందని చెప తుననా ము !	0.5939
और साथ ही , ख ून भी हो गया .	అలాగే దానికి పె న ఈ హ తయ ఒకటి .	0.4703
पर रॉ कस ै ना को यह पसंद है .	కానీ రో క సా న కి ఇది చాలా ఇషటం .	0.5222
कि उसे शादी नहीं करनी चाहिए ?	అని ఎందుకు చెపపి ఉంటుంది ?	0.4922
दो खू बस ू रत बा ल - रह ित जल - पु रु ष स मु दर में तै र रहे होते हैं .	ఇదద రు అంద మెన మె ర మెన స ము ద రం లో ఈ దు కు ంట ూ వెళ తుననారు ,	0.6159
हाँ . मैं उससे बेहद पयार करता हूँ .	నిజ మే . నేను ఆమె ను చాలా పరే మి సతుననాను .	0.5262
- हैलो . - उसने मुझे कभी पसंद नहीं किया .	- హలో . - దానికి నేను అస స లు న చచ ను .	0.6323
मुझे पता है कि मैं बदल नहीं सकता ,	నేను కొంచెం ఎ బ బె టటు గా ఉంటా నని తెలుసు ,	0.5256
यह शान दार है . मैं कुछ प न ने देखना चा हूँ गी .	అది భలే విషయం . నాకు కొనని పే జీ లు చూడ ాలని ఉంది .	0.5901
शायद मैं इस बारे में एक और कि ता ब लि ख ूँगी .	వీ లె తే దీని గురించి కూడా ఇం కొ క పు సత కం రా సతాను .	0.5887
कयोंकि हम एक ही जगह में सो ते हैं , पर . . .	ఎందుకంటే మేము ఒక చో ట పడు కుంటుననా ం , ఒక రి తో . . .	0.5995
- तुमहें भ ू ख लगी है ? - नहीं , नहीं लगी है .	- నీకు ఆ కలి గా ఉందా ? - లేదు , నా కే ం ఆ కలి గా లేదు .	0.5901
जा ह िर त ौर पर , सि लि कॉ न वै ली की शा दि यों में यह आ म बात है .	ఇంత కీ ఇలా చేయడం సి లి కా న వయ ాల ీ లో సా ధా రణ విషయం అ ంట .	0.6328
तुम एक फि ल मी अ ंत के ह क दार हो . और मैं तुमहें वह दिल वा ऊँ गी .	నీకు హ ాల ీ వు డ తర హ ాలో ము గి ంపు కావాలి . నేను నీకు అది తె చచి పె డ తాను .	0.6328
" यही मेरा आ खि री पर सता व है . पर अगर तुमने सवी कार नहीं किया , तो भी मैं ले ही ल ूँगा . "	" న చచి తే తీసుకో , లేదా పో . కానీ నువవు వెళల కపోతే , నేను క చచితంగా తీసు కుంటా . "	0.6286
वह बस इसी बारे में है कि मैं उससे कितना पयार करती हूँ .	అది అంతా నేను తన ను ఎంత గా పరే మి సతుననాను అనన దాని మీ దే రా శా ను .	0.5590
मुझे नहीं लगता मैं जेल में जि ंदा रह पा ऊँ गी . - मैं सब संभाल ल ूँगा .	- నేను జె లు లో బర త క గల నని నాకు అనిపి ంచడం లేదు . - ఆ సంగ తి నేను చూ సు కుంటా ను .	0.6278
मेरा कया ?	ఏమ ననా రు ?	0.4243
तो , है ना हमें उसके फ ूल ों की	సరే , హ ననా నాకు ఇ పపటి వర కు	0.5734
पर यह पर ं परा है .	కానీ ఇది మా ఆ చా రం .	0.4677
इस स पता हा ंत मैं बस इतना चाहता था कि तुमहारे मा ता - पिता मुझसे न फ रत न करें .	నేను మీ అమమా నానన లకు న చచ ాలి అనన ఒక ే ఒకక ఉద దే శ ంతో ఇకకడికి వచచా ను .	0.5883
यह देखो .	ఇలా చూడు .	0.4009
वह सच में नहीं है .	అంటే , నిజ మే కదా .	0.5093
- कया मुझसे अब भी कू मि स की बू आ रही है ? - मैंने ऐसा कयों किया ?	- నా దగగర ఖ ు మి స వా స న వ సతు ందా ? - నేను ఆ పని ఎందుకు చేశా ?	0.6804
मैं कह सकती हूँ कि यहाँ कम से कम छ ह बा थ रू म हैं .	ఇకకడ క నీ సం ఆ రు బా త రూ మ లు ఉ ండి ఉంటా య ని అనుకుంటుననా ను .	0.5997
इसलिए मैं बस उसके ब गल में सो गई थी .	దా ంతో నేను తన ప కక నే పడు కుననాను .	0.5650
क सम ों के बक से की जि म मे दा री मेरी है .	నేనే వా గ దా నా ల బా క సు ఇ చ చే వాడిని .	0.6094
यह छ ि पक ली - ल ु का - छ ि पी थी म वाला खेल है	అద ొక బ లలి తర హా దొ ంగా పోలీసు ఆట ,	0.5475
तुम फै ंग और वि वि यन के आ स - पास बेहद घ बरा ए हुए रह ते हो .	ఫె ంగ ఇంకా వి వి యన ల ముందు నువవు చాలా ఆ రా ట ంగా కనిపి సతుననా వు .	0.6157
मैं परिवार का हि ससा नहीं हूँ पर बन ने वाला हूँ . शायद .	కుటుం బ సతు డిని కా ను , కానీ అలా ంట ో డి నే . అనుకుంటా .	0.5953
तुमहारे मा ता - पिता पहले से यहाँ मौ जू द हैं . मुझे उममीद थी कि मैं उनसे तब मिल ूँगा जब . . .	మీ అమమా నానన ఇంత కు ము ందే వచ చేశారు . నేను వాళళు అ పపుడే వ సతారు అని అని కో లె . . .	0.6647
दिल च सप स जा व ट ों के बारे में बता रही थी .	ఆమె ఏ ర పాటు చేసిన ఈ పు వ వు ల గురించి చెప తోంది .	0.6099
अपनी कार से तुमहारे डै ड का टर क ठ ो क दिया , तुमहारी म ॉ म के ऊपर दू ध थ ूक दिया . . .	నా కారు తో మీ నానన టర క ని గు ద దే శా ను . మీ అమమ మీద ఒ ంట ె ప ాలు ఉ మ మా ను . . .	0.6989
वह मुझसे न फ रत करती है . हमेशा से न फ रत करती थी .	ఆమె కు నేను న చచ ను . ఆమె కు మొదటి నుండి నేను ఇషటం లేదు .	0.5745
जानते हो यह मुझे कैसा जान पडता है ?	ఇది విన డానికి ఎలా ఉ ందో చెపప నా ?	0.5348
अ नी क कया होता है ?	య నిక అంటే ఏంటి ?	0.4581
तुम सभी श ै ता न हो .	మీ రం తా ద ె యయ ాలు !	0.5748
से बा सट ि यन . बे सट मै न , कयोंकि एडगर सबसे बेह तरी न है .	సె బా స టి న . నేను బె టర మయా న ని , ఎందుకంటే ఇకకడ ఎడ గరే బె సట .	0.6563
बिना नि म ं तर ण के यहाँ बैठ ने वाला डर ग स ले ता है .	టే బు ల దగగర కు వచచి నో డి కి డ రగ స అ ల వా టు ఉంది .	0.6886
और इ कल ौ ती इंसान जिस के तुमने जि कर ही नहीं किया , वह है दु ल ह न .	నువవు పె ళ లి కూ తు రి గురించి మా తరం పెదద గా ఏం చెపప లేదు .	0.6262
और कोई सब ूत नहीं है कि यह तुमने किया .	ఈ హ తయ చేసి ంది నువవే అని ఎలా ంటి ఆ ధా రం లేదు .	0.5768
ए , कया तुमहें करि प टो करें सी के बारे में कुछ पता है ?	హేయ , నీకు కరి ప టో క రె నస ీ గురించి ఏమెనా తెలుసా ?	0.6052
हाँ . यह न क ली डि जर ट है .	అవును . అద ొక న కి లీ చా క లెట .	0.5937
