Hindi	Telugu	Similarity_Score
हमारे फोन . हमारे फोन कहाँ हैं ?	మన ఫోన లు . అవి ఎకకడ ఉననాయి ?	0.4630
अ मैं डा , मेरी बात सुनो , ठीक है ?	అమ ండా , నా మాట వి ను , సరేనా ?	0.5937
हमने कर दिखा या .	మనం సా ధి ంచా ం .	0.4804
और , ए लिस , कया यह नि श चि त रूप से जान बू झ कर किया गया है ?	ఇంకా , ఆ లి స , అది ఖచచితంగా కా వాలని చే సతునన దే నా ?	0.5940
तो , वे विमान को हा इ जै क करते हैं ,	కాబటటి , వాళలు విమా నా నని హె జా క చేయ గానే	0.5403
पलीज , सब लोग , अपनी सी ट ों पर बैठ जाओ . . .	దయచేసి , అందరూ , మీ సీ ట లలో కి వెళలి కూ రచ ో ండి . . .	0.6096
क ने क शन ट ू ट गया है . . .	క నె కష న పోయింది . . .	0.6362
लेकिन यह सु नि श चि त करने के लिए , तुमहें मुझसे बात करनी होगी .	కానీ అది జరగ ాలి అంటే , నువవు నాతో మాటలాడు తూ ఉండాలి .	0.5653
लेकिन यह चिंता जन क है . . .	కానీ ఇది ఆ ందో ళ కర ంగా ఉంది . . .	0.5547
- यहाँ की बि ज ली च ली गई है . - यहाँ . . .	- మన కి ప వర పోయింది . - మన కి . . .	0.6101
उनहोंने कहा कि ए यर टर ै वल इ ंड सट री . . .	విమా నయా న రం గం గురించి వాళలు చెబు తునన ది . . .	0.5895
- सै म , मुझे अपनी ठीक दि शा बताओ . . . - अचछा .	- సా మ , మీ ది శ ఖచచితంగా నాకు తెలియ ాలి . . . - అలాగే .	0.6650
लेकिन हम उनहें रो क सकते हैं . तुम और मैं . इसी समय . ठीक है ?	కానీ మనం దానని ఆ ప గల ం . నువవు , నేను . ఇ పపుడే . సరేనా ?	0.6432
उसे जवाब चाहिए , और हमें यहाँ से निकल ना है . तो अब इसे खतम करो .	ఆమె కు జ వా బు చెపప ాలి , అలాగే మనం ఇం క వెళల ాలి . కాబటటి దానని ఇం క ము గి ంచాలి .	0.5773
ठीक है , सै म , अब तुमहें एक काम करना होगा .	సరే , ఇపపుడు నా కోసం నువవు ఒక పని చేయాలి , సా మ .	0.6143
ठीक है ?	సరేనా ?	0.3581
जेल से बाहर निकाल ना चाहते हो , चाह े वे कोई भी हों ,	జె లు నుండి వి డి పి ంచ ాల ంటే , అది ఎవరెనా కానీ ,	0.5637
देखो , यह उसका बै ग है .	సరే , ఇది ఆమె బ యా గ .	0.5788
अ मैं डा ?	అమ ండా ?	0.3206
अ मैं डा ?	అమ ండా ?	0.3206
अ मैं डा ?	అమ ండా ?	0.3206
अ मैं डा ?	అమ ండా ?	0.3206
अ मैं डा ?	అమ ండా ?	0.3206
ठीक है .	అలాగే .	0.3581
इसे मुझे दो .	అది నాకు ఇవ వు .	0.4876
के नी , मेरे साथ आओ .	కె నీ , నాతో పాటు రండి .	0.5539
मेरे रा स ते से ह ट जाओ !	నా దా రికి అడ డు లే !	0.5561
तुम इन हें पुलिस के पास ले जाओ .	ఆమె ని పోలీసు ల దగగర కి తీసుకు వెళల ండి .	0.5211
आप कैसे हैं ?	నీ సంగ తి ఏంటి ?	0.4342
हमारा खेल खतम हो गया .	మన పని అయి పోయింది .	0.4163
अब कोई फा य दा नहीं !	దా క కో వడం లో అరథం లేదు !	0.4841
जा रा , मुझे सै म के फ लै ट पर मदद चाहिए , अभी .	జా హ రా , సా మ ఫ లా ట దగగర నాకు బ ల గ ాలు కావాలి , వెంట నే .	0.6517
कि ंग डम ए यर ला इं स के शे यर उसके विमान से भी जयादा ते जी से नीचे गिर ने लग ते हैं .	కి ంగ డ మ ఎ యి ర లె నస ష ే ర ల ధ రలు విమానం క ననా వే గ ంగా ప త నం అయి పో తుననా యి .	0.6886
जे ट विमान कोई कार र वाई नहीं करेंगे .	యు దధ విమా నాలు దా డి చేయడం లేదు .	0.4597
तुम बाकी सब की जान ें बचा लो गी .	నువవు ఇకకడ పరతి ఒకక రి నీ కా పా డ తా వు .	0.4931
चलो , दोसत . यहाँ की सभी जग हें खा ली कर वाई जा रही हैं .	బయట కి రండి , మి తర మా . భ వ నా నని ఖ ా ళ ీ చేయి సతుననా ం .	0.5975
हमारे ल ंद न के ऊपर पहुँच ते ही , यह खतम हो जाना चाहिए था .	మనం ల ండ న మీ ది కి వచచే స రికి పని పూర త వ వాల సి ఉంది .	0.6324
कयोंकि वे ज मी न पर लोगों को बता देंगे कि यहाँ कया हो रहा है .	ఎందుకంటే ఇకకడ ఏం జరుగు తు ందో వాళలు కింద అంద రికీ చెబు తారు .	0.5784
हम ऐसे चु प चा प नहीं बैठ सकते , उसने राज धा नी में जाकर ध मा का कर दिया तो ?	మనం ఏమీ చేయ లేక ఇలా ని ల బడి ఆ విమానం మన రా జ ధా ని న గరా నని ఢ ీ కొ న డా నని చూ సతూ ఉండ లే ము .	0.6317
- पक डे रहना ! - नहीं .	- పటటు కో ! - చెతత .	0.6023
तुम यह कैसे जानते हो ?	ఆ విషయం నీకు ఎలా తెలుసు ?	0.5162
नहीं ? फिर , यह फै सला मुझे ले ने दो .	వ ద దా ? అయితే , నేను నిరణ యి సతా .	0.6176
ठीक है , दोसत . धयान से चला ना .	సరే , మి తర మా . జా గర తత గా బె క మీద రా .	0.5411
अ ंत तुम जवाब कयों नहीं दे रहे हो ?	ఎ ండ జ వా బు ఎందుకు ఇవ వడం లేదు ?	0.5468
हाँ , हमारे पास पाँच नाम हैं .	సరే , వాళల వి ఐ దు గురి పే రలు ఉననాయి .	0.4941
क डी कार र वाई करने का अधि कार दिया गया है .	హి స మె జె సట ీ పర భు త వం నాకు ఆ దే శ ాలు జా రీ చేసి ంది .	0.5441
स श स तर पुलिस ! स श स तर पुलिस ! नीचे ले ट जाओ !	సా యు ధ పోలీసు లు ! సా యు ధ పోలీసు లు ! కింద పడు కో ండి !	0.5351
ठीक है ? तुम कुछ भी करो , तुम इस विमान को कर ै श करो या ना करो ,	అరథ మె ందా ? నువవు ఏం చేసి నా , నువవు విమా నా నని నే ల కూ ల చి నా , కూ ల చ క పోయి నా ,	0.5795
- यह आपका घर है , सर ? - का श . मैं बस यहाँ काम कर रहा हूँ .	- ఇది మీ ఇ ల లే నా , సర ? - అయితే బాగు ండ ే ది . నేను ఇకకడ పని చేసతుననా ను .	0.6223
विमान न सला ह कार . वह पहले नौ से ना में थी .	ఏ వి యే షన స ల హా దారు . గ తం లో న ౌ కా ద ళ ంలో పని చేసి ంది .	0.5919
के ए 2 9 जी - के ए न डी ए म रा सता 2 9 4	కె ఎ 2 9 జి - కె . ఎ న . డి . ఎ మ ట రా క 2 9 4	0.6833
ग ै स फ ें क रहा हूँ ! चलो , चलो !	గ యా స వి సు రు తుననాం . పద ండి , పద ండి !	0.5668
ऊँ चा ई 3 , 00 0 पर .	ఆ ల టి ట యూ డ మూ డు వే లు .	0.4743
- हे . - सै म ने ल सन .	- హేయ . - సా మ నె లస న .	0.7121
हाँ , तो मार शा से कहना कि वह सही थी . मुझे यह फ ला इट नहीं ले नी चाहिए थी .	తను సరి గ గానే చెపపి ందని మార షా కి చెపప ాలి . ఎందుకంటే నేను అసలు ఈ విమానం ఎ కకి ఉండ కూడదు .	0.6003
सब खतम हो गया , जे . ये जानते हैं कार त ू स खा ली हैं . सब खतम हो गया .	ఇది ము గి సింది , జే య . ఈ గ న లో డ కాల ే దని వాళల కి తెలి సి పోయింది . అంతా అయి పోయింది .	0.5841
यही होने वाला है , ठीक है ?	జరగ బో యే ది అదే , సరేనా ?	0.5002
और मुझे यह करना प डा , नहीं तो वे मेरे पार ट नर को गोली मार दे ते .	నేను ఆ పని చేయ ాల సి వచచింది లే ద ంటే వాళలు నా భా గ సవా మి ని కాల చేసతా ం అననా రు .	0.5945
तुमने जिंदगी में जो भी किया , हमें उस पर ना ज है .	నీ జీవితం లో నువవు సా ధి ంచిన వి జ య ాలని చూ సి మేము గర వ పడ తా ము .	0.5860
बढिया . ठीक है . मैं कया मदद कर सकता हूँ ?	గొపప విషయం . సరే . నేను ఏ సాయం చేయ గలను ?	0.5831
कया सब लोग आ गए ? फ रे ड . . .	అందరూ కష ే మ ంగా ఉననా రా ? ఫ రె డ . . .	0.6542
लेकिन वह विमान कयों उडा रही है ?	కానీ ఆమె ఎందుకు విమా నా నని న డు పు తోంది ?	0.4926
इससे हमारा समय कट जाएगा , है ना ?	అది మన కి మంచి కాల కష ే పం అవు తుంది , కదా ?	0.5398
सै म , विमान के ई ं धन का स तर बताओ .	సా మ , మీ ఇం ధ నం ఎంత ఉ ందో నాకు తెలియ ాలి .	0.5901
उनके लिए हमारी के ए 2 9 की खबर जा री है .	కె ఎ 2 9 క థ నా ల పర సా రా నని మేము కొ న సా గి సతుననా ము .	0.5773
- रा स ते से ह टो ! - इससे कोई फा य दा नहीं होगा !	- దా రి లో అడ డు లె ండి ! - ఇది పని చేయ దు !	0.6415
- सै म , तुम सुन रहे हो ? कया तुम . . . - वह कभी कुछ नहीं बो ले गी .	- సా మ , ఉననా వా ? వి ంటు . . . - ఆమె ఎ పపటి కీ ఏమీ చెపప దు .	0.7163
सिरफ इसी बंद ूक में अस ली गो लिया ँ हैं .	ఆ గ న లో మాతరమే బు లె టలు ఉననాయి .	0.5510
ए लिस , इस बारे में मैं तुमसे कोई बह स नहीं कर ूँगा .	ఆ లి స , దీని గురించి నేను నీ తో వా ది ంచ లేను .	0.5785
इसे पक ड कर रख ना .	వీ డిని కూ రచ ో పెటటు .	0.4567
मतलब दो टा इ फ ून स ह वा में तै ना त .	రెండు టె ఫ ూ న యు దధ విమా నాలు బయ లు దే రా యి .	0.6095
- उप लब ध नहीं है ? - नहीं .	- మీ తో లే రా ? - లే డు .	0.5158
विमान के कर ै श होने तक हमें छु प कर रहना है . बात खतम .	ఆ విమానం నే ల కూ లే వర కూ మనం ఎవరి క ంటా పడ కూడదు . ఇం క మాట లు వదదు .	0.6073
- हाँ . - शुकरिया .	- అవును . - థాంక యూ .	0.6004
माफ करना , मैं . . .	సా రీ , నేను . . .	0.5917
इस त थ य के आ धा र पर कि सै म का बेटा ऊपर ओ सी जी के कब जे में है .	ఎందుకంటే ఆ వయ వ సథ ీ క ృ త నే ర గా ళల ము ఠ ా మను ష ు లు సా మ కొ డు కు ని నిర బం ధి ంచారు .	0.6719
उसका बेटा . पू रे समय हम से छु पा रहा .	అతని కొ డు కు . ఈ మొతత ం సమయం దా కకు నే ఉననాడు .	0.6062
अगर आप उल टा दा ँ व लगा ते हैं तो नहीं .	కానీ మనం ఇం కో లా ఆలోచి సతే తపప .	0.5451
नहीं . कोशिश भी मत करना ! रुको !	వదదు . అన వ సర ంగా ధ ె ర యం చేయ దదు ! ఆ గ ండి !	0.5490
एक बार और पूछ ती हूँ . कया फर सट ऑ फि सर विमान उडा रही है ?	మర ొ కక సారి అడుగు తుననాను . విమా నా నని మొదటి ఫ ల యి ట ఆ ఫీ సరే న డు పు తో ందా ?	0.5818
तुम जवाब कयों नहीं दे रहे हो ?	జ వా బు ఎందుకు ఇవ వడం లేదు ?	0.5133
इससे हमें तुमहारी मदद करने में मदद होगी . लेकिन तुमहें सिरफ मेरी आवा ज सुना ई दे गी .	అది నీకు , నాకు కూడా సా య పడు తుంది . కానీ నా మాట మాతరమే నీకు వి ని పి సతుంది .	0.5806
मार शा ? मैं यहाँ पहुँच गया हूँ . यहाँ मत आ ना , ठीक है ? मैं तुमहें वापस फोन करता हूँ .	మార షా ? నేను ఇకకడ ే ఉననాను . నువవు రా కు , సరేనా ? నీకు మళలీ కాల చేసతాను .	0.5766
या त रि यों के पास विमान को रो क ने का कोई रा सता नहीं है .	పర యా ణి కులు ఈ విమా నా నని ఆ పే పరిసథి తి లో లే రు .	0.5708
हे भगवान . हे भगवान .	ఓహ , దేవుడా . ఓహ , దేవుడా .	0.4165
उसके कह ने का मतलब है कि हम नहीं जानते वह कौन है . हमें उसके बारे में नहीं बताया गया था .	ఆమె ఎవరో ఏమి టో , మాకు ఏమీ తెలియదు . మాకు క నీ సం ఆమె గురించి ఎవరూ చెపప లేదు .	0.5918
कि ंग डम 2 - 9 , पलीज जवाब दी जिए .	కి ంగ డ మ 2 - 9 , దయచేసి పరతి సప ంది ంచండి .	0.5558
- अचछा . सै म , तुम कॉ क पि ट के पास हो ? - कयों ?	- మంచిది , సా మ , నువవు కా క పి ట దగగర ఉననా వా ? - ఎందుకు ?	0.6688
- सै म , कॉ क पि ट . - देखो , मैं समझ सकता हूँ . . .	- సా మ , ఆ కా క పి ట . - చూడు , నేను అరథం చేసుకో గలను . . .	0.7420
मैं एक ट रे डर हूँ .	నేను ట రే డ ర ని .	0.5259
हाँ ? वही सौ दा ?	అవునా ? ఆ ఒ పప ంద మా ?	0.4297
क ने क शन ट ू ट गया है	క నె కష న పోయింది	0.4956
सुनो , ये लोग , ये बहुत ख तर ना क लोग हैं .	వి ను , ఈ నే ర గా ళలు , వీ ళలు చాలా పరమా ద కర మెన ము ఠ ా .	0.6263
तो उनका सौ दा हो जाने के बाद कया होगा ?	కాబటటి వాళల లా వా దే వీ లు పూర తయ యా క , తరువాత ఏంటి ?	0.4939
भगवान . तुमहें कि तने पैसे चाहिए ?	దేవుడా . మన కి ఇం కె ంత కావాలి ?	0.5497
तुमने किसी को वहाँ जाते हुए देखा ? किसी को भी ?	అందు లోకి ఎవరెనా వెళల డం చూశా రా ? ఎవరెనా ?	0.5515
ठीक है , सी ढ ि यों पर धयान से उ तर ना .	సరే , మె టలు జా గర తత గా చూ సు కు ని ది గ ండి .	0.6413
इस विमान को रो क ना हमारे व श में नहीं है .	మేము ఈ విమా నా నని ఆ ప లే కపో తుననా ము .	0.5818
कया तुम अभी भी या तरी - सू ची वाले सभी मो बा इ लों पर फोन कर रही हो ?	జా బి త ాలో ఉనన పరతి మొ బె ల కీ ఇ పపటి కీ ఫోన చేసతుననా వా ?	0.5349
हमें इसे तो ड ना होगा . हम सब को . इसे भी . अब हमारे पास और कोई रा सता नहीं है .	మనం దానని ప గు ల గొ డ దాం . అంద రం . తన తో సహా . మన కి మ రో మా రగ ం లేదు .	0.6881
विमान के लिए सबसे ख रा ब परि ण ा म होगा .	ఆ విమా నా నికి ఎకకువ న ష టం జరగ ాలి .	0.5701
हाँ , मैं समझ ता हूँ , टी ना , लेकिन आ स मान में यह अके ला विमान नहीं है .	అవును , నాకు అరథం అయి ంది , టీ నా , కానీ ఆ కా శం లో ఎ గు రు తునన విమానం అద ొ కక టే కాదు .	0.6419
- यह ऐसे ही काम करता है . - तो , अगर पायलट बाहर रह जाए तो ?	- అది ఇ ందు లో ని సి సట మ . - అయితే , మరి పె లెట ని బయట నుండి లా క చే సతే ?	0.5910
वे चाहते थे कि मैं सै म के प ते की पु ष टि कर ूँ .	సా మ అడ రస నిర ధా రి ంచ ాలని ననను అడి గా రు .	0.6101
हे भगवान .	ఓహ , దేవుడా .	0.3868
- तुम क . . . फोन कहाँ हैं ? - हे , हे !	- చెతత వెధవ . . . అవి ఎకకడ ఉననాయి ? - హేయ , హేయ !	0.6421
ट रो जन , यह सट रा इ क क मा ंड है . पीछे ह ट िए और नजर बना ए रख िए .	ట రో జ న , ఇది దా డి క మా ండ . ఉ ప సం హ రి ంచండి కానీ విమా నా నని గ మని సతూ ఉండ ండి .	0.6240
किस आ धा र पर कह रहे हो ?	దానికి ఏంటి ఆ ధా రం ?	0.4536
के ए 2 9 जी - के ए न डी ए म रा सता 2 9 4	కె ఎ 2 9 జి - కె . ఎ న . డి . ఎ మ 2 9 4 వ ట రా క	0.6812
रुको , रुको .	ఆగు , ఆగు .	0.3892
यह फै सला मेरे अ धी न है .	అది ఖ చచి త మెన హా మీ .	0.5859
यह उन में से एक है !	అతను కూడా వాళ లలో ఒక డు !	0.5049
नहीं , हम कुछ दूसरे फ लै ट ों में देख ते हैं .	లేదు . లేదు , మేము మి గ తా ఫ లా ట స లో కూడా కను కకు ంటా ము .	0.5675
इस अ पार ट में ट के . बी स मिनट पहले .	ఈ అ పార ట మె ంట నుండి . ఇ ర వె నిమిష ాల కింద ట .	0.5970
जब यह सब हो रहा था , सक ूल से फोन आया था . बॉ बी की त बि य त ठीक नहीं है .	ఈ హ డా వు డి జరుగు తునన ంత సే ప ూ , ఆ స కూ లు ఫోన రి ంగ అవు తూ నే ఉంది . బా బీ ఆ రో గ యం బాగా లే ద ట .	0.6720
वे उसे किसी भी हा लत में जि ंदा नहीं छोड ेंगे .	వాళలు ఆమె ని ఎలా గ ెనా చం పే య బో తుననారు .	0.5926
सै म , अगर जो तुम कह रहे हो , वह सच है तो . . .	సా మ , నువవు చెపపే ది నిజ మే అయితే . . .	0.6279
यह ली जिए . उनहोंने आपका फोन मुझे दे दिया था .	ఇది గో . వాళలు నీ ఫోన ని నాకు ఇ చచా రు .	0.5787
मैंने तुमसे कहा था . वह हमारे साथ नहीं है .	నీకు చెపపా ను . ఆమె లో మ ాలో ఒక రు కాదు .	0.5945
वे तुमहें मार ने आ रहे हैं .	వాళలు నినను చం ప డానికి వ సతుననారు .	0.4459
- उसने गोली मार दी . - किस ने ?	- ఆమె ఆ య నని కాల చేసి ంది . - ఎవర ని ?	0.5501
इसे नीचे रख ो !	దానని కింద పడ ే య !	0.4716
उसके रा स ते में आने वाली जग हों को	మేము భా రీ గా ఇంకా అత య వ సర ంగా	0.5787
चार मिनट में .	నాలు గు నిమిష ాలు .	0.3093
हाँ , सही कहा .	అవును , ఖచచితంగా .	0.4387
अ मैं डा , मो टर वे के बारे में बात करना बंद करो . पलीज .	ర హ దారు ల గురించి మాటలాడ టం ఆ పు , అమ ండా . పలీజ .	0.6265
कम बस टर में आ ग बु झ रही है ? तुमहारा सा रा ई ं धन खतम हो गया है ?	మీ ఇం ధ నం అయి పోయి ందా ? మొతత ం ఇం ధ నం ఖ రచు చేసే శా రా ?	0.6451
" नहीं बताया गया था . "	" ఎవరూ చెపప లేదు . "	0.5146
