Hindi	Telugu	Similarity_Score
गु जा रात के मु ख य म ंत री	గు జ రాత ముఖ య మ ంత రి	0.5540
ताकि इन सै नि कों को जल द से जल द वि घ ा को ट के मो र चे पर भे जा जा स के .	కాబటటి , ద ళ ాలను వెంట నే వి ఘ ా కో ట పో సట కు పం ప బడ చచు .	0.6524
पर धा न म ंत री श री म ती इं दि रा गा ं धी ने एक सं देश में कहा है कि . . .	పర ధా న మ ంత రి ఇ ంది రా గా ం ధ ీ ఒక స ందే శా నని ఇ చచా రు .	0.6283
जब फ टे गा तो चि थ डे उडा दे गा .	అది ఇ పపటి కీ మిమమలని ము కక లు చే సతుంది .	0.5419
- ओ वर ए ंड आ उ ट . - सर .	- పూరతి గా ఓ డి పో తా ము - సర .	0.5111
सै न य खु फ िया पर मु ख	మి లి ట రీ ఇంట ె లి జె నస హె డ	0.5688
अब व हां से ना तो कोई ह वाई ज हा ज उडा न भर सकता है और न ही उ तर सकता हैं .	విమా నాలు అకకడ నుండి బయ ల దే ర లేవు , ఇంకా లా ండ అవ వ లేవు .	0.5876
इंसान बन कर आए थे	మేము మను ష ు లు గా జ న మి ంచా ము	0.3674
सब के परिवार को खबर कर दो .	పరతి ఒకక రి కుటుం బ ాల కు తెలియ జే య ండి .	0.4856
सभी लड के , अब ह वाई कष े तर पर . चलो !	అబబా యి లు , ఇపపుడు ఎ యి ర ఫీ ల డ లో ఉననారు రండి !	0.5778
क चछ के 5 0 परति श त हि स से में पा नी है	క చ లో 5 0 శా తం నీ రు ఉంటుంది	0.6056
ठीक है सर .	సరే , సర .	0.4310
कया मन सू बे है उन लोगों के ?	వారి ఉద దే శ ాలు ఏమి టి ?	0.5641
हमारे ज ं गी ह वाई ज हा ज से भ ु ज ह वाई अ ड डे पर 1 00 0 ब म	మన ఫె టర జె టలు 1 00 0 బా ం బు లను పడ ే శా యి	0.6245
हमें अपनी स थि ति बदल नी हों गी	మేము ఇపపుడు మా సథా నా లను మా రచు కో వాలి .	0.4859
मि ट टी है ये माँ हमारी मि ट ने को तैयार	ఇది మన మా త ృ భ ూ మి , దాని కోసం మన జీవి తా నని అర పి ంచ వచచు	0.5240
इस वकत क चछ में पा किस ता न के लि ये काम कर रहे है .	పా కి సతా న కోసం క చ లో పని చేసతుననా రు .	0.5716
हमें जलदी से जलदी वि घ ा को ट च ौ की पर और सै निक भेज ने पड ेंगे .	మన ము వి ఘ ా కో ట పో సట కు మరి నని ద ళ ాలను పం ప ాలి .	0.6519
त ू हमारी औ का त का अं दा जा कया लगा ए गा .	మా పరి మి తులు మీకు తెలియదు .	0.4538
जिस दिन ल डा ई जी त ूं गा उस ी दिन प ग डी पह न ूं गा .	నేను యు దధ ంలో గె లి చి న రోజు మాతరమే నేను ఈ తల పా గా ధ రి సతాను . .	0.5512
हम ी र की बि स मिल ला ह म सा ला फै कट री पर है .	హ రి పర ర వ పర గరా మా నికి పడ మర ఒక కి లో మీ టర దూ రం లో ఉంది .	0.5942
ह ॅ लो . ह ॅ लो कर सन . . .	హలో . హలో , కర స న .	0.5133
पा किस ता नी विमान ब म गि रा रहे है	పా కి సథా న విమా నాలు బా ం బు లు వి సు రు తుననా యి .	0.5215
म रा ठा बा ग , हम लै ंड के लिए तैयार हैं .	మ రా ఠ ా బా గ , మేము ల యా ండ చేయ డానికి సిదధ ంగా ఉననా ము .	0.5851
तो हि न दु सता न ते रे बा प की कहानी है .	అపపుడు భా ర త దేశం మీ త ండ రి .	0.5819
हमारे लि ये काम करने की कया की ं मत ल ेंगे आप .	మాకు పని చేయ డానికి మీ భ త యం ఎంత ?	0.5274
सर अगर हमारे जे ट स भ ु ज ह वाई अ ड डे पर उ ड ते रहे	సర , మా విమా నాలు ఉ ంచిన టల యి తే భు జ విమా నా శ ర యం మీద తి రుగు తోంది	0.5702
तब तक ये हि ंद ु सता न रहे	అలాగే ఓ మా త ృ భ ూ మి	0.5205
इस को रि पे यर करके मेरी हे ड क वार टर में बात करा ओ .	దీ నని బాగు చేసి మరియు ననను పర ధా న కార య ాల యా నికి క నె క ట చేయ ండి .	0.5830
क लि यर . रि पी ट .	కలి య ర . పు న రా వ ృ తం .	0.5925
तो हमारे सै नि कों के घ ा य ल होने का बहुत जयादा खत रा है सर .	అపపుడు మన స వ ంత ద ళ ాలు గా య పడ ే పరమా ద ం ఉంది .	0.6242
वि कर म सि ं ह ने 4 5 0 सै नि को के साथ अभी उडा न भ री है	వి కర మ సి ంగ 4 5 0 ద ళ ాల తో బయ లు దే రి ంది .	0.6645
लेकिन मेरे विमान का आगे का पह िया कष ति गर सत हो गया है .	కానీ నా విమానం య ొ కక ముందు చ క రం ద ె బబ తి ంటుంది .	0.6058
और भ ु ज ए यर पो रट पर 6 0 ब टा लि यन के जवा न है .	మరియు 6 0 మంది సె ని కు ల బె ట ాలి యన భు జ విమా నా శ ర యం లో ఉంది . .	0.6348
ठीक है , चार ली .	సరే , చా ర లీ .	0.4920
कयों ना हम रे गि सता न और द रि या के मु ं ह पर सि में ट की बो रि या डाल दे	మనం స ము దర నీ టి ని సి మె ంట తో ఎందుకు అడ డు కో కూడదు .	0.6230
कौन सा टा इ म ब म कब कहा ं फ ट ने वाला है , कुछ पता न ही है .	ఏ బా ం బు ఎ పపుడు పే లు తు ందో మాకు తెలియదు .	0.5700
कोई धन है कया	ఏ దీ వి లు వెన ది కాదు	0.3829
जी सा ब .	సరే అ ండి .	0.3285
इंसान बन कर आए थे	మేము మను ష ు లు గా జ న మి ంచా ము	0.3674
कोई धन है कया	ఏ దీ వి లు వెన ది కాదు	0.3829
कोई धन है कया	ఏ దీ వి లు వెన ది కాదు	0.3829
उ त त ल , जो ध पु र , अं बा ला , फ री द को ट , जै स ल मे र , ह ल वा रा और भ ु ज पर अ ट ै क करके दी या है . . . .	ఉ తత ర లె , జో ధ పూర , అ ం బ ాలా పర ీ కో ట , జె స ల మే ర , అ ల వా రా మరియు భు జ .	0.7487
ग द दा री की उस बु ढ े ने .	ఆ వ ృ దధ ు డు మాకు ద రో హం చేశా డు .	0.6064
उ नहीं पै स ों से ख री दा हुआ लो हा और बा रू द	మ ందు గు ండు సా మ గ రి మరియు పే లు డు ప దా రథ ాలు కొ ను గో లు చే సతే	0.6062
मेरे पति की तरह .	నా భ ర త లా గా .	0.4206
आप लोग साथ द ें या ना द ें .	మీరు నాకు సహా యం చేసి నా , చేయ క పోయి నా .	0.4240
जलदी . जलदी .	వే గ ంగా . వే గ ంగా .	0.2638
भ ु ज , 1 8 घं टे मे पहु ं च कर ,	మరియు 1 8 గంట లలో భు జ ను చే రు కుంటా యి .	0.5579
या हु क मे श हा द त दे दे	లేదా బ లి దా నం చేసు కునే సం కల పం	0.5448
म रा ठा सिरफ दो बात जानता है .	మ రా ఠ ాల కు రెండు విషయ ాలు మాతరమే తెలుసు .	0.4751
जवा नो . . .	అబబా యి లు . . .	0.5926
1 9 6 5 में पा किस ता न की ए यर फो रस ने	1 9 6 5 లో పా కి సతా న వె మా నిక ద ళ ం కాల చి వే య బడి ంది	0.5877
तो क चछ हि ंद ु सता न से कट जा ये गा .	అపపుడు క చ భా ర త దేశం నుండి వే రు చేయ బ డు తుంది .	0.5896
हे जग त निय ं ता दी न बं ध ु	పరపంచ ాల ర కష కు డు , నిర భయ మెన వయకతి	0.5251
इंसान बन कर आए थे	మేము మను ష ు లు గా జ న మి ంచా ము	0.3674
हर बा ल क नी ति नि धा न रहे	మరియు పరతి అబబా యి ద ృ ఢ ంగా ఉండాలి	0.4452
आज हमारे पास इतना बा रू द है	మా వ దద త గి న ంత పే లు డు ప దా రథ ాలు ఉననాయి	0.5334
हमें ये सू च ना बहुत देर से मिली .	మేము ఈ సమా చా రా నని చాలా ఆ ల సయ ంగా అ ందుకు ననా ము .	0.5456
मैं और मेरी भ जन म ंड ली ह वाई प ट टी बना ने आपके साथ आए ं गे .	నేను మరియు నా మొతత ం బ ృ ంద ం ఎ యి ర సట రి ప ను పు న రని ర మి ంచ డానికి మీకు సహా యం చే సతుంది .	0.6193
तो तुम हो ग द दार .	కాబటటి , మీరు దే శ ద రో హి .	0.4629
क माल की सोच .	బ ృ హ తత ర మెన ఆలోచ న .	0.4074
" जो पि जी ओ सो बि न से पर ो वो आज की का ल , "	" స ృష టి ంచ బడి ంది ఏదెనా నే డు లేదా రే పు నా శ నం చేయ బ డు తుంది . "	0.5695
चलो चलो .	ప రు గె తత ండి !	0.2996
मेरे बा बू जी . . .	మా నానన . . .	0.5530
ओ देश मेरे	నా భ ూ మి	0.3626
सर इससे आगे जाने में खत रा है .	సర . . . ఈ పర దే శా నని దా టి వెళల డం పరమా ద క రం .	0.5567
बा बा की बात भूल गया ?	మీరు త ండ రి మాట లు మర చి పోయా రా ?	0.4482
मार ना या मर ना .	చని పో వడం లేదా చం ప డం .	0.4299
ओ देश मेरे	నా భ ూ మి	0.3626
साह ब पे ट रो ल , डी जल और ते ल की दस बै र ल	సర , 1 0 బా రె లస పె ట రో ల , డీ జి ల మరియు ఇం జి న ఆ యి ల ఉ ంచండి	0.6407
एक वा दे के लिए दूस रा वा दा ट ू ट गया .	నేను మర ొక వా గ దా నం కోసం ఒక వా గ దా నా నని ఉ లల ం ఘ ి ంచా ను .	0.5734
आपको ह ॉ स पि ट ल जाकर एक स रे करवा ना चाहिए और थोडा आ राम करना चाहिए .	మీరు ఎ కస - రే మరియు కొ ంత వి శ రా ంతి తీసుకో వాలి .	0.5154
कया रण नी ति बना रहे हैं ?	వారు ఏ వయ ూ హా నని ప లా న చేసతుననా రు ?	0.5045
कौन बोल रहा है ?	ఎవరు మాటలాడు తుననారు ?	0.3817
ज य क न है या ला ल की . . .	శ రీ క ృష ణ ు డి మ హి మ	0.5711
हमने दे वी माँ कि सप थ ली हैं	మేము పరమా ణం చేశా ము .	0.4946
हा थी घ ो डा पा ल की	గుర రాల , ఏ ను గు ల , ప లల కీ	0.4901
दूसरे अ ट ै क की तै या री करो .	రెండ వ దా డి కి కూడా సిదధ ం గా వు ననా ము .	0.5703
व हीं तो रह ती है	అకకడ ే ఆమె నివ సి సతోంది	0.3854
हा थी घ ो डा पा ल की	గుర రాల , ఏ ను గు ల , ప లల కీ	0.4901
जी सर .	సరే , సర .	0.3701
ओ के ए ंड आ उ ट .	సరే మరియు బయటకు .	0.3638
तब तक ये हि ंद ु सता न रहे	అలాగే ఓ మా త ృ భ ూ మి	0.5205
है अ र ज ये दी वा ने की	ఇది నా అ భయ రథ న	0.4750
1 9 4 7 के ब ंट वा रे में पा किस ता न बना	1 9 4 7 వి భ జ న సమయం లో పా కి సతా న ఉ నికి లోకి వచచి నపపుడు	0.5975
हम बा ं ध उडा देंगे .	మేము దానిని పే ల చి వే సతా ము .	0.4753
इ म रा न सब बच चों को बं कर स में सु ला दो	ఇ మ రా న , పిలల లు అంద రి నీ బం కర లలో కి తీసుకు ని వెళళ ండి .	0.5873
कहाँ से आ रहे है आप ?	నువవు ఎ కకడి నుండి వ సతుననా వు ?	0.4597
मैंने आपको पा किस ता नी से ना का को ड वर ड दिया था . . . याद है आपको .	పా కి సతా న సె న యం య ొ కక కో డ పద ం మీకు గురతు ందా ?	0.5925
हम री से ना के 1 00 ट ै ंक और त करी बन 1 8 00 सै निक ,	1 00 ట యా ం కులు మరియు 1 8 00 ద ళ ాలు	0.6593
गी ली ज मी नों पे नहीं बल कि सु ख ी ला श ों पर ग डे गा तब आ स मान को छ ू ए गा .	కొతత ఎ త తులు సా ధి ంచ డానికి , కు పప లు కు పప లు గా ఉనన మ ృ త దే హ ాల పె న ఎ గర వే య డం మాతరమే మన కునన ఏ కె క మా రగ ం .	0.6674
और बा रह ब जे ओ मा नी से बात करने वाले है .	మరియు వారు అర ధ రాతరి ఒ మా ని ని సం పర ది ంచ డానికి వెళ తుననారు .	0.5363
जी ज बा ब .	అవును అ ండి .	0.4111
लेकिन किसी भी टा इ म ब म पर घ डी का टा इ मर न ही है .	కానీ వాటి లో దే ని పె నా టె మర లేదు .	0.4433
और दूसरे सै निक हमारी मदद के लिए नहीं आ जाते	మన ము మరి నని ఉ ప బ ల ాలను పొ ంద లే ము	0.5796
और एक भी नहीं हा रे .	అతను ఎపపుడూ కూడా ఓ డి పో లేదు .	0.4878
म ं जु र हमें जो भी त ू चु ने	మీరు ఏ ది ఎ ంచు కుననా నేను అ ంగ ీ కరి సతాను	0.5268
जिन होंने मु गल ों को घु ट ने पे ला दिया था .	ఎవర ె తే మొ ఘ లు లను మో కా ళల పె న కూ రచ ొ నే లా కింద కు ది ంచా రో వారు .	0.5967
2 0 जवा न बा ं ध पर र हें गे .	ఆన క టట పె 2 0 ద ళ ాలు	0.5967
या ह या खा न ति ल मिला उठा .	యా హ యా ఖ ా న కి కో పం వచచే లా చేసి ంది .	0.4155
भर ती से द रि या का पा नी	స ము దర నీ రు అ ధి క ఆ టు పో టల సమయం లో	0.5575
और अब मैं चाहती ह ूं अ ल ला ह	మరియు ఇపపుడు నేను కో రు కు ంటు నన ది ఒకక టే	0.4815
दु श मन को पी ठ नहीं दिखा ई	ఎ పపటి కీ శ తరు వు కు నా వె నను చూ ప లేదు .	0.5560
सर हम य हां जा मन गर में है और ये वि घ ा को ट ,	మేము ఇకకడ జా మన గర లో ఉననా ము . మరియు ఇకకడ వి ఘ ా కో ట ఉంది .	0.6046
जी जना ब .	అవును అ ండి .	0.4099
ब हे ख ून मेरा तो हि न दु सता न के लि ये .	పరతి చు కక రక తం కు డా నేను నా భా ర త దే శా నికి అర పి సతాను .	0.5942
" है लि ये ह थ िया र दु श मन ता क में बैठ ा उ ध र . "	" మ ండు తునన తు పా కు లతో కాల పు లు జర ప డానికి శ తరు వు సిదధ ంగా ఉననాడు . "	0.6173
इस को पह चा न ते हो ?	మీరు దీని ని గుర తి ంచా రా ?	0.4576
पूछ ना उससे कि मेरा वा दा नि भा ए गा	అతను నా వా గ దా నా నని ని ల బె టటు కుంటా డా అని అడ గ ండి .	0.4609
खु दा हा फि ज .	వీ డ కో లు .	0.4771
हमने ल डा ई जी त कर भी	యు దధ ంలో గె లి చి న తరవాత కూడా	0.5110
तो ये बो त ल दस गो लि यों का काम करे गी .	మరియు ఈ సీ స ాలు ప ది బు ల లె టలు గా సమా న ంగా ఉ ప యో గ పడు తుంది .	0.5759
सा यर न ब ज ने का मतलब है कि	ఈ సె ర న మో గి నపపుడు	0.5424
और वो था र पार कर वाला अब बू .	మరియు థా ర పార కర గరా మా నికి చె ంది న అబ ూ .	0.4810
वो तो हमारी तरफ ही आ रहा हैं .	ఇది మన వెపు వ సతోంది .	0.4656
सर आपने जो मार कि ंग दी थी उस हि सा ब से सारे सै नि कों की प ले स में ट कर दी ग य ी है .	మీరు చెపపి న గురతు ల పర కా రం ద ళ ాలు ఏ ర పాటు చేయ బడ డా యి .	0.6309
ब म ों की गि न ती और अं क न शुरू करें .	బా ం బు లను లె కకి ంచడం మరియు గుర తి ంచడం పరా రం భి ంచండి .	0.5087
हमारे दस जा सूस	ప ది మంది మన గ ూ ఢ చా రు లు	0.4504
तो हमने भाई को खा ली हाथ नहीं भे जा .	మాకు బాగా తెలుసు మా సోద రు డు ఖ ా ళ ీ చే తు లతో పం ప డం కంటే	0.5402
तब तक दु श मन हमारी च ौ की पार करके क चछ में पै र नहीं रख पा ये गा .	శ తరు వు ఈ పో సట దా టి క చ లో అడుగు పెటట లే డు	0.6170
और त ें और बचचे बं कर स में .	బం కర లలో మ హి ళలు మరియు పిలల లు ఉననారు .	0.4670
अपने म रह ू म भाई को याद करके , अपनी क सम दो हरा ओ .	మీ ది వ ంగ త సోద రు డి గురించి ఆలోచి ంచి మీ పరతి జ ఞ ను పు న రా వ ృ తం చేయ ండి . . .	0.5642
" और हम तैयार है सी ना लिए अपना इ ध र . "	" మరియు నేను పరతి బు ల లెట తీసుకో వడానికి సిదధ ంగా ఉననాను . "	0.5259
पर च मे सि ता रा और हि रा ल .	న కష తరం మరియు నె లవ ంక కలి గి న జె ండా .	0.5263
सु ंदर बे न ! सु ंदर बे न !	- వర ధి లల ాలి . . . - సు ంద ర బె న !	0.5269
सु ंदर बे न ! सु ंदर बे न !	- వర ధి లల ాలి . . . - సు ంద ర బె న !	0.5269
और य हां हम पा किस ता नी अ वा म को अपने ही मु ल क के लोग ो को ये झूठ बोल रहे है	మరియు మేము మా స వ ంత మను ష ు లతో అబ దధ ం చెబు తుననా ము	0.5904
मान व को प थ का पता रहे	మా న వు లు తమ మార గా నని తెలుసు కో వాలి	0.4545
भगवान कृ ष ण ची र देने नहीं आए ं गे .	అపపుడు శ రీ క ృష ణ ు డు మన గ ౌ ర వా నని కా పా డ టానికి రా డు .	0.5896
इ शक हुआ हो गया	నేను పరే మ లో ఉననాను అని	0.4166
सब का चि रह रण होगा स रे आ म .	పరతి ఒకక రూ బ హి రం గ ంగా తొ ల గి ంచ బడ తారు .	0.5706
और बाकी के ह वाई अ ड डे के र न वे को रि पे यर कर रही है .	జె స ల మే ర , అమ ృ త సర ఇంకా ఇ తర ర న వే లు .	0.6509
- कष े तर साफ करें . - सर .	- పరా ంతా నని శు భ రం చేయ ండి . - సర .	0.5660
सर म रा ठ ी हूँ जान जाए गी लेकिन जु बा न नहीं .	నేను మ రా ఠ ీ ని . నేను నా జీవి తా నని వ దు లు కో గలను కానీ నా మాట ను కాదు	0.5248
कया हम बना स का ठा हो कर भ ु ज पर कब जा न ही कर सकते ?	మన ము బ నస కా ంత మరియు భు జ ను సవా ధ ీ నం చేసుకో వడానికి ఎందుకు దా రి మళ లి ంచ లే ము ?	0.5602
पे ट रो ल और फ यू ल भर के सो डा बो त ल रख दि ये है .	ఒకక ొ కక టి 3 0 అడుగు ల లో తు లో పె ట రో ల మరియు ము డి చ ము రు తో ని ం పి ఉంది .	0.6314
