Hindi	Telugu	Similarity_Score
गो लि यों की लो री सुन के लं बी नि ंद सो जाए ं गे	మేము తూ ట ాల ల ాలి వి ంట ూ వి శ రా ంతి తీసు కుంటా ము	0.6094
त ू ना ल मेरे बेह जा	మరియు నాతో ఉండ ండి	0.4710
त ू ना ल मेरे बेह जा	మరియు నాతో ఉండ ండి	0.4710
वि घ ा को ट च ौ की पर हमारे सिरफ 1 2 0 जवा न और एक प ग गी है .	పా కి సతా న 1 8 00 ద ళ ాలు మరియు 1 00 ట యా ం కులు ని ఆ ప డానికి	0.6789
कयोंकि हमें भी उस रा स ते से भ ु ज तक पहुँच ने में 4 8 घं टे का वकत लगे गा .	ఎందుకంటే మాకు కూడా ఆ మా రగ ం ద వా రా భు జ చే రు కో వడానికి 4 8 గంట లు కావాలి .	0.6507
ज य हि ंद ! !	జె హి ంద ! !	0.4813
सु ंदर ये सोच अगर हम मर ग ये तो हमारे बच चों का कया होगा ?	మనం చని పోయి న టల యి తే మన పిలల లకు ఏమి జరుగు తు ందో ఊ హి ంచండి .	0.6156
और या ह या खा न का श री म ती गा ं धी के साथ चा य पी ने का सप ना	మరియు శ రీ మ తి గా ం ధ ీ తో టీ ప ంచుకో వడం యా హ యా ఖ ా న గా రి కల	0.6235
हमारी फ ौ ज ें पू र वी पा किस ता न की ओर तै ना त हो गई	మా బ ల గ ాలు త ూర పు పా కి సతా న వెపు మో హ రి ంచ బడ డా యి .	0.6616
ऑ परे शन च ं गे ज खा न भ ु ज .	ఆ పరే షన చే ం జ ఖ ా న , భు జ .	0.7071
तेरी ध ूल से बढ के	నా దేశం నే ల కంటే	0.5116
तेरी ध ूल से बढ के	నా దేశం నే ల కంటే	0.5116
तेरी ध ूल से बढ के	నా దేశం నే ల కంటే	0.5116
त ू बा ग है मेरा	నువవు నా స వర గం	0.5064
त ू बा ग है मेरा	నువవు నా స వర గం	0.5064
त ू बा ग है मेरा	నువవు నా స వర గం	0.5064
ज य श री राम !	జె శ రీ రా మ !	0.4609
हम इन बो त लों को दु श म नों पर फ े क ेंगे और फिर इन बो त लों पर फा यर करेंगे .	మేము ఈ సీ స ాలను శ తరు వు ల పె న వి సి రే సి మరియు వారి పె కాల పు లు జ రు పు తా ము .	0.6260
आप आ धे घं टे बाद वि ज य साह ब को म ं दि र लेकर आ जा ई ये .	3 0 నిమిష ాల తరవాత మే జర సా రని ఆ ల యా నికి తీసుకు రండి .	0.6369
अ ल वि दा के आँ सू और 7 5 करो ड रु प ए जाते - जाते उनके हाथ पर रख दि ये .	మేము కొంచెం క ననీ ళల తో మరియు 7 5 కో టల రూ పా య లు వారి ని పం పి ంచా ము .	0.7007
आप पो सट अपने 1 2 0 साथ ि यों के साथ संभाल ली जिए .	మీ 1 2 0 మంది సె ని కు లతో ఈ పో సట బాధ యత వ హి ంచండి .	0.6613
गो लि यों की लो री सुन के लं बी नि ंद सो जाए ं गे	మేము తూ ట ాల ల ాలి వి ంట ూ వి శ రా ంతి తీసు కుంటా ము	0.6094
साह ब पा किस ता नी से ना की तीन ब टा लि यन 1 00 ट ै ं को के साथ	సర , మూ డు బె ట ాలి యన లు , తో పాటు 1 00 మంది పా కి సథా న సె న యం	0.6692
पा किस ता नी से ना 1 00 ट ै ं कों की रे जी में ट के साथ 1 8 00 सै निक लेकर रात 1 1 ब जे तक पहु च जाए गी .	పా కి సథా న సె న యం వారి 1 00 ట యా ం కు లతో మరియు 1 8 00 మంది ద ళ ాలు రాతరి 1 1 గంట లకు చే రు కుంటా యి .	0.7535
1 9 6 8 , में कर न ल ना यर ने हि ंद ु सता नी से ना कि ओर खेल ते हुए	కల నా య ర ఇ ండి యన ఆర మీ కి పరా తి ని ధ యం వ హి సతునన పపుడు 1 9 6 8 లో ,	0.7044
उस कु ए ं वाले घर के पास जरूर ठ हर ना	బా వి దగగర ఉనన ఇంటి ని మి స చేయ వదదు .	0.6106
मैं जानता हूँ कि मु का ब ला मुशकिल है .	ఇది పరమా ద కర మెన పని అని నాకు తెలుసు .	0.5545
हमारे पास ब म डि फ यू जर सू ट भी नहीं है .	మన దగగర బా ం బు డి ఫ యూ జర సూ ట కూడా లేదు .	0.6654
आज इसी हि ंद ु सता न के लि ये हमें लड ना है .	ఇపపుడు మనం అదే భా ర త దేశం కోసం పో రా డ ాలి .	0.6470
त ू जग न ु भ ु ला के त ू ना ल मेरे बेह जा	పరప ంచా నని వి డి చి పె టటి నాతో ఉండ ండి	0.5576
पू र वी पा किस ता न के लोग उ र दू की जगह बा ंग ला भा ष ा बोल ते थे .	త ూర పు పా కి సతా న య ొ కక పర ధా న మా ండ లి కం బ ంగ లా ఉ ర దూ కు బ దు లు గా	0.7077
इस हार को जी त में बदल ने के लिए हमारे पास तीन रा स ते है .	ఈ ఓ ట మి ని వి జ య ంగా మా రచ డానికి మాకు మూ డు మా రగ ాలు ఉననాయి .	0.6085
ज य हि ंद !	జె హి ంద !	0.3777
न ब बे लोगों का ए यर पो रट का स टा फ है , और	వా రికి 9 0 మంది సి బబంది ఉననారు , మరియు	0.4946
न ू रा , भी मा , अ ल ता फ , वि र न , वा हि द , ल ती फ , मी राम ड	న ూ రా , భ ీ మా , అ ల తా ఫ , వి రా మ , వా హి ద , ల తీ ఫ , వి రా మన	0.6710
मेरे हि ंद ु सता न को सला मत रख ना .	నా మా త ృ భ ూ మి ని కష ే మ ంగా ఉ ంచండి .	0.5436
क मा ं डि ंग ऑ फि सर भ ु ज ह वाई अ ड डा .	క మా ండి ంగ ఆ ఫీ సర , భు జ ఎ యి ర ఫీ ల డ .	0.6856
हमारी कि सम त में मर ना लि खा होगा तो हमें कोई नहीं बचा पा ए गा .	మన ము చని పో తా ము అని వి ధి అయితే అపపుడు మన లని ఎవరూ ర కషి ంచ లే రు .	0.5861
बो ले सो नि हा ल . . .	నీ పేరు అంత టా . . .	0.6328
अगर भ ु ज ह वाई अ ड डा पा किस ता नी से ना के कब जे में आ गया	పా కి సతా న సె న యం భు జ విమా నా శ ర యం పె నియ ంత రణ తీసుకు ంటే	0.6710
लेकिन वि घ ा को ट तक हमारे सै निक पहु ं च जाने चाहिए .	కానీ మన ద ళ ాలు తపప క వి ఘ ా కో ట పో సట కు చే రు కో వాలి .	0.6234
उसके बाद भी दिल ली को उडा ने के लिए हमारे पास दस टर क बा रू द बच जाएगा .	మేము ఢ ి ల లీ ని పే ల చే ందుకు ఒక డజ ను టర కకు లను పే లు డు ప దా రథ ాల తో ని ంపు తా ము .	0.6327
अभी - अभी मौ ला ना ने पा किस ता न के ब दी न से मुझे खबर दी है .	మ ౌ లా నా ఇ టీ వల పా కి సతా న బా ది న నుండి నాకు వార తలు ఇ చచా రు	0.6380
और आज वि ज य सर उ ष ा मैडम को अपने दिल की बात बता ए ं गे .	మరియు ఇపపుడు సర అతని భా రయ ప టల భా వాల ను వయ క తం చేసతా డు	0.6767
यह लै ं डि ंग सं भ व नहीं है भाई .	ఈ ల యా ండి ంగ సా ధ యం కాదు సోద రా .	0.6077
अगर आज हमने अपने देश की मदद नहीं की	కానీ మనం మన దే శా నికి సహా యం చేయ కపోతే	0.5140
5 00 सै नि को का व जन जयादा है सर .	5 00 ద ళ ాల బ రు వు చాలా ఎకకువ , సర .	0.6515
एक मु स ल मान हो कर पा किस ता न के साथ ग द दा री की बात करती हो .	ఒక ము స లి ం అయి ఉ ండి కూడా , మీరు పా కి సథా న కు ద రో హం చేశారు .	0.6498
भ ु ज ह वाई अ ड डे पर वि ज य कारण ि क र न वे रि पे यर कर रहे है और व हां पे मैं प ले न उ ता रू ं गा .	వి జ య కార నిక ర న వే ని రి పే ర చేసతుననా డు కను క నేను ఈ విమా నా నని అకకడ ల యా ండ చేయ బో తుననాను .	0.6814
बात ू नी अ ँ ख ियाँ कर दी ऐ ब त ियाँ	నీ క ళలు తెలియ జే సతూ నే ఉంటా యి	0.5065
हम उस म हा न छ तर पति शि वा जी म हा राज की औ ल द है . . .	మే ం గొపప వా రెన ఛ తర ప తి శి వా జీ మ హా రా జ కొ డు కు ల ము .	0.6537
की चाह े लो हे के क पडे पह नो	మీరు ఇ ను ప సూ టలు ధ రి ంచి నా ,	0.5826
वो सब इस वकत ह रि पर र वा पर से एक कि लो मी टर प श चि म मे	వారు పర సతు తం హ మీ ర బి స మి లలా స పె స ఫ యా క ట రీ లో ఉననారు .	0.6522
और 2 4 सै निक आज शा म बो ट से आपकी च ौ की पर आने के लिए निकल चु के है .	మరియు 2 4 ద ళ ాలు మీ పో సట చే రు కో వడానికి స ము దర మా రగ ం ఎ ంచు కుననా యి .	0.6962
भ ु ज पहु ं च ने वाले सारे रा स ते पा किस ता नि यों ने तो ड दि ये है सर .	పా కి సథా నీ యు లు భు జ కు వెళ లే అనని ఇ తర మా రగ ాలను నా శ నం చేశారు .	0.6811
2 0 जवा न मेरे साथ ना ले से उस तरफ व हां र हें गे .	2 0 మంది సె ని కులు నాతో క ాలు వ కు ఆ వెపు న ఉంటా రు .	0.6354
और उनहोंने जो भी ज ंग ल डी ध र म के लिए	అతను తన మ తం కోసం ఈ యు దధ ాలు చేశా డు .	0.6335
सर दार जी जे मे न ु कुछ हो गया ते मेरी पर ी तो को संभाल लेना	సర దా ర జీ , నాకు ఏదెనా జరిగి తే తరవాత పర ీ టో ను చూ సుకో ండి .	0.6372
रण छोड भाई प ग गी	రా ంచ ో డ భా య ప గి	0.4939
मो हम म द हु सै न ओ मा नी .	ఎ ండి . హు స సే న ఒ మా ని .	0.6466
कयोंकि कमी ज के ट ू टे हुए ब टन से लेकर ट ू टी हुई हि म मत तक	ఎందుకంటే వి రిగి న చ ొక కా బ టన నుండి వి రిగి న ధ ె ర యం వర కు	0.6401
और उनका रह न स ह न प श चि मी पा किस ता न के लोगों से थोडा अलग था .	మరియు వారి జీ వ న శ ె లి ప శ చి మ పా కి సతా న కంటే పూరతి గా భి నన మెన ది .	0.6193
लेकिन हि ंद ु सता न का एक ब डे से इ ला के पर कब जा हो चुका है .	కానీ భా ర త దేశం వి సతా ర మెన పరా ంతా నని సవా ధ ీ నం చేసు కు ంది .	0.6509
ए ं टी - ए यर ग न फा य रि ंग रो क दो !	యా ంట ీ - ఎ యి ర గ న కాల చ డం ఆ ప ండి !	0.6935
ऑ परे शन ह ूर .	ఆ పరే షన హ ూర .	0.5938
इस ऑ परे शन का को ड ने म है च ं गे ज खा न .	ఈ ఆ పరే షన య ొ కక సం కే త నా మ ం చే ం జ జ ఖ ా న	0.7185
प श चि मी पा किस ता न और पू र वी पा किस ता न .	ప శ చి మ పా కి సతా న మరియు త ూర పు పా కి సతా న	0.5958
बता दो इन कम जर फो को	ఈ రా స కల స కు చూపి ంచు	0.5217
हम ले से पा ं च दिन पहले	దా డి కి 5 రోజు ల ముందు .	0.5306
और त के लिए सबसे अन मो ल है उसका घर .	ఒక మ హి ళ కు ఆమె ఇ లలు అత య ంత వి లు వెన ది	0.6343
जि कर में शा मिल मेरा नाम हो	నా పేరు కూడా పర సతా వి ంచాలి	0.5016
र न वे रि पे यर करने वाले परा इ वे ट वर कर स और इं जि नी अ रस भाग ग ये है .	అనని పర ె వే ట ఇం జ నీ రలు మరియు కార మి కులు భు జ నుండి పా రి పోయా రు .	0.6473
ज य श री राम !	జె శ రీ రా మ !	0.4609
त बा ही का ऐसा आ ल म था कि देख ने वाले की हि म मत ट ू ट जा ये .	ఇలా ంటి వి ధ వం సం ఎలా ంటి వారి నె నా ని రు త సా హ ప రు సతుంది .	0.6442
उसे वि घ ा को ट पहु ं च ने में कम से कम 2 8 घं टे लग ने वाले हैं .	వా రికి క నీ సం వి ఘ ా కో ట చే రు కో వడానికి 2 8 గంట లు పడు తుంది .	0.6839
" अ ल ला ह के सि वा , एक अके ला , बिना सा थी के , "	" అ లలా హ తపప , ఒ ంట రి గా , భా గ సవా మి లే కుండా , "	0.6406
अ क बर की नौ ट ं की .	అ క బర పరి యు ర ాలు .	0.6198
ह ॅ लो कर सन .	హలో , కర స న .	0.5398
भ ु ज ह वाई अ ड डे के इं चार ज वि ज य कारण ि क र न वे को किसी भी तरह रि पे यर करें .	భు జ విమా నా శ ర యం క మా ండి ంగ అ ధి కా రి వి జ య కార నిక ర న వే ను బాగు చేసతా డు .	0.6985
अगर सु बह तक र न वे रि पे यर नहीं हुआ	వే కు వ జా ము న ర న వే మర మమ తులు చేయ కపోతే	0.6053
वि घ ा को ट च ौ की पर हमारे कि तने सै निक हैं ?	మన దగగర వి గా కో ట వ దద ఎ నని ద ళ ాలు వు ననా యి ?	0.6409
उसे किसी की ज मी न छ ी न ने का कोई श ौ क नहीं .	వారు ఎవరి భ ూ మి నీ దో చు కో వడానికి ఇష ట పడ రు .	0.6056
भी मा , अ ल ता फ , वी र न , जा हि द , ल ती फ	భ ీ మా , అ ల తా ఫ , వి రా న , జా హి ర , ల తీ ఫ	0.6254
कयोंकि हमारा भ ु ज ह वाई अ ड डे के साथ कोई सं पर क नहीं है .	ఎందుకంటే భు జ విమా నా శ రయ ంతో మనకు ఎలా ంటి క మ యూ ని కే షన లేదు .	0.6466
और बा कि के जवा न प ग गी के साथ ना ले के इस तरफ र हें गे .	మరియు మి గి లి న వి ప గి తో క ాలు వ య ొ కక ఈ వెపు ఉంటా యి .	0.6633
लेकिन भ ु ज को जयादा न ु क सान नहीं पहु ं चा स के .	కానీ వారు భు జ కి చాలా న ష టం కలి గి ంచ లేక పోయా రు	0.6233
ऐसा मत क हो .	అలా అన క ండి .	0.4490
ल कष म ण . . . आप ह वाई अ ड डे पर रू कि ये .	లకష మ ణ . మీరు ఎ యి ర ఫీ ల డ లో వే చి ఉండ ండి .	0.7101
कि हम ग ं गा और ज मु ना दोनों को पा ट द ें	గ ంగ మరియు జ ము న వి డి పోయి న తరవాత కూడా	0.6030
रो जर , पर हे ली कॉ प टर से आने में आप लोगों बहुत खत रा है .	రో జర , కానీ హె లి కా ప టర ద వా రా పర యా ణం పరమా ద క రం కా వచచు .	0.6624
सभी ब म को एक फ यू ज के साथ क ने कट कर दो	అనని బా ం బు లను ఒక ే ఫ యూ ర కు క నె క ట చేయ ండి	0.6384
और हमारे बच ने का चा ंस है एक परति श त .	మన మను గ డ కు ఒక శా త ంత మాతరమే వు ంది .	0.6561
आज रात को 1 1 ब जे हमारी च ौ की पर हम ला करने वाले है .	ట యా ం కులు దా డి చేయ బో తుననా యి మా పో సట రాతరి 1 1 గంట లకు .	0.6501
" अ ल ला ह के सि वा , एक अके ला , बिना सा थी के , "	" అ లలా హ తపప , ఒ ంట రి గా , భా గ సవా మి లే కుండా , "	0.6406
ले फ टन कर न ल ना यर भी अपनी पर ं परा पर ड टे हुए हैं .	లె ఫ టి నె ంట కల న ల నా య ర ఈ సం పర దా యానని స జీ వ ంగా ఉ ంచారు	0.6450
दिल ली में बैठ करके चा य प िए ं गे .	ఢ ి ల లీ లో ఒక క పపు టీ ప ంచు కుంటా ము .	0.6322
तक हमें दु श मन को रो क ना होगा .	మన ము శ తరు వు లను ద ూర ంగా ఉ ంచాలి .	0.5863
सि ल वर फा र मे शन .	వె ండి నిర మా ణం .	0.4823
पापा .	పా పా .	0.2635
ध र म है .	స రెన ది .	0.5480
लेकिन पा किस ता नी ए यर फो रस ने पा ं चो रा स ते और भ ु ज ह वाई अ ड डे को त बा ह कर दिया है .	కానీ పా కి సతా న ఎ యి ర ఫో రస మొతత ం ఐ దు మా రగ ాలు మరియు భు జ విమా నా శ ర యానని నా శ నం చేసి ంది	0.6817
आप अपना आगे का पह िया टर क के कै रि अ र पर लै ंड दी जिए गा .	మీరు మీ ముందు టె ర ను టర క క యా బి న మీద ల యా ండ చేయ వచచు .	0.6737
और भ ु ज जाने वाले पा ं चो रा स ते भी	మరియు భు జ కు వెళ లే ఐ దు మా రగ ాలు	0.5970
इस बात के लिए अ गा ह किया गया है हमें इसलिए हमें खबर रख नी होगी .	మేము దీని గురించి హె చచ రి ంచా ము కాబటటి మనం అ పర మ తత ంగా ఉండాలి .	0.5973
हमें र न वे बना ने के लिए ई ंट पत थ र ों की जरूरत थी .	ర న వే నిర మి ంచ డానికి మనకు ఇ టు కలు మరియు రా ళలు అవసరం	0.6232
और उनकी खु फ िया जान का रि या ं जु टा ना .	మరియు కీ ల క సమా చా రా నని సే కరి ంచడం .	0.5626
मार दो इसे .	అత డని చం పు .	0.4990
वापस आ जाओ . तु र ंत वापस आ जाओ .	తిరిగి రా . వెంట నే తిరిగి రండి .	0.4558
लेकिन सर इस हम ले मे बल जी त और वि कर म सि ं ह के विमान को खो दी या है .	కానీ సా ర , మేము బ ల జీ తను మరియు వి కర మ సి ంగ విమా నా నని కో ల పోయా ము .	0.6591
मैं अपने देश की और अपनी इ जज त आपके च रण ों में रख के जा रहा ह ू .	నేను నా దే శ గ ౌ ర వా నని , మరియు నా గ ౌ ర వా నని మీ చే తు లలో పె డు తుననాను .	0.6164
अगर दु श मन के हम ले में किसी की जान च ली ग य ी	దా డి సమయం లో ఎవరెనా వారి జీవి త ాలు కో ల పో తే	0.5906
उन सारे पा किस ता नी जा सू सो की लो के शन ट रे स हो ग य ी है .	పా కి సథా నీ గ ూ ఢ చా రు ల య ొ కక అనని సథా నా ల న గుర తి ంచా ము .	0.6580
तो उसके दो हि स से हुआ करते थे .	దానిని రెండు భా గ ాలు గా చేసి ంది .	0.5133
म रा ठा बा ग दु श मन रात 1 1 ब जे वि घ ा को ट च ौ की पर हम ला करे गा .	మ రా ఠ ా బా గ , శ తరు వు రాతరి 1 1 గంట లకు వి ఘ ా కో ట మీద ము టట డి చేసి	0.7098
