Hindi	Telugu	Similarity_Score
आपने ही यह कहा था .	ఆ మాట నువవే అననా వు .	0.5087
कमी ना कहीं का . मुझे पता है तुम कया करने की कोशिश में हो .	చెతత వెధవ . నువవు ఏం చేయ డానికి చూ సతుననా వో నాకు తెలుసు .	0.5960
मेरा मतलब , कोई भी हतया रा हो सकता है .	అంటే , ఈ పని ని ఎవరెనా చేసి ఉండ ొ చచు .	0.5247
वह बेवकूफ नहीं है .	అతను స ననా సి కాదు .	0.5068
- कया तुमहारे पास अस ली अ ंग ूठ ी है ? - हाँ , गल व बॉ कस में .	- నీ దగగర నిజ మెన ఉ ంగ రం ఉందా ? - అవును , గ లో వ బా కస లో .	0.7139
तुम बेहद आकर ष क हो .	నువవు భలే ఉననావు .	0.3886
ठीक है . तो , अगर वि वि यन फै ंग को छोड ने वाली नहीं थी ,	సరే . ఇపపుడు , వి వి యన ఎ నన టి కీ ఫె ంగ ని వదిలే సమ స యే లేదు ,	0.6291
रुको . कया मैंने ऑ न ला इन यह पढ ा कि तुम लोग जे वि यर का कि र दार डे निय ल र ै ड क लि फ से करवा रहे हो ?	ఆగు . నేను ఆన లెన లో జే వి య ర పా తర ని డే నియ ల రా డ కలి ఫ పో షి సతుననా డు అని వి ననాను , నిజ మే నా ?	0.6746
- तुमने कर न ल को मार डा ला ? - शायद .	- నువవు కల న ల ని చం పా వా ? - అనుకుంటా .	0.6418
यह सब पूरी तरह से परि स थि ति जन य है .	ఇ దంతా స ంద ర భా ను సా రం అలా కనిపి సతోంది .	0.5673
हम कि सम त वाले थे कि पहले ही बे च . . .	అలా జరగ డం అద ృష టం అనే చెపప ాలి . . .	0.6566
तो , अब इस पर लौट ते हैं , कि एडगर की हतया किस ने की .	సరే , ఇపపుడు ఎడ గర ని హ తయ చేసిన వయకతి విష యా నికి వ దదాం .	0.6237
गि ला स बद ले गए थे . हमने अभी - अभी वी डियो में वह दिखा या .	ఆ గ లా సు లు మా రి పోయా యి . మేము అది వీ డి యో లో చూపి ంచా ం .	0.6257
हम बस चाहते हैं कि तुम हमें बताओ	నువవు ని నన రాతరి ఆ ఫ టర పార టీ సమయం లో	0.5412
माफ करना , पार ट नर .	కషమించు , పార టన ర .	0.5469
कयोंकि मैंने भी एडगर की हतया की .	ఎందుకంటే నేను కూడా ఎడ గర ని చం పా ను .	0.4943
ठीक है . किसी की हतया करने के लिए , ज रि या , म कस द और मौ का चाहिए होता है .	సరే . ఒక రి ని చం పాల ంటే , దానికి స ౌ ల భ యం , ఉదదేశం అలాగే అవకా శం కావాలి .	0.6266
पर वह यू लि सी स थे ,	కానీ అది యూ లె సీ స	0.5020
और मैंने तुम दोनों को वहाँ देखा .	అలాగే నేను మీ ఇదద రి నీ అకకడ చూశా ను .	0.5367
- नहीं . - मैं घर लौट ते हुए पर ो पो ज करने वाला था ,	- నేను నమమ ను . - ఇంటి కె ళళ ే ట పపుడు అడుగు దాం అను కుననా ,	0.6442
- नहीं , तुमने नहीं मा रा . - पर मुझे पकका यकीन है कि मैंने मा रा .	- లేదు , నువవు చం ప లేదు . - కానీ నేను ఖచచితంగా చం పే ఉంటా అనుకుంటుననా .	0.6079
और आ ख िर कार अभी - अभी अन ुम ति मिली .	చి వ రికి వాళళు ఇం దా కే ఒ పపు కుననా రు .	0.5341
कयोंकि मुझे बेहद बुरा लग रहा है .	ఎందుకంటే నాకు చాలా బాధ గా ఉంది .	0.4933
पकका तुम ही पू र व - पुलिस वाली होगी .	నువవే మా జీ పోలీసు వు అయ యు ంటా వు .	0.5692
जो उ क सा ए जाने पर बाहर आता है .	వచచే ఒక కో పి ష టి కో ణం నాకు ఉంది .	0.5804
{ \ an8 } तुम यहाँ कया कर रहे हो ?	{ \ an8 } నువవు ఇకకడ ఏం చేసతుననా వు ?	0.6319
मुझे तुमहारे ह ॉर न से पी ने दो .	నీ కొ మ ము లో నుండి ననను తా గ నివ వు .	0.5892
- और फिर मैंने न हर में उल टी की . - बहुत हुआ .	- అపపుడు నేను క ాలు వ లో వా ంతి చేసు కుననా . - చ ాలు .	0.5915
मैं इस पल को अचछा बना ने की कोशिश कर रहा हूँ . इसे ख रा ब मत करो .	నేను మంచి గా మాటలాడ దాం అని వచచా ను . ఈ స ంద ర భా నని పా డు చేయ కు .	0.6315
सु नि श चि त किया कि मैं ठीक र हूँ .	నాకు ఏం కా కుండా చూ సు కుననా వు .	0.5454
जब परे स को इसकी जानकारी मिले गी	పర ె స కి ఆ విషయం తెలి సి ంద ంటే ,	0.5149
शायद हम सभी वहाँ देख सकते हैं .	మనం అంద రం అందు లోకి వెళల ొ చచు .	0.5291
इ सा बे ल , चलो भी .	ఇ సా బె ల , ఊ రు కో .	0.6372
कयोंकि एडगर ने मुझे टो क दिया .	అడ గ డానికి నాకు వీ లు కాల ేదు .	0.5578
मैं उसे गिर फ तार कर रहा हूँ .	నేను ఆమె ను అ రె సట ు చేసతుననా ను .	0.5221
उसे वह ि स की पसंद भी नहीं है .	ఆమె కు వి స కీ అసలు న చచ నే న చచ దు .	0.5919
उनहें दिखा दी जिए , श री फै ंग .	వెళలి అద రగ ొ టట ండి , మిసటర ఫె ంగ .	0.5134
यह सच में बेहद बढिया श रा ब है .	ఇది చాలా మంచి క వాలి టీ మ ందు .	0.5263
उप - शी र ष क अनु वाद क : म ून क लि ता	స బ టె టి లస అ నువ ది ంచింది : జో సె ఫ	0.6226
सच कहूँ तो , मुझे मेरी माँ के अफ े यर होने की बात से जयादा है रा नी हुई .	నిజం చెపప ాల ంటే , మా అమమ అ కర మ సంబం ధం పెటటు కు ందని తెలి సి ఇంకా చ లి ంచి పోయా ను .	0.6430
ला इ ब रे री में ,	నేను లె బర రీ లో ,	0.5560
उसे ती स री बार कै ं सर हुआ था , हमने सोचा वह मर गया और उसे द फ ना दिया .	దానికి మూ డ వ సారి క యా న సర వచచింది , చచ చి ంది అను కుననా ం , పా తి పెటట ే శా ము కూడా .	0.6349
मैं भी यही महसूस करता हूँ .	నాకు కూడా అలాగే అనిపి సతోంది .	0.4669
ल ता ओं से , जैसे तुमने बना ई .	కా డ లతో , అ చచ ం నువవు చేసిన టటే .	0.5972
एडगर को लेकर तुमहारे और गरेस के बीच झ ग डा हुआ था . - हाँ .	- నువవు ఇంకా గరేస ఎడ గర విషయం లో గొ డ వ పడ డా రు . - అవును .	0.6714
- डै ड . - माफ करना , भा वना ओं में बह गया था .	- నా ననా . - కషమించు , మి తి మీ రి మాటలా డా .	0.6031
नहीं . सभी को उस अफ े यर के बारे में पता है .	కాదు . అంద రికీ ఆ సంబం ధం గురించి తెలుసు .	0.5356
अ नी क , तुम जो ई के लिए अचछे पति सा बि त हो गे .	య నిక , నువవు జో యి కి మంచి భ ర త వు అవు తా వు ,	0.6708
फिर कभी न जु दा होने के लिए .	ఇం కె పపటి కీ వి డి పో లే న ంత గా .	0.5627
- तुमहें लगता है ? - धनयवाद .	- అనుకుంటుననా వా ? - థాంక స .	0.5674
और तुमहारी वजह से , मैंने वि वि यन को अपनी मु सी ब त ों के बारे में बताया .	అలాగే నీ వల లే , నేను వి వి యన కి నా ఇ బబ ందు ల గురించి అంతా చెపపా ను .	0.6444
मुझे पूरा यकीन था कि हम इसे सु ल झा ल ेंगे .	మనం ఖచచితంగా పరి ష కరి ంచా ము అను కుననాను .	0.5804
देखो तुमहें ! तुम दोनों इतने पया रे हो !	భలే ఉననారు ! మీ రి దద రూ చాలా ము దద ొ సతుననారు !	0.5683
मैं नहीं चाहती थी कि तुम मेरे मा ता - पिता से पूछ ता छ करो	నేను మీరు మా అమమా నానన లతో మాటలాడ డానికి ఇష ట పడ లేదు ,	0.5536
हाँ , यहाँ गरेस इ कल ौ ती इंसान नहीं है जिस के हा ला त सं दे ह जन क हैं .	అవును , ఇకకడ అను మా నా స పద మెన పరిసథి తి లో ఉనన ది కేవలం గరేస మాతరమే కాదు .	0.6340
म कस द नहीं है .	ఉదదేశం లేదు .	0.3328
कया ? सच में ?	ఏంటి ? నిజంగా ?	0.4336
देखा . यह बढिया है , है न ?	చూశా వా . ఇది భలే ఉంది , కదా ?	0.5585
अस ली पुलिस ने अस ली सब ूत ढूँढ निका ला .	నిజ మెన పోలీసు లు కని పె టటి న నిజ మెన ఆ ధా రం .	0.5607
कयोंकि मैं जल द ही जो ई को पर ो पो ज करने के बारे में सोच रहा था .	ఎందుకంటే నేను తవర లో జో యి ని పె ళ లి చేసుకో మని అడుగు దాం అనుకుంటుననా ను .	0.5807
बस तुमहें बता द ूँ , मुझे कभी नहीं लगा था कि गरेस ने एडगर की हतया की होगी .	నీకు ఒకటి చెపప ాలను కుంటుననా ను , నేను ఎడ గర ని గరేస చం పి ఉ ంటు ందని అస స లు అనుకో లేదు .	0.6071
और फिर तुमने मुझे शा ंत करवा या और पूरी दो पह र मेरी पी ठ स ह ला ई ,	అపపుడు నువవు ననను శా ంతి ం ప జే సి , మ ధ యా హ నం అంతా నా వీ పు మీద రు ద దా వు ,	0.6393
मैंने कहा था कि मैं तुमहें तुमहारा ह ॉ ली व ु ड अ ंत द ूँगी .	నీకు నీ హ ాల ీ వు డ ము గి ంపు ద కక ే లా చేసతాను అని చెపపా ను కదా .	0.6364
और फिर यू लि सी स , प थि क जो अ मी र लोगों से न फ रत करता है .	అలాగే యూ లె సీ స , ధన వం తు లను ద వే షి ంచే ఒక స ంచా ర కు డు .	0.7121
अग ले म ही ने किसी पल , जब हमें बिलकुल उममीद नहीं होगी ,	వచచే నె ల ఏద ొక సమయం లో , మనం అస స లు ఊ హి ంచ ని సమయం లో ,	0.6364
अब मुझे अपनी कि ता ब लि ख ना फिर से शुरू करना होगा .	ఇపపుడు ఇక నేను తిరిగి నా పు సత కం రా య డం మొద లె డ తాను లే .	0.6250
इस न न हे कमी ने को मा रा नहीं जा सकता .	ఆ చెతత కు కక ని చం ప డం ఎవరి వల లా కాదు .	0.6232
वि वि यन , मैंने कोशिश की .	వి వి యన , నేను పరయతని ంచా ను .	0.5143
तुम फै ंग को मार ने की कोशिश कर रहे थे .	నువవు ఫె ంగ ని చం ప డానికి పరయతని ంచా వు .	0.5769
- उसने पै स ों के लिए उससे शादी की . . . - नहीं .	- ఆమె అత నని డబబు కో స మే పె ళ లి చేసు కొ ని . . . - లేదు .	0.6812
कयोंकि हम तुमसे काफी ब डे व की ल नि यु कत कर सकते हैं .	ఎందుకంటే మేము నీ క ననా మంచి లా య ర లను పెటటు కో గల ం .	0.6305
मैं नहीं चाहती थी कि वह मा रा जाए .	పరా ణ ాల మీద కు వ సతు ందని నేను అనుకో లేదు .	0.5162
हैलो ? कया अंदर कोई है ?	హలో ? లోప ల ఎవరెనా ఉననా రా ?	0.5039
मैंने भी उसकी हतया की .	నేను కూడా వాడిని చం పా ను .	0.4552
मैं तुमहें यह सा बि त करने के लिए पाँच मिनट द ूँगा कि यह हतया दु ल ह न ने नहीं , किसी और ने की .	పె ళ లి కూ తు రు కా కుండా ఇం కొ క రు ఈ హ తయ ను చేసా రు అని ననను ఒ పప ి ంచ డానికి మీకు అయి దు ని ము ష ాలు ఇ సతుననాను .	0.6467
- कया ? - फ ं कल यू लि सी स ?	- ఏంటి ? - ఫ న కు ల యూ లె సీ స ?	0.6849
अरे , वि वि यन .	ఓహ , వి వి యన .	0.4789
अब सब को पता चल गया है .	విషయం అంద రికీ తెలి సింది .	0.4249
पर पू र व - पुलिस वाली व रत मान पुलिस वाले को बता दे , तुमने अभी - अभी क इ यों के कब ूल ना मे सु ने .	కానీ మా జీ పోలీసు గా మీ తో చెప తుననాను , మీరు ఇ పపుడే చాలా మంది ఒ పపు కో వడం వి ననా రు .	0.6353
और तुम इस उ बा ऊ , द य नी य इंसान के साथ फ ँ सी नहीं रह ती . . .	అలాగే నువవు ఆ ప నికి మ ాలి న , దయ నీ య మెన ద రి ద రు డి తో ఉండ ాల సిన . . .	0.6956
वैसे मैं बता द ूँ , मैंने उसकी हतया की .	నే నె తే వాడిని చం పి ంది నేనే అని చెప తుననా .	0.5164
- तुम सच में पागल हो , जो . - वह तो हूँ . यहाँ आओ .	- నీకు మ తి పోయింది , జో . - నిజంగా నే . ఇలా రా .	0.6314
और उससे यह समझ आ जाएगा कि एडगर ने मर ने से तु र ंत पहले कया कहा था .	ఎడ గర చా వడానికి ముందు ప లి కి న మాట లు ఎందుకు ప లి కి ఉంటా డో అది వి వరి ంచ గల దు .	0.5931
हाँ . नहीं . मैं . . . मैं ठीक हूँ .	అవును . లేదు . నేను . . . బా నే ఉననాను .	0.5745
वैसे मैं बता द ूँ , मैंने उसकी हतया नहीं की .	నే నె తే వాడిని చం ప లేదు అనే చెపప ాలి అనుకుంటుననా .	0.5368
मेरी स गा ई हो चु की है .	నాకు ని శ చి తా ర ధం అయి ంది .	0.5753
मेरे न न हे सै बी , मैंने उनहें सब बता दिया . - हे भगवान .	- నా బు జ జి సె బ బి , నేను వాళ లకు అంతా చెపపా ను . - ఓహ , దేవుడా .	0.6484
साथ ही , तुम खुद ही पूछ चु की हो .	అలాగే , నువవు ము ందే అడి గే శా వు కూడా .	0.5247
मुझे पता था कि गरेस अब भी मुझसे ना राज थी .	గరేస కి ఇంకా నా మీద కో ప ంగా ఉ ందని నాకు తెలుసు .	0.5569
- हम गलत दि शा में जा ँच कर रहे हैं . - हाँ .	- మనం త పపుడు హ ంత కు డిని వె తు కు తుననాం . - అవును .	0.5852
से बा सट ि यन , जिस पार ट नर को नौ करी से निका ला गया .	సె బా స టి న , పని నుండి తొ ల గి ంచ బడి న భా గ సవా మి .	0.5776
तुम सभी दूसरे मौ के के लिए अपने हा ई सक ूल री यू नि यन में आए .	మీ రం తా ఇం కొ క అవకా శం కోసం హె స కూ ల రీ యూ ని యన కి వచచా రు .	0.6826
जो ई , तुमने कया किया ?	జో యి , నువవు ఏం చేసా వు ?	0.5632
{ \ an8 } हैलो ?	{ \ an8 } హలో ?	0.6993
पर इतने साल ों के बाद , मैं . . .	కానీ ఇ న నే ళల తరవాత కూడా , నేను . . .	0.6112
हाँ . ठीक है . माफ करना .	సరే . అలాగే . కషమించు .	0.5501
वह पूरी घट ना किसी ह ॉर र फि ल म व ग ै रह जै सी लग रही थी .	ఈ మొతత ం విషయం ఏదో ఒక హా ర ర సి ని మ ాలో జరిగి న టటు జరిగింది .	0.6159
तुमहें अब भी बेवकूफ फै ंग के साथ रह ने की जरूरत नहीं है .	నువవు ఇక ఆ ము స లి స ననా సి ఫె ంగ తో ఉండ ాల సిన పని లేదు .	0.6455
तुमहें पता था कि गरेस तुमहारी बेटी नहीं थी , पर तुम शक होने का ढ ों ग कर सकते थे .	గరేస నీ కూ తు రు కాదు అని నీకు తెలుసు , కానీ నీకు కొనని స ందే హ ాలు ఉననా య ని నువవు న టి ంచ వచచు .	0.6095
कयोंकि उसने फै ंग की ला श देख ी .	చూ సిన వి వి యన అ రు పు లు అను కుననా డు .	0.5728
और विश वास करो कि परे स को इसकी जानकारी जरूर मिले गी और वे क हें गे ,	ఖచచితంగా తెలుసు కో ండి , ఇది వాళ లకు తెలు సతుంది , అపపుడు వాళళు	0.5593
- धनयवाद . - अरे , हाँ .	- థాంక స . - ఓహ , భలే .	0.6434
और मुझे उसे पहले ही बता देना चाहिए था .	అలాగే నేను ఆమె తో ము ందే మాటలా డి ఉండ ాల సింది .	0.5412
" शे रि फ रि यर ड न ने हतया के कई कब ूल ना मे सु ने और सब को नजर अं दा ज कर दिया	" ష ె రీ ఫ రీ ర డ న అనే క మంది నే రా నని ఒ పపు కుననా కూడా తన సనే హి తు ర ాలు ఇ సా బె ల మి నన ొ స	0.6699
मैं इसे बता ही रही थी कि इसे यहाँ से चले जाना चाहिए .	నేను అతని తో ఇ కకడి నుండి వెళలి పొ మమ ని చెప తుననాను .	0.5580
देखा ? मुझे तुम पर विश वास है .	చూశా వా ? నేను నినను నమ ము తుననాను .	0.5190
शा वर में ब नी चा य , चु रा ई हुई क यू - टि पस .	ష వర లో చేసిన టీ , దొ ం గి లి ంచిన చె వి పు లల లు .	0.6609
और गरेस , वह दु ल ह न जि से दरअसल दू ल हे से पयार नहीं था .	అలాగే గరేస , కు ర రా డి తో పరే మ లో లేని పె ళ లి కూ తు రు .	0.6559
तुमहें तो , कम से कम , पता होना चाहिए कि यह पार ं परि क ज ॉर जि यन " का ंट सी " है .	అంద రి కంటే నీకు బాగా తెలి సి ఉండాలి , అది సా ం పర దా య క జా ర జి యన కా ంట సి .	0.6345
एडगर , कया वह तुम हो ?	ఎడ గర , అది నువవే నా ?	0.5472
हे भगवान .	అమమ బా బో య .	0.4297
तु र ंत बाहर आ गया था .	ల టు కకు న వచ చేసి ంది .	0.5781
और जैसा कि इ सा बे ल ने कहा था , ज हर गलत इंसान के पास पहुँ चा था .	అలాగే ఇ సా బె ల అనన టటే , నీ విష ం త పపుడు వయకతి ని చే రు కు ంది .	0.6654
मैं अपने पति से पयार करती हूँ .	నాకు నా భ ర త అంటే చాలా పరే మ .	0.5421
