Hindi	Telugu	Similarity_Score
यह मेरे पति का कु त ता था , पर मेरे पति के वि पर ी त , यह मर ता ही नहीं है .	అది నా భ ర త కు కక , కానీ నా భ ర త లా గా కా కుండా అది చా వడం లేదు .	0.6270
सच में ? जो कुछ भी मैंने तुमहें बताया , उसके बा व जू द यह सं भ व है ?	అవునా ? నేను నీకు అంత చెపపి న తరవాత కూడా , అది సా ధ యం అవు తుంది అనుకుంటుననా వా ?	0.6070
मैंने के टर र से कुछ वा इन की बो त लें लेकर उस दल को दे दी ं	నేను కే ట రి ంగ వారి నుండి రెండు వెన బా టి ళలు తీసు కొ ని వాళ లకు ఇ చచి ,	0.6021
नहीं , मैं भी उ त सा हि त हूँ .	లేదు , నాకు కూడా ఉ త సా హ ంగా ఉంది .	0.5469
अ नी क 2 : द सी क वल	య నిక 2 : రెండ వ భా గం	0.5750
म ॉ म और डै ड , यह अ नी क है . अ नी क , वि वि यन और फै ंग .	అమమా , నా ననా . ఇ తను య నిక . య నిక , వీ ళళు వి వి యన అలాగే ఫె ంగ .	0.6650
रॉ कस ै ना को इसकी बू से घ ृ ण ा हो रही है	రో క సా న కి ఈ వా స న అస స లు న చచ లేదు ,	0.5792
- कया इंसान है . - बहुत खू ब .	- వీ డు చాలా చేసతుననా డు . - సరే .	0.6103
हम ऐसे ही कुछ माम लों में शा मिल हैं .	మేము ఇలా ంటి కొనని కేసు ల మీద పని చే సతు ంటా ం .	0.5221
- आप लोग कौन हैं ? - हम वा इन च ख ने आए हैं .	- మీ రం తా ఎవరు ? - మేము వెన రు చి చూడ డానికి వచచా ము .	0.5699
- कितनी सी ढ ियाँ हैं , जान ? ठीक है . - दो और .	- ఎ నని అడుగు లు వే య ాలి , బ ే బీ ? సరే . - ఇం కొ క రెండు .	0.6696
कया तुम पूरी रात ज गी हुई थी ?	నువవు రాతరి అంతా మే ల కొ నే ఉననా వా ?	0.4657
हमने यहाँ जो कहा , दुनिया उस पर न जयादा धयान दे गी , न ही याद रख े गी .	ఇ వాళ ఇకకడ చెపప బడి న మాట లను ఈ పరపంచ ం ఏ మా తరం ప టటి ంచుకో దు .	0.6389
. . . एडगर बस वहाँ से चला गया .	. . . ఎడ గర ఉనన టటు ండి వెళళి పోయా డు .	0.6376
दू ल हा और दु ल ह न के साथ ना च ने का समय आ गया है .	ఇ పపు డి క ఈ పొ డ వాటి వయకతి తన భా రయ తో డా నస వే సే సమ య మెంది .	0.6489
कोई दे री नहीं हुई है . हम अब भी कुछ कर सकते हैं .	మనకు ఇంకా సమయం ఉంది . మనం ఏదో క టి చేయ గల ం .	0.6184
गरेस , तुम मेरी बहन हो , पर तुम . . .	గరేస , నువవు నాకు చె లలి వే , కానీ నువవు . . .	0.5739
इसलिए हम अपने कम रे में जा रहे हैं ,	కాబటటి ఇక ఈ రాత రికి మేము వెళలి పడు కుంటా ం ,	0.5133
देखो , शे रि फ को यहाँ आने में अब भी कुछ घं टे हैं , तो हम . . .	చూడ ండి , పోలీసు లు రా వడానికి ఇం కొ క కొనని గంట ల సమయం ఉంది , కాబటటి మనం . . .	0.6526
कल रात मैं खु ले आ स मान के नीचे सो या .	నేను గ త రాతరి బయట పడు కుననాను .	0.5007
हे भगवान . मेरा कान ब ज रहा है .	ఓ రి , దేవుడా . నా చె వు లు మో గు తుననా యి .	0.5481
उसे भा ष ण सुन ना ही होगा , है न ?	ఆ స పీ చ తాను క చచితంగా వి ంటుంది , కదా ?	0.5807
दु र भाग य व श , किसी कारण से ,	దు ర ద ృష ట వ శా తతు , ఎందు కో తెలీదు ,	0.6016
अ नी क मेरे ह ॉर न से पी ए गा .	య నిక నా కొ మ ము నుండి తా గు తా డు .	0.6026
कया तुमने मेरा फोन का चार जर देखा है ? मेरी माँ को वह चाहिए .	నువవు నా ఫోన ఛ ా ర జర చూశా వా ? మా అమమ కి అది కావాల ంట .	0.5958
पता नहीं . वह काफी न शे में था .	ఏ మో . వాడు బాగా తా గే శా డు .	0.5578
यह अचछा नहीं हुआ . यह बुरा हुआ . बहुत , बहुत बुरा हुआ .	ఇదే మి బ ాల ేదు . ఇది దారు ణం . ఇది చాలా దారు ణం .	0.5476
तुमहारा नि जी ड रे सर आ गया है .	నీ వయకతి గ త డ రె స వే సే వయకతి వచచా డు .	0.5160
वह आ शी र वाद दिल वा ने में मदद कर ूँगी .	వాళ లకు నువవు న చ చే లా చేసతాను .	0.5321
बात बस यह है . . .	అంటే , అది . . .	0.5779
- हाँ . किसी को पर वाह नहीं है . ठीक है ? - पता नहीं	- అవును . ఎవ రికీ ప టటి ంపు లేదు . సరేనా ? - ఆ వి డ కు మ తి పోయి ందో	0.5947
गरेस और एडगर ने मुझे , एक अ भ ि ष ि कत र ब बी	గరేస ఇంకా ఎడ గర లు , అభి ష ే కి ంచ బడి న ర బ బీ ని , అలాగే	0.6312
ऐसा नहीं है कि नहीं कर सकते .	చేయ లే ము అని కాదు అనుకో ండి .	0.5157
वाह . यह काफी शान दार है .	వా వ . ఇది చాలా ఫ యా నస ీ గా ఉంది .	0.4653
ठीक है , बढिया है . अब थोडा सी धे हो जाओ . और . . .	సరే , బాగుంది . ఇపపుడు కొంచెం ని టా రు గా ని ల బడ ండి . అంతే . . .	0.6596
हे भगवान . यह बेहद शान दार जगह है !	ఓ రి , దేవుడా . ఈ పర దేశం చాలా అంద ంగా ఉంది !	0.5264
तो , हाँ . यह अचछी शु रु आत नहीं थी .	అది సంగ తి . పరి చ య ాలు అంత గొపప గా జరగ లేదు .	0.5818
अरे , च लिए भी . आप इससे जयादा ता लिया ँ ब जा सकते हैं .	ఓహ , ఊ రు కో ండి . ఇంకా సత గ టటి గ చ పప టలు కొ టట గల రు .	0.6787
मैं जो ई को डे ट कर रहा हूँ .	నేను జో యి ని డే టి ంగ చేసతుననా ను .	0.5156
बिलकुल सही कहा . वे एक - दूसरे को जयादा समय से जानते भी नहीं हैं . . .	అవును . అంటే , వాళ లకు ఎకకువ కాల ంగా పరి చ యం కూడా లేదు . . .	0.6525
मुझे अन ुम ा न लगा ने दो . तुम भी गरेस के पू र व - बॉ य फर ें ड ों में से एक हो .	ననను గె స చేయ నివ వు . నువవు కూడా గరేస మా జీ పరి యు డి వి కదా .	0.6389
नहीं . हम शादी शु दा नहीं हैं .	లేదు . మేము ఇంకా పె ళ లి చేసుకో లేదు .	0.4805
बस ऐसे . . .	అంతే . . .	0.6177
यह कर न ल है .	అది కల న ల .	0.5582
हैलो ! हैलो !	హాయ ! హలో !	0.4151
- दरअसल मुझे पर वाह नहीं है . - मुझे भी .	- అద ంతా నేను అస స లు ప టటి ంచుకో ను . - నేను కూడా .	0.5821
मैं इसका कया कर ूँ ?	దాని తో నేను ఏం చేయాలి ?	0.3686
पर मैं पार ट - टा इ म कुछ और भी करती हूँ जि से मैं " अ ना व श य क बु ना ई "	కా కపోతే నేను పార ట - టె మ గా నేను " అన వ సర అ లలి కలు " అనే	0.6468
- तुम ह द पार कर रही हो . - नहीं , यह झूठ है .	- హ దదు మీ రి మాటలాడు తుననావు . - లేదు , నేను చేయ లేదు .	0.5720
मान ो उसे पता है कि वह बहुत बडी गलती करने वाली है ,	ఆమె పెదద తపపు చేసతుననా నని తన కు తెలి సి నా ,	0.5656
मुझे उस पर भरो सा नहीं है . - माफ करना , म ॉ म . माफ करना , डै ड . सभी से माफ ी चा हूँ गी .	- నేను వాడిని నమమ ను . - కషమించు , అమమా . కషమించు , నా ననా . అందరూ కషమి ంచండి .	0.6272
- हाँ , नहीं हूँ . - तो उसने मुझसे कहा ,	- నిజ మే . - కాబటటి వాడు ననను ఒకటి అడి గా డు ,	0.6125
मै गी पू रे स पता हा ंत ब रे ट के साथ रहे गी , तो हमें बस आ राम और म जे करने हैं .	మయా గ ీ ఈ వా రా ంత ం అంతా బ రె ట తో ఉంటుంది , కాబటటి మనం హా యి గా రి లా కస అవు తూ ఎ ం జా య చే సతే చ ాలు .	0.6677
- यह मर चु की है . - हे भगवान .	- అది చని పోయింది . - ఓ రి , దేవుడా .	0.5908
- रॉ कस ै ना . - ए !	- రో క సా న . - హేయ !	0.6075
मैंने रॉ कस ै ना को हर जगह ढूँढ ा .	నేను రో క సా న కోసం అనని చో ట లా వె తి కా ను .	0.5398
इसलिए उसने उनहें ढूँढ ने के लिए दुनिया छा न मा री .	కాబటటి ఈ వయకతి ని కని పెటట డానికి వాడు పరపంచ ం అంతా గ ాలి ంచా డు .	0.5459
सवागत है , पया रे मु सा फिर ों .	సవా గ తం , పర యా ణి కు లా రా .	0.6145
नहीं . ता इ वा नी शे व ड आ इस नर म और सवा दि ष ट होता है .	కాదు . తె వా నీ స ష ే వ చేసిన ఐ స చాలా మ ృ దు వు గా , రు చి గా ఉంటుంది .	0.6265
अ नी क ! तुमने उससे कया कहा ?	య నిక ! ఆమె కు నువవు ఏ మని చెపపా వు ?	0.5739
यह ह वा इ यन शे व ड आ इस जैसा है , है न ?	అది కూడా హా వా యన ష ే వ చేసిన ఐ స లాంటి దే కదా ?	0.6051
- ए . - हे भगवान . तुम शान दार दिख रही हो .	- హేయ ! - ఓ రి , దేవుడా . నువవు చాలా అంద ంగా ఉననావు	0.5965
इसलिए , बिना सी धे सवाल किए पता करने की कोशिश करो , ठीक है ?	కాబటటి , ముందు తన ఉదదేశం ఏంట ో తెలుసు కో , సరేనా ?	0.5648
हे भगवान , इतने सु ंदर बा ल हैं . अब तुमहारे बा ल कभी नहीं झ ड ेंगे .	దేవుడా , ఎంత మంచి జు టట ో . ఇ పపు డి క ఇది ఎ పపటి కీ ఊ డ దు .	0.6661
कया ?	ఏంటి ?	0.3091
हम सभी बेहद उ त सा हि त हैं .	మా అంద రికీ చాలా ఉ త సా హ ంగా ఉంది .	0.4709
कितना सु ंदर . . . ओ बा मा का पु त ला है ?	భలే అంద మెన . . . ఒ బా మా బ ొ మ మా ?	0.6101
हैलो ?	హలో ?	0.3091
कि मैं उनकी बेटी के लिए उप यु कत हूँ .	చూపి ంచ ాలని నిరణ యి ంచు కుననాను .	0.5097
तुम कहाँ थे ? मैं तुमहें ढूँढ रही थी .	నువవు ఎ కకడికి పోయా వు ? నేను నీ కోసం చూ సతుననాను .	0.5011
अरे , चलो भी .	ఓహ , నిజం చెపపు .	0.4963
म ॉ म .	అమమా .	0.2684
ठीक है . शादी का दिन .	సరే . పె ళ లి రోజు .	0.4987
हम दोनों में से कोई यह नहीं चाहता है , पर . . .	అలా చే సతే మని దద రికీ న చచ దు , కానీ . . .	0.6283
- उसे ला त मार दो . - ठीक है !	- దానని తన ను . - సరే !	0.5888
हैलो ?	హలో ?	0.3091
बस ग ौर किया .	గ మని ంచా ను అంతే .	0.4234
कया ?	ఏంటి ?	0.3091
हाँ . अब यह सं भ व नहीं है .	సర లే . ఇపపుడు అ ందుకు సమయం లేదు .	0.4829
बोल ती रहो .	కా నివ వు .	0.4270
हाँ !	అంతే !	0.3426
पर उनहें ब रे ट से न फ रत थी . सबसे पहले उनहोंने यही बात क ही थी .	అంటే , వాళ లకు బ రె ట అంటే న చచ లేదు కదా . వాళళు నాతో చెపపి న మొ టట మొదటి మాట అదే .	0.6038
ठीक है . शायद तुमहें गलत फ हम ी हुई है .	సరే . నువవు తపపు గా అరథం చేసు కునన టటు ఉననావు .	0.5228
कि लि म ं जा रो के पास के झ र ने श री र को साफ कर दे ते हैं पर बेहद ठ ं डे हैं .	కి లి మ ం జా రో దగగర ఉనన జ ల పా తం లో చాలా బాగా స నా నం చేయ ొ చచు , కానీ , అకకడ బాగా చ లల గా ఉంటుంది .	0.6481
और फिर गरेस ने मुझे वह सु ंदर के त ली का क वर दिया	దానికి పె న గరేస నాకు టీ పా య మీద పెటటు కొ నే బ ొ మమ ను ఇ చచి ంది ,	0.5981
बेशक . उससे याद आया , कि ता ब लि ख ना कैसा चल रहा है ?	ఒ పపు కుంటా ను . ఆ విషయ మె ఒకటి అడ గ ాలి , పు సత కం ఎంత వర కు వచచింది ?	0.6300
मुझे पता है तुम कया सोच रही हो . यह मेरा पह ला अनु भ व नहीं है .	నీ ఆలోచ న నాకు తెలుసు . ఇదే మి నా మొదటి కేసు కాదు .	0.5802
और उसकी पा लत ू छ ि पक ली भी मर जाती है ?	అతను పె ంచు కు ంటు నన బ లలి కూడా అలాగే చని పో వ డ మా ?	0.5802
गरेस के चा चा , फै ंग के भाई , यू लि सी स .	గరేస వాళళ అ ం కు ల , ఫె ంగ గా రి సోద రు డు , యూ లె సీ స .	0.6659
तो , मैंने यह तुमहारे लिए बना या है .	కాబటటి , ఇది నీ కోసం చేశా ను .	0.5421
हे भगवान . ब रे ट ! यही बात है .	ఓ రి , దేవుడా . బ రె ట ! అదే అయ యు ంటుంది .	0.6074
मैं हमारे ह नी म ून में एडगर को यह के त ली का क वर देने वाली थी ,	నేను మా హ నీ మూ న కి వెళళి నపపుడు ఎడ గర కి ఈ టీ పా య తొ డుగు ఇ ద దా ము అను కుననాను ,	0.6287
तो , तुम जो ई को पर ो पो ज करने की यो जना बना रहे हो ?	నువవు జో యి ని పె ళ లి చేసుకో మని అడుగు దాం అనుకుంటుననా వా ?	0.5350
और शायद यह सबसे ला भ दा य क , सबसे पर सि द ध न हो ,	అనని టి కంటే లా భ దా య క మో లేక పేరు పొ ందుకు ననా డో కా కపో వచచు ,	0.5641
तो तुम उसकी बहन के पू र व - बॉ य फर ें ड ों में से एक हो ?	అంటే నువవు ఆమె చె లలి కి మా జీ పరి యు డి వా ?	0.5698
नहीं , फो टो ग रा फर ने केवल परिवार कहा है .	అవును , ఫో టో గరా ఫర కూడా కుటుం బ సతు లు మాతరమే అననా డు .	0.5818
एक होता है , दो होते हैं ,	ఒకటి , రెండు ఉననాయి ,	0.4670
ऐसा नहीं है कि मैंने कभी लिया ही नहीं .	అంటే , నేను డ రగ స వా డ లే దని అ నను .	0.5316
जो रो ज रात को 9 : 3 0 पर सो ने चला जाता है और जिस ने एक अजीब छ ि पक ली पा ल रख ी है .	సరి గగా రాతరి 9 : 3 0 కి ని దర పోయి , వి ంత ె న బ లలి ని పె ంచు కునే ర కం .	0.6488
तुमहें एडगर कभी पसंद नहीं था . तुमने यह सप ष ट कहा था .	నీకు ఎడ గర అంటే మొదటి నుండి ఇషటం లేదు . ఆ విష యానని నువవే చెపపా వు .	0.5804
- एक और ख ून हुआ है . - तुम किस से बात कर रही हो ?	- ఇం కొ క హ తయ జరిగింది అ ంట . - నువవు ఎవరి తో మాటలాడు తుననావు ?	0.6100
कार की वजह से .	ఆ కారు వలల .	0.4833
अगर है , तो मैं वह जरूर सुन ना चा हूँ गा .	ఉ ండి ఉంటే , నాకు వి నా లని ఉంది .	0.5166
यह दिल च सप है . तुम रि हर स ल डि नर पर हो .	ఇది భలే ఉంది . నువవు రి హా రస ల భ ో జ నా నికి వెళళ ా వు .	0.5609
- यह शान दार है . - तुम काफी वि न मर हो .	- ఇది భలే ఉంది . - మీరు భలే బాగా మాటలాడ తారు .	0.5585
आ म भा ष ा में , हम इसे स द मे में होना कहते हैं .	సా మా న యు ల భా ష లో చెపప ాల ంటే , దీని నే షా క కి గుర వ వడం అంటా రు .	0.6096
- कया ? - उसकी पसंद ही नि रा ली है .	- ఏంటి ? - ఆమె కు ఒక రక మెన వార ంటే న చచు తారు .	0.5924
कृपया मेरी म ं गे तर को स हा रे के रूप में इस ते माल मत करो .	దయచేసి నాకు కా బో యే అమమాయి మీద బ రు వు పెటట కు .	0.5957
तो फिर मैंने तुमहें व हीं बि ठा या जहाँ तुमहें बैठ ना चाहिए था .	అయితే నువవు ఎకకడ కూ రచ ో వాల ో అకకడ ే కూ రచ ో బె టట ా ను .	0.5514
वहाँ कई बि लि यन ड ॉलर हैं . और उनकी की मत बढ ती जा रही है .	కొనని వ ంద ల కో టల డ ాల ర ల వి లు వ చేసతా యి అవి . వి లు వ ఇంకా పె రుగు తూ నే ఉంది .	0.5856
सभी अपने हाथ छु पा लो .	అందరూ మీ చే తు లను దా చు కో ండి .	0.5408
मेरी पया री भ ती जी के नाम , जिस से मैं बेहद पयार करता हूँ .	నేను ఎంత గా నో పరే మి ంచే నా పరి య మెన మే న కో డ లా .	0.5897
- से क सी . - और मेरे पास एक ए नि मे स मु रा ई त ल वार भी है .	- అంద ంగా ఉంటా వు . - అలాగే ఒక స ము రా య ఖ డ గం , అది కూడా యా ని మే ను ండ ే .	0.6853
कि से पर वाह है ?	అవి ఎవ డి కి కావాలి ?	0.4655
खु शन ुम ा जो डी के नाम ! चि यर स !	న ూ తన వ ధ ూ వ రు లకు ! చ ీ రస !	0.6583
मैं बस माफ ी माँ ग ना चाहता था .	నేను కష మా ప ణ లు చెపప ాలి అనుకుంటుననా ను .	0.5115
इसलिए वह सब के सामने कस में बोल ना नहीं चाहता था .	కాబటటి అంద రి ముందు ని ల బడి వా గ దా నాలు చెపప డానికి ఇష ట పడ లేదు .	0.5379
वह यहाँ आ ना चाहती थीं , पर वह अपनी चु प पी और श रा ब में ही वय सत हैं .	ఆమె ఇకకడికి రా వాలని అను కు ంది , కానీ ఆమె ని శ శ బ ద ంగా మ ద యం తా గు తూ బి జీ గా ఉంది .	0.6080
रॉ कस ै ना को फर ै ंक कै लि य ै ंड ो पसंद है और मुझे ग ै रि सन की ल र .	రో క సా న కి ఫ రా ంక క ాలి యా ండ ో అంటే ఇషటం , అలాగే నాకు గ యా రి స న కీ ల ర అంటే ఇషటం .	0.6413
तो , पता है कया ? मैं जलदी से न हा ले ता हूँ .	సరే , ఒకటి చెపప నా ? నేను యి టట ె వెళలి స నా నం చేసి వ సతాను .	0.5770
