मैंने माँगा कि कया वह मेरी जिंदगी से मेरे दुशमन हटा सकता है	నా జీవితంలోంచి శతరువులను తొలగించు అని అతనని అడిగాను
रेसन पारकर मीक का कजिन	రాసన పారకర మీక కజిన
वह बहुत मुशकिल वकत था.	అది బాధాకరంగా ఉంది.
कयोंकि वे भी वहीं से आए हैं, जहाँ से हम हैं.	ఎందుకంటే వాళళు మా పరాంతం వాళళే కాబటటి.
अगर रिक रॉस नयू यॉरक से होता, तो उसका नाम पूरी दुनिया में	ఒకవేళ రిక రాస నయూయారక నుంచి వచచుంటే, అతనని పరపంచవయాపతంగా ఇపపటివరకు
कमीनी, मैं हूँ बॉस योजना मैं बनाता हूँ	ఏయ, నేను బాసను అవకాశాలకు పరణాళిక వేసుకుంటాను
यदि किसी भी कारण से	ఒకవేళ ఏదెనా కారణం చేత,
पुलिसवाले ने कहा कि उसे चरस वगैरह की गंध आई.	పోలీసుకు గంజాయి, ఏదో వాసన వచచిందననాడు.
मुझ पर पुलिसवाले पर बंदूक तानने और करैक कोकीन बेचने का आरोप था.	నేను పోలీసులకు తుపాకీ గురిపెటటినటటు, కొకేయిన అమమినటటు నాపె ఆరోపిసతుననారు.
अब भी बालों में वहाँ का तेल लगा है, यार. मीक मिल वापस आ गया है.	అయినా నాకు ఇంకా గడపటానికి సమయం, అవి అననీ ఉననాయి. మీక మిలలీ తిరిగి వచచాడు.
नजरबंदी के दौरान अभियुकत को यातरा करने या काम करने की मनाही है.	నిందితుడు గృహ నిరభంధంలో ఉననపపుడు పరయాణాలు కానీ పని కానీ చేసే అనుమతి లేదు.
और अब वे कहते हैं इतनी जलदी लाखों कैसे बनाए?	వాళళిపపుడు అంటుననారు ఎలా లకషలింత తవరగా సంపాదించావు?
"हीज द फरसट आउट द लिमो. "	"లీమో ఉనన మొదటి వయకతి అతనే. "
वही कपडे. वही जगह. वही बंदूकें.	అవే బటటలు. అదే నేపథయం. అవే తుపాకులు.
पता नहीं वे इन अशवेतों के पीछे कयों पडे हैं	వాళళు ఎందుకు ఈ నిగగాలను పొగుడుతుంటారు
तो मैं सच कहता हूँ, वह अभी तक मर चुका होता.	మీతో నిజాయితీగా చెపతుననాను, అతను చనిపోయి ఉండేవాడే.
मैं अंदर बंद था. सीओ वहाँ से सौ फुट दूर था.	ననను లోపల బంధించారు. సిఓ 100 అడుగుల దూరంలో ఉననాడు.
मियामी में लगता था मानो हर कोई रिक रॉस के पीछे है.	మయామీలో, అందరూ రిక రాస చుటటూ తిరుగుతుంటారు.
केवल भगवान और मैं, मेरी सफलता के लिए जिममेदार हैं.	కేవలం, భగవంతుడు, నేనూ నా విజయానికి కారకులం.
जिससे अटलांटा में अपनी हैलोवीन एलबम रिलीज पारटी में नहीं जा पाया	అతనని అటలాంటాలో హలోవీన ఆలబమ విడుదల పారటీకి వెళళనివవలేదు
-2007. -हाँ.	-2007. -అవును.
जे-जी संसथापक - रॉक नेशन	జే-జీ వయవసథాపకుడు - రాక నేషన
मैं पहली बार बैठा हूँ. . . यह कया है, एक बडा जेट?	ఇది నా మొదటి సారి. . . ఇది ఏంటి, పెదద జెట?
यह सोच कि किसी भी समय, तुम वापस सिसटम में भेज दिए जाओगे,	ఏ కషణంలో అయినా, తిరిగి నయాయ వయవసథలో మాయమెపోతామనన
जे-जी संसथापक - रॉक नेशन	జే-జీ వయవసథాపకుడు - రాక నేషన
मुझे लगा उसमें परतिभा है, और वह सफल हो सकता है.	నాకు అతనిలో పరతిభ ఉందనిపించింది, అతనికి అవకాశం వచచింది.
परेरणा मिली. जब आपको लगता है कि आप जीत रहे हैं,	ముందుకు వెళళటానికి తపనను ఇచచింది. ఒకసారి ఏదెనా గెలిచాక,
हैलो, नफरत करने वालो, कया हाल मैं तो मजे में हूँ	హాయ, దవేషి, బాగుననావా నేను చాలా బాగుననాను
द जसटिस हुआनीटा किड सकाउट सेनटर ऑफ करिमिनल जसटिस	నయాయమూరతి వానీటా కిడ సటౌట నేర నయాయ కేందరం
ए, कया चल रहा है? तुम मीक मिली के साथ हो?	ఏయ, ఏంటి సంగతులు? మీక మిలతో ఉననావా?
कयोंकि मीक ने कथित रूप से फिलाडेलफिया पुलिस अफसरों पर बंदूक तानी थी.	ఎందుకంటే మీక ఫిలడెలఫియా పోలీసులకు గురిపెటటాడని ఆరోపించారు.
शुलक का भुगतान न करना परोबेशन मीटिंग में न आना	రుసుము చెలలించడంలో వెఫలయం పరిశీలన సమావేశానికి గెరహాజరు
और दूसरा था हरिकेन बरिंकली.	ఇంకొకటి బరింకలీ తుఫాను.
एक बार में 52 पुशअप करता था	ఒకేసారి 52 బసకీలు తీయటం
किसी राषटरीय सतर के निरमाता और किसी बडे रिकॉरडिंग लेबल से हो जाएगा.	జాతీయసథాయి నిరమాతకు, గొపప సంసథకు పరిచయం చేసతాయి అనే ఆశతో.
भाड में जाओ! उठो!	వదిలెయ! లేచి నిలబడు!
मुझे लगता है वह उसे अपनी सिंडरेला कहानी बना रही थी,	ఆమె అతనని ఎపపటికీ ఏ తపపు చేయని వాడిలా ఉండాలని అనుకుంటుననారు,
यार, तुम लोग. . .	నిగగా, అబబాయిలు. . .
हाँ, वह तो एकदम. . .	అవును, అదంతా. . .
मुझमें और इन अधिकतर रैपरस में फरक यही है	చాలా మంది ఈ రయాపరలకు నాకూ మధయ తేడా
तुम कह रहे हो कि जो तसवीर तुमहारे वीडियो या कवर का परमोशनल शॉट है,	నువవు చెపపేది నీ వీడియో లేదా కవర కోసం పరచార ఫొటోలో ఉననది
"यार, यह जरूर कोई सपना है. "	"ఇది కల అయయి ఉంటుంది" అనుకుననాను.
मैं 19 साल का था जब जेल की सजा काटकर बाहर आया.	జెలు తరువాత 19 ఏళళ వయసులో బయటకు వచచాను.
उस समय, हम शरी विलियमस की ओर बढ रहे थे,	ఆ సమయంలో, మేము మిసటర విలియమస వెపు నడుసతుననాము,
मेरा नाम चारली मैक है. फिलाडेलफिया का भाई हूँ.	నా పేరు చారలీ మాక. ఫిలడెలఫియా నాయకుడను.
पर मीक दुनिया के सबसे अवयवसथित कारोबार में है,	ఏదెమెనా, మీక పరపంచంలోనే చాలా గందరగోళమెన
वे तुमहें इतनी दूर ले जाते हैं कि परिवार से अलग हो जाते हो.	వాళళు కుటుంబం నుంచి దూరంగా సంబంధం లేకుండా చేసతారు.
तो मुझे लगा, "मुझे कुछ करना पडेगा. कोई तरीका निकालना पडेगा. "	అయితే నేను, "నేను ఏదో ఒకటి చేయాలి. ఏదో ఒకటి పరయతనించాలి" అని అనుకుననాను.
वहाँ लिल वेन था, डीजे खालिद था, और फरेंच मोनटाना था,	లిల వేయిన, డీజే కాలేద, ఫరెంచ మోంటానా ఉననారు,
शोहरत बुरे लोगों को पास खींचती है	పరకాశవంతమెన లెటలు చెడడవాళళను ఆకరషించాయి
मीक मिली. फिली, खडे हो जाओ, समझे?	మీక మిలలీ. ఫిలలీ, నిలబడండి, ఆనందిసతారా?
मैं समझ नहीं पाता था कयोंकि लगता, "मैं इतना अचछा कर रहा हूँ.	నాకు అది నిజంగా అరథం కాలేదు ఎందుకంటే, "నేను చాలా మంచిగా పరవరతిసతుననాను.
शो रदद कर दिए जाते हैं, पैसा नहीं आता. आप तारीख आगे कर देते हैं.	పరదరశనలు రదదు అయయాయి, డబబు రావటం లేదు. తేదీలు జరిపారు.
अदालत की परतिलिपि 11 जुलाई, 2014	కోరటు రాతపరతి జులె 11, 2014
और वे देखते ही समझ जाते हैं, "अचछा, यह सब बकवास है.	వాళళు చూడగలుగుతారు, "సరే అదంతా సరెనది కాదు.
अपने वीडियो में नकली बंदूकों का इसतेमाल करने के लिए	తన మయూజిక వీడియోలో బొమమ తుపాకులు వాడినందుకు
वे मेरे लिए पाँच से दस साल की अनिवारय सजा की बात कर रहे थे,	వాళళు నాకు తపపనిసరిగా ఐదు నుంచి పది ఏళళ జెలు శికష పడుతుందనుకుంటుననారు,
मैं गरीबी में पला हूँ जहाँ दो-दो दिन तक खाना नहीं मिलता था,	నేను దారిదయరం నుంచి వచచాను, రెండు రోజులు అలాగ తిండి తినలేక పోయేవాడిని.
मैंने जेल में एक भी रैप नहीं लिखा. मैं अंदर तक हिला हुआ था.	నేను జెలులో ఒకక రయాప కూడా రాయలేదు. నాకు నేను చాలా నిషపలంగా అనిపించాను.
शरी विलियमस, सबसे पहले तो 24 तारीख को जब तुम गिरफतार हुए,	మిసటర విలియమస, ముందుగా, 24న, మీరు అరెసటయినపపుడు,
हाँ, वह बहुत बुरा था. वाकई नरक था, नरक वैसा ही होता होगा.	అది నరకం. నిజజీవిత నరకం, అది నరకానికి అతి సమీపం.
तो अपने परोबेशन ऑफिसर से इजाजत लिए बिना मैं अपने परिवार के साथ घर भी नहीं जा सकता,	నేను నా కుటుంబం దగగరికి నా పరిశీలనా అధికారికి ఫోన చేసతే తపప వెళళలేను,
जो मुझे घोटाला लगा था. जब मैं अदालत जाता, तो वह कहती,	అది నాకు కుంభకోణంలా అనిపించింది. నేను కోరటుకు వెళళినపపుడు, ఆమె,
वह समय अपने बचचों के भविषय के बारे में सोचने में नहीं लगा सकता,	ఆ శకతి ననను నా పిలలలపె శరదధ వహించాలనన ఆలోచన రానివవదు,
न ही वकीलों के बारे में पता है, तो हम कई जगहों पर बेवकूफ बन चुके हैं,	లాయరల గురించి తెలియదు, అందుకే చాలా రకాలుగా మేము మోసపోయాము,
मैं अपने घर आ रहा था.	నేను మా ఇంటికి వసతుననాను.
सजा में ढील मिल रही है ताकि वह खुद को सफल बना पाए.	ఈ జడజి నుండి మీకకు విరామం లభించినటటు ఉంది.
या, मतलब, उसे समझा न सकूँ.	ఎపపుడూ ఇంత కాలం, ఇంత దూరం లేడు.
पर खासकर बेमिसाल रैपर. मतलब, वह उसी माहौल से आया है.	కానీ పరతయేకించి గొపప రయాపరలు. మీకు తెలుసా, అతను అదే తరహా వాడు.
मुझे उसी समय जेल भेज दिया.	నేను వెంటనే జెలుకు వెళళిపోయాను.
"आखिर वह कया सोच रही है? "	"ఆమె ఏం ఆలోచిసతుందంటావు? " అని.
मेरा बेटा, रॉबरट, मुझसे कभी इतने समय दूर नहीं रहा कि उसे देख न सकूँ,	నా కొడుకు రాబరట, తనని నేను చూడలేనంత, తనతో వయవహరించలేనంతగా
मैं घबराया हुआ था. पता नहीं था कि कया मुसीबत आने वाली है.	నాకు ఆందోళనగా ఉంది. నేను ఎందులోకి కూరుకుపోతుననానో కూడా నాకు తెలియదు.
मैंने टवीट किया, "देखो मेरे पास फिली का सबसे मसत गाना है.	నేను "చూడు, నా దగగర ఇకకడ ఫిలలీలో చాలా మంచి పాట ఉంది. ఒకవేళ రాసకు అది
मुझे अटलांटा के लिए जेट पकडने के लिए डराइव करके फिलाडेलफिया वापस जाना पडा.	నేను తిరిగి ఫిలడెలఫియాకు కారులో వెళళి అటలాంటాకు జెటలో వెళళాలి.
मतलब, आगे जाकर मेरा पोता जैसी जिंदगी जिएगा.	అది, నా కొడుకు కొడుకు పెరిగే విధానం.
तो उनमें से कुछ परिसथिति को समझ लेते हैं,	వాళళలలో కొంతమంది జాగరతతగా పరిసథితులను గమనించగలరు,
ऐसा लगा कि, "मैं किसी फिलम के अंदर हूँ. "	నాకు, "నేను సినిమా మధయలో ఉననాను" అని అనిపించింది.
आशा है तुम करोगे मेरे लिए दुआ दरअसल, गाओ मेरे लिए, लिटिल सनूप	మీరు నా కోసం పరారథించాలని ఆశిసతుననాను వాసతవానికి, నాకోసం పాడండి, లిల సనూప
गवाह:	సాకషి:
मियामी	మయామీ
मैं बस खुश था कि अब मुझे वह सुनहरा मौका मिल जाएगा.	నేను నా వీడియో కోసం సిదధమవటం నాకు చాలా సంతోషంగా అనిపించింది.
कमीनी, मैं हूँ बॉस मैं हूँ बॉस	ఏయ, నేను బాసను నేను బాసను
मौसम ऐसा बदला कि पूरे नयू यॉरक सिटी को अंधेरे में धकेल दिया.	నయూయారక నగరానని అంధకారంలోకి నెడుతూ, తుఫాను తీరం దాటి భూభాగంలోకి వచచింది.
समय काटने के लिए सारे पैंतरे करता था	సమయం గడపటానికి డానస అంతా చేయటం
आपको वहाँ डरेक जैसे लोग और निकी मिनाज जैसे लोग दिखेंगे.	మీరు చూసతుననది, మీకు తెలుసా, డరేక, నికకీ మినాజ లాంటి వాళళు వచచారు.
"धत, कया हुआ? "	"ఛ, ఏం జరిగింది? "
कया सब हंगामा करने को तैयार हैं? तो, हो जाए. हंगामा हो जाए.	గొంతెతతి పాడటానికి సిదధమా? పాడదాం. ఇపపుడు కొంచెం ఉతసాహంగా అలలరి చేదదాం.
ऐसे इलाकों में था मेरा ठिकाना मैंने सच में यह किया था, पर मुझे गया चुना	ఇకకడ నా సొంత సథానంలో నేను నిజంగా గెలిచాను, ననను ఎననుకుననారు
घटनाओं का नाटकीय रूपांतर दिखाया गया है.	ఆధారంగా తిరిగి రూపొందించబడిన సననివేశాలు ఉననాయి.
बहुत जयादा होती है, जो वे जुटा नहीं पाते.	బెయిల మొతతం ఉనన కథలు చాలా వింటారు.
सब मीक की ही बातें कर रहे थे.	మీక అందరూ మాటలాడుకుంటునన కళాకారుడు.
मुझे लगता, "तुम मेरी जिंदगी की चिंता करती ही कयों हो?	నేను అనుకునేవాడిని, "మీరెందుకు నా జీవితం గురించి ఇంత ఆలోచించాలి?
तो जब वह अंदर आया, उसका चेहरा टीवी से जा टकराया.	అందుకే అతను లోపలకు వచచినపపుడు, మొహం వెళళి టీవీకి తగిలింది.
चक करीकमर हिप हॉप पतरकार	చక కరీకమర హిప హాప పాతరికేయుడు
सब कुछ आपके परशंसकों के लिए. मीक मिल के परशंसकों की खातिर.	మీ అందరి అభిమానుల కోసం. మీక మిల అభిమానులు అందరూ.
अधिकतर कलाकार अपना अधिकतर पैसा इन दौरों पर जाकर बनाते हैं.	చాలా మంది కళాకారులు టూరల నుంచే డబబు సంపాదిసతారు.
बस तीस दिन सही कदम न उठाने पर	సంగీత పరిశరమలో 30 రోజులు
जब उसे रंगीन खिडकियों के लिए रोका गया.	ఎకకువ టింట వేసునన కిటికీల కారణంగా అతనని ఆపారు.
उनमें एक था, एक वीडियो शूट फिलाडेलफिया की एक जगह से बदलकर	వాటిలో, వీడియో షూటింగ కోసం ఫిలడెలఫియాలొ అవుటడోర లొకేషనను ఒక చోట నుంచి
जब रोशनी धीमी होती है और शो शुरू होता है	లెటలు తీసేశాక, పరదరశన మొదలవుతుంది
शायद वह समझ रहा था मैं कैसा इंसान हूँ, और मेरी परतिभा को,	నేను అనుకోవటం అతను నననూ, నా పరతిభను చూసతుననాడు,
कया मेरे जीने का तरीका ही मुझे इतनी दूर ले आया?	నిగగా జీవించాలసింది అలాగేనా అది నననింత దూరం తీసుకొచచిందా?
एक के पास एक बडा सा छुरा था.	వాళళలలో ఒకతని దగగర పెదద కతతి ఉంది.
जब भी यहाँ से गुजरूँगा एकदम शानदार दिखूँगा	నేను దానిలో వెళుతుననపపుడలలా డబబుననవాడిలా అనిపిసతాను
जब आपको अशवेत पुरुष या महिला जज मिलते हैं,	నలలజాతి పురుష నయాయమూరతి లేదా సతరీ నయాయమూరతి వచచినా,
लाल गुलाब और मेरे चमकते हीरे	గులాబీ ఎరుపు ఇంకా నా వజరంలొని నీలం
लाल गुलाब और मेरे चमकते हीरे	గులాబి ఎరుపు ఇంకా నా వజరంలొని నీలం
-ए, तुम लोग यह लाए हो? -हाँ, मैं लाया हूँ.	-హే, మీ అందరికీ ఇలాంటిది ఉందా? -సరే, నాకు అరథమెంది.
"इसने पुलिसवाले पर बंदूक तानी? जरा इसका मेडिकल रिकॉरड देखूँ.	"అతను పోలీసుకు తుపాకీ గురిపెటటాడా? ననను అతని మెడికల రికారడులు చూడనివవండి.
