गरेबिल और उसका परिवार हर रोज एक खेल खेला करते.	గరేబిల ఇంకా అతని కుటుంబం పరతిరోజు ఒక ఆట ఆడేది.
जब वह घर आता तो वह	అతను ఇంటికి వచచాక,
पैनिक	పానిక
मुझे भी बडी याद आई.	నాకు కూడా నీ ధయాసే.
देखो, रे.	చూడు, రే.
कया हाल है?	ఎలా ఉననావు.
फिर से?	మళళీనా?
ऐबी कलारक को नयाय मिले.	ఆబీ కలారకకు నయాయం కోసం.
तुमने फिर देर कर दी, हंट.	హంట, మళళీ ఆలసయంగా వచచావు.
उसकी जरूरत नहीं. कह दिया कि तुमहारा साथी बनूँगा.	అవసరం లేదు. నేను నీ భాగసవామిని అవుతానని చెపపాను.
मुझे घुडसवार पसंद हैं.	నాకు కౌబాయస అంటే ఇషటం.
जब डेना और मैं	డేనా ఇంకా నేను
उनहें दूसरी औरत के बारे में पता था, पर. . .	ఆమెకు మరో సతరీ గురించి తెలిసింది, కానీ. . .
मेरी माँ नहीं हैं.	మా అమమ చనిపోయింది.
लूक ने मुझे पाला.	ననను లూక పెంచాడు.
मैं भी कभी नया बचचा थी.	ఒకసారి నేను ఊరికి కొతత.
पहली कलास में, मन ही मन, मैंने दो पककी सहेलियाँ बनाई, लिनली और विलो.	నా ఒకటో తరగతిలో, నేను ఇదదరు పరాణ సనేహితులను చేసుకుననా, లినలీ, విలలో.
वोडका, बहुत जरूरी.	వోడకా, చాలా ముఖయం.
कया, आज रात की चुनौती को लेकर घबरा रही हो?	ఏంటి, ఈ రాతరి సవాలు గురించి కంగారుగా ఉందా?
मैंने एक बडी बेवकूफी कर दी.	నేను చాలా పిచచి పని చేశాను.
यह कया?	ఏంటిది?
पर वह शायद पूरी तरह नशे में है.	కానీ చాలా మతతులో ఉననటటు ఉననాడు.
अब उसके पास इतना पैसा है, लगता है. . .	ఇపపుడు అతని దగగర ఈ డబబు ఉంది, అది. . .
उसे इतना पैसा कहाँ से मिला?	అలాంటి డబబు అతనికి ఎకకడిది?
लडके को परकृति से लगाव है. पेडों में ही रहता है.	అబబాయికి కొంచెం చెటలంటే పిచచి. ఆ చెటలలలో ఉంటాడు.
ओए!	ఏయ!
-बेवकूफ. -तुम कया कर रहे हो?	-వెధవ. -నువవు ఏం చేసతుననావు?
"एक छत के ऊपर से गया, एक चाँद में जा पहुँचा.	"ఒకరు పెకపపు పెకి ఎగిరారు, ఒకరు చందరుడిలోకి.
"रसोइये" को बडा करके लिखा है.	"వంటమనిషి" అని పెదదగా రాసారు.
बू.	భౌ.
खेल जीतना.	ఆట గెలవడం.
तुम ठीक तो हो?	బాగానే ఉననావా?
एक भूतिया घर में ही खोते हैं न?	తమ కనయతవానని కోలపోవాలని లేదుగా?
तुम सौ लडकियों के साथ सोए होगे, मेरे साथ नहीं सोओगे?	నువవు వంద మంది అమమాయిలతో గడిపావు, నాతో ఎందుకు గడపవు?
यह कया?	ఏంటిది?
ओए.	ఏయ.
यह तो कोई कबाडखाना लगता है.	ఇది పనికిరానివి పడేసే చోటు.
साला!	అబబా!
मरा हुआ आदमी? लिंग पर इतना जोर कयों डाला?	చనిపోయినవాడా? దానికి లింగ నిరధారణ ఎందుకు?
थोडी मसती करना चाहती हो?	నీకు కొంచెం సరదా కావాలా?
साला.	అబబా.
मैंने कहा छोड दो.	దానని వదిలేయమననా.
इसे कया हो गया?	అతనికి ఏమయింది?
हेदर!	హేథర!
हेदर!	హేథర!
साला!	అబబా!
तुम कहाँ हो? हेदर!	ఎకకడ ఉననావు? హేథర!
हेदर?	హేథర?
धत! ओह, धत.	ఛ! అయయో. ఛ.
उसने मुझे बताया तुम यहाँ होगे. यह भी बताया कि वह हिससा लेती थी.	తను నువవు ఇకకడ ఉంటావని చెపపింది. ఆమె పోటీలో పాలగొనేదని చెపపింది.
गरेबिल हाउस चुनौती में एक-दूसरे से पंगा लेना एक परंपरा है.	గరేబిల హౌస సవాలులో పరసపరం ఇబబంది పెటటుకోవడం పానిక సంపరదాయం.
-कम से कम उनकी गाडी नहीं मिली. -शायद वे बाइक पर आए होंगे.	-కనీసం వాళళ కారునెనా కనుగొనలేకపోయాము. -బెకుల మీద వచచారేమో.
हमने सोचा कि भितति चितरण लगाने वाले जजों की पहचान करेंगे.	మేము గరాఫిటీ వేసిన నయాయనిరణేతలను గురతిసతామని అనుకుననాము.
याद दिला दें, हेदर अभी भी 200 अंकों के साथ सबसे आगे है.	గురతు చేయడం కోసం, హేథర ఇంకా 200 పాయింటల ఆధికయతలో ఉంది.
हमें पता है कि दो जज मिलकर खेल का आयोजन कर रहे हैं,	మీకు తెలుసుగా ఆటను ఇదదరు నయాయనిరణేతలు నిరవహిసతారు,
शायद इन बचचों के लिए यह मुसीबत या खतरा था ही नहीं.	బహుశా ఈ పిలలలకి, ఇది తలనొపపి లేదా పరమాదమూ కాదేమో.
. . . और उसे किसी गैर मरद की बाहों में पाया.	. . . అతని భారయని మరో వయకతి బాహువులలో చూశాడు.
मुझे तुमहारा दोसत बनने की जरूरत नहीं, डॉज.	నీతో సనేహానికి నాకు కారణం అవసరం లేదు, డాడజ.
हैलो, जान. तुमहारी बडी याद आई. यहाँ आओ.	హే, బేబీ. నేను నినను మిస అయయాను. ఇలా రా.
-हमारी सोच एक है, जॉरज. -जैसा मैंने कहा,	-మనం ఒకే వెపు ఉననాము, జారజ. -చెపపానుగా,
मेरी माँ हाई सकूल में ही माँ बन गई थी.	మా అమమ హె సకూల అయిపోగానే గరభవతి అయింది.
पर समझ नहीं आता कि मुझसे नाराज कयों हो.	కానీ నీకు నాపె ఎందుకు కోపమో తెలియలేదు.
धत तेरी! रे, मुझे लगता है लिटल बिल. . .	అయయో! రే, నేను అనుకోవటం లిటిల బిల. . .
पता नहीं. कहते हैं पयार अंधा होता है,	నాకు తెలియదు. జనం పరేమ గుడడిది అంటారు,
जॉन डेविस हेल - ऐबी कलारक जिमी कोरटेज	జాన డేవిస హేల - ఆబీ కలారక జిమమీ కోరటెజ
माँ ने कहा वह विदेश में काम करते थे,	అతను విదేశాలలో పని చేసతాడని చెపపింది,
इसे देखूँ, उससे पहले पचास सेकंड हैं.	నేనది చూడకుండా 50 సెకనలు ఇసతుననాను.
जीते-जागते बचचों के साथ खेल खेलती.	మేము బతుకునన పిలలలను ఏడిపించేవాళళం.
-इसे छोड दो, टायलर. -चारजर लाए हो?	-వదిలేయ, టెలర. -నీ ఛారజర తెచచావా?
मैं मदद के लिए किसी को बुलाती हूँ!	నేను వెళళి ఎవరినెనా తీసుకువసతాను!
रचनातमक परयवेकषक रवीनदर शंकर शुकल	కరియేటివ సూపరవెజర రాజేశవరరావు వలవల
थोडे गाने चलाएँ? चलो शुरू करें.	కొంచెం సంగీతం విందామా? తవరగా పద.
ताकि अपनी पतनी को हैरान कर सके.	తన భారయను ఆశచరయపరచాలనుకుననాడు.
आए भी तो सडक के रासते नहीं आए.	అలా వచచుంటే, రోడడుగుండా రాలేదు.
-चलकर देखते हैं. -तुमहारी बारी.	-పదండి వెళళి చూదదాం. -నీ వంతు.
अचछा, इसका सिर संभालकर. अचछा.	సరే, సరే, అతని తల జాగరతత. సరే.
उस रात मैंने बहुत पी रखी थी.	ఆ రాతరి, నేను బాగా తాగుననాను.
तुमहें ठंड-वंड लग रही है कया?	ఏ భావం లేకపోవడం లాంటి ఏదెనా?
हे भगवान, तुम कया खाने को कुछ लाए हो, अगर भूख लग आए तो?	దేవుడా, మనకు కోరిక కలిగితే కావాలసిన ఈ శకతి బారలు తెచచావా?
तुमहारा कमरा एकदम तप रहा है.	నీ గది వేడిగా ఉడికిపోతోంది.
तुमहारी शिकायर कर सकता हूँ.	అందుకు నీపె ఫిరయాదు చేయగలను.
-मोर परिवार की है. -बिलकुल.	-మోరెసకు చెందినది. -అవును.
समय बरबाद करके लाभ नहीं. लगता है बिशप कुछ जानता है?	సమయం వృథా చేయడంలో అరథం లేదు. బిషపకు ఏదెనా తెలుసంటావా?
अगर एतराज न हो, तो उसके कमरे की तलाशी लेना चाहूँगा.	అంటే, మీరు ఏమీ అనుకోకపోతే, నేను అతని గదిని శోధిసతాను.
मैंने कहा कि मैं सोचूँगा.	నేనది ఆలోచిసతానని చెపపాను.
अचछा. देखो, वह एक गलती थी.	సరే. చూడు, అది ఒక తపపిదం.
और उसने वहीं पर घर बनाया.	ఎలాగెనా ఇలలు నిరమించాడు.
कया बात कर रहे हो, बिशप?	నువవు ఏం అంటుననావు, బిషప?
इस खून भरी पहेली को देखो.	చూడండి రకతంలో పొడుపు కథ.
हमें पता नहीं होता कि वह कहाँ जाते, फिर अचानक से,	ఆయన ఎకకడికి వెళళారో తెలియదు, అకసమాతతుగా ఒకసారి,
टरॉफियाँ हमारे पास थीं,	టరోఫీలు మా దగగరే ఉననాయి,
-तो, शुकरिया जो आपने मुझे आने दिया. -इतनी जलदी.	-రానిచచినందుకు ధనయవాదాలు. -అదీ తకకువ వయవధిలో.
तुम यह अकसर करते हो, तो इसमें कया बडी बात है?	నువవు ఇలా ఎపపుడూ చేసతుంటావుగా, పెదద విషయం ఏంటి?
अब गरेबिल का भूत उस घर में घुसने वाले सभी परेमियों को अभिशाप देता है.	ఇపపుడు గరేబిల ఆతమ, ఆ ఇంటిలోకి పరవేశించిన పరేమికులందరినీ శపిసతుంది.
अगर मैं तुमसे कुछ कहूँ,	నేను నీకు ఒకటి చెబితే,
पता है कि आप वयसत हैं,	మీరు ఎంత బిజీనో తెలుసు,
हे भगवान! तुम चढ पाओगी?	దేవుడా! నువవు ఎకకగలవా?
-मेरे कोई दोसत नहीं थे. -मुझे यकीन नहीं होता.	-నాకు ఎవరూ సనేహితులు లేరు. -నేను అది నమమను.
उसने कुछ लिया. उनहोंने पैसे देकर वापस लिया.	ఏదో తీశాడు. అది తిరిగి పొందేందుకు చెలలించారు.
उनके वहाँ आने के बाद,	వాళళు అందులోకి వెళళాక,
कुछ देर में मिलता हूँ.	ఇపపుడే వచచి కలుసతాను.
मैंने बाहर बो को देखा.	నేను బయట బోని చూశాను.
-जलदी करो. -चलो. जलदी.	-తవరగా. -రండి. తవరగా.
शरत लगाओगी कि लेनी ने वैकयूम से अपना टरेलर ठंडा करने की कोशिश की,	లేనీ మళళీ తన వయాకయూమ కలీనరతో టరయిలర నుండి వేడిని లాగాలనుకుంది,
शुभकामनाएँ, खिलाडियो.	బాగా ఆడండి, ఆటగాళళు.
हर एक के साथ सोते हो, मेरे साथ नहीं सोओगे?	అందరితో సెకస చేసతావు, నాతో ఎందుకు చేయవు?
दूसरी तरफ चलते हैं.	మనం ఇంకోవెపు చూదదాం.
"उसके अंदर के सुराग का पता लगाओ, जिसने जलदी शीशे खतम किए. "	"లోపల ఎవరో సూచన తెలుసుకోండి, అదదంలో మొదట చివర ఉండవచచు. "
पारटी शुरू की जाए.	పారటీ మొదలుపెడదాము.
उनहोंने वह सब किया जो कि लोगों ने कहा?	ఆయన చేశారని చెపపిన పనులు ఆయన చేశారా?
नहीं, मुझे. . . मुझे गुससा नहीं आया.	లేదు, నాకు రాలేదు. . . నాకు కోపం లేదు.
यह पहेली का भाग है?	పొడుపు కథలో భాగమా?
तुम यह कया कर रही हो? मजाक कर रही हो?	నువవు ఏం చేసతుననావు? నాతో పరాచికమా?
मैं भूल गया था कि आपको अपना कानून अंधा ही अचछा लगता है.	మీ అందరూ ఈ నయాయదేవతలా గంతలు కటటుకుననారని మరచిపోయాను.
नैट, मुझे पता है तुम कया कर रही हो. इसकी जरूरत नहीं.	నాట, నువవు ఏం చేయాలనుకుంటుననావో తెలుసు. ఇలా చేయకకరలేదు.
मैं कशती लेकर अपने दोसतों के साथ सैर के लिए जा रहा था.	నేను నా పడవలో నా సనేహితులతో చినన పరయాణం చేసతుననాను.
जादूगर. . . जिम को पयार से जिमी जादूगर कहा जाता था.	మాంతరికుడు. . . జిమమీ మాంతరికుడు, అది జిమమీ మారు పేరు.
-साला, मेरा फोन बंद हो गया. -नहीं.	-అబబా, నా ఫోనలో ఛారజింగ లేదు. -అయయో.
अब भी इनहें भूतों की कहानियाँ सुनाती हो? रूबी एन को डरावने सपने आते थे.	మీరింకా ఆ పాత దయయం కథలు చెబుతుననారా? రూబీ ఆనకు పీడకలలు తెపపించినవి.
इशारा देता हूँ. मेरे और लीला के बारे में जानकर तुम गुससा कयों हुई?	నీకో సూచన ఇసతాను. లీలా ఇంకా నా సంగతి తెలియగానే నీకెందుకు కోపం వచచింది?
समझ गई. धयान से.	సరే. అకకడ జాగరతత.
नहीं, उतनी नहीं.	లేదు, అంతగా కాదు.
मेरे लिए करता था.	నా కోసమే చేశాడు.
-सुनो, नैट? -हाँ?	-హే, నాట? -ఏంటి?
अपने कपडे पहन लो.	నీ బటటలు వేసుకో.
-बाद में बात करें? -बिलकुल नहीं.	-అది తరువాత మాటలాడుకుందామా? -లేదు.
इस घटिया जगह सिगरेट पीना चाहते हो?	నీకూ ఈ చెతత చోటులో తాగాలని ఉందా?
कुछ दिनों से दिमाग ठिकाने नहीं था.	కొనని రోజులుగా నా మతి కోలపోయాను.
ओए, रे, यह देखो.	ఏయ, రే, ఇది చూడు.
वह चोरी से अपने कमरे में गया. . .	అతను తన పడకగదిలోకి వెళళాడు. . .
और उसने सभी परेमियों को शाप दिया,	అతను ఆ పరేమికులందరినీ శపించాడు,
-मन बदल लिया? -दिमाग ठिकाने नहीं.	-మనసు మారచుకుననావా? -వదిలేశాను.
पर एक दिन वह घर लौटा और उसने दरवाजा नहीं खटखटाया,	అయితే, ఒకరోజు, అతను ఇంటికి వచచి తలుపు తటటలేదు,
चार बार दरवाजा खटखटाता और अंदर घुसने से पहले दस सेकंड रुकता. . .	నాలుగుసారలు తలుపు తటటి, పది సెకనలు ఆగి లోపలికి వచచేవాడు. . .
पता नहीं. मेरी माँ कहा करती थी कि नशे वाले एजेंट मछली पकडते हैं.	నాకు తెలియదు. మతతుమందు బానిసలు చేపలు పడతారని మా అమమ చెపపేది.
जनमदिन के कारड वगैरह भेजते थे.	ఆయన పుటటినరోజు కారడులు పంపేవాడు.
एक नई टरॉफी लेकर, घर पहुँच जाते.	కొతత టరోఫీ తీసుకుని ఊడిపడడారు.
बेकसूर हों या कसूरवार, पैरोल के बिना उमर कैद की सजा काट रहे हैं.	నిరపరాధో లేదా అపరాధో, పెరోల లేకుండా జీవిత ఖెదు గడుపుతుననారు.
अब समझ आया कि परेशानी कयों है.	ఇపపుడు అరథమెందా మనకెందుకు సమసయో.
आप और मैं दोनो.	మీరూ నేను ఇదదరం.
कया बडी बात है?	పెదద విషయం ఏంటా?
मुझे लगने लगा है कि तुम बुरी खबर ही लाते हो.	ఏదో చెడు వారత ఉంటేనే నువవు ఫోన చేసతావనుకుంటాను.
तुम जानते हो यह वयकतिगत जगह है.	ఇది పరెవేట ఆసతి అని తెలుసుగా.
अजीब है कोई इतना खतरा उठाएगा,	వాళళు చాలా రిసక తీసుకుంటుననారు,
जब ऐबी उससे मिलने लगी, तो कुछ लोग उसे डोरोथी कहकर पुकारने लगे.	ఆబీ అతనితో డేటింగ చేసేపపుడు, ఆమెను డోరొతీ అని పిలిచేవాళళం.
तुमहारे लिए पहली बार नहीं है न?	ఇది నీకు మొదటిసారి కాదు, కదా?
वे मेरे जनमदिन पर आते भी थे.	అవి నా పుటటిరోజున వసతాయి కూడా.
छछूँदर से भी जयादा छुपता है.	గూఢచారి కంటే ఎకకువ దాకకుంటాడు.
गरेबिल परिवार.	గరేబిల కుటుంబం.
यह कौन है. वह जिसे फंदा लगा.	అది ఎవరు. ఉచచు వేసుకునన మనిషి.
ओए, रे. सिगरेट पीना चाहते हो? दरवाजा बंद करो.	ఏయ, రే. నువవు ఏమెనా తాగుతావా? తలుపు ముయయి.
हे भगवान! रसोई भंडार में देखो.	అయయో, దేవుడా! పాంటరీలో చూడు.
डरने का सबूत देंगे, तो उनके अंक घटाए जाएँगे.	రుజువు చూపిసతే, వారికి పాయింటలు తగగుతాయి.
ताकि उनहें असली डर का अहसास हो, ताकि वे अपने चाहने वाले को मरता देख सकें.	తమ పరేమికులు చనిపోతుంటే చూసతే, వారికి అసలు భయమంటే ఏమిటో తెలుసతుందని.
"राजा को मरे हुए के अंदर सुराग के लिए कारण की अपेकषा थी. "	"రాజు మరణించిన వారిలో సూచనల కోసం కారణాలు చూసతుననాడు. "
