पर कल मैंने उनकी चिंता दूर कर दी.	కానీ నేను ఆమె ఆందోళనలను అననీతొలగించాను.
फायरिंग रोक दो.	కాలపులు ఆపండి.
जितने भी जितने बैरल पेटरोल, डीजल और इंजन तेल मिले ले आईये.	మరియు అనేక బారెలస పెటరోల, డీజిల మరియు ఇంజిన ఆయిల కూడా తీసుకుని రండి.
और जिस बोट से 24 सीख रेजिमेंट के जवान जा रहे थे	మరియు వారు పడవలో 12 దళాలను కూడా పేలచారు.
हे ईशवर मालिक हे दाता	ఓ పరభూ, ఓ దాత, ఓ సృషటికరత
विकरम, वहां से करीब 50 सैनिकों को कम करो.	వికరమ, అకకడి నుంచి 50 మంది సెనికులును తగగించండి.
पाकिसतान की फौज कचछ पर हमला करने आ रही है.	పాకిసతాన సెనయం కచను సవాధీనం చేసుకోవడానికి వసతోంది.
हमारे रनवे तूफान में उजडे घरौंदो की तरह तहस नहस हो चुका था.	తుఫానులో చికకుకునన ఇలలు లాగ రనవే ధవంసం చేయబడింది.
कल सुबह सूरज की पहली किरण के साथ	రేపు తెలలవారి జాము యొకక మొదటి కాంతితో
हिंदुसतान ने पूरवी और पशचिमी पाकिसतान पर. . .	భారతదేశం, తూరపు మరియు పశచిమ పాకిసతానలో
अब यहीं इचछा है कि रावण को भी मार दूँ.	ఇపపుడు నేను రావణుడిని కూడా చంపాలనుకుంటుననాను.
पाकिसतानी एअर पलेनस और सेना पर हमला करते है	విఘాకోట పోసట వదద ఉనన పాకిసతాన విమానాలు మరియు దళాలు
दुनिया के इतिहास में शराफत की इतनी बडी कीमत किसी और देश ने नही चुकाई होगी.	పరపంచంలో ఏ దేశం కూడా దాని మరయాద కోసం ఇంత పెదద ధర చెలలించలేదు.
मैं पगगी को लेकर वही पहुँचता हू.	నేను పాగీతో అకకడికి వెళతాను.
पाकिसतान ही इसलाम का सबसे बडा दुशमन है.	పాకిసతాన ఇసలాంకు అతి పెదద శతరువు.
इससे माकूल वकत दोबारा नहीं मिलेगा.	మేము దీని కంటే మంచి అవకాశానని కనుగొనలేము.
भारत अपनी जमीन पर हल चलाकर ही खुश है.	భారతదేశం సంతోషంగా తన సొంత భూమిని పండిసతోంది.
जनाब हम '65 में भी हरामी नाला पार नहीं कर पाये थे.	సర, మేము '65 లో హరమి నాలా ను దాటలేకపోయాము.
एक औरत.	ఒక మహిళ.
या कफन सिपाही वाला	లేదా కవచ ముకకలో
सर.	సర.
जिसमे से एक बम जो रनवे हम बना रहे थे उस पर गिर गया,	వాటిలో ఒకటి రనవేపె పడింది మేము దానిని పునరనిరమాణం చేసతుననాము.
हमारी सेना जलद ही पूरवी पाकिसतान के लोगों को	మా సెనయం తవరలో తూరపు పాకిసతాన నుండి విముకతి అవుతుంది.
- सुनाई नहीं दिया! - नहीं, सर!	- వినిపించడం! - లేదు అయయా.
पाकिसतानी सेना को रोकने का कोई तो रासता होगा.	అపపుడు పాకిసతాన సెనయానని ఆపడానికి ఏదో ఒక మారగం ఉండాలి.
फायर! फायर!	కాలచు! కాలచు!
और जितनी जलदी और जितना जयादा डायनामाइट एंटी टैंक माइंस	అకకడ డెనమెటలను, యాంటీ టయాంక గనులను తీసుకోండి.
और सुबह 4 से 5 बजे तक भुज हवाई अडडे को अपने कबजे में कर लेगा.	ఉదయం 5 గంటలకు భుజ విమానాశరయానని సవాధీనం చేసుకోండి.
रनवे और हवाई अडडा दोनों तोड दिये है.	రనవేను మరియు విమానాశరయానని ధవంసం చేయడానికి.
आप उषा से बोलो कि सवामी नारायण मंदिर में हम सब के खाने का इंतेजाम करे	సవామినారాయణ ఆలయంలో అందరి భోజనం ఏరపాటు చేయమని ఉషకు చెపపండి
जब तक भुज हवाई मैदान पर विजय कारणिक रनवे रिपेयर नहीं कर लेते.	భుజ ఎయిరఫీలడలో విజయ కారనిక రనవేని రిపేర చేయనంతకాలం
पशचिमी कषेतर एकदम खाली पडी है.	పశచిమ భూభాగం తెరిచి ఉంది.
औरत कुछ भी जोड सकती है.	మహిళలు ఏదెనా పరిషకరించగలరు.
लेकिन अगर आज हमने पांडवो की तरह अतयाचारी के खिलाफ लडने का संकलप कर लिया	కానీ మనం ఈ నిరంకుశుల తో పాండవుల లా పోరాడతామని పరతిజఞ చేసతే
कमांडिंग अफसर है विजय कारणिक.	వారి కమాండింగ అధికారి విజయ కారనిక.
इसलिए भुज एयरपोरट पर हेलीकॉपटर से 24-24 के तुकडियो में सैनिक उतरेंगे.	కాబటటి, భుజ విమానాశరయంలో 24 సమూహం తో దళాలు మోహరించబడతాయి.
और जैसा लकषमण दिखा रहे है वैसा करेंगे.	మరియు లకషమణ చేసినటటుగానే చేయండి.
लेकिन मैंने सर जमिने हिंदुसतान से वादा किया है	కానీ నేను నా మాతృభూమికి వాగదానం చేసాను
जी जनाब.	సరే అండి.
विघाकोट पोसट से हरामी नाला पार करते हुये	విఘాకోట నుండి హరమి నలను దాటుతాయి.
या 10 फीट सीमेंट की दीवार के पीछे छिप जाओ,	లేదా సిమెంట గోడ వెనుక దాకకుననా కూడా
ये पाकिसतान का राषटरीय धवज है जनाब.	ఇది పాకిసతాన జాతీయ జెండా, సర.
ये है आपका नकली पाकिसतानी आयडी.	ఇది మీ నకిలీ పాకిసతానీ ID.
मेरे शेर की आंखों में उदासी?	నా సింహం కళలలో దుఃఖం కనిపిసతుంది.
पाकिसतानी पलेन बम गिराने के लिए आ रहे है.	అంటే శతరు విమానాలు మాపె దాడి చేయడానికి వసతుననారు.
एक मुसलमान विकलांग लडकी जीनत को अपना दिल हार गया.	ఒక భిననమెన ముసలిం అమమాయి జీనత ని చూసి తన హృదయానని కోలపోయాడు.
और हां उनकी सुरकषा के लिए पाकिसतानी लडाकू विमान आसमान में गसत लगा रहे है.	అవును, పాకిసతాన విమానాలు వారి భదరత కోసం గాలిని వెతుకుననారు.
तो अब पांडव समझ ले कि वो 3. 1 मेगाहरटज पर है.	అవి 3. 3 ఎం ఎచ జి వదద ఉననాయి అని పాండవులు తెలుసుకోవాలి.
और 20 फीट का खडडा हो गया.	మరియు 20 అడుగుల బిలం ఏరపడింది.
मेरे हिसाब से तो असंभव कारय है मराठा बाग.	ఇది అసాధయమెన పని, సకవాడరన నాయకుడు.
और तुम. . . सिरफ तीस लाख लाशें जुटा पाए.	మరియు మూడు లకషల శరీరాలను మీరు మాతరమే సేకరించగలరు.
हिनदुसतानी सेना हमारी मदद के लिये ना आ सके	భారత సెనయానని మన వదదకు సహాయం కోసం రావడానని ఆపడానికి
मेरी सासू मां को हमेशा यहीं चिंता लगी रहती है	మా అతతగారు ఎపపుడూ ఆందోళన చెందుతుంటారు
एक पाकिसतानी बॉकसर का जबडा तोड दिया.	పాకిసతానీ బాకసర దవడ విరిగింది.
जय माता जी!	అమమవారి మహిమ.
टैंक को बाईं ओर ले जाएं. जलदी.	వెంటనే టయాంకను ఎడమ వెపుకు తరలించండి.
बोलिये.	చెపపండి.
और आज रात बारह बजे 3. 1 मेगाहरटज पर वो हमें मैसेज देने वाले है	మరియు ఈ రాతరి అరధరాతరి, వారు మాకు 3. 1 ఎం ఎచ జి వదద సందేశానని పరసారం చేసతారు.
और सबकी पतनियों को यहां बुला लो.	ఇకకడ అందరి భారయలను పిలవండి.
जान बरिगेडियर बेग और तैमूर आ गये है.	పరియురాలా, బరిగేడియర బేగ మరియు తెమూర వచచారు.
फिकर मत कीजिए.	చింతించకండి.
अपनी रोजी रोटी कामने के लिये परदेश चले जाते हैं,	జీవనోపాధి కోసం చాలా దూరం పరయాణించారు. .
"देखना है जोर कितना बाजूएं कातिल में है. "	"శతరువు ఎంత ధెరయంగా ఉందో చూదదాం. "
हर एक बालिका विदुषी हो	పరతి అమమాయి తెలివిగా ఉండాలి
"सर फरोशी की तमनना अब हमारे दिल में है. "	"నా జీవితానని తయాగం చేయాలనే కోరిక నా మనసులో ఉంది. "
हे करणी माता,	ఓ దేవత కరణి
और देखते ही देखते पाकिसतान के एक बहुत बडे हिससे पर हमारा कबजा हो गया.	పాకిసతాన యొకక పెదద భాగానని తవరలో మేము సురకషితం చేసతాము.
कयोंकि पाकिसतानी पलेन ने हमारा हेलीकॉपटर मिसाईल से तोड दिया है.	ఎందుకంటే పాకిసథాన నేవీ మా హెలికాపటరను పేలచివేసింది.
"और साकषी हूँ कि मुहममद (पी. बी. यू. एच)"	"మరియు సాకషయమివవడానికి ముహమమద ఒక (పి. బి. యూ. ఎచ)"
मैंने एक आवाज सुनी. वहाँ कोई है.	అకకడ ఎవరో ఉననారు, నేను ఒక శబదం విననాను.
की ये '71 का पाकिसतान हैं.	ఇది '71 పాకిసతాన యొకక కొతత యుగం.
मेरा छोटा भाई	నా కిడ బరదర
100 से जयादा सैनिकों को आपकी चौकी पर नहीं भेज पाएंगे.	మీ బలోపేతం కోసం 100 దళాలకంటే ఎకకువ పంపలేము.
हीना पाकिसतान में हमारी जासूस है.	పాకిసతానలో హీనా మన గూఢచారి.
ये पांच रासते और भुज रनवे को तोड दे.	ఈ ఐదు మారగాలు మరియు భుజ రనవే.
मैं और मेरे साथी सुंदर बेन के साथ हवाई पटटी जरूर बनाएंगे.	నేను మరియు నా బృందం సుందర బెనతో కలిసి ఎయిరసటరిప ను పునరనిరమాణం చేసతాము.
अगर हम फाइटर पलेन से विघाकोट चौकी पर	మనము దాడి చేయడానికి యుదధ విమానాలను ఉపయోగిసతే
विकरम बलजीत से संपरक नहीं हो पा रहा है.	వికరమ, నేను సంపరదించలేను, బలజీత.
आप लोगों पर कोई दबाव नहीं है.	మీపె ఎలాంటి ఒతతిడి లేదు.
विघाकोट पोसट की तरफ जाते हुए देखा हैं.	విఘాకోట పోసట వెపు కవాతు చేశారు.
बहुत शौक है उसे कि मैं घोडी चढू ढोल बजे	ననను వరుడి లా చూడాలనేది ఆమె కల.
1500 हिंदुसतानी फौजी वहां मौजूद है.	1500 మంది భారత సెనికులు అకకడ నియమించబడడారు.
और पशचिमी भारत का जितना जयादा से जयादा इलाका अपने कबजे में ले सकते हो ले लो.	మరియు పశచిమ భారతదేశం యొకక అనేక భూభాగాలను సవాధీనం చేసుకోవచచు.
इसलिए मैंने फैसला किया कि	కాబటటి నేను నిరణయించుకుననాను,
फिर हिनदुसतानी सेना चाहे समंदर से आये	ఒకవేళ భారత సెనయం అయినా సముదరం గుండానే వసతుంది,
अब कचछ और भुज की सुरकषा आपके ही के हाथों में है.	కచ మరియు భుజ యొకక భదరత మీ చేతులలో ఉంది.
पाकिसतान का परचंम!	పాకిసథాన జెండా!
1970 में पूरवी पाकिसतान के बांगला मुसलमानों और हिंदुओं ने मिलकर	బంగలా ముసలింలు మరియు తూరపు పాకిసతాన యొకక హిందువులు
धीरे-धीरे रेगिसतान में आता है.	కాలువ దవారా ఎడారిలో నెమమదిగా పరవహించి
और हिंदुसतान कि सेना में वीरों की कोई कमी नहीं	మరియు భారత సెనయంలో హీరోలకి కొరత లేదు.
शाबाश.	మంచిది.
निशाना!	లకషయం!
सभी टैंकों को बाईं ओर चलाएं.	అనని టయాంకులను ఎడమ వెపుకు తిపపండి.
कितने फौजी मौजूद है वहां?	అకకడ ఎనని దళాలు నియమించబడడాయి?
सरहदों से कहकर आया था	సరిహదదులకు వాగదానం చేశాడు.
ऑपरेशन हूर में इस चील का काम था पाकिसतानी सेना की अंदुरुनी ठिकानों में झकना	అతని ఉదయోగం ఆపరేషన హూరలో పాకిసతాన రహసయ పరదేశాలను గురతించడం.
पगगी ने जानवर तो नहीं कटने दिये	పాగి జంతువుల మారణహోమానని అనుమతించలేదు.
ऑपरेशन हूर शुरू कर दो.	హూర ఆపరేషన ను పరారంభించండి.
मगर भगवान शरी कृषण ने कहा है	కానీ శరీకృషణుడు చెపపాడు
एक बार भुज हवाई अडडा कबजे में आ गया	ఒకసారి భుజ విమానాశరయం మన నియంతరణలో కి రాగానే
तो लडाई खतम होने के बाद 1965 की तरह	అపపుడు వారు మాతో చరచలు జరపడానికి పరయతనిసతారు
वहां पर पलेन का सही सलामत लैंड होना	ఈ విమానం లయాండింగ సురకషితంగా ఉండే అవకాశాలు,
लैंड माइंस और गोला बारूद मिले ले आईये.	లయాండ మెనస మరియు పేలుడు పదారథాలు మీరు పొందవచచు.
लकषमण. ठेकेदार को बुलाके रनवे रिपेयर करवाना शुरू करो.	లకషమణ. కాంటరాకటరకు కాల చేయండి మరియు రనవే మరమమతు చేయడం పరారంభించండి.
सर ये पलेन 500 सैनिकों को लेकर उड नहीं पायेगा.	సర, ఈ విమానం 500 దళాలను తీసుకెళలలేదు.
- समझ गये? - जी सर.	- అరథమెందా? - సరే అండి.
इन सैनिकों को सिविलियन बोट से भेजा गया है.	ఈ దళాలను పౌర పడవల దవారా పంపబడడాయి.
हिंदुसतान से अपनों का दुख देखा नहीं गया.	వారి సవంత దేశ పరజల దుఃఖం భారతదేశం తటటుకోలేకపోయింది
और उनके साथ छोटा सा वयापार करेंगे.	మరియు ఆమెతో చినన వయాపార ఒపపందం చేసుకుంటాను.
बेहतर.	మంచిది.
भुज हवाईकषेतर के कमांडिंग अफसर साहब. . .	భుజ ఎయిరఫీలడ కమాండింగ ఆఫీసర. . .
वकार आप सोमनाथ के साथ जाईये.	వకార, సోమనాథతో వెళలండి.
रॉ ने रणछोड भाई के हाथ में एक बहुत महतवपूरण संचालन की बागडोर सौंप दी.	రా రానచోడ భాయను చాలా కలిషటమెన ఆపరేషనతో పరదానం చేసింది.
बेकसूर जानवरों कि हतया नहीं होने देंगे.	అమాయక జంతువు యొకక మారణకాండను ఎపపటికీ అనుమతించవదదు
और 50 परतिशत हिससे में रेगिसतान है.	మరియు మిగిలిన 50 శాతం ఎడారి.
जय भवानी!	హాయిల భవాని
"शाहजहाँ पयार का बादशाह है. "	"షాజహాన పరేమ చకరవరతి. "
पूल के दोनों तरफ बारूद लगा हुआ है	వంతెన రెండు వెపులా పేలుడు పదారథాలు ఉననాయి
जी जनाब.	సరే అండి.
पाकिसतान का परचंम!	పాకిసథాన జెండా!
फायर!	కాలచు!
जय कनहैया लाल की. . .	శరీకృషణుడికి మహిమ
तीस लाख जनाब.	మూడు లకషలు, సార.
चलो! चलो!	కదలు! కదలు!
और हिंदुसतान का सबसे खूँखार दुशमन.	మరియు భారతదేశ పరధాన శతరువు.
और 50 टाइम बम गिराके भुज हवाई अडडे को तबाह और बरबाद कर दिया.	మరియు భుజ ఎయిరబేసలో 50 టెం బాంబులను వేసి భుజ వెమానిక సథావరానని ధవంసం చేసింది.
मार दिया जाये! मार दिया जाये!	అతడని చంపు! అతడని చంపు!
जामनगर से या पुना से	జామనగర లేదా పూణే
पशचिमी पाकिसतान के जुलम से मुकती दिलवाएगी.	పశచిమ పాకిసతాన దారుణాల నుండికూడా.
कया ये मुसलमानों के साथ गददारी नहीं थी.	ఇది ముసలింలకు చేసిన దరోహం కాదా?
मार दिया जाये! मार दिया जाये!	అతడని చంపు! అతడని చంపు!
बरखा की जल धारा चरण पखारती	వరషపు చుకకలు మీ పాదాలను కడుగుతాయి
तू हंजू मैनू देदे	మీ కననీళలు నాకు ఇవవండి
मीरामड और अबबू	మీరామద మరియు అబబు
सांसें वतन की है उधारी	దేశానికి నా ఊపిరి
और ठीक बारह बजे वापस चला जाता है.	అరధరాతరి నాటికి తగగుతుంది.
तू हंजू मैनू देदे	మీ కననీళలు నాకు ఇవవండి
सर भुज और जामनगर पर पाकिसतानी लडाकू विमान ने अब तक का सबसे बडा हमला किया है.	పాకిసతాన జెటలు జామనగర సథావరానికి భారీ నషటానని కలిగించాయి. .
