मरीन?	మరీన?
आज के आपके जोडीदारों को	ఈరోజు మీకు జత చేసిన భాగసవాములను
वह आसमान से गिर पडी.	అది ఆకాశం నుండి పడిపోయిందట.
कि इसकी वजह तुमहारा फेलिपे के साथ होना नहीं, बलकि. . .	నువవు ఫిలిపేతో ఉననందుకు కాదని, కానీ. . .
तो तुम अकेले नाचोगी?	అయితే, సోలో చేసతుననావననమాట?
और एक बार फिर उसने अपना दिल आसमान के लिए खोल दिया.	ఇంకోసారి గగనానికి తన హృదయం తెలిపింది.
वही पुरसकार की सीढी है.	తనే పరెజకు కీలకం.
पर एम ने मुझे बता दिया.	కానీ ఎం చెపపింది.
और जिस रात वह घटना घटी,	అది జరిగిన రాతరి,
तुमने कया बकवास की?	ఏమననావు నువవు?
अलारम लगा लिया करो.	అలారం పెటటుకో.
कि मुझे जाना चाहिए.	నేను వెళళాలని.
लेकिन मैंने अपने बोझ से पयार करना. . .	కానీ, నేను నేరచుకుననాను. . .
कि हम साथ में पुरसकार जीतेंगे या फिर जीतेंगे ही नहीं.	కలిసే పరెజ గెలుసతాం, లేదంటే అసలేం వదదు.
मैं नहीं चाहती थी कि उसे तकलीफ हो.	తనను బాధ పెటటాలని లేదంతే.
मुझे पता है वह और एम बहुत करीब थे.	తను, ఎం ఎంత దగగరో తెలుసు.
जिसे मैं गरव के साथ अपना सहयोगी और दोसत कहती हूँ.	గరవంగా చెపపుకొనే తన పుటటినరోజు కనుక.
मैंने "गलत" किया. जैसा मेरा थेरेपिसट कहता है.	"తికక చేసాను". నా థెరపిసట మాటలలో.
कया जलन हुई थी?	అసూయపడడావా?
कया मेरी नजर तुम पर नहीं रहती?	నినను చూడలేననుకుననావా?
तुम और ओली.	నువవు, ఆలీ అలా.
"वह भागयशाली है, जो फिर खडी हो उठती है. "	"తిరిగి గెలిచినదీ ఆశీరవాదమే. "
सब बढिया चल रहा है.	పరిసథితులు చాలా బావుననాయి.
कया तुम मेरी पोल खोल दोगी?	ననను బయటపెటటేసతావా?
कसम से कहती हूँ, जानबूझकर कभी तुमहें दुख नहीं दूँगी.	నామీద ఒటటు, నేను కావాలని బాధ పెటటలేదు.
जानती हूँ हमारी शुरुआत अचछी नहीं हुई.	మనం మంచిగా కలవలేదని తెలుసు.
एक दिन मैं तुमहारे लिए नाचना चाहूँगा.	నీకోసం ఒకరోజు డానస చేసతాను.
तुमहें असल जिंदगी में अपनी देखभाल करना नहीं आता और हमसे कोई उममीद मत रखना.	నీకు లోకంలో బతకటం రాదు, ఇక నేను సంబంధాలు తెంచుకుంటాను.
हम सरवशरेषठ पुरुष नरतक का पुरसकार आपको देते हैं.	బెసట మేల డానసర పరెజ నీకు ఇసతుననాము.
मैं अपने कमरे में हूँ.	నా గదికి వచచాను.
सकूल से?	సకూల నుండా?
अगर हमने चूहों से छुटकारा न पाया,	ఎలుకలను వదిలించుకోకపోతే,
मुझे दूसरा नहीं चाहिए.	నాకింకొకటి వదదు.
कैसी हो?	ఎలా ఉననావు?
तो जलदबाजी करनी होगी.	అయితే మనం అననీ వేగంగా చేయాలి.
माँ किसी की नहीं सुन रही थीं.	ఆమె ఎవరి మాట వినలేదు.
पुरसकार के लिए चार सपताह बाकी	పరెజకు 4 వారాల ముందు.
मैं बेंजामिन की परियोजना और अकादमी दोनों के लिए	బెంజమిన పరాజెకట కోసం ఇంకా అకాడమీకి
एम, जमाल नाम के किसी आदमी का फोन है.	ఎం, టెలిఫోన. ఎవరో జమాల అట.
और हम दोनों ठीक तीन की गिनती पर रुक जाएँगे.	సరిగగా మూడు దగగర ఇదదరం ఆపేదదాం.
मरीन का संकषिपत, पर मुझे यह नाम कभी पसंद नहीं आया.	మరీన కుదిసతే, కానీ నాకెపపుడూ నచచదది.
तुमसे मुझे खुशी मिलती है.	ననను సంతోషపెడతావు.
तो हम कया करें?	అయితే, ఏం చేదదాం మరి?
जोश से भरी है.	చురుకెనది.
कयोंकि अगर करना बंद किया, तो मेरा कोई चहेता मुझसे दूर हो जाएगा.	నేను ఆపితే కనుక, నేను పరేమించినవారు ఇక ఉండరు.
मेरे साथ-साथ दोहराना.	నాతోపాటు చెపపు.
मेरी तरफ देखो!	ననను చూడు!
मैं बस चाहता हूँ. . .	నా ఉదదేశయం. . .
मेरी तरफ देखो.	ననను చూడు.
तुम मुझे सब कुछ बता सकती हो.	నాకు ఏదెనా చెపపవచచు.
ऑडिशन	ఆడిషనలు
पलीज.	దయచేసి.
यह सच नहीं है.	నిజం కాదు.
वह सममान की बात होगी.	అది నాకే గౌరవం.
तुमने मुझे खुद का सामना करने के लिए मजबूर किया और अब मैं आजाद महसूस करती हूँ.	నువవు నిజంగా ననను తటటిలేపావు, ఇపపుడు నాకు సవేచఛగా ఉంది.
शायद वे इनामी डांस के लिए फेलिपे को मेरा जोडीदार बना देंगे.	నా పరెజ డానసకు నాకు ఫిలిపేను జత చేసతారేమో.
कया तुमहें यहीं सिगरेट पीनी है?	ఇకకడ పొగ తాగబోతుననావా?
-हे भगवान. -घबराना मत.	-దేవుడా. ఓరి దేవుడా. -శాంతించు.
जानती हूँ इसे गुमनाम रहना था, इसलिए मैं कुछ कहने वाली नहीं थी.	అది అజఞాతంగా అని తెలుసు, అందుకే ఏం చెపపలేదు.
बढिया! करीब-करीब ऐसे ही!	బావుంది! అంతే ఇక!
सोचती हो कि औरों के साथ सोकर शिखर पा लोगी	నువవు నీ సటారడం కోసం పడుకుంటే
खेलना है या नहीं?	ఆడతావా లేదా?
इसका कया मतलब है?	దానరథం ఏంటి?
मेरा नाम जमाल है.	నాపేరు జమాల.
तो, मैं. . .	అందుకే, నేను. . .
पुरसकार आपका हुआ.	ఈ పరెజ మీదే.
मुझे भी तुमको कुछ बताना है.	నీకో విషయం చెపపాలి.
मेरे लिए बस यही एक मौका है.	ఇది నా ఏకెక అవకాశం.
बस अपना हुनर दिखाओ.	నువవేం చేసతావో అది చెయయంతే.
-बटन लगाने में मदद करोगी? -कयों नहीं.	-బటనలు పెడతావా? -తపపకుండా.
बहुत अचछे.	మంచిది.
यह सौभागय के लिए है. शुभ वसतु.	ఇది అదృషటానికి. చారమ.
करिसमस में तुमने जो वजन बढाया,	కరిసమస సమయంలో పెరిగిన
मुझे वह असली लगा था.	నేను నమమేసాను.
बहुत अचछे.	మంచిది.
यह कया है?	ఏంటిది?
यह कया है?	ఏంటిది?
मेरे जूते.	నా షూస.
धनयवाद.	ధనయవాదాలు.
बहुत अचछे.	మంచిది.
इससे तुम अमेरिका में सबकी चहेती बन सकती हो.	అమెరికాలో అది సంచలనం కావచచేమో.
तुमने मेरा फोन उठाना बंद कर दिया.	నా కాలస ఎతతటం మానేసావు.
तो भगवान करे कि तुम ऐसे ही उनकी माँगों को पूरा करते रहो.	అందుకే, నువవు వారి కోరికలను తీరుసతుండు.
कि हर कदम पर एक-दूसरे की मदद करेंगे.	పరతి అడుగులో చేయూతనిసతాం.
आपने मेरा सिर गरव से ऊँचा कर दिया है, ननहे छातरो!	బులలి డానసరలూ! నాకు గరవకారణం మీరు.
गैर-समलैंगिक डांसर बडे छिछोरे होते हैं.	హెటిరో డానసరలు పొగరుబోతులు.
बस मैं और मेरे डैड ही हैं.	నేనూ మా నానన అంతే.
इसे भी ऐसा करके खुशी होगी.	తనకి కూడా సంతోషమే.
दृढ इचछाशकति,	దృఢచితతం,
उसे बेच दिया.	అమమేసాను.
-हैलो. -हैलो.	-హే. -హే.
कोई बात नहीं.	పరవాలేదు.
पता नहीं.	నాకు తెలియదు.
पता नहीं.	నాకు తెలియదు.
और अब हमारी परतिभाशाली बैलेरीना के लिए.	ఇక మా పరతిభ గల బాలెరీనాలకు.
मुझे भी तुमसे मिलकर अचछा लगा.	నినను కలవటం సంతోషమే.
उनकी माँगों को पूरा करने से उनका कया मतलब था?	వారి కోరికలను తీరచటం అంటే అరథం?
बागी के दिल से. दृढ इचछाशकति से.	విపలవ హృదయం. దృఢచితతం.
यह चूहा हमारे तहखाने की एक चूहेदानी में फँस गया.	ఈ ఎలుక మా బేసమెంట ఎరలో దొరికింది.
ठीक है, लेट जाओ.	సరే, పడుకో.
वह मेरी ही गलती थी.	అంతా నా తపపే.
और आप मान गए?	దానికి ఒపపుకుననావా?
"कोई नए दोसत? "	"కొతత సనేహితులయయారా? "
आपकी बेटी बहुत दिलचसप है.	మీ డయానసర అదభుతం.
कि हम साथ में पुरसकार जीतेंगे या फिर जीतेंगे ही नहीं.	పరెజ కలిసే గెలవాలి లేదంటే అసలు వదదు.
कसम से, मैंने ऐसा नहीं किया.	ఒటటు, నేను చేయలేదు.
वह भागयशाली है, जो गिरती है.	ఓడిపోవటం ఆశీరవాదమే.
तुम कया खेल खेलने की कोशिश कर रही हो?	నువవే చెతత ఆట ఆడుతుననావు?
देखती हूँ इतना बडा कुछ मिलता है या नहीं.	అంత పెదదది ఉందేమో చూడనివవు.
हाँ.	అవును.
मैं तेरी जान ले लूँगी!	నినను చంపేసతాను! నినను చంపేసతాను!
हाँ.	అవును.
किस तरह का खेल?	ఎలాంటి ఆట?
बिलकुल नहीं.	కచచితంగా నొకకలేదు.
जूतों के लिए शुभकामनाएँ.	నీ షూలతో గుడ లక.
जाने दो.	పటటించుకోకు.
नहीं. मैं. . .	లేదు, లేదు. నేను. . .
बस "एम"?	"ఎం" అంతేనా?
तो अब जाओ.	అందుకే, దయచేసి.
फिर से देखो.	అంటే, మళలీ చూదదాం.
जाओ!	వెళళు!
वैसे भी लौटने के लिए कोई घर तो है नहीं.	రావటానికి ఇలలెతే లేదు కదా.
वह आते ही होंगे.	ఒకక నిముషంలో ఇకకడుంటాడు.
हाँ.	అవును.
ए.	హే.
नहीं, यह सच नहीं है.	లేదు, అది కాదు. . . నిజం కాదు.
पहले से जयादा मेहनत के साथ.	ముందుకననా ఎకకువగా.
हाँ.	అవును.
बधाई हो.	శుభాకాంకషలు.
ए!	హే!
वह सब बदल सकती. . . मतलब, वह सब कुछ, जो मैंने किया.	చేసిందంతా. . . వెనకకి తీసుకోవాలని.
पुरसकार के लिए शुभकामनाएँ.	నీ పరెజకు గుడ లక.
पर वह उडती रही.	కానీ అది వెళుతూనే ఉంది.
पता है उनहोंने कया कहा?	తనేమందో తెలుసా?
पता नहीं. . .	నాకు తెలియటలేదు. . .
नियंतरण में रखती हो.	చాలా మొండిగా.
बस नाचती रही.	డానస చేసతూనే ఉననాను.
फेलिपे, आज तुमहारी जोडीदार बनेगी. . .	ఫిలిపే, ఈరోజు నీ జత. . .
-ठीक है. -ठीक है.	-సరే. -సరే.
कारोबार करते हैं.	వయాపారవేతత.
इससे फरक पडता है.	ఇది అవసరమే.
वह बेमिसाल है.	తనే బెసట.
मतलब अभी?	అంటే ఇపపుడేనా?
फिर मिलते हैं.	కలుసతాను.
हम दरद सहने के आदी होते हैं.	మేము నొపపి యోధులం.
नहीं बदल सकते.	మారచలేవు.
फिर मिलते हैं.	కలుసతాను.
जब तक कि एक चिडिया ने किसी भी और चिडिया से कहीं जयादा ऊँची उडान न भरी.	ఒక చిననపిటట మాతరం ఎననడూ ఎగరనంత పెకి ఎగిరింది.
तो कया मैं तुमहें मैरियनेट कहकर बुलाऊँ?	అయితే నేనూ మరినెటటే అననా?
ये पैर किसी डांसर के हैं.	ఈ కాళళు డానసరవి.
घर, कुतता, मेरे लिए यह सब संभालना कठिन है, ठीक है?	ఇలలు, కుకక, నావలల కాలేదు, సరేనా?
लगता है दम निकल जाएगा.	చచచేలా ఉననాను.
मुझे वह कहानी सुनाओगी?	నాకు చెపుతావా?
वॉयसमेल	వాయిస మెయిల
कया बात है?	ఏమెంది?
कया बात है?	ఏమెంది?
काफी अचछी हूँ.	నిజంగా చాలా బావుననాను.
पकका उसे अपने बैग में खोजा था?	నీ బయాగలో వెతికావా?
यह वरतमान से जुडी परियोजना है.	ఇదో ఆధునిక పరాజెకట.
तुम 18 साल की हो न?	నీకు 18 కదా?
सब लोग खडे हो जाएँ.	లేవండి అంతా.
अपनी आँखें बंद करो.	కళళు మూసుకో.
वह भागयशाली है, जो फिर खडी हो उठती है.	తిరిగి గెలవటం ఆశీరవాదమే.
मैडम बरुनेल ने सावधानी से चुना है और इनामी डांस में	మేడమ బరునెల చాలా జాగరతతగా ఎంచారు
फेलिपे, अब तुमहारी बारी है, जान.	ఫిలిపే, నువవే, బేబీ.
दो अमरीकी?	ఇదదరు అమెరికనలా?
मैं उनहें दोष नहीं देती.	తనని నిందించను.
फेलिपे ने मुझे बता दिया.	ఫిలిపే చెపపాడు.
मैडम बरूनेल के निरणय पर	చివరి రాంక వచచిన ఎలుకలు ఇంటికి పోతాయి
फेलिपे, आज तुमहारी जोडीदार बनेगी. . .	ఫిలిపే ఈరోజు నీ జత. . .
तुमने मेरे साथ ऐसा कयों किया?	అలా ఎందుకు చేసావు?
"वह भागयशाली है, जो गिरती है,	"ఓడిపోతే ఆశీరవాదం,
जिनहें तुम हमारी कला की खातिर पैसे लगाने के लिए मना लेते हो.	ఆ ధనవంతుల జేబులు ఖాళీ చేయించకపోయుంటే.
हाँ. . .	అరథమెంది. . .
बार-बार वह कहानी धयान में आती है, जो बचपन में मेरे डैड सुनाया करते थे.	నా చిననపపుడు మా నానన చెపపిన కథ గురతొసతుంది.
साफ दिखता है कि वह बटन नकली है.	ఆ మీట నకిలీది అసలు.
हम दोनों को पुरसकार देना पडेगा.	మినహాయింపు తెచచేలా.
तुमहें मुझ पर गुससा करना चाहिए.	నా మీద కోపం రావాలి.
सममान की बात होगी.	మాకే గౌరవం.
मिस सैंडरस, अब तुमहारी बारी.	మిస సాండరస, మీరే.
एक.	ఒకటి.
हैलो.	హే.
हैलो.	హే.
वह कया है?	ఏంటది?
हैलो.	హే.
हैलो.	హే.
मुझे पहले से पता है.	నాకు తెలుసు.
जिससे हम छुटकारा नहीं पा सकते.	దానిని దించనేలేము.
सीख लिया है.	నా రాయిని పరేమించటం.
कि तुमहारी दिमागी हालत ठीक नहीं और मुझे तुमसे दूर रहना चाहिए.	నీకు పిచచని నీకు దూరంగా ఉండమని అంది.
साबित करके दिखाओ.	నిరూపించు.
यह झूठा दिखावा, जो आपने मुझे करने के लिए बुलाया है?	ననను పరదరశనకు పిలిచిన సంత కదా?
लोग सोने की कोशिश कर रहे हैं!	జనాలు నిదరపోవాలి!
भाड में जाओ!	వెళళిక!
उसने मुझे अपने भार तले दबाने के बजाय	నాకు భారంగా మారకుండా,
बैले का यही सार है.	బాలే హృదయం.
जिससे सूरज छुप गया.	ఎండపడకుండా.
कया सच में?	సీరియసగా అంటుననావా?
इससे फरक नहीं पडता.	అది అనవసరం.
मुझे यह नहीं चाहिए.	నాకు వదదది.
नृतय किसी को लुभाने की एक रसम ही तो है, नहीं?	డానస శృంగార ఉతతేజకం, కాదా?
यहाँ कयों आई हो?	నువవు ఇకకడికి ఎందుకు వచచావు?
तुमने कया कहा?	ఏమననావు?
बिना खून बहाए.	శుభరంగా.
इस बात को मानती हो न?	ఒపపుకుంటావా?
दूतावास की पारटी में.	ఎంబసీ పారటీ.
ठीक है.	సరే.
ठीक है.	సరే.
ठीक है.	సరే.
ठीक है.	సరే.
कि करियर की शुरुआत में इसे ही भूमिका दी जाए.	తనను తీసుకోమని అంది కనుక.
हम दोनों को जीत नहीं मिल सकती.	మనిదదరం గెలవలేము.
इसमें हमेशा सेकस, खून, पैसे का बोलबाला रहा है.	సదా సెకస, రకతం, డబబు అంతే.
तो हार मानती हो?	ఆపేసతావా?
जरूर.	కచచితంగా.
और दिलचसप.	ఇంకా సరదా మనిషివి.
माफ करना!	సారీ!
माफ करना!	సారీ!
तो सब खतम?	అయితే, అంతేనననమాట?
यह तो मानना होगा, बेंजामिन,	నిజంగా బెంజమిన,
समझी?	అరథమెందా?
वह पसंदीदा बन गई है.	తనే ఫేవరెట.
सावधान रहना.	నువవు జాగరతతగా ఉండాలి.
मेरे लिए इसकी अहमियत और बढ गई है.	ఇంకా రుణపడిపోయాను.
कब से?	ఎపపటినుండి?
मैंने फोन ही नहीं उठाया.	నేను ఎతతలేదు.
पर तुमहें यही करना है.	అంటే, అదే కచచితంగా నీనుండి ఆశించేది అంతా.
मुझे माफ कर दो.	కషమించు.
मुझे माफ कर दो.	కషమించు.
मुझे माफ कर दो.	కషమించు.
हम बात कर सकते हैं?	మటలాడవచచా?
बहुत अचछी.	గొపపగా కూడా ఉననాను.
हाँ. मुझे आपसे पयार है.	హా. ఐ లవ యూ.
