पिकेटमोटरस. कॉम	పికెటమోటరస. కామ
पिकेट मोटरस	పికెట మోటరస
कलैंटन 2015	కలాంటన 2015
बिजली वाले दरवाजे के हैंडल. पीछे से धुआँ और कीलें निकलने का बंदोबसत.	కరెంటు షాకిచచే తలుపు పిడులు. వెనుక నుండి మేకులు, పొగ విడుదల చేయవచచు.
शहर में आनेवाली सडक पर मेरे वाले बिलबोरड देखे कया?	ఊరలోకి వచచే రోడడులో నా పరకటన బోరడులుంటాయి, తెలుసా?
तुम ठीक हो?	అంతా సరేనా?
याद दिलाओ कि उनहें कितनी पयास लगेगी.	ఎంత దాహమేయబోతుందో వాళళకి గురతు చేయి.
कभी-कभी अगर निरदयी बनने की हिममत न रखी,	అపపుడపపుడూ కరూరంగా ఉండగల ధెరయం లేకపోతే,
पैसा ले लो, फिशरस को मार दो,	డబబుని తీసుకో, ఫిషరలని చంపు,
जैसपर.	జాసపర.
पैसे को हाथ मत लगाओ.	డబబు ఖాతాలోనే ఉండనీ.
पता करने को कहो अगर फिशरस के साथ कुछ असामानय हो रहा है,	ఫిషర ఇంటలో ఏదెనా అసాధారణంగా జరుగుతోందా అని కనుకకోమందాం,
ऐसा लग रहा है कि मेरा सिर फट जाएगा.	నా తల పేలిపోతుందేమోనని అనిపిసతోంది.
तो, अगर वे तुमहारी माँ के बारे में बता सकते हैं, तो तुमहारे बारे भी जानते होंगे?	అంటే, వాళళు మీ అమమ గురించి చెపపగలిగితే, వాళళకి నీ గురించి కూడా తెలిసుంటుంది కదా?
बहुत ही कम.	భారీ జనాభా.
तुम कया कर रही हो?	నువవేం చేసతుననావు?
तुमहें लंदन जाना है.	లండనలో నీ అవసరముంది.
अपनी साइकिल उस पर टाँगो. घर छोड देता हूँ.	నీ సెకిలు అకకడ పెటటు. ఇంటికి తీసుకెళతాను.
तुमने गाडी खरीद ली?	నువవు కారు కొననావా?
मैं मदद करूँ?	ఓ చేయి పటటనా?
सुनो, फलिन,	చూడు, ఫలిన,
एक बात कहूँ, बरटन?	ఏంటో తెలుసా, బరటన?
धत.	ఛత.
कि मैंने कभी किसी को मारा है.	ఎపుడెనా ఓ మనిషిని చంపావా అని.
जिसके चलते उसके बाद जो कुछ हुआ,	ఇది ఆ తరవాత జరిగే పరతి విషయానని
मान लेते हैं कि अगर हम आरआई से दूर रहें	ఆరఐకు మనం వెలలడి కావడానని ఎంతగా తగగిసతే
वह तुमहारे इलाके में नशीले पदारथ बनाता है. काफी हिंसक है.	మీ పరాంతంలో ఇతను మాదకదరవయాల తయారీదారు. హింసాతమకమెన మనిషి.
तुमहारे सटब के वेब टरेफिक पर नजर रखी.	సటబలో నీ వెబ లావాదేవీలను గమనిసతుననాం.
दोनों में एक रिशता है.	విడదీయలేని జోడీ వీళళు.
वुलफगैंग का छोटा नाम.	వూలఫగయాంగకు పొడిరూపం.
एलीटा.	ఎలీటా.
विलफरेड?	విలఫరెడ?
हैलो, माँ.	హలో, అమమా.
शायद उतना समय भी नहीं हुआ.	బహుశా అది కూడా కాదనుకుంటా.
मैं सेंट जेमस में थी. विलटनस में से निकली.	సెయింట జేమసలో ఉననా. విలటనస నుండి బయటకొచచా.
"जहाँ लंदन में आखिरी बार बरफ पडी. "	"లండనలో చివరగా సనో నేలరాలిన చోటు. "
"जहाँ लंदन में आखिरी बार बरफ पडी. "	"లండనలో చివరగా సనో నేలరాలిన చోటు. "
पास में ऐसे मंडरा रहे हो तो मुझे थकावट महसूस हो रही है.	కమమేసతుననటటు ఉండే నీ చూపులు ననను అలసిపోయేలా చేసతుననాయి.
कभी-कभी, जब मुझे नींद नहीं आती,	కొననిసారలు, నాకు నిదర రానపపుడు,
विलफरेड, जब किसी का साथ न हो	మనసు ఒంటరిదవుతుంది, విలఫరెడ,
पर वह वैसा ही इंसान है.	కానీ అతను అలాంటి వయకతి.
धत.	ఛత.
मतलब, बाद में.	అంటే, ఆ తరవాత.
सुरकषा में चूक होने पर वे चुप नहीं बैठते.	వాళళు భదరతా లోపాలను అంత తేలికగా కషమించరు.
बाप रे.	ఓరి నీ.
जैसपर.	జాసపర.
और तुमहारी सेवा के लिए शुकरिया.	నీ సేవకు ధనయవాదాలు తెలుపుతుననా.
रफतार, तीवरता, हिंसातमकता.	వేగం, తీవరత, హింసాతమక చరయ.
पर कभी इस शहर का बहुत ही बुरा हाल था,	కానీ ఈ ఊరు ఒకపపుడు చెతతకుపపలా ఉండేది,
यही मेरी धमकी है.	ఇదీ నా బెదిరింపు.
डॉकटर!	డాకటర!
वे अपने पंख फडफडाते हैं.	అవి తమ రెకకలని ఆడిసతాయి.
विलफ?	విలఫ?
जब एलीटा मिल जाए, तब उससे पूछ लेना. मुझे कुछ नहीं पता.	మనకు ఎలీటా జాడ తెలిశాక, ఆమెనే అడగవచచు. నాకెతే తెలియదు.
साथ में कुछ असवीकृत सुधार हैं.	కొనని ఆమోదయోగయం కాని మారపులతో.
उसे लेकर निकलने से पहले बता सकती थी.	ఆమెతో బయటకి వచచే ముందే చెపపి ఉండాలి.
और उसे उस चीज से बात करने मत देना.	ఇక ఆ చెతతదానితో ఆమెను మాటలాడనీయకు.
वेकफीलड जेल में तुमहारे लिए सामान जरूर भेजूँगी.	కానీ వేకఫీలడ జెలుకి కావాలసిన వసతువులు పంపుతాలే.
रेनी बिना तैयारी के चली आई.	రెయినీ అనాలోచితంగా ఉంటోంది.
वह पिछली परेमिका के हिसाब से था.	నా మాజీ పరేయసి రూపంలో మలచబడింది.
जलद से जलद इनकी यातरा दरज करवा लीजिए, मिसटर नेदरटन.	తన పరయటనని వీలెనంత తవరగా నమోదు చేయండి, నెథరటన గారు.
गरेस.	గరేస.
वहाँ के लोगों की एक कहावत थी.	అకకడి పరజలకి ఒక సామెత ఉండేది.
तुमहारा पसीना, छतते से निकलने वाले एक रसायन जैसा लगने लगेगा.	నీ చెమట వాసన కందిరీగలు విడుదల చేసే రసాయనపు వాసనలా మారుతుంది.
एक सवाल पूछूँ?	ఒక పరశన అడగనా?
चाहो तो, कोशिश कर सकता हूँ,	నీకు కావాలంటే, పరయతనిసతాను,
-कहीं नशीले पदारथ न हों. -नहीं हैं.	-అందులో డరగస లేకుంటే మంచిది. -లేవు.
पता करो कि यह सब कया है.	ఇది దేని గురించో కనుకకో.
यह लीजिए.	ఇదిగోండి.
मतलब. . .	అంటే. . .
-ले लो. -अचछा.	-తీసుకో. -సరే.
खैर. . .	మరి. . .
अपने हैपटिकस से जुडकर	నీకు ఎలా అనిపిసతుంది,
उसे समझाना मुशकिल है.	దానని వివరించడం కషటం.
जुडने को झेलने के लिए टरेनिंग चाहिए.	విలీనానని తటటుకోవడానికి శికషణ అవసరం.
"जहाँ लंदन में आखिरी बार बरफ पडी. "	"లండనలో చివరగా సనో నేలరాలిన చోటు. "
"ऐबी जंग, वह जगह जहाँ हैरोलड गिरा. "	"యాబీ యుదధం, హెరాలడ నేలరాలిన చోటు. "
जॉन सनो.	జాన సనో.
इनहें कया हुआ?	వాళళకు ఏమెంది?
बरटन.	బరటన.
हमें चलना चाहिए.	మనం వెళళిపోవాలి.
ठीक से ढूँढने के लिए हम अलग हो गए. अब एक मेट कॉएड उसका पीछा कर रहा है.	ఎకకువ పరాంతం జలలెడ పటటాలని విడిపోయాం. పోలీసు రోబో ఆమెను అనుసరిసతోంది.
तुम सटब से जो जानकारी ला रही हो, शायद किसी दिन वह हम सब को बचाएगी.	సటబ నుండి నువవు తీసుకొసతునన డేటా, ఒకరోజున మనలని అందరినీ రకషించవచచు.
खैर, जंग के खतम होने के बाद, मैं कवांटिको में था. एक बार में गया.	యుదధం ముగిసిన తరవాత, కవాంటికో సెనయకషేతరంలో ఉననా. బారులోకి వెళళా.
पर, सच तो यह है कि औरतों के लिए बैठकर करना काफी आसान होता है.	కానీ నయాయంగా చెపపాలంటే, ఆడవారి పని సులభం, కూరచుని కానివవచచు.
सिलटवेल मारग पर बारह लाशें सलीबों से लटकती हुई पाई गईं. . .	సిలటవెల రోడడుపె 12 శవాలు శిలువలపె వేలాడుతూ కనిపించాయి. . .
पर फौज ने मुझे वैसा इंसान बनाने में काफी पैसा खरच किया था.	కానీ ననను అలాంటి వయకతిగా చేయడానికే సెనయం ఎంతో ఖరచు చేసింది.
मुझे वह चेतावनीपूरण लगता है, हौसला पैदा करने वाले तरीके से.	నాకు అవి హెచచరినటలుగా అనిపిసతుంది, అంటే ఉతతేజకరమెన రీతిలో.
हमले के बाद उसने निकाल दिया होगा, ताकि उसका पता न चल सके.	దాడి జరిగిన తరవాత తీసేసి ఉంటుంది, తన జాడ ఎవరూ పసిగటటకుండా.
और हमें लगता है कि यहाँ से किसी ने उससे संपरक किया होगा.	ఇకకడివారు ఎవరో అతనని సంపరదించి ఉండొచచని మాకు అనిపిసతోంది.
उसे सुनते ही, सवाइप करना, पहली उंगली को अंगूठे पर मारना.	అది విననపపుడు, సవెప చేసి, చూపుడు వేలితో బొటన వేలిని తటటు.
जहाँ जाना अचछा लगता हो? तरोताजा होने के लिए? मेरी यह है.	తరచూ వెళళే చోటు? ఉలలాసం పొందటానికి? ఇది నాకు అలాంటి చోటు.
बोली कि इसकी इचछा को अनदेखा करके मैंने इसका अपमान किया.	తన విననపాలు నిరలకషయం చేసతే, తనపె నాకు గౌరవం లేనటటే అంది.
पर उसके अलावा, अगर बारीकी में परौदयोगिकी की बात करें?	కానీ అంతకు మించి, ఆ నిరదిషట సాంకేతికత గురించి అడిగితే?
मुझे इतना पता है कि 70 सालों में बहुत कम लोग बचेंगे.	ఒకటెతే కచచితంగా తెలుసు, 70 ఏళళలో జనాభా తగగిపోనుంది.
कभी पैरागुए नामक एक देश हुआ करता था. जैकपॉट से पहले.	పరాగవే అనే దేశం ఒకపపుడు ఉండేది. జాకపాట ఘటనకు ముందు.
कलैंटन, उततर कैरोलाइना में आज सुबह की एक भयानक खोज.	నారత కారోలీనా కలాంటనలో ఈ ఉదయం ఘోరం వెలుగు చూసింది.
माफ कीजिए, डॉकटर. आपको निराश किया. मैं समझ रही हूँ.	మననించండి, డాకటర. మిమమలని నిరాశపరిచా. అరథమవుతోంది.
टट को शायद शक था कि वह काँच बुलेटपरूफ है या नहीं.	ఆ అదదం బులెటపరూఫా కాదా అని టటకు సందేహముననటటు ఉంది.
सतताईस दिनों में दस की हो जाऊँगी. वुलफ आठ का है.	27 రోజులలో పదేళళు నిండుతాయి. వూలఫకు ఎనిమిదేళళు.
जरा सोचो कि उनहें बचाने के लिए किस हद तक जाओगी.	వారిని రకషించడానికి నువవు ఎలా తపిసతావో ఆలోచించు.
सच में, ऐसी मशीन के लिए ढेरों खरच कर सकता हूँ.	ఇలాంటి యంతరం కోసం నేను నా కాలు, చేయి ఇవవగలను.
मेरे साथ इस तरह बात मत करो. मैं बचची नहीं हूँ.	ఆ చెతత సవరంతో మాటలాడకు. నేను చిననపిలలను కాదు.
पता है, पिछले पाँच सालों में ऐसा दो बार हुआ	నీకు తెలుసా, అవి 2 సారలు అంతరించేపోయే ఘటనలను
अगर मेट को फलिन का पता चला तो खुद संभालना.	ఫలిన సటబ మనిషని పోలీసుకి తెలిసతే, పారిపో.
इसने बताया कि परिफरल इसके मुताबिक नहीं था.	పెరిఫరల తనలా కనిపించడం లేదని రెయినీ అంది.
-हमें बाहर निकालो! -उनहें बाहर निकाल दूँ?	-మమమలని బయటకు రానీ! -వారిని బయటకు వదలనా?
उसके मन की अवसथा समझने की कोशिश में था.	ఆమె ఆలోచించే రీతిలో ఆలోచించాలని యతనించా.
शायद तुम इस लडकी से कुछ पूछना चाहती थी?	ఈ యువతిని ఏదో ఒక విషయం అడగాలని అననావు.
अगर उस रात से मेल खाती कोई भी चीज दिखे,	ఆ రాతరి నుండి ఏదెనా చూసినటటు అనిపిసతే,
हमेशा पूछो कि उनहें बदले में कया चाहिए.	వాళళకి బదులుగా ఏం కావాలో ఎపపుడూ అడుగు.
पता चला कि एलीटा को कहाँ से पैसा मिला?	ఎలీటా నిధులకు మూలం ఏమిటో కనుకకుననావా?
-वे मालिक नहीं हैं. -तुमने कहा. . .	-వాళళు నీ యజమానులు కారు. -నువవు. . .
कयोंकि तुम खयालों में जीते हो, विलफ.	ఎందుకంటే నువవు పరణయాభిమానివి, విలఫ.
पर मैं तुमहारी कदर करती हूँ, डेनिएल.	కానీ నీ విలువ నాకు తెలుసు, డానియెల.
मुझे लगा कि इसे बिसतर पर रखा होगा.	దీనని మంచంపె భదరపరుసతారని అనుకుననా.
एक साल तक दोनों एक ही कमरे में थीं.	వాళళు ఒక సంవతసరం పాటు గది సహచరులు.
-तुमहारा इंतजार कर रहे हैं. -वाह.	-నీ కోసం ఎదురుచూసతుననారు. -మంచిది.
मैं वापस आऊँगा. एक हथौडा लाना है.	ఇపపుడే వసతా. సుతతి తీసుకురావాలి.
वह कहीं जयादा पेचीदा हो जाता है.	సంకలిషటం చేసతోంది, సరళం చేయకుండా.
तुम उस तरफ जाओ. मैं इधर जाता हूँ.	నువవు అలా వెళళు. నేను ఇలా వెళతా.
हमें मिलकर काम करना होगा. समझे?	మనం జటటులా పని చేయాలి. అరథమెందా?
पर अगर आप हमसे दूर रहें तो, मैं आपको हफते के दो लाख दे सकता हूँ.	కానీ వారానికి 2 లకషల డాలరలు ఇసతా, మమమలని మా మానానికి వదిలేసతే.
जो सबसे दुरबल किसम की परेरणा है.	పరేరకాలలో భయం అతయంత బలహీనమెనది.
हाँ, हमारी वाली भी खराब पडी है.	అవును, మాది కూడా పని చేయడం లేదు.
तुम सच में इसे हमारे बेवकूफ भतीजे के हाथों में सौंपना चाहती हो?	ఇలాంటి విషయానని దదదమమ అయిన మన బంధువు చేతులలో పెటటాలనుకుంటావా?
तो तुमहें मुझे वापस भेजना होगा.	అయితే ననను మీరు వెంటనే పంపాలి.
कि इनके विलुपत होने की नौबत आई?	ఎదురకొననాయి, కేవలం గత ఐదేళళలో?
मुझे लगता है कि मैंने वह किया.	ఎందుకంటే, నేను అలాంటిది చేశాను.
उसे हमेशा से पहेलियाँ पसंद थीं.	ఆమెకు పొడుపు కథలంటే చాలా ఇషటం.
बरटन ने फोन पर बेकार सा एप डाला है. उसके चलते डरोन दिखते हैं.	బరటన నా ఫోనులో పెటటిన చెతత యాప. దాంతో నేను డరోనలను చూడవచచు.
शरीर को अपना मानकर चला रही हो.	శరీరం మీదే అయినటటు నడుపుతారు.
वह फलिन फिशर की पककी सहेली है.	ఫలిన ఫిషరకు పరాణ సనేహితురాలు.
सटूल पर एक बंदे को बैठे देखा.	సటూలుపె కూరచునన ఒకడిని చూశాను.
उनकी आँखों की रोशनी लौटने पर तो और बहुत कुछ समझाना पडेगा.	ఆమెకు కనుచూపు రావడంతో వచచే సందరశనలో ఇంకా ఎకకువే వివరించాలి.
मेकन और एडवरड मेरे मालिक हैं?	మేకన, ఎడవరడలు నాకు యజమానులా?
मुझे गरेस हमेशा अचछी लगती थी.	నాకు గరేస అంటే ఎపపుడూ ఇషటమే.
सब मैड डॉगस गुट के सदसय थे.	వీరంతా మాడ డాగస ముఠా సభయులు.
मुझे लगा कि मैं गेम में हूँ.	సిమ ఆడుతుననానని అనుకుననానే.
आदत पडने में समय लग सकता है.	అలవాటవవడానికి సమయం పటటవచచు.
तो पहले कबर खोद लेनी चाहिए.	నువవు మొదట ఒక గోతిని తవవాలి.
-तुमहारे पडोसी हैं न? -हाँ.	-నీ పొరుగువాళలు కదా? -అవును.
तो हम उन पर बम गिराते हैं.	మనం వారిపె బాంబు విసురుతాం.
तुमने किसी को बताया नहीं न?	నువవు ఎవరికీ చెపపలేదు కదా?
यानी, अपराध मे सही जोडीदार.	చకకటి సహ నేేరసతుడు అంటావా.
जैसे कि तुमहें बहुत पता है कि एक शादीशुदा जोडे के बीच	ఓ పెళళయిన జంట గురించి అసలు నీకు ఒక విషయమెనా తెలుసా,
मैं अपने वादे का पकका हूँ.	ఆడిన మాట తపపనని తెలుసుగా.
और मैं नहीं चाहती कि तुम डरकर इंसटीटयूट की सेवा करो,	ఇనసటిటయూట అవసరాలను నువవు కేవలం భయం వలలే తీరచకూడదు,
