अगर तुमहारे पिता होते, तो वह. . . वे सही काम करते.	మీ నానన ఇకకడ ఉంటే, ఆయన. . . ఆయన సరెన పని చేసేవారు.
रॉजर!	రాజర!
रॉजर.	రాజర.
जानते हो,	తెలుసుగా,
तुम जितने साल नहीं.	నీ అంత కాలం కాదులే.
ऐपपल पाई.	యాపిల పె.
लूसी मॅकलीन.	లూసీ మెకలీన.
मॅकलीन.	మెకలీన.
मेरी माँ भी.	మా అమమ కూడా.
सब काम मैं ही कयों कर रहा हूँ?	అసలు నేనే పనంతా ఎందుకు చేయాలి?
तुमहें पसंद है?	నీకు నచచుతుందా?
अभी न जाओ छोड कर.	ఏం ఆలోచిసతుననావు?
असली रूप सामने आ ही गया.	అదిగో చూడు, పిలల రాకాసి.
उसकी बस यही निशानियाँ हैं.	ఆయన సామానులో ఇవే మిగిలాయి.
मुझे उससे बहुत पयार था.	ఆయనను ఎంతగానో పరేమించా.
मैं कोशिश करूँगा इनहें पहनूँ.	వీటిని వేసుకునేందుకు చూసతాను.
बरट.	బరట.
बरट.	బరట.
बरट.	బరట.
बरट.	బరట.
बरट.	బరట.
बरट.	బరట.
बरट.	బరట.
बरट.	బరట.
बरट.	బరట.
बरट!	బరట!
सुपर डुपर मारट	సూపర డూపర మారట
बदले में एक औरत, बेहतरीन हालत में.	బదులుగా, ఒక మహిళ, పరిపూరణ సథితిలో.
अंदर कया है?	లోపల ఏముంది?
- सवागत है! - कया बकवास है?	- సుసవాగతం - అసలు ఏంటీ గోల?
इसके लिए कुछ करते हैं. चलिए.	నీకు చికితస చేదదాం. నాతో రా.
हमारी उंगलियों का संगरह बहुत खराब है.	మా వేలు నిలవ విచారకరమెన సథితిలో ఉంది.
- धनयवाद. मैं. . . - हो रहा है.	- ధనయవాదాలు, నేను. . . - అలాగా.
मीठे की टरे आ रही है.	మిఠాయి పళలెం వసతోంది.
वेरोनिका.	వెరోనికా.
नॉरम, मुझे इसमें मजा तो नहीं आ रहा.	సరే, ఇది నాకు సరెన సరదా కాదు, నారమ.
एडमिन	అడమిన
लूसी.	లూసీ.
- 60 तो हो जाएगा. - बढिया.	- మనం 60 ఇవవగలం. - అదభుతం.
जैसा कहूँ करो, तो सनिप-सनिप बचेगा.	నా మాట వింటే సనిప సనిపను ఏం చేయను.
वह तो रोबोट है.	అది చెతత రోబోట.
डरो मत.	భయపడకు.
{\an8}फेरल	{\an8}ఫెరల
तुमने पहली बार रूबारब पाई और आइसकरीम खाई थी तब मैं भी वहाँ थी.	నువవు మొదటిసారి రూబాబ పె, ఐస కరీమ రుచి చూసినపపుడు అకకడే ఉననాను.
वह सिर मुझे चाहिए. इसी तरह मैं अपने पिता तक पहुंच सकती हूँ.	నాకు ఆ తల కావాలి. మా నాననను తిరిగి తెచచుకునే దారి అదొకకటే.
पलीज, सर, मेरा नाम लूसी मॅकलीन है. मेरे डैड का अपहरण. . .	సర, నా పేరు లూసీ మెకలీన. మా నాననను తీసుకుపోయారు, నేను. . .
आप. . . मेरी. . . माफ करना, मैडम. कया कोई बात. . .	నువవు. . . నా. . . కషమించండి, మేడం. ఏదెనా ఉందా. . .
सब कवारंटाइन में रहे, खेतों में काम नहीं हो पाया.	అందరూ ఏకాంతంలో ఉననాం, పొలాలలో కలిసి పని చేయలేదు.
तो इसकी सीरिंज में अबराकसो नाली सफा डाला है.	అందుకే అతని సిరంజీలలో అబరాకసో దరవం నింపాను.
यार, पता है दिमाग थोडा बचा है. बात तो करो.	రా. లోపల ఎవరో ఉననారని తెలుసు. నాతో మాటలాడు.
कभी-कभी दूसरे बंदे को खा जाना पडता है.	కొననిసారలు మరో వయకతిని తినాలసి ఉంటుంది.
धनयवाद, रेज. तुमहारे वाले भी अचछे हैं?	సరే, ధనయవాదాలు, రెజ. నీవి కూడా అదిరాయి.
- उसने मुझे अचछा बरताव नहीं किया. - सच?	- అతను ననను గౌరవంగా చూడలేదు. - నిజంగా?
मैं बरट की कुछ चीजें अलग रख रही थी और	నిజానికి బరట సామాగరి కొంచెం సరదుతుంటే,
पिता की मौत को तुम कैसे संभाल रही हो?	పుటటబోయే నీ బిడడకు తండరి చనిపోవడంతో?
देवीजी, उन लोगों को आप नहीं जानती.	పిలలా, వాటి సంగతి నీకు అరథం కాదు.
लगा यहाँ मुझे रंडी बनाया जाएगा.	ఇకకడ శృంగార బానిస అవుతాననుకుననా.
कया? नहीं, कितना बुरा विचार है!	ఏంటి? లేదు, పెదద దారుణమెన ఆలోచన!
हाँ, मैं इसे फरिज में रखती हूँ.	అవును, ఇది నా ఫరిజలో పెటటుకుంటా.
माफ करना, रॉजर. खतम हो गई है.	మననించు, రాజర. అననీ అయిపోయాయి.
जो कि पकका जानवर का पेशाब था.	అది ఏ జంతుమూతరమో నాకు తెలియదు.
तुम भी उस इनाम के लिए आए हो?	నువవూ బహుమతి కోసం బయటకొచచావా?
यह चूहा हमें जवाब दे सकता है.	ఈ ఎలుక మనకు జవాబులు ఇవవగలదు.
मॅकलीन, रोज	మెకలీన, రోజ
उस दिन तो तुमहें पसंद आई थी.	నీకు ఆ రోజునే పె నచచుండాలి.
कपास का या फिर आरामदेह सिंथेटिक कपास का डरेसिंग चाहिए?	మామూలు కాటనవా, లేదా సౌకరయంగా ఉండే సింథటిక, కాటన మిశరమమా?
सनिप-सनिप, उनकी माँग कया है?	ఏం అడుగుతుననారు, సనిప సనిప?
औरतें बहुत कमीनी होती हैं.	చెతత సుకుమారులకు మనసు లేదు.
- हाँ, मैं बरट हूँ. - हाँ.	- అవును, నేనే బరట. - అవును.
तुम हम सबमें सबसे बडे हो.	మా అందరి కంటే నువవే ఎకకువ.
सुनिए, एक बडी मछली वह सिर खा गई, मुझे वह चाहिए	కానీ విను, ఓ చేప నా తల తినేయగా, మా నానన కోసం అది
भागयशाली हो तुमने देखा नहीं वो कया कर सकते हैं.	అది ఎకకడకు తీసుకెళుతుందో చూడకపోవడం నీ అదృషటం.
मैंने सोचा शायद तुमहें उनमें से कुछ चाहिए हो.	సరే, వాటిలో కొనని నీకు కావాలేమోనని అనిపించింది.
और मैं ऐसा कयों करूँगी?	అది ఏమిటని అనుకుంటావు?
अपने अजनमे बचचे के. . .	నువవెలా ఉంటుననావు. . .
वेसटसाइड मेडिकल कलिनिक	వెసటసెడ మెడికల కలినిక
सब बरबाद होने से पहले.	పరిసథితులు చెడే లోపు.
सटेफ, वह अचछा आदमी था.	తను మంచి మనిషి, సటెఫ.
लगता है एक-दूसरे को गला घोंट कर मार रहे थे.	అంటే, ఒకరినొకరు చంపుకుననటలుగా కనబడుతోంది.
के दिल अभी भरा नहीं.	నువవు ఎకకడికీ వెళలవు.
बस जनरल एटॉमिकस इंटरनेशनल का मारक फोर है.	జనరల అటామికస ఇంటరనేషనల మారక ఫోర మాతరమే.
मतलब बहुत सारी दवाई.	చాలా వయలస అయుంటాయి.
हँसने की कया बात है?	ఏంటి? ఏమిటంత తమాషా?
ऐसे काम नहीं चलेगा.	అది సంతృపతికరం కాదు.
बहुत मोटी. बहुत गली हुई. यह ठीक रहेगी.	బాగా లావు. బాగా ఎండినది. ఇది సరిపోతుంది.
हाँ, वे तो महान थे.	అవును, తను ఓ సాధువు.
एक समय भरपूर उपलबध खाना और जगह के लिए,	ఎలుకలు ఒకపపుడు సమృదధిగా ఉండే ఆహారం కోసం,
मैंने सोचा रुककर तुमहारा हाल देख लूँ.	నినను కలిసి, ఎలా ఉననావో చూడాలని వచచాను.
तो वॉलटी, आगे बढो.	ఇక, కానివవు, వాలటీ.
कया अब भी मेरी बहन के पयार में हो और	నువవు ఇంకా నా చెలలెలిని పరేమిసతుననావా,
मैं तुमहें इन तीन में से दो देता हूँ.	నీకు ఆ మూడింటిలో ముందరి రెండు ఇసతాను.
पर आखिरकार, जनसंखया जयादा बढ जाती है.	కానీ కరమంగా, అతి జనాభా సంభవించింది.
32 के लिए यह रासता	దీనికి వెళలే దారి
तुम जैसे होशियार गुससा होने पर. . .	తెలివెనవాళలకు కోపం వచచినపుడు. . .
लूसी के लिए वॉलट का दरवाजा खोलना	లూసీ కోసం వాలట తలుపు తెరిచిన విషయం
वेसटलैंड का अपना सवरणिम नियम है.	బంజరుభూమికి సొంత పసిడి నియమం ఉంది.
तो, लूसी मॅकलीन,	సరే, లూసీ మెకలీన,
जो अपने किए की कीमत चुका रहा है.	నువవు మాకు చేసినదానికి తగిన మూలయం.
द मैन फरॉम डेडहॉरस कैलीफोरनिया करेसट सटूडियो	ద మాన ఫరం డెడహారస కాలిఫోరనియా కరెసెంట సటూడియో
तुमहारे पिता की कमी सिरफ तुमहें महसूस नहीं हो रही.	మీ నానన లోటుతో బాధపడుతుననది నువవు ఒకకడివే కాదు.
पता नहीं इसे किन मुशकिलों से गुजरना पडा होगा.	ఈ భీకర జీవి చాలా భయానకమెనవాటిని ఎదురకుని ఉండాలి.
मैं छिप गया था.	నేను దాకకుననాను.
देख कया रहे हो?	ఏంటి చూసతుననావు?
मैडम, माफ करना.	కషమించండి, మేడం.
अंदर अपनी किसमत आजमा सकती हो.	నీ అదృషటం ఆ తలుపు లోపల వెతుకకో.
यहाँ जो कुछ भी हुआ, वह बहुत पहले हो गया था.	ఇకకడ ఏం జరిగిందో అది చాలా కాలం కరితం జరిగింది.
कैसा लग रहा है?	నీకు ఎలా ఉంది?
तुम बदल रहे हो?	మారిపోతుననావా?
तुमहारे पास कोई शीशी होगी कया?	నీ దగగర వయలస లేవుగా, ఉననాయా?
मैं ठीक ही रहा.	బాగానే చేశాను.
कया फरक पडेगा?	అదేమెనా ముఖయమా?
बकवास? यहाँ कोई बकवास नहीं है.	గోలా? ఇకకడ ఎలాంటి గోల ఉండదు.
- ताकि डैड को. . . - हो गया.	- తిరిగి పొందాలి. . . - అదిగో.
भविषय का ओवरसियर वुडी ही है	భావి ఓవరసీర వూడీతో పని చేయండి
यार, तुम तो गीली हो रही हो.	ఇపపుడు, నీది బాగా తడిగా ఉంది.
पता चल जाएगा.	నువవే చూసతావు.
सच कहूँ तो हाल अचछा नहीं है.	నిజంగా అయితే, గొపపగా లేను.
दिलचसप बात है.	అది ఆసకతికరం.
वे परेशान हों यह पसंद नहीं.	జనాలు బాధపడడం నీకు నచచదు.
गंदगी के लिए माफ करना. समय बहुत तेजी से निकल जाता है.	గందరగోళానికి మననించాలి. కాలం వేగంగా గడిచిపోతోంది.
कुछ पता चला?	అదృషటం ఏమెనా?
सनिप-सनिप, बताओ मानव शरीर में अबराकसो कया करेगा.	సనిప సనిప, మనిషి శరీరానని అబరాకసో ఏం చేసతుందో చెపపు.
फिर भी, हमलावर अंदर आए कैसे पता नहीं.	అయినా సరే రెడరలు ఎలా వచచారో తెలియలేదు.
हैलो. जो भी है. यहाँ बकवास नहीं है.	హలో. ఏదెనా సరే. ఇకకడ ఎలాంటి గోల ఉండదు.
इसे फिर शांत करना होगा.	అతనికి మతతు ఇవవడం మంచిది.
वह पराणी जो मुझे यहाँ लाया, उसने. . .	ననను ఇకకడకు తెచచిన జీవి, అతను. . .
तुम पागल हो.	నీకు పిచచి.
सन 77 के बडे पलेग में,	'77లో వచచిన పలేగు వయాధి,
हाँ, उसकी सुरकषा के लिए.	అవును, అతని భదరత కోసం.
तुम बरट के जूते ले लो.	నువవు బరట షూస తీసుకుంటే.
यहाँ बाहर भी तुम मजे में नहीं हो.	నీకు ఇకకడ కూడా సమసయలు ఉననాయి, బుజజీ.
- धनयवाद. यह तो. . . - कोई बात नहीं.	- ధనయవాదాలు. అదీ. . . - పరవాలేదు.
साठ शीशियाँ.	అరవె వయలలు.
लूसी, बेटी, तुम यहाँ कया कर रही हो?	లూసీ, బుజజీ, అకకడ ఏం చేసతుననావు?
ओवरसियर के लिए रेज मैकफी को वोट दो	ఓవరసీరగా రెజ మెకఫీకి ఓటు వేయండి
{\an8}तो शायद उनहोंने दरवाजा खोलकर हमलावरों को बुलाया हो.	{\an8}వాళలు బహుశా తలుపు తెరిచి రెడరలను రానిచచి ఉండాలి.
आइसकरीम और ऐपपल पाई.	ఐస కరీమ ఇంకా యాపిల పె.
पता है हालात कठिन हैं, पर तुम. . . तुमहें ऐसा. . .	ఇకకడ కషటమని తెలుసు, కానీ అలా చేయకు. . . అవసరం లేదు. . .
कल फिर कोशिश करते हैं.	మనం రేపు పరయతనిదదాం.
जेल में बंद हतयारे को,	పంజరంలో ఏ హంతకుడిని,
{\an8}आप नहीं देख सकते	{\an8}యాకసెస తిరసకరణ
नॉरम. हैलो.	నారమ. హాయ.
तुम चाहो तो एयर कंडीशनर को बंधक बना लो.	అవును, నా ఏసీని బందీగా చేసుకుంటే బాగుండేది.
- कैसे हो, वुडी. - हैलो, रेज.	- శుభోదయం, వూడీ. - శుభోదయం, రెజ.
इस समय मन में जो चल रहा है वह उस नियम से कैसे मेल खाता है?	ఇపపటి పరిసథితిపె నీ బురరలో ఆలోచనతో, సవరణ నియమం ఎలా పని చేసతోంది?
वह शायद एक सपताह पहले हुआ था.	అది కనీసం ఓ వారం కరితం అయుండాలి.
रुको, उनहें जेली केक दे रहे हैं?	ఆగు, వాళలకు జెలలో కేక ఇసతామా?
तो अब आपको बेहतरीन कवालिटी के सिंथेटिक फाइबर का,	ఇక, నీకు ఏ దుసతులు ఇషటం, అధిక నాణయమెన సింథటిక ఫెబరవా,
आम तौर पर लडके. . .	మామూలు కురరాళలకు. . .
बहुत अचछी हालत में.	దాదాపు పరిపూరణ సథితి.
तुम सबके साथ यह बाँटने में मजा आता, पर. . .	మీ అందరితో ఇది పంచుకోవాలని నాకుంది, కానీ. . .
डैड का वजन 58 किलो रह गया था	మా నానన 128 పౌండల బరువు తగగాడు,
पाई बनाई है, चाहिए हो तो लो.	మిఠాయి చేశాను, నీకు నచచుతుందని.
हाँ, एयर कंडीशनर भी अचछा है.	సరే, అయినా ఏసీ అనే మాట బాగుంది.
हैलो, रॉज.	హేయ, రాజ.
पहले लूसी को खो दिया, फिर. . .	మొదట, లూసీని కోలపోయాను. . .
आपके पास. . . असली कॉटन है?	మీ దగగర. . . నిజమెన కాటన ఉందా?
तो इनहें मारा किसने?	వాళలను చంపిందెవరు?
माफ करना.	ఒక నిమిషం.
मैंने बैठक में जो कहा उस बारे में बात करने आई हो.	సమావేశంలో నా మాటల గురించి మాటలాడాలని వచచావు.
तो अगर हमलावरों के आने से पहले ही ये सब मर गए थे,	రెడరలు ఇకకడకు వచచేసరికే, వాళలు చనిపోయి ఉంటే,
वे बचे रहने के लिए एक दूसरे को खा जाते हैं.	బతికి ఉండాలనే ఆరాటంతో అవి ఒకదానని ఒకటి తినేశాయి.
फॉलआउट पर पिछली बार	ఫాలౌట ఇంతకు ముందు
मेरा नाम रॉजर है!	రాజర! నా పేరు రాజర!
हमारे अपने पलांट में बनी डेयरी की ताजा आइसकरीम!	డెరీ తాజా ఐస కరీమ మా సొంత పలాంటలో చేసినది!
- वह कया कर रहा है? - नहीं.	- ఏం చేసతుననాడు? - లేదు.
वैसे. . .	సరే. . .
मुझे बहुत अचछा लगेगा अगर	నా మనసు చాలా హాయిగా ఉంటుంది
मैं. . .	నేను. . .
लेन-देन.	లావాదేవీ.
खैर, पैसा कमाने में मुझे आसानी होती है रॉजर.	సరే, సంపాదనలో ఎపపుడూ గొపపగా ఉంటా, రాజర.
कान खोलकर सुनो, यहाँ सब गडबडझाला ही है.	ఇకకడంతా పీచల డబబాలు, మారమలేడలు ఉండవు, బుజజీ.
रेडिएशन किंग	రేడియేషన కింగ
परिषद को पसंद नहीं आया.	కౌనసిలకు అంతగా రుచించలేదు.
भागयशाली हैं कि अंगूठा इसतेमाल नहीं कर रहा.	ఇక, నేను బొటనవేలు వాడకపోవడం నీ అదృషటం.
वह मैं हूँ. लगता है आप एक औरत हैं.	అది నేనే. నువవు మహిళలా ఉననావు.
ठीक है. आपको हलका सा दरद होगा.	సరే. నీకు కుటటినటలుగా అనిపిసతుంది.
मैं चुप रहूँगा.	ఎవరికీ తెలియదులే.
आखिरी बायो सिगनल दो साल पहले मिला था.	గురతించిన ఆఖరి జీవ సంకేతం రెండేళల కరితంది.
- यह गलत है. - चलो भी.	- ఇది పెదద తపపు. - ఊరుకో.
डरिएगा नहीं. बस जरा-सी सनिप-सनिप और काम खतम.	నువవేమీ భయపడకు. కొంచెం కతతిరిసతే, అంతా అయిపోతుంది.
खासकर जबसे द गरेट वॉर में मेरी टेंपोरल सेंस खराब हुई हैं.	ముఖయంగా మహాయుదధంలో నా తాతకాలిక ఇందరియాలు బయటపడడాక.
अरे यार!	అబబా ఛ!
वैसे ही.	అదే కథ.
तुमहारे पिता कया कहेंगे.	మీ నానన ఏమనేవాడో మరి.
बिलकुल.	పూరతిగా.
अगर आपकी नाली में हो रुकावट,	మీ గొంతు నిండా మురికి ఇరుకకుంటే,
अलविदा.	వీడకోలు.
