मेरे मन में फिली के बस अशवेत के लिए पयार है.	నాకు ఒక ఫిలలీ నిగగాతో ఒకే ఒకక విషయం ఉంది.
मीक मिल की डरीमस एंड नाइटमेअरस आज सटोरस में आ चुकी है.	మీక మిల యొకక డరీమస అండ నెటమేరస ఈ రోజు షాపులలో దొరుకుతుంది.
खबर फैल गई कि उसे फिलाडेलफिया के उततर में रोका गया था,	అతనని సరిగగా ఉతతర ఫిలడెలఫియాలో ఆపేశారని అందరికీ తెలిసింది,
2012 के शुरू में, मीक ने डरीमस एंड नाइटमेअरस रिकॉरड किया.	2012 పరారంభంలో, మీక డరీమస అండ నెటమేరస రికారడు చేశాడు.
जब मीक ने निकी को डेट करना शुरू किया, तो मुझे लगा, "यह कैसे हुआ? "	నికకీతో మీక డేటింగ చేసతుననపపుడు, నేను అననాను, "అది ఎలా జరిగింది? " అని.
19 अगसत, 2008	ఆగసటు 19, 2008
मैंने कोई परतिकरिया नहीं दी.	నాలో ఏ సపందనా కనిపించలేదు.
तुम तैयार हो?	మీరు సిదధమేనా?
"तुमने एक अपराधी से संबंध रखा हुआ है. "	"నువవు పేరుమోసిన నేరసతుడితో కలుసతుననావు. "
डीए का कहना है उसे चाहिए एक बंदा पर इस समय	డీఏ ఆమెకు ఒక నిగగా కావాలంది కానీ ఇపపుడు
मुझे नहीं पता.	నాకు తెలియదు.
उनहें अपने ही लोगों के खिलाफ जाना होगा,	వాళళు వాళళ సొంత వాళళకు వయతిరేకంగా వెళళేలా,
पर मैंने सोच रखा है कि चाहे वे मेरे साथ कुछ भी करें,	నా లకషయం అంతా, వాళళు నాకు ఏం చేయటానికి పరయతనించినా గానీ,
नया गाना सुनाऊँ तुमहारी शोक सभा में जब तुम लेटे होगे	నువవు అబదధం ఆడుతుననపపుడు నీ అంతయకరియల ముందు నా పాట పాడతా
कया चल रहा है?	ఏంటి సంగతులు?
वह उस एलबम के साथ शोहरत का एक नया मुकाम हासिल कर रहा है.	అతను నిజంగా ఆ ఆలబమతో సటారడమ తరువాతి సథాయికి వెళతాడు.
छह साल का रिपोरटिंग परोबेशन.	ఆరేళళు హాజరు ఇచచే పరిశీలన.
-एक शानदार जेट. -इतने शानदार जेट में पहली बार बैठा हूँ.	-భారీ జెట. -అవును, భారీ జెటలో నేను రావటం మొదటిసారి.
हरिकेन सैंडी अपने साथ तेज हवाएँ, बारिश और बाढ लेकर आया.	శాండీ తుఫాను ఆగమనం గాలి, వరషం, వరదలు తీసుకువచచింది.
कि कोई अशवेत आदमी ऐसा कैसे कर सकता है.	దారుణం చేయటం, అది ననను నిజంగా బాధించింది.
मैं अभियुकत विलियमस को दोषी मानती हूँ.	ముదదాయి విలియమసను దోషిగా నిరధారించడమెనది.
-हम निकल रहे हैं. -चलो चलें. जलदी करो.	-మనం బయటకు వచచాము. -పదండి. వెళదాం. పదండి.
मैं कहता हूँ, "मुझे हथकडी लगाकर और मुझे मेरे परिवार से दूर करके	నేను, అనుకుననాను "నాకు సంకెళళు వేసి, నా కుటుంబానికి దూరంగా తీసుకెళళి
वहाँ पर बीच में आकर रुक गई,	మధయలో సరిగగా ఇకకడ ఆగింది,
अभियुकत, शरी रॉबरट विलियमस उस घर से बाहर आ रहे थे,	నిందితుడు, రాబరట విలియమస ఆ ఇంటి నుంచి బయటకు వసతుననాడు,
और इससे पहले कि जान पाता धीरे-धीरे मैं दोसत गँवाने लगा	నాకు అది తెలిసేలోపే నేను నా సనేహితులను కోలపోసాగాను
पर शायद उस परिकलपना को तोडने के बारे में थी, जो उसने उसके लिए की थी	కానీ బహుశా ఇవననీ పూరతయయేసరికి అతను ఏమవుతాడని ఆమె ఊహిసతునన వాటి
तो मेरे दिमाग में वही बात घर किए हुए थी.	అయితే అదే నేను ఆలోచిసతునన ముఖయ విషయం.
वह है चारली मैक हीज द फरसट आउट द लिमो	అతను చారలీ మాక లీమో ఉనన మొదటి వయకతి అతనే
तुमहारा परिवार बरबाद होने वाला है, समझे?	కుటుంబం మొతతం నాశనం అవుతుంది, తెలుసా?
मैं जो काम करता हूँ उसकी बात करता हूँ	నేను చేయగల నా పని గురించి మాటలాడుతుననాను
डरीमस वरथ मोर दैन मनी की लहर फैली है.	డరీమస వరత మోర దాన మనీ రికారడ చేసతుననారు.
जब मैं उसकी यह फोटो देखता हूँ, मुझे दरद दिखता है. . .	నేను ఈ ఫొటో చూసినపపుడు, నాకు బాధ కనిపిసతుంది. . .
मैंने यह बात उनहें, पहले, बाद में और इसके दौरान बताई.	నేను ఆమెకు ఇది వివరించాను, ముందు, తరువాత, అపపుడు.
तो मैं असली हथियारों के साथ कभी फोटो नहीं खिंचवाऊँगा.	అందుకే నేను ఎపపటికీ నిజమెన ఆయుధాలతో ఫొటోలు దిగను.
गिरफतारी के बाद, मैं काउंटी जेल में था, सुनवाई के इंतजार में.	నేను అరెసట అయిన తరువాత కౌంటీ జెలులో విచారణ కోసం వేచి చూసతూ ఉననాను.
मैं अपने तरीके से बात करता हूँ, कपडे पहनता हूँ, रैप करता हूँ.	నేను సరిగానే మాటలాడుతుననాను, బటటలు వేసుకుంటుననాను, రాప చేసతుననాను.
मुझे बंद किया कोठरी में. . . चूहों के साथ यार, मुझे बडी आती थी शरम	ననను జెలు గదిలో మూసేశారు. . . ఎలుకలతో అబబా, అది ఇబబందికరమెనది
7 जुलाई, 2007	జులె 7, 2007
वह विल समिथ का अंगरकषक था.	అతను విల సమిత అంగరకషకుడు
चक करीकमर हिप हॉप पतरकार	చక కరీకముర హిప హాప విలేకరి
"कोई उललंघन भी नहीं किया, बस तुमहारी जिंदगी पर बात करने के लिए. "	"నేను ఉలలంఘన కూడా చేయలేదు, నా జీవితం గురించి మాటలాడటానికి. "
उसका कहना था कि वह मेरी मदद करने की कोशिश कर रही है.	ఆమె నాకు సహాయం చేయటానికి చూసతుననటటు చెబుతుననారు.
जेडाकिस रैपर	జాడాకిస రయాపర
"अरे, मैं बस 19 साल का हूँ. जब बाहर आऊँगा तब 24 या 25 का होऊँगा.	"నాకు 19 ఏళళు. నేను బయటకు వచచేసరికి నాకు 24 లేదా 25 వసతాయి.
यह सजा तुमहें सही रासते पर लौटने में मदद करेगी.	ఈ శికష నినను తిరిగి సకరమమెన మారగంలోకి తీసుకొసతుంది.
और अब, वह मेरे परोबेशन को और मुशकिल बना रही है.	ఇంకా ఇపపుడు, ఆమె నా పరిశీలనను ఇంకా కఠినతరం చేసింది.
ताकि मुझे दोबारा ऐसे हालातों में न पहुँचाया जा सके.	అపపుడు ననను ఇలాంటి పరిసథితులలో ఇకమీదట పెటటలేరు.
कि मैं दरअसल इसके लिए शुकरगुजार था.	నిజానికి నేను దానికి కృతజఞుడిగా ఉండడం.
वह मुझ पर कुछ जयादा ही धयान दे रही थी.	నా మీద మితిమీరిన శరదధ చూపిసతుననారు.
और रिक रॉस उस समय बहुत मशहूर था. सब कुछ बहुत अचछे से हो रहा था.	రిక రాస ఆ సమయంలో పరఖయాతిగాంచినవాడు. అననీ చకకగా అమరచబడడాయి.
अपने परोबेशन ऑफिसर के पास देर से पहुँचना तकनीकी उललंघन है.	పరిశీలనా అధికారికి ఆలసయంగా తెలియచేయటం సాంకేతిక ఉలలంఘన అవుతుంది.
मैंने कहा, "सबको फोन करो. " हमें 18 लोग चाहिए थे जो 500 डॉलर दे सकें.	నేను అననాను, "అందరికీ ఫోన చెయయి. " మాకు 18మంది దొరికారు, 500 డాలరలు ఇచచారు.
जब जज ने मुझे 11. 5 से 23 साल जेल, और 10 साल के परोबेशन की सजा सुनाई,	నయాయమూరతి నాకు 11. 5 నుంచి 23 నెలల జెలు, ఇంకా 10 ఏళళ పరిశీలన విధించినపపుడు,
मुझे वीडियो नहीं देखना.	నాకు వీడియో చూడాలని లేదు.
ए, रोजे, देखो मैं अपनी दाढी वगैरह बढा रहा हूँ.	హే, రాస, నేను నా పనులు, అవీ ఇంకొంచెం పెంచుకుననాను.
परोबेशन रदद किया जाता है.	పరిశీలన కొటటివేయబడింది.
जब मैं जेल में था तब उसे निकाला गया था और बहुत सफल हो गई.	అది నేను జెలలో ఉననపపుడు విడుదలయయింది, చాలా బాగా అమముడుపోయింది.
वीडियो के अंत में, लडकियाँ मेरे पास बंदूकें लेकर आती हैं,	వీడియో చివరలో, అమమాయిలు నా దగగరకు తుపాకులతో నడుచుకుంటూ వసతారు,
और हमें लगता है जैसे वे हमें लूटने वाली हैं और वे घोडे दबा देती हैं.	ఇంకా మేము. . . వాళళు దోచుకుంటుననారనుకుంటాం అపపుడు వాళళు తుపాకులు వాడుతారు.
फिर भी, यही कहा गया कि मीक ने उललंघन किया है.	అయినా, తిరిగి ఎలాగెనా మీక ఉలలంఘించాడు అనే వచచేది.
अंत में हम पर बिना कोई आरोप लगाए सुबह के नौ बजे रिहा कर दिया.	చివరకు మాపె ఏ నేరం మోపలేదు, ఉదయం తొమమిదింటికి వదిలేశారు.
मैंने घर पर फोन किया, और कहा, "माँ, मुझे जलदी से यहाँ से निकालो. "	నేను ఇంటికి ఫోన చేసతూనే ఉననాను, "అమమా, వచచి ననను ఇకకడినుంచి తీసుకెళళు. "
फिलाडेलफिया जेल "सममान के साथ सुधरने का एक अवसर"	ఫిలడెలఫియా జెళళు "గౌరవపరదమెన మారపుకు అవకాశం"
मैंने कई बार कोशिश की कि तुमहें जेल न भेजूँ,	నేను నినను జెలుకు పంపకుండా చాలాసారలు పరయతనించాను
यार, वह खाना बहुत ही बुरा था सोच सकते हो मैं पागल हो रहा था?	అది చాలా చెతతగా ఉంది మీరు నా మతి కోలపోవటం ఊహించుకోగలరా?
मैं चरच जाता हूँ ताकि कोयर में गाऊँ रैप गाने	చరచలో పరారథనా గీతాలను రయాప చేయటానికి ఒపపుకుననాను
उसके तुरंत बाद, उसने रॉक नेशन के साथ अपना काम संभालने के लिए करार किया.	ఆ తరవాత వెంటనే అతననినిరవహించటానికి రాక నేషనతో ఒపపందం చేసుకుననాడు.
मैंने यह किया अपने यारों के लिए और यह किया कैथी के लिए	నేను అది నా నిగగాల కోసం చేశాను నేను ఇది నా కాథీ కోసం చేశాను
धातु वाले हिससे पर, और उसकी आँख पर चोट लगी.	అది లోహంతో చేయబడింది, అది అతని కంటికి తగిలింది.
यह ऐसे था, "ठीक है, अब तुम यहाँ हो.	అది, "సరే, ఇకకడ ఇపపుడు పరవాలేదు.
हालाँकि, उस समय फिलाडेलफिया में मीक का बहुत नाम हो रहा था,	అయితే అతను ఫిలడెలఫియాలో అందరూ అభిమానించే వయకతే అయినా,
दुरभागय से अटलांटा में मीक की एलबम रिलीज होने की पारटी थी.	మీకకు దురదృషటవశాతతు అటలాంటాలో ఆలబమ విడుదల పారటీ ఉంది.
2204 साउथ हेमबरगर सटरीट	2200 ఎస హెమబరగర సటరీట
कैथी विलियमस मीक की माँ	కాథీ విలియమస మీక తలలి
उसका नाम रेजी गराहम है.	అతని పేరు రెజీ గరాహం.
तकरीबन डेढ या दो घंटे के बाद, उनहोंने कहा. . .	గంటననర, రెండు గంటల తరువాత, ఆమె అననారు. . .
तो अफसोस की बात यह थी	అందులో బాధాకరమెన విషయం,
तो जरा हंगामा हो जाए.	ఇకకడ ఉతసాహంగా పాడుదాము.
नफरत करने वाले पीछे लगे हैं जानता हूँ मुझसे बदला लेना चाहते हैं	దవేషించేవారు నావెపు పరుగెడుతుననారు ననను పటటుకోవాలనుకుంటుననారని తెలుసు
डरीमस वरथ मोर दैन मनी	కలలు డబబుకంటే విలువెనవి
जब मुझ पर मुकदमा चला, मुझे वाकई एक वकील की जरूरत थी.	నేను కేసులో ఇరుకకుననపపుడు, నాకు నిజంగా లాయర అవసరం పడింది.
और अदालत की परतिलिपियों के आधार पर	సాకషయుల సమృతులు, కోరటు రాతపరతుల
एक रात मैंने भगवान से दुआ माँगी	ఒక రాతరి నేను దేవుడిని పరారథించాను
तो, अब मैं. . . मैं असमंजस में था.	అయితే, నాకు. . . ఉతకంఠంగా ఉంది.
पता नहीं किसने यह नियम बनाया है कि अगर कोई पुलिसवाला कहे	పోలీసు కేవలం ఏదో వాసన వచచిందని, కారు తనిఖీ చేయవచచని
फिलाडेलफिया	ఫిలడెలఫియా
मुझे लगा मेरा पूरा जीवन दाँव पर लगा है, तो मैं अधिक मेहनत से रिकॉरड करने लगा.	నా జీవితమంతా పరమాదంలో ఉననటటనిపించింది, అందుకే రికారడింగకు కషటపడసాగాను.
मुझे घबराहट हो रही थी.	నాకు తల తిరుగుతుంది.
तो सोचता था, "मैं अमीर बनने वाला हूँ. बहुत सारा पैसा बनाने वाला हूँ. "	అయితే, "నేను ధనికుడను కాబోతుననాను. చాలా డబబులు సంపాదించబోతుననాను" అనుకుననాను.
उसका नाम चारली मैक था.	అతని పేరు చారలీ మాక.
चारली मैक आपके जीवन को बदल सकता है. वह हिप-हॉप में माहिर है.	చారలీ మాక సమరథవంతంగా మీ జీవితానని మారచగలడు. హిప హాపలో అనుభవం ఉంది.
और हर जगह संपरक हैं.	అంతటా పరిచయాలు ఉననాయి.
फिलाडेलफिया जुलाई 2010	ఫిలడెలఫియా జులె 2010
आई एम द बॉस, जब यह गाना निकला,	ఐయామ ద బాస, ఆ పాట విడుదలయినపపుడు,
हवाई अडडे, रेलगाडियाँ.	విమానాశరయాలు, రెళళు.
करिस पारकर मीक के अंकल	కరిస పారకర మీక అంకుల
जनमदिन मुबारक हो मीक	జనమదిన శుభాకాంకషలు మీక
करिस पारकर मीक के अंकल	కరిస పారకర మీక అంకుల
मीक का परोबेशन जारी रहेगा 2023 तक	మీక పరిశీలనలో 2023 వరకు ఉంటాడు
सोचा, "मैं एक बडे रिकॉरडिंग लेबल के साथ करार करने के लिए तैयार हूँ. "	"పెదద పేరునన రికారడు కంపెనీతో ఒపపందం సంతకం చేయటానికి సిదధంగా ఉననా" అనుకుననా.
उसके बेटे के दुनिया को देखने के नजरिए पर इसका कया असर होगा?	దానివలల తన కొడుకుకు పరపంచంతో ఉనన సంబంధంపె ఎలాంటి పరభావం పడుతుంది?
वे मीक को काबू में करने की कोशिश कर रहे थे.	వాళళు మీకను లొంగదీసుకోవాలని చూసతుననారు.
आईटयूनस से 22, 000 डॉलर का चेक मिला था.	నాకు ఐటయూనస నుంచి 22, 000 డాలరల చెక ఇచచారు.
सच में, यह सिसटम ऐसा है जिसमें अमीर और दोषी होना बेहतर है,	సపషటంగా చెపపాలంటే, మనకునన వయవసథలో డబబులేని నిరదోషిగా ఉండటం కంటే,
-कया तुमहारे पास बंदूक थी? -हाँ.	-మీ దగగర తుపాకీ ఉందా? -అవును.
जो कथित रूप से 2204 साउथ हेमबरगर सटरीट पर घर के अंदर मिली,	2204 దకషిణ హెమబరగర సటరీటలోని అతని ఇంటలో గణనీయమెన కొకేయిన దొరకటం,
अदालत की परतिलिपि 19 नवंबर, 2012	కోరటు రాతపరతి నవంబరు 19, 2012
जहाँ से मैं आता हूँ, वहाँ शवेत जज मिलने पर चिंता होती है.	నా పరాంతం వాళళు, నిజానికి తెలలజాతి నయాయమూరతి వసతే కంగారు పడాలి.
रॉन पारकर मीक के अंकल	రాన పారకర మీక అంకుల
तुमहारा पूरा करियर बरबाद होने वाला है.	భవిషయతతు మొతతం బూడిదలో పోసిన పననీరవుతుంది.
रॉन पारकर मीक के अंकल	రాన పారకర మీక అంకుల
अदालत की परतिलिपि 19 अगसत, 2008	కోరటు వరాతపరతి ఆగసట 19, 2008
