कॉफी.	కాఫీ.
कॉफी.	కాఫీ.
पी कर गाडी चलाने के जुरम में जबत हो गया.	తాగి నడుపుతుననానని లెసెనస తీసేసుకుననారు.
कि कैसे वह अपनी बंदूक अपने मुँह में रखकर अपना भेजा उडा लेंगे.	నోటలో తుపాకీ పెటటుకొని పేలచేసుకోవడం, తల పుచచకాయలా పగిలిపోవడం.
किसलिए?	ఎందుకు?
वह सरबियन महिला याद है? बरानका.	ఆ సరబియా మహిళ గురతుందా? బరాంకా.
रे.	రే.
पर मुझे डर लग रहा है कहीं मुझे जयादा झटका न लगे.	కానీ అది నా పిరరలకు వాతలు పెడుతుందని భయంగా ఉంది.
यही जीवन का नियम है.	అది జరిగి తీరుతుంది.
कुछ नहीं.	ఏంలేదులే.
और शव पर लेप लगाने की पेशगी रकम दी थी पर उनहोंने कभी बकाया रकम नहीं दी.	శవానని భదరపరచడానికి డిపాజిట కూడా ఇచచారు కానీ మిగతా అమౌంట మాతరం ఇవవలేదు.
-मुझे पता है इस मुशकिल पल में यह. . . -कितनी रकम है?	-ఈ సమయంలో అడగడం భావయం కాదని తెలుసు. . . -ఎంత కటటాలి?
आपसे मिलकर अचछा लगा, सर. मुझे आपके पिता के गुजर जाने का अफसोस है.	మిమమలని కలవడం బాగుంది, సర. మీ నాననగారు చనిపోయినందుకు చింతిసతుననా.
आपके पिता के गुजर जाने का मुझे अफसोस है.	మీ నాననగారు చనిపోయినందుకు చింతిసతుననాను.
बढिया. इस बीच,	మంచిది. ఈలోపు,
धनयवाद.	థయాంకస.
जिस बात से मैं अपने अगले सवाल पर आता हूँ.	కాబటటి మిమమలని ఓ విషయం అడగాలనుకుంటుననాను.
मुझे आपके पिता के गुजर जाने का अफसोस है.	మీ నాననగారు చనిపోయినందుకు చింతిసతుననాను.
किसलिए?	దేనికి?
-नहीं. . . -नहीं. ऐसा करने की इजाजत है भी?	-లేదు. . . -ఆగాగు. దానని అసలు అనుమతిసతారా?
हैलो. हम हैरिस के बेटे हैं.	హాయ. మేము, హయారిస కొడుకులం.
-लूसिया. -मैं रेमंड हूँ.	-లూషియా. -నా పేరు రేమండ.
-यह. . . -रेमंड और रे.	-ఇతను. . . -రేమండ, రే.
आरमी ई नेवी अवॉरड	ఆరమీ ఈ నేవీ అవారడ
-हम ठीक हैं, धनयवाद. -धनयवाद.	-ఇపపుడేమీ వదదులెండి. -థయాంకస.
-मत कहो कि मेरा जीवन कामयाब नहीं रहा. -तुमहें गुससे में देखकर अचछा लगा. शुकर है.	-నా జీవితం తగలడిపోయిందని అనకు! -నువవు కోపంగా ఉంటేనే నాకు నచచుతుంది. కానిదదాం ఇక.
रे	రే
नहीं. मेरे पूरव-पति और मेरी कार धोने की दुकान थी.	లేదు. నా మాజీ భరతకు, నాకు ఒక కార వాష సటోర ఉండేది.
झगडा किस बारे में था?	ఆ గొడవ ఎందుకు అయింది?
रेमंड	రేమండ
जी, हाँ.	చెపపాడు.
बॉनी. माइकल.	బోనీ. మెఖెల.
शोक करने आने वालों को सबसे पहले पहुँचकर अगर खाली कमरा दिखता है	సాధారణంగా, అంతయకరియలకు మొదటగా వచచే వారు గది ఖాళీగా ఉండటం చూసతే
-बढिया. -हाँ.	-మంచిది. -హా.
हाँ, और मुझे आपका डराइविंग लाइसेंस चाहिए होगा.	ఇంకో విషయం, మీ డరెవింగ లెసెనస కావాలసి వసతుంది.
वाह.	వావ.
असपताल का बेड जा चुका है	ఆసుపతరి బెడ ఇపపుడు లేదు,
-तुमहें लगता है मुझे यह अचछा लगा? -नहीं, मैं. . .	-నాకు అది నచచింది అనుకుంటుననారా? -లేదు, నేను. . .
खैर, मैं कोशिश करूँगा कि कमीनों जैसा बरताव करना छोड दूँ.	వెధవలా పరవరతించకుండా ఉండేందుకు నా శాయశకతులా పరయతనిసతాను.
नहीं.	లేదు.
मैंने उनसे पूछा, मैंने कहा, "यह कया संगीत है? "	"ఏ సంగీతం వింటుననారు? " అని నేను ఆయనని అడిగాను.
कया तुम बाद में कबरिसतान में आओगी?	మీరు తరవాత శమశానవాటికకి వసతుననారా?
नहीं, इसलिए नहीं. . . सब ठीक है, अचछा? तुम बस उनहें फोन करो.	అది కాదు. . . దాని గురించి కాదు, సరేనా? ఆయనకి కాల చేయ ముందు.
-ला. . . -उनहोंने कहा. . .	-అబబా. . . -ఏమననాడంటే. . .
-ठीक है. तुमने लूसिया का नंबर लिया? -कया?	-సరే. ఆమె నంబరు అడిగి తీసుకుననావా? -ఏంటి?
कय. . . उसे वापस फोन करो. लूसिया का नंबर लो.	ఏంటి. . . అతనికి కాల చేసి, ఆమె నంబరు తీసుకో.
मैं सीडरडेल कबरिसतान में काम करता हूँ.	నేను సీడరడేల సిమెటరీస లో పని చేసతుననా.
धनयवाद.	థయాంకస.
-शरी कैनफीलड. -रेवरेंड वेसट.	-మిసటర కయానఫీలడ. -ఫాదర వెసట.
हैरिस तुम लोगों के बारे में बहुत बातें करते थे और हर बार तुमहारी तारीफों के पुल बाँध देते थे.	హయారిస మీ ఇదదరి గురించి చాలాసారలు చెపపేవాడు, ఎపపుడూ మీ గురించి ముతయాలలాంటి మాటలు మాటలాడేవాడు.
कया मेरे शबद बकवास हैं?	నావి చెతత పదాలు అంటారా?
किसे पता चलेगा या कौन परवाह करेगा अगर वह गलत भी हुई तो?	అవి తపపని ఎవరికి తెలుసతుంది, అయినా ఎవరు పటటించుకుంటారు?
बहुत-बहुत धनयवाद.	చాలా చాలా థయాంకస.
मिस डेलगाडो.	మిస డెలగాడో.
नहीं, किसलिए?	లేదు, ఎందుకు?
धनयवाद.	థయాంకస.
मेरे बारे में राय मत बनाओ, रे.	నా గురించి తపపుగా అనుకోకు, రే.
नहीं.	లేదు.
यह एक विनमर विचार है	అది చాలా గొపప ఆలోచన,
किस बारे में?	దేని గురించి?
किसलिए?	ఎందుకు?
रुको.	వదదు.
-रेवरेंड वेसट. जी? -माफ कीजिए हमें देर हो गई.	-ఫాదర వెసట. చెపపండి. -ఆలసయమెనందుకు కషమించాలి.
-लियॉन. -लियॉन.	-లియోన. -లియోన.
आने के लिए धनयवाद.	వచచినందుకు థయాంకస.
मैं हमेशा हिचकिचाता हूँ पर मुझे कभी उसका अफसोस नहीं होता.	నేనెపపుడూ తటపటాయిసతూ ఉండేవాడిని, కానీ, బాధపడేవాడినే కాదు.
मैं वह सब नहीं संभाल पा रहा था.	నేను తటటుకోలేని సథితిలో ఉననాను.
माँ! उन लोगों को देखो! वे तो कलाबाज हैं!	అమమా! వీళలను చూడు! యోగా మాసటరలలా ఉననారు!
वाह.	వావ.
मेरा बचचा.	నా బంగారం.
-धनयवाद. -धनयवाद.	-థయాంకస. -థయాంకస.
बहुत अचछे. एक और.	అదిరింది. ఇంకోటి.
तुमहें विलसन याद है, रेमंड?	విలసన నీకు గురతుందా, రేమండ?
आमीन.	ఆమెన.
रे?	రే?
-लूसिया? -नहीं.	-లూషియా? -లేదు.
रेमंड?	రేమండ?
रेमंड.	రేమండ.
रेमंड!	రేమండ!
रेमंड.	రేమండ.
रे.	రే.
तुमहारी आतमा को शांति मिले, हैरिस.	నీ ఆతమకు శాంతి కలుగునుగాక, హయారిస.
सो जाओ, हैरिस.	పడుకో, హయారిస.
धनयवाद.	థయాంకస.
मैंने गैराज में रखने वाले बकसे रख दिए हैं. जरा दिखाओगी कचरा कहाँ फेंकना है?	షెడడుకు వెళలే పెటటెల పని అయిపోయింది. బయట చెతత పడేసే డసట బిన ఎకకడుందో చూపరా?
पहले खाना खा लो.	ముందు డిననర చేయ.
उसने सैंकडों तरह के काम किए और अंत में उसके पास कोई पैसे नहीं थे.	వంద ఉదయోగాలు చేశాడు, కానీ చివరికి చేతిలో చిలలి గవవ కూడా మిగలలేదు.
मैं. . . ओह, उ. . .	నేను. . . అబబా. . .
-सब ठीक है? -हाँ.	-అంతా ఓకేనా? -హా.
आप इस आदमी को जानती हैं?	మీకు ఇతగాడు ఎవడో తెలుసా?
रेमंड	రేమండ
कया तुमने और लूसिया ने. . .	కొంపదీసి నువవు, లూషియా. . .
-इसे गले लगाओ. -इसे गले लगाओ!	-దీనని హతతుకో. -దీనని హతతుకో!
अरे.	హేయ.
हाँ.	సరే.
मुझे जैज को सुनने से जयादा खुशी किसी चीज से नहीं मिलती. वह एक डरग की तरह है.	జాజ సంగీతానని వింటుంటే వచచే ఆనందం నాకు దేని దవారా కూడా రాదు. నాకు అదొక డరగ.
पर मेरे पिता मुझे रे बुलाते थे और उसे रेमंड और सब उथल-पुथल कर देते थे.	కానీ ఆయన ననను రే అని, వాడిని రేమండ అని పిలిచి అయోమయానికి గురి చేసేవాడు.
तुमहारे पिता बहुत अचछी बातें करते थे, बहुत जोश से तरक-वितरक करते थे.	మీ నాననగారు ఒక గొపప సాంపరదాయవాది, చాలా వీరోచితంగా చరచించేయగల మనిషి.
तुम लोगों की या तुमहारी माँओं की तसवीरें, तो मुझे कोई ऐतराज नहीं है.	మీ ఫోటోలు కానీ, మీ అమమల ఫోటోలు కావాలంటే, తీసుకోండి. నాకేం పరవాలేదు.
मैं संगरहालय में हूँ और डैडी. . . हैरिस एक परागैतिहासिक आदमी है.	నేను మయూజియమ లో ఉననా, ఇక నానన. . . హయారిస ఆదిమ జాతి మనిషి అననమాట.
और अंत में, तुमहारे पिता की यह भी इचछा थी कि उनकी कबर तुम खोदो.	ఇంకా చివరగా, మీరే సవయంగా ఆయన గోతిని తవవాలని మీ నాననగారి కోరిక.
ऑलिव कहती थी कि मुझे उससे जयादा एयर कंडीशनिंग में दिलचसपी है.	నాకు తన మీద కననా ఏసీ మీదనే ఆసకతి ఎకకువ ఉందని ఆలివ ఒకసారి అంది.
-हमारी एक फलाइट थोडी देर से आई. -आपको देर नहीं हुई है. लियॉन?	-మా విమానాలలో ఒకటి ఆలసయమెంది. -మీరేమీ ఆలసయంగా రాలేదు. లియోన?
अगर मैं दूसरे आदमी से पूछूँ, कया वह भी यह शबद इसतेमाल करेगा?	నువవు గొడవపడిన వయకతిని అడిగితే, అతను చినన గొడవ అనే చెపతాడా?
-लूसिया, कया तुम इस बारे में जानती थीं? -नहीं, यह मूरखता है.	-లూషియా, దీని గురించి మీకు తెలుసా? -లేదు, ఇది ఒక పిచచి పని.
वह तुम लोगों की झील के पास वाली तसवीर बहुत देखा करता था.	సరససు దగగర కూరచొని ఎపపుడూ మీ ఇదదరి ఫోటోలే చూసతూ ఉండేవాడు.
गाडी चलाना जयादा आसान है पर बार में पैसे जयादा मिलते हैं.	కారు నడపడం సులభమెన పని, కానీ బారులో ఎకకువ డబబులు వసతాయి.
-इसे ठीक तरह से करते हैं. -पर मेरे पास पैसे नहीं हैं.	-చేసేదేదో సరిగగా చేదదాం. -కానీ అంత అంటే నా వలల కాదు.
-मुझे फरक नहीं पडता. -नहीं, छोडो. आप मजाक कर रहे हो.	-అది నాకు అనవసరం. -అబబా. మీరు నా మాటను దాటవేసతుననారు.
बिना दाँत वगैरह के उसके लिए बोलना थोडा मुशकिल होगा.	అతను మాటలాడలేడులే, ఎందుకంటే పాపం పళలు ఊడిపోయాయి కదా.
हाँ. पर इस समय एक और मुवककिल मेरा इंतजार कर रहा है.	అవును. కానీ, ఇపపుడు ఒక కలయింట నా కోసం వేచి ఉననాడు.
-. . . जिसका मतलब है मैं असफल रहा. -नहीं, मैं. . .	-. . . అంటే సంక నాకి పోయిందనే కదా. -లేదు, నేను. . .
बलैकबोरड पर नाखूनों से खुरचने की आवाज कभी सुनी है?	గోళలను బలాక బోరడు మీద గీకితే వచచే శబదం ఉంటుంది కదా?
कोशिश करना कि हमारे अपने पिता के शव के दरशन के समय	నానన అంతయకరియల సమయంలో ఆ ఫయూనెరల హోమ రిసెపషనిసటును
आपको सच में लगता है कि हैरिस को ईशवर में यकीन था?	హయారిస దేవుడిని నమమాడని మీరు నిజంగా అనుకుంటుననారా?
-वह सब बरदाशत करने के लिए धनयवाद. -कोई बात नहीं.	-ఇబబందెనా ఫోజు ఇచచినందుకు థయాంకస. -దానిదేముందిలే.
मुझे यह नहीं पता था. यकीनन काफी दरदनाक रहा होगा.	ఆ విషయం నాకు తెలీదే. చాలా నొపపిగానే ఉండుంటుంది.
-तुमने कहा मेरा जीवन कामयाब नहीं रहा. -मैं. . .	-నా జీవితం ఇలా తగలడింది అననావు. . . -నేను. . .
उनहें अपने जीवन के लिए खुद जिममेदार होना होगा.	అతని జీవితంలో చేసిన పనులకు అతనే బాధయత వహించాలి.
हाँ, जैसे हमारी जिंदगियाँ हमारी जिममेदारी हैं.	హా, మన జీవితాలపె మనకు బాధయత ఎలా ఉంటుందో, అలాగే.
और नहीं, यह धारमिक पढाई के सकूल में नहीं सीखा.	ఆ పదం నేను దెవతవ బడి నుండి నేరచుకుంది కాదులే.
मतलब, वह हमेशा से ही मेरे साथ बुरा बरताव करते थे पर उस दिन से मेरा मन उनसे उठने लगा था.	అంటే, అతను ఎపపుడూ నాతో కటువుగానే ఉండేవాడు, కానీ దానితో ఇక ఆయనకి రాం రాం చెపపేదదామనుకుననా.
-इसे सीधा कर देते हैं. -हम ऐसा नहीं कर सकते.	-శవానని వెలలకిలలా తిపపండి. -ఆ పని చేయకూడదు.
मेरी शादी ठीक नहीं चल रही थी और मैं उदास थी.	నాకూ, నా భరతకు పడేది కాదు, బాధగా ఉండేదానని.
कोई बात नहीं. आने के लिए बहुत-बहुत धनयवाद.	పరవాలేదులెండి. వచచినందుకు చాలా చాలా థయాంకస.
वह बस, आप ऐसे बकवास शबद लाते कहाँ से हैं?	అలాంటి చెతత పదాలను మీరు ఎకకడ నేరచుకుననారు?
इतने चिडचिडे इनसान थे. कुँठा से भरे हुए.	ఎపపుడూ ఏడుసతూనే ఉంటాడు. పెగా చిరాకు ఒకటి.
तुमहारे पिता में एक अजीब तरह का आकरषण था.	మీ నాననలో ఏదో ఉంది, అది ననను ఆకటటుకుంది.
हमें इसकी खबर करनी चाहिए, वेसट. पुलिस को.	వెసట, మనం దీనని పోలీసులకు రిపోరట చేయాలి.
-वह छोटा बचचा? -हाँ. लूसिया का बेटा है.	-ఆ పిలలాడా? -హా. లూషియాకి పుటటిన కొడుకు.
हाँ. जिंदगी जीने के बहुत तरीके होते हैं.	జీవనం సాగించడానికి అనేక మారగాలు ఉననాయి.
इनका लिंग अभी भी हमारे वाले से बडा है.	ఇపపటికీ ఆయన అంగం మన కననా పెదదగానే ఉంది.
हाँ, सिवाय इसके कि अब हम बचचे नहीं हैं.	హా, కానీ ఇపపుడు మనం చినన పిలలలేం కాదు.
छोडो भी! तुम उनसे नफरत करते थे, रेमंड.	ఇక చాలు! నీకు కూడా అతనంటే అసహయం, రేమండ.
यह दकषिण की जयादातर लडकियों की तरह है.	దకషిణ భాగంలో చాలా మంది అమమాయిలు ఇంతే.
पतथर पर कुछ गलत नहीं लिखवाना चाहते थे, तो तारीखें न लिखवाने का फैसला लिया.	సమాధి మీద తపపుడు తారీఖులు ఉండటం అతనికి ఇషటం లేదు, అందుకే వాటిని వదదు అననాడు.
अचछा, चलो, मैं सबकी तसवीर खींचती हूँ.	సరే, అందరూ కలిసి ఉండే ఒక ఫోటో తీసతాను.
-जी, हाँ. -हैलो. आपसे मिलकर खुशी हुई.	-అవును. -హాయ. మిమమలని కలవడం బాగుంది.
लडकों के बारे में ऐसी कया खास बात है?	అబబాయి అని ఎందుకు పరతయేకంగా చెపపావు?
वह लडका, उसे देखकर मुझे गुससा आता है.	ఆ పిలలాడు నాకు చికాకు తెపపిసతుననాడు.
रे को मेरे काम के लिए इनाम मिलता था या मुझे उसके किए की सजा मिल जाती थी.	నేను చేసిన వాటికి రేని మెచచుకొనేవాడు, వాడి చేసిన వాటికి ననను శికషించేవాడు.
उनहें अपने मन से पूरी तरह उतार फेंका जैसे साँप अपनी केंचुली उतारते हैं.	ఆయన నుండి పూరతిగా వదిలేసింది అనుకుంటా, పాములు తమ చరమానని వదిలేసుకొనేటటటు.
माफ कीजिए, मुझे वह सुनाई नहीं दिया.	మళలీ చెపపండి, నాకు సరిగగా వినబడలేదు.
लूसिया. बस. . . बचचे को एक बार देख लेने दो. फिर हम आगे बढते हैं, ठीक है?	లూషియా. ముందు. . . అబబాయిని చూడనివవు. ఆ తరవాత మనం ఆ పని చేదదాం, సరేనా?
माफ करना. माफ करना, यह गलत वाली है.	మననించాలి. ఇది నీకు ఇవవాలసింది కాదు.
