आज का लकषय है, बरेमेन.	ఈ రోజు మీ లకషయం, బరెమన.
तुमहें पता है कि यह बस इस बारे में नहीं है कि तुमहारा दल कितने अचछे से अपने बिसतर बनाता है.	మీ సిబబంది మంచాల మీద పకకదుపపటలని ఎంత చకకగా సరదుకుననారనే దాని గురించి కాదని నీకు తెలుసు.
बक, मारज. . . ए, तोता-मैना. . . हम बकी के नाम जाम पेश कर रहे हैं.	బక, మారజ. . . ఓయ, పరేమపకషులూ. . . మేము ఇకకడ బకీ కోసం టోసట చేసతుననాం.
चलो भी, और तेज! तुमहें हमारी मदद करनी होगी!	కానివవు, ఇంకా వేగంగా! నువవు మాకు సాయం చేయాలి!
आरटी शॉ, बैनी गुडमैन.	ఆరటీ షా, బెననీ గుడమాన.
मेजर, यह जितना दिखता है उतना बुरा है नहीं.	మేజర, ఇది పెకి కనిపించేదానికననా ఘోరమెన సమసయ.
लडाकू विमान, सीधे ऊपर!	ఫెటరస, సరిగగా మన పెన!
ठीक है, आरमी 071, आपको उतरने की अनुमति है.	రోజర, ఆరమీ 071, లయాండింగ కి అనుమతి ఉంది.
शायद आपको चककर लगाकर उतरना चाहिए, मेजर. गरीनलैंड में सवागत है.	మీరు చుటటూ తిరిగి రావడం మంచిది, మేజర. గరీన లయాండ కి సవాగతం.
जमीन से हमला, आगे, ऊपर हलका बाईं तरफ. पीछे, हलका दाईं तरफ.	శతరువు ఎడమ వెపు ఎతతులో ఉననాడు. కుడి వెపు కొదది ఎతతులో ఉననాడు.
मेरे साथ रहो, डुवॉल!	నాతోనే ఉండు, డువాల!
बाईं तरफ, तैनात हूँ.	ఎడమ వెపు రకషణ, సరే.
जब मैं तैनाती के लिए निकलूँगा. लगभग दो या तीन हफते बाद.	నేను యుదధానికి వెళలినపపుడు. రెండు లేదా మూడు వారాలు కావచచు.
ठीक है. तो फिर मुझे अंडे नहीं चाहिए.	సరే. అయితే నేను కోడిగుడలని వదిలేసతాను.
हद है. उसे बंद करो.	డామిట. దానని ఆపేయ.
ठीक है, सरफेस लीड.	విననాను. సరఫేస లీడ.
और नहीं आ रहे हैं.	ఇంకెవరూ రావడం లేదు.
बढिया है. मैं चाहता हूँ कि आज तुम मेरे इतना ही करीब उडो.	మంచిది. నా విమానానికి ఈ రోజు నువవు ఇంత దగగరగా ఉండాలి.
मेरे पास वापस लौटना कैन! पयार, ऐलिस	నా దగగరకి తిరిగి రా కెన! పరేమతో, ఆలిస
एक सौ पैंसठ डिगरी पर दाएँ मुडिए. ओवर.	మీరు కుడి వెపు 165 కి తిరగండి. ఓవర.
तुम बाकी सकवाडरन से अलग कैसे हो गए?	మిగతా సకవాడరన ని నువవు ఎలా కోలపోయావు?
चलो, करट. तुमहारा आज का उदधरण कया है?	చెపపు, కరట. ఈ రోజుకి నీ సూకతి ఏంటి?
और कैपटन बैकर मौसम की जानकारी के साथ मीटिंग खतम करेंगे.	ఆ తరువాత కెపటెన బెకర వాతావరణ సూచనలు చెపపి ముగిసతాడు.
- आज हम विंग का नेतृतव कर रहे हैं. - मैं विंग का नेतृतव नहीं कर सकता.	- ఈ రోజు వింగ కి మనం సారథయం వహిసతుననాం. - నేను వింగ కి నాయకతవం వహించలేను.
उसमें कया लिखा है?	అందులో ఏం రాశావు?
निरविवाद लीडर थे.	ఎదురులేని నాయకులు.
यह बचकाना दांव है.	ఇది మూరఖపు పందెం.
इसकी आशा मत रखना.	దానని పటటించుకోకు.
ठीक है, कलियर-अप.	విననాను. కలియర-అప.
यह बंद नहीं हुईं.	ఈసారి అలా జరగలేదు.
यह रिटज के सुइट जितना आरामदायक है.	రిటజ హోటల లో సయూట అంత సౌకరయంగా ఉంది.
ईंधन काट रहा हूँ.	ఇంధనం ఆపేసతుననాను.
हम वेजर नदी में मौजूद यू-बोट पेनों पर हमला करेंगे.	మనం వేసర నది మీదునన యూ-బోట సథావరాల మీద దాడులు చేసతాం.
मुझे उनहें नहर के ऊपर गिराना पडा.	నేను వాటిని నదిలో పడేయాలసి వచచింది.
पायलट, दल के लिए, करैश लैंडिंग के लिए तैयार रहो.	సిబబందితో పెలెట, అతయవసర లయాండింగ కి సిదధంగా ఉండండి.
रेडमीट लीड, सरफेस लीड बोल रहा हूँ.	రెడమీట లీడ, ఇది సరఫేస లీడ నుండి.
समझ गया, ठीक है.	విననాం, పాటిసతాం.
ठीक है, ठीक है. सजजनों, एक जाम.	సరే, సరే. జెంటిలమెన, టోసట చేదదాం.
ठीक है! हम दूसरे इंजन में तेल का दबाव खो रहे हैं!	విననాను! రెండో ఇంజన లో ఆయిల పరెషర తగగిపోతోంది!
अरे, धत. वे सीधे हमारी ओर आ रहे हैं. हे भगवान.	ఓహ, చెతత. వాళలు నేరుగా మన వెపే వసతుననారు. దేవుడా.
नहीं, मुझे कल जलदी उडान भरनी है.	లేదు, నేను తెలలవారునే వెళలాలి.
तो फिर कल मिलेंगे. अलविदा, मारज.	అయితే రేపు కలుసతాను. బె, మారజ.
कैसपर, वायोमिंग.	కాసపర, వయోమింగ.
मॉरिस. साइकिलों के लिए धनयवाद.	మోరిస. సెకిళలు ఇచచినందుకు థాంకస.
पहली बार असली युदध में भाग ले रहे हैं, लडकों.	అసలెన యుదధంలో మొదటిసారి పాలగొంటుననారు, కురరాళలూ.
जबकि हममें से बाकी लोग नेबरासका के ऊपर अभयास मिशन में उडानें भर रहे होंगे.	కానీ మిగిలిన మనమంతా నెబరాసకా మీదుగా యుదధవిమానాలు నడపడం పరాకటీసు చేసతూ గడుపుతాం.
और ये चीजें हफतों तक बाजार में खतम रहती हैं.	పెగా ఈ సెకిళలని కొనాలంటే కొనని వారాలు పడుతుంది.
- चियरस, मेजर. - 100वें के नाम.	- చీరస, మేజర. - 100వ గరూప కి.
फिर तुम मेरे पास आकर कहोगे, "धनयवाद, बकी. "	అపపుడు నువవు వచచి, "థాంకయూ, బకీ" అని చెబుతావు.
नदी के पूरवी किनारे पर सथित, ये रहे वो पेन.	నదికి తూరపు వెపు ఈ జలాంతరగామి సథావరాలు ఉంటాయి.
जो इंसानों को तबाह करने के लिए पृथवी पर घूमती रहती हैं. आमीन.	ఈ భూమి మీద సంచరించు అందరూ, అందరి నాశనానని కోరేవారూ. ఏమెన.
कमांड पायलट, टेल के लिए, तुमहें वहाँ पीछे कया दिख रहा है?	వెనుక భాగానికి కమాంట పెలెట సందేశం, వెనుక మీకు ఏం కనిపిసతోంది?
मुझे हर पल तुमहारी याद सताएगी.	నినను పరతి కషణం మిస అవుతాను.
- और नहीं, नहीं, कभी नहीं - तुमहें यह करने की जरूरत नहीं है.	- అందుకే లేదు, ఇవవను, ఎపపటికీ - నువవు ఇదంతా చేయనకకరలేదు.
तुम जा सकते हो.	నువవు వెళలచచు.
मेजर, शायद यह जयादा छोटा है. मैं यह पहन नहीं पा रहा हूँ.	మేజర, ఇది చాలా చిననగా ఉందనిపిసతోంది. ఇది నాకు సరిపోవడం లేదు.
हम उसकी देखभाल कर रहे हैं, सर.	మేము అతని పనిలోనే ఉననాం, సర.
बैटरियाँ और जेनेरेटर दोबारा शुरू कर रहा हूँ.	బయాటరీలు ఇంకా జనరేటరలని మళలీ ఆన చేసతుననా.
एयर एगजीकयूटिव को इसकी वयवसथा करनी चाहिए.	ఎయిర ఎగజికయూటివ అలాంటి వయవహారాలు చూసుకోవాలి.
- वैसे ही जैसे हमने अभयास किया था. - जी, सर.	- మనం శికషణ ఎలా పొందామో అలా. - అలాగే, సర.
साथ ही, कीचड के आदी हो जाओ.	అలాగే, విమరశలకు అలవాటు పడాలి.
ठीक है. तैयार हो जाओ, दोसतों.	సరే. సిదధం కండి, మితరులారా.
उसमें ऊरजा नहीं थी और फिर वह बस पूरी तरह से बंद हो गई.	పవర లేదు ఇంకా ఆ తరువాత ఇది పూరతిగా మా మాట వినడం మానేసింది.
हमें एक समसया हो गई है, मेजर.	మనకి ఒక సమసయ వచచింది, మేజర.
सवरग के मेजबान, और सारी बुरी आतमाएँ. . .	దేవలోకపు నాయకుడు, ఇంకా అనని దుషటశకతులూ. . .
21 मई, 1943 389वां बॉमब गरुप	మే 21, 1943 389వ బాంబ గరూప
हम देश के हर कोने से एक साझा उददेशय के साथ इकटठा हुए थे:	మేమంతా దేశం నలుమూలల నుండి ఒక సమషటి లకషయం కోసం వచచాం:
- देखो कौन आया है. - बलेकली.	- అది ఎవరో చూడు. - బలేకలీ.
- मेजर. - हाँ.	- మేజర. - యస.
हाँ. मुझे मंजूर है, यैंकी.	అవును. ఇంక మొదలుపెటటు, యాంక.
चलो भी, टॉमी.	కానివవు, టామీ.
करैंक कहाँ है?	ఆ కరాంక ఎకకడ?
और वह बस 100वें बॉमब गरुप को खतम करने के लिए बेकरार हैं.	ఆయన 100వ బాంబ గరూప ని నిలిపివేయాలని పటటుదలగా ఉననాడు.
बस पिछले महीने में ही हमने यू-बोट के कारण लगभग 70 मालवाहक जहाज खो दिए.	కిందటి ఒకక నెలలోనే మనం ఈ యూ-బోటస వలల డెబబె రవాణా నౌకలని కోలపోయాం.
नोज, दल के लिए, शायद मैंने हमारे ठीक नीचे एक फलेयर देखा.	సిబబందికి ఆదేశాలు, సరిగగా మన కింద నేను మంటని చూశాను.
और मुझे उममीद है कि मेरे सारे ऑफिसर इस कोशिश में मेरा साथ देंगे.	మిగతా మీ ఆఫీసరలు అందరూ ఈ పరయతనంలో నాతో పాటు ఉండాలని నేను ఆశిసతుననాను.
कमांड पायलट, दल के लिए, मैं यह मिशन रदद कर रहा हूँ.	సిబబందితో కమాండ పెలెట, నేను ఈ మిషన ని నిలిపివేసతుననాను.
ईंधन का दबाव, तेल का दबाव ठीक दिख रहा है.	ఇంధనం పరెజర, ఆయిల పరెజర బాగానే ఉననాయి.
बलॉनडी टावर, आरमी 233. बलूई वेसट वन के ऊपर बी-17 का एक बेडा है.	బలాండీ టవర, ఆరమీ 233. బలూయీ వెసట వన మీదుగా బి-17 బాంబర పరయాణిసతోంది.
रेडमीट डिपटी, हमारे पलेन में यांतरिकी खराबी आई है.	రెడమీట డిపయూటీ, మాకు విమానంలో మెకానికల సమసయ తలెతతింది.
बक. आज रात खतम होने से पहले तुम मेरे साथ जरूर नाचोगे.	బక. ఈ రాతరి పొదదుపోయేలోగా నువవు నాతో డానస చేయాలి.
मैं फयूज निकाल कर देखता हूँ. इससे समसया पता चल जाएगी.	నేను ఫయూజులు లాగేసతాను. అది సమసయని వేరు చేసతుంది.
तुमने मेरे लिए चिटठी लिखी?	నువవు నాకు ఉతతరం రాశావా?
- हाँ, 100वें के नाम. - शुभकामनाएँ, सर.	- హా, 100వ గరూప కి. - బెసటాఫ లక, సర.
वे आ गए हैं.	ఇదిగో తీసుకో.
- तुमने पकड लिया? - हाँ.	- నీకు దొరికిందా? - అవును.
और अगर हम अमरीका से गरेट बरिटेन में सामान ना ला सके,	అమెరికా నుండి గరేట బరిటన కి ముడిసరుకులు రాకపోతే,
पर मुझे कुछ दिखाई नहीं दे रहा है. कया मैं बम गिराऊँ?	కానీ నాకు ఏమీ కనిపించడం లేదు. నేను బాంబు వేయాలా?
रॉजर. अंकल. फॉकस. एकसरे.	రోజర. అంకుల. ఫాకస. ఎకస రే.
- एक भी शबद नहीं. - मैं बस पता करने की कोशिश में हूँ	- ఇంకో మాట మాటలాడదదు. - మా కురరాళలకి ఏం జరిగిందో
कोई नहीं आया.	ఎవరూ రాలేదు.
तुम वहाँ खुद मिशन पर पलेन उडाने नहीं जा रहे हो.	యుదధవిమానాల పోరాటాల కోసం నువవు అకకడికి వెళలడం లేదు.
सौवें बॉमब गरुप को नाजी जरमनी के खिलाफ लडाई में	1943 వసంతకాలంలో 100వ బాంబ గరూప ని ఇంగలండ కి పంపించి
हमारी इकाई चार सकवाडरनों से बनी थी.	నాలుగు సకవాడరనలతో మా యూనిట రూపొందింది.
अगर मैं पहले नहीं मरा तो.	మొదటగా నేనే చనిపోకపోతే.
वह भेडिया आधा कुतता है.	అది తోడేలు భాగం ఉనన కుకక.
- सब ठीक है. - अरे, धत.	- అంతా కలియర. - ఓహ, చెతత.
मोहतरमा कमाल की है. वह इस किले को थोडी अतिरिकत शकति देगी.	ఇది భలే బాగుంది. మన బాంబర విమానానికి అమె అదనపు బలానని ఇసతుంది.
विदयुतीय परणाली बंद करके रीसायकल कर रहा हूँ. चलो इसे ठीक करें.	విదయుత ని నిలిపివేసి మళలీ ఆన చేసతాం. మనం దీనని సరిచేయాలి.
पहचाने गए हथियारों में 88 और 105 मिलीमीटर की बंदूकें शामिल हैं	మనం గురతించిన వివరాలు చెపపాలంటే 88 ఇంకా 105 మిలలీమీటర గనస
वह कमाल का ऑबजरवेशन मिशन था, मेजर.	అది చాలా దారుణమెన పరిశీలన మిషన, మేజర.
सारजेंट, मुझे नहीं पता कि कया हुआ था,	సారజెంట, ఏం జరిగిందో నాకు తెలియదు,
जो वरजबरग रेडार दवारा निरदेशित हैं, इसलिए वे आपको टरैक कर रहे होंगे.	ఇంకా వురజ బరగ రాడార వినియోగిసతుననారు, కాబటటి వాళలు మిమమలని గమనిసతూ ఉంటారు.
मेरा एक दोसत कुछ हफतों पहले यहाँ से गुजरा था.	కొనని వారాల కిందట నా మితరుడు ఒకడు ఇకకడికి వచచాడు.
पकका मैं पूरे आरमी एयर फोरस का सबसे बुरा नैविगेटर हूँगा.	మొతతం ఆరమీ ఎయిర ఫోరస లో అతయంత ఘోరమెన నావిగేటర ని నేనే కావచచు.
लडाकू विमान, सीधे सामने!	ఫెటరస, ఎదురుగా పరమాదం!
इसलिए सथान हमारे लिए महतवपूरण था.	కాబటటి మాకు లొకేషన అనేది చాలా ముఖయం.
- सबसे बेहतरीन डारट सलिंगर है! - तुमहारी आँख फूट जाएगी.	- మొతతం ఈసట ఆంగలియా పరాంతంలోనే! - నువవు ఒక కంటిని కోలపోతావు.
नैविगेटर, बॉमबारडियर, यह मीटिंग खतम होने के बाद,	మనం ఇకకడ ముగించాక, నావిగేటరలు, బాంబారడియరలు,
अब, आप यहाँ बरेमेन के उततर पशचिमी छोर से शुरुआत करेंगे.	ఇపపుడు, మీరు పరారంభించాలసింది బరెమన కి వాయువయపరాంతంలో, ఇకకడ.
एक सौ, 110.	వంద, నూటపది.
हमें इसे बदलना होगा. . .	మనం దీనని మారచాలి. . .
मैंने उसे बताया कि मेरा नाम गेल है, गेल कलेवेन.	నా పేరు గేల, గేల కలెవెన అని అతనికి చెపపాను.
यह बेहद जरूरी था कयोंकि अगर हम अलग हो जाते,	అది చాలా ముఖయం ఎందుకంటే మేము కనుక వేరుపడడామంటే,
टॉप टरेट, दल के लिए, सीधे ऊपर. लडाकू विमान!	పెన గననర నుండి సిబబందికి, సరిగగా మన పెన. ఫెటరస!
तुम कया देख रहे हो? तुमहें यह फोरट ठीक करना है.	నువవు ఏం చూసతుననావు? ఈ బాంబర ని సరి చేయాలి.
और जब तक तुम लोग वहाँ नहीं पहुँचते हो, मैं उनके साथ उडान भरूँगा.	ఇంకా మీరంతా వచచేవరకూ నేను ఆ కురరాళలతో కలిసి యుదధవిమానాలు నడుపుతూంటాను.
लेमनस या विंक उसकी देखभाल करेगा.	లెమనస లేదా వింక వాడిని చూసుకుంటారు.
100वें बॉमब गरुप के सी. ओ. , करनल हैरलड कयू. हगलिन का ऑफिस	కలనల హారాలడ కయూ. హగలిన, 100వ బాంబ గరూప కమాండింగ ఆఫీసర
मेजर कलेवेन को दिखाओ.	మేజర కలెవెన కి చూపించు.
उनहोंने जो भी कहा हो, मैंने कुछ गलत नहीं किया.	అతను ఏం చెపపినా, నేను ఎలాంటి తపపూ చేయలేదు.
पर किसी तरह, हम एटलांटिक के ऊपर बादलों में	కానీ ఎలాగో, మేము మా మిగతా గరూప నుండి వేరుపడడాం
उममीद है कि हम सभी सुरकषित वापस लौटें. . .	మేమంతా కషేమంగా తిరిగి వసతామని ఆశిసతుననాను. . .
चलो इसे सफलतापूरवक खतम करें और उन नाजी कमीनों के ऊपर बम फेंकें,	మనం ఒకే దెబబలో విజయం సాధించాలి, ఇంకా ఆ నాజీ వెధవల మీద బాంబులు వేయాలి,
ठीक है. तो फिर हम अब भी यहाँ कयों खडे हैं?	సరే. అయితే మనం ఇంకా ఇకకడే ఎందుకు నిలబడి ఉననాం?
बी-17 में 12 मशीन गन थीं जो चारों तरफ से हमारी रकषा कर रही थीं.	బి-17 విమానంలో పననెండు మెషీన గనస మాకు అనని వెపుల నుండి రకషణగా ఉననాయి.
ऐलिस फरॉम डैलस. ऐलिस, हमारा पैलेस.	ఆలిస ఫరమ డాలస. ఆలిస, మన పయాలెస.
