नारकोटिकस वालों ने उसे (रॉबरट विलियमस) बुरी तरह पीटा, उसका हुलिया ही बदल गया है.	పోలీసులు అతనని (రాబరట విలియమస) దారుణంగా కొటటారు, తను తనలాగే లేడు అసలు.
कि गराहम ईमानदार पुलिसवाला नहीं है.	గరాహం నమమదగిన పోలీసు కాదని మాకు చెపపాడు.
13 फरवरी, 2018	ఫిబరవరి 13, 2018
पॉल सोलोटरॉफ दवारा शॉन मकेबे दवारा चितरण	పాల సోలోటరాఫ రచన సీన మెకకయాబ బొమమలు
बदमाश पुलिसवालों की उस सूची के बारे में	ఆ దురమారగపు పోలీసుల జాబితా గురించి
और मेरी जेब में थोडा बचा भी है.	ఇంకా నా జేబులో మిగిలుననాయి.
और उसने मुझे देखा. वह बोली,	తను నా వెపు చూసింది. తను అననది,
-मैं वह देखने को बेताब हूँ. -सुना, फिली?	-అది చూడాలనుంది. -అది విననావా, ఫిలలీ? విననావా?
लंबी अवधि वाली वयापक छानबीन के लिए बनाई गई थी.	విసతృత పరిధి పరిశోధనలకె రూపొందించబడింది.
बयुला पारकर मीक की दादी	బయూలా పారకర మీక బామమ
2200 साउथ हेमबरगर सटरीट	2200 ఎస హెంబరగర వీధి
"मीक मिल को रिहा करो. "	చెపపామని అనుకుననారు.
जलद घर आ जाओगे, भाई.	తవరగా ఇంటికి రా, సోదరా.
तो हम बस साउथ हेमबरगर सटरीट के 2200 बलॉक में पहुँचने वाले थे.	అందుకే మేము 2200 దకషిణ హెంబరగర వీధిలోకి వెళళబోతుననాం.
-हाँ, "बिंगो" कहा था. -"बिंगो" कयों कह रहे हो?	-అవును, "బింగో. " -మీరు "బింగో" అని దేనికి అంటుననారు?
"कुछ तो करना होगा" यह मेरी शिकायत के अंत में लिखा था.	"ఏదో ఒకటి చేయాలి" అని నా ఫిరయాదు చివరన రాశాను.
और हम इसे संजीदगी से लेते हैं.	మేమది తీవరంగా పరిగణిసతాము.
जो एक तरह से फिलाडेलफिया पुलिस विभाग के नेवी सील के जैसा है.	అది ఫిలడెలఫియా పోలీసు విభాగం వారి నేవీ సీలస లాంటిది.
घूम जा, साले.	వెనుకకు తిరుగు.
मीक को बाहर निकालो और इसको अंदर डालो.	అతనిని వదిలి, ఆమెను లోపల వేయాలి.
लगता है 2018 के सुपर बोल में अपने परिचय के लिए ईगलस	ఈగిల జటటు డరీమస అండ నెటమేరసను వారి 2018 సూపర బౌల పరిచయానికి
रेजी गराहम नारकोटिकस फीलड यूनिट का हिससा था,	రెజీ గరాహం నారకాటిక ఫీలడ యూనిటలో భాగం,
नशा बेचने वालों और उन लोगों के घरों से	కొనని వేల డాలరల డబబును మాదకదరవయ డీలరల నుంచి,
रेसन पारकर मीक का कजिन	రాసన పారకర మీక కజిన
इकीम पारकर मीक का कजिन	ఇకీమ పారకర మీక కజిన
तब एक रेफरी/मधयसथ नियुकत किया जाता है,	వాళళు పరాథమికంగా వీళళు నమమదగిన వారా కాదా అని
हम टवंटी सेकंड एंड जैकसन के नुककड पर पहुँच रहे हैं.	మేము జానసన, 22వ మలుపు దగగరకు చేరుకుంటుననాము.
तथयों की समीकषा: गराहम "संघीय अधिकारियों दवारा भरषटाचार के	వాసతవాల వృతతాంతం: గరాహం "వివిధ ఆరోపిత అవినీతి చరయల
हमारे पास दो हलफनामे हैं,	మాకు రెండు వాంగమూలాలు అందాయి,
डरीमस एंड नाइटमेअरस चुनेंगे, तो. . .	ఎననుకుననటటు ఉననారు, అందుకే. . .
रेजी गराहम मीक का गिरफतारी अफसर	రెజీ గరాహం మీకను అరెసట చేసిన అధికారి
बहुत सी बातें चल रही थीं, अचछी बातें.	చాలా సందడి చోటు చేసుకుంది, చాలా మంచి సందడి.
वह लैमबोरगिनी, मेरी नई गाडी वह मेरा साया है	నా లాంబరగినీని, నా కొతత పరేయసి నా బదులు నడుపుతుంది
ऐसा नहीं होता. खासतौर पर, दकषिणी फिली में तो नहीं.	అది జరగదు. ముఖయంగా, వాసతవంగా, దకషిణ ఫిలలీలో
कि गराहम का नाम उस कथित "नहीं बुलाएँ" सूची में है,	అతని పేరు డు నాట కాల జాబితాలో కనిపిసతుననటలు
घर की तलाशी लेने और उसे गिरफतार करने के लिए इसतेमाल किया.	మీకను అతని ఇంటి దగగర అరెసట చేయటానికి ఉపయోగించారు.
और यह विवरण कि "मधयम वरण" का है, वह मीक से मेल नहीं खाता.	వరణనలో ఉనన. . . "మధయసత రంగు" మీకకు సరిపోలటం లేదు.
मैंने उसे अपना नाम बताया. कहा, "मैं यहाँ मीक मिल के केस पर बात करने आया हूँ. "	అతనికి నా పేరు చెపపా. "ఇకకడికి మీక మిల కేసు విషయంగా వచచాను" అననాను.
मुझे खाने के लिए सनैकस मिले.	నాకు చిరుతిండలు తెచచారు.
ठीक है.	అవును.
वहाँ पर मीक ने कथित रूप से नशीली दवा बेची,	మీక మాదకదరవయాలు అమమినటటు ఆరోపణ ఉంది,
जैसा कि उसने अपने बयान में लिखा है.	విధానానని బటటి విభేదిసతుననాము.
बस वह यही कह रहा था, "मैंने कुछ गलत नहीं किया है.	అది అతను పరాథమికంగా, "నేనేమీ తపపు చేయలేదు.
पुलिसवालों से एक-दूसरे के बारे में बात निकलवाना बहुत मुशकिल है.	పోలీసులను ఒకరి గురించి ఒకరు మాటలాడేలా చేయటం చాలా కషటం.
उसने आज तकरीबन आधा दरजन खुलासों की जानकारी दी है.	ఆరు సోదాలకు వెంటనే తన సహకారానని అందించాడు.
और नारकोटिकस फीलड यूनिट में भरषटाचार जोरों पर था.	నారకోటికస యూనిటలో అవినీతి తారసథాయిలో ఉంది.
दीवार से लगकर खडा हो!	నువవు గోడకు అనుకో.
और इसीलिए, हमें हर केस, हर उस सजा का	ఫలితంగా, మేము జాబితాలో ఉనన పరతిఒకక కేసును,
जॉरडन सीव मीक का वकील	జోరడన సీవ మీక లాయర
समुदाय में उनहें पुलिस अफसर के रूप में सभी जानते हैं, है न?	వాళళు ఈ పరాంతంలో పోలీసు అధికారులుగా జనం అందరికీ తెలిసి ఉంటారు, అవునా?
"2204 साउथ हेमबरगर सटरीट के पास उसके सिर पर वार किया.	"2204 దకషిణ హెంబరగర వీధిలో అతని తలను తననారు అని జిరీక చెపపాడు.
"जिस पुलिसवाले ने मीक के खिलाफ बयान दिया था वह इस सूची में है.	"మీకకు వయతిరేకంగా సాకషయమిచచిన పోలీసు ఆ జాబితాలో ఒకడు.
गराहम नंबर 6214 को नारकोटिकस फीलड यूनिट में डाला गया है	గరాహంను #6214 నారకోటిక ఫీలడ యూనిటకు నియమించారు.
तो आपको उसके साथ ऐसे पेश आने का उचित कारण देना पडता है,	మీరు అతనికి చేసినది నయాయమెనదని నిరూపించుకోవాలి,
"धत. मुझे नहीं पता था यह इतना गंभीर है. "	"దారుణం. దీని వెనక ఇంత కథ ఉననటలు నాకు తెలియదు. "
एक सेवानिवृतत नारकोटिकस अफसर, जेफरी वॉकर,	పరముఖ నారకోటికస పోలీసు, జెఫరీ వాకర,
उन घटनाओं के विवरण में दिककत यह थी	ఆ వరుస సంఘటనల వలల సమసయ ఏంటంటే
और जब कोई बडा छापा मारते हैं तो उनका बडा नाम होता है	వాళళు ఏదెనా పెదద సోదాకు వెళళినపపుడు, ఇంకా వాళళు మాదకదరవయాలననీ
वह भी एक पुलिस अफसर थी.	ఆమె కూడా ఒక పోలీసు అధికారి.
मुझे इसका पूरा यकीन है,	నేను చాలా గటటిగా నమముతుననా,
जब इस तरह के आकरामक बल के इसतेमाल पर सवाल पूछे जाते हैं. . .	అవి ఊడిపోయినపపుడు ఎకకువ బలం ఉపయోగించటం వలలనేమో. . .
*यूएस कानून विभाग	*యూ. ఎస. నయాయ విభాగం
लूक बरिंडल-खिम पराइवेट जासूस	లూక బరిండిల-కిమ పరెవేట పరిశోధకుడు
उनहोंने पूछा, "इसके चेहरे को कया हुआ? "	ఆమె, "అతని మొహానికి ఏమయింది? " అని అడుగుతుంది.
यह शिकायत मैंने 24 जनवरी, 2007 को दरज कराई थी.	నేను జనవరి 24, 2007న చేసిన ఫిరయాదు ఇది.
जब किसी भी टीम का वारंट मंजूर होता है, तो सारी टीमें एक साथ हो जाती हैं,	ఏదెనా బృందానికి వారెంట అమోదించినపపుడు, అనని బృందాలు కలుసతాయి,
गली का दूसरा छोर लोगों से भरा था.	వీధికి అటువెపు అంతా జనంతో నిండిపోయింది.
11 और मामलों पर पुलिस भरषटाचार का धबबा	ఇంకా 11 కేసులు పోలీసుల అవినీతితో కళంకితమయయాయి
जब यह कारयवाही शुरू हुई थी.	అసలు అరెసటయిన దగగర నుంచి చూడాలి.
कि संभव है कि मीक को सजा एक झूठी गवाही के कारण हुई है,	నిరధారించినటలు తెలుసతోంది కాబటటి, దాని ఆధారంగా అతనిపె నిరూపించిన
उनहोंने खबरी को खरीदने के लिए भेजा, ठीक है?	వాళళు రహసయ ఇనఫారమెంటను కొనుగోలుకు పంపించారు, అవునా?
सबसे निंदनीय है, एफबीआई दवारा रखी गई पॉलीगराफ परीकषा में असफल होने का.	ఎఫబిఐ నిరవహించిన పాలిగరాఫ పరీకషలో విఫలమయినటలు నిరధారించారు.
जहाँ मेरे पिता हैं.	మా నానన ఉనన చోట.
गिनो लाखों में पैसा फिर दिखाओ जैसे मैं कंगाल हूँ	కోటల కొలది డబబును లెకకించి అపపుడు దివాలా తీసినటటు పనిచేశా
जिसमें गराहम का दावा था कि उसने मीक को	గరాహం అందులో మీకను, దకషిణ ఫిలలీ,
मीक मिल को रिहा करो	మీక మిలను వదలండి
जब मीक मिल गिरफतार हुआ, तब मैं वहाँ नहीं था.	మీక మిల అరెసటయినపపుడు నేను అకకడ లేను.
इनमें से कई अफसरों का बहुत कम हाथ था,	ఈ అధికారులలో చాలామందికి అతి తకకువ పాతర ఉంది,
अब शहर में एक नया जिला अटॉरनी आया है.	ఇపపుడు, నగరానికి కొతత డిసటరిక అటారనీ వచచారు.
मेरी माँ तुरंत असपताल आ गई. वे पुलिसवालों पर चिलला रहे थे.	మా అమమ, పరుగెతతుకుంటూ ఆసుపతరికొచచింది. వాళళు పోలీసుల మీద అరుసతుననారు.
हाथ ऊपर! अपने हाथ ऊपर करो!	హయాండస అప! చేతులు పెకి పెటటండి!
मैंने बंदूक जमीन पर रख दी.	నేను నేల మీద నా తుపాకీ పెటటాను.
और उनहोंने ये वाकए तलाशी वारंट में बयाँ किए	వాళళు ఆ సంఘటనలను సరచ వారెంటలో రాసారు
हाथापाई, नशे का सौदा, सबूतों के साथ छेडछाड,	దౌరజనయం, సాకషయాలను తపపుదోవ పటటించటం,
कि उनहें घटनासथल से नशीली दवाएँ मिली थीं.	కనుగొనన మాదకదరవయాలకు విచారణలో ఎలాంటి ఆధారము లేదు.
फरवरी 2018	ఫిబరవరి 2018
मीक मिल का डरीमस एंड नाइटमेअरस	మీక విల డరీమస అండ నెటమేరస
कयोंकि जितने दिन हमें सबूत नहीं मिलेंगे,	ఎందుకంటే మాకు కావలసిన ఆధారం దొరకని పరతిఒకక రోజు,
"मीक रिहा नहीं हुआ है, तो मतलब तुम पूरी मेहनत नहीं कर रहे. "	"ఒకవేళ మీక విడుదల అవటంలేదు అంటే, మీరు సరిపడ కషటపడటం లేదు" అని అంటుననారు.
और यह है जैकसन.	జాకసన ఇకకడ ఉననాడు.
पर वह बस एक दस मिनट की बातचीत ही थी,	కానీ అది ఒక 10 నిమిషాల సంభాషణ,
दो से चार साल? उसे बाहर होना चाहिए.	రెండు నుంచి నాలుగు ఏళళా? తను బయటకు రావాలి.
मीक मिल को रिहा करो!	మీక మిలను విడుదల చేయండి!
-तुम ठीक हो, यार? -तुमहें लगता है मैं मजाक कर रहा हूँ?	-నువవు బాగుననావా? -ఆడుకుంటుననా అనుకుంటుననావా?
एक में दोषी होना कबूल किया है,	29 అవినీతి ఆరోపణలలో ఒకటెన
"धत! "	"ఛ! "
मेरी कहानी मीक मिल को उसके अधिकारों से वंचित रखने के बारे में थी.	మీక మిల తన జనమహకకును కోలపోవటంపె నేను ఈ కథనానని రాశాను.
तीनों बोरड सदसयों ने रेजी गराहम को दोषी पाया	బోరడు సభయులు ముగగురూ రెజీ గరాహం దోషి అని నిరధారించారు
वह दो अफसरों के बीच में फँस जाएगा.	అతను రెండు పోలీసు బృందాల మధయ ఇరుకకుంటాడు.
तो हमारे पास पहले से ही रिकॉरड में तीन संभव झूठे बयान हैं.	ఇపపటికే అధికారిక రికారడులలో మనకు మూడు సంభావయ తపపు సటేటమెంటలు దొరికాయి.
पता चला कि आरोप बेबुनियाद है.	ఆరోపణ తోసిపుచచబడిందని బహిరగతమయయింది
एक गिबसन का और दूसरा वॉकर का.	ఒకటి గిబసన నుంచి మరొకటి వాకర నుంచి.
बता नहीं सकता कि कितने. . . मैंने जितने लोगों को वह लेख भेजा था,	నేను ఎంతమందో చెపపలేనుగానీ. . . బహుశా 50 నుంచి 60 మంది
मैंने अपनी बंदूक निकाली.	నేను నా ఆయుధానని తీసుకుననాను.
और उसने वह सुना और देखा,	ఎవరో చకకగా అరథం చేసుకుననారని,
मैंने गराहम और जॉनसन को देखा, उनकी और मेरी बंदूक बाहर थी.	గరాహం, జానసనలు తమ ఆయుధాలు బయటకు తీయటం చూశాను, నేను నాది బయటకు తీశాను.
-तुम इस तसवीर का कया करोगे? -अपने कमरे में टाँगूँगा.	-నువవా ఫొటోతో ఏం చేయాలని అనుకుంటుననావు? -నా గదిలో పెటటుకుంటాను.
मीक ने अपनी दो से चार साल की सजा के तीन महीने काट लिए हैं	మీక తన 2-4 ఏళళ జెలు శికషలో మూడు నెలలు ముగించాడు
यह उस बारे में नहीं है. यह इस नाकाम सिसटम के बारे में है.	అది దాని గురించి కాదు. చెడిపోయిన వయవసథ గురించి.
वारंट नंबर 127338	వారెంట #127338
मधयम वरण, तकरीबन 5 फुट 8 इंच, काली सकी हैट पहने हुए	మధయసత రంగు, దాదాపు 5'8" ఎతతు, నలల ఊలు టోపీ
-गुड मॉरनिंग, दोसतो. -गुड मॉरनिंग.	-శుభోదయం, అందరికీ. -శుభోదయం.
इस बात की ओर जागरूकता बढी कि एक और	ఒకటి ఉందనే అవగాహన పెరగటానికి
मैं सटोर में जाने के लिए घर से निकला.	నేను దుకాణానికి వెళళటానికి బయటకు వెళుతుననాను.
बोरड अधयकष - परिणाम/सजा दोषी/बरखासतगी	బోరడ పరెసిడెంట - కనుగొననది/శికష నేరం/కొటటివేత
मधयम वरण, तकरीबन 5 फुट 8 इंच	మధయసత రంగు, దాదాపు 5'8"
कयोंकि यह हमारी छानबीन को तो साबित करता ही है,	ఎందుకంటే అది మేము చేసతునన పరిశోధనకు ఏకెక రుజువే కాకుండా,
16 अपरैल को, जज बरिंकली	ఏపరిల 16న, నయాయమూరతి బరింకలీ
घटनाओं का नाटकीय रूपांतर दिखाया गया है.	రూపొందించబడిన సననివేశాలు ఉననాయి.
मैं सामने के दरवाजे से बाहर देख रहा था.	నేను ముందు తలుపువెపు చూసతుననాను.
मुझे पता नहीं था कि वह घर कैसा लगता था.	ఆ ఇలలు ఎలా ఉంటుందో నాకు తెలియదు.
कयोंकि उसकी विशवसनीयता पर सवाल उठे हैं.	జిలలా అటారనీ కారయాలయం తెలిపింది.
उनहोंने कहा, "यह रहा 20 डॉलर का नोट. " उनहोंने नंबर नोट किया,	వాళళు అననారు, "ఇదిగో 20 డాలరలు" అని. ఆ నోటు నంబరు,
और वे सब सच और सही हैं झूठी गवाही की सजा के नियमों के अंतरगत.	మరియు అసతయ దండన కరింద ఇవననీ నిజమెనవి మరియు సరెనవి.
पूरव भरषट पुलिसवाला अब उनका गवाह बनेगा जिनहें उसने गिरफतार किया था	ఒకపపటి కపట పోలీసు ఇపపుడు తను అరెసటు చేసిన వారికి సాకషి
