जून लेंकर	జూన లెంకర
पर मैं बता रही हूँ, एरॉल जलद ही घर वापस लौटेगा.	కానీ చెపతుననా కదా, ఎరరొల తవరలోనే ఇంటికి వచచేసతాడు.
उसने मुझे जाँच दल से हटा दिया. आप यह जानते हैं?	అతను ననను విచారణ నుండి తపపించాడు. అది మీకు తెలుసా?
कया तुमने किसी को बताया कि हम उसे ढूँढ रहे हैं?	తన కోసం మనం వెతుకుతుననామని నువవు ఎవరికెనా చెపపావా?
लोग देखते हैं, वे बातें करते हैं.	జనాలు చూసతే, గుసగుసలాడుకుంటారు.
एक बेहद जरूरी मामला सामने आया है.	ఒక అతయవసరమెన పరిసథితి ఏరపడింది.
अब उनहोंने उसे बस कुछ धमकी भरे संदेशों के कारण	బెదిరించే విధంగా ఉండే మెసేజలను కొననింటిని పంపాడని
- हाँ, वह. . . - मेरी कोई. . .	- హా, అతను. . . - కోపం అంటే. . .
जो कि बेहद अजीब है. इसलिए उनहोंने मुझे फोन किया.	అదే వింతగా ఉంది. అందుకే ఆమె నాకు కాల చేసింది.
किस चीज के बदले?	దేనికి బదులుగా?
या तुमहारे किसी परिवार वाले को.	అలాగే నీ కుటుంబ సభయులని కూడా.
तुमहें फोन पर उसकी आवाज सुननी चाहिए थी. हैगरटी की. वह अकड रहा था, पर वह घबराया हुआ था.	ఫోనులో హెగరటీ మాటలను నువవు విని ఉండాలసింది. కటువుగానే మాటలాడినా, కలవరపడుతుననాడని తెలుసతోంది.
पहली पुलिसवाली हो जिसने मेरा नाम सही लिखा.	నా పేరు సపెలలింగ ని సరిగగా రాసిన పోలీసు మీరే.
थोडा "माई लिटिल पोनी" जैसा है.	అమమాయిలకి ఇచచేదిలా ఉంది ఇది.
हाँ, सब ठीक है.	హా, ఏం పరలేదు.
उनके बीच एक बडा झगडा हुआ था.	వాళలిదదరూ బాగా గొడవపడుతుననారు.
वही मिला जिसके वे हकदार हैं #मॉबआरमी हमें परेशान किया तो हम बदला जरूर लेंगे	వాళలకి తగిన శాసతే జరిగింది #గూండాల సెనయం మాతో పెటటుకుంటే వేసి పారేసతాం
मैं समझाने की कोशिश कर रही थी.	నేను వివరించే పరయతనం చేశాను.
जो टीवी पर दिखाया गया था, जिसके बारे में वे बता रहे थे?	టీవీలో ఒక సంఘటన గురించి మాటలాడారు కదా, దాని గురించే అననమాట.
वे जाँच बिठाएँगे. वह जाँच कई महीनों तक चलेगी	విచారణ చేపడతారు. అది ఏళల తరబడి సాగుతుంది,
- यह सोनया है. मुझे जाना चाहिए. - ठीक है.	- సోనియా మెసేజ చేసింది. నేను వెళలాలి. - సరే.
तो तुमने वापस जाकर कहा कयों नहीं कि तुमसे गलती हुई थी?	మరి పోలీసుల దగగరికి వెళలి, పొరపాటు జరిగిందని చెపపవచచు కదా?
हाँ. हाँ, मुझे अभी-अभी लेयटन के एक आशरय गृह से फोन आया था.	సరే. లేటన లో ఉండే ఒక శరణారథుల ఆశరయం నుండి ఫోన వచచింది.
- मुझे पता है कि मैंने तुमहें निराश किया. - कोई बात नहीं.	- నేను నినను చాలా నిరాశపరచానని తెలుసు. - ఏం పరలేదులే.
डैनिएल हैगरटी	డయానియల హెగరటీ
हाँ. जो भी हो.	హా, ఏదోకటిలే.
शायद उसे आखिरकार अपना मन हलका करके कुछ हद तक सुकून मिला.	నాకు చెపపాక, అతని గుండె బరువు వదిలినటటు అనిపించింది.
पुषटि करेगा कि उसने एरॉल को ही देखा था?	అతను చూసింది ఎరరొల నే అని పకకాగా చెపపగలడా?
मैंने अभी-अभी मुसतफा नाम गूगल किया था.	ఇందాకే ముసతఫా అనే పేరును గూగుల లో వెతికా.
पैटरिक, तुम यहाँ इस तरह आते नहीं रह सकते.	పాటరిక, నువవు ఇలా ఊరికే వసతూ ఉండకూడదు.
. . . किसी भी समुदाय में.	. . . అది ఏ వరగానికెనా సరే.
पूरी तरह से मना कर दिया था.	ఆ జఞాపకానని తుడిచివేశాడు.
तुमहें मेरा नाम कैसे पता?	మీకు నా పేరు ఎలా తెలిసింది?
और एरॉल मैथिस की फिकर करना बंद कर दो. मैंने वह मामला सुलझा लिया है.	ఇక ఎరరొల మయాథిస గురించి కంగారుపడటం ఆపేయ. అది పరిషకారమెపోయింది.
तुमहें नहीं पता तुम किससे उलझ रही हो.	మీరు దేనని గెలుకుతుననారో మీకు తెలీటలేదు.
कलॉडिआ मेहयू	కలాడియా మేహయూ
मुसतफा डेमिर	ముసతాఫా డెమీర
अगर कोई है जो तुमहें चेतावनी देने की कोशिश कर रहा है	ఆగంతకులు కొందరిని లకషయంగా చేసుకొని దాడులు చేసతూ,
सर, उस आदमी को कैसे पता चला कि मेरी कार वहाँ खडी थी?	సర, నా కారు పారక చేసి ఉందని అతగాడికి ఎలా తెలుసు?
- नहीं. मैंने तुम पर विशवास किया था. और तुमने कया किया? - यह. . .	- లేదు, నేను నినను నమమాను. కానీ నువవు ఇలా చేశావు! - అది. . .
- सूची में? - फलैट के लिए.	- జాబితానా? - ఫలాట కోసం.
तुम उनसे दूर रहोगी और तुम यह आज रात को ही करोगी.	తన దగగర నువవు ఉండకూడదు, ఆ ఫోన నువవు ఈరాతరికే చేయాలి.
अगर मुझे पता चला कि तुमने जानकारी साझा की है, कोई भी जानकारी, तो मैं कोई परहेज नहीं करूँगा.	ఆ విషయాలను, కొనని అయినా నువవు చెపపావని నాకు తెలిసిందనుకో, నువవు నా విశవరూపం చూసతావు.
मैं तुमहें बरबाद कर दूँगा.	నినను భూసథాపితం చేసేసతా.
धनयवाद. जैसा कि आप जानते हैं, आइजैक की हालत अब भी गंभीर है.	థయాంకయూ. మీకు తెలిసే ఉంటుంది, ఐసాక పరిసథితి ఇంకా విషమంగానే ఉంది.
हैलो. आप जाँच दल से बात कर रहे हैं.	హలో. మీరు విచారణ బృందానికి కాల చేశారు.
हाँ. माफ कीजिए, सर. यह बस एक और झटका है, समझे?	అవును. సారీ, సర. వేరే విషయం గురించి ఆలోచిసతుననాను.
- पैथॉलोजी रिपोरट. - हाँ.	- పాథాలజీ రిపోరట. - హా.
सीना तानकर अंदर जाओ. कोई नहीं हँसेगा.	వెళలి ధెరయంగా మాటలాడు. ఎవరూ నవవరు.
पर तुमहें सूचित करना मेरा करतवय है	కానీ నా బాధయతగా నేను మీకొకటి చెపపాలి,
माफ करना, मैं ब. . . मैं बस बडबडा रही हूँ और. . .	సారీ, నేను. . . నేను ఏదేదో వాగుతూనే ఉననా. . .
- कैसे पकष? - तुमहें पता है कि मैं तुमहें विवरण नहीं दे सकता.	- అందరి పటలా అంటే? - ఆ విషయం నేను చెపపలేనని నీకూ తెలుసు.
आपको कयों लगता है कि आप जिस महिला से मिली थी, यह फलायर वाली महिला वही है?	పాంపలెట లో ఉనన మహిళ, మీరు కలిసిన మహిళ ఒకకరే అని మీకు పకకాగా తెలుసా?
हाँ. धनयवाद.	హా. థయాంకస.
यही तथय हैं.	అవి నిజాలే.
तुमहारे पुराने बॉस को लगता है कि तुम इसतानबुल जाकर बस गए थे.	నీ పాత బాస, నువవు ఇసతానబుల కి వెళలిపోయావేమో అని అననాడు.
बस फोन करो.	ఫోన చేయవమమా.
हम आप पर हमला नहीं कर रहे हैं. बस शांत हो जाइए.	మేమేమీ మీపె దాడి చేయటలేదు. కాసత శాంతించండి.
- कया तुमने इसकी पुषटि की? - हाँ. हे भगवान.	- అది నువవు నిరధారించుకుననావా? - హా. అయయ బాబోయ.
- कया? - तुम और तुमहारे नए दोसत.	- ఏంటి? - నువవు, నీ కొతత సనేహితులు.
नहीं, हम तुमसे सूची मिलने का इंतजार कर रहे हैं. कयों?	లేదు, నువవు పంపే జాబితా కోసం మేము ఎదురు చూసతుననాం. ఏమెంది?
हेलपलाइन पर फोन करें.	హెలప లెన కి కాల చేయండి.
- सात बार. - सात बार.	- ఏడుసారలు. - ఏడుసారలు.
नहीं. आपका कया मतलब है?	లేదు. ఎందుకలా అననారు?
हम बस जानना चाहते थे कि उनकी योजना कया है.	వాళల వయూహం ఏంటో తెలుసుకోవాలననదే మా పలాన, అంతే.
- चलो भी. - और फिर अब, आज मैंने किसी पर दादागिरी की?	- ఏం మాటలాడుతుననావు? - ఇవాళేమో, ఏకంగా ననను రౌడీ చేసేశాడు.
ठीक है. तो, बेशक, तुमने उसे कारला के बारे में बताया?	సరే. అయితే, నువవే ఆయనకి కారలా గురించి చెపపుంటావు, అంతేనా?
पर तुमहारी माँ तीखा खा सकती थी.	కానీ అంత కారముననా మీ అమమ తినేసేది.
मुझे इस सबके लिए खेद है, पर यह मेरा फैसला था.	ఈ ఏరపాటలకి మననించాలి, నేనే ఈ పని చేయమననా.
तुमहें खुद से पूछना होगा, "उसने किसे फोन किया था? "	"అతను ఎవరికి కాల చేసి ఉంటాడు? " అనే పరశన మనం వేసుకోవాలి.
उनहोंने उनके वयसक जीवन के दौरान, हर दिन उनहें परेशान किया था.	అతడిని రోజూ చితరహింసలు పెటటి, అతని జీవితానని అతనికి కాకుండా చేశారు.
जेनी विटलो	జెననీ విటలో
इतने लंबे और सुंदर बनते देखकर.	చాలా పొడుగగా, అందంగా తయారెనందుకు.
दूसरे लडके का? चलिए भी. बेशक, मुझसे बदतर है.	వాడా? తెలీటలేదా? నాకననా దారుణంగా ఉననాడు.
हम कया करेंगे, मुसतफा?	ఏం చేసతావు, మొసతాఫా?
जून. मुझे पता है कि यह बहुत बडा झटका है.	జూన, నాకు తెలుసు, ఇవననీ దిగమింగుకోవడం కషటమే.
यह मेरी बेटी है, लीसा.	తను నా కూతురు, లీసా.
तुमहें कोई अंदाजा नहीं है कि कितनी कषति पहुँची है.	దాని వలల ఎంత నషటం జరిగిందో మీరు ఊహించను కూడా ఊహించలేరు.
सब ठीक है?	అంతా ఓకేనా?
तुमहें मुझ पर विशवास नहीं है. वो यह पहले भी कर चुका है.	మీరు నా మాటలని నమమటలేదు. అతనికి ఇది కొతతదేమీ కాదు.
एक पुरुष पुलिस ऑफिसर ने कारला के नाम से रहने वाली	ఆ ఆశరయంలో కారలా అనే పేరుతో చేరినవారు ఎవరెనా ఉననారా అని
हमारे पास चशमदीद गवाहों का बयान है कि उनहोंने तुमहें हथियार के साथ देखा था.	ఆయుధం నీ చేతిలో ఉండిందని కొందరు సాకషులు ఇచచిన వాంగమూలం ఉంది మా దగగర.
पर हतया की कोशिश के लिए नहीं.	కానీ హతయాయతనం మీద ఎపపుడూ కాలేదు.
तुमहारी दोसत, मेगन मारकल के साथ.	నీ సనేహితురాలు మేఘన మారకల తో.
देखो, मैं किसी मुसीबत में नहीं पडना चाहता.	చూడండి, నాకు సమసయలలో ఇరుకకోవాలని లేదు.
मुसतफा, कुछ है जो तुम मुझे बताना चाहते हो?	మొసతాఫా, నువవేమెనా చెపపాలనుకుంటుననావా?
- लीसा. - एक सेकंड.	- లీసా. - ఒకక నిమిషం.
- मैं उसे जानकारी देती हूँ. - जानकारी?	- నేను అతనికి కొనని చెపతాను. - కొనని అంటే?
जो मरजी कह सकती हो.	నీకు నచచింది చెపపుకో.
- माँ नाटक में हिससा लेती थी? - दरअसल, सभा में.	- అమమ నాటికలు వేసేదా? - నాటికలంటే అసెంబలీ చెపపేదిలే.
देखो. वह इसमें है. पीछे खडी है.	చూడండి. వెనుక పకకన ఉంది ఆమె.
ठीक है, ठीक है. तो मैं फोन करूँगी. वे शिकायत दरज करेंगे.	సరే. నేను కాల చేసతాననే అనుకుందాం. వాళలు ఫిరయాదు నమోదు చేసతారు.
- माँ. - कया हुआ? उसे जानने का हक है.	- అమమా. - ఏంటి? వీడికి కూడా తెలియాలి కదా.
हाँ, तो हम बस 28 तारीख, बुधवार को घटी	సరే, బుధవారం 28వ తేదీన జరిగిన ఘటన గురించి
कया हुआ? कया तुमहारी माँ को लेकर कोई तुमहें परेशान कर रहा है?	ఏమెంది? మీ అమమ విషయంలో ఎవరెనా నినను ఇబబంది పెడుతుననారా?
मैं यह जानना चाहता हूँ कि तुमहारे पास वह हथियार कहाँ से आया?	అది నీ దగగరికి ఎలా వచచిందో నేను తెలుసుకోవాలనుకుంటుననా.
अलबेनियन?	అలబేనియనా?
एरॉल. . .	ఎరరొల. . .
मुझे हर पकष के साथ निषपकष रहना होगा.	నేను అందరి పటలా నయాయంగా వయవహరించాలి కదా.
हाँ. हैगरटी को एक नाम मिला.	హా. హెగరటీకి ఆ పేరు తెలిసింది.
हम एक लडके को ढूँढने की कोशिश कर रहे हैं. वह टरकिश हो सकता है.	మేము ఒక కురరాడి కోసం గాలిసతుననాం. అతను టరకీకి చెందినవాడని ఊహిసతుననాం.
पुलिस हमेशा यहाँ आती रहती है.	ఎపపుడూ మీరు వసతూనే ఉంటారు.
तुमहें कार दुरघटना याद है?	నీకు కారు పరమాద ఘటన గురతుందా?
जिसे आदेश मानने के लिए रिशवत और धमकी दी गई.	ఒక 17 ఏళల పిలలాడి చేత పని చేయించుకుననారనే విషయం.
ठीक है, हासाड. तुम कितनी बार गिरफतार हो चुके हो?	సరే, హసాద. నినను ఎననిసారలు అరెసట చేశారేంటి?
देखो, मैं समझता हूँ. सच में. वह इस सथिति के लिए उपयुकत थी. मैं उसकी निंदा नहीं कर रहा.	చూడు, నాకు అరథమెంది. ఆ సందరభానికి తనే బాగా సరిపోతుంది. దానికి నేనేమీ అనటలేదు.
अंत में, सारे सबूत उसके विरुदध थे. उसके पास इनकार करने का कोई रासता नहीं बचा.	చివరికి, సాకషయాలననీ అతనే దోషి అని చూపిసతుననాయి. అతనికి బయటపడే అవకాశమే లేకుండా పోయింది.
वे किसी महिला को ढूँढ रहे हैं जिसके पास जानकारी है.	ఎవరో యువతి కోసం వెతుకుతుననారట, ఆమె దగగర ఏదో సమాచారం ఉందట.
लटीशा. हैलो, जान.	లటీషా. హలో, బంగారం.
तो, अगर ऑफिसर ने उसके नाम की वरतनी गलत लिखी हो तो?	అయితే, పోలీసు అతని పేరు విషయంలో తపపు సపెలలింగ రాసి ఉంటే?
पर वह कया कर रही है? वह कया चाहती है?	కానీ తనేం చేసతోంది? తనకేం కావాలి?
उसका नहीं. समझ रहे हो मैं कया कह रहा हूँ?	అతనిది కాదు. నేనేం చెపతుననానో అరథమవుతోంది కదా?
पुलिस ने कई तसवीरें दिखाकर उसे पहचानने को कहा था.	పోలీసులు నాకు అతని ఫోటోలు చూపించి గురతు పటటమని చెపపారు.
यह आपके बचचे के साथ भी हो सकता था. कोई बहाना नहीं. . .	ఇలా మీ బిడడకే జరగవచచు. ఇది మరోసారి జరగకూడదు. . .
वैसे. . .	అది. . .
सात बार.	ఏడుసారలు.
मैंने उसे देखा था. मैं उस महिला को जानती हूँ.	నేను ఆమెని చూశాను. ఆమె ఎవరో నాకు తెలుసు.
जानकारी?	సమాచారమా?
पता नहीं.	ఏమో మరి.
मुझे नहीं पता. शायद? पर, सोनया, चलो भी. बताओ.	ఏమో. చెపతాడేమో. కానీ, సోనియా ఒకటి చెపపు.
मुझे वह करने दोगे?	ఆ అవకాశం ఇసతావా?
या उनके मददगारों में से किसी ने.	లేదా ఆమె దగగర పని చేసే వాళలు కావచచు.
तुमने उसे बताया कि मैं तुमहारी मदद कर रही थी?	మీకు నేను సాయపడుతుననానని కూడా చెపపేశావా?
अगर कोई सवाल हो, तो कृपया हमें बताइएगा, ठीक है?	మీకు ఏవెనా సందేహాలుంటే, మాకు తపపక తెలియజేయండి, సరేనా?
- आठ. - पर मैंने केवल अचछी बातें बताईं.	- ఎనిమిది. - కానీ నేను మంచి విషయాలే చెపపాను.
हाँ, पर उसे सवीकार करने की जरूरत नहीं थी. उसने बस आसानी से हार मान ली.	హా, కానీ అతను ఒపపుకోవాలసిన పని లేదు. కానీ ఊరికే ఒపపేసుకుననాడు.
तो, यह इलाके के नियंतरण को लेकर है?	ఇది ముఠా తగాదాలకు సంబంధించినదా?
