अगर उस बंदे ने तुम पर बंदूक तानी हो.	సమరధిసతుంది మీ పెకి తుపాకీ గురిపెటటిన వయకతి.
"मैं इस सिसटम पर बात करना चाहता हूँ और यह कि यह अशवेतों के साथ कया करती है. "	ఈ వయవసథ, ఇది నలలజాతీయులకు చేసినదానిపె మాటలాడాలని అనుకుంటుననాను.
उसकी कही आखिरी बात थी, "अपनी गलतियों को सुधारो. "	ఆమె నాకు చెపపిన చివరి మాట, "నీ తపపును నువవు సరిదిదదుకో" అని.
ऑफिसर गराहम और जोनस ने अपने गुपत खबरी को	అధికారులు గరాహం మరియు జోనలు వాళళ రహసయ ఇనఫారమెంటను
और कहा हमें आंतरिक मामलों के विभाग से बात करनी है	అంతరగత వయవహారాల వారితో మాటలాడాలని అడిగాం
इस शरृंखला में गवाहों दवारा बताई गई बातों और अदालत की परतिलिपियों के आधार पर	ఈ సీరీసలో సాకషయుల ఙఞాపకాలు, ఇంకా కోరటు రాతపరతుల సేకరణల ఆధారంగా
जो हमारी करनी में हमारा साथ दे रहे थे,	మేము చేసేదానికి మదదతు ఇచచేవాళళు
यहाँ दिया विवरण मीक के शारीरिक विवरण से मेल नहीं खाता.	ఇకకడిచచిన వరణన మీక శారీరక వరణనతో సరిపోలలేదు.
कुल मूलय 3486. 00 डॉलर	మొతతం డబబు 3486. 00 డాలరలు.
"कया कभी ऐसा हुआ था कि तुमहें किसी भी गिरफतारी के दौरान कोई शक हुआ था?	"మీకు ఎపపుడెనా అతనని అరెసట చేయటంపె ఏమెనా అనుమానం వచచిందా?
पुलिस जाँच बोरड ने एकमत होकर उसकी बरखासतगी का फैसला लिया,	పోలీసు బోరడ ఆఫ ఇంకవెరీ ఏకగరీవంగా అతని దావా కొటటివేతకు సిఫారసు చేసింది,
तलाशी और गिरफतारी वारंट के लिए संभावित कारण	సోదా, నిరబంధన వారెంటకు సంభావయ కారణం
बाकी सब कुछ अपने लिए रख लेते और गाडी में आपस में बाँट लेते.	మిగతాది అంతా వాళళు ఉంచుకొని, కారులో పంచుకుననారు.
"उस पर कितना यकीन कर सकते हैं? "	"అతనని ఎంత వరకు నమమవచచు? "
जब तुम ऐसे इलाके में काम कर रहे हो जहाँ कई बार आना-जाना होता है.	అది ఆ పరాంతంలో ఎననోసారలు ఆ తనిఖీలు నిరవహించినా కూడా.
मीक को वापस घर में जाते देखना.	మీకను తిరిగి ఇంటలోకి వెళుతుంటే చూడటం.
न ही उससे मेल खाता था जो ऑफिसर गराहम ने मुकदमे में कहा था.	ఇంకా ఆఫీసర గరాహం చెపపిన దానికి కూడా సరిపోలలేదు.
यह हमारी कंपनी की अब तक की सबसे बडी तहकीकात है.	ఇది మా సంసథ ఎననడూ చేయనంత పెదద పరిశోధన.
मैंने रेजी गराहम के साथ जयादा काम नहीं किया है.	నేను రెజీ గరాహంతో ఎకకువగా పని చేయలేదు.
जो यह थी कि मीक ने पुलिस अफसरों पर बंदूक तानी थी या नहीं,	మీక పోలీసుకు తుపాకి గురి పెటటాడని చెబుతుననారో,
और आखिरकार मुझे कहना पडा,	చివరకు నేను ఇలా అనాలసి వచచింది,
यह रहा. यह है हमारा लडका.	అదుగో అకకడ ఉననాడు. అతనే మావాడు.
हमने उन सारे पुलिस अफसरों का पता किया जिनहोंने रेजी गराहम के साथ काम किया था.	మేము రెజీ గరాహంతో పని చేసిన పరతి ఒకక పోలీసు ఆఫీసరను కనుగొననాం,
आधिकारिक रिकॉरडों से हमें पता चला	ఆధికారిక రికారడుల పరకారం మేము నేరచుకుననది
उस समय के गिरफतारी रिकॉरड दिखाते हैं कि वह छह फुट का है.	అతనని అరెసట చేసినపపుడు, ఆరడుగుల ఎతతు ఉననాడని.
पोसट-कनविकशन रिलीफ के लिए मीक की अपील सुनेगी.	శికషానంతర ఉపశమనం కోసం మీక చేసిన అపపీలను విచారించబోతోంది.
मीक को रिहा करो!	మీకను విడుదల చేయండి!
मीक को रिहा करो!	మీకను విడుదల చేయండి!
मीक को रिहा करो!	మీకను విడుదల చేయండి!
यह रहा हेमबरगर. यह टवंटी सेकंड सटरीट है.	ఇకకడ హెంబరగర ఉంది. ఇకకడ 22 ఉంది.
हाथ ऊपर करो!	చేతులు పెకెతతు!
जो उसे नियमों के खिलाफ लगा हो.	ఏమీ చేయలేదు అని చెపపాడు.
पुलिसवाले पर बंदूक तानने की बात झूठी है.	పోలీసు అధికారికి తుపాకీ గురి పెటటటం పూరతిగా అబదధం.
मुझे मीक मिल की गिरफतारी का पता था,	నాకు మీక అరెసటు సంగతి తెలుసు
माइकल कोरड दंड बचाव वकील	మెఖేల కోరడ కరిమినల డిఫెనస లాయర
कि मीक ने भरी हुई बंदूक उन पुलिसवालों पर तानी थी	బులెటలు నింపిన తుపాకీని మీక తనకు వారెంట జారీ చేయటానికి వచచిన
उस समय, रेजी ने बताया कि उसका एक संदिगध बाहर है.	ఆ సమయంలో, రెజీ తన లకషయంలో ఒకరు బయట ఉననాడని నిరణయించుకుననాడు.
"इस बारे में कुछ करो. " और मैं बस वही करने में लगा हूँ.	"అందుకోసం నువవు ఏదెనా చేయాలి. " ఇంకా నేను. . . అందుకోసమే ఇకకడ ఉననాను.
इसका मतलब यह नहीं कि हम एक अहम गवाह के तौर पर उससे संपरक न करते,	దానరథం అతని దగగరకు వెళళి గరాహం గురించి మాటలాడటానికి
बहुत से बुरे लोग जेल जा रहे थे.	చాలా మంది చెడడవాళళు జెలుకు వెళుతుననారు.
बाकी रिपोरट पूरी करने के लिए निवासी की शिकायत दरज की - विलियमस नशीमा	మిగతా నివేదికను పూరతి చేయమంటునన పౌరులు - విలియమస నషీమా
तो, जो इस घर में हुआ था उसमें उसकी बहुत अहम भूमिका है.	అందుకే, అది ఈ ఇంటి దగగర జరిగిన పెనుగులాటలో చాలా ముఖయ పాతర వహిసతుంది.
उसने कभी भी कुछ ऐसा नहीं किया	తను నిబంధనలకు విరుదధంగా
यह एक परिवार की तरह है.	వీళళంతా ఒకే కుటుంబంలా ఉంటారు.
उसकी शिकायत दरज नहीं की.	రిపోరటు ఏం చేయలేదు.
और उस छापे के कारण लगे आरोपों तक पहुँचेंगे.	గురించి వాసతవాలను తెలియజేసే మారగం.
तो हो सकता था कि इसका फैसला कुछ और ही होता.	తీరపు వేరుగా వచచే అవకాశాలు ఉండేవి.
हथियार फेंक दो!	ఆయుధానని కింద పడేయ!
माफ करना. मुझसे गले नहीं मिले.	ఇలా చూడు, ఈ రోజు ననను కౌగిలించుకోలేదు.
बावन परतिशत पुलिस अफसरों का कहना है कि कानूनी अफसरों का दूसरे अफसरों की	52 శాతం పోలీసు అధికారులు చటట అమలు అధికారులు ఇతర అధికారుల
जिनके बारे में लोग बात नहीं करते,	జనం మాటలాడని కొనని విషయాలు
रेजी ने झूठा सबूत दिया था.	రెజీ తపపుడు సాకషయాలను సృషటించాడు.
शायद कई हजार केस वापस खोले जाएँगे	ఇంకా బహుశా ఎననో వేల కేసులు
जो मुकदमे के दौरान सबूत के तौर पर पेश की गई हो.	విచారణ సమయంలో ఆధారాలలో నమోదు చేయలేదు.
सबसे पहले तो, मीक कम से कम छह फुट लंबा है, है न?	ముందుగా, అది, అంటే. . . మీక కనీసం ఆరడుగుల ఎతతు ఉననాడు, అవునా?
नशे के सौदे वाला नुककड	మాదకదరవయ ఒపపందం జరిగిన మలుపు
नहीं! वे बस आम लोग हैं,	లేదు! వీళళు పరజలు,
ऐसा कुछ हुआ था या नहीं.	అది అసలు జరిగిందా.
जिला अटॉरनी की इस सवीकृति के आधार पर	ఈ అధికారుల విశవసనీయతపె గంభీరమెన పరశనలు ఉననాయని
सीधा उनकी जेबों में. बूम.	నేరుగా వాళళ జేబులలోకి. ఇలా, ఇలా.
कि कुछ बातों का जिकर तक नहीं था.	అది ఏదెతే వదిలేసిందో అదే.
आप साथ में काम करते हैं, साथ खाते हैं, साथ में मिलते-मिलाते हैं.	వీళళు కలిసి పనిచేసతారు, తింటారు, కలిసి తిరుగుతారు.
और वह उददेशय था लूटना और चुराना.	ఆ లకషయం ఏంటంటే అది దోపిడీ, దొంగతనం చేయటం.
इसका कोई मतलब नहीं निकलता, कयोंकि मीक ने उसे देख लिया होता.	అందులో అరథం లేదు, ఎందుకంటే వాళళను మీక చూడగలడు.
अदालत के एक ऑरडर ने फिलाडेलफिया जिला अटॉरनी को	ఫిలడెలఫియా డిసటరిక అటారనీని ఇబబంది పెటటిన అధికారుల జాబితాను
मतलब, यदि सच में वही है, तो यह बात तलाशी के वारंट में होनी चाहिए थी.	ఒకవేళ అది అతనే అనుకొని ఉంటే, అది సరచ వారెంటలో ఉండేది.
और उस अनयाय को ठीक करना चाहता है जो शायद उससे हुआ हो.	ఇంకా తను ఏదెనా అనయాయం చేసుంటే దానిని సరిదిదదుకోవాలని పరయతనిసతుననాడు.
उसने हमें बताया कि बतौर पुलिस अफसर,	అతను తను పోలీసు అధికారిగా ఎపపుడూ ఒకకసారి కూడా
तो मुझे बचे हुए बाल भी निकालने पडे.	అపపుడు నేను ఆ చివరి వెంటరుక ముకకలను లాగేశాను.
आपकी अपनी दो से पाँच लोगों की टीम होती है.	అందులో మీకు ఇదదరి నుంచి బహుశా ఐదుగురునన బృందం ఉంటుంది.
यह पूरे केस के मुखय तथयों में से है,	ఇది మొతతం కేసుకు ముఖయ విషయం,
पर अगर उसका बयान सही है कि उसके पास बंदूक थी,	కానీ అది అతను ఆ తుపాకిని కొంతమంది పోలీసులకు గురిపెటటటమననది
डीए ने 'न बुलाएँ' वाले अफसरों की सूची सारवजनिक की	డిఎ 'డునాట కాల' జాబితాను విడుదల చేశారు
उममीद फिर से जाग रही है.	ఒక ఆశలాంటిది మళళీ చిగురిసతోంది.
इस सबसे मेरे दिमाग में एक शक पैदा हुआ जो ठीक लगता है,	ఇవననీ అధికారులు చెబుతునన విధంగా చూసతుంటే,
एक तहकीकात की गई.	ఒక పరిశోధన జరిపించారు.
शायद उसमें से 50 से 60 लोगों का जवाब आया कि,	ఈ కథనానని చదివినవారు ననను అడిగారు,
कि रेजी से पूछें कि वह इस बारे में कया सोचता है.	ఏం అనుకుంటుననాడో అడగాలసిన బాధయత ఉంది.
-तकरीबन 30, 000 गायब थे. -शायद 30, 000 गायब थे.	-30 వేల డాలరల వరకు పోయాయి. -బహుశా 30 వేల డాలరలు పోయాయనుకుంటా.
पहले तलाशी वारंट तक,	ఆ తరువాత రాతరి జరిగిన సోదా
-तो. . . -यह मुमकिन नहीं लगता.	-అయితే. . . -హేతుబదధంగా అనిపించటం లేదు.
फिर वह मुडकर वापस अंदर जाने लगता है, और मैंने कहा,	అపపుడు అతను ఇంటలోకి తిరిగి వెళళిపోవటానికి వెనుతిరిగాడు, నేనననాను,
नशा रखने वाली जगह से बाहर नहीं आते और न ही उसी जगह वापस जाते हैं.	కొంచెం మోతాదులో అమమి తిరిగి దాకునన ఇంటలోకి వెళళరు.
तो उसे चुराना, यदि उस घर में चुराने के लिए कुछ भी हो.	దొంగతనం చేయటానికి, ఒకవేళ ఆ ఇంటలో అతనికి దొంగతనం చేయటానికి ఏదెనా ఉంటే.
मतलब, जनवरी 2007.	జనవరి 2007కి.
गराहम के बारे में बात करने के लिए.	పనికొచచే సాకషి కాదని కాదు.
मैंने उसको पुलिस अफसरों पर बंदूक तानते नहीं देखा था.	నేను ఎపపుడూ అతను పోలీసు అధికారులపెకి ఆయుధానని గురిపెటటినటటు చూడలేదు.
तो यह नामुमकिन है कि मीक मिल पुलिस अफसर को न पहचान पाए,	ఉననది పోలీస అధికారని గురతించకపోవటం అసాధయం,
जो हमसे बात करने को तैयार है.	మాతో మాటలాడటానికి ఇషటపడడవాడు దొరికాడు.
जो भरषटाचार और दुरवयवहार हो रहा था,	ఇలాంటి అవినీతి, దుషపరవరతన లాంటి వాటికి పాలపడటం
"या शायद तलाशी के समय वारंट न मिला हो,	"లేదా, మీరు సోదా చేసినపపుడు మీ దగగర వారెంట లేదేమో,
और अब, वह एक बेहतर जिंदगी जीने की कोशिश कर रहा है,	ఇపపుడు, అతను మంచి జీవితం జీవించటానికి,
और ऐसा कोई जिसे यूनिट के अंदर	ఇంకా ఎవరెనా పరతయేకించి
अब, हमें नयाय चाहिए था तो हम पुलिस सटेशन गए,	ఇపపుడు మాకు నయాయం కావాలి, అందుకే మేము పోలీసు సటేషనకు వెళళి
मैंने शरी विलियमस को अपनी बंदूक उठाते	నేను ఎపపుడూ విలియమస తుపాకితో
इस समय तक, समय की कमी का एहसास हो गया था.	ఈ సమయంలో, అతయవసర పరిసథితి ఉంది.
तो सोच सकती हूँ उनहें कैसा लगता होगा.	కాబటటి, నేను వాళళు ఏ సథితిలో ఉననారో ఊహించుకోగలను.
और इसलिए, बतौर छानबीनकरता हमारा करतवय है	అందుకే, పరిశోధకులుగా మనకు రెజీని అతను దీనంతటి గురించి
तो मैंने वहाँ से चले जाने का फैसला किया.	అందుకే నేను అకకడినుంచి వెళళిపోవాలని నిరణయించుకుననాను.
यही मैंने कहा था. मैंने कहा तकरीबन दो दरजन.	అదే నేను చెపపింది. రెండు చెపపాను. . . సుమారు రెండు డజనలు.
यह कि उसे भूले नहीं हैं.	అతనని మరచిపోలేదని తెలియచేసతుంది.
उस 20 डॉलर के नोट का सीरियल नंबर.	20 డాలరల పెన ఉనన వరుసకరమ సంఖయను రాసుకుననారు.
उसका उददेशय है अफसरों का एक ऐसा समूह बनाना	అవసరం అయినపపుడలలా, మాదక దరవయాలను మరియు మాదక దరవయ డీలరలను
हम बहुत सी बंदूकें बरामद करते थे.	మేము చాలా తుపాకులు వీధులలో దొరకబుచచుకుననాము.
और वे कहते हैं, "मुझे कोई परवाह नहीं, "	వాళళు, "నేను పటటించుకోను, " అని అంటారు, మీకు తెలుసా,
वह वहीं पर था, घर के बाहर खडा था,	అతను సరిగగా అకకడ ఉననాడు, అతను ఇంటి బయట ఉండగా
और कभी-कभार किसी तलाशी के वारंट पर काम करते हुए मिल जाते थे.	అపపుడపపుడు సరచ వారెంటల సమయంలో ఎదురుపడే వాళళం.
ने आपराधिक आचरण किया है, मानय है.	నేరంలో పాలుపంచుకుననాడనన ఆరోపణ నిరూపితమయింది.
जज बरिंकली के सामने हमारी सुनवाई है.	అవుతుందని మేం అనుకుంటుననాం.
मीक के केस के साथ अलग रवैया नहीं होना चाहिए.	మీక కేసును భిననంగా పరిగణించకూడదు.
वहाँ ऐसे लोगों के बचचे मिलने आए थे, जिनहें 10-20 साल की सजा हुई है,	తమ తండరులను 10, 20 ఏళళ తరువాత చూసిన పిలలలు ఉననారు,
"जायरीक ने कहा कि रॉबरट ने अपने हाथ खडे कर दिए और पुलिसवालों ने	"రాబరట తన చేతినిపెకి విదిలచాడు, అపపుడు పోలీసులు
यह कोई छोटी-मोटी चूक नहीं है, है न?	ఇది చినన తేడా కాదు, అవునా?
तो तलाशी के वारंट में अभियुकत की चोटियाँ होने की बात नहीं लिखी है,	సరచ వారెంటలో ముదధాయికి జడలు ఉననటటుగా ఉదహరించలేదు,
मीक उतने दिन जेल में रहेगा.	మీక జెలులోనే ఉంటాడు.
तलाशी के वारंट से लगता है कि ऑफिसर गराहम और ऑफिसर जोनस	సరచ వారెంట పరకారం అధికారులు గరాహం, జోనలు
बरैड बरिज सहायक वकील	బరాడ బరిడజ అసిసటెంట డిఫెండర
हम सोच रहे हैं, "उसकी मदद कैसे कर सकते हैं? "	మేము, "తనకు నిజంగా సహాయం చేయాలంటే ఏం చేయాలి? " అని అనుకుననాం.
खबरी अफसरों के पास लौटा और उनहें पुडिया दी	ఆ రహసయ ఇనఫారమెంట అధికారుల వదదకు తిరిగి వచచి దానని ఇచచాడు,
