मरीन?	మరీన?
तारा बनने के लिए नरम बनना पडता है.	సటార అవవాలంటే నువవు మృదువుగా ఉండాలి.
ठीक है, पीछे झुको.	సరే, వెనకకి వంగు.
जानवर डरे हुए थे.	జంతువులు భయపడడాయి.
अब भी लडकों जैसा.	ఇంకా అబబాయిలాగానే.
तुमहें छोडना ही होगा. मेरा दिल अनंतकाल तक तडपता रहेगा.	నువవు కావాలసిందే. నీకోసం నా గుండె తపిసతూనే ఉంటుంది.
"डूरंड की बेटी. "	"డయూరాండ కూతురు. "
जब मरीन ओली के साथ नाचती थी, तो वे हमेशा अववल रहते थे.	మరీన ఆలీతో డానస చేసేటపపుడు వాళళిదదరూ సదా నెంబర వనే.
मुझे बस जानना है कि यह कैसा लगता है.	ఎలా ఉంటుందో తెలుసుకోవాలనిపించింది.
पुरसकार बस एक है.	ఒకే ఒకక పరెజ ఉంది.
हमें सैरा के लिए कोई अंडरसटडी चाहिए.	సారా కోసం పరతయామనాయం వెతుకుతుననాం.
आपने घर कयों बेचा?	ఇలలెందుకు అమమావు?
मेरा इसतेमाल किया.	ననను వాడుకుననావు.
तो तुमने आने का फैसला कर ही लिया.	మొతతానికి కలుదదామని అనుకుననావననమాట.
शायद अब तुमहें घर भेज देना चाहिए.	ఇపపుడే నినను ఇంటికి పంపిసతే మంచిది.
मैं और ओली जब नौ साल के थे, तब उसने हमें बुलाकर हमारे साथ यही किया था.	ఆమె నననూ ఆలీని తొమమిదేళళపపుడు ఆఫీసులోకి తీసుకెళళి అదే పని చేసింది.
सच कहूँ तो जैसे हालात चल रहे हैं,	అంటే, నిజంగా, పరిసథితులను చూసతుంటే,
यहाँ हलकी और नजाकत से भरी बैलेरीना पसंद की जाती हैं.	వాళళు బాలెరీనాలు నాజూకుగా సొంపుగా ఉండాలనుకుంటారు.
कया हम दोसत हैं?	మనం సనేహితులమేనా?
तुम नहीं खरीदोगी?	నువవేం కొనటలేదా?
आप उसे जानती हैं?	నీకు తను తెలుసా?
वह तो दिख रहा है.	అది కనిపిసతుంది.
मैंने सच कहा था. या तो हम दोनों या फिर कोई नहीं.	నేను నిజమే చెపపాను. వసతే ఇదదరికీ లేదంటే అవసరం లేదు.
#9 कलोई #10 लिसा	#9 కలియో #10 లీసా
जयादातर जंगल में.	ఎకకువగా జంగిలలో.
आज रात इसे घर ले जाकर अपनी बिलली को खिला दूँगी,	ఈరోజు దీనిని ఇంటికి తీసుకెళళి నా పిలలికి పెడదామని.
कुछ हफतों बाद मेरे अंदर पल रहे बचचे की जान चली गई.	నాలో ఉనన జీవం కొదదివారాల తరువాత రకతంగా కారింది.
अराबेसक करो और दरवाजे की ओर मुडो.	అరాబెసక ఇంకా తలుపు వెపు తిరుగు.
नहीं, मैं उस बैंड का एक सदसय हूँ.	లేదు, నేను. . . బయాండతో వచచాను.
कहा था न. इस कमरे की किसी भी चीज को हाथ मत लगाना.	చెపపానుగా. నువవు ఈ గదిలో దేనినీ ముటటుకోకూడదని.
आप अचछा नाचे. यकीन नहीं होता आपसे बात कर रही हूँ.	మీరు అదభుతం. మాటలాడుతుననానంటే నమమలేకపోతుననాను.
बरडस ऑफ पैराडाइज	బరడస ఆఫ పయారడెజ
हे भगवान. रुको!	ఓరి దేవుడా. ఆగు!
उसका जुडवाँ भाई.	తన కవల సోదరుడు.
मगर यह पेरिस है.	కానీ ఇది పారిస.
यह ठीक तो है न?	తను బాగానే ఉందా?
और तुमहारी माँ?	మీ అమమ సంగతేంటి?
नजर लकषय की ओर.	లకషయం పెనే చూపు.
और वह चीख पडीं.	ఇక తను అరిచింది.
ठीक है. जाने दो.	సరే. వదిలెయయిక.
उसे लगा कि इससे मुझे जलन होगी.	నాకు అసూయ కలుగుతుంది అనుకుననాడు.
शायद यही सच है.	బహుశా నిజమేనేమో.
तुम नहीं समझोगी.	నీకు అరథం కాదు.
अब भी नाचती हो?	డానస చేసతుననావా?
बरडस ऑफ पैराडाइज	బరడస ఆఫ పయారడెజ
मैंने अभी एक नए डांस की कोरियोगराफी पूरी की है.	నేను కొతత భాగం ఒకదానికి రూపకలపన పూరతి చేసాను
कुछ मत सोचो. साँस लो. ऐसे ही.	ఆలోచించకు. గాలి పీలచుకో. అదిగో.
माफ करना कि तुमहारा बैग खंगाला.	నీ బయాగ వెతికినందుకు మననించు.
हैलो. कया मैं तुमहें जानता हूँ?	హాయ, ఎవరు. నువవు నాకు తెలుసా?
इन दस असाधारण युवा डांसरों का	ఈ పదిమంది అదభుత డానసరల పరదరశనను
उनहोंने हमें अलग किया और मुझे एक झापड मारा.	మా ఇదదరినీ లాగేసింది, ననను లాగిపెటటి కొటటింది.
जो एक पुल से कूद गया था, है न?	వంతెన మీద నుండి దూకాడు, కదా?
अपनी सहमति पर हसताकषर करो. . .	ఇకకడ సమమతపు సంతకం చెయయి. . .
अभी तुमहारा रैंक सबसे नीचे है.	పరసతుతానికి నీది ఆఖరి రయాంక.
कया तुम ठीक हो?	బాగానే ఉననావా?
एक साथ अभयास कैसे कर सकती हूँ?	ఒకేసారి నేను రిహారస చేయలేను.
वह ननही चिडिया फिर पलटकर उडी,	చినని పిటట తిరిగి ఎగిరింది,
जानती हूँ आपने उसे चुना होता.	మీరు తననే ఎంచేవారని తెలుసు.
पर उसने उस दरद को भुला दिया जिससे वह बच नहीं सकती थी.	కానీ అది నొపపిని మరిచిపోయింది అదిక తపపించుకోలేని నొపపిని.
संगीत बंद करो!	సంగీతం ఆపండి!
और उसमें से बस एक लडकी और एक लडके को पुरसकार मिलेगा.	అందులో కేవలం ఒకే ఒకక అమమాయికి ఇంకా అబబాయికి పరెజ ఇసతారు.
रसीले काषठफल.	పిండగల గింజలు.
फिर तो ठीक है, कयोंकि. . .	అంటే మంచిదిలే, ఎందుకంటే. . .
अपनी दोसत एम से पूछ सकती हो.	నీ సనేహితురాలు ఎంను అడుగు.
ऐसे ही, और हलकेपन से! शाबाश.	అదిగో తేలికయయారు! బావుంది.
वह हर तरह की चीज लेने लगा.	అననీ తీసుకోవటం మొదలుపెటటాడు.
आज आप पुरसकार नहीं जीत पाईं.	ఈరోజు నువవు పరెజ గెలవలేదు.
तो वह कौन थी?	అయితే, అదెవరు?
-आप सकूल से बात नहीं कर सकतीं? -वह तुमहारी विरोधी है न?	-నువవు సకూల వాళళతో మాటలాడలేవా? -తను నీకు పోటీ కాదా?
पूरी मेहनत करती रहो. सही काम करती रहो.	అతయుతతమం చేసతూ ఉండు. సరెన పని చేసతూ ఉండు.
मुझे कभी बताया कयों नहीं?	నువవు నాకు ఎందుకు చెపపలేదు?
वहाँ से गिरकर वह टूट सी गई.	ఆ పడటం బాగా గాయం చేసింది.
मैकडेमिया, सोया, नारियल, बादाम, काजू.	మకాడిమియా, సోయా, కొబబరి, బాదాం, జీడిపపపు
पर देवताओं ने उनकी परारथना अनसुनी कर दी.	కానీ దేవతలు వాటి పరారథనలు ఆలకించలేదు.
आप साथ में मिलकर रोमियो एंड जूलिएट का एक अंश चुनेंगे.	మీరు కలిసి రోమియో & జూలియటలో ఒక భాగం ఎంచుకుంటారు.
मेरी जूठन का सवाद कैसा है?	నా ఎంగిలి రుచి ఎలా ఉంది?
एम, रुको. . .	ఎం, ఆపు. . .
मैं लुक हूँ.	నా పేరు లయూక.
-माफ करना. -भार, वरजीनिया.	-సారీ. -బరువు, వరజీనియా.
इसमें से एक गैस निकलती है,	అది ఒక గయాసను వదులుతుంది
मेरी माँ अमरीकी राजदूत है.	మా అమమ అమెరికన అంబాసిడర.
समसया यह है कि मुझे तुमसे फिर मिलना है.	సమసయేంటంటే, నినను మళలీ కలవాలని ఉంది.
तो कैसा रहा?	ఎలా జరిగింది?
वह अब भी मुझसे खफा है कयोंकि फेलिपे ने उसे छोड दिया.	ఫిలిపే వదిలేసినందుకు తనింకా నామీద కోపంగానే ఉంది.
परेशान नहीं करना चाहता था.	నినను బాధ పెటటాలని లేదు.
मैं उसे यह लौटाने वाली थी.	తనకి తిరిగి ఇచచేయబోయాను.
उसने उडने में उसकी मदद की.	దానిని మళలీ ఎగిరించింది.
अब हम बस पाँच लोग बचे हैं.	కేవలం ఐదుగురుమే మిగిలాం.
पुरसकार के लिए दो दिन बाकी	పరెజకు రెండు రోజుల ముందు
मुझे और मजबूत बना दिया है.	అది ననను దృఢంగా చేసింది.
-एक बात बताती हूँ, वरजीनिया. -केट. मेरा नाम केट है.	-వరజీనియా, ఒక విషయం చెపపాలి. -కేట. నా పేరు కేట.
और कुछ करने को था ही नहीं. कोई नई खबर?	చెయయటానికి ఏం లేదు. కొతత విషయమేంటి?
पर शायद वह सुनने में थोडा अजीब लगे.	కానీ అది కొంచెం గగురపాటు కలిగిసతుందని.
हम तुमहें देख रहे हैं. तुम वहाँ हो.	నినను చూసాం. నువవు అకకడుననావని తెలుసు.
उन कमीनों ने तुमहारी छातरवृतति छीन ली.	ఆ వెధవ సకాలరషిప వెనకకి తీసుకుననాడు.
अगर पता होता कि वे किसी महिला डांसर को पैसे देंगे,	వాళళు మహిళా డానసరకి ఆ డబబులు ఇసతారని తెలిసుంటే
मैं शुकरिया कहने आई थी.	ధనయవాదాలు చెపుదామని వచచా.
एक बार अववल होने का यह मतलब नहीं कि तुम फिर से अववल बन जाओगी.	ఒకపపుడు నువవు నెంబర వన అయినంత మాతరాన మళళీ కావాలనేం లేదు.
बिलकुल नहीं.	అససలు ఆపను.
शायद बहुत दुख होता होगा.	చాలా బాధిసతుందేమో మరి.
तुमहारा भाई?	మీ సోదరుడా?
घुपप अंधकार.	కటిక చీకటి.
मैंने शहर के पास एक मकान ले लिया है.	టౌనకి దగగరగా అపారటుమెంటకు మారాను.
उसकी हडडियाँ टूट गई थीं.	దాని శరీరం దెబబ తింది.
कुछ भी. वादा करती हूँ.	ఏదెనా సరే. ఒటటేసతుననాను.
नाचने के लिए हमने गोलियाँ ली थीं.	మేము. . . డానస కోసం పిలస తీసుకుననాం.
तुम खुश दिख तो नहीं रही.	సంతోషంగా కనిపించటలేదు.
नहीं. उसकी चिंता मत करो.	వదదు. దానిని వదిలెయయి.
मिस सैंडरस,	మేడమ సాండరస,
तीन साल बाद	3 ఏళళ తరువాత
मेरा कोई रूममेट तो नहीं होना था.	రూమమేట గురించి నాకెవరూ ఏం చెపపలేదే.
बैले सटीकता और पूरणता का खेल है.	బాలే అంటేనే కచచితతవం ఇంకా పరిపూరణత.
यहाँ ईमानदारी जैसा कभी कुछ नहीं था.	ఇదెపపుడూ సమనయాయం ఉండే చోటు కాదు.
अगर सब ठीक रहा, तो यह पेरिस ओपेरा बैले में शामिल हो जाएगी.	అననీ సరిగగా జరిగితే తను పారిస ఒపేరా బాలేలో చేరుతుంది.
पुरसकार जीतने आई हूँ.	పరెజ గెలవటానికి వచచాను.
ठीक है, मुझे सचमुच. . .	సరే, నేను నిజంగా. . .
तुम एक बेमिसाल डांसर हो, चाहे रिबन हो या न हो.	నువవు గొపప డానసరవి, రిబబను ఉననా లేకపోయినా.
पता है यह कैसा लगता है.	అదెలా ఉంటుందో తెలుసు.
वे इसकी घोषणा कर देंगे.	టాప ఫెవను నిరణయించాక.
अगर तुमहें नापसंद करती, तो नाकाम हो जाने देती.	నాకు నచచకపోతే, నినను ఓటమికి వదిలేసేదానిని.
उसने बस पाँच साल पहले से नाचना शुरू किया है.	ఆమె కేవలం ఐదేళళ కరితమే డానస ఆరంభించిందట.
बासकेटबॉल?	బాసకెటబాలా?
ओली के लिए कर रही हूँ.	ఆలీ కోసం చేసతుననాను.
बिना इस कीडे के अंदर जाना मना है.	పురుగు లేకుండా ఎవవరూ వెళళలేరు.
मैडम बरुनेल तुमहें परख रही है.	మేడమ బరునెల నినను పరీకషిసతుందంతే.
बेमिसाल मुखय बैलेरीना बनने के लिए	పరఫెకట పరెమా బాలెరీనా అవవాలంటే
माफ करना, आपका फोन नहीं उठा पाती.	సారీ, నీ కాలస ఎతతలేకపోతుననాను.
लगता है मुझे जीतना ही होगा, है न?	అంటే, నేను గెలవాలేమో మరిక కదా?
जानती हूँ.	నిజమేననుకో.
यह बहुत मायने रखता है.	మీ రుణం తీరచుకోలేను.
मैं और ओली.	ఆలీ, నేనూ.
-लेकिन. . . -लेकिन कया, मेरी जान?	-కానీ. . . -కానీ ఏంటి, బంగారం?
कया सच है?	ఏంటి నిజమా?
तो आपको इस मंच को छोडकर जाना होगा	మీరు వేదిక వదిలేసి బయటకు వెళళి
ओली के पुरसकार का कया?	ఆలీ పరెజ సంగతి ఏంటి?
पलीज, मुझे जानना है.	దయచేసి, నాకు తెలియాలి.
तो तुम अब तक यहाँ कया कर रही हो?	అయితే ఇంకా ఇకకడేం చేసతుననావు?
इससे पहले वह बासकेटबॉल खेलती थी.	ముందేమో తను బాసకెట బాల ఆడేదట.
मैं देखूँगा नहीं, वादा करता हूँ.	నేను చూడను. అసలు చూడను, ఒటటు.
सुना है वह बाहर होने के करीब है.	కొంచెం పరాకుగా ఉందని విననాను.
और बडे लोगों में शुमार हो जाओगी?	నువవు హె కలాస అయిపోతావా ఏంటి?
एक बार फिर पूछती हूँ.	ఇంకోసారి అడుగుతాను.
तुम बहुत बडी झूठी हो.	నువవో అబదధాలకోరువి.
-मैं कोई. . . -झूठ.	-నేను చేయ. . . -సోది.
तुम आलू की बोरी जैसी लग रही हो.	బంగాళాదుంపల బసతాలాగా ఉననావు.
यह बोझ हमें ढोना ही पडता है.	మనం గుండెలో మోసే పెదద రాయి అది.
इसीलिए उसका रैंक पहले जितना अचछा नहीं है.	అందుకే తన రయాంక ఇంతకుముందంత బాగాలేదు.
यह कया था?	ఏంటి అది?
तुम एक डांसर हो. . .	నువవు డానసరవి. . .
वह कौन है?	తను ఎవరు?
तो यह आखिरी छातर था?	వాడేనా చివరి ఎలుక?
मैं ऐसा नहीं करूँगी.	నేనలా అససలు చేయను.
-वह सुंदर थीं. -हाँ.	-తను అందగతతె. -హా.
हैलो, डैड.	హే, నానన.
उसकी रिबन.	తన రిబబన.
बढिया, मिस सैंडरस!	మంచిది, మిస. సాండరస!
मुझे बस यही चाहिए.	అదే నేను కోరుకొనేది.
हैलो. केट.	హాయ. కేట.
तुमहारे पास उसका नंबर कैसे है?	తన ఫోన నెంబర నీకెలా తెలుసు?
अभी नहीं.	ఇంకా లేదు.
कया मतलब?	అంటే అరథం?
यह सच है.	కానీ నిజం.
जानवर बुरा बरताव कर रहे थे.	జంతువులు చెడుగా పరవరతిసతుననాయి
एक विदेशी छातर के तौर पर शामिल होने की छातरवृतति.	విదేశీ విదయారథినిగా ఉండటానికి నీకు సకాలరషిప.
यह कमरा तब से मेरा है, जब मैं आठ साल की थी. देखो.	అంటే, నాకు ఎనిమిదేళళ నుండి ఇది నా గదే. చూడు.
शायद तुम कुछ चीजों में मेरी मदद कर सको.	నువవు నాకు కొననింటిలో సహాయపడతావేమో.
ओली, हाँ. वही डांसर न जो. . .	ఆలీ, హా. తనికకడ డానసర. . .
कया तुमहें मुझे कुछ बताना है?	నాకేమననా చెపపాలసింది ఉందా?
गुड नाइट, जिया. अचछे से सोना!	గుడ నెట, జియా. బాగా పడుకో!
मैं तीन तक गिनूँगी.	మూడు లెకకపెడతాను.
मेरी हर छोटी-मोटी गलती पकड ली जाती है.	నావరకూ చినన తపపు కూడా పటటుకుంటారు.
कई तरह के दूध का.	పాలకు సంబంధించినవి.
हद में रहो, मरीन.	మరీన, హదదులలో ఉండు.
आसमान में उड चली.	ఆకాశానికి ఎగిరింది.
कंबल में अपनी चोंच से सूराख न कर डाला.	తన ముకకుతో దుపపటికి బొకక పెటటింది.
वह बहुत दरद में थी.	చాలా బాధలో ఉందది.
अचछे से सोना, जिया!	బాగా పడుకో, జియా!
यह बेशक चुनी जाएगी.	కచచితంగా ఉంటుంది.
उसे जो भी मिल जाता.	ఏది దొరికితే అది.
तुमसे घिन आती है.	కంపరం నాకు నువవంటే.
तुम बहुत अचछा नाची.	చాలా బాగా చేసావు.
पिछले पतझड में तुमहारे जाने के बाद जिया नंबर एक पर आ गई.	పోయిన శిశిరంలో నువవు వెళళాక, జియా నెంబర వన అయింది.
अगर तुम गई, तो अपने बलबूते जीना होगा.	నువవు వదిలేసతే కనుక నీ దారి నీదే.
