जब आते, तो कुछ हफतों या महीनों के लिए रहते और फिर चले जाते, और. . .	ఒకేసారి కొనని వారాలో లేక నెలలో ఉండేవాడు, తరువాత వెళళిపోయేవారు, ఇంకా. . .
अचछा, ए, रुको.	సరే, హే, ఆగు.
कानून शायद वाकई में अंधा है.	చటటం నిజంగా గుడడిదనుకుంటా.
-कया कह रहे हो? -मुझे अपने करीब लाने की कोशिश कर रही हो.	-ఏం అంటుననావు? -నిననిషటపడేలా చేసుకోవాలని చూసతుననావు.
हाँ, बिलकुल नहीं दोहरा सकते.	అవును, చేయకూడదు, ఖచచితంగా.
बिशप के सेल फोन रिकारड से काफी मदद मिलेगी.	బిషప సెల ఫోన రికారడులు చాలా ఉపకరిసతాయి.
अभी तक आप लोग परतियोगी थे,	ఇపపటి వరకు, మీరు పోటీదారులు,
देखते हैं और कया मिलता है.	మనం ఇంకేం కనుగొనగలమో చూదదాం.
बस एक गलती थी.	కేవలం తపపిదం.
अगर तुम चुगली नहीं करती, तो डरने वाली कोई बात नहीं.	ఎవరిపెనా గూఢచరయం చేయకపోతే, దాని గురించి ఏం భయపడకకరలేదు,
तुम बताओ. तुमहें देख मुझे पसीना आ रहा है.	ఆ విషయం చెపపు. నాకు చెమటలు పోసతుననాయి.
यहाँ इतना अंधेरा कयों है?	ఇకకడ ఎందుకింత చీకటిగా ఉంది?
हैलो! हम अभी भी अंदर हैं!	హలో! మేము ఇంకా లోపలే ఉననాం.
आखिरी वाला सडा हुआ अंडा होगा! इतना सुसत!	చివర వచచేవారు పిచచివాళళు! అంత నెమమదా!
पूरे राजय में सबसे अचछी बैरल रेसर, शायद पूरे देश में.	రాషటరంలో ఉతతమ బారెల రేసర, జాతియ సథాయిలోనూ ఉండేది.
पैसे लाए हो?	డబబు తెచచావా?
कभी-कभी. . .	ఒకకోసారి. . .
मैं गणित में माहिर नहीं.	నాకు లెకకలు అంత బాగా రావు.
खासकर वे बचचे जो कुछ छुपाना चाहते हैं,	ముఖయంగా ఏదో దాచాలని అనుకునన పిలలలు,
टरांसफारमर खराब हो गया?	టరానసఫారమర పేలిపోయిందేమో?
भले ही वे पेडों पर रहे.	వాళళు ఆ చెటలలలో ఉననా సరే.
खेल खेलना अचछे से आता है.	నువవు ఆటలు బాగా ఆడతావు.
उसकी एक खूबसूरत पतनी और तीन बचचे थे, जो काफी खुश रहते थे,	అతనికి అందమెన భారయ మరియు ముగగురు సంతోషంగా ఉనన పిలలలు ఉండేవారు,
डॉज 175 अंकों के साथ थोडा ही पीछे है.	డాడజ 175 పాయింటలతో సమీపంలో ఉననాడు.
कया मतलब? गलती से उसकी तरफ मुड गई?	అంటే ఏంటి? అతనికి తపపుగా ఎదురుపడడావా?
-मदद करता हूँ. -उन तक नहीं पहुँचा.	-సాయం చేయనీ. -వాళళను తీసుకురాలేకపోయా.
पर उसने जो जमीन पसंद की, वह अभिशपत मानी जाती थी.	కానీ అతను ఎంచుకునన సథలం శాపగరసతమని నమముతారు.
और मुझे लगा कि बिशप मेरे नकशे कदम पर नहीं चलेगा.	ఈ విషయంలో బిషప నాతో కోరటు గదిలో ఉంటాడనుకోను.
होना चाहिए.	అయి ఉంటుంది.
तुम जो मरजी कहो, हेदर.	నువవు ఏమెనా అనుకో, హేథర.
हमें निकलना होगा. अभी!	మనం వెళళిపోవాలి. ఇపపుడే!
नैटली, मुझे बाहर निकालो!	నాటలీ, ననను బయటకు తియ!
हमने गरेनरी का फुटेज पूरा देख लिया.	ధానయాగార ఫుటేజీని చూడడం అయయింది.
शायद यह कोई चेतावनी है.	బహుశా అది హెచచరికేమో.
घर काफी डरावना लगता है.	ఈ ఇలలు భయంకరంగా ఉంది.
इसकी आँखें हिल रही हैं.	తన కళళు కదులుతుననాయి.
तुमहारे पास ढंग का काम नहीं है?	నీకు చేయడానికి ఇంకే మంచి పని లేదా?
तुमहें कया चाहिए, एंडरयू डॉज मेसन?	నీకు ఏం కావాలి ఆండరూ డాడజ మేసన?
"पाँच खाने पर, छह देर से. . . "	"భోజనానికి ఐదు, ఆలసయంగా ఆరు. . . "
एक-दूसरे को अनदेखा करना बंद करो. बहुत हो गया.	మీరు పరసపరం విసమరించుకుంటూ ఉండకూడదు. ఆగు.
हैलो, बेटा.	హే, పాపాయ.
पापा रोडियो विजेता थे.	నానన రోడియో ఛాంపియన.
एक हफते तक.	వారం పాటు.
अचछा, देखो.	సరే, చూడు.
कयों न हम उस तरफ चलें?	మనం అటువెపు వెళదామా?
हमें साथ रहना चाहिए.	మనం కలిసికటటుగా ఉందాం.
कोई हतयारा, ताकि खुद अपने हाथों से तुमहें न मारना पडे?	హంతకుడినెనా, అపపుడు నేను నినను సవయంగా చంపకకరలేదు?
मुझे दरअसल लगा कि वह मुझे पसंद करता है.	అతను నిజంగా ననను ఇషటపడుతుననాడని అనుకుననాను.
तो, पहले पैनिक खिलाडी ने गरेबिल के भूत को पुनरजीवित किया,	హే, అయితే, మొదటి పానిక ఆటగాడు గరేబిల ఆతమను పునరుజజీవింప చేశాడు,
मैंने आपको देखा नहीं.	నేను నినను చూడలేదు.
पता नहीं, वह अपनी दुनिया में फँसी हुई हैं.	తెలియదు, ఆమె ముందుకు కొనసాగలేకపోతుంది.
पर कमबखत किसे पता है?	కానీ ఎవరికి తెలుసు?
वह अभी तक ठीक ही रहा.	ఇంత దూరం రాగలిగాడు.
खून हमेशा बताता है.	రకతం ఎపుడూ చెబుతుంది.
बस थोडा सा घबरा गई.	కొంచెం భయపడడాను అంతే.
"हाथों के पीछे. . . "	"చేతుల వెనుక. . . "
"हाथों के पीछे. . . "	"చేతుల వెనుక. . . "
"हाथों के पीछे. . . "	"చేతుల వెనుక. . . "
हम अभी भी अंदर हैं!	మేమింకా ఇకకడే ఉననాము!
अचछा, ठीक है. मैं मानती हूँ.	అంటే, సరే, మంచిది. ఒపపుకుంటాను.
मुझ पर एक एहसान करो. अपने बॉयफरेंड से कहो पीछे हटे.	నాకో సహాయం చెయ. నీ బాయఫరెండను వెనుకకు వెళళమను.
ए, जूली, गरेबिल हाउस में जो हंगामा हुआ, उसे देखने जा रहा हूँ.	హే, జూలీ, నేను గరేబిల హౌసలో ఆ గందరగోళం ఏమిటో చూసొసతాను.
मेरी पूरी जिंदगी, किसी ने मुझसे यह सवाल नहीं पूछा.	నా జీవితంలో ఎవరూ ఇంతవరకూ ఆ పరశన ననను అడగలేదు.
और मुझे डर है कि मैं उसे दोहराती रहूँगी.	నేను అది చేసతూనే ఉంటానని భయంగా ఉంది.
तुम कया कर रहे हो?	నువవు ఏం చేసతుననావు?
कया मतलब?	అంటే ఏంటి?
अपने दुख में उसने घंटाघर में खुद को फाँसी लगा ली.	దుఃఖంలో, అతను ఘంట సతంభానికి ఉరి వేసుకుననాడు.
और हमें लगता है कि बिशप उनमें से एक है.	బిషప అందులో ఒకడని మేము నమముతుననాము.
एक बात कहूँ? शायद तुम पैनिक जीतोगी.	ఒకటి చెపపనా? బహుశా నువవు పానిక గెలవచచు.
समझ रहे हो? झाँसा देकर पकडना?	నీకు తెలుసా? ఎరవేసి పటటడం?
मतलब, बडा ताला लगा हुआ है!	దీనిని తాళంకపపతో తాళం వేశారు!
तो जब तक टंकी में पानी है, जलदी से नहा लो.	అందుకని టయాంకులో నీళళు ఉండగానే తవరగా సనానం చెయ.
खुश हूँ कि मुझे हमेशा अचछा महसूस कराती हो.	నా మనసును ఎలా ఆహలాదపరచాలో నీకు తెలియడం నాకిషటం.
तुमहें यह लगता है कि. . .	నీకు అనిపించడం లేదా అది. . .
यहाँ से निकलना होगा, वरना घुसपैठ के लिए गिरफतार करूँगा.	ఇకకడినుండి వెళళు, లేదంటే అతికరమణకు అరెసట చేసతాను.
गरदन वाली रससी को थोडा ढीला छोडो. ठीक है? सही है.	ఆ మెడకు కటటిన తాడు కాసత వదులు చేసతాను. బాగుందా? మంచిది.
हाँ, चलो!	సరే, రా!
तुम अपनी माँ के करीब हो?	మీ అమమతో సననిహితంగా ఉంటావా?
-उनहें पहचान नहीं पाए? -नहीं, हमें वे नहीं मिले.	-మీరు వాళళని గురతించలేకపోయారా? -లేదు, కనుగొనలేకపోయాము.
माफ करना जो लीला के साथ अजीब तरीके से पेश आई.	కషమించు, లీలా విషయంలో వింతగా పరవరతిచాను.
मैं. . . यहाँ. . . अकेला रहूँगा.	నేను. . . ఇకకడే ఉంటాను. . . ఒకకడినే.
सबको शुभकामनाएँ.	అందరూ బాగా చేయండి.
तुमहें शाप से डर नहीं लगता?	నీకు శాపం అంటే భయం లేదా?
किसी को बुलाऊँ? मनोचिकितसक को? पुलिस को?	ఎవరినెనా పిలవనా? మానసిక వెదయుడిని? పోలీసులను?
यह देखो.	ఇది చూడు.
धत तेरी! लिटल बिल?	అయయో! లిటిల బిల?
-धयान से. -अचछा. इसे नीचे बिठाओ.	-జాగరతత. -సరే. అతనని కిందకు దింపండి.
तुम अभी भी. . . बिशप को लेकर परेशान हो?	నువవు ఇంకా నిరాశగా ఉననావా. . . బిషప విషయంలో?
हे भगवान, मैं कितनी बेवकूफ हूँ!	ఓహ, ఛ, దేవుడా, నేను ఎంత పిచచిదానని!
अब जब वह एकदम अकेला है?	ఇపపుడు ఒంటరిగా ఉంటుననాడనా?
मैं 911 को फोन कर रहा हूँ.	నేను 911కు ఫోన చేసతాను.
अपनी बडी बहनों के बाहर जाने पर चुगली करतीं.	చిననపిలలలను గరేబెల లాకకెళళాడని అననావు.
तुमहें कया चाहिए?	నీకు ఏం కావాలి?
बिशप जज है कया?	బిషప నయాయనిరణేతా?
मैं जा रहा हूँ.	నేను వెళుతుననాను.
सच में घटिया जगह.	చాలా చెతత చోటు.
उनहोंने कहा कि नहीं मारी.	ఆయన కాలచలేదని చెపపారు.
मेरे कोई दोसत नहीं थे.	నాకు ఎవరూ సనేహితులు లేరు.
वेग के साथ बह रहा हूँ.	పరవాహంతోపాటు వెళుతుననాను.
तुम अंधविशवासी तो नहीं हो न, डॉज?	నీకు మూఢనమమకాలు లేవుగా, డాడజ?
और दूसरी कलास के पहले दिन, हेदर ने कहा कि उसे मेरा टैटू अचछा लगा.	సెకెండ గరేడ మొదటి రోజు, హేథరకు నా టాటూ నచచిందని చెపపింది.
गरेबिल उन लडकियों को पकडता था जो	తమ సోదరీమణులపె గూఢచరయం చేసిన
घुसपैठ.	అతికరమణ.
यह आखिरी बार है.	ఇదే చివరిసారి.
मेरे पापा सेरविल में हैं, हमेशा से वहीं रहे हैं.	మా నానన సెరెవిలలో ఉననారు, నా జీవితం మొతతం.
पता है मुझे कया पसंद है?	నాకు ఏం ఇషటమో తెలుసా?
यह अजीब सा बकसा देखो.	ఈ విచితరమెన బాకసను చూడు.
घुसपैठ? जो लोग असल में गडबड करते हैं, उनहें जाकर पकडिए.	అతికరమణా? అసలు నేరసతుల వెనుకపడి ఎందుకు పటటుకోరు?
"मरे हुए के अंदर सुराग. " शायद हमें लाशों को ढूँढना है?	"మరణించిన వారిలో సూచనలు. " మనం శవాలను కనుగొనాలా?
यहाँ पर खून है. किसी और को खून से डर लग रहा है?	అదిగో రకతం. ఇంకెవరెనా రకతం చూసి భయపడడారా?
संवाद अनुवादक परवीन कौर शोम	ఉపశీరషికలు అనువదించినది కరత సమత
अचछा, खेल खतम करते हैं.	సరే, మనం ఇది చేదదాం.
एमा कैंपबेल एडी डगलस	ఎమమా కయాంపబెల ఎడడీ డగలస
जलदी से सोचो!	తవరగా ఆలోచించు!
मजाक नहीं है.	నిజంగా అంటుననా.
उनहोंने रेंजर को गोली मारी थी?	మీ నానన ఆ రేంజరను కాలచారా?
नैटली के साथ गरेजुएशन पूरी की.	నాటలీతో గరాడయుయేషన చేశాడు.
अगर तुमहें डर है कि मुझसे पयार हो जाएगा, तभी.	నువవు నాతో పరేమలో పడిపోతానని భయపడితేనే.
अचछा मजाक था.	బాగా అడిగావులే.
और उनहें घर की दीवारों में दफना दिया.	వాళళను ఇంటి గోడలలో పాతి పెటటాడు.
-नहीं! रुको! रे, रुको! रुक जाओ! -कया?	-వదదు! ఆగు! రే, ఆగు! ఆగు! -ఏంటి?
नियम एकदम आसान हैं.	నియమాలు చాలా సరళమెనవి.
-धत तेरी. -अगर बिशप कुछ छुपा रहा है,	-ఛ. -కానీ బిషప ఏదెనా దాచి ఉంటే,
और वह कारप में एक बडा सा घर बनाना चाहता था.	అతను కారపలో గొపప ఇలలు కటటాలనుకుననాడు.
कुतते की तरह दुम हिलाता हुआ आया, बोला कि मेरी याद आती है.	తోకలేని కుకకలా బాధగా వచచాడు, నేను గురతొసతుననానంట.
रोष में आकर, उसने अपनी पतनी और बचचों को मार डाला,	కషణికావేశంలో, అతను తన భారయాపిలలలను చంపేసి,
कोशिश करोगी?	నువవు చేసతావా?
बस एक?	ఒకటేనా?
पूरी करने के लिए आप सबको बधाई.	సవాలు పూరతి చేసినందుకు శుభాకాంకషలు.
कया पता कब जरूरत पड जाए?	ఎపపుడు అవసరం పడతాయో తెలియదు.
मैं ठीक हूँ.	బాగానే ఉననాను.
ऐसे वादे नहीं करता जिनहें पूरा न कर पाऊँ.	నేను నిలబెటటుకోలేని పరమాణాలు చేయను.
बूझ लेगा, उसे 50 अंक फालतू मिलेंगे.	రకతంలో రాయబడిన పొడుపు కథలను విపపినవారికి.
मुझे लगता है इस हद तक फँस चुकी हैं	ఆమె, బహుశా అకకడే ఉండిపోయింది,
शायद जज काफी कुछ छुपा रहा है.	నయాయమూరతి ఖచచితంగా ఏదో దాసతుననాడు.
शायद हमें किताबों में देखना चाहिए.	బహుశా మనం పుసతకాలలో చూడాలేమో.
हमेशा कुछ न कुछ साथ लेकर चलता हूँ.	నేను ఎపపుడూ నిలవ ఉంచుకుంటాను.
तुमहें अपना लिंग कैसे मिलेगा?	అయయో నీకు నీ అంగం ఎలా కనిపిసతుంది?
शायद सुराग रसोई में हो?	బహుశా వంటగదిలో సూచన ఉందేమో?
एक-दूसरे को मुसीबत में डालना अचछा रहेगा.	విదరోహానని పూరతిగా పరోతసహిసతుననాం.
दीवारों पर कुछ नहीं.	గోడల పెన ఏం లేవు.
यार! कोई मदद करो!	అందరూ! సహాయం చేయండి!
उस घर में कई सारे राज होंगे.	ఆ ఇంటలో చాలా రహసయాలు ఉండి ఉండాలి.
वे लोग जो इस खेल में मारे गए हैं.	వీళళంతా ఆటలో చనిపోయిన వాళళు.
बेवकूफ भी है.	మూగది కూడా.
मैं बस, मुझे हैरानी हुई थी.	నాకు కేవలం, ఆశచరయమేసింది తెలుసా?
और फिर पता चला कि वह हंटसविल में ही रहते थे.	చూసతే అతను ఎపపుడూ హంటసవిలలోనే ఉననాడు.
और आखिरी पर अहम बात, जो खून वाली पहेलियों को	చివరాఖరుకు ముందుగా, 50 పాయింటలు అదనం,
पर, बुलाने के लिए शुकरिया.	ఏదేమెనా, ధనయవాదాలు, ఆహవానానికి.
वह जो भी करता, उसका आधा तो. . .	అతను చేసిన పనులలో సగం. . .
शाम तक ही बाहर रहना, समझे?	చీకటి పడేలోపు ఇంటికి రా, సరేనా?
मैं कुँवारी नहीं हूँ, ठीक है? सच में.	నేను కనయను కాదు, సరేనా? నిజంగా.
जो टेकसस का सबसे अमीर आदमी था.	సామయూల గరేబిల అనే ధనికుడు ఉండేవాడని.
शेरी, मैं अभी आया. बीयर लाने जा रहा हूँ.	షెరీ, నేను ఇపపుడే వసతాను. వెళళి బీర తీసుకొసతాను.
हमने जो किया उसके लिए माफी चाहते हैं	మేము చేసినదానికి చింతిసతుననాము
बीस सेकंड.	ఇరవె సెకనలు.
तुमहारे पिता को कया हुआ?	మీ నాననకు ఏం అయింది?
कोई हमें नहीं देख पाता. हम अदृशय थी.	మమమలని ఎవరూ చూడలేరు. అదృశయులం.
कोरटेज, एक समसया है.	కోరటెజ, ఒక సమసయ వచచింది.
इस समय, हम बस कुछ सुरागों की जाँच कर रहे हैं.	అంటే, పరసతుతానికి, మేము కొనని ఆధారాలను అనుసరిసతుననాము.
बारिश हो, ओलों की बारिश हो या तेज गरमी हो.	వరషంలో, మంచు పడుతుననా, వేడిగా ఉననా.
हाँ, जैसा कि मैंने फोन पर कहा.	అవును, సరే, నేను ఫోనలో వివరించానుగా.
यहाँ.	ఇదిగో.
नहीं, मैं ठीक हूँ.	లేదు, పరవాలేదు.
ताकि उसकी खूबसूरत पतनी और बचचे उसके लिए दरवाजा खोलें.	అపపుడతని చకకని భారయ, పిలలలు తలుపు దగగరకొచచి అతనిని పలకరించేవారు.
