शायद मैं तुम जैसी दिखने लगूँ.	చివరకు నేనూ నీలాగే మారవచచు.
एक पुरानी मेकसिकन कहावत है:  "बदसूरत, मजबूत और औपचारिक. "	ఓ మెకసికన సతోతరం ఉంది:  "ఫెయో, ఫుయెరటే, యి ఫరమాల. "
- तो आए ही कयों? - सच कहूँ तो, पता नहीं.	- మరెందుకు వచచావు? - నిజం అయితే, నాకు తెలియదు.
रचनातमक परयवेकषक अशोक बकषी	కరియేటివ సూపరవెజర శిరీష దరభా
तो तुम यहाँ हो. लगा था यहीं होगे.	ఇకకడ ఉననావు. ఇకకడే ఉంటావని అనుకుననాను.
वॉलट 32 के रिकॉरड ला रहे हैं. . .	వాలట 32 రికారడులు యాకసెస చేసతోంది. . .
कोई बात नहीं. जो कहें. मुझे खुशी हुई. कया. . .	అససలేమీ సమసయ లేదు. ఏదెనా సరే. నాకు సంతోషం. ఏమిటా. . .
कयों जी रहे हो?	ఎందుకు బతకడం?
उसके साथी ओवरसियर मॅकलीन को कयों ले गए,	ఓవరసీర మెకలీనను తన సహచరులు ఎందుకు అపహరించారో,
कुछ नहीं बताया?	ఏమీ చెపపలేదా?
- हैलो. - हैलो.	- హేయ. - హేయ.
अंदर, ये चूहें सारी सुविधाओं का मजा लेते हैं.	లోపల, అనని సౌకరయాలను ఎలుకలు ఆనందిసతాయి.
पर तुम जैसी बनूँगी नहीं.	కానీ నీలాగా ఎననటికీ ఉండను.
वॉलट वाली, यहाँ कुछ भी साफ नहीं रहता.	ఇకకడ శుభరం చోటలు లేవు, వాలటవాసి.
- घर से निकलने का मन है? - जरूर.	- ఇంటి నుంచి బయటపడాలని ఉందా? - అవును.
- धनयवाद, सनिप-सनिप. - माफ करना.	- ధనయవాదాలు, సనిప సనిప. - ఏమనుకోకండి.
तुमहारी बात में उममीद से जयादा वजन है.	నీ అంచనా కంటే నీ సవరానికి ఎకకువ బలం ఉంటుంది.
पता नहीं वॉलट 32 के लोग कया कर रहे थे.	వాలట 32 పరజలు ఏం చేసేవాళలో మరి నాకు తెలియదు.
बलैमको मैक और चीज.	బలామకో మాక, ఇంకా చీజ.
लोगों को परेशानी हुई.	జనాలను బాధిసతుంది.
मैंने कहा, सब लोग.	వాళలందరూ అని చెపపాను.
सही सुना. मेरा नाम मारथा है.	అది నిజం. నీ పేరు మారతా.
ऐसा होता है कया?	అలాగే జరుగుతుందా?
इनकी मदद करना हमारा काम नहीं है. वे हतयारे हैं.	ఈ మనుషులకు సాయం చేయడం మన పనిగా భావించను. వాళలు హంతకులు.
तो हमें कया करना चाहिए?	అయితే, మాకేం పరతిపాదిసతావు?
अपने जूतों का खयाल रखता था.	తన షూస జాగరతతగా ఉంచాడు.
{\an8}उसे अंदर भेज दें.	{\an8}ఆమెను లోపలకు పంపించు.
शायद वे खुद उनहें केक देते.	ఆయన ఆ కేక తనే ఇచచేవాడు.
हाँ, एयर कंडीशनर बडी बात होगी. मतलब, बात समझो.	అవును, ఏసీ కోసం అయితే మంచి ఒపపందం. నా ఉదదేశం తెలుసుగా.
तुम मुझे बेच रहे हो?	ననను అమముతుననావా?
वॉलट 32 के मासूम लोगों की हतया करने की.	వాలట 32లో అమాయకులకు నువవు చేసినదానికి పరతిఫలం.
वे जो चाहें वह खा सकते हैं, हर तरह के बिसतर पर सो सकते हैं.	అవి తినగలిగే ఆహారమంతా, అవి నిదరపోగలిగే సౌకరయాలననీ.
नहीं. खोलने के लिए पिप-बॉय की जरूरत होती.	లేదు. తలుపు తెరవడం కోసం వాళలకు పిప బాయ కావాలి.
{\an8}अबराकसो नाली साफ करें	{\an8}అబరాకసో డరెయిన శుభరపరిచేది
तुमहारी बहन के जाने के बाद तुम अकेले मॅकलीन बचे हो.	మీ చెలలెలు వెళలిపోయాక, నువవే ఆఖరి మెకలీనవి.
तुमहारा नाम कया है?	నీ పేరు ఏమననావు?
सर, रुक जाइए. आपको चोट लग जाएगी.	సర, ఆపండి. మీకు మీరే గాయం చేసుకుంటారు.
मैं कया सोच रहा था?	నా ఆలోచన ఏంటసలు?
जो वे हमारे साथ करते.	వాళలు మనలని ఏమీ చేసేవాళళు
इसके लिए बहुत धनयवाद.	నేనిది నిజంగా అభినందిసతా.
मारथा, मेरा नाम मारथा है.	మారతా, నా పేరు మారతా.
मारथा, मेरा नाम मारथा है.	మారతా, నా పేరు మారతా.
मारथा, मेरा नाम मारथा है.	మారతా, నా పేరు మారతా.
मारथा, मेरा नाम मारथा है.	మారతా, నా పేరు మారతా.
मारथा, मेरा नाम मारथा है.	మారతా, నా పేరు మారతా.
मारथा, मेरा नाम मारथा है.	మారతా, నా పేరు మారతా.
मारथा, मेरा नाम मारथा है.	మారతా. నా పేరు మారతా.
मारथा, मेरा नाम मारथा है.	మారతా. నా పేరు మారతా.
मारथा. मेरा नाम मारथा है.	మారతా. నా పేరు మారతా.
उममीद है गोलियों का सवाद पसंद आया होगा, कमयुनिसट कुतते.	నీకు సీసం రుచి నచచిందని ఆశిసతాను, కామీ దరిదరుడా.
तुमहें यह सब करने की. . .	దానిపె ఆధారపడే అవసరం లేదు. . .
फॉलआउट	ఫాలౌట
पोसटर अचछे हैं.	పోసటరలు బాగుననాయి.
मैं बस तुमहारे अंग निकालने वाला हूँ.	నేను నీ అవయవాలను తొలగిసతానంతే.
वही मेरे आदेश हैं.	అవి నా ఆదేశాలు.
कि शायद 32 में कुछ तो गडबड है.	32తో ఏదెనా ఉండి ఉండాలని నాతో అననారు.
तो तुमहारे डैडी खाने की लाइन में सबसे आगे रहते होंगे.	సరే, ఇలాంటి పని చేయడంలో మీ నానన మొదట ఉంటాడు.
साथी को जयादा इंतजार नहीं कराएँगे.	నీ తోటివాడిని అంతగా ఎదురుచూసేలా చేయకూడదు.
फिर गेटकीपर की नौकरी भी.	తరవాత గేటకీపర ఉదయోగం పోయింది.
मुझे अपना हाथ देंगी. . .	ఇపపుడు, నీ చేయి ఇచచావంటే. . .
इसे अभी कर दो, ताकि अगले पिकअप के लिए तैयार रहे.	తన సంగతి వెంటనే చూసేసెయ, మరుసటి బటవాడాకు ఆమె సిదధంగా ఉంది.
रॉजर. मेरा नाम रॉजर है.	రాజర. నా పేరు రాజర.
यहाँ पर कया-कया है?	ఇక, మనకు ఇకకడ ఏముననాయి?
{\an8}परबंधन को मौत की सजा	{\an8}నిరవాహకులకు మరణం
बहुत बुरा हुआ. उन लोगों से नफरत है मुझे.	దారుణం. వాళల మీద నాకు చాలా దవేషం.
वह बाहर ही है.	బయట ఉనన అతను. . .
सिरफ मैं नहीं.	నేను మాతరమే కాదు.
हाँ. मतलब, और कया कहें?	కచచితంగా. అంటే, నువవేమంటావు?
- हाँ. माफ करना. - हाँ.	- సరే. కచచితంగా, సారీ. - హా.
मुझे अपने अंग नहीं देने हैं.	నాకు నా అవయవాలు కావాలి.
मेरी गरदन में रससी डाली, गंदा पानी पिलाया	నా మెడకు పటటీ బిగించి, నాతో మురికి నీరు తాగించాడు,
जूतों के बारे में बात करते हुए वह तो	అతనితో షూ నిరవహణ గురించి మాటలాడిసతే, ఇక తను,
हैलो, नॉरम.	హే, నారమ.
वे सब भी.	వాళలు కూడా.
हे भगवान.	ఓరి దేవుడా.
{\an8}ये लोग पागल थे. अगर यहाँ कोई बच गया था,	{\an8}ఈ జనాలకు పిచచి పటటింది. ఇకకడ ఎవరెనా బతికి ఉంటే,
अचछे सवाल के लिए एक और सवाल तो बनता है.	సరే, ఒక మంచి పరశనకు మరో పరశన పొందే అరహత ఉంటుంది.
धनयवाद, सटेफ.	ధనయవాదాలు, సటెఫ.
तुमहें चाहिए?	నీకు ఇది కావాలా?
नहीं, धनयवाद.	వదదు, ధనయవాదాలు.
उससे सब पूछा. वह कौन है, किसके लिए काम करता है,	అతనిని అనని పరశనలు అడిగాను, అతను ఎవరో, ఎవరికి పని చేసతాడో,
तुम लोग बिन बुलाए मेहमान हो.	మీ అందరినీ పారటీకి ఆహవానించలేదు.
बस बोलता ही जाता था जब तक सब लोग वहाँ से चले न जाएँ.	గదిలో అందరూ వెళలిపోయేవరకూ చెబుతూనే ఉంటాడు.
वॉलट 33 बातचीत का लॉग	వాలట 33 సంపరదింపుల వివరాలు
किसी से ऐसा बरताव मत करो.	మీరు మనుషులతో అలా పరవరించకూడదు.
बस थोडा इंतजार करना होगा.	నీకు కొంచెం సమయం ఇచచుకుని చూడు.
मेरे साथ उसकी याद आती है?	ఇంకా నాతో ఉంటే తన జఞాపకాలు అనా?
तुमहें वेसटलैंडिंग करते कितना समय हो गया?	బంజరుభూమిలో ఎంత కాలంగా ఉంటుననావు?
वाह.	అబబో.
सवरणिम नियम कहता है.	ఎందుకంటే అదే పసిడి నియమం.
हैलो.	హేయ.
हालात बहुत कठिन हैं.	బయట కషటంగా ఉంది.
सुनो.	హేయ.
पहली बार लकषण दिखे 28 साल हो गए.	అలా కనబడడం మొదలుపెటటాక 28 ఏళలు అలా ఉననా.
जरूरत. . .	అదీ. . .
वाह.	అబబో.
देखो, मेरे वॉलट में भी मुशकिलें आई थीं.	మా వాలట కూడా కషటాలను ఎదురకుంది.
उन दरिंदों ने उसे छीन लिया.	ఆ రాకషసులు ఆయనను నాకు దూరం చేశారు.
जयादा मसती मत करना.	అపరమతతంగా ఉండు.
जहरीला होता है.	అది ఎంతో విషపూరితం.
शायद वह मुझे परेशान कर रहा था. पर उनमें से एक ने कहा	బహుశా తనది నాతో పరాచికం. కానీ వాళలలో ఒకరు
सवरणिम नियम, कमीने.	సవరణ నియమం, చెతత వెధవ.
तुम ठीक हो?	బాగానే ఉననావా?
आपकी एक उंगली गायब है.	నీకు వేలు పోయిందని చెపపగలను.
अचछा रोबोट है.	మంచి రోబోట.
मैं तुमहारा ही रूप हूँ.	నేను నువవే, బుజజీ.
तो तुम कहाँ से हो?	ఎకకడి నుంచి వచచానననావు?
खाने का सवाद कितना अचछा होता था?	మంచి భోజనం రుచి గురతుందా?
मैं तो कभी गया नहीं. जलदी ही जाने की उममीद है.	అకకడికి ఎపపుడూ వెళలలేదు. తవరలో ఏదో రోజున వెళలాలని ఆశిసతాను.
बिलकुल.	తపపకుండా.
मैंने कहा उसने सवरणिम नियम का पालन नहीं किया,	అతను సవరణ నియమం పాటించలేదని చెబితే,
बिना संपरक के दो सौ साल.	ఏ సంపరదింపులు లేకుండా 200 ఏళలు.
गुससा होने पर बस दीवार पर पेशाब कर देते हैं.	కోపం వసతే, గోడల మీద మూతరం పోసతారు.
सर, हमेशा की तरह शानदार बात कही है.	ఎపపటిలా అదభుతమెన ఉపాయం, సర.
लोग तकलीफ में हैं. परेशान हैं.	ఇకకడ జనాలు బాధలలో, దికకులేకుండా ఉననారు.
इससे गुससा आ रहा है?	అది నీకు కోపం తెపపిసతుందా?
जरूर है. आपके पास नहीं है?	తపపకుండా. నీకు లేదా?
पर शायद तुम और तुमहारी चिकनी. . .	అయితే నువవు, నీ సుననిత ముఖ సనేహితురాలు. . .
- उनके पास था. - किसका था?	- వాళల దగగర ఒకటి ఉంది. - ఎవరిది?
मेरा नाम रॉजर है.	నా పేరు రాజర.
मेरा नाम है रॉजर.	నా పేరు రాజర.
मेरा नाम रॉजर है.	నా పేరు రాజర.
मेरा नाम रॉजर है.	నా పేరు రాజర.
मेरा नाम रॉजर है.	నా పేరు రాజర.
अब सथिर रहें.	ఇక కదలకుండా ఉండు.
मेरे पति की हतया हुई.	నా భరతను చంపారు.
यही कह सकती हूँ.	నేను అడిగేది అంతవరకే.
मेरा भी अपहरण हुआ है.	ననను అపహరించారు.
हमें पता है सच कया है	మాకు నిజం తెలుసు
पर करते कुछ और हैं.	జనాలు నిజంగా చేసినదానికి.
सेवा में हाजिर हूँ.	నేను సేవ చేసేందుకు సిదధం.
तुमहें दवा नहीं मिले तो वैसे बन जाओगे?	నువవు ఇవి వేసుకోకపోతే, వాళలలో ఒకడిగా మారిపోతావా?
रुकावट के लिए खेद है, ताजा माल आ गया है.	అంతరాయానికి మననించాలి, కొతతగా వచచినామె ఇదిగో వచచింది.
बहुत समय हो गया.	చాలా కాలంగా.
तुमने ऐसा कयों किया?	ఎందుకలా చేశావు?
तुम ऐसे कैसे जी सकते हो?	ఇలా ఎలా బతుకుతావు?
बात कुछ बनती नहीं.	దానికి ఎలాంటి అరథం లేదు.
सवाल यह है, कया वह समझ रही है?	పరశన ఏంటంటే, నీ ఉదదేశమేంటో ఆమెకు తెలుసా?
कया हुआ. . .	అసలు ఏమెంది. . .
{\an8}इसके लिए शारीरिक जाँच करनी होगी.	{\an8}సథితిని అంచనా వేసేందుకు భౌతిక విశలేషణ చేయాలి.
चूहों की इस कॉलोनी को चूहों का आदरशलोक कहा जाता है.	ఈ ఎలుకల కాలనీని ఎలుకల యూటోపియా అంటారు.
तुमहें यह जरूर देखना चाहिए.	నువవు దీనిని చూడాలి.
अचछी बात है. और इसे भी.	మంచిది. ఇంకా ఇది.
बस एक कश, मैं ठीक हो जाऊँगा.	చిననగా పీలచితే చాలు, మళలీ కోలుకుంటాను.
लॉग ढूँढ रहे हैं. . .	లాగలను యాకసెస చేసతోంది. . .
पता है, उसे सच में ऐसा करना पसंद था.	తెలుసుగా, ఆయన బాగా పరేమించిన కొననింటిలో అదీ ఒకటి.
अचछा, कयों?	అవునా, ఎందుకలా?
फिर भी उनहोंने ऐसा कुछ नहीं किया.	అయినా సరే ఇలాంటివి చేసేందుకు ఆయన అంగీకరించడు.
दो महीने की दवा.	రెండు నెలల వయలస సరఫరా.
पता है, मेरी माँ. . .	తెలుసుగా, మా అమమ పెటటేది. . .
कृपया यहाँ पर बैठने का कषट करेंगी?	నీ ముందు ఉనన ఆ చదును బలల మీద దయచేసి కూరచుంటావా?
लिखा है इसे बाहर से खोला था.	ఇది బయటి నుంచి తెరిచారని చూపిసతోంది.
कया है?	ఏంటి?
बहुत अचछा लग रहा है.	ఇది నిజంగా చాలా మంచిగా ఉంది.
देखा?	చూశావా?
पलीज!	దయచేసి!
नहीं. देखो, इसे पहने रहोगे? हाँ.	వదదు, వదదు. చూడు. అది వేసుకునే ఉండగలవా? అంతే.
इससे दरद नहीं होगा.	ఇది కొంచమెనా నొపపిగా ఉండదు.
धनयवाद.	ధనయవాదాలు.
अब ठीक है, है न?	అది బాగా నయం, కాదంటావా?
शायद बाहर जाना चाहो.	మీరు తవరగా వెళలిపోవాలనుకుంటా.
इसके पकौडे किसी को तो बनाने हैं.	ఆ పని ఎవరో ఒకరు చేయాలి
कोई बात नहीं.	పరవాలేదు. పరవాలేదు.
तो तुम यहाँ हो.	నిననికకడ చూడడం ఆశచరయం.
सर, ऐसा मत करो.	సర, మీరు ఇలా చేయకూడదు.
तुम आजाद हो. जाओ.	మీకు సవేచఛ ఉంది. వెళలండి.
हाँ.	అవును.
रुको! पलीज! मैं. . .	ఆపు! ఆపు! ఆపు! పలీజ! నేను. . .
जाओ.	వెళలు.
आप खुश नहीं हैं.	నువవు సంతోషంగా కనబడలేదు.
हाथ ऊपर!	చేతులు పెకి.
शायद समझ गई.	నాకు తెలుసనుకుంటా.
मतलब, "वह बदसूरत, मजबूत था और शालीन भी. "	దాని అరథం, "అతను వికారి, బలవంతుడు, అయినా అతను మరయాదసతుడు. "
मेरी माँ का.	మా అమమది.
वॉलट के दरवाजे का लॉग	వాలట తలుపు లాగలు
ठीक है, तुम जा सकती हो.	సరే, నువవు ఇకకడి నుంచి వెళలిపోవచచు.
तो, अब मैं गेटकीपर नहीं हूँ.	అందుకే, నేను ఇకపె దవారపాలకుడిని కాదనుకుంటా.
पता चल जाएगा.	నువవే తెలుసుకుంటావు?
तुम भी औरत साथ लाए हो.	నీ దగగర కూడా సొంత సుకుమారి ఉందిగా.
वैसे, लोग तो कुछ भी कहते हैं,	సరే, తేడా ఉంటుంది, జనాలు చేశామని చెపపేదానికి,
हमले के दौरान मैं छिपा रहा.	దాడి సమయంలో, నిలవ చోటుకు వెళలి దాకకుననాను.
तो अबराकसो साफ करेगा झटपट.	అది వదిలించడానికి అబరాకసో దరవానని నమమండి.
हम आ गए. तो शुरू करें?	ఇదిగో వచచేశాం. ఇక పని మొదలుపెడదామా?
हाँ, शायद.	అవును, అనుకుంటా.
लोग भूखे मर गए.	జనాలు ఆకలితో మాడిపోయారు.
सही कहा.	నిజం.
इकतीस, बततीस, तैंतीस. . .	ముపఫె ఒకటి, ముపఫె రెండు, ముపఫె మూడు. . .
संवाद अनुवादक कमलेश ढवले	సబటెటిల అనువాద కరత కృషణమోహన తంగిరాల
पता है. . .	నీకు తెలుసుగా. . .
कयों, हैलो.	ఎందుకలా, మీకు హలో.
तो जोई,	సరే, జోయీ,
तुम कया चीज हो?	నువవేంటి?
उनके समाज के नियम कया हैं.	నిరవహణ నియమాలు ఏంటో, ఏదెనా ఉంటే, ఎవరి కిందో.
अब समझ रही हो.	ఇపపుడు నీకు అరథమవుతోంది.
