ठीक है, सीधा हो रहा है! लगभग हो गया!	సరే, మామూలు సథితికి తెసతుననా! దాదాపు వచచేశాం!
पहला भाग	మొదటి భాగం
- यहाँ देश भर से लोग हैं. - हाँ.	- అనని పరాంతాల కురరాళలూ ఉననారు. - అవును.
- कया मैं बजाऊँगा. . . - तो वह कौन होगा?	- నేను ఈ పాట వాయించనా. . . - అది ఎవరు కాబోతుననారు?
ए, मेजर.	హేయ, మేజర.
चलो, मीटबॉल.	ఇలా రా, మీటబాల.
बायाँ नीचे आ रहा है.	ఎడమ వెపు కిందికి వసతోంది.
तुम इस वाले में नहीं जाना चाहोगे, दोसत. मेरा विशवास करो.	ఈ మిషన లో రాకుండా ఉంటే బాగుండు అనుకుంటావు, మితరమా. పరామిస గా చెపతుననా.
चैपल	చాపెల
बूसटर पंप, दबाव?	బూసటర పంపులు, పరెజర?
साठ.	అరవె.
साठ.	అరవె.
नैविगेटर, तैनात हूँ.	నావిగేటర, సిదధం.
शुरू हो गया. जमीन से हमला हो रहा है. डटे रहो, लडकों.	ఇదిగో చూడండి. శతరువు ఎదురుగా వసతుననాడు. సిదధంగా ఉండండి, కురరాళలూ.
जूटसूट टू लीड, जूटसूट टू के लिए.	జూటసూట టూ లీడ నుండి జూటసూట టూ సిబబందికి.
मोटर पर गोली लगी थी.	మోటార మీద కాలపులు చేశారు.
कया?	ఏంటి?
तीस लोग. . .	ముపపె మంది. . .
जो मुझे नहीं जानते हैं, मैं फादर टेसका हूँ.	నా గురించి తెలియని వారికి చెపపాలి, నా పేరు ఫాదర టెసకా.
इसीलिए मैं उनके तह करने से जयादा, उनकी उडान को पराथमिकता देता हूँ.	అందుకే నేను దుపపటలు మడతపెటటడం గురించి కననా విమానాలని నడపడం గురించి పరాధానయత ఇసతాను.
मुझे विशवास है कि तुम सभी को अपना परशिकषण और अपने काम याद हैं.	మీ శికషణని బాగా గురతుంచుకుని మీరు ఏం చేయాలో ఆ పనులు బాగా చేసతారని నమముతుననాను.
आज मैं फरिशते की तरह उडूँगा, पर फरिशते की तरह नहीं मरूँगा.	ఈ రోజు నేను దేవదూత మాదిరిగా గాలిలో ఎగురుతాను ఇంకా వాళల మాదిరిగా మరణించను.
हाँ. फलैपस एक-चौथाई पर हैं.	పెటటాం. ఫలాపస ని కవారటర కి పెటటాం.
नटिंग, पीछे सब कैसा है?	నటటింగ, మన పరిసథితి ఎలా ఉంది?
ऑलटीमीटर दो-नौ-नौ-शूनय.	ఆలటీమీటర 2-తొమమిది-తొమమిది-0.
हम जितनी जयादा देर इंतजार करेंगे, बाकियों को उन तक पहुँचने में उतना ही जयादा समय लगेगा.	మనం ఎంత ఎకకువసేపు ఎదురుచూసతే, వాళలని అందుకోవడానికి అంత కషటం అవుతుంది.
कुछ दिखाई नहीं दे रहा है, सर.	ఏమీ కనిపించడం లేదు, సర.
- करैश लैंडिंग की तैयारी करो. - जयादा नीचे है. जयादा नीचे है.	- అతయవసర లయాండింగ కి సిదధంకండి. - చాలా కిందికి దిగింది. చాలా కిందికి దిగింది.
आगे का बयौरा देंगे.	ఇకకడి నుండి అందుకుంటాడు.
लगभग 11 मिनटों में.	సుమారు పదకొండు నిమిషాలు.
अब, मैं तुम सभी के विरुदध खेल चुका हूँ. . .	ఇపపుడు, నేను మీ అందరితో ఆడాను. . .
- नमसते, मेजर. कया वह साइकिल बेचेंगे? - कभी नहीं.	- గుడ ఈవెనింగ మేజర. ఆ సెకిల అమముతారా? - ఎంత డబబు ఇచచినా అమమను.
ऐलिस फरॉम डैलस?	ఆలిస ఫరమ డాలస అంటే?
यह हिल नहीं रहा है.	ఇది లొంగడంలేదు.
वैसे, तुमहें कहावत पता है.	సరే, వాళలు ఏం అంటారో నీకు తెలుసు.
मासक पहन लो और सथिति बताओ.	మాసకులు పెటటుకుని సిదధంగా ఉండండి.
थोडे हिचकोले लगेंगे. डटे रहो, दोसतों.	లయాండింగ ఎగుడుదిగుడుగా ఉంటుంది. ఓరచుకోండి, గయస.
यह गति बरकरार नहीं रख सकते. हम वापस लौट रहे हैं.	మేము ఈ వేగానని అందుకోలేకపోతుననాము. మేము తిరిగి వెళలిపోతుననాం.
बताओ भी, मारज.	చెపపు మారజ.
फलैपस ऊपर करो.	ఫలాపస పెకి.
मेरे दो सोफे फाड दिए और बार के लगभग सारे गिलास तोड दिए.	నా రెండు సోఫాలని చించివేశాడు, బార లో దాదాపు అనని గలాసులనీ పగులగొటటాడు.
ठीक है, टॉमी. जब भी तुम तैयार हो.	సరే, టామీ. నువవు ఎపపుడు రెడీ అయితే అపపుడు.
हमें अंगरेजों से मासक और पैराशूट उधार में लेने पडे.	మాసకులు, పారాచూటలని బరిటీష సెనయం నుండి అరువు తీసుకోవాలసి వచచింది.
मैं चाहता हूँ कि हमारे विमान आपस में इतना करीब उडें	మీ విమానాల ఏరపాటు ఎంత పకడబందీగా ఉండాలంటే
- अरे, हद है, करॉज. - मुझे माफ कर दो.	- ఓహ, ఇది ఘోరం, కరోజ. - సారీ.
- करट, आज मैं तुमहारे साथ उडान भरूँगा. - यह लो.	- కరట, ఈ రోజు నేను నీతోపాటు విమానంలో వసతాను. - ఇదిగో తీసుకో.
- मैं जिंदा नहीं बचूँगा, बकी. - चुप रहो, डुवॉल. तुमहें कुछ नहीं होगा.	- నేను బతకను, బకీ. - అలా అనకు, డువాల. నువవు బతుకుతావు.
मुझे साइकिल चाहिए होगी?	నాకు సెకిల అవసరమా?
अरे, वह रहा बरेडी.	అదిగో, బరాడీ వసతుననాడు.
मैं ठंड से मर रहा हूँ. कोई मुझे यहाँ से निकाल सकता है?	నేను చలికి గడడకటటుకుపోతుననాను. ఎవరెనా ననను ఇకకడి నుండి పెకి లాగుతారా?
- वे सभी वील के सकवाड से हैं. - चलो.	- అవననీ వీల సకవాడ కి సంబంధించినవి. - ఇలా చూడు.
ए. जानते हो, मुझे हैरानी है कि हम दोसत हैं.	హేయ. చూడు, మనం సనేహితులం కావడం నాకు గొపపగా అనిపిసతుంది.
मिशन के दिनों में हमेशा खास नाशता मिलता था:	మిషన కి వెళలే రోజులలో ఎపపుడూ పరతయేకమెన అలపాహారం ఇసతారు:
पायलट दो तरह के होते हैं,	పెలెటలలో రెండు రకాలవాళలు ఉంటారు,
बाकी के समूह तक पहुँचने में ईंधन की काफी खपत होगी.	మనం మిగతా గరూప ని అందుకోవాలంటే చాలా ఇంధనానని మండించాలసి వసతుంది.
एक सौ पैंसठ, जैसा कि तुमने मुझे बताया था.	165, నువవు నాకు చెపపిన విధంగానే.
तुमहें पता है कि इसका मतलब कया है, लडकों.	దాని అరథం ఏంటో తెలుసా, కురరాళలూ.
- हाँ? - बताओ.	- చెపపనా? - చెపపు.
तुम पीते नहीं हो. जुआ नहीं खेलते हो.	నువవు మదయం తాగవు. జూదం ఆడవు.
बलूई वेसट वन एयरफीलड दकषिण गरीनलैंड	బలూయీ వెసట వన వెమానిక సథావరం దకషిణ గరీన లయాండ
बदबू आ रही है.	ఇది కంపుగొడుతోంది.
वैसे, यूनिकॉरन मेरा सबसे पसंदीदा विलुपत जानवर है.	అవును, ఆ ఒంటికొమము గురరం నాకు ఇషటమెన అంతరించిపోయిన జాతి జంతువు.
- कम से कम एक तो होगा. - ए.	- కనీసం ఒకకటి. - హేయ.
नींद कैसी रही?	నిదర బాగా పటటిందా?
धनयवाद, पाडरे. हम यह जरूर धयान में रखेंगे.	థాంకయూ, ఫాదర. మేము ఖచచితంగా దానని దృషటిలో పెటటుకుంటాం.
यह ले लो.	తీసుకో.
जी, सर.	రెడీ, సర.
- दूसरा शुरू करो. - दूसरा शुरू करो.	- రెండో ఇంజన ఆన చేయి. - రెండో ఇంజన ఆన అయింది.
एक सौ दस.	నూటపది.
बॉल, दल के लिए, जमीन से हमला, आगे, नीचे हलका बाईं तरफ.	గన నుండి సిబబందికి, శతరువు. కింద ఎడమ వెపు.
हे भगवान.	దేవుడా.
तुमने मुझे बताया कयों नहीं?	నాకు ఎందుకు చెపపలేదు?
"बक, जूते के फीते बाँधने में मेरी मदद करोगे? " "बक, यह पलेन उडाने में मेरी मदद करो. "	"బక, నా షూ తాళలు ముడివేయగలవా? " "బక, ఈ విమానం నడపడంలో సాయం చేయి. "
पकका नियंतरण सरकिटों में से एक में खराबी आई होगी.	కంటరోల సరకయూటస లో ఒకదానలో సమసయ కావచచు.
उसके पास एक मासक है. मैंने तीन डॉलर में खरीदा था. पर, इसे उडना बेहद पसंद है.	వీడికి ఒక మాసక ఉంది. దానికి నాకు మూడు డాలరలు ఖరచయింది. కానీ బాబూ, వీడికి విమానంలో ఎగరడం అంటే ఇషటం.
- ठीक है. इसे ठीक करो. - ठीक है, मेजर.	- అలాగే. దానని సరిచేయండి. - ఆ పనిలోనే ఉననా, మేజర.
जैसा कि तुम जानते हो, यह यहाँ हमारा पहला मिशन है.	మీకు తెలుసు, ఇకకడ ఇది మనకి మొదటి మిషన.
मेजर यहाँ हमारे साथ उडान भरेंगे. मेजर?	మేజర ఇకకడ మనతో పాటు విమానంలో వసతుననారు. కదా మేజర?
यह कुछ ही घंटों में ठीक हो जाना चाहिए.	దానని సరి చేయడానికి కేవలం కొనని గంటలు సరిపోతుంది.
मैं तुम अमरीकियों की सराहना करता हूँ. तुम दिन के उजाले में वहाँ ऊपर थे.	మీ అమెరికనలని నేను మెచచుకుంటాను. పటటపగలు మీరు పోరాడారు.
- दो और. - अभी देता हूँ.	- ఇంకో రెండు. - వెంటనే వసతుననా.
बकी, तुमसे इंगलैंड में मिलूँगा.	బకీ, ఇంగలండ లో కలుసతాను.
तुमहें वापस ऊपर लेना होगा, वील. दोबारा चककर लगाकर आओ.	మీరు పెకి ఎగరాలి, వీల. చుటటూ తిరిగి రండి.
नहीं, सर. यह बस "बक यह, बक वह" था.	లేదు, సర. ఇది "ఈ బక, ఆ బక" అంటూ మాటలాడేవాడు.
खैर, वॉलयूम बढाओ.	సరే, దానని పెకి తిపపు.
बॉमबारडियर, तैनात हूँ.	బంబారడియర, సిదధం.
टेल, पायलट के लिए, हम सुरकषित हैं.	వెనుక భాగం నుండి పెలెట కి, మనం దూరంగా ఉననాం.
ए, दोसतों, बॉसर को वहाँ से निकालो और उसे गरमाहट दो.	హేయ, మితరులారా, బాసర ని కిందినుండి పెకి లాగి అతడిని వెచచగా ఉంచండి.
- बंद हो जाती थीं. - नहीं, हाँ, आमतौर पर बंद हो जाती हैं.	- అనుకుననా. - లేదు, మామూలుగా అలానే అవుతుంది.
चलो देखें कि हम इस कोहरे में विनयास बना सकते हैं या नहीं.	ఈ పొగమంచులో మనం ఫారమేషన చేయగలమో లేదో చూదదాం.
मैं वापस लौट रहा हूँ. तुम नेतृतव करो.	నేను తిరిగి వెళలిపోతుననాను. సారథయం అంతా ఇక మీదే.
मुझे तुमहें पूछताछ के लिए ले जाना होगा, बक. चलो.	నినను విచారణకి తీసుకువెళలాలి, బక. పద.
चलो, लडके.	ఇలా రా, బాబూ.
मेरी निगरानी में यह नहीं होगा.	నేను అధికారిగా ఉననంతకాలం అది సాగనివవను.
अपनी आँखें खुली रखो.	చాలా జాగరతతగా దృషటి పెటటు.
हाँ, वह मोहतरमा बेहद सुंदर है.	అవును, తను అందంగా ఉంది.
- कया? - माफ करना, डिक.	- నువవు ఏంటననావు? - సారీ, డిక.
अब तुम खुद देख चुके हो.	ఇపపుడు నువవు పరతయకషంగా చూశావు.
सात, आठ, नौ, दस, 11, 12, 13, 14, 15.	ఏడు, ఎనిమిది, తొమమిది, పది, 11, 12, 13, 14, 15.
नई दिशा: 248 पर बाएँ मुडो.	కొతత మారగం: ఎడమ వెపు 248కి తిరుగు.
अंतिम-परवेश चेक. फलैपस एक-चौथाई पर हैं?	తుది దశ చెక. రెకకల ఫలాపస నాలుగో వంతు తెరుచుకుననాయా?
सर. सर, आप आज उडान भरेंगे.	సర. సర, మీరు ఈ రోజు విమానం నడపాలి.
आप गंभीर हैं?	నిజంగా అంటుననావా?
डिकी, दोहराओ.	డికీ, మళలీ చెపపు.
- पूरा शेकर नहीं, चक. - यह अपशगुन नहीं है.	- మొతతం అంతా అవసరం లేదు, చక. - అది మనకి ఏమీ చెడు చేయదు.
अमरीकी सेना की एटथ एयर फोरस के साथ शामिल होने के लिए सन 1943 के वसंत में इंगलैंड भेजा गया था.	నాజీ జరమనీపెన యుదధం చేసతునన అమెరికన ఆరమీ ఎయిత ఎయిర ఫోరస కి సాయపడమననారు.
तुमने वह सुना? चलो. चलो चलें.	అది విననావా? పద. వెళదాం పద. వెళదాం పద.
चिंता मत करो. हम जलदी ही वहाँ बम गिरा रहे होंगे.	కంగారుపడకు. చాలా తవరలోనే మనం ఆ పరాంతం అంతా బాంబులు వేయబోతుననాం.
तो अभी के लिए अलविदा.	అయితే ఇదీ సంగతి.
पर इंगलैंड में नहीं यहाँ खराब मौसम और नीला आसमान	కానీ ఇంగలండ లో కాదు అకకడ పిచచి వాతావరణం ఇంకా నీలపు ఆకాశం ఉననాయి
इसका यह मतलब नहीं कि तुम फैसले ले सकते हो.	వాళలు మంచి బయాండ లీడరలు అయిపోరు.
रेडियो पर, तैनात हूँ.	రేడియో, విననాను.
और याद रहे, मुझे अतिरिकत कंबल और अचछा नजारा दिखने वाला बिसतर चाहिए.	ఇంకా గురతుంచుకో, మంచి పరకృతి దృశయాలు కనిపించేలా ఒక మంచం ఇంకా అదనంగా దుపపటలు నాకు కావాలి.
- उसे उठाकर गाडी से जोडो. - अभी करता हूँ. चलो चलें.	- జాక తో పెకి లేపి తగిలించి ఉంచు. - ఆ పనిలోనే ఉననాను. పదండి వెళదాం.
और जो तबाही हुई थी, इससे उसकी भरपाई कैसे होगी?	ఇది దేనికి బదులో ఖచచితంగా చెపపగలరా?
नॉरडने से लेकर लैंगेउग तक, फरीजन दवीपों के पास	శతరుసెనికుల నౌకాదళం ఇంకా పదాతిదళాలు
खींचो! ऊपर लो! ऊपर!	లాగు! పెకి పోనివవు! పెకి!
मुझे यह वापस चाहिए.	నాకు ఇది తిరిగి ఇచచేయాలి.
दायाँ गियर ऊपर उठ गया है.	కుడి గేర పెకి ఉంది.
- थरॉटल? - थरॉटल बंद हैं.	- థరాటిలస? - థరాటిలస మూసి ఉననాయి.
हे भगवान. आप ठीक हैं, सर?	ఓహ, అయయో. మీరు బాగానే ఉననారా, సర?
हाँ, वह हम सभी में है, दोसत.	అవును, మన అందరిలోనూ అది ఉంది, మితరమా.
अपनी जी मितलाने की समसया को काबू में लाओ.	ఎయిర సికనెస ని అదుపులో పెటటుకో.
ताकि तुमहें बता सके कि दरअसल वहाँ कैसा महसूस होता है.	అకకడ పరిసథితి ఎలా ఉంది నీకు చెపపాలి కదా.
किसी भी अनधिकृत वयकति को परवेश करने की अनुमति नहीं है	అధికారిక గురతింపు లేనివారికి పరవేశం లేదు
पर इस बार विकषोम के कारण, यह. . . पता नहीं.	కానీ ఈసారి విమానం ఊగిపోవడంతో, ఇది కాసత. . . నాకు తెలియదు.
- इसमें काफी समय लगेगा. - चलो इसकी मरममत करें.	- ఇది బాగుపడటానికి కొంత సమయం పడుతుంది. - మనం దీనని సరిచేదదాం.
जाओ, जाओ! चलो! जलदी निकलो. तुरंत भागो वरना मारे जाओगे! जाओ, जाओ!	పదండి, పదండి! కదలండి! ముందుకు కదలండి. వెంటనే పరిగెతతండి లేదా చనిపోతారు. పదండి, పదండి!
और मुझे गोली लगी है.	నేను గాయపడడాను.
समझ गया.	అలాగా.
मेरी याद आई?	ననను మిస అయయావా?
हमारे पलेन में यांतरिकी खराबी आई थी.	మనకి మెకానికల సమసయ వచచింది.
नहीं, उसकी परवाह मत करो, बक.	లేదు, ఆందోళనపడకు, బక.
- धनयवाद. - यह लो.	- థాంకస. - ఇదిగో తీసుకో.
इंटरकूलर ठंडे हैं.	ఇంటర కూలరస చలలగా ఉననాయి.
सौ.	వంద.
इतने करीब नहीं.	మరీ ఇంత దగగరగా కాదు.
चलो भी. चढो.	పద. కదులు, బాబూ.
खैर, मेरे वहाँ पहुँचने से पहले मारे मत जाना.	సరే, నేను అకకడికి వచచేలోపు నీ మరణానికి ననను బాధయుణణి చేయకు.
टेल, कलेवेन के लिए, लडाकू विमान जा चुके हैं.	కలెవెన కి వెనుక సెనికుడి సందేశం, శతరు విమానాలు వెళలిపోయాయి.
जॉन को बचपन से ही सब बकी बुलाते थे.	జాన ని చిననతనం నుండి ఎపపుడూ బకీగానే పిలిచేవారు.
शूनय दृशयता के कारण पहले से ही समसया हो रही थी,	అసలు ఏమీ కనిపించక చాలా కషటం అయింది,
