वह बस वहाँ बैठकर मुसकुराता है. . .	అకకడ కూరచొని నవవుతుననాడు అంతే. . .
दोनों बैठकर एक-दूसरे को देख मुसकुराते रहते हैं.	ఇదదరకకడ కూరచొని ఒకరినొకరు చూసుకొని నవవుకుననారు.
मीक मिल को रिहा करो	మీక మిలను వదిలేయండి
लोगों को कहते सुनता हूँ, "मीक मिल को रिहा करो. "	నేను జనం "మీక మిలను వదిలేయండి" అని అనటం విననాను.
मीक मिल को रिहा करो.	మీక మిలను వదిలేయండి.
मीक मिल को रिहा करो.	మీక మిలను వదిలేయండి.
मीक मिल को रिहा करो.	మీక మిలను వదిలేయండి.
फरी मीक	ఫరీ మీక
मीक मिल को रिहा करो.	మీకను విడుదల చేయండి.
24 जनवरी, 2007	జనవరి 24, 2007
पी/ओ रेजिनालड गराहम	పి/ఓ రెజినాలడ గరాహం
उसकी अगली रात के उस छापे तक	ఇంకా ఆ సోదాలో చేయబడడ ఆరోపణల
उसी जगह पर वापस भेजा,	అదే చోటుకు పంపించారు,
ये लोग नारकोटिकस अफसर हैं.	వీళళు నారకోటికస అధికారులు.
गिरफतारी जायज थी.	అననది కనుగొనవచచు.
ओरलैंडो	ఓరలాండో
मैं हवाई जहाज से फलोरिडा गया और रेजी गराहम के घर पहुँचा.	నేను ఫలోరిడాకి విమానంలో వెళళి రెజీ గరాహం ఇంటికి వెళళాను.
और उसने कहा, "मुझे मीक मिल के केस के बारे में कुछ नहीं कहना. "	అతను, "నేను మీక మిల కేసు గురించి చెపపాలసింది ఏమీ లేదు" అననాడు.
सेकंड नाजरेथ मिशनरी बैपटिसट चरच	సెకండ నజారెత మిషనరీ బాపటిసట చరచ
रेव. डॉ. जो. एल. हॉली सीनियर, पादरी	రెవ. డా. జో. ఎల. హోలీ సీనియర, పాసటర
आमीन.	ఆమెన.
हाँ, मुझे. . .	సరే, ననను. . .
मैं मीक के लिए परारथना करती हूँ कयोंकि वह एक पिता है,	నేను మీక కోసం పరారథిసతుననాను, ఎందుకంటే అతను ఒక తండరి,
ऑफिसर जोनस, ऑफिसर गराहम. . .	ఆఫీసర జోనస, ఆఫీసర గరాహం. . .
अब, इस यूनिट का उददेशय बडा होता है.	ఇపపుడు, యూనిటకు గంభీరమెన మిషన ఉంది.
उसने "गलती" नहीं कहा था. "गंद" कहा था.	ఆమె "తపపు" అని అనలేదు. "చెతతపని" అంది.
उस समय, मैं और रेजी गराहम	ఆ సమయంలో, నేనూ రెజీ గరాహం
कयोंकि ऐसी ही कहानियाँ मैंने भी बहुत बार बनाई थीं.	ఎందుకంటే ఇవే కథాంశాలను నేను చాలాసారలు ఉపయోగించాను.
और यह पूरी तरह संगठित है.	అది చాలా దగగర సంబంధముంది.
पुलिस!	పోలీస!
वे बस आए और उसे बुरी तरह मारना शुरू कर दिया.	వాళళు వచచి అతనని తననటం, కొటటటం పరారంభించారు.
-वह जिसके लिए आया था उसे मिल गया. -हाँ.	-దేనికోసం వచచాడో అది దొరికింది. -అవును.
घर एकदम तहस-नहस पडा था.	ఇలలు చిననాభిననంగా ఉంది.
नशीमा विलियमस	నషీమా విలియమస
और इसके कारण, पुलिसवाले और भी शेर हो जाते हैं,	అందుకే, అతను సూపర పరెడేటర పోలీసులను సృషటించాడు
"मैं तुम पर मुकदमा करूँगा. मैं देख लूँगा. "	"నేను మీపె కేసు పెడతాను. ఇది చేసతాను" అంటే,
मीक की पिटाई और गिरफतारी के छह महीने बाद,	మీకను కొటటి, అరెసట చేసిన ఆరు నెలల తరువాత,
तो यह सूची फिलाडेलफिया पुलिस विभाग के उन सभी अफसरों की है	అయితే ఫిలడెలఫియా పోలీసు విభాగం మీక పోలీసుల కరూరతవ ఆరోపణపె
और वह है पुलिस ऑफिसर जेरलड गिबसन.	అతనే పోలీసు అధికారి జెరాలడ గిబసన.
जो घटनाकरम जेरलड गिबसन ने हमें बताया,	జరాలడ గిబసన మాకు చెపపిన సంఘటనల కథనాలు
अधिकारियों से झूठ बोलना, ये उन कुछ आरोपों में से हैं, जो उसमें बताए गए हैं.	మాదకదరవయ వయాపారం, అధికారులకు అబదధం చెపపటం, అది కేవలం జాబితాలోని కొంత భాగమే.
डीए के दफतर ने एक विशेष सूची तैयार की,	డిఎ కారయాలయం 66 పోలీస అధికారుల పేరలునన
शायद मैंने खबरों में देखा था कि एक गुपत सूची है.	నేను దానిని వారతలలో, రహసయ జాబితాగా చూశాననుకుంటా.
रेजी गराहम को अनुशासन संबंधी आरोपों की जाँच के लिए	రెజీ గరాహంను పోలీసు బోరడ ఆఫ ఇంకవెరీ, పిబిఐ ముందుకు
मुझे समझ नहीं आया कि उस पर मुकदमा कयों नहीं चला.	అతనిని ఎందుకు విచారించలేదో నాకు సపషటంగా తెలియదు.
तो उसे इस सजा से मुकत होने का अधिकार है.	నేరానని రదదు చేయొచచని దావాలో పేరకొననాము.
11 साल की यह कठिन परीकषा अब खतम कर दी जाएगी,	ఈ 11 ఏళళ కఠిన పరిసథితులు, అసలు ఏమీ జరగనటలుగా
और फिर, ऊपर से वह लेख जो रोलिंग सटोन में छपा था.	వీటననింటినీ మించి, రోలింగ సటోన లో వయాసం వచచింది.
उसने कहा, "नहीं. " ऐसी कोई गिरफतारी नहीं थी जिसमें उसे जरा सा भी शक हो, ठीक?	అతను అననాడు, "లేదు. " అతని ఏ ఒకక అరెసటు విషయంలో ఎలాంటి అనుమానం లేదు, సరేనా?
जेनीस बरिंकली को ये खेल खेलना बंद करके यह बकवास बंद करनी चाहिए.	జినీస బరింకలీ, ఆమె ఇక ఆటలాడటం ఆపేయాలి, దానిని దూరంగా పారేయాలి.
"फिर उसे घर के अंदर घसीटकर ले गए और उसके सिर पर वार करते रहे.	"వాళళు అపపుడు అతనని ఇంటలోకి లాకెళళి అతని తలపె కొడుతూనే ఉననారు.
फिली के पूरव नारकोटिकस अफसर जेफरी वॉकर को साढे तीन साल की सजा	మాజీ ఫిలలీ నారకోటికస పోలీసు జెఫరీ వాకరకు 3 1/2 ఏళళ జెలు శికష
वह एक धारमिक संसथा का हिससा है जिसमें वह भगवान के उपदेशों को	అతను ఒక మినిసటరీలో ఉననాడు, అతను దేవుని మాట ఫలోరిడాలో పరజలకు
फिलाडेलफिया के पूरव डीए सेथ विलियमस को अधिकतम सजा मिली है.	మాజీ ఫిలడెలఫియా డిఎ సేథ విలియమసకు శికష అతయధికంగా ఉంటుంది.
साथ ही, जब हम पूरव अफसरों तक पहुँचने की कोशिश कर रहे थे,	అదే సమయంలో, మేము మాజీ అధికారులను కలవాలని పరయతనించినపపుడు,
"वह साइकिल पर टवंटी सेकंड एंड जैकसन के नुककड तक गया. "	"అతను బెక మీద వచచి 22వ మరియు జాకసన మలుపువెపు వెళళాడు. "
आज का खुलासा पिछले साल की गिरफतारी के कारण सामने आया.	ఆ రోజు చేసిన సోదా గత సంవతసరం అరెసటు కారణంగా చేసింది.
हम सोच रहे थे, "रेजी गराहम की कहानी कया हो सकती है?	మేము, "రెజీ గరాహం నేపథయం ఎలాంటిది? " అని అనుకుననాము.
जैसे ही मैंने फोन रखा, मैंने मुडकर अपनी बीवी से कहा,	ఫోన పెటటేసిన వెంటనే నేను నా భారయవెపు తిరిగి అననాను,
मीक मिल - ईगलस ने सुपर बोल में मेरा साथ दिया. . .	మీక మిల - ఈగిలస 'డరీమస అండ నెటమేరస' వినిపించి. . .
ऊपर वाले कमरे से पुलिसवाले को कहते सुना, "बिंगो. "	కింద నుంచి, పోలీసు పెకి "బింగో" అని అనటం విననాను.
विलियमस ने अपनी सामने वाली जेब से बंदूक निकाली	విలియమస తన పయాంటు ముందు నుంచి నలల తుపాకీ తీశాడు
यह मेरे लिए परेरणादायक था कि उन खिलाडियों ने	ఆ కరీడాకారులు అతనికి సందేశానని అందించటానికి
पुलिस अफसर गराहम ने अपने झूठ को सवीकार किया.	పి/ఓ గరాహం తను అబదదం చెపపినటటు ఒపపుకుననాడు.
हम जानते थे, गिबसन की अपनी परेशानियाँ थीं.	గిబసనకు తన సమసయలు తనకు ఉననాయని మాకు తెలుసు.
भरषटाचार तहकीकात ने किया पुलिस की ओर इशारा	అవినీతి దరయాపతు పోలీసులను చికకులలో పడేసింది
इस तरह मिटा दी जाएगी मानो कुछ हुआ ही न था.	తుడిచిపెటటుకు పోతాయని కొతత ఆశలు కలిగించాయి.
दूसरे लोगों के मुकदमे फिर शुरू हो रहे हैं.	ఇతర వయకతులు కొతత విచారణలు ఎదురకొంటుననారు.
खुद को बचाने का सबसे अचछा तरीका होता था	మీ టరాకస తెలియకుండా చేయటానికి ఉతతమ మారగం
"मैं मीक मिल की गिरफतारी में शामिल था. "	"నేను మీక మిల అరెసటులో భాగసతుడినే" అని.
मेनसा डीन पतरकार - फिलाडेलफिया इनकवायरर	మెనషా డీన విలేకరి - ఫిలడెలఫియా ఎంకవెరర
मैंने पुलिसवाले से पूछा, "अपने बेटे से बात कर सकती हूँ? " उसने कहा, "नहीं. "	నేను పోలీసును అడిగాను, "మా అబబాయితో మాటలాడవచచా? " అని, అతను "లేదు" అననాడు.
और वह थी. . . हम सब उस इलाके में गए.	అది. . . మేమందరం ఆ పరాంతానికి వెళళాం.
कुल जाँच परिणाम/अनुशंसा दोषी/बरखासतगी	సమగర కనుగొననవి/సిఫారసు నేరం/కొటటివేత
और जिला अटॉरनी के दफतर से पता चला है	గరాహం విశవసనీయత అనుమానాసపదంగా ఉననందున
तो, हम उसी के लिए परारथना कर रहे हैं.	కాబటటి మేం దాని కోసం పరారథిసతుననాము.
शुरुआत 11 से 23 महीने की सजा से हुई थी, जो बढकर करीब 10 से 12 साल हो गई.	అది 11 నుంచి 23 నెలలతో మొదలయి, తరువాత దాదాపు 10 నుంచి 12 ఏళళు అయయింది.
सारे अफसरों को दोषमुकत कर दिया गया.	అధికారులు అందరూ నివృతతి చేయబడడారు.
तो अब हम साउथ टवंटी सेकंड पर हैं.	ఇపపుడు మనం దకషిణ 22వ వీధిలో ఉననాం.
यहाँ तक कि जब उस पर आरोप लगाए गए,	అరెసటు రికారడులు కూడా చూపిసతుననది,
जिसमें 66 पुलिस अफसरों के नाम हैं.	ఒక పరతయేక జాబితాను తయారు చేసింది.
और हमारे साथ बहुत से अहम लोग थे	మాకు మా చుటటూ చాలా ముఖయమెన వాళళు
अब चीजें कुछ बेहतर होने लगी हैं.	ఇక అతనికి అననీ అనుకూలిసతుననాయి.
और पुलिसवाले, हमें रोक रहे थे.	పోలీసులు మమమలని అడడుకుంటుననారు.
हम देखना चाहते थे कि अफसरों ने अदालती कागजातों और कटघरे में	మేము అధికారులు కోరటు పేపరలలో మరియు బోనులో వారు వివరించినటటుగా
जब उसकी मौत हुई, तो लगा, मानो मेरा एक हिससा मुझसे दूर हो गया.	ఆమె చనిపోయినపపుడు, నాలో ఒక భాగానని కోలపోయినటటు అనిపించింది.
यह जानने के लिए कि पुलिसवाले मेरे भाई को कयों मार रहे हैं?	ఎందుకంటే ఈ పోలీసులు ఎందుకు మా సోదరుడిని అలా కొడుతుననారు?
पर वह कहानी मैंने नहीं लिखी.	అది నేను ఇపపుడు రాసినది కాదు.
उनके पास मेरा पैसा है, भाई!	వాళళు నా డబబులు తీసుకుననారు!
और, जैसे, कुछ लोग उस समय बस पुलिस की गाडी चला रहे थे.	ఉదాహరణకు, అందులో కొందరు కేవలం పోలీస వాహనం నడుపుతుననారు.
और जब पीछे से अंदर गए, मीक हमें एक कमरे में मिला.	మేము వెనుక నుంచి వెళళినపపుడు, మీక గది కనుగొనగలిగాం.
मैंने कहा, "मुझे नहीं पता था कि वह मीक मिल है. "	నేను చెపపాను, "నాకు అతను మీక మిల అని తెలియదు" అని.
मैं बहुत खुश हूँ और बस अब यह देखना है कि कया होने वाला है, समझ रहे हो न?	నేను సంతోషంగా ఉననాను, ఏమి జరుగుతుందోనని వేచి చూసతుననాను, నా భావం అరథమయిందా?
बहुत सी कोशिशों के बाद हमें एक पुलिस अफसर मिला,	చాలా, చాలా పరయతనాల తరువాత, మాకు ఒక పోలీసు అధికారి
कि यदि उस घर में पैसा है, वह भी बहुत सारा पैसा,	ఒకవేళ ఆ ఇంటలో చాలా డబబు ఉండుంటే, చాలా ఎకకువ డబబు,
जो यह है कि कया मीक ने अफसरों पर बंदूक तानी थी?	అంటే, అసలు మీక ఈ అధికాారులకు తుపాకి గురి పెటటాడా?
पापी विलियमस मीक का बेटा	పాపీ విలియమస మీక కొడుకు
नशीमा विलियमस मीक की बहन	నషీమా విలియమస మీక సోదరి
फिलाडेलफिया पुलिस विभाग	ఫిలడెలఫియా పోలీసు విభాగం
अभी भी हमारी जज वही है.	ఆ నయాయమూరతి ఇంకా ఉననాడు.
जब तक मैं सामने के दरवाजे से निकला, वे लोग रमीक को असपताल ले जा रहे थे.	నేను ముందు తలుపు దగగరకు వెళళేసరికి రమీకను ఆసుపతరికి తీసుకెళుతుననారు.
ऑफिसर गराहम और जॉनसन ने दावा किया कि विलियमस ने उन पर बंदूक तानी थी.	అధికారులు గరాహం, జానసనలు విలియమస తమపెకి తుపాకి గురిపెటటాడని ఆరోపించారు.
कई पुलिसवाले हमसे बात करने से इंकार कर देते थे.	చాలా మంది పోలీసులు మాటలాడటానికి నిరాకరించారు.
और उसे ऑफिसर गराहम और जॉनसन पर तानते नहीं देखा.	అధికారులు గరాహం, జానసనలకు గురిపెటటగా చూడలేదు.
मेरा नाम जेरलड गिबसन है. यहाँ दिए तथयों की मुझे वयकतिगत जानकारी है,	నేను జరాలడ గిబసన. ఇందుమీదట వాంగమూలం ఇచచిన వాసతవాల పె నాకు అవగాహన ఉంది,
फिलाडेलफिया के छह नारकोटिकस पुलिसवालों के कथित भरषटाचार का खुलासा.	ఆరుగురు ఫిలడెలఫియా నారకోటికస పోలీసులు అవినీతి ఆరోపణను బటటబయలు చేశారు.
विलियम बेली मीक का कजिन	విలియమ బెయిలీ మీక కజిన
आंतरिक मामलों के विभाग दवारा एक और छानबीन से	అంతరగత వయవహారాల విభాగం జరిపిన తదుపరి పరిశోధనలో
"उसने यह कयों किया था? उसने वह कयों किया था? "	"అతను ఇలా చేశాడు కదా? అతను అలా చేశాడు కదా? "
मीक के बहुत से दोसत हैं, और हर कोई कह रहा है,	మీకకు చాలా మంది సనేహితులు ఉననారు, వాళళందరూ,
हम छापा मारने वाली जगह से दो बलॉक दूर रुके.	మేము లకషయ పరాంతానికి రెండు వీధుల అవతల ఉననాము.
यदि विलियमस ने ऐसा किया होता, तो अफसरों ने उसे गोली मार दी होती.	ఒకవేళ విలియమస అలా చేసుంటే, అధికారులు అతనని కాలచి చంపేసి ఉండే వాళళు.
ईगलस की जीत हुई, 41-33	ఈగిలస గెలిచారు, 41-33
जहाँ पर सौदा होता हुआ	ఆ లావాదేవి జరుగుతుండగా
सेनटर सिटी फिलाडेलफिया	సెంటర సిటీ ఫిలడెలఫియా
अगर मैं कहूँ कि मुझे पता है वे वहाँ कया कर रहे थे, तो वह झूठ होगा.	అయితే, అకకడ వాళళు ఏం చేసతుననారో చెబితే అబదధం చెపపినటటు ఉంటుంది.
केवल रिकॉरड में ही नहीं, बलकि शपथपतर में भी,	అధికారికంగానే కాకుండా, పరమాణ పతరాలలో కూడా,
लाखों डॉलर लूटे और चुराए गए थे जिनके लिए वे वारंट निकालते थे.	ఇంకా వాళళ దగగర వారెంట ఉనన ఇళళలలో ఉననవారి దగగర నుంచి తీసుకుననారు.
और वे सारी नशीली दवा मेज पर रख देते हैं.	టేబులపెన పెటటినపపుడు, చాలా పరచారం ఉంటుంది.
लैरी करैजनर (डी) फिलाडेलफिया जिला अटॉरनी	లారీ కరాసనర (డి) ఫిలడెలఫియా డిసటరిక అటారనీ
डीए का दफतर भरषट अफसरों की एक सूची रखता है	డిఎ కారయాలయం కళంకిత అధికారుల జాబితా ఉంది
