पिकेटमोटरस. कॉम	పికెటమోటరస. కామ
हमारे परेत के आने तक यह महज एक चीज है.	మన పోలట వచచేదాకా ఇదొక వసతువు, అంతే.
इतनी जलदी बुलाने पर आने का शुकरिया.	కబురు పెటటిన వెంటనే వచచినందుకు థాంకయూ.
अचछा. तो जाओ. अंदर चलो.	సరే. కానివవు. లోపలికి రా.
हमें संभावनाओं के बारे में सोचना होगा, ठीक है?	మనం అనుకోకుండా జరిగేవాటి గురించి మాటలాడాలి, సరేనా?
शायद आप सोच रहे होंगे कि हम गाडी से कयों उतरे?	వాహనం వదిలి బయటకి ఎందుకొచచామా అని ఆలోచిసతుంటారుగా?
आपको पाकर खुशकिसमत हैं.	మీ అండ ఉండటం వాటి అదృషటం.
-अंदर झाँककर देखा? -नहीं.	-లోపలికి చూశావా? -లేదు.
तुमहें मुझसे कया चाहिए?	నా నుండి నీకేం కావాలి, ఆ?
लिऑन हमारा पीछा करते यहाँ तक चला आया.	లియోన మనలని ఇకకడ దాకా అనుసరించాడు.
तुमहें किसी चीज जैसा महसूस हो रहा है?	నీకు నువవే ఓ వసతువులా అనిపిసతుందా?
साथ में थोडा सा आधयातमिक अंदाज भी है.	కానీ విషాద సంగీతం అంతరలీనంగా ఉంది.
उसे समझना अभी भी मुशकिल हो रहा है.	ఆ ముడి విపపడానికి ఇంకా సతమతమవుతుననాం.
मैंने इसलिए नहीं पूछा ताकि मुझे अचछा महसूस करवाओ.	నాకు ఊరట కలిగించే జవాబు చెపతావని అది అడగలేదు.
शायद तुम सोच रही हो, "मुझे मार डालो, फिर खेल खतम", है न?	నువవిలా అనుకుంటూ ఉంటావు, "ననను చంపు, ఆట అయిపోతుంది" అని, కదా?
वे तुमहारे घर में हैं?	మీ ఇంటిపె తిరుగుతుననాయా?
तो फिर तुमहें बचपना नहीं करना चाहिए.	అయితే చిననపిలలల పరవరతన ఆపేయాలేమో.
ऐश अभी पूछ रही थी. . .	యాష ఇపపుడే అడిగింది. . .
साफ लगता है कि उसकी पुतली की मदद से,	ఆమె కనుగుడడును ఇనసటిటయూటకు చెందిన
पूरी तरह से महसूस होगा, केवल तसवीर और आवाज नहीं.	చూడటం, వినటమే కాదు, ఇందరియాలననీ సంధానమయయాయి.
डॉ. नयूलैंड?	డా. నులాండ?
यही कि तुम उस सबसे अहम सवाल के जवाब का पता लगाओ.	ఆ అతి ముఖయమెన పరశనకు నువవు జవాబు కనుకకోవాలి.
नहीं, शक पैदा होगा. मेरे इशारे के लिए रुको.	వదదు, పారిపోయినటటు ఉంటుంది. నా సంకేతం కోసం ఆగు.
-आपका मतलब. . . -देखो, मैं सीधे-सीधे बताता हूँ.	-అంటే, అది. . . -చూడు, నేను సూటిగా చెపతాను.
दोनों को. करियाकरम पर न आने के लिए.	మీ ఇదదరని. ఆయన చనిపోతే రానందుకు.
और हैपटिकस के चलते, मुझे यह पता था.	హాపటికస వలల, ఆ జఞాపకం నాలో ఉంది.
जैसा कि मैंने कहा, मैं उममीद नहीं करती कि तुम समझोगे.	ఇందాకే చెపపాగా, నువవు అరథం చేసుకుంటావని నేను ఆశించడం లేదు.
और बात पककी हो जाएगी.	ఇక మన ఒపపందం ఖాయమెనటటే.
तुमहारे कैंपर के बाहर	నీకు నీ గుంపులో జనాలంతా
शायद सोचूँगा कि यह सारा पैसा कहाँ से आ रहा है.	డబబంతా ఎకకడి నుండి వసతోందని ఆశచరయమేసతోంది.
और तुमने वह देखा जो नहीं देखना था.	చూడకూడనిది ఏదో చూశావని చెపపాను.
मेरा एक काम करो तो खाने की तैयारी करूँगी.	నువవు ఓ పని చేసి పెడితే వంట చేయడం మొదలుపెడతా.
एलीटा की तलाश जारी रखो, और मैं एक घंटे में वापस लौटूँगी.	మీరు ఎలీటా కోసం వెతుకుతూ ఉండండి, నేను గంటలో వసతాను.
दो आतमाओं का एक होना पयार के जैसा महसूस हो सकता है.	ఒకలాంటి పరేమగా అనిపించవచచు, నీకు అంతకు మించి తెలియకపోతే.
मेरे परिवार, कलेपट कुलीनतंतर के चलते, हमने तुमहें शामिल किया.	నా కుటుంబం, అంటే విసతృతమెన కలెపట పెతతందారుల వలలే, నినను తీసుకుననాం.
लाओ. मैं खोल देता हूँ.	ఇదిగో. నేను తీసతాను.
तुम लोग वहाँ से चोरी कर रहे थे न?	మీరు దాననుండి దొంగలించారు కదా?
यह हमारी जिममेदारी है.	అలా చేయడం మా కరతవయం.
अचछा बचचा.	మంచబబాయివి.
एलीटा ने उसे मार डाला?	ఎలీటా ఆమెను చంపిందా?
ऊँचाई से डर लगता है?	ఎతతెన పరదేశాలంటే భయమా?
यह बात साफ नहीं है कि कौन सा परिवार है, पर अनुमान लगाना हो तो. . .	కచచితంగా ఏ కుటుంబం అననది అసపషటంగా ఉంది, కానీ నా అంచనాలో. . .
कया बात है?	సమసయ ఏంటి?
उसे वापस भेज सकती हूँ.	తనను ఇంటికి పంపగలను.
चाय में एक रसायन है.	ఆ టీలో ఒక రసాయనం ఉంది.
चिंता है कि ठीक से नहीं सोच रहीं.	నీ ఆలోచన సపషటంగా లేదని దిగులు.
पर उसके लिए जो मेहनत चाहिए. . . जितना खयाल रखना चाहिए.	కానీ దానని అలా ఉంచడానికి పడాలసిన శరమ. . . ఆ శరదధ.
मैं फिशर परिवार को लेकर थोडा सा परेशान हूँ.	నేను ఫిషరల గురించి కొంత దిగులుపడుతుననా.
अगर आप कोई राज साझा करने के लिए मजबूर महसूस करें. . .	ఒక రహసయానని పంచుకోవాలని నీకు బలంగా అనిపిసతే. . .
उसकी पतनी, बिली ऐन?	అతని భారయ, బిలలీ యాన?
तो पता है कया मिला?	ఏం కనుకకుననానో చెపపు?
वे मुझे और मेरी बहन को मारने के लिए कितना दे रहे थे?	ననను, నా సోదరిని చంపడానికి మీకు ఎంత ఇసతామననారు?
बेशक, हम उनहें दूर रखने की पूरी कोशिश करते हैं.	వాటిని దూరంగా పెటటడానికి మాకు ఎంత వీలెతే అంత చేసతాం.
नहीं, सर. मैंने बताया कि कया चाहिए, उनहोंने दे दिया.	లేదండి. నేను ఎందుకు వచచానో చెపపా, వాళళు ఇచచారు.
जो हमारे शहर में वापस आ रही है.	అది మళళీ మన ఊరికి రాబోతోంది.
तो मैं लेटे-लेटे तुमहारी बहन और तुमहारी पहेली हल करने की कोशिश करती हूँ.	'నీ సోదరి, నువవు' అనే పొడుపు కథని పరిషకరించడానికి పరయతనిసతుంటాను.
मेडिकल करमचारियों को चमतकार आता है. वह ठीक ही होगी.	వెదయ సిబబంది అదభుతాలు చేయగలరు. ఆమె బాగుంటుంది.
मुझे समझ में नहीं आता कि उसे पहेलियाँ बुझाने की कया जरूरत है.	తను అలాంటి పొడుపు కథలు ఎందుకు చెబుతుందో నాకు అరథం కాదు.
तुम एक "परिफरल" के अंदर हो.	"పెరిఫరల" అనేదానిలో మీరుననారు.
नहीं, सर.	తెలియదండి.
साठ डिगरी सेलसियस. लगभग एक घंटा लगता है.	60 డిగరీల సెలసియస. గంటసేపు పడుతుంది.
बहुत गरमी हो रही है!	లోపల వేడెకకుతోంది!
बहुत गरमी हो रही है!	లోపల వేడెకకుతోంది!
बेवकूफ बनकर गुजारना.	మూరఖుడిగా గడపవచచు.
तुमहारे घर के पीछे लाशें. जादुई दवा.	మీ ఇంటి వెనుక శవాలు. అదభుతాలు చేసే ఔషధం.
वे छापने नहीं देंगे.	మీకు అనుమతి ఇవవరు.
गाडी रोको.	కారు ఆపు.
वुलफगैंग.	వూలఫగయాంగ.
और तुमहें उसका मतलब पता है?	తను ఏ అరథంలో అందో నీకు తెలుసా?
मेरियल का.	మరియెలకు.
दो इसतेमाल हो चुकी हैं. यह तीसरी है.	వాటిలో రెండింటిని వాడాం. ఇది మూడవ పరయటన.
-फलिन ने तुमहें दिया? -मेकन और एडवरड ने.	-దానని ఫలిన ఇచచిందా? -మేకన, ఎడవరడలు.
तुमहारी घडी कया समय दिखाती है?	మీ గడియారంలో సమయం ఎంత ఉంది?
कोरबेल पिकेट नाम के आदमी से तुमहारा कया संबंध है?	కారబెల పికెట అనే మనిషితో నీకునన సంబంధం ఏంటి?
तो, उस डिपॉजिट के बारे में सोच रही हूँ.	నేను ఆ డిపాజిట గురించి ఆలోచిసతుననా.
शायद हमारी हैसियत कुछ जयादा ही ऊँची थी.	నీ జనమసథలానికి చెందిన పరతయేకతల వలల.
कई दिनों तक बिना पौषटिक सनान के रखे गए.	పోషక సనానం లేకుండా అలాగే వదిలేశారు.
एलीटा भी वहीं काम करती है.	ఎలీటా పని చేసే చోటు కూడా అదే.
तो शायद तुमहें खुद से पूछना होगा, किसके परति वफादार?	కాబటటి నినను నువవు పరశనించుకోవాలి, దేనికి విధేయుడిని? అని.
मैं घर जा सकती हूँ, कानसटेबल?	ఇంటికి వెళళనా, కానిసటేబుల?
थोडा ठीक करना बाकी है, पर उतना बुरा हाल नहीं है.	కాసతంత మెరుగు చేయాలి, కానీ అంత ఘోరంగా లేవు.
और इस बार उसने हिसाब चुकता करने के लिए	వారికి అభిపరాయ బేధాలను హింసాతమకంగా
और ओलड हवाना में मेरा वह नया दोसत?	పాత హవానాలో ఉనన నా కొతత మితరుడి సంగతి?
अभी तक पूछा नहीं.	ఇంకా ఆమెను అడగలేదు.
यह कया हो रहा है?	అకకడ ఏం జరుగుతోంది?
पर तुम इस बार से इंकार नहीं कर सकते कि हमने तुमहें बेहतर से बेहतर जिंदगी दी.	కానీ అనని విషయాలలోనూ నీకు ఉతతమమెనవే ఇచచామనే విషయానని నువవు కాదనలేవు.
उसके चलते हमारे ये दोसत थोडे से उततेजित हो उठे हैं.	మన బుజజి మితరులని అది కాసత అలజడికి గురి చేసిందనుకుంటుననా.
उसके ठिकाने का जो भी पता था, मैंने वह बता दिया.	తన ఆచూకీ గురించి నాకు తెలిసినదంతా చెపపాను.
अभी तक तुमहें माफ नहीं किया.	నేను నిననింకా మననించలేదు.
पर अगर इसका कोई सबक है तो	కానీ ఇందులో ఏదెనా నీతి ఉంటే,
तो, तुम नहीं चाहोगे कि उनके साथ कुछ बुरा हो, है न?	అయితే, వారికి ఏ చెడూ జరగకూడదని నువవు అనుకుంటుననావు, కదా?
हमें मारने के लिए, किसी को पीछे आने में कितना समय लगेगा?	మరొకరు వచచి మమమలని చంపడానికి ఇంకెంత కాలం పడుతుంది?
फिर तो मैं कमजोर नजर आऊँगा, नहीं?	అది ననను బలహీనుడిగా చూపెడుతుంది, కదా?
सब को पता है कि आपको काम रहता है.	మీకు తీరికే ఉండదని మా అందరికీ తెలుసు.
बिना जाने कि उनहें कितना खतरा है.	అవి ఎంత దురబలమెనవి అనన ఎరుకే లేకుండా.
एलीटा की मदद से मेरी दुनिया में चोरी से घुसना?	ఎలీటాను నా పరపంచంలోకి చొరబడటానికి వాడుతూ?
अपने ठिकाने को लेकर एलीटा एक सुराग पीछे छोड गई. एक पहेली.	ఎలీటా తన జాడ గురించి ఓ సంకేతానని వదిలి వెళళింది. అదొక పొడుపు కథ.
द परिफरल	ద పెరిఫరల
आज सुबह हमने इसे खरीद लिया.	ఈ ఉదయం మనం దీనని కొననాం.
धत, यार.	ఛత, బాబు.
मेरी गैरमौजूदगी में, तुमने मुझे किसी बकसे में रखा कया?	నేను ఇకకడ లేనపపుడు ననను పెటటెలో పెటటరని చెపపండి.
ऑकसफोरडशायर में हमारे साथ आकर रहोगी?	మాతో వచచి ఆకసఫరడషెరలో జీవిసతావా?
और हमारी चाय काफी ठंडी हो गई है.	మన టీ రుచీపచీలేని వేడికి ఆరిపోయింది.
उसका नतीजा होगा.	మా రకతం కారుతుంది.
वे ऐसे उडते हैं.	అవి ఎగిరేది అలానే.
और यह परिफरल में रेनी पोरटिस है.	ఇక పెరిఫరలలో ఉనన ఈవిడ రెయినీ పోరటిస.
और, यह फॉरएवर फैब से है.	పెగా, అవి ఫరెవర ఫయాబ నుండి.
एलीटा का?	ఎలీటాదా?
ऐसा लगता है कि एलीटा वेसट गरेस होगारट के साथ सकूल में पढती थी.	చూసతుంటే, ఎలీటా వెసట గరేస హోగారటకు బాలయంలో సకూలు సహచరి.
पहुँचकर आदमी को एहसास होता है कि उसे बदलाव करना होगा.	మనిషికి ఇక మారాలి అని గరహించే పరిసథితి వసతుంది.
पता करो कि मेरियल कौन है, फिर आगे देखो.	మరియెల ఎవరో కనుగొని, అటు నుండి ముందుకెళళండి.
आम तौर पर मुझे पता न होता कि कया कर रहा हूँ.	నేను ఏం చేసతుననానో కూడా నాకే తెలియలేదు.
आपको पता है कि मुझे ऐसा करना पसंद नहीं.	అలా చేయడం నాకు సరిగా అనిపించదని మీకు తెలుసు.
बाकी जिंदगी रेड अनियन सुपरमैकस में,	నీ శేష జీవితానని పరభుతవ జెలులో,
सेंपर का मतलब जानती हो?	నీకు ఎలలపపుడూ అంటే తెలుసా?
तुमहारी पूरी टोली आग के आसपास बैठी रहती है. पर मैं?	ఆ బండి ముందునన నిపపు చుటటూ ఉంటారు. కానీ నాకు?
तकनीकी रूप से, मैं वही हूँ. पर अफसोस तुमहारे सवाल में एक कमी है. . .	సాంకేతికంగా, నేను వసతువునే. కానీ నీ పరశనలో ఒక లోపం ఉంది. . .
और आगे भी यही चाहती हूँ. कयों?	అలాగే ఉంటే మంచిది. ఎందుకు అడిగారు?
वुलफ आ सकता है?	వూలఫ కూడా రావచచా?
कोशिश करके देखिए.	పరయతనించి చూడు.
जो उनकी हैसियत से थोडा बडा है.	అది వాళళ సామరథయానికి మించిన విషయం.
मेरे पापा के गुजरने के बाद रुक गई.	మా నానన మృతి తరవాత ఆగిపోయింది.
तुमहें इस सब से हैरत होती है? उनका मुझे दो लाख देना?	ఇది నీకు ఆశచరయంగా ఉందా? వాళళు నాకు 2 లకషల డాలరలు ఇవవడమనేది?
हम सिरफ एक को गोद लेने की सोच रहे थे.	మేం ఒకకరిని మాతరమే దతతత తీసుకోవాలనుకుననాం.
जानती हूँ. मुझे फेडेलिस का मतलब भी पता है.	తెలుసు. నాకు విధేయత అంటే కూడా తెలుసు.
अंगरेज डॉकटर. हैजा फैलने का कारण ढूँढा था.	ఇంగలీషు వెదయుడు. కలరా వయాపతి ఆవిషకరత.
पर उसके लिए मुझे उनहें कुछ हद तक यकीन दिलाना होगा.	దానని సగమెనా ఒపపించగలిగే మారగం నాకు కనపడితే.
बरटन, तुम बेरहमी से कोरबेल पिकेट को नहीं मार सकते.	బరటన, నువవు కారబెల పికెటను నిరదయగా చంపకూడదు.
द परिफरल में आगे देखिए	ద పెరిఫరల రాబోయే ఎపిసోడలో
कयों न थोडा पैदल चलें? देखते हैं अगर कुछ नजर आ जाए.	అయితే మనం కాసేపు నడుదదామా? ఏదెనా గురతుకు వసతుందా అని చూడు.
और इसमें से कुछ भी लेने का सोचना भी मत, जैसपर बेकर.	ఇందులో ఉననవి తీసుకోవడం గురించి ఆలోచనెనా చేయకు, జాసపర బేకర.
अरे यार, मैं साँस नहीं ले पा रहा!	కానివవు, నాకు శవాస ఆడటం లేదు!
इसलिए हम जो चाहे कर सकते हैं.	కనుక మనకేం కావాలో అది చేసుకోవచచు.
जुड सकते हैं, मेरा सब दिखेगा.	సంధానమెతే, నీ చూపు నాది అవుతుంది.
मैं बुरी बात जानना चाहता हूँ.	బెదిరింపు గురించి కుతూహలంగా ఉంది.
मुझे यह औरत अचछी लगने लगी है.	నాకు ఈమెపె పరేమ భావనలు మొదలయయాయి.
-मजाक था. -बहुत मजेदार भी था.	-తమాషాకు అననాను. -భలే నవవొసతోంది.
-मैं वह कैसे करूँ? -खुद सोचो.	-దానని ఎలా చేయాలి? -నువవే కనుకకో.
या तुम जहाँ से आए थे वह मददेनजर रखते हुए,	లేదా మా పరమాణాలు మరీ ఎకకువ ఉననాయేమో,
वादा करता हूँ, ऐसा कुछ नहीं जो आपके कारोबार में दखल देगा.	మీ వయాపారానని దెబబతీసేది అయితే కాదు, మాటిసతుననాను.
