लूसी, दरवाजा खोलो. दरवाजा खोलो, घर चलते हैं.	తలుపు తెరువు, లూసీ. తలుపు తెరువు, ఇంటికి వెళదాం.
इस बंजर जमीन को देखें तो	ఈ బంజరునేలను చూశావంటే,
पर एक असफल देश को जिंदा रखना सही नहीं होता.	కానీ విఫల దేశానని సజీవంగా ఉంచడం అసహజంగా ఉండేది.
हेनरी, पर सब मुझे हॅनक कहते हैं.	హెనరీ, కానీ అందరూ ననను హాంక అంటారు.
जहाँ वॉलट के वादे के मुताबिक सब था.	వాలటలు వాగదానం చేసిన పరతిదీ అదే.
सैकडों साल लग सकते हैं.	అది వందల ఏళలు కావచచు.
बचचों को माँ-बाप से अलग कर दें.	తలలిదండరులు, పిలలలను వేరు చేయవచచు.
जैसे उनहोंने 200 साल पहले किया था.	వాళలు 200 ఏళల కరితం చేసినటలుగా.
उनका पिप-बॉय कहाँ गया?	తన పిప బాయకు ఏమెంది?
मैं आऊंगा.	కనిపెడతాను.
तब मैं मेरी बेटी जेनी के बारे में सोचती हूँ.	నేను నా కూతురి గురించి ఆలోచిసతాను. జేనీ.
अगर दुनिया की समसया है कि गुट हमेशा लडते रहते हैं,	పరపంచంతో సమసయ ఏమిటంటే, వరగాలు అంతులేని పోరాటం చేసతుంటే,
चलो! पलीज!	రా! దయచేసి!
तुम यहाँ इसके साथ रुक सकती हो,	నువవు ఇపపుడు ఇకకడ అతనితో ఉండవచచు,
सुनो, मैकस.	హేయ. మాకస.
और लूसी, मैं मानता हूँ कि मुझे पता है मैंने सही फैसला किया.	నేను నమముతుననాను, లూసీ, నేను సరెన ఎంపిక చేసుకుననానని నాకు తెలుసు.
सारी जिंदगी तुम अपने घर को तलाश रहे हो.	నీ జీవితం మొతతం, నువవు ఇంటి కోసమే వెతికావు.
हर समसया का जवाब उसके पास है.	ఉననాయని భావించే సంసథలో ఓ భాగంగా.
और उसने तुमहें खतरे में डाला.	మిమమలని పరమాదంలోకి తీసుకెళలింది.
भविषय की कुंजी. . .	భవిషయతతుకు కీలకం. . .
पर बिकरी ठीक ही है.	మన అమమకాలు బాగుననాయి.
कार खराब मैंने ही की, तो यह भी मुझे ही करना था.	నీ ఆయిల మారపును నేను చెడగొటటాక కనీసం ఇదెనా చేయాలిగా.
तो गुटों को खतम करने के अलावा और कया समाधान है?	అపపుడు ఆయా వరగాలను వదిలించుకోవడం తపప పరిషకారం ఏమిటి?
और अगर वह चीज तुम मुझे लाकर दो,	నా దగగరకు ఆ తలను తీసుకువసతే,
उनके बारे में तुम कया जानती हो?	మా అమమ గురించి నీకేం తెలుసు?
हॅनक के बेटे, तुम नहीं जा सकते.	ఇంటికి పోలేవు, హాంక పుతరుడా.
जो बिना मारगदरशन के यूँ ही बन गया है,	రూపుదిదదుకునన మన పరసతుత సామాజిక ఏరపాటులో,
{\an8}फरेडी, तुम तो जुआघर चलाकर भी दिवालिया हो सकते हो.	{\an8}నువవే మాటలాడాలి, ఫరెడడీ బాబూ, కేసినోలో డబబు పోగొటటగలవు.
वह है समय.	అది సమయం.
तुमहारे पिता के साथ.	నేను ఇంకా మీ నానన.
मैं मदद कर सकता हूँ.	మీకు సాయం చేయగలను.
कूप. सुनो.	కూప. హేయ.
रोज, हमने कर दिखाया.	మనం సాధించాం, రోజ.
आप जो भी करना चाहें, किसी को पता नहीं चलेगा.	మీరేం చేయాలనుకుననా, ఎవరికీ తెలియాలసిన అవసరం లేదు.
तब वे तुमहें और यहाँ के सभी लोगों को मार डालेंगे.	వాళలు నినను, ఇకకడ ఉనన పరతి ఒకకరినీ చంపుతారు.
तुमहारा कोई साथी मुशकिल में फँस गया हो.	దురదృషటం పాలవడం ఇది మొదటిసారి కాదు.
वरटिकल इंटीगरेशन या ऐसा ही कुछ. . .	ఏదో విలీన కారయకరమం లాంటిదేదో, లేదా. . .
मेरे साथ अपना घर खुद बनाओ.	నాతో కలిసి ఓ ఇంటిని నిరమించు.
मानवता के भविषय की कुंजी. . .	మానవ భవిషయతతుకు కీలకం. . .
मानवता के भविषय की कुंजी. . .	మానవ భవిషయతతుకు కీలకం. . .
मैं चला. जेनी को रससी की कलाकारी सिखानी है.	ఇక వెళతాను. జేనీకి తాళలతో ఆట నేరపుతానని మాటిచచా.
पर हम बात कर रहे हैं बहुत बडा निवेश करने की	కానీ ఊహ ఆధారంగా గణనీయమెన పెటటుబడి పెటటడం గురించి
और तब उसे पता चला कि उसका पति, यानी ओवरसियर	ఇక అపపుడే ఆమె గరహించింది, తన భరత, ఆ పరయవేకషకుడు,
फॉलआउट पर पिछली बार	ఫాలౌట ఇంతకు ముందు
- तुमहें मेरे साथ आना था. - वे खोजना कभी बंद नहीं करेंगे.	- నువవు నాతో రావాలిగా. - వాళలు వెతకడం ఏనాటికీ ఆపరు.
अंतहीन युदध चलता है	అంతులేని యుదధంలో,
अचछा? मेरे बचचे नहीं हैं,	అవునా? ఇక, నాకు పిలలలు లేరు,
नतीजों की गारंटी कैसे देंगे?	ఫలితాలకు హామీ ఎలా ఇసతారు?
कयोंकि आखिरकार बडे विनाश का असरदार हथियार कया है?	ఎందుకంటే, ఏదేమెనా, సామూహిక విధవంసంలో అంతిమ ఆయుధం ఏమిటి?
असली दुनिया में.	నిజమెన పరపంచంలోకి.
और अब भी झूठ बोल रहे हो.	ఇపపుడు అబదధం చెపపినటలుగానే.
नहीं, वह मीटिंग में हैं.	మననించాలి, ఆమె భేటీలో ఉంది.
जब बाहर आने का समय होगा,	బయటకు వచచే సమయం వచచినపపుడు,
अगर मैं बातचीत को पटरी पर लाने की कोशिश करूँ!	నేను సంభాషణను తిరిగి కేందరీకరించగలిగితే!
रुको! मैं यहां ओवरसियर हूँ.	ఆగు! ఇకకడ పరయవేకషణ నాదే.
आपको वह सीन याद है जिसमें आप जोई टोरो को गोली मारते हैं?	ఆ సననివేశం తెలుసుగా, అందులో మీరు ఆ ముఖంతో జోయి టోరోగా చేశారుగా?
मुझे ऐसा करना पसंद नहीं, पर कया आप मुझे ऑटोगराफ देंगे?	అలా ఉండడం నాకు నచచదు, కానీ నాకు ఆటోగరాఫ ఇవవగలరా?
पलीज, दरवाजा खोलो, लूसी.	దయచేసి. తలుపు తెరువు, లూసీ.
कयोंकि उनहोंने किया. . .	ఎందుకంటే అది ఆయనే, ఆయన. . .
ए. मैकस.	హే. మాకస.
तुमहारा बाप वहीं गया है.	మీ నానన అకకడికే బయలుదేరాడు.
बात यह है कि कुछ पाने में बडी रुकावट है	దాని పరాథమిక ఆలోచన, మానవ జీవితకాలపు సంకషిపతత
तुमहारा पिप-बॉय अजीब काम कर रहा है?	నీ పిప బోయ వింతగా పరవరతిసతోందా?
उनहें बताने की जरूरत नहीं.	వాళలకు తెలిసే పని లేదు.
या हजारों साल लगते हैं.	పని చేయకుండా మమమలని ఆపింది
आजकल यह जयादा दिखती नहीं है, है न?	అవి అంత ఎకకువగా కనబడవు, అవునా?
मैं ही कर लूँगी. बस यह देखना है कि	లేదు, నేనే సరిచేయగలను. పిప బోయ
यह कैसी जगह है?	అసలు ఈ చోటు ఏంటి?
मैंने खुद के साथ जो किया उसकी सजा.	నేను నాకు చేసుకుననదానికి శికష.
इस पल के बारे में मैंने बहुत सोचा है.	ఈ కషణంపె ఆలోచనకు నాకు చాలా సమయం దొరికింది.
कोई कहीं नहीं जा पाएगा, काश ऐसा होता.	ఇక వెళలడం కూడా ఉండదు, ఉండాలని కోరుకుననాను.
पता नहीं नए मॉडल में इसे ठीक किया या नहीं.	ఈ కొతత మోడలలో అది సరిచేశారో లేదో మరి.
ठंडा फयूजन, अनंत ऊरजा.	కోలడ ఫయూజన, అనంతమెన శకతి.
जिसमें यही सब होता है.	అది సహజంగా అలాగే ఉంటుంది.
बारब ने बताया तो होगा?	బారబ మీకది చెపపుంటుందిగా?
लूसी, चलो, चलें. चलो. . .	లూసీ, వెళలిపో. ఇక. . .
- लूसी, इधर देखो. - एक बेहतर दुनिया.	- లూసీ, ననను చూడు. - మెరుగెన లోకం కాగలదు.
कया हुआ?	ఏమెంది?
धनयवाद, बेटटी.	ధనయవాదాలు, బెటీ.
सब ठीक है, मि. हॉवरड?	అంతా బాగుందా, మి. హావరడ?
इसलिए वॉलट टेक का भरोसेमंद गुरगा ही	ఇక, విశవసనీయమెన వాలట టెక అనుచరుడు మాతరమే
वॉलट टेक	వాలటటెక
सतह पर जाने की तैयारी पूरी होने तक.	మన అందరం ఉపరితలం పెకి వెళలే వరకు మాతరమే.
मैंने 200 साल इंतजार किया है	ఇక, అసలు ఎవరినెనా ఓ పరశన అడగాలని
मुझे उसी से मिलना है.	వాళలతోనే నేను మాటలాడాలి.
ठीक है.	అలగలాగే.
मैं लाता हूँ. मैं ले आऊँगा, चिंता मत करो.	నేను అరథం చేసుకుంటా. అరథం చేసుకుంటా, చింతించకు.
हवा में दिमाग खराब करने वाली दवाएँ डालें.	మేము సెకోటరోపిక ఔషధాలను గాలి సరఫరాలోకి పంపవచచు.
- पयार है तुमसे. - मुझे भी.	- ఐ లవ యూ. - నేను కూడా ఐ లవ యూ.
कयों न किसी वॉलट में अवैध आपरवासियों की मदद से बना हुआ	అకరమ వలసదారుల దవారా సూపర మయూటెంట సెనికుడిని అభివృదధి చేయడానికి
परमाणु बम गिरना बुरी बात तो है,	అణు సంఘటన అనేది ఒక విషాదమే,
यूँ कहो कि तुमहारी इस दुनिया की हर बात का फैसला	మీ మొతతం చినన పరపంచం గురించి పరతిదీ 200 సంవతసరాల కరితం
रुको! मैं आ रहा हूँ.	ఆగు! నీ కోసం వసతుననాను.
आप सबको इसपर चरचा करने के लिए बुलाया है.	దానిపె చరచించడానికి మిమమలని ఇకకడకు ఆహవానించాం.
यही असली एकाधिकार होगा.	నిజమెన ఏకఛతరాధిపతయం.
मैं बाहर जाने से डरता था. पता नहीं था इसका दोष तुम पर लगेगा.	విసతారమెన పరాంతానికి వెళలడమంటే భయం. అందుకు నినను నిందిసతారని తెలియదు.
सटेफनी हारपर - पूरा हुआ	సటెఫనీ హారపర - పూరతి
रुको. सवालों के जवाब नहीं मिलेंगे	ఆగు, ఆగు. నేను నీ పరశనలకు జవాబు ఇవవను,
पलीज, मिलॉरड.	దయచేసి, మిలారడ.
नहीं, लूसी, इसकी बात मत सुनना.	వదదు, లూసీ, ఆమె మాట వినకు.
इंसानों के भविषय की कुंजी. . .	మానవ భవిషయతతుకు కీలకం. . .
- समय. - समय.	- కాలం. - కాలం.
मैं तुमहारे डैड से कैसे मिली यह सुनना चाहोगी?	నాకు మీ నానన ఎలా తెలుసో అని నీకు చెబితే ఎలా ఉంటుంది?
पर वह घर छोडकर गई, तबसे तुमहारी माँ नहीं रही.	కానీ ఆమె ఇంటి నుంచి వెళలాక మీ అమమగా ఉండడం మానేసింది.
टाइटस की मौत कैसे हुई?	టెటస ఎలా చనిపోయాడు?
. . . परशिकषित कनिषठ अधिकारियों का सटाफ. . .	. . . పరయవేకషించే జూనియర ఉదయోగులు. . .
डैड, उसे कोड दे दो.	ఆమెకు కోడ ఇవవు, నాననా.
हॅनक मॅकलीन - पूरा हुआ	హాంక మెకలెన - పూరతి
इसमें एक ही कमी है.	దానితో ఒకటే సమసయ ఉంది.
- कया वह. . . - फयूजन कोर है.	- అది ఓ. . . - ఫయూజన కోర.
अपनी बीवी की जासूसी करूँ?	నా భారయ మీద ననను నిఘా వేయమనా?
हम अपने कुछ वॉलट में सहयोग चाहते हैं.	మా వాలటలలో కొననింటికి సహకరించాలని మా కోరిక.
बात बरदरहुड की है. पता तो चल जाएगा.	అది బరదరహుడ. వాళలు కనిపెడతారు.
आजकल ऐसा देखने में नहीं आता.	అలాంటిది ఎకకువగా కనబడదు.
और उसके साथ ही	ఇంకా దానితో,
आप गंतवय तक पहुँच गए हैं	మీరు మీ గమయసథానం చేరుకుననారు
पता है, ऐसी कार रखने वाले जयादातर लोग. . .	ఇలాంటి పరయాణం చేసే చాలా మంది కురరాళలు, వాళలు. . .
इंसान की छोटी-सी जिंदगी.	సాధించడానికి అతిపెదద అడడంకి.
लूसी, चलो. यहाँ से निकलते हैं.	లూసీ, వెళలిపో. ఇకకడి నుంచి వెళలిపో.
पर फिर उसका पति भी वहाँ आ गया.	కానీ అపపుడు ఆమె భరత తన వెంట వచచాడు.
करायो बड के दोसत रीएकटिवेट की सथिति	కరయో బడస బడస రీయాకటివేషన సథితి
वह कमीना गूल कहां है?	ఆ జీవ పిశాచి ఎకకడ?
घर चलते हैं.	ఇంటికి వెళదాం.
घर चलते हैं.	ఇంటికి వెళదాం.
पता है मैं उसे कैसे जानता हूँ?	మీ నానన నాకెలా తెలుసో తెలుసుకోవాలా?
कयोंकि मानवता का भविषय एक शबद पर टिका है.	ఎందుకంటే మానవాళి భవిషయతతు ఒకక పదానికి వచచేసింది.
तुमहारी माँ को भी नहीं बताया.	అతను మీ అమమకు కూడా ఏనాడూ చెపపలేదు.
तो शालीनता से बात करते हैं.	మనం మనుషులుగా ముగిదదాం.
सबसे अचछा आइडिया जीत जाएगा.	ఇక ఉతతమ ఆలోచన గెలవవచచు.
मैकस, कोई जगह सुरकषित नहीं.	భదరత ఎకకడా ఉండదు, మాకస.
आने वाली कई सदियों तक चला सकेंगे. निफटी.	నా పరాజెకటను టరాక చేసతుంది. నిఫటీ.
नहीं, आपने आँकडे देखे ही नहीं हैं.	లేదు, లేదు, మీరు నిజంగా సంఖయలను చూడలేదు.
मैं किसी से मिला,	నేను ఒకరిని కలిశాను,
उनकी हिंसक और हमारी शांति वाली दुनिया के बीच.	వాళల హింసాతమక పరపంచానికి, మన శాంతియుత పరపంచానికి మధయ.
लगभग 200 साल पहले हो गया था.	నిరణయించబడిందని చెపపాలసి ఉంటుంది.
उनहें सिर चाहिए न? मैं उनहें सिर दूँगा.	వాళలకు తల కావాలా? నేను తల ఇసతాను.
अपनी परतिसपरधा को खतम करने का बेहतरीन हथियार कया है?	మీ పోటీని నాశనం చేయడానికి అంతిమ ఆయుధం ఏమిటి?
मेरी माँ. . .	మా అమమ. . .
करमचारी आईडी:	ఉదయోగి ఐడీ:
लूसी, मैं तुमहारा बाप हूँ.	నేను నీ తండరిని, లూసీ.
लगता है तुमने तब भी झूठ बोला था.	అయితే అబదధమాడావని నా అంచనా.
शुरू हो रहा है. . .	ఆరంభిసతోంది. . .
मुझे 31 में लौटना है.	నేను 31 కి తిరిగి రావాలి.
तो कया हम किसी दिन कैफै कबाना जा सकते हैं?	సరే, బహుశా, మనమంతా ఎపపుడెనా కెఫే కబానాకు వెళలగలమా?
खरीद कर कबजा कर लिया.	దానిని సొంతం చేసుకుననారు.
पिंजरे में बहुत-से चूहे रखने पर	మీరు ఆ ఎలుకల సమూహానని ఎకకువ కాలం పాటు
उसे मैं बेहतर भविषय कैसे दूँगी?	ఆమెకు మంచి భవిషయతతును ఎలా అందించగలను?
वह जहाँ की है, वहीं जाऊँगा मैं.	ఆమె వచచిన చోటుకు నేను తిరిగి వెళతాను.
- हम अपनी दुनिया बनाएँगे. - यह हतयारी है.	- మనం మన సొంత పరపంచం నిరమించగలం. - ఆమె హంతకురాలు.
तुम भविषय बदल सकती हो अगर तुम मुझे मोलडेवर तक पहुँचा दो.	నువవు ననను మోలడేవర దగగరకు తీసుకుని వెళలగలిగితే భవిషయతతును మారచగలవు.
है न?	అవునా?
फॉलआउट	ఫాలౌట
वह सच में कौन है सुनोगी?	నిజంగా అతను ఎవరోనని.
एक ऐसे संगठन का हिससा हैं जिसे लगता था दुनिया की	పరపంచంలోని అనని సమసయలకు తమ వదద సమాధానాలు
जैसा मैंने. . .	ఆ విధంగా నేను. . .
रुको, डेन, तुमहें भेज रहे हैं?	ఆగు, డేన, నినను పంపుతారా?
परीकषण	పరీకష
मुझे फैसला करना पडा.	నేను ఓ ఎంపిక చేసుకోవాలి.
हम खुद इसे आकार दें.	మనం మాతరమే తీరచిదిదదాలి.
तुम मुझे कुछ नहीं करोगी.	నువవు ననను బాధించవు.
- कबूल करो. - मुझे मत मारिए और मैं वहां पहुंचा दूंगा.	- ఒపపుకో. - ననను చంపకండి, నేను తీసుకెళలగలను.
हम ऐसे काम नहीं कर पाते जिनमें सदियाँ लगती हैं,	శతాబదాలు, సహసరాబది కాలం కూడా పరాజెకటలపె
तुमने कहीं और काम करने का सोचा है?	వేరే చోట పని చేయడంపె ఎపపుడెనా ఆలోచించావా?
