जून लेंकर	జూన లెంకర
उसने एक अपंजीकृत नंबर पर 34 सेकंड बात की, जो अब सेवा में नहीं है.	ఒక రిజిసటర కాని నంబరుకు కాల చేసి 34 సెకనలు మాటలాడాడు, ఇపపుడు ఆ ఫోన మనుగడలో లేదు.
- तुमहें पकका यकीन है कि वह टरकी लौट गया? - हाँ.	- అతను టరకీకే వెళలిపోయాడు అంటావా? - హా.
बारह साल बाद,	పననెండేళల తరవాత,
जून. कया हुआ?	జూన. ఏంటి సంగతి?
- जानता हूँ. और हम सभी को तुमसे सहानुभूति है. - मेरा मतलब, आपको मानना होगा. . .	- తెలుసు. మేమందరమూ నీకు అండగా ఉననాం. - మీరు ఒకటి ఆలోచించాలి. . .
तुम इसे सात अलग-अलग तरीकों से लिख सकती हो.	ఆ ఒకక పేరుకి ఏడు సపెలలింగస ఉననాయి.
मैं रोज इस बारे में सोचता हूँ. . .	పరతిరోజూ అది ననను కలచివేసతూనే ఉంటుంది. . .
आदरश पुलिस काररवाई. उनहोंने उसे पुरानी केमप रोड के एक टरैप हाउस से गिरफतार किया.	పోలీసులంటే అలా ఉండాలి. అతను పాత కెంప రోడడులోని ఓ డరగస తయారీ ఇంటలో ఉననాడని తెలిసి వెళలి పటటుకుననారు.
आपको कभी नहीं भूलेंगे	ఎలలపపుడూ మా మదిలోనే ఉంటావు
एक महिला है जो कारला नामक किसी महिला को ढूँढ रही है.	మేము కారలా అనే ఒక యువతి కోసం వెతుకుతుననాం.
वह यहाँ कब तक रहेंगे?	అతను ఎంత కాలం ఇకకడ ఉంటాడు?
और मैं टोनी से कया कहूँगी?	మరి టోనీకి ఏం చెపపను?
इसे जलते हुए देखो #कोईनियमनहीं #जलो #भाडमेंगईपुलिस	తగలబడటం చూడండి #నియమాలు లేవు #తగలబడమమా తగలబడు #తొకకలో పోలీసులు
अरे, वह बेहद साफ और जोर से बोलती थी.	చాలా సపషటంగా, గటటిగా చెపపేది.
मैं वादा करती हूँ, हम तुमहारी मदद कर सकते हैं.	నేను నీకు సాయపడగలను, మాటిసతుననా కూడా.
कौन समझदार आदमी वह हथियार अपने पास रखेगा?	బుదధి ఉననవాడు ఎవడెనా ఆ తుపాకీని తమతోనే ఉంచుకుంటారా?
हैलो?	హలో?
हासाड	హసాద
कया?	ఏంటి?
ए, भाड में जाओ!	హేయ, దొబబేయ!
मैं कुछ कर सकता हूँ?	నేనేమెనా చేయాలా?
वह मेरी कार है!	అది నా కారు!
ठीक है. धनयवाद.	సరే. థయాంకస.
कया?	ఏంటి?
मेरा मतलब, चलिए भी. आपको मानना होगा	అరథం కావటలేదా మీకు? అననీ ఇలా
- यह तुमने बनाया? - हाँ.	- దీనని నువవే చేశావా? - అవును.
कया?	ఏంటి?
हैलो?	హలో?
हैलो.	హలో.
सुरकषित.	రకషణ ఉందట.
- कारला? - बस यह बंद करो.	- కారలా. - ఇక ఆపండి.
आइजैक को लगी गोली जेसन की बंदूक से मेल खाती है.	ఐసాక మెదడులోని బులలెట, జేసన ఆయుధానికి చెందినదే అని తేలింది.
देखिए, मुझे इस सबके लिए खेद है, बॉस, ठीक है?	ఈ విషయంలో ననను కషమించు, బాస, సరేనా?
हाँ, कितनी बार गिरफतार हो चुका है?	హా, ఎననిసారలు అరెసట అయయాడు?
उप-शीरषक अनुवादक: मून कलिता	సబ టెటిళలను అనువదించినది: రాంపరసాద
अठारह, 20 सालों की सजा. तुमहें यह ठीक लगता है?	పదదెనిమిది, 20 ఏళలు హుష కాకీ అయిపోతాయి. అది నీకు పరవాలేదా?
खोजें मुसतफा डेमिर लंदन	సెరచ చేయండి ముసతఫా డెమీర లండన
अब वह अतीत बन चुका है. मुझे परेशान करना बंद करो.	అదెపపుడో జరిగిపోయింది. ఇక ననను వదిలేయ.
कारला, तुम कहाँ हो?	కారలా, ఎకకడుననావు నువవు?
- बहुत-बहुत धनयवाद. - उसे कया कहते हैं. . .	- చాలా చాలా థయాంకస. - ఏమంటారు. . .
ठीक है. दरअसल, मैं आपको बताना चाहती थी. . .	సరే. మీకు నేనొక విషయం చెపపాలి. . .
- पर हम सबकी गाडियों को टरैक किया जा रहा है. - अरे, बस भी करो.	- కానీ మన వాహనాలననింటికీ టరాకింగ ఉంటుంది. - అబబా.
तो, तुम झूठ बोल रहे थे? तुमहें धमकाया गया था?	కాబటటి, నువవు అబదధం ఆడుతుననావా? ఎవరెనా నినను బెదిరించారా?
हम एक टरकिश आदमी को ढूँढ रहे हैं. धनयवाद.	టరకీ దేశానికి చెందినవాడి కోసం వెతుకుతుననాం. థయాంకయూ.
कयोंकि वह उस पर हतया की कोशिश का आरोप लगाने पर जोर दे रहा है.	ఎందుకంటే, అతను హతయాయతనం కేసు వేయాలని చూసతుననాడు.
मैं तुमहारी मदद करना चाहता हूँ, जेसन.	నీకు సాయపడాలనుకుంటుననా, జేసన.
अह, मेरी बात सुनो, उस महिला बॉस को फोन करो जो टीवी पर आई थी.	ఒకటి చెపపనా, టీవీలో మాటలాడిన మీ బాస కి కాల చేయ.
मेरा मतलब, पारक में बचचे को गोली मारने के बाद,	పారకులో ఎవరెనా ఒక పిలలాడిని కాలచితే,
अगले हफते मिलेंगे.	మళలీ వచచే వారం కలుదదాం.
काश मैं वहाँ होती.	నేను అకకడ ఉంటే బాగుండు.
खान एंड कंपनी सॉलिसिटरस	ఖాన & కో సొలిసిటరస
जेसन, मैं सुझाव देना चाहूँगा कि तुम अपने अधिकार का. . .	జేసన, నువవు చెపపాలసిన అవసరం లేదని నీకు. . .
उस ऑफिसर ने अपना नाम नहीं बताया.	ఆ పోలీసోడు పేరు చెపపలేదట.
मैं गंभीर हूँ. हाँ. अगर जैसे के साथ तैसा ही करना है, तो फिर. . .	నిజంగానే చెపతుననా. వాళలకి ఆ మందే సరెనది అయితే. . .
यह जानकर खुशी हुई.	మంచి విషయమేలే.
ठीक है.	సరే. సరే.
तुम यह कर सकते हो?	నువవు చేయగలవా?
बढिया है.	మంచిది.
बढिया है.	మంచిది.
कया तुमहारे नए दोसतों को उस आपातकालीन कॉल पर किए गए कुछ खास दावों के बारे में पता है?	ఆ ఎమరజెనసీ కాల లో చెపపిన కొనని విషయాలు నీ కొతత సనేహితులకి చెపపావా?
पर नैना मो से कुछ मत कहना, समझे? तुमहें पता है वह कैसी हैं.	దీని గురించి మౌ బామమకి చెపపకు, సరేనా? తను కంగారుపడిపోతుందని నీకు తెలుసు కదా.
एरॉल और तुमहारी माँ चीख और. . . चिलला रहे थे.	ఎరరొల, ఇంకా మీ అమమ అరుచుకుంటుననారు. . . కేకలు పెడుతుననారు.
मैंने तुमहारी माँ को. . . रसोई में देखा.	మీ అమమని. . . వంట గదిలో చూశాను.
तुम कुछ नहीं बदल सकती.	నువవేమీ మారచలేవు.
मुददा वह नहीं है.	నేను చెపపేది అది కాదు.
डाउनिंग सटरीट में कुछ लोग हैं जिनहें गिरफतार किए जाने की जरूरत है.	మీరు అరెసట చేయాలసింది డౌనింగ సటరీటులో ఉనన పిసతాలను.
हाँ, धनयवाद. यह बढिया होगा.	హా, థయాంకస. నాకు కూడా నీళళే కావాలి.
मैं बस यह कह रही हूँ कि, अगर तुमने कुछ सुना, तो कृपया मुझे बस फोन कर देना.	నీకేమెనా తెలిసతే, నాకు ఫోన చేయి అని మాతరమే నీకు చెపతుననా.
मैं वह नहीं लूँगा. मैं वह नहीं लूँगा. देखो, मुझे किसी भी गोलीबारी के बारे में कुछ नहीं पता.	నాకు ఇవవవదదు. నేను తీసుకోను. చూడండి, నాకు ఆ కాలపుల గురించి ఏమీ తెలీదు.
- हैलो. - पानी लोगी?	- హాయ. - మంచి నీళలు ఇవవనా?
इसे अपनी आँख पर रखो.	దీనని నీ కంటి మీద పెటటుకో.
- काम पर सब ठीक है? - हाँ.	- మరేం పరలేదా? - హా.
वह काफी जवान थी जब उसने तुमहें जनम दिया था.	మీ అమమ చినన వయససులోనే నినను కంది.
- कि यह बिलकुल सही समय पर हुआ है. - बस करो.	- వరుసగా జరుగుతుననాయి. - ఇక చాలు.
- मैंने उनहें उस मासूम बचचे को गोली मारते देखा था. - ठीक है.	- వాళలు ఆ పిలలాడిని కాలచడం నేను చూశాను. - సరే.
हम तुमहारी तरह लचीले नहीं हैं.	నీకుననంత అండ మాకు లేదు.
- यह कया है? - तुमहारी माँ देख रही हैं, ठीक है?	- ఏంటిది? - మీ అమమే చూసతోంది, సరేనా?
हम फलैट में घुसे. एक पडोसी ने 999 को फोन किया था.	మేము ఇంటలోకి పరవేశించాం. పొరుగున ఉండేవారు ఎవరో 999కి కాల చేశారు.
- हाँ, पर तुम. . . - सुनो.	- అవును, కానీ నువవు. . . - చూడండి.
कयों न हम तुमहारे रहने की जगह बदलने की कोशिश करें, हाँ?	నీ ఫలాట ని మారచే పరయతనం చేదదాంలే, ఏమంటావు?
मुझे इस सबके लिए बेहद खेद है.	నేను చేసిన దానికి కషమాపణ కోరుతుననానని.
उनहोंने उस बेचारी महिला के बेटे के साथ असल में कया किया था?	పాపం, ఆ అమాయక డోరిస కొడుకుని వీళలు ఏం చేశారు?
तुमहें विशवास होता है? उसकी सवीकारोकति पर?	అతని నేరాంగీకారానని నమముతుననావా?
कयोंकि उनहोंने यही कहा था. देखो.	అలా చేసతే కానీ నాకు నినను ఇవవమననారు. చూడు.
तो कहीं अगर उनहें तुमहारे घर का पता मिले, हमें तैयार रहना होगा.	వాళలకి నీ ఇలలు ఎకకడుందో తెలిసతే ఇక అంతే సంగతులు.
कुछ ऑन. . . कया?	ఏవేవో. . . అంటే ఏంటి?
गिरोह संबंधी चीजें. वे दिखा रहे हैं कि आगे वे कया करेंगे, समझी?	ముఠా అలలరలు. తరవాత వాళలు ఏం చేసతారో చూపుతుననారు.
मुझे पता था कि मुझे तुमहें मेरा बैमी और एसकोविच खिलाकर मोटा करना होगा.	నా సపెషల పరోటాలు, నెలలూరు చేపల పులుసు చేసిపెటటి నినను లావు చేయాలని నాకు అపపుడే అరథమెపోయింది.
- वे तसवीरें? - वे चेहरे.	- ఫోటోలా? - ముఖాలు.
मेरी कार जला दी गई.	నా కారు బూడిద అయిపోయింది.
जनमदिन मुबारक हो, माँ.	పుటటినరోజు శుభాకాంకషలు, అమమా.
अचानक आ धमकते हैं, आदेश देना शुरू करते हैं, हमसे डरगस बिकवाते हैं.	హఠాతతుగా వసతారు, ఆదేశాలు ఇసతారు, మాకు డరగస ఇసతారు.
फासीवादी लोग, कॉमबैट लीग.	ఛాందసవాదులు, ఏమెనా చేసతారు వాళలు.
हमारे पास एक चशमदीद गवाह है.	దానని కళళారా చూసిన వారు మాకు చెపపారు.
उसे बेहद गरव होता. हाँ, सच में.	మీ అమమ చాలా గరవ పడేది. నిజంగానే చెపతుననా.
मैं तुमहें दोबारा वह घटना दोहरा कर बताऊँ?	మళలీ ఆ రోజు జరిగిందేంటో చెపపనా?
हम ऐसी ही दुनिया में रहते हैं. इसके आदी हो जाओ, समझे?	మన పరపంచం ఇదే. దానికి అలవాటు పడు, సరేనా?
जाहिर तौर पर, तुम उसकी अनयतर उपसथिति की गवाही नहीं दे सके थे.	ఎరరొల నినను కలిశాడననది నిజం కాదని చెపపావట కదా.
तब दरअसल वह तुमहारी नाई की दुकान में काम के लिए पूछने आया था.	నీ బారబర షాప లోనే పని కోసం వచచాడని చెపతుననాడు.
"कृपया, माँ. बस पाँच मिनट. बस पाँच मिनट. "	"పలీజ, అమమా. ఒకక అయిదు నిమిషాలు, అయిదే నిమిషాలు, " అంటూ.
पर फिलहाल. . . जाँच चल रही है.	కానీ ఈ. . . ఈ దరయాపతు ఇంకా కొనసాగుతోంది.
हाँ.	హా.
हाँ.	హా.
किम, मैं यहाँ एक कॉल का इंतजार कर रहा हूँ.	నాకు ఒక ఫోన కాల రావాలి, దాని కోసం ఎదురు చూసతూ ఉననా, కిమ.
ठीक है. "हासाड"?	సరే. "హసాద"?
इंटरनेट पर ढूँढा, वगैरह-वगैरह. कयों?	ఇంటరనెటులో గాలించా, ఇంకా చాలా చాలా చేశా. ఎందుకు?
हाँ.	హా.
हाँ.	హా.
कोई नहीं.	ఎవరూ లేరులే.
हाँ.	హా.
हाँ.	హా.
पडोसी, वह झगडा, वह खून, शवपरीकषा.	పకకింటివాళల ఫిరయాదు, గొడవ, రకతం, పోసట మారటమ.
हाँ, और?	అయితే?
यह बस आम परकरिया है. बस इस पर धयान मत देना, ठीक है?	ఇది మామూలుగా జరుగుతూ ఉండేదే. నువవు ఆన లెన లో దీని కోసం చూడకు, సరేనా?
मैं तुमहारी रकषा करना चाहता हूँ.	నినను కాపాడాలనుకుంటుననా.
आरोप है कि तुमने कारयसथल पर किसी पर दादागिरी की.	ఆఫీసులో మీరు బెదిరింపులకు పాలపడడారట.
हाँ.	హా.
मरिया डी सूजा की. कलाइव सिलकॉकस केस.	మరియా డి సౌజాకి సంబంధించినది. కలెవ సిలకాకస కేసు.
आठ सालों से.	ఎనిమిదేళల నుండి.
हाँ.	హా.
तो सही हो या गलत, वे सजा के तौर पर या तो तुमहें मार डालेंगे	అది ఎలాగెనా కానీ, వాళలు నినను ఏమెనా చేయవచచు,
लगता है मैं उस सदमे से कभी आजाद नहीं हूँगा.	ఆ సంఘటనని నేను మరచిపోలేకపోతుననా.
समझ रही हो? वह सुरकषित है.	మీకు అరథమవుతోందా? అతనికి రకషణ ఉంది.
तो मैंने लैब से बात की.	నేను లయాబొరేటరీ వాళలతో మాటలాడా.
आपने कितने हमलावरों को देखा था?	మీరు ఎంత మందిని చుశారు?
आपको यहाँ आने की जरूरत नहीं थी.	మీరు రావాలసిన పని లేదు.
हाँ. हाँ, हम यहाँ बाहर हैं.	హా, మేము ఇకకడ ఉననాం.
जेनी, आइजैक की माँ, वह. . .	ఐసాక అమమ, జెననీ. . .
कया किसी ने आशरय गृहों में फोन करना शुरू किया? हमारी गुमशुदा महिला को ढूँढते हुए.	శరణాలయాలకు ఎవరెనా కాల చేసతుననారా? మనం వెతుకుతునన వయకతి కోసం.
शायद वह सहयोग करने के बारे में सोच रहा है. . .	ఇపపుడు సహకరిదదాం అనుకుననాడేమో. . .
कया आप बहरे हैं? मैंने कहा नहीं था कि उसे मैंने गोली मारी थी?	మీకేమెనా చెముడా? కాలచింది నేనే అని చెపపా కదా?
कयों न मैं आपको आपके घर छोड आऊँ? चलिए.	మిమమలని ఇంటలో దింపనా? పదండి.
उससे कहना. . .	అతనికి చెపపండి. . .
माफ करना, कया?	మననించాలి, ఏమననారు?
गिरफतार करने वाले ऑफिसर: डीसी टोनी गिलफॉएल	అరెసట చేసిన పోలీసు ఆఫీసర: డిటెకటివ కానసటబుల టోనీ గిలఫోయిల
हम उन सबसे सामने आने का अनुरोध करते हैं	మంగళవారం మధయాహనం రౌన టరీ పారక పరిసరాలలో ఉనన వారందరికీ
ठीक है, तो हमारी योजना कया है?	సరే, ఇపపుడు ఏం చేదదాం?
तो, कया बात है?	ఏంటి సంగతి?
मुझे माफ कर दो.	సారీ. సారీ.
दरअसल, तुमहें देखना चाहिए कि वे गरुप चैट में तुमहें कया बुलाते हैं. वे. . .	గరూప చాట లో నీకు పెటటిన పేరును నువవు చూడాలి. వాళలు. . .
माफ करना. आप वयसत हैं?	మననించాలి. మీరు బిజీగా ఉననారా?
उसने अपराध सवीकार कर लिया.	అతను ఒపపేసుకుననాడు.
जो सिसोन	జోయి సికకోన
एडालेइड बरौज की पयारी याद में	అడిలెడ బరోస జఞాపకారథం
आपका शुकरिया अदा करने के लिए.	మీకు థయాంకస చెపదామని.
- माफ करना, तुम ठीक हो? - हाँ, मैं ठीक हूँ. मैं तुमहारी कया मदद कर सकती हूँ?	- సారీ, మీరు బాగానే ఉననారా? - హా, బాగానే ఉననా. చెపపండి.
मैं किसी मुसीबत में नहीं पडना चाहता.	నాకు చికకులలో పడాలని లేదు.
यह थोडा सुविधाजनक नहीं है?	ఇది అంతా బాగా నమమడానికి బాగుంది కదా?
हैलो. मैंने राउनटरी पारक में हुई गोलीबारी के बारे में बताने के लिए फोन किया है.	నేను రౌన టరీ పారకులో జరిగిన కాలపుల విషయమె కాల చేసతుననాను.
हाँ, पर मैंने तुम पर दादागिरी नहीं की थी. मेरा मतलब, हे भगवान, कलोई.	హా, కానీ బెదిరించలేదు కదా. ఏంటి కలోయి అలా అంటావు!
