कॉफी.	కాఫీ.
हम दो वयसक आदमी हैं जिनका जीवन कामयाब नहीं रहा.	మనం బాగా ఎదిగిన మగాళళం, కాకపోతే మన జీవితాలే ఇలా తగలడడాయి.
हैरिस ने मुझसे कहा था कि अगर कोई कुछ बोलना चाहे तो मैं उसे परोतसाहित करूँ.	ఎవరెనా మాటలాడాలనుకుంటే, వారికి ఆ అవకాశం ఇవవమని హయారిస అననాడు.
मैं आपको अपना पता भेज देता हूँ. और जैसा कि आपके पिता कहते थे, आ बियानटो यानि जलद मिलते हैं.	నేను మీకు నా చిరునామాని మెసేజ పంపుతా. మీ నాననగారు ఎపపుడూ అనే విధంగా, బె బె.
बुरा मत मानना.	తపపుగా అనుకోకండి.
-हम बात करते हैं. -हे भगवान.	-పరశాంతంగా మాటలాడుకుందాం. -దేవుడా.
कृपया, बस दो सेकंड के लिए, ठीक है?	రెండంటే రెండే కషణాలు, సరేనా?
-उसके कंधे पर पैर रखो. बहुत अचछे. -बहुत अचछे.	-అతని భుజంపె కాలు పెటటు. అంతే. -అంతే.
-मुझे याद दिलाने के लिए धनयवाद, रे. -कया, तुम भूल गए थे?	-గురతుచేసినందుకు థయాంకస. రే. -మరచిపోయావా ఏంటి?
पर बीतते समय के साथ, हमने एक-दूसरे से संपरक बनाए रखा है.	కానీ ఏళలు గడిచినా, ఇదదరం మాటలాడుకుంటూనే ఉననాం.
या अंतयेषटि में आने वालों को बाद में खाना खिला सकते हो.	లేదంటే, అంతయకరియలు అయయాక వచచిన వారికి మీరు ఒక విందు ఏరపాటు చేయవచచు.
और तुम जिस लडके को अपना बेटा सोचते थे, वह उनका बेटा था.	నువవు ఎవరినెతే నీ కొడుకని అనుకుంటుననావో, నిజానికి అతను వాడి కొడుకు.
वहाँ एक वह थियेटर जैसी खिडकी थी.	మధయలో చినన నాటికలలాంటిది వేశారు అననమాట.
मुझे नहीं लगता यह अचछा विचार है.	అది మంచి ఆలోచన అని నాకు అనిపించడం లేదు.
तुमहारा पिता, बेंजामिन रीड हैरिस तीसरा.	మీ నానన, బెంజమిన రీడ హయారిస III.
शायद मुझे हमेशा से लगता था वह ऐसा करेंगे.	నాకు ఎపపటనుంచో ఆయన ఆతమహతయ చేసుకుంటాడనే అనిపించేది.
इसका मतलब है तुमहारे दिमाग से उनहें निकालने के लिए	ఆ ముసలాయనని నీ ఆలోచనల నుండి దూరం చేయాలంటే
मैं यहाँ आसपास ही होऊँगा अगर आपको कोई जरूरत हो तो.	నేను ఇకకడే ఉంటా, ఏవెనా అవసరముంటే పిలవండి.
खुदकुशी की?	ఆతమహతయనా?
अपना पूरा बचपन मैं इसी चीज की कलपना करता रहा,	చిననపపుడు ఎలా ఆతమహతయ చేసుకుంటాడా అని ఊహించుకొనే వాడిని,
किस तरह के इंतजाम?	ఏరపాటలు అంటే ఎలాంటివి?
नहीं बताया.	చెపపలేదు.
मैं यह उठाने में मदद कर देता हूँ.	బయాగులను నేను తెసతానులెండి.
शरी वेसट?	మిసటర వెసట?
देखो ना, इसे ऐसी चीजें पसंद हैं. रीति-रिवाज.	అంటే, అతనికి ఆచారాల వంటివి నచచుతాయి.
हे भगवान.	ఓరి దేవుడా.
हे भगवान. अब कया हो रहा है?	అబబా. ఇపపుడు ఈయన ఏం చేసతాడో ఏంటో?
कयोंकि मेरी एक बेटी है और. . . उसे संभालना कोई बचचों का खेल नहीं.	ఎందుకంటే, నాకు కూతురు ఉంది. . . తనతో వేగలేకపోతుననాను.
कया मैंने कुछ कह दिया? एक बार साफ-साफ बता दो, फिर मैं चली जाऊँगी.	నేనేమెనా అననానా? చెపపేసేయ, నా దారిన నేను వెళలిపోతాను.
कया तुम उनसे पयार करती थीं?	మీరు ఆయనని పరేమించారా?
कयोंकि डरगस, चाहे अचछे हों या बुरे, तुमहें आनंद देते हैं.	ఎందుకంటే, డరగస మంచివెనా, చెడువెనా కానీ, అవి ఎనలేని ఆనందానని అందిసతాయి.
मैं पहले वह काम खतम करना चाहता हूँ.	ముందు, ఆ పని చేసతే నాకు మనశశాంతిగా ఉంటుంది.
कितनी रकम है?	ఇంకా ఎంత కటటాలి?
बहुत सवादिषट है.	వంట అదిరింది.
बहुत-बहुत धनयवाद. मुचा गरासियास.	అందరికీ థయాంకస. ధనయవాదాలు.
आप जरा यहाँ इंतजार करेंगे. मैं अभी आता हूँ.	మీరు ఏమనుకోకుండా ఇకకడే ఉంటారా, నేను ఇపపుడే వచచేసతాను.
मुझे पता चल गया था कि वह बार-बार एक ही गाना सुनते थे.	ఆయన వినన పాటనే పదే పదే వినేవాడని గరహించాను.
बहुत आकरषक थे. काफी संवेदनशील.	ఇటటే ఆకటటుకొనే మనిషి. సుననిత మనసకుడు.
उनहोंने अपनी सारी जमा-पूँजी, जो कि एक बैंक के खाते में करीब 5200 डॉलर हैं,	ఆయన ఆసథులననీ, అంటే బయాంక ఖాతాలో సుమారుగా 5, 200 డాలరలు ఉంది,
तुम अब भी उसी फैकटरी में ही काम कर रहे हो?	ఇంకా ఆ ఫయాకటరిలోనే పని చేసతుననావా?
मैं खाना पका रही हूँ.	నేను వండుతుననాను.
जरा रे को देखो. वह जैसे. . . कया कहते हैं?	రేని చూడు. అతను చాలా. . . ఏమంటారు?
चुप करो, रे, नहीं तो मैं तुमहें मार दूँगा.	ఇక ఆపు, రే, లేకపోతే నినను చంపేసతా.
उसने मुझे कुछ दिन रहने के लिए कहा है और मैं रहूँगा.	ఆమె ఇంకొనని రోజులు ఉండమని ననను ఆహవానించింది, నేను కూడా ఉంటుననా.
तुमने उनकी परेमिका के साथ संभोग किया, भाई!	నువవు ఈవిడతో పడక పంచుకుననావు, బరో!
वह अब वाकई चले गए हैं. मुझे यह महसूस हो रहा है.	అతను చనిపోయాడనే విషయం నాకు తెలుసతోంది.
हमारा रिशता खतम हो गया है.	మాకు అంతగా పొసగటలేదు.
यह बस एक बुरी आदत है.	అదొక చెడు అలవాటు అనుకోండి.
खास तौर पर एक लडके के साथ.	మరీ ముఖయంగా అబబాయిని.
तुम कहाँ काम करते हो?	నువవు ఎకకడ ఉదయోగం చేసతావు?
-कया बात है. शानदार. -वाह.	-వారెవవా. శభాష. -హేయ.
-तुम लोग वापस कब जा रहे हो? -आज रात को, बस से.	-మీరు ఎపపుడు బయలుదేరుతుననారు? -ఈరాతరికే బససులో వెళతుననాం.
मैं आज उसे जबरदसती अपने साथ यहाँ लेकर आया हूँ.	ఇవాళ ఇకకడికి అతడిని నేనే తీసుకొచచాను.
-बकवास बंद करो, रे! -हमारे पिता का सतयानाश हो!	-నోరమూసుకో, రే! -మన నానన ఒక దరిదరుడు!
कि उनके बेटे, बिना किसी मशीनों की मदद के, उनकी कबर खुद खोदें.	ఏ యంతరాల సాయం లేకుండా ఆయన కొడుకులే గోతిని తవవాలట.
कितना कुछ करके वह बच जाते थे. तुम सोच भी सकते हो?	చాలా ఘోరాలు చేసి భలే తపపించుకుననాడు. అసలు నువవు ఊహించుకోగలవా?
पता नहीं. कुछ विवाद हो गया था.	ఏమో మరి. చినన గొడవ అంతే.
कहाँ हैं हम?	ఎకకడ ఉననాం మనం?
-बस यही चाहिए? -हाँ.	-అంతేనా? -అవును.
जैसा कि वह चाहते थे.	మేము వెంటనే పరారంభించాలి.
-मैं पैसे नहीं दूँगा. -मैं दे दूँगा, रे.	-నేను కటటను. -నేను కడతానులే, రే.
आपका घर कहाँ है?	మీరు ఎకకడ ఉంటుననారు?
कया?	ఏంటి?
-हाँ. -यह रहा परमिट.	-అవును. -ఇదిగోండి అనుమతి.
-ऐसा मत कहो. -यही सच है.	-అలా అని అనకు. -అది నిజమే కదా.
-शांत हो जाओ, सांड. -ए, भाड में जाओ, रे.	-బాబోయ! కాసత ఆగు, పోటుగాడా. -నా చేతిలో చచచావు, రే.
हमारा बचपन अशांति से भरा था.	మన బాలయం ఎంత దారుణమెనదో తెలుసు కదా.
और कय. . .	అదీ. . .
हैलो.	హాయ.
कया मैं तुमहें जानती हूँ?	నేనెవరో మీకు తెలుసా?
उनके लिए यह महतवपूरण था.	అయనకి ఇది ముఖయమని అనిపించింది.
शरी कैनफीलड.	మిసటర కయానఫీలడ.
हैलो.	హలో.
हैलो.	హేయ.
हमें एक ही नाम दिया.	ఇదదరికీ ఒకే పేరు పెటటాడు.
रे पर इसका सबसे जयादा असर पडा.	రే అససలు భరించలేకపోయాడు.
मुसकुराते हुए सटाइल दिखाओ. हप!	నవవుతూ అదరగొటటేయాలి. చల!
पर वे लोग कितना समय एक साथ रहे? वह और तुमहारी माँ?	కానీ మీ అమమతో ఆయన ఎంత కాలం కలిసి ఉననాడు?
शरी कैनफीलड.	మిసటర కయానఫీలడ.
तुमहें कभी इसका अफसोस नहीं होगा.	ఆ అపరాధ భావం ఇక జీవితంలో నినను వెంటాడదు.
सुनो!	హేయ!
कया?	ఏంటి?
पर मेरी जानकारी के अनुसार, मृतयु परमाण-पतर में दिल की धडकन रुकना	కానీ మరణ ధృవీకరణ పతరంలో గుండె కొటటుకోవడం ఆగినందుకు,
-उसकी जरूरत नहीं होगी. -हाँ. हमारे पिता यहूदी नहीं थे.	-ఆ అవసరం లేదులెండి. -మా నానన యూదుడేమీ కాదు.
-तो मैंने सोचा थोडा कुछ हट कर करूँ. -सच में?	-నేను వేరేలా ఉండాలనుకుననా. -నిజంగా?
-जी, कया कहा? -यह मेरा भाई, रे, है.	-ఏమననారు? -ఇపపుడు మాటలాడింది నా సోదరుడు, రే.
वैसे, एक तरह से, यह सही भी लगता है.	ఒక రకంగా చూసతే, ఇది అరథవంతంగానే అనిపిసతోంది.
सिटी हॉल में करिसमस के पुषपचकर.	సిటీ హాలుపె కరిసమస అలంకరణలు చేసినందుకు.
सुनो, जरा उस वकील, मेनडेज को फोन करोगे?	హేయ, ఆ లాయర, మెండేజ కి కాల చేయ.
एक पिता बनना बहुत थकाने वाला काम था, चाहे वह बुरा पिता बनना ही कयों न हो.	మంచి తండరి కాకపోయినా, తండరిగా ఉండటం అనేదే చాలా కషటమెన పని.
मैं रिमैमबरैनस फयूनरल होमस से शरी कैनफीलड बोल रहा हूँ.	నేను రిమెంబరెనస ఫయూనెరల హోమస నుండి మిసటర కయానఫీలడ ని కాల చేసతుననాను.
तुम मेकअप की बात कर रहे हो?	వామమోయ, మీరు మేకప కూడా చేసతుననారా?
अगर कमरे में केवल मृत वयकति ही हो.	శవం పకకన ఎవరూ లేరని అననమాట.
-कया वह यही चाहते थे? -हाँ.	-అతనికి కూడా కావలసింది అదేనా? -హా.
-बहुत अचछे. -नीचे आ रहा है.	-బాగా చేశారు. -ఇపపుడు దిగుతుననాడు.
-कोई साथ चाहिए? -ऐसी कोई बात नहीं.	-నేను కూడా రానా? -పరవాలేదు.
कृपया, आप काम शुरू करें. हम वहाँ पहुँचेंगे तो आपके पैसे दे देंगे.	దయచేసి, మీ ఏరపాటలు మీరు చేయండి. మేము అకకడికి చేరుకుననపపుడు అంతా సరదుబాటు చేసేసతాం.
ऐसे लगता था जैसे इस बोझ के कारण मुझे साँस नहीं आ रही.	ఆ బరువుకు నేను సరిగగా వాయించలేకపోయేవాడిని.
खुद बजाने से जयादा सुनने से? उस समय तुम काफी अचछा बजा रहे थे.	వాయించడం కననా వింటుండటమే నీకు బాగుంటుందా? శమశాన వాటికలో చాలా చకకగా వాయించావు.
मैंने बस दो बीयर पी थीं.	రెండే బీరలు తాగాను.
वह झगडा किस बारे में था?	గొడవ ఎందుకు అయింది?
तुमहें 80 साल लग गए	అది నీ బాధను తగగించగలదని
ना. मुझसे मिलने से पहले ही हैरिस ने पीना छोड दिया था.	లేదు. హయారిస నాకు పరిచయం కాక ముందు నుండే తాగుడుకు దూరంగా ఉంటుననాడు.
वह तो केवल मारशा के साथ मेरी शादी पर आए थे.	ఆయన మారషాతో జరిగిన పెళలికే వచచాడు.
हैलो? रेवरेंड वेसट?	హలో? ఫాదర వెసట?
तुम इनसे आखिरी बार कब मिले थे?	ఈయనని చివరిసారిగా నువవు ఎపపుడు చూశావు?
तुमहें लगता है तुम नरक में बैठ कर मुझ पर हँस सकते हो, हँ?	నరకం నుండి ననను చూసి నవవుకుందామని అనుకుననావా?
चलो, काम शुरू करें.	ఇక పని కానివవు.
आमतौर पर, लोगों को एक ऐसी. . .	సాధారణంగా, పిలలలు వదదు అనుకుంటునన. . .
वह एक खुला ताबूत चाहते थे.	శవపేటిక తెరిచి ఉండేది కావాలననాడు.
उनहोंने कहा, "यह राज की बात है. "	" అది రహసయం, " అని అననాడు.
-हाँ. हालाँकि, ये ठंडे नहीं हैं. -कोई बात नहीं.	-ఉంది. కానీ వెచచగా ఉననాయి. -పరవాలేదు.
मैं अब बजाता नहीं हूँ.	నేను ఇపపుడు వాయించడం లేదులే.
यह तुमहारी है?	అది నీదేనా?
अथीना चल बसी और मुझे छोड गई. बाकी सब मेरी अपनी मरजी है.	అథీనా చనిపోయి నాకు దూరమెపోయింది. మిగిలిందంతా నాకు నచచినటటే జీవిసతుననా.
तीन घंटे से वह इस गरमी में ऐसे ही पडे हैं.	దాదాపు మూడు గంటల పాటు ఎండలో ఉంది.
किस चीज का डर?	దేనికి భయం?
चुप रहने में कया मजा है, हँ?	అందులో కికకేముంది, హా?
मैं जानना चाहता हूँ कि उनहें जमीन के नीचे दफन करना कैसा दिखता है,	అతడిని ఖననం చేసేటపపుడు ఎలా ఉంటుందో, ఎలా అనిపిసతుందో
तुम लोग उनके करीबी थे, है ना?	మీరు అతనితో సననిహితంగా ఉండేవాళలు కదా?
हमारे पिता गुजर गए हैं.	మన నానన చనిపోయాడు.
कि जैज बस अफरीकी कबीलों का संगीत है और यहूदी लोग पैसे बनाने के लिए इसका परचार करते हैं.	దానని సొమము చేసుకోవడానికి యూదులు పరచారం చేసతుంటారని మా నానన అనేవాడు.
वैसे, उनकी और पतनियाँ भी तो हैं.	ఆయనకి వేరే భారయలు ఉననారు.
आने-जाने का खरचा निकल जाए, शायद.	అలాగే రవాణా ఖరచులకు కూడా.
जैसे कोई दुखी पतनियों का कलब हो.	భరత బాధితుల భారయల సంఘంలా.
उनहें यह सब सुनकर बहुत मजा आएगा.	భలే గమమతతుగా ఫీల అవుతాడు.
मैंने उनहें और ताबूतों पर छूट देने की बात भी की थी पर उनहोंने इसी के लिए जोर दिया.	ఇతర శవపేటికలను తగగించి కూడా ఇసతానననాను, కానీ ఆయన ఇదే కావాలననాడు.
उनके पास आपको देने लायक पैसे थे?	మీకు ఫీజు చెలలించే సతోమత అసలు ఆయనకి ఉందా?
मतलब, जब मैं बजा रहा होता था, तो बीच में मुझे. . .	అంటే, నేను వాయిసతుననపపుడు మధయమధయలో. . .
पर अगर किसी ने मुझे रोका तो मैं बहुत बडी मुसीबत में फँस जाऊँगा.	దారలో పోలీసులు ఆపుంటే, నా బతుకు బసటాండ అయయుండేది.
हे भगवान.	దేవుడా.
रेवरेंड वेसट का फोन आया था.	ఫాదర వెసట కాల చేశాడు.
हे भगवान.	దేవుడా.
मुझे पता है यह कुछ जयादा नहीं लग रहा	అది పెదద మొతతమేమీ కాకపోవచచు,
धनयवाद.	పరవాలేదు.
धनयवाद.	పరవాలేదు.
तुम कया कर रहे हो?	ఏం చేసతుననావు?
मैं देख लूँगा.	నాకేమీ పరవాలేదులే.
हो सके तो किसी तरह मुझे माफ कर देना.	ననను కషమించడానికి పరయతనించు.
मैंने एक महिला को यहाँ से जाते हुए देखा था. वह रिशता बनाने लायक है?	ఇందాక ఒక మహిళ బయటకు వెళలడం చూశాను. తను మంచి ఆవిడేనా?
-उनहोंने ऐसे ही लिखने को कहा था? -कया उनहोंने बताया, कयों?	-ఆయన అలాగే కావాలననాడు. -ఎందుకో ఏమెనా చెపపాడా?
-कुल मिलाकर कितने भाई हैं? -मुझे बिलकुल नहीं पता.	-మొతతం ఎంత మంది సోదరులు? -నాకు తెలీదు.
सब ठीक है. तुम यहाँ सुरकषित हो.	ఇకకడ అంతా బాగానే ఉంటుంది. నీకు ఏమీ కాదు.
तुम आजकल कोई कारयकरम कर रहे हो?	ఎకకడెనా షోలు చేసతుననావా?
हाँ. हमने मना नहीं किया.	అవును. కానీ మేము ఆ పని చేయలేదు.
यह तकलीफ में लग रहे हैं.	అసౌకరయంగా ఉననటటు అనిపిసతుననాడు.
हाँ. खैर, यह तो सच है.	అవును. అది నిజమే.
