एक रात में रनवे रिपेयर किया.	ఒకే రాతరిలో రనవేను మరమమతులు చేశారు.
अब हम अपनी सेना चाहे राजसथान से भेजे या पूना से भेजे या जामनगर से भेजे	మనము మన దళాలను రాజసథాన, పూణే లేదా జామ నగర నుండి పంపినా
उनहोंने जंगे लगी ना जोरू के लिए ना जररे के लिए और ना जमीन के लिए.	అతను మహిళల ఆసతి, లేదా సంపద కోసం ఈ యుదధాలు చేయలేదు.
इस गांव में अब सिरफ बचचे बुजुरग और औरतें है.	ఈ గరామంలో మహిళలు, పిలలలు మరియు పాత వయకతులు మాతరమే ఉననారు.
ये सैनिक 4 से 8 घंटे में आपकी चौकी पर पहुँच जाएंगे.	వారు మీ పోసటకు 4-8 గంటల లోపల చేరుకుంటారు
विकरम, हमारा मिशन सफल हो गया है.	వికరమ, మిషన విజయవంతమెంది.
झूठ बोला हमसे. उसने हमें झांसा दिया है.	అతను మాకు అబదధం చెపపాడు. అతను మమమలని మాయ చేశాడు.
सांसें वतन की है उधारी	దేశానికి నా ఊపిరి
शहिद बन कर जाएंगे	అమరవీరులుగా బరతుకుతాము
सांसें वतन की है उधारी	దేశానికి నా ఊపిరి
- सर. . . - जी.	- సర. . . - చెపపు.
दुनिया का नकशा हमेशा के लिए बदल गया	పరపంచం యొకక భూగోళశాసతరం శాశవతంగా మారిపోయింది.
हां मराठा बाग.	అవును, మరాఠా బాగ.
इसलिए पाकिसतानी विमानों ने भुज हवाई अडडे की हवाई पटटी तोड दी.	పాకిసతాన విమానాలు భుజ ఎయిరసటరిపను ధవంసం చేశాయి.
- सिरफ 120 सर? - जी.	- కేవలం 120, సర? - అవును.
और बहुत मुमकिन है कि तब तक हिंदुसतानी फौज वहां तक पहुच जाये.	మరియు భారత సెనయం అపపటి వరకు ఉపబలాలను పొందవచచు.
चटटानों से खडे है रहदील लडने को तैयार	బండలా సథిరంగా, ఎలలపపుడూ పోరాడటానికి సిదధంగా ఉంది.
तू जग नु भुला के	పరపంచానని వదిలివేయండి
सब दिवय दृषटी के पोषक हो	దెవిక కాంతిలో మనము చలలగా ఉండచచు
कचछ और भुज को हिंदुसतान से काट दिया है.	మరియు భారతదేశం నుండి కచ ను మరియు భుజను కతతిరించారు.
हमारे पास इस वकत 100 टैंक, 1800 फौजी मौजूद है	మన దగగర ఇపపుడు 100 టయాంకులు పరసతుతం 1800 మంది దళాలు ఉననాయి,
तेरा बेटा दूलहा बनकर आया है.	మీ కొడుకు వరుడిగా వచచాడు. . . అని. .
मैं आपका साथ दूंगा.	నేను మీకు సహాయం చేసతాను.
या खुदा. . . तेरी अदालत में मेरी एक जमानत रखना.	దేవుడా. . . మీ కోరటులో నా కోసం ఒక సథలానని సురకషితంగా ఉంచండి. .
जिससे मैंने जीने मरने का वादा किया था.	నేను జీవించడం మరియు చనిపోవడం కోసం వాగదానం చేశాను.
बलली कितथे है?	బలలి ఎకకడ ఉననాడు?
हम सैनिकों को भेजने की कितनी भी कोशिश कर लें.	మీ పోసటకు దళాలను పంపడానికి మనము ఎంత కషటపడడామో అది అనవసరం.
उडने के लिए तैयार है सर.	ఎగరడానికి సిదధంగా ఉంది సార.
कडी तुमने बंद की थी ना?	మీరు తలుపు తాళం వేశారు, కాదా?
और दूसरी तरफ रेगिसतान का गहरा दलदल.	మరియు మరొక వెపు ఊబి ఉననాయి.
विघाकोट चौकी से.	విఘాకోట పోసట.
युदध के दौरान आप आम नागरिकों से काम नहीं करवा सकते.	మీరు యుదధ సమయంలో పౌరులను ఉపయోగించకూడదు.
इंशाअललाह अब हमारी मुलाकात परसो होगी.	అలలా అనుకుంటే, మనము రెండు రోజులలో మళలీ కలుసతాము.
तेरा करम और तिरंगे का कफन.	మీ దయ తరివరణ పతాకంతో చుటటబడింది. .
जब तक हमारे जिसम में खून की एक भी बूंद बाकि है	మన శరీరంలో ఆఖరి చుకక రకతం వచచే వరకు
विघाकोट से भुज हवाई अडडे का रासता तकरीबन 170 किलोमीटर के फासले पर है.	విఘాకోట నుండి భుజ ఎయిరబేసకు 170 కిలోమీటరలు అవుతుంది.
हमरे अमृतसर, शरीनगर, पठानकोट, अवंतीपुर,	వీటి పె దాడి చేయడం దవారా, శరీనగర, పఠానకోట, అవంతిపూర
या तिरंगे में लिपटकर आना.	లేదా మీరు దానిలో చుటటి ఉననపపుడు.
और तिसरा	మరియు మూడు
बधाई हो.	అభినందనలు.
तो हिंदुसतान का खेल खतम.	అపపుడు భారతదేశము ఆట ముగుసతుంది.
जाधव जी भाई.	జాదవజీ సోదరుడు.
रेशम का हो वो दो शाला	నార వసతరంలో ఉననా
अगर हमने 2 घंटे के अंदर हरामी नाला पार कर लीया,	మేము హరమి నాలాను రెండు గంటలలో దాటితే
कि हमारे सर कट जाएंगे	మనము మన తలలు కోలపోయినపపటికీ
खबर देने के लिये शुकरिया.	సమాచారం అందిచినందుకు ధనయవాదములు.
रखता हूँ!	అయిపొయింది!
अगला आदेश आपको जलदी मिल जाएंगा.	మీరు తవరలో మీ తదుపరి ఆదేశాలను పొందుతారు.
वहीं ढाई सौ जवान इस मिशन पर मेरे साथ चले.	వారి జీవితానికి విలువ ఇవవని వారు ఈ మిషనలో నాతో కలవచచు.
एक माँ के बनकर आये थे	మా తలలికి కొడుకుగా జనమించారు
एक और सायरन बजेगा.	మీరు మరొక సెరన వింటారు.
एक माँ के बनकर आये थे	మా తలలికి కొడుకుగా జనమించారు
जनाब चाय.	సర. టీ.
हिंदुसतानी नेवी ने हमारे वॉरशिप	భారత నావికాదళం మన యుదధ నౌకను ముంచివేసింది
लंबी नींद से जाग कर हम अगले जनम फिर आएंगे	మేము మళలీ మా నిదర నుండి తిరిగి నినను రకషించడానికి వసతాము
हे परमेशवर, हे भगवन,	ఓ దేవుళల దేవుడు
लंबी नींद से जाग कर हम अगले जनम फिर आएंगे	మేము మళలీ మా నిదర నుండి తిరిగి నినను రకషించడానికి వసతాము
तो फिर कया रासता है?	అపపుడు మనకు ఏ అవకాశం ఉంది?
ये पांच सडके भुज जाती है.	వీటిలో ఐదు మారగాలు భుజకు వెళతాయి.
शरी गणेशा देवा शरी गणेशा	నమసకారం గణపతి దేవా
गम ना करने देश मेरे हम जब भी याद आएंगे	మీరు మా గురించి ఆలోచించినపపుడలలా బాధపడకు, ఓ మాతృభూమి
गम ना करने देश मेरे हम जब भी याद आएंगे	మీరు మా గురించి ఆలోచించినపపుడలలా బాధపడకు, ఓ మాతృభూమి
ठीक है सर.	సరే, సరే సార.
विकरम सर टेक ऑफ करने वाले हैं.	వికరం సర బయలదేరడానికి సిదదం గా వుననారు.
इतिहास गढे जाये परति पल	చరితర పరతి కషణం సృషటించబడుతుంది
लेकिन बॉकसिंग रिंग में जीतने वाला	రింగ(వలయం) యొకక ఈ ఛాంపియన
तो समझो कचछ गया दुशमन के हाथ में	అపపుడు మనము కచను శతరువుల చేతిలో కోలపోతాము.
शहिद बन कर जाएंगे	మరియు అమరవీరులు అవుతాము
गुजारात के मुखयमंतरी	గుజరాత ముఖయమంతరి
ताकि इन सैनिकों को जलद से जलद विघाकोट के मोरचे पर भेजा जा सके.	కాబటటి, దళాలను వెంటనే విఘాకోట పోసటకు పంపబడచచు.
परधानमंतरी शरीमती इंदिरा गांधी ने एक संदेश में कहा है कि. . .	పరధాన మంతరి ఇందిరా గాంధీ ఒక సందేశానని ఇచచారు.
जब फटेगा तो चिथडे उडा देगा.	అది ఇపపటికీ మిమమలని ముకకలు చేసతుంది.
-ओवर एंड आउट. -सर.	-పూరతిగా ఓడిపోతాము -సర.
सैनय खुफिया परमुख	మిలిటరీ ఇంటెలిజెనస హెడ
अब वहां से ना तो कोई हवाई जहाज उडान भर सकता है और न ही उतर सकता हैं.	విమానాలు అకకడ నుండి బయలదేరలేవు, ఇంకా లాండ అవవలేవు.
इंसान बन कर आए थे	మేముమనుషులుగా జనమించాము
सब के परिवार को खबर कर दो.	పరతి ఒకకరి కుటుంబాలకు తెలియజేయండి.
सभी लडके, अब हवाईकषेतर पर. चलो!	అబబాయిలు, ఇపపుడు ఎయిరఫీలడలో ఉననారు రండి!
कचछ के 50 परतिशत हिससे में पानी है	కచలో 50 శాతం నీరు ఉంటుంది
ठीक है सर.	సరే, సర.
कया मनसूबे है उन लोगों के?	వారి ఉదదేశాలు ఏమిటి?
हमारे जंगी हवाई जहाज से भुज हवाई अडडे पर 1000 बम	మన ఫెటర జెటలు 1000 బాంబులను పడేశాయి
हमें अपनी सथिति बदलनी होंगी	మేము ఇపపుడు మా సథానాలను మారచుకోవాలి.
मिटटी है ये माँ हमारी मिटने को तैयार	ఇది మన మాతృభూమి, దాని కోసం మన జీవితానని అరపించవచచు
इस वकत कचछ में पाकिसतान के लिये काम कर रहे है.	పాకిసతాన కోసం కచలో పని చేసతుననారు.
हमें जलदी से जलदी विघाकोट चौकी पर और सैनिक भेजने पडेंगे.	మనము విఘాకోట పోసటకు మరినని దళాలను పంపాలి.
तू हमारी औकात का अंदाजा कया लगाएगा.	మా పరిమితులు మీకు తెలియదు.
जिस दिन लडाई जीतूंगा उसी दिन पगडी पहनूंगा.	నేను యుదధంలో గెలిచిన రోజు మాతరమే నేను ఈ తలపాగా ధరిసతాను. .
हमीर की बिसमिललाह मसाला फैकटरी पर है.	హరిపర రవపర గరామానికి పడమర ఒక కిలోమీటర దూరం లో ఉంది.
हॅलो. हॅलो करसन. . .	హలో. హలో, కరసన.
पाकिसतानी विमान बम गिरा रहे है	పాకిసథాన విమానాలు బాంబులు విసురుతుననాయి.
मराठा बाग, हम लैंड के लिए तैयार हैं.	మరాఠా బాగ, మేము లయాండ చేయడానికి సిదధంగా ఉననాము.
तो हिनदुसतान तेरे बाप की कहानी है.	అపపుడు భారతదేశం మీ తండరి.
हमारे लिये काम करने की कया कींमत लेंगे आप.	మాకు పని చేయడానికి మీ భతయం ఎంత?
सर अगर हमारे जेटस भुज हवाई अडडे पर उडते रहे	సర, మా విమానాలు ఉంచినటలయితే భుజ విమానాశరయం మీద తిరుగుతోంది
तब तक ये हिंदुसतान रहे	అలాగే ఓ మాతృభూమి
इसको रिपेयर करके मेरी हेडकवारटर में बात कराओ.	దీనని బాగు చేసి మరియు ననను పరధాన కారయాలయానికి కనెకట చేయండి.
कलियर. रिपीट.	కలియర. పునరావృతం.
तो हमारे सैनिकों के घायल होने का बहुत जयादा खतरा है सर.	అపపుడు మన సవంత దళాలు గాయపడే పరమాదం ఉంది.
विकरम सिंह ने 450 सैनिको के साथ अभी उडान भरी है	వికరమ సింగ 450 దళాలతో బయలుదేరింది.
लेकिन मेरे विमान का आगे का पहिया कषतिगरसत हो गया है.	కానీ నా విమానం యొకక ముందు చకరం దెబబతింటుంది.
और भुज एयरपोरट पर 60 बटालियन के जवान है.	మరియు 60 మంది సెనికుల బెటాలియన భుజ విమానాశరయంలో ఉంది. .
ठीक है, चारली.	సరే, చారలీ.
कयों ना हम रेगिसतान और दरिया के मुंह पर सिमेंट की बोरिया डाल दे	మనం సముదర నీటిని సిమెంటతో ఎందుకు అడడుకోకూడదు.
कौन सा टाइम बम कब कहां फटने वाला है, कुछ पता नही है.	ఏ బాంబు ఎపపుడు పేలుతుందో మాకు తెలియదు.
कोई धन है कया	ఏదీ విలువెనది కాదు
जी साब.	సరే అండి.
इंसान बन कर आए थे	మేము మనుషులుగా జనమించాము
कोई धन है कया	ఏదీ విలువెనది కాదు
कोई धन है कया	ఏదీ విలువెనది కాదు
उततल, जोधपुर, अंबाला, फरीदकोट, जैसलमेर, हलवारा और भुज पर अटैक करके दीया है. . . .	ఉతతరలె, జోధపూర, అంబాలా పరీకోట, జెసలమేర, అలవారా మరియు భుజ.
गददारी की उस बुढे ने.	ఆ వృదధుడు మాకు దరోహం చేశాడు.
उनहीं पैसों से खरीदा हुआ लोहा और बारूद	మందుగుండు సామగరి మరియు పేలుడు పదారథాలు కొనుగోలు చేసతే
मेरे पति की तरह.	నా భరత లాగా.
आप लोग साथ दें या ना दें.	మీరు నాకు సహాయం చేసినా, చేయకపోయినా.
जलदी. जलदी.	వేగంగా. వేగంగా.
भुज, 18 घंटे मे पहुंच कर,	మరియు 18 గంటలలో భుజ ను చేరుకుంటాయి.
या हुकमे शहादत दे दे	లేదా బలిదానం చేసుకునే సంకలపం
मराठा सिरफ दो बात जानता है.	మరాఠాలకు రెండు విషయాలు మాతరమే తెలుసు.
जवानो. . .	అబబాయిలు. . .
1965 में पाकिसतान की एयरफोरस ने	1965 లో పాకిసతాన వెమానిక దళం కాలచివేయబడింది
तो कचछ हिंदुसतान से कट जायेगा.	అపపుడు కచ భారతదేశం నుండి వేరు చేయబడుతుంది.
हे जगत नियंता दीन बंधु	పరపంచాల రకషకుడు, నిరభయమెన వయకతి
इंसान बन कर आए थे	మేము మనుషులుగా జనమించాము
हर बालक नीति निधान रहे	మరియు పరతి అబబాయి దృఢంగా ఉండాలి
आज हमारे पास इतना बारूद है	మా వదద తగినంత పేలుడు పదారథాలు ఉననాయి
हमें ये सूचना बहुत देर से मिली.	మేము ఈ సమాచారానని చాలా ఆలసయంగా అందుకుననాము.
मैं और मेरी भजन मंडली हवाई पटटी बनाने आपके साथ आएंगे.	నేను మరియు నా మొతతం బృందం ఎయిరసటరిపను పునరనిరమించడానికి మీకు సహాయం చేసతుంది.
तो तुम हो गददार.	కాబటటి, మీరు దేశదరోహి.
कमाल की सोच.	బృహతతరమెన ఆలోచన.
"जो पिजीओ सो बिन से परो वो आज की काल, "	"సృషటించబడింది ఏదెనా నేడు లేదా రేపు నాశనం చేయబడుతుంది. "
चलो चलो.	పరుగెతతండి!
मेरे बाबूजी. . .	మా నానన. . .
ओ देश मेरे	నా భూమి
सर इससे आगे जाने में खतरा है.	సర. . . ఈ పరదేశానని దాటి వెళలడం పరమాదకరం.
बाबा की बात भूल गया?	మీరు తండరి మాటలు మరచిపోయారా?
मारना या मरना.	చనిపోవడం లేదా చంపడం.
ओ देश मेरे	నా భూమి
साहब पेटरोल, डीजल और तेल की दस बैरल	సర, 10 బారెలస పెటరోల, డీజిల మరియు ఇంజిన ఆయిల ఉంచండి
एक वादे के लिए दूसरा वादा टूट गया.	నేను మరొక వాగదానం కోసం ఒక వాగదానానని ఉలలంఘించాను.
आपको हॉसपिटल जाकर एकस रे करवाना चाहिए और थोडा आराम करना चाहिए.	మీరు ఎకస-రే మరియు కొంత విశరాంతి తీసుకోవాలి.
कया रणनीति बना रहे हैं?	వారు ఏ వయూహానని పలాన చేసతుననారు?
कौन बोल रहा है?	ఎవరు మాటలాడుతుననారు?
जय कनहैया लाल की. . .	శరీకృషణుడి మహిమ
हमने देवी माँ कि सपथ ली हैं	మేము పరమాణం చేశాము.
हाथी घोडा पालकी	గురరాల, ఏనుగుల, పలలకీ
दूसरे अटैक की तैयारी करो.	రెండవ దాడికి కూడా సిదధం గా వుననాము.
वहीं तो रहती है	అకకడే ఆమె నివసిసతోంది
हाथी घोडा पालकी	గురరాల, ఏనుగుల, పలలకీ
जी सर.	సరే, సర.
ओके एंड आउट.	సరే మరియు బయటకు.
तब तक ये हिंदुसतान रहे	అలాగే ఓమాతృభూమి
है अरज ये दीवाने की	ఇది నా అభయరథన
1947 के बंटवारे में पाकिसतान बना	1947 విభజన సమయంలో పాకిసతాన ఉనికిలోకి వచచినపపుడు
हम बांध उडा देंगे.	మేము దానిని పేలచివేసతాము.
इमरान सब बचचों को बंकरस में सुला दो	ఇమరాన, పిలలలు అందరినీ బంకరలలో కి తీసుకుని వెళళండి.
कहाँ से आ रहे है आप?	నువవు ఎకకడి నుండి వసతుననావు?
मैंने आपको पाकिसतानी सेना का कोड वरड दिया था. . . याद है आपको.	పాకిసతాన సెనయం యొకక కోడ పదం మీకు గురతుందా?
हमरी सेना के 100 टैंक और तकरीबन 1800 सैनिक,	100 టయాంకులు మరియు 1800 దళాలు
