गोलियों की लोरी सुनके लंबी निंद सो जाएंगे	మేము తూటాల లాలి వింటూవిశరాంతి తీసుకుంటాము
तू नाल मेरे बेहजा	మరియు నాతో ఉండండి
तू नाल मेरे बेहजा	మరియు నాతో ఉండండి
विघाकोट चौकी पर हमारे सिरफ 120 जवान और एक पगगी है.	పాకిసతాన 1800 దళాలు మరియు 100 టయాంకులు ని ఆపడానికి
कयोंकि हमें भी उस रासते से भुज तक पहुँचने में 48 घंटे का वकत लगेगा.	ఎందుకంటే మాకు కూడా ఆ మారగం దవారా భుజ చేరుకోవడానికి 48 గంటలు కావాలి.
जय हिंद! !	జె హింద! !
सुंदर ये सोच अगर हम मर गये तो हमारे बचचों का कया होगा?	మనం చనిపోయినటలయితే మన పిలలలకు ఏమి జరుగుతుందో ఊహించండి.
और याहया खान का शरीमती गांधी के साथ चाय पीने का सपना	మరియు శరీమతి గాంధీ తో టీ పంచుకోవడం యాహయా ఖాన గారి కల
हमारी फौजें पूरवी पाकिसतान की ओर तैनात हो गई	మా బలగాలు తూరపు పాకిసతాన వెపు మోహరించబడడాయి.
ऑपरेशन चंगेज खान भुज.	ఆపరేషన చేంజ ఖాన, భుజ.
तेरी धूल से बढके	నా దేశం నేల కంటే
तेरी धूल से बढके	నా దేశం నేల కంటే
तेरी धूल से बढके	నా దేశం నేల కంటే
तू बाग है मेरा	నువవు నా సవరగం
तू बाग है मेरा	నువవు నా సవరగం
तू बाग है मेरा	నువవు నా సవరగం
जय शरी राम!	జె శరీ రామ!
हम इन बोतलों को दुशमनों पर फेकेंगे और फिर इन बोतलों पर फायर करेंगे.	మేము ఈ సీసాలను శతరువు ల పెన విసిరేసి మరియు వారిపె కాలపులు జరుపుతాము.
आप आधे घंटे बाद विजय साहब को मंदिर लेकर आ जाईये.	30 నిమిషాల తరవాత మేజర సారని ఆలయానికి తీసుకురండి.
अलविदा के आँसू और 75 करोड रुपए जाते-जाते उनके हाथ पर रख दिये.	మేము కొంచెం కననీళలతో మరియు 75 కోటల రూపాయలు వారిని పంపించాము.
आप पोसट अपने 120 साथियों के साथ संभाल लीजिए.	మీ 120 మంది సెనికులతో ఈ పోసట బాధయత వహించండి.
गोलियों की लोरी सुनके लंबी निंद सो जाएंगे	మేము తూటాల లాలి వింటూ విశరాంతి తీసుకుంటాము
साहब पाकिसतानी सेना की तीन बटालियन 100 टैंको के साथ	సర, మూడు బెటాలియనలు, తో పాటు 100 మంది పాకిసథాన సెనయం
पाकिसतानी सेना 100 टैंकों की रेजीमेंट के साथ 1800 सैनिक लेकर रात 11 बजे तक पहुच जाएगी.	పాకిసథాన సెనయం వారి 100 టయాంకులతో మరియు 1800 మంది దళాలు రాతరి 11 గంటలకు చేరుకుంటాయి.
1968, में करनल नायर ने हिंदुसतानी सेना कि ओर खेलते हुए	కల నాయర ఇండియన ఆరమీకి పరాతినిధయం వహిసతుననపపుడు 1968 లో,
उस कुएं वाले घर के पास जरूर ठहरना	బావి దగగర ఉనన ఇంటిని మిస చేయవదదు.
मैं जानता हूँ कि मुकाबला मुशकिल है.	ఇది పరమాదకరమెన పని అని నాకు తెలుసు.
हमारे पास बम डिफयूजर सूट भी नहीं है.	మన దగగర బాంబు డిఫయూజర సూట కూడా లేదు.
आज इसी हिंदुसतान के लिये हमें लडना है.	ఇపపుడు మనం అదే భారతదేశం కోసం పోరాడాలి.
तू जग नु भुला के तू नाल मेरे बेहजा	పరపంచానని విడిచిపెటటి నాతో ఉండండి
पूरवी पाकिसतान के लोग उरदू की जगह बांगला भाषा बोलते थे.	తూరపు పాకిసతాన యొకక పరధాన మాండలికం బంగలా ఉరదూ కు బదులుగా
इस हार को जीत में बदलने के लिए हमारे पास तीन रासते है.	ఈ ఓటమిని విజయంగా మారచడానికి మాకు మూడు మారగాలు ఉననాయి.
जय हिंद!	జె హింద!
नबबे लोगों का एयरपोरट का सटाफ है, और	వారికి 90 మంది సిబబంది ఉననారు, మరియు
नूरा, भीमा, अलताफ, विरन, वाहिद, लतीफ, मीरामड	నూరా, భీమా, అలతాఫ, విరామ, వాహిద, లతీఫ, విరామన
मेरे हिंदुसतान को सलामत रखना.	నా మాతృభూమిని కషేమంగా ఉంచండి.
कमांडिंग ऑफिसर भुज हवाई अडडा.	కమాండింగ ఆఫీసర, భుజ ఎయిరఫీలడ.
हमारी किसमत में मरना लिखा होगा तो हमें कोई नहीं बचा पाएगा.	మనము చనిపోతాము అని విధి అయితే అపపుడు మనలని ఎవరూ రకషించలేరు.
बोले सो निहाल. . .	నీ పేరు అంతటా. . .
अगर भुज हवाई अडडा पाकिसतानी सेना के कबजे में आ गया	పాకిసతాన సెనయం భుజ విమానాశరయంపె నియంతరణ తీసుకుంటే
लेकिन विघाकोट तक हमारे सैनिक पहुंच जाने चाहिए.	కానీ మన దళాలు తపపక విఘాకోట పోసటకు చేరుకోవాలి.
उसके बाद भी दिलली को उडाने के लिए हमारे पास दस टरक बारूद बच जाएगा.	మేము ఢిలలీని పేలచేందుకు ఒక డజను టరకకులను పేలుడు పదారథాలతో నింపుతాము.
अभी-अभी मौलाना ने पाकिसतान के बदीन से मुझे खबर दी है.	మౌలానా ఇటీవల పాకిసతాన బాదిన నుండి నాకు వారతలు ఇచచారు
और आज विजय सर उषा मैडम को अपने दिल की बात बताएंगे.	మరియు ఇపపుడు సర అతని భారయ పటల భావాలను వయకతం చేసతాడు
यह लैंडिंग संभव नहीं है भाई.	ఈ లయాండింగ సాధయం కాదు సోదరా.
अगर आज हमने अपने देश की मदद नहीं की	కానీ మనం మన దేశానికి సహాయం చేయకపోతే
500 सैनिको का वजन जयादा है सर.	500 దళాల బరువు చాలా ఎకకువ, సర.
एक मुसलमान होकर पाकिसतान के साथ गददारी की बात करती हो.	ఒక ముసలిం అయిఉండి కూడా, మీరు పాకిసథానకు దరోహం చేశారు.
भुज हवाई अडडे पर विजय कारणिक रनवे रिपेयर कर रहे है और वहां पे मैं पलेन उतारूंगा.	విజయ కారనిక రనవేని రిపేర చేసతుననాడు కనుక నేను ఈ విమానానని అకకడ లయాండ చేయబోతుననాను.
बातूनी अँखियाँ करदी ऐ बतियाँ	నీ కళలు తెలియజేసతూనే ఉంటాయి
हम उस महान छतरपति शिवाजी महाराज की औलद है. . .	మేం గొపపవారెన ఛతరపతి శివాజీ మహారాజ కొడుకులము.
की चाहे लोहे के कपडे पहनो	మీరు ఇనుప సూటలు ధరించినా,
वो सब इस वकत हरिपर रवा पर से एक किलो मीटर पशचिम मे	వారు పరసతుతం హమీర బిసమిలలా సపెస ఫయాకటరీలో ఉననారు.
और 24 सैनिक आज शाम बोट से आपकी चौकी पर आने के लिए निकल चुके है.	మరియు 24 దళాలు మీ పోసట చేరుకోవడానికి సముదర మారగం ఎంచుకుననాయి.
भुज पहुंचनेवाले सारे रासते पाकिसतानियों ने तोड दिये है सर.	పాకిసథానీయులు భుజకు వెళలే అనని ఇతర మారగాలను నాశనం చేశారు.
20 जवान मेरे साथ नाले से उस तरफ वहां रहेंगे.	20 మంది సెనికులు నాతో కాలువకు ఆ వెపున ఉంటారు.
और उनहोंने जो भी जंग लडी धरम के लिए	అతను తన మతం కోసం ఈ యుదధాలు చేశాడు.
सरदारजी जे मेनु कुछ हो गया ते मेरी परीतो को संभाल लेना	సరదారజీ, నాకు ఏదెనా జరిగితే తరవాత పరీటోను చూసుకోండి.
रणछोड भाई पगगी	రాంచోడ భాయ పగి
मोहममद हुसैन ओमानी.	ఎండి. హుససేన ఒమాని.
कयोंकि कमीज के टूटे हुए बटन से लेकर टूटी हुई हिममत तक	ఎందుకంటే విరిగిన చొకకా బటన నుండి విరిగిన ధెరయం వరకు
और उनका रहन सहन पशचिमी पाकिसतान के लोगों से थोडा अलग था.	మరియు వారి జీవనశెలి పశచిమ పాకిసతాన కంటే పూరతిగా భిననమెనది.
लेकिन हिंदुसतान का एक बडे से इलाके पर कबजा हो चुका है.	కానీ భారతదేశం విసతారమెన పరాంతానని సవాధీనం చేసుకుంది.
एंटी-एयर गन फायरिंग रोक दो!	యాంటీ-ఎయిర గన కాలచడం ఆపండి!
ऑपरेशन हूर.	ఆపరేషన హూర.
इस ऑपरेशन का कोड नेम है चंगेज खान.	ఈ ఆపరేషన యొకక సంకేతనామం చేంజజ ఖాన
पशचिमी पाकिसतान और पूरवी पाकिसतान.	పశచిమ పాకిసతాన మరియు తూరపు పాకిసతాన
बता दो इन कमजरफो को	ఈ రాసకలస కు చూపించు
हमले से पांच दिन पहले	దాడికి 5 రోజుల ముందు.
औरत के लिए सबसे अनमोल है उसका घर.	ఒక మహిళకు ఆమె ఇలలు అతయంత విలువెనది
जिकर में शामिल मेरा नाम हो	నా పేరు కూడా పరసతావించాలి
रनवे रिपेयर करने वाले पराइवेट वरकरस और इंजिनीअरस भाग गये है.	అనని పరెవేట ఇంజనీరలు మరియు కారమికులు భుజ నుండి పారిపోయారు.
जय शरी राम!	జె శరీ రామ!
तबाही का ऐसा आलम था कि देखनेवाले की हिममत टूट जाये.	ఇలాంటి విధవంసం ఎలాంటి వారినెనా నిరుతసాహపరుసతుంది.
उसे विघाकोट पहुंचने में कम से कम 28 घंटे लगने वाले हैं.	వారికి కనీసం విఘాకోట చేరుకోవడానికి 28 గంటలు పడుతుంది.
"अललाह के सिवा, एक अकेला, बिना साथी के, "	"అలలాహ తపప, ఒంటరిగా, భాగసవామి లేకుండా, "
अकबर की नौटंकी.	అకబర పరియురాలు.
हॅलो करसन.	హలో, కరసన.
भुज हवाई अडडे के इंचारज विजय कारणिक रनवे को किसी भी तरह रिपेयर करें.	భుజ విమానాశరయం కమాండింగ అధికారి విజయ కారనిక రన వేను బాగు చేసతాడు.
अगर सुबह तक रनवे रिपेयर नहीं हुआ	వేకువజామున రనవే మరమమతులు చేయకపోతే
विघाकोट चौकी पर हमारे कितने सैनिक हैं?	మన దగగర విగాకోట వదద ఎనని దళాలు వుననాయి?
उसे किसी की जमीन छीनने का कोई शौक नहीं.	వారు ఎవరి భూమి నీ దోచుకోవడానికి ఇషటపడరు.
भीमा, अलताफ, वीरन, जाहिद, लतीफ	భీమా, అలతాఫ, విరాన, జాహిర, లతీఫ
कयोंकि हमारा भुज हवाई अडडे के साथ कोई संपरक नहीं है.	ఎందుకంటే భుజ విమానాశరయంతో మనకు ఎలాంటి కమయూనికేషన లేదు.
और बाकि के जवान पगगी के साथ नाले के इस तरफ रहेंगे.	మరియు మిగిలినవి పగి తో కాలువ యొకక ఈ వెపు ఉంటాయి.
लेकिन भुज को जयादा नुकसान नहीं पहुंचा सके.	కానీ వారు భుజకి చాలా నషటం కలిగించ లేకపోయారు
ऐसा मत कहो.	అలా అనకండి.
लकषमण. . . आप हवाई अडडे पर रूकिये.	లకషమణ. మీరు ఎయిరఫీలడలో వేచి ఉండండి.
कि हम गंगा और जमुना दोनों को पाट दें	గంగ మరియు జమున విడిపోయిన తరవాత కూడా
रोजर, पर हेलीकॉपटर से आने में आप लोगों बहुत खतरा है.	రోజర, కానీ హెలికాపటర దవారా పరయాణం పరమాదకరం కావచచు.
सभी बम को एक फयूज के साथ कनेकट कर दो	అనని బాంబులను ఒకే ఫయూరకు కనెకట చేయండి
और हमारे बचने का चांस है एक परतिशत.	మన మనుగడ కు ఒక శాతంత మాతరమే వుంది.
आज रात को 11 बजे हमारी चौकी पर हमला करने वाले है.	టయాంకులు దాడి చేయబోతుననాయి మా పోసట రాతరి 11 గంటలకు.
"अललाह के सिवा, एक अकेला, बिना साथी के, "	"అలలాహ తపప, ఒంటరిగా, భాగసవామి లేకుండా, "
लेफटन करनल नायर भी अपनी परंपरा पर डटे हुए हैं.	లెఫటినెంట కలనల నాయర ఈ సంపరదాయానని సజీవంగా ఉంచారు
दिलली में बैठ करके चाय पिएंगे.	ఢిలలీలో ఒక కపపు టీ పంచుకుంటాము.
तक हमें दुशमन को रोकना होगा.	మనము శతరువులను దూరంగా ఉంచాలి.
सिलवर फारमेशन.	వెండి నిరమాణం.
पापा.	పాపా.
धरम है.	సరెనది.
लेकिन पाकिसतानी एयरफोरस ने पांचो रासते और भुज हवाई अडडे को तबाह कर दिया है.	కానీ పాకిసతాన ఎయిర ఫోరస మొతతం ఐదు మారగాలు మరియు భుజ విమానాశరయానని నాశనం చేసింది
आप अपना आगे का पहिया टरक के कैरिअर पर लैंड दीजिएगा.	మీరు మీ ముందు టెరను టరక కయాబిన మీద లయాండ చేయవచచు.
और भुज जानेवाले पांचो रासते भी	మరియు భుజకు వెళలే ఐదు మారగాలు
इस बात के लिए अगाह किया गया है हमें इसलिए हमें खबर रखनी होगी.	మేము దీని గురించి హెచచరించాము కాబటటి మనం అపరమతతంగా ఉండాలి.
हमें रनवे बनाने के लिए ईंट पतथरों की जरूरत थी.	రనవే నిరమించడానికి మనకు ఇటుకలు మరియు రాళలు అవసరం
और उनकी खुफिया जानकारियां जुटाना.	మరియు కీలక సమాచారానని సేకరించడం.
मार दो इसे.	అతడని చంపు.
वापस आ जाओ. तुरंत वापस आ जाओ.	తిరిగి రా. వెంటనే తిరిగి రండి.
लेकिन सर इस हमले मे बलजीत और विकरम सिंह के विमान को खो दीया है.	కానీ సార, మేము బలజీతను మరియు వికరమ సింగ విమానానని కోలపోయాము.
मैं अपने देश की और अपनी इजजत आपके चरणों में रख के जा रहा हू.	నేను నా దేశ గౌరవానని, మరియు నా గౌరవానని మీ చేతులలో పెడుతుననాను.
अगर दुशमन के हमले में किसी की जान चली गयी	దాడి సమయంలో ఎవరెనా వారి జీవితాలు కోలపోతే
उन सारे पाकिसतानी जासूसो की लोकेशन टरेस हो गयी है.	పాకిసథానీ గూఢచారుల యొకక అనని సథానాలన గురతించాము.
तो उसके दो हिससे हुआ करते थे.	దానిని రెండు భాగాలుగా చేసింది.
मराठा बाग दुशमन रात 11 बजे विघाकोट चौकी पर हमला करेगा.	మరాఠా బాగ, శతరువు రాతరి 11 గంటలకు విఘాకోట మీద ముటటడి చేసి
जब तक मैं ना कहू, कोई फायर नहीं करेगा.	నేను చెపపనంత వరకు ఎవరూ కాలపులు జరపరు.
पाकिसतानी फोरसेस को धोखा देने के लिए	మరియు పాకిసతానీ దళాలను అధిగమించడానికి
तो यकीनी तौर पर हमें शिखसत मिलकर रहेंगी.	అపపుడు ఖచచితంగా, మనము ఓటమిని రుచి చూసతాము.
कयोंकि वो फिर से हमला कर सकते है.	ఎందుకంటే వారు మళలీ దాడి చేయవచచు.
मैं विजय शरीनिवास कारणिक.	నేను విజయ శరీనివాస కారనిక.
सजजनता का अनुशीलन हो	దయ పరతిచోటా పాటించాలి
कि पाकिसतान जंग जीत रहा है.	పాకిసతాన యుదధంలో గెలుసతోంది.
अब हमारे पास उनके साथ संचार का कोई विकलप नहीं है.	ఇపపుడు మనకు వారితో మాటలాడడానికి ఎలాంటి రూపాలు లేవు.
तो आपका कोरट मारशल भी हो सकता है.	అపపుడు మీరు కోరటు మారషలగా మారవచచు.
कि मुझे उसका तोहफा याद है.	ఆమె బహుమతి నాకు గురతుంది.
- भारत माता की! - जय!	- కీరతి! - మాతృభూమి!
दोसतों, कृपया कया आप मेरी बात पर धयान देंगे.	సనేహితులారా, దయచేసి మీరంతా నాపె దృషటి పెటటండి.
दिल ये गया लो गया	నా హృదయం పోయింది
"उनके नौकर और रसूल हैं. "	"అతని సేవకుడు మరియు దూత. "
बलली सावधान!	బలలి జాగరతత.
- भारत माता की! - जय!	- కీరతి! - మాతృభూమి!
मोहममद हुसैन ओमानी ने उसे बडी दरदनाक मौत दी थी.	ఎండి. హుససేన ఒమాని అతనికి భయంకరమెన మరణానని ఇచచారు.
