लगा, "कया इससे तुमहारा नाम होगा? कया इससे जयादा तनखवाह मिलेगी?	"ఇది మీ సథాయిని పెంచుతుందా? మీకు ఇంకా ఎకకువ డబబులిసతారా?
उसकी सही लोगों से जान-पहचान है.	అతనికి సరెన వాళళందరూ తెలుసు.
पर उसे वापस जेल भेज दिया गया	కానీ అతనని తిరిగి జెలుకు పంపారు
मैंने उसकी ओर हैरान होकर देखा, "तुम सच में दूसरे अशवेत के खिलाफ झूठ बोल रहे हो? "	నేను అతనిని "ఇంకో నలలజాతి పిలలాడిపెన అబదధం చెబుతుననావా? " అని చూసతుననాను.
कयोंकि यदि वे दावा करते हैं कि उसने बंदूक तानी थी. . .	ఎందుకంటే అతను వాళళపె తుపాకీ గురిపెటటాడని వాళళు ఆరోపిసతే. . .
मीक 2021 तक परोबेशन पर होगा	మీక పరిశీలనలో ఉండేది 2021 వరకు
डीजे डायमंड कटस पावर 99 एफएम फिलाडेलफिया	డీజే డెమండ కటస పవర 99ఎఫఎమ ఫిలడెలఫియా
वह रॉस को एक गाने में लेना चाहता था,	అతను రాసతో ఒక పాట పాడించాలని అనుకుననాడు,
आई एम ए बॉस - मीक मिल (पेश है - रिक रॉस)	ఐయామ ఏ బాస - మీక మిల (ఎఫటీ. రిక రాస)
डीजे डायमंड कटस पावर 99 एफएम फिलाडेलफिया	డీజే డెమండ కటస పవర 99ఎఫఎమ ఫిలడెలఫియా
अगसत 2012	ఆగసటు 2012
"न पता है कि वह किस राजय में जा रहा है. " उनहें लताड रही थी.	"ఏ రాషటరానికి వెళతాడు తెలుపలేరు. " వాళళను విమరశించారు.
और जब आप परोबेशन पर हों, और जेनीस बरिंकली हो,	పరిశీలన మరియు జినీస బరింకలీ ఉనన పరపంచంలో ఉననపపుడు,
हथियार के साथ फोटो खिंचवाना यातरा उललंघन	ఆయుధాలతో ఫొటోలు దిగటం పరయాణ ఉలలంఘనలు
मैंने कहा माफ करना अगर मैं था मगरूर पैसों की हो रही थी बरसात	నేను పొగరుగా ఉంటే మననించమననాను ఆ డబబు ఆసథిరంగా ఉంటుంది
जब मेरे हर फोन के पैसे दिए तुमने कयोंकि उसी के सहारे दिन काटे थे मैंने	నేను మిమమలని తీసుకెళళమని చెపపాను ఎందుకంటే నాకది నరకం చూపించింది
बचपन में मैं भी परोबेशन पर रहा हूँ. बात समझ रहे हो न?	నేను పిలలాడిగా ఉననపపుడు సమసయ ఉండేది. నా ఉదదేశం మీకు తెలుసా?
अपने घर के अंदर गया, अपने सभी कजिनस से मिला.	మా ఇంటలోకి వెళళాను, మా కజినలు అందరినీ పలకరించాను.
रिक रॉस संसथापक - मेबैक मयूजिक गरुप	రిక రాస వయవసథాపకుడు - మేబాక మయూజిక గరూప
रिक रॉस संसथापक - मेबैक मयूजिक गरुप	రిక రాస వయవసథాపకుడు - మేబాక మయూజిక గరూప
उनहोंने हथकडी पहनाकर मेरी फोटो खींची और उनहें इंसटागराम पर डाल दिया.	వాళళు నా ఫోటోలు తీసుకొని, సంకెళళతో ఉననది ఇనసటాగరామలో పెటటారు.
मैं करैक कोकीन नहीं बेचता था.	నేను ఏ కొకేయిన అమమటం లేదు.
तुमहें ऐसी चीज किसी आलतू-फालतू से नहीं मिल सकती.	ఇది అలాంటి ఇలాంటి వాళళ దగగర నుండి పొందలేవు.
मैं किसी के लिए कोई खतरा नहीं हूँ. समझे न मैं कया कह रहा हूँ	నేను ఏలాంటి పరమాదం సృషటించటం లేదు. నేను ఏం చెబుతుననానో అరథమవుతుందా?
यकीनन दृढ निशचय है.	ఖచచితంగా పటటుదలే.
सिसटम में दिन - 1	నయాయ వయవసథలో రోజులు
तुम वीडियो पर हो.	వీడియో పెడుతుననాను.
मैं अपने पूरे परिवार का जीवन बदलने के लिए काम कर रहा हूँ.	నేను నా కుటుంబం జీవన శెలి మొతతం మారచాలనుకుంటుననాను.
मैं यहाँ नशा नहीं बेच रहा. न ही किसी को चोट पहुँचा रहा हूँ.	ఇపపుడు, నేను ఇకకడ డరగస అమమటం లేదు. నేను ఇకకడ ఎవరినీ బాధించటం లేదు.
परोबेशन सुनवाई: 5 फरवरी, 2016 यातरा उललंघन	పరిశీలనా విచారణ: ఫిబరవరీ 5, 2016 పరయాణ ఉలలంఘనలు
24 जनवरी, 2000, कया, सात?	జనవరి 24, 2000, ఎపపుడు, ఏడా?
अमेरिकन इकोनॉमिक रिवयू, 2018	అమెరికన ఆరథిక సమీకష, 2018
तब जो करना चाहो, कर सकती हो.	కోరటులో ఉననపపుడు చేసతారు.
मेरे साथ वैसे ही बहुत कुछ चल रहा था. मयूजिक बनाना, रैपिंग.	నేను నాకోసం చేసుకోవాలసిన పనులు చాలా ఉననాయి. పాటలు, రయాపింగ చేయటం.
और यदि आप उन शरतों का पालन नहीं करते,	ఒకవేళ ఆ షరతులకు కటటుబడి ఉండకపోతే,
डरीमस वरथ मोर दैन मनी. जबरदसत है.	డరీమస వరత మోర దాన మనీ. తపపు జరిగింది.
जाता हूँ अदालत परोबेशन के लिए जो लगता है मानो मुकदमा हो	నేను పరిశీలనకు కోరటుకు వెళతాను విచారణ ఎదురకొంటాను
उसने मुझे तमीज सीखने की कलास में भेजा कयोंकि मैंने "सतयानाश" शबद बोला था.	ఆమె "తికకరేగింది" అనన పదం వాడినందుకు శిషటాచార తరగతులకు పంపించారు.
मैं कोठरी में कुछ सपैनिश लोगों के साथ था. वे बातें भी अंगरेजी में नहीं कर रहे थे.	నేను జెలు గదిలో కొంతమంది సపానిష వాళళతో ఉననాను. వాళళకు ఇంగలీషు కూడా రాదు.
"मैं तुमहारे लिए कुछ बॉकसर और मोजे ला रही हूँ. "	"నేను నీకు కొనని బాకసరలు ఇంకా కొనని సాకస తెసతుననాను. "
पहले पाँच में आता, जिंदा या मुरदा. यकीनन, मेरे हिसाब से.	జీవించి ఉనన లేదా మరణించిన ఉతతమ ఐదుగురిలో ఒకడిగా తపపక భావిసతారు.
मैं चीजें कर रहा था, पैसा बना रहा था और सफलता पा रहा था.	నేను నిజానికి డబబులు సంపాదిసతూ, విజయవంతం కాగల పనులు చేసతుననాను.
मैं यह नई सजा सुनाती हूँ. छह से 12 महीने काउंटी जेल में.	కొతత శికష ఈ విధంగా ఉంటుంది. ఆరు నుంచి 12 నెలలు కౌంటీ జెలు శికష.
मैं अभी जेल से निकला हूँ और यह सोचकर मत रोना	నేను ఇపపుడే జెల నుంచి వచచాను ఏడవటం లేదు
मैं वापस अपनी माँ के साथ रह रहा था,	నేను తిరిగి మా అమమతో ఉంటుననాను,
और जब वह चिललाया, "पुलिस. . . "	"పోలీస. . . " అని అతను అరిచినపపుడు,
बस यह मेरी कलाई पर पूरा आ जाए, जान.	అది నా చేతికి సరిపోయేలా చూసుకో.
वह कहीं भी यातरा कर सकता है बशरते अदालत को अपनी कारय सूची दे.	తన పరణాళిక కోరటుకు తెలిపినంత వరకు అతను పరయాణం చేయవచచు.
वैन जोनस राजनैतिक वयाखयाता	వాన జోనస రాజకీయ వయాఖయాత
वैन जोनस राजनैतिक वयाखयाता	వాన జోనస రాజకీయ వయాఖయాత
हैलो, रोजे, कया चल रहा है?	ఏయ, రోసె, ఏంటి సంగతులు?
पॉल सोलोटरॉफ खोजी पतरकार - रोलिंग सटोन	పాల సోలోటరాఫ పరిశోధనా విలేకరి - రోలింగ సటోన
पॉल सोलोटरॉफ खोजी पतरकार - रोलिंग सटोन	పాల సోలోటరాఫ పరిశోధనా విలేకరి - రోలింగ సటోన
पॉल सोलोटरॉफ खोजी पतरकार - रोलिंग सटोन	పాల సోలోటరాఫ పరిశోధనా విలేకరి - రోలింగ సటోన
यदि आयकर का समय न होता, तो मीक को वकील मिलता ही नहीं.	అది ఆదాయ పననుకు సమయం కాకపోతే, మీకకు లాయర కూడా ఉండేవాడు కాదు.
पर छोडी न मैंने अपनी कोशिश पता था कामयाबी पाके रहूँगा	కానీ నేను వదిలేయలేదు ఎందుకంటే నేను నెగగుకురాగలని నాకు తెలుసు
और सामानय हमला,	ఇంకా సాధారణ దాడి,
और देखा कि शरी विलियमस ने अपनी कमर से बंदूक निकाली.	మిసటర విలియమస తన నడికటటు నుంచి తుపాకీ తీశాడు.
हाँ. कया कोई वह वीडियो देखना चाहेगा, यॉर ऑनर?	అవును. ఎవరెనా ఆ వీడియో చూడాలనుకుంటుననారా, యువర ఆనర?
मतलब, लगा कि वापस आओ और उनहें हराओ. उनहें फिर से हराने की कोशिश करो.	అది తిరిగొచచి వాళళను పడగొటటటంలాంటిది. వాళళను మళళీ పడగొటటాలి.
मैं इस कमरे से जिंदा बचने के लिए कुछ भी कर सकता हूँ.	నేను ఈ గదిలో బరతికుండటానికి ఏమెనా చేయటానికి సిదధంగా ఉననాను.
बस अपने जीवन में वापस जाने की खातिर ताकि सब कुछ न गँवा दें.	తిరిగి తమ జీవితం కొనసాగించేందుకు పరిశీలన పరతిపాదనకు ఒపపుకుంటుననారు.
और उसने कई बार कहा, कि उसके पास अगला जे-जी बनने का मौका है,	ఆమె అది చాలా సారలు చెపపారు, అతనికి తదుపరి జే-జీ అవవగల అవకాశం ఉందని,
मैं उससे जुडने की कोशिश करता हूँ और इन बातों को नहीं छेडता.	నేను తనతో కలిసిపోయి ఉండటానికి పరయతనిసతా ఇంకా ఇవననీ పకకకు తోసేసతాను.
मुझे नजरबंदी की सजा देने के बाद उसने अदालत की कारयवाही सथगित कर दी,	ఆమె అతనికి గృహ నిరబంధ శికష విధించాక, కోరటును వాయిదా వేశారు,
"जब रात को बचचों के पास घर जाओगे तो जयादा रकम का चेक लेकर जाओगे? "	"మీ జీతం ఇంకా ఎకకువ అవుతుందా మీరు రాతరి మీ పిలలల కోసం ఇంటికి వెళళినపపుడు? "
जब मैं बाहर निकला, तो मैं वापस घर गया, और फिर अपनी जिंदगी शुरू की.	నేను బయటకు వచచిన తరువాత, మీకు తెలుసా, ఇంటికి వెళళి, పని చేయటం పరారంభించాను.
मुझे लगा, "मुझे मेरा पहला बडा चेक मिला है. "	"నాకు పెదద చెక ఇచచారు. మొదటి పెదద చెక" అనుకుననాను.
परोबेशन उललंघन की सुनवाई.	విచారణకు దారితీసతుంది.
मैं अपनी दादी, माँ अपनी बहन का खयाल रखता हूँ	నేను మా నానమమను, అమమను చూసుకుంటాను మా అమమ కూతురును
इस नयाय की दुनिया में,	వాళళకి బరెయినవాష చేసతారు.
उसे अपना दस साल का परोबेशन शुरू करने के लिए रिहा किया गया.	అతనని 10 ఏళళ పరిశీలన పరారంభించటానికి విడుదల చేశారు.
परोबेशन के दौरान, आप अपना लकषय पाने के लिए मेहनत करते हैं,	పరిశీలనలో ఉండి, మనం మన జీవిత లకషయాల వెపు నడుసతుంటే,
जैसे मेरी भतीजी के बचचे पलेंगे, समझे न मैं कया कह रहा हूँ?	నా మేనకోడళళ పిలలలు పెరిగే విధానం, మీకు నేనేం అంటుననానో తెలుసతుందా?
"यह पागलपन है. " मैं यही सोच रहा था.	"ఇది పిచచిగా ఉంది. " అదే నేను ఆలోచించేది.
तो तब मैं सोच रहा था, "मैंने कर दिखाया. "	అపపుడనుకుంటాను, "నేనికకడకు చేరాను. "
मैंने किए कई पुशअप और मैं रहा दिलेरों संग	నేను బసకీలు తీసాను సింహంలా గరజించాను
मीक ने सजा मिलने से पहले जो समय जेल में काटा था, उसे सजा से घटाया गया था.	మీక నేర నిరూపణ సమయంలో గడిపిన జెలు కాలానని పరిగణలోకి తీసుకుననారు.
लाल गुलाब, चमकते हीरे	రోసె రోహో, వజరాల కురరాడు
2 दिसंबर, 2014	డిసెంబరు 2, 2014
सच में, कमीनो अब मैं ओपरा पे भी हूँ छाया	నిజాయితీగా, చెతతమొహాలు ఓపరా కాకుండా
हमेशा महसूस करता हूँ.	కావాలనన ఒతతిడిలో ఉంటాను.
हे भगवान, डरीमस वरथ मोर दैन मनी.	అయయో, డరీమస వరత మోర దాన మనీ.
मैंने पीछे मुडकर अपनी बंदूक जमीन पर रखी, और खडा हो गया,	నేను వెనకకి తిరిగి తుపాకీని నేల మీద పెటటాను, నేను వెనుకకు వచచి,
फिलाडेलफिया की ही किसी दूसरी जगह पर करना.	ఫిలడెలఫియాలొ ఇంకో అవుటడోర లోకేషనకు మారచారు అని.
सब बडी तादाद में लोगों के जेल में होने की बात करते हैं, जिसका मतलब 23 लाख लोग.	అందరూ దాదాపు 23 లకషలమంది ఉనన సామూహిక నిరబంధం గురించి మాటలాడుకుంటారు.
उसने बंदूक हमारी ओर तान दी.	అతను తుపాకీ మావెపు గురిపెటటాడు.
मीक मिली मैं बहुत गुससे में हूँ	మీక మిలలీ నేను రగులుతుననాను
धत, यार, अभी गाडी में बैठा हूँ.	హే, ఇపపుడే కారులోకి ఎకకాము.
आपका जीवन बेहतर हो जाता है, जेल नहीं जाना पडता,	నాకు జీవితంలో మంచి అవకాశం దొరికింది, జెలుకు వెళళకుండా,
मैं पहले से बेहतर जी रहा हूँ सोचता हूँ कि कैसे?	నేను ఎపపటికంటే ఇపపుడు బాగా ఉననాను, అనుకుంటుననాను, ఎలా?
यदि यहाँ कुछ हो गया, तो वे देख भी नहीं पाएँगे.	ఇకకడ ఏదెనా జరిగితే వాళళకు ఏమీ కనిపించదు.
गिरफतार करने वाला अफसर.	అరెసటు చేసిన పోలీసు.
कयोंकि अपने परोबेशन ऑफिसर को बिना बताए घर जाना, उललंघन होगा.	ఎందుకంటే ఒకవేళ నేను ఇంటికి నా పరిశీలనా అధికారికి తెలియచేయకుండా వెళితే
मुझे बदलना चाहती है.	చూసతుననటటు అనిపిసతుంది.
कयोंकि हमेशा यही बात दिमाग में रहती है कि, "कया मैं कल यहाँ रहूँगा? "	ఎందుకంటే నితయం "నేను రేపు ఇకకడ ఉంటానా? " అనన ఆందోళన ఉంటుంది.
हैलो, पापी, कैसे हो?	ఏయ, పాపీ, ఏంటి సంగతులు?
उसे कुछ महीने के लिए नजरबंद करना काफी नहीं था.	అతనికి కొనని నెలల గృహ నిరబంధం సరిపోలేదు.
यह 2204 साउथ हेमबरगर सटरीट है, जहाँ सारी घटनाएँ घटीं.	మీకు తెలుసా, ఇది 2204 దకషిణ హెమబరగర సటరీట, ఇదంతా జరిగిన చోటు.
पर वह बेवकूफ नहीं है. कोई बेवकूफी करके वह अपनी आजादी को दाँव पर नहीं लगाएगा.	కానీ అతను మూరఖుడు కాడు. అతను తన సవేచఛకు హాని కలిగించేది ఏదీ చేయడు.
यह कमाल की बात है. कोई इसे समझ नहीं सकता. वही तो. . .	ఇది దిమమ తిరిగేది. ఎవరూ కనుగొనలేనిది. అది. . .
सोलह दिसंबर के बाद, तुम मेरी विशेष अनुमति के बगैर कहीं नहीं जा सकते.	డిసెంబరు 16 తరవాత నా అనుమతి లేకుండా నీవు ఎకకడికి వెళళకూడదు.
सबसे बदतर हालत उन लोगों की होती है जिनके पास पैसे नहीं होते,	దారుణమెన సథితిలో నలిగిపోయేది తమ దగగర డబబులేని వాళళు,
मेरे पास बिलकुल भी पैसा नहीं था. तो मुझे कोई रासता खोजना था.	నా దగగరేం డబబు లేదు. అందుకే, నేను నా దారి కనుగొనాలి.
बाद में, वह मैनेजर बन गया.	జీవితంలో తరువాత మేనేజర అయయాడు.
उसने कहा वापस आने के बाद कया मुझे सकूल से लेने आओगे?	తనననాడు నువవు తిరిగి వచచేటపపుడు ననను సకూల నుంచి తీసుకొసతావా?
शायद उस समय मेरे नाम पर केवल 15, 000 डॉलर थे.	బహుశా నా దగగర కేవలం 15, 000 డాలరలు మాతరమే ఉండుంటాయి.
इससे मैं बना होशियार और सब झेलने को हुआ तैयार	అది ననను తెలివెనవాడిని చేసింది ననను కఠినంగా మారచింది
पर वे परोबेशन के संदरभ में अपराध हैं.	కానీ అవి పరిశీలనకు సంబంధించినది.
"अरे, वाह. एक अशवेत जज. मुझे अशवेत महिला मिली है. "	"సరే. నయాయమూరతి నలలజాతీయురాలు. నాకు నలలజాతీయురాలు వచచారు. "
