उसे मैंने ही दफनाया था.	ఆమెను నేనే పాతిపెటటాను.
फिलली	ఫిలలీ
तुम योदधा के लाल कपडों में हो.	నువవు సెనికుని వసతరం ధరించావు.
उनकी मौत हो गई.	అతను చనిపోయాడు.
लगता है तुमने यह सबक सीख लिया है.	ఆ పాఠం నువవు నేరచుకుననటలు ఉననావు.
हम एक नए बरदरहुड की नींव रखेंगे जिसका मुखिया मैं हूँगा	మనం కొతత బరదరహుడని పరారంభిదదాం, దానికి నేను తలగా ఉంటే,
नेविगेशन	నావిగేషన
यह वही है.	అది ఆమెనే.
गरिफिथ ऑबजरवेटरी	గరిఫిత అబజరవేటరీ
वॉलट टेक	వాలట టెక
नाम है बड के दोसत.	అది బడస బడస అంటాం.
- देर हो रही है. - हाँ.	- ఆలసయం అవుతోంది. - హా.
लूसी.	లూసీ.
सवागत है.	సుసవాగతం.
तुमहारी तरह.	నీ మాదిరిగా.
यह लो. इस महान खेल. . .	ఇదిగో. ఈ గొపప ఆటలో. . .
- मैं उनका बेटा हूँ. - नहीं.	- నేను ఆయన కొడుకును. - లేదు.
तुम कौन हो?	ఎవరు నువవు?
वहाँ लिखा कुछ पढना मत या लाइट मत जलाना.	అకకడ ఏమీ చదవవదదు లేదా లెటలు ఆన చేయవదదు.
मेरी समझ से बाहर है.	నా సథాయికి మించినది.
{\an8}वॉलट-टेक	{\an8}వాలట టెక
{\an8}रॉब-को	{\an8}రాబ కో
{\an8}वेसट-टेक	{\an8}వెసట టెక
{\an8}बिग एमटी	{\an8}బిగ ఎంటీ
{\an8}रेपकॉन	{\an8}రెపకాన
समय सबसे बडा शिकारी है.	కాలం అతయుననత వినాశకారి.
तुमहारे चूहे बेहतर होंगे ऐसा कैसे?	మెరుగగా జీవించగలవని ఎవరు చెపపగలరు?
वह पता लगा लेगा.	అతను కనిపెడతాడు.
सारे अमेरिका में हमारे सौ से भी जयादा वॉलट हैं.	మనకు అమెరికా వయాపతంగా వందకు పెగా వాలటలు ఉననాయి.
मानवता के लिए सबसे अचछा कया होगा.	మీ సవంత ఆలోచనల పరకారం చేసుకోవచచు.
नहीं. . . हम एक ऐसा रोबोट बना रहे हैं जो दरवाजे पर दूध पहुँचाता है.	లేదు. . . ఇంటి ముందుకు పాలు అందించే రోబోను మేము అభివృదధి చేసతుననాం.
मि. हॉवरड?	మి. హావరడ?
मि. हॉवरड?	మి. హావరడ?
तुमहारे पिता बहुत समय से जिंदा हैं.	మీ నానన మాతో చాలా కాలం పాటు ఉననారు.
युदध कभी नहीं बदलता.	యుదధం ఎపపటికీ మారదు.
वह तुम जैसी ही थी.	ఆమె నీలాగే ఉండేది.
कोई बात नहीं.	ఆ అవసరం లేదు.
वॉलट में.	ఓ వాలటకు.
उस एक सुराग से	ఆ ఒకక ఆధారంతో,
वह झूठ बोल रही है.	ఆమె అబదధమాడుతోంది.
- शेडी सैंडस. - यह झूठ बोल रही है, लूसी.	- షేడీ శాండస. - ఆమె అబదధమాడుతోంది, లూసీ.
- यह असीमित ऊरजा है. - लूसी.	- దాని అపరిమిత శకతి. - లూసీ.
शायद तुम जानती हो.	నీకు తెలుసనుకుంటా.
लूसी. . .	లూసీ. . .
लूसी. . .	లూసీ. . .
वह झूठ बोल रही है, लूसी.	ఆమె అబదధమాడుతోంది, లూసీ.
नहीं!	లేదు!
भूख से मरना नहीं चाहते तो.	ఆకలితో చావాలనుకుంటే మినహా.
लोगों की जान बचानी थी.	మన పరజలను కాపాడేందుకు.
कोलड फयूजन तैयार	కోలడ ఫయూజన సిదధం
दरवाजों पर ओट लगाओ.	తలుపులను అడడుకోండి.
लूसी. . .	లూసీ. . .
सिरफ हमारी दुनिया बनाएँ.	పరపంచమే మనంగా చేయడానికి.
लूसी.	లూసీ.
लूसी? लूसी.	లూసీ? లూసీ.
- कया किया? - उनहोंने. . .	- ఆయన పని ఏంటి? - ఆయన. . .
शेडी सैंडस.	షేడీ శాండస.
नहीं!	లేదు!
देखा यह जगह लोगों को कया बना देती है?	ఈ పరదేశం మనుషులను ఏం చేసతుందో చూశావా?
युदध कभी नहीं बदलता.	యుదధం ఎపపటికీ మారదు.
पर जब इसके टीन के साथी यहाँ कबजा करेंगे,	కానీ అతని సెనికులు ఈ సథలానని సవీకరించాక,
मैकस.	మాకస.
कोलड फयूजन तैयार	కోలడ ఫయూజన సిదధం
लूसी.	లూసీ.
लूसी.	లూసీ.
लूसी.	లూసీ.
रोज.	రోజ.
तुमने उसे मार डाला.	నువవు ఆమెను చంపావు.
नहीं. डेन.	లేదు, డేన.
- इसने हमारे लोगों को मारा. - कयोंकि वॉलट-टेक ने मेरा शोध	- ఆమె మన వాళలను చంపింది. - ఎందుకంటే వాలట నా పరిశోధన కొనేసి
यहाँ जयादा खाना नहीं है, कई बार बडे-बडे कीडे आते हैं.	అరుదుగా వచచే ఓ పెదద పురుగు తపప ఇకకడ అంతగా ఆహారం ఉండదు.
धत. यह बचचा धोबी से मेरी बीवी के कपडे लाया करता था.	అబబా ఛ. ఈ చిననారి నా భారయ మాసిన బటటలు తీసుకెళలేది.
अमेरिका ने देश का असतितव निजी कषेतर को सौंप दिया,	అమెరికా ఈ దేశ మనుగడను పరెవేట రంగానికి అపపగించింది,
पलीज मेरी बात सुनिए. मैं असली सिर ला सकता हूँ.	దయచేసి నా మాట వినండి నిజమెన తలను నేను తేగలను.
मैं सोच रहा था, अगर. . . अगर आप बुरा न मानें,	నేను అనుకోవడం, ఒకవేళ. . . మీరు ఏమీ అనుకోకపోతే,
उन कंपनियों में जो अमेरिका को महान बनाती हैं.	అమెరికాను గొపపగా మారచే ఒకే తరహా కారపొరేషనలు.
बारब के साथ एक नया बंदा काम करता है, हेनरी.	బారబతో పని చేసే హెనరీ అనే కొతత వయకతి ఉననాడు.
बाहर खडे होकर शिकायत करने से कुछ नहीं होगा.	పకక నుండి ఫిరయాదు చేయడం ఎవరికీ మేలు చేయదు.
तुम नहीं समझ सकतीं मैंने कया-कया सोचा है.	నేను ఆలోచించన విషయాలను నువవు నమమవు కూడా.
भविषय की कुंजी. . . इस बार काम बन जाएगा.	భవిషయతతుకు కీలకం. . . ఈసారి నేను తెసతాను.
समय बीतने पर वे एक-दूसरे को खा जाते हैं.	ఆ గూడులో ఉంచితే, అవి ఒకదానికొకటి తింటాయి.
शायद तुम उनहें रोक लो. शायद नहीं रोक पाओ.	బహుశా నువవు వాళలను ఆపగలవు. బహుశా ఆపలేవు.
पर हम यहां आपको मौका देना चाहते हैं.	మీకు ఒక అవకాశానని అందించడానికి వచచాం.
अमेरिका संसाधनों की लडाई लड रहा है.	అమెరికా వనరుల యుదధంలో కూరుకుపోయింది.
अगर मैं सो सकता, तो खुद भी सो जाता.	నాకు వీలయితే ననను నిదర పుచచుకుంటాను.
ताकि हमारे बचचों का भविषय बेहतर हो?	మన వాలట సొసెటీని ఎలా డిజెన చేయాలి?
रुको, तुम बेटटी या हॅनक नहीं हो.	ఆగు, నువవు బెటీ లేదా హాంకవి కావు.
पर वॉलट-टेक मेरे बिना भी बनेगा.	నేను లేకపోయినా వాలట టెక ఉంటుంది.
कभी हम वेसटलैंड पर राज करते थे.	మనం ఒకపపుడు బంజరునేలను పాలించాం.
पर मेरी परवरिश ऐसे नहीं हुई है.	కానీ నిజానికి నేను అలా పెరగలేదు.
मेरे खयाल से दोनों ओर से सोचें.	మన పందేలను హెడజ చేయాలని నా సూచన.
- मार दिया? - कुछ दिख नहीं रहा.	- తనను పటటారా? - నాకేం కనబడలేదు.
ताकि किसी से एक सवाल पूछ सकूँ.	నేను 200 సంవతసరాలు ఎదురుచూశాను.
उस मिशन पर जाना मेरी किसमत थी.	నేను ఆ మిషనకు వెళలాలని తలరాత.
वह बेहद समझदार है. उसे किसी वॉलट का भार सौंप सकते हैं.	అది చాలా తెలివెనది. దాని నిరవహణలో ఓ వాలటని చూడాలని ఉంది.
फिलली उतरने की अनुमति है.	ఫిలలీ నుండి లాండింగ ఆమోదం.
छाती की पलेट के ठीक नीचे.	సరిగగా ఛాతీ పలేటకు కింద.
तुम मेरे लिए यहाँ आई हो.	ఇంత దూరం నా కోసమే వచచావు.
- कोलड फयूजन चला सकता है. - इसकी बातें मत सुनो.	- కోలడ ఫయూజనని యాకటివేట చేయగలరు. - ఆమె మాట వినకు.
तो साथ मिलकर तुम और मैं	అపపుడు నువవు, నేను కలిసి
नहीं. शायद मुझे बस. . .	లేదు, బహుశా నా వరకు. . .
वे पिछडे हुए लोग होंगे.	వాళలు రాతి యుగపు జీవులే.
किसी को अंदर मत आने दो.	ఎవరినీ లోపలకు రానీయకండి.
तुमने यह दुनिया देखी है.	ఇకకడెలా ఉంటుందో చూశావు.
हॉलीवुड सपॉनसर नुका कोला	హాలీవుడ నూకా కోలా సమరపణ
फेयो, फयुएरते इ फॉरमल.	ఫెయో, ఫుయెరటే యి ఫరమాల.
आईटी के बंदों को बता देना, वो लोग देख लेंगे.	సరే, ఐటీ వాళలకు అందించు, వాళలు సరిచేసతారు.
अगर ये लोग 10, 000 सालों तक रह भी लिए. . .	ఒకవేళ వీళలు 10, 000 సంవతసరాలు జీవించగలిగితే.
मुझे उसके साथ रहना है.	ఆమెతో వెళలిపోతుననాను.
जैसे तुम भागीं, लूसी.	నీ మాదిరిగానే, లూసీ.
पर नए अधिकारियों का टरेनिंग परोगराम है	కానీ వరథమాన ఉదయోగులకు నేను శికషణ ఇవవాలి,
तुमहारे भाई की तरह.	నీ సోదరుడి మాదిరిగా.
इसी तरह वॉलट-टेक परतिसपरधा से निपटता है.	పోటీలో వాలట-టెక ఒపపందాలు అలాగే ఉంటాయి.
तुमहारे पिता को पाने का यही तरीका है.	మీ నాననను తెచచుకునేందుకు ఇదొకకటే మారగం.
कयोंकि हमारे मौजूदा समाज की रचना में,	ఎందుకంటే ఉదదేశపూరవక మారగదరశకతవం లేకుండా
उममीदवार डेन. पता है उसे चोट लगी है?	ఆసపిరంట డేన. అతని గాయం గురించి తెలుసా?
हवाई जहाज आ रहा है.	ఎయిరకరాఫట వసతోంది.
यह पिप-बॉय कहाँ टरांसमिट कर रहा है.	ఎకకడకు పరసారం చేసతోందో నాకు తెలియాలి.
जब तुमहारी बेटी ने कहा उसका सरनेम मॅकलीन है, तो. . .	నీ కూతురు తన ఇంటి పేరు మెకలెన అని చెపపినపపుడు. సరే. . .
बिलकुल, शांतिवारता की अफवाह ने हमें झटका जरूर दिया,	తపపకుండా, శాంతి పరతిపాదనల పుకారలతో కొంచెం నెమమదించినా,
उसे वह कोड दे दो.	ఆమెకు కోడ ఇచచేసెయ.
मेरा पिप-बॉय. कुछ गडबड कर रहा है.	నా పిప బోయ. ఇదేమిటో వింతగా ఉంటోంది.
बस होशियार बचचों को बडा होने दें.	తెలివెన పిలలలే యుకతవయససుకు చేరతారు.
सही है. मेरी मानो तो अपने डैड के पॉड में इंतजार करो.	నిజం. అందుకే మీ నానన పాడలో వేచి ఉండమని నీకు సూచన.
तो उसने कहा कि बेकार की बात है.	అది హాసయాసపదమెన ఆలోచన అని అననాడు.
अरे. मैं उसका बाप हूँ. तुम हमें यहाँ से निकालोगे?	హేయ. హే, నేను తన తండరిని. మమమలని తీసుకెళలగలవా?
नहीं, रुको जरा.	సరే, అలాగే ఉండు.
अचछा आइडिया है.	అది తమాషా ఉపాయం.
लूसी, इधर देखो!	లూసీ, ననను చూడు!
लूसी, इधर देखो!	ననను చూడు! లూసీ.
और तुमने बुनियादी सवाल का जवाब नहीं दिया है.	ఇంకా మీరు ఇపపటికీ పరాథమిక పరశనను పరిషకరించలేదు.
मैं. . . मुझे वॉलट समझ नहीं आए.	నాకు. . . వాలటలు అరథం కాలేదు.
शायद तुम बस कोशिश कर सकते हो.	బహుశా నువవు చేయగలిగేది పరయతనమే.
वॉलट-टेक ने उस लडाई को रोकने के साधन खरीद लिए.	ఆ యుదధం ముగించే దారులను వాలట టెక కొనేసింది.
ऐसे लोग जो धरती पर राज करेंगे जब हम सतह को पूरा साफ कर देंगे.	మేము ఉపరితలానని తుడిచేశాక భూమిని వారసతవంగా పొందే మనుషులు.
तू गया काम से.	నినను చంపుతారు.
और फिर भी सतता छीनी जाती है, माँगी नहीं जाती.	అధికారం అంటే తీసుకునేది, ఒకరు ఇచచేది కాదు.
बात वह नहीं है.	అది సమసయ కాదు.
बहुत संघरष है,	మనకు ఘరషణ ఉంది,
ऐसी जगह जो शांत और सुरकषित है.	అది శాంతి, భదరత ఉండే పరదేశం.
उसे कोड दे दो.	ఆమెకు కోడ ఇవవు.
- हमें निकलना होगा. - रुको. उनके साथ नहीं!	- మనం బయటకు వెళలాలి. - ఆగు. లేదు, ఆయనతో కాదు!
तुमहारा बरदरहुड असीमित ऊरजा का कया करेगा तुमहें कया लगता है?	నీ బరదరహుడ అనంతమెన శకతితో ఏం చేసతుందని నువవు అనుకుంటారు?
लूसी, तुमने मुझे कोलड फयूजन लाकर दिया है,	లూసీ, నువవు నా దగగరకు తెచచినది ఓ కోలడ ఫయూజన,
घायल सूअर को टरैक करना आसान है वह कहाँ जा रहा है उससे पूछना कठिन है.	ఇరుకకుపోయిన పందిని అదెటు వెళుతోందోనని అడగడం కంటే, దాని ఆచూకీ తీయడం తేలిక.
तुम सोचते हो तुम पहले साथी हो जो योदधा बनना चाहता है?	తన సెనికుడి కవచానని కోరుకునన మొదటివాడివి నువవేననుకుంటావా?
मि. हॉवरड, आपका बडा फैन हूँ.	మి. హావరడ, పెదద అభిమానిని.
"बदसूरत, मजबूत और औपचारिक. "	"ఫెయె, ఫుయెరటె యి ఫరమాల. "
रचनातमक परयवेकषक अशोक बकषी	కరియేటివ సూపరవెజర శిరీష దరభా
ऐसा पहली बार नहीं हुआ है कि	నీకు తోడుగా ఉనన ఓ సోదరుడు
मुझे यहाँ लाने का धनयवाद.	సరే, దింపినందుకు ధనయవాదాలు.
रुको. बस. . . वहीं रुक जाओ.	ఆగు. అదీ. . . అకకడే ఉండు.
मेरे दोसतों के साथ संतानें पैदा करके सुपर मैनेजर बनाने के लिए खास तौर पर चुने गए.	సూపర మేనేజరల తరగతి సృషటికి నా బడసతో సంతానోతపతతి కోసం జనయుపరంగా చేసిన ఎంపిక.
कुंजी. . . मानवता के भविषय की कुंजी. . .	కీలకం. . . మానవ భవిషయతతుకు కీలకం. . .
तो वॉलट 32 और 33 कया हैं, बस नियंतरण में दबे लोग?	అయితే, వాలట 32 ఇంకా 33లు పరజలను నియంతరించడం మాతరమేనా?
मिलॉरड, इसमें कुछ नहीं है.	ఆరటిఫాకటలు లేవు, మెలారడ.
अचछा, हेनरी.	అవును, హెనరీ.
मेरा आदेश मानना ही होगा.	నా ఆదేశాలు పాటించి తీరాలి.
काम बन कयों नहीं रहा? यह संघरष का समाधान 101 है.	ఆగు. ఇదెందుకు పని చేయడం లేదు? ఇది సమసయ పరిషకారం 101.
तो इसके बजाय वॉलट-टेक को जिंदा रखा. . .	అందుకే, వాలట టెకను జీవంతో ఉంచాం. . .
पति बचचों को ले गया. . .	అతను పిలలలను తీసుకుని. . .
मुझे दुख है.	ననను కషమించు.
युवा हेनरी, तुमहें एक और ऑटोगराफ चाहिए?	నీకు మరో ఆటోగరాఫ కావాలా, కురర హెనరీ?
इस डरेस में तुम खुद को बडा आदमी मानते हो, है न?	ఆ దుసతుల వలల మీ అందరికీ ముఖయులుగా అనిపిసతుంది, కదా?
तुम सोचती हो उनका जनम वॉलट में हुआ था.	మీ నానన వాలటలో పుటటాడని అనుకుంటావు.
लूसी. . . मुझे तुमहारी माँ से पयार था.	లూసీ. . . నేను మీ అమమను పరేమించాను.
भरोसा ही नहीं हुआ तुम ही वह मॅकलीन हो.	అది ఈ మెకలెన అని నేను నమమలేకపోయాను.
एक रात तो मैंने इसकी गरदन में हथगोला फँसाने की भी सोची थी.	ఓ రాతరి పాత గరెనేడను మెడ రంధరంలోకి కుకకడానికి నేను పరయతనించాను.
इस जानकारी के बाद नहीं.	నువవు అదంతా తెలుసుకుననాక.
पर तुमने उनहें जाने दिया.	కానీ ఆయనను వెళలనిచచావు.
तुम में हॅनक मॅकलीन का डीएनए बस 50 परतिशत है.	నీలో కేవలం 50 శాతం మాతరమే హాంక మెకలెన డీఎనఏ ఉంది.
कयोंकि जब सिरफ हम बचे होंगे, तो लडने वाला कोई नहीं होगा.	ఎందుకంటే మనం మాతరమే మిగిలిపోయినపపుడు, పోరాడటానికి ఎవరూ ఉండరు.
और तुम जैसे लोग हमारी तलवारें होंगे.	నీలాంటి వాళలు దాని ఖడగంగా ఉంటారు.
यह बकवास है.	ఇది దారుణం.
चलो अब चलें.	ఇక వెళలండి.
वेलडिंग में जरा गडबडी है	ఆ వెలడింగలో లోపం ఉంది,
