पासवाले गांव माधापुर की बहनों से मैं रनवे रिपेयर करवाऊंगा.	రనవే మరమమతు చేయడానికి పొరుగు గరామం నుండి పౌరుల సహాయం తీసుకోవాలని.
मेरे मरने का मातम मत करना	నా మరణానికి సంతాపం చెపపవదదు.
संभलके लैंड करना. शुभकामनाएं.	భూమి జాగరతత. అంతా మంచి జరుగుగాక.
भुज में कारगो पलेन से हमारे सैनिकों को उतारा जाये.	కారగో విమానాల దవారా భుజలో మన దళాలను మోహరించడం
तो भगवान कृषण खुद हमारे सारथी बनने के लिए आयेंगे.	అపపుడు శరీకృషణుడు మనకు మారగనిరదేశం చేసతాడు.
विघाकोट और भुज के बीच के रासतो को छोडकर	విఘాకోట మరియు భుజ మధయ ఉనన మారగం తపప
उनहोंने 100 टैंक और 1800 पाकिसतानी सैनिको को	అతను 100 టయాంకులు మరియు దాదాపు 1800 దళాలను చూశాడు.
हमने उनके साथ संचार के सभी रासतों को भी खो दिया है.	మేము అనని రూపాలను మరియు వారితో కమయూనికేషన కూడా కోలపోయాము.
सर रनवे के आस पास टोटल 50 टाइम बम पडे है.	సర, రనవే చుటటూ సుమారుగా 50 టెం బాంబులు ఉననాయి.
विघाकोट चौकी पर 120 हिंदुसतानी फौजी और एक पगगी है.	120 మంది భారత దళాలు మరియు విఘాకోట పోసట వదద 1 పాగి ఉననాయి.
कया किया जाए इसके साथ?	మనము అతనితో ఏమి చేసతాము?
फायर करने के बाद हम अपनी अपनी पोजिशन बदलते रहेंगे.	కాలపులు జరిపిన తరువాత మేము మా సథానాలను మారుసతూనే ఉంటాము.
मिलों तक फैले हुए कचछ और सिंध के मरुसथल में रेत का ऐसा कोई जररा नहीं जिसे बगगी नहीं पहचानते.	అతను కచ మరియు సింధ మీద విసతరించి ఉనన ఎడారి యొకక పరతి భాగానని బాగా తెలుసుకుననాడు.
3. 1 मेगाहरटज कुरुकषेतर की परिसथितीयों का.	3. 1 ఎం ఎచ జి వదద, కురుకషేతర పరిసథితుల గురించి.
सूरज की लाली तुझे तिलक लगाती है	సూరయుడు మీ ముఖానికి అభిషేకం చేసతాడు
सर. . .	సర. . .
कचछ को हिंदुसतान से जोडनेवाले सूरजबाडी और बनासकाठा का पूल	సూరజబరి మరియు బనసకాంత వదద వంతెనలు కచను భారతదేశంతో అనుసంధానించింది
"अललाह के सिवा कोई इबादत नहीं" और मुहममद अललाह के रसूल हैं. "	"ఆరాధనకు విలువెనది అలలా తపప మరొకటి లేదు మరియు ముహమమద అలలాహ యొకక దూత. "
हमारी फौंजे वहाँ दाखिल भी नहीं हो सकती जनाब.	మన బలగాలు అకకడ అడుగు కూడా పెటటలేవు, సర.
आओ हम सब मिल कर खुद से वादा करे. . .	మనలో మనమే ఒక వాగదానం చేదదాం. . .
और अपने खून से हिंदुसतान का इतिहास लिखा था.	మరియు భారతదేశ చరితరను అతని రకతంతో తిరిగి వరాశారు.
- मौत से पंगा! - हम लेंगे!	- మనము సవాలు చేసతాము! - మరణం!
- मौत से पंगा! - हम लेंगे!	- మనము సవాలు చేసతాము! - మరణం!
मैं पाकिसतानी टैंकों को एक लाइन से लेकर आऊंगा.	నేను పాకిసతానీ టయాంకులను ఒకే పంకతి గా తయారు చేసతాను.
फायरिंग रोको!	కాలపులు ఆపండి.
कयोंकि इस इलाके में पाकिसतानी वायुसेना काफी सतरक है.	ఎందుకంటే పాకిసతాన ఎయిర ఫోరస ఈ పరాంతంలో చాలా అపరమతతంగా ఉంది.
पाकिसतान कि सीमा से लगे एक गाँव में रहते थे.	పాకిసతాన సరిహదదుకు ఉనన అనుబంధ గరామం లో నివసించారు.
भुज हवाई अडडे पर हमला करो.	భుజ ఎయిర బేస మీద దాడి చేయండి.
- मौत से पंगा! - हम लेंगे!	- మనము సవాలు చేసతాము! - మరణం!
भगवान शंकर जहर पीने नहीं आएंगे.	ఎందుకంటే శివుడు మనకి సహాయం గా రాడు.
सर रनवे और कंटरोल रूम बरबाद हो गया.	సర, రన వే పూరతిగా నాశనం అయింది.
जहां भोर सुहानी देखी इक रोज वही मेरी शाम हो	మీ వెలుగుకి దూరంగా నేను అదృశయం కావాలి
बेसमेंट में रडार उनको कोई परॉबलम नहीं है.	నేలమాళిగ లో ఉనన రాడార గది చెకకుచెదరకుండా ఉంది.
और फाइटर पायलट सागर मेहता भी घायल है.	మరియు ఫెటర పెలట సాగర మెహతా కూడా గాయపడడాడు.
हिनदुसतान की जांबाज बेटी हीना रहमान.	భారతదేశము యొకక ధెరయవంతురాలు. హీనా రెహమాన.
बहू साथ नहीं लाया तो कया हुआ	అతని దగగర వధువు లేనపపటికీ
और बाकी 50 परतिशत हिससे मे रेगिसतान.	మరియు మిగిలిన పరాంతం ఎడారితో కపపబడి ఉంది.
ढाका में हमारे सैनिको को कपडे, हथियार, गोला-बारूद मिलने बंद हो गये है.	ఢాకాలోని మా సెనికులు బటటలు, చేతులు మరియు మందుగుండు సామగరిని సవీకరించడం ఆపివేశారు.
पाकिसतान से हीना की लडाई नेशनल भी है	హీనా యొకక శతరుతవం పాకిసతాన తో జాతీయమెనది.
किंमत तो तेरे जासूसों को मारकर मैंने वसूल कर ली है.	మీ గూఢచారులను చంపడం దవారా నేను ఇపపటికే నా భతయం ను పొందాను.
हे पुनराशी करुणा अवतार	ఓ సంపద ఇచచేవాడా, దయగలవాడా
हम मुकाबला करेंगे.	మేం నిలబడి పోరాడతాం.
-सुनाई नहीं दिया. -नहीं, सर.	- వినిపించడం లేదా. - లేదు అయయా.
ये है फाइटर पायलट विकरम सिंह बाज.	ఇది ఫెటర పెలట వికరమ సింగ బాజ.
सर सकॉडर लीडर विकरम सिंह.	సర, సకవాడరన లీడర వికరమ సింగ.
जामनगर से हम अतिरिकत सैनय भेजें.	మేము జామనగర నుండి ఉపబలాలను పంపుతాము.
जिसके 50 परतिशत हिससे में समंदर है	ఈ పరాంతంలో 50 శాతం సముదరంతో కపపబడి ఉంది
हिंदुसतानी सेना की मदद करने मैं हवाई पटटी बनाने जा रही हूं.	భారత సెనయానికి సహాయం చేయడానికి నేను ఎయిరసటరిపను మరమమతు చేయబోతుననాను.
इसका मतलब आप काम पे वापिस आ सकते है.	మీరు పనికి తిరిగి వెళలాలని అరథం.
पशचिमी भारत के कई हवाई अडडे पर जोरदार हमला किया	పశచిమ భారతదేశంలో అనేక ఎయిరఫీలడలు దూకుడుగా దాడి చేసారు.
जय हिंद, सर!	జె హింద సర.
बहुत बढिया.	బాగా చేసారు.
हमें और सरतक रहना पडेंगा.	మనము మరింత అపరమతతంగా ఉండాలి.
सर आपके इलाके में जो पाकिसतानी जासूस, जासूसी कर रहे है	పాకిసతాన గూఢచారులు మీ పరాంతంలో చురుకుగా ఉననారు.
ऑपरेशन सरचलाइट के तहत तीस लाख बेगुनाहों को मौत के घाट उतार दिया.	ఆపరేషన సెరచలెట కింద మూడు మిలియనల మంది అమాయకులను చంపారు.
तेरा बाप, विजय कारणिक.	మీ తండరి. విజయ కారనిక ని.
इसलिए आप पूल के उपर से जाईये.	కాబటటి, మీరు వంతెనను ఉపయోగించాలి.
मैं जीता हूँ मरने के लिए.	నేను చనిపోయే వరకు జీవిసతాను.
लेकिन मैं भुज को दुशमन के हाथों जाने नहीं दूंगा.	కానీ నేను భుజని శతరువు చేతులలోకి పడనివవను.
रात गयारह बजे हम हिंदुसतानी चेकपोसट विघाकोट पहुंचेंगे.	రాతరి 11 గంటలకు మేము ఇండియన చెక పోసట విఘాకోట వదదకు చేరుకుంటాము.
और दुशमन टैंक बटालियन के साथ हजारों में.	మరియు శతరువు టయాంకులతో పాటు వేల సంఖయలో ఉననారు.
और जिनकी मिटटी थी उनको सौंपकर वापस अपने देश आ गये.	ఎవరికి చెందిన దేశం వారికి తిరిగి వచచింది. .
और मिटटी भरकर गडढों में दबा दो.	మరియు వాటిని భూమి కింద పాతిపెటటండి.
जनाब, हमें सबसे जयादा मुशकिल हरामी नाला पार करने में होगी.	సర, హరమి నాలా ను దాటటం మనకు అతిపెదద కషటం అవుతుంది.
हिंदुसतान के खिलाफ लडाई शुरू करने का ऑरडर आ गया हैं.	భారతదేశానికి వయతిరేకంగా యుదధం చేయడానికి మాకు ఆదేశాలు ఉననాయి.
दूसरा पीएनएस गाजी आईएनएस विकरांत को डूबो दे.	రెండవది, పి ఎం ఎస ఘాజీ ఐ ఎం ఎస వికరాంత మునిగిపోవడం.
रब दा है वासता	దేవుని కొరకు
1947 में पाकिसतान अपनी जिदद पर हमसे अलग हुआ	1947 లో పాకిసతాన మొండిగా ఉననపపుడు మాతో విడిపోయారు.
तभी तो तुमहारे जनरल टिकका खान ने 30 लाख बंगाली मुसलमानो को मार दीया.	అందుకే జనరల తికక ఖాన మూడు మిలియన బెంగాలీ ముసలింలను చంపారు.
और हमें भारी नुकसान पाहुचाया.	మరియు మాకు భారీ నషటం కలిగించింది.
कर दो कुदृषटी का सरवनाश	చీకటిని నిరమూలించండి
दुशमनों पर टूट पडो.	శతరువుపె ఆరోపణలు.
हमने उनको मुंह तोड जवाब दीया और हमले को नाकाम कर दिया है.	మేము వారికి తగిన సమాధానం ఇచచాము మరియు వారి పరణాళికలను భగనం చేశాము.
मराठा बाग बोल रहा हूँ.	మరాఠా బాగ ఇకకడ ఉంది.
तो हिंदुसतानी सिपाहियों को निसतोनाबुद करने के लिए हमें सिरफ दो घंटे का वकत दरकार होगा.	కాబటటి, మాకు రెండు గంటలు మాతరమే కావాలి భారతీయ చెక పోసటను నాశనం చేయడానికి.
घर जाऊंगा यारा और बेबे के घुटने का ऑपरेशन करवाऊँगा.	ఇంటికి వెళలి నా తలలిని ఆమె మోకాలి ఆపరేషన కోసంతీసుకువెళతాను.
मेरा नाम है सिपाही.	నా పేరు సెనికుడు.
आगे बढिए, सर.	చెపపండి సార.
एक ही रासता हैं.	ఒకే ఒక మారగం ఉంది.
वाहे गुरू!	దేవుడా. . .
सूरजबाडी का और ये बनासकाठा का.	సూరజబరి మరియు బనసకాంత వదద.
हमारा एक बाल भी बाका होने नहीं देंगे.	అతను మనకు ఎలాంటి హాని జరగనివవడు.
- उसके बाद? - उसके बाद. . .	- దాని తరవాత? - దాని తరవాత. . .
ये हमारे पलेनस है.	ఇవి మా విమానాలు.
आप वहां पर वाहन तैयार रखिये	వాహనాలను సిదధంగా ఉంచండి.
मेरे शेर की आँखों में उदासी?	నా సింహం కళలలో దుఖం కనిపిసతుంది.
सर ऑपरेशन हूर खतम हो चुका है.	సర, ఆపరేషన హూర ముగిసింది.
गांव की औरतों ने अपने घर अपने हाथों से तोड दिये.	భుజ యొకక మహిళలు వారి సవంత చేతులతో వారి ఇళళ ను పడగొటటారు.
पलेन का वजन कम करना पडेगा.	మేము భారానని తగగించాలి.
और उन सबकी पोजिशन रनवे की तरफ करवा दो.	మరియు వాటిని రనవే వెపు సూచించండి.
रणछोड भाई रेगिसतानी चील है.	రానచోడ భాయ ఎడారి డేగ లాంటివారు.
और कचछ पर दुशमनों का कबजा हो गया	మరియు శతరువు నియంతరణలోకి తీసుకుంటాడు.
फतेह. . .	విజయం. . .
पूरवायी आके तेरा भवन बुहारती	గాలులు మీ గదులను నింపాయి
इसके मायने ये हुए की हम सूबह 4 से 5 बजे तक भुज हवाई अडडे पर कबजा करने में कामयाब साबित होंगे.	దీని అరథం మనము ఉదయం 5 గంటలకు భుజ ఎయిరబేసపె నియంతరణ తీసుకోవడంలో విజయం సాధిసతాం.
जाओ अपनी पोजिसन पे जाओ.	మీ సథానాలకు వెళలండి.
उसे भुज पहुंचने में 28 से 48 घंटे का वकत लग जायेगा.	భుజ చేరుకోవడానికి వారికి 28-48 గంటలు అవసరం.
हेलीकॉपटर से आपकी चौकी पे सैनिक उतारने में बहुत खतरा है.	మీ పోసటకు దళాలను హెలికాపటరలను ఉపయోగించి పంపడంలో పెదద పరమాదం ఉంది.
जय हिंद सर.	జె హింద, సర.
जासूस इतर नहीं लगाते.	గూఢచారులు పెరఫయూమ వాడరు.
और हिंदुसतानी सिपाहियों को मार गिराया	మరియు భారత సెనికులు అననింటినీ నిరమూలించండి.
और आपकी मदद करने के लिए आपका साथ देंगे पगगी रणछोड सवा भाई रबारी.	మరియు పాగి రాంచోడ భాయ సవ భాయ రబబరి మీకు సహాయం చేసతారు.
गुजरात की शेरनी सुंदरबेन.	గుజరాత యొకక సింహం; సుందర బెన.
सर चिंता की कोई बात नहीं है.	సర, ఆందోళన చెందాలసిన అవసరం లేదు.
- फतेह. . . - हमारी है!	- విజయం. . . - మనది!
विजय सर और उषा मैडम को दसवीं सालगिरह की	నా సోదరుడు విజయ మరియు కోడలు ఉష కి శుభాకాంకషలు
गोली मारने से पहले आखरी बार बोल दो.	నేను నినను కాలచే ముందు చివరిసారి చెపపండి.
ये बम इतना शकतिशाली है,	ఈ బాంబు చాలా శకతివంతమెనది.
यही खबर मैं हेडकवारटर देने जा रहा हूँ.	నేను ఈ వారత పరధాన కారయాలయానికి ఇవవబోతుననాను.
हम इस हमले का मुंह तोड जवाब.	మేము వారికి తగిన సమాధానం ఇసతాము.
वो झंडा जो लहराये तो चाँद और सितारों को छू ले.	కొతత ఎతతులు ఎగరగల సామరథయం కల జెండా ఇది.
और इधर हमारी सेना के 100 टैंक. . . 1800 सैनिक	మరియు మా 100 టయాంకులు మరియు 1800 దళాలు
या अललाह. . यहीं तो आरजू है मेरी.	అలలా. . . ఇది నా ఏకెక కోరిక.
लेकिन पाँच पाकिसतानी फौजी काटकर देवी माँ को भेट कर दिये.	కానీ దాని బదులు గా ఐదుగురు పాకిసతానీ సెనికుల ఊచకోత ను అనుమతించారు.
ये सारे जग का पालनहारा है ना कृषण कनहैया	పరపంచమంయొకక శరేయోభిలాషి శరీకృషణుడు
पाकिसतानी वायु सेना के लडाकू विमान ने	పాకిసతాన ఎయిర ఫోరస యుదధ విమానాలు
कुल जमात कितने आदमी हैं?	మొతతం ఎంతమంది ఉననారు?
- फतेह. . . - हमारी है!	- విజయం. . . - మనది!
जिसको 400 साल तक हमने अपनी जूते की नोक पर रखा.	ఇనుప పిడికిలితో వీరిని మేము 400 సంవతసరాలు పరిపాలించాము.
लेकिन जनाब अभी वकत माकूल नहीं हैं.	కానీ, సర. ఇది సరెన సమయం కాదు?
परीतो के बारे में सोच रहा था सर.	నేను పరీటో గురించి ఆలోచిసతుననాను సార.
हे ईशवर मालिक हे दाता	ఓ పరభూ, ఓ దాత, ఓ సృషటికరత
सर कुछ देर पहले पाकिसतानी जेटस ने हमला किया था.	పాకిసథాన విమానాలు మళలీ మాపె దాడి చేశాయి.
टरक की सपीड 400 किलोमीटर परति घंटा हो जाएगी	టరకకు వేగం 400 కిలోమీటరలకు పెరుగుతుంది.
"ताजमहल पयार की निशानी है. "	"తాజ మహల పరేమకు చిహనం. "
इससे दुशमन का नुकसान जयादा होगा और हमारी कम गोलियां बरबाद होंगी.	ఇది శతరువుకు మరింత నషటం కలిగిసతుంది మరియు మనము తకకువ బులలెటలను వృధా చేసతాము.
आप कमरे से बाहर मत निकलियेगा.	గది నుండి బయటకు వెళలవదదు.
तो पूरवी पाकिसतान को खाली करवा दो.	అపపుడు ఆమె తూరపు పాకిసతానను ఖాళీ చేయాలి.
यहाँ हैं विघाकोट पोसट.	ఇదిగో విఘాకోట పోసట.
मैं रहूँ या ना रहू	నేను బరతికి లేకపోయినా
टरॉली बमबारी में टूट चुकी है.	బాంబు దాడిలో టరాలీ నాశనం చేయబడింది
ऊंचा आसमां से हो तेरा तिरंगा	తరివరణ మే ఆకాశం కంటే ఎతతుగా ఎగరండి
और जैसे ही खतरा टल जाएगा	పరమాదం ముగిసిన వెంటనే
हे शकति रूप हे गुणाकार	ఓ బలం మరియు శౌరయం ఇచచేవాడా
