पिकेटमोटरस. कॉम	పికెటమోటరస. కామ
कोई हमसे पहले यहाँ आया था.	ఎవరో మనకననా ముందే వచచారు.
उससे कहो कि तैयारी में लगे हो. थोडा समय लग सकता है.	సిదధమవుతుననావని చెపపు. కొంత సమయం పడుతుందని చెపపు.
-इस नजारे को देख आपको खुशी मिलती है? -मधुमकखियाँ.	-ఈ దృశయం మీకు ఉతతేజానని ఇసతుందా? -తేనెటీగలు ఇసతాయి.
ये नया पैंतरा अपनाया हो.	పరిషకరించే వెఖరి ఉండొచచు.
तो वह जैसपर भी जान जाएगा.	అది జాసపరకు చెబుతుననటటే.
मैं कया मदद कर सकता हूँ?	నేను నీకు ఎలా సహాయపడగలను?
उसमें काफी चुनौतियाँ हैं. मुझे अचछी तरह पता है.	అది పరతయేక సవాళళను విసురుతోంది. నాకు బాగా తెలుసు.
जब अपनी ठोडी को हाथ लगाऊँ, घर जाने की बात करना.	నేను నా గడడానని తాకగానే, ఇంటికి వెళళనా అని అడుగు.
शायद अचछी खबर नहीं होगी.	అది దురవారత అయయింటుంది.
हम फिर से रसोई में हैं.	మనం మళళీ వంటగదిలో ఉననాం.
उससे टकराते-टकराते बची.	తనతో ముఖాముఖి ఎదురుపడడా.
धत. कुछ ठीक नहीं लग रहा.	ఛత. నాకు బలహీనంగా ఉంది.
पहले अचछी वाली सुनेंगे?	మీకు మొదట బహుమతి కావాలా?
हैपटिक भरती के लिए, फौज गाँव में जाकर तलाशती है.	హాపటిక నియామకాలకు సెనయం పలలెలపె గురిపెడుతుంది.
कैसे लगता है कि हमारे अनाज और फलियाँ विभाग में	ధానయాలు, పపపు దినుసుల విభాగంలో పని చేసతుననవారికి
आपको बदले में कया चाहिए?	మీకు బదులుగా ఏం కావాలి?
वापस सवागत है, मिस फिशर.	మళళీ సవాగతం, ఫిషర గారు.
इसी पर हाथ मिलाते हैं.	ఒపపందంపె చేయి కలుపుదాం.
उन पर थोडा पानी छिडको.	వాటిపె కొంత నీళళు చళళు.
अगर उनहोंने डॉकटर को दिखाईं तो समझाना पडेगा.	ఆమె వాటిని డాకటరుకి చూపిసతే, మనం వివరణ ఇవవాలి.
मैं उनहें सच बता देता,	నేను ఆమెకు నిజమే చెపతా,
मैं उसे यकीन दिला रहा था कि एलीटा को ढूँढने के लिए तुम सही इंसान हो.	ఎలీటాను కనుకకోవడానికి నువవు సరెన వయకతివని ఆమెకి రూఢిగా చెపపానంతే.
यह परिफरल इस इलाके में इस तरह से घूमता रहा है	ఈ పెరిఫరల పరిసర పరాంతాలలో సాంకేతిక అంచనాలను
मुशकिल यह है कि शायद यह कोई घटिया चाल न हो	ఈ ఎంపికలో సమసయ ఏంటంటే, ఇది ఉచచు కాకపోవచచేమో,
शायद हम वहाँ मुडे थे.	ఇకకడ తిరిగాం అనుకుంటా.
तुरंत परिफरल को जमा करें ताकि जाँच और. . .	ఈ పెరిఫరలను పరయవేకషణకు అపపజెపపండి అలాగే. . .
थोडी तकलीफ होती है न?	కాసత నొపపిగా ఉంది కదా?
या शायद कुछ जजबात जागने लगे हैं, अगर आप मेरी बात समझ पाएँ तो.	కనీసం ఆ భావనలు వచచే అవకాశం ఉందనిపిసతోంది, నేను మీకు అరథమవుతోంటే.
और किसी चीज को बकसे के अलावा कहाँ रखोगे?	పెటటెలో కాకుండా, ఒక వసతువును ఎకకడ పెటటాలి?
हाँ, जरूर, कानसटेबल.	తపపకుండా, కానిసటేబుల.
मैं ऐसा कभी नहीं. . .	నేను అలా ఎపపుడూ. . .
मेरे साथ चलो. मुझे खुले में साँस लेनी है.	నాతో నడువు. నాకు కొంత తాజా గాలి కావాలి.
खिडकियाँ और दरवाजे भी नहीं खुल रहे, जो कि अफसोस की बात है.	కిటికీలు, తలుపులు కూడా తెరుచుకోవడం లేదు, ఇది చాలా దురదృషటకరం.
तुमहारे पास यहाँ काम करने का समय नहीं.	ఇకకడ పని చేయడానికి నీకు ఎలాగూ సమయం లేదు.
ऐसे दिखा रहे हो जैसे तुमहीं इंचारज हो?	పెతతనమంతా నీదే అయినటటు ఎందుకు ఉంటుననావు?
तुम, तुमहारा परिवार.	నీపె, నీ కుటుంబంపె.
लडके का नाम वुलफ है?	ఆ బాబు పేరు వూలఫ ఆ?
-और? -एक महीना पहले.	-తరవాత? -నెల కరితం.
मैं वह नहीं कर रहा.	అది నేను చేయడం లేదు.
सच कहूँ तो, थोडी सी.	ఆశచరయమే, అబదధమాడను.
यह सच नहीं है, है न?	ఇది నిజం కాదు, కదా?
बताओ कि लोग मुझे और मेरे परिवार को कयों मारना चाहते हैं.	ననను, నా కుటుంబానని ఎందుకు చంపాలనుకుంటుననారో నువవు చెపపాలి.
शायद एक लडकी को खतम करने का कोई आसान तरीका जरूर होगा, है न?	ఆ అమమాయిని చంపడానికి సులభమెన మారగమేదో ఉండే ఉంటుంది, కదా?
उनहें उतार रहा हूँ.	వాటిని తీసేసతుననా.
अब कोई तुमहें उसके लिए मारना चाहता है.	అందుకు నినను ఎవరో చంపాలనుకుంటుననారు.
थोडी बहस हो गई थी.	కాసత వాదన జరిగింది.
मतलब, उनकी अजञानता.	అంటే, వాటి అజఞానం.
सही जगह पर पेशाब करना कितना मुशकिल है?	సరెన చోట మూతరం పోయడం ఎంత కషటమెన పని?
तुम इसे ले चुके हो.	నువవు తీసుకుననావు.
कैसे भटक सकते हैं?	కొటటుకుపోవడమా, ఎలా?
इसके नाम में दूरसथ-यातरा वीजा की अरजी दी थी. दस यातराएँ.	నేను దూర సందరశన వీసా దరఖాసతు చేశాను. పది పరయటనల కోసం.
हालाँकि मुझे माफी की उममीद नहीं है.	అంటే నీ కషమాపణ ఎదురుచూసతుననానని కాదు.
मैं जासूस नहीं हूँ, पर आगे बढने के लिए इतना काफी है.	సంకలిషటత ఏమీ లేదు, కానీ పని పరారంభించడానికి సరిపోతుంది.
गाडियाँ बेचना बंद किया तो इनकी सरविस कैसे करवाएँगे?	నువవు కారల అమమకం ఆపేసతే, వీటి సరవీస ఎలా చేయించుకోవాలి?
सबसे जयादा खतरनाक?	ముపపుననది చెపపనా?
हाँ, यह हुई न बात.	అదిగో, వచచేసింది.
तुमहारा बगीचा. . .	నీ పూదోట ఎలా. . .
-जुड सकते हैं? -कोई घंटी सुनाई देगी.	-సంధానమా? -నీకు రింగ వినిపిసతుంది.
ऊपर या नीचे. मुझे पास या दूर करने.	పెకి, కిందకి. పిలవడానికి, పంపడానికి.
वो वातावरण से कारबन को खींचते हैं.	వాతావరణంలో ఉనన కరబనానని పటటుకుంటాయి.
डॉ. नयूलैंड, पलीज!	డా. నులాండ, పలీజ!
तो उसकी बात का सही मतलब समझ पाती.	తను చెపపేది నాకు అరథమవుతుందని అంది.
बैठो, विलफरेड. पल भर के लिए ही सही.	కూరచో, విలఫరెడ. ఒక నిమిషం పాటెనా.
हाँ, पर तुम हमारे साथ जो भी करोगी	అవును, నిజం ఏంటంటే, మమమలని గిలలితే,
अगर उनहोंने आपसे कम की बात की है,	కనుక, మీకు అంతకననా తకకువ చెపపారంటే,
घर आ गया है, जैसपर. गाडी बंद करो.	ఇలలు వచచింది, జాసపర. టరక ఆఫ చేయాలి.
वह कया कह रहा है?	అతను ఏమంటుననాడు?
-दिल दुखा रहे हो! -मजाक नहीं है.	-బాగా గాయపరిచావు! -నిజంగా అంటుననా.
रीस और उनसे कहा कि तुम गेम में थीं	రీసకు, మిగిలినవారికి సిమ ఆడావని,
तुमने कहा, वह हमें मारना चाहता है.	మనలని చంపాలనుకుంటుననాడని అననావు.
उसके पास पहुँचो.	ఆమె దగగరకు వెళళు.
सोचा कि उसे इसतेमाल करता रहता हूँ,	దీనని వాడటం సులభంగా అనిపించింది,
वह कया था? सुराग.	ఏంటది? ఆ సంకేతం.
पर एक जरा सी चूक हुई नहीं कि फिर से मुसीबतों का पहाड टूट पडेगा.	కానీ పరయవేకషణలో కషణమాతరపు లోపం జరిగినా ముపపుల జలపాతం ముంచుకొసతుంది.
पता है, अमेरिकी फौज की कौन सी बात अचछी लगती है?	అమెరికా సెనయంలో నాకు నచచిన ఉతతమ విషయం ఏంటో తెలుసా?
जब मैं उलझन में पड गई, तब उसने मेरा अपमान किया.	నేను తికమకపడడానని చెపతే తనకి అమరయాదగా అనిపించింది.
अंदर चलो. वे तुमहें समझा देंगे.	లోపలికి రా. నీకు అననీ వివరిసతారు.
हाँ, शायद मेरे खुमार के चलते है. तुम उसे ठीक कर सकती हो. देखो.	అవును, నా తాగుడు పరభావం అనుకుంటా. దానని సంతులనం చేసుకోగలవు. ఇదిగో.
अपनी तरफ से तैयारी करके रखिए, कयोंकि मैं अब सिरफ मैं नहीं हूँ.	నువవు రోజులు లెకకబెటటుకోవాలసిందే, ఎందుకంటే నేను, నేను మాతరమే కాదు.
जितनों के साथ सेवा की, वे सब हूँ.	సెనయంలో నాతో పని చేసిన అందరినీ.
आप यहाँ सुरकषित महसूस करते हैं?	ఇకకడ మీకు సురకషితంగా అనిపిసతోందా?
मैं कोरबेल पिकेट को जानती हूँ.	నాకు ఈ చెతత కారబెల పికెట తెలుసు.
और आपने बात की?	నువవు మాటలాడావా?
तुम सोचो कि मुझे कया करना चाहिए,	నువవు పని చేసే ఓ వయూహం కనుకకో,
आप चाहें तो, इसे हल कर सकता हूँ.	దానని పరిషకరిసతా, మీకు నచచితే.
कनाडा की नागरिक.	కెనడా పౌరురాలు.
मैंने उनसे पूछा था, पर उनहोंने साफ मना कर दिया.	నేను వారిని అడిగాను, వాళళు జవాబుని దాటేశారు.
मानता हूँ. हाथ को कया हुआ है?	ఒపపుకుంటుననా. నీ చేతికి ఏమెంది?
उसे पहले कभी देखा तक नहीं था.	వాడిని అంతకు ముందెననడూ చూడలేదు.
जब रेनी ने खुद को उसी परिफरल में पाया, तो उसे गुससा आ गया.	ఈసారి కూడా రెయినీ ఇదే పెరిఫరలలోకి రావడంతో, ఆమెకు కోపం వచచింది.
तुम मुझे बहुत ही आकरषक लगती हो.	ననను ఎంతగానో ఆకటటుకుంటుననావు.
तुम एक समझदार आदमी हो, जैसपर.	నువవు తెలివెన యువకుడివి, జాసపర.
जो होना तय है उसे टाल रही हो.	అనివారయానని ఆలసయం చేసతుననావంతే.
अगली बार दूसरा नमूना भाडे पर लेना चाहती थी.	ఈసారి వచచినపపుడు మరో మోడలను అదదెకు తీసుకోమంది.
तुमहारे आने से बहुत पहले बनाया गया. पता है, वो कैसे चलते हैं?	నువవు చేరడానికి ముందే కటటారు. అవి ఎలా పని చేసతాయో తెలుసా?
या तुमहारे उस रूप के बारे में?	లేదా వారి లోకంలో నీ గురించి?
वापस सवागत है.	మరోసారి సవాగతం.
हाँ, मैं यहाँ काफी सुरकषित महसूस करता हूँ.	అవును, నాకు ఇకకడ చాలా సురకషితంగా అనిపిసతోంది.
बिना हडबडाए चलना. मैं उलटी तरफ से आता हूँ.	తొందరపడకుండా నడువు. నీకు ఎదురుగా నేను వసతాను.
बस भी करो, ऐश.	ఏంటీ చెతత, యాష.
कयोंकि यही सबसे अहम सवाल है.	నిజానికి అదే అతి ముఖయమెన పరశన.
मुझे लगता है कि वे ऐसे किसी काम में शामिल हैं	నా దృషటిలో వాళళు ఏదో విషయంలో చికకుకుననారు,
तुम हमेशा बच निकलते हो. मानो तुम पर यकीन नहीं किया जा सकता.	ఎపపుడూ తపపించుకు తిరుగాడుతుంటావు. నినను నమమలేని రీతిలో.
इनको नहीं पता कि इनहोंने किससे पंगा लिया.	వాళళు ఎవరితో పెటటుకుంటుననారో వాళళకు తెలియదు.
मैं तुमहें जीवन भर की गारंटी दूँगा, सीजे.	నేను మీకు జీవితకాలపు హామీని ఇసతుననాను, సీజే.
-सब कैसा होता है. -जैसपर के अंकल कौन हैं?	-అదెలా నడుసతుందో తెలుసా? -జాసపర బాబాయి ఎవరు?
तो तुमहारे माधयम से एलीटा तक पहुँच सकते हैं.	మనం నీ దారితో ఎలీటా పరదేశానని కనుకకోవచచు.
इससे बेहतर हल नहीं सोच सकतीं?	ఇంతకననా మెరుగెనవి లేవంటావా?
आज सुबह नशे की हालत में जागा,	ఈ ఉదయం తాగిన మతతులో లేచాను,
-अभी! -मैं गाडी नहीं रोकूँगा.	-ఇపపుడే! -నేను కారుని ఆపను.
तुमहारा बगीचा कैसे फलता है?	నీ పూదోట ఎలా పెరుగుతుంది మరి?
-तो फिर. . . -मैं वुलफ के बिना नहीं जाऊँगी.	-అలా అయితే. . . -వూలఫ రాకపోతే నేనూ రాను.
मेरियल रफाएल.	మరియెల రఫెయెల.
और कौडियों से	సముదరపు గవవలతో
अगर आप देखें तो पता चलेगा कि	మీరు చెక చేసతే, ఈమె పేరుపె
और तुम जो काम कर रही हो, उसका वही मतलब है.	నువవు చేసతునన పనిలోని ముఖయ ఉదదేశయం అదే.
तुम समझ रही हो, है न? तुमने मेरे लिए कोई चारा नहीं छोडा?	నీకు అరథమెంది కదా? నాకు మరో దారి లేకుండా చేశావు కదా?
-फिर कया? -शायद तुमसे तलाक लेना पडेगा.	-ఆ తరవాత? -అపపుడు నీకు విడాకులు ఇవవాలేమో.
-हाँ. -वे हमारा पीछा करते यहाँ तक चले आए?	-అవును. -మనలని ఇకకడి దాకా అనుసరించాయా?
तुम इंसटीटयूट की निषिदध सुविधा में गए.	నిరభంధ పరాంతంలోకి వెళళేందుకు మీరు వాడారు.
वह बडे ही बेढंगे मगरूर अंदाज से पेश आई	అపపుడు తను ఓ పొగరుబోతు ఉదవేగానని చూపింది,
शायद तुम बहुत छोटे थे, इसलिए याद नहीं,	ఇది గురతుండటానికి నువవు మరీ చిననవాడివేమో,
और हमारा कोई पुराना दुशमन जाग गया हो बदला लेने के लिए,	ధనబలం, కండబలం ఉననవారిని మనం ఎదిరించినటటు అవుతుంది,
तुम इसे यहाँ नहीं छाप सकते.	వీటిని ఇకకడ ముదరించకూడదు.
तो इंसान तनहा रह जाता है.	తోడు అననది లేకుండా జీవిసతే.
मैं पिकेट को संभाल लूँगा.	పికెట సంగతి నేను చూసుకుంటా.
करमचारी भी ऐसा कर सकते हैं.	వెదయ సిబబంది అలా చేయగలరు.
उनहें कया लगता है, वह दवा कहाँ से आई?	ఆ ఔషధం ఎకకడి నుండి వచచిందని అనుకుంటోంది?
-ठीक है. -जाहिर है तुमहें ठीक नहीं लगता.	-సరే. -సఫషటంగా తెలుసతోంది, సరి కాదని.
वह कया है, यह भी. पलीज, टीवी बंद करो.	వాడు చేసే పనులు. ఆ చెతతను ఆపండి, దయచేసి.
राजय के नियमों के अनुसार पूरी तरह से.	పరభుతవ ఆదేశాలను పూరతిగా అనుసరించి వేశాం.
-कयोंकि वे भले लोग लगते हैं. -जी हाँ.	-ఎందుకంటే మంచివాళళలా ఉననారు. -మంచివాళళే.
और ऐसा लगता है कि मैं उस नाजुक मोड पर पहुँच गया हूँ.	నేను ఆ విసమయకర సథితికి చేరుకుననానని అనిపిసతోంది.
जागो और उठो.	మేలుకో, లెగు.
डीएनए से जरमन और उततर अफरीकी वंश का पता चलता है.	డీఎనఏ జరమనీ మరియు ఉతతర ఆఫరికా వారసతవానని సూచిసతోంది.
मैंने आखिरी बार एलीटा को कब देखा था?	నేను ఎలీటాను చివరి సారి ఎపపుడు చూశానని?
मैं तुमहारी बात समझा नहीं.	ఏమంటుననావో నాకు తెలియదు.
शुकरिया, यार.	థాంకస, బాబు.
हैलो? तुम हो?	హలో? ఉననావా?
बुरा न मानें तो आपकी राय जानना चाहूँगा.	మీ అభిపరాయం కావాలి, మీకు ఫరవాలేదంటే.
हे भगवान, बिली ऐन, मैं बेवकूफ नहीं हूँ.	దేవుడా, బిలలీ యాన, నేను వెధవని కాదు.
तुमहें मैड डॉगस याद हैं?	నీకు మయాడ డాగస గురతుననారా?
और विलफरेड नेदरटन, है न?	అలాగే విలఫరెడ నెథరటన, కదా?
इन खिडकियों पर दो-इंच का पॉलिमर है.	ఆ కిటికీలపె రెండు అంగుళాల పాలిమర ఉంది.
मुझे लगता है, हमारे पास कुछ विकलप हैं.	నా దృషటిలో మనకు కొనని ఎంపికలుననాయి.
