जून लेंकर	జూన లెంకర
जेसन.	జేసన.
उस बचचे को गलती से गोली लग गई.	ఆ పిలలాడికి పొరపాటున తగిలింది.
तो, तुमहारा एक विरोधी गिरोह से झगडा था?	అయితే, శతరు మూకతో నీకు విబేధాలు ఉననాయా?
तो, तुम आइजैक विटलो को गोली मारने की बात सवीकार कर रहे हो?	అయితే, ఐసాక విటలో నీ కారణంగానే చనిపోయాడని అంగీకరిసతుననావా?
जून.	జూన.
- उसने आना बंद कर दिया. - हाँ.	- తను రావడం ఆపేసింది. - అవును.
कारलिता? कारला? कारला.	కారలిటా? కారలా? కారలా.
- जेड. - सर?	- జెడ. - సర?
टरकिश?	టరకిష?
- शांत हो जाइए. दूर हटिए. - ए!	- శాంతించి, వెళలిపోండి. - హేయ!
अब, उसने 17 साल नौकरी की.	అతనికి 17 ఏళల సరవీస ఉంది.
इससे फरक नहीं पडता है.	ఇపపుడు అదంతా ఎందుకులే.
मैं एरॉल को छोड नहीं सकती थी. . .	ఎరరొల ని నేను వదిలేయలేను కదా. . .
मुसतफा डेमिर	ముసతఫా డెమీర
पैटरिक.	పాటరిక.
धनयवाद.	థయాంకస.
धनयवाद.	థయాంకస.
मुसतफा डेमिर	మొసతఫా డెమీర
नहीं.	లేదు.
मुझे तुमहें. . . तुमहें यह सब जानने की जरूरत नहीं है.	అంటే. . . వీటననింటి గురించి నీకు తెలియాలసిన పని లేదు.
वे जो मरजी कह सकते हैं, पर मैं वहाँ मौजूद था.	వాళలు ఏమెనా చెపతారు, కానీ నేను అకకడ ఉననా కదా.
वह बेवकूफी थी.	వెరరి పని అది.
हाँ.	సరే.
नहीं, दरअसल यह बेतुका है. बस पैसों की बरबादी है.	లేదు, ఏడచినటటు ఉంది. డబబులు వృథా తపప ఇంకేం లేదు.
कुछ ऑनलाइन गतिविधियाँ हुई हैं.	ఆన లెన లో ఏవేవో కనిపిసతుననాయి.
भाड में गए फेडस. भाड में गए फेडस.	తొకకలో పోలీసులు. తొకకలో పోలీసులు.
- सर? - जून.	- సర? - జూన.
जून.	జూన.
"उसने" मतलब?	"అతను" అంటే?
जून.	జూన.
जून.	జూన.
पैटरिक.	పాటరిక.
- सच में, भाड में जाओ. - मेरा मतलब, यह सच है. मुझे कभी यह मौका नहीं मिलता.	- ఏం మాటలాడుతుననావు నువవు! - నేను కూడా బాగానే చేసతుననా, కానీ నాకు దకకలేదే.
नैशनल डेटाबेस - मारसिया जोंस	నేషనల డేటాబేస - మారసియా జోనస
मारसिया.	మారసియా.
लटीशा?	లటీషా?
लटीशा अलिमायु	లటీషా అలిమాయూ
मैंने उसे सकूल के दौरों और विकलांगता परोटोकॉल पर लगवाकर रखा है.	బడి పిలలల పనులని, వెకలయ పదధతుల పనులని అతనికి అపపగించేలా చేశాను.
यह ऐसा है मानो कोई मायने नहीं रखता है.	ఎవరూ ముఖయం కాదు అననటటు మాటలాడుతుననాడు.
हाँ.	సరే.
माफ करना, तुम कौन हो?	మననించాలి, ఎవరు మీరు?
कारला?	కారలా?
कैसे? कौन उसकी रकषा कर रहा है?	ఎలా? అతడిని ఎవరు రకషిసతుననారు?
सुनो, एरॉल की अनयतर उपसथिति का गवाह, नाई की दुकान में काम करने वाला वह आदमी. . .	చూడు, హతయ జరిగిన సమయంలో ఎరరొల, బారబర షాపు దగగరికి వెళలి ఒకడిని కలిశాడు కదా. . .
उसने तुमहें दुकान में चोरी के आरोप में गिरफतार किया और फिर आरोप हटा दिए.	దుకాణంలో దొంగతనం చేశావని అతను నినను అరెసట చేశాడు, ఆ తరవాత కేసు కొటటేశాడు.
चलो भी. अगर खबर फैली कि हम अब भी गोली चलाने वाले को ढूँढ रहे हैं,	కానివవయయా. కాలచిన వాడి కోసం మేము చూసతుననామనే విషయం వాళలకి తెలిసతే,
देखो, किम, यह पूरी तरह से अपरासंगिक है. मुझे और भी काम करने हैं.	చూడు, కిమ, అది పూరతిగా అసంబదధమెన విషయం. నాకు వేరే పనులు ఉననాయి.
कयोंकि चाहे वह जैसा भी दिखे, डैन अचछे पुलिसवालों में से एक है.	ఎందుకంటే, పెకి ఎలా కనిపించినా కానీ, డాన పోలీసుగా చాలా గొపపవాడు.
हमारे पास सीसीटीवी फुटेज है जिसमें तुम वह हथियार फेंक रहे थे.	ఆ ఆయుధానని నువవు పారేసతుననటటు చూపే సీసీటీవీ ఫుటేజ కూడా ఉంది.
जूरी इस पर विचार भी नहीं करेगी. उस लडके को सजा जरूर होगी.	జయూరీ వాళలు ఇంకేమీ ఆలోచించరు. ఆ కురరాడికి శికష పడిపోతుంది.
पर वे उसे लीक करने के लिए मेरे पीछे पड गए थे और मैं. . .	దానని లీక చేశామని వాళలందరూ నా మీద పడిపోయారు, ఇక నేను. . .
हमने उसका पता लगाया. उससे बात की. और उसने मना कर दिया.	అతని ఆచూకీ కనిపెటటి, అతనితో మాటలాడాం. అతను లేదు అననాడు.
भूल जाओ कि मैं कौन हूँ. कयोंकि तुम मुझे मरवा डालोगी.	నేనెవరో మరచిపోండి. మీ వలల నా పరాణాలు పోయేలా ఉననాయి.
कि उसे नहीं लगता है कि एरॉल उस समय उस फलैट में था.	హతయ జరిగినపపుడు, ఎరరొల తన ఇంటలో లేడని చెపపాడు కద.
और वैसे भी तुम लोग यहाँ अपना समय बरबाद कर रहे हो.	అయినా, ఈ విషయంలో మీ సమయానని వృథా చేసుకుంటుననారు.
लोग कई बार टरकिश नाम लिखने में गडबडी कर देते हैं.	టరకిష పేరలు జనాలను బాగా అయోమయానికి గురి చేసతాయి.
पर सुनो, अगर रॉय भावुक और विवेकहीन बन गया. . .	కానీ, ఒక మాట, రాయ పిచచిపిచచిగా పరవరతించి. . .
कया इसका अपील पैनल पर सच में कोई परभाव पडेगा?	అపపీళల పయానెల దానని చూసి సపందిసతుంది అంటావా?
लोग टरकिश नाम लिखने में काफी गडबडी करते हैं.	టరకిష పేరలు జనాలను అయోమయానికి గురి చేసతాయి.
यह लो. इसकी कीमत दस पाउंड है. कया कहते हो?	ఇదుగో. నీ పది పౌండలకు ఇది వసతుంది. బాగుందా?
एरॉल. . . उसने एरॉल को कभी नहीं देखा था.	ఎరరొల. . . అతను ఎరరొల ని అసలు కలవనే లేదట.
पर बेशक, एरॉल ने इस सबसे इनकार किया था.	కానీ ఎరరొల, ఊహించినటటుగానే ఒపపుకోలేదు.
मुझे वे सारे चेहरे एक जैसे दिखते हैं.	నాకు వాళల ముఖాలననీ ఒకేలా కనిపిసతాయి.
महिला को ढूँढते हुए वहाँ फोन किया था.	ఒక మగ పోలీసు ఆఫీసర కాల చేసి అడిగారట.
सुनो, वे एक अपील की योजना बना रहे थे.	చూడు, వాళలు అపపీల చేయాలనుకుంటుననారు.
उसने यह सुनिशचित करने की पूरी कोशिश की कि मैं एक माँ बनना जारी रख सकूँ.	ఒక తలలిగా నేను అనని బాధయతలూ నిరవరతించగలగడానికి కావలసినవననీ తనే చూసుకుంది.
- हैलो. हाँ, कया आप. . . - कया हुआ?	- హాయ. మీరేమెనా. . . - ఏంటి సంగతి?
पारक में घटी घटना के बारे में है.	ఆ సంఘటన గురించి దరయాపతు చేసతుననాం.
जून. हमें पता है तुम कहाँ रहती हो	జూన. నువవు ఎకకడ ఉంటావో మాకు తెలుసు
- मुझे लगा था आपको पुलिस से नफरत थी. - मुझे मेरी बेटी से पयार है.	- నీకు పోలీసులంటే ఇషటం లేదు కదా. - కానీ నా కూతురంటే నాకు ఇషటమే కదా.
मैंने कभी कोई बुरी बात नहीं बताई.	నేను చెడుగా ఎపపుడూ ఏమీ చెపపలేదు.
तुमहें अब इतना अचछा करते देखकर,	నువవు ఇంత పరయోజకుడివి అయినందుకు,
हाँ, मुझे इस बारे में पता है. यह बेकार है. उनहें गलतफहमी हुई है.	హా, అది నాకూ తెలుసులే. అకకడ ఏమీ లేదులే. వాళలు పొరబడుతుననారంతే.
वह मुझ पर काफी दयालु रही है. उसने मुझे मेरे बचचे वापस दिलवाए.	తను ననను సొంత అకకలా చూసుకుంది. నా పిలలల విషయంలో బాగా సాయపడింది.
मेरा मतलब, वह गिरफतारी से बचने के लिए कैनन रोड पर भाग रहा था.	అతను పోలీసులకి చికకకూడదని కయానన రోడడులో వేగంగా నడుసతుననాడు.
मैं समझ गया तुम कया कह रही हो.	నువవేం అంటుననావో అరథమవుతోంది.
इससे मुझे इतनी चिढ होती थी.	దాని వలల నాకు చాలా మండేది.
तुम लोग हमेशा यहाँ आते हो.	మీరు వసతూనే ఉంటారు ఇకకడికి.
नहीं? 28-वरषीय, टरकिश आदमी.	తెలీదా? 28 ఏళల టరకీ వయకతి.
- सुनो. . . - यह लजानया है.	- చూడు. . . - లసానయా చేశా.
कया वह पागल है या बस सचचाई सवीकार नहीं करना चाहती है?	ఆమెకి మతి పోయిందా లేదా ఆ దురవారతను భరించలేకపోతోందా?
यह रहा. मैं लंदन में हूँ.	ఇంతే. నేను లండన లో ఉననాను.
अगर मुझे कहीं तुमसे किसी जानकारी की जरूरत पडे तो.	నాకు ఇకకడి విషయాలు ఏమెనా తెలియాలంటే నీకు కాల చేసతా.
- आज नहीं. - अरे, चलो भी.	- ఇపపుడు వదదులే. - అబబా.
ठीक है, सभी इकटठा हो जाओ.	సరే మరి, అందరూ ఇలా రండి.
हम सीपीएस को सूचित करेंगे, संदिगध पर आरोप लगाएँगे.	పరాసికయూషన వాళలని సంపరదించి, అతనిపె కేసు వేదదాం.
सहयोग करने के लिए धनयवाद.	మీ సహకారానికి ధనయవాదాలు.
यह इतना शरमनाक है. वह कैसी थी? कया वह अचछी थी?	పరువు పోయిందిపో. ఎలా చెపపేదేంటి? బాగానే చెపపేదా?
हम समुदाय के नेताओं के साथ मिलकर काम कर रहे हैं,	మేము వివిధ వరగాల నాయకులతో కలిసి పని చేసతుననాం,
आप इस महिला को जानते हैं	ఈ మహిళ ఎవరో మీకు తెలుసా
हमें इसकी जरूरत नहीं है.	కానీ మాకు ఈ అవసరం లేదు.
माफ करना. कोई और भी कारला को ढूँढ रहा है? कौन?	సారీ. కారలా కోసం వేరే వాళలు వెతుకుతుననారా? ఎవరు?
उसने किसे फोन किया था?	అతను ఎవరికి కాల చేశాడు?
मैंने उनसे कहा कि अगर मैंने जून के बारे में बुरा बोला तो कलॉडिआ मेहयू	తన గురించి వయతిరేకంగా మాటలాడితే, కలాడియా మేహయూ, ఇంకా పోలీసులలో ఉనన
कया? आपका कया मतलब है?	ఏంటి? ఏమంటుననావు నువవు?
शायद तुमहें शुरुआत. . .	నువవు మొదలుపెటటడం. . .
तुमहें डैन मकैब याद है जो ऐलथम में रहता है?	ఎలతమ లో పని చేసే డాన మెక కేబ గురతుననాడా నీకు?
वह लाल बालों वाली. उसका नाम कया है? कलॉडिआ.	అదే ఆ ఎరర జుటటు ఆవిడకి. ఆమె పేరేంటి? కలాడియా.
- मुसतफा डेमिर? - हाँ.	- ముసతఫా డెమీర? - హా.
हे भगवान, तुमहें ढूँढने में काफी कठिनाई हुई.	బాబోయ, నినను కనిపెటటడానికి చాలా కషటపడడాను.
तुमसे मिलकर खुशी हुई.	మిమమలని కలవడం బాగుంది.
मैंने कभी उस शबद का इसतेमाल नहीं किया. पर रॉय मेरे पीछे पड गया था.	ఆ పదమే నేను వాడలేదు. కానీ రాయ పరశనలతో ఉకకిరిబికకిరి చేసతుననాడు.
हाँ, तो गिलफॉएल के साथ कया समझौता था? वह तुमहें पैसे दे रहा था?	సరే, గిలఫోయిల తో నువవు కుదురచుకునన ఒపపందమేంటి? నీకు డబబులు ఇసతాడా?
ठीक है, तुम आज रात डोरिस को फोन करोगी. . .	సరే, ఈరాతరికి నువవు డోరిస కి కాల చేయాలి. . .
सुनो, मुझे हर संभव मदद की जरूरत है, समझे?	చూడు, నాకు ఎంత సాయం వీలెతే, అంత కావాలి కదా?
वह कया है? आरमेनियन?	ఎవరు అతను? అరమేనియనా?
- कषति? - हाँ. कषति.	- నషటమా? - హా, నషటమే.
हैलो, सर. यह बस उस घटना के बारे में है जो पारक में घटी थी.	హలో, సర. పారకులో జరిగిన కాలపుల ఘటన గురించి దరయాపతు చేసతుననాం.
नहीं, नहीं, नहीं, तुम यह अचछी तरह जानती हो. वह परेस कॉनफरेंस?	లేదు, లేదు, నీకు బాగా తెలుసు. ఆ మీడియా సమావేశం జరిగిందిగా.
- कि तुम पुलिस में कयों भरती हुई. - मैं कोशिश कर रही थी. . .	- నాకు అససలు అరథం కాని విషయం అదే. - నా పరయతనం ఏంటంటే. . .
और आपको पूरा यकीन है कि यह वही महिला है?	ఆవిడ ఈవిడే అని మీకు పకకాగా తెలుసు కదా?
- कैसी जानकारी? - तुम उसकी चिंता मत करो.	- ఏ సమాచారం? - దాని సంగతి నీకు వదదులే.
उसने सब कुछ सवीकार कर लिया, पूरी घटना.	మొతతం నేరమంతా తనే చేసినటటు అంగీకరించాడు.
कैमरा घुमाओ. घुमाओ.	కెమెరా తిపపు. తిపపు.
और बात को हद से आगे बढा दिया, तो यह उसकी गलती है. यह. . . मेरी गलती नहीं है.	మొతతానని పెసథాయికి రిపోరట చేశాడంటే, ఇది జరిగింది అతని వలలే. నా. . . నా వలల కాదు.
- नहीं. नहीं कर सकती. -. . . और उनहें,	- నేను చేయలేను. -. . . ఎవరికో బాగాలేదనో,
आप उसका नाम जानती हैं, मिसेज ओदिनाका?	ఆమె పేరేంటో మీకు తెలుసా, మిసెస ఒడినాకా?
मानो मुझे यहाँ की सारी खबरें पता हों.	నేను ఏదో ఇకకడి పరజల పరతినిధిని అయినటటు.
उसके पास अनयतर उपसथिति का गवाह भी था.	ఆ సమయంలో వేరే చోట ఉననానని కూడా చెపపాడు.
हमें तुम पर विशवास है. तुमहें बस हमें उसका नाम बताना होगा.	నినను మేము నమముతుననాం. నువవు మాకు అతని పేరు చెపపు చాలు.
उसकी शानदार देखभाल की जा रही है. . .	అతనని వెదయులు బాగా చూసుకుంటుననారు. . .
वे पूरे इलाके पर नियंतरण करना चाहते हैं और उनहें कोई विरोधी नहीं चाहिए.	అననీ వాళల అదుపులోనే ఉంచుకోవాలనుకుంటారు, పరతయరథులు ఉండటం వాళలకి అససలు నచచదు.
हाँ. मेरा मतलब, मुझे विशवास हुआ, हाँ.	హా, నాకు అది నమమకంగానే అనిపించింది.
पर कया उसने वह खुद चलाई थी या उसने किसी दोसत के लिए उसे सहेजकर रखा था?	కానీ అతనే కాలచాడా, లేకపోతే వేరే మితరుని కోసం దానని అతని దగగర పెటటుకుననాడా?
मेरा मतलब, कया मैं कुछ चूक रही हूँ?	అంటే, నాకేమెనా తెలియాలసిన సంగతి ఉందా?
पर उसे एक फोन करने का समय मिल गया.	ఆ కంగారులో కూడా అతను ఫోన కాల చేశాడు,
गलती मेरी है. मुझे तुमहें परेस कॉनफरेंस में बोलने ही नहीं देना चाहिए था.	తపపు నాదే. మీడియా సమావేశంలో నినను భాగసథురాలిగా చేసి ఉండాలసింది కాదు.
हमें तुमहें इस जाँच से हटाना होगा.	విచారణ నుండి నినను తపపించక తపపటలేదు.
हम बस यहाँ जितना हो सके जानकारी इकटठी करने आए हैं.	మాకు వీలెనంత సమాచారం సేకరించే పనిలో ఉననాం మేము, అంతే.
पर मैंने कभी नहीं कहा कि तुमने मुझ पर दादागिरी की थी.	కానీ నువవు ననను బెదిరిసతుననావని మాతరం నేను అనలేదు.
मेरा मतलब, चलो यह सच मान लें, तुमने काफी जोर डाला था.	ఉనన విషయం చెపతాను, నువవు కూడా బాగా గటటిగా అడిగావు.
- तुम शानदार जिंदगी जी रहे हो. - हाँ, मेरे दोसत. जिंदगी शानदार है.	- ఇంత కననా ఏం కావాలి నీకు! - అవును, నేసతమా. జీవితం సాఫీగా సాగిపోతోంది.
आप यहीं रहती हैं?	ఇకకడే ఉంటుననారా?
नहीं, तुमने सही कहा. मैं बस. . .	లేదు, నువవు అననది నిజమే. నేను. . .
सभी को सुरकषित और संरकषित महसूस करने का हक है. . .	అందరికీ సురకషితంగా, భదరంగా అనిపించడం ముఖయం. . .
